date,title,source
Oct-18-18,Are Northwest Natural Holding Companys (NYSE:NWN) Interest Costs Too High?,Simply Wall St.
Oct-24-18,ONEOK (OKE) to Post Q3 Earnings: Is a Beat in the Cards?,Zacks
Oct-26-18,"Factors of Influence in 2018, Key Indicators and Opportunity within POSCO, Enerplus, Solar Capital, Ryanair, America First Multifamily Investors, and Northwest Natural Gas  New Research Emphasizes Economic Growth",GlobeNewswire
Oct-29-18,Lower Rates for Natural Gas Customers Start Nov. 1,GlobeNewswire
Nov-06-18,Northwest Natural Gas Co (NWN) Q3 2018 Earnings Conference Call Transcript,Motley Fool
Nov-06-18,Northwest Natural: 3Q Earnings Snapshot,Associated Press
Nov-06-18,NW Natural Holdings Reports Third Quarter and Year-To-Date 2018 Results,GlobeNewswire
Nov-15-18,NW Natural Wins National Award for Business Compliance and Integrity Program,GlobeNewswire
Nov-15-18,Edited Transcript of NWN earnings conference call or presentation 6-Nov-18 4:00pm GMT,Thomson Reuters StreetEvents
Dec-04-18,Study Shows Natural Gas Is Key to Reaching Northwest Emission Reduction Goals,GlobeNewswire
Dec-13-18,Tom Imeson to Retire from NW Natural Following Illustrious Career in Public Affairs,GlobeNewswire
Dec-18-18,SWX or NWN: Which Is the Better Value Stock Right Now?,Zacks
Jan-02-19,NW Natural Files First General Washington Rate Case in 10 Years,GlobeNewswire
Jan-07-19,NW Natural Celebrates 160 Years of Serving Customers,GlobeNewswire
Jan-15-19,NW Natural Holdings Announces Dividend,GlobeNewswire
Jan-16-19,"NW Natural Holdings Schedules Earnings Release and Conference Call for Friday, March 1",GlobeNewswire
Jan-24-19,Could Northwest Natural Holding Companys (NYSE:NWN) Investor Composition Influence The Stock Price?,Simply Wall St.
Jan-30-19,7 Dividend Stocks With a 60-Year Streak of Increasing Their Payouts,Motley Fool
Feb-08-19,Global Economic Growth Concerns Resurface: 5 Defensive Picks,Zacks
Feb-11-19,"The Zacks Analyst Blog Highlights: Celsius, Monster Beverage, Northwest Natural, NRG and Cincinnati Bell",Zacks
Feb-22-19,Market Rally Halts on Global Growth Concern: 5 Defensive Picks,Zacks
