date,title,source
Oct-22-18,Pacific Mercantile: 3Q Earnings Snapshot,Associated Press
Oct-22-18,Pacific Mercantile Bancorp Reports Third Quarter 2018 Operating Results,GlobeNewswire
Nov-05-18,Pacific Mercantile Bancorp to Participate in the Piper Jaffray Western Bank Symposium,GlobeNewswire
Nov-06-18,Pacific Mercantile Bank Provides Financing for Expansion of MonkeySports Capital,GlobeNewswire
Nov-14-18,Pacific Mercantile Bank Provides $5 Million Credit Facility to Egide USA,GlobeNewswire
