date,title,source
Oct-18-18,Missouri American Water Plans Pipeline Upgrades on Multiple Streets in Mexico,Business Wire
Oct-18-18,Local public companies with the most women board members,American City Business Journals
Oct-18-18,"American Waters 2018 Third Quarter Conference Call Scheduled for November 1, 2018",Business Wire
Oct-19-18,Missouri American Water Recognized During Metro Water Infrastructure Partnership (MWIP) Farewell Dinner,Business Wire
Oct-24-18,"Illinois American Water Encourages Customers to Participate in National Prescription Drug Take Back Day on Oct. 27, 2018",Business Wire
Oct-24-18,Aqua America's Stock Plunged 7.6%. Should American Water Works Investors Fear a Similar Scenario?,Motley Fool
Oct-25-18,Does American Water Works Company Incs (NYSE:AWK) Debt Level Pose A Problem?,Simply Wall St.
Oct-25-18,American Water Works (AWK) Q3 Earnings: What's in Store?,Zacks
Oct-29-18,New Jersey American Water Granted New Rates by New Jersey Board of Public Utilities,Business Wire
Oct-29-18,"American Water Employees Contribute 4,800 Volunteer Hours Across U.S. During Month of Service",Business Wire
Oct-29-18,Agreement Reached in West Virginia American Water Rate Case and Distribution System Improvement Charge Case,Business Wire
Oct-30-18,American Water Declares Quarterly Dividend,Business Wire
Oct-30-18,American Water Resources and the Philadelphia Energy Authority Launch Service Line Protection Partnership for City Homeowners,Business Wire
Oct-30-18,This is Why American Water Works (AWK) is a Great Dividend Stock,Zacks
Oct-31-18,American Water Works (AWK) Q3 Earnings and Revenues Beat Estimates,Zacks
Oct-31-18,American Water Works: 3Q Earnings Snapshot,Associated Press
Oct-31-18,American Water Reports Third Quarter 2018 Results,Business Wire
Oct-31-18,How Should Investors Feel About American Water Works Company Incs (NYSE:AWK) CEO Pay?,Simply Wall St.
Oct-31-18,Missouri American Water Plans Pipeline Upgrades on Multiple Streets in Jefferson City,Business Wire
Nov-01-18,"Missouri American Water Named Recipient of WIFIA Loan for Projects That Benefit Customers in St. Louis County, Joplin",Business Wire
Nov-01-18,American Water Works Co Inc (AWK) Q3 2018 Earnings Conference Call Transcript,Motley Fool
Nov-01-18,American Water (AWK) Q3 Earnings & Revenues Beat Estimates,Zacks
