date,title,source
Oct-18-18,Sasol Publishes Production and Sales Metrics for the Three Months Ended 30 September 2018,PR Newswire
Oct-19-18,"Notice of Separate Class Meeting of The Holders of Sasol Bee Ordinary Shares (""SOLBE1 Shareholders""), Notice of Annual General Meeting and Salient Dates",PR Newswire
Oct-31-18,"ReneSola to Announce Third Quarter 2018 Financial Results on November 19, 2018",PR Newswire
Nov-05-18,Africa Enjoys Oil Boom as Drilling Spreads Across the Continent,Bloomberg
Nov-08-18,When Should You Buy ReneSola Ltd (NYSE:SOL)?,Simply Wall St.
Nov-08-18,ReneSola Signs Letter of Intent to Sell Solar Projects in Poland,PR Newswire
Nov-14-18,Sasol Oil (Pty) Ltd - Tax Litigation Update,PR Newswire
