date,title,source
Oct-25-18,Ashland Investor Nominates Four to Chemical Maker's Board,Bloomberg
Oct-25-18,Ashland issues statement regarding director nominations,GlobeNewswire
Oct-29-18,"Consolidated Research: 2018 Summary Expectations for TD Ameritrade Holding, Spire, CoStar Group, American Express, Centene, and Ashland Global  Fundamental Analysis, Key Performance Indications",GlobeNewswire
Oct-31-18,Is Ashland Global Holdings Inc (NYSE:ASH) Excessively Paying Its CEO?,Simply Wall St.
Nov-06-18,Ashland reports preliminary financial results for fourth quarter of fiscal 2018 at upper end of previous guidance; Provides fiscal 2019 financial outlook,GlobeNewswire
Nov-06-18,What does Ashland Global Holdings Incs (NYSE:ASH) Balance Sheet Tell Us About Its Future?,Simply Wall St.
Nov-07-18,Ashland Inc (ASH) Q4 2018 Earnings Conference Call Transcript,Motley Fool
Nov-07-18,Is Ashland Global Holdings Incs (NYSE:ASH) 1.3% Worse Than Average?,Simply Wall St.
Nov-09-18,Edited Transcript of ASH.N earnings conference call or presentation 7-Nov-18 2:00pm GMT,Thomson Reuters StreetEvents
Nov-12-18,"Ashland (ASH) Misses Q4 Earnings, Beats Revenue Estimates",Zacks
Nov-15-18,Ashland board declares quarterly dividend and announces record date for annual meeting of stockholders,GlobeNewswire
Nov-15-18,Ashland Global to sell composites business for $1.1 billion,Reuters
Nov-15-18,Ashland agrees to sell composites business and butanediol facility to INEOS in deal valued at $1.1 billion,MarketWatch
Nov-15-18,"Ashland signs definitive agreement to sell Composites business and butanediol facility in Marl, Germany, to INEOS Enterprises for $1.1 billion",GlobeNewswire
Nov-16-18,Ashland to Sell Composites Unit & Marl BDO Facility for $1.1B,Zacks
Nov-19-18,"Ashland Global Holdings Inc (ASH) Files 10-K for the Fiscal Year Ended on September 30, 2018",GuruFocus.com
Nov-20-18,Cruiser Says Ashland Could Be Worth More Than $125 Per Share,Bloomberg
Nov-20-18,Valvoline (VVV) Announces Quarterly Dividend Increase of 40%,Zacks
Nov-20-18,Cruiser Capital Sends Letter to Ashland Board of Directors,Business Wire
Nov-20-18,Mosaic (MOS) Shares Up 18% in 3 months: What's Driving it?,Zacks
Nov-20-18,Here's Why You Should Add Ashland (ASH) to Your Portfolio,Zacks
Nov-23-18,6 Reasons to Add Mosaic (MOS) Stock to Your Portfolio Now,Zacks
Nov-26-18,Ashland (ASH) Shares Up 15% YTD: What's Driving the Stock?,Zacks
Nov-26-18,Here's Why You Should Add Domtar (UFS) to Your Portfolio Now,Zacks
Nov-28-18,The Myth of Ashlands Superior Shareholder Returns  And What an Actual Investment Would Have Earned,CorpGov.com
Nov-29-18,Why Should You Add Air Products (APD) to Your Portfolio?,Zacks
Nov-30-18,US Specialty Chemicals Volumes Up in October: 3 Stocks to Buy,Zacks
Dec-03-18,Here's Why Ingevity (NGVT) Stock is Worth Buying Right Now,Zacks
Dec-11-18,"Ashland (ASH) Wraps Up HEC Expansion, Boosts Production",Zacks
Dec-13-18,Ashland announces continued board refreshment,GlobeNewswire
Dec-13-18,Ashland promotes Whitaker to vice president and treasurer,GlobeNewswire
Dec-17-18,Cruiser Capital Says Ashlands Letter to Staff Was Designed to Cause Confusion,CorpGov.com
Dec-17-18,Cruiser Capital Criticizes Ashland Globals Recent Actions and Board Updates,Business Wire
Dec-17-18,"New Research: Key Drivers of Growth for Ashland Global, Intellia Therapeutics, Thor Industries, Zogenix, BWX Technologies, and Heidrick & Struggles International  Factors of Influence, Major Initiatives and Sustained Production",GlobeNewswire
Dec-27-18,Dow Plunges 346 Points Because Tis the Season to Return Gifts,Barrons.com
Dec-27-18,Ashland tweaks 2019 guidance to reflect asset sales,MarketWatch
Dec-27-18,"Ashland reaffirms business outlook and provides fiscal 2019 financial outlook reflecting the pending divestiture of the Composites business and the butanediol manufacturing facility in Marl, Germany",GlobeNewswire
Dec-31-18,Ashland (ASH) Releases Update on Fiscal 2019 Financial View,Zacks
Jan-07-19,[$$] Cruiser Capital Won't Support Ashland CEO in Board Election,The Wall Street Journal
Jan-07-19,"Cruiser Capital targets Ashland directors, including chairman",Reuters
Jan-07-19,"EXCLUSIVE: Cruiser Letter Names Four Ashland Directors to Replace, Including Chairman Wulfsohn",CorpGov.com
Jan-07-19,Ashland (ASH) Raises Prices of Composites Products in India,Zacks
Jan-08-19,"Detailed Research: Economic Perspectives on Air Lease, AMN Healthcare Services, Trinseo S.A, Ashland Global, DENTSPLY SIRONA, and Overseas Shipholding Group  What Drives Growth in Today's Competitive Landscape",GlobeNewswire
Jan-10-19,Ashland investor seeks new board members in proxy fight,American City Business Journals
Jan-14-19,Ashland announces significant board refreshment and board leadership changes to support continued execution of strategic plan,GlobeNewswire
Jan-15-19,Ashland plans board changes amid proxy fight,American City Business Journals
Jan-15-19,Cruiser Capital Releases Detailed Presentation on Ashland,Business Wire
Jan-15-19,Cruiser Capital vows to fight on at Ashland even after board deal,Reuters
Jan-16-19,Ashland files investor presentation highlighting transformation into pure-play specialty chemicals company,GlobeNewswire
