date,title,source
Oct-29-18,FTS International: 3Q Earnings Snapshot,Associated Press
Oct-29-18,FTS International Reports Third Quarter Financial and Operational Results,Business Wire
Nov-12-18,"FTS International, Inc. to Present at the Bank of America Merrill Lynch 2018 Global Energy Conference",Business Wire
Nov-14-18,"Report: Exploring Fundamental Drivers Behind Aeglea BioTherapeutics, Barnes & Noble Education, GSI Technology, Morgan Stanley, FTS International, and Crown Crafts  New Horizons, Emerging Trends, and Upcoming Developments",GlobeNewswire
Dec-19-18,"Why FedEx, Allergan, and FTS International Slumped Today",Motley Fool
Dec-19-18,Why FTS International Stock Sank Today,Motley Fool
Dec-19-18,FTS International Slides After Downgrade to Neutral,TheStreet.com
Jan-03-19,"FTS International, Inc. Appoints Michael C. Jennings to Board of Directors",Business Wire
Jan-24-19,"Scott+Scott Attorneys at Law LLP Announces Investigation into FTS International, Inc. (FTSI)",PR Newswire
Jan-25-19,"FTS International, Inc. Announces Timing of Fourth Quarter and Full-Year 2018 Financial Results, Conference Call and Webcast",Business Wire
Jan-25-19,"FTS International (FTSI) Alert: Johnson Fistel Announces Investigation of FTS International, Inc.; Encourages Investors to Contact the Firm for Additional Information",PR Newswire
Feb-05-19,"FTS International, Inc. to Present at the Credit Suisse 24th Annual Energy Summit",Business Wire
Feb-11-19,FTS International Announces Preliminary Fourth Quarter 2018 Financial and Operational Results,Business Wire
Feb-20-19,Analysts Estimate FTS International (FTSI) to Report a Decline in Earnings: What to Look Out for,Zacks
Feb-27-19,FTS International Announces Fourth Quarter and Fiscal Year 2018 Financial and Operational Results,Business Wire
Feb-28-19,"SHAREHOLDER ALERT: Levi & Korsinsky, LLP Notifies Shareholders of FTS International, Inc. of Securities Action",GlobeNewswire
Feb-28-19,"FTS International, Inc. (FTSI) Q4 2019 Earnings Conference Call Transcript",Motley Fool
Mar-01-19,"FTS International, Inc. Announces Record Date and Date of 2019 Annual Meeting of Stockholders",Business Wire
Mar-06-19,"INVESTOR ALERT: Levi & Korsinsky, LLP Reminds Shareholders of FTS International, Inc. of Securities Action",GlobeNewswire
Mar-12-19,"Lawsuit for Investors in NYSE: FTSI shares against FTS International, Inc. announced by Shareholders Foundation",GlobeNewswire
Mar-15-19,"EQUITY ALERT: Levi & Korsinsky, LLP Reminds Shareholders of FTS International, Inc. of Securities Action",GlobeNewswire
Mar-28-19,"Lifshitz & Miller LLP Announces Investigation of Atlas Financial Holdings, Inc., Conduent, Inc., DBV Technologies SA, Ebix, Inc., FTS International, Inc., NV5 Global, Inc., and Venator Materials PLC",PR Newswire
Mar-28-19,"INVESTOR ALERT: Levi & Korsinsky, LLP Reminds Shareholders of FTS International, Inc. of Securities Action",ACCESSWIRE
Mar-29-19,Hagens Berman Alerts FTS International (NYSE: FTSI) Investors to Securities Class Action,PR Newswire
Mar-29-19,"Investor Expectations to Drive Momentum within Apple Hospitality REIT, Superior Energy Services, US Foods Holding, NovoCure, FTS International, and Envestnet  Discovering Underlying Factors of Influence",GlobeNewswire
Apr-02-19,Hagens Berman Reminds FTS International (FTSI) Investors of Securities Class Action and Encourages Investors to Contact the Firm,GlobeNewswire
Apr-05-19,"EQUITY ALERT: Levi & Korsinsky, LLP Reminds Shareholders of FTS International, Inc. of Securities Action",GlobeNewswire
Apr-09-19,"Notice for NYSE: FTSI Investors - Lawsuit against FTS International, Inc. announced by Shareholders Foundation",ACCESSWIRE
Apr-17-19,FTS International (FTSI) Jumps: Stock Rises 9.5%,Zacks
Apr-18-19,"FTS International, Inc. Announces Timing of First Quarter 2019 Financial Results, Conference Call and Webcast",Business Wire
Apr-18-19,"SHAREHOLDER ALERT: Levi & Korsinsky, LLP Reminds Shareholders of FTS International, Inc. of Securities Action",ACCESSWIRE
Apr-30-19,FTS International (FTSI) Expected to Beat Earnings Estimates: What to Know Ahead of Q1 Release,Zacks
May-01-19,What's in the Offing for Noble Energy's (NBL) Q1 Earnings?,Zacks
May-02-19,What's in the Cards for Occidental's (OXY) Q1 Earnings?,Zacks
May-08-19,"FTS International, Inc. (FTSI) Q1 2019 Earnings Call Transcript",Motley Fool
May-08-19,"FTS International, Inc. to Host Earnings Call",ACCESSWIRE
May-08-19,FTS International (FTSI) Q1 Earnings and Revenues Miss Estimates,Zacks
May-08-19,FTS International: 1Q Earnings Snapshot,Associated Press
May-08-19,FTS International Announces First Quarter 2019 Financial and Operational Results,Business Wire
May-13-19,"INVESTOR ALERT: Levi & Korsinsky, LLP Reminds Shareholders of FTS International, Inc. of Securities Action",GlobeNewswire
May-15-19,FTS International Announces $100 Million Stock Repurchase Program,Business Wire
