date,title,source
Oct-17-18,"Exclusive: Express Scripts covers Amgen, Lilly migraine drugs, excludes Teva",Reuters
Oct-17-18,"Express Scripts covers Amgen, Lilly migraine drugs, excludes Teva",Reuters
Oct-17-18,"Stocks - Netflix Soars in Pre-market; IBM, Tilray, Canopy Growth Sink; Tesla Rises",Investing.com
Oct-17-18,Regeneron's Dupixent Meets Goals in Nasal Polyps Studies,Zacks
Oct-17-18,"Stocks making the biggest move premarket: NFLX, IBM, CSX, UAL, TEVA & more",CNBC
Oct-19-18,Teva Pharmaceutical Industries Ltd. (TEVA) Gains As Market Dips: What You Should Know,Zacks
Oct-19-18,"New Research: Key Drivers of Growth for Teva Pharmaceutical Industries, Axovant Sciences, SolarEdge Technologies, NantHealth, Kosmos Energy, and Retrophin  Factors of Influence, Major Initiatives and Sustained Production",GlobeNewswire
Oct-22-18,Teva's move of N. American HQ from Montco to N.J. takes another step forward,American City Business Journals
Oct-22-18,BRIEF-Harbin Pharmaceutical Signs Agreement With Israel's Teva Pharmaceutical Industries,Reuters
Oct-26-18,Deckers Outdoor Corp (DECK) Q2 2019 Earnings Conference Call Transcript,Motley Fool
Oct-29-18,Knock Offs Loom For J&amp;J's Blockbuster  Why An Analyst Is Still Bullish,Investor's Business Daily
Oct-29-18,Teva (TEVA) to Report Q3 Earnings: What's in the Cards?,Zacks
Oct-31-18,Teva Seeks to Break Its Streak of Post-Earnings Stock Losses,Bloomberg
Nov-01-18,[$$] Teva Passes Its Check-Up,The Wall Street Journal
Nov-01-18,Why Teva Pharmaceutical Industries Ltd. Stock Crushed It Today,Motley Fool
Nov-01-18,"Why Las Vegas Sands, DowDuPont, and Teva Pharmaceutical Industries Jumped Today",Motley Fool
Nov-01-18,Financial Results Spur 2 Stocks Higher on Thursday,GuruFocus.com
Nov-01-18,Israel's Teva gives upbeat outlook as restructuring proceeds,Associated Press
Nov-01-18,[$$] Teva Passes Its Check-Up,The Wall Street Journal
Nov-01-18,"Stocks - Fitbit, Teva, DowDuPont Jump in Pre-market; Wayfair, Spotify Plunge",Investing.com
Nov-01-18,How Teva Beat the Big Pharma Curse to Win 2018,Barrons.com
Nov-01-18,Eli Lilly (LLY) to Report Q3 Earnings: What's in the Cards?,Zacks
Nov-01-18,[$$] Investors Buoyed by Teva's Turnaround Progress,The Wall Street Journal
Nov-01-18,"Stock Market News Daily Roundup November 1, Key Earnings",Market Exclusive
Nov-01-18,"Teva (TEVA) Beats on Q3 Earnings, Lags Sales, Shares Up",Zacks
Nov-01-18,"Teva Soars After Earnings Beat, Increased Guidance",TheStreet.com
Nov-01-18,Teva Pharm raises 2018 profit outlook after Q3 tops estimates,Reuters
Nov-01-18,"Teva stock surges 6% on Q3 beats, upbeat guidance",MarketWatch
Nov-01-18,"Teva Pharm Q3 profit tops estimates, raises 2018 profit forecast",Reuters
Nov-01-18,Teva Reports Third Quarter 2018 Financial Results,Business Wire
Nov-05-18,"These Health-Care Standouts Have More Room to Rise, Morgan Stanley Says",Barrons.com
Nov-05-18,"Teva To Deliver Cost Cuts, Earnings Surprise In Coming Years, Morgan Stanley Says In Upgrade",Benzinga
Nov-05-18,Monday's Top Healthcare Stocks To Watch Ahead Of Elections,ACCESSWIRE
Nov-06-18,9 High-Risk Stocks to Buy for Massive Rewards,InvestorPlace
Nov-07-18,Amgen (AMGN) Counts on New Drugs Amid Rising Biosimilar Woes,Zacks
Nov-07-18,Is Teva Pharmaceutical Industries (TEVA) Outperforming Other Medical Stocks This Year?,Zacks
Nov-07-18,These 3 Value Stocks Are Absurdly Cheap Right Now,Motley Fool
Nov-08-18,"Even Following the Latest Surge, Mylan Stock Has Plenty of Room to Grow",InvestorPlace
Nov-12-18,4 Stocks Warren Buffett and Insiders Are Crazy About,Insider Monkey
Nov-13-18,Cramer's lightning round: Dropbox's stock is a buy even after the tech sell-off,CNBC
Nov-14-18,Migraine-Focused Biotech Has A Headache On Quarterly Losses,Investor's Business Daily
Nov-14-18,"Jim Cramer Weighs In On Dropbox, Teva And More",Benzinga
Nov-16-18,Regeneron (REGN) Rides on Eylea and Dupixent's Performance,Zacks
Nov-16-18,Why Teva Pharmaceutical Is Up 20% in 2018 So Far,Motley Fool
Nov-19-18,J&J Gets Positive CHMP Opinion for Prostate Cancer Treatment,Zacks
Nov-21-18,Today's Research Reports on Trending Tickers: Mylan and Teva Pharmaceutical Industries,ACCESSWIRE
Nov-26-18,4 Reasons Why Lilly is Up More Than 30% This Year So Far,Zacks
Nov-27-18,Teva to recall certain blood pressure medicine in U.S.,Reuters
Nov-27-18,"Teva prices EpiPen generic at $300, same price as Mylan generic",Reuters
Nov-27-18,Teva's generic EpiPen hits the market in limited doses,American City Business Journals
Nov-27-18,"Teva prices EpiPen generic at $300, same price as Mylan generic",Reuters
Nov-27-18,[$$] Teva Releases Generic EpiPen in Limited Doses in the U.S.,The Wall Street Journal
Nov-27-18,Astrazeneca's Fasenra Gets Orphan Drug for Autoimmune Disease,Zacks
Nov-27-18,Teva prices EpiPen generic at $300,Reuters
Nov-28-18,Famous Stocks Warren Buffett Bought and Sold,GOBankingRates
Nov-28-18,Galapagos' Osteoarthritis Candidate Gets Fast Track Status,Zacks
Nov-29-18,A Pharmaceutical Company With a Resilient Portfolio and Solid Pipeline,GuruFocus.com
Nov-29-18,Teva's Rituxan Biosimilar Gets FDA Nod in Non-Hodgkin Lymphoma,Zacks
Nov-29-18,"Detailed Research: Economic Perspectives on American Tower Corporation (REIT), Ligand Pharmaceuticals, Teva Pharmaceutical Industries, Cummins, Alexander's, and Korea Electric Power  What Drives Growth in Today's Competitive Landscape",GlobeNewswire
Nov-30-18,Novartis' Gilenya Approved in EU for Expanded Population,Zacks
Dec-03-18,Famous Stocks Warren Buffett Bought and Sold,GOBankingRates
Dec-03-18,AbbVie Presents Long-Term Data on Cancer Drugs at ASH 2018,Zacks
Dec-04-18,Roche Announces Positive Data on Venclexta/Venclyxto at ASH,Zacks
Dec-04-18,U.S. justices wrestle with patent arguments for anti-nausea drug,Reuters
Dec-06-18,Roche's Kadcyla Halves Death Risk in Breast Cancer Study,Zacks
Dec-06-18,Is Teva Pharmaceutical Industries Limited (TEVA) A Good Stock To Buy?,Insider Monkey
Dec-10-18,"Why Teva Pharmaceutical Industries, Tivity Health, and Marine Products Slumped Today",Motley Fool
Dec-10-18,Generic-drug stocks slammed by report of expanded price-fixing probe,MarketWatch
Dec-10-18,Generic drug makers stocks fall sharply after report of expanded price-fixing probe,MarketWatch
Dec-10-18,ATRS: Xyosted & Epi Pen Available for Sale,Zacks Small Cap Research
Dec-11-18,Teva (TEVA) Stock Poised to Record Big Gains in 2019?,Zacks
Dec-11-18,Warren Buffett's 10 Big Stock Losers,Investopedia
Dec-11-18,Generic Drugmakers Down on Allegations of Price Fixing,Zacks
Dec-11-18,"3 Big Stock Charts for Tuesday: Micron Technology, Fortive and Morgan Stanley",InvestorPlace
Dec-11-18,Generic-drug stocks slammed by report of expanded price-fixing probe,MarketWatch
Dec-11-18,Today's Research Reports on Trending Tickers: Teva Pharmaceutical and Innovate Biopharmaceuticals,ACCESSWIRE
Dec-13-18,Should Warren Buffett  And You  Buy More TEVA Stock Right Now?,InvestorPlace
Dec-13-18,Teva Pharm to move headquarters to Tel Aviv,Reuters
Dec-17-18,Teva Announces Positive Topline Phase IIIb Results with Fremanezumab in Adults with Migraine Who Did Not Respond to Multiple Classes of Preventive Treatments,Business Wire
Dec-18-18,Teva Reports Positive Top-Line Data for Migraine Candidate,Zacks
Dec-18-18,"Alkermes, Biogen Submit NDA to FDA for Multiple Sclerosis Drug",Zacks
Dec-18-18,3 Value Stocks to Absolutely Love During This Correction,Motley Fool
Dec-19-18,Fighting the Fed: Cramer's 'Mad Money' Recap (Wednesday 12/19/18),TheStreet.com
Dec-19-18,Cramer's lightning round: Sell Tevadebt is not king in t...,CNBC Videos
Dec-19-18,Cramer's lightning round: Sell Tevadebt is not king in this environment,CNBC
Dec-19-18,Eli Lilly CEO on winning in migraine treatments: 'It's a horse race between three great companies',CNBC
Dec-20-18,I See No Technical Reason to Approach Teva Pharmaceuticals From the Long Side,TheStreet.com
Dec-20-18,"Allergan Drops, Stops Textured Breast Implant Sales in Europe",Zacks
Dec-20-18,Should Value Investors Buy Teva Pharmaceutical Industries Ltd. (TEVA) Stock?,Zacks
Dec-20-18,Today's Research Reports on Trending Tickers: Allergan and Teva Pharmaceutical,ACCESSWIRE
Dec-26-18,US Stocks Rally on Wednesday,GuruFocus.com
Dec-26-18,Value Investors Should Buy into the Teva Stock Dip,InvestorPlace
Dec-26-18,Teva shares surge 5% on news of patent settlement with Neos over ADHD drug,MarketWatch
Dec-26-18,"Neos, Teva settle litigation over ADHD drug",American City Business Journals
Dec-26-18,Teva shares up 2.5% premarket after reaching patent settlement with Neos,MarketWatch
Dec-26-18,3 of the Cheapest Drug Stocks You Can Buy in 2019,Motley Fool
Dec-28-18,Generic Industry on Path to Recovery: 3 Hot Picks for 2019,Zacks
Dec-28-18,My Top Portfolio Holdings for 2019,Motley Fool
Dec-31-18,Does Pfizer Have A Multibillion-Dollar Replacement For Opioids?,Investor's Business Daily
Jan-02-19,Teva and Amgen Resolve Ongoing Dispute Over Tevas Generic Cinacalet HCl Product,Business Wire
Jan-02-19,"Cannabis, Migraines, Gene-Silencing: FDA Approvals Hit High Note In 2018",Investor's Business Daily
Jan-03-19,"VIVUS (VVUS) Banks on New Drug Pancreaze, Qsymia Lacks Luster",Zacks
Jan-03-19,Teva (TEVA) Ends Dispute with Amgen Over Generic Sensipar,Zacks
Jan-03-19,"Stocks making the biggest moves premarket: AAPL, CELG, JNJ, UBS & more",CNBC
Jan-03-19,"The Daily Biotech Pulse: Aevi's ADHD Drug Flunks Mid-Stage Trial, Bristol-Myers To Buy Celgene, Teva Settles With Amgen",Benzinga
Jan-03-19,"Stocks - Apple Plunges in Premarket; Celgene, IZEA Soar; Starbucks, Amgen Drop",Investing.com
Jan-07-19,"Regeneron, Sanofi Restructure Immuno-Oncology Collaboration",Zacks
Jan-07-19,The 3 Best Warren Buffett Stocks to Buy in 2019,Motley Fool
Jan-09-19,5 Must-Watch Warren Buffett Stocks for 2019,Zacks
Jan-10-19,INSYS Therapeutics Rises on Dose-Ranging Allergy Study Data,Zacks
Jan-10-19,"The Zacks Analyst Blog Highlights: Berkshire Hathaway, Teva Pharmaceutical Industries, Visa, American Express, Liberty Latin America and Sirius XM",Zacks
Jan-11-19,Teva Pharmaceutical Industries Ltd. (TEVA) Gains As Market Dips: What You Should Know,Zacks
Jan-14-19,Is Teva Pharmaceutical Industries Limited Stock a Bargain?,Motley Fool
Jan-14-19,Will Biogen Jump On This Biotech Stock Amid Buying Spree?,Investor's Business Daily
Jan-14-19,"Teva to Host Conference Call to Discuss Fourth Quarter and Full Year 2018 Financial Results at 8 a.m. ET on February 13, 2019",Business Wire
Jan-14-19,House Democrats launch drug-pricing probe into a dozen major health-care companies,CNBC
Jan-16-19,6 Reasons Why You Should Buy Eli Lilly (LLY) Stock in 2019,Zacks
Jan-17-19,Teva Pharmaceutical Industries Ltd. (TEVA) Gains But Lags Market: What You Should Know,Zacks
