date,title,source
Oct-22-18,"SemGroup Completes $350 Million Transaction, Executing Balance Sheet Leverage Goals",GlobeNewswire
Oct-31-18,SemGroup Declares Quarterly Dividend,GlobeNewswire
Nov-06-18,SemGroup to Participate in 2018 RBC Capital Markets Midstream Conference,GlobeNewswire
Nov-07-18,SemGroup Reports Financial Results for Third Quarter 2018,GlobeNewswire
Nov-08-18,Semgroup Corporation (SEMG) Q3 2018 Earnings Conference Call Transcript,Motley Fool
Nov-08-18,SemGroup (SEMG) Q3 Earnings Miss Estimates,Zacks
Nov-08-18,SemGroup: 3Q Earnings Snapshot,Associated Press
Nov-15-18,"SemGroup's (SEMG) Q3 Earnings Lag Estimates, Sales Beat",Zacks
Nov-27-18,SemGroup to Participate in Wells Fargo Energy Symposium,GlobeNewswire
Nov-27-18,"Detailed Research: Economic Perspectives on Genocea Biosciences, Big Lots, SemGroup, Conn's, Mimecast, and Neos Therapeutics  What Drives Growth in Today's Competitive Landscape",GlobeNewswire
Dec-03-18,SemGroup and DCP Midstream Announce Open Season for Light Crude Transportation Solution from Cushing to Gulf Coast Markets,GlobeNewswire
Dec-04-18,SemGroup (SEMG) Commences Open Season for Gladiator Pipeline,Zacks
Dec-13-18,Long-Term Montney Gas Processing Agreement Fills SemCAMS Wapiti Gas Plant,GlobeNewswire
Dec-17-18,How Many Insiders Bought SemGroup Corporation (NYSE:SEMG) Shares?,Simply Wall St.
Jan-07-19,Why DCP Midstream Plummeted More Than 20% in December,Motley Fool
Jan-08-19,What to watch for among midstreams in 2019,American City Business Journals
Jan-10-19,"[$$] SemGroup, KKR Form Canadian Joint Venture and Buy Meritage Midstream",The Wall Street Journal
Jan-10-19,"[$$] SemGroup, KKR Team Up to Buy Meritage Midstream",The Wall Street Journal
Jan-10-19,SemGroup and KKR Form Canadian Joint Venture and Acquire Meritage Midstream ULC,GlobeNewswire
Jan-14-19,SemGroup (SEMG) &amp; KKR Team Up for Meritage Midstream Buyout,Zacks
Jan-14-19,SemGroup to Participate in UBS Midstream Conference,GlobeNewswire
Jan-15-19,"Oil &amp; Gas Stock Roundup: Shell's Olefins Unit Start-Up, SemGroup's JV &amp; More",Zacks
Jan-16-19,"The Zacks Analyst Blog Highlights: Royal Dutch, SemGroup, Nabors Industries, TechnipFMC and BP",Zacks
Jan-17-19,"Market Trends Toward New Normal in Altria Group, Anthem, SemGroup, Axcelis Technologies, M.D.C., and Hologic  Emerging Consolidated Expectations, Analyst Ratings",GlobeNewswire
Jan-31-19,SemGroup and DCP Midstream Extend Open Season for Light Crude Transportation Solution from Cushing to Gulf Coast Markets,GlobeNewswire
Jan-31-19,Are SemGroup Corporations (NYSE:SEMG) Interest Costs Too High?,Simply Wall St.
Feb-05-19,"SemCAMS Wapiti Gas Plant Completed on Budget, Ahead of Schedule",GlobeNewswire
Feb-20-19,SemGroup Declares Quarterly Dividends,GlobeNewswire
Feb-25-19,SemCAMS Midstream Joint Venture Completes Acquisition of Meritage Midstream ULC,GlobeNewswire
