date,title,source
Oct-25-18,Century Aluminum (CENX) Beats Q3 Earnings and Revenue Estimates,Zacks
Oct-25-18,Century: 3Q Earnings Snapshot,Associated Press
Oct-25-18,Century Aluminum Company Reports Third Quarter 2018 Results,GlobeNewswire
Oct-26-18,Why Century Aluminum Co's Shares Plunged 18% Today,Motley Fool
Oct-26-18,Edited Transcript of CENX earnings conference call or presentation 25-Oct-18 9:00pm GMT,Thomson Reuters StreetEvents
Oct-30-18,"Report: Exploring Fundamental Drivers Behind Century Aluminum, Insteel Industries, Altisource Portfolio Solutions S.A, Enova International, Stewart Information Services, and Interpace Diagnostics Group  New Horizons, Emerging Trends, and Upcoming Developments",GlobeNewswire
Oct-30-18,Edited Transcript of CENX earnings conference call or presentation 25-Oct-18 9:00pm GMT,Thomson Reuters StreetEvents
Nov-01-18,"Every U.S. Metal Producer Is Down for 2018, Despite Tariffs",Bloomberg
Nov-28-18,Century Aluminum Announces Expansion of Sebree Casthouse,GlobeNewswire
Nov-29-18,"Century Aluminum to Expand Sebree Casthouse, Boost Production",Zacks
Jan-03-19,5 Broker Favorite Stocks to Watch Out For,Zacks
Jan-03-19,Here's Why Century Aluminum (CENX) is Worth Buying Right Now,Zacks
Jan-04-19,Here's Why Industrial-Materials Stocks Soared Today,Motley Fool
Jan-04-19,"Zacks.com featured highlights include: ArcBest, American Airlines, Cardinal, Century Aluminum and CVS",Zacks
Jan-07-19,Surprise! U.S. Steel Isnt as Vulnerable to Tariffs as Feared.,InvestorPlace
Jan-08-19,Should Century Aluminum Company (NASDAQ:CENX) Focus On Improving This Fundamental Metric?,Simply Wall St.
Jan-11-19,Metal Fabrication Industry Outlook: Near Term Prospects Dim,Zacks
Feb-08-19,Century Aluminum Sets Date for Fourth Quarter 2018 Earnings Announcement,GlobeNewswire
Feb-11-19,"Consolidated Research: 2019 Summary Expectations for Granite Point Mortgage Trust, Brandywine Realty Trust, Kraton, Century Aluminum, Rudolph Technologies, and Calyxt  Fundamental Analysis, Key Performance Indications",GlobeNewswire
Feb-13-19,8 Battered Commodity Stocks That Can Rise As Inflation Fires Up,Investopedia
Feb-14-19,Analysts Estimate Century Aluminum (CENX) to Report a Decline in Earnings: What to Look Out for,Zacks
Feb-14-19,Century Aluminum Companys (NASDAQ:CENX) Investment Returns Are Lagging Its Industry,Simply Wall St.
Feb-19-19,COLUMN-The United States' aluminium tariff wall is crumbling: Andy Home,Reuters
Feb-19-19,COLUMN-The United States' aluminium tariff wall is crumbling: Andy Home,Reuters
Feb-21-19,"Century Aluminum (CENX) Reports Q4 Loss, Tops Revenue Estimates",Zacks
Feb-21-19,Century: 4Q Earnings Snapshot,Associated Press
Feb-21-19,Century Aluminum Company Reports Fourth Quarter and Full Year 2018 Results,GlobeNewswire
Feb-22-19,Edited Transcript of CENX earnings conference call or presentation 21-Feb-19 10:00pm GMT,Thomson Reuters StreetEvents
Feb-22-19,Century Aluminum (CENX) Earnings &amp; Sales Beat Estimates in Q4,Zacks
Mar-08-19,"Trump Touts Lower Aluminum Prices, But Americans Are Still Paying More",Bloomberg
Mar-08-19,US tariffs have accomplished exactly what the Trump team wanted: Century Aluminum CEO,Fox Business Videos
Mar-11-19,Will These Falling Knives Rebound in 2019?,GuruFocus.com
Mar-20-19,Edited Transcript of CENX earnings conference call or presentation 21-Feb-19 10:00pm GMT,Thomson Reuters StreetEvents
Mar-26-19,Did You Manage To Avoid Century Aluminums (NASDAQ:CENX) Painful 52% Share Price Drop?,Simply Wall St.
Apr-01-19,5 Cheap Small-Cap Stocks to Buy,InvestorPlace
Apr-10-19,Century Aluminum Sets Date for First Quarter 2019 Earnings Announcement,GlobeNewswire
Apr-17-19,"NASDAQ Back Above 8,000",Zacks
Apr-18-19,Why Century Aluminum Stock Dropped Today,Motley Fool
Apr-23-19,Century Aluminum (CENX) Expected to Beat Earnings Estimates: What to Know Ahead of Q1 Release,Zacks
Apr-26-19,Will Organic Growth Benefit Eaton's Earnings (ETN) in Q1?,Zacks
Apr-29-19,Century Aluminum Company Appoints Chief Operating Officer,GlobeNewswire
Apr-29-19,Ingersoll-Rand (IR) to Post Q1 Earnings: What's in Store?,Zacks
Apr-29-19,A.O. Smith (AOS) to Report Q1 Earnings: What's in the Cards?,Zacks
Apr-30-19,Century: 1Q Earnings Snapshot,Associated Press
Apr-30-19,Century Aluminum Company Reports First Quarter 2019 Results,GlobeNewswire
Apr-30-19,SHAREHOLDER NOTICE: Kaskela Law LLC Announces Investigation of Century Aluminum Company on Behalf of Shareholders - CENX,ACCESSWIRE
May-01-19,Edited Transcript of CENX earnings conference call or presentation 30-Apr-19 9:00pm GMT,Thomson Reuters StreetEvents
May-01-19,Century Aluminum (CENX) Q1 2019 Earnings Call Transcript,Motley Fool
May-03-19,Edited Transcript of CENX earnings conference call or presentation 30-Apr-19 9:00pm GMT,Thomson Reuters StreetEvents
May-06-19,Does Century Aluminum Company (NASDAQ:CENX) Have A High Beta?,Simply Wall St.
May-07-19,"Century Aluminum (CENX) Q1 Earnings, Revenues Beat Estimates",Zacks
May-08-19,Heres What Hedge Funds Think About Century Aluminum Co (CENX),Insider Monkey
