date,title,source
Oct-18-18,"[$$] 5G Has Arrived. Its Been A Long Wait for Ericsson, Nokia.",The Wall Street Journal
Oct-18-18,Ericsson peeling off standalone media solutions business to be based in North Texas,American City Business Journals
Oct-18-18,"[$$] 5G Has Arrived. It's Been A Long Wait for Ericsson, Nokia.",The Wall Street Journal
Oct-18-18,Ericsson has dismissed 50 employees following U.S. corruption probe,Reuters
Oct-18-18,Ericsson has dismissed 50 employees following U.S. corruption probe,Reuters
Oct-18-18,Ericsson Reports Third Quarter Results 2018,PR Newswire
Oct-18-18,Ericsson: 3Q Earnings Snapshot,Associated Press
Oct-18-18,Ericsson Reports Third Quarter Results 2018,PR Newswire
Oct-18-18,Ericsson CEO Scores Third Straight Quarterly Earnings Beat,Bloomberg
Oct-18-18,Ericsson tops Q3 forecasts as savings and 5G sales kick in,Reuters
Oct-18-18,"Sweden's Ericsson third-quarter sales, profits surge as savings kick in",Reuters
Oct-18-18,"Sweden's Ericsson Q3 sales, profits surge as savings kick in",Reuters
Oct-18-18,"Ericsson third-quarter sales beat expectations, operating profit jumps",CNBC
Oct-25-18,Press Invitation: Ericsson Capital Markets Day 2018,PR Newswire
Oct-25-18,Ericsson to Deliver Mission-critical Communications to UN Peacekeepers,PR Newswire
Oct-25-18,Ericsson to Deliver Mission-critical Communications to UN Peacekeepers,PR Newswire
Oct-26-18,"Consolidated Research: 2018 Summary Expectations for Ericsson, Magna International, Essent Group, CNH Industrial N.V, Lamar Advertising, and Green Plains Partners LP  Fundamental Analysis, Key Performance Indications",GlobeNewswire
Oct-26-18,Fujitsu and Ericsson Team up on 5G Partnership,PR Newswire
Oct-26-18,Fujitsu and Ericsson Team up on 5G Partnership,PR Newswire
Nov-06-18,"DISH selects Ericsson for NB-IoT radio access and core network, including radio frequency design",PR Newswire
Nov-07-18,Ericsson Capital Markets Day 2018,PR Newswire
Nov-08-18,"The Zacks Analyst Blog Highlights: LM Ericsson, Nokia, Comtech Telecommunications, Juniper Networks and Ubiquiti Networks",Zacks
Nov-08-18,Ericsson raises 2020 sales target as recovery gains pace,Reuters
Nov-14-18,"BMW, Vodafone, Ericsson urge EU to consider 5G car standard",Reuters
Nov-14-18,Ericsson doesn't see sales lift after security concerns hit Chinese rivals,Reuters
Nov-14-18,Is Ericsson (ERIC) Stock Outpacing Its Computer and Technology Peers This Year?,Zacks
Nov-14-18,Ericsson to Help Telenor Transform to 5G in Key Markets,Zacks
Nov-14-18,Telenor Selects Ericsson for 5G Core Network Transformation,PR Newswire
Nov-15-18,"BMW, Vodafone and Ericsson Appeal to EU for 5G Car Standard",Zacks
Nov-15-18,"Telecom Stock Roundup: Qualcomm Reports Earnings, Ericsson Inks Deal & More",Zacks
Nov-23-18,Strong Demand for Wireless Infrastructure Makers: 5 Top Picks,Zacks
Nov-27-18,[$$] Ericsson Predicts 1.5 Billion 5G Subscriptions in 2024,The Wall Street Journal
Nov-27-18,5G Estimated to Reach 1.5 Billion Subscriptions in 2024 - Ericsson Mobility Report,PR Newswire
Nov-27-18,Ericsson sees 5G subscriptions hitting 1.5 billion in 2024,Reuters
Nov-28-18,Ericsson's Mobility Report Shows 5G as the Next Big Thing,Zacks
Nov-29-18,Ericsson and Volvo Cars Sign Five-year Connected Vehicle Cloud Worldwide Deal,PR Newswire
Nov-29-18,Ericsson and Volvo Cars Sign Five-year Connected Vehicle Cloud Worldwide Deal,PR Newswire
Nov-30-18,Is Ericsson (ERIC) Stock Outpacing Its Computer and Technology Peers This Year?,Zacks
Nov-30-18,Qualcomm Stock Looks to Self-Driving Cars for a Jumpstart,InvestorPlace
Dec-04-18,QUALCOMM (QCOM) & Nokia Conclude OTA 5G NR Data Calls Test,Zacks
Dec-04-18,"Factors of Influence in 2018, Key Indicators and Opportunity within Crocs, Ericsson, AAC, Coty, Tutor Perini, and Endo International plc  New Research Emphasizes Economic Growth",GlobeNewswire
Dec-06-18,Ericsson sorry for software glitch that hits mobile services in UK and Japan,Reuters
Dec-06-18,Ericsson sorry for software glitch that hits mobile services in Britain and Japan,Reuters
Dec-06-18,European shares plunge to two-year low as Huawei arrest triggers global selloff,Reuters
Dec-06-18,Update on Software Issue Impacting Certain Customers,PR Newswire
Dec-06-18,Ericsson says has identified software glitch causing mobile network outages,Reuters
Dec-06-18,Ericsson says has identified software glitch causing mobile network outages,Reuters
Dec-06-18,Update on Software Issue Impacting Certain Customers,PR Newswire
Dec-06-18,Strong Demand for Wireless Equipment Makers: 5 Top Picks,Zacks
Dec-06-18,Ericsson says working with operators to solve network outages,Reuters
Dec-06-18,Swisscom Optimizes Customer Experience With Ericsson Expert Analytics,PR Newswire
Dec-06-18,[$$] Millions hit by smartphone outage after Ericsson software problem,Financial Times
Dec-07-18,TIGO Selects Ericsson to Upgrade its Network in Paraguay and Honduras,PR Newswire
Dec-10-18,Ericsson Gets Multi-Year Deal From TIGO to Boost Network,Zacks
Dec-11-18,5 of the Best Stocks Under $10 for 2019,Zacks
Dec-12-18,"The Zacks Analyst Blog Highlights: Ericcson, eGain, inTest, Trivago and Snap",Zacks
Dec-12-18,Ericsson Releases its 10 Hot Consumer Trends for 2019,PR Newswire
Dec-12-18,Ericsson Releases its 10 Hot Consumer Trends for 2019,PR Newswire
Dec-13-18,5 Tech Stocks That Braved Nasdaq's Loss of 2018 Gains,Zacks
Dec-18-18,5 Telecom Stocks with Promise to Continue Bull Run in 2019,Zacks
Dec-18-18,Is Ericsson (ERIC) Stock Outpacing Its Computer and Technology Peers This Year?,Zacks
Dec-20-18,Jabil (JBL) Surges: Stock Moves 6.9% Higher,Zacks
Dec-20-18,Fed Lowers GDP Estimates for 2018 & 2019: 5 Defensive Picks,Zacks
Dec-20-18,Tigo and Ericsson Accelerate Digitalization in Senegal,PR Newswire
Dec-27-18,Verizon Poised on Healthy Wireless Business and 5G Boom,Zacks
Dec-31-18,[$$] Huawei Rivals Nokia and Ericsson Struggle to Capitalize on U.S. Scrutiny,The Wall Street Journal
Jan-04-19,Cramer's lightning round: 'Do some trimming' in Qualcomm if the stock rallies,CNBC
Jan-04-19,Top 10 Stocks Under $20,Zacks
Jan-07-19,"Verizon to Gain From Solid Wireless Business, Risks Stay",Zacks
Jan-07-19,"Jim Cramer Gives His Opinion On Ciena, Momo, Qualcomm And More",Benzinga
Jan-08-19,Ericsson (ERIC) Outpaces Stock Market Gains: What You Should Know,Zacks
Jan-08-19,"Motorola Buys VaaS, Boosts Command Center Software Portfolio",Zacks
Jan-10-19,5 of the Best Stocks Under $10 for 2019,Zacks
Jan-10-19,Ericsson books charge as it rethinks Digital Services strategy,Reuters
Jan-10-19,[$$] Ericsson shares slide on restructuring costs concern,Financial Times
Jan-10-19,Ericsson takes $687 million hit as it changes course in services,Reuters
Jan-10-19,Provisions in Fourth Quarter 2018 Related to Reshaping BSS Business,PR Newswire
Jan-10-19,Provisions in Fourth Quarter 2018 Related to Reshaping BSS Business,PR Newswire
Jan-11-19,Ericsson to Reshape Digital Services Strategy to Stem Losses,Zacks
Jan-11-19,Invitation to Media and Analyst Briefings for Ericsson Q4 and Full Year 2018 Report,PR Newswire
Jan-11-19,"The Zacks Analyst Blog Highlights: Ericcson, BlackBerry, inTest, AudioEye and eGain",Zacks
Jan-14-19,Motorola Unveils Si200 Body-Worn Camera for Digital Evidence,Zacks
Jan-14-19,Zayo (ZAYO) Chosen by Tech Firm for Dark Fiber Solution,Zacks
Jan-15-19,What Is 5G? Answer That Question and Upload Profits,InvestorPlace
Jan-17-19,Nokia's eSOC Chosen by Telefonica to Transform U.K. Unit,Zacks
Jan-17-19,Ericsson (ERIC) Stock Sinks As Market Gains: What You Should Know,Zacks
Jan-17-19,"Telecom Stock Roundup: AT&amp;T to Shelve Data Sharing, Qualcomm's Defense &amp; More",Zacks
Jan-22-19,Ericsson (ERIC) to Report Q4 Earnings: What's in the Cards?,Zacks
Jan-24-19,LM Ericsson Q4 Earnings Outlook,Benzinga
Jan-25-19,"Rogers Communications Q4 Earnings &amp; Revenues Beat, Up Y/Y",Zacks
Jan-25-19,"Ericsson (ERIC) Q4 Earnings Miss Estimates, Revenues Improve",Zacks
Jan-25-19,Ericsson Shies Away from a Victory Lap on Huawei,Bloomberg
Jan-25-19,[$$] Ericsson Loss Narrows on US 5G Demand,The Wall Street Journal
Jan-25-19,Ericsson: 4Q Earnings Snapshot,Associated Press
Jan-25-19,Ericsson beats fourth-quarter forecasts on cost cuts and U.S. demand,Reuters
Jan-25-19,Ericsson Reports Fourth Quarter and Full Year Results 2018,PR Newswire
Jan-25-19,Ericsson Reports Fourth Quarter and Full Year Results 2018,PR Newswire
Jan-25-19,Ericsson reports smaller fourth-quarter operating loss than expected,Reuters
Jan-29-19,Ericsson (ERIC) Gains As Market Dips: What You Should Know,Zacks
Jan-29-19,[$$] Australias TPG cancels mobile network rollout after Huawei ban,Financial Times
Jan-29-19,New AI-based Ericsson Operations Engine Makes Managed Services Simple,PR Newswire
Jan-29-19,New AI-based Ericsson Operations Engine Makes Managed Services Simple,PR Newswire
Jan-30-19,"Juniper (JNPR) Q4 Earnings Beat Estimates, Revenues Lag",Zacks
Jan-30-19,4 Telecom Stocks to Buy as 5G Network Revs Up Sector,Zacks
Jan-31-19,[$$] Huawei woes fail to bolster telecoms rival Nokias outlook,Financial Times
Jan-31-19,Ericsson Lays Out Vision for Cellular IoT With New Segments and Solutions,PR Newswire
Jan-31-19,Ericsson Lays Out Vision for Cellular IoT With New Segments and Solutions,PR Newswire
Feb-01-19,Ericsson Completes Divestment of Majority Stake in MediaKind,PR Newswire
Feb-04-19,Ericsson Joins O-RAN Alliance,PR Newswire
Feb-06-19,"These 2 telecom stocks could be major winners from US-China trade war, Cramer says",CNBC
Feb-07-19,Ericsson Launches Critical Communications Broadband Networks Offering,PR Newswire
Feb-07-19,Ericsson Launches Critical Communications Broadband Networks Offering,PR Newswire
Feb-11-19,Ericsson and Intel Jointly Develop Next-generation Software Defined Infrastructure for the 5G Era,PR Newswire
Feb-11-19,Trump May Ban Chinese Telecom Equipment: Winners and Losers,Zacks
Feb-12-19,"The Zacks Analyst Blog Highlights: Ericsson, Cisco, Comtech, Verizon and Apple",Zacks
Feb-12-19,Ericsson-Intel Partner to Develop Advanced Platform for CSPs,Zacks
Feb-14-19,New Strong Sell Stocks for February 14th,Zacks
Feb-14-19,Swisscom Selects Ericsson Security Manager,PR Newswire
Feb-19-19,Ericsson Enhances 5G Platform for Smooth Network Evolution,PR Newswire
Feb-19-19,Ericsson Enhances 5G Platform for Smooth Network Evolution,PR Newswire
Feb-19-19,Ericsson and OPPO Sign Initial Patent License Agreement,PR Newswire
Feb-19-19,Ericsson and OPPO Sign Initial Patent License Agreement,PR Newswire
Feb-20-19,India Threatens to Send One of Its Billionaires to Jail,Bloomberg
Feb-20-19,"AT&T, Ericsson, Intel and Warner Bros. showcase the potential of 5G through a mixed-reality experience featuring DC's Batman and The Scarecrow at MWC19 Barcelona",PR Newswire
Feb-20-19,Invitation to Ericsson's Annual General Meeting 2019,PR Newswire
Feb-20-19,Invitation to Ericsson's Annual General Meeting 2019,PR Newswire
Feb-20-19,India's top court finds Anil Ambani guilty on contempt in Ericsson case,Reuters
Feb-21-19,Tech Stocks Rise Midday After Trump Touts 5G,Investing.com
Feb-22-19,2019 Healthiest Employers: Ericsson,American City Business Journals
Feb-25-19,STC and Ericsson Launch 5G Network in Saudi Arabia,PR Newswire
Feb-25-19,STC and Ericsson Launch 5G Network in Saudi Arabia,PR Newswire
Feb-25-19,Ooredoo Selects Ericsson for 5G,PR Newswire
Feb-25-19,Ooredoo Selects Ericsson for 5G,PR Newswire
Feb-25-19,Ooredoo Selects Ericsson for 5G,PR Newswire
Feb-25-19,Ericsson and Inseego Partner to Make 5G NR Networks Real,Business Wire
Feb-25-19,5G primer: What you need to know,American City Business Journals
Feb-25-19,Ericsson buys antenna and filters business of Germany's Kathrein,Reuters
Feb-25-19,Borje Ekholm: Ericsson to Switch on 5G Globally in 2019,PR Newswire
Feb-26-19,5 Stock Charts Ripe for a Breakout,InvestorPlace
Feb-26-19,Etisalat UAE Selects Ericsson for 5G,PR Newswire
Feb-26-19,Etisalat UAE Selects Ericsson for 5G,PR Newswire
Feb-26-19,Intel at MWC 2019: 5G &amp; Edge Computing Remain Focal Points,Zacks
Feb-26-19,Ericsson Plans to Buy Kathrein's Antenna &amp; Filters Business,Zacks
Feb-26-19,Ericsson to Transform Tele 2 Russia Network Towards 5G,PR Newswire
Feb-26-19,Sprint to Debut Commercial 5G Services in 9 Cities in May,Zacks
Feb-26-19,Chunghwa Telecom Selects Ericsson IoT Accelerator to Drive Enterprise IoT,PR Newswire
Feb-26-19,Chunghwa Telecom Selects Ericsson IoT Accelerator to Drive Enterprise IoT,PR Newswire
Feb-26-19,Ericsson and China Unicom Announce 5G Smart Harbor at the Port of Qingdao,PR Newswire
Feb-26-19,Ericsson and China Unicom Announce 5G Smart Harbor at the Port of Qingdao,PR Newswire
Feb-27-19,Ericsson Could Push Higher but Slowing Momentum Is an Issue,TheStreet.com
Feb-27-19,5G Is Still Tomorrows Dream for Big Tech. Expect a Slow Rollout.,Barrons.com
Feb-28-19,"Telecom Stock Roundup: Qualcomm Offers New Chip, Sprint's 5G Debut &amp; More",Zacks
Feb-28-19,U.S. Cellular Selects Ericsson for 5G Deployments,PR Newswire
Mar-01-19,Ericsson Annual Report 2018 Published,PR Newswire
Mar-07-19,"Report: Exploring Fundamental Drivers Behind Manulife Financial, Fidelity National Financial, Heritage-Crystal Clean, Ericsson, Ascendis Pharma A/S, and Astec Industries  New Horizons, Emerging Trends, and Upcoming Developments",GlobeNewswire
Mar-08-19,Ericsson and UNESCO Launch New Global AI Skill Development Initiative for Youth,PR Newswire
Mar-12-19,Ericsson (ERIC) Stock Sinks As Market Gains: What You Should Know,Zacks
Mar-12-19,Legal Noise Wont Stop Qualcomm Stock,InvestorPlace
Mar-15-19,"Hurd says Congress, local governments need to incentivize 5G",American City Business Journals
Mar-15-19,New Strong Sell Stocks for March 15th,Zacks
Mar-18-19,TDC Selects Ericsson for 5G and Ericsson Operations Engine Managed Services,PR Newswire
Mar-18-19,Brotherly love at Reliance? India's Mukesh Ambani provides 'support' to brother Anil as debt paid off,Reuters
Mar-18-19,"India's RCom pays Ericsson, says asset deal with Jio falls through",Reuters
Mar-19-19,Ericsson Collaborates With TDC to Support Digital Denmark,Zacks
Mar-19-19,India's RCom jumps after Mukesh Ambani bails out brother Anil on Ericsson dues,Reuters
Mar-19-19,Reliance Communications jumps after Mukesh Ambani bails out brother Anil on Ericsson dues,Reuters
Mar-21-19,Ericsson (ERIC) Stock Sinks As Market Gains: What You Should Know,Zacks
Mar-21-19,Poland faces 5G slowdown without regulatory change: Ericsson,Reuters
Mar-21-19,Ericsson Wins 5G Commercial Deal With KT,PR Newswire
Mar-21-19,Ericsson Wins 5G Commercial Deal With KT,PR Newswire
Mar-22-19,"Telecom Stock Roundup: Verizon to Launch 5G, Qualcomm's U.S. Verdict &amp; More",Zacks
Mar-25-19,Ericsson Gears Up for South Korea 5G Launch With Local Firms,Zacks
Mar-26-19,AT&T and Ericsson demonstrate world's first network slice with lifecycle management based on ONAP,PR Newswire
Mar-26-19,Ericsson Industry Connect: Accelerating Industry 4.0 Through Reliable Wireless Connectivity,PR Newswire
Mar-26-19,Ericsson Industry Connect: Accelerating Industry 4.0 Through Reliable Wireless Connectivity,PR Newswire
Mar-27-19,Ericsson's Annual General Meeting 2019,PR Newswire
Mar-28-19,"Telecom Stock Roundup: AT&amp;T Averts Viacom Blackout, T-Mobile's Broadband &amp; More",Zacks
Mar-29-19,Here is What Hedge Funds Think About Telefonaktiebolaget LM Ericsson (ERIC),Insider Monkey
Mar-29-19,Ericsson Annual Report on Form 20-F filed with the SEC,PR Newswire
Mar-29-19,Ericsson Annual Report on Form 20-F filed with the SEC,PR Newswire
Apr-01-19,Ericsson and Batelco to Introduce 5G Services in Bahrain,Zacks
Apr-01-19,Ericsson and ABB Join Forces to Accelerate Wireless Automation for Flexible Factories,PR Newswire
Apr-03-19,Race for 5G Intensifies as U.S. Matches Stride With China,Zacks
Apr-03-19,Invitation to Media and Analyst Briefings for Ericsson Q1 2019 Report,PR Newswire
Apr-04-19,Ericsson (ERIC) Stock Sinks As Market Gains: What You Should Know,Zacks
Apr-05-19,A little-known risk to Apple is 5G cellular technology,MarketWatch
Apr-05-19,"US Fails to Convince Allies to Ban Huawei, Resorts to Plan B",Zacks
Apr-05-19,ConVeX Participates in World's First Multi-Country Cross-Border C-V2X Demonstration Across Europe,PR Newswire
Apr-08-19,A little-known risk to Apple is 5G cellular technology,MarketWatch
Apr-11-19,Ericsson (ERIC) Stock Moves 0.31%: What You Should Know,Zacks
Apr-12-19,Ericsson (ERIC) to Report Q1 Earnings: What Lies Ahead?,Zacks
Apr-15-19,Ericsson North America leader sees resurgence after brutal period  but work remains,American City Business Journals
Apr-15-19,Nokia shares drop 3% after Goldman downgrade citing competition from Samsung and Ericsson,CNBC
Apr-16-19,The Tech Cold War With China Is Still Heating Up. Just Ask Ericsson.,Barrons.com
Apr-17-19,"Why HEXO, Smart & Final Stores, and Ericsson Jumped Today",Motley Fool
Apr-17-19,"Ericsson (ERIC) Q1 Earnings Beat Estimates, Revenues Up Y/Y",Zacks
Apr-17-19,Ericsson and Future Technologies Venture ink strategic cooperation agreement,PR Newswire
Apr-17-19,"We won't use price as a weapon to improve margins, Ericsson CEO says",CNBC Videos
Apr-17-19,China growth sees mixed reaction in Europe markets,MarketWatch
Apr-17-19,"Ericsson profit beats forecasts for fifth straight quarter as savings, 5G sales kick in",CNBC
Apr-17-19,"European 5G regulation needs to be more accommodative, Ericsson CEO says",CNBC Videos
Apr-17-19,Ericsson: 1Q Earnings Snapshot,Associated Press
Apr-17-19,Ericsson shares hit four-year high after profit tops forecasts for fifth quarter,Reuters
Apr-17-19,"Ericsson profit beats forecasts for fifth straight quarter as savings, 5G sales kick in",Reuters
Apr-17-19,Ericsson and Swisscom in European Commercial 5G First,PR Newswire
Apr-17-19,Ericsson Reports First Quarter Results 2019,PR Newswire
Apr-17-19,Ericsson first-quarter operating profit beats forecast,Reuters
Apr-17-19,Ericsson Reports First Quarter Results 2019,PR Newswire
Apr-18-19,Nokia Stock Is Still Waiting for the 5G Gold Rush,InvestorPlace
Apr-18-19,"Telecom Stock Roundup: Qualcomm Settles Patent Battle, AT&amp;T's Hulu Sale &amp; More",Zacks
Apr-18-19,New Strong Buy Stocks for April 18th,Zacks
Apr-18-19,Ericsson (ERIC) Catches Eye: Stock Jumps 7.3%,Zacks
Apr-22-19,"Rogers Communications (RCI) Misses on Q1 Earnings, Revenues",Zacks
Apr-22-19,Huawei revenue rises 39% despite US pressure on 5G,Financial Times
Apr-23-19,Dare. Design. Deliver: Ericsson D-Fifteen debuts in Silicon Valley,PR Newswire
Apr-23-19,"The Zacks Analyst Blog Highlights: Showa Denko, Ericsson and Snap",Zacks
Apr-24-19,Qualcomm (QCOM) in Focus: Stock Moves 5.8% Higher,Zacks
Apr-25-19,"Nokia (NOK) Q1 Earnings Miss Estimates, Revenues Up Y/Y",Zacks
Apr-25-19,Huawei's 5G Struggles Make Life Harder for Nokia,Bloomberg
Apr-25-19,Nokia records shock loss in 5G price war,The Telegraph
Apr-26-19,7 A-Rated Stocks That Are Under $10,InvestorPlace
Apr-26-19,KPN: Excluding Huawei from 5G network will not incur extra costs,Reuters
Apr-26-19,KPN: Excluding Huawei from 5G network will not incur extra costs,Reuters
Apr-26-19,Ericsson's Nomination Committee Appointed,PR Newswire
Apr-29-19,Jim Cramer revisits his top stock picks for the 5G rollout,CNBC
Apr-29-19,Ericsson and Ambra sign global contract to sell 5G-ready mining industry automation,CNW Group
Apr-29-19,Ericsson and Ambra sign global contract to sell 5G-ready mining industry automation,PR Newswire
Apr-30-19,Surprise Loss Highlights Ongoing Risk to Nokia Stock,InvestorPlace
Apr-30-19,Woodward (WWD) Q2 Earnings Beat Estimates on Higher Revenues,Zacks
May-01-19,Media Advisory - Ericsson to announce new AI investment in Montreal to support 5G strategy,CNW Group
May-01-19,"Harris (HRS) Q3 Earnings &amp; Revenues Beat, FY19 View Up",Zacks
May-03-19,The drive to make 5G a reality has led to a surge in demand for tower climbers,CNBC
May-03-19,Is Ericsson (ERIC) Outperforming Other Computer and Technology Stocks This Year?,Zacks
May-03-19,"Disappointing as It Is, Nokia Stock Is a Solid Dividend Buy",InvestorPlace
May-03-19,Motorola (MSI) Outpaces Q1 Earnings &amp; Revenue Estimates,Zacks
May-07-19,Ericsson ConsumerLab Report Busts Myths Surrounding the Value of 5G for Consumers,PR Newswire
May-08-19,Videotron and its partners deploy a 5G-enabled site in the Open-Air Laboratory for Smart Living,CNW Group
May-09-19,Carolina West Wireless signs multi-year network modernization deal with Ericsson,PR Newswire
May-09-19,Near-Term Prospects for Wireless Equipment Industry Promising,Zacks
May-10-19,Value Investing Set to Shine: 5 Top-Ranked ETFs &amp; Stocks,Zacks
