date,title,source
Oct-17-18,Top Ranked Value Stocks to Buy for October 17th,Zacks
Oct-18-18,Should Tailored Brands Inc (NYSE:TLRD) Be Part Of Your Portfolio?,Simply Wall St.
Oct-22-18,American Airlines flight attendants take challenge: Describe employer in three words,American City Business Journals
Oct-23-18,Has Tailored Brands (TLRD) Outpaced Other Consumer Discretionary Stocks This Year?,Zacks
Oct-25-18,"Factors of Influence in 2018, Key Indicators and Opportunity within StoneMor Partners, Catalyst Biosciences, Kennametal, Emergent Biosolutions, Kimball International, and Tailored Brands  New Research Emphasizes Economic Growth",GlobeNewswire
Oct-31-18,"Tailored Brands To Announce Fiscal 2018 Third Quarter Financial Results And Host Conference Call On December 12, 2018",PR Newswire
Nov-05-18,Men's Wearhouse Grows Custom Programs,PR Newswire
Nov-09-18,Morgan Stanley Bank of America Merrill Lynch Trust 2013-C11 -- Moody's affirms nine and downgrades four classes of MSBAM 2013-C11,Moody's
Nov-13-18,American Airlines employees start Lands' End uniform field test,American City Business Journals
Dec-06-18,Is Now An Opportune Moment To Examine Tailored Brands Inc (NYSE:TLRD)?,Simply Wall St.
Dec-10-18,One Liberty Properties Acquires Industrial Property,GlobeNewswire
Dec-12-18,[$$] Tailored Brands Cuts Outlook on Sluggish Mens Wearhouse Sales,The Wall Street Journal
Dec-12-18,[$$] Tailored Brands Trims Outlook,The Wall Street Journal
Dec-12-18,Tailored Brands plummets 25 percent after missing revenue expectations,CNBC
Dec-12-18,Tailored Brands (TLRD) Q3 Earnings Beat Estimates,Zacks
Dec-12-18,"Stocks making the biggest moves after hours: Tailored Brands, Oxford Industries and more",CNBC
Dec-12-18,Tailored Brands: Fiscal 3Q Earnings Snapshot,Associated Press
Dec-12-18,"Tailored Brands, Inc. Reports Fiscal 2018 Third Quarter Results",Business Wire
Dec-13-18,CVS and Delta fall while Aflac and General Electric jump,Associated Press
Dec-13-18,"Why Aurora Cannabis, Tailored Brands, and Limelight Networks Slumped Today",Motley Fool
Dec-13-18,2 Stocks Move on Thursday,GuruFocus.com
Dec-13-18,"MarketPulse: Tailored Brands, Oxford Industries Slump Rattles Retailers",Investing.com
Dec-13-18,Why Tailored Brands Stock Crashed Today,Motley Fool
Dec-13-18,[$$] Tailored Brands Folded Like a Cheap Suit,The Wall Street Journal
Dec-13-18,Tailored Brands Unravels After Reducing Full-Year Guidance,TheStreet.com
Dec-13-18,"Stocks making the biggest moves premarket: KO, GE, PG, AAPL & more",CNBC
Dec-14-18,Edited Transcript of TLRD earnings conference call or presentation 12-Dec-18 10:00pm GMT,Thomson Reuters StreetEvents
Dec-14-18,"Company News For Dec 14, 2018",Zacks
Dec-14-18,Today's Research Reports on Trending Tickers: Tailored Brands and Hanesbrands,ACCESSWIRE
Dec-17-18,Edited Transcript of TLRD earnings conference call or presentation 12-Dec-18 10:00pm GMT,Thomson Reuters StreetEvents
Dec-18-18,Tailored Brands Climbs on New 'Buy' Rating,TheStreet.com
Dec-20-18,Rumors fly when American Airlines executive gets promotion,American City Business Journals
Dec-24-18,Men's Wearhouse parent Tailored Brands' stock bounces back after 37% plummet last week,MarketWatch
Jan-02-19,Edited Transcript of TLRD earnings conference call or presentation 12-Dec-18 10:00pm GMT,Thomson Reuters StreetEvents
Jan-08-19,"Tailored Brands Announces Participation in 21st Annual ICR Conference on Tuesday January 15, 2019",Business Wire
Jan-14-19,[$$] Tailored Brands: We Hate the Way It Looks,The Wall Street Journal
Jan-14-19,"Newmont Mining, Wynn and PG&E skid while Gannett jumps",Associated Press
Jan-14-19,"Why Tailored Brands, Newmont Mining, and Prestige Consumer Healthcare Slumped Today",Motley Fool
Jan-14-19,Tailored Brands Tanks After Lowering Guidance on Weakness at Jos. A Bank,TheStreet.com
Jan-14-19,"Profit and sales warnings batter retail stocks, but Lululemon shines",MarketWatch
Jan-14-19,Why Tailored Brands Stock Is Tanking Today,InvestorPlace
Jan-14-19,[$$] Tailored Brands: We Hate the Way It Looks,The Wall Street Journal
Jan-14-19,Why Tailored Brands Stock Tumbled Today,Motley Fool
Jan-14-19,"UPDATE: Tailored Brands lowers Q4 guidance as Jos. A. Bank sales fall short, shares slide",MarketWatch
Jan-14-19,"Tailored Brands, Inc. Updates Outlook in Advance of ICR Conference",Business Wire
Jan-15-19,"Profit and sales warnings batter retail stocks, but Lululemon shines",MarketWatch
Jan-23-19,3 Stocks That Are Absurdly Cheap Right Now,Motley Fool
Jan-23-19,"Tech Data, Tailored Brands, Texas Instruments and Xilinx highlighted as Zacks Bull and Bear of the Day",Zacks
Jan-23-19,Tailored Brands Releases 2018 Sustainability Report,Business Wire
Jan-30-19,American Airlines fast-track uniform project hits some speed bumps,American City Business Journals
Jan-31-19,"Read This Before You Buy Tailored Brands, Inc. (NYSE:TLRD) Because Of Its P/E Ratio",Simply Wall St.
Feb-04-19,"Tailored Brands, Inc. Declares Quarterly Cash Dividend",Business Wire
Feb-07-19,"Tailored Brands to Announce Fiscal 2018 Fourth Quarter Financial Results and Host Conference Call on March 13, 2019",Business Wire
Feb-20-19,The Big Shorts Michael Burry Reveals His Latest Stock Picks for the First Time Since 2016,Insider Monkey
Feb-27-19,"Detailed Research: Economic Perspectives on AT&T, Nokia, United Parcel Service, Tailored Brands, ADTRAN, and Carpenter Technology  What Drives Growth in Today's Competitive Landscape",GlobeNewswire
