date,title,source
Oct-18-18,Can UnitedHealth Group and Johnson & Johnson Continue Their Winning Ways?,Motley Fool
Oct-18-18,Gilead Sciences (GILD) Dips More Than Broader Markets: What You Should Know,Zacks
Oct-18-18,Risk-Reward With Gilead Sciences,GuruFocus.com
Oct-18-18,Edited Transcript of GILD earnings conference call or presentation 25-Jul-18 9:00pm GMT,Thomson Reuters StreetEvents
Oct-18-18,"Market Morning: China, Yuan Crushed; Fed Minutes Sparse, HIV Meets Match, Exxon Wants China",Market Exclusive
Oct-18-18,Is Sangamo Therapeutics Inc. a Buy?,Motley Fool
Oct-19-18,Jackpot stocks that could make you a billionaire,CNBC Videos
Oct-19-18,Could a Diagnostic Be Key to Winning This Big Healthcare Market?,Motley Fool
Oct-19-18,Investors Hunt for Biotech Winners as Wider Stock Market Churns,Bloomberg
Oct-22-18,Will Gilead (GILD) HIV Sales Offset HCV Sales Decline in Q3?,Zacks
Oct-22-18,POSITIVE TRIAL RESULTS WITH FILGOTINIB IN PSORIATIC ARTHRITIS AND ANKYLOSING SPONDYLITIS BOTH PUBLISHED IN THE LANCET,GlobeNewswire
Oct-22-18,Positive Trial Results with Filgotinib in Psoriatic Arthritis and Ankylosing Spondylitis Both Published in The Lancet,Business Wire
Oct-23-18,Why CASI Pharmaceuticals Inc. Is Rocketing Higher Today,Motley Fool
Oct-23-18,"Alkermes (ALKS) Exceeds Q3 Earnings Estimates, Raises Outlook",Zacks
Oct-23-18,"The Zacks Analyst Blog Highlights: Roche, Gilead and Bristol Myers",Zacks
Oct-24-18,3 Top Healthcare Stocks to Buy Right Now,Motley Fool
Oct-24-18,Gilead earnings: Expect a strong quarter despite executive turnover,MarketWatch
Oct-24-18,Healthcare ETFs to Buy Ahead of Q3 Earnings,Zacks
Oct-24-18,Investors Are Underestimating Gilead Sciences Stock,InvestorPlace
Oct-24-18,"Drug Stocks' Earnings Due on Oct 25: MRK, BMY, GILD & CELG",Zacks
