date,title,source
Oct-18-18,Can UnitedHealth Group and Johnson & Johnson Continue Their Winning Ways?,Motley Fool
Oct-18-18,Gilead Sciences (GILD) Dips More Than Broader Markets: What You Should Know,Zacks
Oct-18-18,Risk-Reward With Gilead Sciences,GuruFocus.com
Oct-18-18,Edited Transcript of GILD earnings conference call or presentation 25-Jul-18 9:00pm GMT,Thomson Reuters StreetEvents
Oct-18-18,"Market Morning: China, Yuan Crushed; Fed Minutes Sparse, HIV Meets Match, Exxon Wants China",Market Exclusive
Oct-18-18,Is Sangamo Therapeutics Inc. a Buy?,Motley Fool
Oct-19-18,Jackpot stocks that could make you a billionaire,CNBC Videos
Oct-19-18,Could a Diagnostic Be Key to Winning This Big Healthcare Market?,Motley Fool
Oct-19-18,Investors Hunt for Biotech Winners as Wider Stock Market Churns,Bloomberg
