date,title,source
Oct-18-18,Houghton Mifflin Harcourt Schedules Conference Call to Discuss Third Quarter 2018 Results,PR Newswire
Oct-31-18,"Houghton Mifflin Harcourt and Audible to Publish Guy Raz's ""How I Built This""",PR Newswire
Nov-08-18,Why Houghton Mifflin Harcourt Company Stock Soared 22% Today,Motley Fool
Nov-08-18,Edited Transcript of HMHC earnings conference call or presentation 8-Nov-18 1:30pm GMT,Thomson Reuters StreetEvents
Nov-08-18,Houghton Mifflin (HMHC) Surpasses Q3 Earnings Estimates,Zacks
Nov-08-18,Houghton Mifflin: 3Q Earnings Snapshot,Associated Press
Nov-08-18,Houghton Mifflin Harcourt Announces Third Quarter 2018 Results,PR Newswire
Nov-09-18,California State Board of Education Approves Houghton Mifflin Harcourt's Science Dimensions for Grades K-8,PR Newswire
Nov-12-18,Edited Transcript of HMHC earnings conference call or presentation 8-Nov-18 1:30pm GMT,Thomson Reuters StreetEvents
