date,title,source
Oct-22-18,"ASUR 3Q18 Passenger Traffic Increased 6.7% YoY in Mexico, 3.8% in San Juan, Puerto Rico and 7.3% in Colombia",PR Newswire
Oct-23-18,"Grupo Aeroportuario del Sureste, SAB de CV (ASR) Q3 2018 Earnings Conference Call Transcript",Motley Fool
Oct-23-18,Grupo Aeroportuario del Sureste SAB de CV Continued to Battle Some Turbulence in Q3,Motley Fool
Nov-05-18,ASUR Announces Total Passenger Traffic for October 2018,PR Newswire
Nov-19-18,ECHO vs. ASR: Which Stock Should Value Investors Buy Now?,Zacks
Dec-24-18,ECHO vs. ASR: Which Stock Is the Better Value Option?,Zacks
Jan-03-19,ASUR Announces Total Passenger Traffic for December 2018,PR Newswire
Jan-14-19,ECHO or ASR: Which Is the Better Value Stock Right Now?,Zacks
Jan-17-19,"Canada Jetlines Reaches Agreements with Puerto Vallarta, Los Cabos, and Cancun Airports",GlobeNewswire
Jan-31-19,ECHO or ASR: Which Is the Better Value Stock Right Now?,Zacks
