date,title,source
Oct-18-18,"Detailed Research: Economic Perspectives on Rockwell Medical, Diamondback Energy, Steven Madden, Synaptics, Photronics, and Caleres  What Drives Growth in Today's Competitive Landscape",GlobeNewswire
Oct-29-18,Rockwell Medical Schedules Third Quarter 2018 Conference Call,PR Newswire
Nov-01-18,Rockwell Medical Appoints New Chief Financial Officer,PR Newswire
Nov-09-18,Edited Transcript of RMTI earnings conference call or presentation 9-Nov-18 1:30pm GMT,Thomson Reuters StreetEvents
Nov-09-18,"Rockwell Medical (RMTI) Reports Q3 Loss, Tops Revenue Estimates",Zacks
Nov-09-18,Rockwell Medical: 3Q Earnings Snapshot,Associated Press
Nov-09-18,"Rockwell Medical, Inc. Reports Third Quarter 2018 Financial Results",PR Newswire
Dec-03-18,"Rockwell Medical, Inc. Appoints New Vice President, Marketing",PR Newswire
Dec-10-18,"Rockwell Medical, Inc. Appoints New Vice President, Operations",PR Newswire
Dec-11-18,"Report: Developing Opportunities within Eaton Vance, IDT, Hemispherx BioPharma, Edgewell Personal Care, Rockwell Medical, and Avadel Pharmaceuticals  Future Expectations, Projections Moving into 2018",GlobeNewswire
Dec-12-18,Edited Transcript of RMTI earnings conference call or presentation 9-Nov-18 1:30pm GMT,Thomson Reuters StreetEvents
Dec-18-18,Edited Transcript of RMTI earnings conference call or presentation 9-Nov-18 1:30pm GMT,Thomson Reuters StreetEvents
Dec-18-18,5 Beaten-Down Medical Product Stocks to Rebound in 2019,Zacks
Dec-21-18,"Rockwell Medical, Inc. to Present at Biotech Showcase 2019",GlobeNewswire
Dec-31-18,7 Hot Momentum Stocks to Watch in 2019,Zacks
Jan-02-19,"The Zacks Analyst Blog Highlights: Barclays, Rockwell Medical, NextEra, Belmond and Shaw Communications",Zacks
Jan-17-19,"Rockwell Medical, Inc. (NASDAQ:RMTI): What Does Its Beta Value Mean For Your Portfolio?",Simply Wall St.
Feb-05-19,"Rockwell Medical, Inc. to Present at 2019 BIO CEO & Investor Conference",GlobeNewswire
Mar-06-19,"Rockwell Medical, Inc. to Discuss Fourth Quarter and Full Year 2018 Financial Results on March 14, 2019",GlobeNewswire
Mar-14-19,Rockwell Medical: 4Q Earnings Snapshot,Associated Press
Mar-14-19,"Rockwell Medical, Inc. Reports Fourth Quarter and Full Year 2018 Financial Results",GlobeNewswire
Mar-15-19,Edited Transcript of RMTI earnings conference call or presentation 14-Mar-19 12:30pm GMT,Thomson Reuters StreetEvents
Mar-20-19,"Rockwell Medical, Inc. to Present at Sidoti & Company LLC Spring 2019 Investor Conference",GlobeNewswire
Apr-03-19,"Rockwell Medical, Inc. to Present at H.C Wainwright Global Life Sciences Conference",GlobeNewswire
