date,title,source
Oct-22-18,"Varian Ranked First in Probability of Repurchase and Overall Manufacturer, System, and Service Performance in 2018 Survey of Radiation Oncology Professionals",PR Newswire
Oct-22-18,"EW, VAR Earnings Due on Oct 23: Here Are Key Predictions",Zacks
Oct-22-18,"Cincinnati Childrens, UC Health research 1-second cancer treatment",American City Business Journals
Oct-23-18,Varian and GenesisCare to Form Strategic Partnership for Cancer Care Research and Increased Access to Care,PR Newswire
Oct-23-18,Varian Reports Results for Fourth Quarter and Full Fiscal Year 2018,PR Newswire
Oct-23-18,A Look At Varian Medical's Q4 Earnings,Benzinga
Oct-24-18,"Dow Plunges 608 Points...and Just Like That, All Its 2018 Gains Are Gone",Barrons.com
Oct-24-18,Edited Transcript of VAR earnings conference call or presentation 23-Oct-18 8:30pm GMT,Thomson Reuters StreetEvents
Oct-24-18,Why Varian Medical Systems Is Flying High Today,Motley Fool
Oct-24-18,"Varian (VAR) Misses Earnings, Beats Revenue Estimates in Q4",Zacks
Oct-24-18,"The Daily Biotech Pulse: Illumina's Strong Q3, Celgene's Positive Cancer Drug Trial, Proteostasis Offering",Benzinga
Oct-24-18,"Varian Medical Systems, Inc. (VAR) Q4 2018 Earnings Conference Call Transcript",Motley Fool
Oct-25-18,Varian Medical (VAR) Jumps: Stock Rises 7.7%,Zacks
Oct-25-18,"3 Big Stock Charts for Thursday: Pfizer, Philip Morris and Dominion Energy",InvestorPlace
Oct-25-18,The Dow Lost All of Its Gains From 2018 and the Nasdaq Is in Correction Territory,Barrons.com
Oct-25-18,Varian Outlines Strategy for AI-Driven Multimodality Adaptive Radiotherapy Suite,PR Newswire
Oct-25-18,Varian Expands Cancer Care Portfolio with Noona Healthcare Acquisition,PR Newswire
Nov-01-18,Varian Medical Systems Inc (NYSE:VAR) Has A ROE Of 9.5%,Simply Wall St.
Nov-01-18,"Consolidated Research: 2018 Summary Expectations for Dr. Reddy's Laboratories, Union Pacific, Zimmer Biomet, Varian Medical, Sonic Automotive, and Axalta Coating  Fundamental Analysis, Key Performance Indications",GlobeNewswire
Nov-05-18,Beijing Cancer Hospital Utilizes Varian RapidPlan to Win IDC Digital Transformation Award,PR Newswire
Nov-14-18,Varian Publishes 2018 Sustainability Report,PR Newswire
Nov-19-18,Varian to Present at the Citi Global Healthcare Conference,PR Newswire
Nov-20-18,Anat Ashkenazi Named to Varian Board of Directors,PR Newswire
Nov-26-18,"Varian Medical Systems Inc (VAR) Files 10-K for the Fiscal Year Ended on September 30, 2018",GuruFocus.com
Nov-28-18,Varian Halcyon Treatment System Receives China NMPA Approval,PR Newswire
Nov-28-18,MSH Selects Varian Cancer Care Solution to Expand Treatment Capabilities Across South Africa,PR Newswire
Nov-29-18,Varian Medical's (VAR) Halcyon Gets NMPA Approval in China,Zacks
Nov-30-18,HollandPTC Opens with ProBeam System from Varian,PR Newswire
Dec-03-18,Varian Schedules Annual Stockholder Meeting in Palo Alto,PR Newswire
Dec-06-18,Varian-Equipped Emory Proton Therapy Center Opens,PR Newswire
Dec-10-18,Varian Announces First Quarter Fiscal Year 2019 Earnings Release Date,PR Newswire
Dec-10-18,Varian Named One of America's Most Just Companies in 2018 by Forbes and JUST Capital,PR Newswire
Dec-10-18,"New Research Coverage Highlights Tractor Supply, Shaw Communications, Alkermes plc, Jacobs Engineering Group, Eastman Chemical, and Varian Medical  Consolidated Revenues, Company Growth, and Expectations for 2018",GlobeNewswire
Dec-11-18,Varian Medical ProBeam-Equipped Emory Center Opens in Georgia,Zacks
Dec-11-18,Paul Scherrer Institute Utilizing Varian Software Solution for Advanced Proton Therapy Treatments,PR Newswire
Dec-13-18,"All You Need To Know About Varian Medical Systems, Inc.s (NYSE:VAR) Financial Health",Simply Wall St.
Dec-13-18,Varian Medical's Eclipse Picked by Paul Scherrer Institute,Zacks
Dec-18-18,Phoenix Cyberknife and Radiation Oncology Center Delivers Its First HyperArc Treatments,PR Newswire
Dec-18-18,"Varian Medical Systems, Inc. (VAR): Are Hedge Funds Right About This Stock?",Insider Monkey
Dec-19-18,Varian to Present at the J.P. Morgan Healthcare Conference,PR Newswire
Dec-24-18,Varian U.S. Tariff Exclusion Request Granted for Halcyon Radiotherapy System for Cancer Treatments,PR Newswire
Dec-26-18,Varian Medical's (VAR) Halcyon Excluded From Trade Tariffs,Zacks
Jan-09-19,Here's Why You Should Hold Varian Medical (VAR) Stock Now,Zacks
Jan-14-19,Varian Showcases Radiotherapy Ecosystem at 2019 China Users Meeting,PR Newswire
Jan-15-19,Varian Medical (VAR) to Report Q1 Earnings: What's in Store?,Zacks
Jan-16-19,Varian Medical Systems (VAR) Reports Earnings Next Week: What Awaits?,Zacks
Jan-17-19,First Cancer Patients in Taiwan Treated with Varian HyperArc High-Definition Radiotherapy,PR Newswire
Jan-22-19,"Medical Product Stocks' Earnings on Jan 23: ABT, NXGN &amp; VAR",Zacks
Jan-22-19,Varian Medical's (VAR) ProBeam Compact Picked by Biopolis,Zacks
Jan-23-19,Varian Reports Results for First Quarter of Fiscal Year 2019,PR Newswire
Jan-24-19,Edited Transcript of VAR earnings conference call or presentation 23-Jan-19 9:30pm GMT,Thomson Reuters StreetEvents
Jan-24-19,"Varian (VAR) Meets Q1 Earnings Estimates, Grows Globally",Zacks
Jan-25-19,Edited Transcript of VAR earnings conference call or presentation 23-Jan-19 9:30pm GMT,Thomson Reuters StreetEvents
Jan-25-19,"Intuitive Surgical (ISRG) Earnings Miss, Revenues Beat in Q4",Zacks
Jan-28-19,Hill-Rom's (HRC) Earnings and Revenues Top Estimates in Q1,Zacks
Jan-29-19,Accuray &amp; China Isotope Collaborate to Sell Radiation Devices,Zacks
Jan-29-19,Edited Transcript of VAR earnings conference call or presentation 23-Jan-19 9:30pm GMT,Thomson Reuters StreetEvents
Jan-30-19,"Illumina (ILMN) Q4 Earnings Lag Estimates, Revenues Top Mark",Zacks
Jan-30-19,Thermo Fisher (TMO) Beats on Earnings and Revenues in Q4,Zacks
Jan-30-19,Align Technology (ALGN) Beats on Earnings and Revenues in Q4,Zacks
Jan-30-19,Varian Strong on Global Expansion and Proton Therapy Arm,Zacks
Jan-30-19,"Stryker (SYK) Q4 Earnings Beat, International Revenues Surge",Zacks
Jan-30-19,Edited Transcript of VAR earnings conference call or presentation 23-Jan-19 9:30pm GMT,Thomson Reuters StreetEvents
Jan-31-19,"Hologic's (HOLX) Q1 Earnings Beat Estimates, Guidance Raised",Zacks
Jan-31-19,"Surmodics (SRDX) Q1 Earnings &amp; Revenues Beat, Guidance Solid",Zacks
Jan-31-19,"AmerisourceBergen (ABC) Beats on Q1 Earnings, Trims EPS View",Zacks
Jan-31-19,"Baxter's (BAX) Earnings, Revenues Beat Estimates in Q4",Zacks
Feb-01-19,"IDEXX (IDXX) Q4 Earnings Top Estimates, Raises '19 EPS View",Zacks
Feb-01-19,"PerkinElmer (PKI) Q4 Earnings Beat, Diagnostics Grows Y/Y",Zacks
Feb-01-19,"McKesson (MCK) Beats on Q3 Earnings, Gains From Solid View",Zacks
Feb-01-19,"Cardiovascular Systems (CSII) Q2 Earnings Top, Revenues Meet",Zacks
Feb-01-19,"Zimmer Biomet (ZBH) Q4 Earnings Meet Estimates, Revenues Top",Zacks
Feb-01-19,"Factors of Influence in 2019, Key Indicators and Opportunity within Exelixis, Varian Medical, DXC Technology, Bridgepoint Education, Armstrong World Industries, and Immunomedics  New Research Emphasizes Economic Growth",GlobeNewswire
Feb-01-19,"Edwards Lifesciences (EW) Q4 Earnings In Line, Revenues Top",Zacks
Feb-01-19,"ABIOMED (ABMD) Q3 Earnings Beat, Impella Maintains Momentum",Zacks
Feb-04-19,"Today's Bell Ringer, February 4, 2019",CNBC Videos
Feb-04-19,Omnicell Solid on Geographic Expansion Amid Stiff Competition,Zacks
Feb-05-19,"QIAGEN's (QGEN) Q4 Earnings In Line, Revenues Miss Mark",Zacks
Feb-05-19,"Becton, Dickinson (BDX) Q1 Earnings In Line With Estimates",Zacks
Feb-05-19,3 Medical Instruments Stocks Likely to Beat Estimates in Q4,Zacks
Feb-05-19,Varian Demonstrating Smarter Cancer Care Solutions at HIMSS19,PR Newswire
Feb-05-19,"Should You Be Worried About Insider Transactions At Varian Medical Systems, Inc. (NYSE:VAR)?",Simply Wall St.
Feb-06-19,"Haemonetics (HAE) Earnings Top, Revenues Lag Estimates in Q3",Zacks
Feb-06-19,"Boston Scientific (BSX) Beats on Q4 Earnings, Margins Dip",Zacks
Feb-06-19,Myriad Genetics (MYGN) Q2 Earnings &amp; Revenues Miss Estimates,Zacks
Feb-06-19,"Cerner (CERN) Q4 Earnings Meet Estimates, Revenues Miss",Zacks
Feb-06-19,Varian Eclipse and TrueBeam Named Category Leaders in the 2019 Best in KLAS: Software and Services Report,PR Newswire
Feb-06-19,"Luminex (LMNX) Q4 Earnings Miss, 2019 Guidance Lacks Luster",Zacks
Feb-07-19,Bright Near-Term Outlook for Medical Instruments Industry,Zacks
Feb-07-19,LabCorp's (LH) Q4 Earnings and Revenues Surpass Estimates,Zacks
Feb-07-19,"Cardinal Health (CAH) Beats on Q2 Earnings, Ups FY19 View",Zacks
Feb-13-19,Top Ranked Momentum Stocks to Buy for February 13th,Zacks
Feb-13-19,"Medidata (MDSO) Q4 Earnings Beat, Revenues Miss Estimates",Zacks
Feb-14-19,DaVita (DVA) Q4 Earnings Beat and Revenues Miss Estimates,Zacks
Feb-15-19,Quidel (QDEL) Q4 Earnings and Revenues Surpass Estimates,Zacks
Feb-19-19,Ecolab (ECL) Earnings and Revenues Match Estimates in Q4,Zacks
Feb-21-19,"Genomic Health (GHDX) Q4 Earnings Beat Estimates, Margins Up",Zacks
Feb-22-19,Varian (VAR) Up 2.2% Since Last Earnings Report: Can It Continue?,Zacks
Feb-22-19,"Allscripts (MDRX) Q4 Earnings Lag Estimates, Bookings Up Y/Y",Zacks
Feb-22-19,"Integer Holdings' (ITGR) Q4 Earnings Beat, '19 View Strong",Zacks
Feb-25-19,"DexCom's (DXCM) Q4 Earnings Beat, International Revenues Up",Zacks
Feb-25-19,Varian Announces South Florida Proton Therapy Institute Joins FlashForward Consortium,PR Newswire
Feb-26-19,Integra's (IART) Q4 Earnings and Revenues Beat Estimates,Zacks
Feb-26-19,Varian-equipped NSIA-LUTH Cancer Treatment Centre in Nigeria Commissioned,PR Newswire
Feb-27-19,"Tandem (TNDM) Posts Earnings in Q4, Revenues Top Estimates",Zacks
Feb-27-19,Insulet (PODD) Beats Earnings and Revenue Estimates in Q4,Zacks
Feb-27-19,"Fresenius Medical (FMS) Earnings Beat, Revenues Miss in Q4",Zacks
Feb-27-19,"Masimo (MASI) Q4 Earnings and Revenues Beat, Guidance Solid",Zacks
Feb-28-19,Patterson Companies (PDCO) Earnings Match Estimates in Q3,Zacks
Feb-28-19,Here's Why You Should Invest in Chemed (CHE) Stock Right Now,Zacks
Feb-28-19,Amedisys (AMED) Tops Earnings and Revenue Estimates in Q4,Zacks
Feb-28-19,Varian and Danish Center for Particle Therapy Announce Grand Opening and First Patient Treatments,PR Newswire
Mar-01-19,"Heres What Varian Medical Systems, Inc.s (NYSE:VAR) P/E Ratio Is Telling Us",Simply Wall St.
Mar-01-19,"New Research Coverage Highlights Micron Technology, Varian Medical, St. Joe, Himax Technologies, Aerie Pharmaceuticals, and Hexcel  Consolidated Revenues, Company Growth, and Expectations for 2019",GlobeNewswire
Mar-01-19,Medtronic Gets FDA Approval for Accurian RF Ablation Platform,Zacks
Mar-01-19,Bio-Rad (BIO) Earnings and Revenues Beat Estimates in Q4,Zacks
Mar-01-19,Here's Why You Should Buy Varian Medical (VAR) Stock Now,Zacks
Mar-04-19,"Medtronic's Mazor Robotics Aid Growth, Rising Costs Ail",Zacks
Mar-04-19,"Inogen (INGN) Q4 Earnings Beat Estimates, Rental Revenues Up",Zacks
Mar-04-19,"OPKO Health (OPK) Reports Loss in Q4, Misses on Revenues",Zacks
Mar-04-19,Medtronic Launches Grafton DBM Bone Grafting Product in Japan,Zacks
Mar-04-19,Here's Why You Should Snap Up Abbott (ABT) Stock Right Now,Zacks
Mar-04-19,Penumbra (PEN) Earnings and Revenues Beat Estimates in Q4,Zacks
Mar-05-19,"HMS Holdings' (HMSY) Q4 Earnings Beat, Revenues Rise Y/Y",Zacks
Mar-05-19,"Walgreens Boots Rides on Retail Pharmacy USA, Strategic Deals",Zacks
Mar-05-19,"Henry Schien Buys North American Rescue, Expands Medical Arm",Zacks
Mar-05-19,Here's Why You Must Add Hologic (HOLX) to Your Portfolio Now,Zacks
Mar-05-19,Hologic (HOLX) Receives Global Nods for Omni Hysteroscope,Zacks
Mar-05-19,"PRA Health's (PRAH) Q4 Earnings Top, Revenues Lag Estimates",Zacks
Mar-05-19,Quest Diagnostics Ties Up With RMC to Deliver Lab Services,Zacks
Mar-06-19,5 Companies Hit 52-Week Highs,GuruFocus.com
Mar-06-19,"Align Technology Teen Case Growth High, Competition Lingers",Zacks
Mar-06-19,"Cooper Companies' (COO) Q1 Earnings Beat, Revenues Rise Y/Y",Zacks
Mar-06-19,GNC Forms Joint Venture With IVC to Improve Cost Efficiency,Zacks
Mar-07-19,GNC Holdings to Expand Portfolio With Alani Nutrition Deal,Zacks
Mar-07-19,"Tandem's Global Growth a Boost, Operating Losses a Bane",Zacks
Mar-08-19,"AMN Healthcare (AMN) Q4 Earnings Top, Revenues Lag Estimates",Zacks
Mar-08-19,Resmed (RMD) to Acquire HB Healthcare to Treat Sleep Apnea,Zacks
Mar-08-19,Align Technology-Benco Dental Deal to Expand iTero Reach,Zacks
Mar-11-19,Varian Announces Second Quarter Fiscal Year 2019 Earnings Release Date and Upcoming Investor Event,PR Newswire
Mar-11-19,"GNC Holdings Global Business Strong, Domestic Sales Weak",Zacks
Mar-11-19,Tandem Diabetes Signs as an Insulin Pump Vendor in Canada,Zacks
Mar-11-19,Varian and Tata Trusts Sign Framework Agreement for Advanced Cancer Care Solutions to Address Growing Need in India,PR Newswire
Mar-12-19,"Avanos (AVNS) Q4 Earnings Beat, Revenues Miss, Shares Down",Zacks
Mar-12-19,Edwards Lifesciences Makes Investments in Heart Failure Space,Zacks
Mar-12-19,"Stock Market News For Mar 12, 2019",Zacks
Mar-12-19,Varian &amp; Tata Trust Tie Up to Boost Radiotherapy in India,Zacks
Mar-13-19,HOLX vs VAR: Which MedTech Stock is a Better Investment Pick?,Zacks
Mar-14-19,Cardiovascular Systems Gains on Global Growth &amp; Innovation,Zacks
Mar-14-19,"Nevro (NVRO) Q4 Loss Wider Than Expected, Revenues Beat",Zacks
Mar-15-19,Abbott (ABT) Gets FDA Approval for Expanded Use of MitraClip,Zacks
Mar-18-19,"Omnicell's Global Expansion on Track, Stiff Competition Ails",Zacks
Mar-18-19,"BioScrip (BIOS) Reports Loss in Q4, Both Margins Contract",Zacks
Mar-19-19,"Boston Scientific (BSX) Rides on Acquisitions, Innovation",Zacks
Mar-19-19,Boston Scientific's EP Arm Gets a Lift From Study Success,Zacks
Mar-19-19,Abbott's (ABT) MitraClip COAPT Trial Shows Favorable Results,Zacks
Mar-20-19,Abbott's (ABT) MitraClip COAPT Trial Shows Favorable Results (revised),Zacks
Mar-20-19,Stryker (SYK) Scales a New 52-Week High on Solid Prospects,Zacks
Mar-20-19,Abbott's (ABT) MitraClip COAPT Trial Shows Favorable Results (Revised),Zacks
Mar-21-19,Varian Holds First Meeting of FlashForward Consortium,PR Newswire
Mar-22-19,Varian (VAR) Scales New 52-Week High on Solid Prospects,Zacks
Mar-22-19,"HMS Holdings Gains on PI &amp; TPM Solutions, Competition Rife",Zacks
Mar-22-19,Here's Why You Should Retain Ecolab Stock in Your Portfolio,Zacks
