date,title,source
Oct-17-18,"BRIEF-Citigroup- ANZ, Banco Santander, BNP Paribas, Citi, Deutsche Bank, HSBC, Standard Chartered Announce Joint Initiative To Build Digital ""Trade Information Network"" By 2018 End",Reuters
Oct-17-18,Seven international banks agree to launch digital trade finance network,Reuters
Oct-17-18,Santander Bank Contributes Nearly $4 Million to 135 Non-Profit Organizations,PR Newswire
Oct-17-18,Volta VI Electricity Receivables Securitisation Notes -- Moody's upgrades the ratings of five Portuguese ABS transactions backed by electricity tariff deficit receivables,Moody's
Oct-17-18,NB Finance Ltd. -- Moody's takes rating actions on Portuguese banks,Moody's
Oct-18-18,Santander Consumer Bank AS -- Moody's affirms Santander Consumer Bank AS's ratings and assigns a Ba2(hyb) rating to the additional Tier 1 non-viability securities,Moody's
Oct-18-18,Santander Joins List of Banks in German Tax-Dodge Crackdown,Bloomberg
Oct-18-18,Seven international banks agree to launch digital trade finance network,Reuters
Oct-18-18,Dividend windfall: Santander latest target in Germany's giant fraud probe,Reuters
Oct-18-18,Dividend windfall: Santander latest target in Germany's giant fraud probe,Reuters
Oct-23-18,OSVBF vs. BSAC: Which Stock Is the Better Value Option?,Zacks
