date,title,source
Oct-17-18,BancorpSouth (BXS) Q3 Earnings Meet Estimates,Zacks
Oct-17-18,BancorpSouth: 3Q Earnings Snapshot,Associated Press
Oct-17-18,BancorpSouth Reports Record Quarterly Earnings,PR Newswire
Oct-18-18,Bancorpsouth Inc (BXS) Q3 2018 Earnings Conference Call Transcript,Motley Fool
Oct-18-18,"BancorpSouth (BXS) Q3 Earnings In Line, Revenues Increase",Zacks
Oct-19-18,Edited Transcript of BXS.N earnings conference call or presentation 18-Oct-18 3:00pm GMT,Thomson Reuters StreetEvents
Oct-19-18,Bank OZK (OZK) Q3 Earnings Miss on Higher Costs & Provision,Zacks
Oct-24-18,BancorpSouth Bank Declares Quarterly Dividend,PR Newswire
Oct-31-18,BancorpSouth Bank Completes Purchase of 6 Million Shares Under Stock Repurchase Program,PR Newswire
Nov-14-18,BancorpSouth to expand in Alabama with acquisition of Jackson bank,American City Business Journals
Nov-14-18,BancorpSouth (BXS) to Buy Merchants Trust and Casey Bancorp,Zacks
Nov-16-18,BancorpSouth (BXS) Up 0.6% Since Last Earnings Report: Can It Continue?,Zacks
Nov-27-18,BancorpSouth (BXS) Displays Fee Income Growth: Time to Hold?,Zacks
Jan-07-19,BancorpSouth Announces Fourth Quarter Earnings Webcast Schedule,PR Newswire
Jan-16-19,BancorpSouth (BXS) Earnings Expected to Grow: Should You Buy?,Zacks
Jan-23-19,BancorpSouth: 4Q Earnings Snapshot,Associated Press
Jan-23-19,BancorpSouth Reports Record Annual Earnings; Declares Quarterly Dividend,PR Newswire
