date,title,source
Oct-17-18,"3 ""Internet of Things"" Stocks to Buy Right Now",Zacks
Oct-19-18,"The Zacks Analyst Blog Highlights: Amazon, SMART, Vishay and Semtech",Zacks
Oct-22-18,Q3 Earnings Revive Wall Street's Fortunes: 5 Value Picks,Zacks
Oct-23-18,"Intel's (INTC) Q3 Earnings: CCG, DCG & NSG in Spotlight",Zacks
Oct-23-18,Vishay Intertechnology (VSH) Q3 Earnings Preview: What to Watch Ahead of the Release,Zacks
Oct-23-18,"The Zacks Analyst Blog Highlights: Equinor, Atkore, RH, Vishay and Eni",Zacks
Oct-24-18,"Amphenol (APH) Beats on Q3 Earnings & Revenues, Raises View",Zacks
Oct-24-18,Are Investors Undervaluing Vishay Intertechnology (VSH) Right Now?,Zacks
Oct-25-18,"MKS Instruments (MKSI) Q3 Earnings Beat, Revenues Miss",Zacks
Oct-25-18,Vishay Intertechnology (VSH) Q3 Earnings: What's in Store?,Zacks
Oct-29-18,Vishay Intertechnology Declares Quarterly Dividend,GlobeNewswire
Oct-29-18,Vishay Intertechnologys New Proximity Sensor Features Range Up to 20 cm in 3.05 mm by 2 mm Leadless Package,GlobeNewswire
