date,title,source
Oct-17-18,Atlantic Tele-Network (ATNI) Q3 Earnings Preview: What's in the Cards?,Zacks
Oct-24-18,ATN Reports Third Quarter 2018 Results,GlobeNewswire
Oct-25-18,Edited Transcript of ATNI earnings conference call or presentation 25-Oct-18 1:30pm GMT,Thomson Reuters StreetEvents
Oct-25-18,Atlantic Tele-Network (ATNI) Q3 Earnings and Revenues Surpass Estimates,Zacks
Oct-25-18,Atlantic Tele-Network: 3Q Earnings Snapshot,Associated Press
Oct-29-18,Edited Transcript of ATNI earnings conference call or presentation 25-Oct-18 1:30pm GMT,Thomson Reuters StreetEvents
Oct-30-18,Edited Transcript of ATNI earnings conference call or presentation 25-Oct-18 1:30pm GMT,Thomson Reuters StreetEvents
Oct-30-18,"Report: Exploring Fundamental Drivers Behind Sarepta Therapeutics, Reinsurance Group of America, Illinois Tool Works, ATN International, Morningstar, and Hubbell  New Horizons, Emerging Trends, and Upcoming Developments",GlobeNewswire
Nov-08-18,UPDATE - ATN Closes Sale of U.S. Solar Portfolio,GlobeNewswire
Nov-08-18,ATN Closes Sale of U.S. Solar Portfolio,GlobeNewswire
Nov-13-18,Geoverse Launches New Partner Program for Private LTE with CBRS,GlobeNewswire
Nov-14-18,Windstream Announces Implementation of SD-WAN by U.S. Firm,Zacks
Nov-26-18,T-Mobile Brings Innovative Service Offerings for Holidays,Zacks
Nov-27-18,CenturyLink to Offer Cloud Connectivity for AWS re:Invent,Zacks
Nov-27-18,United States Cellular (USM) Hits 52-Week High on Solid View,Zacks
Nov-28-18,Sprint & HTC to Bring 5G Mobile Smart Hub in First-Half 2019,Zacks
Nov-28-18,Verizon to Transform Agfa's Global Network Infrastructure,Zacks
Nov-30-18,"Is ATN International, Inc. (NASDAQ:ATNI) Worthy of Your Portfolio?",Insider Monkey
Dec-10-18,Ericsson Gets Multi-Year Deal From TIGO to Boost Network,Zacks
Dec-12-18,ATN Board Declares Quarterly Dividend,GlobeNewswire
Dec-12-18,"Estimating The Fair Value Of ATN International, Inc. (NASDAQ:ATNI)",Simply Wall St.
Dec-18-18,T-Mobile & Sprint Secure Approval From CFIUS for Merger,Zacks
Dec-19-18,"CenturyLink Partners With Palo Alto, Boosts Network Security",Zacks
Jan-09-19,Verizon Rides on Customer Loyalty and Subscriber Additions,Zacks
Jan-09-19,AT&T to Offer Enriching Ads With Xandr-Turner Collaboration,Zacks
Jan-10-19,AT&T Augments LTE Coverage to Benefit FirstNet Subscribers,Zacks
Jan-17-19,"U.S. Cellular (USM) Soars to 52-Week High, Time to Cash Out?",Zacks
Jan-17-19,"ATN International, Inc. (NASDAQ:ATNI) Might Not Be A Great Investment",Simply Wall St.
Jan-22-19,AT&amp;T Unveils Industry's First Three-Pronged 5G Strategy,Zacks
Jan-29-19,"Verizon (VZ) Beats on Q4 Earnings, Misses Revenue Estimates",Zacks
Jan-30-19,"AT&amp;T (T) Trumps Q4 Earnings Estimates, Falters on Revenues",Zacks
Jan-31-19,Sprint (S) Misses Q3 Earnings Estimate Despite Higher Revenues,Zacks
Feb-07-19,ATN Sets Date to Report Fourth Quarter and Full Year 2018 Results,GlobeNewswire
Feb-07-19,T-Mobile (TMUS) Beats Q4 Earnings Estimate on Record Revenues,Zacks
Feb-11-19,"New Research: Key Drivers of Growth for Equity Residential, Proto Labs, USANA Health Sciences, TC PipeLines, LP, American States Water, and ATN International  Factors of Influence, Major Initiatives and Sustained Production",GlobeNewswire
Feb-13-19,Analysts Estimate Atlantic Tele-Network (ATNI) to Report a Decline in Earnings: What to Look Out for,Zacks
Feb-20-19,Atlantic Tele-Network: 4Q Earnings Snapshot,Associated Press
Feb-20-19,ATN Reports Fourth Quarter and Full Year 2018 Results,GlobeNewswire
Feb-20-19,Wireless National Stock Outlook: Prospects Look Enthralling,Zacks
Feb-20-19,Geoverse Selects Ericsson Dot System for its U.S. Enterprise Private LTE Offering,GlobeNewswire
Feb-21-19,Why ATN International Stock Plunged Today,Motley Fool
Feb-21-19,"ATN International, Inc. to Host Earnings Call",ACCESSWIRE
Feb-22-19,"Are Insiders Selling ATN International, Inc. (NASDAQ:ATNI) Stock?",Simply Wall St.
Mar-05-19,Edited Transcript of ATNI earnings conference call or presentation 21-Feb-19 2:30pm GMT,Thomson Reuters StreetEvents
