date,title,source
Nov-07-18,"Medallion Financial Corp. to Report Third Quarter Results on Monday, November 12, 2018",Business Wire
Nov-07-18,What Does Medallion Financial Corps (NASDAQ:MFIN) Share Price Indicate?,Simply Wall St.
Nov-12-18,Medallion Financial: 3Q Earnings Snapshot,Associated Press
Nov-12-18,Medallion Financial Corp. Reports 2018 Third Quarter Results,Business Wire
Nov-19-18,"New Research: Key Drivers of Growth for Huttig Building Products, Stratus Properties, Manitex International, Marathon Patent Group, Medallion Financial, and Opiant Pharmaceuticals  Factors of Influence, Major Initiatives and Sustained Production",GlobeNewswire
Nov-21-18,New Strong Sell Stocks for November 21st,Zacks
Nov-30-18,New Strong Sell Stocks for November 21st (Revised),Zacks
