date,title,source
Feb-11-19,Is AT&T a Buy After Its Fourth-Quarter 2018 Report?,Motley Fool
Feb-11-19,Love Dividends? 2 Stocks You Might Want to Buy,Motley Fool
Feb-11-19,"Insider Buys Of The Week: ADM, AT&T, JPMorgan And More",Benzinga
Feb-11-19,"Podcast: 4 Telecom Operators In the 5G Race, and Two Other Numbers You Need to Know",Barrons.com
Feb-11-19,"Epix launches streaming service, Sprint sues AT&T",CNET
Feb-12-19,Streaming Alternatives Are Cannibalizing Traditional Pay TV,Motley Fool
Feb-12-19,"Democratic senators urge administration to reject Sprint, T-Mobile merger",Reuters
Feb-12-19,[$$] Presidential hopefuls hit at Sprint tie-up with T-Mobile,Financial Times
