date,title,source
Oct-17-18,What Does IntriCon Corporations (NASDAQ:IIN) Ownership Structure Look Like?,Simply Wall St.
Oct-31-18,IntriCon (IIN) to Report Q3 Earnings: What's in the Cards?,Zacks
Nov-05-18,IntriCon Reports 2018 Third-Quarter Results,Business Wire
Nov-07-18,IntriCon to Present at Stifel 2018 Healthcare Conference,Business Wire
Nov-14-18,"Report: Exploring Fundamental Drivers Behind Targa Resources, IntriCon, ENDRA Life Sciences, Coffee Holding Co., Orion Group, and Carbon Black  New Horizons, Emerging Trends, and Upcoming Developments",GlobeNewswire
Nov-16-18,Edited Transcript of IIN earnings conference call or presentation 5-Nov-18 10:00pm GMT,Thomson Reuters StreetEvents
Nov-21-18,10 Triple-A Stocks to Buy for the Rest of 2018,InvestorPlace
Dec-19-18,Is IntriCon Corporation (IIN) A Good Stock To Buy?,Insider Monkey
Dec-25-18,How Does IntriCon Corporation (NASDAQ:IIN) Affect Your Portfolio Volatility?,Simply Wall St.
Jan-15-19,"At US$26.58, Is IntriCon Corporation (NASDAQ:IIN) Worth Looking At Closely?",Simply Wall St.
Jan-16-19,IntriCon Hires Doug Pletcher as Vice President of Medical Business Development,Business Wire
Jan-17-19,Executives made millions off IntriCon's secondary offering,American City Business Journals
Feb-04-19,Is IntriCon Corporation (NASDAQ:IIN) Potentially Underrated?,Simply Wall St.
Feb-06-19,"IntriCon to Announce 2018 Fourth-Quarter and Year-End Results on Tuesday, February 19",Business Wire
