date,title,source
Oct-18-18,The Benefits of Buyback ETFs as Markets Turnaround,ETF Trends
Oct-30-18,Buyback ETFs Could Strengthen as Companies Buy Back on the Cheap,ETF Trends
Dec-17-18,Look to Buyback ETFs as Companies Continue to Reinvest,ETF Trends
Dec-28-18,3 ETFs to Benefit From 8-Year High Insider Buying,Zacks
Mar-01-19,"Despite Its Strengths, This Buyback Strategy May Disappoint",Morningstar
Mar-07-19,Buybacks on a Tear Despite Political Attack: ETFs in Focus,Zacks
Mar-08-19,ETF Trends Seen in the 10-Year Old Bull Market,Zacks
Mar-26-19,ETFs to Ride on Share Buyback Craze,Zacks
Apr-18-19,Buyback ETF (PKW) Hits New 52-Week High,Zacks
