date,title,source
Oct-19-18,7 Breakout Stocks to Buy That Are Immune to Volatility,InvestorPlace
Oct-19-18,China's Shandong Zhaojin seeks South American mining assets,Reuters
Oct-22-18,Randgold Resources Ld - Kibali Set for Another Record Quarter,ACCESSWIRE
Oct-22-18,Kibali Set for Another Record Quarter,ACCESSWIRE
Oct-22-18,The Worlds Largest Gold Miner May Not Be a Gold Mine for Investors,Barrons.com
Oct-22-18,Gold Becomes Popular With Investors Again,Investopedia
Oct-23-18,Randgold Resources Limited - ISS/Glass Lewis Recommend Yes Vote to Shareholders,ACCESSWIRE
Oct-23-18,ISS/Glass Lewis Recommend Yes Vote to Shareholders,ACCESSWIRE
Oct-23-18,Barrick Favors Taking Back Control of Acacia Mining,Bloomberg
Oct-23-18,"[$$] Barrick Randgold merger could lead to $5bn asset sales, BMO says",Financial Times
Oct-24-18,"Barrick Gold profit, revenue drop as metal prices weaken",Reuters
Oct-24-18,"Barrick Gold profit, revenue drop as metal prices weaken",Reuters
Oct-24-18,Barrick Gold posts lower 3rd-qtr profit on declining metal prices,Reuters
Oct-24-18,Will Investors Care About the Earnings Report for Barrick Gold Stock?,InvestorPlace
Oct-25-18,Barrick Gold sees potential to expand Tier 1 assets,Reuters
Oct-25-18,Randgold Resources Limited Announces CDI Targets Advance as Tongon Gets Back to Work,ACCESSWIRE
Oct-25-18,CDI Targets Advance as Tongon Gets Back to Work,ACCESSWIRE
Oct-25-18,Barrick Gold sees potential to expand Tier 1 assets - Thornton,Reuters
Oct-25-18,New Strong Sell Stocks for October 25th,Zacks
Oct-26-18,"Market Trends Toward New Normal in Ascendis Pharma A/S, Diodes, Laureate Education, Randgold Resources, Fastenal, and LTC Properties  Emerging Consolidated Expectations, Analyst Ratings",GlobeNewswire
Oct-26-18,Barrick's Bet on African Gold Maestro Faces First Test in Congo,Bloomberg
Oct-29-18,"Stocks - U.S. Futures Higher Ahead of Earnings, Data",Investing.com
Oct-29-18,Randgold Resources Limited Announces Proposed merger with Barrick Gold,ACCESSWIRE
Oct-30-18,"Barrick Gold Stock Is Making Some Progress, But Not Enough",InvestorPlace
Oct-30-18,Randgold Resources Limited - Flagship Loulo-Gounkoto Steps Up Production,ACCESSWIRE
Oct-30-18,Randgold Resources' Mali gold mining complex ramps up production,Reuters
Oct-31-18,"Barrick, Randgold sweeten dividend ahead of takeover deal vote",Reuters
Oct-31-18,Barrick Gold woos Randgold shareholders with higher dividend,Reuters
Oct-31-18,Bear of the Day: Randgold (GOLD),Zacks
Oct-31-18,Randgold Resources Limited Announces Update: Dividends & adjourned shareholder meetings,ACCESSWIRE
Oct-31-18,[$$] Randgold ups dividend ahead of merger with Canadas Barrick,Financial Times
Nov-01-18,Barrick's Randgold Acquisition May Spur More Gold M&A,Bloomberg
Nov-01-18,Merger clearance from SA Competition Tribunal,ACCESSWIRE
Nov-05-18,Barrick chairman says miner eyes nimble future after Randgold deal,Reuters
Nov-05-18,UPDATE 2-Barrick chairman says miner eyes nimble future after Randgold deal,Reuters
Nov-05-18,Barrick shareholders approve Randgold deal,Reuters
Nov-05-18,Randgold Resources Limited Announces Court Meeting and EGM Adjourned,ACCESSWIRE
Nov-05-18,CANADA STOCKS-Futures up ahead of U.S. midterm elections,Reuters
Nov-05-18,Barrick in talks with Newmont to combine Nevada gold operations -sources,Reuters
Nov-05-18,Randgold Court Meeting and EGM Adjourned,ACCESSWIRE
Nov-06-18,Barrick Gold Shareholders Approve Randgold Resources Merger,GuruFocus.com
Nov-06-18,Why This Gold Stock Soared 13% Higher in October,Motley Fool
Nov-06-18,Randgold ready to mediate in Acacia's Tanzania row before Barrick tie-up,Reuters
Nov-06-18,[$$] Barrick to sell unwanted mines to mid-tier gold companies after merger,Financial Times
Nov-06-18,Randgold CEO Says New Barrick to Focus on Cash-Generating Assets,Bloomberg
Nov-06-18,[$$] Randgold profits jump 20% as shareholders set to vote on Barrick deal,Financial Times
Nov-06-18,Randgold Resources says Q3 profit jumps helped by lower costs,Reuters
Nov-06-18,Randgold Resources Limited Announces 3rd Quarter Results and Updates,ACCESSWIRE
Nov-07-18,Edited Transcript of RRS.L earnings conference call or presentation 6-Nov-18 12:00pm GMT,Thomson Reuters StreetEvents
Nov-07-18,Clarification Statement,ACCESSWIRE
Nov-07-18,Randgold Resources shareholders greenlight takeover by Barrick,Reuters
Nov-07-18,Randgold Resources shareholders greenlight takeover by Barrick,Reuters
Nov-07-18,Randgold Shareholders Approve Merger with Barrick,ACCESSWIRE
Nov-07-18,Randgold Resources Limited Announces Shareholders Approve Merger with Barrick,ACCESSWIRE
Nov-07-18,Randgold: 3Q Earnings Snapshot,Associated Press
Nov-08-18,John Hussman Continues to Buy Gold Mining Companies,GuruFocus.com
Nov-08-18,India's Booming Economy Expected to Firm Up Gold Demand,Harvest Exchange
Nov-09-18,Is The Rally Over For Gold?,Benzinga
Nov-13-18,Randgold Resources Limited Announces Scheme Dividend Indicative Timetable,ACCESSWIRE
Nov-13-18,Randgold Resources Ld - Scheme Dividend Indicative Timetable,ACCESSWIRE
Nov-14-18,Edited Transcript of RRS.L earnings conference call or presentation 6-Nov-18 12:00pm GMT,Thomson Reuters StreetEvents
Nov-15-18,Edited Transcript of RRS.L earnings conference call or presentation 6-Nov-18 12:00pm GMT,Thomson Reuters StreetEvents
Nov-15-18,Randgold Resources Limited Announces Investor Days Webcast Available 16 November 2018,ACCESSWIRE
Nov-15-18,Randgold Announces Investor Days Webcast Available 16 November 2018,ACCESSWIRE
Nov-16-18,"Barrick Gold eyes assets, exploration as it plots new phase",Reuters
Nov-16-18,"Barrick Gold eyes assets, exploration as it plots new phase",Reuters
Nov-16-18,"Barrick Gold eyes assets, exploration as it plots new phase",Reuters
Nov-16-18,"Barrick keen on Guyana Shield, Canada for exploration -executive",Reuters
Nov-23-18,New Barrick CEO eyes miners' alliance to fix Tanzania tax row,Reuters
Nov-26-18,[$$] Gold company Resolute Mining to seek UK listing,Financial Times
Nov-26-18,New Barrick CEO eyes miners' alliance to fix Tanzania tax row,Reuters
Nov-27-18,Cramer's lightning round: Citigroup and JP Morgan are my only bank stock picks,CNBC
Nov-27-18,"La Mancha plans to expand its African footprint, buy Barrick gold mines",Reuters
Nov-27-18,"La Mancha plans to expand its African footprint, buy Barrick gold mines",Reuters
Nov-30-18,Randgold Resources Limited Announces Rule 2.9 Announcement,ACCESSWIRE
Nov-30-18,Randgold Resources Limited - Rule 2.9 Announcement,ACCESSWIRE
Dec-04-18,Sterling rally hurts FTSE as Brexit and growth anxieties dominate,Reuters
Dec-06-18,"Barrick Gold to sell assets, reduce head-office management - WSJ",Reuters
Dec-06-18,"Barrick Gold to sell assets, reduce head-office management - WSJ",Reuters
Dec-06-18,"Recent Analysis Shows American Express, Ryanair, Chubb, CNA Financial, Danaher, and Randgold Resources Market Influences  Renewed Outlook, Key Drivers of Growth",GlobeNewswire
Dec-12-18,Barrick Moves Closer to Resolving Acacia Dispute,Bloomberg
Dec-12-18,"Barrick, Tanzania make progress in tax row, no deal yet -source",Reuters
Dec-17-18,Randgold Resources Limited Announces Interim Dividend and Issuance of Shares,ACCESSWIRE
Dec-17-18,Randgold Resources Limited Announces Scheme of Arrangement,ACCESSWIRE
Dec-17-18,Randgold Resources Limited - Scheme of Arrangement,ACCESSWIRE
Dec-17-18,Court Approves Randgold-Barrick Merger,ACCESSWIRE
Dec-18-18,"A Goldman Alum, a Big-Game Hunter, and $100 Billion Business",Bloomberg
Dec-18-18,Randgold Resources Ld - Notification of major interest in shares,ACCESSWIRE
Dec-18-18,Randgold Resources Limited Announces Notification of major interest in shares,ACCESSWIRE
Dec-20-18,"Cramer feels 'powerless' after Fed hike, tells investors ...",CNBC Videos
Dec-20-18,Cramer tells investors to buy gold after Fed hike,CNBC Videos
Dec-20-18,Randgold Resources Limited Announces Vesting of Directors Awards,ACCESSWIRE
Dec-20-18,Randgold Resources Ld - Holding(s) in Company,ACCESSWIRE
Dec-20-18,Randgold Resources Ld announces Holding(s) in Company,ACCESSWIRE
Dec-21-18,"Barrick Gold cuts jobs, director Munk to step down - Globe and Mail",Reuters
Dec-21-18,Does Randgold Resources Have More Room to Rally?,TheStreet.com
Dec-21-18,BMO Digs Deeper in Mining During a Transition Year for Bank,Bloomberg
Dec-24-18,2018 Leaders and Laggards in the Gold Stock Industry,GuruFocus.com
Dec-31-18,Randgold Resources Limited Announces Rule 2.9 Announcement,ACCESSWIRE
Jan-02-19,[$$] New Barrick Gold Chief Looks to End Tanzania Dispute,The Wall Street Journal
Jan-02-19,[$$] New Barrick Gold Chief Looks to End Tanzania Dispute,The Wall Street Journal
Jan-02-19,I don't plan to leave before I see the benefits of the me...,CNBC Videos
Jan-02-19,Barrick-Randgold Merger Consummated as Trading Starts in New Companys Shares,GlobeNewswire
Jan-02-19,Randgold Resources Limited Announces Delisting of Randgold ordinary shares,ACCESSWIRE
Jan-02-19,Randgold Resources Limited Announces Delisting of Randgold ordinary shares,ACCESSWIRE
Jan-03-19,The New Barrick Begins Trading Wednesday,GuruFocus.com
Jan-08-19,PRESS DIGEST - Canada - Jan 8,Reuters
Jan-10-19,"Barrick to Announce Q4 2018 Results on February 13, Preliminary Q4 Production Results on January 21",GlobeNewswire
Jan-11-19,"Cramer says if you're worried about stocks, invest in gol...",CNBC Videos
Jan-14-19,Monster Gold-Mining Deals Pile Pressure on Those Left Behind,Bloomberg
Jan-14-19,Gold miner sector slips as Newmont's selloff outweighs Goldcorp's rally,MarketWatch
Jan-14-19,"Cramer Talks Gold, Newmont-Goldcorp Deal",Benzinga
Jan-14-19,Here's Why Goldcorp Rose as Much as 12.5% Today,Motley Fool
Jan-14-19,Personality Clashes Could Be a Real Hurdle for GOLD Stock,InvestorPlace
Jan-14-19,Jim Cramer: Barrick-Randgold deal was better than Newmont...,CNBC Videos
Jan-15-19,Monster Gold-Mining Deals Pile Pressure on Those Left Behind,Bloomberg
Jan-16-19,Newmont-Goldcorp Deal Puts Gold Mining ETFs in Focus,Zacks
Jan-18-19,Why Gold Mining Stocks Are an Unalloyed Bargain,Barrons.com
Jan-22-19,Loulo-Gounkoto Complex Continues to Invest in Its Future and Points to Ongoing Improvement in Production,GlobeNewswire
Jan-22-19,Barrick (GOLD) Releases Preliminary Q4 Production Results,Zacks
Jan-22-19,PRESS DIGEST- Canada- Jan 22,Reuters
Jan-24-19,Tongon Achieves Revised Guidance After Overcoming Major Challenges,GlobeNewswire
Jan-25-19,NovaGold Resources (NG) Q4 2018 Earnings Conference Call Transcript,Motley Fool
Jan-25-19,Barrick CEO on Zambia Tax Dispute: Threats Don't Solve Problems,Bloomberg
Jan-28-19,"Kibali Breaks Records Across Board, All Key Production Parameters Above Plan",GlobeNewswire
Jan-31-19,Gold Prices Just Got a Boost From the Fed,Barrons.com
Feb-01-19,Gold Stocks to Buy as They Outperform Gold Futures,TheStreet.com
Feb-04-19,"Ma'aden Eyes Fertilizer, Copper Investment: Africa Mining Update",Bloomberg
Feb-04-19,Barrick Announces Strategic Alliance and Additional Investment in Reunion Gold Corporation,GlobeNewswire
Feb-04-19,"Reunion Gold announces a strategic alliance with Barrick Gold Corporation to explore, develop and mine mineral properties in the Guiana Shield; concurrently, Barrick agrees to increase its interest in Reunion to 19.9%",GlobeNewswire
Feb-04-19,[$$] Barrick chief declines to set deadline to settle Tanzania row,Financial Times
Feb-04-19,"After Years in the Doldrums, Gold Miners are Finally Hot Again",Bloomberg
Feb-05-19,"`Let's Talk,' Ramaphosa Tells Producers: Africa Mining Update",Bloomberg
Feb-05-19,Gold deal rush sweeps by broader mining sector,Reuters
Feb-05-19,Gold deal rush sweeps by broader mining sector,Reuters
Feb-06-19,5 Gold Stocks That Should Glitter in 2019,InvestorPlace
Feb-06-19,Analysts Estimate Barrick Gold (GOLD) to Report a Decline in Earnings: What to Look Out for,Zacks
Feb-06-19,4 Mining Stocks Poised to Outshine Q4 Earnings Estimates,Zacks
Feb-08-19,Cramer's game plan: Next week's action hinges on US-China trade,CNBC
Feb-11-19,Will Higher Costs Hurt Barrick (GOLD) This Earnings Season?,Zacks
Feb-11-19,"Tanzania row overshadows Acacia's upbeat output, cost figures",Reuters
Feb-11-19,[$$] Acacia returns to profit despite Tanzanian tax dispute,Financial Times
Feb-12-19,"Dont Bet on a Higher Bid for Goldcorp, Analyst Says",Barrons.com
Feb-12-19,Golds Surge Has Been Disguised by the Strong Dollar,Barrons.com
Feb-13-19,Barrick Gold Corp (ABX) Q4 2018 Earnings Conference Call Transcript,Motley Fool
Feb-13-19,[$$] New Barrick Gold CEO Discusses Possibilities for Miner,The Wall Street Journal
Feb-13-19,Barrick CEO Says Cuts to Take Miner Beyond Thorntons Path,Bloomberg
Feb-13-19,Barrick Gold (GOLD) Matches Q4 Earnings Estimates,Zacks
Feb-13-19,Barrick exceeds adjusted profit estimates; cost cuts offset lower output,Reuters
Feb-13-19,[$$] Barrick's Loss Widens on Impairments,The Wall Street Journal
Feb-13-19,New Barrick Gold Sees Costs Higher This Year Than Before Merger,Bloomberg
Feb-13-19,Barrick Gold's stock edges up after earnings match expectations but revenue falls shy,MarketWatch
Feb-13-19,"Barrick's quarterly loss widens on impairment charge, rising costs",Reuters
Feb-13-19,Restructured Barrick Picks Up Speed as New Executive Teams Get Down to Business,GlobeNewswire
Feb-13-19,Randgold Bows Out on a High Note Before Its Merger with Barrick,GlobeNewswire
Feb-13-19,Barrick Reports 2018 Full Year and Fourth Quarter Results,GlobeNewswire
Feb-14-19,Gold rises as weak U.S. economic data drags dollar lower,Reuters
Feb-14-19,Barrick Gold Corp Falls on 4th Quarter Results,GuruFocus.com
Feb-14-19,"Barrick (GOLD) Q4 Earnings in Line, Revenues Miss Estimates",Zacks
Feb-15-19,Gold Prices Have Been Rising. Gold Miners Have Been Rising Even More.,Barrons.com
Feb-20-19,Barrick Confirms Commitment to Chile as It Reviews Its Latin American Strategy,GlobeNewswire
Feb-20-19,Barricks Cost of Doing Business Could Shoot Up With Acacia Deal,Bloomberg
Feb-20-19,Barrick and Tanzanian Government Progress Discussions in Settlement of Acacia Disputes,GlobeNewswire
Feb-21-19,3 Gold Stocks Percolating Right Now,InvestorPlace
Feb-21-19,Why The Top Stock In The No. 1 Industry Group Is Surging Today,Investor's Business Daily
Feb-22-19,[$$] Barrick Gold Is Considering Possible Deal With Newmont,The Wall Street Journal
Feb-25-19,'Loser' vs 'Anemic': Barrick's Newmont bid starts on toxic note,Reuters
Feb-25-19,[$$] Mining Giant Barrick Gold Makes Unsolicited Bid for Rival Newmont,The Wall Street Journal
Feb-25-19,[$$] Mining Giant Barrick Makes Unsolicited Bid for Rival Newmont,The Wall Street Journal
Feb-25-19,Ex-Goldman Banker May Finish Massive Gold Deal Five Years Later,Bloomberg
Feb-25-19,US stocks close higher after Trump postpones tariff increase,Associated Press
Feb-25-19,Evolution Eyes Australian Spoils From Any Barrick-Newmont Deal,Bloomberg
Feb-25-19,Spark and GE rise while Barrick Gold slides,Associated Press
Feb-25-19,Dow Closes Modestly Higher After Trump Extends China Tariff Deadline,TheStreet.com
Feb-25-19,Barrick CEO defends $18 billion hostile Newmont bid as logical tie-up,Reuters
Feb-25-19,Newcrest CEO says 'happy to do M&A' if right value for shareholders,Reuters
Feb-25-19,Barrick CEO defends $18 billion hostile Newmont bid as logical tie-up,Reuters
Feb-25-19,Newmont Mining CEO blasts Barrick's $19B takeover bid as gold miners' rivalry heats up,American City Business Journals
Feb-25-19,Barrick Gold Makes Hostile $17.8 Billion Bid for Newmont Mining,Bloomberg
Feb-25-19,Barrick makes $18 bln hostile bid for Newmont,Reuters Videos
Feb-25-19,Barrick CEO: Newmont deal 'logical' for shareholders of both companies,Reuters
Feb-25-19,Barrick CEO Says He'll Run Newmont's Mines Better Than They Can,Bloomberg
Feb-25-19,"Stock Market News: Barrick Gold Gets Hostile, GE Soars",Motley Fool
Feb-25-19,Barrick Gold Makes Formal $18 Billion All-Share Bid for Rival Newmont Mining,TheStreet.com
Feb-25-19,US stocks rise broadly after Trump postpones tariff increase,Associated Press
Feb-25-19,Barrick makes $18 billion hostile bid for Newmont in gold mega-merger,Reuters
Feb-25-19,Barrick Swings Hard for Newmont - Maybe Too Hard,Bloomberg
Feb-25-19,Newmont Mining Stock Slips on Barrick Golds Below-Market Buyout Offer,Barrons.com
Feb-25-19,Barrick Confirms Media Reports Of Interest In Newmont Mining,Benzinga
Feb-25-19,Barrick goes after Newmont to create $42 billion gold giant,Associated Press
Feb-25-19,Newmont's stock gains after Barrick Gold makes hostile buyout bid,MarketWatch
Feb-25-19,[$$] Barrick Gold launches $18bn hostile offer to buy US rival,Financial Times
Feb-25-19,Conference Call: Barrick Proposal for Newmont,GlobeNewswire
Feb-25-19,Barrick Gold launches bid to acquire Newmont in blockbuster all-stock mining deal,CNBC
Feb-25-19,Barrick Proposes Merger With Newmont as an Unprecedented Value Creation Opportunity for Shareholders,GlobeNewswire
Feb-26-19,Gold's Next Fight: Barrick-Newmont's $4.5 Billion Castoffs,Bloomberg
Feb-26-19,Gold Mining ETFs Heat Up on M&amp;A Buzz,Zacks
Feb-26-19,Ex-Goldman Banker May Finish Huge Gold Deal Five Years Later,Bloomberg
Feb-27-19,Why Barrick Gold Is Trying to Buy Newmont Mining Again,Barrons.com
Feb-27-19,Bet On Gold Stocks as the M&A Love Triangle Gets Interesting,InvestorPlace
Feb-27-19,"Factors of Influence in 2019, Key Indicators and Opportunity within Wayfair, Valero Energy, Barrick Gold, U.S. Silica, NanoString Technologies, and Pzena Investment Management  New Research Emphasizes Economic Growth",GlobeNewswire
Feb-27-19,Barrick's Bid for Newmont Faces Challenges,Morningstar
Mar-01-19,Cultural clash overshadowing Barrick's Newmont bid,Reuters
Mar-04-19,PRESS DIGEST- Financial Times - March 5,Reuters
Mar-04-19,Barrick CEO Vows to Press On With Bid for Newmont After Rebuff,Bloomberg
Mar-04-19,[$$] Nevadas Gold Is at Center of Barrick vs. Newmont Fight,The Wall Street Journal
Mar-04-19,Barrick says open to Nevada joint venture talks with Newmont,Reuters
Mar-04-19,Barrick CEO says will discuss Nevada joint venture with Newmont,Reuters
Mar-04-19,[$$] Newmont Rejects Barrick Gold's Takeover Bid,The Wall Street Journal
Mar-04-19,Barrick Statement from Mark Bristow,GlobeNewswire
Mar-04-19,"Thanks, But No Thanks: Newmont Rejects Barrick's Acquisition Offer",Benzinga
Mar-04-19,"Newmont Shoots Down Barrick Bid, to Proceed With Goldcorp Deal",TheStreet.com
Mar-04-19,"[$$] Nevada Is the Jackpot of a Barrick, Newmont Merger",The Wall Street Journal
Mar-04-19,Newmont Slide Show Heats Up War of Words on Barrick Takeover,Bloomberg
Mar-04-19,Newmont rejects Barrick Gold's 'negative premium' buyout bid,MarketWatch
Mar-05-19,Top Barrick shareholder urges joint venture in Nevada with Newmont,Reuters
Mar-05-19,Top Barrick shareholder urges joint venture in Nevada with Newmont,Reuters
Mar-05-19,[$$] Barrick's Biggest Shareholder Opposes Acquisition of Newmont,The Wall Street Journal
Mar-05-19,Barrick's top shareholder pushes for Nevada deal with Newmont,Reuters
Mar-05-19,"Target, Kohl's Surprise on FY Guidance; Plus GOLD, NEM",Zacks
Mar-05-19,Newmont CEO Eager to Meet with Barrick But Not About Merger,Bloomberg
Mar-05-19,Takeovers &amp; Earnings To Watch Out For,Zacks
Mar-05-19,"Target, Kohl's Surprise on FY Guidance; Plus GOLD, NEM",Zacks
Mar-05-19,Newmont Mining CEO Gary Goldberg on Barrick's hostile bid,CNBC Videos
Mar-05-19,Newmont Mining CEO responds to Barrick's hostile takeover,CNBC Videos
Mar-05-19,What Humphrey Bogart Can Teach the Gold Diggers,Bloomberg
Mar-05-19,[$$] Barricks biggest shareholder calls for JV with Newmont,Financial Times
Mar-06-19,"Barrick and Newmont Talk, But Details Yet to Emerge on Progress",Bloomberg
Mar-06-19,[$$] Newmont Mining says initial talks with Barrick constructive,Financial Times
Mar-06-19,[$$] Barrick chief faces test of credentials and time,Financial Times
Mar-07-19,The 6 Stocks To Watch: Cramer's 'Mad Money' Recap (Thursday 3/7/19),TheStreet.com
Mar-07-19,Megamerger Push Has Gold Miners Eyeing New Dance Partners,Bloomberg
Mar-07-19,Barrick Gold CEO: Newmont merger would deliver 'real value' in Nevada,CNBC
Mar-07-19,Barrick Gold CEO: Newmont merger would deliver 'real value' in Nevada,CNBC Videos
Mar-07-19,Barrick CEO calls Nevada JV talks with Newmont 'constructive' -CNBC,Reuters
Mar-07-19,"Gold Miners Are Talking Deals. Expect a Resolution Soon, Analyst Says.",Barrons.com
Mar-08-19,Barrick Gold Could Really Rally If It Can Break Above $14.13,TheStreet.com
Mar-08-19,Megamerger Push Has Gold Miners Eyeing New Dance Partners,Bloomberg
Mar-08-19,[$$] Acacia says spill at North Mara mine stopped,Financial Times
Mar-08-19,[$$] Newmont Gold in the firing line of Barricks Bristow,Financial Times
Mar-11-19,[$$] Barrick Drops Newmont Bid; Both Agree to Joint Venture,The Wall Street Journal
Mar-11-19,Barrick Ends Hostile Bid But Walks Away With Long-Sought Prize,Bloomberg
Mar-11-19,The Gold Rush Is Over: Barrick Gold Drops Newmont Mining Hostile Bid; Gold Miners Form Joint Venture,Investor's Business Daily
Mar-11-19,Barrick Golds Joint Venture With Newmont Mining Looks Like a Winner,Barrons.com
Mar-11-19,[$$] Barrick Drops Newmont Bid; Both Agree to Joint Venture,The Wall Street Journal
Mar-11-19,"Newmont, Barrick strike deal for massive gold venture, end hostile takeover drama",American City Business Journals
Mar-11-19,"Barrick Gold ends hostile Newmont bid, signs Nevada joint venture",Reuters
Mar-11-19,"Newmont Fends Off Barrick's Hostile Bid, But Only for Two Years",Bloomberg
Mar-11-19,Gold Miners Dont Quite Put a Ring on It,Bloomberg
Mar-11-19,Newmont Mining and Barrick Gold Agree to a Different Kind of Deal,Barrons.com
Mar-11-19,Barrick Gold Drops $18 Hostile Bid for Newmont; Pair Will Focus on Nevada JV,TheStreet.com
Mar-11-19,Barrick Gold drops takeover bid for Newmont Mining,Associated Press
Mar-11-19,"Barrick ends hostile bid for Newmont, signs Nevada joint venture",Reuters
Mar-11-19,[$$] Barrick Gold drops $18bn hostile bid for Newmont,Financial Times
Mar-11-19,Barrick withdraws bid for Newmont as companies agree to form Nevada joint venture instead,MarketWatch
Mar-11-19,Goldcorp Announces Support for Barrick and Newmont Nevada Joint Venture,CNW Group
Mar-11-19,Barrick and Newmont Forge Nevada Joint Venture Agreement,GlobeNewswire
Mar-12-19,Newmont Minings CEO on the Barrick Gold Deal and His Bid to Take Over Goldcorp,Barrons.com
Mar-12-19,Big Gold Gets Bigger With Barrick,Motley Fool
Mar-12-19,"Newmont &amp; Barrick Form JV in Nevada, Creates Long-Term Value",Zacks
Mar-12-19,[$$] New Yorks Four Seasons plays home to a gold mining deal,Financial Times
Mar-14-19,Nevada Joint Venture Creates the Worlds Largest Gold Mining Operation,GlobeNewswire
Mar-14-19,[$$] Barrick CEO's Nevada Venture Could Be His Biggest Challenge,The Wall Street Journal
Mar-18-19,Chile Supreme Court annuls lower court order to close Barrick's Pasqua Lama project,Reuters
Mar-18-19,Chilean Supreme Court Overturns Environmental Court Ruling in Pascua-Lama Closure Review Process,GlobeNewswire
Mar-20-19,Gold Stocks to Watch,ACCESSWIRE
Mar-21-19,Update on Operations at Golden Sunlight,GlobeNewswire
Mar-22-19,Barricks 2018 Annual Information Form and Other Documents Now Available,GlobeNewswire
Mar-22-19,VanEck Shares Paulson's Concerns on Newmont-Goldcorp Merger,Bloomberg
Mar-22-19,Top shareholders express concerns over parts of Newmont-Goldcorp deal,Reuters
Mar-25-19,"Newmont's Goldcorp Deal Wins Support of Paulson, VanEck, ISS",Bloomberg
Mar-25-19,Newmont's special dividend wins top investors over to Goldcorp deal,Reuters
Mar-25-19,Newmont offers special dividend to investors to back Goldcorp deal,Reuters
Mar-25-19,"Hoping to assuage investors, Newmont offers special dividend if Goldcorp deal approved",Reuters
Mar-25-19,Goldcorp Announces Support for Newmont Special Dividend,CNW Group
Mar-26-19,3 Gold Stocks That Should Glitter With Rising Gold Prices,InvestorPlace
Apr-03-19,DRC and Barrick Renew Mutual Commitment to Developing Countrys Great Potential,GlobeNewswire
Apr-03-19,Investors Have Little Reason to Stick With Goldcorp Stock,InvestorPlace
Apr-04-19,Goldcorp shareholders approve Newmont's $10 billion takeover offer,Reuters
Apr-04-19,Goldcorp Shareholders Approve Newmonts $10 Billion Takeover Bid,Bloomberg
Apr-04-19,Why Barrick Gold Stock Rose 11% in March,Motley Fool
Apr-05-19,Barrick Information Circular Highlights Post-Merger Progress,GlobeNewswire
Apr-05-19,NovaGold Resources (NG) Q1 2019 Earnings Conference Call Transcript,Motley Fool
Apr-09-19,Top Gold Stocks of April 2019,Investopedia
Apr-09-19,This Gold Stock Could Be Acquired,ACCESSWIRE
Apr-10-19,Newmont Bondholder Revolt May Put Barrick on Hook for Debt,Bloomberg
Apr-10-19,"Gold Prices Are Going Higher, so Buy Barrick Stock, Says Analyst",Barrons.com
Apr-11-19,"Newmont shareholders OK $10 billion Goldcorp takeover, creating biggest gold producer",Reuters
Apr-15-19,"First Quarter 2019 Results Release on May 8, Preliminary First Quarter Production Results on April 18",GlobeNewswire
Apr-15-19,Barrick Gold (GOLD) Expected to Beat Earnings Estimates: Should You Buy?,Zacks
Apr-16-19,Kibali Makes Strong Start to 2019,GlobeNewswire
Apr-16-19,Miners slide as gold price hits lowest level of the year,Financial Times
Apr-18-19,Barrick Reports Preliminary First Quarter Production Results,GlobeNewswire
Apr-22-19,Nevada Joint Venture Deal Clears All Regulatory Conditions,GlobeNewswire
Apr-24-19,"Jim Cramer Gives His Opinion On Barrick Gold, Canopy Growth, EA, Johnson & Johnson And More",Benzinga
Apr-25-19,Acacia Mining Releases 1st-Quarter Results,GuruFocus.com
