date,title,source
Nov-05-18,Is It Time to Invest in Cuba?,Investopedia
Nov-27-18,"The Herzfeld Caribbean Basin Fund, Inc. Declares $0.305 Per Share Year-End Distribution Payable in Cash",GlobeNewswire
Apr-03-19,"Cuba's Economy Is Doing Better, But Still Has A Long Way To Go",Benzinga
May-31-19,"Thomas J. Herzfeld Advisors, Inc. and The Herzfeld Caribbean Basin Fund, Inc. (NASDAQ: CUBA) Announce Measures to Address the Funds Trading Discount",GlobeNewswire
Jun-11-19,Closed-End Funds at a Discount,MoneyShow
