date,title,source
Oct-17-18,Century Communities announces Oct. 20 grand opening for Vistas at Eastgate in Layton,PR Newswire
Oct-17-18,National homebuilders new Houston-area community targets first-time buyers,American City Business Journals
Oct-24-18,Statement re grant of options,GlobeNewswire
Oct-30-18,Century Communities announces pre-grand opening sales for new homes in Davenport Station,PR Newswire
Oct-30-18,Should You Investigate Century Communities Inc (NYSE:CCS) At US$20.64?,Simply Wall St.
Oct-30-18,Analysts Estimate Century Communities (CCS) to Report a Decline in Earnings: What to Look Out for,Zacks
