date,title,source
Oct-18-18,Is Steelcase (SCS) Stock Outpacing Its Business Services Peers This Year?,Zacks
Oct-18-18,"Market Trends Toward New Normal in Etsy, RCI Hospitality, SecureWorks, C&J Energy Services, Steelcase, and MoneyGram International  Emerging Consolidated Expectations, Analyst Ratings",GlobeNewswire
Oct-25-18,Dont Chase Yield and Dont Chase Ford Stock,InvestorPlace
Oct-30-18,Is Steelcase (SCS) Stock Undervalued Right Now?,Zacks
Nov-01-18,Steelcase Sees Hammer Chart Pattern: Time to Buy?,Zacks
