date,title,source
Oct-24-18,"Pioneer to Host Third Quarter 2018 Financial Results Conference Call on Thursday, November 8, 2018 at 4:30 p.m. ET",PR Newswire
Nov-06-18,What Type Of Shareholder Owns Pioneer Power Solutions Incs (NASDAQ:PPSI)?,Simply Wall St.
Nov-08-18,Pioneer Reports Third Quarter 2018 Financial Results,PR Newswire
Nov-09-18,Edited Transcript of PPSI earnings conference call or presentation 8-Nov-18 9:30pm GMT,Thomson Reuters StreetEvents
Nov-13-18,"Report: Exploring Fundamental Drivers Behind FirstService, WNS (Holdings), Pioneer Power Solutions, Visteon, Pixelworks, and Nevada Gold & Casinos  New Horizons, Emerging Trends, and Upcoming Developments",GlobeNewswire
Dec-11-18,Edited Transcript of PPSI earnings conference call or presentation 8-Nov-18 9:30pm GMT,Thomson Reuters StreetEvents
Dec-21-18,"How Does Investing In Pioneer Power Solutions, Inc. (NASDAQ:PPSI) Impact The Volatility Of Your Portfolio?",Simply Wall St.
Jan-10-19,Edited Transcript of PPSI earnings conference call or presentation 8-Nov-18 9:30pm GMT,Thomson Reuters StreetEvents
Jan-11-19,Pioneer Receives $2.6 Million Order from Data Center Customer,PR Newswire
Jan-28-19,"CleanSpark Completes Acquisition of Pioneer Critical Power, Inc.",PR Newswire
Jan-28-19,"Pioneer Completes Sale of Pioneer Critical Power, Inc to Cleanspark Inc.",PR Newswire
Feb-01-19,"Rexnord (RXN) Beats Q3 Earnings Estimates, Raises FY19 View",Zacks
Feb-06-19,"Is Pioneer Power Solutions, Inc.s (NASDAQ:PPSI) CEO Pay Fair?",Simply Wall St.
Feb-06-19,US Manufacturing Remains Strong in January: 5 Top Picks,Zacks
Feb-07-19,"The Zacks Analyst Blog Highlights: Pioneer Power, Titan, Colfax, Dover and EnerSys",Zacks
Feb-11-19,Emerson to Gain From Solid Demand in Key Markets Amid Risks,Zacks
Feb-13-19,Emerson &amp; HID Global to Offer Healthcare Monitoring Solution,Zacks
Feb-13-19,Bear of the Day: AZZ (AZZ),Zacks
Feb-22-19,Will A. O. Smith be Able to Sustain Momentum Amid Headwinds?,Zacks
