date,title,source
Oct-22-18,MarketPulse: Healthcare Slips as Bristol-Myers Squibb Sinks,Investing.com
Oct-22-18,"Haeggquist & Eck, LLP Investigates AmerisourceBergen Corporations Directors and Officers for Breach of Fiduciary Duty Regarding Double-Billing, Kickbacks, and Criminal Fines and Forfeitures",Business Wire
Oct-24-18,AmerisourceBergen Applauds Signing of Bipartisan Legislation to Combat Opioid Abuse,Business Wire
Oct-25-18,Scott+Scott Attorneys at Law LLP Investigating Derivative Claims on Behalf of Shareholders of AmerisourceBergen Corporation  ABC,Business Wire
Oct-25-18,"Market Trends Toward New Normal in Alleghany, Veeva, State Street, Starbucks, AmerisourceBergen, and NxStage Medical  Emerging Consolidated Expectations, Analyst Ratings",GlobeNewswire
Oct-26-18,CURRENT SHAREHOLDERS: Zamansky LLC Investigates AmerisourceBergen (ABC) for Potential Breaches of Fiduciary Duties,Business Wire
Oct-29-18,Can AmerisourceBergen (ABC) Keep the Earnings Surprise Streak Alive?,Zacks
Oct-30-18,"INVESTOR ALERT: Levi & Korsinsky, LLP Reminds Investors of Commencement of an Investigation Involving Possible Securities Fraud Violations by the Board of Directors of AmerisourceBergen Corporation -- ABC",GlobeNewswire
Oct-30-18,What You Need To Know About AmerisourceBergen Corporations (NYSE:ABC) Cash Situation,Simply Wall St.
Oct-30-18,"Bragar Eagel & Squire, P.C. is Investigating Certain Officers and Directors of AmerisourceBergen Corporation (ABC) and Encourages ABC Investors to Contact the Firm",GlobeNewswire
Nov-02-18,What's in Store for AmerisourceBergen (ABC) in Q4 Earnings?,Zacks
Nov-06-18,"Why AmerisourceBergen, GreenSky, and Frontdoor Slumped Today",Motley Fool
Nov-06-18,AmerisourceBergen Corp (ABC) Q4 2018 Earnings Conference Call Transcript,Motley Fool
Nov-06-18,"AmerisourceBergen's stock tumbles after PharMEDium woes, downbeat outlook outweighs earnings beat",MarketWatch
Nov-06-18,"AmerisourceBergen (ABC) Beats on Q4 Earnings, Issues '19 View",Zacks
Nov-06-18,Why AmerisourceBergen Corporations (NYSE:ABC) CEO Salary Matters To You,Simply Wall St.
Nov-06-18,AmerisourceBergen (ABC) Tops Q4 Earnings Estimates,Zacks
Nov-06-18,"Stocks making the biggest move premarket: CVS, Eli Lilly, Marriott, Mylan & more",CNBC
Nov-06-18,AmerisourceBergen: Fiscal 4Q Earnings Snapshot,Associated Press
Nov-06-18,AmerisourceBergen Reports Fiscal 2018 Fourth Quarter and Year End Results,Business Wire
Nov-07-18,"Company News For Nov 7, 2018",Zacks
Nov-07-18,Does AmerisourceBergen Corporations (NYSE:ABC) P/E Ratio Signal A Buying Opportunity?,Simply Wall St.
Nov-12-18,Aurora Cannabis Tanks Despite Strong Earnings Growth,TheStreet.com
Nov-19-18,Edited Transcript of ABC earnings conference call or presentation 6-Nov-18 1:30pm GMT,Thomson Reuters StreetEvents
Nov-19-18,"The Zacks Analyst Blog Highlights: Pfizer, Cisco, Southern, SunTrust Banks and AmerisourceBergen",Zacks
Nov-20-18,"Walgreens and Humana Discussing Equity Stakes, WSJ Reports",Bloomberg
Nov-20-18,"AmerisourceBergen Corp (ABC) Files 10-K for the Fiscal Year Ended on September 30, 2018",GuruFocus.com
Dec-03-18,Edited Transcript of ABC earnings conference call or presentation 6-Nov-18 1:30pm GMT,Thomson Reuters StreetEvents
Dec-04-18,"Recent Analysis Shows NetApp, Williams-Sonoma, DENTSPLY SIRONA, Applied Materials, Alleghany, and AmerisourceBergen Market Influences  Renewed Outlook, Key Drivers of Growth",GlobeNewswire
Dec-07-18,AmerisourceBergen's Natomas distribution center plans big solar installation,American City Business Journals
Dec-10-18,"INVESTOR ALERT: Levi & Korsinsky, LLP Reminds Investors of Commencement of an Investigation Involving Possible Securities Fraud Violations by the Board of Directors of AmerisourceBergen Corporation -- ABC",GlobeNewswire
Dec-18-18,Edited Transcript of ABC earnings conference call or presentation 6-Nov-18 1:30pm GMT,Thomson Reuters StreetEvents
Dec-19-18,Edited Transcript of ABC earnings conference call or presentation 6-Nov-18 1:30pm GMT,Thomson Reuters StreetEvents
Dec-20-18,Baird: What Rite Aid's Renewed Deal With Distributor McKesson Means For Both Companies,Benzinga
Dec-31-18,3 Health Care Stocks to Watch in 2019,GuruFocus.com
Jan-03-19,AmerisourceBergen Announces Date and Time for First Quarter Fiscal 2019 Earnings Release,Business Wire
Jan-15-19,Update: Pharmaceutical firm to lay off 225 Memphis workers,American City Business Journals
Jan-15-19,Is AmerisourceBergen (ABC) a Great Stock for Value Investors?,Zacks
Jan-17-19,Should We Be Delighted With AmerisourceBergen Corporations (NYSE:ABC) ROE Of 53%?,Simply Wall St.
Jan-18-19,Analysts Commence Coverage on Large Caps,GuruFocus.com
Jan-18-19,5 Stocks in Focus After Recent Broker Rating Upgrades,Zacks
Jan-24-19,Earnings Preview: AmerisourceBergen (ABC) Q1 Earnings Expected to Decline,Zacks
Jan-25-19,AmerisourceBergen (ABC) Q1 Earnings: What's in the Cards?,Zacks
Jan-30-19,"Medical Products' Earnings Lineup for Jan 31: EW, BAX &amp; More",Zacks
Jan-31-19,"AmerisourceBergen Jumps on Revenue, EPS Beats in Q1",TheStreet.com
Jan-31-19,"AmerisourceBergen (ABC) Beats on Q1 Earnings, Trims EPS View",Zacks
Jan-31-19,AmerisourceBergen (ABC) Beats Q1 Earnings and Revenue Estimates,Zacks
Jan-31-19,AmerisourceBergen: Fiscal 1Q Earnings Snapshot,Associated Press
Jan-31-19,AmerisourceBergen Reports Fiscal 2019 First Quarter Results,Business Wire
