date,title,source
Oct-30-18,"JELD-WEN Holding, Inc. to Participate in the Baird 2018 Global Industrial Conference",Business Wire
Nov-06-18,"JELD-WEN Holding, Inc. (JELD) Q3 Earnings and Revenues Miss Estimates",Zacks
Nov-06-18,JELD-WEN Announces Third Quarter 2018 Results and Affirms 2018 Outlook,Business Wire
Nov-09-18,"Report: Exploring Fundamental Drivers Behind California Water Service Group Holding, Canadian Solar, JELD-WEN Holding, CONSOL Coal Resources LP, Global Blood Therapeutics, and Pier 1 Imports  New Horizons, Emerging Trends, and Upcoming Developments",GlobeNewswire
Dec-10-18,"Goldman Sachs Upgrades Fortune Brands, Downgrades Jeld-Wen In Building Products Pair Trade",Benzinga
Dec-13-18,Jeld-Wen Is a Buy,GuruFocus.com
Jan-23-19,JELD-WEN Announces Date of Earnings Release and Conference Call for 2018 Fourth Quarter and Full Year Results,Business Wire
Feb-08-19,"New Research Coverage Highlights Teleflex, Louisiana-Pacific, New Jersey Resources, STAAR Surgical, JELD-WEN Holding, and Powell Industries  Consolidated Revenues, Company Growth, and Expectations for 2019",GlobeNewswire
Feb-12-19,"JELD-WEN Holding, Inc. (JELD) Earnings Expected to Grow: What to Know Ahead of Next Week's Release",Zacks
Feb-13-19,"Have Insiders Been Selling JELD-WEN Holding, Inc. (NYSE:JELD) Shares This Year?",Simply Wall St.
Feb-19-19,Wall Street Climbs on Tuesday,GuruFocus.com
Feb-19-19,"JELD-WEN Holding, Inc. (JELD) Q4 2018 Earnings Conference Call Transcript",Motley Fool
Feb-19-19,Jeld-Wen Soars After Q4 Earnings Top Wall Street Forecasts,TheStreet.com
Feb-19-19,"JELD-WEN Holding, Inc. to Host Earnings Call",ACCESSWIRE
Feb-19-19,"JELD-WEN Announces Fourth Quarter and Full Year 2018 Results, Provides 2019 Outlook, and Announces Board Leadership Transition",Business Wire
Feb-20-19,"Company News For Feb 20, 2019",Zacks
Feb-20-19,"Former interim CEO to retire, step down from Charlotte-based Jeld-Wen's board",American City Business Journals
Feb-28-19,"JELD-WEN Holding, Inc. to Participate in the 2019 Wells Fargo Homebuilding & Building Products Forum",Business Wire
Mar-04-19,"JELD-WEN Holding, Inc. Announces Agreement to Acquire VPI Quality Windows, Inc.",Business Wire
