date,title,source
Oct-17-18,Hilton Grand Vacations to Report Third-Quarter 2018 Results,Business Wire
Oct-24-18,Hilton Grand Vacations Inc. (HGV) Q3 Earnings Preview: What to Watch Ahead of the Release,Zacks
Oct-25-18,Hilton Grand Vacations Named Top Upper-Upscale Brand in ReviewPro and Cornell University Reputation Report,Business Wire
Oct-25-18,Ackman's Pershing Square acquires stake in Hilton,American City Business Journals
Oct-30-18,"Hilton Grand Vacations Appoints Jesse Seidman as Vice President, Corporate Strategy",Business Wire
Oct-31-18,Hilton Grand Vacations Inc. (HGV) Lags Q3 Earnings Estimates,Zacks
Oct-31-18,"Hilton Grand Vacations Reports Third-Quarter 2018 Results, Net Owner Growth Accelerates to 7.4 Percent",Business Wire
