date,title,source
Oct-17-18,Is Archer Daniels Midland (ADM) Stock Outpacing Its Consumer Staples Peers This Year?,Zacks
Oct-18-18,Archer Daniels Midland (ADM) Gains As Market Dips: What You Should Know,Zacks
Oct-22-18,Procter & Gamble (PG) Catches Eye: Stock Jumps 8.8%,Zacks
Oct-23-18,U.S. appeals court revives Nestle child slavery lawsuit,Reuters
Oct-23-18,"Canadian farmers race to reap wheat while sun shines, but damage done",Reuters
Oct-25-18,Archer Daniels Midland (ADM) Gains But Lags Market: What You Should Know,Zacks
Oct-25-18,ABCD quartet of grain traders partner to digitize global trades,Reuters
Oct-25-18,3 Blue-Chip Stocks to Buy Amid Global Conflicts,Zacks
Oct-25-18,5 Consumer Staples Stocks to Buy in a Volatile Market,Zacks
Oct-25-18,Agribusinesses Seek to Modernize Global Agricultural Commodity Trade Operations,Business Wire
Oct-29-18,ADM and Cargill to help farmers achieve greater profitability with Grainbridge technology joint venture,PR Newswire
Oct-29-18,Factors Likely to Influence Molson Coors' (TAP) Q3 Earnings,Zacks
Oct-29-18,Does Archer-Daniels-Midland Companys (NYSE:ADM) P/E Ratio Signal A Buying Opportunity?,Simply Wall St.
Oct-30-18,Archer Daniels Midland (ADM) Earnings Expected to Grow: Should You Buy?,Zacks
Oct-31-18,Archer Daniels Midland (ADM) Stock Sinks As Market Gains: What You Should Know,Zacks
Nov-01-18,ADM Named Leader in Board and Executive Leadership Diversity,Business Wire
Nov-01-18,Is Archer Daniels (ADM) Poised for Earnings Beat in Q3?,Zacks
Nov-01-18,Wall Street Mayhem to Persist in November: 5 Defensive Picks,Zacks
Nov-01-18,Winning November to Make Up for a Spooky October: 5 Picks,Zacks
Nov-01-18,New Strong Buy Stocks for November 1st,Zacks
Nov-02-18,"The Zacks Analyst Blog Highlights: Archer-Daniels-Midland, Best Buy, Heidrick & Struggles International, Amedisys and RH",Zacks
Nov-02-18,Has Archer Daniels Midland (ADM) Outpaced Other Consumer Staples Stocks This Year?,Zacks
