date,title,source
Oct-18-18,"Report: Developing Opportunities within Natera, InnerWorkings, Chanticleer, NN, Stoneridge, and Avid Technology  Future Expectations, Projections Moving into 2018",GlobeNewswire
Oct-29-18,"InnerWorkings to Announce Third Quarter 2018 Financial Results on November 8, 2018",Business Wire
Nov-08-18,InnerWorkings (INWK) Q3 Earnings and Revenues Miss Estimates,Zacks
Nov-08-18,InnerWorkings: 3Q Earnings Snapshot,Associated Press
Nov-08-18,InnerWorkings Announces Third Quarter 2018 Results,Business Wire
Nov-08-18,InnerWorkings Awarded a Major Expansion with an Existing Client,Business Wire
Nov-09-18,Edited Transcript of INWK earnings conference call or presentation 8-Nov-18 10:00pm GMT,Thomson Reuters StreetEvents
