date,title,source
Oct-17-18,"With crude above $70, its time to sell your oil stocks",MarketWatch
Oct-18-18,"Viper Energy Partners LP, a Subsidiary of Diamondback Energy, Inc., Schedules Third Quarter 2018 Conference Call for October 30, 2018",GlobeNewswire
Oct-18-18,"Diamondback Energy, Inc. Schedules Third Quarter 2018 Conference Call for November 7, 2018",GlobeNewswire
Oct-18-18,"With crude around $70, its time to sell your oil stocks",MarketWatch
Oct-18-18,"Detailed Research: Economic Perspectives on Rockwell Medical, Diamondback Energy, Steven Madden, Synaptics, Photronics, and Caleres  What Drives Growth in Today's Competitive Landscape",GlobeNewswire
Oct-29-18,"Viper Energy Misses, Continental Resources To Report Late",Investor's Business Daily
Oct-29-18,"Viper Energy Partners LP, a Subsidiary of Diamondback Energy, Inc., Reports Third Quarter 2018 Financial and Operating Results",GlobeNewswire
Nov-06-18,Diamondback Energy (FANG) Tops Q3 Earnings and Revenue Estimates,Zacks
Nov-06-18,Energen beats profit estimates on higher production,Reuters
Nov-06-18,Diamondback: 3Q Earnings Snapshot,Associated Press
Nov-06-18,"Diamondback Energy, Inc. Announces Third Quarter 2018 Financial and Operating Results",GlobeNewswire
Nov-07-18,Edited Transcript of FANG earnings conference call or presentation 7-Nov-18 2:00pm GMT,Thomson Reuters StreetEvents
Nov-08-18,Edited Transcript of FANG earnings conference call or presentation 7-Nov-18 2:00pm GMT,Thomson Reuters StreetEvents
