date,title,source
Oct-24-18,"Recent Analysis Shows Zayo Group, W.P. Carey, Tuniu, 21Vianet Group, Domino's Pizza, and Seaboard Market Influences  Renewed Outlook, Key Drivers of Growth",GlobeNewswire
Oct-29-18,"21Vianet Group, Inc. to Announce Third Quarter 2018 Financial Results",GlobeNewswire
Nov-06-18,5 Breakout Stocks Offering Admirable Returns,Zacks
Nov-07-18,"Zacks.com highlights: FireEye, Nokia, 21Vianet Group, Endurance International Group Holdings and Energy Fuels",Zacks
Nov-20-18,21Vianet: 3Q Earnings Snapshot,Associated Press
Nov-20-18,"21Vianet Group, Inc. Reports Unaudited Third Quarter 2018 Financial Results",GlobeNewswire
Jan-02-19,"What Investors Should Know About 21Vianet Group, Inc.s (NASDAQ:VNET) Financial Strength",Simply Wall St.
Feb-01-19,"Is There Now An Opportunity In 21Vianet Group, Inc. (NASDAQ:VNET)?",Simply Wall St.
Feb-19-19,"21Vianet Group, Inc. to Announce Fourth Quarter and Full Year 2018 Financial Results",GlobeNewswire
Feb-28-19,"21Vianet Group, Inc. to Provide Baozun with Hybrid Cloud-based Container Solutions, Leading a New Era of E-commerce",GlobeNewswire
Mar-04-19,"21Vianet Group, Inc. Reports Unaudited Fourth Quarter and Full Year 2018 Financial Results",GlobeNewswire
Mar-04-19,"What Kind Of Share Price Volatility Should You Expect For 21Vianet Group, Inc. (NASDAQ:VNET)?",Simply Wall St.
Mar-05-19,Edited Transcript of VNET earnings conference call or presentation 5-Mar-19 1:00am GMT,Thomson Reuters StreetEvents
Mar-06-19,"New Research Coverage Highlights Clovis Oncology, Welltower, The Ultimate Software Group, Nielsen Holdings Plc, Xencor, and 21Vianet Group  Consolidated Revenues, Company Growth, and Expectations for 2019",GlobeNewswire
Mar-14-19,New Strong Sell Stocks for March 14th,Zacks
Mar-19-19,New Strong Sell Stocks for March 19th,Zacks
Mar-25-19,New Strong Sell Stocks for March 25th,Zacks
