date,title,source
Nov-01-18,"FuelCell Energy Enters into Power Purchase Agreement for 14.8 MW Fuel Cell Project in Derby, CT",GlobeNewswire
Nov-05-18,FuelCell Energy to Acquire 14.9 Megawatt Bridgeport Fuel Cell Park from Dominion Energy,GlobeNewswire
Nov-13-18,"FuelCell Energy Announces Governance Changes, Appoints New Chairman and Expands Board to Nine Members",GlobeNewswire
Nov-16-18,One Thing To Remember About The FuelCell Energy Inc (NASDAQ:FCEL) Share Price,Simply Wall St.
Nov-28-18,FuelCell Energy (FCEL) Enters Oversold Territory,Zacks
Nov-28-18,Connecticut Governor-Elect Lamont Names FuelCell Energys Jennifer Arasimowicz to Transition Team,GlobeNewswire
Nov-30-18,Will Lower Revenues Dampen Finisar's (FNSR) Q2 Earnings?,Zacks
Dec-11-18,"Market Trends Toward New Normal in CME Group, Ambac Financial Group, Erie Indemnity, FuelCell Energy, Hovnanian Enterprises, and Rexahn Pharmaceuticals  Emerging Consolidated Expectations, Analyst Ratings",GlobeNewswire
