date,title,source
Oct-22-18,"Fabrinet to Announce First Quarter Fiscal-Year 2019 Financial Results on November 5, 2018",Business Wire
Oct-26-18,"Recent Analysis Shows Prologis, Delek Logistics Partners, Fabrinet, New York Mortgage Trust, Petroleo Brasileiro S.A.- Petrobras, and Athenex Market Influences  Renewed Outlook, Key Drivers of Growth",GlobeNewswire
Nov-01-18,US Stock Market Rises Thursday,GuruFocus.com
Nov-05-18,Fabrinet (FN) Q1 2019 Earnings Conference Call Transcript,Motley Fool
Nov-05-18,Fabrinet: Fiscal 1Q Earnings Snapshot,Associated Press
Nov-05-18,Fabrinet Announces First Quarter Fiscal Year 2019 Financial Results,Business Wire
Nov-06-18,"Cyclical, Semiconductor Stocks Lead Market But These Breakouts Sputter",Investor's Business Daily
Nov-19-18,Edited Transcript of FN earnings conference call or presentation 5-Nov-18 10:00pm GMT,Thomson Reuters StreetEvents
Nov-23-18,Should You Be Excited About Fabrinets (NYSE:FN) 12% Return On Equity?,Simply Wall St.
Nov-26-18,IBD Stock Of The Day: This Contract Manufacturer's Relative Strength Shines,Investor's Business Daily
Jan-08-19,ZAGG vs. FN: Which Stock Is the Better Value Option?,Zacks
Jan-10-19,"Dow Jones, Nasdaq Erase Early Losses; 4 Clues Hint At Apple Stock Bottoming",Investor's Business Daily
Jan-16-19,3 Small Caps Hitting New Highs,Investopedia
Jan-22-19,"Fabrinet to Announce Second Quarter Fiscal-Year 2019 Financial Results on February 4, 2019",Business Wire
Jan-25-19,3 Reasons Why Growth Investors Shouldn't Overlook Fabrinet (FN),Zacks
Jan-28-19,Fabrinet (FN) Earnings Expected to Grow: Should You Buy?,Zacks
Jan-29-19,What Makes Fabrinet (FN) a Strong Momentum Stock: Buy Now?,Zacks
Jan-29-19,Top Ranked Growth Stocks to Buy for January 29th,Zacks
Jan-30-19,Optimism Rises Ahead of US-China Trade Talks: 6 Gainers,Zacks
Feb-01-19,"The Zacks Analyst Blog Highlights: Jabil, Fabrinet, Intrepid Potash, EnerSys and Sealed Air",Zacks
Feb-04-19,Fabrinet (FN) Surpasses Q2 Earnings and Revenue Estimates,Zacks
Feb-04-19,Fabrinet: Fiscal 2Q Earnings Snapshot,Associated Press
Feb-04-19,Bright Near-Term Outlook for Electronics Components Industry,Zacks
Feb-04-19,Fabrinet Announces Second Quarter Fiscal Year 2019 Financial Results,Business Wire
Feb-04-19,Fabrinet to Host Earnings Call,ACCESSWIRE
Feb-04-19,Q2 Earnings Preview For Fabrinet,Benzinga
Feb-05-19,Edited Transcript of FN earnings conference call or presentation 4-Feb-19 10:00pm GMT,Thomson Reuters StreetEvents
Feb-05-19,Pick These 4 Stocks With Excellent Interest Coverage Ratio,Zacks
Feb-05-19,5 Top-Notch Liquid Stocks to Reap High Portfolio Returns,Zacks
Feb-06-19,"Zacks.com featured highlights include: Crocs, Commvault, Fabrinet, Trupanion and WNS",Zacks
Feb-06-19,New Strong Buy Stocks for February 6th,Zacks
Feb-06-19,State of the Market Remains Positive,Zacks
Feb-06-19,Edited Transcript of FN earnings conference call or presentation 4-Feb-19 10:00pm GMT,Thomson Reuters StreetEvents
Feb-07-19,Is Fabrinet (FN) Outperforming Other Computer and Technology Stocks This Year?,Zacks
Feb-11-19,Fabrinet (FN) is an Incredible Growth Stock: 3 Reasons Why,Zacks
Feb-13-19,FN or LFUS: Which Is the Better Value Stock Right Now?,Zacks
Feb-19-19,Top Ranked Growth Stocks to Buy for February 19th,Zacks
Feb-19-19,"Dow Jones Futures: Current Stock Market Rally Shows Fiber, And So Do These 6 Top Stocks",Investor's Business Daily
Feb-20-19,Pick These 5 Stocks With Superb Interest Coverage Ratio,Zacks
Feb-25-19,OSI (OSIS) Hits Fresh High: Is There Still Room to Run?,Zacks
Feb-25-19,"Analysis: Positioning to Benefit within Infosys, QUALCOMM, Zayo Group, Prologis, State Street, and Fabrinet  Research Highlights Growth, Revenue, and Consolidated Results",GlobeNewswire
Feb-28-19,Fabrinet Expands Board of Directors with Addition of Optical Industry Veteran Greg Dougherty,Business Wire
Mar-04-19,S&P Reclaims 2800; NASDAQs Streak Hits 10 Weeks,Zacks
Mar-07-19,3 Reasons Growth Investors Will Love Fabrinet (FN),Zacks
Mar-07-19,Here Are 5 Stocks With Remarkable Interest Coverage Ratio,Zacks
Mar-11-19,What Makes Fabrinet (FN) a Strong Momentum Stock: Buy Now?,Zacks
Mar-11-19,Has Fabrinet (FN) Outpaced Other Computer and Technology Stocks This Year?,Zacks
Mar-12-19,Fabrinet (FN) Stock Sinks As Market Gains: What You Should Know,Zacks
Mar-13-19,FN vs. TEL: Which Stock Should Value Investors Buy Now?,Zacks
Mar-20-19,"Amtek (AME) Hits 52-Week High, Can the Run Continue?",Zacks
Mar-21-19,Top Ranked Growth Stocks to Buy for March 21st,Zacks
Mar-25-19,5 Stocks With Impressive Interest Coverage Ratio to Invest In,Zacks
Mar-26-19,American Superconductor (AMSC) in Focus: Stock Moves 7.7% Higher,Zacks
Apr-01-19,Is Fabrinet (FN) Stock Outpacing Its Computer and Technology Peers This Year?,Zacks
Apr-22-19,"Fabrinet to Announce Third Quarter Fiscal-Year 2019 Financial Results on May 6, 2019",Business Wire
Apr-29-19,Fabrinet (FN) Earnings Expected to Grow: What to Know Ahead of Next Week's Release,Zacks
Apr-30-19,Is Fabrinet (FN) A Good Stock To Buy?,Insider Monkey
May-01-19,Fabrinet (FN) to Report Q3 Earnings: What's in the Cards?,Zacks
May-06-19,Fabrinet Announces Third Quarter Fiscal Year 2019 Financial Results,Business Wire
May-07-19,Fabrinet: Fiscal 3Q Earnings Snapshot,Associated Press
May-07-19,Edited Transcript of FN earnings conference call or presentation 6-May-19 9:00pm GMT,Thomson Reuters StreetEvents
