date,title,source
Oct-17-18,"Report: Exploring Fundamental Drivers Behind Shenandoah Telecommunications, Nova Measuring Instruments, FRP, National Fuel Gas, Organovo, and Sierra Wireless  New Horizons, Emerging Trends, and Upcoming Developments",GlobeNewswire
Oct-25-18,"Shenandoah Telecommunications Company to Hold its Third Quarter 2018 Earnings Call at 10 a.m. on Tuesday, November 6, 2018",GlobeNewswire
Oct-31-18,Shenandoah Telecommunications Company Announces Increased Dividend,GlobeNewswire
Nov-06-18,Edited Transcript of SHEN earnings conference call or presentation 6-Nov-18 3:00pm GMT,Thomson Reuters StreetEvents
Nov-06-18,Shenandoah Telecom: 3Q Earnings Snapshot,Associated Press
Nov-06-18,Shenandoah Telecommunications Company Reports Third Quarter 2018 Results,GlobeNewswire
Nov-09-18,"Report: Exploring Fundamental Drivers Behind AcelRx Pharmaceuticals, Fossil Group, FMC, Ultragenyx Pharmaceutical, Shenandoah Telecommunications, and Marcus & Millichap  New Horizons, Emerging Trends, and Upcoming Developments",GlobeNewswire
Nov-13-18,Shenandoah Telecommunications (SHEN) Is Up 13.35% in One Week: What You Should Know,Zacks
Nov-14-18,Edited Transcript of SHEN earnings conference call or presentation 6-Nov-18 3:00pm GMT,Thomson Reuters StreetEvents
Nov-14-18,Wall Street Fettered by Three Major Things: 5 Defensive Picks,Zacks
Nov-15-18,Edited Transcript of SHEN earnings conference call or presentation 6-Nov-18 3:00pm GMT,Thomson Reuters StreetEvents
Nov-23-18,"Shenandoah, NVIDIA, Garmin, Qualcomm and Hewlett Packard Enterprise highlighted as Zacks Bull and Bear of the Day",Zacks
Nov-27-18,"With A Return On Equity Of 21%, Has Shenandoah Telecommunications Companys (NASDAQ:SHEN) Management Done Well?",Simply Wall St.
Dec-06-18,Has Shenandoah Telecommunications (SHEN) Outpaced Other Utilities Stocks This Year?,Zacks
Dec-11-18,Why Shenandoah (SHEN) Could Be Positioned for a Surge,Zacks
Dec-14-18,Shenandoah Telecommunications (SHEN) Stock Moves -0.97%: What You Should Know,Zacks
Dec-14-18,Bet on These 5 Low-Beta Stocks to Fight Market Volatility,Zacks
Dec-18-18,"Zacks.com featured highlights include: Abercrombie, Dr. Reddy???s, Cree, Otter and Shenandoah",Zacks
Dec-20-18,Hedge Funds Are Buying Shenandoah Telecommunications Company (SHEN),Insider Monkey
Dec-24-18,Is Shenandoah Telecommunications (SHEN) Stock Outpacing Its Utilities Peers This Year?,Zacks
Dec-24-18,Cincinnati Bell (CBB) Displays Bright Prospects Amid Risks,Zacks
Jan-10-19,Is There An Opportunity With Shenandoah Telecommunications Companys (NASDAQ:SHEN) 47.62% Undervaluation?,Simply Wall St.
Jan-23-19,Frontier (FTR) Divests Communication Towers for $80 Million,Zacks
Jan-23-19,Telefonica Mulling Non-Core Asset Sale in Central America,Zacks
Jan-24-19,Shentel Reports 2018 Fourth Quarter and Year End Operating Statistics,GlobeNewswire
Feb-11-19,Is Shenandoah Telecommunications Companys (NASDAQ:SHEN) CEO Being Overpaid?,Simply Wall St.
Feb-13-19,"New Research Coverage Highlights Amicus Therapeutics, Clovis Oncology, YRC Worldwide, FORTERRA INC, Shenandoah Telecommunications, and Basic Energy Services  Consolidated Revenues, Company Growth, and Expectations for 2019",GlobeNewswire
Feb-19-19,"Shenandoah Telecommunications Company to Hold its Fourth Quarter 2018 Earnings Call at 10 a.m. on Thursday, February 28, 2019",GlobeNewswire
Feb-21-19,Shenandoah Telecommunications (SHEN) Reports Next Week: Wall Street Expects Earnings Growth,Zacks
Feb-22-19,5 Stocks to Buy as New Analysts Initiate Coverage,Zacks
Feb-25-19,"Zacks.com featured expert Kevin Matras highlights: Shenandoah Telecommunications, Honda Motor, PolarityTE, Ubiquiti Networks and Titan Machinery",Zacks
Feb-28-19,"Shenandoah Telecommunications Announces Acquisition of Big Sandy Broadband, Inc.",GlobeNewswire
Feb-28-19,Shenandoah Telecommunications Company Reports Fourth Quarter and Full Year 2018 Results,GlobeNewswire
Mar-04-19,Edited Transcript of SHEN earnings conference call or presentation 28-Feb-19 3:00pm GMT,Thomson Reuters StreetEvents
Mar-04-19,What Kind Of Shareholder Appears On The Shenandoah Telecommunications Companys (NASDAQ:SHEN) Shareholder Register?,Simply Wall St.
Mar-06-19,Edited Transcript of SHEN earnings conference call or presentation 28-Feb-19 3:00pm GMT,Thomson Reuters StreetEvents
Apr-23-19,Shenandoah Telecommunications Company Announces Resignation of Chief Financial Officer James Woodward,GlobeNewswire
Apr-26-19,"Shenandoah Telecommunications Company to Hold its First Quarter 2019 Earnings Call at 10 a.m. on Thursday, May 9, 2019",GlobeNewswire
Apr-29-19,Shenandoah Telecommunications Company Announces Additions to Senior Management Team,GlobeNewswire
May-01-19,Heres What Hedge Funds Think About Shenandoah Telecommunications Company (SHEN),Insider Monkey
May-02-19,Shenandoah Telecommunications (SHEN) Reports Next Week: Wall Street Expects Earnings Growth,Zacks
May-03-19,Is Shenandoah Telecommunications Company's (NASDAQ:SHEN) High P/E Ratio A Problem For Investors?,Simply Wall St.
May-09-19,Shenandoah Telecommunications (SHEN) Meets Q1 Earnings Estimates,Zacks
May-09-19,Shenandoah Telecom: 1Q Earnings Snapshot,Associated Press
May-09-19,Shenandoah Telecommunications Company Reports First Quarter 2019 Results,GlobeNewswire
