date,title,source
Nov-01-18,Unum Therapeutics to Present Preliminary Results from Ongoing Phase 1 Studies ATTCK-20-03 and ATTCK-17-01 at the 2018 ASH Annual Meeting,GlobeNewswire
Nov-01-18,"Report: Developing Opportunities within Waste Management, Cubic, Unum Therapeutics, Highwoods Properties, Trinity Industries, and Cerner  Future Expectations, Projections Moving into 2018",GlobeNewswire
Nov-05-18,"Unum Therapeutics to Host Third Quarter 2018 Financial Results Conference Call and Webcast on November 12, 2018 at 4:30 P.M. ET",GlobeNewswire
Nov-06-18,"Unum Therapeutics to Present Preclinical Data on a New, Emerging Platform Technology for Solid Tumors at the SITC Annual Meeting",GlobeNewswire
Nov-09-18,Unum Therapeutics to Present Preclinical Data on Applications of ACTR Proprietary Technology Platform in Solid Tumors at the San Antonio Breast Cancer Symposium,GlobeNewswire
Nov-12-18,Unum Therapeutics to Host Investor Event on its Efforts to Realize the Promise of T Cell Therapies in Solid Tumors,GlobeNewswire
Nov-12-18,Unum Therapeutics Reports Third Quarter 2018 Financial Results and Provides Business Update,GlobeNewswire
Dec-06-18,Unum Therapeutics Announces US Patent Protection for ACTR Technology,GlobeNewswire
Dec-10-18,"New Research Coverage Highlights Synopsys, Unum Therapeutics, HD Supply, Tech Data, Mellanox Technologies, and eHealth  Consolidated Revenues, Company Growth, and Expectations for 2018",GlobeNewswire
Dec-20-18,Unum Therapeutics Added to NASDAQ Biotechnology Index,GlobeNewswire
