date,title,source
Oct-19-18,Cabot Corporation (NYSE:CBT): Time For A Financial Health Check,Simply Wall St.
Oct-23-18,MEEC: Midwest Energy Emissions Announces 2 Multi-Million Dollar Contracts,Zacks Small Cap Research
Oct-29-18,"New Research Coverage Highlights Rite Aid, The Boeing, Cabot, Biogen, McDonald's, and Pegasystems  Consolidated Revenues, Company Growth, and Expectations for 2018",GlobeNewswire
Nov-02-18,"Chemical Stocks Earnings Slated on Nov 5: FMC, CBT, IFF & VVV",Zacks
Nov-05-18,Cabot: Fiscal 4Q Earnings Snapshot,Associated Press
Nov-05-18,Cabot Corp Reports Fourth Quarter Diluted EPS of $1.51 and Adjusted EPS of $1.00,Business Wire
Nov-05-18,Does The Data Make Cabot Corporation (NYSE:CBT) An Attractive Investment?,Simply Wall St.
Nov-06-18,Cabot Corp (CBT) Q4 2018 Earnings Conference Call Transcript,Motley Fool
Nov-08-18,"Cabot (CBT) Misses Q4 Earnings, Tops Revenue Estimates",Zacks
