date,title,source
Oct-17-18,Amgen Launches Humira Biosimilar in Europe,GuruFocus.com
Oct-17-18,"Exclusive: Express Scripts covers Amgen, Lilly migraine drugs, excludes Teva",Reuters
Oct-17-18,"Express Scripts covers Amgen, Lilly migraine drugs, excludes Teva",Reuters
Oct-17-18,"Stocks - Netflix Soars in Pre-market; IBM, Tilray, Canopy Growth Sink; Tesla Rises",Investing.com
Oct-17-18,"Can Allergan's Key Drugs, Solid Pipeline Abate Generic Woes?",Zacks
Oct-19-18,Amgen (AMGN) Dips More Than Broader Markets: What You Should Know,Zacks
Oct-19-18,Biotech Sector Could Enter Bear Market,Investopedia
Oct-19-18,AMGN or ILMN: Which Is the Better Value Stock Right Now?,Zacks
Oct-19-18,10 S&P 500 Stocks to Buy for the Long Term,Kiplinger
Oct-19-18,"Investor Expectations to Drive Momentum within Amgen, Crown Castle International, Constellation Brands, Nice, NetEase, and The Hanover Insurance Group  Discovering Underlying Factors of Influence",GlobeNewswire
Oct-22-18,"Novartis (NVS) Q3 Earnings In Line, Revenues Beat Estimates",Zacks
Oct-22-18,Is a Beat in Store for Bristol-Myers (BMY) in Q3 Earnings?,Zacks
Oct-23-18,Amgen Announces 2018 Fourth Quarter Dividend,PR Newswire
Oct-23-18,"Stocks to Buy, Stocks to Dump in This Volatile Market",TheStreet.com
Oct-23-18,Amgen (AMGN) Q3 Earnings Preview: What to Look Out For,Zacks
Oct-24-18,Amgen cuts U.S. price of cholesterol drug Repatha by 60 percent,Reuters
Oct-24-18,"Amgen slashes price of $14,000-a-year cholesterol drug",Associated Press
Oct-24-18,Amgen Falls 3%,Investing.com
Oct-24-18,"Amgen slashes price of $14,000-a-year cholesterol drug",Associated Press
Oct-24-18,"Amgen cuts price of cholesterol drug by almost 60%, echoing rival's move",CNBC
Oct-25-18,Trump seeks to base Medicare drug prices on lower overseas rates,Reuters
Oct-25-18,Amgen (AMGN) Gains But Lags Market: What You Should Know,Zacks
Oct-25-18,Can Amgen (AMGN) Keep the Earnings Streak Alive in Q3?,Zacks
Oct-25-18,"Sarepta (SRPT) Q3 Earnings & Sales Miss, Exondys 51 Sales Up",Zacks
Oct-25-18,Can Amgen (AMGN) Keep the Earnings Surprise Streak Alive?,Zacks
Oct-25-18,Has Amgen (AMGN) Outpaced Other Medical Stocks This Year?,Zacks
Oct-25-18,"In 'high risk gambit,' Amgen slashes price of underused cholesterol drug",MarketWatch
Oct-25-18,"The Daily Biotech Pulse: AbbVie Takes Full Control Of Cystic Fibrosis Program, Amgen Slashes Cholesterol Drug Price",Benzinga
Oct-29-18,The bigger message behind Amgens decision to slash cost of its Repatha cholesterol drug,MarketWatch
Oct-29-18,Teva (TEVA) to Report Q3 Earnings: What's in the Cards?,Zacks
Oct-29-18,"The Zacks Analyst Blog Highlights: Allergan, Regeneron Pharmaceuticals, Amgen, Alnylam Pharmaceuticals and AMAG Pharmaceuticals",Zacks
Oct-30-18,Aging Blockbusters Send Amgen Inc.'s Bottom Line Lower,Motley Fool
Oct-30-18,"Amgen posts higher quarterly EPS, Repatha sales fall short",Reuters
Oct-30-18,"Amgen Earnings, Revenue beat in Q3",Investing.com
Oct-30-18,"Facebook Beats Q3 Estimates, Swings to Positive; Plus AMGN, MGM",Zacks
Oct-30-18,Amgen (AMGN) Q3 Earnings and Revenues Beat Estimates,Zacks
Oct-30-18,Why this East Bay drug maker plans to add 300 jobs,American City Business Journals
Oct-30-18,Amgen: 3Q Earnings Snapshot,Associated Press
Oct-30-18,"Amgen stock rises after company beats earnings, raises guidance",MarketWatch
Oct-30-18,Amgen quarterly net profit falls as expenses increase; EPS rises,Reuters
Oct-30-18,Amgen Reports Third Quarter 2018 Financial Results,PR Newswire
Oct-30-18,"Community Health's (CYH) Q3 Loss Widens, Admissions Drop",Zacks
Oct-30-18,"The Daily Biotech Pulse: Pfizer And Allergan Earnings, CFO Departures At Acadia And Assertio",Benzinga
Oct-31-18,Amgen Rises 3%,Investing.com
Oct-31-18,Edited Transcript of AMGN earnings conference call or presentation 30-Oct-18 9:00pm GMT,Thomson Reuters StreetEvents
Oct-31-18,"Biotech Stock Roundup: Celgene, Amgen, Vertex Impress in Q3, DRNA Soars on LLY Deal",Zacks
Oct-31-18,Amgen Lower in After-Hours Trading Following 3rd-Quarter Results,GuruFocus.com
Oct-31-18,Big Pharma's Price Freezes Aren't Fooling Anybody,Bloomberg
Oct-31-18,"Amgen (AMGN) Beats on Earnings & Sales in Q3, Raises View",Zacks
Oct-31-18,"The Zacks Analyst Blog Highlights: Facebook, Amgen and MGM Resorts International",Zacks
Oct-31-18,"The Daily Biotech Pulse: KemPharm, FDA Nod For Merck, Clovis Q3 Miss, 3 Stocks To Debut",Benzinga
Oct-31-18,"Stocks making the biggest move premarket: GM, ANTM, CLX, EL & more",CNBC
Oct-31-18,[$$] Stocks to Watch,The Wall Street Journal
Nov-01-18,Amgen To Present New Data Showcasing Extensive Portfolio And Exciting Early Oncology Pipeline At ASH 2018,PR Newswire
Nov-01-18,Biotech ETFs in Focus on String of Q3 Earnings Beat,Zacks
Nov-01-18,Amgen Foundation Deepens Commitment To Aspiring Scientists Worldwide By Expanding Amgen Scholars Program,PR Newswire
Nov-01-18,"The Zacks Analyst Blog Highlights: Gilead Sciences, Amgen, Vertex Pharmaceuticals, Celgene and Regeneron Pharmaceuticals",Zacks
Nov-05-18,Amgen (AMGN) Outpaces Stock Market Gains: What You Should Know,Zacks
Nov-07-18,Amgen Rises 3%,Investing.com
Nov-07-18,Drug Stocks Climb as Investors Digest Midterm Election Results,TheStreet.com
Nov-07-18,Amgen (AMGN) Counts on New Drugs Amid Rising Biosimilar Woes,Zacks
Nov-07-18,3 Cancer Stocks to Watch in December,Motley Fool
Nov-07-18,"The Zacks Analyst Blog Highlights: Amgen, Intercontinental Exchange, TOTAL S.A., Royal Dutch Shell and Williams",Zacks
Nov-08-18,The Latest: Neighbor: Shooter was strange before military,Associated Press
Nov-08-18,Coherus prices biosimilar to Amgen's Neulasta at 33 pct discount,Reuters
Nov-09-18,Cramer Remix: Next week's earnings could make or break how the Fed approaches rate hikes,CNBC
Nov-09-18,Highly Rated 'Surgeon' For Biologic-Drug Makers Soars 85% In 2018,Investor's Business Daily
Nov-09-18,6 Pharmaceutical Stocks to Buy After the Midterms,InvestorPlace
Nov-12-18,Amgen (AMGN) Stock Moves -0.83%: What You Should Know,Zacks
Nov-13-18,"Despite Lofty Price, Illumina May Still Be a Buy",GuruFocus.com
Nov-13-18,Express Scripts offers new formulary for lower list-price drugs,Reuters
Nov-14-18,Migraine-Focused Biotech Has A Headache On Quarterly Losses,Investor's Business Daily
Nov-16-18,This Biotech Stock Is a Remedy for Tougher Times,Barrons.com
Nov-19-18,Amgen (AMGN) Gains As Market Dips: What You Should Know,Zacks
Nov-19-18,Is Amgen (AMGN) a Great Stock for Value Investors?,Zacks
Nov-19-18,Amgen's Blincyto Gets Positive CHMP Opinion for Line Extension,Zacks
Nov-19-18,"Drug Pricing Resurfaces, Pfizer to Raise Cost of 41 Drugs",Zacks
Nov-21-18,This Highly Rated Pharma Giant Is More Than Just A Diabetes Player,Investor's Business Daily
Nov-21-18,Amgen To Present At the Piper Jaffray And Evercore ISI Healthcare Conferences,PR Newswire
Nov-21-18,"Biotech Stock Roundup: GILD's Drug Wins Nod in China, Arena Up On Licensing Deal",Zacks
Nov-21-18,Should You Invest in the Invesco Dynamic Biotechnology & Genome ETF (PBE)?,Zacks
Nov-21-18,5 Quality Blue Chips to Thrive in Bull and Bear Markets,Investopedia
Nov-26-18,Google asks for refund of campaign contribution to embattled Sen. Cindy Hyde-Smith,CNBC
Nov-26-18,4 Reasons Why Lilly is Up More Than 30% This Year So Far,Zacks
Nov-27-18,Health Care Stocks May Be Safe Haven in Event of Market Downturn,GuruFocus.com
Nov-27-18,Why Celgene's Blockbuster Cancer Drug Looks Safe  For Now,Investor's Business Daily
Nov-27-18,5 Biotech Stocks to Scoop Up for Big Dividends,InvestorPlace
Nov-28-18,Novartis (NVS) Receives EC Approval for Neulasta Biosimilar,Zacks
Nov-28-18,3 Themes To Watch As Biopharmas 'Bring Some Excitement' In Blood Cancer,Investor's Business Daily
Nov-28-18,Amgen To Webcast Investor Call At ASH 2018,PR Newswire
Nov-28-18,Novartis' Biosimilar to Amgen's Neulasta Approved in Europe,GuruFocus.com
Nov-28-18,"3 Big Stock Charts for Wednesday: Delta Air Lines, Amgen and Mondelez International",InvestorPlace
Nov-29-18,Amgen (AMGN) Gains As Market Dips: What You Should Know,Zacks
Nov-29-18,"Research Report Identifies Equinix, Universal Electronics, LHC Group, Cohbar, Amgen, and Aetna with Renewed Outlook  Fundamental Analysis, Calculating Forward Movement",GlobeNewswire
Nov-30-18,Pfizer Stock Edges Into Buy Zone On AbbVie Deal For Humira Biosimilar,Investor's Business Daily
Nov-30-18,Amgen And UCB Announce FDA Advisory Committee Meeting To Review EVENITY (romosozumab) For The Treatment Of Osteoporosis In Postmenopausal Women At High Risk For Fracture,PR Newswire
Nov-30-18,Good News Is on the Way for Blood Cancer Patients,Barrons.com
Dec-03-18,Amgen To Present At The Citi Global Healthcare Conference,PR Newswire
Dec-03-18,Amgen Falls 3%,Investing.com
Dec-03-18,Could Amgen Incs (NASDAQ:AMGN) Investor Composition Influence The Stock Price?,Simply Wall St.
Dec-03-18,AbbVie Settles With Pfizer for Humira Biosimilar in U.S.,Zacks
Dec-03-18,FDA Committee to Review Amgen's (AMGN) Osteoporosis Candidate,Zacks
Dec-04-18,Amgen's BiTE Immunotherapies Show Promise in Early Studies,Zacks
Dec-04-18,"The Daily Biotech Pulse: ASH Presentations Take The Spotlight, Eiger Gets A New CFO",Benzinga
Dec-04-18,"Amgen antibody shows promise in myeloma trial, gets FDA fast track",Reuters
Dec-07-18,Amgen raises dividend by 10%,MarketWatch
Dec-07-18,Amgen Announces 10 Percent Increase In 2019 First Quarter Dividend,PR Newswire
Dec-07-18,Amgen Falls 3%,Investing.com
Dec-10-18,Amgen And Lazarex Cancer Foundation Team Up To Allow More Diversity In Clinical Trials,PR Newswire
Dec-10-18,"Amgen (AMGN) Continues to Reward Shareholders, Ups Dividend",Zacks
