date,title,source
Oct-17-18,T-Mobile to power US headquarters with renewable energy,CNBC
Oct-17-18,The iPhone XR is Coming to T-Mobile,Business Wire
Oct-17-18,Trade Up to a New Smartphone AND Unlimited at T-Mobile for just $40 a month!,Business Wire
Oct-17-18,Is Sprint Corporation a Buy?,Motley Fool
Oct-17-18,"Customers Bancorp suspends BankMobile deal, plans partnership with T-Mobile",American City Business Journals
Oct-17-18,T-Mobile to power US headquarters with renewable energy,CNBC
Oct-18-18,Crown Castle International Corp (CCI) Q3 2018 Earnings Conference Call Transcript,Motley Fool
Oct-18-18,Twilio and T-Mobile US Partner to Introduce Twilio Narrowband: the Nations First Developer Platform for Narrowband IoT,GlobeNewswire
Oct-18-18,"T-Mobile Achieves Record Customer Care Results, Hosts TEX Talks to Spread Its Revolutionary Care Model",Business Wire
Oct-19-18,"Metro by T-Mobile Presents Live in LA Featuring Cardi B and Kehlani, Powered by Pandora",Business Wire
Oct-22-18,T-Mobile CEO said he'd rather live in Kansas City than Bellevue,American City Business Journals
Oct-22-18,"Transcript: Sprint town hall featured story of merger talks, banter between Claure and Legere",American City Business Journals
Oct-23-18,"Verizon adds 295K phone subscribers, exceeds analyst expectations",American City Business Journals
Oct-23-18,5 Companies Hit 52-Week Highs,GuruFocus.com
Oct-23-18,T-Mobile Doubles Hurricane Recovery Donations During MLB World Series,Business Wire
Oct-24-18,"AT&T satellite TV numbers disappoint, shares fall",Reuters
Oct-24-18,"AT&T satellite TV numbers disappoint, shares fall",Reuters
Oct-24-18,Verizon Stock Proves Its the Real Deal Following Q3 Earnings,InvestorPlace
Oct-24-18,"AT&T misses profit estimates, shares fall",Reuters
Oct-25-18,Trump signs order to set U.S. spectrum strategy as 5G race looms,Reuters
Oct-25-18,Trump signs order to set U.S. spectrum strategy as 5G race looms,Reuters
Oct-26-18,Is a Surprise Coming for T-Mobile (TMUS) This Earnings Season?,Zacks
Oct-26-18,"T-Mobile to Host Q3 2018 Earnings Call on October 30, 2018",GlobeNewswire
Oct-29-18,"China's OnePlus, backed by Qualcomm and T-Mobile, launches smartphone in U.S",Reuters
Oct-29-18,"China's OnePlus, backed by Qualcomm and T-Mobile, launches smartphone in U.S",Reuters
Oct-29-18,T-Mobile + OnePlus 6T = Exclusive Soulmates,Business Wire
Oct-29-18,"New York attorney general amps up T-Mobile, Sprint investigation",American City Business Journals
Oct-29-18,T-Mobiles Hands-On Tech Experience Rolls Into New York,Business Wire
Oct-29-18,"China's OnePlus, backed by Qualcomm and T-Mobile, launches smartphone in U.S",Reuters
Oct-30-18,T-Mobile US Inc (TMUS) Q3 2018 Earnings Conference Call Transcript,Motley Fool
Oct-30-18,"T-Mobile President Talks Subscriber Growth, 5G Plans and Sprint Merger",Bloomberg
Oct-30-18,[$$] T-Mobile Reports Surge in New Customers,The Wall Street Journal
Oct-30-18,"T-Mobile exceeds expectations for phone subscribers, profit",Reuters
Oct-30-18,T-Mobile: 3Q Earnings Snapshot,Associated Press
Oct-30-18,"Stocks making the biggest moves after hours: Facebook, Electronic Arts, T-Mobile and more",CNBC
Oct-30-18,T-Mobile deliver strong 3Q earnings results,Fox Business Videos
Oct-30-18,"T-Mobile exceeds expectations for phone subscribers, profit",Reuters
Oct-30-18,T-Mobile beats phone subscriber estimates,Reuters
Oct-30-18,T-Mobile Delivers Its Best Financials Ever and Strong Customer Growth in Q3,Business Wire
Oct-30-18,3 Best Wireless Stocks to Buy for the 5G Rollout,InvestorPlace
Oct-30-18,Analysts bump up odds T-Mobile/Sprint merger will happen,American City Business Journals
Oct-31-18,"T-Mobiles Stock Is a Winner, With or Without Sprint",Barrons.com
Oct-31-18,Edited Transcript of TMUS earnings conference call or presentation 30-Oct-18 8:30pm GMT,Thomson Reuters StreetEvents
Oct-31-18,Can Apple Stock Build Its New Empire on Services?,InvestorPlace
Oct-31-18,Why Sprint Stock Jumped Today,Motley Fool
Oct-31-18,"Sprint, T-Mobile Surge as Executives Express Optimism for Merger",Bloomberg
Oct-31-18,"Stocks Surging After Earnings Today: GM, S, HSC",Zacks
Oct-31-18,T-Mobile receives shareholder approval for Sprint merger plans,American City Business Journals
Oct-31-18,"Sprint beats revenue and profit forecasts, shares rise",Reuters
Oct-31-18,Sprint Earnings: Trick or Treat?,Bloomberg
Oct-31-18,"T-Mobile, Sprint receive shareholder approval for merger plans",American City Business Journals
Oct-31-18,"Sprint beats revenue and profit forecasts, shares rise",Reuters
Oct-31-18,Sprint net subscriber additions blow past estimates,Reuters
Oct-31-18,"Stocks making the biggest move premarket: GM, ANTM, CLX, EL & more",CNBC
Oct-31-18,[$$] Stocks to Watch,The Wall Street Journal
Oct-31-18,T-Mobile Receives Shareholder Approval for Combination with Sprint,Business Wire
