date,title,source
Oct-23-18,B&G Foods (BGS) Q3 Earnings Preview: What to Expect,Zacks
Oct-25-18,B&G Foods (BGS) Q3 Earnings: Factors Shaping the Outcome,Zacks
Oct-30-18,B&G Foods (BGS) Lags Q3 Earnings and Revenue Estimates,Zacks
Oct-30-18,B&G Foods: 3Q Earnings Snapshot,Associated Press
Oct-30-18,B&G Foods Reports Financial Results for Third Quarter 2018,Business Wire
Oct-31-18,B&G Foods (BGS) Trims Outlook on Q3 Earnings & Sales Miss,Zacks
Oct-31-18,Edited Transcript of BGS earnings conference call or presentation 30-Oct-18 8:30pm GMT,Thomson Reuters StreetEvents
Nov-01-18,B&G Foods Declares Regular Quarterly Dividend,Business Wire
Nov-02-18,"Report: Developing Opportunities within Central Garden & Pet, B&G Foods, STAAR Surgical, Forrester Research, QTS Realty Trust, and MCBC  Future Expectations, Projections Moving into 2018",GlobeNewswire
Nov-05-18,Edited Transcript of BGS earnings conference call or presentation 30-Oct-18 8:30pm GMT,Thomson Reuters StreetEvents
Nov-06-18,How U.S. Silica Holdings Inc (SLCA) Stacks Up Against Its Market Cap Peers,Insider Monkey
Nov-07-18,"B&G Foods, Inc. -- Moody's affirms B&G Foods' B1 CFR; upgrades sr. secured first lien revolver",Moody's
Nov-16-18,3 Top Stocks That Aren't on Wall Street's Radar,Motley Fool
Nov-20-18,Is B&G Foods Incs (NYSE:BGS) CEO Paid Enough Relative To Peers?,Simply Wall St.
Dec-13-18,Here's Why Investors Should Avoid B&G Foods (BGS) Stock,Zacks
Dec-18-18,"An Intrinsic Calculation For B&G Foods, Inc. (NYSE:BGS) Shows Its 46.41% Undervalued",Simply Wall St.
Jan-07-19,"Kraft and Other Packaged-Food Stocks Arent a Safe Haven Anymore, Analyst Says",Barrons.com
Jan-08-19,"B&G Foods Up 8% in 3 Months, Strong Brands a Key Catalyst",Zacks
Jan-11-19,"Did B&G Foods, Inc. (NYSE:BGS) Insiders Sell Shares?",Simply Wall St.
Jan-14-19,B&G Foods Announces Tax Treatment of Common Stock Dividends Paid in 2018,Business Wire
Jan-18-19,"Ferrero, Hostess, B&G Foods bid on Kellogg's Keebler and Famous Amos cookie business",CNBC
Jan-22-19,Top Picks 2019- BG Foods BGS,MoneyShow
Jan-24-19,Hershey (HSY) Q4 Earnings to Gain on Buyouts &amp; Savings Plans,Zacks
Jan-29-19,B&G Foods CEO Bob Cantwell Announces Plan to Retire in April,Business Wire
Feb-05-19,"B&G Foods, Inc. (NYSE:BGS): Commentary On Fundamentals",Simply Wall St.
Feb-06-19,B&G Foods Announces Fourth Quarter and Fiscal Year 2018 Earnings Conference Call,Business Wire
Feb-19-19,Will Escalated Costs Mar B&amp;G Foods' (BGS) Earnings in Q4?,Zacks
Feb-26-19,B&G Foods Announces Leadership Appointments,Business Wire
Feb-26-19,B&G Foods Reports Financial Results for Fourth Quarter and Full Year 2018,Business Wire
Feb-27-19,Edited Transcript of BGS earnings conference call or presentation 26-Feb-19 9:30pm GMT,Thomson Reuters StreetEvents
Feb-27-19,"B&amp;G Foods (BGS) Q4 Earnings &amp; Sales Lag Estimates, Stock Down",Zacks
Feb-27-19,B & G Foods (BGS) Q4 2018 Earnings Conference Call Transcript,Motley Fool
Feb-28-19,Edited Transcript of BGS earnings conference call or presentation 26-Feb-19 9:30pm GMT,Thomson Reuters StreetEvents
Mar-01-19,Edited Transcript of BGS earnings conference call or presentation 26-Feb-19 9:30pm GMT,Thomson Reuters StreetEvents
Mar-04-19,"Report: Exploring Fundamental Drivers Behind Stericycle, B&G Foods, QTS Realty Trust, Trimble, Electronics for Imaging, and Bio-Techne  New Horizons, Emerging Trends, and Upcoming Developments",GlobeNewswire
Mar-05-19,Risk-Reward With B&G Foods,GuruFocus.com
Mar-06-19,6 Companies Paying High Dividend Yields,GuruFocus.com
Mar-06-19,"Is B&G Foods, Inc. (NYSE:BGS) Creating Value For Shareholders?",Simply Wall St.
Mar-11-19,Hershey's Portfolio Strength Drives Growth Amid Cost Woes,Zacks
Mar-12-19,New Strong Sell Stocks for March 12th,Zacks
Mar-13-19,Board of Directors of B&G Foods Authorizes Extension of Stock Repurchase Program to March 2020,Business Wire
Mar-14-19,B&amp;G Foods Extends Buyback Plan: Can Efforts Revive the Stock?,Zacks
Mar-15-19,4 Stocks At Risk From The Global Merger Boom,Investopedia
Mar-18-19,"B&G Foods Announces that Bill Herbes, EVP of Operations, Plans to Retire in December 2019",Business Wire
Mar-28-19,Why Is B&amp;G Foods (BGS) Up 2.6% Since Last Earnings Report?,Zacks
Apr-03-19,"Why Dividend Hunters Love B&G Foods, Inc. (NYSE:BGS)",Simply Wall St.
Apr-17-19,Will Hershey (HSY) Q1 Earnings Beat Estimates Amid Cost Woes?,Zacks
Apr-25-19,B&G Foods Announces First Quarter 2019 Earnings Conference Call,Business Wire
Apr-29-19,Is Disappointment in Store for B&amp;G Foods (BGS) in Q1 Earnings?,Zacks
Apr-30-19,"Is B&G Foods, Inc. (BGS) A Good Stock To Buy ?",Insider Monkey
May-02-19,B&amp;G Foods (BGS) Q1 Earnings Miss Estimates,Zacks
May-02-19,B&G Foods: 1Q Earnings Snapshot,Associated Press
May-02-19,B&G Foods Reports Financial Results for First Quarter 2019,Business Wire
May-02-19,Did Changing Sentiment Drive B&G Foods's (NYSE:BGS) Share Price Down By 39%?,Simply Wall St.
May-03-19,B & G Foods (BGS) Q1 2019 Earnings Call Transcript,Motley Fool
May-03-19,"B&amp;G Foods (BGS) Q1 Earnings &amp; Sales Decline Y/Y, Stock Down",Zacks
May-06-19,"B&G Foods, Inc. -- Moody's announces completion of a periodic review of ratings of B&G Foods, Inc.",Moody's
May-09-19,Edited Transcript of BGS earnings conference call or presentation 2-May-19 8:30pm GMT,Thomson Reuters StreetEvents
May-15-19,B&G Foods Acquires Clabber Girl Corporation,Business Wire
May-16-19,"Final Trades: Twitter, Hess, B&G Foods, Constellium & Alibaba",CNBC Videos
