date,title,source
Oct-22-18,Is Six Flags Entertainment Corporation (NYSE:SIX) Expensive For A Reason? A Look At The Intrinsic Value,Simply Wall St.
Oct-23-18,What Does Six Flags Entertainment Corporations (NYSE:SIX) Share Price Indicate?,Simply Wall St.
Oct-23-18,Six Flags Entertainment Q3 Earnings Outlook,Benzinga
Oct-24-18,Edited Transcript of SIX earnings conference call or presentation 24-Oct-18 1:00pm GMT,Thomson Reuters StreetEvents
Oct-24-18,"Six Flags Is Sticking With Saudi Arabia, Even as Others Cut Ties",Bloomberg
Oct-24-18,"Why iRobot, Noodles & Co., and Six Flags Entertainment Slumped Today",Motley Fool
Oct-24-18,3 Stocks Decline on Wednesday,GuruFocus.com
Oct-24-18,More good news for San Antonios Fiesta Texas theme park parent company,American City Business Journals
Oct-24-18,Why Six Flags Entertainment Stock Just Crashed 14%,Motley Fool
Oct-24-18,Texas Instruments Hits Chips Midday; Disney Slumps,Investing.com
Oct-25-18,Edited Transcript of SIX earnings conference call or presentation 24-Oct-18 1:00pm GMT,Thomson Reuters StreetEvents
Oct-25-18,Todays Research Reports on Stocks to Watch: XpresSpa and Six Flags,ACCESSWIRE
Oct-29-18,3 Big Yields That Got Bigger Last Week,Motley Fool
Oct-30-18,"Jim Cramer Weighs In On Marvell Technology, Cheniere Energy And More",Benzinga
Nov-07-18,"Why AMD, Micron, Diplomat Pharmacy, and More Are Trending",Insider Monkey
Nov-07-18,"It's back! SeaWorld, Six Flags buyout rumor resurfaces",American City Business Journals
Nov-07-18,3 Reasons Why Six Flags Isn't Buying SeaWorld,Motley Fool
Nov-09-18,Plans for SeaWorld-Evans Hotels project are scuttled,American City Business Journals
Nov-14-18,The Biggest and Brightest Holiday Event of the Year Opens at Six Flags Parks Nationwide,Business Wire
Nov-14-18,Dividend Increases for Eighth Consecutive Year at Six Flags,Business Wire
Nov-15-18,Six Flags Could Continue to Be a White Knuckle Ride for Longs,TheStreet.com
Nov-16-18,Six Flags Entertainment (SIX): Moving Average Crossover Alert,Zacks
Nov-21-18,Why SeaWorld Stock Popped 10% Today,Motley Fool
Dec-04-18,4 Stocks to Buy With Dividends Yielding More Than 4%,Motley Fool
Dec-12-18,Six Flags Entertainment Corp (SIX) Hedge Funds Are Snapping Up,Insider Monkey
Dec-13-18,"Market Trends Toward New Normal in DXC Technology, Patterson Companies, Lumentum, DSW, Agios Pharmaceuticals, and Six Flags Entertainment Corporation New  Emerging Consolidated Expectations, Analyst Ratings",GlobeNewswire
Dec-17-18,Sharp Friday Selloff Pulls Week Into the Red,Zacks
Dec-26-18,"Highlighted as Zacks Bull and Bear of the Day Twitter, Six Flags Entertainment, Popular, City Holding and First Financial Bankshares",Zacks
Dec-26-18,Bear of the Day: Six Flags (SIX),Zacks
Jan-04-19,Should You Be Tempted To Sell Six Flags Entertainment Corporation (NYSE:SIX) Because Of Its P/E Ratio?,Simply Wall St.
Jan-11-19,Traders mixed on Piper Jaffray's restaurant stocks list,CNBC Videos
Jan-17-19,3 Big Reasons to Buy Amusement Park Stocks in 2019,Motley Fool
Jan-24-19,Six Flags Hurricane Harbor Announces Largest Expansion in Park History,Business Wire
Jan-25-19,Six Flags Sets Date to Announce Fourth Quarter and Full Year 2018 Earnings,Business Wire
Feb-06-19,Six Flags Announces Quarterly Cash Dividend,Business Wire
Feb-07-19,Does Six Flags Entertainment Corporation (NYSE:SIX) Have A Place In Your Portfolio?,Simply Wall St.
Feb-07-19,Six Flags (SIX) Earnings Expected to Grow: What to Know Ahead of Next Week's Release,Zacks
Feb-07-19,Struggling Dubai amusement park abandons Six Flags expansion,Associated Press
Feb-07-19,Struggling Dubai amusement park abandons Six Flags expansion,Associated Press
Feb-12-19,Six Flags and Cedar Fair Have a Lot to Prove This Week,Motley Fool
Feb-12-19,Fiesta Texas boss to oversee Six Flags' Houston water park makeover,American City Business Journals
Feb-12-19,Six Flags Banner Flying High Over Three New Parks,Business Wire
Feb-12-19,"Exclusive: Six Flags unveils new name, other changes for SplashTown in Houston",American City Business Journals
Feb-13-19,Q4 Earnings Preview For Six Flags Entertainment,Benzinga
Feb-14-19,[$$] Six Flags Shares Fall as Company Delays New Parks in China,The Wall Street Journal
Feb-14-19,Cramer's lightning round: I didn't expect Six Flags to do that poorly,CNBC
Feb-14-19,Six Flags Entertainment Corp (SIX) Q4 2018 Earnings Conference Call Transcript,Motley Fool
Feb-14-19,"Why American International Group, CenturyLink, and Six Flags Entertainment Slumped Today",Motley Fool
Feb-14-19,[$$] Six Flags Shares Fall as Company Delays New Parks in China,The Wall Street Journal
Feb-14-19,Why Six Flags Entertainment's Shares Plunged 16.7% Today,Motley Fool
Feb-14-19,Fiesta Texas parent cashing in on 2018 revenue gains,American City Business Journals
Feb-14-19,Six Flags Earnings: SIX Stock Sinks Despite Q4 Beat,InvestorPlace
Feb-14-19,Six Flags CEO: Share price doesn't align with our record performance,CNBC Videos
Feb-14-19,Six Flags Sinks as Revenue Misses Estimates Because of 'Challenging' China,TheStreet.com
Feb-14-19,Six Flags (SIX) Q4 Earnings Surpass Estimates,Zacks
Feb-14-19,"Six Flags earnings beat by wide margin, but sales come up short",MarketWatch
Feb-14-19,Six Flags Takes Theme Park Stocks for a Midday Ride,Investing.com
Feb-14-19,Six Flags: 4Q Earnings Snapshot,Associated Press
Feb-14-19,Record Revenue for Ninth Consecutive Year at Six Flags,Business Wire
Feb-15-19,"Company News For Feb 15, 2019",Zacks
Feb-15-19,"Jim Cramer Shares His Thoughts On Six Flags, Zynga And More",Benzinga
Feb-20-19,Analysts: Patience is wearing thin for Six Flags; Saudi park plans may expand,American City Business Journals
Feb-20-19,"Six Flags Entertainment Corp (SIX) Files 10-K for the Fiscal Year Ended on December 31, 2018",GuruFocus.com
Mar-01-19,"Final trades: Six Flags, Alexion Pharma, Alphabet, American Express & the financials",CNBC Videos
Mar-01-19,"Detailed Research: Economic Perspectives on Xilinx, Activision Blizzard, International Business Machines, Digital Realty Trust, Six Flags Entertainment Corporation New, and INTL FCStone  What Drives Growth in Today's Competitive Landscape",GlobeNewswire
Mar-05-19,How Much Are Six Flags Entertainment Corporation (NYSE:SIX) Insiders Spending On Buying Shares?,Simply Wall St.
Mar-08-19,Six Flags CEO to retire in 2020,American City Business Journals
Mar-08-19,Six Flags on the hunt for new CEO,American City Business Journals
Mar-18-19,3 Surprising Stocks Hitting New Lows Last Week,Motley Fool
Mar-25-19,2 Recently Dinged Stocks Insiders Are Buying,TheStreet.com
Mar-26-19,Six Flags Entertainment Corporation -- Moody's assigns a Ba1 rating to Six Flags' new secured credit facility; outlook stable,Moody's
Mar-26-19,3 Top Dividend Stocks to Buy Right Now,Motley Fool
Apr-01-19,Six Flags Entertainment Corporation (NYSE:SIX): Should The Future Outlook Worry You?,Simply Wall St.
Apr-02-19,Frontier City Opens Saturday for 61st Season,Business Wire
Apr-03-19,New DC UNIVERSE Themed Area Coming to Six Flags Discovery Kingdom in 2019,Business Wire
Apr-04-19,Why Six Flags Entertainment Stock Lost 11% in March,Motley Fool
Apr-16-19,Analysts Estimate Six Flags (SIX) to Report a Decline in Earnings: What to Look Out for,Zacks
Apr-17-19,New Bank Credit Facility Increases Financial Flexibility for Six Flags,Business Wire
Apr-22-19,Were Hedge Funds Right About Souring On Six Flags Entertainment Corp (SIX)?,Insider Monkey
Apr-23-19,Six Flags: 1Q Earnings Snapshot,Associated Press
Apr-23-19,Six Flags Announces First Quarter 2019 Earnings,Business Wire
Apr-23-19,An Intrinsic Calculation For Six Flags Entertainment Corporation (NYSE:SIX) Suggests It's 23% Undervalued,Simply Wall St.
Apr-24-19,SIX FLAGS ENTERTAINMENT CORP (SIX) Q1 2019 Earnings Call Transcript,Motley Fool
Apr-24-19,Centerbridge Is Considering Options for Great Wolf Resorts,Bloomberg
Apr-24-19,Six Flags CEO Jim Reid-Anderson breaks down the company's earnings,CNBC Videos
Apr-25-19,Edited Transcript of SIX earnings conference call or presentation 24-Apr-19 1:00pm GMT,Thomson Reuters StreetEvents
Apr-25-19,"Jim Cramer Weighs In On Micron, Halliburton And More",Benzinga
May-01-19,Six Flags Announces Quarterly Cash Dividend,Business Wire
May-01-19,Six Flags Hosts 2nd Annual National Hiring Day,Business Wire
May-06-19,"Jim Cramer Gives His Opinion On Visa, Six Flags And More",Benzinga
May-06-19,Marylands First Floorless Coaster Debuts at Six Flags America,Business Wire
May-08-19,Six Flags to Present at Upcoming Investor Conferences,Business Wire
May-10-19,7 High-Yield Dividend Stocks With More to Give,Kiplinger
May-14-19,Did You Miss Six Flags Entertainment's (NYSE:SIX) 34% Share Price Gain?,Simply Wall St.
May-17-19,Frontier City Celebrates Grand Opening of Timber Town,Business Wire
May-17-19,New York States Tallest Thrill Ride Debuts at Six Flags Darien Lake,Business Wire
May-22-19,3 Top Dividend Stocks With Yields Over 5%,Motley Fool
May-23-19,Six Flags Over Georgia Unveils Tallest Swing Ride in the Southeast,Business Wire
May-24-19,Six Flags Invites Guests to Take the Plunge to Benefit Special Olympics,Business Wire
May-28-19,"West Coasts First 4D Roller Coaster, Batman: The Ride Opens at Six Flags Discovery Kingdom",Business Wire
May-28-19,Worlds Tallest Loop Coaster Opens at Six Flags Over Texas,Business Wire
May-29-19,Futuristic Thrill Ride Now Open at Six Flags New England,Business Wire
May-30-19,Highlights From Wedbush's Chat With Six Flags,Benzinga
May-31-19,SUPERGIRL: Sky Flyer Takes Off at Six Flags St. Louis,Business Wire
May-31-19,Six Flags Is Showing Some Subtle Signs of a Reversal,TheStreet.com
May-31-19,"Jim Cramer Gives His Opinion On Six Flags, Sunworks And More",Benzinga
Jun-10-19,3 High Forward-Yield Stocks for the Dividend Investor,GuruFocus.com
Jun-11-19,Why Six Flags Entertainment Corporations (NYSE:SIX) Return On Capital Employed Is Impressive,Simply Wall St.
Jun-12-19,Six Flags Great Adventure Now Powered by Solar Energy,Business Wire
Jun-13-19,Worlds Tallest Pendulum Ride Opens at Six Flags Great Adventure,Business Wire
Jun-19-19,Is Six Flags Entertainment Corp (SIX) A Good Stock To Buy ?,Insider Monkey
Jun-19-19,Six Flags Upgraded By Wedbush On 3 Positive Catalysts,Benzinga
