date,title,source
Oct-22-18,Is Six Flags Entertainment Corporation (NYSE:SIX) Expensive For A Reason? A Look At The Intrinsic Value,Simply Wall St.
Oct-23-18,What Does Six Flags Entertainment Corporations (NYSE:SIX) Share Price Indicate?,Simply Wall St.
Oct-23-18,Six Flags Entertainment Q3 Earnings Outlook,Benzinga
Oct-24-18,Edited Transcript of SIX earnings conference call or presentation 24-Oct-18 1:00pm GMT,Thomson Reuters StreetEvents
Oct-24-18,"Six Flags Is Sticking With Saudi Arabia, Even as Others Cut Ties",Bloomberg
Oct-24-18,"Why iRobot, Noodles & Co., and Six Flags Entertainment Slumped Today",Motley Fool
Oct-24-18,3 Stocks Decline on Wednesday,GuruFocus.com
Oct-24-18,More good news for San Antonios Fiesta Texas theme park parent company,American City Business Journals
Oct-24-18,Why Six Flags Entertainment Stock Just Crashed 14%,Motley Fool
Oct-24-18,Texas Instruments Hits Chips Midday; Disney Slumps,Investing.com
Oct-25-18,Edited Transcript of SIX earnings conference call or presentation 24-Oct-18 1:00pm GMT,Thomson Reuters StreetEvents
Oct-25-18,Todays Research Reports on Stocks to Watch: XpresSpa and Six Flags,ACCESSWIRE
Oct-29-18,3 Big Yields That Got Bigger Last Week,Motley Fool
Oct-30-18,"Jim Cramer Weighs In On Marvell Technology, Cheniere Energy And More",Benzinga
Nov-07-18,"Why AMD, Micron, Diplomat Pharmacy, and More Are Trending",Insider Monkey
Nov-07-18,"It's back! SeaWorld, Six Flags buyout rumor resurfaces",American City Business Journals
Nov-07-18,3 Reasons Why Six Flags Isn't Buying SeaWorld,Motley Fool
