date,title,source
Nov-13-18,Can AngioDynamics Inc (NASDAQ:ANGO) Improve Its Returns?,Simply Wall St.
Dec-10-18,"AngioDynamics to Report Fiscal 2019 Second Quarter Financial Results on January 4, 2019",Business Wire
Dec-19-18,"What Does AngioDynamics, Inc.s (NASDAQ:ANGO) P/E Ratio Tell You?",Simply Wall St.
Dec-20-18,AngioDynamics to Present at the J.P. Morgan Healthcare Conference,Business Wire
Dec-28-18,AngioDynamics (ANGO) Earnings Expected to Grow: What to Know Ahead of Next Week's Release,Zacks
Jan-04-19,Edited Transcript of ANGO earnings conference call or presentation 4-Jan-19 1:00pm GMT,Thomson Reuters StreetEvents
Jan-04-19,AngioDynamics (ANGO) Beats Q2 Earnings and Revenue Estimates,Zacks
Jan-04-19,AngioDynamics: Fiscal 2Q Earnings Snapshot,Associated Press
Jan-04-19,AngioDynamics Reports Fiscal 2019 Second Quarter Financial Results,Business Wire
Jan-07-19,AngioDynamics (ANGO) Q2 2019 Earnings Conference Call Transcript,Motley Fool
Jan-07-19,AngioDynamics (ANGO) Q2 Earnings Beat on Gains From NanoKnife,Zacks
Jan-07-19,Oncology business propels AngioDynamics to $91.5 million second quarter,American City Business Journals
Jan-14-19,Edited Transcript of ANGO earnings conference call or presentation 4-Jan-19 1:00pm GMT,Thomson Reuters StreetEvents
Jan-18-19,Here's Why Investors Should Hold AngioDynamics (ANGO) Now,Zacks
Jan-23-19,"Accuray's (ARAY) Q2 Loss Narrows, Radixact Demand Shoots Up",Zacks
Jan-23-19,"CONMED (CNMD) Q4 Earnings Match Estimates, Revenues Beat",Zacks
Jan-25-19,"Estimating The Fair Value Of AngioDynamics, Inc. (NASDAQ:ANGO)",Simply Wall St.
Jan-25-19,"Intuitive Surgical (ISRG) Earnings Miss, Revenues Beat in Q4",Zacks
Jan-28-19,Hill-Rom's (HRC) Earnings and Revenues Top Estimates in Q1,Zacks
Jan-30-19,Thermo Fisher (TMO) Beats on Earnings and Revenues in Q4,Zacks
Jan-30-19,Align Technology (ALGN) Beats on Earnings and Revenues in Q4,Zacks
Jan-30-19,Varian Strong on Global Expansion and Proton Therapy Arm,Zacks
Jan-30-19,"Stryker (SYK) Q4 Earnings Beat, International Revenues Surge",Zacks
Jan-30-19,"New Research Coverage Highlights Heron Therapeutics, IDACORP, Star Bulk Carriers, AngioDynamics, Marinus Pharmaceuticals, and Advaxis  Consolidated Revenues, Company Growth, and Expectations for 2019",GlobeNewswire
Jan-31-19,"Hologic's (HOLX) Q1 Earnings Beat Estimates, Guidance Raised",Zacks
Jan-31-19,"Surmodics (SRDX) Q1 Earnings &amp; Revenues Beat, Guidance Solid",Zacks
Jan-31-19,"AmerisourceBergen (ABC) Beats on Q1 Earnings, Trims EPS View",Zacks
Jan-31-19,"Baxter's (BAX) Earnings, Revenues Beat Estimates in Q4",Zacks
Feb-01-19,"IDEXX (IDXX) Q4 Earnings Top Estimates, Raises '19 EPS View",Zacks
Feb-01-19,"PerkinElmer (PKI) Q4 Earnings Beat, Diagnostics Grows Y/Y",Zacks
Feb-01-19,"McKesson (MCK) Beats on Q3 Earnings, Gains From Solid View",Zacks
Feb-01-19,"Cardiovascular Systems (CSII) Q2 Earnings Top, Revenues Meet",Zacks
Feb-01-19,"Zimmer Biomet (ZBH) Q4 Earnings Meet Estimates, Revenues Top",Zacks
Feb-01-19,"Edwards Lifesciences (EW) Q4 Earnings In Line, Revenues Top",Zacks
Feb-01-19,"ABIOMED (ABMD) Q3 Earnings Beat, Impella Maintains Momentum",Zacks
Feb-04-19,Omnicell Solid on Geographic Expansion Amid Stiff Competition,Zacks
Feb-05-19,"QIAGEN's (QGEN) Q4 Earnings In Line, Revenues Miss Mark",Zacks
Feb-05-19,"Becton, Dickinson (BDX) Q1 Earnings In Line With Estimates",Zacks
Feb-06-19,"Haemonetics (HAE) Earnings Top, Revenues Lag Estimates in Q3",Zacks
Feb-06-19,"Boston Scientific (BSX) Beats on Q4 Earnings, Margins Dip",Zacks
Feb-06-19,Myriad Genetics (MYGN) Q2 Earnings &amp; Revenues Miss Estimates,Zacks
Feb-06-19,"Cerner (CERN) Q4 Earnings Meet Estimates, Revenues Miss",Zacks
Feb-06-19,"Luminex (LMNX) Q4 Earnings Miss, 2019 Guidance Lacks Luster",Zacks
Feb-07-19,LabCorp's (LH) Q4 Earnings and Revenues Surpass Estimates,Zacks
Feb-07-19,"Cardinal Health (CAH) Beats on Q2 Earnings, Ups FY19 View",Zacks
Feb-08-19,"Phirbo (PAHC) Q2 Earnings Lag Estimates, Operating Margin Up",Zacks
Feb-08-19,"Omnicell (OMCL) Q4 Earnings Beat Estimates, Revenues Miss",Zacks
Feb-11-19,"IRADIMED (IRMD) Q4 Earnings Surpass Estimates, Margins Up",Zacks
Feb-12-19,"Bruker (BRKR) Q4 Earnings In Line, Margin Growth Strong",Zacks
Feb-12-19,"STERIS (STE) Q3 Earnings In Line, Revenues Beat Estimates",Zacks
Feb-13-19,"Medidata (MDSO) Q4 Earnings Beat, Revenues Miss Estimates",Zacks
Feb-14-19,"Quest Diagnostics (DGX) Q4 Earnings in Line, Margins Down",Zacks
Feb-14-19,"Bio-Techne (TECH) Q2 Earnings Beat, Gross Margin Declines",Zacks
Feb-14-19,DaVita (DVA) Q4 Earnings Beat and Revenues Miss Estimates,Zacks
Feb-15-19,Quidel (QDEL) Q4 Earnings and Revenues Surpass Estimates,Zacks
Feb-19-19,"Medtronic (MDT) Beats on Q3 Earnings, Gross Margin Down",Zacks
Feb-19-19,Ecolab (ECL) Earnings and Revenues Match Estimates in Q4,Zacks
Feb-20-19,"CVS Health's (CVS) Q4 Earnings Top Estimates, Margins Up",Zacks
Feb-20-19,"Henry Schein's (HSIC) Q4 Earnings Top, Revenues Lag Estimates",Zacks
Feb-21-19,"Genomic Health (GHDX) Q4 Earnings Beat Estimates, Margins Up",Zacks
Feb-22-19,"Allscripts (MDRX) Q4 Earnings Lag Estimates, Bookings Up Y/Y",Zacks
Feb-22-19,"Integer Holdings' (ITGR) Q4 Earnings Beat, '19 View Strong",Zacks
Feb-22-19,"NuVasive (NUVA) Q4 Earnings Beat Estimates, Margins Fall",Zacks
Feb-25-19,"DexCom's (DXCM) Q4 Earnings Beat, International Revenues Up",Zacks
Feb-25-19,"Chemed (CHE) Q4 Earnings Beat Estimates, Gross Margin Falls",Zacks
Feb-26-19,AngioDynamics to Present at the Barclays Global Healthcare Conference,Business Wire
Feb-26-19,"Teleflex (TFX) Q4 Earnings Miss Estimates, Margins Rise",Zacks
Feb-26-19,Integra's (IART) Q4 Earnings and Revenues Beat Estimates,Zacks
Feb-27-19,"Tandem (TNDM) Posts Earnings in Q4, Revenues Top Estimates",Zacks
Feb-27-19,Insulet (PODD) Beats Earnings and Revenue Estimates in Q4,Zacks
Feb-27-19,"Fresenius Medical (FMS) Earnings Beat, Revenues Miss in Q4",Zacks
Feb-27-19,"Masimo (MASI) Q4 Earnings and Revenues Beat, Guidance Solid",Zacks
Feb-28-19,Patterson Companies (PDCO) Earnings Match Estimates in Q3,Zacks
Feb-28-19,New Strong Buy Stocks for February 28th,Zacks
Feb-28-19,Amedisys (AMED) Tops Earnings and Revenue Estimates in Q4,Zacks
Feb-28-19,"Orthofix (OFIX) Earnings Beat Estimates in Q4, Margins Fall",Zacks
Mar-01-19,Bio-Rad (BIO) Earnings and Revenues Beat Estimates in Q4,Zacks
Mar-04-19,"Inogen (INGN) Q4 Earnings Beat Estimates, Rental Revenues Up",Zacks
Mar-04-19,"OPKO Health (OPK) Reports Loss in Q4, Misses on Revenues",Zacks
Mar-04-19,Penumbra (PEN) Earnings and Revenues Beat Estimates in Q4,Zacks
Mar-05-19,Here's Why You Should Invest in AngioDynamics Stock Now,Zacks
Mar-05-19,"HMS Holdings' (HMSY) Q4 Earnings Beat, Revenues Rise Y/Y",Zacks
Mar-05-19,"PRA Health's (PRAH) Q4 Earnings Top, Revenues Lag Estimates",Zacks
Mar-06-19,"Cooper Companies' (COO) Q1 Earnings Beat, Revenues Rise Y/Y",Zacks
Mar-06-19,"GNC Holdings' (GNC) Q4 Earnings Miss Estimates, Margins Fall",Zacks
Mar-08-19,AngioDynamics Wins Patent Infringement Dispute With Bard,Business Wire
Mar-08-19,"AMN Healthcare (AMN) Q4 Earnings Top, Revenues Lag Estimates",Zacks
Mar-11-19,The AngioDynamics (NASDAQ:ANGO) Share Price Has Gained 88% And Shareholders Are Hoping For More,Simply Wall St.
Mar-12-19,"AngioDynamics to Report Fiscal 2019 Third Quarter Financial Results on April 2, 2019",Business Wire
Mar-12-19,"Avanos (AVNS) Q4 Earnings Beat, Revenues Miss, Shares Down",Zacks
Mar-26-19,Analysts Estimate AngioDynamics (ANGO) to Report a Decline in Earnings: What to Look Out for,Zacks
Apr-01-19,AngioDynamics to Present at the Needham Healthcare Conference,Business Wire
Apr-02-19,Edited Transcript of ANGO earnings conference call or presentation 2-Apr-19 12:00pm GMT,Thomson Reuters StreetEvents
Apr-02-19,AngioDynamics Gets FDA Nod to Begin NanoKnife DIRECT Study,Zacks
Apr-02-19,AngioDynamics (ANGO) Lags Q3 Earnings and Revenue Estimates,Zacks
Apr-02-19,AngioDynamics: Fiscal 3Q Earnings Snapshot,Associated Press
Apr-02-19,AngioDynamics Reports Fiscal 2019 Third Quarter Financial Results,Business Wire
Apr-02-19,"AngioDynamics, Inc. to Host Earnings Call",ACCESSWIRE
Apr-03-19,AngioDynamics' (ANGO) Q3 Earnings &amp; Revenues Lag Estimates,Zacks
Apr-08-19,Edited Transcript of ANGO earnings conference call or presentation 2-Apr-19 12:00pm GMT,Thomson Reuters StreetEvents
Apr-09-19,Edited Transcript of ANGO earnings conference call or presentation 2-Apr-19 12:00pm GMT,Thomson Reuters StreetEvents
Apr-10-19,Edited Transcript of ANGO earnings conference call or presentation 2-Apr-19 12:00pm GMT,Thomson Reuters StreetEvents
Apr-18-19,"The Daily Biotech Pulse: Hookipa To Debut, Mustang Bio Skyrockets, AngioDynamics Sheds Portfolio",Benzinga
May-02-19,Why Is AngioDynamics (ANGO) Down 12.1% Since Last Earnings Report?,Zacks
May-09-19,"Heres What Hedge Funds Think About AngioDynamics, Inc. (ANGO)",Insider Monkey
May-23-19,AngioDynamics IDE Application for NanoKnife Gets FDA Nod,Zacks
May-28-19,AngioDynamics to Ring NASDAQ Closing Bell to Celebrate the 15th Anniversary of its Listing on the Exchange,Business Wire
Jun-04-19,AngioDynamics to Present at the Raymond James Life Sciences and MedTech Conference,Business Wire
Jun-05-19,AngioDynamics Divests NAMIC Portfolio to Medline Industries,Zacks
Jun-06-19,AngioDynamics moving 125 employees into downtown Glens Falls,American City Business Journals
