date,title,source
Oct-17-18,These entertainment firms plan to work in Orlando despite lack of state film incentives,American City Business Journals
Oct-17-18,"Will Amazon, Facebook, Twitter spend to acquire sports programming rights?",American City Business Journals
Oct-17-18,"Tastemade raises $35M for lifestyle videos from Amazon, other investors",American City Business Journals
Oct-18-18,Comcast says its fastest internet reaches more U.S. homes than any other provider,Reuters
Oct-18-18,Internet provider groups sue Vermont over net neutrality law,Reuters
Oct-18-18,Comcast (CMCSA) Stock Moves -1.26%: What You Should Know,Zacks
Oct-18-18,Internet provider groups sue Vermont over net neutrality law,Reuters
Oct-18-18,Comcast Now Nations Largest Provider of Gigabit Internet,Business Wire
Oct-18-18,Comcast says its fastest internet reaches more U.S. homes than any other provider,Reuters
Oct-18-18,Comcast's Forecast Lowered at Nomura on Concerns About Theme Park Weakness,TheStreet.com
Oct-18-18,Comcast Technology Center is now open. Here's the story behind its world-class art.,American City Business Journals
Oct-18-18,iPhone XR Arrives at Xfinity Mobile on October 26,Business Wire
Oct-19-18,Cramer's game plan: Companies tied to China or the Fed are 'guilty until proven innocent',CNBC
Oct-19-18,Main Line software company forms strategic partnership with Golf Channel,American City Business Journals
Oct-19-18,The 1 Netflix Number That Matters: 7 Million,Motley Fool
Oct-19-18,"Netflix Keeps Surging, IBM Stops Surging",Motley Fool
Oct-22-18,"Fandango dances onto 5,000 more screens in Latin America",American City Business Journals
Oct-22-18,Comcast (CMCSA) Set to Report Q3 Earnings: What's in Store?,Zacks
Oct-22-18,Comcast NBCUniversal Supports Hurricane Michael Relief Efforts in Florida,PR Newswire
Oct-22-18,Universal threatens box-office records with Halloween,American City Business Journals
Oct-22-18,"AT&T, Comcast Investors Seek Clues That Deals Will Pay Off",Bloomberg
Oct-22-18,Comcast Announces Time Change for Conference Call to Discuss Third Quarter 2018 Earnings and Acquisition of Sky,Business Wire
Oct-22-18,Buy Disney Stock as It Breaks out to New All-Time Highs,InvestorPlace
Oct-23-18,AT&T and Comcast earnings: What to watch for this week,MarketWatch
Oct-23-18,Liberty Property Trust (LPT) Q3 2018 Earnings Conference Call Transcript,Motley Fool
Oct-23-18,Hulu sees Starz,American City Business Journals
Oct-23-18,'Halloween' scores big box office win for Jamie Lee Curtis,American City Business Journals
Oct-24-18,Day Ahead: Top 3 Things to Watch,Investing.com
Oct-24-18,Comcast Falls 3%,Investing.com
Oct-24-18,A Preview Of Comcast's Q3 Earnings,Benzinga
Oct-25-18,Asian shares mostly higher after US stocks surge on earnings,Associated Press
Oct-25-18,[$$] Comcast Profit Rises as It Looks Beyond U.S. for Growth,The Wall Street Journal
Oct-25-18,Wall Street Advances on Thursday,GuruFocus.com
Oct-25-18,Edited Transcript of CMCSA earnings conference call or presentation 25-Oct-18 12:00pm GMT,Thomson Reuters StreetEvents
Oct-25-18,Dow Closes 400 Points Higher as Wall Street Rebounds on Earnings,TheStreet.com
Oct-25-18,Risk-Reward With Comcast,GuruFocus.com
Oct-25-18,"Comcast Stock Rises As Earnings Beat, Broadband Growth Continues",Investor's Business Daily
Oct-25-18,Megyn Kelly reportedly out at NBC,American City Business Journals
Oct-25-18,Strong Earnings Inspire Stock Rebound: Will Amazon Follow Suit?,Zacks
Oct-25-18,Comcast Stock Gets a Boost by Q3 Earnings Beat,InvestorPlace
Oct-25-18,"[$$] Comcast Clears Bar, Looks to Sky",The Wall Street Journal
Oct-25-18,Comcast Rises 5%,Investing.com
Oct-25-18,"Comcast (CMCSA) Q3 Earnings Beat, Internet Subscribers Up Y/Y",Zacks
Oct-25-18,"Thriving in U.S., Comcast Pitches Investors on European Plans",Bloomberg
Oct-25-18,Fox's new OTT streaming service will launch in November,MarketWatch
Oct-25-18,High-speed data boom drives Comcast profit beat,Reuters
Oct-25-18,"Stocks - Tesla, Twitter Soar in Pre-market; AMD Crashes; Microsoft, Ford Gain",Investing.com
Oct-25-18,Comcast Tops Q3 Earnings Forecast After $40 Billion Sky Deal,TheStreet.com
Oct-25-18,Top 3 Companies Owned by Comcast (CMCSA),Investopedia
Oct-25-18,"Comcast Stock Rises After Earnings, Revenue beat in Q3",Investing.com
Oct-25-18,"Venom, Halloween Set Holiday Mood: Box Office to Hit Record",Zacks
Oct-25-18,Comcast Corp.'s Universal theme parks see dip in 3Q due to overseas biz,American City Business Journals
Oct-25-18,High-speed data boom drives Comcast profit beat,Reuters
Oct-25-18,"Stocks making the biggest move premarket: CMCSA, TWTR, BMY, SWK, LUV & more",CNBC
Oct-25-18,Comcast (CMCSA) Surpasses Q3 Earnings and Revenue Estimates,Zacks
Oct-25-18,Comcast shares surge 4.6% in premarket trade after earnings beat,MarketWatch
Oct-25-18,[$$] Comcast Profit Rises as It Looks Beyond U.S. for Growth,The Wall Street Journal
Oct-25-18,Roberts: Thrilled with Q3 performance,CNBC Videos
Oct-25-18,Roberts: Sky adds to our successful formula,CNBC Videos
Oct-25-18,Roberts: Comcast core business has great momentum,CNBC Videos
Oct-25-18,High-speed data boom drives Comcast profit beat,Reuters
Oct-25-18,Comcast: 3Q Earnings Snapshot,Associated Press
Oct-25-18,Comcast 3Q net income rises on more internet customers,Associated Press
Oct-25-18,Comcast Declares Quarterly Dividend,Business Wire
Oct-25-18,[$$] Comcast ekes out quarterly profit despite more cord cutting,Financial Times
Oct-25-18,Comcast Reports 3rd Quarter 2018 Results,Business Wire
Oct-25-18,Comcast earnings beat Wall Street expectations,CNBC Videos
Oct-25-18,Comcast beats on top and bottom lines,CNBC
Oct-26-18,Comcast Corp. Earnings: Blue Skies Ahead,Motley Fool
Oct-26-18,California will not enforce state net neutrality law pending appeal,Reuters
Oct-26-18,Rupert Murdoch could buy Fox regional sports networks back from Disney at a discount of billions,CNBC
Oct-26-18,Lawyer: Megyn Kelly to remain at NBC for now despite losing show,American City Business Journals
Oct-26-18,NBC says 'Megyn Kelly Today' not returning to the air,Reuters
Oct-26-18,"'Megyn Kelly Today' will not be returning to NBC, network says",MarketWatch
Oct-26-18,NBC says 'Megyn Kelly Today' not returning to the air,Reuters
Oct-26-18,Credit Suisse Upgrades 'Well-Positioned' Comcast After Q3 Beat,Benzinga
Oct-26-18,"Company News For Oct 26, 2018",Zacks
Oct-26-18,Charter signs up more internet subscribers than expected,Reuters
Oct-26-18,Edited Transcript of CMCSA earnings conference call or presentation 25-Oct-18 12:00pm GMT,Thomson Reuters StreetEvents
Oct-26-18,Asian shares mostly lower despite US markets rally,Associated Press
Oct-29-18,Harmonic Inc (HLIT) Q3 2018 Earnings Conference Call Transcript,Motley Fool
Oct-29-18,Comcast Rises 3%,Investing.com
Oct-29-18,Happy Halloween: Universals horror flick pushes October to record box office,American City Business Journals
Oct-29-18,"Breaking: Universal Orlando I-Drive plans lay out infrastructure, road work of future expansion",American City Business Journals
Oct-29-18,Mega Rock Radio Stays Tuned to Customer and Business Needs with Comcast Business Services,PR Newswire
Oct-29-18,Movie Review: 'First Man' is worse than a bore,American City Business Journals
Oct-30-18,World Series ratings sharply down from last year,Associated Press
Oct-30-18,Disney World's Top Foe Is Ready to Punch Back,Motley Fool
Oct-30-18,Hulu nabs YouTube executive to head content partnerships,American City Business Journals
Oct-30-18,Comcast Rises 3%,Investing.com
Oct-30-18,Bears bet on energy and biotech,CNBC Videos
Oct-30-18,Port Houston Sets Sail with Comcast Business for its Network Connectivity Needs,Business Wire
Oct-31-18,"Hulu adds Spanish-language, entertainment tiers to live TV offering",American City Business Journals
Oct-31-18,Insight: Musk shakes up SpaceX in race to make satellite launch window - sources,Reuters
Oct-31-18,Musk shakes up SpaceX in race to make satellite launch window - sources,Reuters
Oct-31-18,"Top Research Reports for Comcast, ConocoPhillips & Delta Air Lines",Zacks
Oct-31-18,"Roku Stock Is Down Big, But Its Still a Risky Trade",InvestorPlace
Oct-31-18,CMCSA or RCI: Which Is the Better Value Stock Right Now?,Zacks
Oct-31-18,"Factors of Influence in 2018, Key Indicators and Opportunity within Gentex, Duke Realty, Tenneco, Jacobs Engineering Group, Comcast, and Rollins  New Research Emphasizes Economic Growth",GlobeNewswire
Nov-01-18,NBCUniversal to lay off 50 in ad sales,American City Business Journals
Nov-01-18,Should You Buy Disney (DIS) Stock Ahead of Q4 Earnings?,Zacks
Nov-01-18,Insight: Musk shakes up SpaceX in race to make satellite launch window - sources,Reuters
Nov-01-18,"Comcast to expand its military hiring pledge in Atlanta, U.S. by 11K",American City Business Journals
Nov-01-18,"Comcast NBCUniversal Expands Military Hiring Goal to 21,000 by 2021",Business Wire
Nov-01-18,Universal Orlando lays out plans for future I-Drive expansion,American City Business Journals
Nov-01-18,"The Zacks Analyst Blog Highlights: Comcast, ConocoPhillips, Delta Air Lines, ServiceNow and Zimmer Biomet",Zacks
Nov-05-18,"NBC, Fox and Facebook pull controversial Trump ad",American City Business Journals
Nov-05-18,U.S. regulator demands companies take action to halt 'robocalls',Reuters
Nov-05-18,U.S. Supreme Court ends fight over Obama-era net neutrality rules,Reuters
Nov-05-18,U.S. Supreme Court ends fight over Obama-era net neutrality rules,Reuters
Nov-05-18,"David Carlson Buys 3, Sells 2 in 3rd Quarter",GuruFocus.com
Nov-05-18,There Are Many Reasons to Like Comcast Stock,InvestorPlace
Nov-05-18,SeaWorld Entertainment's financials back on course,American City Business Journals
Nov-05-18,"With Its Chairman Scooping up Falling DISH Stock, Maybe Its Time to Buy",InvestorPlace
Nov-05-18,U.S. Supreme Court ends fight over Obama-era net neutrality rules,Reuters
Nov-06-18,Pro and college football games dominate the TV ratings,Associated Press
Nov-06-18,"New Universal tech may be for new Jurassic World, How to Train Your Dragon or Harry Potter rides",American City Business Journals
Nov-06-18,U.S. voters give verdict on Trump as control of Congress at stake,Reuters
Nov-06-18,[$$] Disney gains EU approval for Fox deal,Financial Times
Nov-07-18,Comcast plans to roll out new video-streaming device: source,Reuters
Nov-07-18,Comcast plans streaming box for broadband customers,CNBC Videos
Nov-07-18,Comcast is developing a video-streaming box for broadband-only customers,CNBC
Nov-07-18,Yacktman Fund Comments on Fox,GuruFocus.com
Nov-07-18,NBC Sports to gather motorsports properties for offseason summit,American City Business Journals
Nov-07-18,NFL Network celebrates 15th anniversary,American City Business Journals
Nov-07-18,Trump scorns GOP midterm losers who did not 'embrace' him,CNBC
Nov-07-18,"Trump calls CNN reporter a 'rude, terrible person' during explosive press conference",CNBC
Nov-07-18,"DISH Network (DISH) Q3 Earnings Beat, Subscriber Loss Rises",Zacks
Nov-07-18,[$$] ITV blames economic uncertainty for flat advertising sales,Financial Times
Nov-07-18,[$$] Comcast sets its sights on European pay-TV market,Financial Times
Nov-08-18,Roku Stock Dives As Streaming Video Platform Disappoints On Growth,Investor's Business Daily
Nov-08-18,"Discovery (DISCA) Q3 Earnings Decline, Revenues Rise Y/Y",Zacks
Nov-08-18,Is Now the Perfect Time to Buy Disney Stock?,InvestorPlace
Nov-08-18,Universal Orlando permit hints at ongoing work at former Terminator 2 attraction,American City Business Journals
Nov-08-18,Disney opens up bidding for 22 Fox-branded regional sports networks,American City Business Journals
Nov-08-18,Comcast Business Awarded Enterprise Application of the Year for Hospitality at MEF 2018,Business Wire
Nov-08-18,The Movie Studio Releases New Titles on Comcast XFINITY On Demand,GlobeNewswire
Nov-09-18,First On CNBC: CNBC Transcript: Disney CEO Bob Iger Speaks with CNBC's Julia Boorstin Today,CNBC
Nov-09-18,Disney Touts Fox Deal and Potential of Its Streaming Plans,TheStreet.com
Nov-09-18,Disney Stock Receives New Life After Tremendous Q4 Earnings,InvestorPlace
Nov-09-18,"A Big Bet on Tesla Stock Is Paying Off for ING. The GE Stake, Not So Much",Barrons.com
Nov-09-18,EU Commission seeks input on Disney pledges in pay-TV inquiry,Reuters
Nov-12-18,Cable group urges antitrust probe of Comcast and Trump tweets support,Reuters
Nov-12-18,Cable group urges antitrust probe of Comcast and Trump tweets support,Reuters
Nov-12-18,"Donald Trump Attacks Comcast on Twitter, Echoes Possible Antitrust Violations",TheStreet.com
Nov-12-18,Comcast Hosts Special Event in Portland to Help Close the Digital Divide for Low-Income Veterans,Business Wire
Nov-12-18,Comcast dips following Trump comments on antitrust probe,CNBC Videos
Nov-12-18,Trump quotes trade group saying Comcast violates antitrust law,MarketWatch
Nov-12-18,Comcast shares slip after Trump tweets about a call for antitrust investigation,CNBC
Nov-12-18,Comcast shares slip after Trump alleges company 'routinely violates antitrust laws',CNBC
Nov-12-18,Comcast accused of acting in an anti-competitive way: Gasparino,Fox Business Videos
Nov-12-18,See inside Universal Orlando's guest rooms at new Surfside Inn & Suites on I-Drive (PHOTOS),American City Business Journals
Nov-12-18,The Grinch makes a merry $66 million for Universal,American City Business Journals
Nov-12-18,Universal patent may use Harry Potter wands for theme park locker technology,American City Business Journals
Nov-13-18,DOJ's antitrust chief says Trump tweets 'don't affect our decisions' a day after Trump slams Comcast,CNBC
Nov-13-18,"U.S. antitrust chief says evidence, not tweets, drives decision-making",Reuters
Nov-13-18,Comcast Stock Is Probably Facing Too Many Severe Headwinds,InvestorPlace
Nov-13-18,"This Week in Comcast: Allegations in Trumps tweet without merit,' Comcast says",American City Business Journals
Nov-14-18,Who's going to buy the 22 Fox Sports regional sports networks up for sale?,American City Business Journals
Nov-14-18,Major League Baseball local streaming talks heat up,American City Business Journals
Nov-14-18,All signs point to the Cubs launching a regional sports network,American City Business Journals
Nov-14-18,"White House fires back at CNN lawsuit, claiming 'broad discretion' to yank reporter's press pass",CNBC
Nov-14-18,Comcast Gets a Surprising Dose of Green From Moviegoers,Motley Fool
Nov-14-18,"Liberty Media John Malone on Comcast, Verizon and Charte...",CNBC Videos
Nov-14-18,Disney Stock Is About to Get Its Magic Back in a Big Way,InvestorPlace
Nov-14-18,Want to hire veterans? Comcast's head of military affairs has some advice,American City Business Journals
Nov-15-18,Comcast NBCUniversal Contributes $1.1 Million in Cash and In-Kind Support for California Fire Relief Efforts,Business Wire
Nov-15-18,Comcast Announces Agreements with Two New African American Majority Owned Independent Networks,Business Wire
Nov-15-18,Comcasts New Security Camera Features Help Consumers Spot Package Theft Grinches This Holiday Season,Business Wire
Nov-15-18,Roku Stocks Setbacks Didnt Make Analysts Flinch,InvestorPlace
Nov-16-18,NVIDIA Corporation (NVDA) vs. Netflix Inc (NFLX): Here is What Hedge Funds Think,Insider Monkey
Nov-16-18,Judge orders Trump administration to restore CNN reporter Jim Acosta's White House press pass,CNBC
Nov-16-18,Jimmy Butler's first game produces 76ers highest TV ratings in 17 years,American City Business Journals
Nov-16-18,"Facebook Stock Is Battered, But At Least Its Still a Cloud Czar",InvestorPlace
Nov-19-18,In sync: Here's how Universal's film and theme parks divisions work together,American City Business Journals
Nov-20-18,[$$] Megyn Kelly Nears Deal to Leave NBC News With Entirety of $69 Million Contract,The Wall Street Journal
Nov-20-18,Megyn Kelly close to exit deal with NBC News,American City Business Journals
Nov-20-18,Universal patents another Jurassic World-style VR attraction,American City Business Journals
Nov-20-18,[$$] Megyn Kelly Nears Deal to Leave NBC News With Entirety of $69 Million Contract,The Wall Street Journal
Nov-20-18,Amazon's Bid for Disney's Sports Networks Could Help It Beat Netflix,Zacks
Nov-20-18,Comcast to Participate in UBS Investor Conference,Business Wire
Nov-20-18,Comcast Falls 3%,Investing.com
Nov-20-18,A Bidding War for the Fox Regional Sports Networks Is Another Win for Disney,Barrons.com
Nov-20-18,"Comcast Northeast Division Completes Solar System Installation To Power Manchester, NH Headquarters",PR Newswire
Nov-20-18,This Week in Comcast: Byron Allen's $20B lawsuit moves forward,American City Business Journals
Nov-21-18,NASCAR considering over-the-top streaming service,American City Business Journals
Nov-21-18,WLS-Channel 7 still leading pack in late local news ratings derby,American City Business Journals
Nov-21-18,Universal may be working on escape room attraction,American City Business Journals
Nov-21-18,4 Cable Stocks Wired for Gains,InvestorPlace
Nov-21-18,3 Stocks to Buy for the Cord-Cutting Trend,InvestorPlace
Nov-26-18,"Wreck-It Ralph, Creed punch Thanksgiving box office to record high",American City Business Journals
Nov-27-18,"[$$] Disney Consolidates Ad-Serving With Google, Ends Relationship With Comcasts Freewheel",The Wall Street Journal
Nov-27-18,"Comcast Awards More Than $300,000 in Grants to Community Partners in Florida",PR Newswire
Nov-27-18,Why Amazon is Ready to Spend Billions on Live Sports in the Streaming Age,Zacks
Nov-27-18,Disney taps Google for all of its digital ad sales,American City Business Journals
Nov-27-18,"[$$] Disney Consolidates Ad-Serving With Google, Ends Relationship With Comcast's Freewheel",The Wall Street Journal
Nov-27-18,Disney Stock Still Has an ESPN Problem,InvestorPlace
Nov-27-18,Higher-than-expected viewership of 'The Match' reportedly forces refunds,CNBC
Nov-27-18,Should You Invest in the Fidelity MSCI Consumer Discretionary Index ETF (FDIS)?,Zacks
Nov-27-18,This Week in Comcast: Will the Tiger v. Phil pay-per-view fiasco come at a cost?,American City Business Journals
Nov-29-18,NBC10 moves closer to Action News's world in November sweeps ratings,American City Business Journals
Nov-29-18,MLB commish expresses interest in Fox's regional sports channels,American City Business Journals
Nov-30-18,"Investing Insights: Tax-Managed Funds, Healthcare, and GM",Morningstar
Nov-30-18,Disney Just Gave Google a Big Advertising Win,Motley Fool
Nov-30-18,AT&T may sell its stake in Hulu as it prepares WarnerMedia streaming service,American City Business Journals
Nov-30-18,"Universal patent aims for cheaper, reliable way to direct ride cars",American City Business Journals
Dec-03-18,"Disney, Universal serve family-friendly Thanksgiving leftovers at weekend box office",American City Business Journals
Dec-03-18,Comcast Invests Nearly $2 Million to Serve Deer Park Residents and Businesses,Business Wire
Dec-04-18,Dodge & Cox's Top 5 Holdings as of the 3rd Quarter,GuruFocus.com
Dec-04-18,Victoria's Secret show tumbles to lowest ratings,Associated Press
Dec-04-18,Victoria's Secret show tumbles to lowest ratings,Associated Press
Dec-04-18,Does AT&T Stock Have More Room to Run?,InvestorPlace
Dec-04-18,Comcast Falls 3%,Investing.com
Dec-04-18,"Comcast to Provide Innovative Technologies for Homes, Businesses and Public Spaces Throughout Tesoro Viejo",Business Wire
Dec-04-18,Should You Invest in the First Trust Consumer Discretionary AlphaDEX Fund (FXD)?,Zacks
Dec-04-18,Lyft highlights Orlando's most traveled to destinations,American City Business Journals
Dec-04-18,Discovery Benefits From Portfolio Strength and Partnerships,Zacks
Dec-04-18,This Week in Comcast: Clashes with Disney come at all levels,American City Business Journals
Dec-06-18,Santa Rosa City Schools Partners with Comcast to Host Grand Opening Event for New Integrated Wellness Center Designed to Serve Families Impacted by the 2017 North Bay Wildfires,Business Wire
Dec-06-18,Which Cable Companies Are Best in Class?,Motley Fool
Dec-06-18,Can Broadband Keep Big Cable Afloat,Motley Fool
Dec-06-18,"Politics, race, music dominate diverse Golden Globe film nominations",Reuters
Dec-06-18,Pull-Back in Roku Stock Creates Welcome Entry Point for Investors,InvestorPlace
Dec-07-18,"[$$] Disney, Comcast to Account for Nearly 40% of Spending on U.S. Programming",The Wall Street Journal
Dec-07-18,"[$$] Disney, Comcast to Account for Nearly 40% of Spending on U.S. Programming",The Wall Street Journal
Dec-07-18,"Consolidated Research: 2018 Summary Expectations for Comcast, Avnet, NIKE, Helios and Matheson Analytics, Quest Diagnostics, and Nevsun Resources  Fundamental Analysis, Key Performance Indications",GlobeNewswire
Dec-10-18,Disneys Ralph leads slow pre-holiday box office,American City Business Journals
Dec-10-18,Comcast Opens Seven Interactive Xfinity Stores In New England In 2018,PR Newswire
Dec-10-18,"New Universal Orlando tech aims to smooth out rides, operations",American City Business Journals
Dec-11-18,Growing Bay Area Mental Health Nonprofit Counts on Comcast Business to Support Reliable Access to Resources and Patient Data,Business Wire
Dec-11-18,Disney's Box Office Results Boost Studio Entertainment Unit,Zacks
Dec-12-18,Comcast to Host Fourth Quarter and Full Year 2018 Earnings Conference Call,Business Wire
Dec-12-18,Musical 'A Star is Born' leads film contenders for SAG awards,Reuters
Dec-12-18,UPDATE 2-Musical 'A Star is Born' leads film contenders for SAG awards,Reuters
Dec-12-18,"Will Apple's Higher Content Budget Foil DIS, CMCSA '19 Plans?",Zacks
Dec-12-18,4 Media Stocks Ready to Continue Their Winning Streak in 2019,Zacks
Dec-12-18,"The Zacks Analyst Blog Highlights: Walt Disney, Comcast, PCM and Churchill Downs",Zacks
Dec-13-18,"Discovery Partners with European Tour, Expands Golf Coverage",Zacks
Dec-13-18,Netflix Could Lose 20% of Its Top Content as Soon as 2020,Motley Fool
Dec-13-18,This may be the name of Universal Orlando's rumored next theme park,American City Business Journals
Dec-13-18,"Netflix Better Watch Out, Better Not Shout!",TheStreet.com
Dec-13-18,U.S. Box Office Revenues Hit $11.1B: Can It Set a New Record?,Zacks
Dec-13-18,Poor Leadership Continues to Fail Snap Stock,InvestorPlace
Dec-14-18,Buy Twitter (TWTR) Stock as We Head into 2019?,Zacks
Dec-14-18,Comcast reportedly to spend big on Universal's theme park expansions,American City Business Journals
Dec-14-18,ESPN2 loses No. 2 position among sports nets for first time in 25 years,American City Business Journals
Dec-14-18,[$$] UK cycling dominance in doubt after Sky ends sponsorship,Financial Times
Dec-17-18,The Looming Spending War Doesnt Bode Well for Disney Stock,InvestorPlace
Dec-17-18,"The Zacks Analyst Blog Highlights: Comcast, American Express, Bristol-Myers, T-Mobile and General Motors",Zacks
Dec-18-18,Football dominates television viewing as holiday nears,Associated Press
Dec-18-18,Disney Stock Is a Sound Investment in an Unsound Market,InvestorPlace
Dec-18-18,NBC Chief Hints That Company May Unveil Netflix-Style Service,Bloomberg
Dec-18-18,"Hawks, Comcast boost State Farm Arena WiFi",American City Business Journals
Dec-18-18,NCC Media Names Deborah Josephs as Chief People Officer,PR Newswire
Dec-18-18,Atlanta Hawks and Comcast Business to Keep Fans Connected at the All-New State Farm Arena,Business Wire
Dec-18-18,Technology Partnership Delivers Premier Data Management Services to More Kansas City Businesses,Business Wire
Dec-19-18,Orange County accepts state funding toward $250M-$300M Kirkman Road expansion,American City Business Journals
Dec-20-18,Comcast Invests Nearly $6 Million in Washington State Nonprofits in 2018,Business Wire
Dec-20-18,Film studios and Sky offer to end anti-competitive movie deals,Reuters
Dec-20-18,"NBCUniversal, Sony Pictures, Warner Bros, Sky offer EU concessions",Reuters
Dec-21-18,Minnesota attorney general files fraud suit against Comcast,Associated Press
Dec-21-18,The Latest: Comcast says facts don't support Minnesota suit,Associated Press
Dec-21-18,Comcast Collaborates with Industry Partners on Blockgraph Software to Jumpstart the Use of Secure Data Sharing for Advanced TV Advertising,Business Wire
Dec-24-18,Universal Orlando shares insights into its new nighttime show,American City Business Journals
Dec-24-18,Women in Fintech: Leadership in the Next Big Growth Industry,Zacks
Dec-24-18,The most important tech stories of 2018  in tweets,CNBC
Dec-25-18,Is Netflix a Buy?,Motley Fool
Dec-26-18,Comcast Rises 3%,Investing.com
Dec-26-18,"Original content is key in 2019, says Albion Financial Gr...",CNBC Videos
Dec-27-18,Here's what it may cost to party on New Year's Eve at Universal Orlando,American City Business Journals
Dec-27-18,What Is Net Neutrality and Why Is It Important in 2019?,TheStreet.com
Dec-27-18,Universal patents tech for mimicking holographic displays,American City Business Journals
Dec-28-18,"Can T-Mobile's Threat to Disrupt Cable TV Hurt CMCSA, CHTR?",Zacks
Dec-28-18,"Feds won't revisit Comcast's NBCU merger, report says",American City Business Journals
Dec-28-18,4 Factors to Consider Before Investing in Netflix for 2019,Zacks
Dec-28-18,Walt Disney Stock Went Nowhere in 2018,Barrons.com
Dec-28-18,"This Year in Comcast: 2018 brought broadband gains, Sky & a new skyscraper",American City Business Journals
Dec-31-18,The 10 biggest box-office bombs of 2018,American City Business Journals
Dec-31-18,Inside the queue: Top theme park stories of 2018,American City Business Journals
Dec-31-18,'Alice' to 'Walking Dead': Productions filmed in Georgia in 2018,American City Business Journals
Dec-31-18,"Mondays Vital Data: Comcast, Amazon and Citigroup",InvestorPlace
