date,title,source
Oct-17-18,These entertainment firms plan to work in Orlando despite lack of state film incentives,American City Business Journals
Oct-17-18,"Will Amazon, Facebook, Twitter spend to acquire sports programming rights?",American City Business Journals
Oct-17-18,"Tastemade raises $35M for lifestyle videos from Amazon, other investors",American City Business Journals
Oct-18-18,Comcast says its fastest internet reaches more U.S. homes than any other provider,Reuters
Oct-18-18,Internet provider groups sue Vermont over net neutrality law,Reuters
Oct-18-18,Comcast (CMCSA) Stock Moves -1.26%: What You Should Know,Zacks
Oct-18-18,Internet provider groups sue Vermont over net neutrality law,Reuters
Oct-18-18,Comcast Now Nations Largest Provider of Gigabit Internet,Business Wire
Oct-18-18,Comcast says its fastest internet reaches more U.S. homes than any other provider,Reuters
Oct-18-18,Comcast's Forecast Lowered at Nomura on Concerns About Theme Park Weakness,TheStreet.com
Oct-18-18,Comcast Technology Center is now open. Here's the story behind its world-class art.,American City Business Journals
Oct-18-18,iPhone XR Arrives at Xfinity Mobile on October 26,Business Wire
Oct-19-18,Cramer's game plan: Companies tied to China or the Fed are 'guilty until proven innocent',CNBC
Oct-19-18,Main Line software company forms strategic partnership with Golf Channel,American City Business Journals
Oct-19-18,The 1 Netflix Number That Matters: 7 Million,Motley Fool
Oct-19-18,"Netflix Keeps Surging, IBM Stops Surging",Motley Fool
Oct-22-18,"Fandango dances onto 5,000 more screens in Latin America",American City Business Journals
Oct-22-18,Comcast (CMCSA) Set to Report Q3 Earnings: What's in Store?,Zacks
Oct-22-18,Comcast NBCUniversal Supports Hurricane Michael Relief Efforts in Florida,PR Newswire
Oct-22-18,Universal threatens box-office records with Halloween,American City Business Journals
Oct-22-18,"AT&T, Comcast Investors Seek Clues That Deals Will Pay Off",Bloomberg
Oct-22-18,Comcast Announces Time Change for Conference Call to Discuss Third Quarter 2018 Earnings and Acquisition of Sky,Business Wire
Oct-22-18,Buy Disney Stock as It Breaks out to New All-Time Highs,InvestorPlace
Oct-23-18,AT&T and Comcast earnings: What to watch for this week,MarketWatch
Oct-23-18,Liberty Property Trust (LPT) Q3 2018 Earnings Conference Call Transcript,Motley Fool
Oct-23-18,Hulu sees Starz,American City Business Journals
Oct-23-18,'Halloween' scores big box office win for Jamie Lee Curtis,American City Business Journals
Oct-24-18,Day Ahead: Top 3 Things to Watch,Investing.com
Oct-24-18,Comcast Falls 3%,Investing.com
Oct-24-18,A Preview Of Comcast's Q3 Earnings,Benzinga
Oct-25-18,Asian shares mostly higher after US stocks surge on earnings,Associated Press
Oct-25-18,[$$] Comcast Profit Rises as It Looks Beyond U.S. for Growth,The Wall Street Journal
Oct-25-18,Wall Street Advances on Thursday,GuruFocus.com
Oct-25-18,Edited Transcript of CMCSA earnings conference call or presentation 25-Oct-18 12:00pm GMT,Thomson Reuters StreetEvents
Oct-25-18,Dow Closes 400 Points Higher as Wall Street Rebounds on Earnings,TheStreet.com
Oct-25-18,Risk-Reward With Comcast,GuruFocus.com
Oct-25-18,"Comcast Stock Rises As Earnings Beat, Broadband Growth Continues",Investor's Business Daily
Oct-25-18,Megyn Kelly reportedly out at NBC,American City Business Journals
Oct-25-18,Strong Earnings Inspire Stock Rebound: Will Amazon Follow Suit?,Zacks
Oct-25-18,Comcast Stock Gets a Boost by Q3 Earnings Beat,InvestorPlace
Oct-25-18,"[$$] Comcast Clears Bar, Looks to Sky",The Wall Street Journal
Oct-25-18,Comcast Rises 5%,Investing.com
Oct-25-18,"Comcast (CMCSA) Q3 Earnings Beat, Internet Subscribers Up Y/Y",Zacks
Oct-25-18,"Thriving in U.S., Comcast Pitches Investors on European Plans",Bloomberg
Oct-25-18,Fox's new OTT streaming service will launch in November,MarketWatch
Oct-25-18,High-speed data boom drives Comcast profit beat,Reuters
Oct-25-18,"Stocks - Tesla, Twitter Soar in Pre-market; AMD Crashes; Microsoft, Ford Gain",Investing.com
Oct-25-18,Comcast Tops Q3 Earnings Forecast After $40 Billion Sky Deal,TheStreet.com
Oct-25-18,Top 3 Companies Owned by Comcast (CMCSA),Investopedia
Oct-25-18,"Comcast Stock Rises After Earnings, Revenue beat in Q3",Investing.com
Oct-25-18,"Venom, Halloween Set Holiday Mood: Box Office to Hit Record",Zacks
Oct-25-18,Comcast Corp.'s Universal theme parks see dip in 3Q due to overseas biz,American City Business Journals
Oct-25-18,High-speed data boom drives Comcast profit beat,Reuters
Oct-25-18,"Stocks making the biggest move premarket: CMCSA, TWTR, BMY, SWK, LUV & more",CNBC
Oct-25-18,Comcast (CMCSA) Surpasses Q3 Earnings and Revenue Estimates,Zacks
Oct-25-18,Comcast shares surge 4.6% in premarket trade after earnings beat,MarketWatch
Oct-25-18,[$$] Comcast Profit Rises as It Looks Beyond U.S. for Growth,The Wall Street Journal
Oct-25-18,Roberts: Thrilled with Q3 performance,CNBC Videos
Oct-25-18,Roberts: Sky adds to our successful formula,CNBC Videos
Oct-25-18,Roberts: Comcast core business has great momentum,CNBC Videos
Oct-25-18,High-speed data boom drives Comcast profit beat,Reuters
Oct-25-18,Comcast: 3Q Earnings Snapshot,Associated Press
Oct-25-18,Comcast 3Q net income rises on more internet customers,Associated Press
Oct-25-18,Comcast Declares Quarterly Dividend,Business Wire
Oct-25-18,[$$] Comcast ekes out quarterly profit despite more cord cutting,Financial Times
Oct-25-18,Comcast Reports 3rd Quarter 2018 Results,Business Wire
Oct-25-18,Comcast earnings beat Wall Street expectations,CNBC Videos
Oct-25-18,Comcast beats on top and bottom lines,CNBC
