date,title,source
Dec-31-18,Will the Dream Run for U.S. Box Office Continue in 2019?,Zacks
Dec-31-18,"The Zacks Analyst Blog Highlights: Netflix, AT&T, Disney, Apple and Comcast",Zacks
Jan-02-19,2018 Year-End Portfolio Review,GuruFocus.com
Jan-02-19,"AT&T Stock, Marvell, Disney Among Top Tech Picks As Akamai Downgraded",Investor's Business Daily
Jan-02-19,Comcast's NBC/Telemundo to pay $495K for bumping children's shows for live sports,American City Business Journals
Jan-02-19,State doles out $9M for projects designed to create jobs,American City Business Journals
Jan-02-19,The Fire Within Netflix Stock Still Burns Despite the Panic,InvestorPlace
Jan-02-19,"Stocks making the biggest moves premarket: ATVI, GOOGL, TSLA, WFC & more",CNBC
Jan-02-19,"Communication Services: Attractive, Sustainable Yields on Offer",Morningstar
Jan-03-19,Netflix's (NFLX) &quot;Bird Box&quot; Hits Record First Week Viewership,Zacks
Jan-03-19,Charter (CHTR) and Tribune Media's Price Negotiations Fail,Zacks
Jan-04-19,Comcast Rises 3%,Investing.com
Jan-07-19,Imax Enhanced movies to be available exclusively on FandangoNow in US,American City Business Journals
Jan-07-19,"Golden Globe TV audience slightly lower, but bucks awards show trend",Reuters
Jan-07-19,NFL Recap: Why Climbing TV Ratings Matter & Football's Gambling Future,Zacks
Jan-07-19,Golden Globes ratings a mixed bag,American City Business Journals
Jan-07-19,Golden Globe awards attracts 18.6 million TV viewers -NBC,Reuters
Jan-07-19,"Netflix Wins 5 Golden Globes, Roma Best Foreign Language Film",Zacks
Jan-07-19,"Applications Now Open for Comcast NBCUniversal LIFT Labs Accelerator, Powered by Techstars",Business Wire
Jan-07-19,Top Picks 2019- Comcast CMCSA,MoneyShow
Jan-07-19,[$$] Tile to embed trackers in range of consumer electronics,Financial Times
Jan-08-19,Watch CNBC's full interview with Hulu CEO Randy Freer,CNBC Videos
Jan-08-19,Hulu hits 25 million subscribers,American City Business Journals
Jan-08-19,NBCUniversal plans to slash primetime ad time by 20%,American City Business Journals
Jan-08-19,This Week in Comcast: Would you buy a security service for your Wi-Fi?,American City Business Journals
Jan-08-19,Comcast Launches Digital Security Service to Protect WiFi Connected Devices in the Home,Business Wire
Jan-08-19,"Hulu reaches 25 million subscribers, up 48 percent year-o...",CNBC Videos
Jan-08-19,'Today' readies lineup for show's third hour,American City Business Journals
Jan-08-19,"The Zacks Analyst Blog Highlights: Netflix, Comcast, Townsquare Media and Discovery",Zacks
Jan-08-19,"Intel (INTC) at CES 2019: Xeon CPUs, AI-Chip & Alliances",Zacks
Jan-08-19,Eagles Postgame Live earns biggest TV ratings in more than 8 years,American City Business Journals
Jan-09-19,DreamWorks Animation names new president,American City Business Journals
Jan-09-19,Why Comcast Stock Fell 12.7% in December,Motley Fool
Jan-09-19,Why Comcast (CMCSA) is Poised to Beat Earnings Estimates Again,Zacks
Jan-10-19,"Despite Some Risks, Analysts Still Expecting Double Digit Growth From Communications Services In Q4",Benzinga
Jan-10-19,Can Disney (DIS) and Hulu Reduce Netflix's Dominance in 2019?,Zacks
Jan-10-19,Should Netflix Stock Watchers Worry About Hulu? Yep.,InvestorPlace
Jan-11-19,TEGNA (TGNA) and ABC Extend Multi-Year Affiliate Agreement,Zacks
Jan-11-19,Is There an Upside Surprise Coming for Facebook Stock?,InvestorPlace
Jan-11-19,Work on Universal's rumored Harry Potter ride upgrades underway,American City Business Journals
Jan-11-19,Comcast Launches Xfinity xFi Advanced for Connected Devices,Zacks
Jan-11-19,Fox says no plans to bid for sports networks Disney may sell,Reuters
Jan-11-19,What business leaders say Maryland should learn after losing out on Amazon HQ2,American City Business Journals
Jan-14-19,NBCUniversal to launch ad-supported streaming service in 2020,MarketWatch
Jan-14-19,[$$] NBCUniversal to Launch Own Streaming Service,The Wall Street Journal
Jan-14-19,NBCUniversal to launch streaming service in 2020,Reuters
Jan-14-19,[$$] NBCUniversal to Launch Streaming Service,The Wall Street Journal
Jan-14-19,How NBCs New Streaming Service Stacks Up Against the Competition,Barrons.com
Jan-14-19,NBCUniversal to launch streaming service,American City Business Journals
Jan-14-19,NBCUniversal to launch streaming service in 2020,Reuters
Jan-14-19,NBCUniversal jumps into the streaming fray,Associated Press
Jan-14-19,NBCUniversal to launch streaming service in 2020,CNBC Videos
Jan-14-19,[$$] NBCUniversal Plans Streaming Service in 2020,The Wall Street Journal
Jan-14-19,NBC Plans Web TV Service for 2020 as Streaming Gets More Crowded,Bloomberg
Jan-14-19,"NBC is banking on a free streaming service to counter-balance Netflix, Disney and Amazon",CNBC
Jan-14-19,NBC finally jumps in the streaming wars  announces a new service to compete with Netflix and others,CNBC
Jan-14-19,Why Twenty-First Century Fox Stock Jumped 39% Last Year,Motley Fool
Jan-14-19,5G Wireless Network Race Set to Begin in 2019,Zacks
Jan-15-19,"Football rules ratings, but 'Big Bang Theory' energized",Associated Press
Jan-15-19,Hollywood's debt crisis,CNBC Videos
Jan-15-19,Comcast NBCUniversal To Launch Streaming Service In 2020: What You Need To Know,Benzinga
Jan-15-19,NBCUniversal Streaming Service: 13 Things to Know,InvestorPlace
Jan-15-19,Netflix's Price Hike Shows It Isn't Afraid of the Competition,Motley Fool
Jan-15-19,Comcast's NBCUniversal to Launch Streaming Service in 2020,Zacks
Jan-15-19,"Top Research Reports for Walmart, Comcast & ConocoPhillips",Zacks
Jan-15-19,"JPMorgan Chase, Wells Fargo, Ford, Volkswagen and PG&E - 5 Things You Must Know",TheStreet.com
Jan-15-19,This Week in Comcast: Why NBCs new streaming service will stand out,American City Business Journals
Jan-15-19,"Shaw Communications (SJR) Q1 Earnings Beat, Revenues Up Y/Y",Zacks
Jan-15-19,PRESS DIGEST- New York Times business news - Jan 15,Reuters
Jan-15-19,PRESS DIGEST -Wall Street Journal - Jan 15,Reuters
Jan-16-19,Comcast And District New Haven Mark Grand Opening Of Comcast Business Innovation Lounge,PR Newswire
Jan-16-19,Will a Crowded Streaming Space Challenge Netflix's Dominance?,Zacks
Jan-16-19,Comcast (CMCSA) Reports Next Week: Wall Street Expects Earnings Growth,Zacks
Jan-16-19,"The Zacks Analyst Blog Highlights: Walmart, Comcast, ConocoPhillips, PayPal and CSX",Zacks
Jan-16-19,Did Netflix Just Signal a Giant Q4 Earnings Beat?,Motley Fool
Jan-16-19,Comcast Customers: You've Got a Free Streaming Service Coming Your Way,Motley Fool
Jan-17-19,U.S. appeals court will not delay net neutrality case,Reuters
Jan-17-19,"NBC, Crocs could be looking to bring 850 jobs to Denver area with help of incentives",American City Business Journals
Jan-17-19,"Comcast Sky Strategy A Mystery As Analysts Eye Content, Streaming",Investor's Business Daily
Jan-17-19,Universal Orlando now taking reservations for new I-Drive resort,American City Business Journals
Jan-17-19,"Comcast NBCUniversal to Create Digital Mosaic in Celebration of the Life of Dr. Martin Luther King, Jr.",Business Wire
Jan-17-19,"Opening Bell, January 17, 2019",CNBC Videos
Jan-17-19,Gamma Infrastructure III B.V. -- Moody's: European cable television companies' outlook weaker than US peers in 2019,Moody's
Jan-18-19,Comcast (CMCSA) Gains But Lags Market: What You Should Know,Zacks
Jan-18-19,Key Takeaways from Q4 Earnings Results Thus Far,Zacks
Jan-18-19,House Intel Chairman Schiff vows to focus on Trump Tower Moscow deal in wake of BuzzFeed report,CNBC
Jan-18-19,Dont Bet Against Netflix Stock. Just Dont.,InvestorPlace
Jan-18-19,Trump accuses Michael Cohen of 'lying to reduce his jail time' in wake of BuzzFeed bombshell,CNBC
Jan-18-19,Sinclair Broadcast Launches Free Streaming Service STIRR,Zacks
Jan-18-19,"Netflix Stock Cools Down, But It Still Dominates the Space",InvestorPlace
Jan-18-19,Will Internet User Growth Aid Comcast (CMCSA) Q4 Earnings?,Zacks
Jan-18-19,"Netflix (NFLX) Q4 Earnings Beat, Paid Subscriber Count Up",Zacks
Jan-22-19,Report: Universal Orlando paves way for new Jurassic Park ride,American City Business Journals
Jan-22-19,NBCUniversal taps Comscore for local TV ratings,American City Business Journals
Jan-22-19,Theres Plenty to Like About Comcast Stock Ahead of Earnings,InvestorPlace
Jan-22-19,Comcast Q4 Earnings Preview,Benzinga
Jan-22-19,Day Ahead: Top 3 Things to Watch,Investing.com
Jan-22-19,Expect Comcast Stock to Soar on Over-the-Top Q4 Results,InvestorPlace
Jan-22-19,Comcast Falls 3%,Investing.com
Jan-22-19,"Movie Review: 'On the Basis of Sex' is a bit unwieldy and dull, but probably the best family film around",American City Business Journals
Jan-22-19,This Week in Comcast: How to tackle $114B in debt,American City Business Journals
Jan-23-19,Edited Transcript of CMCSA earnings conference call or presentation 23-Jan-19 1:30pm GMT,Thomson Reuters StreetEvents
Jan-23-19,"[$$] Hulu Raises Price of Live TV Service, Cuts Cost of Basic Plan",The Wall Street Journal
Jan-23-19,Jim Cramer: These Giant Hedge Funds Are Financial Hooligans,TheStreet.com
Jan-23-19,Comcast Corporation (CMCSA) Q4 2018 Earnings Conference Call Transcript,Motley Fool
Jan-23-19,Cramer: Oil prices are taking too much control over the stock market's moves,CNBC
Jan-23-19,Comcast Soars on Strong 4th-Quarter Revenue Growth,GuruFocus.com
Jan-23-19,Capital One and Abbott fall while IBM and Comcast jump,Associated Press
Jan-23-19,"Comcast Beats Q4 Earnings, Boosts Dividend, As Customer Retention Surprises",TheStreet.com
Jan-23-19,"Dow Rises as Wall Street Weighs Strong Earnings, Global Growth Concerns",TheStreet.com
Jan-23-19,"Comcast Stock Rises As Earnings Beat, Video Loss Lighter Than Expected",Investor's Business Daily
Jan-23-19,Hulu Cuts Low-End Plan Price After Netflix Raises Monthly Fees,Barrons.com
Jan-23-19,Why Comcast Shares Jumped 7% Higher This Morning,Motley Fool
Jan-23-19,[$$] Comcast Lifted by Media and Broadband Growth,The Wall Street Journal
Jan-23-19,Netflix shares edge lower after rival Hulu cuts prices,MarketWatch
Jan-23-19,"TXN vs. INTC Ahead of Earnings and Reports from IBM, UTX, &amp; More",Zacks
Jan-23-19,"Comcast loses cable users, but internet subscribers surge",Associated Press
Jan-23-19,Will NBC yank The Office from Netflix? Execs weigh in on new streaming service in Q4 earnings call,American City Business Journals
Jan-23-19,The Streaming Service Price War Takes Direct Aim at Netflix,TheStreet.com
Jan-23-19,Comcast tops profit forecasts as broadband business grows,Reuters
Jan-23-19,Hulu sees Netflixs price hike  and lowers its own basic on-demand rate,American City Business Journals
Jan-23-19,Comcast Shares Rise Most in Six Years as Broadband Fuels Growth,Bloomberg
Jan-23-19,[$$] Good News Isn't Enough at Comcast,The Wall Street Journal
Jan-23-19,"Stocks making the biggest moves midday: United Technologies, Tesla, IBM & more",CNBC
Jan-23-19,Comcasts Businesses Fired On All Cylinders In the Fourth Quarter,Barrons.com
Jan-23-19,"Hulu cuts base subscription price by 25%, Netflix shares extend fall",MarketWatch
Jan-23-19,"Hulu changes subscription prices, lowers price of basic p...",CNBC Videos
Jan-23-19,Q4 2018 Earnings in Full Swing,Zacks
Jan-23-19,Comcast Stock Has Sure Caught My Attention,TheStreet.com
Jan-23-19,"Q4 Earnings Roundup: PG, CMCSA, KMB &amp; More",Zacks
Jan-23-19,"Comcast (CMCSA) Q4 Earnings Beat Estimates, Revenues Grow Y/Y",Zacks
Jan-23-19,"Comcast, You Can Thank Netflix for the Win",Bloomberg
Jan-23-19,Comcasts Universal theme parks grew revenue 4.4% in 2018,American City Business Journals
Jan-23-19,Comcast Back to Resistance After Upbeat Earnings,Investopedia
Jan-23-19,Comcast (CMCSA) Q4 Earnings and Revenues Surpass Estimates,Zacks
Jan-23-19,[$$] Comcast boosted by strong broadband subscriber growth,Financial Times
Jan-23-19,"Comcast revenue, EPS beat expectations",CNBC Videos
Jan-23-19,Comcast Increases Dividend by 10% to $0.84 Per Share on an Annualized Basis in 2019,Business Wire
Jan-23-19,Comcast Reports 4th Quarter and Full Year 2018 Results,Business Wire
Jan-23-19,Comcast stock rises after an earnings beat,CNBC
Jan-23-19,Disney to Report Results in Accordance With New Structure,Zacks
Jan-23-19,Top 5 Things to Know in The Market on Wednesday,Investing.com
Jan-24-19,Disney Looks to Attract Users with Low Cost Disney+ &amp; Hulu,Zacks
Jan-24-19,Comcast Stock Gives Back Some Gains From Earnings Pop,TheStreet.com
Jan-24-19,NBC Sports readies new moves for NHL All-Star Game,American City Business Journals
Jan-24-19,A Look at Comcast's 2018 Results,GuruFocus.com
Jan-24-19,Netflix shares edge lower after rival Hulu cuts prices,MarketWatch
Jan-24-19,Comcast Falls 3%,Investing.com
Jan-25-19,Cramer's favorite ways to invest in the rise of streaming services,CNBC
Jan-25-19,Comcast's Fourth Quarter: Sky Hits the Ground Running,Motley Fool
Jan-25-19,"IBM, Comcast, and eBay's Quandary",Motley Fool
Jan-25-19,"Raymond James Raises Comcast Price Target To Reflect Sky Synergies, Broadband Sub Growth",Benzinga
Jan-28-19,Xfinity TV Releases an Unmatched Collection of Asian and Asian American Entertainment to Celebrate the 2019 Lunar New Year,Business Wire
Jan-28-19,"Comcast, NBCUniversal plant $105 million to grow Acorns fintech startup",American City Business Journals
Jan-28-19,Fintech start-up Acorns valued at $860 million after latest funding round,CNBC
Jan-28-19,Take Profits and Buy Netflix Stock on Its Next Big Dip,InvestorPlace
Jan-28-19,Can Comcast Climb Out of the Doldrums?,Motley Fool
Jan-28-19,"Glass shatters box-office hopes of Kid Who Would Be King, Serenity",American City Business Journals
Jan-28-19,Britain's Sky Sports News returning to US TV on NBCSN,Associated Press
Jan-28-19,Comcast & NBCUniversal invest in fintech app Acorns with a deal to produce content through CNBC,CNBC
Jan-28-19,"Report: Developing Opportunities within ONEOK, Alaska Air Group, Comcast, Mack-Cali Realty, Vistra Energy, and Xencor  Future Expectations, Projections Moving into 2019",GlobeNewswire
Jan-28-19,Comcast Falls 3%,Investing.com
Jan-28-19,2019 Predictions from CFRA Research's The Outlook,MoneyShow
Jan-29-19,"Top Analyst Reports for JPMorgan, Intel & Comcast",Zacks
Jan-29-19,Comcast Expands California Regional Senior Leadership Team,Business Wire
Jan-29-19,This Week in Comcast: Why capital spending is down despite net neutrality repeal,American City Business Journals
Jan-30-19,Comcast (CMCSA) Stock Sinks As Market Gains: What You Should Know,Zacks
Jan-30-19,"Feds indict powerful Philly union boss, councilman, others",Associated Press
Jan-30-19,"Comcast, CHOP among victims of Dougherty and Henon's alleged crimes",American City Business Journals
Jan-30-19,"New Jersey Local Government Boosts Productivity, Customer Service with Comcast Business",PR Newswire
Jan-30-19,FreeWheel and NBCUniversal Connect Linear TV and Digital Video Ad Delivery Systems as Part of Broader Initiative to Unify Ad Decisioning,Business Wire
Jan-30-19,"The Zacks Analyst Blog Highlights: JPMorgan, Intel, Comcast, Kinder Morgan and Discover Financial",Zacks
Jan-31-19,AT&T's $49 Billion Direct TV Bust,GuruFocus.com
Jan-31-19,"U.S. appeals court, House panel to take up net neutrality",Reuters
Jan-31-19,Channel 7's 10 p.m. news wins ratings battle as weather makes headlines,American City Business Journals
Jan-31-19,"Coca-Cola, Charmin ads may pop up when you pause Hulu",American City Business Journals
Jan-31-19,Communications Stocks Rise Midday as Charter Soars 16%,Investing.com
Jan-31-19,10 Cheap Stocks With Growing Dividends,Morningstar
Jan-31-19,Comcast Rises 3%,Investing.com
Feb-01-19,[$$] The Real Streaming Race Starts... Now,The Wall Street Journal
Feb-01-19,"Tech companies, states spar with govt over net neutrality",Associated Press
Feb-01-19,"Tech companies, states spar with govt over net neutrality",Associated Press
Feb-01-19,Comcast Ventures leads $20M Series B round for cloud security firm,American City Business Journals
Feb-01-19,U.S. appeals court hears challenge to FCC net neutrality repeal,Reuters
Feb-01-19,"$171M at stake as Comcast's trial in Washington State wraps up, report says",American City Business Journals
Feb-01-19,A Winning Mutual Fund Prepares for the Next Storm,Barrons.com
Feb-01-19,Comcast may use Super Bowl as springboard for free MARTA Wi-Fi,American City Business Journals
Feb-01-19,Why Does Comcast Want Its Own Mini Hulu?,Motley Fool
Feb-01-19,Investors Should Ignore the Haters And Buy Comcast Stock,InvestorPlace
Feb-01-19,Snap (SNAP) to Report Q4 Earnings: What's in the Cards?,Zacks
Feb-01-19,"Amazon's (AMZN) Q4 Earnings Beat, Sales View Disappoints",Zacks
Feb-01-19,[$$] Let the Streaming Wars Begin,The Wall Street Journal
Feb-04-19,Heres Why Roku Stock Jumped Monday  Then Gave Much of It Back,Barrons.com
Feb-04-19,"Super Bowl Spending, Streaming &amp; Amazon's Big TV Advertising Push",Zacks
Feb-04-19,"Top Gainers: Ultimate Software, Roku, Papa John's Rally",Investing.com
Feb-04-19,This Is the Main Way Disney Stock Can Overcome Any Short-Term Headwinds,InvestorPlace
Feb-05-19,Liberty Property Trust (LPT) Q4 2018 Earnings Conference Call Transcript,Motley Fool
Feb-05-19,All the Outcomes Are Unknown,GuruFocus.com
Feb-05-19,"Often overlooked, evening news shows have loyal fans",Associated Press
Feb-05-19,$20B lawsuit against Comcast could reach U.S. Supreme Court,American City Business Journals
Feb-05-19,Disney Stock Always Has Value,InvestorPlace
Feb-05-19,Its Time to Take Profits in Netflix Stock as Competition Heats Up,InvestorPlace
Feb-05-19,CMCSA vs. RCI: Which Stock Is the Better Value Option?,Zacks
