date,title,source
Oct-17-18,"3 ""Internet of Things"" Stocks to Buy Right Now",Zacks
Oct-17-18,Semiconductor Bear Market Could Trap Complacent Shareholders,Investopedia
Oct-17-18,"Micron Stock Is Running out of Gas, so It Is Time to Take a Break",InvestorPlace
Oct-17-18,Bull of the Day: SMART Global (SGH),Zacks
Oct-18-18,Micron to buy Intel's stake in joint venture IM Flash Technologies,Reuters
Oct-18-18,Micron to buy out Intels share of flash joint venture for $1.5 billion,MarketWatch
Oct-18-18,Micron to buy Intel's stake in joint venture IM Flash Technologies,Reuters
Oct-18-18,Time to get out of growth and into value? Top technician ...,CNBC Videos
Oct-18-18,Micron to buy out Intel's share in flash memory joint venture for $1.5 billion,MarketWatch
Oct-18-18,Micron Announces Intent to Acquire Remaining Interest in IM Flash Technologies Joint Venture,GlobeNewswire
Oct-18-18,Is It Too Early to Get Back Into Nvidia Stock?,InvestorPlace
Oct-18-18,Micron Celebrates 40 Years of Leadership and Innovation,GlobeNewswire
Oct-19-18,Micron's Plans to Buy Out Intel's JV Stake Strengthen its Data Center Hand,TheStreet.com
Oct-19-18,"Wall Street is missing the mark on these sinking stocks, but some could make a comeback",CNBC
Oct-19-18,Will Micron Stock Pick Up the Pace?,InvestorPlace
Oct-19-18,Analysts: Micron's Buyout of Joint Flash Venture With Intel A Long-Term Positive,Benzinga
Oct-19-18,Micron Buying Out Intel's Stake in Flash Memory Joint Venture for $1.5 Billion,TheStreet.com
Oct-19-18,Micron to buy out Intels share of flash joint venture for $1.5 billion,MarketWatch
Oct-19-18,Why Is Micron Bullish on 3D XPoint Technology?,Investopedia
Oct-22-18,These stocks may be sacrificed in a cold war with China,CNBC Videos
Oct-22-18,"Cramer: We could be facing a cold war with China, and the...",CNBC Videos
Oct-22-18,Micron (MU) Dips More Than Broader Markets: What You Should Know,Zacks
Oct-23-18,Micron Technology Is Under the Gun as Demand Outlook Worsens,Barrons.com
Oct-24-18,Why the Dip in Micron Stock Shouldnt Spook You,InvestorPlace
Oct-24-18,Stock News Today: Texas Instruments Casts Pall On Technology Sector,Investor's Business Daily
Oct-24-18,"Earnings Aside, AMD Stock Still Has a Ton of Room to Grow",InvestorPlace
Oct-24-18,Micron Is Buying Intel's Share of IM Flash Technologies,Motley Fool
Oct-24-18,Intel Stock Needs an Earnings Beat (And Chip Stocks Need It Even More),InvestorPlace
Oct-25-18,Here's Why Micron Is Investing $10.5 Billion in Capital Expenditures in Fiscal 2019,Motley Fool
Oct-25-18,45% of the S&P 500 is sitting in the bear's den,CNBC Videos
Oct-25-18,Micron Investors Have Reasons to Worry,Motley Fool
Oct-25-18,"Thursdays Vital Data: AT&T, Microsoft and Micron",InvestorPlace
Oct-29-18,[$$] U.S. to Restrict Chinese Chip Maker From Doing Business with American Firms,The Wall Street Journal
Oct-29-18,Chinese chip maker Fujian Jinhua added to U.S. export ban,MarketWatch
Oct-29-18,Will Micron Technology Incs (NASDAQ:MU) Earnings Grow Over The Next Few Years?,Simply Wall St.
Oct-29-18,U.S. restricts exports to Chinese semiconductor firm Fujian Jinhua,Reuters
Oct-29-18,Better Buy: Micron Technology vs. Skyworks Solutions,Motley Fool
Oct-29-18,3 Beaten-Down Tech Stocks You Can Buy Now,InvestorPlace
Oct-29-18,3 Reasons This Is the End of the Micron Stock Growth Cycle,InvestorPlace
Oct-29-18,"The Zacks Analyst Blog Highlights: Advanced Micro Devices, Texas Instruments, Intel, Micron Technology and Broadcom",Zacks
Oct-29-18,9 Buffett-Style Stock Picks for a Still-Pricey Stock Market,Investopedia
Oct-30-18,[$$] U.S. Ban Threatens Beijings Ambitions as Tech Power,The Wall Street Journal
Oct-30-18,Jerome Dodson Podcast Interview With GuruFocus Transcript,GuruFocus.com
Oct-30-18,Micron CEO on how the company plans to stay ahead of the semiconductor slump,American City Business Journals
Oct-30-18,"Intel Roundup: Earnings, Micron & ARM Deals, New Chips, More",Zacks
Oct-30-18,Micron Stock Will Bottom Soon,InvestorPlace
Oct-30-18,US STOCKS-Wall Street moves higher as chip stocks rebound,Reuters
Oct-30-18,Nvidia Stock Has Some Potential That AMD Just Never Will,InvestorPlace
Oct-30-18,US STOCKS-Wall Street gains as chip stocks lead bounce back,Reuters
Oct-30-18,[$$] U.S. Ban Threatens China's Ambitions as Tech Power,The Wall Street Journal
Oct-30-18,2 Great Stocks You Can Buy on Sale,Motley Fool
Oct-30-18,U.S. restricts exports to Chinese semiconductor firm Fujian Jinhua,Reuters
Oct-30-18,US limits tech exports to Chinese firm on security grounds,Associated Press
Oct-30-18,U.S. restricts exports to Chinese semiconductor firm Fujian Jinhua,Reuters
Oct-30-18,U.S. Blocks Exports to Chinese Chipmaker as Tensions Simmer,Bloomberg
Oct-31-18,BRIEF-New Sports Group Says Unit To Buy Micron Technology Development Ltd,Reuters
Oct-31-18,Jerome Dodson Comments on Micron Technology,GuruFocus.com
Oct-31-18,Jerome Dodson's 3rd Quarter Endeavor Fund Shareholder Letter,GuruFocus.com
Oct-31-18,US limits tech exports to Chinese firm on security grounds,Associated Press
Oct-31-18,US limits tech exports to Chinese firm on security grounds,Associated Press
Nov-01-18,"U.S. indicts Chinese, Taiwan firms for targeting Micron trade secrets",Reuters
Nov-01-18,"U.S. indicts Chinese, Taiwan firms for targeting Micron trade secrets",Reuters
Nov-01-18,[$$] A Better China Trade Strategy,The Wall Street Journal
Nov-01-18,"[$$] U.S. Accuses Chinese Firm, Partner of Stealing Trade Secrets From Micron",The Wall Street Journal
Nov-01-18,[$$] A Better China Trade Strategy,The Wall Street Journal
Nov-01-18,"U.S. indicts Chinese, Taiwan firms for targeting Micron trade secrets",Reuters
Nov-01-18,"Trump, Xi upbeat on U.S.-China trade; U.S. targets more Chinese firms",Reuters
Nov-01-18,"U.S. indicts Chinese, Taiwan firms for targeting Micron trade secrets",Reuters
Nov-01-18,China State-Owned Company Charged With Micron Secrets Theft,Bloomberg
Nov-01-18,Micron Provides Statement on U.S. Department of Justice Indictments Relating to Theft of Micron Trade Secrets,GlobeNewswire
Nov-01-18,FBI official on China threat: They are not pulling any punches,MarketWatch
Nov-01-18,Sessions announces charges case over Chinese espionage against Micron,MarketWatch
Nov-01-18,"U.S. indicts Chinese, Taiwan firms for targeting Micron trade secrets",Reuters
Nov-01-18,Nvidia Stock Is Worth a Look,InvestorPlace
Nov-05-18,Micron Technology Announces Upcoming Investor Events,GlobeNewswire
Nov-05-18,3 Weakening Stocks to Short Today,InvestorPlace
Nov-05-18,Why Micron Technology Stock Is Still Worth At Least $60,InvestorPlace
Nov-05-18,"Fear of a DRAM Glut Is Stifling Micron Stock, but It Cant Last Forever",InvestorPlace
Nov-05-18,"Report: Developing Opportunities within PriceSmart, Packaging Corporation of America, Micron Technology, Southwest Airlines, The Goodyear Tire & Rubber, and Electronic Arts  Future Expectations, Projections Moving into 2018",GlobeNewswire
Nov-06-18,Micron's Battered Stock Faces Even Steeper Declines,Investopedia
Nov-06-18,Why Micron Still Has Room to Run,GuruFocus.com
Nov-06-18,Stocks - Wall Street Rises After Upbeat Earnings,Investing.com
Nov-06-18,Dont Buy Micron Stock Just Yet,InvestorPlace
Nov-07-18,"Why AMD, Micron, Diplomat Pharmacy, and More Are Trending",Insider Monkey
Nov-07-18,Micron Positions QLC to Lead Market Transition from Hard Disk Drives to Solid State Drives,GlobeNewswire
Nov-07-18,Micron Announces Mass Production of Industrys Highest-Capacity Monolithic Memory for Mobile Applications,GlobeNewswire
Nov-08-18,Micron (MU) Dips More Than Broader Markets: What You Should Know,Zacks
Nov-08-18,Micron (MU) Dips More Than Broader Markets: What You Should Know,Zacks
Nov-09-18,Yacktman Asset Management Buys 4 Companies in 3rd Quarter,GuruFocus.com
Nov-09-18,3 Cheap Stocks to Buy Before They Skyrocket,InvestorPlace
Nov-12-18,[$$] U.S. Adopts New Battle Plan to Fight Chinas Theft of Trade Secrets,The Wall Street Journal
Nov-12-18,Micron CEO Says IP Must Be Protected in 'All Geographies',Bloomberg
Nov-12-18,"Micron Joins CERN openlab, Bringing New Machine Learning Capabilities to Advance Science and Research",GlobeNewswire
Nov-12-18,Stocks - U.S. Futures Mixed as Investors Pause on Veterans Day,Investing.com
Nov-12-18,Micron and Achronix Deliver Next-Generation FPGAs Powered by High-Performance GDDR6 Memory for Machine Learning Applications,GlobeNewswire
Nov-12-18,The Micron Stock Cycle Is Easier to Understand Than You Might Think,InvestorPlace
Nov-12-18,Micron Collaborates with Premium German Automaker to Advance Automotive Memory Technologies,GlobeNewswire
Nov-13-18,Micron Stock Is a Keeper Even Through the Trade War,InvestorPlace
Nov-13-18,Micron Partners BMW to Expand in Autonomous Vehicle Market,Zacks
Nov-13-18,China says U.S. controls on semiconductor firm break WTO rules,Reuters
Nov-13-18,Micron Unveils Complete High-Density 45nm Automotive-Grade NOR Flash Portfolio,GlobeNewswire
Nov-13-18,Micron Introduces Industrys First 1TB Automotive and Industrial Grade PCIe NVMe Flash Storage,GlobeNewswire
Nov-14-18,Better Buy: Micron Technology vs. Samsung Electronics,Motley Fool
Nov-14-18,Should KLA-Tencor Investors Be Worried About This New Ban on Exports to China?,Motley Fool
Nov-14-18,Micron (MU) Gains As Market Dips: What You Should Know,Zacks
Nov-14-18,Micron Boosts Foothold in ADAS Industry With New Launches,Zacks
Nov-14-18,Micron Unveils Secure NOR Flash Memory Solution to Accelerate and Authenticate Intelligence at the Edge,GlobeNewswire
Nov-15-18,George Soros' Top 6 Buys in 3rd Quarter,GuruFocus.com
Nov-15-18,Why Micron Technology Stock Is Down 7.5% So Far in 2018,Motley Fool
Nov-15-18,Is Micron Stock Going to Double or Get Cut in Half?,InvestorPlace
Nov-15-18,"Forget Micron, Cypress Semiconductor Is a Better Chip Stock",Motley Fool
Nov-16-18,3 &quot;Internet of Things&quot; Stocks to Buy Right Now,Zacks
Nov-16-18,Flashback Friday: Nvidia Is the Ultimate Chip and Dip,TheStreet.com
Nov-16-18,"AMD, Micron Shares Follow Nvidia Lower",TheStreet.com
Nov-19-18,Micron Technology Stock Dinged By China Antitrust Probe,Investor's Business Daily
Nov-19-18,Apple Stock Hounded By iPhone Production Cuts Amid Soft Demand,Investor's Business Daily
Nov-19-18,"Micron Technology to Report Fiscal First Quarter Results on December 18, 2018",GlobeNewswire
Nov-19-18,FAANG Stocks Are Getting Knocked Again,Bloomberg
Nov-19-18,Stocks Widen Losses; Dow Jones Fails To Keep Friday's Gain,Investor's Business Daily
Nov-19-18,Here's One Simple Way to Buy Micron Into Weakness,TheStreet.com
Nov-19-18,Is Applied Materials Stock Poised to Drop Further?,InvestorPlace
Nov-19-18,"US STOCKS-Wall St pulled lower by Apple, trade worries",Reuters
Nov-19-18,"Shares of Apple, iPhone suppliers extend losses after WSJ report of further production cuts",MarketWatch
Nov-19-18,"US STOCKS-Wall St set to open lower on Apple concerns, trade uncertainties",Reuters
Nov-19-18,Stocks - U.S. Futures Slip Lower as Trade Tensions Linger,Investing.com
Nov-19-18,"US STOCKS-Futures dip on Apple concerns, trade uncertainties",Reuters
Nov-19-18,Paul Meeks on why he's taking tech-like defense on chip s...,CNBC Videos
Nov-19-18,Micron Falls After FT Report Indicates Deepening China Probe,Bloomberg
Nov-19-18,Todays Research Reports on Stocks to Watch: Micron Technology and Advanced Micro Devices,ACCESSWIRE
Nov-19-18,[$$] China alleges massive evidence of chipmaker violations,Financial Times
Nov-20-18,John Buckingham's Top 6 Buys in 3rd Quarter,GuruFocus.com
Nov-20-18,Micron (MU) Dips More Than Broader Markets: What You Should Know,Zacks
Nov-20-18,How Low Can Micron Stock Go?,Motley Fool
Nov-20-18,The worst is not behind semis: Pro,CNBC Videos
Nov-20-18,Buy Boring Cisco Systems as Market Uncertainties Grow,InvestorPlace
Nov-20-18,"Micron Technology Stock Can Fall Even More, Says Analyst",Barrons.com
Nov-20-18,"John Buckingham Buys Micron Technology, BASF",GuruFocus.com
Nov-20-18,Tech Stocks Continue to Take Beating,TheStreet.com
Nov-20-18,Micron leads chipmaker losses as demand concerns grow,Reuters
Nov-20-18,Micron leads chipmaker losses as demand concerns grow,Reuters
Nov-20-18,Western Digital stock falls after Susquehanna downgrade,MarketWatch
Nov-20-18,Micron stock sinks on Baird downgrade,MarketWatch
Nov-20-18,"3 Big Stock Charts for Tuesday: Micron Technology, PulteGroup and Intuit",InvestorPlace
Nov-20-18,[$$] Growth worries help stoke global equity sell-off,Financial Times
Nov-20-18,"Chinese officials find 'evidence' of anti-competitive behavior by Micron, Samsung, SK Hynix",MarketWatch
Nov-21-18,The Semiconductors After the Sell Off: Are they Value Stocks or Traps?,Zacks
Nov-21-18,"Goldman Sees More Pain for Facebook, Micron on Hedge Fund Exodus",Bloomberg
Nov-21-18,The Market Is Right About Qualcomm Stock,InvestorPlace
Nov-21-18,"Unfortunately, There Is Nothing Very Special About Nvidia Stock",InvestorPlace
Nov-21-18,Baird Slashes Micron Price Target in Half,Investopedia
Nov-21-18,"Sell Micron because of continued deterioration in pricing, analyst says in downgrade",CNBC
Nov-21-18,Is Micron Technology Incs (NASDAQ:MU) Liquidity Good Enough?,Simply Wall St.
Nov-26-18,Heres Why You Should Stay Away from Micron Stock,InvestorPlace
Nov-26-18,"Zacks Value Trader Highlights: NVIDIA, Lam Research, Micron, Intel, Applied Materials and Applied Micro Devices",Zacks
Nov-27-18,Micron (MU) Outpaces Stock Market Gains: What You Should Know,Zacks
Nov-27-18,Volatility causing a lot of indigestion for investors rig...,CNBC Videos
Nov-27-18,"UBS Lowers Micron Price Target, Says DRAM Cycle Deteriorating Faster Than Projected",Benzinga
Nov-27-18,US STOCKS-Wall St set to open lower on Trump tariff threat,Reuters
Nov-28-18,Qualcomm sets up $100 mln fund to invest in AI startups,Reuters
Nov-28-18,5 Beaten-Down Semiconductor Stocks That Will Struggle to Rise Again,InvestorPlace
Nov-28-18,Micron Highlights Commitment to Diversity and Inclusion With 2018 Benchmark Report,GlobeNewswire
Nov-29-18,Micron President and CEO Sanjay Mehrotra Elected Chair of Semiconductor Industry Association,PR Newswire
Nov-29-18,"Morgan Stanley Sees Choppier Waters Ahead For Micron, Says To 'Use Strength As A Selling Opportunity'",Benzinga
Nov-29-18,"Near a 6-Year Low, Is Western Digital a Buy?",Motley Fool
Nov-29-18,Micron stock falls as analysts weigh in on update to outlook,MarketWatch
Nov-29-18,Today's Research Reports on Trending Tickers: Micron Technology and Lam Research,ACCESSWIRE
Nov-30-18,Where Will Micron Technology Be in 1 Year?,Motley Fool
Dec-03-18,AMD's stock soars on heavy volume to pace chip sector's gainers,MarketWatch
Dec-03-18,2 Tech Companies to Consider as US-China Trade War Comes to a Ceasefire,GuruFocus.com
Dec-03-18,Stocks - U.S. Futures Rise After U.S. and China Agree to Trade Ceasefire,Investing.com
Dec-06-18,"Huawei arrest made companies, including Apple, less valua...",CNBC Videos
Dec-06-18,Micron Stock Rallies to Gain on Thursday After Pre-Market Plunge,TheStreet.com
Dec-06-18,1 Thing Micron Has Going for It,Motley Fool
Dec-06-18,Low PE Tech Plays Bounce Alongside After HPE's Strong Earnings Forecast,TheStreet.com
Dec-06-18,Chart of the Day: Just How Much Are Semiconductors Tied to China?,TheStreet.com
Dec-06-18,How to Trade Micron Technology in This Volatile Market,TheStreet.com
Dec-06-18,Micron Technology Stock Bulls Have a Trade War Advantage,InvestorPlace
Dec-06-18,Give Up on Micron? No Way!,TheStreet.com
Dec-06-18,7 Toxic Stocks to Watch Going Into 2019,InvestorPlace
Dec-06-18,Micron Offers Primer on Stalking Entry Points in a Dicey Market,TheStreet.com
Dec-06-18,Can Micron Technology Stock Hold the Recent Lows?,TheStreet.com
Dec-06-18,"Micron, Other Chipmakers Slip as Huawei CFO Arrest Exacerbates Trade Anxiety",TheStreet.com
Dec-06-18,"Is Micron Technology, Inc. (NASDAQ:MU) A Good Stock To Buy?",Insider Monkey
Dec-07-18,How a Company From Idaho Revolutionized Data Solutions: Making Micron,TheStreet.com
Dec-07-18,Stocks - U.S. Futures Fall Despite Reports that Fed Could Pause Rate Hikes,Investing.com
Dec-10-18,Micron (MU) Stock Sinks As Market Gains: What You Should Know,Zacks
Dec-10-18,Support Will Hold for Micron Stock After Earnings,InvestorPlace
Dec-10-18,China ruling could ban some Apple iPhones sales amid Qualcomm fight,Reuters
Dec-10-18,A Micron Stock Skeptic Cuts Price Target Again,Barrons.com
Dec-10-18,"Chip Stocks Are Staring Into A Black Hole, Analyst Says",Barrons.com
Dec-10-18,Qualcomm wins preliminary China import ruling against some iPhone models,Reuters
Dec-10-18,Qualcomm wins preliminary China import ruling against some iPhone models,Reuters
Dec-10-18,Stocks - U.S. Futures Fall on Trade Concerns,Investing.com
Dec-10-18,Qualcomm wins import ban against several Apple iPhones in China,Reuters
Dec-10-18,Adobe Systems (ADBE) to Report Q4 Earnings: What's in Store?,Zacks
Dec-11-18,3 Chip Stocks to Buy for the Next 3 Years,InvestorPlace
Dec-11-18,Micron (MU) Earnings Expected to Grow: Should You Buy?,Zacks
Dec-11-18,Stocks - U.S. Futures Lifted on News of Trade Talks,Investing.com
Dec-12-18,Oracle (ORCL) to Report Q2 Earnings: What's in the Offing?,Zacks
Dec-13-18,"Micron Stock Is a Long-Term Buy, Even Ahead of Earnings",InvestorPlace
Dec-13-18,Should You Buy Micron (MU) Stock On the Dip Ahead of Earnings?,Zacks
Dec-13-18,There Are so Many Reasons You Dont Want to Touch MU Stock,InvestorPlace
Dec-13-18,MKM Still Bullish On Micron,Benzinga
Dec-13-18,Micron (MU) Q1 Earnings: Will the Stock Disappoint This Time?,Zacks
Dec-13-18,Micron Delivers Industrys Highest-Capacity Monolithic Mobile Memory for MediaTeks Newest Helio Smartphone Platform,GlobeNewswire
Dec-13-18,"Micron Technology, Inc. (NASDAQ:MU): Earnings Expected To Remain Subdued",Simply Wall St.
Dec-14-18,Micron earnings: Hunkering down for the winter with hopes of a summer turnaround,MarketWatch
Dec-14-18,Better Buy: Sierra Wireless vs. Micron Technology,Motley Fool
Dec-14-18,Will Low DRAM and NAND Pricing Hamper Micron's Q1 Earnings?,Zacks
Dec-14-18,3 Cheap Stocks to Buy Before They Skyrocket,InvestorPlace
Dec-14-18,"Upcoming Earnings to Watch: MU, NKE, WBA",Zacks
Dec-14-18,3 Earnings Reports to Watch Next Week,InvestorPlace
Dec-14-18,"The Zacks Analyst Blog Highlights: Intuitive Surgical, HCA Healthcare, Exelon, 3M and Micron",Zacks
Dec-14-18,"Highlighted as Zacks Bull and Bear of the Day Azure Power, Tata Motors, Micron, Nvidia and AMD",Zacks
Dec-14-18,U.S. Stock Index Futures Fall as Asian Markets Extend Losses,Bloomberg
Dec-17-18,Micron Has Everything to Prove on Tuesday,Motley Fool
Dec-17-18,"Micron Technology Stock Is a Bargain, Say Analysts",Barrons.com
Dec-17-18,MarketPulse: Micron Gives up Gains as Tech Turns Ugly,Investing.com
Dec-17-18,This Week's Top Tech Earnings and Today's Trending Stocks: PTI & NBEV,Zacks
Dec-17-18,Buy Micron Down to Its Key Weekly Moving Average on Post-Earnings Volatility,TheStreet.com
Dec-18-18,"Micron sales, profit miss estimates as chip glut hurts prices",Reuters
Dec-18-18,"[$$] Micron Cuts Plans for Spending, Chip Production",The Wall Street Journal
Dec-18-18,Micron Falls on Soft Guidance: 5 Key Takeaways,TheStreet.com
Dec-18-18,"Micron stock is plunging, but executives stick to the script",MarketWatch
Dec-18-18,"Micron Technology, Inc. (MU) Q1 2019 Earnings Conference Call Transcript",Motley Fool
Dec-18-18,[$$] Micron Brings Back Painful Memories,The Wall Street Journal
Dec-18-18,An earnings double whammy may add fuel to the fire on Wall Street,MarketWatch
Dec-18-18,"Micron stock tanks as sales outlook falls well short of target, production growth slashed",MarketWatch
Dec-18-18,Day Ahead: Top 3 Things to Watch,Investing.com
Dec-18-18,Micron's downturn may not be as bad as those in the past:...,CNBC Videos
Dec-18-18,Micron sales miss target as chip glut hurts prices,Reuters
Dec-18-18,Micron Sales Fall Short of Estimates in Memory Chip Slowdown,Bloomberg
Dec-18-18,Micron sales miss target as chip glut hurts prices,Reuters
Dec-18-18,"Scary S&P Charts Are Back After FedEx, Micron Awaken Macro Dread",Bloomberg
Dec-18-18,Micron Shares Tumble on Mixed Earnings Results,TheStreet.com
Dec-18-18,Top technician reacts to Micron earnings and makes a bold...,CNBC Videos
Dec-18-18,Micron (MU) Tops Q1 Earnings Estimates,Zacks
Dec-18-18,"Stocks making the biggest moves after hours: FedEx, Micron and more",CNBC
Dec-18-18,Micron shares drop more than 7% after missing on revenue,CNBC
Dec-18-18,Micron Technology Stock Is Plummeting on a Gloomy Outlook,Barrons.com
Dec-18-18,Micron: Fiscal 1Q Earnings Snapshot,Associated Press
Dec-18-18,"Micron Earnings Edge Views, But Revenue Light In Fiscal First Quarter",Investor's Business Daily
Dec-18-18,Micron quarterly sales come up short of analyst expectations,MarketWatch
Dec-18-18,"Micron underperforms due to &quot;weak&quot; industry dynamics, say...",CNBC Videos
Dec-18-18,"Micron Technology, Inc., Reports Results for the First Quarter of Fiscal 2019",GlobeNewswire
Dec-18-18,Micron earnings: Hunkering down for the winter with hopes of a summer turnaround,MarketWatch
Dec-18-18,"Dow Jones Rebounds After 2-Day, 1,000-Point Plunge; These 2 Sectors Aim At Comeback",Investor's Business Daily
Dec-18-18,Dow Jones Leads Rally As These 2 Blue-Chip Stocks Boost Buybacks,Investor's Business Daily
Dec-18-18,How a Company From Idaho Revolutionized Data Solutions: Making Micron,TheStreet.com
Dec-18-18,"Tuesdays Vital Data: Transocean, Tesla and Micron Technology",InvestorPlace
Dec-18-18,Should Investors Load Up on MU Stock Before Earnings Report?,InvestorPlace
Dec-19-18,Fighting the Fed: Cramer's 'Mad Money' Recap (Wednesday 12/19/18),TheStreet.com
Dec-19-18,Micron CEO on 'vibrant' demand for key products,CNBC Videos
Dec-19-18,"Cramer Remix: If you can handle the allegations, these companies could be profitable long-term plays",CNBC
Dec-19-18,Micron Stock Slumps as Slashed Guidance Sends Shares Downward,TheStreet.com
Dec-19-18,Micron CEO touts 'vibrant' demand for key products as sto...,CNBC Videos
Dec-19-18,Micron CEO touts 'vibrant' demand for key products as stock hits 52-week low after earnings,CNBC
Dec-19-18,Stocks Hit New Lows After Early Rally as Fed Hikes Key Rate,TheStreet.com
Dec-19-18,Micron Stock Tanks On Downturn In Demand For Memory Chips,Investor's Business Daily
Dec-19-18,"5 Must-See Stock Charts for Thursday: FDX, MU, GIS, NVDA, AMD",InvestorPlace
Dec-19-18,Micron's Memory Chip Bonanza Is Over,Motley Fool
Dec-19-18,Chip Maker Microns Downbeat Forecast Points to Pain for Industrial Stocks,Barrons.com
Dec-19-18,Micron Tumbles After Earnings Forecast Sparks Memory Demand Concerns,TheStreet.com
Dec-19-18,"Will the Fed Notice Oil's Crash? & Today's Stocks to Watch: MU, FDX, WBA",Zacks
Dec-19-18,Jim Cramer's Thoughts on the Market Ahead of the Fed and Micron's Earnings,TheStreet.com
Dec-19-18,Micron Stock Breaks Down Following Q1 Earnings and Guidance,Investopedia
Dec-19-18,Micron plunges after earnings forecast,CNBC Videos
Dec-19-18,Micron Stock Sees Spate of Downgrades After Distressing Demand Forecast,TheStreet.com
Dec-19-18,Micron Stock Gets Downgraded as Chip-Demand Worries Worsen,Barrons.com
Dec-19-18,Kass: The Lesson of Micron,TheStreet.com
Dec-19-18,Wall Street Divided On Buying The Micron Dip,Benzinga
Dec-19-18,"Stocks - GE, General Mills Jump in Premarket; FedEx, Micron Tumble; Facebook Falls",Investing.com
Dec-19-18,Stocks Gain Steam Ahead Of Fed; 2 Stocks Offer Poor Earnings Outlooks,Investor's Business Daily
Dec-19-18,"Stocks Open Higher: Fed Rate Hike Vote, A Dow Jones Merger",Investor's Business Daily
Dec-19-18,"Micron stock downgraded at RBC as analyst says pricing cuts, further capacity reductions are a 'real possibility'",MarketWatch
Dec-19-18,"[$$] Stocks to Watch: General Mills, Winnebago, Micron, Pfizer, FedEx, Eli Lilly, Jabil, Blue Apron, MetLife",The Wall Street Journal
Dec-19-18,Micron's Earnings Day Move Has Major Implications,TheStreet.com
Dec-19-18,Chip gear makers take a beating after Micron's dour forecast,Reuters
Dec-19-18,Memory Demand 'Air Pocket' Deflates Micron Stock,TheStreet.com
Dec-19-18,Stocks - U.S. Futures Higher as Investors Wait for Fed Decision,Investing.com
Dec-19-18,"Micron Disappoints Investors, but Is the Worst Already Reflected in the Stock?",TheStreet.com
Dec-19-18,"Fed, Micron, Glaxo and Pfizer, FedEx and Facebook - 5 Things You Must Know",TheStreet.com
Dec-19-18,An earnings double whammy may add fuel to the fire on Wall Street,MarketWatch
Dec-19-18,"Micron stock is plunging, but executives stick to the script",MarketWatch
Dec-19-18,"Micron stock tanks as sales outlook falls well short of target, production growth slashed",MarketWatch
Dec-19-18,Lam Research leads chip-equipment stocks lower after Micron earnings,MarketWatch
Dec-19-18,Micron downgraded to hold at Needham after earnings,MarketWatch
Dec-19-18,"Stocks making the biggest moves premarket: GIS, UAA, FDX, FB, JNJ & more",CNBC
Dec-19-18,How a Company From Idaho Revolutionized Data Solutions: Making Micron,TheStreet.com
Dec-19-18,Today's Research Reports on Trending Tickers: Micron Technology and NVIDIA,ACCESSWIRE
Dec-19-18,"Micron Earnings beat, Revenue misses In Q1",Investing.com
Dec-19-18,Edited Transcript of MU earnings conference call or presentation 18-Dec-18 9:30pm GMT,Thomson Reuters StreetEvents
Dec-20-18,"Micron Issues Ugly Guidance, Slashes Capital Expenditure Forecast",Motley Fool
Dec-20-18,Micron Technology Announces Upcoming Investor Events,GlobeNewswire
Dec-20-18,The Weakness of Micron Stock Has Created a Good Buying Opportunity,InvestorPlace
Dec-20-18,Understanding Micron's Inventory Problem,Motley Fool
Dec-20-18,Micron CEO Expects Industry Fundamentals To Improve In Second Half Of 2019,Benzinga
