date,title,source
Feb-11-19,"A DRAM recovery looks highly unlikely later this year, says Morgan Stanley",MarketWatch
Feb-11-19,IBM Inks $2 Billion Deal to Develop AI Hardware Center in NY,Zacks
Feb-11-19,"Analysis: Positioning to Benefit within Micron Technology, Carvana, LCI Industries, Silicon Laboratories, Floor & Decor, and McGrath RentCorp  Research Highlights Growth, Revenue, and Consolidated Results",GlobeNewswire
Feb-11-19,Stocks - U.S. Futures Rise as China Expresses Hope of Trade Progress,Investing.com
Feb-12-19,"SHAREHOLDER ALERT: Pomerantz Law Firm Investigates Claims On Behalf of Investors of Micron Technology, Inc. - MU",ACCESSWIRE
Feb-12-19,"MU CLASS ACTION DEADLINE: Rosen Law Firm Announces Filing of Securities Class Action Lawsuit Against Micron Technology, Inc.; Expanded Class Period - MU",PR Newswire
Feb-12-19,"CLASS ACTION UPDATE for MAXR, GSM, MU and TYME: Levi & Korsinsky, LLP Reminds Investors of Class Actions on Behalf of Shareholders",GlobeNewswire
Feb-12-19,"CLASS ACTION UPDATE for XRAY, AGN, MU and ASTE: Levi & Korsinsky, LLP Reminds Investors of Class Actions on Behalf of Shareholders",GlobeNewswire
Feb-12-19,"3 Big Stock Charts for Tuesday: Micron Technology, Citrix Systems and Vulcan Materials",InvestorPlace
Feb-13-19,"CLASS ACTION UPDATE for IMMU, ATVI, GSM and MU: Levi & Korsinsky, LLP Reminds Investors of Class Actions on Behalf of Shareholders",GlobeNewswire
Feb-13-19,Mohnish Pabrai Buys Shares of Tepper Stock Micron Technology,GuruFocus.com
Feb-13-19,"5 Top Stock Trades for Thursday: NVTA, MU, NVDA, AAPL, TWLO",InvestorPlace
Feb-13-19,"FILING DEADLINE--Kuznicki Law PLLC Announces Class Actions on Behalf of Shareholders of DXC, ATVI, MU and ASTE",GlobeNewswire
Feb-13-19,"CLASS ACTION UPDATE for MU, ASTE and WCAGY, WRCDF: Levi & Korsinsky, LLP Reminds Investors of Class Actions on Behalf of Shareholders",GlobeNewswire
Feb-14-19,"CLASS ACTION UPDATE for YRCW, DXC, YRIV and MU: Levi & Korsinsky, LLP Reminds Investors of Class Actions on Behalf of Shareholders",GlobeNewswire
Feb-15-19,"MU MARCH 25th DEADLINE: Rosen Law Firm Announces Filing of Securities Class Action Lawsuit Against Micron Technology, Inc.; Expanded Class Period  MU",GlobeNewswire
Feb-15-19,"CLASS ACTION UPDATE for ARLO, XRAY, MU and TAP: Levi & Korsinsky, LLP Reminds Investors of Class Actions on Behalf of Shareholders",GlobeNewswire
Feb-15-19,"SHAREHOLDER ALERT - Bronstein, Gewirtz & Grossman, LLC Reminds Investors of Class Action Against Micron Technology, Inc. (MU) and Lead Plaintiff Deadline: March 25, 2019",ACCESSWIRE
Feb-15-19,"CLASS ACTION UPDATE for GSM, MU, TYME and SVXY: Levi & Korsinsky, LLP Reminds Investors of Class Actions on Behalf of Shareholders",GlobeNewswire
Feb-15-19,"SHAREHOLDER ALERT - Bronstein, Gewirtz & Grossman, LLC Reminds Investors of Class Action Against Micron Technology, Inc. (MU) and Lead Plaintiff Deadline: March 25, 2019",ACCESSWIRE
Feb-19-19,"SHAREHOLDER ALERT: Bronstein, Gewirtz & Grossman, LLC Reminds Investors of Class Action Against Micron Technology, Inc. (MU) and Lead Plaintiff Deadline: March 25, 2019",ACCESSWIRE
Feb-19-19,"CLASS ACTION UPDATE for GS, ALKS, MU and TAP: Levi & Korsinsky, LLP Reminds Investors of Class Actions on Behalf of Shareholders",GlobeNewswire
Feb-19-19,"SHAREHOLDER ALERT - Bronstein, Gewirtz & Grossman, LLC Reminds Investors of Class Action Against Micron Technology, Inc. (MU) and Lead Plaintiff Deadline: March 25, 2019",ACCESSWIRE
Feb-19-19,3 Stocks With Breakout Potential,InvestorPlace
Feb-19-19,"FILING DEADLINE--Kuznicki Law PLLC Announces Class Actions on Behalf of Shareholders of ATVI, MU, TYME and SVXY",GlobeNewswire
Feb-19-19,US-China Talks Set in Washington: ETFs in Focus,Zacks
Feb-19-19,"Arlo Technologies, Inc. (ARLO), Micron Technology, Inc. (MU) and Ferroglobe PLC (GSM): Bronstein, Gewirtz & Grossman, LLC Class Action Update",ACCESSWIRE
Feb-20-19,Micron (MU) Outpaces Stock Market Gains: What You Should Know,Zacks
Feb-20-19,"SHAREHOLDER ALERT: Pomerantz Law Firm Investigates Claims On Behalf of Investors of Micron Technology, Inc. - MU",ACCESSWIRE
Feb-20-19,"Micron Technology to Report Fiscal Second Quarter Results on March 20, 2019",GlobeNewswire
Feb-20-19,"SHAREHOLDER ALERT: Bronstein, Gewirtz & Grossman, LLC Reminds Investors of Class Action Against Micron Technology, Inc. (MU) and Lead Plaintiff Deadline: March 25, 2019",ACCESSWIRE
Feb-20-19,"David Tepper Sells Micron Technology, Facebook, Alibaba",GuruFocus.com
Feb-20-19,"CLASS ACTION UPDATE for PRGO, MKL, ATVI and MU: Levi & Korsinsky, LLP Reminds Investors of Class Actions on Behalf of Shareholders",GlobeNewswire
Feb-20-19,"SHAREHOLDER ALERT: Bronstein, Gewirtz & Grossman, LLC Reminds Investors of Class Action Against Micron Technology, Inc. (MU) and Lead Plaintiff Deadline: March 25, 2019",ACCESSWIRE
Feb-20-19,"FILING DEADLINE--Kuznicki Law PLLC Announces Class Actions on Behalf of Shareholders of AXGN, ALKS, MU and TAP",GlobeNewswire
Feb-20-19,"Class Action Update - Arlo Technologies, Inc. (ARLO), Micron Technology, Inc. (MU) and Ferroglobe PLC (GSM): Bronstein, Gewirtz & Grossman, LLC",ACCESSWIRE
Feb-20-19,"CLASS ACTION UPDATE for ARLO, MU and WRCDF, WCAGY: Levi & Korsinsky, LLP Reminds Investors of Class Actions on Behalf of Shareholders",GlobeNewswire
Feb-20-19,"Lawsuit for Investors in shares of Micron Technology, Inc. (NASDAQ: MU) announced by Shareholders Foundation",ACCESSWIRE
Feb-20-19,"Analysis: Positioning to Benefit within Micron Technology, Caterpillar, Agenus, Fossil Group, Marathon Petroleum, and Geo Group  Research Highlights Growth, Revenue, and Consolidated Results",GlobeNewswire
Feb-20-19,"CLASS ACTION UPDATE for DNKEY, SOGO, GSM and MU: Levi & Korsinsky, LLP Reminds Investors of Class Actions on Behalf of Shareholders",GlobeNewswire
Feb-21-19,"CLASS ACTION UPDATE for ATVI, MU, ASTE and AVP: Levi & Korsinsky, LLP Reminds Investors of Class Actions on Behalf of Shareholders",GlobeNewswire
Feb-21-19,"SHAREHOLDER ALERT: Pomerantz Law Firm Investigates Claims On Behalf of Investors of Micron Technology, Inc. - MU",GlobeNewswire
Feb-21-19,"SHAREHOLDER ALERT: Bronstein, Gewirtz & Grossman, LLC Reminds Investors of Class Action Against Micron Technology, Inc. (MU) & Lead Plaintiff Deadline: March 25, 2019",ACCESSWIRE
Feb-21-19,"CLASS ACTION UPDATE for DXC, W, MU and ASTE: Levi & Korsinsky, LLP Reminds Investors of Class Actions on Behalf of Shareholders",GlobeNewswire
Feb-21-19,"SHAREHOLDER ALERT: Bronstein, Gewirtz & Grossman, LLC Reminds Investors of Class Action Against Micron Technology, Inc. (MU) and Lead Plaintiff Deadline: March 25, 2019",ACCESSWIRE
Feb-21-19,"CLASS ACTION UPDATE for MU, VALE, GE and MHLD: Levi & Korsinsky, LLP Reminds Investors of Class Actions on Behalf of Shareholders",GlobeNewswire
Feb-21-19,"Arlo Technologies, Inc. (ARLO), Micron Technology, Inc. (MU) & Ferroglobe PLC (GSM): Bronstein, Gewirtz & Grossman, LLC Class Action Update",ACCESSWIRE
Feb-22-19,The Cold War in Tech Is Real and Investors Cant Ignore It,Barrons.com
Feb-22-19,"CLASS ACTION UPDATE for ALKS, MU, SVXY and UXIN: Levi & Korsinsky, LLP Reminds Investors of Class Actions on Behalf of Shareholders",GlobeNewswire
Feb-22-19,"SHAREHOLDER ALERT: Bronstein, Gewirtz & Grossman, LLC Reminds Investors of Class Action Against Micron Technology, Inc. (MU) & Lead Plaintiff Deadline: March 25, 2019",ACCESSWIRE
Feb-22-19,"CLASS ACTION UPDATE for PRGO, MU, MHLD and AVP: Levi & Korsinsky, LLP Reminds Investors of Class Actions on Behalf of Shareholders",GlobeNewswire
Feb-22-19,"SHAREHOLDER ALERT: Bronstein, Gewirtz & Grossman, LLC Reminds Investors of Class Action Against Micron Technology, Inc. (MU) & Lead Plaintiff Deadline: March 25, 2019",ACCESSWIRE
Feb-22-19,The 3D XPoint Could Be a True Game Changer for MU Stock,InvestorPlace
Feb-22-19,"MU ALERT: Zhang Investor Law Announces the Filing of a Securities Class Action Lawsuit Against Micron Technology, Inc.  MU",GlobeNewswire
Feb-22-19,"FILING DEADLINE--Kuznicki Law PLLC Announces Class Actions on Behalf of Shareholders of W, MKL, GSM and MU",GlobeNewswire
Feb-22-19,"Arlo Technologies, Inc. (ARLO), Micron Technology, Inc. (MU) & Ferroglobe PLC (GSM): Bronstein, Gewirtz & Grossman, LLC Class Action Update",ACCESSWIRE
Feb-22-19,"CLASS ACTION UPDATE for YRCW, YRIV, MU and AVP: Levi & Korsinsky, LLP Reminds Investors of Class Actions on Behalf of Shareholders",GlobeNewswire
Feb-25-19,Is Micron Stock Actually Cheap?,Motley Fool
Feb-25-19,"MICRON INVESTOR ALERT: Rosen Law Firm Reminds Micron Technology, Inc. Investors of Important Deadline in Class Action Lawsuit Seeking to Recover Investor Losses  MU",GlobeNewswire
Feb-25-19,How a U.S.-China Trade Deal Could Double S&P 500 Gains,Investopedia
Feb-25-19,"CLASS ACTION UPDATE for ARLO, YRCW, ATVI and MU: Levi & Korsinsky, LLP Reminds Investors of Class Actions on Behalf of Shareholders",GlobeNewswire
Feb-25-19,"FILING DEADLINE--Kuznicki Law PLLC Announces Class Actions on Behalf of Shareholders of YRCW, SOGO, W and MU",GlobeNewswire
Feb-25-19,"INVESTOR ALERT: Bronstein, Gewirtz & Grossman, LLC Reminds Stockholders of Class Action Against Micron Technology, Inc. (MU) & Lead Plaintiff Deadline: March 25, 2019",ACCESSWIRE
Feb-25-19,"CLASS ACTION UPDATE for DNKEY, YRCW, PRGO and MU: Levi & Korsinsky, LLP Reminds Investors of Class Actions on Behalf of Shareholders",GlobeNewswire
Feb-25-19,"INVESTOR ALERT: Bronstein, Gewirtz & Grossman, LLC Reminds Shareholders of Class Action Against Micron Technology, Inc. (MU) & Lead Plaintiff Deadline: March 25, 2019",ACCESSWIRE
Feb-25-19,Micron Technology Could Rise Another 25% From Here,TheStreet.com
Feb-25-19,"CLASS ACTION UPDATE for DBVT, ALKS, GSM and MU: Levi & Korsinsky, LLP Reminds Investors of Class Actions on Behalf of Shareholders",GlobeNewswire
Feb-25-19,Intel and Apple Among Stocks Set to Gain on Improving U.S.-China Relations,TheStreet.com
Feb-25-19,"Class Action Update MU, GSM & TYME - Bronstein, Gewirtz & Grossman, LLC",ACCESSWIRE
Feb-25-19,NanoLock Collaborates with Micron to Offer Flash-to-Cloud Management Solution for Security of IoT Devices,Business Wire
Feb-25-19,Micron Unveils Worlds First 1TB microSD Card to Meet Consumer Demand for Mobile Storage,GlobeNewswire
Feb-25-19,Stocks - U.S. Futures Rise as Trump Extends Trade Deadline,Investing.com
Feb-26-19,"CLASS ACTION UPDATE for DBVT, MKL, MU and TAP: Levi & Korsinsky, LLP Reminds Investors of Class Actions on Behalf of Shareholders",GlobeNewswire
Feb-26-19,"SHAREHOLDER ALERT: Pomerantz Law Firm Investigates Claims On Behalf of Investors of Micron Technology, Inc. - MU",ACCESSWIRE
Feb-26-19,"Micron Technology, Inc. (MU) : Bronstein, Gewirtz & Grossman, LLC Reminds Shareholders of Class Action & Lead Plaintiff Deadline: March 25, 2019",ACCESSWIRE
Feb-26-19,"CLASS ACTION UPDATE for SOGO, MU, SVXY and DPLO: Levi & Korsinsky, LLP Reminds Investors of Class Actions on Behalf of Shareholders",GlobeNewswire
Feb-26-19,"Micron Technology, Inc. (MU): Bronstein, Gewirtz & Grossman, LLC Reminds Stockholders of Class Action & Lead Plaintiff Deadline: March 25, 2019",ACCESSWIRE
Feb-26-19,"FILING DEADLINE--Kuznicki Law PLLC Announces Class Actions on Behalf of Shareholders of MU, MHLD, DPLO and AMRN",GlobeNewswire
Feb-26-19,"Bronstein, Gewirtz & Grossman, LLC Class Action Update MU, GSM & TYME -",ACCESSWIRE
Feb-26-19,"Market Trends Toward New Normal in Micron Technology, Harris, Sientra, Noble, Amphastar Pharmaceuticals, and CECO Environmental  Emerging Consolidated Expectations, Analyst Ratings",GlobeNewswire
Feb-27-19,"Micron Technology, Inc. (MU) : Bronstein, Gewirtz & Grossman, LLC Reminds Stockholders of Class Action & Lead Plaintiff Deadline: March 25, 2019",ACCESSWIRE
Feb-27-19,"CLASS ACTION UPDATE for MU, AVEO, DPLO and AMRN: Levi & Korsinsky, LLP Reminds Investors of Class Actions on Behalf of Shareholders",GlobeNewswire
Feb-27-19,Securities Class Action Filed Against Micron Technology Inc. by Block & Leviton LLP; Shareholders Are Encouraged to Contact the Firm,GlobeNewswire
Feb-27-19,Cold War With China Will Hurt U.S. Stocks Long After Trade Deal,Investopedia
Feb-27-19,"FILING DEADLINE--Kuznicki Law PLLC Announces Class Actions on Behalf of Shareholders of YRIV, W, MU and ASTE",GlobeNewswire
Feb-27-19,"Micron Technology, Inc. (MU) : Bronstein, Gewirtz & Grossman, LLC Reminds Stockholders of Class Action & Lead Plaintiff Deadline: March 25, 2019",ACCESSWIRE
Feb-27-19,"CLASS ACTION UPDATE for AXGN, MU, ASTE and KHC: Levi & Korsinsky, LLP Reminds Investors of Class Actions on Behalf of Shareholders",GlobeNewswire
Feb-27-19,"Bronstein, Gewirtz & Grossman, LLC Class Action MU, GSM & TYME",ACCESSWIRE
Feb-27-19,Micron Accelerates the Mobile Computing Experience With Introduction of New Client SSD,GlobeNewswire
Feb-27-19,"Top Analyst Sees Improving Conditions for Micron (MU), But the Stock Looks Fairly Valued",SmarterAnalyst
Feb-27-19,Micron Works With Qualcomm to Enable 5G Automotive Platform for Next-Generation Vehicles,GlobeNewswire
Feb-28-19,"Deadline Reminder: The Law Offices of Howard G. Smith Reminds Investors of Looming Deadline in the Class Action Lawsuit Against Micron Technology, Inc. (MU)",GlobeNewswire
Feb-28-19,"Micron Technology, Inc. (MU) : Bronstein, Gewirtz & Grossman, LLC Reminds of Class Action & Deadline: March 25, 2019",ACCESSWIRE
Feb-28-19,"SHAREHOLDER ALERT: Pomerantz Law Firm Investigates Claims On Behalf of Investors of Micron Technology, Inc. - MU",GlobeNewswire
Feb-28-19,"Micron Technology, Inc. (MU) : Bronstein, Gewirtz & Grossman, LLC Reminds of Class Action & Lead Plaintiff Deadline: March 25, 2019",ACCESSWIRE
Feb-28-19,SHAREHOLDER ALERT: YRIV GSM MU TYME: The Law Offices of Vincent Wong Reminds Investors of Important Class Action Deadlines,GlobeNewswire
Feb-28-19,"Class Action Bronstein, Gewirtz & Grossman, LLC MU, GSM & TYME",ACCESSWIRE
Feb-28-19,How to Profit Off a U.S.-China Stock Rebound,Investopedia
Mar-01-19,"The Klein Law Firm Reminds Investors of Class Actions on Behalf of Shareholders of ARLO, GSM, MU and VALE",GlobeNewswire
Mar-01-19,"New Research Coverage Highlights Micron Technology, Varian Medical, St. Joe, Himax Technologies, Aerie Pharmaceuticals, and Hexcel  Consolidated Revenues, Company Growth, and Expectations for 2019",GlobeNewswire
Mar-04-19,"(MU) Micron Technology, Inc.: Bronstein, Gewirtz & Grossman, LLC Reminds Investors of Class Action & Final Deadline: March 25, 2019",ACCESSWIRE
Mar-04-19,"CLASS ACTION UPDATE for ARLO, DBVT, MAXR and MU: Levi & Korsinsky, LLP Reminds Investors of Class Actions on Behalf of Shareholders",GlobeNewswire
Mar-05-19,"Bragar Eagel & Squire, P.C. Announces That a Class Action Lawsuit Has Been Filed Against Micron Technology, Inc. (MU) and Encourages MU Investors to Contact the Firm",GlobeNewswire
Mar-05-19,This Latest Memory Industry News Isn't Good for Micron,Motley Fool
Mar-05-19,"FILING DEADLINE--Kuznicki Law PLLC Announces Class Actions on Behalf of Shareholders of ARLO, MU, ASTE and MHLD",GlobeNewswire
Mar-05-19,"Microns Profits Will Disappoint Because Chip Prices Are Plunging, Analyst Says",Barrons.com
Mar-05-19,9 Trade War Stocks to Sell on U.S.-China Deal News,InvestorPlace
Mar-05-19,"Class Action: 22nd Century Group, Inc. (XXII), Arlo Technologies, Inc. (ARLO), Micron Technology, Inc. (MU) Bronstein, Gewirtz & Grossman, LLC",ACCESSWIRE
Mar-05-19,"Consolidated Research: 2019 Summary Expectations for Campbell Soup, Compass Diversified, Micron Technology, Juniper Networks, Archer Daniels Midland, and TreeHouse Foods  Fundamental Analysis, Key Performance Indications",GlobeNewswire
Mar-06-19,"The Klein Law Firm Reminds Investors of Class Actions on Behalf of Shareholders of ATVI, MU and SYNH",ACCESSWIRE
Mar-06-19,Stocks - Dow Downed by Falling Energy Stocks,Investing.com
Mar-06-19,Micron Shares Fall as Analysts Cite Concerns About Memory Prices,TheStreet.com
Mar-06-19,"MICRON LEAD PLAINTIFF DEADLINE ALERT: Faruqi & Faruqi, LLP Encourages Investors Who Suffered Losses Exceeding $50,000 In Micron Technology, Inc. To Contact The Firm",GlobeNewswire
Mar-06-19,SHAREHOLDER ALERT: AXGN GSM MU TYME: The Law Offices of Vincent Wong Reminds Investors of Important Class Action Deadlines,GlobeNewswire
Mar-06-19,"Micron's stock sinks again to pace chip losers as DRAM, NAND pricing concerns continue",MarketWatch
Mar-06-19,DRAM Prices Are Falling Off a Cliff,Motley Fool
Mar-06-19,"Stocks - U.S. Futures Slip on Trade Deal Wait, European Bank Woes",Investing.com
Mar-08-19,"The Klein Law Firm Reminds Investors of Class Actions on Behalf of Shareholders of SOGO, MU and SYNH",ACCESSWIRE
Mar-08-19,Analyst Cuts His Micron Profit Forecast Thanks to Falling Chip Prices,Barrons.com
Mar-08-19,Why Seagate Stock Could Be a Yield Trap,InvestorPlace
Mar-08-19,10 Tech Stocks to Buy Now for 2025,InvestorPlace
Mar-08-19,SHAREHOLDER ALERT: ARLO MU CVS: The Law Offices of Vincent Wong Reminds Investors of Important Class Action Deadlines,ACCESSWIRE
Mar-11-19,"MICRON LEAD PLAINTIFF DEADLINE ALERT: Faruqi & Faruqi, LLP Encourages Investors Who Suffered Losses Exceeding $50,000 In Micron Technology, Inc. To Contact The Firm",PR Newswire
Mar-11-19,Micron (MU) Gains But Lags Market: What You Should Know,Zacks
Mar-11-19,Buy NVDA Stock With Nvidia Set to Buy Mellanox to Expand Cloud Business?,Zacks
Mar-11-19,Applied Materials Stock Has Upside But May Require Patience,InvestorPlace
Mar-12-19,"SHAREHOLDER ALERT: Pomerantz Law Firm Reminds Shareholders with Losses on their Investment in Micron Technology, Inc. of Class Action Lawsuit and Upcoming Deadline  MU",ACCESSWIRE
Mar-12-19,"Jim Cramer: Nvidia's Mellanox Deal, and Apple Upgrade, Have Lifted the Semis",TheStreet.com
Mar-12-19,"The Klein Law Firm Reminds Investors of Class Actions on Behalf of Shareholders of ARLO, ATVI, MU and TYME",GlobeNewswire
Mar-12-19,Top Analyst Remains Sidelined on Micron (MU) Stock as Worries of Plummeting ASPs Accelerate,SmarterAnalyst
Mar-12-19,"MU DEADLINE: Zhang Investor Law Reminds Investors of March 25 Deadline in Securities Class Action Lawsuit Against Micron Technology, Inc.  MU",GlobeNewswire
Mar-12-19,"CLASS ACTION UPDATE for MU, GE, MHLD and CNDT: Levi & Korsinsky, LLP Reminds Investors of Class Actions on Behalf of Shareholders",GlobeNewswire
Mar-12-19,"(MU) Micron Technology, Inc.: Bronstein, Gewirtz & Grossman, LLC Reminds Shareholders of Class Action & Final Deadline: March 25, 2019",ACCESSWIRE
Mar-12-19,Why 2019 Probably Will Be a Really Tough Year for Nvidia Stock,InvestorPlace
Mar-12-19,Is Micron Stock Poised To Make New Lows On Changes To DRAM Chip Outlook?,InvestorPlace
Mar-13-19,Lane Partners nearly doubles money on sale of big North San Jose campus,American City Business Journals
Mar-13-19,"FILING DEADLINE--Kuznicki Law PLLC Announces Class Actions on Behalf of Shareholders of ATVI, MU, STMP and BPI",GlobeNewswire
Mar-13-19,"(MU) Micron Technology, Inc.: Bronstein, Gewirtz & Grossman, LLC Reminds of Class Action & Deadline: March 25, 2019",ACCESSWIRE
Mar-13-19,Analysts Estimate Micron (MU) to Report a Decline in Earnings: What to Look Out for,Zacks
Mar-13-19,SHAREHOLDER ALERT: MAXR MU TYME TAP: The Law Offices of Vincent Wong Reminds Investors of Important Class Action Deadlines,GlobeNewswire
Mar-13-19,Five Tech Stocks to Watch this Week,ACCESSWIRE
Mar-13-19,"Stocks - U.S. Futures Subdued Amid Brexit, Trade Worries; Rite Aid Soars",Investing.com
Mar-14-19,"SHAREHOLDER ALERT: Pomerantz Law Firm Reminds Shareholders with Losses on their Investment in Micron Technology, Inc. of Class Action Lawsuit and Upcoming Deadline  MU",ACCESSWIRE
Mar-14-19,"Deadline Reminder: The Law Offices of Howard G. Smith Reminds Investors of Looming Deadline in the Class Action Lawsuit Against Micron Technology, Inc. (MU)",GlobeNewswire
Mar-14-19,"CLASS ACTION UPDATE for MU, STMP and VNDA: Levi & Korsinsky, LLP Reminds Investors of Class Actions on Behalf of Shareholders",ACCESSWIRE
Mar-15-19,"7-DAY DEADLINE ALERT: The Schall Law Firm Announces the Filing of a Class Action Lawsuit Against Micron Technology, Inc. and Encourages Investors with Losses in Excess of $500,000 to Contact the Firm",GlobeNewswire
Mar-15-19,"Micron earnings: As memory-chip glut persists, can forecast raise hopes?",MarketWatch
Mar-15-19,7 Single-Digit P/E Stocks With Massive Upside,InvestorPlace
Mar-15-19,"MICRON LEAD PLAINTIFF DEADLINE ALERT: Faruqi & Faruqi, LLP Encourages Investors Who Suffered Losses Exceeding $50,000 In Micron Technology, Inc. To Contact The Firm",GlobeNewswire
Mar-15-19,3 Earnings Reports to Watch Next Week,InvestorPlace
Mar-15-19,3 Semiconductor Stocks to Buy Right Now,Zacks
Mar-15-19,"CLASS ACTION UPDATE for SPB, MU and CTL: Levi & Korsinsky, LLP Reminds Investors of Class Actions on Behalf of Shareholders",ACCESSWIRE
Mar-15-19,Micron (MU) Q2 Earnings: What's in the Cards for the Stock?,Zacks
Mar-15-19,Is Micron Technologys (NASDAQ:MU) Share Price Gain Of 245% Well Earned?,Simply Wall St.
Mar-15-19,Stocks - U.S. Futures Rise on Trade Progress,Investing.com
Mar-18-19,"Buy 'Cheap' Micron (MU) Stock Before Earnings, Despite Chip Price Worries?",Zacks
Mar-18-19,"Forget Falling Chip Prices, Micron Stock Is Cheap",Barrons.com
Mar-18-19,Will Falling Chip Prices Thwart Micron's (MU) Q2 Earnings?,Zacks
Mar-18-19,"Block & Leviton LLP Reminds Shareholders of Important Deadlines: MU, AKRX, SYNH, CTL",GlobeNewswire
Mar-18-19,5 Earnings Charts to Watch this Week,Zacks
Mar-18-19,Micron Boosts Client Computing Performance With Introduction of New NVMe SSD Portfolio,GlobeNewswire
Mar-18-19,"Micron earnings: As memory-chip glut persists, can forecast raise hopes?",MarketWatch
Mar-19-19,Stocks to Watch in March,Motley Fool
Mar-19-19,"SHAREHOLDER ALERT: Pomerantz Law Firm Reminds Shareholders with Losses on their Investment in Micron Technology, Inc. of Class Action Lawsuit and Upcoming Deadline  MU",ACCESSWIRE
Mar-19-19,Cramer: Market action shows investors are taking a 'leap of taste',CNBC
Mar-19-19,"CLASS ACTION UPDATE for SPB, ARLO, MU and GE: Levi & Korsinsky, LLP Reminds Investors of Class Actions on Behalf of Shareholders",GlobeNewswire
Mar-19-19,4 Unexpected Trade War Stocks That Will Benefit From an End to Tariffs,InvestorPlace
Mar-19-19,"Nasdaq Extends Gains As Advanced Micro, Nvidia, Micron Lead Another Chip Rally",Investor's Business Daily
Mar-19-19,Micron Tech Reports Earnings in Recovery Mode,TheStreet.com
Mar-19-19,Micron Analyst: Don't Look for Chipmaker to Recover in Second Half,TheStreet.com
Mar-19-19,How Will Micron (MU) Stock React to Wednesdays Earning Release?,SmarterAnalyst
Mar-19-19,StockBeat - AMD Rallies Amid 'Significant Opportunity' From Cloud Gaming,Investing.com
Mar-19-19,Micron Earnings Could Squeeze Complacent Bears,Investopedia
Mar-19-19,Brace Yourself for Micron's Earnings Report,Motley Fool
Mar-19-19,Micron Stock Will Likely See Little Change After Wednesdays Earnings Report,InvestorPlace
Mar-19-19,Stocks - U.S. Futures Rise as FOMC Meeting Kicks Off,Investing.com
Mar-20-19,Dow Jones Futures: Market Rally Grows FANGs; These 2 Stocks Are Active Late,Investor's Business Daily
Mar-20-19,Micron recognizes reality and receives a relief rally,MarketWatch
Mar-20-19,Micron Gains in Spite of Light Guidance: 6 Key Takeaways,TheStreet.com
Mar-20-19,"Micron's Profits Tumble, With More Pain to Come",Motley Fool
Mar-20-19,"Micron sees memory chip recovery coming later in year, shares rise",Reuters
Mar-20-19,Micron Says It Will Cut Output as Memory Chip Demand Stalls,Bloomberg
Mar-20-19,After-Hours News: Micron and Uniti Earnings,Motley Fool
Mar-20-19,"Micron (MU) Misses Estimates 1st Time in Years, Plus GES, WSM",Zacks
Mar-20-19,Micron Stock Is Climbing Despite Disappointing Guidance,Barrons.com
Mar-20-19,"Micron stock rises despite weak outlook, company plans to cut spending",MarketWatch
Mar-20-19,"Chipmaker Micron beats revenue, profit estimates",Reuters
Mar-20-19,"Stocks making the biggest moves after hours: Micron, Williams-Sonoma, Guess and more",CNBC
Mar-20-19,Micron Shares Rise as Memory Chipmaker Beats Estimates,TheStreet.com
Mar-20-19,Micron Earnings Top Views In 'Challenging Market Environment',Investor's Business Daily
Mar-20-19,Micron beats second quarter revenue expectations,CNBC Videos
Mar-20-19,Micron: Fiscal 2Q Earnings Snapshot,Associated Press
Mar-20-19,Micron stock ticks higher as results top lowered Wall Street expectations,MarketWatch
Mar-20-19,"Micron Technology, Inc., Reports Results for the Second Quarter of Fiscal 2019",GlobeNewswire
Mar-20-19,Last Minute Thought: Buy or Sell Micron (MU) Stock Before 2Q19 Report?,SmarterAnalyst
Mar-20-19,Micron's stock could drop another 15% on make-or-break earnings report: Analyst,CNBC
Mar-20-19,"22nd Century Group, Inc. (XXII), Arlo Technologies, Inc. (ARLO), Micron Technology, Inc. (MU) Bronstein, Gewirtz & Grossman, LLC Class Action Reminder",GlobeNewswire
Mar-20-19,Analysts expecting 'tough quarter' for Micron's earnings report,CNBC
Mar-20-19,Will Semiconductor ETFs' Best Start to a Year Last Long?,Zacks
Mar-20-19,"Micron earnings: As memory-chip glut persists, can forecast raise hopes?",MarketWatch
Mar-20-19,"The Klein Law Firm Reminds Investors of Class Actions on Behalf of Shareholders of GSM, MU, VNDA and WTW",GlobeNewswire
Mar-20-19,3 Chip Stocks to Buy for the Next 3 Years,InvestorPlace
Mar-20-19,Stocks - U.S. Futures Muted Ahead of Fed Decision,Investing.com
Mar-21-19,Edited Transcript of MU earnings conference call or presentation 20-Mar-19 8:30pm GMT,Thomson Reuters StreetEvents
Mar-21-19,"Deadline Reminder: The Law Offices of Howard G. Smith Reminds Investors of Looming Deadline in the Class Action Lawsuit Against Micron Technology, Inc. (MU)",GlobeNewswire
Mar-22-19,Mohnish Pabrai Interview With GuruFocus: Finding Value in India and the US,GuruFocus.com
