date,title,source
Dec-20-18,"3 Big Stock Charts for Thursday: McCormick & Co, Verizon and Alexandria Real Estate Equities",InvestorPlace
Dec-20-18,Here are stock losers to buy today  because others are selling them for tax purposes,MarketWatch
Dec-21-18,"Bear Market Triggered After Fed Rate Hike, Trump Threat; Oil Prices, FedEx, Micron, Tilray, Micron: Weekly Review",Investor's Business Daily
Dec-21-18,"The Zacks Analyst Blog Highlights: Disney, U.S. Bancorp, EOG, 3M and Micron",Zacks
Dec-21-18,Here are stock losers to buy today  because others are selling them for tax purposes,MarketWatch
Dec-21-18,"When Micron Stock Slid, Insiders Stopped Selling",Barrons.com
Dec-24-18,Micron's Fiscal First Quarter of 2019 Was OK. What's the Short-Term Outlook?,Motley Fool
Dec-24-18,"Micron Stock Dips to a New 52-Week Low, Shares Decline 3%",Zacks
Dec-24-18,Micron's Prospects Should Improve Significantly by the End of 2019,TheStreet.com
Dec-24-18,3 Things You Shouldn't Miss from Micron's Last Earnings Call,Motley Fool
Dec-26-18,Stock Investors: How to Prepare for a Recession in 2019,Zacks
Dec-26-18,Seagate Pin Hopes on Appointment of Gianluca Romano as CFO,Zacks
Dec-27-18,Beaten-Down Chip Equipment Stocks Lead Semiconductor Rebound,Bloomberg
Dec-27-18,Chip Stocks Under Pressure Midday in Overall Selloff,Investing.com
Dec-27-18,Stocks Drop: FANGs Chip Stocks Tumble; Dow Jones Dives 300-Points,Investor's Business Daily
Dec-27-18,"Zacks Market Edge Highlights: Micron, Qualcomm, Apple, Amazon and Twitter",Zacks
Dec-28-18,Micron (MU) Dips More Than Broader Markets: What You Should Know,Zacks
Dec-28-18,MU Stock Is Worth Watching as It Cycles out of This Downturn,InvestorPlace
Dec-28-18,Should You Join Advanced Micro Devices Stock as Part of the NASDAQ-100?,InvestorPlace
Dec-28-18,Marvell Directors Are Buying Up the Chip Stock,Barrons.com
Dec-31-18,7 Stocks to Sell In January,InvestorPlace
Jan-02-19,Micron Stock Isn't As Cheap As It Looks,Motley Fool
Jan-02-19,Here's What to Expect from Micron (MU) Stock in 2019,Zacks
Jan-02-19,Advanced Micro Devices Stock Is In Good Shape for 2019,InvestorPlace
Jan-02-19,"Micron Stock Is Getting Cheaper, but Dont Buy Until This Happens",InvestorPlace
Jan-02-19,"New Research: Key Drivers of Growth for Hewlett Packard Enterprise, Micron Technology, Cirrus Logic, Applied Genetic Technologies, KemPharm, and Communications  Factors of Influence, Major Initiatives and Sustained Production",GlobeNewswire
Jan-03-19,What's Next For Apple (AAPL) After It Slashed Its Q1 Sales Forecast?,Zacks
Jan-03-19,Nvidia Stock Is Far Too Cheap to Ignore Now,InvestorPlace
Jan-03-19,Stocks - Wall Street Hammered as Apples Problems Take on Global Significance,Investing.com
Jan-03-19,"The Zacks Analyst Blog Highlights: Micron, Nvidia, AMD and Intel",Zacks
Jan-03-19,Semiconductor Sales Dip in November: Can Chipmakers Rebound?,Zacks
Jan-04-19,Values and Value StocksHow to Beat the Market,Barrons.com
Jan-04-19,"Stocks - Wall Street Soars on 'Patient' Powell, Strong Jobs Data",Investing.com
Jan-07-19,Cramer Remix: This chipmaker could have another bad quart...,CNBC Videos
Jan-07-19,Cramer Remix: This chipmaker could have another bad quarterbut it's worth buying now,CNBC
Jan-07-19,Here's What to Expect from Nvidia (NVDA) Stock in 2019,Zacks
Jan-07-19,"BMO Sees Nearly 50% Upside Potential In Micron, 'Attractive' Risk-Reward Picture",Benzinga
Jan-07-19,"Micron Climbs as BMO Upgrades the Stock, Raises Target Price",TheStreet.com
Jan-07-19,"Micron upgraded to outperform at BMO, traders debate the ...",CNBC Videos
Jan-07-19,Better Buy: NVIDIA vs. Micron Technology,Motley Fool
Jan-07-19,Micron shares gain after BMO upgrade that sees 50% rebound this year,CNBC
Jan-07-19,"Micron has 'bottomed out' and is set to rebound 50% this year, analyst says",CNBC
Jan-07-19,Mobileye Selects Micron to Advance Development of Its Fifth-Generation Autonomous Driving Platform,GlobeNewswire
Jan-08-19,Why Chip Stocks Face More Carnage In 2019,Investopedia
Jan-08-19,"Samsung Chip Warning Is Bad News for Micron Stock, Says Analyst",Barrons.com
Jan-08-19,Micron (MU) Stock Sinks As Market Gains: What You Should Know,Zacks
Jan-08-19,Micron Shares Fall as Samsung's Guidance Confirms Weak Memory Demand,TheStreet.com
Jan-08-19,4 Stocks to Invest In for Their Buyback Programs,InvestorPlace
Jan-08-19,Can Micron Stock Rally More Than 50% to $50?,TheStreet.com
Jan-08-19,The Four Key Questions to Consider Before Buying Caterpillar Stock,InvestorPlace
Jan-08-19,Western Digital (WDC) Unveils Storage Products at CES 2019,Zacks
Jan-08-19,Micron's Solutions Chosen by Mobileye to Aid ADAS Efforts,Zacks
Jan-08-19,Oversold Opportunities Rallying You Need to Know,ACCESSWIRE
Jan-09-19,China chipmaker Fujian Jinhua pleads not guilty to US trade secrets theft charges,Reuters
Jan-09-19,Edited Transcript of MU earnings conference call or presentation 18-Dec-18 9:30pm GMT,Thomson Reuters StreetEvents
Jan-09-19,Jim Cramer: Today's Theme - Buy Ahead of the End of Bad News,TheStreet.com
Jan-09-19,U.S. Deploys New Tactics in Prosecution of Chinese Chipmaker,Bloomberg
Jan-09-19,Cramer on chip stocks' reversal: 'You can't wait for an all-clear sign' to buy,CNBC
Jan-09-19,Micron Stock Upgraded Twice in 1 Week: What You Need to Know,Motley Fool
Jan-09-19,"Why Canopy Growth, Chesapeake Energy, and Micron Technology Jumped Today",Motley Fool
Jan-09-19,Micron and Intuitive Surgical jump while Constellation skids,Associated Press
Jan-09-19,Why Is Micron (MU) Stock Surging Today?,Zacks
Jan-09-19,4 Tech Stocks Hitting Their Stride on Wednesday (1/9/19),ACCESSWIRE
Jan-09-19,Micron stock jumps after Bernstein upgrade,MarketWatch
Jan-09-19,Chip Stocks Biggest Rally Since 2015,ACCESSWIRE
Jan-09-19,"Bad News for Chips Will Eventually Be Good News for Micron Stock, Analyst Says",Barrons.com
Jan-09-19,Micron CEO: Outside factors caused us to lower guidance,CNBC Videos
Jan-09-19,Why Chip Stocks Face More Carnage In 2019,Investopedia
Jan-09-19,Micron-Qualcomm Partner to Build Automotive Cockpit Platform,Zacks
Jan-09-19,Chip Stocks Higher Midday Despite Lowered Guidance,Investing.com
Jan-10-19,3 Top Digital Memory Stocks to Buy in 2019,Motley Fool
Jan-10-19,7 Stocks at Risk of the Global Smartphone Slowdown,InvestorPlace
Jan-10-19,"Wynn Resorts, Sprouts Farmers Market and Micron highlighted as Zacks Bull and Bear of the Day",Zacks
Jan-10-19,"3 Big Stock Charts for Thursday: PayPal, Nike and Micron Technology",InvestorPlace
Jan-10-19,Today's Research Reports on Trending Tickers: Advanced Micro Devices and Micron Technology,ACCESSWIRE
Jan-10-19,Stocks - U.S. Futures Fall as Government Shutdown Starts to Weigh,Investing.com
Jan-11-19,"NXP Partners Kalray on ADAS Efforts, Ups Game in Self-Drive",Zacks
Jan-11-19,Micron Scores Big Automotive Deals With Intel and Qualcomm,Motley Fool
Jan-11-19,"Analysts Think Micron Stock Has Bottomed Out, But Proceed With Caution",InvestorPlace
Jan-14-19,Why Micron Technology Stock Fell 22.8% in 2018,Motley Fool
Jan-14-19,Western Digitals Dividend Isnt as Safe as It Looks,Motley Fool
Jan-14-19,3 Things Micron Management Wants You to Know,Motley Fool
Jan-14-19,Micron Technology Slides on Morgan Stanley Downgrade,TheStreet.com
Jan-14-19,Turmoil in tech: 3 trades,CNBC Videos
Jan-14-19,Micron Exercises Call Option to Acquire Remaining Interest in IM Flash Technologies Joint Venture,GlobeNewswire
Jan-14-19,Stock Market Down But Not Out; Can Apple Get Back On Track?,Investor's Business Daily
Jan-14-19,"Xilinx Gets Price-Target Hike, Named A Top Chip Stock Pick For 2019",Investor's Business Daily
Jan-14-19,Morgan Stanley Says Micron Stock Has Risen Too Far,Barrons.com
Jan-14-19,Micron's stock falls after analyst sees no rebound 'at any point' in 2019,MarketWatch
Jan-14-19,Why You Should Buy Micron Stock Now for the Long Run  Not Sell It,InvestorPlace
Jan-14-19,Stocks - U.S. Futures Slip after Chinese Exports Shrink,Investing.com
Jan-15-19,Micron Confirms It's Buying Out Intel in Flash Memory Joint Venture,TheStreet.com
Jan-15-19,Micron (MU) Stock Sinks As Market Gains: What You Should Know,Zacks
Jan-15-19,8 Corporate Earnings That Are Vulnerable To China's Downturn,Investopedia
Jan-16-19,"Look to Semiconductor ETFs Once U.S., China Reach a Deal",ETF Trends
Jan-16-19,These stocks could surge the most if and when US and China reach a trade deal,CNBC
Jan-16-19,Micron to Own 100% of IM Flash Post Intel's Share Purchase,Zacks
Jan-16-19,8 Corporate Earnings That Are Vulnerable To China's Downturn,Investopedia
Jan-17-19,[$$] U.S. Adds Criminal Courts to Its Fight Against Chinese Theft of Trade Secrets,The Wall Street Journal
Jan-17-19,These stocks could surge the most if the US lowers tariffs on China and makes a trade deal,CNBC
Jan-17-19,"5 Picks in Chip Stocks, Now That the Sectors Hit Bottom",Barrons.com
Jan-17-19,Why Is Micron (MU) Up 6.9% Since Last Earnings Report?,Zacks
Jan-17-19,Today's Research Reports on Trending Tickers: Micron Technology and NVIDIA,ACCESSWIRE
Jan-18-19,Boeing (BA) Stock Was a Strong Buy Before US-China Trade Positivity,Zacks
Jan-18-19,"EQUITY ALERT: Rosen Law Firm Announces Investigation of Securities Claims Against Micron Technology, Inc.  MU",Business Wire
Jan-18-19,Micron Technology Inc. Investigated by Block & Leviton LLP For Violations of Federal Securities Laws,GlobeNewswire
Jan-22-19,"INVESTIGATION REMINDER: The Schall Law Firm Announces it is Investigating Claims Against Micron Technology, Inc. and Encourages Investors with Losses in Excess of $100,000 to Contact the Firm",Business Wire
Jan-22-19,"Glancy Prongay & Murray LLP Announces Investigation on Behalf of Micron Technology, Inc. Investors (MU)",Business Wire
Jan-22-19,"INVESTOR ALERT: Law Offices of Howard G. Smith Announces Investigation on Behalf of Micron Technology, Inc. Investors (MU)",Business Wire
Jan-22-19,"[$$] Stocks to Watch: Arconic, eBay, Facebook, Micron",The Wall Street Journal
Jan-22-19,Stocks - Wall Street Weaker on Global Growth Concerns,Investing.com
Jan-23-19,Securities Class Action Filed Against Micron Technology Inc. by Block & Leviton LLP; Shareholders Are Encouraged to Contact the Firm,GlobeNewswire
Jan-23-19,Earnings Growth Slowing Down,Zacks
Jan-23-19,Earnings Growth Slowing Down,Zacks
Jan-23-19,Micron Stock Still Too Early to Buy,TheStreet.com
Jan-23-19,Should You Buy Micron Technology Stock Because of This?,Motley Fool
Jan-23-19,"Dont Jump on Nvidia Stock Just Yet, It Might Stay Stuck Awhile",InvestorPlace
Jan-24-19,"CLASS ACTION UPDATE for DNKEY, SOGO and MU: Levi & Korsinsky, LLP Reminds Investors of Class Actions on Behalf of Shareholders",GlobeNewswire
Jan-24-19,Investors With Outsized Bets on One Stock: David Tepper and Daniel Loeb,GuruFocus.com
Jan-24-19,SHAREHOLDER ALERT: YOGA YRCW PRGO MU: The Law Offices of Vincent Wong Reminds Investors of Important Class Action Deadlines,GlobeNewswire
Jan-24-19,Why Is Micron (MU) Stock Surging Today?,Zacks
Jan-24-19,"3 Pros, 3 Cons of Micron Stock",InvestorPlace
Jan-24-19,Do You Have the Guts to be a Value Investor?,Zacks
Jan-24-19,"EQUITY ALERT: Rosen Law Firm Announces Filing of Securities Class Action Lawsuit Against Micron Technology, Inc.  MU",Business Wire
Jan-24-19,"Zacks Earnings Trends Highlights: Apple, JPMorgan, Micron Technology",Zacks
Jan-25-19,"Robbins Arroyo LLP: Micron Technology, Inc. (MU) Misled Shareholders According to a Recently Filed Class Action",Business Wire
Jan-25-19,"MU DEADLINE REMINDER: Rosen Law Firm Reminds Micron Technology, Inc. Investors of Important Deadline in Class Action  MU",Business Wire
Jan-25-19,"Glancy Prongay & Murray LLP Announces Investigation on Behalf of Micron Technology, Inc. Investors (MU)",GlobeNewswire
Jan-25-19,Western Digital Stock Jumps On Positive Second-Half Outlook,Investor's Business Daily
Jan-25-19,SHAREHOLDER ALERT: CMCM ATVI GSM MU: The Law Offices of Vincent Wong Reminds Investors of Important Class Action Deadlines,GlobeNewswire
Jan-25-19,"SHAREHOLDER ACTION ALERT: The Schall Law Firm Announces the Filing of a Class Action Lawsuit Against Micron Technology, Inc. and Encourages Investors with Losses in Excess of $500,000 to Contact the Firm",ACCESSWIRE
Jan-25-19,SHAREHOLDER ALERT: SOGO W SNAP MU: The Law Offices of Vincent Wong Reminds Investors of Important Class Action Deadlines,GlobeNewswire
Jan-25-19,"CLASS ACTION UPDATE for ATVI, GSM and MU: Levi & Korsinsky, LLP Reminds Investors of Class Actions on Behalf of Shareholders",GlobeNewswire
Jan-25-19,"IMPORTANT INVESTOR ALERT: The Schall Law Firm Announces the Filing of a Class Action Lawsuit Against Micron Technology, Inc. and Encourages Investors with Losses in Excess of $500,000 to Contact the Firm",GlobeNewswire
Jan-25-19,"SHAREHOLDER ALERT: Bronstein, Gewirtz & Grossman, LLC Notifies Investors of Class Action Against Micron Technology, Inc. (MU) & Lead Plaintiff Deadline: March 25, 2019",ACCESSWIRE
Jan-25-19,I'm Particularly Attracted to the Breakout in Micron,TheStreet.com
Jan-25-19,An Early Nvidia (NVDA) Q4 Earnings Preview,Zacks
Jan-25-19,Dont Bite Into the Cheap Western Digital Stock Price,InvestorPlace
Jan-25-19,These 7 stocks will get a big boost when the U.S.-China tariff wars wind down,MarketWatch
Jan-25-19,"Funko, Occidental Petroleum, Micron, Lam Research and Texas Instruments highlighted as Zacks Bull and Bear of the Day",Zacks
Jan-25-19,"Zacks Value Trader Highlights: Micron, Apple, Bank OZK, WW and Fossil",Zacks
Jan-25-19,Chinese Chipmaker to Appeal U.S. Ban Over Alleged Secrets Theft,Bloomberg
Jan-25-19,China's Fujian Jinhua to file complaint to be taken off U.S. export control list,Reuters
Jan-28-19,"RM LAW Announces Class Action Lawsuit Against Micron Technology, Inc.",PR Newswire
Jan-28-19,What to Expect from AMD Q4 Earnings After Nvidia Lowered Guidance,Zacks
Jan-28-19,SHAREHOLDER ALERT: TDOC SNAP GSM MU: The Law Offices of Vincent Wong Reminds Investors of Important Class Action Deadlines,GlobeNewswire
Jan-28-19,"IMPORTANT DEADLINE REMINDER: The Schall Law Firm Announces the Filing of a Class Action Lawsuit Against Micron Technology, Inc. and Encourages Investors with Losses in Excess of $500,000 to Contact the Firm",ACCESSWIRE
Jan-28-19,"Glancy Prongay & Murray LLP Announces the Filing of a Securities Class Action on Behalf of Micron Technology, Inc. Investors (MU)",Business Wire
Jan-28-19,"As Tempting as It Is, AMD Stock Still Comes down to Valuation",InvestorPlace
Jan-28-19,"Why Boeing Is a Strong Buy Stock and News from CAT, NVDA, &amp; VALE",Zacks
Jan-28-19,"SHAREHOLDER ALERT: Bronstein, Gewirtz & Grossman, LLC Reminds Investors of Class Action Against Micron Technology, Inc. (MU) & Lead Plaintiff Deadline: March 25, 2019",ACCESSWIRE
Jan-28-19,Nvidias Growth Story Hits a Wall,InvestorPlace
Jan-28-19,"IMPORTANT INVESTOR REMINDER: The Schall Law Firm Announces the Filing of a Class Action Lawsuit Against Micron Technology, Inc. and Encourages Investors with Losses in Excess of $500,000 to Contact the Firm",Business Wire
Jan-28-19,Time to Cash In the Chips On Micron Stock,InvestorPlace
Jan-28-19,"AMD, Micron and Intel shares sink after Nvidia cuts revenue and gross margin guidance",MarketWatch
Jan-28-19,"Dow, NASDAQ Rise Just Enough for a 5-Week Rally",Zacks
Jan-28-19,"MarketPulse: Nvidia Nosedives, Dragging Semis South",Investing.com
Jan-28-19,"CLASS ACTION UPDATE for ATVI, GSM and MU: Levi & Korsinsky, LLP Reminds Investors of Class Actions on Behalf of Shareholders",GlobeNewswire
Jan-28-19,[$$] Trade war forces Chinese chipmaker Fujian Jinhua to halt output,Financial Times
Jan-29-19,"Kuznicki Law PLLC Announces Class Actions on Behalf of Shareholders of GSM, MU, VALE and TYME",GlobeNewswire
Jan-29-19,"Law Offices of Howard G. Smith Announces the Filing of a Securities Class Action on Behalf of Micron Technology, Inc. Investors (MU)",Business Wire
Jan-29-19,Micron (MU) Dips More Than Broader Markets: What You Should Know,Zacks
Jan-29-19,"Federman & Sherwood Announces Filing of Securities Class Action Lawsuit Against Micron Technology, Inc.",Business Wire
Jan-29-19,"CLASS ACTION UPDATE for SOGO, MAXR, GSM and MU: Levi & Korsinsky, LLP Reminds Investors of Class Actions on Behalf of Shareholders",GlobeNewswire
Jan-29-19,6 Stocks After Nvidia That May Blow Up on China's Slowdown,Investopedia
Jan-29-19,Dont Be So Quick to Catch the Nvidia Stock Falling Knife,InvestorPlace
Jan-29-19,"Kuznicki Law PLLC Announces Class Actions on Behalf of Shareholders of SOGO, SNAP, ATVI and MU",GlobeNewswire
Jan-29-19,5 ETFs Hit By NVIDIA's Revenue Guidance Cut,Zacks
Jan-29-19,"INVESTOR ACTION ALERT: The Schall Law Firm Announces the Filing of a Class Action Lawsuit Against Micron Technology, Inc. and Encourages Investors with Losses in Excess of $500,000 to Contact the Firm",Business Wire
Jan-29-19,"Stock Market News For Jan 29, 2019",Zacks
Jan-29-19,NVIDIA (NVDA) Down on Reduction in Revenue Forecast for Q4,Zacks
Jan-29-19,Nvidia Short Sellers Have Earned $1.3B in Profits Since Mid-November,Investopedia
Jan-29-19,"3 Big Stock Charts for Tuesday: Micron Technology, Western Digital and PayPal Holdings",InvestorPlace
Jan-29-19,"Micron Stock Is Perfect For Patient, Buy and Wait Investors",InvestorPlace
Jan-30-19,"Glancy Prongay & Murray LLP Reminds Investors of the Deadline in the Class Action Lawsuit Against Micron Technology, Inc. (MU)",Business Wire
Jan-30-19,7 Stocks With Too Much Riding On China,InvestorPlace
Jan-30-19,Should You Buy Nvidia Stock After Its Recent Drop?,InvestorPlace
Jan-30-19,SHAREHOLDER ALERT: LOMA XRAY MU TYME: The Law Offices of Vincent Wong Reminds Investors of Important Class Action Deadlines,GlobeNewswire
Jan-31-19,"Glancy Prongay & Murray LLP Files a Securities Class Action on Behalf of Micron Technology, Inc., Advising Investors of Expanded Class Period (MU)",Business Wire
Jan-31-19,SHAREHOLDER ALERT: DBVT MU VALE TYME: The Law Offices of Vincent Wong Reminds Investors of Important Class Action Deadlines,GlobeNewswire
Jan-31-19,"Gainey McKenna & Egleston Announces A Class Action Lawsuit Has Been Filed Against Micron Technology, Inc. (MU)",GlobeNewswire
Jan-31-19,"SHAREHOLDER ALERT: Pomerantz Law Firm Investigates Claims On Behalf of Investors of Micron Technology, Inc. - MU",PR Newswire
Jan-31-19,"MU CLASS ACTION DEADLINE: Rosen Law Firm Announces Filing of Securities Class Action Lawsuit Against Micron Technology, Inc.  MU",GlobeNewswire
Jan-31-19,"Deadline Reminder: The Law Offices of Howard G. Smith Reminds Investors of Looming Deadline in the Class Action Lawsuit Against Micron Technology, Inc. (MU)",Business Wire
Jan-31-19,"SHAREHOLDER ACTION NOTICE: The Schall Law Firm Announces the Filing of a Class Action Lawsuit Against Micron Technology, Inc. and Encourages Investors with Losses in Excess of $500,000 to Contact the Firm",ACCESSWIRE
Jan-31-19,"The Klein Law Firm Reminds Investors of Class Actions on Behalf of Shareholders of ATVI, GSM, MU and SVXY",GlobeNewswire
Jan-31-19,How 5 Goldman Stock Portfolios Are Racing Ahead of The Market,Investopedia
Jan-31-19,7 Blue-Chip Stocks That Could Lead the Market Higher,InvestorPlace
Jan-31-19,"Heres What Micron Technology, Inc.s (NASDAQ:MU) P/E Ratio Is Telling Us",Simply Wall St.
Feb-01-19,"IMPORTANT INVESTOR ALERT: The Schall Law Firm Announces the Filing of a Class Action Lawsuit Against Micron Technology, Inc. and Encourages Investors with Losses in Excess of $500,000 to Contact the Firm",ACCESSWIRE
Feb-01-19,SHAREHOLDER ALERT: ATVI MU VALE TYME: The Law Offices of Vincent Wong Reminds Investors of Important Class Action Deadlines,GlobeNewswire
Feb-01-19,"FILING DEADLINE--Kuznicki Law PLLC Announces Class Actions on Behalf of Shareholders of ARLO, ATVI, GSM and MU",GlobeNewswire
Feb-01-19,"MU CLASS ACTION UPDATE: Rosen Law Firm Announces Filing of Securities Class Action Lawsuit Against Micron Technology, Inc.; Expanded Class Period",Business Wire
Feb-01-19,"CLASS ACTION UPDATE for MU, VALE and TYME: Levi & Korsinsky, LLP Reminds Investors of Class Actions on Behalf of Shareholders",GlobeNewswire
Feb-01-19,Micron Investors Informed Of Expanded Class Period In Securities Fraud Class Action By Block & Leviton LLP; Investors Are Encouraged to Contact the Firm,GlobeNewswire
Feb-01-19,"SHAREHOLDER ALERT: Bronstein, Gewirtz & Grossman, LLC Reminds Investors of Class Action Against Micron Technology, Inc. (MU) & Lead Plaintiff Deadline: March 25, 2019",ACCESSWIRE
Feb-01-19,"Consolidated Research: 2019 Summary Expectations for Micron Technology, Quidel, Ligand Pharmaceuticals, Altra Industrial Motion, USG, and Equity Lifestyle Properties  Fundamental Analysis, Key Performance Indications",GlobeNewswire
Feb-04-19,"IMPORTANT DEADLINE REMINDER: The Schall Law Firm Announces the Filing of a Class Action Lawsuit Against Micron Technology, Inc. and Encourages Investors with Losses in Excess of $750,000 to Contact the Firm",ACCESSWIRE
Feb-04-19,"FILING DEADLINE--Kuznicki Law PLLC Announces Class Actions on Behalf of Shareholders of DBVT, AXGN, GSM and MU",GlobeNewswire
Feb-04-19,"Law Offices of Howard G. Smith Announces Expanded Class Period in the Filing of a Securities Class Action on Behalf of Micron Technology, Inc. Investors (MU)",Business Wire
Feb-04-19,"The Klein Law Firm Reminds Investors of Class Actions on Behalf of Shareholders of IMMU, PRGO, DXC and MU",GlobeNewswire
Feb-04-19,"Micron Technology, Inc. -- Moody's rates Micron's new senior notes at Baa3",Moody's
Feb-04-19,Dont Count On Xilinx Stocks Hot Streak to Last,InvestorPlace
Feb-04-19,"Global chip sales rise to record $468.8 billion in 2018, top one trillion units for first time",MarketWatch
Feb-04-19,"SHAREHOLDER ALERT - Bronstein, Gewirtz & Grossman, LLC Reminds Investors of Class Action Against Micron Technology, Inc. (MU) & Lead Plaintiff Deadline: March 25, 2019",ACCESSWIRE
Feb-04-19,Micron Announces Offering of Senior Notes,GlobeNewswire
Feb-04-19,Be Careful with the Post-Earnings Rally in WDC Stock,InvestorPlace
Feb-04-19,"3 Big Stock Charts for Monday: Morgan Stanley, LyondellBasell and Micron Technology",InvestorPlace
Feb-04-19,10 Stocks That May Get Burned by Climate Change,Investopedia
Feb-05-19,"SHAREHOLDER ALERT: Pomerantz Law Firm Investigates Claims On Behalf of Investors of Micron Technology, Inc. - MU",ACCESSWIRE
Feb-05-19,3 Reasons Micron Technology Stock Is Still a Buy,Motley Fool
Feb-05-19,"CLASS ACTION UPDATE for XPO, YRCW, PRGO and MU: Levi & Korsinsky, LLP Reminds Investors of Class Actions on Behalf of Shareholders",GlobeNewswire
Feb-05-19,"Glancy Prongay & Murray LLP Reminds Investors of the Deadline in the Class Action Lawsuit Against Micron Technology, Inc. (MU)",Business Wire
Feb-05-19,Micron (MU) Stock Sinks As Market Gains: What You Should Know,Zacks
Feb-05-19,"INVESTOR ACTION NOTICE: The Schall Law Firm Announces the Filing of a Class Action Lawsuit Against Micron Technology, Inc. and Encourages Investors with Losses in Excess of $500,000 to Contact the Firm",GlobeNewswire
Feb-05-19,"FILING DEADLINE--Kuznicki Law PLLC Announces Class Actions on Behalf of Shareholders of ARLO, ATVI, GSM and MU",GlobeNewswire
Feb-05-19,"MICRON LEAD PLAINTIFF DEADLINE ALERT: Faruqi & Faruqi, LLP Encourages Investors Who Suffered Losses Exceeding $50,000 In Micron Technology, Inc. To Contact The Firm",GlobeNewswire
Feb-05-19,Cloud-Computing Giants Keep Growing Despite Slowdown Fears,Bloomberg
Feb-06-19,"IMPORTANT INVESTOR ALERT: The Schall Law Firm Announces the Filing of a Class Action Lawsuit Against Micron Technology, Inc. and Encourages Investors with Losses in Excess of $750,000 to Contact the Firm",ACCESSWIRE
Feb-06-19,"Semi stocks are on fire, but could the hot trade be about to burn out?",CNBC Videos
Feb-06-19,"CLASS ACTION UPDATE for YRCW, NVDA, AXGN and MU: Levi & Korsinsky, LLP Reminds Investors of Class Actions on Behalf of Shareholders",GlobeNewswire
Feb-06-19,"SHAREHOLDER ALERT - Bronstein, Gewirtz & Grossman, LLC Reminds Investors of Class Action Against Micron Technology, Inc. (MU) & Lead Plaintiff Deadline: March 25, 2019",ACCESSWIRE
Feb-06-19,"CLASS ACTION UPDATE for DNKEY, DBVT, MKL and MU: Levi & Korsinsky, LLP Reminds Investors of Class Actions on Behalf of Shareholders",GlobeNewswire
Feb-06-19,Trading Sony Stock After Earnings Disappointment,InvestorPlace
Feb-08-19,"CLASS ACTION UPDATE for IMMU, AGN, MAXR and MU: Levi & Korsinsky, LLP Reminds Investors of Class Actions on Behalf of Shareholders",GlobeNewswire
Feb-08-19,"FILING DEADLINE--Kuznicki Law PLLC Announces Class Actions on Behalf of Shareholders of TS, YRCW, W and MU",GlobeNewswire
Feb-08-19,"SHAREHOLDER ALERT: Bronstein, Gewirtz & Grossman, LLC Reminds Investors of Class Action Against 22nd Century Group, Inc. (XXII), Arlo Technologies, Inc. (ARLO), Micron Technology, Inc. (MU) and Ferroglobe PLC (GSM)",GlobeNewswire
Feb-08-19,Goldman Says Micron Tech and Western Digital Stock Are at Risk,Barrons.com
Feb-08-19,"CLASS ACTION UPDATE for XPO, ALKS, MU and VALE: Levi & Korsinsky, LLP Reminds Investors of Class Actions on Behalf of Shareholders",GlobeNewswire
Feb-08-19,Stocks - U.S. Futures Fall on Trade Worry; Wells Fargo Eyed After Outage,Investing.com
Feb-11-19,Micron (MU) Flat As Market Gains: What You Should Know,Zacks
Feb-11-19,"FILING DEADLINE--Kuznicki Law PLLC Announces Class Actions on Behalf of Shareholders of YRCW, MAXR, MU and GE",GlobeNewswire
Feb-11-19,How Micron Technology Stock Gained 20.5% in January,Motley Fool
Feb-11-19,Microns Pain Could Last Into 2020,Motley Fool
Feb-11-19,"SHAREHOLDER ALERT - Bronstein, Gewirtz & Grossman, LLC Reminds Investors of Class Action Against Micron Technology, Inc. (MU) & Lead Plaintiff Deadline: March 25, 2019",ACCESSWIRE
Feb-11-19,"CLASS ACTION UPDATE for IMMU, AGN, MAXR and MU: Levi & Korsinsky, LLP Reminds Investors of Class Actions on Behalf of Shareholders",GlobeNewswire
