date,title,source
Mar-22-19,"Lifshitz & Miller LLP Announces Investigation of Corbus Pharmaceutical Holdings, Inc., Domino's Pizza, Inc., Eventbrite, Inc., Healthcare Services Group, Inc., Maxar Technologies, Inc., and Micron Technology, Inc.",PR Newswire
Mar-22-19,Soft Start to Q1 Earnings Season,Zacks
Mar-22-19,"CLASS ACTION UPDATE for MU, CVS and AMR: Levi & Korsinsky, LLP Reminds Investors of Class Actions on Behalf of Shareholders",ACCESSWIRE
Mar-22-19,"Top Analyst Reports for Alphabet, Wells Fargo & PetroChina",Zacks
Mar-22-19,"DEADLINE MONDAY: The Schall Law Firm Announces the Filing of a Class Action Lawsuit Against Micron Technology, Inc. and Encourages Investors with Losses in Excess of $100,000 to Contact the Firm",GlobeNewswire
Mar-22-19,Micron (MU) Stock Looks Poised for a Turnaround,SmarterAnalyst
Mar-22-19,SHAREHOLDER ALERT: MU SVXY AVEO: The Law Offices of Vincent Wong Reminds Investors of Important Class Action Deadlines,ACCESSWIRE
Mar-22-19,"22nd Century Group, Inc. (XXII), Arlo Technologies, Inc. (ARLO), Micron Technology, Inc. (MU) Class Action Reminder Bronstein, Gewirtz & Grossman, LLC",ACCESSWIRE
Mar-22-19,US STOCKS-Wall St set for weaker open as global growth concerns weigh,Reuters
Mar-22-19,Chipmakers on Fire: 3 Under-the-Radar Stocks to Win,Zacks
Mar-22-19,"3 Big Stock Charts for Friday: AT&T, Morgan Stanley and Lowes Companies",InvestorPlace
Mar-22-19,Micron stock surge leads chips to near record high levels,MarketWatch
Mar-22-19,US STOCKS-Futures fall as global growth worries weigh,Reuters
Mar-22-19,"Stocks - Wall Street Declines on Global Growth, Yield Curve Concerns",Investing.com
Mar-22-19,Stocks - U.S. Futures Slump on Weak European Data,Investing.com
Mar-25-19,Micron (MU) Earnings &amp; Revenue Are Expected to Decline Beyond 2019,Zacks
Mar-25-19,"FILING DEADLINE--Kuznicki Law PLLC Announces Class Actions on Behalf of Shareholders of MU, HCSG and INGN",ACCESSWIRE
Mar-25-19,"With a Potential Recovery Ahead, Consider These Semiconductor Companies",GuruFocus.com
Mar-25-19,"FINAL DEADLINE ALERT: Arlo Technologies, Inc. (ARLO), Micron Technology, Inc. (MU) Bronstein, Gewirtz & Grossman, LLC",GlobeNewswire
Mar-25-19,3 Insights From Micron's Earnings Call That You Need to See,Motley Fool
Mar-25-19,"Stock Market Reaction to Micron (MU) Earnings Was Positive, but Short-Lived; MKM Weighs In",SmarterAnalyst
Mar-25-19,"DEADLINE TODAY: The Klein Law Firm Reminds Investors of Class Actions on Behalf of Shareholders of ARLO, GSM and MU",GlobeNewswire
Mar-25-19,There's at Least One More Bad Quarter Left for Micron,Motley Fool
Mar-25-19,"JPMorgan, Wells Fargo, Nike, Micron and FedEx are part of Zacks Earnings Preview",Zacks
Mar-25-19,"The Zacks Analyst Blog Highlights: Alphabet, Wells Fargo, PetroChina, Micron and Allstate",Zacks
Mar-25-19,Edited Transcript of MU earnings conference call or presentation 20-Mar-19 8:30pm GMT,Thomson Reuters StreetEvents
Mar-26-19,Is Micron Technology a Buy?,Motley Fool
Mar-26-19,Inside Micron's Tricky Memory Technology Transition,Motley Fool
Mar-26-19,Micron Stock Remains Bargain-Priced,TheStreet.com
Mar-26-19,"Samsung Warns on Q1 Profit As Weak Memory, Smartphone Demand Weighs on Chipmaker",TheStreet.com
Mar-26-19,Stocks - U.S. Futures Rise as Investors Ignore Inverted Yield Curve,Investing.com
Mar-27-19,Price Declines Are Normal for Micron,Motley Fool
Mar-27-19,Tech Stocks: The Best Long-Term Winners?,Zacks
Mar-27-19,"Micron Stock Is Tanking, but Could Soon Bottom Out",TheStreet.com
Mar-27-19,Is Micron (MU) Stock a Buy? Deutsche Bank Says Yes,SmarterAnalyst
Mar-28-19,Why Micron could be the best catch-up trade to the chip rally,CNBC Videos
Mar-28-19,"Micron Stock Will Rally Because the Slide in Chip Prices Is Almost Over, Analyst Says",Barrons.com
Mar-28-19,"Zacks Market Edge Highlights: Microsoft, Amazon, Micron, Union Pacific and Fastenal",Zacks
Mar-28-19,StockBeat - Chip Stocks Turn in Sluggish Performance Despite Upbeat Outlook,Investing.com
Mar-28-19,"Were Hedge Funds Right About Flocking Into Micron Technology, Inc. (MU)?",Insider Monkey
Mar-29-19,Lyft IPO and PCE Price Index Bring Out the Bulls,Investopedia
Mar-29-19,"Buy Micron (MU) Stock on Momentum &amp; Analyst Positivity, Despite Headwinds?",Zacks
Apr-01-19,5 Stocks With High Business Predictability Ratings,GuruFocus.com
Apr-01-19,Micron (MU) Stock: Breaking Down RBCs New Bullish Call,SmarterAnalyst
Apr-01-19,"Ignore Plunging Chip Prices and Focus on Microns Future, Analyst Says",Barrons.com
Apr-01-19,Semiconductor Stocks at Risk as Macroeconomic Woes Linger,Zacks
Apr-01-19,"Mondays Vital Data: Micron, Alibaba and Amazon",InvestorPlace
Apr-01-19,"US STOCKS-Wall Street set to rally on China data, trade hopes",Reuters
Apr-01-19,Stocks - Wall Street Rises as China's Factories Start Humming Again,Investing.com
Apr-01-19,Stocks - U.S. Futures Jump as China Manufacturing Sector Rebounds,Investing.com
Apr-02-19,"Why I Like Micron Technology, Inc. (NASDAQ:MU)",Simply Wall St.
Apr-03-19,Stocks End Up on Reports U.S.-China Trade Deal Close to Being Done,TheStreet.com
Apr-03-19,The Big Trading Dichotomy as Samsung Readies to Report Results,Bloomberg
Apr-03-19,"What's Next for AMD, Intel (INTC), Nvidia (NVDA) &amp; Micron (MU) Stock?",Zacks
Apr-03-19,Will Micron (MU) Stocks Momentum Continue?,SmarterAnalyst
Apr-03-19,"AMD, Micron Trade Higher After Report Says TSMC Seeing Smartphone Order Increase",TheStreet.com
Apr-03-19,Semiconductor group urges more research funding to counter China,Reuters
Apr-03-19,Semiconductor group urges more research funding to counter China,Reuters
Apr-03-19,"Micron Technology, Tencent and two dozen other companies most likely to benefit from a China trade deal",MarketWatch
Apr-03-19,"Stocks - U.S. Futures Rise on Upbeat China, Europe Data",Investing.com
Apr-04-19,Traders Wary but Mostly Positive,Investopedia
Apr-04-19,4 Large-Cap Semiconductor Stocks to Buy Now,InvestorPlace
Apr-04-19,Micron Shares Fall on Morgan Stanley Downgrade,TheStreet.com
Apr-04-19,"Micron Stock Will Plunge Because the Chip Market Hasnt Hit Bottom, Morgan Stanley Says",Barrons.com
Apr-04-19,"Morgan Stanley Downgrades Micron, Says Street Outlook 'Too Optimistic'",Benzinga
Apr-04-19,Micron Stock Is Heating up for the Long-Term Growth,InvestorPlace
Apr-04-19,"US STOCKS-Wall St set for muted open as growth worries resurface, trade talks eyed",Reuters
Apr-04-19,Micron stock falls after Morgan Stanley downgrades to underweight,MarketWatch
Apr-04-19,"Morgan Stanley downgrades trader favorite Micron to sell, says inventories will pressure margins",CNBC
Apr-04-19,The Big Trading Dichotomy as Samsung Readies to Report Results,Bloomberg
Apr-04-19,Stocks - U.S. Futures Flat as Investors Pause After Weak European Data,Investing.com
Apr-05-19,Chip Stocks Soaring 28% On China Optimism Risk Steep Pullback,Investopedia
Apr-05-19,"Micron is surging, but chart points to a more than 50% drop, technician says",CNBC
Apr-05-19,Chip Stocks Are on a Roll: 5 Solid Buys,Zacks
Apr-08-19,"Boeing, Micron Technology fall; Sony, Fiat Chrysler rise",Associated Press
Apr-08-19,3 Superior Earnings Yield Stocks,GuruFocus.com
Apr-08-19,Micron Stock Falls Because Analysts Keep Downgrading Its Shares,Barrons.com
Apr-08-19,Cowen Projects More Profit Declines For Micron In 2020,Benzinga
Apr-08-19,Micron stock falls after another downgrade,MarketWatch
Apr-09-19,"5 Top Stock Trades for Wednesday: Micron, Twitter, U.S. Steel",InvestorPlace
Apr-09-19,Here's what to expect from earnings season,CNBC Videos
Apr-11-19,3 Semiconductor Stocks to Buy Right Now,Zacks
Apr-11-19,Micron Is Moving Toward Breakout Territory,TheStreet.com
Apr-12-19,Stock market investors are split into bull and bear camps  taking the middle road is the way to go,MarketWatch
Apr-12-19,"Micron (MU) Stock Is Heading Back Down to $32, Analyst Says",SmarterAnalyst
Apr-12-19,"Micron Is a Challenging Stock, but Worth the Effort",TheStreet.com
Apr-15-19,Stock market investors are split into bull and bear camps  taking the middle road is the way to go,MarketWatch
Apr-16-19,Better Buy: Micron Technology vs. Cypress Semiconductor,Motley Fool
Apr-16-19,Charting the S&P 500s slow-motion approach of record territory,MarketWatch
Apr-16-19,"Dont Buy Micron Stock Because Lower Profits Loom, Analyst Says",Barrons.com
Apr-16-19,5 Tech Stocks Gearing Up for Blockbuster Q1 Earnings,Zacks
Apr-16-19,"Nomura Initiates Micron At Neutral, Sees Positives And Negatives To The Stock",Benzinga
Apr-17-19,"These 5G Stocks Have Soared Over 30% in 2019, and Could Go Even Higher",Motley Fool
Apr-18-19,5 Semiconductor Stocks to Buy for a Spring Charge,InvestorPlace
Apr-18-19,"Micron Stock Can Keep Surging Because AI Will Require More Chips, Analyst Says",Barrons.com
Apr-22-19,MKM Continues to Recommend Micron (MU) Stock; Heres Why,SmarterAnalyst
Apr-22-19,New Pressure on China Might Just Boost Applied Materials Stock,InvestorPlace
Apr-23-19,Micron Introduces New Series of High-Performance NVMe SSDs for Cloud and Enterprise Markets,GlobeNewswire
Apr-24-19,This chart says to stay bullish on the U.S. stock market,MarketWatch
Apr-24-19,Pabrai Investment Funds 2019 Q1 Investor Letter,Insider Monkey
Apr-25-19,Micron (MU) Dips More Than Broader Markets: What You Should Know,Zacks
Apr-25-19,Jerome Dodson's 1st Quarter Parnassus Endeavor Fund Commentary,GuruFocus.com
Apr-25-19,"Back to School: My Trading Strategy for ServiceNow, Microsoft, Raytheon, Amazon",TheStreet.com
Apr-25-19,"Jim Cramer Weighs In On Micron, Halliburton And More",Benzinga
Apr-25-19,"Better Pricing, New Product Release Could Boost Micron Stock",InvestorPlace
Apr-26-19,Intels Guidance Cut Is Bad News for Micron and Western Digital,Motley Fool
Apr-26-19,Why this analyst sees a buying opportunity in Intel,CNBC Videos
May-01-19,Micron (MU) Stock Moves -0.38%: What You Should Know,Zacks
May-01-19,Making Sense of Tech Sector Earnings,Zacks
May-03-19,10 Tech Stocks to Buy Now for 2025,InvestorPlace
May-06-19,Dow Jones Futures Fall Again As Key Officials Fan China Trade War Fears,Investor's Business Daily
May-06-19,Jerome Dodson Comments on Micron Technology,GuruFocus.com
May-06-19,How to trade stocks as Trump threatens China with new tariffs,MarketWatch
May-06-19,"All 30 SOX components are falling, AMD and Micron stocks were the most active decliners",MarketWatch
May-06-19,Surprise threat from Trump to raise tariffs sinks stocks,Associated Press
May-06-19,Here are the biggest stock-market losers after Trump threatens more tariffs,MarketWatch
May-06-19,Apple Slides With Tech Caught in the Cross Fire of Trade Woes,Bloomberg
May-06-19,Apple Slides With Tech Caught in the Cross Fire of Trade Woes,Bloomberg
May-06-19,"Morris Marks Mark Asset Managements Return, AUM, and Holdings",Insider Monkey
May-06-19,Nearer-Term Headwinds Cloud an Otherwise Bullish Micron Stock,InvestorPlace
May-06-19,New Strong Sell Stocks for May 6th,Zacks
May-07-19,Micron Technology Announces Upcoming Investor Event,GlobeNewswire
May-07-19,"Memory Chip Prices Havent Bottomed Out Yet, Analyst Says",Barrons.com
May-07-19,How to trade stocks as Trump threatens China with new tariffs,MarketWatch
May-07-19,Dow Jones Futures Fall On China Trade War Fears Ahead Of Talks,Investor's Business Daily
May-08-19,"Buy Nvidia (NVDA) Stock Ahead of Q1 Earnings, Despite Semiconductor Industry Concerns?",Zacks
May-08-19,Micron (MU) Dips More Than Broader Markets: What You Should Know,Zacks
May-08-19,Detailed Look at Q1 Earnings Season,Zacks
May-08-19,U.S. stock market is setting two traps for investors,MarketWatch
May-08-19,"Does Micron Technology, Inc.'s (NASDAQ:MU) 31% Earnings Growth Make It An Outperformer?",Simply Wall St.
May-09-19,3 Semiconductor Stocks to Buy Right Now,Zacks
May-09-19,"Zacks Earnings Trends Highlights: Apple, Intel, Advanced Micro Devices, Micron and Lam Research",Zacks
May-09-19,China chipmaker accused of stealing secrets eyes deal with Micron,Financial Times
May-09-19,Stocks - U.S. Futures Lurch Lower as Trade War Escalation Looms,Investing.com
May-10-19,"Trade war tensions continued their drag on stocks, which had their worst week of the year",CNBC Videos
May-10-19,5 Tech Stocks Getting Crushed,InvestorPlace
May-10-19,3 Large-Cap Income Stocks for Tech Investors to Buy,Zacks
May-10-19,J.P. Morgan Remains Bullish on Micron (MU) Stock Following Investor Meeting,SmarterAnalyst
May-14-19,Mohnish Pabrai Triples Stake in Micron Technology,GuruFocus.com
May-14-19,"Dalal Street, LLC Buys Micron Technology Inc",GuruFocus.com
May-14-19,Market Drops as China Retaliates,Zacks
May-15-19,Trump administration hits China's Huawei with one-two punch,Reuters
May-15-19,Trump administration hits China's Huawei with one-two punch,Reuters
May-15-19,Trump administration hits China's Huawei with one-two punch,Reuters
May-15-19,Philippe Laffont's Top 5 Buys of the 1st Quarter,GuruFocus.com
May-15-19,What to Expect from Nvidia (NVDA) Q1 Earnings Amid Semiconductor Market Downturn,Zacks
May-15-19,Micron (MU) Stock Sinks As Market Gains: What You Should Know,Zacks
May-15-19,"Appaloosa takes stakes in Alibaba, Amazon but drops big name banks",MarketWatch
May-15-19,"Chip sales to fall more than 7% in 2019 after three years of growth, IDC predicts",MarketWatch
May-15-19,Mohnish Pabrai Increases Micron Holding to About 12% of Portfolio,GuruFocus.com
May-15-19,A Prolonged Trade War Could Hit Micron Harder Than Other Chip Stocks,Barrons.com
May-15-19,Wells Fargo: We're 'lukewarm' on Apple right now,CNBC Videos
