date,title,source
Oct-17-18,New Strong Sell Stocks for October 17th,Zacks
Oct-19-18,10 S&P 500 Stocks to Buy for the Long Term,Kiplinger
Oct-24-18,Kroger and Cardinal Health to Co-Host Drug Take-Back Events Across 27 States on October 27,PR Newswire
Oct-31-18,What's in Store for Cardinal Health's (CAH) Q1 Earnings?,Zacks
Nov-01-18,Earnings Preview: Cardinal Health (CAH) Q1 Earnings Expected to Decline,Zacks
Nov-02-18,3 Blue-Chip Stocks to Buy for Future Growth,InvestorPlace
Nov-05-18,"Report: Exploring Fundamental Drivers Behind SkyWest, Blueprint Medicines, HP, Hewlett Packard Enterprise, Cardinal Health, and The Medicines  New Horizons, Emerging Trends, and Upcoming Developments",GlobeNewswire
Nov-07-18,3 Top Dividend Stocks to Buy Right Now,Motley Fool
Nov-07-18,Cardinal Health seats first independent chairman,American City Business Journals
Nov-08-18,Cardinal Health finally sees savings from the tax cut  here's how it's spending it,American City Business Journals
Nov-08-18,Cardinal Health Stock Has Formed a Bullish Reversal Pattern,TheStreet.com
Nov-08-18,Cardinal Health Inc (CAH) Q1 2019 Earnings Conference Call Transcript,Motley Fool
Nov-08-18,Cardinal Health (CAH) Surpasses Earnings Estimates in Q1,Zacks
Nov-08-18,Cardinal Health (CAH) Beats on Earnings & Revenues in Q1,Zacks
Nov-08-18,[$$] Cardinal Health 1Q Profit Surges,The Wall Street Journal
Nov-08-18,"Cardinal Health's stock surges after earnings, revenue rise above expectations",MarketWatch
Nov-08-18,Cardinal: Fiscal 1Q Earnings Snapshot,Associated Press
Nov-08-18,Cardinal Health Reports First Quarter Results for Fiscal Year 2019,PR Newswire
Nov-09-18,"Company News For Nov 8, 2018",Zacks
Nov-15-18,What Should We Expect From Cardinal Health Incs (NYSE:CAH) Earnings In The Year Ahead?,Simply Wall St.
Nov-19-18,Edited Transcript of CAH earnings conference call or presentation 8-Nov-18 1:30pm GMT,Thomson Reuters StreetEvents
Nov-26-18,Cardinal's a Critical Link in the Pharma Supply Chain,Morningstar
Nov-27-18,Drug cost containment strategies for hospital pharmacy leaders highlighted at ASHP Midyear,PR Newswire
Nov-28-18,Is Cardinal Health (CAH) a Great Stock for Value Investors?,Zacks
Nov-28-18,Cardinal Health to Highlight Cost-Control Approach in ASHP,Zacks
Nov-30-18,Research Explores the Issues Impacting Today's Oncology Practices,PR Newswire
Dec-07-18,Cardinal Health Elects J. Michael Losh to its Board of Directors,PR Newswire
