date,title,source
Oct-22-18,HCI Group Issues Loss Estimate from Hurricane Michael,GlobeNewswire
Oct-23-18,HCI Group Declares Q4 2018 Regular Quarterly Cash Dividend,GlobeNewswire
Nov-06-18,HCI Group Reports Third Quarter 2018 Results,GlobeNewswire
Nov-07-18,HCI Group Announces Settlement Method for Conversions of its 3.875% Convertible Senior Notes due 2019; Financial Outcomes Discussed,GlobeNewswire
Nov-08-18,"HCI Group (HCI) Hits 52-Week High, Can the Run Continue?",Zacks
Nov-19-18,Edited Transcript of HCI earnings conference call or presentation 6-Nov-18 9:45pm GMT,Thomson Reuters StreetEvents
