date,title,source
Oct-24-18,"Research Report Identifies Cato, Roadrunner Transportation, Talend S.A, Vi, MannKind, and Acceleron Pharma with Renewed Outlook  Fundamental Analysis, Calculating Forward Movement",GlobeNewswire
Nov-07-18,"Talend to Acquire Stitch, a Leader in Self-Service Cloud Data Integration",GlobeNewswire
Nov-07-18,Talend Reports Third Quarter 2018 Financial Results,GlobeNewswire
Nov-08-18,"Why Wynn Resorts, Ctrip.com International, and Talend Slumped Today",Motley Fool
Nov-08-18,Dow Jones Holds Up Best In Mild Downdraft On Wall Street; These Stocks Plunge On Earnings,Investor's Business Daily
Nov-08-18,Why Talend Stock Crashed Today,Motley Fool
Nov-08-18,Center City tech company Stitch to be acquired by California firm for $60M,American City Business Journals
Nov-08-18,Edited Transcript of TLND earnings conference call or presentation 7-Nov-18 9:30pm GMT,Thomson Reuters StreetEvents
