date,title,source
Oct-18-18,"Evolus to Release Third Quarter 2018 Financial Results on Monday, November 5, 2018",GlobeNewswire
Oct-19-18,What Kind Of Shareholder Owns Most Evolus Inc (NASDAQ:EOLS) Stock?,Simply Wall St.
Oct-22-18,Evolus Expands Leadership Team with Appointments of Key Executives,GlobeNewswire
Oct-22-18,"Detailed Research: Economic Perspectives on Caseys General Stores, Evolus, OptiNose, Xunlei, Molina Healthcare, and Frontline  What Drives Growth in Today's Competitive Landscape",GlobeNewswire
Nov-01-18,Evolus to Participate in Two Upcoming Investor Conferences,GlobeNewswire
Nov-05-18,Evolus Reports Third Quarter 2018 Financial Results,GlobeNewswire
Nov-19-18,Evolus Receives Conditional FDA Acceptance of Jeuveau Brand Name,GlobeNewswire
Dec-03-18,"ALPHAEON repays outstanding principal amount under its secured convertible notes due December 23, 2018",PR Newswire
Dec-11-18,"Investor Expectations to Drive Momentum within eBay, Pulse Biosciences, Evolus, Weibo, OptiNose, and The Descartes Systems Group  Discovering Underlying Factors of Influence",GlobeNewswire
Dec-19-18,Evolus Added to NASDAQ Biotechnology Index,GlobeNewswire
Dec-20-18,"Should You Take Comfort From Insider Transactions At Evolus, Inc. (NASDAQ:EOLS)?",Simply Wall St.
Feb-01-19,FDA approves cheaper Botox rival to treat frown lines,Reuters
Feb-01-19,FDA approves cheaper Botox rival to treat frown lines,Reuters
Feb-01-19,FDA approves cheaper Botox rival to treat frown lines,Reuters
Feb-01-19,FDA approves cheaper Botox rival to treat frown lines,Reuters
Feb-01-19,Evolus Receives FDA Approval for Jeuveau prabotulinumtoxinA-xvfs for Injection,GlobeNewswire
Feb-01-19,Two cannabis companies top Harry Boxers stocks to watch,MarketWatch
Feb-04-19,"Papa John's, Evolus rise; Gannett, Allergan slip",Associated Press
Feb-04-19,"Allergan Slides, Evolus Gains as FDA Approves Wrinkle Treatment to Rival Botox",TheStreet.com
Feb-04-19,Implied Volatility Surging for Evolus (EOLS) Stock Options,Zacks
Feb-04-19,"Stocks Open Mixed, Dow Jones Drags Ahead Of Alphabet Earnings",Investor's Business Daily
Feb-04-19,UPDATE 1-FDA approves cheaper Botox rival to treat frown lines (Feb.1),Reuters
Feb-04-19,Evolus Rises Midday as Botox Drama Unfolds,Investing.com
Feb-04-19,Evolus to Hold Conference Call Following Jeuveau FDA Approval,GlobeNewswire
Feb-05-19,"Why Leggett & Platt, Mueller Industries, and Evolus Jumped Today",Motley Fool
Feb-05-19,Botox Maker Allergan Falls After Tepper's Hedge Fund Challenges Management,TheStreet.com
Feb-05-19,Allergan Stock Falls as FDA OK's Botox Rival for Frown Lines,Zacks
Feb-07-19,"Cramer Remix: If the market drops tomorrow, buy this stock",CNBC
Feb-07-19,Aesthetics company behind latest Botox rival was 'designed' to compete with Botox: CEO,CNBC Videos
Feb-08-19,Harry Boxers stocks to watch include maker of Botox competitor,MarketWatch
Feb-08-19,Evolus Stockholders May Be Frowning in the Short Run,TheStreet.com
Feb-20-19,Allergan Responds to Investor's Call for CEO/Chair Role Split,Zacks
Feb-21-19,"2 Frustrating Flops, Plus Welcome to the Wrinkle Wars",Motley Fool
Feb-27-19,Evolus Appoints Crystal Muilenburg as Vice President Corporate Communications & Public Relations,GlobeNewswire
Mar-06-19,Implied Volatility Surging for Evolus (EOLS) Stock Options,Zacks
Mar-12-19,"Evolus, Inc.s (NASDAQ:EOLS) Path To Profitability",Simply Wall St.
Mar-15-19,"Evolus to Release Fourth Quarter and Full Year 2018 Financial Results and Provide a Business Update on Monday, March 18, 2019",GlobeNewswire
Mar-18-19,Evolus Reports Fourth Quarter and Full Year 2018 Results,GlobeNewswire
Mar-18-19,Evolus Secures $100 Million Senior Debt Facility with Oxford Finance LLC,GlobeNewswire
Mar-19-19,Why Evolus Stock Is Soaring 12% Higher Today,Motley Fool
Mar-20-19,"NASH, Allergies and Beauty Stocks: Invest or Not?",Zacks
Mar-21-19,"Zacks Market Edge Highlights: Edwards Lifesciences, Exact Sciences, Aimmune Therapeutics, Allergan and Evolus",Zacks
Mar-21-19,Evolus Announces Publication of U.S. Phase III Pivotal Trial Results for Jeuveau in Dermatologic Surgery,GlobeNewswire
Mar-25-19,"Why Penn Virginia, Evolus, and Cousins Properties Slumped Today",Motley Fool
Apr-01-19,Evolus Provides Regulatory Update on Nuceiva in the European Union,GlobeNewswire
Apr-03-19,3 Small-Cap Biotech Stocks to Watch Now,Motley Fool
Apr-23-19,Can Core Renal Care Unit Drive Baxter's (BAX) Q1 Earnings?,Zacks
Apr-24-19,"Evolus to Release First Quarter 2019 Financial Results and Provide a Business Update on Tuesday, April 30, 2019",GlobeNewswire
Apr-24-19,Can Front Line Care Drive Hill-Rom's (HRC) Q2 Earnings?,Zacks
Apr-25-19,Harry Boxers three stocks to watch this week,MarketWatch
Apr-25-19,Will Pricing Pressure Hurt Zimmer Biomet (ZBH) Q1 Earnings?,Zacks
Apr-25-19,Can Covance Business Growth Aid LabCorp (LH) in Q1 Earnings?,Zacks
Apr-25-19,Can iTotal PS Revenues Drive ConforMIS' (CFMS) Q1 Earnings?,Zacks
Apr-26-19,3 Stocks To Watch Ahead Of Earnings,Benzinga
Apr-26-19,Evolus Receives Positive CHMP Opinion for Nuceiva in the European Union,GlobeNewswire
Apr-29-19,Evolus to Participate in Two Upcoming Investor Conferences,GlobeNewswire
Apr-30-19,Evolus Reports First Quarter 2019 Financial Results,GlobeNewswire
May-01-19,"How Many Evolus, Inc. (NASDAQ:EOLS) Shares Do Institutions Own?",Simply Wall St.
May-06-19,Which Pharmaceutical Stocks Are Outperforming All Other Stocks?,Investor's Business Daily
May-08-19,Botox Competitor Aims to Take Market Share as Allergan Stumbles,Bloomberg
May-15-19,ALPHAEON Corporation sells 4 million shares in Evolus Inc.,PR Newswire
May-15-19,Evolus Announces First Shipment of Jeuveau (prabotulinumtoxinA-xvfs) to Customers in the United States,GlobeNewswire
