date,title,source
Oct-17-18,"Final trades: First Data, AK Steel, J&J, American Airline...",CNBC Videos
Oct-17-18,AK Steel (AKS) Receives New $1.2-Million Award From DOE,Zacks
Oct-18-18,"Car Wars: Steel Getting Stronger, Lighter to Curb Aluminum Rise",Bloomberg
Oct-23-18,What's in the Offing for AK Steel (AKS) This Earnings Season?,Zacks
Oct-25-18,AK Steel (AKS) Q3 Earnings and Revenues Miss Estimates,Zacks
Oct-25-18,AK Steel plummets after earnings disappoint,CNBC
Oct-25-18,"Stocks making the biggest moves after hours: Amazon, Alphabet, Snap, Intel and more",CNBC
Oct-25-18,AK Steel: 3Q Earnings Snapshot,Associated Press
Oct-25-18,AK Steel misses earnings expectations,CNBC Videos
Oct-25-18,AK Steel Announces Third Quarter 2018 Financial Results and Fourth Quarter Outlook,GlobeNewswire
Oct-25-18,Does AK Steel Holding Corporations (NYSE:AKS) CEO Salary Compare Well With Others?,Simply Wall St.
Oct-25-18,A Preview Of AK Steel's Q3 Earnings,Benzinga
