date,title,source
Oct-31-18,Aimco Announces Quarterly Common Dividend of $0.38 Per Share,Business Wire
Oct-31-18,"REITs to Watch for Q3 Earnings on Nov 1: AIV, EQIX & HST",Zacks
Oct-31-18,Will Elevated Supply Dampen Aimco's (AIV) Earnings in Q3?,Zacks
Nov-01-18,Apartment Investment Management: 3Q Earnings Snapshot,Associated Press
Nov-01-18,Aimco Reports Third Quarter Results,Business Wire
Nov-01-18,Why Apartment Investment and Management Companys (NYSE:AIV) CEO Pay Matters To You,Simply Wall St.
Nov-02-18,Edited Transcript of AIV earnings conference call or presentation 2-Nov-18 5:00pm GMT,Thomson Reuters StreetEvents
Nov-02-18,Apartment Investment & Management Co (AIV) Q3 2018 Earnings Conference Call Transcript,Motley Fool
Nov-02-18,Aimco reports lower year-over-year revenue despite increased occupancy in Q3,American City Business Journals
Nov-02-18,"Aimco's (AIV) Q3 FFO Surpasses Estimates, Revenues Down",Zacks
Nov-07-18,"Research Report Identifies Kaman, Apartment Investment and Management, Immersion, Sturm, Ruger, Sotheby's, and Aerojet Rocketdyne with Renewed Outlook  Fundamental Analysis, Calculating Forward Movement",GlobeNewswire
Nov-09-18,Aimco Cares Gift to Scholarship Fund Makes College Possible for 26 Affordable Housing Residents: Company's Total Contribution Reaches $1.17 Million,PR Newswire
Nov-14-18,Edited Transcript of AIV earnings conference call or presentation 2-Nov-18 5:00pm GMT,Thomson Reuters StreetEvents
Nov-16-18,Edited Transcript of AIV earnings conference call or presentation 2-Nov-18 5:00pm GMT,Thomson Reuters StreetEvents
Nov-28-18,Aimco Team Members Salute Veterans During 21-Day Community Service Campaign,PR Newswire
Dec-10-18,Aimco Declares Dividend on Class A Cumulative Preferred Stock,Business Wire
Dec-12-18,"Aimco and Airbnb settle and dismiss all legal battles, agree to 'discuss opportunities' in future",American City Business Journals
Dec-13-18,Aimco (AIV) Agrees to Settle All Legal Feuds With Airbnb,Zacks
Dec-18-18,Is Apartment Investment and Management Co. (AIV) A Good Stock To Buy?,Insider Monkey
Jan-02-19,Apartment Investment and Management Sees Hammer Chart Pattern: Time to Buy?,Zacks
Jan-03-19,Aimco Announces Dates for Fourth Quarter 2018 Earnings Release and Conference Call,Business Wire
Jan-14-19,Apartment Investment and Management Company Announces 2018 Dividend Income Tax Allocation,Business Wire
Jan-25-19,"Research Report Identifies TechnipFMC plc, Glu Mobile, EPR Properties, Apartment Investment and Management, KalVista Pharmaceuticals, and DXP Enterprises with Renewed Outlook  Fundamental Analysis, Calculating Forward Movement",GlobeNewswire
Jan-29-19,Are You Looking for a Top Momentum Pick? Why Apartment Investment Management (AIV) is a Great Choice,Zacks
Jan-30-19,What's in Store for Aimco's (AIV) Earnings This Season?,Zacks
Jan-30-19,"Equity Residential (EQR) Q4 FFO Lags Estimates, Revenues Top",Zacks
Jan-31-19,"Essex Property (ESS) Meets Q4 FFO Estimates, Revenues Beat",Zacks
Jan-31-19,"Duke Realty (DRE) Meets Q4 FFO Estimates, Revenues Up Y/Y",Zacks
Jan-31-19,"Kimco Realty (KIM) Q4 FFO Meets Estimates, Revenues Beat",Zacks
Feb-01-19,"REITs to Watch for Q4 Earnings on Feb 4: AVB, ARE, AIV &amp; KRC",Zacks
Feb-04-19,Apartment Investment Management: 4Q Earnings Snapshot,Associated Press
Feb-04-19,Aimco Reports Fourth Quarter Results,Business Wire
Feb-04-19,"The Zacks Analyst Blog Highlights: Kilroy, Alexandria, AvalonBay, Apartment Investment and CBRE",Zacks
Feb-05-19,"Aimco's (AIV) Q4 FFO Misses Estimates, Revenues Decline Y/Y",Zacks
Feb-06-19,Edited Transcript of AIV earnings conference call or presentation 5-Feb-19 6:00pm GMT,Thomson Reuters StreetEvents
Feb-06-19,Aimco dips below billion-dollar mark for 2018 revenue,American City Business Journals
Feb-06-19,Aimco (AIV) Q4 2018 Earnings Conference Call Transcript,Motley Fool
Feb-08-19,Top Ranked Momentum Stocks to Buy for February 8th,Zacks
Feb-11-19,Top Ranked Momentum Stocks to Buy for February 11th,Zacks
Feb-13-19,Apartment Investment and Management Company Sets Ratio for Reverse Stock Split,Business Wire
Feb-27-19,Aimco Announces Participation in Citi 2019 Global Property CEO Conference,Business Wire
Mar-05-19,AvalonBay Communities (AVB) Issues Q1 Rental Revenue Update,Zacks
Mar-06-19,Why Is Apartment Investment Management (AIV) Down 2.8% Since Last Earnings Report?,Zacks
Mar-11-19,Aimco Declares Dividend on Class A Cumulative Preferred Stock,Business Wire
Mar-13-19,Apartment Investment and Management Company Announces Valuation of Special Dividend is $2.02 Per Share,Business Wire
Mar-14-19,Does Apartment Investment and Managements (NYSE:AIV) Share Price Gain of 64% Match Its Business Performance?,Simply Wall St.
Mar-21-19,Essex Property Trust (ESS) Prices Senior Notes Worth $150M,Zacks
Mar-22-19,Apartment Investment and Management Company Announces Election Results for Special Dividend,Business Wire
