date,title,source
Nov-16-18,"Investor Expectations to Drive Momentum within 2U, Broadwind Energy, Nuverra Environmental Solutions, Ability, ContraFect, and Conatus Pharmaceuticals  Discovering Underlying Factors of Influence",GlobeNewswire
Nov-21-18,ABIL Stock: Why Ability Stock Is Skyrocketing Today,InvestorPlace
Nov-23-18,Ability Announces Pricing of $10 Million Offering,GlobeNewswire
Nov-28-18,Ability Announces Closing of $10 Million Offering,GlobeNewswire
Dec-12-18,Ability Inc. Regains Compliance With Nasdaq Minimum Shareholders Equity Requirement,GlobeNewswire
Dec-28-18,Abilitys Line of Credit to be Repaid and Converted into Equity,GlobeNewswire
Jan-15-19,Ability Inc. Announces Closing of Stock Purchase Agreement,GlobeNewswire
Jan-15-19,4 Tech Stocks Surging with Potential,ACCESSWIRE
Jan-16-19,These 4 Tech Stocks May Set The Pace On Wednesday (1/16/19),ACCESSWIRE
