date,title,source
Oct-23-18,Helios Technologies Announces Third Quarter 2018 Financial Results Release and Conference Call,Business Wire
Oct-24-18,Helios Technologies to Participate at Baird 2018 Global Industrial Conference,Business Wire
Oct-26-18,Why Helios Technologiess (NASDAQ:SNHY) CEO Pay Matters To You,Simply Wall St.
Oct-29-18,Sun Hydraulics (SNHY) Q3 Earnings Preview: What's Shaping Up?,Zacks
Nov-05-18,Sun Hydraulics (SNHY) Lags Q3 Earnings and Revenue Estimates,Zacks
Nov-05-18,Sun Hydraulics: 3Q Earnings Snapshot,Associated Press
Nov-05-18,Helios Technologies Reports Third Quarter 2018 Results,Business Wire
Nov-07-18,Edited Transcript of SNHY earnings conference call or presentation 6-Nov-18 2:00pm GMT,Thomson Reuters StreetEvents
Nov-13-18,"Factors of Influence in 2018, Key Indicators and Opportunity within Sun Hydraulics, FIS, TRACON Pharmaceuticals, Kona Grill, Endava PLC Sponsored ADR, and Chembio Diagnostics  New Research Emphasizes Economic Growth",GlobeNewswire
Nov-20-18,Should You Think About Buying Helios Technologies (NASDAQ:SNHY) Now?,Simply Wall St.
Dec-13-18,Estimating The Fair Value Of Helios Technologies (NASDAQ:SNHY),Simply Wall St.
Dec-19-18,Helios Technologies Declares Fourth Quarter Cash Dividend of $0.09 Per Share,Business Wire
Jan-29-19,Helios Technologiess (NASDAQ:SNHY) Investment Returns Are Lagging Its Industry,Simply Wall St.
Feb-12-19,Helios Technologies Announces Fourth Quarter and Full Year 2018 Financial Results Release and Conference Call,Business Wire
Feb-22-19,Factors Likely to Impact Axon Enterprise's (AAXN) Q4 Earnings,Zacks
Feb-25-19,Helios Technologies Reports Fourth Quarter and Full Year 2018 Results,Business Wire
Feb-25-19,TriMas (TRS) to Report Q4 Earnings: What's in the Offing?,Zacks
Feb-26-19,"Helios Technologies (SNHY) Files 10-K for the Fiscal Year Ended on December 31, 2018",GuruFocus.com
Feb-26-19,Helios Technologies Inc (SNHY) Q4 2018 Earnings Conference Call Transcript,Motley Fool
Feb-27-19,Edited Transcript of SNHY earnings conference call or presentation 26-Feb-19 2:00pm GMT,Thomson Reuters StreetEvents
Mar-04-19,Dont Sell Sun Hydraulics Corporation (NASDAQ:SNHY) Before You Read This,Simply Wall St.
Mar-06-19,Edited Transcript of SNHY earnings conference call or presentation 26-Feb-19 2:00pm GMT,Thomson Reuters StreetEvents
Mar-06-19,Earnings Estimates Moving Higher for Sun Hydraulics (SNHY): Time to Buy?,Zacks
Mar-11-19,The Big Reason Helios Technologies Stock Popped 34.3% in February,Motley Fool
Mar-11-19,Helios Technologies Declares First Quarter Cash Dividend of $0.09 Per Share,Business Wire
Mar-14-19,Sun Hydraulics (SNHY) Q4 Earnings and Revenues Surpass Estimates,Zacks
Mar-14-19,Helios Technologies to Participate at the Sidoti & Company Spring 2019 Conference,ACCESSWIRE
Mar-15-19,3 Reasons Why Sun Hydraulics (SNHY) Is a Great Growth Stock,Zacks
Mar-20-19,"Roper is Set to Acquire Foundry, Declares Cash Dividend",Zacks
Mar-26-19,Here's Why You Should Hold IDEX (IEX) Stock in Your Portfolio,Zacks
Mar-27-19,Here's Why it is Worth Investing in Rexnord (RXN) Stock Now,Zacks
Mar-27-19,Near-Term View Bleak for Industrial Manufacturing Industry,Zacks
Mar-28-19,Here's Why You Should Avoid Betting on Altra Industrial Now,Zacks
Apr-01-19,Here's Why You Should Avoid Betting on Stanley Black &amp; Decker,Zacks
