date,title,source
Oct-19-18,Comfort Systems USA Announces Third Quarter 2018 Conference Call and Webcast,Business Wire
Oct-25-18,Comfort Systems: 3Q Earnings Snapshot,Associated Press
Oct-25-18,Comfort Systems USA Reports Third Quarter 2018 Results,Business Wire
Oct-25-18,Comfort Systems USA Increases Quarterly Dividend,Business Wire
Oct-25-18,Comfort Systems Announces New Board Member,Business Wire
Oct-26-18,Dont Sell Comfort Systems USA Inc (NYSE:FIX) Before You Read This,Simply Wall St.
Oct-29-18,Edited Transcript of FIX earnings conference call or presentation 26-Oct-18 3:00pm GMT,Thomson Reuters StreetEvents
Oct-30-18,"Research Report Identifies Alcoa, Digital Realty Trust, CoreSite Realty, Flexsteel Industries, Comfort Systems, and Orchid Island Capital with Renewed Outlook  Fundamental Analysis, Calculating Forward Movement",GlobeNewswire
Nov-01-18,"Quanta Services (PWR) Lags on Q3 Earnings, Raises Guidance",Zacks
Nov-19-18,5 Quality Stock Picks Screened on DuPont Analysis,Zacks
Nov-20-18,"Zacks.com highlights: Robert Half International, Children' Place, Amedisys, Foot Locker and Comfort Systems USA",Zacks
Nov-21-18,Comfort Systems USA Inc (NYSE:FIX): Whats In It For The Shareholders?,Simply Wall St.
Nov-26-18,"Dycom Banks on Telecom Business, Inclement Weather Hurts",Zacks
Nov-26-18,"North American Construction Acquires Aecon, Expands Fleet",Zacks
Nov-27-18,"Gibraltar (ROCK) Rides on Value Creation Strategy, Costs High",Zacks
Nov-29-18,Here's Why You Should Hold on to Trex Company Stock Now,Zacks
Dec-06-18,"Zacks.com featured highlights include: Amedisys, Marine Products, Foot Locker, Systemax and Comfort Systems",Zacks
Dec-11-18,"Why Comfort Systems USA, Inc.s (NYSE:FIX) CEO Pay Matters To You",Simply Wall St.
Dec-11-18,Here's Why You Should Buy Comfort Systems (FIX) Stock Now,Zacks
Dec-11-18,NACG (NOA) Gets Contract Extension in Canadian Oil Sands,Zacks
Dec-12-18,Comfort Systems Announces General Counsel Transition,Business Wire
Dec-12-18,Falling Earnings Estimates Signal Weakness Ahead for Thor Industries (THO),Zacks
Dec-13-18,"Here is What Hedge Funds Think About Comfort Systems USA, Inc. (FIX)",Insider Monkey
Dec-13-18,4 Construction Stocks That Survived the 2018 Bloodbath,Zacks
Dec-18-18,KBR Develops New Propane Dehydrogenation Technology K-PRO,Zacks
