date,title,source
Oct-30-18,Will Agenus (AGEN) Report Negative Earnings Next Week? What You Should Know,Zacks
Oct-31-18,"Agenus to Report Third Quarter 2018 Financial Results on November 6, 2018 and Host Conference Call and Webcast",PR Newswire
Nov-06-18,Agenus to Present Data on Neoantigen Vaccines and anti-CD137 Antibody at SITC 2018,PR Newswire
Nov-06-18,"Agenus (AGEN) Reports Q3 Loss, Tops Revenue Estimates",Zacks
Nov-06-18,Agenus: 3Q Earnings Snapshot,Associated Press
Nov-06-18,Agenus Reports Third Quarter 2018 Financial Results and Provides Corporate Update,PR Newswire
Nov-08-18,"Agenus (AGEN) Q3 Loss Wider Than Expected, Pipeline in Focus",Zacks
Nov-09-18,"Report: Developing Opportunities within Agenus, Kirkland's, Preferred Apartment Communities, Gulfport Energy, ProAssurance, and US Ecology  Future Expectations, Projections Moving into 2018",GlobeNewswire
