date,title,source
Oct-17-18,Koppers Holdings chairman resigns,American City Business Journals
Oct-17-18,KOP vs. PX: Which Stock Should Value Investors Buy Now?,Zacks
Oct-17-18,David M. Hillenbrand Resigns as Chair of Koppers Holdings Inc. Due to Health Reasons,PR Newswire
Oct-24-18,4 GARP Stocks to Scoop Up for Maximum Returns,Zacks
Oct-24-18,Koppers Completes Sale of Clairton Facility,PR Newswire
Oct-25-18,Koppers Holdings Inc. Schedules Third Quarter 2018 Conference Call,PR Newswire
Oct-25-18,"Zacks.com featured highlights include: EMCOR, Koppers, O???Reilly and Celanese",Zacks
