date,title,source
Oct-17-18,SHAREHOLDER ALERT: TRCO MCHP ALNY MGTI CPB CHGG ADNT TRVN SFIX: The Law Offices of Vincent Wong Reminds Investors of Important Class Action Deadlines,GlobeNewswire
Oct-17-18,SHAREHOLDER ALERT: Pomerantz Law Firm Investigates Claims On Behalf of Investors of Tribune Media Company - TRCO,ACCESSWIRE
Oct-18-18,"DEADLINE ALERT: The Schall Law Firm Announces it is Investigating Claims Against Tribune Media Company and Encourages Investors with Losses in Excess of $100,000 to Contact the Firm",ACCESSWIRE
Oct-18-18,"The Klein Law Firm Reminds Investors of Class Actions on Behalf of Shareholders of TRCO, MCHP, CPB and TRVN",GlobeNewswire
Oct-19-18,SHAREHOLDER ALERT: Pomerantz Law Firm Investigates Claims On Behalf of Investors of Tribune Media Company - TRCO,GlobeNewswire
Oct-19-18,"The Klein Law Firm Reminds Investors of Class Actions on Behalf of Shareholders of PDD, AMPE, NVRO, PZZA and TRCO",GlobeNewswire
Oct-22-18,"Bragar Eagel & Squire, P.C. Reminds Investors That Class Action Lawsuits Have Been Filed Against Tribune Media, Microchip Technology, and Cocrystal and Encourages Investors to Contact the Firm",GlobeNewswire
Oct-22-18,SHAREHOLDER ALERT: Pomerantz Law Firm Investigates Claims on Behalf of Investors of Tribune Media Company - TRCO,ACCESSWIRE
Oct-22-18,"ONGOING INVESTIGATION ALERT: The Schall Law Firm Announces it is Investigating Claims Against Tribune Media Company and Encourages Investors with Losses in Excess of $100,000 to Contact the Firm",GlobeNewswire
Oct-23-18,SHAREHOLDER ALERT: CBS TRCO ALNY MGTI HAS CHGG ADNT TRVN HTHT GOOG: The Law Offices of Vincent Wong Reminds Investors of Important Class Action Deadlines,GlobeNewswire
Oct-23-18,A Note On Tribune Media Companys (NYSE:TRCO) ROE and Debt To Equity,Simply Wall St.
Oct-24-18,SHAREHOLDER ALERT: Pomerantz Law Firm Investigates Claims on Behalf of Investors of Tribune Media Company - TRCO,ACCESSWIRE
Oct-24-18,"[$$] Explosive devices sent to Clinton, Obama and CNN offices",Financial Times
Oct-25-18,"The Klein Law Firm Reminds Investors of Class Actions on Behalf of Shareholders of TRCO, COCP, ALNY and CHGG",GlobeNewswire
Oct-25-18,"4-Day Deadline Alert: The Schall Law Firm Announces it is Investigating Claims Against Tribune Media Company and Encourages Investors with Losses in Excess of $100,000 to Contact the Firm",ACCESSWIRE
Oct-25-18,Channel 7's late news scores ratings victory as numbers grow,American City Business Journals
Oct-25-18,"SHAREHOLDER ALERT - Bronstein, Gewirtz & Grossman, LLC Notifies Investors With Losses Exceeding $250K of Class Action Against Tribune Media Company (TRCO) and Lead Plaintiff Deadline  November 13, 2018",GlobeNewswire
Oct-25-18,"Investor Expectations to Drive Momentum within Tribune Media, Intra-Cellular Therapies, Icahn Enterprises, NVE, PetMed Express, and United Fire Group  Discovering Underlying Factors of Influence",GlobeNewswire
Oct-29-18,SHAREHOLDER ALERT: QRTEA TRCO USAT MCHP CHGG JT ADNT TRVN CWH DY: The Law Offices of Vincent Wong Reminds Investors of Important Class Action Deadlines,GlobeNewswire
Oct-29-18,"ONGOING SHAREHOLDER ALERT: The Schall Law Firm Announces it is Investigating Claims Against Tribune Media Company and Encourages Investors with Losses in Excess of $100,000 to Contact the Firm",GlobeNewswire
Oct-29-18,Tribune Media Company To Report Third Quarter 2018 Financial Results and Host Conference Call,PR Newswire
Oct-30-18,"The Klein Law Firm Reminds Investors of Class Actions on Behalf of Shareholders of QRTEA, TRCO, USAT, COCP and CHGG",GlobeNewswire
Oct-30-18,"SHAREHOLDER ALERT  Bronstein, Gewirtz & Grossman, LLC Notifies Investors With Losses Exceeding $250K of Class Action Against Tribune Media Company (TRCO) and Lead Plaintiff Deadline  November 13, 2018",GlobeNewswire
