date,title,source
Oct-30-18,Alarm.com Launches Video Analytics,GlobeNewswire
Oct-31-18,Should You Consider Alarmcom Holdings Inc (NASDAQ:ALRM)?,Simply Wall St.
Nov-06-18,Alarm.com to Participate in Upcoming Investor Conferences,GlobeNewswire
Nov-07-18,Alarm.com Holdings (ALRM) Q3 Earnings and Revenues Beat Estimates,Zacks
Nov-07-18,"Alarm.com stock rallies more than 15% after earnings, outlook top Street view",MarketWatch
Nov-07-18,Alarm.com: 3Q Earnings Snapshot,Associated Press
Nov-07-18,Alarm.com Reports Third Quarter 2018 Results,GlobeNewswire
Nov-08-18,"CyberArk Stock Jumps On Better Sales Execution, Alarm.com Stock Rises",Investor's Business Daily
Nov-08-18,Alarm.com Sees Slower Growth in 2019,Motley Fool
Nov-08-18,"Dow Jones Futures: CyberArk, Alarm.com Skyrocket On Earnings; These Key Stocks Dive",Investor's Business Daily
Nov-12-18,Edited Transcript of ALRM earnings conference call or presentation 7-Nov-18 9:30pm GMT,Thomson Reuters StreetEvents
Nov-26-18,"New Research Coverage Highlights Alarm, Del Frisco's Restaurant Group, Universal Security Instruments, Income Opportunity Realty Investors, Tanzanian Royalty Exploration, and CrossAmerica Partners LP  Consolidated Revenues, Company Growth, and Expectations for 2018",GlobeNewswire
Dec-03-18,Edited Transcript of ALRM earnings conference call or presentation 7-Nov-18 9:30pm GMT,Thomson Reuters StreetEvents
Jan-02-19,IBD 50 Stocks To Watch: Alarm.Com Sounds The Deceleration Alarm,Investor's Business Daily
Jan-02-19,Alarm.com Is an Attractive Stock,TheStreet.com
Jan-02-19,Here's Why You Should Add Bemis (BMS) to Your Portfolio Now,Zacks
Jan-02-19,Here's Why You Should Dump Terex From Your Portfolio Now,Zacks
Jan-07-19,Alarm Expands Home Automation Portfolio With New Products,Zacks
Jan-09-19,Alarm.com Enhances Security Solutions With Smart Signal,Zacks
Jan-10-19,The Alarm.com Academy Earns Best Education and Support Program Award at CES 2019,GlobeNewswire
Jan-10-19,Alarm.com Awarded Security Product of the Year at CES 2019,GlobeNewswire
Jan-11-19,Apogee Stock Down 32% in the Past Year: Will It Bounce Back?,Zacks
Jan-14-19,Bemis' (BMS) Stock Up 13% in 6 Months: Can It Gain Further?,Zacks
Jan-14-19,Allegion (ALLE) Hit by Surging Costs &amp; Broader Market Risks,Zacks
Jan-15-19,Reasons to Add Sealed Air (SEE) Stock to Your Portfolio Now,Zacks
Jan-15-19,Rising Demand &amp; Cost Reduction to Drive Milacron's Results,Zacks
Jan-16-19,"Avery Dennison to Ride on Restructuring Efforts, Risks Linger",Zacks
Jan-17-19,Banks Keep Stocks Moving Higher,Zacks
Jan-17-19,Dover (DOV) to Acquire Belanger to Boost OPW Business Unit,Zacks
Jan-17-19,"Alarm.com, Activision, Snap and Amazon highlighted as Zacks Bull and Bear of the Day",Zacks
Jan-17-19,Here's Why Investors Should Hold Ball Corporation (BLL) Stock,Zacks
Jan-23-19,"Weak Agricultural Markets, Higher Costs to Weigh on Lindsay",Zacks
Jan-28-19,Alarm.com Holdings (ALRM) Gains As Market Dips: What You Should Know,Zacks
Jan-28-19,"Caterpillar (CAT) Q4 Earnings, Revenues Lag Estimates, Up Y/Y",Zacks
Jan-29-19,"Pentair (PNR) Surpasses Earnings, Sales Estimates in Q4",Zacks
Jan-29-19,"Rockwell Automation (ROK) Q1 Earnings, Revenues Top Estimates",Zacks
Jan-29-19,"Alarm.com to Announce 2018 Fourth Quarter Financial Results on February 28, 2019",GlobeNewswire
Jan-30-19,"Avery Dennison (AVY) Q4 Earnings Beat, Sales Lag Estimates",Zacks
Jan-30-19,"Consolidated Research: 2019 Summary Expectations for Telephone and Data, EMCOR Group, Chart Industries, Alarm, Flexion Therapeutics, and Social Reality  Fundamental Analysis, Key Performance Indications",GlobeNewswire
Jan-31-19,"Ball Corporation (BLL) Q4 Earnings Lag, Sales Top Estimates",Zacks
Feb-01-19,"Bemis (BMS) Earnings In Line, Sales Beat Estimates in Q4",Zacks
Feb-01-19,"Fortune Brands (FBHS) Q4 Earnings Miss Estimates, Improve Y/Y",Zacks
Feb-05-19,Alarm.com Holdings (ALRM) Stock Sinks As Market Gains: What You Should Know,Zacks
Feb-06-19,AGCO Corp (AGCO) Tops Earnings &amp; Revenue Estimates in Q4,Zacks
Feb-06-19,Owens-Illinois (OI) Misses Earnings &amp; Sales Estimates in Q4,Zacks
Feb-07-19,Is Alarm.com Holdings (ALRM) Stock Outpacing Its Industrial Products Peers This Year?,Zacks
Feb-07-19,"iRobot (IRBT) Q4 Earnings &amp; Revenues Beat Estimates, Up Y/Y",Zacks
Feb-07-19,Allegion Board Approves 29% Hike in Quarterly Dividend Rate,Zacks
Feb-07-19,"Sealed Air (SEE) Q4 Earnings &amp; Revenue Top Estimates, Up Y/Y",Zacks
Feb-07-19,"Crown Holdings (CCK) Q4 Earnings Match, Sales Lag Estimates",Zacks
Feb-08-19,Manitowoc (MTW) Beats on Q4 Earnings &amp; Revenue Estimates,Zacks
Feb-11-19,Alarm.com Holdings (ALRM) Stock Sinks As Market Gains: What You Should Know,Zacks
Feb-12-19,Greif's (GEF) Caraustar Buyout to Boost Portfolio &amp; Margins,Zacks
Feb-12-19,Sealed Air Rides on Reinvent SEE Strategy &amp; Favorable Demand,Zacks
Feb-13-19,Here's Why You Should Hold Grainger Stock in Your Portfolio,Zacks
Feb-13-19,Reasons to Add Dover (DOV) Stock to Your Portfolio Right Now,Zacks
