date,title,source
Oct-30-18,Alarm.com Launches Video Analytics,GlobeNewswire
Oct-31-18,Should You Consider Alarmcom Holdings Inc (NASDAQ:ALRM)?,Simply Wall St.
Nov-06-18,Alarm.com to Participate in Upcoming Investor Conferences,GlobeNewswire
Nov-07-18,Alarm.com Holdings (ALRM) Q3 Earnings and Revenues Beat Estimates,Zacks
Nov-07-18,"Alarm.com stock rallies more than 15% after earnings, outlook top Street view",MarketWatch
Nov-07-18,Alarm.com: 3Q Earnings Snapshot,Associated Press
Nov-07-18,Alarm.com Reports Third Quarter 2018 Results,GlobeNewswire
Nov-08-18,"CyberArk Stock Jumps On Better Sales Execution, Alarm.com Stock Rises",Investor's Business Daily
Nov-08-18,Alarm.com Sees Slower Growth in 2019,Motley Fool
Nov-08-18,"Dow Jones Futures: CyberArk, Alarm.com Skyrocket On Earnings; These Key Stocks Dive",Investor's Business Daily
Nov-12-18,Edited Transcript of ALRM earnings conference call or presentation 7-Nov-18 9:30pm GMT,Thomson Reuters StreetEvents
Nov-26-18,"New Research Coverage Highlights Alarm, Del Frisco's Restaurant Group, Universal Security Instruments, Income Opportunity Realty Investors, Tanzanian Royalty Exploration, and CrossAmerica Partners LP  Consolidated Revenues, Company Growth, and Expectations for 2018",GlobeNewswire
Dec-03-18,Edited Transcript of ALRM earnings conference call or presentation 7-Nov-18 9:30pm GMT,Thomson Reuters StreetEvents
Jan-02-19,IBD 50 Stocks To Watch: Alarm.Com Sounds The Deceleration Alarm,Investor's Business Daily
Jan-02-19,Alarm.com Is an Attractive Stock,TheStreet.com
Jan-02-19,Here's Why You Should Add Bemis (BMS) to Your Portfolio Now,Zacks
Jan-02-19,Here's Why You Should Dump Terex From Your Portfolio Now,Zacks
Jan-07-19,Alarm Expands Home Automation Portfolio With New Products,Zacks
Jan-09-19,Alarm.com Enhances Security Solutions With Smart Signal,Zacks
Jan-10-19,The Alarm.com Academy Earns Best Education and Support Program Award at CES 2019,GlobeNewswire
Jan-10-19,Alarm.com Awarded Security Product of the Year at CES 2019,GlobeNewswire
