date,title,source
Oct-25-18,Conatus Pharmaceuticals to Report Third Quarter 2018 Financial Results,GlobeNewswire
Nov-01-18,Conatus Pharmaceuticals Reports Third Quarter 2018 Financial Results and Program Updates,GlobeNewswire
Nov-05-18,Todays Research Reports on Stocks to Watch: Conatus Pharmaceuticals and Titan Pharmaceuticals,ACCESSWIRE
Nov-08-18,Conatus Pharmaceuticals Announces Presentations and Posters at AASLD Annual Meeting,GlobeNewswire
Nov-09-18,Edited Transcript of CNAT earnings conference call or presentation 1-Nov-18 8:30pm GMT,Thomson Reuters StreetEvents
Nov-14-18,Do Options Traders Know Something About Conatus (CNAT) Stock We Don't?,Zacks
Nov-16-18,When Will Conatus Pharmaceuticals Inc (NASDAQ:CNAT) Become Profitable?,Simply Wall St.
Nov-16-18,"Investor Expectations to Drive Momentum within 2U, Broadwind Energy, Nuverra Environmental Solutions, Ability, ContraFect, and Conatus Pharmaceuticals  Discovering Underlying Factors of Influence",GlobeNewswire
Dec-06-18,Conatus' Emricasan Misses Primary Endpoint in Mid-Stage Study,Zacks
Dec-06-18,Shares of Conatus Pharmaceuticals plummet over 50% after Phase 2 trial fails to meet primary endpoint,MarketWatch
Dec-06-18,Today's Research Reports on Trending Tickers: Conatus Pharmaceuticals and Exelixis,ACCESSWIRE
Dec-07-18,"The Daily Biotech Pulse: FDA Nod For Roche, Bristol-Myers Hikes Dividend, 2 Biotechs To Debut",Benzinga
Dec-12-18,"Biotech Stock Roundup: Gilead to Get New CEO, Biogen In-Licenses Candidate",Zacks
Dec-13-18,"The Zacks Analyst Blog Highlights: Gilead Sciences, Conatus Pharmaceuticals, Biogen, Ionis Pharmaceuticals and Exelixis",Zacks
Dec-28-18,Conatus (CNAT) Focuses on Developing NASH Candidate Emricasan,Zacks
