date,title,source
Oct-30-18,"Bandwidth (BAND) Reports Q3 Loss, Tops Revenue Estimates",Zacks
Oct-30-18,Bandwidth: 3Q Earnings Snapshot,Associated Press
Oct-30-18,Bandwidth Announces Resignation of Director Henry R. Kaestner and Appointment of Luke Roush,PR Newswire
Oct-30-18,Bandwidth Announces Third Quarter 2018 Financial Results,PR Newswire
Oct-31-18,Bandwidth co-founder steps down,American City Business Journals
Nov-01-18,"Bandwidth execs talk hiring plans, international growth",American City Business Journals
Nov-05-18,U.S. regulator demands companies take action to halt 'robocalls',Reuters
Nov-21-18,"Research Report Identifies Chicken Soup for the Soul Entertainment, Allied Motion Technologies, Bandwidth, Solid Biosciences, Avenue Therapeutics, and BeyondSpring with Renewed Outlook  Fundamental Analysis, Calculating Forward Movement",GlobeNewswire
Nov-30-18,Heres What Bandwidth Incs (NASDAQ:BAND) P/E Is Telling Us,Simply Wall St.
Dec-19-18,Hedge Funds Are Crazy About Bandwidth Inc. (BAND),Insider Monkey
Dec-21-18,Another longtime exec to leave Bandwidth,American City Business Journals
Dec-21-18,Bandwidth Announces Executive Transition,PR Newswire
Jan-03-19,From Iqvia to Red Hat: These execs raked in millions from stock sales in 2018,American City Business Journals
Jan-07-19,Bandwidth to expand Raleigh footprint  again,American City Business Journals
Jan-09-19,Bandwidth Inc (BAND) Chairman & CEO David A. Morken Sold $5.3 million of Shares,GuruFocus.com
Jan-22-19,Bandwidth to Report Fourth Quarter and Full Year 2018 Financial Results,PR Newswire
Jan-22-19,Is Bandwidth Inc.s (NASDAQ:BAND) ROE Of 17% Impressive?,Simply Wall St.
Feb-06-19,Analysts Estimate Bandwidth (BAND) to Report a Decline in Earnings: What to Look Out for,Zacks
Feb-13-19,"Bandwidth (BAND) Reports Q4 Loss, Tops Revenue Estimates",Zacks
Feb-13-19,Bandwidth: 4Q Earnings Snapshot,Associated Press
Feb-13-19,Bandwidth Announces Fourth Quarter and Full Year 2018 Financial Results,PR Newswire
Feb-13-19,Bandwidth Inc. Class A to Host Earnings Call,ACCESSWIRE
Feb-14-19,"Bandwidth CEO talks headcount, going international",American City Business Journals
Feb-14-19,Bandwidth to Present at Upcoming Investor Conferences,PR Newswire
Feb-15-19,"Bandwidth Inc (BAND) Files 10-K for the Fiscal Year Ended on December 31, 2018",GuruFocus.com
Mar-05-19,Bandwidth Announces Commencement of Public Offering of Common Stock,PR Newswire
Mar-07-19,Bandwidth Announces Upsizing and Pricing of Public Offering of Common Stock,PR Newswire
Mar-08-19,Bandwidth (BAND) Surges: Stock Moves 10.8% Higher,Zacks
Mar-11-19,Bandwidth Solves Local SMS Messaging Dilemma at Massive Scale with Local A2P Launch,PR Newswire
Mar-14-19,Do Directors Own Bandwidth Inc. (NASDAQ:BAND) Shares?,Simply Wall St.
Apr-05-19,3 High-Growth Technology Stocks to Buy,Motley Fool
Apr-11-19,Bandwidth to Report First Quarter 2019 Financial Results,PR Newswire
Apr-12-19,5 Stock Picks From Top-Rated TipRanks Analyst Richard Davis,Benzinga
Apr-16-19,Zayo Shares Up on Takeover Speculations by P-E Consortium,Zacks
Apr-17-19,"Ericsson (ERIC) Q1 Earnings Beat Estimates, Revenues Up Y/Y",Zacks
Apr-18-19,"Badger Meter (BMI) Q1 Earnings Beat Estimates, Revenues Miss",Zacks
Apr-18-19,"ADTRAN (ADTN) Q1 Earnings and Revenues Beat, Increase Y/Y",Zacks
Apr-22-19,From Iqvia to Bandwdith: These execs walked away with millions in Q1 insider stock sales,American City Business Journals
Apr-23-19,Did You Miss Bandwidth's (NASDAQ:BAND) Impressive 116% Share Price Gain?,Simply Wall St.
Apr-25-19,Earnings Preview: Bandwidth (BAND) Q1 Earnings Expected to Decline,Zacks
May-02-19,"Bandwidth (BAND) Reports Q1 Loss, Tops Revenue Estimates",Zacks
May-02-19,Bandwidth: 1Q Earnings Snapshot,Associated Press
May-02-19,Bandwidth Announces First Quarter 2019 Financial Results,PR Newswire
May-03-19,Bandwidth Inc. (BAND) Q1 2019 Earnings Call Transcript,Motley Fool
May-06-19,Bandwidth to Present at Upcoming Investor Conferences,PR Newswire
May-08-19,Bandwidth CEO: We're pushing forward with international expansion,American City Business Journals
May-15-19,John Burbank Goes 3 for 2 in 1st Quarter,GuruFocus.com
May-21-19,"Bandwidth Celebrates Women in Tech, Sponsoring Women's Leadership Conference",PR Newswire
