date,title,source
Oct-18-18,Imperial Reports Third Quarter Production Results,GlobeNewswire
Oct-18-18,ISG to Discuss Digital Impacts on Pharmaceutical Enterprises at ProcureCon Pharma Conference,PR Newswire
Oct-19-18,Investors Are Undervaluing Information Services Group Inc (NASDAQ:III) By 30.87%,Simply Wall St.
Oct-19-18,ISG to Lead Workshop on HR and the Future Workplace at HRSSO Summit,PR Newswire
Oct-25-18,ISG Partners with CENTRL to Enhance Its Third-Party Risk Management Service,PR Newswire
Nov-01-18,ISG to Present Automation Strategies and Benefits at IPT Property Tax Symposium,PR Newswire
Nov-05-18,ISG Index(TM): Cloud-Based Services Boost 3Q Asia Pacific Sourcing Market,PR Newswire
Nov-05-18,ISG Index: Cloud-Based Services Boost 3Q Asia Pacific Sourcing Market,PR Newswire
Nov-07-18,BFSI Leading Charge for Next-Gen ADM in Australia,PR Newswire
Nov-08-18,Information Services Group (III) Beats Q3 Earnings Estimates,Zacks
Nov-08-18,Imperial Reports Third Quarter 2018 Financial Results,GlobeNewswire
Nov-08-18,ISG: 3Q Earnings Snapshot,Associated Press
Nov-08-18,Information Services Group Announces Third-Quarter Financial Results,PR Newswire
Nov-09-18,Edited Transcript of III earnings conference call or presentation 9-Nov-18 2:00pm GMT,Thomson Reuters StreetEvents
Nov-12-18,ISG to Host Global Webinar on Annual Checkup and Benchmark for Automation Centers of Excellence,PR Newswire
Nov-13-18,Edited Transcript of III earnings conference call or presentation 9-Nov-18 2:00pm GMT,Thomson Reuters StreetEvents
Nov-13-18,"Detailed Research: Economic Perspectives on Pernix Therapeutics, Hallador Energy, Vince Holding, Tuesday Morning, Information Services Group, and Sienna Biopharmaceuticals  What Drives Growth in Today's Competitive Landscape",GlobeNewswire
Nov-14-18,User Experience Defining Digital Workplace Services,PR Newswire
Nov-15-18,III vs. NVEE: Which Stock Should Value Investors Buy Now?,Zacks
Nov-16-18,Smart Products and Factories Transforming Engineering Services Industry,PR Newswire
Nov-21-18,ISG Invites Nominations for 2019 ISG Paragon Awards ANZ,PR Newswire
Nov-26-18,Are Information Services Group Incs (NASDAQ:III) Interest Costs Too High?,Simply Wall St.
Nov-27-18,Imperial Provides Operational and Financial Update,GlobeNewswire
Nov-29-18,ISG Forms Automation Partnership with UiPath,PR Newswire
Nov-30-18,ISG to Discuss How to Fast-Track and Scale IA Programs at Intelligent Automation Week in Austin,PR Newswire
Nov-30-18,WEX and Chevron Ink Agreement for Improved Card Services,Zacks
Dec-03-18,III or ACN: Which Is the Better Value Stock Right Now?,Zacks
Dec-04-18,Is Information Services Group (III) Stock Undervalued Right Now?,Zacks
Dec-04-18,Bet on These Top 6 Stocks With a Striking Net Profit Margin,Zacks
Dec-06-18,"ISG to Host Webinar on Using Market Price Intelligence to Overcome Bid Issues, Retain Clients",PR Newswire
Dec-07-18,ISG Adds New Features to Corporate Website,PR Newswire
Dec-10-18,Unemployment Still at 49-Year Low: 5 Business Services Picks,Zacks
Dec-11-18,"Brazilian Cloud Market Provides Local Opportunity, ISG Says",PR Newswire
Dec-11-18,"The Zacks Analyst Blog Highlights: Information Services Group, Clean Harbors, Xerox, Heidrick & Struggles International and Insperity",Zacks
Dec-14-18,ISG Featured in December Issue of Delta Sky,PR Newswire
Dec-17-18,Data Analytics Adding Value for U.S. Enterprises,PR Newswire
Dec-18-18,Three ISG Advisors Named 2018 Superstars by HRO Today,PR Newswire
