date,title,source
Oct-18-18,"Covenant Transportation Group, Inc. Announces Timing of Third Quarter Earnings Release and Conference Call",GlobeNewswire
Oct-23-18,Covenant Transportation (CVTI) Q3 Earnings and Revenues Top Estimates,Zacks
Oct-23-18,Covenant Transportation Group Announces Third Quarter Financial and Operating Results,GlobeNewswire
Oct-24-18,"Covenant Rushes Into Dedicated Contracts, Reports A Q3 Beat",Benzinga
Oct-25-18,Edited Transcript of CVTI earnings conference call or presentation 24-Oct-18 2:00pm GMT,Thomson Reuters StreetEvents
Oct-26-18,Is Covenant Transportation (CVTI) Stock Undervalued Right Now?,Zacks
Oct-30-18,"Detailed Research: Economic Perspectives on Liberty Property Trust, Franklin Electric Co., The Progressive, Covenant Transportation Group, Rush Enterprises, and GrubHub  What Drives Growth in Today's Competitive Landscape",GlobeNewswire
