date,title,source
Oct-31-18,MiMedx to Present Clinical and Scientific Studies at SAWC Fall Meeting,PR Newswire
Nov-06-18,MiMedx To Present Clinical And Scientific Studies At Desert Foot Conference,PR Newswire
Nov-07-18,"Jack Henry & Associates Set to Join S&P 500; EQT, Equitrans Midstream, MasTec to Join S&P MidCap 400; Superior Energy Services, United Natural Foods to Join S&P SmallCap 600",PR Newswire
Nov-07-18,[$$] Nasdaq to Delist MiMedx Amid Financial Probe,The Wall Street Journal
Nov-07-18,Here's Why MiMedx Group Shares Are Imploding 30% Today,Motley Fool
Nov-07-18,MDXG News: MiMedx Stock Plunges on Nasdaq Delisting Notice,InvestorPlace
Nov-07-18,MiMedx stock plunges after receiving delisting notice from Nasdaq,MarketWatch
Nov-07-18,MiMedx Adopts Limited Duration Shareholder Rights Plan In Response To Delisting From Nasdaq,PR Newswire
Nov-07-18,MiMedx Receives Nasdaq Delisting Notification,PR Newswire
