date,title,source
Oct-17-18,Spotify takes minor stake in music distributor DistroKid,Reuters
Oct-17-18,How Tencent Music Will Leverage Its Parent Companys Dominance for More Growth,Motley Fool
Oct-17-18,Tencent Music Is Less About Music Streaming Than You Think,Motley Fool
Oct-17-18,Meet the Largest Music Streaming Service on Earth,Motley Fool
Oct-17-18,Spotify takes minor stake in music distributor DistroKid,Reuters
Oct-17-18,Apple's Acquisitions in 2018 Play on Some Familiar Themes,TheStreet.com
Oct-17-18,Somethings Wrong With the Netflix Stock Price,InvestorPlace
Oct-17-18,The Hottest Tech IPOs Slated for 2019,Investopedia
Oct-17-18,Earnings are the ultimate stock-market reality show,MarketWatch
Oct-17-18,These stocks got turbocharged when companies adopted a subscription model,MarketWatch
Oct-19-18,"Report: Developing Opportunities within Spotify Technology SA, Vornado Realty Trust, Merus N.V, Teekay Tankers, PagSeguro Digital, and Liberty Oilfield Services  Future Expectations, Projections Moving into 2018",GlobeNewswire
Oct-22-18,RBC Capital: 5 Tech Stocks to Buy Before Earnings,Kiplinger
Oct-23-18,Apples App Store Ad Business to $2 Billion by 2020: Bernstein,Investopedia
Oct-24-18,Sirius XMs Purchase of Pandora Just Got One Step Closer,Barrons.com
Oct-24-18,Spotify's Recent Weakness Doesn't Change Morgan Stanley's Bullish Tune,Benzinga
Oct-24-18,[$$] Universal Music taps former NFL exec Weston for top marketing job,Financial Times
