date,title,source
Oct-19-18,Aileron Announces Poster Presentations at Two Scientific Conferences in November,GlobeNewswire
Oct-30-18,"Aileron Therapeutics to Report Third Quarter 2018 Financial Results on November 7, 2018",GlobeNewswire
Nov-01-18,Aileron Therapeutics Announces Clinical Trial Collaboration with Dana-Farber/Boston Childrens Cancer and Blood Disorders Center,GlobeNewswire
Nov-05-18,"Aileron Therapeutics Appoints Vojislav Vukovic, MD, PhD, as Chief Medical Officer",GlobeNewswire
Nov-07-18,Aileron Therapeutics Reports Third Quarter 2018 Financial Results,GlobeNewswire
Nov-19-18,"Recent Analysis Shows Arcimoto, ADOMANI, Lipocine, Aileron Therapeutics, Allena Pharmaceuticals, and Perma-Fix Environmental Services Market Influences  Renewed Outlook, Key Drivers of Growth",GlobeNewswire
Nov-28-18,Aileron Inks Collaboration Deal With Pfizer for Cancer Combo,Zacks
Dec-04-18,"Aileron Presents Interim ALRN-6924 Data from PTCL, MDS, and AML Clinical Trials at the 60th Annual American Society of Hematology Meeting",GlobeNewswire
Dec-21-18,"Could The Aileron Therapeutics, Inc. (NASDAQ:ALRN) Ownership Structure Tell Us Something Useful?",Simply Wall St.
Jan-29-19,"Aileron Therapeutics, Inc. (ALRN) Upgraded to Strong Buy: Here's Why",Zacks
Feb-01-19,4 Healthcare Stocks Looking To Start February Off Strong,ACCESSWIRE
Mar-04-19,Aileron Therapeutics Appoints Kathryn Gregory as Chief Business Officer,GlobeNewswire
Mar-29-19,Aileron Therapeutics Announces Pricing of $26M Private Placement,GlobeNewswire
Apr-03-19,Aileron Therapeutics Completes $26M Private Placement,GlobeNewswire
May-01-19,Aileron Therapeutics to Report First Quarter 2019 Financial Results on May 8,GlobeNewswire
May-08-19,Aileron Therapeutics Reports First Quarter 2019 Financial Results,GlobeNewswire
May-30-19,Aileron Therapeutics to Present at the Jefferies 2019 Healthcare Conference,GlobeNewswire
