date,title,source
Oct-24-18,"China cutting rare earth output, unnerving global manufacturers",Reuters
Oct-26-18,"Adamas to Announce Third Quarter 2018 Financial Results and Host Conference Call on November 1, 2018",GlobeNewswire
Nov-01-18,Adamas: 3Q Earnings Snapshot,Associated Press
Nov-01-18,Adamas Reports Third Quarter 2018 Financial Results,GlobeNewswire
Nov-01-18,"The Daily Biotech Pulse: AbbVie's Leukemia Drug Trial Meets Endpoint, Denali Strikes Collaboration Deal",Benzinga
Nov-08-18,"Factors of Influence in 2018, Key Indicators and Opportunity within Apptio, Adamas Pharmaceuticals, NEXEO SOLUTIONS, Computer Programs and, Solaris Oilfield Infrastructure, and SPX  New Research Emphasizes Economic Growth",GlobeNewswire
Nov-09-18,Adamas to Present at Three November Investor Conferences,GlobeNewswire
Nov-15-18,Edited Transcript of ADMS earnings conference call or presentation 1-Nov-18 8:30pm GMT,Thomson Reuters StreetEvents
