date,title,source
Oct-17-18,2 Big Pharmas Pleased With J&J's Third-Quarter Earnings Report,Motley Fool
Oct-17-18,"They tackled chronic cough. Now with $54.5 million, this duo is targeting Alzheimer's and more",American City Business Journals
Oct-17-18,Merck Announces Appointment of Jim Scholefield as Chief Information and Digital Officer,Business Wire
Oct-17-18,5 Blue Chip Drug Stocks Poised for Long-Term Gains,Investopedia
Oct-18-18,Jim Scholefield Leaves Nike for Top Tech and Digital Job at Merck,The Wall Street Journal
Oct-18-18,"Merck, Pfizer combo treatment meets main goals of kidney cancer trial",Reuters
Oct-18-18,"Merck, Pfizer combo treatment meets main goals of kidney cancer trial",Reuters
Oct-19-18,Merck (MRK) Gains As Market Dips: What You Should Know,Zacks
Oct-19-18,2 Dow Safety Stock for Volatile Market: Portfolio Manager,Investopedia
Oct-19-18,"Top Stock Reports for UPS, Merck & BHP Billiton",Zacks
Oct-19-18,Why Merck's Latest Success Means Trouble for Exelixis Inc.,Motley Fool
Oct-19-18,"Today's Research Reports on Trending Tickers: Merck & Co., and Bristol-Myers Squibb",ACCESSWIRE
Oct-22-18,Why Aduro Biotech Crashed 29.5% Today,Motley Fool
Oct-22-18,"Why Tesaro, Inc. Is Tanking Today",Motley Fool
Oct-22-18,Here's Why Clovis Oncology Dropped as Much as 21.2% Today,Motley Fool
Oct-22-18,Here's Why ImmunoGen Fell Today,Motley Fool
Oct-22-18,Bristol-Myers Squibb stock drops 6% after FDA delays approval deadline for cancer drug,MarketWatch
Oct-22-18,"Mercks KEYTRUDA (pembrolizumab) Significantly Improved Overall Survival Compared to Standard of Care, as Monotherapy and in Combination with Chemotherapy, as First-Line Treatment for Patients with Recurrent or Metastatic Head and Neck Cancer",Business Wire
Oct-22-18,Merck (MRK) to Report Q3 Earnings: What's in the Cards?,Zacks
Oct-22-18,Strong Earnings Enough Reason to Stay Long JNJ Stock,InvestorPlace
Oct-24-18,Merck's Q3 Earnings Preview,Benzinga
Oct-25-18,Dow Closes 400 Points Higher as Wall Street Rebounds on Earnings,TheStreet.com
Oct-25-18,Edited Transcript of MRK earnings conference call or presentation 25-Oct-18 12:00pm GMT,Thomson Reuters StreetEvents
Oct-25-18,"Merck & Co., Inc. -- Moody's: Merck's shareholder payouts credit negative",Moody's
Oct-25-18,"Pharma Giants Merck, Bristol Diverge On Earnings Beat As Sales Lag",Investor's Business Daily
Oct-25-18,Merck & Co Inc (MRK) Q3 2018 Earnings Conference Call Transcript,Motley Fool
Oct-25-18,Merck and Bristol-Myers Squibb Are Seeing Rising Sales of Their Cancer Drugs,Barrons.com
Oct-25-18,"Merck (MRK) Beats on Q3 Earnings, Lags Sales, Ups EPS View",Zacks
Oct-25-18,Former P&Ger joins Merck C-suite,American City Business Journals
Oct-25-18,"Merck, Bristol-Myers profits rise on cancer drug sales",Reuters
Oct-25-18,"Merck, Bristol-Myers profits rise on cancer drug sales",Reuters
Oct-25-18,Merck posts global sales of $11B in third quarter,Associated Press
Oct-25-18,"Merck&Co Earnings beat, Revenue misses In Q3",Investing.com
Oct-25-18,J&J Intends to Buy Residual Stake in Japanese Skincare Firm,Zacks
Oct-25-18,Merck says to retain animal health business as part of company,Reuters
Oct-25-18,3 Beaten-Down Biotech Stocks: Can They Bounce Back?,Motley Fool
Oct-25-18,"Cancer drug Keytruda powers Merck's profit beat, forecast raise",Reuters
Oct-25-18,Merck (MRK) Q3 Earnings Surpass Estimates,Zacks
Oct-25-18,[$$] Merck's 3Q Profit Misses Expectations,The Wall Street Journal
Oct-25-18,Drugmaker Merck beats profit estimate on Keytruda strength,Reuters
Oct-25-18,[$$] Bristol-Myers Squibb Raises Full-Year Profit Forecast,The Wall Street Journal
Oct-25-18,Bristol-Myers profit rises on better-than-expected cancer drug sales,Reuters
Oct-25-18,"Merck raises quarterly dividend by 15% to 55 cents a share, unveils $10 billion buyback",MarketWatch
Oct-25-18,Merck reports third-quarter profit vs year-ago loss,Reuters
Oct-25-18,Merck Announces Increased Fourth-Quarter Dividend and $10 Billion Share Repurchase Authorization,Business Wire
Oct-25-18,Merck Announces Third-Quarter 2018 Financial Results,Business Wire
Oct-26-18,"Pharma Stock Roundup: MRK, BMY Q3 Earnings, Cancer Data Presentations at ESMO",Zacks
Oct-26-18,"Company News For Oct 26, 2018",Zacks
Oct-26-18,Edited Transcript of MRK earnings conference call or presentation 25-Oct-18 12:00pm GMT,Thomson Reuters StreetEvents
Oct-29-18,Merck (MRK) Gains As Market Dips: What You Should Know,Zacks
Oct-29-18,Biogen And Eisai May Be At Odds In Alzheimer's  So What Now?,Investor's Business Daily
Oct-31-18,The Pharmaceuticals Industry Stock Outlook: A Steady Path Ahead,Zacks
Oct-31-18,"The Daily Biotech Pulse: KemPharm, FDA Nod For Merck, Clovis Q3 Miss, 3 Stocks To Debut",Benzinga
Nov-01-18,"Novo Nordisk (NVO) Reports In-Line Q3 Earnings, Beats Sales",Zacks
Nov-01-18,"Zoetis (ZTS) Beats on Q3 Earnings & Sales, Updates '18 View",Zacks
Nov-01-18,Does Merck & Co Incs (NYSE:MRK) CEO Pay Reflect Performance?,Simply Wall St.
Nov-01-18,Merck CEO on US healthcare system and drug pricing,CNBC Videos
Nov-01-18,"Big pharma leases almost 500,000 square feet for new research center",American City Business Journals
Nov-01-18,Edited Transcript of MRK earnings conference call or presentation 25-Oct-18 12:00pm GMT,Thomson Reuters StreetEvents
Nov-01-18,3 Pharma Stocks to Make a Portfolio Feel Better,Investopedia
Nov-02-18,"AMAG Posts Wider-Than-Expected Q3 Loss, Beats on Revenues",Zacks
Nov-02-18,"The Zacks Analyst Blog Highlights: Amazon, Facebook, Mastercard and Merck",Zacks
Nov-02-18,Dow Recovers More Than 900 Points in 3 Days: 5 Top Picks,Zacks
Nov-02-18,"New Research Coverage Highlights Landstar System, CMS Energy, MoSys, Pennsylvania Real Estate Investment Trust, Procter & Gamble, and Merck & Co.  Consolidated Revenues, Company Growth, and Expectations for 2018",GlobeNewswire
Nov-05-18,Epizyme (EPZM) Reports Narrower-Than-Expected Loss in Q3,Zacks
Nov-05-18,"ImmunoGen (IMGN) Beats on Earnings in Q3, Lowers Guidance",Zacks
Nov-06-18,5 Companies Hit 52-Week Highs,GuruFocus.com
Nov-06-18,Democrats Hold Edge in House Battle: 5 Great Picks,Zacks
Nov-07-18,"Mallinckrodt (MNK) Beats on Q3 Earnings Estimates, Ups View",Zacks
Nov-07-18,"'We have a lot of things in common'  Trump wants to work with Democrats on infrastructure, drugs",CNBC
Nov-07-18,Early Phase 1 Data from Mercks Oncology Pipeline for Investigational Anti-LAG-3 Therapy (MK-4280) and Anti-TIGIT Therapy (MK-7684) to Be Presented at SITCs 33rd Annual Meeting,Business Wire
Nov-08-18,Merck (MRK) Gains As Market Dips: What You Should Know,Zacks
Nov-08-18,Endo Plans For Cellulite Drug In 2020  Here's Why Investors Balked,Investor's Business Daily
Nov-08-18,AstraZeneca Breaks Out As CEO Predicts 'Sustained Growth' Streak,Investor's Business Daily
Nov-08-18,Jeff Auxier Comments on Biogen,GuruFocus.com
Nov-08-18,"Horizon Pharma (HZNP) Q3 Earnings & Sales Beat, Shares Rise",Zacks
Nov-08-18,Merck and Johnson & Johnson Shares Show Big Buying,Investopedia
Nov-08-18,Democrats Hold Edge in House Battle: 5 Great Picks (Revised),Zacks
Nov-08-18,Endo stock rises 6% after Q3 beats and upbeat 2018 guidance,MarketWatch
Nov-12-18,5 Stocks to Sell After the Midterm Election,InvestorPlace
Nov-12-18,October's biggest Losers And Most Surprising Winners,Benzinga
Nov-12-18,Merck's (MRK) Keytruda Gets FDA Approval for Liver Cancer,Zacks
Nov-13-18,Daniel Loeb Purchases 7 Stocks in 3rd Quarter,GuruFocus.com
Nov-13-18,Merck Begins Rolling Submission of Licensure Application for V920 (rVSVG-ZEBOV-GP) to U.S. Food and Drug Administration,Business Wire
Nov-13-18,"Bayer (BAYRY) Beats on Q3 Earnings, Revenue Estimates",Zacks
Nov-14-18,Merck (MRK) Stock Moves -0.7%: What You Should Know,Zacks
Nov-14-18,AbbVie's HCV Drug Mavyret Succeeds in Label Expansion Study,Zacks
Nov-14-18,Merck Starts Rolling BLA Submission for Ebola Vaccine V920,Zacks
Nov-14-18,Can These 2 Battered Biotech Stocks Recover?,Motley Fool
Nov-14-18,"The Daily Biotech Pulse: Mallinckrodt Faces FDA Panel, Reshape's Earnings, Vapotherm To Debut",Benzinga
Nov-14-18,Merck drug Keytruda succeeds in late-stage esophageal cancer trial,Reuters
Nov-15-18,Mallinckrodt Gets FDA Committee Vote for Abuse-Deterrent Drug,Zacks
Nov-15-18,Merck's Keytruda Improves Survival in Esophageal Cancer Study,Zacks
Nov-16-18,"Pharma Stock Roundup: FDA Updates on MRK, AZN's Cancer Drugs, Bayer's Q3 Earnings",Zacks
Nov-16-18,A Look At Merck & Co Incs (NYSE:MRK) Exceptional Fundamentals,Simply Wall St.
Nov-19-18,"AstraZeneca's Imfinzi Fails in Lung Cancer Study, Stock Down",Zacks
Nov-19-18,"Drug Pricing Resurfaces, Pfizer to Raise Cost of 41 Drugs",Zacks
Nov-19-18,"Merck KGaA, Darmstadt, Germany, and Pfizer Provide Update on Avelumab in Platinum-Resistant/Refractory Ovarian Cancer",PR Newswire
Nov-21-18,Merck (MRK) Gains But Lags Market: What You Should Know,Zacks
Nov-21-18,Pfizer Stock Has Multiple Positive Catalysts,InvestorPlace
Nov-21-18,Not business as usual: Rockville biotechs new CEO wants to turn things around,American City Business Journals
Nov-21-18,October's Biggest Losers And Most Surprising Winners,Benzinga
Nov-21-18,"Mylan Recalls Valsartan Lots, Gets FDA Warning for Facility",Zacks
Nov-21-18,IntelGenx's NDA Resubmission for Rizaport Gets FDA Acceptance,Zacks
Nov-21-18,FDA Accepts Allergan's (AGN) sNDA for Anti-Infective Avycaz,Zacks
Nov-21-18,Shire-Takeda Deal Gets Phase I Conditional European Approval,Zacks
Nov-21-18,TESARO Shares Rally on Rumors of Potential Acquisition Offer,Zacks
Nov-21-18,"Amid sell-off, top analysts are getting bullish these 5 defensive stocks including Merck",CNBC
Nov-21-18,Can Deal Interest Help Tesaro Recover?,Motley Fool
Nov-21-18,Today's Research Reports on Trending Tickers: Johnson & Johnson and Merck & Co.,ACCESSWIRE
Nov-23-18,Bayer Hurts from Generic Competition & Pipeline Setbacks,Zacks
Nov-26-18,AMAG's Label Expansion of Lead Products Raises Share Price,Zacks
Nov-26-18,"Bayer looks at options for consumer brands, animal health - sources",Reuters
Nov-26-18,"Bayer discusses sale of some consumer brands, future of animal health-sources",Reuters
Nov-26-18,Glaxo Inks Marketing Deal for Anaemia Candidate in Japan,Zacks
Nov-27-18,Accenture Brings Open Partner Ecosystem for Drug Discovery,Zacks
Nov-27-18,Merck (MRK) Outpaces Stock Market Gains: What You Should Know,Zacks
Nov-27-18,"Alnylam, Vir Begin Phase I/II Study on Hepatitis B Candidate",Zacks
Nov-27-18,Bristol-Myers' Opdivo-Yervoy Combo Fails in Lung Cancer Trial,Zacks
Nov-27-18,This Pharma Giant Is Still Consolidating Despite Lung Cancer Flop,Investor's Business Daily
Nov-27-18,Astrazeneca's Fasenra Gets Orphan Drug for Autoimmune Disease,Zacks
Nov-28-18,Merck raised prices five drugs including Keytruda in November,Reuters
Nov-28-18,Pfizer's Epilepsy Drug Lyrica Gets Pediatric Exclusivity,Zacks
Nov-28-18,"European Commission Approves Mercks DELSTRIGO (doravirine / lamivudine / tenofovir disoproxil fumarate), a Once-Daily Fixed-Dose Combination Tablet as a Complete Regimen and PIFELTRO (doravirine), an NNRTI, Both for the Treatment of HIV-1 in Appropriate Patients",Business Wire
Nov-29-18,[$$] Another Bad Deal for Bayer,The Wall Street Journal
Nov-29-18,Merck (MRK) Receives Approval for 2 HIV Medicines in EU,Zacks
Nov-29-18,Moderna IPO On Path To Be Largest Offering Of Venture-Backed Biotech,Investor's Business Daily
Nov-29-18,"Bayer to sell businesses, cut jobs after Monsanto deal",Reuters
Nov-29-18,"Bayer to sell businesses, cut jobs after Monsanto deal",Reuters
Nov-29-18,Dow Records Highest Single Day Gain in 8 Months: 5 Picks,Zacks
Nov-29-18,Catalyst's Firdapse Receives FDA Approval for Rare Disease,Zacks
Nov-29-18,4 Big Pharma Stocks to Add to Your Portfolio in December,Zacks
Nov-29-18,"The Daily Biotech Pulse: Twist In Protagonist Tale, Catalyst's Autoimmune Disorder Drug Approved",Benzinga
Nov-30-18,Novartis' Gilenya Approved in EU for Expanded Population,Zacks
Nov-30-18,Key Pharma Players With HIV Focus Ahead of World Aids Day,Zacks
Nov-30-18,"Fridays Vital Data: McDonalds, Twitter and Merck",InvestorPlace
Nov-30-18,"The Zacks Analyst Blog Highlights: Boeing, Merck, Microsoft, UnitedHealth and American Express",Zacks
Nov-30-18,Bayer (BAYRY) to Restructure Business & Reduce Headcount,Zacks
Nov-30-18,"The Zacks Analyst Blog Highlights: Merck, Mastercard, Salesforce, Diageo and State Street",Zacks
Nov-30-18,"Dow 30 Stock Roundup: BA's $383M Modification Contract, MSFT's Army Contract",Zacks
Dec-03-18,Merck (MRK) Stock Sinks As Market Gains: What You Should Know,Zacks
Dec-03-18,Shire's Takhzyro Gets European Nod for Hereditary Angioedema,Zacks
Dec-03-18,Does Keytruda's Dominance Make Merck & Co. a Buy Now?,Motley Fool
Dec-03-18,"The Zacks Analyst Blog Highlights: General Motors, Boeing, Microsoft, Merck and UnitedHealth",Zacks
Dec-03-18,Merck to Present at the Citi 2018 Global Healthcare Conference,Business Wire
Dec-04-18,Incyte (INCY) Announces Positive Data on Jakafi for GVHD,Zacks
Dec-04-18,3 Big Pharma Stocks Hitting 52-Week Highs -- Are They Buys?,Motley Fool
Dec-06-18,These 16 Top-Rated Stocks Are Showing Strength In Volatile Market,Investor's Business Daily
Dec-06-18,AbbVie Halts Rova-T Phase III Second-Line Lung Cancer Study,Zacks
Dec-06-18,"Your first trade for Thursday, December 6",CNBC
Dec-07-18,New Biotech IPO Dropped a Unicorn-Sized Value on Its First Day,Bloomberg
Dec-07-18,Mallinckrodt (MNK) to Separate Generics & Branded Businesses,Zacks
Dec-10-18,Merck (MRK) Outpaces Stock Market Gains: What You Should Know,Zacks
Dec-10-18,Mercks President of Global Human Health Adam H. Schechter to Leave Merck Frank Clyburn Named Chief Commercial Officer and Michael Nally Named Chief Marketing Officer,Business Wire
Dec-10-18,Roche's Tecentriq Gets FDA Approval for First-Line NSCLC,Zacks
Dec-10-18,PFE Stock Has Broken Its Slump and Could Challenge Former Highs,InvestorPlace
Dec-11-18,McDonald's to curb antibiotic use in its beef supply,Reuters
Dec-11-18,"Gabelli Names Clovis As Top Pick, Calls The Biotech A Likely Takeout Candidate",Benzinga
Dec-11-18,Moderna Stock Ushers In the Next Wave of Biotech,InvestorPlace
Dec-11-18,"The Daily Biotech Pulse: Management Change At Merck, Jazz Buyback, Arrowhead Earnings",Benzinga
Dec-12-18,Merck and Instituto Butantan Announce Collaboration Agreement to Develop Vaccines to Protect Against Dengue Infections,Business Wire
Dec-12-18,Roche to Create Companion Diagnostic Test for Merck's Keytruda,Zacks
Dec-12-18,Pfizer's (PFE) Shares Drop on Rating Downgrade by JP Morgan,Zacks
Dec-13-18,J&J's Tremfya Beats Novartis' Cosentyx in Head-to-Head Study,Zacks
Dec-13-18,Mallinckrodt's Roxicodone Reformulation Gets CRL From FDA,Zacks
Dec-13-18,Lilly Inks Deal With AC Immune for Potential Alzheimer's Drug,Zacks
Dec-13-18,5 Dow Stocks Stand Tall Despite Index's Loss of 2018 Gains,Zacks
Dec-13-18,5 Dow Stocks Defying the Index's YTD Plunge,Zacks
Dec-14-18,Merck Slips After Announcing Acquisition of France's Antelliq Group,TheStreet.com
Dec-14-18,[$$] Merck to Buy Animal Health Tech Business for $2.37 Billion,The Wall Street Journal
Dec-14-18,"Stocks - Starbucks, Costco Slump in Premarket; Apple, Merck, Adobe Fall",Investing.com
Dec-14-18,Should You Invest in the VanEck Vectors Pharmaceutical ETF (PPH)?,Zacks
Dec-14-18,Merck bolsters animal health unit with $2.4 billion Antelliq purchase,Reuters
Dec-14-18,Merck bolsters animal health unit with $2.4 billion Antelliq purchase,Reuters
Dec-14-18,5 Drug/Biotech Stocks With Promise to Sustain Bull Run in 2019,Zacks
Dec-14-18,Gwynedd Mercy University nearly doubles campus with 154-acre purchase,American City Business Journals
Dec-14-18,Today's Research Reports on Trending Tickers: Pfizer and Merck & Co.,ACCESSWIRE
Dec-14-18,Merck to bolster animal health unit with $2.4 billion purchase of Antelliq,Reuters
Dec-14-18,Merck to Acquire Privately Held Antelliq Group,Business Wire
Dec-17-18,Merck (MRK) Stock Moves -1.63%: What You Should Know,Zacks
Dec-17-18,Merck to Acquire Europe's Antelliq Group for $2.4 Billion,Zacks
Dec-17-18,Incyte (INCY) Collaborates with Innovent for 3 Candidates,Zacks
Dec-17-18,Lilly (LLY) to Acquire Pain Candidate From Private Biotech,Zacks
Dec-17-18,J&J Dips 10% as Reuters Says Company Knew of Asbestos in Talc,Zacks
Dec-17-18,Better Buy: Eli Lilly and Company vs. Merck & Co.,Motley Fool
Dec-18-18,Evofem Shares Up as Birth Control Gel Succeeds in Phase III,Zacks
Dec-18-18,Merck's Keytruda Gets EU Nod as Adjuvant Therapy for Melanoma,Zacks
Dec-18-18,Lilly's Taltz Outshines Humira in Psoriatic Arthritis Study,Zacks
Dec-18-18,"J&J Okays $5B Stock Buyback Plan, Stock Remains Stressed",Zacks
Dec-19-18,AstraZeneca's ovarian cancer drug gets FDA nod as maintenance treatment,Reuters
Dec-21-18,Merck KGaA-Pfizer to end late-stage ovarian cancer treatment study,Reuters
Dec-21-18,Merck KGaA-Pfizer to terminate late-stage ovarian cancer treatment study,Reuters
Dec-21-18,"Merck KGaA, Darmstadt, Germany, and Pfizer Provide Update on JAVELIN Ovarian 100 Trial of Avelumab in Previously Untreated Advanced Ovarian Cancer",PR Newswire
Dec-21-18,Pfizer Xtandi Succeeds in Late-Stage Prostate Cancer Study,Zacks
Dec-21-18,"Pharma Stock Roundup: GSK, PFE Ink Consumer Health JV, JNJ Hit by Talc Allegations",Zacks
Dec-21-18,Merck's sBLA for Keytruda in Lung Cancer Gets Extended Review,Zacks
Dec-21-18,"Dow 30 Stock Roundup: Nike, Walgreens Boots Earnings Impress",Zacks
Dec-21-18,5 S&P 500 Stocks Stand Tall Despite Index's Loss of 2018 Gains,Zacks
Dec-21-18,"Do Directors Own Merck & Co., Inc. (NYSE:MRK) Shares?",Simply Wall St.
Dec-24-18,"Dow Jones Falls 3,700 Points For The Month; This Blue-Chip Stock Triggers Sell Signal",Investor's Business Daily
Dec-24-18,Pfizer/Merck KGaA End Bavencio Ovarian Cancer Phase III Study,Zacks
Dec-26-18,"Sanofi: FDA Approves VAXELIS(TM), Sanofi and MSD's Pediatric Hexavalent Combination Vaccine",GlobeNewswire
Dec-26-18,"Eversept Partners Return, AUM, and Holdings",Insider Monkey
Dec-26-18,Will Big Pharma's Giant Maw Scoop Up These Small-Cap Players?,Investor's Business Daily
Dec-26-18,"Bristol-Myers Squibb Stock Is Coming Back Slow, but Thats Fine",InvestorPlace
Dec-27-18,This Is The Top Dow Stock Of 2018  And It's Not Even Close,Investor's Business Daily
Dec-27-18,Sanofi Wins FDA Nod for Pediatric Hexavalent Combo Vaccine,Zacks
Dec-27-18,Buy 5 Dow Stocks to Strengthen Your Portfolio in 2019,Zacks
Dec-27-18,"Forget J&J, Buy These 3 Big Drug Stocks Instead in 2019",Zacks
Dec-28-18,Merck (MRK) Stock Moves -0.01%: What You Should Know,Zacks
Dec-28-18,BioXcel Surges on Fast Track Designation to Agitation Drug,Zacks
Dec-28-18,"Top Analyst Reports for Merck, Abbott & Lockheed Martin",Zacks
Dec-28-18,"Analysis: Positioning to Benefit within General Motors, RE/MAX, Genworth Financial, Merck & Co., Aerojet Rocketdyne, and Fluor  Research Highlights Growth, Revenue, and Consolidated Results",GlobeNewswire
Dec-31-18,What Happened in the Stock Market Today,Motley Fool
Dec-31-18,This Is The Top Dow Stock Of 2018  And It's Not Even Close,Investor's Business Daily
Dec-31-18,Stocks Today Brush Off The Bears; Will These 4 Lead The Dow Jones In 2019?,Investor's Business Daily
Dec-31-18,The best and worst stocks of 2018,MarketWatch
Dec-31-18,"Dow Jones Futures Jump, But Here's A Stock Market Rally Reality Check",Investor's Business Daily
Dec-31-18,"The Zacks Analyst Blog Highlights: Merck, Abbott, Lockheed Martin, United Parcel Service and Bank of New York Mellon",Zacks
Jan-02-19,Horizon Pharma (HZNP) Up 28% on Business Expansion Strategy,Zacks
Jan-02-19,Could This New Biotech IPO Could Score Big With A Cancer Vaccine?,Investor's Business Daily
Jan-02-19,Merck to Participate at the 37th Annual J.P. Morgan Healthcare Conference,Business Wire
Jan-02-19,"BriaCell Announces Switch to Novel Frozen Formulation for Lead Cancer Drug Candidate, Upcoming Attendance at Biotech Showcase 2019 and Presentation at Keystone Symposia Conference",GlobeNewswire
Jan-03-19,The Top Healthcare Stocks of 2018: Can They Continue in 2019?,Motley Fool
Jan-03-19,Bristol-Myers' (BMY) Sprycel Gets FDA Nod for Label Expansion,Zacks
Jan-03-19,P.R. Ind Tour Ed Med & Env Ctl Facs Fin Auth -- Moody's reviews Bristol-Myers Squibb for downgrade,Moody's
Jan-03-19,"UPDATE: Cocrystal Pharma to work with Merck on flu therapy, sending shares up 32% premarket",MarketWatch
Jan-03-19,Merck's Keytruda wins 5 new approvals in Japan,MarketWatch
Jan-04-19,Bristol To Become Top 5 Pharma  And Other Fallout From Celgene Takeover,Investor's Business Daily
Jan-04-19,Bristol-Myers Becomes a Cancer-Fighting Giant With Celgene Buyout,InvestorPlace
Jan-04-19,"Pharma Stock Roundup: BMY to Buy CELG for $74B, MRK Gets Rights to NASH Candidate",Zacks
Jan-04-19,Bristol-Myers to Acquire Leading Biotech Celgene for $74B,Zacks
Jan-04-19,Pfizer Begins Pivotal Study on Alopecia Areata Candidate,Zacks
Jan-04-19,Today's Research Reports on Trending Tickers: Johnson & Johnson and Merck & Co.,ACCESSWIRE
Jan-04-19,"Merck Buys NASH Candidate, Keytruda Wins 5 Approvals in Japan",Zacks
Jan-07-19,Top Dow Stocks for 2018,Investopedia
Jan-07-19,Merck (MRK) Stock Sinks As Market Gains: What You Should Know,Zacks
Jan-07-19,Spiros Segalas' 5 Biggest Stock Buys of 4th Quarter,GuruFocus.com
Jan-07-19,U.S. Supreme Court could side with Merck over Fosamax lawsuits,Reuters
Jan-07-19,U.S. Supreme Court could side with Merck over Fosamax lawsuits,Reuters
Jan-07-19,Merck loses bid to revive $200 million Gilead verdict at U.S. high court,Reuters
Jan-07-19,Merck loses bid to revive $200 mln Gilead verdict at U.S. high court,Reuters
Jan-07-19,Should You Invest in the VanEck Vectors Pharmaceutical ETF (PPH)?,Zacks
Jan-07-19,Justice Ruth Bader Ginsburg missing oral arguments for first time in 25 years on Supreme Court,CNBC
Jan-07-19,Gilead (GILD) Collaborates With Yuhan for NASH Candidates,Zacks
Jan-07-19,"The Zacks Analyst Blog Highlights: Bristol-Myers, Celgene, Merck, Pfizer and AbbVie",Zacks
Jan-08-19,Is It Time to Sell Celgene Stock After the Bristol-Myers Squibb Offer?,InvestorPlace
Jan-08-19,Moderna Shares Jump on Positive Cancer-Treatment Progress,TheStreet.com
Jan-08-19,Moderna's stock jumps after progress report on cancer treatments,MarketWatch
Jan-08-19,Dogs of the Dow Win in 2018: Will ETFs See Success in 2019?,Zacks
Jan-09-19,Moderna Soars After Update of Its Pipeline Programs,GuruFocus.com
Jan-09-19,"Moderna (MRNA) Announces Pipeline Progress, Shares Rise",Zacks
Jan-09-19,Novartis' Crizanlizumab Gets Breakthrough Therapy Status,Zacks
Jan-09-19,Dow Posts Longest Winning Run Since November: 5 Top Picks,Zacks
Jan-10-19,Big Pharma CEOs Indicate More M&A Deals at JP Morgan Meeting,Zacks
Jan-11-19,NASH Space in Focus in 2019 as Firms Look to Diversify,Zacks
Jan-11-19,5 Reasons Why Investors Should Buy Novo Nordisk (NVO) in 2019,Zacks
Jan-11-19,"Pharma Stock Roundup: Lilly to Buy Loxo for $8B, M&A in Focus at JP Morgan Meet",Zacks
Jan-11-19,"Dow 30 Stock Roundup: Boeing Q4 Commercial Deliveries Up Y/Y, Merck Buys NASH Candidate",Zacks
Jan-11-19,3 Biotech Stocks Bubbling Away,Investopedia
Jan-11-19,4 Pharma & Biotech Pipeline Areas to Keep an Eye on in 2019,Zacks
Jan-14-19,5 Reasons Why Investors Should Buy Exelixis (EXEL) in 2019,Zacks
Jan-15-19,3 of the Top Big Pharma Stocks to Buy Now,InvestorPlace
Jan-15-19,"Stock Market News For Jan 15, 2019",Zacks
Jan-15-19,"3 Big Stock Charts for Tuesday: Broadcom, Facebook and Merck",InvestorPlace
Jan-17-19,Roche's sBLA for Tecentriq-Abraxane Combo Accepted by FDA,Zacks
Jan-17-19,"Nasdaq Leads Dow Jones In Bullish Upturn; These 4 Blue Chips Are Outpacing Apple, Forming Chart Patterns",Investor's Business Daily
Jan-17-19,Bull Signal Flashing for This Healthcare Stock,Schaeffer's Investment Research
Jan-17-19,Here's Yana Barton's 2019 stock picks,CNBC Videos
Jan-17-19,"3 Big Stock Charts for Thursday: Fiserv, Pfizer and PNC Financial Services Group",InvestorPlace
Jan-18-19,Samsung Bioepis biosimilar to Roche's Herceptin wins FDA nod,Reuters
Jan-18-19,Aerie's (AERI) Eye Care Candidate to Enter Clinical Studies,Zacks
Jan-18-19,"Dow 30 Stock Roundup: JPM &amp; AXP Earnings Disappoint, GS &amp; UNH Impress",Zacks
Jan-22-19,"J&amp;J's (JNJ) Q4 Earnings Beat, 2019 Sales Forecast Soft",Zacks
Jan-22-19,All Signals Are Positive for Buying Abbott Laboratories,InvestorPlace
Jan-22-19,Alnylam &amp; Medison Partner to Market RNAi Products in Israel,Zacks
Jan-22-19,Merck to Hold Fourth-Quarter and Full-Year 2018 Sales and Earnings Conference Call on February 1,Business Wire
Jan-22-19,"The Zacks Analyst Blog Highlights: Bank of America, Merck, Netflix, IBM and The Bank of New York Mellon",Zacks
Jan-23-19,"Healthcare ETFs Slip After Abbot Labs Revenue Miss, Weak Outlook",ETF Trends
Jan-23-19,BMO downgrades Merck to market perform,MarketWatch
Jan-23-19,"BRIEF-Merck KGaA, Tencent Announce Collaboration On Digital Health Services In China",Reuters
Jan-24-19,[$$] Bristol-Myers Reports Higher Sales but Another Lung-Cancer Setback,The Wall Street Journal
Jan-24-19,[$$] Bristol-Myers Reports Higher Sales but Another Lung-Cancer Setback,The Wall Street Journal
Jan-24-19,Stocks waver again as chipmakers jump and drug companies dip,Associated Press
Jan-24-19,"Bristol-Myers (BMY) Beats Q4 Earnings, Withdraws Opdivo sBLA",Zacks
Jan-24-19,Healthcare ETFs in Focus Ahead of Q4 Earnings,Zacks
Jan-24-19,Sanofi's (SNY) Influenza Vaccine Gets FDA Approval for Kids,Zacks
Jan-24-19,Merck Grants Exclusive License to Vertex for Two DNA Damage Response Inhibitors,CNW Group
Jan-24-19,Does Johnson & Johnson's Grim Outlook Spell Trouble for Big Pharma Stocks?,Motley Fool
Jan-25-19,Merck (MRK) Stock Sinks As Market Gains: What You Should Know,Zacks
Jan-25-19,"Pharma Stock Roundup: JNJ &amp; BMY's Q4 Earnings, Study Failures at LLY &amp; ABBV",Zacks
