date,title,source
Jan-25-19,Amgen/Allergan's Rituxan Biosimilar Meets Goal in Phase III,Zacks
Jan-25-19,How to Trade Merck and Pfizer Pre-Earnings - Each Face Deteriorating Charts,TheStreet.com
Jan-25-19,"Dow 30 Stock Roundup: UTX, TRV, PG, JNJ Earnings Impress, IBM Revenues Decline Y/Y",Zacks
Jan-25-19,"3 Big Stock Charts for Friday: Merck, Broadcom and Advanced Micro Devices",InvestorPlace
Jan-25-19,Asian shares rise on optimism over China-US trade talks,Associated Press
Jan-28-19,Inovio's Early/Mid-Stage Vaccine Pipeline Exhibits Growth,Zacks
Jan-28-19,"The Zacks Analyst Blog Highlights: J&amp;J, Bristol-Myers, Lilly, AbbVie and Merck",Zacks
Jan-28-19,Merck (MRK) Q4 Earnings Coming Up: What's in the Cards?,Zacks
Jan-28-19,"3 Big Stock Charts for Monday: Pfizer, MGM Resorts and Incyte",InvestorPlace
Jan-28-19,"Heres What Merck & Co., Inc.s (NYSE:MRK) P/E Is Telling Us",Simply Wall St.
Jan-29-19,Mary Ellen Coe Elected to Merck Board of Directors,Business Wire
Jan-29-19,Merck Announces Second-Quarter 2019 Dividend,Business Wire
Jan-29-19,Why Merck (MRK) Could Beat Earnings Estimates Again,Zacks
Jan-29-19,What's next for this slow-moving Peninsula biotech IPO?,American City Business Journals
Jan-29-19,Today's Research Reports on Trending Tickers: Teva Pharmaceutical Industries and Merck & Co.,ACCESSWIRE
Jan-30-19,Roche Halts Two Late-Stage Studies on Alzheimer's Candidate,Zacks
Jan-30-19,"Merck Receives Breakthrough Therapy Designation from FDA for V114, the Companys Investigational 15-Valent Conjugate Vaccine for the Prevention of Invasive Pneumococcal Disease, in Infants, Children, and Adolescents",Business Wire
Jan-31-19,"Friday Earnings Preview: Cigna, Merck, Exxon, Honeywell All Report",TheStreet.com
Jan-31-19,Merck's Q4 Earnings Preview,Benzinga
Jan-31-19,25 Stocks to Avoid This February,Schaeffer's Investment Research
Jan-31-19,Merck's Pneumococcal Vaccine Gets Breakthrough Therapy Status,Zacks
Jan-31-19,Eli Lilly (LLY) Q4 Earnings Coming Up: What's in the Cards?,Zacks
Jan-31-19,What's in the Cards for Skyworks (SWKS) in Q1 Earnings?,Zacks
Feb-01-19,Warren Buffett's Market Indicator Rises Near 135%,GuruFocus.com
Feb-01-19,"Merck Tops Q4 Earnings, Guides for Solid 2019, as Keytruda Sales Pass $2 Billion",TheStreet.com
Feb-01-19,Dow and S&P Hold on to Slim Gains While Amazon Drags Nasdaq Into the Red,TheStreet.com
Feb-01-19,Wall Street Green on Positive Jobs Report,GuruFocus.com
Feb-01-19,Merck News: MRK Stock Moves Higher on Q4 Earnings Beat,InvestorPlace
Feb-01-19,"Merck's Keytruda tops $2 billion in quarterly sales, shares rise",Reuters
Feb-01-19,"Merck 4Q net powered by cancer treatment sales, lower taxes",Associated Press
Feb-01-19,Merck (MRK) Beats on Q4 Earnings &amp; Sales as Keytruda Shines,Zacks
Feb-01-19,Dow's 3 earnings reporters adding nearly 40 points to the rally,MarketWatch
Feb-01-19,"Merck (MRK) Tops on Q4 Earnings &amp; Sales, Stock Up",Zacks
Feb-01-19,Merck tops profit and sales estimates in latest quarter,MarketWatch
Feb-01-19,Merck's quarterly sales rise 5.4 pct on Keytruda strength,Reuters
Feb-01-19,Merck Announces Fourth-Quarter and Full-Year 2018 Financial Results,Business Wire
Feb-01-19,"Stocks - Amazon, Cigna Sink in Premarket, Exxon, Merck, Honeywell, Symantec Rise",Investing.com
Feb-01-19,"Merck Reports In Line Q4 Results, Shares Slip",Investing.com
Feb-01-19,Top 5 Things to Know in the Market on Friday,Investing.com
Feb-04-19,"Stock Market News For Feb 4, 2019",Zacks
Feb-04-19,Why Merck (MRK) is a Great Dividend Stock Right Now,Zacks
Feb-04-19,Better Buy: Johnson & Johnson vs. Merck & Co.,Motley Fool
Feb-05-19,Merck CEO Frazier to testify at Senate drug pricing hearing,Reuters
Feb-05-19,Here's Why Codexis Gained as Much as 9.8% Today,Motley Fool
Feb-05-19,Edited Transcript of MRK earnings conference call or presentation 1-Feb-19 1:00pm GMT,Thomson Reuters StreetEvents
Feb-05-19,"Market Update: May Back to Brussels, BP Gushes Oil, Iron Spike, Pain Feels Pain",Market Exclusive
Feb-05-19,GSK pays up to $4.2 billion for Merck KGaA cancer immunotherapy,Reuters
Feb-05-19,Merck Is Named No. 1 Pharma Pick at Bank of America,TheStreet.com
Feb-05-19,Merck's Keytruda Clinches CHMP Nod for Difficult Lung Cancer,Zacks
Feb-05-19,Merck named the best pharma stock by Bank of America,CNBC
Feb-05-19,"The Daily Biotech Pulse: Gilead Earnings, Codexis Sings Pact With Merck, Eli Lilly Reports Positive Trial Results",Benzinga
Feb-06-19,"Merck & Co Inc (MRK) Chairman, President & CEO Kenneth C Frazier Sold $18. ...",GuruFocus.com
Feb-06-19,GlaxoSmithKline plc (GSK) Q4 2018 Earnings Conference Call Transcript,Motley Fool
Feb-06-19,Glaxo Inks Deal With Merck KGaA to Co-Develop Cancer Candidate,Zacks
Feb-06-19,Winners &amp; Losers from Trump's State of the Union Address,Zacks
Feb-07-19,Prior dengue infection may protect against Zika - study,Reuters
Feb-08-19,Incyte Down as FDA Extends Review Period of Jakafi for GVHD,Zacks
Feb-08-19,"Seattle Genetics (SGEN) Q4 Loss Widens, Revenues Top Mark",Zacks
Feb-08-19,"Pharma Stock Roundup: Q4 Earnings at MRK, LLY, CHMP Nod for Several Drugs",Zacks
Feb-08-19,"Dow 30 Stock Roundup: Disney Earnings Impress, Pfizer's Cancer Drug Gets CHMP Nod",Zacks
