date,title,source
Oct-31-18,Innoviva: 3Q Earnings Snapshot,Associated Press
Oct-31-18,Innoviva Reports Third Quarter 2018 Financial Results,Business Wire
Nov-05-18,IBD 50 Stocks To Watch: This Stock Rallied Despite A Miss On Earnings And Revenue,Investor's Business Daily
Nov-06-18,"Research Report Identifies Oil States International, Brightcove, Electronics for Imaging, Cirrus Logic, Innoviva, and Marinus Pharmaceuticals with Renewed Outlook  Fundamental Analysis, Calculating Forward Movement",GlobeNewswire
Nov-09-18,Moving Average Crossover Alert: Innoviva (INVA),Zacks
Nov-09-18,Once-daily Trelegy Ellipta gains expanded COPD indication in Europe,Business Wire
Nov-13-18,Glaxo/Innoviva's Trelegy Ellipta Gets Line Extension in Europe,Zacks
