date,title,source
Oct-18-18,Merger Alert: Monteverde & Associates PC Announces An Investigation Of Energen Corporation (EGN),ACCESSWIRE
Oct-25-18,"Energen Schedules 3Q18 Earnings Release for November 6, 2018",Business Wire
Oct-31-18,5 Low Leverage Stocks to Secure Your Portfolio Amid Volatility,Zacks
Nov-01-18,"Zacks.com highlights: Werner Enterprises, Amedysis, Haverty Furniture, Energen and MGIC Investment",Zacks
Nov-06-18,Energen (EGN) Q3 Earnings and Revenues Beat Estimates,Zacks
Nov-06-18,Energen beats profit estimates on higher production,Reuters
Nov-06-18,Energen: 3Q Earnings Snapshot,Associated Press
Nov-06-18,Energen quarterly net loss widens,Reuters
Nov-06-18,"Energen Production Tops 103 mboepd, Exceeds Guidance Midpoint by 4%",Business Wire
Nov-06-18,WeissLaw LLP Files Class Action Lawsuit Against Energen Corporation,ACCESSWIRE
