date,title,source
Oct-23-18,Transcat Operating Income Increases 49% on 8% Revenue Growth for Fiscal 2019 Second Quarter,Business Wire
Oct-24-18,Edited Transcript of TRNS earnings conference call or presentation 24-Oct-18 3:00pm GMT,Thomson Reuters StreetEvents
Oct-29-18,Transcat Sees Hammer Chart Pattern: Time to Buy?,Zacks
Oct-30-18,Edited Transcript of TRNS earnings conference call or presentation 24-Oct-18 3:00pm GMT,Thomson Reuters StreetEvents
Nov-12-18,How Financially Strong Is Transcat Inc (NASDAQ:TRNS)?,Simply Wall St.
Nov-21-18,"Market Trends Toward New Normal in Transcat, BioXcel Therapeutics, Youngevity International, Aquestive Therapeutics, TORM, and Transglobe Energy  Emerging Consolidated Expectations, Analyst Ratings",GlobeNewswire
Dec-14-18,"Heres What Transcat, Inc.s (NASDAQ:TRNS) P/E Is Telling Us",Simply Wall St.
Jan-10-19,"Is Transcat, Inc.s (NASDAQ:TRNS) CEO Pay Fair?",Simply Wall St.
Jan-22-19,Transcat Announces Third Quarter Fiscal Year 2019 Conference Call and Webcast,Business Wire
Jan-28-19,Transcat (TRNS) Earnings Expected to Grow: Should You Buy?,Zacks
Feb-04-19,Transcat Reports Record Third Quarter Revenue in Fiscal 2019,Business Wire
Feb-05-19,"Is Transcat, Inc. (NASDAQ:TRNS) A Volatile Stock?",Simply Wall St.
Feb-07-19,Edited Transcript of TRNS earnings conference call or presentation 5-Feb-19 4:00pm GMT,Thomson Reuters StreetEvents
Mar-12-19,"Have Insiders Been Selling Transcat, Inc. (NASDAQ:TRNS) Shares This Year?",Simply Wall St.
Apr-01-19,Transcat Expands Its Southern California Presence with Acquisition of Gauge Repair Service,Business Wire
Apr-01-19,"What Transcat, Inc.'s (NASDAQ:TRNS) ROE Can Tell Us",Simply Wall St.
Apr-18-19,"A Look At The Fair Value Of Transcat, Inc. (NASDAQ:TRNS)",Simply Wall St.
May-06-19,"Do Insiders Own Shares In Transcat, Inc. (NASDAQ:TRNS)?",Simply Wall St.
May-08-19,Transcat Announces Fourth Quarter and Full Fiscal Year 2019 Conference Call and Webcast,Business Wire
May-14-19,Analysts Estimate Transcat (TRNS) to Report a Decline in Earnings: What to Look Out for,Zacks
May-21-19,Transcat Reports Operating Income Up 13% on Record Revenue for Fiscal 2019,Business Wire
May-21-19,If You Had Bought Transcat (NASDAQ:TRNS) Shares Five Years Ago You'd Have Made 166%,Simply Wall St.
May-22-19,Edited Transcript of TRNS earnings conference call or presentation 22-May-19 3:00pm GMT,Thomson Reuters StreetEvents
May-22-19,"Transcat, Inc. to Host Earnings Call",ACCESSWIRE
May-24-19,Looking for a Growth Stock? 3 Reasons Why Transcat (TRNS) is a Solid Choice,Zacks
May-29-19,"Transcat, Inc. to Present at Stifel 2019 Cross Sector Insight Conference",Business Wire
May-31-19,New Strong Buy Stocks for May 31st,Zacks
