date,title,source
Oct-19-18,Provident Financial (PFS) Q3 Earnings Preview: What to Know Ahead of the Release,Zacks
Oct-26-18,"Provident Financial Services, Inc. (PFS) Q3 2018 Earnings Conference Call Transcript",Motley Fool
Oct-26-18,Provident Financial (PFS) Beats Q3 Earnings and Revenue Estimates,Zacks
Oct-26-18,Provident Financial: 3Q Earnings Snapshot,Associated Press
Oct-26-18,"Provident Financial Services, Inc. Announces Record Third Quarter Earnings and Declares Quarterly Cash Dividend",GlobeNewswire
Oct-26-18,Is Provident Financial Services Incs (NYSE:PFS) P/E Ratio Really That Good?,Simply Wall St.
Oct-29-18,Edited Transcript of PFS earnings conference call or presentation 26-Oct-18 2:00pm GMT,Thomson Reuters StreetEvents
Oct-31-18,Edited Transcript of PFS earnings conference call or presentation 26-Oct-18 2:00pm GMT,Thomson Reuters StreetEvents
Nov-01-18,Edited Transcript of PFS earnings conference call or presentation 26-Oct-18 2:00pm GMT,Thomson Reuters StreetEvents
Nov-01-18,"Moran Joins Provident Bank as Executive Vice President, Director of Retail Banking",PR Newswire
Nov-08-18,Edited Transcript of PFS earnings conference call or presentation 26-Oct-18 2:00pm GMT,Thomson Reuters StreetEvents
Nov-09-18,"4 Days Left Before Provident Financial Services Inc (NYSE:PFS) Will Be Trading Ex-Dividend,",Simply Wall St.
Jan-03-19,Provident to Assist Customers Affected by U.S. Government Shutdown,PR Newswire
Jan-03-19,HMST vs. PFS: Which Stock Is the Better Value Option?,Zacks
Jan-04-19,"Provident Financial Services, Inc. Schedules Fourth Quarter and Year-Ended Earnings Conference Call",GlobeNewswire
Jan-22-19,Beacon Trust Announces Agreement to Acquire Tirschwell & Loewy,PR Newswire
Jan-23-19,"Did Provident Financial Services, Inc. (NYSE:PFS) Insiders Sell Shares?",Simply Wall St.
Jan-25-19,Provident Financial (PFS) Earnings Expected to Grow: Should You Buy?,Zacks
Feb-01-19,Provident Financial Services Inc (PFS) Q4 2018 Earnings Conference Call Transcript,Motley Fool
Feb-01-19,Provident Financial (PFS) Beats Q4 Earnings and Revenue Estimates,Zacks
Feb-01-19,Provident Financial: 4Q Earnings Snapshot,Associated Press
Feb-01-19,"Provident Financial Services, Inc. Announces Record Fourth Quarter and Full Year Earnings, Declares Increased Quarterly Cash Dividend and Special Cash Dividend",GlobeNewswire
Feb-04-19,Edited Transcript of PFS earnings conference call or presentation 1-Feb-19 3:00pm GMT,Thomson Reuters StreetEvents
Feb-05-19,Are You Looking for a High-Growth Dividend Stock? Provident Financial (PFS) Could Be a Great Choice,Zacks
Feb-08-19,Provident Financial (PFS) Is Up 6.05% in One Week: What You Should Know,Zacks
Feb-15-19,Top Ranked Income Stocks to Buy for February 15th,Zacks
Feb-21-19,Are You Looking for a High-Growth Dividend Stock? Provident Financial (PFS) Could Be a Great Choice,Zacks
Feb-26-19,Provident Bank Launches Digital Lending Capability for Small Business Customers Powered by Fundation,Business Wire
Feb-28-19,"Could Provident Financial Services, Inc.s (NYSE:PFS) Investor Composition Influence The Stock Price?",Simply Wall St.
Mar-11-19,Why Provident Financial is an Attractive Pick Right Now?,Zacks
Mar-13-19,Provident Financial (PFS) is a Top Dividend Stock Right Now: Should You Buy?,Zacks
Mar-21-19,These 5 banks are likely M&A buyers in Philadelphia,American City Business Journals
Mar-26-19,Edited Transcript of PFS earnings conference call or presentation 27-Jul-18 2:00pm GMT,Thomson Reuters StreetEvents
Apr-01-19,This is Why Provident Financial (PFS) is a Great Dividend Stock,Zacks
Apr-01-19,"Provident Financial Services, Inc. Schedules First Quarter Earnings Conference Call",GlobeNewswire
Apr-03-19,SHAREHOLDER ALERT: Monteverde & Associates PC Launches an Investigation of the Board of Directors and Officers,PR Newswire
Apr-04-19,"Should You Worry About Provident Financial Services, Inc.'s (NYSE:PFS) CEO Pay?",Simply Wall St.
Apr-15-19,"Leary Joins Provident as SVP, BSA/AML Compliance Director",PR Newswire
Apr-17-19,Provident Financial (PFS) is a Top Dividend Stock Right Now: Should You Buy?,Zacks
Apr-26-19,Provident Financial Services Inc (PFS) Q1 2019 Earnings Call Transcript,Motley Fool
Apr-26-19,Provident Financial: 1Q Earnings Snapshot,Associated Press
Apr-26-19,"Provident Financial Services, Inc. Announces Increased First Quarter Earnings and Declares Quarterly Cash Dividend",GlobeNewswire
Apr-29-19,Edited Transcript of PFS earnings conference call or presentation 26-Apr-19 2:00pm GMT,Thomson Reuters StreetEvents
May-01-19,"Is Provident Financial Services, Inc. (PFS) A Good Stock To Buy?",Insider Monkey
May-10-19,"What Type Of Shareholder Owns Provident Financial Services, Inc.'s (NYSE:PFS)?",Simply Wall St.
May-13-19,Why North Jersey banks are eyeing Philadelphia,American City Business Journals
Jun-05-19,The Provident Financial Services (NYSE:PFS) Share Price Is Up 34% And Shareholders Are Holding On,Simply Wall St.
