date,title,source
Oct-18-18,"Report: Exploring Fundamental Drivers Behind Syndax Pharmaceuticals, Arconic, Del Taco Restaurants, Aerohive Networks, KalVista Pharmaceuticals, and Adtalem Global Education  New Horizons, Emerging Trends, and Upcoming Developments",GlobeNewswire
Oct-22-18,Ross University School of Medicine Holds Inaugural Convocation Ceremony to Celebrate Faculty and Staff,Business Wire
Oct-23-18,Adtalem Global Education Announces First Quarter Fiscal 2019 Conference Call,Business Wire
Oct-30-18,Is Adtalem Global Education Incs (NYSE:ATGE) CEO Paid Enough To Stay Motivated?,Simply Wall St.
Nov-01-18,Adtalem: Fiscal 1Q Earnings Snapshot,Associated Press
Nov-01-18,Adtalem Global Education Announces First Quarter Fiscal 2019 Results,Business Wire
Nov-01-18,Dont Sell Adtalem Global Education Inc (NYSE:ATGE) Before You Read This,Simply Wall St.
Nov-02-18,"Adtalem's (ATGE) Q1 Earnings Beat Estimates, Revenues Miss",Zacks
Nov-02-18,Edited Transcript of ATGE earnings conference call or presentation 1-Nov-18 9:00pm GMT,Thomson Reuters StreetEvents
Nov-07-18,Edited Transcript of ATGE earnings conference call or presentation 1-Nov-18 9:00pm GMT,Thomson Reuters StreetEvents
Nov-08-18,Adtalem Global Education Announces New $300 Million Share Repurchase Program,Business Wire
Nov-12-18,"Recent Analysis Shows Carrizo Oil & Gas, MaxLinear, Aerohive Networks, Adtalem Global Education, Tenet Healthcare, and Cornerstone OnDemand Market Influences  Renewed Outlook, Key Drivers of Growth",GlobeNewswire
Nov-13-18,BPI or ATGE: Which Is the Better Value Stock Right Now?,Zacks
Nov-15-18,Ross University School of Veterinary Medicine Counseling Center Earns International Association of Counseling Services Accreditation,Business Wire
Nov-16-18,Strategic Education (STRA) Boosts Campus Count in Texas,Zacks
Nov-19-18,"Adtalem (ATGE) Surges 52% in a Year, Outperforms Industry",Zacks
Nov-21-18,Adtalem Global Education Inc. (ATGE): Moving Average Crossover Alert,Zacks
Nov-26-18,Healthcare in Time of a Disaster,Business Wire
Nov-29-18,ATGE or BFAM: Which Is the Better Value Stock Right Now?,Zacks
Nov-30-18,"Universal Technical's (UTI) Q4 Loss In Line, Revenues Miss",Zacks
Dec-04-18,Mohawk (MHK) Falls 55% Over a Year: What's Hurting the Stock?,Zacks
Dec-06-18,Ross University School of Medicine Expands Partnership with Cleveland Clinic Florida,Business Wire
Dec-11-18,Adtalem Global Education Completes Divestitures of DeVry University and Carrington College,Business Wire
Dec-12-18,Adtalem Closes Sale of DeVry University & Carrington College,Zacks
Dec-14-18,Here's Why You Should Buy Universal Technical Stock Right Now,Zacks
Dec-18-18,ATGE vs. BFAM: Which Stock Is the Better Value Option?,Zacks
Dec-19-18,Here's Why You Should Add K12 (LRN) to Your Portfolio Now,Zacks
Dec-19-18,Adtalem Global Education Inc. (ATGE): Are Hedge Funds Right About This Stock?,Insider Monkey
Dec-21-18,5 Top-Ranked Education Stocks to Buy for 2019,Zacks
Dec-26-18,"Consolidated Research: 2019 Summary Expectations for NextEra Energy, Gogo, Stryker, Aerohive Networks, Adtalem Global Education, and RCI Hospitality  Fundamental Analysis, Key Performance Indications",GlobeNewswire
Jan-02-19,Barbados Grand Opening for Ross University School of Medicine,Business Wire
Jan-09-19,Adtalem Global Education Names Stephen Beard as Chief Operating Officer and General Counsel,Business Wire
Jan-28-19,Adtalem Global Education Announces Second Quarter Fiscal 2019 Conference Call,Business Wire
Jan-31-19,Analysts Estimate Adtalem Global Education (ATGE) to Report a Decline in Earnings: What to Look Out for,Zacks
Feb-01-19,"Research Report Identifies Whirlpool, Adtalem Global Education, Reinsurance Group of America, W.R. Berkley, Veracyte, and 22nd Century Group with Renewed Outlook  Fundamental Analysis, Calculating Forward Movement",GlobeNewswire
Feb-06-19,Ross University School of Veterinary Medicine Announces First Doctoral Graduates,Business Wire
Feb-07-19,Adtalem: Fiscal 2Q Earnings Snapshot,Associated Press
Feb-07-19,Adtalem Global Education Announces Second Quarter Fiscal 2019 Results,Business Wire
Feb-07-19,Bright Horizons (BFAM) to Post Q4 Earnings: What's in Store?,Zacks
Feb-07-19,Caribbean Conference Addresses Critical Healthcare Preparedness for Hurricanes and Other Disasters,Business Wire
Feb-08-19,"Adtalem (ATGE) Beats Q2 Earnings Estimates, Lags Revenues",Zacks
Feb-08-19,Edited Transcript of ATGE earnings conference call or presentation 7-Feb-19 10:00pm GMT,Thomson Reuters StreetEvents
Feb-11-19,Edited Transcript of ATGE earnings conference call or presentation 7-Feb-19 10:00pm GMT,Thomson Reuters StreetEvents
Feb-15-19,Ross University School of Medicine & Florida Agricultural and Mechanical University Partner to Increase Physician Diversity in the U.S.,Business Wire
Feb-19-19,"With A Return On Equity Of 13%, Has Adtalem Global Education Inc.s (NYSE:ATGE) Management Done Well?",Simply Wall St.
Feb-20-19,ATGE vs. BFAM: Which Stock Should Value Investors Buy Now?,Zacks
Feb-25-19,"Focus on Technology Disruptions, Current Investigations and Cases at ACAMS 24th Annual International AML & Financial Crime Conference",Business Wire
Feb-26-19,Ross University School of Veterinary Medicine Establishes Partnership with Clarence Fitzroy Bryant College,Business Wire
Feb-26-19,"New Research: Key Drivers of Growth for Molson Coors Brewing, Ralph Lauren, Stratasys, Adtalem Global Education, Unifirst, and Natural Health Trends  Factors of Influence, Major Initiatives and Sustained Production",GlobeNewswire
Mar-04-19,"Strategic Education (STRA) Q4 Earnings Beat, Enrollment High",Zacks
Mar-04-19,CAMS Certification to debut in Turkey,Business Wire
Mar-05-19,Lisa W. Wardell Honored By Summer Search for Contributions to Education,Business Wire
Mar-07-19,Adtalem Global Education Becomes First Higher Education Organization to Accept HBCU Caucus Partnership Challenge,Business Wire
Mar-13-19,American Public Education's (APEI) Q4 Earnings Top Estimates,Zacks
Mar-13-19,ATGE vs. STRA: Which Stock Is the Better Value Option?,Zacks
Mar-15-19,Adtalem's Investment Initiatives &amp; Enrollment to Drive Growth,Zacks
Mar-18-19,"Match Day: Adtalem Medical Schools Driving Diversity, Addressing Doctor Shortfall in US",Business Wire
Mar-18-19,"Strategic Plans Aid American Public Education, Enrollment Down",Zacks
Mar-21-19,"Strategic Education Rides on Solid Enrollment, Regulations Ail",Zacks
Mar-22-19,Is Adtalem Global Education (ATGE) a Great Value Stock Right Now?,Zacks
Mar-26-19,Chamberlain University Names Dr. Simendea Clark President of Chicago Campus,Business Wire
