date,title,source
Oct-17-18,Citrix Systems (CTXS) Q3 Earnings Preview: Here's What to Look Out For,Zacks
Oct-19-18,Is a Beat in Store for Citrix Systems (CTXS) in Q3 Earnings?,Zacks
Oct-23-18,"Software Stocks' Earnings on Oct 24: FFIV, CTXS & MSFT",Zacks
Oct-24-18,Citrix: 3Q Earnings Snapshot,Associated Press
Oct-24-18,Citrix Reports Third Quarter 2018 Financial Results,Business Wire
Oct-24-18,Citrix Declares Quarterly Dividend,Business Wire
Oct-25-18,"Citrix (CTXS) Beats on Q3 Earnings & Revenues, Hikes 18' View",Zacks
Oct-30-18,"Research Report Identifies Citrix, Ameriprise Financial, Natus Medical, Alphabet, Amazon, and MarketAxess with Renewed Outlook  Fundamental Analysis, Calculating Forward Movement",GlobeNewswire
Nov-01-18,Citrix Transforms Future of Work,Business Wire
Nov-06-18,Citrix Arms Companies in Global War for Talent,Business Wire
Nov-08-18,"Paul Singer and Billionaires Dont Think the Bull Run is Over for Citrix Systems, Inc. (CTXS) Just Yet",Insider Monkey
Nov-14-18,Citrix Stock Is Surging This Year With a New CEO,Barrons.com
Nov-15-18,Citrix Executives to Present at Upcoming Investor Conferences,Business Wire
Nov-15-18,Citrix Redefines Employee Experience,Business Wire
Nov-16-18,The Funded: 9 Bay Area companies raise nearly $600M at week's end,American City Business Journals
Nov-16-18,Citrix acquires Silicon Valley-area startup,American City Business Journals
Nov-20-18,Palo Alto Networks stock climbs as Morgan Stanley defends bullish rating,MarketWatch
Nov-20-18,"Microsoft Buys FSLogix, Ups Ante in Desktop Virtualization",Zacks
Nov-23-18,2 Tech Stocks That Have Defied the Downturn,Barrons.com
Nov-26-18,Here's Why You Should Retain Citrix (CTXS) in Your Portfolio,Zacks
Nov-27-18,Citrix Ranked as a Leader in Unified Endpoint Management Solutions,Business Wire
Nov-28-18,What's next for Citrix after acquiring Sapho,American City Business Journals
Dec-04-18,Vector Rockets into New Frontiers with Citrix,Business Wire
Dec-07-18,"New Research: Key Drivers of Growth for JetBlue Airways, DaVita, Align Technology, Box, Manhattan Associates, and Citrix  Factors of Influence, Major Initiatives and Sustained Production",GlobeNewswire
Dec-10-18,Should You Invest in the Invesco Dynamic Software ETF (PSJ)?,Zacks
Dec-10-18,"Is Citrix Systems, Inc. (CTXS) A Good Stock To Buy?",Insider Monkey
Dec-11-18,Citrix Elects Thomas Hogan to Its Board of Directors,Business Wire
Dec-11-18,"Is Citrix Systems, Inc. (NASDAQ:CTXS) A Smart Pick For Income Investors?",Simply Wall St.
Dec-11-18,Citrix Recognized for its Leadership in Digital Workspace Solutions,Business Wire
Dec-27-18,"3 Big Stock Charts for Thursday: Verizon, Kroger and Citrix Systems",InvestorPlace
Jan-03-19,Citrix Recognized for Customer Support Excellence,Business Wire
Jan-08-19,8 Stocks To Lead As Market Risk Escalates,Investopedia
Jan-09-19,Citrix Presents 2019 Partner Innovation Awards,Business Wire
Jan-10-19,"Citrix Systems to Announce Fourth Quarter 2018 Financial Results on Wednesday, January 23",Business Wire
Jan-15-19,"Saab Teams with Citrix and DXC Technology to Create Intelligent Digital Workspace, Fuel Collaboration and Innovation Across Global Operations",Business Wire
Jan-15-19,"This is how much Apple pays a typical employee  and how that compares to Google, Facebook, Netflix, Microsoft, Box and more",American City Business Journals
Jan-16-19,"Is Citrix Systems, Inc.s (NASDAQ:CTXS) 31% ROCE Any Good?",Simply Wall St.
Jan-16-19,Earnings Preview: Citrix Systems (CTXS) Q4 Earnings Expected to Decline,Zacks
Jan-18-19,Factors Expected to Impact Citrix Systems' (CTXS) Q4 Earnings,Zacks
Jan-22-19,"Software Stocks Earnings Roster for Jan 23: FFIV, PTC &amp; More",Zacks
Jan-23-19,"Citrix Systems stock falls after earnings beat, weak guidance",MarketWatch
Jan-23-19,Citrix: 4Q Earnings Snapshot,Associated Press
Jan-23-19,Citrix Reports Fourth Quarter and Fiscal Year Financial Results,Business Wire
Jan-23-19,"Citrix Systems Earnings, Revenue beat in Q4",Investing.com
Jan-24-19,American Airlines and SLM jump while McCormick falls,Associated Press
Jan-24-19,Citrix (CTXS) Earnings &amp; Revenues Beat Estimates in Q4,Zacks
Jan-24-19,Stocks - Market Ends Mixed as Dow Sees Red on Fresh Trade Jitters,Investing.com
Jan-24-19,Stocks - Wall Street Starts Little Changed,Investing.com
Jan-24-19,"Stocks - Texas Instruments, Apple, American Airlines Gain in Premarket",Investing.com
Jan-24-19,Edited Transcript of CTXS earnings conference call or presentation 23-Jan-19 9:45pm GMT,Thomson Reuters StreetEvents
Jan-25-19,Don't Sweat This Software Stock's Pullback,Schaeffer's Investment Research
Jan-25-19,Edited Transcript of CTXS earnings conference call or presentation 23-Jan-19 9:45pm GMT,Thomson Reuters StreetEvents
Jan-25-19,Citrix Systems enters the space race,American City Business Journals
Feb-01-19,Palo Alto 'digital experience' startup loads up on ex-Citrix execs,American City Business Journals
Feb-04-19,Citrix Executive to Present at Upcoming Investor Conference,Business Wire
Feb-05-19,CMP Swims Ahead of Competition with Citrix and XenTegra,Business Wire
Feb-12-19,WellSpan Partners with Citrix to Transform Healthcare,Business Wire
Feb-12-19,"3 Big Stock Charts for Tuesday: Micron Technology, Citrix Systems and Vulcan Materials",InvestorPlace
Feb-14-19,Citrix Systems Ready to Break Out,Investopedia
Feb-15-19,"Citrix Systems Inc (CTXS) Files 10-K for the Fiscal Year Ended on December 31, 2018",GuruFocus.com
Feb-15-19,The typical Facebook employee earns double Silicon Valley's median household income. How 50+ big tech employers compare,American City Business Journals
Feb-22-19,Citrix (CTXS) Up 3.1% Since Last Earnings Report: Can It Continue?,Zacks
Feb-27-19,"Glancy Prongay & Murray LLP Continues Investigation on Behalf of Citrix Systems, Inc. Investors (CTXS)",GlobeNewswire
Feb-27-19,Upcoming Citrix Events for Financial Analysts,Business Wire
Feb-28-19,"Research Report Identifies Sunoco LP, Citrix, Alkermes plc, CubeSmart, Morningstar, and Synopsys with Renewed Outlook  Fundamental Analysis, Calculating Forward Movement",GlobeNewswire
Mar-05-19,Citrix Raises Bar for SD-WAN Security,Business Wire
Mar-05-19,The $200K Club: Broadcom joins these Bay Area tech companies paying a typical employee top dollar,American City Business Journals
Mar-08-19,Citrix Systems says hackers gained access to its internal network,Reuters
Mar-08-19,[$$] Citrix investigates FBI report about cyber breach,Financial Times
Mar-11-19,[$$] Cyber Daily: Information Security Chiefs Gain Stature; Citrix Attacked; U.K. Girds for Election Interference,The Wall Street Journal
Mar-11-19,"3 Big Stock Charts for Monday: Coca-Cola, Citrix Systems and Johnson Controls",InvestorPlace
Mar-14-19,Citrix Synergy 2019: Delivering the Future of Work,Business Wire
Mar-19-19,Miami Marlins Reach for the Cloud with Citrix,Business Wire
Mar-20-19,Pareteum and Citrix Agree Mobile Workforce Global Cloud Strategy Deployment,PR Newswire
Mar-21-19,Tech Stocks in the News You Should Know,ACCESSWIRE
Mar-21-19,9 High-Margin Stocks Seen Leading in Fed's New Dovish Era,Investopedia
Mar-25-19,"Report: Exploring Fundamental Drivers Behind M.D.C., salesforce.com, inc, Citrix, Match Group, Sangamo Therapeutics, and Popular  New Horizons, Emerging Trends, and Upcoming Developments",GlobeNewswire
Apr-03-19,Shares of Citrix Systems jump nearly 7% on report it hired Goldman for a potential sale,MarketWatch
Apr-03-19,"Heres What Hedge Funds Think About Citrix Systems, Inc. (CTXS)",Insider Monkey
Apr-04-19,"Citrix Systems, Inc. -- Moody's announces completion of a periodic review of ratings of Citrix Systems, Inc.",Moody's
Apr-04-19,"3 Big Stock Charts for Thursday: Citrix Systems, Invesco and HollyFrontier",InvestorPlace
Apr-09-19,Citrix Delivers Next-Generation Networking Solutions on Google Cloud Platform,Business Wire
Apr-10-19,"FireEye joins major Bay Area employers like Facebook, Netflix, Google, Microsoft and Salesforce in paying a typical worker more than $150,000 per year",American City Business Journals
Apr-12-19,"Citrix Systems to Announce First Quarter 2019 Financial Results on Wednesday, April 24",Business Wire
Apr-16-19,Ravensdown Enables Smarter Farming with Citrix and Inde Technology,Business Wire
Apr-17-19,Earnings Preview: Citrix Systems (CTXS) Q1 Earnings Expected to Decline,Zacks
Apr-18-19,Can Citrix Systems (CTXS) Retain Earnings Beat Streak in Q1?,Zacks
Apr-18-19,"3 Big Stock Charts for Thursday: Citrix Systems, Goldman Sachs Group and Amgen",InvestorPlace
