date,title,source
Oct-18-18,Should Bassett Furniture Industries Incorporated (NASDAQ:BSET) Focus On Improving This Fundamental Metric?,Simply Wall St.
Oct-25-18,"New Research: Key Drivers of Growth for Watts Water Technologies, The Western Union, Take-Two Interactive Software, Bassett Furniture Industries, Twilio, and Cisco  Factors of Influence, Major Initiatives and Sustained Production",GlobeNewswire
Nov-29-18,Is Bassett Furniture Industries Incorporateds (NASDAQ:BSET) CEO Paid Enough Relative To Peers?,Simply Wall St.
Dec-17-18,"What You Must Know About Bassett Furniture Industries, Incorporateds (NASDAQ:BSET) Beta Value",Simply Wall St.
Jan-10-19,Earnings Preview: Bassett Furniture (BSET) Q4 Earnings Expected to Decline,Zacks
Jan-17-19,Bassett Furniture (BSET) Misses Q4 Earnings and Revenue Estimates,Zacks
Jan-17-19,Bassett: Fiscal 4Q Earnings Snapshot,Associated Press
Jan-17-19,Bassett Announces Fiscal Fourth Quarter Results,GlobeNewswire
Jan-22-19,"Is Bassett Furniture Industries, Incorporated (NASDAQ:BSET) A Smart Choice For Dividend Investors?",Simply Wall St.
Feb-14-19,"Should You Take Comfort From Insider Transactions At Bassett Furniture Industries, Incorporated (NASDAQ:BSET)?",Simply Wall St.
Feb-15-19,"Analysis: Positioning to Benefit within Cloudera, Domtar, NextEra Energy Partners, LP, Benefitfocus, Robert Half International, and Bassett Furniture Industries  Research Highlights Growth, Revenue, and Consolidated Results",GlobeNewswire
Mar-06-19,"Why Bassett Furniture Industries, Incorporateds (NASDAQ:BSET) Use Of Investor Capital Doesnt Look Great",Simply Wall St.
Mar-07-19,Bassett Declares Quarterly Dividend,GlobeNewswire
Mar-12-19,15 Stocks Sitting on Huge Piles of Cash,InvestorPlace
Mar-20-19,Earnings Preview: Bassett Furniture (BSET) Q1 Earnings Expected to Decline,Zacks
