date,title,source
Nov-13-18,BroadVision Announces Third Quarter 2018 Results,GlobeNewswire
Nov-23-18,"Report: Exploring Fundamental Drivers Behind State Auto Financial, CTI Industries, 1347 Property Insurance, U.S. Auto Parts Network, EDAP TMS S.A, and BroadVision  New Horizons, Emerging Trends, and Upcoming Developments",GlobeNewswire
Dec-26-18,"Is BroadVision, Inc.s (NASDAQ:BVSN) CEO Being Overpaid?",Simply Wall St.
Jan-08-19,"BroadVision Announces Completion of Its Subsidiary Vmoso, Inc. Spin-Out via Private Placement",GlobeNewswire
Feb-13-19,"What You Must Know About BroadVision, Inc.s (NASDAQ:BVSN) Beta Value",Simply Wall St.
Apr-01-19,BroadVision Announces Fourth Quarter 2018 Results,GlobeNewswire
Apr-29-19,"Can We See Significant Insider Ownership On The BroadVision, Inc. (NASDAQ:BVSN) Share Register?",Simply Wall St.
May-15-19,BroadVision Announces First Quarter 2019 Results,GlobeNewswire
