date,title,source
Oct-17-18,"Q2 Holdings, Inc. Announces Investor Conference Call to Review Third Quarter 2018 Financial Results",Business Wire
Oct-23-18,"Report: Exploring Fundamental Drivers Behind Q2, Badger Meter, Tiffany, Walgreens Boots Alliance, Intrexon, and Denali Therapeutics  New Horizons, Emerging Trends, and Upcoming Developments",GlobeNewswire
Oct-25-18,3 Top Mid-Cap Stocks to Buy Immediately,Motley Fool
Nov-01-18,Q2 Holdings Named Best-in-Class and Awarded for Superior User Experience in Aite Group U.S. Cash Management Evaluation,Business Wire
Nov-05-18,"Q2 Holdings Named a Top Workplace in Austin for Eighth Consecutive Year, Earns No. 3 Ranking Among Large Employers",Business Wire
Nov-06-18,Q2 Holdings: 3Q Earnings Snapshot,Associated Press
Nov-06-18,"Q2 Holdings, Inc. Announces Third Quarter 2018 Financial Results",Business Wire
Nov-08-18,"After Another Strong Quarter, Q2 Holdings Looks Forward to Expanding Its Reach",Motley Fool
Nov-08-18,Edited Transcript of QTWO earnings conference call or presentation 7-Nov-18 1:30pm GMT,Thomson Reuters StreetEvents
Nov-13-18,Edited Transcript of QTWO earnings conference call or presentation 7-Nov-18 1:30pm GMT,Thomson Reuters StreetEvents
Nov-14-18,Q2 Holdings Integrates with DocuSign to Help Dispute Form Signatures Go Digital,Business Wire
Nov-30-18,Is Q2 Holdings Incs (NYSE:QTWO) CEO Overpaid Relative To Its Peers?,Simply Wall St.
Dec-03-18,Q2 Holdings Boosts Cross-Selling Capabilities and Accelerates Digital Onboarding with Acquisition of Gro Solutions,Business Wire
Dec-03-18,"New Research: Key Drivers of Growth for Q2, BioTime, Verastem, Fair Isaac, Ulta Beauty, and Chimerix  Factors of Influence, Major Initiatives and Sustained Production",GlobeNewswire
Dec-10-18,"M&A wrap: With revenue surging, NYSE-traded fintech company opens wallet for another buyout",American City Business Journals
Dec-11-18,"Q2 Holdings, Inc. to Host Investor Conference on Feb. 28, 2019, in New York City",Business Wire
Dec-28-18,3 Top Small-Cap Stocks to Buy Right Now,Motley Fool
Jan-02-19,Austin's top-performing stocks of 2018,American City Business Journals
Jan-16-19,"Q2 Holdings, Inc. Announces Investor Conference Call to Review Fourth Quarter and Full-Year 2018 Financial Results",Business Wire
Jan-23-19,KeyBanc Upgrades Q2 Holdings On Growing Total Addressable Market,Benzinga
Jan-25-19,WIT vs. QTWO: Which Stock Is the Better Value Option?,Zacks
Feb-05-19,"Recent Analysis Shows DICK'S Sporting Goods, Zix, Q2, InfraREIT, The Boston Beer, and Dicerna Pharmaceuticals Market Influences  Renewed Outlook, Key Drivers of Growth",GlobeNewswire
Feb-06-19,Analysts Estimate Q2 Holdings (QTWO) to Report a Decline in Earnings: What to Look Out for,Zacks
Feb-13-19,Q2 Holdings: 4Q Earnings Snapshot,Associated Press
Feb-13-19,"Q2 Holdings, Inc. Announces Fourth Quarter and Full-Year 2018 Financial Results",Business Wire
Feb-14-19,Q2 Holdings Inc (QTWO) Q4 2018 Earnings Conference Call Transcript,Motley Fool
Feb-14-19,WIT or QTWO: Which Is the Better Value Stock Right Now?,Zacks
Feb-15-19,"Jim Cramer Shares His Thoughts On Six Flags, Zynga And More",Benzinga
Feb-19-19,"Q2 Holdings, Inc. (NYSE:QTWO): Time For A Financial Health Check",Simply Wall St.
Feb-27-19,"Q2 Holdings, Inc. to Host Investor Conference on Feb. 28, 2019",Business Wire
Mar-12-19,Top Financial Stocks to Buy in 2019,Motley Fool
Mar-12-19,Facebook's Empty Promises and a Bad Week For Eventbrite and Okta,Motley Fool
Mar-22-19,IBD Stock Of The Day: Q2 Holdings Showing Accelerated Sales Growth,Investor's Business Daily
Apr-05-19,Top 10 Fintech Stocks to Buy Now,Motley Fool
Apr-05-19,Wall Street analysts said this week these stocks could be takeover candidates,CNBC
Apr-09-19,SNX vs. QTWO: Which Stock Is the Better Value Option?,Zacks
Apr-12-19,8 Stocks May Jump on Takeovers as Market Nears Peak,Investopedia
Apr-16-19,"Q2 Holdings, Inc. Announces Investor Conference Call to Review First Quarter 2019 Financial Results",Business Wire
