date,title,source
Oct-19-18,See the largest office leases signed in Houston so far this year,American City Business Journals
Oct-19-18,"What $1,000 in Stocks Invested 10 Years Ago Would Be Worth Today",GoBankingRates
Oct-19-18,"Report: Developing Opportunities within VICI Properties, Transocean, Akebia Therapeutics, Welltower, Golden Star Resources, and Casa  Future Expectations, Projections Moving into 2018",GlobeNewswire
Oct-19-18,"With major tenant departures, Greenway Plaza to transform into 24/7 hub",American City Business Journals
Oct-22-18,Transocean Inc. -- Moody's assigns B3 rating to Transocean's proposed $750 million unsecured notes,Moody's
Oct-22-18,Transocean Ltd. Announces Pricing of U.S. $750 Million of Senior Unsecured Notes Due 2025,GlobeNewswire
Oct-22-18,Transocean (RIG) Q3 Earnings Preview: What to Look Out For,Zacks
Oct-22-18,Transocean Ltd. Announces Offering of Notes,GlobeNewswire
Oct-22-18,Transocean Ltd. Provides Quarterly Fleet Status Report,GlobeNewswire
Oct-24-18,Will Rig Utilization Drive Transocean's (RIG) Q3 Earnings?,Zacks
Oct-29-18,"DryShips, Transocean, Clementia, and More: Heres Why These Stocks Are in the Spotlight",Insider Monkey
Oct-29-18,Transocean: 3Q Earnings Snapshot,Associated Press
Oct-29-18,Transocean Ltd. Reports Third Quarter 2018 Results,GlobeNewswire
