date,title,source
Oct-23-18,Beware of the Dead Cat Bounce: 5 Safe Stocks for Now,Zacks
Oct-24-18,Buy 5 Low-Beta Stocks to Counter Market Volatility,Zacks
Oct-31-18,DSW (DSW) Stock Sinks As Market Gains: What You Should Know,Zacks
Oct-31-18,"New Research: Key Drivers of Growth for Covanta Holding, Seattle Genetics, DSW, Canada Goose, Oaktree Capital Group, and Arthur J. Gallagher  Factors of Influence, Major Initiatives and Sustained Production",GlobeNewswire
Nov-06-18,DSW (DSW) Gains But Lags Market: What You Should Know,Zacks
Nov-06-18,DSW Inc. and Authentic Brands Group Complete Acquisition of Legendary Footwear and Accessories Organization Camuto Group,PR Newswire
Nov-13-18,DSW (DSW) Reports Next Week: Wall Street Expects Earnings Growth,Zacks
Nov-14-18,Will DSW Sustain Sturdy Comparable Sales Run in Q3 Earnings?,Zacks
Nov-15-18,DSW Inc. Announces Third Quarter 2018 Earnings Release Date,PR Newswire
