date,title,source
Oct-23-18,Albany International (AIN) Q3 Earnings Preview: What's in the Cards?,Zacks
Oct-30-18,Albany International: 3Q Earnings Snapshot,Associated Press
Oct-30-18,Albany International Reports Third-Quarter Results,Business Wire
Oct-31-18,Albany International Corp (AIN) Q3 2018 Earnings Conference Call Transcript,Motley Fool
Nov-05-18,"Research Report Identifies Plug Power, Continental Resources, Pinnacle West Capital, 3D, Albany International, and Genesee & Wyoming with Renewed Outlook  Fundamental Analysis, Calculating Forward Movement",GlobeNewswire
Nov-12-18,Edited Transcript of AIN earnings conference call or presentation 31-Oct-18 1:00pm GMT,Thomson Reuters StreetEvents
Nov-16-18,Edited Transcript of AIN earnings conference call or presentation 31-Oct-18 1:00pm GMT,Thomson Reuters StreetEvents
Nov-16-18,Did Albany International Corp (NYSE:AIN) Use Debt To Deliver Its ROE Of 12%?,Simply Wall St.
Dec-11-18,Albany International Sees Hammer Chart Pattern: Time to Buy?,Zacks
Dec-12-18,Albany International Announces New Senior Vice President of Global Customers and Marketing,Business Wire
Dec-14-18,Albany International Declares Dividend,Business Wire
Dec-25-18,Are Albany International Corp.s (NYSE:AIN) Interest Costs Too High?,Simply Wall St.
Dec-26-18,Albany International Enters Oversold Territory,Zacks
Jan-14-19,Albany International Announces Earnings Release Date,Business Wire
Jan-24-19,What You Must Know About Albany International Corp.s (NYSE:AIN) Financial Strength,Simply Wall St.
Feb-06-19,"Factors of Influence in 2019, Key Indicators and Opportunity within Booz Allen Hamilton Holding, Select Medical, Beazer Homes, Albany International, Lancaster Colony, and Heritage Insurance  New Research Emphasizes Economic Growth",GlobeNewswire
Feb-11-19,Albany International Reports Fourth-Quarter Results,Business Wire
Feb-12-19,Albany International: 4Q Earnings Snapshot,Associated Press
