date,title,source
Oct-18-18,Rowan Provides Fleet Status Report Update,PR Newswire
Oct-18-18,"Detailed Research: Economic Perspectives on Beacon Roofing Supply, Rowan Companies, CASI Pharmaceuticals, LivePerson, Impinj, and Tredegar  What Drives Growth in Today's Competitive Landscape",GlobeNewswire
Oct-22-18,Rowan Stavanger Awarded Contract by Equinor,PR Newswire
Oct-24-18,Rowan (RDC) Q3 Earnings Preview: Here's What to Look Out For,Zacks
Oct-29-18,Rowan Reliance Awarded Contract by Fieldwood,PR Newswire
Oct-30-18,SHAREHOLDER ALERT: Monteverde & Associates PC Announces An Investigation Of Rowan Companies plc. - RDC,PR Newswire
Oct-30-18,"Lifshitz & Miller LLP Announces Investigation of Alnylam Pharmaceuticals, Inc., Campbell Soup Company, Fanhua Inc., Hasbro, Inc., OPKO Health, Inc., Pretium Resources, Inc., Rowan Companies PLC and SodaStream International Ltd.",PR Newswire
Oct-30-18,Here's Why Investors Shouldn't Fret About This Oil Stock's Recent Quarter,Motley Fool
