date,title,source
Oct-18-18,Rowan Provides Fleet Status Report Update,PR Newswire
Oct-18-18,"Detailed Research: Economic Perspectives on Beacon Roofing Supply, Rowan Companies, CASI Pharmaceuticals, LivePerson, Impinj, and Tredegar  What Drives Growth in Today's Competitive Landscape",GlobeNewswire
Oct-22-18,Rowan Stavanger Awarded Contract by Equinor,PR Newswire
Oct-24-18,Rowan (RDC) Q3 Earnings Preview: Here's What to Look Out For,Zacks
Oct-29-18,Rowan Reliance Awarded Contract by Fieldwood,PR Newswire
Oct-30-18,SHAREHOLDER ALERT: Monteverde & Associates PC Announces An Investigation Of Rowan Companies plc. - RDC,PR Newswire
Oct-30-18,"Lifshitz & Miller LLP Announces Investigation of Alnylam Pharmaceuticals, Inc., Campbell Soup Company, Fanhua Inc., Hasbro, Inc., OPKO Health, Inc., Pretium Resources, Inc., Rowan Companies PLC and SodaStream International Ltd.",PR Newswire
Oct-30-18,Here's Why Investors Shouldn't Fret About This Oil Stock's Recent Quarter,Motley Fool
Oct-31-18,"ROWAN COMPANIES PLC SHAREHOLDER ALERT: Rigrodsky & Long, P.A. Announces Investigation of Merger",Business Wire
Oct-31-18,Rowan Companies PLC (RDC) Q3 2018 Earnings Conference Call Transcript,Motley Fool
Oct-31-18,Ken Fisher's Top 5 Buys of the 3rd Quarter,GuruFocus.com
Oct-31-18,"Rowan (RDC) Reports Q3 Loss, Tops Revenue Estimates",Zacks
Oct-31-18,Rowan Reports Third Quarter 2018 Results,PR Newswire
Nov-01-18,Edited Transcript of RDC earnings conference call or presentation 31-Oct-18 3:00pm GMT,Thomson Reuters StreetEvents
