date,title,source
Feb-20-19,Buy Walmart (WMT) Stock After Blowout Holiday Quarter Earnings?,Zacks
Feb-20-19,7 Healthy Dividend Stocks to Buy for Extra Stability,InvestorPlace
Feb-20-19,How to Trade Walmart Stock After Its Strong Earnings Report,InvestorPlace
Feb-20-19,Analysts Cheer Walmart's Big Quarter,Benzinga
Feb-20-19,"Costco Stock Will Benefit From Its Wealthy Clientele, Low Prices",InvestorPlace
Feb-21-19,Target (TGT) Dips More Than Broader Markets: What You Should Know,Zacks
Feb-21-19,"Target's newest wine line, The Collection, moves upmarket (just a bit)",American City Business Journals
Feb-22-19,Target broadens Art Class children's clothing line to pull in more parents,American City Business Journals
Feb-22-19,What Does Pro Bono Really Mean?,Investopedia
Feb-22-19,Wayfair Cant Relax on the Easy Chair of Sales Growth,Bloomberg
Feb-25-19,Buy Amazon (AMZN) Stock Down 20% From Highs?,Zacks
Feb-25-19,Target adding items from third-party sellers to e-commerce site,MarketWatch
Feb-25-19,Costco vs. Sam's Club: What's the Difference?,Investopedia
Feb-25-19,Target launches invite-only third-party seller initiative for its website,American City Business Journals
Feb-25-19,Victoria's Secret Should Be Terrified of Target,Motley Fool
Feb-25-19,Target's latest in-store brands: A trio of intimate labels,American City Business Journals
Feb-25-19,Target launching three new labels in women's underwear and pajamas,MarketWatch
Feb-25-19,Embattled Victoria's Secret's latest competitor: Target,CNBC
Feb-25-19,Target debuts three lingerie and sleepwear lines,American City Business Journals
Feb-25-19,Target is inviting retailers to its website  taking a different approach than Walmart and Amazon to grow online,CNBC
Feb-26-19,Costco vs. Sam's Club: What's the Difference?,Investopedia
Feb-26-19,Big-name investors join $55M ThirdLove round,American City Business Journals
Feb-26-19,"Dillard's Rockets Higher Midday, but Retail Mixed Amid Home Depot Disappointment",Investing.com
Feb-26-19,Quarterly Report Will Continue the Recovery of Best Buy Stock,InvestorPlace
Feb-27-19,It Worked at Target. Maybe It'll Work at Macy's.,Bloomberg
Feb-27-19,Here's Why Target's (TGT) Q4 Earnings are Likely to Rise Y/Y,Zacks
Feb-28-19,Dynamic Pricing at Target Causes Concern,Motley Fool
Feb-28-19,The Vineyard Vines-Target Collection: What We Know,InvestorPlace
Feb-28-19,Target teams with preppy fashion label Vineyard Vines,American City Business Journals
Feb-28-19,Walmart Stock Looks Better and Better from Every Angle,InvestorPlace
Feb-28-19,Target partners with Vineyard Vines for limited-edition collection,MarketWatch
Feb-28-19,"Target goes preppy, again, in teaming up with Vineyard Vines",CNBC
Feb-28-19,Target and vineyard vines Announce Limited-Edition Collaboration,PR Newswire
Feb-28-19,TJX Ends the Year With Another Stellar Sales Performance,Motley Fool
Mar-01-19,Your Game Plan: Cramer's 'Mad Money' Recap (Friday 3/1/19),TheStreet.com
Mar-01-19,How Short Sellers Lost $7.6 Billion On 12 Bad Retail Bets,Investopedia
Mar-01-19,What to Expect from Costco (COST) Earnings as E-Commerce Expands,Zacks
Mar-01-19,Millionaires in America 2019: All 50 States Ranked,Kiplinger
Mar-01-19,What to Expect from Target's (TGT) Q4 Earnings Tuesday,Zacks
Mar-01-19,Carter's sales growth impacted by retail bankruptcies,MarketWatch
Mar-04-19,What to Expect from Kroger (KR) Earnings as Amazon Expands Grocery Business,Zacks
Mar-04-19,Target Analysts Brace for New Margin Pain While Awaiting Its End,Bloomberg
Mar-04-19,A Preview Of Target's Q4 Earnings,Benzinga
Mar-04-19,Target Needs an Earnings Beat to Make It Buyable,TheStreet.com
Mar-04-19,Day Ahead: Top 3 Things to Watch,Investing.com
Mar-04-19,What Target Earnings Could Mean for Its Stock,Barrons.com
Mar-04-19,"How Amazon, eBay Can Post Huge Profits In The Cannabis Supplement Market",Investopedia
Mar-04-19,Target Stuck in Neutral Ahead of Earnings,Investopedia
Mar-04-19,"Retailers In Focus As New Week Starts, With Target, Costco, And Kohl's Soon To Report",Benzinga
Mar-04-19,Kroger Losing Ground After Amazon Grocery Initiative,Investopedia
Mar-04-19,3 Dividend Stocks That Should Pay You for the Rest of Your Life,Motley Fool
Mar-04-19,Target Corporation to Webcast Presentation to Investors on March 5,PR Newswire
Mar-05-19,[$$] Target and Kohls Gain as Rivals Shrink,The Wall Street Journal
Mar-05-19,Target and Papa John's rise while Hertz stumbles,Associated Press
Mar-05-19,"The Bulls Still Have the Ball, but the Bears Are Looking to Steal It",TheStreet.com
Mar-05-19,Stock Market Today: Strong Earnings Boost Retailers,Motley Fool
Mar-05-19,[$$] Target and Kohl's Gain as Rivals Shrink,The Wall Street Journal
Mar-05-19,Amazon Bolsters Retail Focus with New Grocery Store Plans,Zacks
Mar-05-19,Why Target Stock Jumped Today,Motley Fool
Mar-05-19,Target hits on all cylinders in the fourth quarter,Associated Press
Mar-05-19,"GLOBAL MARKETS-Stocks slip, dollar gains as China cuts growth target",Reuters
Mar-05-19,Target's ship-to-store strategy succeeds where Amazon can't,American City Business Journals
Mar-05-19,"Target, Kohl's Earnings Guidance Send Retail Giants Soaring",Investor's Business Daily
Mar-05-19,Stocks finish mostly unchanged in topsy-turvy trading session,MarketWatch
Mar-05-19,Target's 4th-Quarter Financials: What You Need to Know,GuruFocus.com
Mar-05-19,Target Corp (TGT) Q4 2018 Earnings Conference Call Transcript,Motley Fool
Mar-05-19,"Target is the standout right now, says retail industry pro",CNBC Videos
Mar-05-19,Target Stock Breaks Out to Key Resistance,Investopedia
Mar-05-19,2 Large Retailers Issue Results for the 4th Quarter,GuruFocus.com
Mar-05-19,I Like Target Stock at Current Prices,TheStreet.com
Mar-05-19,Target Beats Q4 Earnings and Same-Store Sales Estimates,TheStreet.com
Mar-05-19,ETF Spotlight: Target's strong earnings boost retail sector,CNBC Videos
Mar-05-19,Solid Holiday Sales Send Target Shares Higher,GuruFocus.com
Mar-05-19,Target Silences the Doubters,Bloomberg
Mar-05-19,"Holiday sales boost Target forecasts, shares jump",Reuters
Mar-05-19,Stock Market News: Target Hits the Mark; Salesforce Sinks,Motley Fool
Mar-05-19,"Target, Kohl's Surprise on FY Guidance; Plus GOLD, NEM",Zacks
Mar-05-19,Jan Kniffen on who's winning and losing in the retail sector,CNBC Videos
Mar-05-19,[$$] Target Hits the Bull's Eye,The Wall Street Journal
Mar-05-19,Target CEO sounds less exuberant about US consumer now compared to last year,CNBC
Mar-05-19,TREASURIES-Yields up on strong economic data and retail earnings,Reuters
Mar-05-19,Takeovers &amp; Earnings To Watch Out For,Zacks
Mar-05-19,Target Stock Soars on Blowout Earnings Report,Barrons.com
Mar-05-19,"Target, Kohl's Surprise on FY Guidance; Plus GOLD, NEM",Zacks
Mar-05-19,Exchange Traded Funds: How To Find The Best ETFs,Investor's Business Daily
Mar-05-19,"[$$] Stocks to Watch: Target, Kohl's, Ciena, GameStop",The Wall Street Journal
Mar-05-19,"Target's (TGT) Q4 Earnings Meet Estimates, '19 View Upbeat",Zacks
Mar-05-19,UBS retail analyst breaks down Target and Kohl's earnings,CNBC Videos
Mar-05-19,"Target, GameStop Rise, and 3 More Tuesday Morning Movers",Barrons.com
Mar-05-19,Target finished 2018 strong as digital gives chain 'best in a decade' boost to sales,American City Business Journals
Mar-05-19,"Holiday sales boost Target forecasts, shares jump",Reuters
Mar-05-19,"Target CEO explains Q4 earnings results, Q1 outlook",CNBC Videos
Mar-05-19,[$$] FirstFT: Todays top stories,Financial Times
Mar-05-19,"Stocks making the biggest moves premarket: Target, Kohl's, Papa John's & more",CNBC
Mar-05-19,Here's how Kohl's earnings compare to Target,CNBC Videos
Mar-05-19,Target earnings beat expectations. Here's what investors need to know,CNBC Videos
Mar-05-19,"Target's stock surges after earnings and sales beat expectations, amid traffic and digital strength",MarketWatch
Mar-05-19,Target holiday quarter comparable sales beat estimates,Reuters
Mar-05-19,Target shares surge as company beats Wall Street estimates,CNBC
Mar-05-19,Target Reports Fourth Quarter and Full-Year 2018 Earnings,PR Newswire
Mar-05-19,Top 5 Things to Know in The Market on Tuesday,Investing.com
Mar-06-19,Target's Stores &quot;Saved&quot; Its Digital Business $3 Billion,Motley Fool
Mar-06-19,Costco (COST) Q2 Earnings Preview,Zacks
Mar-06-19,Why Target Reported Its Best Sales Year in More Than a Decade,GOBankingRates
Mar-06-19,"The Street Reacts To Target's Q4 Earnings, Analyst Day",Benzinga
Mar-06-19,"3 Blue-Chip Stocks to Buy Right Now: WMT, FB &amp; NKE",Zacks
Mar-06-19,Will American Eagle Stock Pop After Earnings?,InvestorPlace
Mar-06-19,Target Stock vs Amazon Stock: Which Is the Better Buy?,InvestorPlace
Mar-06-19,Edited Transcript of TGT earnings conference call or presentation 5-Mar-19 2:00pm GMT,Thomson Reuters StreetEvents
Mar-06-19,3 Retail Stocks That Are Sure Winners,InvestorPlace
Mar-06-19,What We Think Of Target Corporations (NYSE:TGT) Investment Potential,Simply Wall St.
Mar-06-19,"General Electric Takes A Hit, Retailers Outperform Amid Broader Market Pause",Benzinga
Mar-06-19,"Company News For Mar 6, 2019",Zacks
Mar-06-19,"TGT Jumped Above $75, But There is Still Some Overhead Resistance",InvestorPlace
Mar-07-19,Target and Kohl's Adoption Strategy Bears Fruit,GuruFocus.com
Mar-07-19,DC unveils plans for Batmans 80th anniversary,American City Business Journals
Mar-07-19,How Target and Salesforce Crushed Expectations,Motley Fool
Mar-07-19,The Best News From Target's Holiday Earnings Report,Motley Fool
Mar-08-19,What Target Management Wants You to Know,Motley Fool
Mar-08-19,"Made in Dayton, eco-friendly thermometers to hit Target shelves nationwide",American City Business Journals
Mar-08-19,"Top Research Reports for Microsoft, Mastercard & General Electric",Zacks
Mar-08-19,Ross Stores Guidance Raises Fundamental Questions,InvestorPlace
Mar-08-19,3 Earnings Reports to Watch Next Week,InvestorPlace
Mar-08-19,"The Zacks Analyst Blog Highlights: Amazon, Kohl???s, Walmart and Target",Zacks
Mar-08-19,PriceSmart February Comps Face Currency Fluctuation Headwind,Zacks
Mar-08-19,Is Target (TGT) Stock Undervalued Right Now?,Zacks
Mar-08-19,"Costco's (COST) Q2 Earnings Surpass Estimates, Rise Y/Y",Zacks
Mar-08-19,Takeaways From Target's Top-Notch Q4 Report,Motley Fool
Mar-08-19,[$$] Fit Hacks: volunteering at a race,Financial Times
Mar-08-19,Bear of the Day: The Children's Place (PLCE),Zacks
Mar-11-19,Costco vs. Sam's Club: What's the Difference?,Investopedia
Mar-11-19,Better Buy: Home Depot vs. Target,Motley Fool
Mar-11-19,15 Growth Stocks to Buy Under 15x Earnings,InvestorPlace
Mar-11-19,"Shipt taps Target exec, retail veteran as new CEO",American City Business Journals
Mar-11-19,"Big Lots (BIG) Q4 Earnings Beat Estimates, Rise Y/Y, Stock Up",Zacks
Mar-11-19,What are Target and Best Buy doing right? Depends who's asking,American City Business Journals
Mar-11-19,"The Zacks Analyst Blog Highlights: Microsoft, Mastercard, General Electric, Target and Brown-Forman",Zacks
Mar-11-19,Costco's Decent Comparable Sales Run Continues in February,Zacks
Mar-11-19,Costco (COST) Looks Good: Stock Adds 5.1% in Session,Zacks
Mar-12-19,Costco vs. Sam's Club: What's the Difference?,Investopedia
Mar-12-19,7 Retail Stocks Winning in 2019 and Beyond,InvestorPlace
Mar-12-19,Has Target (TGT) Outpaced Other Retail-Wholesale Stocks This Year?,Zacks
Mar-12-19,"Ross Stores (ROST) Opens 28 Outlets for Q1, '19 Plan on Track",Zacks
Mar-12-19,5 Retailers Benefiting From the Click-and-Collect Trend,Zacks
Mar-13-19,Buy Amazon (AMZN) Stock on Earnings Growth &amp; E-commerce Dominance?,Zacks
Mar-13-19,"Mossimo, designer behind longtime Target label, charged in college admissions scam",American City Business Journals
Mar-13-19,Target Continues to Hit the Bullseye,InvestorPlace
Mar-13-19,Walmart Stock Still Doesnt Look Quite Cheap Enough,InvestorPlace
Mar-13-19,Amazon's (AMZN) E-commerce Lead Threatened By New Entrants,Zacks
Mar-13-19,"Investors Should Shop A Retail Pop-and-Drop With Wayfair, Target Stock",InvestorPlace
Mar-14-19,"Dollar General (DG) Stock Down on Q4 Earnings Miss, Soft View",Zacks
Mar-14-19,Retail Tech's Upcoming Revolution,Motley Fool
Mar-14-19,Kroger Concludes Sale of You Technology for $565 Million,Zacks
Mar-14-19,"EBay Is the Un-Amazon, for Better and Worse",Bloomberg
Mar-14-19,Target Corporation Declares Regular Quarterly Dividend,PR Newswire
Mar-15-19,What to Expect from FedEx's (FDX) Q3 Earnings,Zacks
Mar-15-19,Kroger to Bring Unmanned Delivery Service to Houston Via Nuro,Zacks
Mar-15-19,Try Your Luck Out With These Stocks on St. Patrick's Day,Zacks
Mar-15-19,Target's 'clean' symbol identifies products without harmful chemicals,American City Business Journals
Mar-18-19,TREASURIES-Yields tick up in muted trading ahead of Fed meeting,Reuters
Mar-18-19,Target takes over shopping center previously occupied by Toys 'R' Us,American City Business Journals
Mar-18-19,TJX Companies Gains 19% in 3 Months: Will Momentum Sustain?,Zacks
Mar-18-19,Top Ranked Income Stocks to Buy for March 18th,Zacks
Mar-19-19,Top Ranked Income Stocks to Buy for March 19th,Zacks
Mar-19-19,74% of consumers go to Amazon when they're ready to buy something. That should be keeping retailers up at night,CNBC
Mar-19-19,Here Are 3 Factors Shaping Ross Stores' (ROST) Upside Story,Zacks
Mar-19-19,Should Xtrackers Russell 1000 Comprehensive Factor ETF (DEUS) Be on Your Investing Radar?,Zacks
Mar-19-19,New Week Kicks Off with New Gains,Zacks
Mar-19-19,Buy Target Stock to Ride the Coming Untapped Growth Wave,InvestorPlace
Mar-20-19,Will Private Labels Wake Up Amazon Stock?,InvestorPlace
Mar-20-19,Target's Archer Farms coffee to be fair trade by 2022,Reuters
Mar-20-19,Kroger (KR) to Divest Turkey Hill &amp; Focus on Core Operations,Zacks
Mar-20-19,Target tests self-service grab-and-go 'Snack Bar' in stores,American City Business Journals
Mar-20-19,Kidfluencers' Rampant YouTube Marketing Creates Minefield for Google,Bloomberg
Mar-21-19,Why Lululemon (LULU) Stock Looks Like a Buy Heading into Q4 Earnings,Zacks
Mar-21-19,7 Retail Stocks That Will Continue to Rebound in 2019,InvestorPlace
Mar-21-19,"Target Stock and Other Retailers Should Gain Because Theres Pent-up Demand, Analyst Says",Barrons.com
Mar-21-19,Target Stock Is Worth a Buy on Every Dip,InvestorPlace
Mar-21-19,Simple Math Says You Should Buy the Dip in Kroger Stock,InvestorPlace
Mar-21-19,Amazon's Getting Schooled in the Private-Label Game,Motley Fool
Mar-22-19,3 Blue-Chip Stocks to Buy Right Now,Zacks
Mar-22-19,Amazon Unveils Belei to Boost Private Label Initiatives,Zacks
Mar-25-19,"More space, more locations: How one fitness tenant is defying the typical S.F. retail narrative",American City Business Journals
Mar-25-19,7 Consumer Discretionary Stocks to Buy Now,InvestorPlace
Mar-25-19,Why Target (TGT) is a Top Dividend Stock for Your Portfolio,Zacks
Mar-25-19,Is Target (TGT) a Great Value Stock Right Now?,Zacks
Mar-25-19,Costco vs. Sam's Club: What's the Difference?,Investopedia
