date,title,source
Nov-26-18,How Much is Target Corporations (NYSE:TGT) CEO Getting Paid?,Simply Wall St.
Nov-26-18,Black Friday Online Sales Hit Record: E-Commerce Romping Ahead,Zacks
Nov-27-18,Amazon Cyber Monday Sales Highlight its Expanding Advertising Business,Zacks
Nov-27-18,"Ahead of the Holiday Season, The Selloff in TGT Stock Is Overdone",InvestorPlace
Nov-27-18,Stanley Black & Decker commits to making all plastic packaging reusable by 2025,American City Business Journals
Nov-27-18,"Stock Market News For Nov 27, 2018",Zacks
Nov-27-18,"E-Trade, Jack in the Box, Amazon, Target and Best Buy highlighted as Zacks Bull and Bear of the Day",Zacks
Nov-27-18,Cyber Monday Gives E-Commerce ETF A Modest Boost,Benzinga
Nov-27-18,Costco's (COST) Comparable Sales Run Looks Compelling,Zacks
Nov-27-18,"Cyber Monday sales break a record, with $7.9 billion spent online, Adobe Analytics says",CNBC
Nov-27-18,Holiday Shopping Season Off to a Smashing Start: 5 Winners,Zacks
Nov-27-18,Dental care startup Quip secures $40 million in funding,American City Business Journals
Nov-27-18,Can Traditional Retailers Battle Online Competition? 5 Picks,Zacks
Nov-28-18,Target (TGT) Gains But Lags Market: What You Should Know,Zacks
Nov-28-18,5 Stocks to Buy for December,InvestorPlace
Nov-29-18,"MarketPulse: Dollar Tree, Abercrombie Buck Bearish Day for Retailers",Investing.com
Nov-29-18,Buy Discount Retail Stocks After Dollar Tree's (DLTR) Strong Q3 Earnings?,Zacks
Nov-29-18,10 Stocks to Buy for a Rate Hike Slowdown,InvestorPlace
Nov-29-18,"Buy Walmart, Target as online sales growth starts to outpace Amazon's: Bank of America",CNBC
Nov-30-18,3 Top Dividend Stocks With Yields Over 3%,Motley Fool
Nov-30-18,Weak Black Friday Trends Affirm That JCP Stock Is a Sell,InvestorPlace
Nov-30-18,Today's Research Reports on Trending Tickers: Dollar Tree and Target,ACCESSWIRE
Dec-03-18,Should You Buy Kroger (KR) Stock Before Q3 Earnings?,Zacks
Dec-03-18,"Walmart, Target among the retail winners from the tariff truce: Wells Fargo",MarketWatch
Dec-03-18,"Walmart, Target Benefiting From G-20 Talks, TJX, Ross Not So Much",TheStreet.com
Dec-03-18,10 Stocks to Buy With The Trade War on Pause,InvestorPlace
Dec-03-18,"Target replaces startup accelerator program, partners with German retailer",American City Business Journals
Dec-03-18,Amazon to Expand Cashierless Technology to Bigger Stores,Zacks
Dec-03-18,Amazon Performance Another Warning Sign For Retailers,InvestorPlace
Dec-03-18,"Report: Exploring Fundamental Drivers Behind Target, The Gap, Alliance Data, Foot Locker, The Travelers Companies, and Hecla Mining  New Horizons, Emerging Trends, and Upcoming Developments",GlobeNewswire
Dec-04-18,"Walmart, Target among the retail winners from the tariff truce: Wells Fargo",MarketWatch
Dec-04-18,The Tortoise Can Beat the Hare,GuruFocus.com
Dec-04-18,Here's What to Expect from Ulta Beauty's (ULTA) Q3 Earnings,Zacks
Dec-04-18,Buy Walgreens (WBA) Stock on Expanded Kroger (KR) Partnership?,Zacks
Dec-04-18,Amazon bumps holiday ad spending as other retailers cut back,American City Business Journals
Dec-06-18,Target (TGT) Gains As Market Dips: What You Should Know,Zacks
Dec-06-18,"Buy Costco (COST) Stock Before Earnings, After Kroger's Beat?",Zacks
Dec-06-18,Target's augmented reality feature lets you see a Christmas tree in your living room before you buy,American City Business Journals
Dec-06-18,One of Target's downtown Minneapolis HQ offices is sold for $171 million,American City Business Journals
Dec-06-18,Why Target Stock Dropped 15% in November,Motley Fool
Dec-06-18,"[$$] For Walmart and Target, the Fed Holds the Keys to Faster Payments",The Wall Street Journal
Dec-07-18,"Walmart Stock Faces Pressure, But Its Premature to Panic",InvestorPlace
Dec-07-18,Retailers plan for 2019 amid uncertainty in the market,CNBC Videos
Dec-07-18,"ALSAC, USA: CEO Shadyac on how to save lives with data-driven CSR",American City Business Journals
Dec-10-18,2 Retail Stocks for Your Christmas List,Motley Fool
Dec-10-18,Target spent more than $1.2 billion sprucing up stores in 2018; here's one of its new-look locations (gallery),American City Business Journals
Dec-10-18,What's Next for Lululemon (LULU) Stock?,Zacks
Dec-10-18,Is Target's Post-Earnings Plunge Justified?,Motley Fool
Dec-10-18,JCPenney Stock Is a Bet on a Turnaround That Isnt Coming,InvestorPlace
Dec-10-18,Target Stock Doesnt Reflect the Companys Strong Results,InvestorPlace
Dec-10-18,"Without Toys R Us, one iconic, international toy chain could soon make its mark in the US",CNBC
Dec-10-18,Costco (COST) Continues With Solid Comparable Sales Momentum,Zacks
Dec-11-18,Target Christmas Eve Hours 2018  The Store Will Be Open Until Late,InvestorPlace
Dec-11-18,Target to pay $3M to resolve Massachusetts Medicaid claim,Associated Press
Dec-11-18,Target to pay $3M to resolve Massachusetts Medicaid claim,Associated Press
Dec-11-18,12 Best Things to Buy at Dollar Stores for the Holidays,Kiplinger
Dec-11-18,It's getting easier for shoppers to skip the line by buying online and picking up in store,CNBC
Dec-11-18,Amazon Boosts Private Label Initiatives With Own Brand Toys,Zacks
Dec-11-18,Costco Stock May Be the Markets Top Recession Pick,InvestorPlace
Dec-12-18,Target (TGT) Outpaces Stock Market Gains: What You Should Know,Zacks
Dec-12-18,"For retailers, the smartphone is future of store experience",Associated Press
Dec-12-18,"Believe It or Not, Blue Apron Stock Can Still Cook Up Something Good",InvestorPlace
Dec-12-18,'We're kids in a candy store'  money managers use the wild stock market swings to find value,CNBC
Dec-12-18,Gap's Old Navy Teams Up With Lyft to Ease Peak Holiday Rush,Zacks
Dec-12-18,Who Will Fill the Void Created by Toys &quot;R&quot; Us This Christmas?,Zacks
Dec-12-18,Target will pay $3M to settle auto-refill prescription complaint,American City Business Journals
Dec-12-18,Today's Research Reports on Trending Tickers: Target and Urban Outfitters,ACCESSWIRE
Dec-12-18,"Changing consumer patterns feed into market volatility, s...",CNBC Videos
Dec-13-18,"New York sues Target, Walmart over lead-contaminated toys",Reuters
Dec-13-18,"New York sues Target, Walmart over lead-contaminated toys",Reuters
Dec-13-18,"New York sues Target, Walmart for sale of lead-contaminated toys",Reuters
Dec-13-18,"With OK from Congress, US hemp market set to boom",Associated Press
Dec-13-18,Buy Amazon (AMZN) Stock on the Dip Heading into 2019?,Zacks
Dec-13-18,"New York sues Target, Walmart for sale of lead-contaminated toys",Reuters
Dec-13-18,"With OK from Congress, US hemp market set to boom",Associated Press
Dec-13-18,"New York AG sues Target, Walmart and LaRose Industries for selling lead-contaminated children's toys",CNBC
Dec-13-18,3 Reasons Why Target Stock Looks Compelling on This Dip,InvestorPlace
Dec-13-18,Is Target (TGT) a Suitable Stock for Value Investors Now?,Zacks
Dec-13-18,Costco Stock Continues To Justify Its Lofty Multiple Ahead Of Todays Earnings,InvestorPlace
Dec-14-18,"Target acquired delivery service Shipt a year ago  here's how the service grew in 2018, and what's next",American City Business Journals
Dec-14-18,"Opus buys former Target West campus, lands Tactile Medical HQ as top tenant",American City Business Journals
Dec-14-18,Bulls charge into Visa & Target,CNBC Videos
Dec-14-18,"New York Sues Target, Walmart Over Lead in Kids Toys",InvestorPlace
Dec-17-18,"Final Trades: BA, TGT & more",CNBC Videos
Dec-17-18,Munster: Amazon Buying Target Still Makes Sense,Benzinga
Dec-17-18,Here's Why J. C. Penney is Down More Than 50% in 6 Months,Zacks
Dec-17-18,Target Saves the Day for Last-Minute Shoppers with More Easy Ways to Buy and Deliver Gifts - No Reindeer Required,PR Newswire
Dec-18-18,Target leases large distribution warehouse in Hawaii,American City Business Journals
Dec-18-18,Target (TGT) Outpaces Stock Market Gains: What You Should Know,Zacks
Dec-18-18,Rejoice procrastinators! There are still ways to buy those last-minute gifts online,CNBC
Dec-18-18,Why Amazon Stock Could Be Hurt by a Lack of Focus,InvestorPlace
Dec-19-18,"This year, more returns expected before the gifts are opened",Associated Press
Dec-19-18,3 Top Large-Cap Stocks to Buy in December,Motley Fool
Dec-19-18,"This year, more returns expected before the gifts are opened",Associated Press
Dec-19-18,Here's why the 'retail apocalypse' won't happen,CNBC
Dec-19-18,Kmart was once rescued from bankruptcy by Eddie Lampert. Now it needs an encore.,CNBC
Dec-19-18,"Barring an Abysmal 2019, Target Stock Looks Woefully Undervalued Here",InvestorPlace
Dec-19-18,Target Stock Just Broke Vital Support. Now What?,InvestorPlace
Dec-20-18,Why You Should Still Short Amazon Stock,InvestorPlace
Dec-20-18,This Missed Opportunity Shouldnt Hurt Walmart Stock Too Much,InvestorPlace
Dec-20-18,Better Buy: Costco vs. Target,Motley Fool
Dec-20-18,Nearly a quarter of Amazon's 'hot toys' were out of stock in December,MarketWatch
Dec-20-18,Target (TGT) Down 9.3% Since Last Earnings Report: Can It Rebound?,Zacks
Dec-20-18,Trump tariff war with China sends U.S. retailers on buying binge,Reuters
Dec-20-18,Trump tariff war with China sends U.S. retailers on buying binge,Reuters
Dec-20-18,Trump tariff war with China sends U.S. retailers on buying binge,Reuters
Dec-21-18,[$$] Shoppers Find Out How Much They Miss Toys R Us,The Wall Street Journal
Dec-21-18,Toys R Us closure hits Toys for Tots hard,Associated Press
Dec-21-18,Super Saturday the Biggest Shopping Day of 2018? 4 ETF Deals,Zacks
Dec-21-18,[$$] Shoppers Find Out How Much They Miss Toys 'R' Us,The Wall Street Journal
Dec-21-18,There's never been this kind of surge in last-minute shoppers picking up online orders,CNBC
Dec-21-18,"Expect a strong close for retail season, industry veteran...",CNBC Videos
Dec-24-18,Target (TGT) Gains As Market Dips: What You Should Know,Zacks
Dec-24-18,"Vans sues Target, alleging the retailer copied its sneaker design",American City Business Journals
Dec-24-18,3 Reasons Nearly Everyone Renews Their Costco Membership,Motley Fool
Dec-24-18,Walmart and Target Face Christmas Eve in Bear Market Territory,TheStreet.com
Dec-26-18,Amazon Posts Record-Breaking Holiday Sales: Time to Buy AMZN Stock?,Zacks
Dec-26-18,"Consumer spending is 'on fire' despite lagging markets, s...",CNBC Videos
Dec-26-18,3 Reasons to Stay Away From JCPenney Stock,InvestorPlace
Dec-26-18,The department store genre is dead: Retail expert,CNBC Videos
Dec-26-18,Amazon (AMZN) to See Higher Online Sales This Holiday Season,Zacks
Dec-26-18,"Bold 2019 Predictions For Amazon, Apple, Snap, Tesla In Acquisitions",Investor's Business Daily
Dec-26-18,Bear of the Day: Six Flags (SIX),Zacks
Dec-26-18,How to Play Walmart and Target Stock Following Christmas,TheStreet.com
Dec-26-18,"Stocks - Amazon, Target, Walmart, Intel, Jd.Com Rise in Premarket",Investing.com
Dec-27-18,2018 retail recap: Target battles Amazon; Best Buy courts seniors; Chains file Chapter 11,American City Business Journals
Dec-27-18,Marshalls at Mondawmin Mall to close,American City Business Journals
Dec-27-18,4 Top Stocks That Are Attractive Bargains for 2019,Zacks
Dec-27-18,Was This the Best or Worst Retail Holiday Season in Years?,Motley Fool
Dec-28-18,Target Stock Is a Top Retail Name for 2019,InvestorPlace
Dec-28-18,5 Consumer Defensive Stocks That Beat the Market in 2018,GuruFocus.com
Dec-28-18,2019 Playbook: Marijuana,CNBC Videos
Dec-28-18,Top 10 Stock Market Predictions for 2019,InvestorPlace
Dec-28-18,"Margin Pressures Could Hold Back Costco Stock, but Not for Long",InvestorPlace
Dec-31-18,Target (TGT) Outpaces Stock Market Gains: What You Should Know,Zacks
Dec-31-18,3 Top Retail Stocks to Buy Right Now,Motley Fool
Dec-31-18,Buy Amazon Stock Because Its Retail Business Only Is Getting Stronger,InvestorPlace
Dec-31-18,Amazon to Expand Grocery Retail With More Whole Foods Stores,Zacks
Jan-02-19,Why Target Stock Could Soar in 2019,Motley Fool
Jan-02-19,Self-storage facility eyed for former Target store,American City Business Journals
Jan-02-19,Whole Foods plans expansion,American City Business Journals
Jan-03-19,Why Target Stock Could Go Nowhere in 2019,Motley Fool
Jan-04-19,The Inventor of the Apple Store on Retail Revolutions,Barrons.com
Jan-04-19,Kroger Stock Could Be the Big Underdog Retail Play in 2019,InvestorPlace
Jan-04-19,Target Corporations (NYSE:TGT) Most Important Factor To Consider,Simply Wall St.
Jan-04-19,How to Profit Even If Target Stock Continues to Get No Respect,InvestorPlace
Jan-07-19,Why These 3 Retail Stocks Rallied Today,Motley Fool
Jan-07-19,Investing in Retail Stocks? Look for These Things,Motley Fool
Jan-07-19,Shipt inks huge lease downtown; skyscraper will become Shipt Tower in 2020,American City Business Journals
Jan-07-19,Top Picks 2019- Target TGT,MoneyShow
Jan-09-19,Target (TGT) Outpaces Stock Market Gains: What You Should Know,Zacks
Jan-09-19,"Najarian Brothers See Unusual Options Activity In Bunge, Schlumberger And More",Benzinga
Jan-09-19,Traders say this energy name is heading higher.,CNBC Videos
Jan-10-19,[$$] New Target CFO Will Have to Sustain Retailers Turnaround Pace,The Wall Street Journal
Jan-10-19,Strong economy does little to lift department store sales,Associated Press
Jan-10-19,"Macy's cuts profit, sales forecast after weak holiday season",Reuters
Jan-10-19,Industrials lead US stocks higher again; Macy's nosedives,Associated Press
Jan-10-19,Macy's Holiday Troubles Are Giving Retail Investors 2019 Jitters,Bloomberg
Jan-10-19,[$$] New Target CFO Will Have to Sustain Retailer's Turnaround Pace,The Wall Street Journal
Jan-10-19,Here's Why Amazon (AMZN) Stock Looks Like A Strong Buy Right Now,Zacks
Jan-10-19,"Department stores are 'fighting for their lives,' says ex-Target exec Gerald Storch",CNBC
Jan-10-19,3 Things to Know at the Market Close: The Retail Rundown and More,TheStreet.com
Jan-10-19,Kohl's Tumbles After Reporting Weaker Holiday Sales Growth,TheStreet.com
Jan-10-19,"Target Posts Solid Holiday Sales, Maintains 2018 Earnings Forecast",TheStreet.com
Jan-10-19,Dow Ends in the Green After Falling Triple Digits in Earlier Trading,TheStreet.com
Jan-10-19,From Macy's to Kohl's to L Brands: Retailers Get Hammered,TheStreet.com
Jan-10-19,Stocks edge higher as industrials climb; Macy's nosedives,Associated Press
Jan-10-19,"Department stores fight for life in Amazon era, says form...",CNBC Videos
Jan-10-19,Target will be one of the top holiday performers: Moodys,MarketWatch
Jan-10-19,Why Retail Stocks Sold Off Today,Motley Fool
Jan-10-19,"Retail sales numbers  strong, consumer in good shape: Pro...",CNBC Videos
Jan-10-19,Buy Target (TGT) Stock After Strong Holiday Sales Despite Macy's Sell-off?,Zacks
Jan-10-19,"Macy's cuts profit, sales forecast after weak holiday season",Reuters
Jan-10-19,"US STOCKS-Wall St heads for lower open as trade talks, retailers disappoint",Reuters
Jan-10-19,Target announces six changes to its executive team,American City Business Journals
Jan-10-19,Do Costco's December Comps Indicate a Solid Run in 2019?,Zacks
Jan-10-19,"Market is overreacting to Macy's sales, says former Walma...",CNBC Videos
Jan-10-19,"WRAPUP 1-Macy's shares sink after it trims holiday sales forecast, drags down peers",Reuters
Jan-10-19,"Margin flow-through will be main retail concern in 2019, ...",CNBC Videos
Jan-10-19,"Macy's, Kohl's Lead Shift From Retail Boom to Post-Holiday Gloom",Bloomberg
Jan-10-19,Target says holiday sales were strong; CFO Cathy Smith to retire,American City Business Journals
Jan-10-19,"Target posts strong holiday sales, maintains outlook",Reuters
Jan-10-19,3 Dividend Stocks That Pay You Better Than Coca-Cola Does,Motley Fool
Jan-10-19,Target Corporation Declares Regular Quarterly Dividend,PR Newswire
Jan-10-19,"Target's stock climbs after holiday-period sales growth accelerates, CFO to retire",MarketWatch
Jan-10-19,Target's comparable store sales soar 6% during holiday se...,CNBC Videos
Jan-10-19,"[$$] Target Sales Surged at Year-End, Capping Strong Holiday Season",The Wall Street Journal
Jan-10-19,"Target Reports November/December Sales, Maintains Full-Year Sales and EPS Guidance",PR Newswire
Jan-10-19,"Target reports holiday same-store sales growth of 5.7%, maintains 2018 outlook",CNBC
Jan-11-19,Target will be one of the top holiday performers: Moodys,MarketWatch
Jan-11-19,Buy the Big Dip Below $30 in Macys Stock,InvestorPlace
Jan-11-19,"Target introduces Kona Sol, an exclusive swimwear brand",American City Business Journals
Jan-11-19,Today's Logistics Report: Shoppers Skip the Mall; Trade War Disrupts; Huawei Exports Blocked,The Wall Street Journal
Jan-11-19,Doubt Appears To Creep Into Stock Market On News Flow,Benzinga
Jan-11-19,Amazon to Invest in Balyo to Expand Warehouse Automation,Zacks
Jan-11-19,Target Posts Solid Holiday Numbers Unlike Few Other Retailers,Zacks
Jan-11-19,Is Macy's Spooking You? 3 Retail ETFs & Stocks for 2019,Zacks
Jan-11-19,Urban Outfitters Falls After Posting In-Line Holiday Sales,TheStreet.com
Jan-11-19,[$$] Macys profit warning raises concerns over US retailers,Financial Times
Jan-11-19,"3 Big Stock Charts for Friday: General Electric, Hologic and MGM Resorts",InvestorPlace
Jan-11-19,"Buy The Post-Holiday Sales Dip In Target Stock, Retails Hottest Story",InvestorPlace
Jan-14-19,Lululemon (LULU) Stock Looks Like a Buy &amp; It Just Raised Its Q4 Guidance,Zacks
Jan-14-19,Dont Let the Rally In Bed Bath & Beyond Stock Fool You,InvestorPlace
Jan-15-19,Target's Digital Strategy Is Paying Off,Motley Fool
Jan-15-19,American Eagle Posts Solid Comps on Successful Holiday Feat,Zacks
Jan-15-19,2 Retail Stocks to Buy Right Now,TheStreet.com
Jan-16-19,3 Top Retail Stocks to Buy in January,Motley Fool
Jan-16-19,How Costco Crushed It in 2018,Motley Fool
Jan-16-19,Target (TGT) Stock Sinks As Market Gains: What You Should Know,Zacks
Jan-16-19,This Tysons cyber startup believes its 'scorecard' gives it an edge in a crowded field,American City Business Journals
Jan-16-19,"Nordstrom Holiday Comps Up 1.3%, Stock Down on Cautious View",Zacks
Jan-16-19,How These 3 Discount Retailers Fared The Holiday Season,Zacks
Jan-16-19,"Holiday online sales up between 16 -19%, in-store sales m...",CNBC Videos
Jan-16-19,Sears Chairman Eddie Lampert prevails with strengthened bid in bankruptcy auction: Reuters,MarketWatch
Jan-16-19,Bear of the Day: Macy's (M),Zacks
Jan-16-19,YOUR MONEY-Can you make $100 grow into a house?,Reuters
Jan-17-19,Consumer giants spurn risks to chase online subscribers,Reuters
Jan-17-19,Consumer giants spurn risks to chase online subscribers,Reuters
Jan-17-19,Target continues push on baby products as it expands Cloud Island line,American City Business Journals
Jan-17-19,Doom and gloom: Department stores' disappointing holiday sales results spell trouble for 2019,CNBC
Jan-17-19,"Amazon (AMZN) Q4 Earnings Preview: Revenue, AWS, Advertising &amp; Prime",Zacks
Jan-17-19,Target expands private label baby brand Cloud Island into diapers and other essentials,MarketWatch
Jan-17-19,M&M's Maker Mars Gives Rare Peek Into Its $70 Billion Future,Bloomberg
Jan-17-19,Nonprofits on edge as Target Foundation warns of coming changes,American City Business Journals
Jan-17-19,Target is making a bigger bet on baby,CNBC
Jan-18-19,Here's Why Target Scored Decent Numbers for the Holiday Season,Zacks
Jan-18-19,Walmart's Latest Move to Step Up Online Grocery Delivery Game,Zacks
Jan-18-19,Consumer giants spurn risks to chase online subscribers,Reuters
Jan-18-19,Consumer giants spurn risks to chase online subscribers,Reuters
Jan-22-19,"Target stores will soon accept Apple Pay, Google Pay, Samsung Pay and contactless cards",American City Business Journals
Jan-22-19,Walmarts Ability to Turn Down Bad Projects Is Bullish for Walmart Stock,InvestorPlace
Jan-23-19,"The Battle for Queens, New York, Is Not Just About Amazon",City Lab NonHosted
Jan-23-19,Buy Walmart (WMT) Stock For 2019 on Morgan Stanley Upgrade?,Zacks
Jan-24-19,9 Valentine's Day Candy and Chocolates for 2019,TheStreet.com
Jan-24-19,Target's Shipt subsidiary to bring same-day grocery delivery to Hawaii,American City Business Journals
Jan-24-19,Can J.C. Penney Steer Clear of the Iceberg?,GuruFocus.com
Jan-24-19,"The Battle for Queens, New York, Is Not Just About Amazon",City Lab NonHosted
Jan-24-19,Shipt And Target Expand Same-Day Delivery In Hawaii,GlobeNewswire
Jan-24-19,How Much Are Target Corporation (NYSE:TGT) Insiders Taking Off The Table?,Simply Wall St.
Jan-24-19,Target Stock Has Much More Room to Run From Here,InvestorPlace
Jan-24-19,TGT Wont Break Above Resistance at $72.50 Before Earnings,InvestorPlace
Jan-25-19,Private Labels Are One More Reason to Love Amazon Stock,InvestorPlace
Jan-25-19,Amazon (AMZN) to Post Q4 Earnings: Prime to Play a Key Role,Zacks
Jan-28-19,"The Battle for Queens, New York, Is Not Just About Amazon",City Lab NonHosted
Jan-28-19,A Foolish Take: Pressure for Retailers to Provide Free Shipping Increases,Motley Fool
Jan-28-19,"The Zacks Analyst Blog Highlights: Amazon, Walmart, Target and Twitter",Zacks
Jan-28-19,Target (TGT) Set to Offer Same-Day Delivery Service in Hawaii,Zacks
Jan-28-19,4 Discount Retailers to Steal the Show this Earnings Season,Zacks
Jan-28-19,"Target Off to Solid Start in 2019, Outpaces S&amp;P 500 &amp; Industry",Zacks
Jan-29-19,Target (TGT) Dips More Than Broader Markets: What You Should Know,Zacks
Jan-29-19,3 Top Retail Stocks to Buy Right Now,Motley Fool
Jan-29-19,Harry's expands Manhattan office space,American City Business Journals
Jan-29-19,Millennial Money: 5 keys to picture-perfect TV buying,Associated Press
Jan-29-19,"The Zacks Analyst Blog Highlights: Ross Stores, Costco, Target and Burlington",Zacks
Jan-29-19,Here's Why Five Below Scored Decent Numbers in Holiday Season,Zacks
Jan-30-19,"What to Expect from Amazon (AMZN) Q4 Earnings, Revenue, AWS &amp; More",Zacks
Jan-30-19,Target announces 10 beauty startups in this year's Takeoff Accelerator program,American City Business Journals
Jan-30-19,Target Stock Doesnt Look Cheap Enough,InvestorPlace
Jan-31-19,St. Louis coffee company inks new distribution deal,American City Business Journals
Jan-31-19,"Walmart, Kroger, others to sit out 2019 as Houstons retail development declines again, Wulfe survey says",American City Business Journals
Jan-31-19,3 Key Facts That Demonstrate Amazon's Retail Dominance,Motley Fool
Feb-01-19,Report: Target's app charges higher prices to customers near a store,American City Business Journals
Feb-01-19,Amazon Q4 Earnings Breakdown: Should Investors Worry About Slowing Growth?,Zacks
Feb-04-19,What Does Pro Bono Really Mean?,Investopedia
Feb-04-19,Could Patriots Win Show Dick's Sporting Goods a Path to Retail Victory?,Motley Fool
Feb-04-19,"Target to sell Flamingo razors, adding to its roster of online brands like Casper and Harry's",CNBC
Feb-05-19,Target (TGT) Gains But Lags Market: What You Should Know,Zacks
Feb-05-19,Buy Soaring Chipotle (CMG) Stock Ahead of Q4 Earnings Wednesday?,Zacks
Feb-05-19,Target's newest loyalty program experiment includes a birthday present,American City Business Journals
Feb-05-19,Most shoppers are still leery of buying their groceries online. But delivery in the US is set to 'explode',CNBC
Feb-05-19,Target is taking its new loyalty program to more cities,CNBC
Feb-06-19,Procter &amp; Gamble to Widen Naturals Line With This is L. Buyout,Zacks
Feb-07-19,Buy Chipotle (CMG) Stock at New High After Blowout Q4 Earnings &amp; Sales?,Zacks
Feb-07-19,"Top Gainers - Hanesbrands, Sealed Air and Cardinal Health Rally",Investing.com
Feb-08-19,Target updates app after TV station reveals pricing changes,Associated Press
Feb-08-19,3 Top Value Stocks to Buy in February,Motley Fool
Feb-08-19,Why Target Stock Gained 11% in January,Motley Fool
Feb-08-19,These stores are apparently coming to a new Auburn retail center,American City Business Journals
Feb-11-19,Target (TGT) Stock Sinks As Market Gains: What You Should Know,Zacks
Feb-11-19,Toys R US plans second act under new name,Associated Press
Feb-11-19,Toys R US plans second act under new name,Associated Press
Feb-11-19,Costco's January Comps Growth Decelerates: Should You Worry?,Zacks
Feb-11-19,Walmart launches private-label furniture collection online,American City Business Journals
Feb-12-19,New owner promises to revitalize deteriorated Triad mall,American City Business Journals
Feb-12-19,Best Buy tops Barron's 'Most Sustainable Companies' list,American City Business Journals
Feb-12-19,"Target Corporation (NYSE:TGT) Should Be In Your Dividend Portfolio, Heres Why",Simply Wall St.
Feb-12-19,Toys R Us 2.0: Does a Market Exist for Its Revival?,Motley Fool
Feb-13-19,"What to Expect from CVS Health's Q4 Earnings, Revenue &amp; Comps",Zacks
Feb-13-19,Tanger Outlets reveals details about Nashville plans,American City Business Journals
Feb-13-19,"Downtown Minneapolis population nears 50,000 after a big year; top employers ranked",American City Business Journals
Feb-13-19,Here's What to Expect from Walmart's (WMT) Q4 Earnings Results,Zacks
Feb-14-19,Why Starbucks (SBUX) Stock Looks Like a Strong Buy at New High,Zacks
Feb-15-19,Time to go shopping in retail? Big box breaks out,CNBC Videos
Feb-15-19,Walmart 'holding its own' against Amazon ahead of earnings report,CNBC
Feb-15-19,"So long, khakis  Target now allows store employees to wear jeans",American City Business Journals
Feb-15-19,Target to fill big Tenleytown retail vacancy,American City Business Journals
Feb-19-19,The Retail Race: 4 trades,CNBC Videos
Feb-19-19,3 Top Value Stocks to Buy in February,Motley Fool
Feb-19-19,Walmart's E-Commerce Sales Maintain Strong Momentum,Motley Fool
Feb-20-19,Buy Target (TGT) Stock After Walmart's (WMT) Strong Holiday Quarter?,Zacks
