date,title,source
Oct-17-18,Target Goes All-in on Private-Label Brands,Motley Fool
Oct-17-18,Target Embraces Change at Its Stores and Online,Motley Fool
Oct-17-18,The Target Cheese-Advent Calendar Is Coming Soon,InvestorPlace
Oct-17-18,U.S. holiday hiring hits highest since 2014 as consumer confidence soars,Reuters
Oct-17-18,U.S. holiday hiring hits highest since 2014 as consumer confidence soars,Reuters
Oct-17-18,"Retailers Like Target and Amazon Plan Massive Holiday Hiring, Says Report",TheStreet.com
Oct-17-18,Will Walmarts Latest Acquisition Disrupt the Lingerie Market?,Motley Fool
Oct-17-18,Is Target (TGT) a Great Value Stock Right Now?,Zacks
Oct-17-18,"Target aims to fill the void left by Toys R Us with 250,000 square feet dedicated to toys",MarketWatch
Oct-17-18,Target will overhaul hundreds of toy departments ahead of holidays (images),American City Business Journals
Oct-17-18,Take a tour of Preston Center's new Target store,American City Business Journals
Oct-18-18,"StarKist admits fixing tuna prices, faces $100 million fine",Associated Press
Oct-18-18,"StarKist admits fixing tuna prices, faces $100 million fine",Associated Press
Oct-18-18,Downtown Orlando's (retail) shopping list: 9 things business people want here,American City Business Journals
Oct-18-18,Can Target Win With Toys This Holiday Season?,Motley Fool
Oct-18-18,This is Why Target (TGT) is a Great Dividend Stock,Zacks
Oct-18-18,5 Retail Stocks Seen Winning From a Sears Bankruptcy,Investopedia
Oct-19-18,5 Retail Stocks That Could Follow in Sears Footsteps,InvestorPlace
Oct-19-18,UPS to hold Orlando event for seasonal hiring,American City Business Journals
Oct-19-18,Lawsuit claims Target tech vendor used company secrets to thwart rivals,American City Business Journals
Oct-19-18,Bill Smead says buy homebuilder stocks,CNBC Videos
Oct-19-18,Will E-Commerce Drive Retail Sales This Black Friday?,Zacks
Oct-19-18,"StarKist admits fixing tuna prices, faces $100 million fine",Associated Press
Oct-22-18,20 Halloween Costumes You Can Wear To Work in 2018,TheStreet.com
Oct-22-18,American Retail Brushes Off Sears Collapse: 5 Picks,Zacks
Oct-23-18,Target offers two-day shipping with no minimums for holiday,Associated Press
Oct-23-18,Walmart and Target Go Head-to-Head for the Holiday Season,Zacks
Oct-23-18,[$$] Target Undercuts Amazon With Free Two-Day Shipping,The Wall Street Journal
Oct-23-18,"Target's two-day holiday shipping option beats Amazon, Walmart",Reuters
Oct-23-18,Target's private label brand A New Day reaches $1 billion in sales,MarketWatch
Oct-23-18,"Target's battle plan for the holidays: Free two-day shipping, more staff and toys",CNBC
Oct-23-18,Target Makes the Holidays Easier Than Ever: First Retailer to Offer Same-Day Delivery and Drive Up Service Coast to Coast,PR Newswire
Oct-23-18,EBay: Street Becomes Bearish Ahead of Earnings,Investopedia
Oct-23-18,"The Zacks Analyst Blog Highlights: Target, Burlington, Dollar General, Tilly's and Urban Outfitters",Zacks
Oct-23-18,Walmart to expand shipping perks for shoppers ahead of the holidays,CNBC
Oct-24-18,Target Gets Aggressive Ahead of the Holidays,Motley Fool
Oct-24-18,Target (TGT) Stock Moves -0.51%: What You Should Know,Zacks
Oct-24-18,Will 2-Day Shipping Offer Lend Target Edge Over AMZN & WMT?,Zacks
Oct-24-18,Target CEO says the US consumer is as strong as ever: 'They're seeing wages rise',CNBC
Oct-24-18,"Research Report Identifies FS Investment, Zebra Technologies, Workday, Target, Cinedigm, and Tronox with Renewed Outlook  Fundamental Analysis, Calculating Forward Movement",GlobeNewswire
Oct-24-18,"Target expands free two-day shipping for holidays, pressuring Amazon, Walmart",American City Business Journals
Oct-24-18,Target offers free 2-day shipping for the holidays,American City Business Journals
Oct-24-18,Target offers free 2-day shipping for the holidays,American City Business Journals
Oct-24-18,7 things to know today and is your boss reading your email? Maybe,American City Business Journals
Oct-24-18,"This is a solid consumer spending environment, says Oppen...",CNBC Videos
Oct-25-18,"Moody's turns ""positive"" as retailers reap rewards from strong U.S. economy",Reuters
Oct-25-18,Target (TGT) Now Has the Best Free Shipping Offer This Holiday Season,GoBankingRates
Oct-25-18,"Target Aims to Outdo Walmart, Amazon for Holiday Shopping Convenience",Motley Fool
Oct-25-18,Walmart and Target Are Fighting for Holiday Business With Shipping Deals,Barrons.com
Oct-26-18,Target (TGT) Now Has the Best Free Shipping Offer This Holiday Season,GoBankingRates
Oct-26-18,Target technology exec Tom Kadlec dies unexpectedly,American City Business Journals
Oct-26-18,Amazon Stock Tumbles on Rare Earnings Disappointment,InvestorPlace
Oct-26-18,How Walmart and Target Plan to Take on Amazon This Black Friday,Motley Fool
Oct-29-18,Retail analyst: Holiday season without Toys R Us is 'good news' for certain retailers,CNBC
Oct-29-18,Target Stock Is Still Not Cheap Enough,InvestorPlace
Oct-29-18,"With Toys R Us gone, these retailers are stepping up their game",American City Business Journals
Oct-29-18,"Retailers offer vacation raffles, kayaks, even 'glamour' bundles to attract holiday help",CNBC
Oct-29-18,Should We Worry About Target Corporations (NYSE:TGT) P/E Ratio?,Simply Wall St.
Oct-29-18,Target joins the foodie holiday countdown market,American City Business Journals
Oct-30-18,"Best Buy to toy market: Can we play, too?",American City Business Journals
Oct-30-18,"Walmart, expecting best holiday season yet, wants to speed shoppers with new mobile checkout",CNBC
Oct-31-18,Target (TGT) Stock Sinks As Market Gains: What You Should Know,Zacks
Oct-31-18,L.L. Bean looks to northern neighbor to boost sales,Associated Press
Oct-31-18,5 Top Stocks to Make the Most of All Hallows' Eve,Zacks
Oct-31-18,Here's How A Halloween Portfolio Performs Against The Market,Benzinga
Oct-31-18,20 Halloween Costumes You Can Wear To Work in 2018,TheStreet.com
Nov-01-18,"With employers eager to fill jobs, hiring could stay strong",Associated Press
Nov-01-18,Kohl's opening its stores at 5 p.m. on Thanksgiving,MarketWatch
Nov-01-18,J.C. Penney to start Black Friday at 2 p.m. on Thanksgiving day,MarketWatch
Nov-01-18,"Target, looking to win market share from Publix and Amazon, spends millions remodeling six Tampa Bay stores",American City Business Journals
Nov-01-18,Kohl's is sweetening its rewards program this holiday season,CNBC
Nov-01-18,"Target's holiday strategy starts with mobile checkout, longer Thanksgiving hours",American City Business Journals
Nov-01-18,"Amazon, Target and Other Retailers Are Starting Black Friday Early",TheStreet.com
Nov-01-18,"Target launching Skip-the-Line checkout technology, will open at 5 p.m. on Thanksgiving",MarketWatch
Nov-01-18,"Earthquakes to open another tiny soccer field for recreation, fan development",American City Business Journals
Nov-01-18,"Target Ushers in the Holidays with Reveal of Black Friday Deals, New ""Skip-the-Line"" Mobile Checkout Technology and Season-Long Savings",PR Newswire
Nov-01-18,"Target plans to open its doors at 5 pm on Thanksgiving, one hour earlier than last year",CNBC
Nov-01-18,Retail expert weighs in on minimum wage and tariff impact,CNBC Videos
Nov-01-18,Shipt and Target Expand Same-Day Delivery in Pennsylvania and Maryland,GlobeNewswire
Nov-05-18,Amazon drops free-shipping minimum in race for holiday sales,Reuters
Nov-05-18,10 Blue-Chip Stocks to Buy Ahead of Black Friday,InvestorPlace
Nov-05-18,Celebrity hairstylist Kristin Ess expands Target line,American City Business Journals
Nov-05-18,Amazon Offers Free Shipping for Everyone  Is It Enough?,InvestorPlace
Nov-05-18,TGT vs. ROST: Which Stock Is the Better Value Option?,Zacks
Nov-05-18,Target (TGT) is a Top Dividend Stock Right Now: Should You Buy?,Zacks
Nov-05-18,[$$] Amazon Offering Free Shipping on Holiday Orders,The Wall Street Journal
Nov-05-18,"Amazon, like Target, offering free shipping to all U.S. customers with no minimum purchase",MarketWatch
Nov-05-18,"Target launching Skip-the-Line checkout technology, will open at 5 p.m. on Thanksgiving",MarketWatch
Nov-06-18,Lowe's Taps Target Digital Leader as CIO,The Wall Street Journal
Nov-06-18,"Shipt expands with two grocery stores, continues Target rollout",American City Business Journals
Nov-06-18,Toys War Heating Up This Holiday Season,Zacks
Nov-06-18,Is the Holiday Season Tradition of Long Checkout Lines Going Away?,Motley Fool
Nov-07-18,Target (TGT) Gains But Lags Market: What You Should Know,Zacks
Nov-07-18,Mayor's executive order aims to stop stores like Target from closing,American City Business Journals
Nov-07-18,4 Stocks Profiting From Amazons Decline,InvestorPlace
Nov-07-18,"Amazon Jumps Midday, Bolstering Retail Sector",Investing.com
Nov-07-18,Amazons Slowing Retail Business Isnt a Deal Breaker for Amazon Stock,InvestorPlace
Nov-07-18,"Target Stock, Already Up More Than 30% This Year, Jumps on Rosy Forecast",Barrons.com
Nov-07-18,Cowen: 5 Reasons Target Will Outperform,Benzinga
Nov-07-18,"Target upgraded as price, digital, private labels expected to drive up shares",MarketWatch
Nov-07-18,"Target shares rise after Cowen upgrades the stock, raises price forecast to $100",CNBC
Nov-07-18,"Stocks making the biggest move premarket: TGT, DISH, PZZA, DVMT, KORS & more",CNBC
Nov-07-18,George S. Barrett Elected to Target Corporation's Board of Directors,PR Newswire
Nov-08-18,Retail's dilemma: 3 trades,CNBC Videos
Nov-08-18,Walmart Black Friday Ad 2018: 10 Top Deals to Expect,InvestorPlace
Nov-08-18,KSS Stock is a Standout in the Soaring Retail Sector,InvestorPlace
Nov-08-18,Party City shares sink 11% after earnings hurt by 'operational disruptions' and helium shortages,MarketWatch
Nov-08-18,Walmart Jump-Starts Its Black Friday Deals Early Online,TheStreet.com
Nov-08-18,Is Target (TGT) Stock Outpacing Its Retail-Wholesale Peers This Year?,Zacks
Nov-08-18,Walmart will offer Black Friday deals earlier this year,Reuters
Nov-08-18,Walmart Narrows Price Gap With Amazon and Has Lowest Baby Prices,Bloomberg
Nov-08-18,What Perk Do Holiday Shoppers Want Most?,Motley Fool
Nov-08-18,Walmart will offer Black Friday deals earlier this year,Reuters
Nov-08-18,Walmart will offer Black Friday deals earlier this year,Reuters
Nov-08-18,"Walmart is holding parties in its stores on Thanksgiving, kicking off online deals earlier than ever",CNBC
Nov-09-18,10 Retail Stocks to Buy Ahead of the Holidays,InvestorPlace
Nov-12-18,Target Black Friday Hours 2018  When Your Store Opens,InvestorPlace
Nov-12-18,Hedge Funds Are Getting Onboard With Target Corporation (TGT)s Rebound,Insider Monkey
Nov-12-18,Where's Walmart? Opening of Canadian CBD Market Prompts Speculation About Retail Giant,Benzinga
Nov-13-18,Target (TGT) Dips More Than Broader Markets: What You Should Know,Zacks
Nov-13-18,Decoding the circulars: What Target and Walmart's Black Friday ads say about their holiday strategies,American City Business Journals
Nov-13-18,Scammers hack Target's Twitter account in bitcoin fraud,American City Business Journals
Nov-13-18,Retail ETFs in Focus Ahead of Q3 Brick-and-Mortar Earnings,Zacks
Nov-13-18,Target (TGT) Reports Next Week: Wall Street Expects Earnings Growth,Zacks
Nov-13-18,New Week Starts with New Selloff,Zacks
Nov-14-18,"Cowen: Kohl's, Target, Tiffany Are Top Holiday Retail Picks",Benzinga
Nov-14-18,Target (TGT) Q3 Earnings: Omnichannel Strategy to Fuel Growth,Zacks
Nov-14-18,Will E-Commerce Drive Retail Sales This Holiday Season?,Zacks
Nov-14-18,Macy's earnings beat estimates as retailer raises forecast with hopes for strong holiday,CNBC
Nov-14-18,Cryptocurrencies Mixed as Investors Show Confidence in Blockchain Technology,Investing.com
Nov-15-18,"Retail rally is rolling over, are these names on sale ahe...",CNBC Videos
Nov-15-18,Does Walmart's strong guidance bode well for the holidays...,CNBC Videos
Nov-15-18,US retail sales rose a solid 0.8 percent last month,Associated Press
Nov-15-18,Target (TGT) Stock Looks Like a Buy After Walmart's (WMT) Strong Q3,Zacks
Nov-15-18,Snap Stocks Risks Limit Its Near-Term Upside,InvestorPlace
Nov-15-18,Target Corporation (NYSE:TGT): Ex-Dividend Is In 4 Days,Simply Wall St.
Nov-16-18,Cramer's lightning round: Don't buy shares of Target unti...,CNBC Videos
Nov-16-18,Cramer's lightning round: Don't buy shares of Target until after it reports,CNBC
Nov-16-18,Buy Lowe's (LOW) Stock Before Q3 Earnings After HD's Strong Quarter?,Zacks
Nov-16-18,Wholesale grocery giant to cut fewer Orlando jobs than expected,American City Business Journals
Nov-16-18,"Upcoming Earnings to Watch: TGT, TJX, DE",Zacks
Nov-16-18,Why JP Morgan's top internet analyst expects breakout growth for Facebook and Amazon shares in 2019,CNBC
Nov-16-18,Congressman plans Chicago Target store protest on Black Friday,American City Business Journals
Nov-16-18,Black Friday hours: Here's a list of when retailers will be open,CNBC
Nov-19-18,COMM 2015-CCRE26 Mortgage Trust -- Moody's affirms six classes of COMM 2015-CCRE26,Moody's
Nov-19-18,The Best Sports Retail Stocks to Buy Amid the Holiday Shopping Season,Zacks
Nov-19-18,This is the time of year when everyone gets in the mood f...,CNBC Videos
Nov-19-18,More Volatility for Tech Stocks & a Final Wave of Retail Earnings Reports,Zacks
Nov-19-18,Burlington Stores (BURL) Q3 Earnings: Is a Beat in Store?,Zacks
Nov-19-18,Are Investors Undervaluing Target (TGT) Right Now?,Zacks
Nov-19-18,Walmart Stocks Earnings Good  But Not Quite Good Enough,InvestorPlace
Nov-19-18,"Nordstrom, Wal-Mart, Macy's, Target and Amazon are part of Zacks Earnings Preview",Zacks
Nov-19-18,Why Target (TGT) Might Surprise This Earnings Season,Zacks
Nov-19-18,"Rent-A-Center, Advanced Energy, Target, TJX and Deere highlighted as Zacks Bull and Bear of the Day",Zacks
Nov-19-18,"Target Corporation to Webcast 3rd Quarter Earnings Conference Call on Tuesday, November 20, 2018",PR Newswire
Nov-19-18,5 Great Videogame Deals for Black Friday 2018,Barrons.com
Nov-19-18,Three things to watch for Target's Q3 earnings,American City Business Journals
Nov-19-18,"Target Reveals Cyber Week Savings, Including 15% off Hundreds of Thousands of Items on Target.com on Cyber Monday",PR Newswire
Nov-20-18,[$$] Retail Stocks Get Crushed Despite Hopeful Sales,The Wall Street Journal
Nov-20-18,"Facebook, Apple, Amazon & the FAANG Stock Selloff in Four Charts",Zacks
Nov-20-18,Stock Market Today: Bear Territory,Investopedia
Nov-20-18,3 (Mostly) Nonpolitical Topics for Your Thanksgiving Table Conversation,Motley Fool
Nov-20-18,"Target, Boston Scientific and Kohl's fall; Campbell jumps",Associated Press
Nov-20-18,What Happened in the Stock Market Today,Motley Fool
Nov-20-18,Markets Right Now: Tech rout erases market's gain for year,Associated Press
Nov-20-18,"US STOCKS-Wall St sells off again as retail, energy struggle",Reuters
Nov-20-18,Retail stocks slide as CEOs fail to persuade skeptical investors that outlook is rosy,CNBC
Nov-20-18,Target shares take a beating after investments take a toll on margins,MarketWatch
Nov-20-18,"Red Tuesday for retailers, as Targets stock suffers worst stretch since the financial crisis",MarketWatch
Nov-20-18,Target Corporation (TGT) Q3 2018 Earnings Conference Call Transcript,Motley Fool
Nov-20-18,"After bleak Tuesday, Black Friday can't come soon enough for Target",American City Business Journals
Nov-20-18,[$$] Retail Stocks Get Crushed Despite Hopeful Sales,The Wall Street Journal
Nov-20-18,"Target shares tumble after profit miss, big jump in inventories",Reuters
Nov-20-18,"The tech-stock selloff is a golden opportunity to buy Microsoft, Apple, Netflix and Tesla",MarketWatch
Nov-20-18,Dip in Target a buying moment: Expert,CNBC Videos
Nov-20-18,Stock News Today: Apple Hit Again As Dow Jones Slumps Nearly 600 Points,Investor's Business Daily
Nov-20-18,"US STOCKS-Retail disappointments, energy decline hit Wall Street",Reuters
Nov-20-18,"Ross Stores (ROST) Q3 Earnings Beat, Soft Margin Hurts Stock",Zacks
Nov-20-18,TJX Companies (TJX) Raises View on Solid Q3 Earnings & Sales,Zacks
Nov-20-18,"Walmart, Target, Best Buy take steps to curb gift card fraud",Reuters
Nov-20-18,The only problem I can find with retail right now is the ...,CNBC Videos
Nov-20-18,Retail ETF Investors Arent Impressed with Rising Consumer Spending,ETF Trends
Nov-20-18,"Walmart, Target to grab more online sales this holiday, but it's come at a cost",CNBC
Nov-20-18,"Walmart, Target, Best Buy take steps to curb gift card fraud",Reuters
Nov-20-18,"Kudlow, Retail Earnings, & Tech Uncertainty Create Mixed Investor Sentiment",Zacks
Nov-20-18,"US STOCKS-Retail warnings, tech tumble hit Wall Street",Reuters
Nov-20-18,Why Target Stock Tumbled Today,Motley Fool
Nov-20-18,Tempering Our Short-Term Expectations for Target,Morningstar
Nov-20-18,"Target shares tumble after profit miss, big jump in inventories",Reuters
Nov-20-18,[$$] Investors Are Too Pessimistic About Target,The Wall Street Journal
Nov-20-18,"US STOCKS-Retail, tech stocks lead slide on Wall Street",Reuters
Nov-20-18,"U.S. housing starts rise, but underlying trend weak",Reuters
Nov-20-18,"Target Stock Just Took a Plunge, and That Means Its a Black Friday Bargain Buy",Barrons.com
Nov-20-18,"Target shares slide as profit misses estimate, inventories jump",Reuters
Nov-20-18,Who are Target's Main Competitors? (TGT),Investopedia
Nov-20-18,Target tumbles after mixed third-quarter results,CNBC Videos
Nov-20-18,Target shares plunge after earnings miss forecasts,CNBC Videos
Nov-20-18,Apple Taken Down To Correction Levels,Zacks
Nov-20-18,"Attention, Target Investors: Your Stock Is Down 10%",Barrons.com
Nov-20-18,Target CEO Brian Cornell says 'no sign' consumer spending is slowing ahead of holidays,CNBC
Nov-20-18,"Tech-Led Bloodbath Hurting Retail Stocks: TGT, BBY, KSS & More",Zacks
Nov-20-18,"Target Slumps After Q3 Earnings, Comparable Sales Miss as Cost Increases Bite",TheStreet.com
Nov-20-18,"Kohl's Tops Q3 Earnings, Boosts Outlook, But Gets Caught in Retail Downdraft",TheStreet.com
Nov-20-18,Tech Takes Another Big Bite Out of the Market,Zacks
Nov-20-18,Walmart debuts digital toy tester for kids,American City Business Journals
Nov-20-18,"Target (TGT) Q3 Earnings Miss Estimates, Stock Tumbles",Zacks
Nov-20-18,Target Has a Bull's-Eye on Its Back,Bloomberg
Nov-20-18,Target's investments in the future hits margins,Associated Press
Nov-20-18,"Target Shares Plunge After Earnings, Revenue Miss",Investing.com
Nov-20-18,Retail sector stocks tumble to extend long losing streaks after disappointing earnings reports,MarketWatch
Nov-20-18,Is Target's hot streak fading at the worst possible time?,American City Business Journals
Nov-20-18,Target CEO Brian Cornell appointed non-executive chairman of Yum! Brands,American City Business Journals
Nov-20-18,"Target third-quarter results miss estimates, shares tumble",Reuters
Nov-20-18,"Stocks making the biggest move premarket: TGT, BBY, KSS, LOW, MDT & more",CNBC
Nov-20-18,6 Consumer Discretionary Stocks to Buy for Black Friday Week,Zacks
Nov-20-18,"[$$] Target shares hit by falling margins, sales miss",Financial Times
Nov-20-18,Yum! Brands names Target CEO as non-executive board chairman,American City Business Journals
Nov-20-18,5 Stocks to Profit From the Thanksgiving Weekend Bonanza,Zacks
Nov-20-18,This expert is concerned that the third quarter was a hig...,CNBC Videos
Nov-20-18,"As Thanksgiving nears, these grocery stores are most accessible in DFW",American City Business Journals
Nov-20-18,"Target's stock tumbles after profit, same-store sales miss expectations",MarketWatch
Nov-20-18,Target shares down sharply after quarterly report,CNBC Videos
Nov-20-18,Target Reports Third Quarter Results,PR Newswire
Nov-20-18,Target shares tumble as earnings miss the mark but retailer reiterates 2018 forecast,CNBC
Nov-20-18,"Target shares tumble 7% as earnings miss mark, weighed down by higher costs",CNBC
Nov-21-18,Target Talks Rising Traffic and Falling Profit Margins,Motley Fool
Nov-21-18,Here's What Target Is Doing for Black Friday,Motley Fool
Nov-21-18,These retailers will attract the most shoppers during the holidays,American City Business Journals
Nov-21-18,Jim Cramer: What Has to Happen for These Stocks to Be in Favor Again?,TheStreet.com
Nov-21-18,Wall Street Week Ahead: Investors caught in crossfire of fight for holiday shoppers,Reuters
Nov-21-18,Target Falls After Q3 Print: Should Investors Buy The Dip?,Benzinga
Nov-21-18,Investors caught in crossfire of fight for holiday shoppers,Reuters
Nov-21-18,Investors caught in crossfire of fight for holiday shoppers,Reuters
Nov-21-18,Target and Walmart Stocks Will Bounce Back,Motley Fool
Nov-21-18,"Target Reports Impressive 3rd-Quarter Revenue, Misses Earnings Estimates",GuruFocus.com
Nov-21-18,"Target's stock turns lower, is now in danger of longest losing streak in nearly 19 years",MarketWatch
Nov-21-18,"Stock Market News For Nov 21, 2018",Zacks
Nov-21-18,TGT vs. COST: Which Stock Is the Better Value Option?,Zacks
Nov-21-18,"When Retail's Seasonal Hiring Binge Meets a Tight Labor Market, Something's Got to Give",Motley Fool
Nov-21-18,4 Retail Stocks to Buy This Thanksgiving Weekend,Zacks
Nov-21-18,"The Zacks Analyst Blog Highlights: Spirit Airlines, Marcus, Hudson, Target and Kohl's",Zacks
Nov-21-18,"BJ's Wholesale (BJ) Stock Gains on Q3 Earnings Beat, Ups View",Zacks
Nov-21-18,Target Earnings Significantly Miss Bull's Eye,Investopedia
Nov-21-18,"The tech-stock selloff is a golden opportunity to buy Amazon, Apple, Netflix and Tesla",MarketWatch
Nov-21-18,Edited Transcript of TGT earnings conference call or presentation 20-Nov-18 1:00pm GMT,Thomson Reuters StreetEvents
Nov-21-18,5 Great Travel & Retail Stocks to Buy for Thanksgiving,Zacks
Nov-21-18,Target shares take a beating after investments take a toll on margins,MarketWatch
Nov-21-18,"Red Tuesday for retailers, as Targets stock suffers worst stretch since the financial crisis",MarketWatch
Nov-21-18,Today's Research Reports on Trending Tickers: Target and L Brands,ACCESSWIRE
Nov-21-18,A Complete History of Black Friday,Zacks
Nov-21-18,"With Toys R Us Gone, Here's Where Its Customers Are Going",Motley Fool
Nov-23-18,"Target Stock Plunged This Week, Making It a Bargain Buy",Barrons.com
Nov-23-18,Business Highlights,Associated Press
Nov-23-18,Cyber Monday Is a Chance for Walmart and Target to Fight Amazon on Its Own Turf,Barrons.com
Nov-23-18,"Millennial, Gen Z Shoppers Head to Malls: Black Friday Update",Bloomberg
Nov-23-18,"Target is winning out in post-Toys R Us toy sales, says former Walmart CEO",CNBC
Nov-23-18,"Black Friday deals lure U.S. shoppers, biggest sales gains online",Reuters
Nov-23-18,Morgan Stanley: Why Retailers Should Continue To Worry About 'The Amazon Effect',Benzinga
Nov-23-18,S&P 500 ends in correction on Black Friday as oil endures a fresh pummeling to end the week,MarketWatch
Nov-23-18,Investors caught in crossfire of fight for holiday shoppers,Reuters
Nov-23-18,Wall Street Weekahead: Investors caught in crossfire of fight for holiday shoppers,Reuters
Nov-23-18,3 Top Retail Stocks to Buy Right Now,Motley Fool
Nov-23-18,Holiday shoppers used their phones to spend $1 billion this Thanksgiving,CNBC
Nov-23-18,Target Pays the Price for Survival,Motley Fool
Nov-23-18,Top E-Commerce Retailers Higher on US Online Spending Growth,GuruFocus.com
Nov-23-18,Welcome To Black Friday: A Day For Retailers,Zacks
Nov-23-18,"Black Friday, Red Pre-Market",Zacks
Nov-23-18,Retail ETFs to Buy on Black Friday Deals,Zacks
Nov-23-18,"Target and Kohls Stock Are Long-Term Winners, Says Analyst",Barrons.com
Nov-23-18,How Black Friday Became America's Biggest Shopping Holiday of the Year,Zacks
Nov-23-18,3 Dividend Stocks That Pay You Better Than Pepsi Does,Motley Fool
Nov-23-18,JP Morgan retail analyst says 2019 looks late cycle,CNBC Videos
Nov-23-18,Thanksgiving Day deals could be stealing Black Friday's thunder,CNBC
Nov-23-18,Will Cyber Monday Deals Lead to Record-Breaking Sales?,Zacks
Nov-23-18,"The Zacks Analyst Blog Highlights: Spirit Airlines, Hertz Global Holdings, Macy's, Target and Ross Stores",Zacks
Nov-23-18,What's Hurting Ross Stores (ROST) Stock Despite a Strong Q3?,Zacks
Nov-23-18,Are You An Income Investor? Dont Miss Out On Target Corporation (NYSE:TGT),Simply Wall St.
Nov-23-18,5 Stocks That Make Great Buys This Black Friday,Zacks
Nov-26-18,"Cramer flags 'bargain' retail stocks: Macy's, Kohl's, Tar...",CNBC Videos
Nov-26-18,"Macy's, Kohl's, Target, Amazon 'bargain' retail stocks: C...",CNBC Videos
Nov-26-18,"Cramer flags 'bargain' retail stocks: Macy's, Kohl's, Target, Amazon",CNBC
Nov-26-18,Cyber Monday on track for U.S. online shopping record,Reuters
Nov-26-18,Target Earnings: Don't Worry About Margin Pressure,Motley Fool
Nov-26-18,Cyber Monday Online Sales On Track For Biggest Day Ever,Investor's Business Daily
Nov-26-18,The Bears Hit the Bulls Eye with Target Corp.,TheStreet.com
Nov-26-18,7 Retail Stocks That Won Big This Black Friday,InvestorPlace
Nov-26-18,3 Reasons Why Stocks Are Rebounding Today,Zacks
Nov-26-18,Cyber Monday set to become record U.S. online shopping day,Reuters
Nov-26-18,"Black Friday Saw Hike in Smartphone, Online Sales",TheStreet.com
Nov-26-18,Blockbuster Cyber Monday Is Overshadowed by Economic Outlook,Bloomberg
Nov-26-18,The Flip-Side to the Big Box Black Friday,Zacks
Nov-26-18,Cyber Monday Tips And Deals,Benzinga
Nov-26-18,Hottest Online Stock & ETF Deals for Cyber Monday,Zacks
Nov-26-18,Holiday Shopping Brings Positive Market Sentiment,Zacks
Nov-26-18,4 Stocks to Make the Most of This Cyber Monday,Zacks
Nov-26-18,"The Zacks Analyst Blog Highlights: Amazon, Medtronic, Lowe???s, Target and Hilton",Zacks
Nov-26-18,Blockbuster Cyber Monday Is Overshadowed by Economic Outlook,Bloomberg
