date,title,source
Oct-17-18,Can Dominion Energy (D) Keep the Earnings Surprise Streak Alive?,Zacks
Oct-22-18,Why Dominion Energy (D) is a Top Dividend Stock for Your Portfolio,Zacks
Oct-25-18,Can Dominion Energy (D) Deliver a Beat Again in Q3 Earnings?,Zacks
Oct-30-18,US-China Trade War Set to Escalate: 5 Safe Utility Picks,Zacks
Oct-31-18,Should You Buy Dominion Energy (D) Ahead of Earnings?,Zacks
Oct-31-18,"The Zacks Analyst Blog Highlights: National Fuel Gas, Dominion Energy, American Electric Power, WEC Energy Group and Exelon",Zacks
