date,title,source
Oct-18-18,Is Atkore International Group Inc. (ATKR) Stock Undervalued Right Now?,Zacks
Oct-22-18,Atkore International Announces Mark Lamps as Vice President of Business Development and Strategy,Business Wire
Oct-23-18,"Investor Expectations to Drive Momentum within Navios Maritime Partners LP, Alliance Data, Eli Lilly, CONVERGEONE HLD, Atkore International Group, and NantKwest  Discovering Underlying Factors of Influence",GlobeNewswire
Oct-23-18,"The Zacks Analyst Blog Highlights: Equinor, Atkore, RH, Vishay and Eni",Zacks
Oct-31-18,Atkore International Group Inc. (ATKR) Stock Sinks As Market Gains: What You Should Know,Zacks
Nov-05-18,Atkore International Announces Fourth Quarter and Full Year Fiscal Year 2018 Earnings Release Date and Conference Call,Business Wire
Nov-05-18,Is Atkore International Group Inc. (ATKR) a Great Value Stock Right Now?,Zacks
