date,title,source
Oct-18-18,ORBCOMM to Host Third Quarter 2018 Results Conference Call,GlobeNewswire
Oct-25-18,Chief Express Selects ORBCOMMs In-Cab and Trailer Monitoring Solutions for Fleet Management,GlobeNewswire
Oct-30-18,"Orbcomm (ORBC) Reports Q3 Loss, Misses Revenue Estimates",Zacks
Oct-30-18,Orbcomm: 3Q Earnings Snapshot,Associated Press
Oct-30-18,ORBCOMM Announces Third Quarter 2018 Results,GlobeNewswire
Oct-30-18,"ORBCOMM and Savi Secure Multi-Million Dollar Order to Track and Monitor Nearly 24,000 Assets for the Department of Defense",Business Wire
Oct-30-18,"ORBCOMM and Savi Secure Multi-Million Dollar Order to Track and Monitor Nearly 24,000 Assets for the Department of Defense",GlobeNewswire
Oct-31-18,Edited Transcript of ORBC earnings conference call or presentation 30-Oct-18 8:30pm GMT,Thomson Reuters StreetEvents
Nov-05-18,Edited Transcript of ORBC earnings conference call or presentation 30-Oct-18 8:30pm GMT,Thomson Reuters StreetEvents
Nov-06-18,"Market Trends Toward New Normal in Public Service Enterprise Group, AXT, ORBCOMM, Lancaster Colony, Juniper Networks, and Kellogg  Emerging Consolidated Expectations, Analyst Ratings",GlobeNewswire
Nov-06-18,ORBCOMM Launches Next-Generation Refrigerated Container Monitoring Solution,GlobeNewswire
Dec-20-18,Is ORBCOMM Inc (ORBC) A Good Stock To Buy?,Insider Monkey
Feb-13-19,ORBCOMM to Host Fourth Quarter and Full Year 2018 Results Conference Call,GlobeNewswire
Feb-20-19,Will Orbcomm (ORBC) Report Negative Earnings Next Week? What You Should Know,Zacks
Feb-21-19,Rehrig Pacific Selects ORBCOMMs Analytics Services to Power Its Vision Business Intelligence Platform,GlobeNewswire
Feb-27-19,Orbcomm Inc (ORBC) Q4 2018 Earnings Conference Call Transcript,Motley Fool
Feb-27-19,ORBCOMM Announces Fourth Quarter and Full Year 2018 Results,GlobeNewswire
Feb-28-19,Here's Why ORBCOMM Stock Fell 20% Today,Motley Fool
Feb-28-19,Edited Transcript of ORBC earnings conference call or presentation 27-Feb-19 9:30pm GMT,Thomson Reuters StreetEvents
Mar-01-19,"ORBCOMM Inc (ORBC) Files 10-K for the Fiscal Year Ended on December 31, 2018",GuruFocus.com
Mar-11-19,ORBCOMM Launches Next Generation Solar-Powered Tracking Solution for Dry Trailers and Containers,GlobeNewswire
Mar-13-19,Edited Transcript of ORBC earnings conference call or presentation 27-Feb-19 9:30pm GMT,Thomson Reuters StreetEvents
Mar-20-19,Lidl Uk Selects Orbcomms Cold Chain Monitoring Solution to Maximize Protection of Refrigerated Cargo,GlobeNewswire
Mar-27-19,ORBCOMM and Maerospace Extend AIS Contract With Government of Canada,GlobeNewswire
Apr-03-19,ORBCOMM Earns Acclaim from Frost & Sullivan for Leading the Heavy Vehicles Telematics Market with Its Connected Fleet Solutions,PR Newswire
Apr-03-19,ORBCOMM Earns Acclaim from Frost & Sullivan for Leading the Heavy Vehicles Telematics Market with Its Connected Fleet Solutions,PR Newswire
Apr-05-19,ORBCOMM Announces Dean Milcos as Chief Financial Officer,GlobeNewswire
Apr-08-19,ORBCOMM Launches Enhanced Web Platform and Latest Telematics Devices for Heavy Equipment Industry,GlobeNewswire
Apr-10-19,Cramer's lightning round: This stock is good  it's a great level to buy some more,CNBC
Apr-11-19,"Jim Cramer Shares His Thoughts On Aurora Cannabis, Electronic Arts, Yeti And More",Benzinga
Apr-17-19,ORBCOMM to Host First Quarter 2019 Results Conference Call,GlobeNewswire
Apr-24-19,Orbcomm (ORBC) May Report Negative Earnings: Know the Trend Ahead of Next Week's Release,Zacks
Apr-30-19,ORBCOMM and Kordia Extend AIS Contract With Australian Maritime Safety Authority,GlobeNewswire
May-01-19,ORBCOMM (ORBC) Q1 2019 Earnings Call Transcript,Motley Fool
May-01-19,"Orbcomm (ORBC) Reports Q1 Loss, Tops Revenue Estimates",Zacks
May-01-19,Orbcomm: 1Q Earnings Snapshot,Associated Press
May-01-19,ORBCOMM Announces First Quarter 2019 Results,GlobeNewswire
May-02-19,Edited Transcript of ORBC earnings conference call or presentation 1-May-19 12:30pm GMT,Thomson Reuters StreetEvents
May-06-19,Edited Transcript of ORBC earnings conference call or presentation 1-May-19 12:30pm GMT,Thomson Reuters StreetEvents
