date,title,source
Oct-24-18,Marchex Launches New MIND Innovation Lab and Hires Chief AI Scientist,Business Wire
Oct-26-18,Marchex to Report Third Quarter 2018 Results on November 5,Business Wire
Oct-30-18,Marchex to Attend the 2018 Stephens Investment Conference,Business Wire
Nov-05-18,Marchex: 3Q Earnings Snapshot,Associated Press
Nov-05-18,Marchex Announces Third Quarter 2018 Results,Business Wire
Nov-05-18,Marchex Acquires Telmetrics,Business Wire
Nov-06-18,Edited Transcript of MCHX earnings conference call or presentation 5-Nov-18 10:00pm GMT,Thomson Reuters StreetEvents
Nov-13-18,New Marchex Institute Study Reveals Phone Calls Can Make or Break the Automotive Customer Journey,Business Wire
Nov-16-18,Edited Transcript of MCHX earnings conference call or presentation 5-Nov-18 10:00pm GMT,Thomson Reuters StreetEvents
Nov-23-18,How Much Of Marchex Inc (NASDAQ:MCHX) Do Insiders Own?,Simply Wall St.
Nov-23-18,"Research Report Identifies Synlogic, Consolidated Water Co., AeroCentury, Tecogen, Truett-Hurst, and Marchex with Renewed Outlook  Fundamental Analysis, Calculating Forward Movement",GlobeNewswire
Nov-26-18,"Marchex Acquires Callcap, A Leading Call Monitoring Company",Business Wire
Dec-12-18,Google CEO Testifies Before Republicans at Awaited Hearing,Zacks
Jan-14-19,Google Partners Wikipedia to Expand in Translation Space,Zacks
Jan-14-19,5 Breakout Stocks Offering Impressive Returns,Zacks
Jan-15-19,Marchex to Present at the 2019 Needham Growth Conference,Business Wire
Jan-15-19,"Zacks.com featured highlights include: Rent-A-Center, BioDelivery , Seabridge, Marchex and DSP",Zacks
Jan-23-19,New Auto Industry Study: 28% of Consumers Who Call a Dealership Will Purchase a Vehicle,Business Wire
Jan-28-19,"Roth Capital Upgrades Marchex On Improving Fundamentals, Compelling Valuation",Benzinga
Feb-06-19,Marchex to Report Fourth Quarter 2018 Results on February 13,Business Wire
Feb-12-19,"Marchexs AI-Powered Speech Analytics Sets New Standard, Approaches Human Levels of Accuracy in Consumer to Business Conversations",Business Wire
Feb-13-19,Marchex (MCHX) Q4 Earnings and Revenues Surpass Estimates,Zacks
Feb-13-19,Marchex: 4Q Earnings Snapshot,Associated Press
Feb-13-19,Marchex Announces Fourth Quarter and Full Year 2018 Results,Business Wire
Mar-13-19,Marchex to Present at the 2019 Roth Growth Conference,Business Wire
Mar-18-19,"Marchex Inc (MCHX) Files 10-K for the Fiscal Year Ended on December 31, 2018",GuruFocus.com
Mar-27-19,Marchex AI Innovators Featured at Two International Artificial Intelligence Conferences,Business Wire
Apr-10-19,Marchex Announces New Director and Board Changes,Business Wire
Apr-24-19,Marchex to Report First Quarter 2019 Results on May 2,Business Wire
Apr-25-19,Marchex Launches Real-Time Sales Rescue Solution for Businesses,Business Wire
Apr-26-19,Can You Imagine How Marchex's (NASDAQ:MCHX) Shareholders Feel About The 73% Share Price Increase?,Simply Wall St.
May-01-19,"Marchex Launches Marchex Stream, Unlocking Transformative Conversational Analytics Capabilities for Businesses",Business Wire
May-02-19,Marchex (MCHX) Q1 Earnings Match Estimates,Zacks
May-02-19,Marchex: 1Q Earnings Snapshot,Associated Press
May-02-19,Marchex Announces First Quarter 2019 Results,Business Wire
May-03-19,Edited Transcript of MCHX earnings conference call or presentation 2-May-19 9:00pm GMT,Thomson Reuters StreetEvents
May-08-19,Edited Transcript of MCHX earnings conference call or presentation 2-May-19 9:00pm GMT,Thomson Reuters StreetEvents
May-16-19,Marchex to Present at Investor Conferences,Business Wire
May-29-19,5 Tech Stocks Up in May Despite Stock Market Mayhem,Zacks
May-30-19,"The Zacks Analyst Blog Highlights: OptimizeRx, Match, OSI and Marchex",Zacks
Jun-06-19,"An Intrinsic Calculation For Marchex, Inc. (NASDAQ:MCHX) Suggests It's 22% Undervalued",Simply Wall St.
