date,title,source
Oct-17-18,OneMain Holdings Announces Date of Third Quarter 2018 Earnings Release and Conference Call,Business Wire
Oct-24-18,OneMain Holdings (OMF) Q3 Earnings Preview: What to Know Ahead of the Release,Zacks
Oct-31-18,OneMain Holdings (OMF) Beats Q3 Earnings Estimates,Zacks
Oct-31-18,OneMain: 3Q Earnings Snapshot,Associated Press
Oct-31-18,"OneMain Holdings, Inc. Reports Third Quarter 2018 Results",Business Wire
Nov-01-18,Edited Transcript of OMF earnings conference call or presentation 1-Nov-18 12:00pm GMT,Thomson Reuters StreetEvents
Nov-02-18,Edited Transcript of OMF earnings conference call or presentation 1-Nov-18 12:00pm GMT,Thomson Reuters StreetEvents
Nov-05-18,OneMain Financial Announces Partnership With Operation Gratitude,Business Wire
Nov-06-18,Edited Transcript of OMF earnings conference call or presentation 1-Nov-18 12:00pm GMT,Thomson Reuters StreetEvents
Nov-07-18,Edited Transcript of OMF earnings conference call or presentation 1-Nov-18 12:00pm GMT,Thomson Reuters StreetEvents
Nov-07-18,"Consolidated Research: 2018 Summary Expectations for Pacific Biosciences of California, NXP Semiconductors N.V., Consolidated Communications, Alexander & Baldwin, Willdan Group, and OneMain  Fundamental Analysis, Key Performance Indications",GlobeNewswire
Nov-16-18,OneMain Direct Auto Receivables Trust 2017-1 -- Moody's upgrades OneMain auto loan ABS issued in 2017,Moody's
Nov-19-18,OneMain Direct Auto Receivables Trust 2017-1 -- Moody's upgrades OneMain auto loan ABS issued in 2017,Moody's
Nov-26-18,"Basswood Capital Managements Returns, AUM and Holdings",Insider Monkey
Dec-14-18,OneMain Holdings Inc (OMF): Are Hedge Funds Right About This Stock?,Insider Monkey
