date,title,source
Oct-18-18,Jabil Declares Quarterly Dividend,Business Wire
Oct-19-18,"Jabil Inc (JBL) Files 10-K for the Fiscal Year Ended on August 31, 2018",GuruFocus.com
Oct-19-18,"Detailed Research: Economic Perspectives on W.W. Grainger, Jabil, Grand Canyon Education, Sage Therapeutics, H. B. Fuller, and Jazz Pharmaceuticals  What Drives Growth in Today's Competitive Landscape",GlobeNewswire
Oct-29-18,Exclusive: Apple supplier Jabil extends furloughs to San Jose campuses,American City Business Journals
Nov-01-18,Jabil To Present at Upcoming Investor Conference,Business Wire
Nov-02-18,Triad industrial portfolio sells for more than $81 million,American City Business Journals
Nov-15-18,"Jabil partners with med-tech startup on devices for back pain, calf muscles",American City Business Journals
Nov-29-18,"Research Report Identifies Intuitive Surgical, Coherent, Jabil, Becton, Dickinson, IHS Markit, and Grand Canyon Education with Renewed Outlook  Fundamental Analysis, Calculating Forward Movement",GlobeNewswire
Dec-04-18,Jabils First Quarter of Fiscal Year 2019 Earnings Announcement Set,Business Wire
Dec-11-18,Jabil (JBL) Reports Next Week: Wall Street Expects Earnings Growth,Zacks
Dec-14-18,Hedge Funds Are Crazy About Jabil Inc. (JBL),Insider Monkey
Dec-18-18,"Stocks making the biggest moves after hours: FedEx, Micron and more",CNBC
Dec-18-18,Jabil (JBL) Surpasses Q1 Earnings and Revenue Estimates,Zacks
Dec-18-18,Jabil stock rises 10% after earnings beat,MarketWatch
Dec-18-18,Jabil: Fiscal 1Q Earnings Snapshot,Associated Press
Dec-18-18,Jabil Posts Record First Quarter Results,Business Wire
Dec-18-18,3 Stocks to Watch Into Earnings Tuesday With an Eye on FedEx,TheStreet.com
Dec-19-18,"Why Winnebago Industries, Jabil, and Tallgrass Energy Jumped Today",Motley Fool
Dec-19-18,2 Stocks Move on Wednesday,GuruFocus.com
Dec-19-18,Jabil To Present at Upcoming Investor Conference,Business Wire
Dec-19-18,Jabil Stock Surges on Stellar First-Quarter Earnings,TheStreet.com
Dec-19-18,"Jabil's Valuation 'Intriguing,' Analyst Says Following Q1 Beat, Strong Guidance",Benzinga
Dec-19-18,"[$$] Stocks to Watch: General Mills, Winnebago, Micron, Pfizer, FedEx, Eli Lilly, Jabil, Blue Apron, MetLife",The Wall Street Journal
Dec-19-18,"Jabil (JBL) Q1 Earnings Beat Estimates, Revenues Up Y/Y",Zacks
Dec-19-18,"Stocks making the biggest moves premarket: GIS, UAA, FDX, FB, JNJ & more",CNBC
Dec-19-18,"Dow futures higher | Fed rate decision set | Pfizer, GSK agree to $12.7 billion deal",CNBC
Dec-19-18,Edited Transcript of JBL earnings conference call or presentation 18-Dec-18 9:30pm GMT,Thomson Reuters StreetEvents
Dec-20-18,Jabil (JBL) Surges: Stock Moves 6.9% Higher,Zacks
Dec-20-18,Jabil reports strong performance in fiscal 2019 earnings,American City Business Journals
Dec-27-18,Jabil's president to retire by the end of 2018,American City Business Journals
Jan-08-19,Jabil Packaging Solutions Bolsters its E-Commerce Channel Solutions by Joining Amazons Packaging Support and Supplier Network,Business Wire
Jan-09-19,Edited Transcript of JBL earnings conference call or presentation 18-Dec-18 9:30pm GMT,Thomson Reuters StreetEvents
Jan-10-19,Jabil Announces Annual Meeting of Shareholders,Business Wire
Jan-10-19,Edited Transcript of JBL earnings conference call or presentation 25-Sep-18 12:30pm GMT,Thomson Reuters StreetEvents
Jan-10-19,Edited Transcript of JBL earnings conference call or presentation 18-Dec-18 9:30pm GMT,Thomson Reuters StreetEvents
Jan-14-19,Jabil Expands Retail Innovation Ecosystem to Transform Customer Experiences,Business Wire
