date,title,source
Oct-18-18,Associated Banc-Corp (ASB) Matches Q3 Earnings Estimates,Zacks
Oct-18-18,Associated Banc-Corp: 3Q Earnings Snapshot,Associated Press
Oct-18-18,"Associated Banc-Corp Reports Third Quarter Earnings of $0.48 Per Common Share, or $0.49 Per Common Share Excluding $3 million in Acquisition Related Costs(1)",PR Newswire
Oct-18-18,Associated Banc-Corp to Host Earnings Call,ACCESSWIRE
Oct-18-18,What To Know Before Buying Associated Banc-Corp (NYSE:ASB) For Its Dividend,Simply Wall St.
Oct-19-18,"Associated Banc-Corp (ASB) Beats on Q3 Earnings, Costs Rise",Zacks
Oct-22-18,Edited Transcript of ASB earnings conference call or presentation 18-Oct-18 9:00pm GMT,Thomson Reuters StreetEvents
Oct-22-18,"Associated Banc-Corp's (ASB) Q3 Earnings In Line, Costs Rise (Revised)",Zacks
Oct-23-18,Associated Banc-Corp Announces Increase in Common Stock Dividend,PR Newswire
Oct-24-18,Associated Bank announces leadership team changes,PR Newswire
Oct-24-18,/C O R R E C T I O N -- Associated Banc-Corp/,PR Newswire
Oct-25-18,Associated Banc-Corp (ASB): Moving Average Crossover Alert,Zacks
Oct-29-18,"Associated Banc-Corp to Present at Bank of America Merrill Lynch Conference on November 5, 2018",PR Newswire
Nov-09-18,Associated Banc-Corp Issues Reminder Concerning Expiration of Warrants,PR Newswire
Nov-13-18,Do You Like Associated Banc-Corp (NYSE:ASB) At This P/E Ratio?,Simply Wall St.
Nov-20-18,Associated Bank announces leadership changes,PR Newswire
Dec-11-18,Associated Banc-Corp to buy Huntington National Bank's Wisconsin branches,American City Business Journals
Dec-11-18,Associated Banc-Corp to acquire Wisconsin banking operations of The Huntington National Bank,PR Newswire
Dec-12-18,Franklin (BEN) Rewards Shareholders With 13% Dividend Hike,Zacks
Dec-12-18,Huntington to Sell 32 Wisconsin Bank Branches to Associated,Zacks
Dec-14-18,What Does Associated Banc-Corps (NYSE:ASB) Share Price Indicate?,Simply Wall St.
Dec-17-18,"Associated Banc-Corp to Announce Fourth Quarter and Full Year 2018 Earnings and Hold Conference Call on January 24, 2019",PR Newswire
Dec-18-18,ServisFirst Bancshares (SFBS) Announces 36% Dividend Hike,Zacks
Dec-18-18,Is Associated Banc Corp (ASB) Going to Burn These Hedge Funds?,Insider Monkey
Dec-19-18,Associated Banc-Corp Increases Prime Rate,PR Newswire
Jan-17-19,Are Insiders Selling Associated Banc-Corp (NYSE:ASB) Stock?,Simply Wall St.
Jan-17-19,Associated Banc-Corp (ASB) Earnings Expected to Grow: Should You Buy?,Zacks
Jan-24-19,Associated Banc-Corp: 4Q Earnings Snapshot,Associated Press
Jan-24-19,"Associated Banc-Corp Reports Full Year 2018 Earnings of $1.89 Per Common Share, Earnings per share up 33% from the prior year",PR Newswire
Jan-25-19,Associated Bank expects to close Huntington deal in second quarter,American City Business Journals
Jan-25-19,"Associated Banc-Corp's (ASB) Q4 Earnings Beat, Revenues Rise",Zacks
Jan-25-19,Associated Banc-Corp (ASB) Q4 2018 Earnings Conference Call Transcript,Motley Fool
Jan-25-19,Edited Transcript of ASB earnings conference call or presentation 24-Jan-19 10:00pm GMT,Thomson Reuters StreetEvents
Feb-05-19,Associated Banc-Corp Announces Dividends,PR Newswire
Feb-06-19,"Associated Banc-Corp to Present at the 2019 KBW Winter Financial Services Symposium on February 14-15, 2019",PR Newswire
Feb-11-19,Are You Looking for a High-Growth Dividend Stock? Associated Banc-Corp (ASB) Could Be a Great Choice,Zacks
Feb-12-19,How Should Investors React To Associated Banc-Corps (NYSE:ASB) CEO Pay?,Simply Wall St.
