date,title,source
Oct-19-18,Kennedy Wilson aims to reopen renewed Kona Village Resort in 2021,American City Business Journals
Oct-29-18,Kennedy Wilson and AXA IM - Real Assets Complete 161 Million PRS Acquisition in Ireland,Business Wire
Oct-31-18,Kennedy-Wilson: 3Q Earnings Snapshot,Associated Press
Oct-31-18,Kennedy Wilson Reports Record Third Quarter 2018 Results,Business Wire
Oct-31-18,Kennedy Wilson Increases Dividend by 11% to $0.21 Per Common Share for Fourth Quarter 2018,Business Wire
Nov-06-18,"Research Report Identifies Exelon, La Jolla Pharmaceutical, Kennedy-Wilson, Fluidigm, Telefonica SA, and Cognex with Renewed Outlook  Fundamental Analysis, Calculating Forward Movement",GlobeNewswire
Nov-13-18,Edited Transcript of KW earnings conference call or presentation 1-Nov-18 2:00pm GMT,Thomson Reuters StreetEvents
Nov-13-18,Does Kennedy-Wilson Holdings Incs (NYSE:KW) CEO Salary Reflect Performance?,Simply Wall St.
