date,title,source
Oct-19-18,Hibbett Sports Stores Take Red Cross Donations During Hurricane Michael Aftermath,PR Newswire
Oct-29-18,Hibbett Sports acquires Memphis company in deal worth at least $88M,American City Business Journals
Oct-29-18,Memphis-based City Gear acquired by public company,American City Business Journals
Oct-29-18,Hibbett Sports to Acquire City Gear,Business Wire
Oct-30-18,"Memphis retailer found a niche, created a 'passionate customer base' and sold for $88M",American City Business Journals
Oct-30-18,Hibbett Sports shares leap after City Gear acquisition announced,MarketWatch
