date,title,source
Oct-23-18,National Commerce (NCOM) Q3 Earnings Miss Estimates,Zacks
Oct-23-18,National Commerce: 3Q Earnings Snapshot,Associated Press
Oct-23-18,National Commerce Corporation Announces Third Quarter 2018 Earnings,GlobeNewswire
Oct-24-18,Edited Transcript of NCOM earnings conference call or presentation 24-Oct-18 1:30pm GMT,Thomson Reuters StreetEvents
Oct-29-18,Edited Transcript of NCOM earnings conference call or presentation 24-Oct-18 1:30pm GMT,Thomson Reuters StreetEvents
Oct-30-18,Edited Transcript of NCOM earnings conference call or presentation 24-Oct-18 1:30pm GMT,Thomson Reuters StreetEvents
