date,title,source
Oct-18-18,"Why Activision Blizzard, United Rentals, and Gap Slumped Today",Motley Fool
Oct-18-18,Why Gap Inc. Shares Sunk Today,Motley Fool
Oct-18-18,Gap Hits 52-Week Low After JPMorgan Downgrade,Benzinga
Oct-18-18,Dump Gap Before the Holiday: JPMorgan,Investopedia
Oct-18-18,Gap Is Fraying at the Seams,Barrons.com
Oct-18-18,"Gap's stock sinks after J.P. Morgan turns bearish, citing sales weakness and margin pressure",MarketWatch
Oct-18-18,"JP Morgan downgrades Gap, saying it's not ready for the holidays and faces higher costs from tariffs",CNBC
