date,title,source
Oct-23-18,"Recent Analysis Shows Textainer Group, Frank's International N.V, Hudson, Diana Shipping inc, Cott, and Despegar Market Influences  Renewed Outlook, Key Drivers of Growth",GlobeNewswire
Nov-01-18,Cott (COT) Reports Next Week: Wall Street Expects Earnings Growth,Zacks
Nov-07-18,Cott Announces Appointment of Britta Bomhard and Steven Stanbrook to Board of Directors and Declaration of Dividend,PR Newswire
Nov-08-18,Cott (COT) Q3 Earnings Miss Estimates,Zacks
Nov-08-18,Cott: 3Q Earnings Snapshot,Associated Press
Nov-08-18,Cott Reports Third Quarter 2018 Results,CNW Group
