date,title,source
Oct-18-18,"1+1 = $16B: Harris Corp., L3 Technologies merger shakes up defense industry",American City Business Journals
Oct-19-18,"Report: Exploring Fundamental Drivers Behind Teleflex, Loral Space and Communications, MSCI, Mid-America Apartment Communities, Huntington Ingalls Industries, and Korea Electric Power  New Horizons, Emerging Trends, and Upcoming Developments",GlobeNewswire
Oct-26-18,PHOTO RELEASE--Two HII Executives Among Mississippis Top 25 Most Influential African-Americans for 2018,GlobeNewswire
Nov-02-18,A Scary New Missile Could Start a New Arms Race,Barrons.com
Nov-06-18,Huntington Ingalls Industries Awarded Contract Modification For First Columbia-Class Ballistic Missile Submarine,GlobeNewswire
Nov-06-18,Will Contract Wins Boost Huntington Ingalls (HII) Q3 Earnings?,Zacks
Nov-06-18,MEDIA ADVISORY--Huntington Ingalls Industries to Host Third Quarter Earnings Conference Call and Webcast on Thursday,GlobeNewswire
Nov-06-18,A Holistic Look At Huntington Ingalls Industries Inc (NYSE:HII),Simply Wall St.
