date,title,source
Oct-23-18,SkyWest (SKYW) Q3 Earnings Preview: Here's What to Look Out For,Zacks
Oct-25-18,SkyWest (SKYW) to Post Q3 Earnings: Is a Beat in Store?,Zacks
Oct-29-18,ArcBest (ARCB) to Post Q3 Earnings: Is a Beat in the Cards?,Zacks
Oct-30-18,SkyWest (SKYW) Q3 Earnings and Revenues Beat Estimates,Zacks
Oct-30-18,SkyWest: 3Q Earnings Snapshot,Associated Press
Oct-30-18,"SkyWest, Inc. Announces Third Quarter 2018 Profit",PR Newswire
Oct-31-18,Edited Transcript of SKYW earnings conference call or presentation 30-Oct-18 8:30pm GMT,Thomson Reuters StreetEvents
Oct-31-18,"Airline Stock Roundup: Q3 Earnings Beat at AAL, LUV & Others Amid Fuel Cost Woes",Zacks
Nov-01-18,Edited Transcript of SKYW earnings conference call or presentation 30-Oct-18 8:30pm GMT,Thomson Reuters StreetEvents
Nov-01-18,"SkyWest (SKYW) Q3 Earnings Surpass Estimates, Surge Y/Y",Zacks
Nov-05-18,"Report: Exploring Fundamental Drivers Behind SkyWest, Blueprint Medicines, HP, Hewlett Packard Enterprise, Cardinal Health, and The Medicines  New Horizons, Emerging Trends, and Upcoming Developments",GlobeNewswire
Nov-06-18,Southwest (LUV) Offers Numerous Options for Holiday Travel,Zacks
Nov-06-18,Should Value Investors Buy SkyWest (SKYW) Stock?,Zacks
