date,title,source
Oct-17-18,IBD 50 Growth Stocks To Watch,Investor's Business Daily
Oct-17-18,Icahn Takes Significant Stake in Dollar Tree,Investopedia
Oct-17-18,"Sturdy Comps, Better Pricing to Propel Dollar General's Sales",Zacks
Oct-18-18,"Heres a radical idea for stock picking: Weigh the price, not just the big theme",MarketWatch
Oct-19-18,"Heres a radical idea for stock picking: Weigh the price, not just the big theme",MarketWatch
Oct-22-18,"Factors of Influence in 2018, Key Indicators and Opportunity within Wix, Darden Restaurants, Dollar General, TOCAGEN INC, Burlington Stores, and McCormick & Company  New Research Emphasizes Economic Growth",GlobeNewswire
Oct-23-18,IBD 50 Growth Stocks To Watch,Investor's Business Daily
Oct-23-18,"The Zacks Analyst Blog Highlights: Target, Burlington, Dollar General, Tilly's and Urban Outfitters",Zacks
Oct-24-18,The Stock Market Correction Just Got A Lot Worse,Investor's Business Daily
Oct-24-18,IBD Stock Of The Day Burlington Stores Powers Toward Buy Point In Market Correction,Investor's Business Daily
Oct-24-18,Dow Jones Futures Rebound On Boeing Earnings: Watch These 5 Top Resilient Stocks,Investor's Business Daily
