date,title,source
Oct-17-18,"Total ties up with India's Adani for LNG plants, fuel retail",Reuters
Oct-17-18,Oil Biggies Spur Renewable Energy Game: Who Leads the Race?,Zacks
Oct-17-18,"Total ties up with India's Adani for LNG plants, fuel retail",Reuters
Oct-18-18,"The Zacks Analyst Blog Highlights: TOTAL, Royal Dutch, Equinor, BP and Exxon",Zacks
Oct-19-18,Shell to Vend Danish Assets for $1.9B to Optimize Portfolio,Zacks
Oct-22-18,[$$] Total CEO Confirms Decision to Attend Saudi 'Davos in the Desert',The Wall Street Journal
Oct-23-18,Total CEO Steps Into the Eye of Saudi Storm as Other Bosses Balk,Bloomberg
Oct-23-18,Davos In The Desert Could Yield $50B In Oil & Gas Deals,Oilprice.com
Oct-23-18,TOTAL (TOT) to Report Q3 Earnings: What's in the Cards?,Zacks
Oct-24-18,Total CEO Steps Into Eye of Saudi Storm as Other Bosses Balk,Bloomberg
Oct-26-18,TOTAL (TOT) Q3 Earnings & Revenues Beat on High Production,Zacks
Oct-26-18,[$$] Total 3Q Net Profit Jumped on Higher Oil Prices,The Wall Street Journal
Oct-29-18,This Cheap Big Oil Stock Looks Better by the Day,Motley Fool
Oct-30-18,"Oil & Gas Stock Roundup: TOTAL, ConocoPhillips & Valero's Q3",Zacks
Oct-31-18,"The Zacks Analyst Blog Highlights: TOTAL S.A., ConocoPhillips, Valero Energy, National Oilwell Varco and Denbury Resources",Zacks
Nov-01-18,"Investor Expectations to Drive Momentum within Valero Energy, Philip Morris International, Lennar, TOTAL S.A, Washington Prime Group, and Jack In The Box  Discovering Underlying Factors of Influence",GlobeNewswire
Nov-01-18,Exxon Mobil Has Something to Prove With Fridays Q3 Earnings Report,InvestorPlace
Nov-01-18,"Fuel Thieves Cause Mexico Supply Shortages for BP and Total, Sources Say",Bloomberg
Nov-05-18,Is Citigroup Inc. (C) A Good Stock To Buy Now?,Insider Monkey
Nov-05-18,Sempra Energy And Total S.A. Sign Memorandum Of Understanding For Development Of North American LNG Export Projects,PR Newswire
Nov-07-18,"Shell, Total Are Anomaly, Allowing Investors to Track Carbon",Bloomberg
Nov-07-18,"The Zacks Analyst Blog Highlights: Amgen, Intercontinental Exchange, TOTAL S.A., Royal Dutch Shell and Williams",Zacks
Nov-09-18,Should You Follow Billionaire Ken Fisher Into TOTAL S.A. (ADR) (TOT)?,Insider Monkey
Nov-15-18,"Papua New Guinea paves way for Exxon, Total LNG expansion",Reuters
Nov-15-18,Abu Dhabis Remarkable Energy Diversification,Oilprice.com
Nov-15-18,"Oil Prices Crash, But Oil Majors Arent Panicking",Oilprice.com
Nov-16-18,NVIDIA Corporation (NVDA) vs. Netflix Inc (NFLX): Here is What Hedge Funds Think,Insider Monkey
Nov-19-18,ExxonMobil Receives Warning From Turkey Before Thanksgiving,Zacks
Nov-20-18,Should We Worry About TOTAL SAs (EPA:FP) P/E Ratio?,Simply Wall St.
Nov-23-18,French union threatens refinery shutdown as pay strike extended,Reuters
Nov-27-18,Saudi Arabia Struggles As Oil Prices Crash,Oilprice.com
Nov-27-18,BP's Bid to Purchase TOTAL Stakes in Venezuela Rejected,Zacks
Nov-28-18,Brexit Drama Plagues France ETF,ETF Trends
Nov-29-18,Petrobras (PBR) to Vend 37 Oilfields for $823M to Trim Debt,Zacks
Dec-03-18,TOTAL's JV to Increase Polypropylene Output in South Korea,Zacks
Dec-03-18,"Eni to Boost Presence in Persian Gulf, Lower Africa Reliance",Zacks
Dec-03-18,"Oil Surges on US-China Trade Truce, OPEC Cut Speculation, Alberta Output Pledge",TheStreet.com
Dec-06-18,YPF Sociedad Ties Up with Petronas to Invest in Vaca Muerta,Zacks
Dec-06-18,"Petrobras Ups Investment, Divestment Goals in New 5-Year Plan",Zacks
Dec-07-18,A.P. Moller-Maersk A/S -- Moody's downgrades Maersk to Baa3; outlook stable,Moody's
Dec-10-18,TOTAL Launches New Fluids for Electric & Hybrid Vehicles,Zacks
Dec-10-18,Equinor's (EQNR) Troll Phase 3 Development Receives Nod,Zacks
Dec-10-18,"Market Trends Toward New Normal in General Dynamics, At Home Group, STMicroelectronics N.V., TOTAL S.A., EQT, and Hilton Worldwide  Emerging Consolidated Expectations, Analyst Ratings",GlobeNewswire
Dec-11-18,"Total offers 3.1 percent compensation increase, bonus to employees in France",Reuters
Dec-13-18,4 Days Left To Cash In On TOTAL S.A. (EPA:FP) Dividend,Simply Wall St.
Dec-14-18,TOTAL to Sell 4% Interest in Ichthys to Offset Cost Overruns,Zacks
Dec-18-18,"Oil & Gas Stock Roundup: TOTAL's Stake Sale, Suncor & Phillips 66's Capex & More",Zacks
Dec-18-18,"Iran Claims It Holds The Most Oil, Gas Reserves In The World",Oilprice.com
Dec-19-18,Tiny Qatar Flexes Its Muscles With Oil And Gas Investment Push,Oilprice.com
Dec-20-18,"Shell Revs up Bets on Renewables, Buys Stake in Cleantech",Zacks
Dec-20-18,Oil Continues Plunge to Fresh 16-Month Lows as Fed Move Ripples Through Markets,TheStreet.com
Dec-24-18,BP to Divest Three Wind Energy Plants in Texas to Ares,Zacks
Dec-24-18,Petrobras (PBR) Up 24% Over a Year: What's Going in its Favor?,Zacks
Dec-24-18,Oil Prices Drift Lower as US Drillers Add Rigs Amid OPEC Concern Over Cut Plan,TheStreet.com
Dec-27-18,Oil Majors Submit Interests to Explore Oil Blocks in Ghana,Zacks
Dec-27-18,"Shell Brings Prelude Facility Online, Ups Renewable Spending",Zacks
Dec-31-18,New Strong Sell Stocks for December 31st,Zacks
Jan-03-19,CNOOC (CEO) Brings Online the Egina Field Offshore Nigeria,Zacks
Jan-08-19,"Oil & Gas Stock Roundup: Elliott's QEP Bid, Transocean's Contract Win & More",Zacks
Jan-08-19,A Look At TOTAL S.A.s (EPA:FP) Exceptional Fundamentals,Simply Wall St.
Jan-09-19,"The Zacks Analyst Blog Highlights: QEP Resources, Transocean, Chevron, TOTAL and Eni",Zacks
Jan-15-19,Shell (RDS.A) Eyes Eneco Buyout to Boost Renewables Business,Zacks
Jan-16-19,EIA: OPEC Production To Fall By 1 Million Bpd This Year,Oilprice.com
Jan-17-19,Petrobras (PBR) Misses 2018 Production &amp; Divestment Targets,Zacks
Jan-25-19,Energy Majors Queuing Up for Stakes in Qatar's LNG Expansion,Zacks
Jan-29-19,Oil Prices Bounce On Venezuela Turmoil And Saudi Cuts,Oilprice.com
Jan-29-19,[$$] Total Makes Major Gas Discovery,The Wall Street Journal
Jan-31-19,Why TOTAL S.A.s (EPA:FP) Return On Capital Employed Is Impressive,Simply Wall St.
Feb-01-19,"The Top 5 Dividend Paying Oil Stocks for 2018 (BP, RDS-A, RDS-B, E, TOT, OXY)",Investopedia
Feb-04-19,TOTAL (TOT) to Report Q4 Earnings: What's in the Offing?,Zacks
Feb-06-19,TechnipFMC Wins EPCI Contract for Mero 1 Field From Petrobras,Zacks
Feb-07-19,"TOTAL's (TOT) Q4 Earnings Miss Estimates, Revenues Up Y/Y",Zacks
Feb-07-19,First Big Oil and Gas Discovery Made Offshore of South Africa,Bloomberg
Feb-08-19,What Is Keeping Oil Prices Subdued?,Oilprice.com
Feb-11-19,Total's Earnings Show an Oil Stock That Can Handle Any Price Environment,Motley Fool
Feb-12-19,Chevron CEO Vows to Work With U.S. to Remain in Venezuela,Bloomberg
Feb-12-19,Oil &amp; Gas Stock Roundup: BP and TOTAL Report Q4 Earnings,Zacks
Feb-12-19,Big Oils Big Issue With Embracing Big Energy,Bloomberg
Feb-13-19,Dare I Say It? Oil Majors Look Like an Attractive Buy,TheStreet.com
Feb-14-19,"Solar Star Funding, LLC -- Moody's announces completion of a periodic review of ratings of Solar Star Funding, LLC",Moody's
Feb-14-19,French energy giant Total to move UK trading jobs to Geneva - Sky News,Reuters
Feb-14-19,Big Oils Big Issue With Embracing Big Energy,Bloomberg
Feb-21-19,Big Oil Q4 Earnings Scorecard: Things Investors Need to Know,Zacks
Feb-22-19,"The Zacks Analyst Blog Highlights: ExxonMobil, Chevron, Royal Dutch, BP and TOTAL",Zacks
Feb-25-19,"The Top 5 Dividend Paying Oil Stocks for 2019 (BP, RDS-A, RDS-B, E, TOT, OXY)",Investopedia
Feb-28-19,Houston petrochemical JV breaks ground on another part of $3B expansion,American City Business Journals
Mar-01-19,3 High-Performing Large-Cap Stocks,GuruFocus.com
Mar-05-19,Pasadena chemical co. nabs $60M tax incentive,American City Business Journals
Mar-05-19,"Europe Stocks Open Flat as Automakers Fall, Total Jumps on Deal",Bloomberg
Mar-06-19,TOTAL (TOT) Expands LNG Operation in Russia Via Acquisitions,Zacks
Mar-07-19,TOTAL S.A. (EPA:FP): Is It A Smart Long Term Opportunity?,Simply Wall St.
Mar-08-19,"Solar Star Funding, LLC -- Moody's downgrades Solar Star to Baa2; rating outlook changed to negative",Moody's
Mar-12-19,"Oil &amp; Gas Stock Roundup: Big Oil's Strategy Updates, Conoco's Venezuela Win &amp; More",Zacks
Mar-12-19,Petrobras to Cut Costs and Rev Up Divestments to Deleverage,Zacks
Mar-13-19,Cheniere's Sabine Pass Train 5 to Come Online in August,Zacks
Mar-13-19,"The Zacks Analyst Blog Highlights: ExxonMobil, Chevron, ConocoPhillips, TOTAL and Canadian Natural Resources",Zacks
Mar-15-19,Shell Teams Up With Eneco to Build Two Dutch Wind Farms,Zacks
Mar-18-19,Petrobras' (PBR) Strategic Strides Make it a Compelling Buy,Zacks
Mar-20-19,Petrobras (PBR) Eyes $10B on Government Dispute Resolution,Zacks
Mar-20-19,ExxonMobil (XOM) to Increase Export From PNG LNG Plant,Zacks
Mar-21-19,Eni Discovers Oil and Gas Reserves in PL869 in North Sea,Zacks
Mar-22-19,"Dow 30 Stock Roundup: AAPL Refreshes Product Lineup, BA Wins $327M Navy Order",Zacks
Mar-25-19,Total Drills in World's Fastest Ocean Current in Africa Oil Search,Bloomberg
Mar-25-19,Comcast Corporation (CMCSA): Are Hedge Funds Right About This Stock?,Insider Monkey
Mar-26-19,Were Hedge Funds Right About Selling TOTAL S.A. (TOT)?,Insider Monkey
Mar-27-19,LNG Is Finally Taking Off In Egypt,Oilprice.com
Mar-27-19,Can We See Significant Institutional Ownership On The TOTAL S.A. (EPA:FP) Share Register?,Simply Wall St.
Mar-28-19,Can Energy Bring Peace To The Levant Basin?,Oilprice.com
Mar-29-19,Tullow Oil Finds 2nd Well Site in Orinduik Offshore Guyana,Zacks
Apr-02-19,Noble Energy Approves Alen Gas Project in Equatorial Guinea,Zacks
Apr-04-19,French energy giant Total invests $700M more in Houston LNG co.,American City Business Journals
Apr-05-19,TOTAL's (TOT) Unit to Expand Energy Storage Operation Via JV,Zacks
Apr-08-19,Petrobras Divestment Goals to Get Boost from $8.6B TAG Sale,Zacks
Apr-08-19,Shell (RDS.A) and Tokyo Gas LNG Deal Is Unique: Here's Why,Zacks
Apr-08-19,Oil & Gas Discoveries On The Rise As Oil Majors Dive In,Oilprice.com
Apr-08-19,Nigeria Boasts Oil Production Cost of $23 Per Barrel,Oilprice.com
Apr-08-19,"TOTAL, Tellurian Ink Deal Related to Driftwood LNG Project",Zacks
Apr-09-19,TOTAL Teams Up with Partners to Develop Papua LNG Project,Zacks
Apr-09-19,Tellurian (TELL) Starts Binding Open Season for PGAP Project,Zacks
Apr-09-19,"Oil &amp; Gas Stock Roundup: Concho Midstream Monetization, Noble Energy Project Approval",Zacks
Apr-09-19,"Total, partners reach initial agreement on $13 billion Papua LNG project",Reuters
Apr-09-19,Total and the State of Papua New Guinea Sign Gas Agreement for Papua LNG Project,Business Wire
Apr-09-19,"Total, partners sign long-awaited gas deal with Papua New Guinea",Reuters
Apr-10-19,TechnipFMC (FTI) Secures Subsea Contract for Lapa Field,Zacks
Apr-15-19,Top Ranked Income Stocks to Buy for April 15th,Zacks
Apr-15-19,Should Value Investors Buy TOTAL S.A. (TOT) Stock?,Zacks
Apr-16-19,Here's Why You Should Add TOTAL (TOT) to Your Portfolio,Zacks
Apr-16-19,TOT vs. XOM: Which Stock Should Value Investors Buy Now?,Zacks
Apr-17-19,Global Oil &amp; Gas Discoveries to Witness Major Uptick in 2019,Zacks
Apr-17-19,McDermott Up 12.6% as Cameron LNG Project Nears Completion,Zacks
Apr-17-19,5 Value Stocks With Amazingly Low EV/EBITDA Ratios to Own Now,Zacks
Apr-23-19,"Zacks.com featured expert Kevin Matras highlights: Quanta Services, Chaparral Energy, DXC Technology, TOTAL and Principal Financial",Zacks
Apr-24-19,Why Chevrons purchase of Anadarko wont lead to a flurry of oil deals,MarketWatch
Apr-24-19,Will Start-Up Production Boost TOTAL's (TOT) Q1 Earnings?,Zacks
Apr-26-19,Robust First-Quarter 2019 GDP Data,Zacks
Apr-26-19,Q1 GDP 3.2% -- Big Upside Surprise!,Zacks
Apr-26-19,"TOTAL (TOT) Q1 Earnings Miss Estimates, Volatile Price Hurts",Zacks
Apr-29-19,Why France's Total Is a Much Better Oil Play Than Exxon Mobil,TheStreet.com
Apr-29-19,"Covanta Holding (CVA) Q1 Earnings Top, Revenues Lag Estimates",Zacks
Apr-29-19,Anadarko Petroleum (APC) Beats Earnings Estimates in Q1,Zacks
May-01-19,"Oil &amp; Gas Stock Roundup: Chevron Tops Q1 Earnings, Exxon &amp; TOTAL Flops",Zacks
May-01-19,"Devon Energy (DVN) Q1 Earnings Beat Estimates, Guidance Up",Zacks
May-02-19,Murphy Oil (MUR) Beats Q1 Earnings and Revenue Estimates,Zacks
May-02-19,"The Zacks Analyst Blog Highlights: ExxonMobil, Chevron, TOTAL, Valero and Hess",Zacks
May-03-19,"Noble Energy (NBL) Q1 Loss Wider Than Expected, Revenues Beat",Zacks
May-06-19,"With Total Producing Results Like This, Why Is Its Stock Down 14%?",Motley Fool
May-06-19,Occidental says its only option was to boost cash piece of Anadarko bid,Reuters
May-06-19,"Investors are pushing the panic button on U.S.-China trade talks, analyst suggests",MarketWatch
May-06-19,Factbox: World's biggest LNG suppliers - Wood Mackenzie,Reuters
May-06-19,Why Tellurian Stock Slumped 15.5% in April,Motley Fool
May-06-19,Occidental Seeks Edge Over Chevron Bid by Adding More Cash,Bloomberg
May-06-19,"Autos, major oil companies tumble in Europe as U.S.-China trade talks up in the air",MarketWatch
May-07-19,"Ormat Technologies (ORA) Q1 Earnings Beat, Revenues Up Y/Y",Zacks
May-07-19,Profit from Day Trading on Gas-Related Stocks,Insider Monkey
May-07-19,"Anadarko Board Backs 'Superior' Occidental Deal, Says Chevron Can Make New Bid",TheStreet.com
May-07-19,TOTAL Inks $8.8B Deal With Occidental to Buy Anadarko's Assets,Zacks
May-07-19,Do You Know What TOTAL S.A.'s (EPA:FP) P/E Ratio Means?,Simply Wall St.
May-08-19,TOT vs. CVX: Which Stock Is the Better Value Option?,Zacks
May-08-19,Are Investors Undervaluing TOTAL S.A. (TOT) Right Now?,Zacks
May-09-19,"Its official: Anadarko cancels Chevron deal, enters into Oxy deal",American City Business Journals
May-09-19,The Battle for Anadarko: Will Chevron Outbid Occidental?,Zacks
May-09-19,Chevron ends Anadarko bidding war with Occidental,American City Business Journals
May-10-19,Deal of the Week: Anadarko deems Occidentals revised offer superior to Chevrons,American City Business Journals
May-14-19,Anadarko Petroleum Signs Long-Term SPA with JERA and CPC,Zacks
May-17-19,Is TOTAL (TOT) a Worthy Stock for Value Investors?,Zacks
May-17-19,Total CEO Eyed Anadarko Assets for a Year Before $8.8 Billion Deal,Bloomberg
May-22-19,"Cheniere Energy Partners, L.P. -- Moody's rates Blackstone CQP Holdco B1",Moody's
May-23-19,"EVs are the Road to the Future, Big Oil Hears the Message",Zacks
May-24-19,Are Investors Undervaluing TOTAL S.A. (TOT) Right Now?,Zacks
May-28-19,Oil Markets Are Stuck Once Again,Oilprice.com
May-28-19,5 Stocks to Buy on European Parliament Election Results,Zacks
May-29-19,"The Zacks Analyst Blog Highlights: L'Or??al, Kering, TOTAL, Deutsche Telekom and Davide",Zacks
May-30-19,Top Ranked Value Stocks to Buy for May 30th,Zacks
May-31-19,Petrobras' (PBR) Asset Sales Suspended by Court Rulings,Zacks
May-31-19,TOTAL S.A. (EPA:FP): Time For A Financial Health Check,Simply Wall St.
May-31-19,Deals of the day-Mergers and acquisitions,Reuters
Jun-03-19,TOTAL's (TOT) 2nd Solar Plant in Japan Becomes Operational,Zacks
Jun-04-19,Eni Hits Oil for the 5th Time in Block 15/06 Offshore Angola,Zacks
Jun-04-19,Top Ranked Value Stocks to Buy for June 4th,Zacks
Jun-04-19,Cheniere Energy Stock Up on Raised EBITDA &amp; DCF Forecast,Zacks
Jun-05-19,Marathon Oil (MRO) Exits Iraq to Further Streamline Portfolio,Zacks
Jun-05-19,"TOTAL Acquires Toshiba's LNG Assets, Expands US LNG Business",Zacks
Jun-05-19,Commodity firms push to meet new Papua New Guinea PM as he sets out agenda,Reuters
Jun-06-19,Why Trump's Tariff Threat on Mexico is Bad News for US Refiners,Zacks
Jun-06-19,Top Ranked Value Stocks to Buy for June 6th,Zacks
Jun-06-19,McDermott Scoops Up EPC Contract for Mozambique LNG Project,Zacks
Jun-06-19,Malaysia's Petronas set to supply Thailand's EGAT its first LNG imports,Reuters
Jun-07-19,"The Zacks Analyst Blog Highlights: Royal Dutch Shell, Valero Energy, Chevron, Exxon Mobil and TOTAL",Zacks
Jun-07-19,Shell (RDS.A) &amp; Gazprom Neft to Create West Siberian Oil JV,Zacks
Jun-07-19,Top Ranked Value Stocks to Buy for June 7th,Zacks
Jun-07-19,"UPDATE 1-European stocks head for best week in 2 months, Sanofi jumps",Reuters
Jun-07-19,European stocks recover after ECB disappointment,Reuters
Jun-07-19,Papua New Guinea appoints reformer to crucial petroleum portfolio,Reuters
Jun-10-19,Petrobras (PBR) Receives Court Approval for Asset Sales,Zacks
Jun-10-19,Ecopetrol (EC) Eyes $2.4B Cost Cuts in the 2019-2023 Period,Zacks
Jun-11-19,Phillips 66 Creates 2 JVs for Liberty &amp; Red Oak Pipelines,Zacks
Jun-12-19,Ketterer's Causeway International Value Fund Buys 5 Stocks in 1st Quarter,GuruFocus.com
Jun-13-19,Frances Total close to buying 30% in Adani Gas for more than $800 million - TOI,Reuters
Jun-13-19,Callon (CPE) Updates '19 Guidance on Midland Basin Divestment,Zacks
Jun-13-19,Chesapeake (CHK) Falls 16.2% Year to Date: What's Ahead?,Zacks
Jun-13-19,Petrobras (PBR) Ups 5-Year Investment &amp; Divestment Targets,Zacks
