date,title,source
Oct-17-18,Cypress Expands Collaboration With Arm to Deliver Full-Featured IoT Platform With Secure Device Management,Business Wire
Oct-22-18,Cypress Semiconductor (CY) Q3 Earnings: What to Expect?,Zacks
Oct-22-18,Cypress Instrument Cluster Solution Enables Yazaki to Bring Rich Graphics to Automotive Market,Business Wire
Oct-24-18,Here's Why Leading Semiconductor Stocks Plunged Today,Motley Fool
Oct-25-18,Cypress Semiconductor (CY) Q3 Earnings and Revenues Beat Estimates,Zacks
Oct-25-18,Cypress Semiconductor Hones Its Focus After Another Strong Quarter,Motley Fool
Oct-25-18,Cypress: 3Q Earnings Snapshot,Associated Press
Oct-25-18,Cypress Reports Third Quarter 2018 Results,Business Wire
Oct-25-18,Cypress Enters Into a Joint Venture With SK hynix system ic for NAND Flash Business,Business Wire
Oct-25-18,Cypress Semiconductor's Q3 Earnings Preview,Benzinga
Oct-26-18,Edited Transcript of CY earnings conference call or presentation 25-Oct-18 8:30pm GMT,Thomson Reuters StreetEvents
Oct-26-18,Cypress Semiconductor Corp (CY) Q3 2018 Earnings Conference Call Transcript,Motley Fool
Oct-29-18,Cypress Semiconductor (CY) Flat As Market Sinks: What You Should Know,Zacks
Oct-29-18,Cypress (CY) Beats Earnings and Revenue Estimates in Q3,Zacks
Oct-29-18,Is It Finally Time to Buy Cypress Semiconductor?,Motley Fool
Oct-30-18,Edited Transcript of CY earnings conference call or presentation 25-Oct-18 8:30pm GMT,Thomson Reuters StreetEvents
Nov-01-18,Cypress Semiconductor Is a New Breed of Chip Stock,Motley Fool
