date,title,source
Oct-19-18,Weyerhaeuser (WY) Q3 Earnings Preview: What to Expect,Zacks
Oct-22-18,Fed Chair Powell 'like a racehorse with blinkers on',CNBC Videos
Oct-22-18,Cramer: Fed Chair Powell is 'like a racehorse with blinke...,CNBC Videos
Oct-26-18,MarketPulse: Mohawk Slumps 20% as Housing-Sensitive Stocks Hammered,Investing.com
Oct-26-18,Weyerhaeuser Co (WY) Q3 2018 Earnings Conference Call Transcript,Motley Fool
Oct-26-18,Weyerhaeuser Stock Takes a Dive on Q3 Earnings Miss,InvestorPlace
Oct-26-18,Weyerhaeuser's (WY) Shares Down on Q3 Earnings & Sales Miss,Zacks
Oct-26-18,Can Weyerhaeuser Companys (NYSE:WY) ROE Continue To Surpass The Industry Average?,Simply Wall St.
Oct-26-18,Weyerhaeuser (WY) Lags Q3 Earnings and Revenue Estimates,Zacks
Oct-26-18,"[$$] Weyerhaeuser Third-Quarter Profit, Sales Miss Forecasts",The Wall Street Journal
Oct-26-18,Weyerhaeuser: 3Q Earnings Snapshot,Associated Press
Oct-26-18,Weyerhaeuser reports third quarter results,PR Newswire
Nov-01-18,"Investor Expectations to Drive Momentum within Valmont Industries, Tupperware Brands, Integrated Device Technology, WisdomTree Investments, Weyerhaeuser, and Wynn Resorts  Discovering Underlying Factors of Influence",GlobeNewswire
Nov-09-18,Weyerhaeuser Company declares dividend on common shares,PR Newswire
Nov-26-18,"International Paper's Segments Poised for Growth, Costs Rise",Zacks
Nov-27-18,[$$] Supreme Court Orders Review of Agencys Frog-Habitat Designation,The Wall Street Journal
Nov-27-18,[$$] Supreme Court Orders Review of Agency's Frog-Habitat Designation,The Wall Street Journal
Nov-27-18,Dusky gopher frog suffers setback in U.S. Supreme Court ruling,Reuters
Nov-27-18,U.S. high court revives timber company's fight over frog habitat,Reuters
Nov-30-18,Hedge Funds Are Crazy About Weyerhaeuser Company (NYSE:WY),Insider Monkey
Dec-10-18,Weyerhaeuser Co. (WY)Hedge Funds Are Snapping Up,Insider Monkey
