date,title,source
Oct-17-18,Who Are The Major Shareholders In Accuray Incorporated (NASDAQ:ARAY)?,Simply Wall St.
Oct-17-18,Accuray Showcases Radiation Therapy Innovations Designed to Improve What's Possible for Patients at ASTRO 2018,PR Newswire
Oct-18-18,"Factors of Influence in 2018, Key Indicators and Opportunity within Basic Energy Services, Scientific Games, The Michaels Companies, Accuray, Shake Shack, and NII  New Research Emphasizes Economic Growth",GlobeNewswire
Oct-30-18,"Accuray (ARAY) Reports Q1 Loss, Tops Revenue Estimates",Zacks
Oct-30-18,Accuray: Fiscal 1Q Earnings Snapshot,Associated Press
Oct-30-18,Accuray Reports Fiscal 2019 First Quarter Financial Results,PR Newswire
