date,title,source
Oct-17-18,Story on Zhoushan in talks with Exxon Mobil on ethylene plant withdrawn,Reuters
Oct-17-18,Honeywell to Equip Embraer Aircraft With HTF7500E Engine,Zacks
Oct-17-18,Honeywell (HON) to Post Q3 Earnings: Another Beat in Store?,Zacks
Oct-18-18,Day Ahead: Top 3 Things to Watch,Investing.com
Oct-18-18,Honeywell International Q3 Earnings Preview,Benzinga
Oct-19-18,[$$] SEC Opens Investigation Into Honeywells Asbestos Accounting,The Wall Street Journal
Oct-19-18,Stocks - S&P Closes Flat Amid Earnings-Fueled Rally in Consumer Staples,Investing.com
Oct-19-18,2 Stocks Move Friday,GuruFocus.com
Oct-19-18,"US STOCKS-S&P falls on interest rate, trade concerns; P&G lifts Dow",Reuters
Oct-19-18,"Dow Gains, S&P 500 and Nasdaq Slip; Ford Hits 52-Week Low",TheStreet.com
Oct-19-18,Edited Transcript of HON earnings conference call or presentation 19-Oct-18 12:30pm GMT,Thomson Reuters StreetEvents
Oct-19-18,SEC investigates Honeywell for asbetos-related accounting,Reuters
Oct-19-18,US STOCKS-S&P 500 index little changed despite strong P&G earnings,Reuters
Oct-19-18,U.S. SEC investigates Honeywell for asbetos-related accounting,Reuters
Oct-19-18,[$$] SEC Opens Investigation Into Honeywell's Accounting,The Wall Street Journal
Oct-19-18,Honeywell International Inc. (HON) Q3 2018 Earnings Conference Call Transcript,Motley Fool
Oct-19-18,Honeywell's stock turns lower after SEC accounting investigation disclosed,MarketWatch
Oct-19-18,"Honeywell says China growth slowing, tariffs to squeeze margins",Reuters
Oct-19-18,"Honeywell Rises on Earnings, Revenue Beat",TheStreet.com
Oct-19-18,Earnings Season At Full Throttle,Zacks
Oct-19-18,"Q3 Earnings Season Rolls On: Some Hits, Some Whiffs",Zacks
Oct-19-18,Honeywell says tariff-related costs to weigh on margins in 2019,Reuters
Oct-19-18,"Stocks- U.S. Futures Rise as Investors Wait for Earnings, Data",Investing.com
Oct-19-18,"Honeywell Earnings, Revenue beat in Q3",Investing.com
Oct-19-18,Top 5 Things to Know in the Market on Friday,Investing.com
Oct-19-18,"Honeywell profit beats on strong aero, warehouse automation sales",Reuters
Oct-19-18,Honeywell Results Tell a Positive Tale for These 4 Companies,Barrons.com
Oct-19-18,"Honeywell (HON) Beats on Q3 Earnings, Lowers 2018 EPS View",Zacks
Oct-19-18,Honeywell Gets a Chance to Own the Spotlight,Bloomberg
Oct-19-18,"PayPal, Tesla, Honeywell, P&G and DowDuPont - 5 Things You Must Know",TheStreet.com
Oct-19-18,"Honeywell's stock jumps after earnings beat expectations, sales meet",MarketWatch
Oct-19-18,"Honeywell Delivers Third-Quarter Reported Sales Growth Of 6%, Operating Cash Flow Growth Of 33%",PR Newswire
Oct-19-18,Honeywell beats on top and bottom line,CNBC Videos
Oct-22-18,"INVESTOR ALERT: Ademi & O'Reilly, LLP Investigates Whether Honeywell International Inc. (HON) Violated Securities Laws",PR Newswire
Oct-22-18,Edited Transcript of HON earnings conference call or presentation 19-Oct-18 12:30pm GMT,Thomson Reuters StreetEvents
Oct-22-18,SHAREHOLDER ALERT: Pomerantz Law Firm Investigates Claims On Behalf of Investors of Honeywell International Inc. - HON,PR Newswire
Oct-22-18,"SHAREHOLDER ALERT: Bronstein, Gewirtz & Grossman, LLC Announces Investigation of Honeywell International Inc. (HON)",GlobeNewswire
Oct-22-18,"Company News For Oct 22, 2018",Zacks
Oct-23-18,Resideo Technologies Set to Join S&P MidCap 400; Akorn to Join S&P SmallCap 600,PR Newswire
Oct-23-18,Honeywell Falls 3%,Investing.com
Oct-23-18,United Technologies Stock Needs Help From China,InvestorPlace
Oct-23-18,"Lockheed Martin Earnings, Revenue beat in Q3",Investing.com
Oct-23-18,Caterpillar Stock Tumbles 5% After Q3 Report Disappoints,Investing.com
Oct-23-18,"3M Shares Sink After Earnings, Revenue Miss in Q3",Investing.com
Oct-23-18,"United Technologies Earnings miss, Revenue beats In Q3",Investing.com
Oct-23-18,"New Research: Key Drivers of Growth for Flotek Industries, ServiceMaster Global, NOW, PPG Industries, Honeywell International, and Dean Foods  Factors of Influence, Major Initiatives and Sustained Production",GlobeNewswire
Oct-24-18,Honeywell Falls 3%,Investing.com
Oct-24-18,Buffett quote 'the perfect tagline for this earnings seas...,CNBC Videos
Oct-24-18,This Warren Buffett quote 'is the perfect tagline for thi...,CNBC Videos
Oct-24-18,Honeywell wins $1.04 billion U.S. defense contract -Pentagon,Reuters
Oct-24-18,"SHAREHOLDER ALERT: Levi & Korsinsky, LLP Notifies Investors of an Investigation Involving Possible Securities Fraud Violations by Certain Officers and Directors of Honeywell International Inc.",GlobeNewswire
Oct-24-18,Keep Caterpillars Q3 Report in Perspective (Even If Nobody Else Is),InvestorPlace
Oct-24-18,"Top Analyst Reports for Procter & Gamble, Philip Morris & Honeywell",Zacks
Oct-24-18,"General Dynamics Earnings beat, Revenue misses In Q3",Investing.com
Oct-24-18,Boeing Shares Surge After Earnings Beat; Raises Full-Year Guidance,Investing.com
Oct-25-18,Honeywell wins $1 billion U.S. Air Force contract,American City Business Journals
Oct-25-18,5 Things the Market Missed From Honeywell's Earnings,Motley Fool
Oct-25-18,"The Zacks Analyst Blog Highlights: Procter & Gamble, Philip Morris, Honeywell, Lockheed and Illumina",Zacks
Oct-26-18,Honeywell (HON) Stock Moves -0.96%: What You Should Know,Zacks
Oct-26-18,10 Super Safe Growth Stocks to Buy for Long-Lasting Dividends,InvestorPlace
Oct-26-18,Real Estate Notebook: Honeywell expands; WeWork to Interlock,American City Business Journals
Oct-29-18,Honeywell spinoff picks Austin for its HQ,American City Business Journals
Oct-29-18,Honeywell Rises 3%,Investing.com
Oct-29-18,"Honeywell Completes Spin-Off of Resideo Technologies, Inc.",PR Newswire
Oct-31-18,"Bragar Eagel & Squire, P.C. Announces That a Class Action Lawsuit Has Been Filed Against Honeywell International Inc. (HON) and Encourages HON Investors to Contact the Firm",GlobeNewswire
Oct-31-18,Honeywell To Present At Baird 2018 Global Industrial Conference,PR Newswire
Oct-31-18,"Pomerantz Law Firm Announces the Filing of a Class Action against Honeywell International, Inc. and Certain Officers  HON",GlobeNewswire
Oct-31-18,Some companies have all the luck. These are not those companies.,American City Business Journals
Oct-31-18,Sonatrach To Use Honeywell Technologies To Produce Cleaner-Burning High-Octane Fuels,PR Newswire
Oct-31-18,Arizona defense contractors secure $362M in combined Army contracts,American City Business Journals
Nov-01-18,Honeywell (HON) Stock Sinks As Market Gains: What You Should Know,Zacks
Nov-01-18,"CLASS ACTION UPDATE for PM and HON: Levi & Korsinsky, LLP Reminds Investors of Class Actions on Behalf of Shareholders",GlobeNewswire
Nov-01-18,"Lifshitz & Miller LLP Announces Investigation of Corium International, Inc., Dragon Victory International Limited, Honeywell International Inc., Hortonworks, Inc., Idaho Independent Bank, L3 Technologies, Inc., MBT Financial Corp., Nevro Corp., and Ormat Technologies, Inc.",PR Newswire
Nov-01-18,Scott+Scott Attorneys at Law LLP Alerts Investors to Securities Class Action Against Honeywell International Inc. (HON),Business Wire
Nov-01-18,"IMPORTANT INVESTOR ALERT: The Schall Law Firm Announces the Filing of a Class Action Lawsuit Against Honeywell International Inc. and Encourages Investors with Losses in Excess of $100,000 to Contact the Firm",Business Wire
Nov-02-18,"The Klein Law Firm Reminds Investors of Class Actions on Behalf of Shareholders of TRVN, GOOG, HON and NKTR",GlobeNewswire
Nov-02-18,"HONEYWELL INVESTOR ALERT: Faruqi & Faruqi, LLP Encourages Investors Who Suffered Losses Exceeding $100,000 Investing In Honeywell International, Inc. To Contact The Firm",PR Newswire
Nov-02-18,"Parsons reorganizes, head of federal business named COO",American City Business Journals
Nov-02-18,INVESTOR ALERT: Law Offices of Howard G. Smith Announces Investigation on Behalf of Honeywell International Inc. Investors (HON),Business Wire
Nov-02-18,"IMPORTANT INVESTOR REMINDER: The Schall Law Firm Announces the Filing of a Class Action Lawsuit Against Honeywell International Inc. and Encourages Investors with Losses in Excess of $100,000 to Contact the Firm",Business Wire
Nov-02-18,"SHAREHOLDER ALERT - Bronstein, Gewirtz & Grossman, LLC Notifies Investors of Class Action Against Honeywell International Inc. (HON) & Lead Plaintiff Deadline: January 2, 2019",ACCESSWIRE
Nov-05-18,SHAREHOLDER ALERT: TRCO MCHP TGTX HAS ADNT TRVN HTHT SFIX HON: The Law Offices of Vincent Wong Reminds Investors of Important Class Action Deadlines,GlobeNewswire
Nov-05-18,"Kessler Topaz Meltzer & Check, LLP Announces a Securities Fraud Class Action Filed Against Honeywell International Inc.",GlobeNewswire
Nov-05-18,CLASS ACTION ALERT: Brower Piven Notifies Investors of Class Action Lawsuit And Encourages Those Who Have Significant Losses From Investment In Honeywell International Inc. (NYSE: HON) To Contact Brower Piven Before The Lead Plaintiff Deadline,GlobeNewswire
Nov-05-18,"INVESTOR ACTION REMINDER: The Schall Law Firm Announces the Filing of a Class Action Lawsuit Against Honeywell International Inc. and Encourages Investors with Losses in Excess of $100,000 to Contact the Firm",GlobeNewswire
Nov-05-18,Time to Buy GE Stock After the Earnings Dump?,InvestorPlace
Nov-06-18,"The Klein Law Firm Reminds Investors of Class Actions on Behalf of Shareholders of TRVN, HON, OZK and NKTR",GlobeNewswire
Nov-06-18,HON LOSS NOTICE: Rosen Law Firm Announces Filing of Securities Class Action Lawsuit Against Honeywell International Inc.; Important Deadline - HON,PR Newswire
Nov-06-18,"IMPORTANT INVESTOR ALERT: The Schall Law Firm Announces the Filing of a Class Action Lawsuit Against Honeywell International Inc. and Encourages Investors with Losses in Excess of $100,000 to Contact the Firm",ACCESSWIRE
Nov-06-18,"Kessler Topaz Meltzer & Check, LLP: Securities Fraud Class Action Filed Against Honeywell International Inc. - HON",PR Newswire
Nov-06-18,"HONEYWELL INVESTOR ALERT: Faruqi & Faruqi, LLP Encourages Investors Who Suffered Losses Exceeding $100,000 Investing In Honeywell International, Inc. To Contact The Firm",Business Wire
Nov-06-18,"SHAREHOLDER ALERT: Bronstein, Gewirtz & Grossman, LLC Notifies Investors of Class Action Against Honeywell International Inc. (HON) & Lead Plaintiff Deadline: January 2, 2019",ACCESSWIRE
Nov-06-18,Honeywell Modernizes Century-Old German Refinery with Innovative Service Model to Share Operational Responsibility,PR Newswire
Nov-07-18,"SHAREHOLDER ALERT: Pomerantz Law Firm Reminds Shareholders with Losses on their Investment in Honeywell International, Inc. of Class Action Lawsuit and Upcoming Deadline - HON",PR Newswire
Nov-07-18,"CLASS ACTION UPDATE for HON, SYF and RYAAY: Levi & Korsinsky, LLP Reminds Investors of Class Actions on Behalf of Shareholders",GlobeNewswire
Nov-07-18,"IMPORTANT INVESTOR NOTICE: The Schall Law Firm Announces the Filing of a Class Action Lawsuit Against Honeywell International Inc. and Encourages Investors with Losses in Excess of $100,000 to Contact the Firm",ACCESSWIRE
Nov-07-18,"Kessler Topaz Meltzer & Check, LLP Announces Investor Securities Fraud Class Action Lawsuit Filed against Honeywell International Inc.",Business Wire
Nov-07-18,Why Honeywell International Slumped 13% in October,Motley Fool
Nov-07-18,Dont Take a Chance on General Electric Stock Yet,InvestorPlace
Nov-07-18,Wanhua To Use Honeywell Connected Plant Technology,PR Newswire
Nov-08-18,"Honeywell Aerospace to move manufacturing, engineering out of ABQ",American City Business Journals
Nov-08-18,"The Klein Law Firm Reminds Investors of Class Actions on Behalf of Shareholders of COCP, SFIX, CWH, HON, NKTR and SYF",GlobeNewswire
Nov-08-18,"INVESTIGATION ALERT: The Schall Law Firm Announces it is Investigating Claims Against Honeywell International Inc. and Encourages Investors with Losses in Excess of $100,000 to Contact the Firm",Business Wire
Nov-08-18,"LEAD PLAINTIFF DEADLINE ALERT: Faruqi & Faruqi, LLP Encourages Investors Who Suffered Losses Exceeding $100,000 In Honeywell International, Inc. To Contact The Firm",PR Newswire
Nov-08-18,SHAREHOLDER ALERT: MCHP COCP ABBV JT TRVN SFIX CWH HON ALGN NKTR SYF: The Law Offices of Vincent Wong Reminds Investors of Important Class Action Deadlines,GlobeNewswire
Nov-08-18,ALERT: Pawar Law Group Announces a Securities Class Action Lawsuit Against Honeywell International Inc. - HON,ACCESSWIRE
Nov-08-18,"KESSLER TOPAZ MELTZER & CHECK, LLP - Reminds Investors of Securities Fraud Class Action Lawsuit Against HONEYWELL INTERNATIONAL INC. - HON",ACCESSWIRE
Nov-08-18,"SHAREHOLDER ALERT: Bronstein, Gewirtz & Grossman, LLC Reminds Investors of Class Action Against Honeywell International Inc. (HON) & Lead Plaintiff Deadline: January 2, 2019",ACCESSWIRE
Nov-13-18,"Resideo Rises on Solid Quarterly Results, Reaffirms Guidance",TheStreet.com
Nov-13-18,Resideo Announces Third Quarter 2018 Financial Results,PR Newswire
Nov-13-18,"INVESTOR ACTION ALERT: The Schall Law Firm Announces the Filing of a Class Action Lawsuit Against Honeywell International Inc. and Encourages Investors with Losses in Excess of $100,000 to Contact the Firm",ACCESSWIRE
Nov-13-18,"CLASS ACTION UPDATE for ACHC, HON and DY: Levi & Korsinsky, LLP Reminds Investors of Class Actions on Behalf of Shareholders",GlobeNewswire
Nov-13-18,"SHAREHOLDER ALERT - Bronstein, Gewirtz & Grossman, LLC Reminds Investors of Class Action Against Honeywell International Inc. (HON) & Lead Plaintiff Deadline: January 2, 2019",ACCESSWIRE
Nov-13-18,New Honeywell Aerospace Safety Technology Will Reduce Costly And Sometimes Fatal Runway Collisions,PR Newswire
Nov-14-18,Smart Home Firm Resideo Technologies Pops On Earnings Report,Investor's Business Daily
Nov-14-18,SHAREHOLDER ALERT: APOG COCP COST TRVN HON DY ALGN AQUA SONS TSRO: The Law Offices of Vincent Wong Reminds Investors of Important Class Action Deadlines,GlobeNewswire
Nov-14-18,SHAREHOLDER ALERT: Pawar Law Group Announces a Securities Class Action Lawsuit Against Honeywell International Inc.  HON,ACCESSWIRE
Nov-14-18,Smart Home Firm Resideo Technologies Pops On Earnings Report,Investor's Business Daily
Nov-14-18,Honeywell Finishes Initial Test of SURF IA Safety Technology,Zacks
Nov-14-18,Honeywell Named A Global Reseller Of Inmarsat's GX Aviation In-Flight Broadband Solution,PR Newswire
Nov-15-18,"SHAREHOLDER ACTION REMINDER: The Schall Law Firm Announces the Filing of a Class Action Lawsuit Against Honeywell International Inc. and Encourages Investors with Losses in Excess of $100,000 to Contact the Firm",GlobeNewswire
Nov-15-18,These two big catalysts could kick the sluggish bull market in stocks into high gear,MarketWatch
Nov-15-18,"KESSLER TOPAZ MELTZER & CHECK, LLP - Important Deadline Reminder for Honeywell International Inc. Investors",GlobeNewswire
Nov-15-18,Honeywell Becomes Global Reseller of Inmarsat's GX Aviation,Zacks
Nov-19-18,Honeywell (HON) Stock Moves -0.73%: What You Should Know,Zacks
Nov-19-18,"INVESTOR ACTION DEADLINE: The Schall Law Firm Announces the Filing of a Class Action Lawsuit Against Honeywell International Inc. and Encourages Investors with Losses in Excess of $100,000 to Contact the Firm",ACCESSWIRE
Nov-20-18,HON ALERT: Rosen Law Firm Reminds Honeywell International Inc. Investors of Important Deadline in Class Action Seeking Investor Losses  HON,Business Wire
Nov-20-18,CLASS ACTION ALERT: Brower Piven Notifies Investors of Class Action Lawsuit And Encourages Those Who Have Significant Losses From Investment In Honeywell International Inc. (NYSE: HON) To Contact Brower Piven Before The Lead Plaintiff Deadline,GlobeNewswire
Nov-20-18,"INVESTOR ACTION NOTICE: The Schall Law Firm Announces the Filing of a Class Action Lawsuit Against Honeywell International Inc. and Encourages Investors with Losses in Excess of $100,000 to Contact the Firm",GlobeNewswire
Nov-20-18,SHAREHOLDER ALERT: ABBV JT CWH HON DY RYAAY: The Law Offices of Vincent Wong Reminds Investors of Important Class Action Deadlines,GlobeNewswire
Nov-20-18,"SHAREHOLDER ALERT - Bronstein, Gewirtz & Grossman, LLC Reminds Investors of Class Action Against Honeywell International Inc. (HON) & Lead Plaintiff Deadline: January 2, 2019",ACCESSWIRE
Nov-21-18,"IMPORTANT SHAREHOLDER ALERT: The Schall Law Firm Announces the Filing of a Class Action Lawsuit Against Honeywell International Inc. and Encourages Investors with Losses in Excess of $100,000 to Contact the Firm",ACCESSWIRE
Nov-21-18,"SHAREHOLDER ALERT: Pomerantz Law Firm Reminds Shareholders with Losses on their Investment in Honeywell International, Inc. of Class Action Lawsuit and Upcoming Deadline  HON",ACCESSWIRE
Nov-21-18,SHAREHOLDER ALERT: Pawar Law Group Announces a Securities Class Action Lawsuit Against Honeywell International Inc.  HON,ACCESSWIRE
Nov-21-18,"CLASS ACTION UPDATE for HON, DY and ALGN: Levi & Korsinsky, LLP Reminds Investors of Class Actions on Behalf of Shareholders",GlobeNewswire
Nov-21-18,What Honeywell International Incs (NYSE:HON) ROE Can Tell Us,Simply Wall St.
Nov-21-18,"Kessler Topaz Meltzer & Check, LLP Reminds Honeywell International Inc. Investors of Important Deadline in Securities Fraud Class Action Lawsuit",GlobeNewswire
Nov-23-18,"SHAREHOLDER ALERT: Pomerantz Law Firm Reminds Shareholders with Losses on their Investment in Honeywell International, Inc. of Class Action Lawsuit and Upcoming Deadline  HON",GlobeNewswire
Nov-23-18,SHAREHOLDER ALERT: APOG TGTX ALNY ACHC JT HON DY ALGN RYAAY MGI: The Law Offices of Vincent Wong Reminds Investors of Important Class Action Deadlines,GlobeNewswire
Nov-26-18,"SHAREHOLDER ALERT: Pomerantz Law Firm Reminds Shareholders with Losses on their Investment in Honeywell International, Inc. of Class Action Lawsuit and Upcoming Deadline  HON",ACCESSWIRE
Nov-26-18,"CLASS ACTION UPDATE for HON, IGCC, FIT and SYF: Levi & Korsinsky, LLP Reminds Investors of Class Actions on Behalf of Shareholders",GlobeNewswire
Nov-26-18,3 Reasons Why the Volatility in GE Stock Is Overdone,InvestorPlace
Nov-27-18,Honeywell (HON) Stock Sinks As Market Gains: What You Should Know,Zacks
Nov-27-18,Here Are 3 Key Numbers From United Technologies' Breakup Plan,Investor's Business Daily
Nov-27-18,"After Cutting Guidance, Expect Shares Of Honeywell To Keep Falling",Benzinga
Nov-27-18,SHAREHOLDER ALERT: APOG TGTX JT COST HON DY RYAAY MGI PPDF: The Law Offices of Vincent Wong Reminds Investors of Important Class Action Deadlines,GlobeNewswire
Nov-27-18,SHAREHOLDER ALERT: Pawar Law Group Announces a Securities Class Action Lawsuit Against Honeywell International Inc. - HON,ACCESSWIRE
Nov-27-18,"INVESTOR ACTION REMINDER: The Schall Law Firm Announces the Filing of a Class Action Lawsuit Against Honeywell International Inc. and Encourages Investors with Losses in Excess of $100,000 to Contact the Firm",GlobeNewswire
Nov-28-18,"The Klein Law Firm Reminds Investors of Class Actions on Behalf of Shareholders of APOG, TRVN, CWH, HON and DY",GlobeNewswire
Nov-29-18,"CLASS ACTION UPDATE for JT, HTHT and HON: Levi & Korsinsky, LLP Reminds Investors of Class Actions on Behalf of Shareholders",GlobeNewswire
Nov-29-18,Honeywell bringing HQ to Charlotte following incentives bill passage,American City Business Journals
Nov-29-18,Scott+Scott Attorneys at Law LLP Reminds Investors of Securities Class Action Against Honeywell International Inc. (HON) and Lead Plaintiff Deadline of January 2,PR Newswire
Nov-29-18,"Global Video Surveillance market to Reach $105.99 billion by 2026 and How New Technology will Play Key Role; DirectView Holdings, Inc (OTC: DIRV), FLIR Systems, Honeywell and Panasonic Corporation",GlobeNewswire
Dec-03-18,Mario Gabelli Comments on Honeywell International,GuruFocus.com
Dec-03-18,"Gov. Cooper on Honeywell HQ, tech jobs and Carolina Panthers",American City Business Journals
Dec-03-18,Traders and Investors Can Approach the Long Side of Honeywell - Risk Defined,TheStreet.com
Dec-03-18,"CLASS ACTION UPDATE for JT, HTHT and HON: Levi & Korsinsky, LLP Reminds Investors of Class Actions on Behalf of Shareholders",GlobeNewswire
Dec-03-18,Honeywell Rises 3%,Investing.com
Dec-03-18,"Bragar Eagel & Squire, P.C. Reminds Investors That Class Action Lawsuits Have Been Filed Against Jianpu, Nektar, and Honeywell and Encourages Investors to Contact the Firm",GlobeNewswire
Dec-03-18,"Detailed Research: Economic Perspectives on Honeywell International, Tabula Rasa Healthcare, El Pollo Loco, Acceleron Pharma, vTv Therapeutics, and 22nd Century Group  What Drives Growth in Today's Competitive Landscape",GlobeNewswire
Dec-04-18,HON DEADLINE LOSS NOTICE: Rosen Law Firm Announces Filing of Securities Class Action Lawsuit Against Honeywell International Inc.; Important Deadline - HON,PR Newswire
Dec-04-18,Honeywell Falls 3%,Investing.com
Dec-04-18,SHAREHOLDER ALERT: COST HON IGCC ALGN MGI TX MAR CMCM: The Law Offices of Vincent Wong Reminds Investors of Important Class Action Deadlines,GlobeNewswire
Dec-04-18,Honeywell International Inc. (NYSE:HON): Are Hedge Funds Right About This Stock?,Insider Monkey
Dec-04-18,"Kessler Topaz Meltzer & Check, LLP Reminds Investors of Securities Fraud Class Action Lawsuit Filed Against Honeywell International Inc.  HON",GlobeNewswire
Dec-04-18,"INVESTOR NOTICE ALERT: The Schall Law Firm Announces the Filing of a Class Action Lawsuit Against Honeywell International Inc. and Encourages Investors with Losses in Excess of $100,000 to Contact the Firm",GlobeNewswire
Dec-06-18,"CLASS ACTION UPDATE for HON, EIX, ATUS and CMCM: Levi & Korsinsky, LLP Reminds Investors of Class Actions on Behalf of Shareholders",GlobeNewswire
Dec-06-18,Honeywell Falls 3%,Investing.com
Dec-06-18,"INVESTOR ACTION NOTICE: The Schall Law Firm Announces the Filing of a Class Action Lawsuit Against Honeywell International Inc. and Encourages Investors with Losses in Excess of $100,000 to Contact the Firm",ACCESSWIRE
Dec-06-18,10 Super Safe Growth Stocks for Long-Lasting Dividends,InvestorPlace
Dec-06-18,3 Things Zebra Technologies' CEO Wants You to Know,Motley Fool
Dec-06-18,State Oil Company of Azerbaijan Selects Honeywell for Modernization Program,PR Newswire
Dec-06-18,"SHAREHOLDER ALERT -- Bronstein, Gewirtz & Grossman, LLC Reminds Investors of Class Action Against Honeywell International Inc. (HON) & Lead Plaintiff Deadline: January 2, 2019",GlobeNewswire
Dec-10-18,"CLASS ACTION UPDATE for HON, FIT and SYF: Levi & Korsinsky, LLP Reminds Investors of Class Actions on Behalf of Shareholders",GlobeNewswire
Dec-10-18,"LEAD PLAINTIFF DEADLINE ALERT: Faruqi & Faruqi, LLP Encourages Investors Who Suffered Losses Exceeding $100,000 In Honeywell International, Inc. To Contact The Firm",GlobeNewswire
Dec-10-18,"SHAREHOLDER ACTION ALERT: The Schall Law Firm Announces the Filing of a Class Action Lawsuit Against Honeywell International Inc. and Encourages Investors with Losses in Excess of $100,000 to Contact the Firm",ACCESSWIRE
Dec-10-18,SHAREHOLDER ALERT: TRVN GOOG GOOGL CWH HON FIT SYF RYAAY TSRO MGI: The Law Offices of Vincent Wong Reminds Investors of Important Class Action Deadlines,GlobeNewswire
Dec-10-18,Pawar Law Group Announces a Securities Class Action Lawsuit Against Honeywell International Inc. - HON,ACCESSWIRE
Dec-10-18,"Kessler Topaz Meltzer & Check, LLP - Important Deadline Reminder for Honeywell International Inc. Investors",GlobeNewswire
Dec-10-18,Swissport International To Improve Ground Operations At Airports With Honeywell Connected Service,PR Newswire
