date,title,source
Oct-17-18,Western Union receives patent for debt tracker that can connect to social networks,American City Business Journals
Oct-22-18,Western Union Advances Consumer Bill Pay Cross Border,Business Wire
Oct-23-18,"3 Big Stock Charts for Tuesday: Western Union, Praxair and Activision Blizzard",InvestorPlace
Oct-25-18,"New Research: Key Drivers of Growth for Watts Water Technologies, The Western Union, Take-Two Interactive Software, Bassett Furniture Industries, Twilio, and Cisco  Factors of Influence, Major Initiatives and Sustained Production",GlobeNewswire
Oct-31-18,Western Union CEO: Why we're partnering with Amazon on new international payment option,American City Business Journals
Oct-31-18,Why All the FANG Stocks Jumped Today,Motley Fool
Oct-31-18,"Business Services Stocks' Q3 Earnings on Nov 1: IT, SRCL, WU",Zacks
Oct-31-18,Western Union (WU) Q3 Earnings: What's in the Cards?,Zacks
Oct-31-18,Western Union and Amazon to Launch New Way to Pay,Business Wire
Nov-01-18,The Western Union Company (WU) Q3 2018 Earnings Conference Call Transcript,Motley Fool
Nov-01-18,Western Union (WU) Tops Q3 Earnings Estimates,Zacks
Nov-01-18,Western Union: 3Q Earnings Snapshot,Associated Press
Nov-01-18,Western Union Reports Third Quarter Results,Business Wire
Nov-07-18,CORRECTING and REPLACING Western Union Named Official Foreign Exchange Partner of PGA Australia,Business Wire
Nov-07-18,Western Union Powers Safaricoms M-PESA Mobile Wallet to Send Money Globally,Business Wire
Nov-09-18,Edited Transcript of WU earnings conference call or presentation 1-Nov-18 8:30pm GMT,Thomson Reuters StreetEvents
Nov-13-18,Western Union and Hong Kongs Tap & Go Collaborate for Online Global Money Transfers,Business Wire
Nov-14-18,"Western Union, HKT Team Up for Payment Services in Hong Kong",Zacks
Nov-15-18,MoneyGram Payment Systems Worldwide Inc. -- Moody's downgrades MoneyGram's CFR to B2; outlook negative,Moody's
Nov-26-18,Western Union Expands with Online International Money Transfers in Malaysia,Business Wire
Nov-27-18,Does The Western Union Companys (NYSE:WU) CEO Salary Reflect Performance?,Simply Wall St.
Nov-27-18,Don't Expect a Turnaround at Western Union Yet,GuruFocus.com
Nov-27-18,Western Union Introduces Online Money Transfer in Malaysia,Zacks
Nov-28-18,MoneyGram's Digital Platform Expansion to Augment Growth,Zacks
Nov-30-18,"This Stock Is A Real Cash Machine, Even In Digital-Payments Era",Investor's Business Daily
Dec-04-18,"Detailed Research: Economic Perspectives on The Western Union, Allscripts Healthcare Solutions, Terreno Realty, UnitedHealth Group, LendingClub, and W.P. Carey  What Drives Growth in Today's Competitive Landscape",GlobeNewswire
Dec-04-18,Western Union Completes Relocation to New Global Headquarters in Denver,Business Wire
Dec-06-18,Western Union Announces $0.19 Quarterly Dividend,Business Wire
Dec-06-18,7 Reasons Why Western Union is a Must Add to Your Portfolio,Zacks
Dec-12-18,Should You Ignore the Fall in Western Union's (WU) Stock?,Zacks
Dec-13-18,Western Union Works with TerraPay to Expand Payout Options to Millions of Mobile Wallets,Business Wire
Dec-14-18,"Abrams Capital Managements Return, AUM and Holdings",Insider Monkey
Dec-14-18,Western Union (WU) Collaborates to Enhance Digital Platform,Zacks
Dec-14-18,Western Union and Chinas JD Digits Join Forces for Global Digital Money Movement,Business Wire
Dec-17-18,Western Union Collaborates to Ease Money Transfer in China,Zacks
Dec-17-18,"In a world of borders, Western Unions strategy is still immigrant-first",Quartz
Dec-18-18,Western Union Digital Expands in Asia: Mobile App Now Live in Singapore,Business Wire
Dec-19-18,Western Union Unveils E-App in Singapore for Money Clearance,Zacks
