date,title,source
Nov-14-18,Gritstone Oncology Reports Third Quarter 2018 Financial Results and Recent Business Highlights,GlobeNewswire
Nov-26-18,Here's how much better insiders have profited from this year's IPO boom,American City Business Journals
Dec-10-18,Gritstone Oncology Advances Solid Tumor Bispecific Antibody Program into Lead Optimization Phase; Appoints Vice President of Antibody Therapeutics to Spearhead,GlobeNewswire
Dec-13-18,"Targeting 'bubble baby' disease, this gene therapy company is planting a flag in the East Bay",American City Business Journals
Dec-17-18,"Gritstone Oncology Announces Publication in Nature Biotechnology of Neoantigen Identification Capabilities of its Artificial Intelligence Platform, EDGE",GlobeNewswire
