date,title,source
Nov-08-18,Caladrius Biosciences Reports 2018 Third Quarter Financial Results,GlobeNewswire
Nov-08-18,Caladrius Biosciences Appoints Cynthia Schwalm to Board of Directors,GlobeNewswire
Nov-09-18,Caladrius Biosciences to Participate in the Inv$tival Showcase in Partnership with Jefferies and the Jefferies 2018 London Healthcare Conference,GlobeNewswire
Nov-15-18,"Recent Analysis Shows Escalade, Caladrius Biosciences, LightInTheBox Holding Co., Vishay Intertechnology, Ceridian HCM Holding, and Avista Market Influences  Renewed Outlook, Key Drivers of Growth",GlobeNewswire
Jan-07-19,Caladrius Biosciences to Participate in Upcoming January Conferences,GlobeNewswire
Jan-23-19,What Makes Caladrius Biosciences (CLBS) a New Buy Stock,Zacks
Feb-05-19,Caladrius Biosciences to Present at Upcoming February Conferences,GlobeNewswire
Feb-13-19,Caladrius Biosciences Reports Top-Line Data for the Phase 2a Sanford Project: T-Rex Trial of CLBS03 for Recent Onset Type 1 Diabetes,GlobeNewswire
Mar-11-19,"What Kind Of Shareholder Appears On The Caladrius Biosciences, Inc.s (NASDAQ:CLBS) Shareholder Register?",Simply Wall St.
Mar-11-19,Caladrius Biosciences to Present at the Alliance for Regenerative Medicine 7th Annual Cell & Gene Therapy Investor Day,GlobeNewswire
Mar-13-19,"Caladrius Biosciences to Host 2018 Fourth Quarter and Year End Financial Results Conference Call on Thursday, March 14, 2019 at 4:30 p.m. Eastern Time",GlobeNewswire
Mar-14-19,Caladrius Biosciences Reports 2018 Fourth Quarter and Year End Financial Results,ACCESSWIRE
Mar-14-19,Caladrius Biosciences announces Purchase Agreement with Lincoln Park Capital for up to $26 million,ACCESSWIRE
