date,title,source
Oct-23-18,Calculating The Fair Value Of RPM International Inc (NYSE:RPM),Simply Wall St.
Oct-31-18,"New Research: Key Drivers of Growth for Celgene, Briggs & Stratton, NewJersey Resources, RPM International, Anixter International, and Sensient Technologies  Factors of Influence, Major Initiatives and Sustained Production",GlobeNewswire
Nov-02-18,RPM International (RPM) Up 3.3% Since Last Earnings Report: Can It Continue?,Zacks
Nov-09-18,"RPM Banks on Buyout & Expansion Plans, Costs on the Rise",Zacks
Nov-27-18,RPM Announces Completion of Redemption of Its 2.25% Convertible Senior Notes Due 2020,Business Wire
Nov-28-18,RPM International Hosts Investor Day,Business Wire
Nov-29-18,RPM International Inc (NYSE:RPM): Is It A Smart Long Term Opportunity?,Simply Wall St.
Dec-03-18,What Marriott's Security Breach Means for the Long Term,Motley Fool
Dec-11-18,"RPM's Strategic Acquisitions Bode Well, Material Costs High",Zacks
Dec-14-18,Are You Looking for a High-Growth Dividend Stock? RPM International (RPM) Could Be a Great Choice,Zacks
Dec-17-18,RPM Acquires Leading Specialty Mold Solutions Brand,Business Wire
Dec-17-18,Here's Why CF Industries' (CF) Stock is a Solid Pick Now,Zacks
Dec-18-18,"RPM Buys Siamons, Boosts Specialty Cleaning Product Portfolio",Zacks
Dec-18-18,Have Insiders Been Buying RPM International Inc. (NYSE:RPM) Shares?,Simply Wall St.
Dec-20-18,"Universal Forest Products Banks on Acquisitions, Costs High",Zacks
Dec-20-18,NCI Building's (NCS) Shares Decline 14% on Q4 Earnings Miss,Zacks
Dec-20-18,4 Stocks Respected Activist Investor Jeffrey Smith Bought in Q3 (and 1 He Dumped),Insider Monkey
Dec-28-18,Analysts Estimate RPM International (RPM) to Report a Decline in Earnings: What to Look Out for,Zacks
Dec-31-18,Are You Looking for a High-Growth Dividend Stock? RPM International (RPM) Could Be a Great Choice,Zacks
Jan-02-19,RPM Declares Quarterly Dividend,Business Wire
Jan-02-19,What to Expect From RPM International's (RPM) Q2 Earnings,Zacks
Jan-04-19,RPM International (RPM) Q2 Earnings and Revenues Miss Estimates,Zacks
Jan-04-19,U.S.-China Commerce Dept Talks Give a Boost: Market Recon,TheStreet.com
Jan-04-19,RPM International: Fiscal 2Q Earnings Snapshot,Associated Press
Jan-04-19,RPM Reports Fiscal 2019 Second-Quarter Results,Business Wire
Jan-07-19,"RPM Misses Q2 Earnings and Revenue Estimates, Shares Decline",Zacks
Jan-07-19,RPM International Sees Tough Times Ahead Despite Record Sales,Motley Fool
Jan-08-19,"Factors of Influence in 2019, Key Indicators and Opportunity within RPM International, CareTrust REIT, Global Net Lease, EchoStar, Urban Outfitters, and Spartan Motors  New Research Emphasizes Economic Growth",GlobeNewswire
Jan-08-19,RPM International (RPM) Q2 2019 Earnings Conference Call Transcript,Motley Fool
Jan-11-19,Edited Transcript of RPM earnings conference call or presentation 4-Jan-19 3:00pm GMT,Thomson Reuters StreetEvents
Jan-16-19,Why RPM International (RPM) is a Top Dividend Stock for Your Portfolio,Zacks
Jan-17-19,RPM International Inc. -- Moody's affirms RPM International's ratings; changes outlook to Stable,Moody's
Jan-25-19,"RPM International Inc. (NYSE:RPM) Is An Attractive Dividend Stock, Heres Why",Simply Wall St.
Feb-12-19,BASF to launch construction chemicals unit sale in spring - sources,Reuters
