date,title,source
Oct-22-18,PTC Therapeutics to Host Conference Call to Discuss Third Quarter 2018 Financial Results,PR Newswire
Oct-23-18,PTC Therapeutics Reports Inducement Grants Under Nasdaq Listing Rule 5635(c)(4),PR Newswire
Oct-23-18,"Market Trends Toward New Normal in PTC Therapeutics, AeroVironment, Autodesk, Coca-Cola Bottling Co. Consolidated, Akers Biosciences, and TEGNA  Emerging Consolidated Expectations, Analyst Ratings",GlobeNewswire
Oct-25-18,How Does PTC Therapeutics Inc (NASDAQ:PTCT) Affect Your Portfolio Volatility?,Simply Wall St.
Oct-29-18,PTC Therapeutics (PTCT) Q3 Earnings Preview: What to Watch Ahead of the Release,Zacks
Oct-30-18,PTC Therapeutics to Participate at Upcoming Investor Conference,PR Newswire
Nov-05-18,PTC Therapeutics Reports Third Quarter 2018 Financial Results and Provides a Corporate Update,PR Newswire
Nov-06-18,"PTC Therapeutics (PTCT) Reports Q3 Loss, Lags Revenue Estimates",Zacks
Nov-06-18,PTC Therapeutics: 3Q Earnings Snapshot,Associated Press
Nov-06-18,Edited Transcript of PTCT earnings conference call or presentation 5-Nov-18 9:30pm GMT,Thomson Reuters StreetEvents
Nov-06-18,"Amazon, Pandora, PTC Therapeutics, and More: Why These Stocks Are Trending",Insider Monkey
Nov-07-18,Here's Why PTC Therapeutics Dropped 18% in October,Motley Fool
Nov-09-18,New Strong Sell Stocks for November 9th,Zacks
Nov-16-18,PTC Therapeutics Reports Inducement Grants Under Nasdaq Listing Rule 5635(c)(4),PR Newswire
Nov-21-18,Edited Transcript of PTCT earnings conference call or presentation 5-Nov-18 9:30pm GMT,Thomson Reuters StreetEvents
Nov-30-18,"Report: Exploring Fundamental Drivers Behind J.B. Hunt Transport Services, Kura Oncology, National Beverage, Benefitfocus, PTC Therapeutics, and Walgreens Boots Alliance  New Horizons, Emerging Trends, and Upcoming Developments",GlobeNewswire
Dec-07-18,PTC Therapeutics Reports Inducement Grants Under Nasdaq Listing Rule 5635(c)(4),PR Newswire
Dec-11-18,"Hedge Funds Are Buying PTC Therapeutics, Inc. (PTCT)",Insider Monkey
Dec-13-18,"Is PTC Therapeutics, Inc.s (NASDAQ:PTCT) CEO Paid Enough Relative To Peers?",Simply Wall St.
Dec-13-18,"Ghost Tree Capitals AUM, Returns and Holdings",Insider Monkey
Dec-17-18,Roche's SMA Candidate Risdiplam Gets PRIME Designation in EU,Zacks
Dec-17-18,Should You Invest in the Invesco DWA Healthcare Momentum ETF (PTH)?,Zacks
Dec-18-18,PTC Therapeutics Deepens Financial and Commercial Expertise of Board with Two New Appointments,PR Newswire
Dec-20-18,PTC Therapeutics Reports Inducement Grants Under Nasdaq Listing Rule 5635(c)(4),PR Newswire
Jan-02-19,PTC Therapeutics to Participate at Upcoming Investor Conference,PR Newswire
Jan-03-19,"Praesidium Investment Managements Return, AUM, and Holdings",Insider Monkey
Jan-07-19,PTC Therapeutics Announces Executive Team Updates Focused on Accelerating Pipeline and Bringing Gene Therapy Manufacturing In-house,PR Newswire
Jan-07-19,PTC Therapeutics Provides Corporate Update and Outlines 5-year Strategic Plan at 2019 J.P. Morgan Healthcare Conference,PR Newswire
Jan-22-19,PTC Therapeutics Announces Proposed Public Offering of Common Stock,PR Newswire
Jan-23-19,"Why Capital One Financial, PTC Therapeutics, and Quotient Technology Slumped Today",Motley Fool
Jan-23-19,Here's Why PTC Therapeutics Fell as Much as 11.7% Today,Motley Fool
Jan-23-19,PTC Therapeutics Announces Pricing of Public Offering of Common Stock,PR Newswire
Jan-23-19,"The Daily Biotech Pulse: PTC Therapeutics, Select Biosciences Offering, Unity Biotech Expands Early-Stage Osteoporosis Drug Study",Benzinga
Jan-25-19,PTC Therapeutics Reports Inducement Grants Under Nasdaq Listing Rule 5635(c)(4),PR Newswire
Jan-28-19,"Report: Exploring Fundamental Drivers Behind Realty Income, United Therapeutics, NxStage Medical, PTC Therapeutics, AVEO Pharmaceuticals, and Owens & Minor  New Horizons, Emerging Trends, and Upcoming Developments",GlobeNewswire
Jan-29-19,"What Kind Of Shareholders Own PTC Therapeutics, Inc. (NASDAQ:PTCT)?",Simply Wall St.
Jan-31-19,"PTC Therapeutics Launches New Program to Support Research Projects in Rare, Genetic Disorders",PR Newswire
Feb-01-19,Top Insider Buys Highlight for the Week of Feb. 1,GuruFocus.com
Feb-13-19,PTC Therapeutics Launches Fifth Annual STRIVE Grant Award Program for Duchenne Muscular Dystrophy,PR Newswire
Feb-14-19,PTC Therapeutics to Host Conference Call to Discuss Fourth Quarter and Year End 2018 Financial Results,PR Newswire
Feb-21-19,Earnings Preview: PTC Therapeutics (PTCT) Q4 Earnings Expected to Decline,Zacks
Feb-25-19,PTC Therapeutics Announces Partial Exercise of Underwriter's Option to Purchase Additional Shares,PR Newswire
Feb-25-19,Sell-Side Picks Top Gene Therapy Takeout Candidates Following Spark Therapeutics Deal,Benzinga
Feb-28-19,PTC Therapeutics Reports Fourth Quarter and Full Year 2018 Financial Results and Provides a Corporate Update,PR Newswire
Mar-01-19,PTC Therapeutics Reports Inducement Grants Under Nasdaq Listing Rule 5635(c)(4),PR Newswire
Mar-01-19,PTC Therapeutics Inc (PTCT) Q4 2018 Earnings Conference Call Transcript,Motley Fool
Mar-04-19,PTC Therapeutics to Participate at Upcoming Investor Conferences,PR Newswire
Mar-04-19,PTC to Expand Product Portfolio in Latin America with WAYLIVRA,PR Newswire
Mar-06-19,"Research Report Identifies E*TRADE Financial, Kennedy-Wilson, Alteryx, PTC Therapeutics, Ocean Power Technologies, and NuVasive with Renewed Outlook  Fundamental Analysis, Calculating Forward Movement",GlobeNewswire
Mar-15-19,Edited Transcript of PTCT earnings conference call or presentation 28-Feb-19 9:30pm GMT,Thomson Reuters StreetEvents
Mar-15-19,"Is PTC Therapeutics, Inc.s (NASDAQ:PTCT) Balance Sheet Strong Enough To Weather A Storm?",Simply Wall St.
Apr-01-19,Medison to Nominate Six Highly Qualified Directors for Knight Therapeutics' Board to Strengthen Oversight and Drive Value Creation for All Shareholders,CNW Group
Apr-12-19,"Have Insiders Been Selling PTC Therapeutics, Inc. (NASDAQ:PTCT) Shares?",Simply Wall St.
Apr-18-19,PTC Therapeutics to Host Conference Call to Discuss First Quarter 2019 Financial Results,PR Newswire
Apr-25-19,Analysts Estimate PTC Therapeutics (PTCT) to Report a Decline in Earnings: What to Look Out for,Zacks
Apr-29-19,Translarna (ataluren) is the First Therapy Approved in Brazil for Duchenne Muscular Dystrophy,PR Newswire
May-01-19,"Here is What Hedge Funds Think About PTC Therapeutics, Inc. (PTCT)",Insider Monkey
May-02-19,"PTC Therapeutics (PTCT) Reports Q1 Loss, Lags Revenue Estimates",Zacks
May-02-19,PTC Therapeutics: 1Q Earnings Snapshot,Associated Press
May-02-19,PTC Therapeutics Reports First Quarter 2019 Financial Results and Provides a Corporate Update,PR Newswire
May-03-19,PTC Therapeutics Reports Inducement Grants Under Nasdaq Listing Rule 5635(c)(4),PR Newswire
May-03-19,Edited Transcript of PTCT earnings conference call or presentation 2-May-19 8:30pm GMT,Thomson Reuters StreetEvents
May-07-19,This Biotech Has A 'Swing Factor' In SMA Drugs And It's Slugging Biogen,Investor's Business Daily
May-07-19,"Data from Pivotal FIREFISH and SUNFISH Studies Demonstrate Clinical Benefit of Risdiplam in Type 1, 2, & 3 Spinal Muscular Atrophy Patients",PR Newswire
May-08-19,Edited Transcript of PTCT earnings conference call or presentation 2-May-19 8:30pm GMT,Thomson Reuters StreetEvents
May-09-19,PTC Therapeutics and MRI Interventions Announce Strategic Investment,PR Newswire
May-20-19,"PTC Therapeutics Announces First-Ever Winners of Its PRIORITY Program To Support Research Projects In Rare, Genetic Disorders",PR Newswire
