date,title,source
Oct-19-18,Brady Corporation Announces Earnings Conference Call,GlobeNewswire
Oct-25-18,What Kind Of Shareholders Own Brady Corporation (NYSE:BRC)?,Simply Wall St.
Oct-25-18,"Detailed Research: Economic Perspectives on Movado Group, MFA Financial, Trinseo S.A, Performance Food Group, Conduent, and Brady  What Drives Growth in Today's Competitive Landscape",GlobeNewswire
Nov-06-18,How U.S. Silica Holdings Inc (SLCA) Stacks Up Against Its Market Cap Peers,Insider Monkey
Nov-08-18,Brady (BRC) Earnings Expected to Grow: What to Know Ahead of Next Week's Release,Zacks
Nov-12-18,Brady Corporation (NYSE:BRC): The Best Of Both Worlds,Simply Wall St.
Nov-12-18,Regal Beloit (RBC) Displays Bright Prospects Amid Risks,Zacks
Nov-13-18,Fortune Brands Arm Clinches Partnership Deal With Wolf Home,Zacks
Nov-15-18,Brady Corporation (BRC) Q4 2018 Earnings Conference Call Transcript,Motley Fool
Nov-15-18,Brady (BRC) Surpasses Q1 Earnings Estimates,Zacks
Nov-15-18,"With A Return On Equity Of 12%, Has Brady Corporations (NYSE:BRC) Management Done Well?",Simply Wall St.
Nov-15-18,Brady: Fiscal 1Q Earnings Snapshot,Associated Press
Nov-15-18,Brady Corporation Reports Fiscal 2019 First Quarter Results and Increases its Fiscal 2019 EPS Guidance,GlobeNewswire
Nov-30-18,HD Supply (HDS) to Report Q3 Earnings: What's in the Offing?,Zacks
Dec-03-18,Allegion Gains From Solid Product Demand Despite High Costs,Zacks
Dec-06-18,Supply Insight and Brady's New Partnership Delivers the First Turnkey RFID Item Tracking,PR Newswire
Dec-06-18,Should Brady Corporation (NYSE:BRC) Be Part Of Your Dividend Portfolio?,Simply Wall St.
Dec-18-18,Hedge Funds Arent Crazy About Brady Corp (BRC) Anymore,Insider Monkey
Dec-21-18,5 Industrial Products Stocks That Survived 2018 Sector Crash,Zacks
Dec-24-18,Should You Be Worried About Insider Transactions At Brady Corporation (NYSE:BRC)?,Simply Wall St.
Dec-24-18,"Tetra Tech (TTEK) Displays Bright Prospects, Risks Persist",Zacks
Dec-28-18,Here's Why Investing in Cintas (CTAS) Right Now Makes Sense,Zacks
Jan-02-19,Here's Why You Should Add Bemis (BMS) to Your Portfolio Now,Zacks
Jan-02-19,Here's Why You Should Dump Terex From Your Portfolio Now,Zacks
Jan-04-19,Here's Why You Should Hold Sonoco Stock in Your Portfolio,Zacks
Jan-04-19,Here's Why Owens-Illinois (OI) is Worth Buying Right Now,Zacks
Jan-07-19,Crown Holdings' Results to be Hurt by Impact of Hurricanes,Zacks
Jan-07-19,Improving Demand to Drive Caterpillar Despite Higher Costs,Zacks
Jan-08-19,"Allegion Unveils Latest Deadbolt, Enhances Product Portfolio",Zacks
Jan-09-19,"Lindsay (LNN) Q1 Earnings Miss Estimates, Up Y/Y, Shares Dip",Zacks
Jan-10-19,Manitowoc (MTW) Down 63% in 2018: Can It Rebound This Year?,Zacks
Jan-11-19,Apogee Stock Down 32% in the Past Year: Will It Bounce Back?,Zacks
Jan-14-19,Bemis' (BMS) Stock Up 13% in 6 Months: Can It Gain Further?,Zacks
Jan-14-19,Allegion (ALLE) Hit by Surging Costs &amp; Broader Market Risks,Zacks
Jan-15-19,Reasons to Add Sealed Air (SEE) Stock to Your Portfolio Now,Zacks
Jan-15-19,Rising Demand &amp; Cost Reduction to Drive Milacron's Results,Zacks
Jan-25-19,Should You Be Tempted To Sell Brady Corporation (NYSE:BRC) Because Of Its P/E Ratio?,Simply Wall St.
Feb-08-19,David S. Bem and Michelle E. Williams join Brady Corporation Board of Directors,GlobeNewswire
Feb-11-19,Calculating The Intrinsic Value Of Brady Corporation (NYSE:BRC),Simply Wall St.
Feb-14-19,Brady (BRC) Earnings Expected to Grow: Should You Buy?,Zacks
Feb-14-19,Will Brady (BRC) Beat Estimates Again in Its Next Earnings Report?,Zacks
Feb-14-19,Brady (BRC) Upgraded to Buy: What Does It Mean for the Stock?,Zacks
Feb-14-19,Will Allegion be Able to Sustain Momentum Amid Headwinds?,Zacks
Feb-15-19,"Market Trends Toward New Normal in HubSpot, Capstone Turbine, Warrior Met Coal, MSG Networks, U.S. Global Investors, and Brady  Emerging Consolidated Expectations, Analyst Ratings",GlobeNewswire
Feb-19-19,"Allegion (ALLE) Q4 Earnings Beat Estimates, Revenues In Line",Zacks
Feb-20-19,Brady Corporation declares regular dividend to shareholders,GlobeNewswire
Feb-21-19,Brady (BRC) Beats Q2 Earnings Estimates,Zacks
Feb-21-19,Brady: Fiscal 2Q Earnings Snapshot,Associated Press
Feb-21-19,Brady Corporation Reports Fiscal 2019 Second Quarter Results and Increases its Fiscal 2019 EPS Guidance,GlobeNewswire
Feb-22-19,Brady (BRC) is a Great Momentum Stock: Should You Buy?,Zacks
Feb-22-19,Brady (BRC) Q2 2019 Earnings Conference Call Transcript,Motley Fool
Mar-01-19,"ABB Earnings &amp; Revenues Miss Estimates in Q4, Orders Up Y/Y",Zacks
Mar-01-19,Edited Transcript of BRC earnings conference call or presentation 21-Feb-19 3:30pm GMT,Thomson Reuters StreetEvents
Mar-04-19,Emerson (EMR) Unveils New Service Center in Permian Basin,Zacks
Mar-05-19,Has Brady Corporation (NYSE:BRC) Got Enough Cash?,Simply Wall St.
Mar-06-19,"MRC Global (MRC) Displays Bright Prospects, Risks Persist",Zacks
Mar-11-19,RBC Bearings to Gain From Solid Demand in Markets Amid Risks,Zacks
Mar-11-19,Here's Why You Should Hold on to Owens-Illinois Stock for Now,Zacks
Mar-12-19,Emerson Chosen by IndianOil for Modernization of Refineries,Zacks
Mar-12-19,Owens-Illinois Announces $60M Expansion Project in Europe,Zacks
Mar-12-19,Here's Why TriMas (TRS) Stock is Worth Investing in Right Now,Zacks
Mar-14-19,Emerson's (EMR) DeltaV Automation System Gets Certification,Zacks
Mar-18-19,Strong Markets &amp; Products Fuel TriMas Amid High Input Costs,Zacks
Apr-03-19,Read This Before Considering Brady Corporation (NYSE:BRC) For Its Upcoming US$0.21 Dividend,Simply Wall St.
Apr-04-19,Here's Why Brady (BRC) is a Suitable Investment Choice Now,Zacks
Apr-10-19,iRobot Poised on Solid Demand in Key Markets Amid Risks,Zacks
