date,title,source
Oct-17-18,Nvidia (NVDA) Dips More Than Broader Markets: What You Should Know,Zacks
Oct-17-18,Semiconductor Bear Market Could Trap Complacent Shareholders,Investopedia
Oct-17-18,Bear of the Day: Newmont Mining (NEM),Zacks
Oct-18-18,"Taiwan Semi's Sales Outlook: Good News for Apple, Mixed Bag for Others",TheStreet.com
Oct-18-18,Throwback Thursday: To Trade or Not to Trade Paypal,TheStreet.com
Oct-18-18,"Daimler's Going Autonomous With Nvidia to Take On Uber, Ride-Hailing Race",TheStreet.com
Oct-18-18,Trading Nvidia After Goldman Sachs Upgrades to 'Conviction Buy',TheStreet.com
Oct-18-18,Goldman Sachs Adds Nvidia To 'Conviction Buy' List,Benzinga
Oct-18-18,The One Chip Stock Goldman Recommends in a Fading Semiconductor Market,Barrons.com
Oct-18-18,Is It Too Early to Get Back Into Nvidia Stock?,InvestorPlace
Oct-18-18,Goldman Sachs sees a correction coming for chipmakers but still likes Nvidia,CNBC
Oct-18-18,Theres a Huge Flaw in Valuing AMD Stock Like Amazon or Netflix,InvestorPlace
Oct-18-18,Love the Players and the Games With This New ETF,Investopedia
Oct-19-18,NVIDIA Falls 3%,Investing.com
Oct-19-18,Nvidia an Exception Amid More Bearish Chip Sector Outlook: Goldman,Investopedia
Oct-22-18,"Stock Picks: Netflix, Nvidia Gave These Clues For Finding The Best Stocks To Buy",Investor's Business Daily
Oct-22-18,Should You Buy Intel This Week Into Earnings?,TheStreet.com
Oct-22-18,Why You Should Buy Beaten-Down Chip ETFs Ahead of Q3 Earnings,Zacks
Oct-22-18,Whats more volatile than bitcoin? You may be surprised,MarketWatch
Oct-22-18,"3 Stock Charts for Monday: Netflix, PPL and Nvidia",InvestorPlace
Oct-22-18,"The Future of Cars, Nvidia, CBS: Three Keys to Your Investing Day",TheStreet.com
Oct-22-18,"Google Stock Is a Great Long-Term Investment, but Wait to Buy",InvestorPlace
Oct-22-18,"Artificial Intelligence Set to Propel Global GDP as Business Integration Proliferates; Gopher Protocol Inc. (OTCQB: GOPH), NVIDIA Corp., Amazon, Snap Inc.",GlobeNewswire
Oct-23-18,It's Clear Nvidia Is Leading the A.I. Revolution,TheStreet.com
Oct-23-18,NVIDIA Falls 5%,Investing.com
Oct-23-18,Buy INTC Stock With Confidence Ahead of Earnings,InvestorPlace
Oct-23-18,Advanced Micro Devices Stock Is Finally Ready for a Strong Comeback,InvestorPlace
Oct-23-18,Whats more volatile than bitcoin? You may be surprised,MarketWatch
Oct-23-18,"Chip stocks could plunge another 8 percent before hitting bottom, technician warns",CNBC
Oct-24-18,Here's Why Leading Semiconductor Stocks Plunged Today,Motley Fool
Oct-24-18,AMD revenue forecast disappoints as crypto demand wanes,Reuters
Oct-24-18,Chip stocks suffer their biggest drop in nearly 10 years,CNBC
Oct-24-18,Top 3 Shareholders of AMD,Investopedia
Oct-24-18,"5 Top Stock Charts for Thursday: Ford, AMD Earnings on Deck",InvestorPlace
Oct-24-18,Buy Nvidia Stock While Everyone Else Panic Sells,InvestorPlace
Oct-24-18,Stock News Today: Texas Instruments Casts Pall On Technology Sector,Investor's Business Daily
Oct-24-18,NVIDIA Stock Falls to Key Support Levels,Investopedia
Oct-24-18,NVIDIA Falls 3%,Investing.com
Oct-24-18,"Earnings Aside, AMD Stock Still Has a Ton of Room to Grow",InvestorPlace
Oct-24-18,Silicon Valley's relationship with Saudi Arabia starts to wobble,American City Business Journals
Oct-24-18,Today's Research Reports on Trending Tickers: Texas Instruments and NVIDIA,ACCESSWIRE
Oct-24-18,Intel Stock Needs an Earnings Beat (And Chip Stocks Need It Even More),InvestorPlace
Oct-25-18,Stocks - Dow Returns to Positive for the Year After 400-Point Rally,Investing.com
Oct-25-18,NVIDIA Rises 3%,Investing.com
Oct-25-18,How To Invest In Stocks: A Guide To The Stock Market For Beginners,Investor's Business Daily
Oct-25-18,Nvidias Stock Price Target Is Cut After AMDs Weak Earnings Outlook,Barrons.com
Oct-25-18,"Nvidia, Regulators Uncovering the Top Factors for Autonomous Driving",TheStreet.com
Oct-25-18,3 Stocks to Buy and Hold Through the Panic Selling,InvestorPlace
Oct-25-18,Why October Spells Doom for Semis: ETFs in Focus,Zacks
Oct-25-18,"Final Trades: JPMorgan, NVIDIA, Caterpillar & Activision ...",CNBC Videos
Oct-25-18,AMD Is Getting Battered After a Weak Revenue Forecast. Heres What Wall Street Is Saying,Bloomberg
Oct-25-18,Crypto Rout Sends Advanced Micro Devices Stock Reeling,InvestorPlace
Oct-25-18,Whats more volatile than bitcoin? You may be surprised,MarketWatch
Oct-25-18,"Analysis: Positioning to Benefit within Wright Medical Group N.V, Heska, XG Technology, Newtek Business Services, NVIDIA, and The Providence Service  Research Highlights Growth, Revenue, and Consolidated Results",GlobeNewswire
Oct-26-18,"Stock News Today: Western Digital, Cerner, Amazon, Nvidia Lead Nasdaq 100 Lower",Investor's Business Daily
Oct-26-18,"AMD, Nvidia, Western Digital Get Smoked",TheStreet.com
Oct-26-18,"Stock Picks: Netflix, Nvidia Gave These Clues For Finding The Best Stocks To Buy",Investor's Business Daily
Oct-26-18,"How Nvidia, Google and Others Will Make Autonomous Driving a Reality",TheStreet.com
Oct-26-18,Nvidia Upside Slimmer on AMD Earnings: BofA,Investopedia
Oct-26-18,Nvidia's Drop May Push Down Stock 39% Off High,Investopedia
Oct-26-18,AMD Stock Could Bounce Back to $20 Once Tech Markets Stabilize,InvestorPlace
Oct-26-18,NVIDIA Falls 4%,Investing.com
Oct-26-18,Mediocre Earnings Undercut the Bull Case for Buying AMD Stock,InvestorPlace
Oct-26-18,Buying Nvidia Stock Below $200 Is a No-Brainer,InvestorPlace
Oct-26-18,Trading the Earnings Plunge in AMD Stock,InvestorPlace
Oct-29-18,NVIDIA Falls 4%,Investing.com
Oct-29-18,3 Top Driverless-Car Stocks to Watch in November,Motley Fool
Oct-29-18,3 Reasons This Is the End of the Micron Stock Growth Cycle,InvestorPlace
Oct-29-18,"Wall Street volatility erases trillions in company value, from Silicon Valley to Austin",American City Business Journals
Oct-29-18,October's swoon has erased trillions from America's biggest companies. Here's who's down the most in Tampa Bay,American City Business Journals
Oct-29-18,Bull of the Day: Turtle Beach (HEAR),Zacks
Oct-30-18,"We Want Bad News, Bears: Cramer's 'Mad Money' Recap (Tuesday 10/30/18)",TheStreet.com
Oct-30-18,Nvidia to Gain Over 35%: JPMorgan,Investopedia
Oct-30-18,NVIDIA Rises 3%,Investing.com
Oct-30-18,JP Morgan upgrades Nvidia to buy,CNBC Videos
Oct-30-18,Nvidia Stock Has Some Potential That AMD Just Never Will,InvestorPlace
Oct-30-18,AMD Stock Is on Its Way Back to Reasonable Valuation Land,InvestorPlace
Oct-30-18,"Weakness In Nvidia's Gaming Segment Could Be A Passing Phase, JPMorgan Says In Upgrade",Benzinga
Oct-30-18,"Nvidia Stock Ready to Rally, According to JPMorgan",Barrons.com
Oct-30-18,Nvidia stock climbs after J.P. Morgan upgrades to overweight,MarketWatch
Oct-30-18,Today's Research Reports on Trending Tickers: NVIDIA and ON Semiconductor,ACCESSWIRE
Oct-31-18,How Does Bitcoin Mining Work?,Investopedia
Oct-31-18,NVIDIA Rises 3%,Investing.com
Oct-31-18,"Nvidia is pacing for its worst month in a decade, but now is the time to buy, JPMorgan says in upgrade",CNBC
Oct-31-18,Use This Disciplined Approach to Trade Nvidia Stock,TheStreet.com
Oct-31-18,Why NVIDIA Stock Jumped 9.4% on Tuesday,Motley Fool
Oct-31-18,Stay Disciplined When Trading Nvidia: Market Recon,TheStreet.com
Nov-01-18,NVIDIA Sets Conference Call for Third-Quarter Financial Results,GlobeNewswire
Nov-01-18,"Throwback Thursday: Cloud Kings, Chip Stocks and the Final FANG",TheStreet.com
Nov-01-18,Looking For The Next Breakout Stocks? Start With These Lists,Investor's Business Daily
Nov-01-18,Nvidia Helps Lead Semiconductors Higher: Now What?,TheStreet.com
Nov-01-18,NVIDIA Rises 3%,Investing.com
Nov-01-18,Nvidia Stock Is Worth a Look,InvestorPlace
Nov-01-18,Heres What the Apple Stock Charts Say Ahead of Earnings,InvestorPlace
Nov-01-18,"Driverless Cars Hit the Road for Testing, Stocks in Focus",Zacks
Nov-01-18,3 Stocks That Could Make You Rich,Motley Fool
Nov-05-18,How Trump could rescue Apples fast-sinking stock,MarketWatch
Nov-05-18,Which of These 3 Semiconductor Stocks Leads the Self-Driving Race?,InvestorPlace
Nov-05-18,Market today reflecting everything we're expecting to hap...,CNBC Videos
Nov-05-18,Nvidia May See 18% Price Swings After Earnings,Investopedia
Nov-05-18,NVIDIA Falls 3%,Investing.com
Nov-06-18,AMD Unveils How It Plans to Battle Intel and Nvidia in the Data Center,TheStreet.com
Nov-06-18,Why NVIDIA Stock Lost 25% in October,Motley Fool
Nov-06-18,10 Stocks to Buy for a Midterm Rally,InvestorPlace
Nov-06-18,5 Artificial Intelligence Stocks to Consider,InvestorPlace
Nov-06-18,Theres a Great Deal to Like About Microsoft Stock,InvestorPlace
Nov-06-18,The Cost of Catching AMD Will Take a Toll on INTC Stock,InvestorPlace
Nov-06-18,How Trump could rescue Apples fast-sinking stock,MarketWatch
Nov-06-18,3 Chip Stocks to Buy Amid Techs Wild Swings,Investopedia
Nov-07-18,"Community Impact Corporate Champion: Nvidia supports research, education",American City Business Journals
Nov-07-18,Does NVIDIA Corporations (NASDAQ:NVDA) CEO Pay Matter?,Simply Wall St.
Nov-08-18,Want to Play the Internet of Things? Jim Cramer Suggests Nvidia,TheStreet.com
Nov-08-18,5 Big Tech Stocks That Are Pumping the Brakes Today,InvestorPlace
Nov-08-18,Nvidias New Graphics Cards Could Be Slow to Take Off,Barrons.com
Nov-08-18,Morgan Stanley's Bull Case For Nvidia Unchanged By Near-Term Concerns,Benzinga
Nov-08-18,NVIDIA Falls 4%,Investing.com
Nov-08-18,Is Tilray Stock the Best Cannabis Stock to Buy Now?,InvestorPlace
Nov-08-18,Nvidia (NVDA) Reports Next Week: Wall Street Expects Earnings Growth,Zacks
Nov-08-18,Dont Miss This Opportunity in Nvidia Stock,InvestorPlace
Nov-08-18,NVDA Stock Will Profit From Tomorrows Biggest Technologies,InvestorPlace
Nov-09-18,Cramer's game plan: Let the market fret over oil and get ready to buy high-quality stocks,CNBC
Nov-09-18,Nvidia (NVDA) Stock Moves -0.16%: What You Should Know,Zacks
Nov-09-18,"Upcoming Earnings to Watch: TLRY, WMT, NVDA",Zacks
Nov-09-18,"3 Earnings Reports to Watch Next Week, Including Canopy Growth Stock",InvestorPlace
Nov-09-18,5 Trends Explain the Growth of the Video Game Industry,Motley Fool
Nov-09-18,Want to Play the Internet of Things? Jim Cramer Suggests Nvidia,TheStreet.com
Nov-12-18,Cramer's lightning round: How investors should approach t...,CNBC Videos
Nov-12-18,Cramer's lightning round: How investors should approach the 'best-in-show' stock of Nvidia,CNBC
Nov-12-18,NVIDIA Announces Record Adoption of New Turing T4 Cloud GPU,GlobeNewswire
Nov-12-18,Top Stock Picks for the Week of November 12th,Zacks
Nov-12-18,This Is What You Should Expect From Nvidia Earnings This Week,InvestorPlace
Nov-12-18,How To Invest In Stocks: A Guide To The Stock Market For Beginners,Investor's Business Daily
Nov-12-18,Must-Know Levels in Nvidia Stock Ahead of Earnings,TheStreet.com
Nov-12-18,The year's best-performing tech stock  AMD  got crushed,CNBC
Nov-12-18,NVIDIA Falls 4%,Investing.com
Nov-12-18,Factors Likely to Influence NVIDIA's (NVDA) Q3 Earnings?,Zacks
Nov-12-18,Why NVIDIA Just Discontinued This Expensive Graphics Card,Motley Fool
Nov-12-18,NVIDIA-Accelerated Supercomputers Hit New Highs on TOP500 List,GlobeNewswire
Nov-12-18,Is the Options Market Predicting a Spike in NVIDIA (NVDA) Stock?,Zacks
Nov-12-18,Citigroup gets negative on chip stocks citing weak iPhone demand,CNBC
Nov-12-18,"The Zacks Analyst Blog Highlights: Tilray, Walmart and NVIDIA",Zacks
Nov-12-18,Want to Play the Internet of Things? Jim Cramer Suggests Nvidia,TheStreet.com
Nov-13-18,Nvidia Reports Earnings on Thursday: 5 Important Things to Watch,TheStreet.com
Nov-13-18,Kellogg Joins Campbell In Seeking Sweets Exit; Oil Dips Again -- ICYMI,TheStreet.com
Nov-13-18,Chart Reading For Beginners: 3 Telltale Clues To Look For In Your Stocks,Investor's Business Daily
Nov-13-18,Chart Reading For Beginners: What's In A Stock Chart? Why Use Charts?,Investor's Business Daily
Nov-13-18,"Chart Reading For Beginners: Lessons From Nvidia, Netflix, Facebook",Investor's Business Daily
Nov-13-18,3 Overpriced Semiconductor Stocks Due for a Fall,InvestorPlace
Nov-13-18,Stocks Today: Nvidia Leads Technology Rally; Caterpillar Boosts Dow,Investor's Business Daily
Nov-13-18,Time to Buy Nvidia (NVDA) Stock on the Dip Before Q3 Earnings?,Zacks
Nov-13-18,This chart shows how cryptocurrency mining on your own is no longer profitable,CNBC
Nov-13-18,"Nvidia, Xilinx Stocks Upgraded To Buy On Artificial Intelligence",Investor's Business Daily
Nov-13-18,Nvidia Stock Soars After Analyst Says Bad News is Already Priced In,Barrons.com
Nov-13-18,Chips Stocks to Fall on Weaker Than Expected iPhone Demand: Citigroup,Investopedia
Nov-13-18,Nvidia upgraded to positive at Susquehanna,CNBC Videos
Nov-13-18,Why Jim Cramer Is Waiting Ahead of Nvidia's Earnings,TheStreet.com
Nov-13-18,NVIDIA Rises 4%,Investing.com
Nov-13-18,A Deeper Dive Into Nvidia,GuruFocus.com
Nov-13-18,Can Strong Demand for GPUs Aid NVIDIA's (NVDA) Q3 Earnings?,Zacks
Nov-13-18,"General Electric Gains, Nvidia Jumps, Best Buy Slumps",Barrons.com
Nov-13-18,"3 Big Stock Charts for Tuesday: Apple, Scana and Procter & Gamble",InvestorPlace
Nov-13-18,Can AMD Keep Growing Without Crypto at its Back?,Motley Fool
Nov-13-18,"Stocks making the biggest move premarket: AMZN, AAPL, HD, K & more",CNBC
Nov-13-18,Want to Play the Internet of Things? Jim Cramer Suggests Nvidia,TheStreet.com
Nov-13-18,Nvidia and Xilinx shares rise premarket after Susquehanna upgrades,MarketWatch
Nov-13-18,"Nvidia's earnings report will disappoint this week, analyst says, but he's upgrading anyway",CNBC
Nov-13-18,Todays Research Reports on Stocks to Watch: NVIDIA and Advanced Micro Devices,ACCESSWIRE
Nov-13-18,Nvidia May Fall to New Lows Following Results,Investopedia
Nov-14-18,Here's What to Expect from Nvidia's (NVDA) Q3 Earnings,Zacks
Nov-14-18,The Hottest Tech and Chinese Stock Earnings Charts This Week,Zacks
Nov-14-18,"Gaming, Datacenters, & Other Key Q3 Nvidia (NVDA) Estimates",Zacks
Nov-14-18,NVIDIA Falls 3%,Investing.com
Nov-14-18,"Nvidia Q3 Earnings Preview: Analysts Forecast Data Center, Gaming, Automotive Performance",Benzinga
Nov-14-18,"Stocks Today: Apple, Netflix, Nvidia Lead Nasdaq 100 Lower",Investor's Business Daily
Nov-14-18,"Nvidia: Bad News Already Priced into Shares, Says Susquehanna",Investopedia
Nov-14-18,Activision Stock Gets Back to Where It Belonged All Along,InvestorPlace
Nov-14-18,3 Beaten-Down Semiconductor Stocks to Buy Before the End of 2018,InvestorPlace
Nov-14-18,NVIDIA Rises 3%,Investing.com
Nov-14-18,Upcoming Earnings: Tech Giant Nvidia To Report Q3 Results Tomorrow,Benzinga
Nov-14-18,"Fossil, Red Robin, NVIDIA, Amazon and Alphabet highlighted as Zacks Bull and Bear of the Day",Zacks
Nov-14-18,NVIDIA Earnings Preview: What to Watch on Thursday,Motley Fool
Nov-14-18,Factors Setting the Tone for Pure Storage (PSTG) Q3 Earnings,Zacks
Nov-14-18,"Despite Headwinds, NVDA Stock Looks Compelling Ahead of Earnings",InvestorPlace
Nov-14-18,Why Jim Cramer Is Waiting Ahead of Nvidia's Earnings,TheStreet.com
Nov-14-18,Nvidia Reports Earnings on Thursday: 5 Important Things to Watch,TheStreet.com
Nov-14-18,Why This NVIDIA Partnership Is a Big Deal,Motley Fool
Nov-15-18,Nikkei falls as Nvidia's poor results dent chip sector,Reuters
Nov-15-18,Nvidia Tumbles on Soft Guidance: 5 Key Takeaways,TheStreet.com
Nov-15-18,Crypto hangover has Nvidia staggering into holidays with a big headache,MarketWatch
Nov-15-18,"'Crypto hangover' hammers Nvidia's outlook, shares drop 17 percent",Reuters
Nov-15-18,"AMD stock drops 6% after hours, following Nvidia GPU inventory issues",MarketWatch
Nov-15-18,[$$] Nvidias Game Isnt Over,The Wall Street Journal
Nov-15-18,[$$] Cryptocurrency Hangover Weighs on Nvidia,The Wall Street Journal
Nov-15-18,[$$] Cryptocurrency Hangover Weighs on Nvidia,The Wall Street Journal
Nov-15-18,"Nvidia Gives Lackluster Forecast on Inventory, Shares Plunge",Bloomberg
Nov-15-18,Jim Cramer: Here's What a Bull Needs,TheStreet.com
Nov-15-18,Nvidia shares slide 17 percent as cryptocurrency demand vanishes,Reuters
Nov-15-18,"NVIDIA Earnings beat, Revenue misses In Q3",Investing.com
Nov-15-18,[$$] Nvidia's Game Isn't Over,The Wall Street Journal
Nov-15-18,"Nvidia has a Pascal problem, and its stock is plunging after earnings",MarketWatch
Nov-15-18,Jim Cramer Correctly Predicted Nvidia's Earnings Miss Back in October,TheStreet.com
Nov-15-18,"NVIDIA Crashes 16% After Q3 Miss, Lowered Guidance",Zacks
Nov-15-18,Nvidia shares slide 17 percent as cryptocurrency demand vanishes,Reuters
Nov-15-18,Day Ahead: Top 3 Things to Watch,Investing.com
Nov-15-18,Nvidia (NVDA) Lags Q3 Earnings and Revenue Estimates,Zacks
Nov-15-18,The crypto party is over for Nvidia,Quartz
Nov-15-18,"Stocks making the biggest moves after hours: Nvidia, PG&E, Sonos and more",CNBC
Nov-15-18,Nvidia Stock Is Plunging on Weak Guidance Due to Rising Inventories,Barrons.com
Nov-15-18,"Nvidia Shares Tank After Earnings And Revenue Miss, Poor Guidance",TheStreet.com
Nov-15-18,Nvidia: Fiscal 3Q Earnings Snapshot,Associated Press
Nov-15-18,"Nvidia stock drops 15% as earnings, outlook miss",MarketWatch
Nov-15-18,Nvidia Shares Tumble on Quarterly Revenue Miss and Weak Guidance -- Live Blog,TheStreet.com
Nov-15-18,NVIDIA Announces Financial Results for Third Quarter Fiscal 2019,GlobeNewswire
Nov-15-18,NVIDIA Rises 3%,Investing.com
Nov-15-18,"Stock Picks: Netflix, Nvidia Gave These Clues For Finding The Best Stocks To Buy",Investor's Business Daily
Nov-15-18,Nvidia plunges after missing on revenue,CNBC
Nov-15-18,"Throwback Thursday: Have No Fear, Cramer's Here to Stave Off the Hungry Bears",TheStreet.com
Nov-15-18,Nvidia jumps into its earnings report  here's how to trade the chips now,CNBC
Nov-15-18,Here's What to Watch for When Nvidia Reports Earnings,TheStreet.com
Nov-15-18,How to Play Nvidia's Earnings Report & the State of Retail Stocks,Zacks
Nov-15-18,Here's What to Watch for When Nvidia Reports Earnings,TheStreet.com
Nov-15-18,Nvidia is Building the Future. How Did They Get There?,TheStreet.com
Nov-15-18,Here's What to Expect When Nvidia Reports Q3 Earnings,TheStreet.com
Nov-15-18,Nvidia Reports Earnings on Thursday: 5 Important Things to Watch,TheStreet.com
Nov-15-18,"Nvidia Reports Q3 Thursday Night, Here's My Take",TheStreet.com
Nov-15-18,Is Micron Stock Going to Double or Get Cut in Half?,InvestorPlace
Nov-15-18,"Big Box Bonanza: Walmart Beats Most Estimates, But Brexit Could Steal Attention",Benzinga
Nov-15-18,Its Time to Buy NVDA Stock Before and After Earnings,InvestorPlace
Nov-15-18,How Nvidia Historically Trades Following Earnings,Benzinga
Nov-15-18,INTC or NVDA: Which Is the Better Value Stock Right Now?,Zacks
Nov-15-18,Why Jim Cramer Is Waiting Ahead of Nvidia's Earnings,TheStreet.com
Nov-15-18,Brexit Blues and Fed Follies: Market Recon,TheStreet.com
Nov-15-18,"Nikkei hit by selling in banks, Apple suppliers",Reuters
Nov-16-18,[$$] Nvidia Grapples With Cryptocurrency Miners Exit,The Wall Street Journal
Nov-16-18,Nvidia in the penalty box for now,CNBC Videos
Nov-16-18,Cramer: Don't buy shares of Nvidiathe chipmaker is in th...,CNBC Videos
Nov-16-18,Jim Cramer: Nvidia Is a Great Company and They Will Get It Right,TheStreet.com
Nov-16-18,"Cramer Remix: When the market brings this sector down, this stock is a buy",CNBC
Nov-16-18,Nvidia Wipes Nearly $25 Billion From Its Market Cap After Earnings Day Disaster,TheStreet.com
Nov-16-18,Nvidia Shares Tank as Analysts Cut Price Targets,TheStreet.com
Nov-16-18,Dow Gains 124 Points as Market Sends Mixed Messages,Barrons.com
Nov-16-18,Nvidia Hands an $824 Million Windfall to Semiconductor Shorts,Bloomberg
Nov-16-18,What Happened in the Stock Market Today,Motley Fool
Nov-16-18,"S&P, Dow advance on trade optimism; Nvidia sinks Nasdaq",Reuters
Nov-16-18,[$$] Nvidia Grapples With Cryptocurrency Miners' Exit,The Wall Street Journal
Nov-16-18,Stock Market Today: End-of-Week Jitters,Investopedia
Nov-16-18,Nvidia loses an AMD worth of market cap on worst day for stock in more than a decade,MarketWatch
Nov-16-18,Recent Warnings From Chipmakers Aren't Just About Weaker Demand,TheStreet.com
Nov-16-18,"Nvidia, Nordstrom fall; PG&E, Sprint rise",Associated Press
Nov-16-18,"S&P, Dow advance on trade optimism; Nvidia sinks Nasdaq",Reuters
Nov-16-18,Flashback Friday: Nvidia Is the Ultimate Chip and Dip,TheStreet.com
Nov-16-18,Nvidia Stock Is a Cryptocurrency Victim as Price Targets Are Slashed,Barrons.com
Nov-16-18,Dow Leads The Stock Market Today As These 5 Big Caps Rally,Investor's Business Daily
Nov-16-18,Dow Ends Higher on Dovish Trump Tariff Comments; Nasdaq Falls,TheStreet.com
Nov-16-18,"How to Play Semiconductors Amid Nvidia's Crash, Cycle Pressure",TheStreet.com
Nov-16-18,Expert surprised semis are weak because they're tech's 'd...,CNBC Videos
Nov-16-18,Tech Stocks Recover After Early Downdraft; Applied Materials Reverses Higher,Investor's Business Daily
Nov-16-18,NVIDIA Corp. Earnings: A Harsh Cryptocurrency Hangover,Motley Fool
Nov-16-18,"Brexit, Mixed Retail Earnings & Nvidia's Weak Outlook Weigh on Stocks",Zacks
Nov-16-18,Trump Trade Comments Boost Dow Jones; These 6 Growth Stocks Take Market Helm,Investor's Business Daily
Nov-16-18,"Chip Bull Run Teeters as Nvidia, Applied Add to Gloom",Bloomberg
Nov-16-18,"GLOBAL MARKETS-Dollar, U.S. yields slide on Fed official's rate comments",Reuters
Nov-16-18,'I Didn't Sleep Well Last Night:' Analysts Predict Bitcoin Has Further to Fall,Bloomberg
Nov-16-18,NVIDIA Corporation (NVDA) vs. Netflix Inc (NFLX): Here is What Hedge Funds Think,Insider Monkey
Nov-16-18,"AMD, Micron Shares Follow Nvidia Lower",TheStreet.com
Nov-16-18,Crypto hangover has Nvidia staggering into holidays with a big headache,MarketWatch
Nov-16-18,Dow gains 100-point gain as Trump says 'doesn't want to put China in a bad position',MarketWatch
Nov-16-18,Nvidia Is Still a Growth Stock to Bullish Buyers on Weakness,TheStreet.com
Nov-16-18,Nvidia Will Only Appeal to Value Buyers With a Longer Term Time Frame,TheStreet.com
Nov-16-18,Jim Cramer Discusses Nvidia CEO's Defensiveness on Earnings Call,TheStreet.com
Nov-16-18,Why NVIDIA Corp. Shares Fell as Much as 20% Today,Motley Fool
Nov-16-18,Jim Cramer's Advice for Investors Eyeing Nvidia,TheStreet.com
Nov-16-18,Nvidia stock sent crashing after missed earnings,CNBC Videos
Nov-16-18,How Jim Cramer Knew Nvidia Would Miss the Quarter,TheStreet.com
Nov-16-18,NVIDIA Falls 19%,Investing.com
Nov-16-18,Nvidia Seen Plummeting 17% Further As Bulls Turn Bearish,Investopedia
Nov-16-18,"GLOBAL MARKETS-Dollar, U.S. yields fall on Fed comments; Brexit casts shadow",Reuters
Nov-16-18,"BioTelemetry, Ultra Clean, NVIDIA and AMD highlighted as Zacks Bull and Bear of the Day",Zacks
Nov-16-18,"Chip Bull Run Teeters Near End as Nvidia, Applied Materials Sink",Bloomberg
Nov-16-18,Nvidia nurses 'crypto hangover' as demand for mining chips evaporates,CNBC
Nov-16-18,"Nvidia Targets Slashed, Outlook Sparks Worst Day in a Decade",Bloomberg
Nov-16-18,Goldman Says It Was Wrong on Nvidia Stock and Boots It From Best Ideas List,Barrons.com
Nov-16-18,Nvidia 'finally stumbled:' What every major Wall Street analyst said after the chipmaker's earnings,CNBC
Nov-16-18,Supply glut mars Turing effect for Nvidia shares,Reuters
Nov-16-18,Nvidia Faces $20 Billion Wipeout as Cryptocurrency 'Hangover' Hits Q4 Outlook,TheStreet.com
Nov-16-18,European chipmakers see new growth drivers to weather volatile demand,Reuters
Nov-16-18,"GLOBAL MARKETS-Europe battles Brexit blues, Wall Street faces tech stress",Reuters
Nov-16-18,"Nvidia misses earnings, plunges to lowest price since mid-2017 on crypto hangover",American City Business Journals
Nov-16-18,'Crypto Hangover' Crushes Nvidia Stock As Wall Street Reins in Targets,TheStreet.com
Nov-16-18,"Chip stocks set to tumble after Nvidia, AMD and Applied Materials pace losers",MarketWatch
Nov-16-18,US STOCKS-Nasdaq futures fall 1 pct as Nvidia takes down chipmakers,Reuters
Nov-16-18,"[$$] Stocks to Watch: Viacom, PG&E, Nvidia, Nordstrom",The Wall Street Journal
Nov-16-18,"Home Depot Drops, PG&E Soars as Dow Set for 100-Point Drop",Barrons.com
Nov-16-18,Nvidia tumbles 18% premarket after missing on revenue and guidance,CNBC
Nov-16-18,"NVIDIA's Earnings Were Solid, but Stock Plunges 17% on Weak Outlook Due to &quot;Crypto Hangover&quot;",Motley Fool
Nov-16-18,Stocks - U.S. Futures Fall as Trade Talks Fail to Halt Tariffs,Investing.com
Nov-16-18,Stock in Nvidia Takes a Dive as Chip Inventories Pile Up,Barrons.com
Nov-16-18,"Stocks making the biggest move premarket: FB, NVDA, PCG, JWN & more",CNBC
Nov-16-18,Nvidia stock removed from Goldman Sachs Conviction List on increased near-term uncertainty,MarketWatch
Nov-16-18,Nvidia Charts Warn Market Players to Look Out Below,TheStreet.com
Nov-16-18,Dow Futures Weaken Amid Tech Sector Concerns; Oil Rebounds on OPEC Cut Plans,TheStreet.com
Nov-16-18,Supply glut mars Turing effect for Nvidia shares,Reuters
Nov-16-18,"Nvidia Shares Tank After Earnings And Revenue Miss, Poor Guidance",TheStreet.com
Nov-16-18,Rewind: Remember When Jim Cramer Warned Nvidia 'Is Going to Miss the Quarter?',TheStreet.com
Nov-16-18,Poor Earnings Are Causing Problems but This Market Wants to Bounce,TheStreet.com
Nov-16-18,"Nvidia, Applied Materials, SpaceX and PG&E - 5 Things You Must Know",TheStreet.com
Nov-16-18,US STOCKS-Nasdaq futures fall 1 pct as Nvidia takes down chipmakers,Reuters
Nov-16-18,"After Nvidia's Earnings Defeat, I'm First Watching the Stock: Market Recon",TheStreet.com
Nov-16-18,Today's Research Reports on Trending Tickers: Advanced Micro Devices and NVIDIA,ACCESSWIRE
Nov-16-18,Nvidia is Building the Future. How Did They Get There?,TheStreet.com
