date,title,source
Nov-16-18,"Nvidia has a Pascal problem, and its stock is plunging after earnings",MarketWatch
Nov-19-18,The Dow Dove 396 Points Because the Carving Started Early,Barrons.com
Nov-19-18,The poster child of bull-market excess just dimmed the prospects of the broader stock market,MarketWatch
Nov-19-18,"Why NVIDIA, Spectrum Brands Holdings, and Facebook Slumped Today",Motley Fool
Nov-19-18,Nvidia Stock Falls Another 12%,TheStreet.com
Nov-19-18,Once popular tech stocks like Facebook and Apple are now getting crushed: Here's what happened,CNBC
Nov-19-18,NVIDIA's Gaming Business Got Sideswiped,Motley Fool
Nov-19-18,"5 Top Stock Trades for Tuesday: Trading SPY, GOOGL and SQ",InvestorPlace
Nov-19-18,"Monday Madness: Don't Be Afraid of the Big, Bad Bear",TheStreet.com
Nov-19-18,MarketPulse: Apple Triggers Tech Wreck on Fears of Production Cut,Investing.com
Nov-19-18,Why NVIDIA Stock Tumbled Today,Motley Fool
Nov-19-18,[$$] A Silicon Valley Tech Leader Walks a High Wire Between the U.S. and China,The Wall Street Journal
Nov-19-18,More Volatility for Tech Stocks & a Final Wave of Retail Earnings Reports,Zacks
Nov-19-18,Why Mining Cryptocurrencies on Your Own is Pointless,Investopedia
Nov-19-18,NVIDIA Falls 3%,Investing.com
Nov-19-18,How Nvidia Makes Money (NVDA),Investopedia
Nov-19-18,NVIDIA Crashes on Dismal Outlook: Should You Buy Its ETFs?,Zacks
Nov-19-18,Nvidia continues to fall as much as 8 percent after revenue and guidance miss,CNBC
Nov-19-18,"Stock Market News For Nov 19, 2018",Zacks
Nov-19-18,NetApp (NTAP) Looks Promising on Upbeat Q2: Should You Buy?,Zacks
Nov-19-18,Oversold Chip Stocks Could Squeeze Complacent Sellers,Investopedia
Nov-19-18,NVIDIA (NVDA) Shares Decline to Touch a New 52-Week Low,Zacks
Nov-19-18,Today's Research Reports on Trending Tickers: Applied Materials and Nvidia,ACCESSWIRE
Nov-19-18,How the Crypto Collapse is Hurting Nvidia,Investopedia
Nov-19-18,Edited Transcript of NVDA earnings conference call or presentation 15-Nov-18 10:30pm GMT,Thomson Reuters StreetEvents
Nov-19-18,"Nikkei rises as chip-related stocks, SoftBank recover; financials tumble",Reuters
