date,title,source
Oct-31-18,Drive Shack Inc. Schedules Third Quarter 2018 Earnings Release and Conference Call,Business Wire
Nov-08-18,"Drive Shack (DS) Reports Q3 Loss, Misses Revenue Estimates",Zacks
Nov-08-18,Drive Shack: 3Q Earnings Snapshot,Associated Press
Nov-08-18,Drive Shack Inc. Announces Leadership Additions and Third Quarter 2018 Earnings Results,Business Wire
Nov-08-18,New York City Officials Award Coveted Randalls Island Golf Center Site to Drive Shack,Business Wire
Nov-12-18,Edited Transcript of DS earnings conference call or presentation 8-Nov-18 2:00pm GMT,Thomson Reuters StreetEvents
