date,title,source
Nov-06-18,"Daktronics, Inc. to Release Second Quarter Fiscal 2019 Financial Results",GlobeNewswire
Nov-09-18,What Type Of Shareholder Owns Daktronics Incs (NASDAQ:DAKT)?,Simply Wall St.
Nov-16-18,"Daktronics, Inc. Adopts New Shareholder Rights Plan",GlobeNewswire
Nov-21-18,Why Daktronics Stock Popped 11%,Motley Fool
Nov-21-18,Daktronics Inc (DAKT) Q2 2019 Earnings Conference Call Transcript,Motley Fool
Nov-21-18,Daktronics: Fiscal 2Q Earnings Snapshot,Associated Press
Nov-21-18,"Daktronics, Inc. Announces Second Quarter Fiscal 2019 Results",GlobeNewswire
Nov-30-18,Daktronics Announces Quarterly Cash Dividend per Share,GlobeNewswire
Dec-10-18,Daktronics Inc (NASDAQ:DAKT): What Does Its Beta Value Mean For Your Portfolio?,Simply Wall St.
Jan-09-19,"Should You Worry About Daktronics, Inc.s (NASDAQ:DAKT) CEO Pay Cheque?",Simply Wall St.
Jan-30-19,"Investor Expectations to Drive Momentum within Stanley Black & Decker, Tempur Sealy International, Avis Budget Group, Penske Automotive Group, E.W. Scripps, and Daktronics  Discovering Underlying Factors of Influence",GlobeNewswire
Feb-04-19,"Daktronics, Inc. to Release Third Quarter Fiscal 2019 Financial Results",GlobeNewswire
Feb-04-19,Zooming in on NASDAQ:DAKTs 3.6% Dividend Yield,Simply Wall St.
Feb-20-19,Daktronics Inc (DAKT) Q3 2019 Earnings Conference Call Transcript,Motley Fool
Feb-20-19,Daktronics: Fiscal 3Q Earnings Snapshot,Associated Press
Feb-20-19,"Daktronics, Inc. Announces Third Quarter Fiscal 2019 Results",GlobeNewswire
Feb-21-19,Edited Transcript of DAKT earnings conference call or presentation 20-Feb-19 4:00pm GMT,Thomson Reuters StreetEvents
Feb-22-19,"When Should You Buy Daktronics, Inc. (NASDAQ:DAKT)?",Simply Wall St.
Mar-01-19,Daktronics Announces Quarterly Cash Dividend per Share,GlobeNewswire
Mar-11-19,Edited Transcript of DAKT earnings conference call or presentation 20-Feb-19 4:00pm GMT,Thomson Reuters StreetEvents
Mar-15-19,"Daktronics, Inc. (NASDAQ:DAKT) Insiders Have Been Selling",Simply Wall St.
Apr-04-19,"Here's What Daktronics, Inc.'s (NASDAQ:DAKT) P/E Is Telling Us",Simply Wall St.
Apr-22-19,"What Kind Of Investor Owns Most Of Daktronics, Inc. (NASDAQ:DAKT)?",Simply Wall St.
May-06-19,"Texas Rangers Introducing Nine Daktronics LED Video Displays, Fully-Integrated IPTV System At New Ballpark",GlobeNewswire
May-10-19,"Read This Before Buying Daktronics, Inc. (NASDAQ:DAKT) Shares",Simply Wall St.
May-14-19,"Daktronics, Inc. to Release Fourth Quarter and Fiscal 2019 Financial Results",GlobeNewswire
May-28-19,Daktronics Q4 Earnings Preview,Benzinga
May-29-19,Daktronics' Scoreboard Didn't Light Up in Q4,Motley Fool
May-29-19,Daktronics Inc (DAKT) Q4 2019 Earnings Call Transcript,Motley Fool
May-29-19,"Daktronics, Inc. to Host Earnings Call",ACCESSWIRE
May-29-19,Daktronics: Fiscal 4Q Earnings Snapshot,Associated Press
May-29-19,"Daktronics, Inc. Announces Fiscal and Fourth Quarter 2019 Results",GlobeNewswire
May-31-19,"Daktronics, Inc. Announces Quarterly Cash Dividend per Share",GlobeNewswire
Jun-07-19,"Daktronics Inc (DAKT) Files 10-K for the Fiscal Year Ended on April 30, 2019",GuruFocus.com
Jun-13-19,Edited Transcript of DAKT earnings conference call or presentation 29-May-19 3:00pm GMT,Thomson Reuters StreetEvents
