date,title,source
Oct-17-18,Clean Harbors to Announce Third-Quarter Financial Results on October 31,Business Wire
Oct-22-18,Pick These 5 Stocks With Stellar Relative Price Strength,Zacks
Oct-23-18,Waste Management (WM) To Report Q3 Earnings: What's in Store?,Zacks
Oct-23-18,"Zacks.com featured highlights include: Arch Coal, North American, Verso, EnLink and Clean Harbors",Zacks
Oct-24-18,Clean Harbors (CLH) Q3 Earnings Preview: How Are Events Shaping Up?,Zacks
Oct-24-18,Clean Harbors to Present at Bairds 2018 Industrial Conference,Business Wire
Oct-24-18,Republic Services (RSG) Q3 Earnings: What's in the Cards?,Zacks
Oct-29-18,Aptiv (APTV) to Report Q3 Earnings: What's in the Offing?,Zacks
Oct-29-18,What's in the Cards for Spotify (SPOT) This Earnings Season?,Zacks
Oct-29-18,Automatic Data Processing (ADP) Q1 Earnings: What's in Store?,Zacks
Oct-29-18,Clean Harbors (CLH) Q3 Earnings: Is a Beat in the Cards?,Zacks
Oct-31-18,Clean Harbors Inc (CLH) Q3 2018 Earnings Conference Call Transcript,Motley Fool
Oct-31-18,Clean Harbors (CLH) Q3 Earnings Top Estimates,Zacks
Oct-31-18,Clean Harbors: 3Q Earnings Snapshot,Associated Press
Oct-31-18,Clean Harbors Announces Third-Quarter 2018 Financial Results,Business Wire
Nov-01-18,Edited Transcript of CLH earnings conference call or presentation 31-Oct-18 1:00pm GMT,Thomson Reuters StreetEvents
Nov-01-18,"Clean Harbors (CLH) Tops Q3 Earnings Estimates, Updates View",Zacks
Nov-02-18,Edited Transcript of CLH earnings conference call or presentation 31-Oct-18 1:00pm GMT,Thomson Reuters StreetEvents
Nov-02-18,Norwell's Clean Harbors pledges to interview any soldier who wants a job,American City Business Journals
Nov-02-18,The Hidden Story Behind Clean Harbors' Strong Q3 Earnings,Motley Fool
Nov-05-18,Job Growth Breezes Past Estimates: 5 Business Services Picks,Zacks
