date,title,source
Nov-01-18,"ClearBridge Energy MLP Opportunity Fund Inc. Portfolio Composition as of September 30, 2018",Business Wire
Nov-06-18,ClearBridge American Energy MLP Fund Expected to be Removed from the Alerian MLP Closed End Fund Index,PR Newswire
Nov-07-18,"ClearBridge Energy MLP Opportunity Fund Inc. Announces Unaudited Balance Sheet Information as of October 31, 2018",Business Wire
Nov-08-18,ClearBridge American Energy MLP Fund Inc. and ClearBridge Energy MLP Opportunity Fund Inc. Announce Results of Joint Special Meeting of Stockholders: Proposal to Merge is Approved,Business Wire
Nov-12-18,"Legg Mason Partners Fund Advisor, LLC Announces Distributions for the Month of November 2018",Business Wire
Nov-19-18,ClearBridge Energy Midstream Opportunity Fund Inc. Announces Completion of Merger and Share Conversion Price and Reaffirms Name and Policy Change,Business Wire
Dec-07-18,"ClearBridge Energy Midstream Opportunity Fund Inc. Announces Unaudited Balance Sheet Information as of November 30, 2018",Business Wire
Jan-02-19,"Certain Closed-End Funds Advised by Legg Mason Partners Fund Advisor, LLC Announce Appointment of New Director and Retirements",Business Wire
