date,title,source
Oct-18-18,Dow tumbles 370 points as technology and communication-services stocks tank in midday trade,MarketWatch
Oct-22-18,5 incredible tools for VR game developers,American City Business Journals
Oct-23-18,"Autodesk, Flex veterans raise $179 million for manufacturing startup",Reuters
Oct-23-18,"Autodesk, Flex veterans raise $179 mln for manufacturing startup",Reuters
Oct-23-18,"Autodesk, Flex veterans raise $179 million for manufacturing startup",Reuters
Oct-23-18,"Market Trends Toward New Normal in PTC Therapeutics, AeroVironment, Autodesk, Coca-Cola Bottling Co. Consolidated, Akers Biosciences, and TEGNA  Emerging Consolidated Expectations, Analyst Ratings",GlobeNewswire
Oct-24-18,"Corrected: Autodesk, Flex veterans raise $179 mln for manufacturing startup",Reuters
Oct-24-18,"Autodesk, Flex veterans raise $179 mln for manufacturing startup",Reuters
Oct-25-18,Autodesk CIO Says AI Helps Human Worker Productivity,The Wall Street Journal
Oct-26-18,Moving Average Lines Help Lock In Swing Trading Profits,Investor's Business Daily
Oct-30-18,"Apple spruces up Macs, iPad Pros and raises prices",Reuters
Oct-30-18,"Apple spruces up Macs, iPad Pros and raises prices",Reuters
Oct-31-18,Jerome Dodson Comments on Autodesk,GuruFocus.com
Oct-31-18,Jerome Dodson's 3rd Quarter Endeavor Fund Shareholder Letter,GuruFocus.com
Nov-01-18,Autodesk Extends Invitation to Join Financial Results Conference Call,PR Newswire
Nov-12-18,Autodesk University 2018 Showcases the Future of Making,PR Newswire
Nov-13-18,Autodesk (ADSK) Reports Next Week: Wall Street Expects Earnings Growth,Zacks
Nov-15-18,Autodesk (ADSK) to Report Q3 Earnings: What's in the Cards?,Zacks
Nov-20-18,"Autodesk Earnings, Revenue beat in Q3",Investing.com
Nov-20-18,Autodesk snaps up S.F. construction planning software company in $875 million deal,American City Business Journals
Nov-20-18,Autodesk (ADSK) Q3 Earnings and Revenues Top Estimates,Zacks
Nov-20-18,"Stocks making the biggest moves after hours: Foot Locker, Autodesk and more",CNBC
Nov-20-18,"Autodesk stock surges after earnings, outlook beat",MarketWatch
Nov-20-18,Autodesk: Fiscal 3Q Earnings Snapshot,Associated Press
Nov-20-18,Autodesk to Acquire PlanGrid to Accelerate Construction Productivity,PR Newswire
Nov-20-18,Annualized Recurring Revenue (ARR) Growth Acceleration Highlights Autodesk's Third Quarter Results,PR Newswire
Nov-20-18,Autodesk's Q3 Earnings Outlook,Benzinga
Nov-21-18,"US STOCKS-S&P 500 gains with energy, tech but ends near day's low",Reuters
Nov-21-18,"Stocks - S&P Rebounds After Two-Day Rout, Led by Energy",Investing.com
Nov-21-18,"Why Autodesk, Inc. Shares Jumped 10% Higher Today",Motley Fool
Nov-21-18,Foot Locker and Autodesk jump while First Energy falls,Associated Press
Nov-21-18,"US STOCKS-S&P 500 gains with energy, tech but ends near day's low",Reuters
Nov-21-18,"Why Autodesk, BJ's Wholesale Club Holdings, and Bilibili Jumped Today",Motley Fool
Nov-21-18,Stock Market Rally Dampened As Dow Gives Up 200-Point Gain,Investor's Business Daily
Nov-21-18,3 Stocks Move Wednesday,GuruFocus.com
Nov-21-18,"US STOCKS-Wall St climbs as tech, internet stocks bounce back",Reuters
Nov-21-18,Autodesk shares surge on better-than-expected quarterly results and an optimistic forecast,CNBC
Nov-21-18,Stocks Today: Autodesk Soars On Earnings; Microsoft Leads Dow Jones,Investor's Business Daily
Nov-21-18,US STOCKS-Wall Street recovers as technology stocks bounce back,Reuters
Nov-21-18,US STOCKS-Wall Street regains footing as tech shares recover,Reuters
Nov-21-18,Analysts React To Autodesk's Earnings Beat,Benzinga
Nov-21-18,US STOCKS-Wall Street bounces back as tech shares recover,Reuters
Nov-21-18,Sequoia scores in PlanGrid's $875M sale to AutoDesk  Y Combinator's 3rd biggest M&A exit,American City Business Journals
Nov-21-18,"Stocks Bounce As 1 Retailer, 1 Tech Name Lead Early Gains",Investor's Business Daily
Nov-21-18,"Autodesk (ADSK) Q3 Earnings Beat, Revenues Increase Y/Y",Zacks
Nov-21-18,"[$$] Stocks to Watch: Amazon, Gap, Facebook, Apple",The Wall Street Journal
Nov-21-18,US STOCKS-Wall Street set to open higher as tech shares recover,Reuters
Nov-21-18,Autodesk to Present at Upcoming Investor Conferences,PR Newswire
Nov-21-18,"Stocks making the biggest move premarket: DE, AMZN, GS, BJ, GPS & more",CNBC
Nov-21-18,Today's Research Reports on Trending Tickers: Autodesk and Sphere 3D,ACCESSWIRE
Nov-23-18,Top VC deals: Chinese AI robots land $150 million; an esports league picks up a major league backer,CNBC
Nov-23-18,"Company News For Nov 23, 2018",Zacks
Nov-23-18,Autodesk (ADSK) Soars: Stock Adds 9.7% in Session,Zacks
Nov-23-18,Bitcoin (BTC): Nobody Knows You When Youre Down and Out,InvestorPlace
Nov-23-18,2 Tech Stocks That Have Defied the Downturn,Barrons.com
Nov-26-18,Today's Research Reports on Trending Tickers: Autodesk and Sphere 3D,ACCESSWIRE
Nov-28-18,Autodesk Is Showing a Bullish Pattern in the Charts,TheStreet.com
Nov-29-18,11 Still Expensive High-Quality Tech Stocks,Morningstar
Nov-30-18,"Analysis: Positioning to Benefit within Dicerna Pharmaceuticals, Sun Life Financial, Autodesk, Eagle Pharmaceuticals, Curis, and Accenture  Research Highlights Growth, Revenue, and Consolidated Results",GlobeNewswire
Dec-06-18,NVIDIA (NVDA) Takes GPUs a Notch Ahead with Titan RTX,Zacks
Dec-06-18,"Autodesk, Inc. (NASDAQ:ADSK): Are Hedge Funds Right About This Stock?",Insider Monkey
Dec-07-18,Why Autodesk Stock Jumped 12% in November,Motley Fool
Dec-07-18,"HMI Capitals Returns, AUM and Holdings",Insider Monkey
Dec-11-18,Volatility Presents Opportunities In These 5 Hedge Fund Stocks,Insider Monkey
Dec-12-18,"Is Autodesk, Inc. (NASDAQ:ADSK) Worth US$134 Based On Intrinsic Value?",Simply Wall St.
Dec-12-18,Volatility Presents Opportunities In These 5 Hedge Fund Stocks,Insider Monkey
Dec-13-18,Edited Transcript of ADSK earnings conference call or presentation 20-Nov-18 10:00pm GMT,Thomson Reuters StreetEvents
Dec-14-18,Autodesk Appoints Stephen Milligan to Board of Directors,PR Newswire
Dec-20-18,Autodesk acquires construction workflow management company for $275 million,American City Business Journals
Dec-20-18,Autodesk Adds To Construction Software Portfolio With Acquisition,Investor's Business Daily
Dec-20-18,Autodesk to acquire BuildingConnected for $275 million,MarketWatch
Dec-20-18,Autodesk (ADSK) Down 5.1% Since Last Earnings Report: Can It Rebound?,Zacks
Dec-20-18,"Autodesk to Acquire BuildingConnected, a Leading Construction Bid-Management Platform",PR Newswire
Dec-20-18,Autodesk Completes PlanGrid Acquisition,PR Newswire
Dec-21-18,Autodesk's Latest Acquisition Expands Construction Portfolio,Zacks
Dec-28-18,Bi-Partisan Bets on an Infrastructure Plan,MoneyShow
Jan-02-19,The five coolest aerospace innovations of 2018,MarketWatch
Jan-03-19,Autodesk Doubles Down on the Construction Industry,Motley Fool
Jan-03-19,Edited Transcript of ADSK earnings conference call or presentation 20-Nov-18 10:00pm GMT,Thomson Reuters StreetEvents
Jan-09-19,Why Autodesk Stock Gained 23% in 2018,Motley Fool
Jan-11-19,Check Out These 4 Stocks With Superb Earnings Acceleration,Zacks
Jan-14-19,Here are the 10 hottest Bay Area startups from the fourth quarter,American City Business Journals
Jan-14-19,"Zacks.com featured highlights include: Autodesk, Splunk, CNX and Entergy",Zacks
Jan-14-19,Why Shares of Autodesk Dropped 11.0% in December,Motley Fool
Jan-15-19,"This is how much Apple pays a typical employee  and how that compares to Google, Facebook, Netflix, Microsoft, Box and more",American City Business Journals
Jan-15-19,"30 Companies Where You Can Easily Earn Over $100,000",GOBankingRates
Jan-23-19,Autodesk Completes BuildingConnected Acquisition,PR Newswire
Jan-25-19,"Joe Montana, Carol Bartz join San Jose pot startup's $75M first round",American City Business Journals
Jan-31-19,3 Goldman Portfolios That Are Crushing The Market,Investopedia
Feb-01-19,Autodesk Extends Invitation to Join Financial Results Conference Call,PR Newswire
Feb-08-19,Why Autodesk Stock Gained 15% in January,Motley Fool
Feb-15-19,The typical Facebook employee earns double Silicon Valley's median household income. How 50+ big tech employers compare,American City Business Journals
Feb-19-19,Steve Mandel Starts 6 New Positions in 4th Quarter,GuruFocus.com
Feb-21-19,"IBD Stock Of The Day: This Software Firm Expands, Earnings Make Triple-Digit Jump",Investor's Business Daily
Feb-21-19,Autodesk (ADSK) Earnings Expected to Grow: What to Know Ahead of Next Week's Release,Zacks
Feb-22-19,"Analysis: Positioning to Benefit within Quest Diagnostics, Autodesk, Agios Pharmaceuticals, AMN Healthcare Services, Vistra Energy, and Helen of Troy  Research Highlights Growth, Revenue, and Consolidated Results",GlobeNewswire
Feb-25-19,Autodesk (ADSK) to Report Q4 Earnings: What's in the Cards?,Zacks
Feb-27-19,Day Ahead: Top 3 Things to Watch,Investing.com
Feb-28-19,Dow Jones Futures: Tesla Leads 7 Key Movers Late On Earnings,Investor's Business Daily
Feb-28-19,"Autodesk Earnings Top Forecasts For Fourth Quarter, But Guidance Soft",Investor's Business Daily
Feb-28-19,Autodesk shares rise following better-than-expected quarterly earnings,MarketWatch
Feb-28-19,Autodesk Reports Strong Fourth Quarter Results Led By Annualized Recurring Revenue (ARR),PR Newswire
Feb-28-19,"Stocks Moving After Hours: Autodesk, Nordstrom, Gap, Workday, Marriott, AMC",Investing.com
Feb-28-19,"Autodesk Earnings, Revenue beat in Q4",Investing.com
Feb-28-19,Autodesk Q4 Earnings Preview,Benzinga
Feb-28-19,"Stocks - Wall Street Drops on Geopolitical Fears, U.S. Growth Slowdown",Investing.com
Feb-28-19,Top 5 Things to Know in The Market on Thursday,Investing.com
Mar-01-19,AutoDesk CEO: We don't believe digitized design will slow down,CNBC Videos
Mar-01-19,3 Large-Cap Software Companies Release 4th-Quarter Financial Results,GuruFocus.com
Mar-01-19,"Dow Jones Gains Fade, But This Blue Chip Hits Buy Point",Investor's Business Daily
Mar-01-19,Autodesk (ADSK) Q4 Earnings &amp; Revenues Surpass Estimates,Zacks
Mar-01-19,"Stocks Rocket Higher; Nike Breaks Out, Dow Jones Surges 200 Points",Investor's Business Daily
Mar-01-19,Dow Jones Futures Rise On China; Tesla Leads 7 Key Movers On Earnings,Investor's Business Daily
Mar-01-19,Edited Transcript of ADSK earnings conference call or presentation 28-Feb-19 10:00pm GMT,Thomson Reuters StreetEvents
Mar-01-19,"Stocks - Gap, Foot Locker Surge in Premarket; Tesla Sinks",Investing.com
Mar-04-19,Edited Transcript of ADSK earnings conference call or presentation 28-Feb-19 10:00pm GMT,Thomson Reuters StreetEvents
Mar-05-19,Edited Transcript of ADSK earnings conference call or presentation 28-Feb-19 10:00pm GMT,Thomson Reuters StreetEvents
Mar-05-19,The $200K Club: Broadcom joins these Bay Area tech companies paying a typical employee top dollar,American City Business Journals
Mar-06-19,Bear of the Day: Autodesk (ADSK),Zacks
Mar-11-19,Why Autodesk Stock Popped Nearly 11% Last Month,Motley Fool
Mar-14-19,8 Fast-Growth Stocks That Can Lead as Bull Market Slows,Investopedia
Mar-15-19,Corporate Counsel awards: Autodesk's Alexandra Ross has helped build its privacy legal and governance team,American City Business Journals
Mar-20-19,6 Stocks With 'Pricing Power' Poised To Race Ahead of Market,Investopedia
Mar-21-19,Autodesk Extends Invitation to Join Investor Day Webcast,PR Newswire
Mar-25-19,"Autodesk Inc (ADSK) Files 10-K for the Fiscal Year Ended on January 31, 2019",GuruFocus.com
Mar-25-19,Autodesk Appoints Blake Irving to Board of Directors,PR Newswire
Mar-28-19,Autodesk Reaffirms First Quarter And Fiscal Year 2020 Outlook At Annual Investor Day,PR Newswire
Mar-29-19,"Were Hedge Funds Right About Piling Into Autodesk, Inc. (ADSK)?",Insider Monkey
Mar-29-19,Autodesk Analysts Talk Growth Drivers After Investor Day,Benzinga
Apr-01-19,Is Autodesk's (NASDAQ:ADSK) 229% Share Price Increase Well Justified?,Simply Wall St.
Apr-02-19,Autodesk (ADSK) Looks Good: Stock Adds 5.1% in Session,Zacks
Apr-02-19,Elon Musks CEO pay-to-worker ratio is the highest ever recorded  how it compares at other tech companies,American City Business Journals
Apr-03-19,IBD Stock Of The Day: Autodesk Climbs Following Upbeat Investor Day,Investor's Business Daily
Apr-05-19,New Strong Sell Stocks for April 5th,Zacks
Apr-09-19,The 10 Fastest-Growing Stocks to Invest In Right Now,InvestorPlace
Apr-10-19,"Autodesk Stock Breaks Out On Fresh Buy Rating, Positive Industry Outlook",Investor's Business Daily
Apr-10-19,"Public markets give companies the right value, says CFO",CNBC Videos
Apr-10-19,"FireEye joins major Bay Area employers like Facebook, Netflix, Google, Microsoft and Salesforce in paying a typical worker more than $150,000 per year",American City Business Journals
Apr-12-19,Stock market investors are split into bull and bear camps  taking the middle road is the way to go,MarketWatch
Apr-12-19,5 Stock Picks From Top-Rated TipRanks Analyst Richard Davis,Benzinga
Apr-12-19,"Here are the biggest analyst calls of the day: Disney, Apple, Autodesk, Murphy Oil, & more",CNBC
Apr-15-19,Stock market investors are split into bull and bear camps  taking the middle road is the way to go,MarketWatch
Apr-16-19,"Autodesk Analyst Positive On Momentum, Strategy, Positioning",Benzinga
Apr-24-19,Crawford W. Beveridge to Retire from Autodesk Board of Directors,PR Newswire
Apr-24-19,7 Stocks Ken Fisher Continues to Buy,GuruFocus.com
May-01-19,Autodesk Extends Invitation to Join Financial Results Conference Call,PR Newswire
May-06-19,Why Autodesk Stock Gained 14% in April,Motley Fool
May-07-19,"Netflix and Google now pay a typical employee more than $200K per year. Here's how that compares to Facebook, Intel, Twitter and other big Bay Area tech employers.",American City Business Journals
May-16-19,Autodesk (ADSK) Reports Next Week: Wall Street Expects Earnings Growth,Zacks
May-16-19,Why Autodesk (ADSK) is Poised to Beat Earnings Estimates Again,Zacks
May-20-19,Here's What to Expect From Autodesk's (ADSK) Q1 Earnings,Zacks
May-20-19,Analog Devices (ADI) to Report Q2 Earnings: What's in Store?,Zacks
May-21-19,Autodesk Expected to Earn 45 Cents a Share,TheStreet.com
May-23-19,Autodesk Inc (ADSK) Q1 2020 Earnings Call Transcript,Motley Fool
May-23-19,"Dow Jones Futures: Investors Fear Long China Trade War; Boeing, Splunk Move Late",Investor's Business Daily
May-23-19,"After Hours: Boeing's Possible Break, Autodesk's Q1 Whiff",Motley Fool
May-23-19,"Stocks making the biggest moves after hours: HP, Autodesk, Boeing and more",CNBC
May-23-19,Autodesk (ADSK) Q1 Earnings and Revenues Miss Estimates,Zacks
May-23-19,"Autodesk Earnings Miss Views In First Quarter, And Stock Tumbles",Investor's Business Daily
May-23-19,Autodesk falls on weak quarterly results and disappointing guidance,CNBC
May-23-19,"Autodesk stock falls nearly 7% on surprise Q1 loss, sales miss",MarketWatch
May-23-19,Autodesk: Fiscal 1Q Earnings Snapshot,Associated Press
May-23-19,"Autodesk, Inc. Announces Fiscal 2020 First Quarter Results",PR Newswire
May-23-19,"Autodesk Earnings inline, Revenue Misses In Q1",Investing.com
May-23-19,Autodesk Falls On Earnings,Investor's Business Daily Video
May-24-19,US STOCKS-Wall St edges higher after Trump sparks U.S.-China trade hopes,Reuters
May-24-19,Stocks close higher but Dow logs longest weekly losing streak since 2011,MarketWatch
May-24-19,Dow Ends Modestly Higher; Stocks Edge Up Ahead of Holiday Weekend,TheStreet.com
May-24-19,"HP, Hibbett rise; Foot Locker, Autodesk fall",Associated Press
May-24-19,"4 Top Stock Trades for Tuesday: ROKU, ADSK, SPLK, NVS",InvestorPlace
May-24-19,US STOCKS-Wall St clings to slight gains after Trump sparks U.S.-China trade hopes,Reuters
May-24-19,Analysts Hold Their Views On Autodesk Despite Mixed Quarter,Benzinga
May-24-19,US STOCKS-Wall St clings to gains on trade hopes,Reuters
May-24-19,Autodesk Stock Is Sliding After Its Earnings Barely Met the Low End of Its Expectations,Barrons.com
May-24-19,"Stocks making the biggest moves midday: Foot Locker, Autodesk, Intuit & more",CNBC
May-24-19,"Autodesk Shares Slump on Lower Earnings, Weak Guidance",TheStreet.com
May-24-19,US STOCKS-Wall Street gains on trade reprieve ahead of long weekend,Reuters
May-24-19,US STOCKS-Wall Street gains as trade tensions ease,Reuters
May-24-19,US STOCKS-Wall St set for modest gains at open after previous day's sell-off,Reuters
May-24-19,"Autodesk (ADSK) Q1 Earnings Miss Estimates, Revenues Up Y/Y",Zacks
May-24-19,US STOCKS-Futures attempt rebound after sharp sell-off in previous session,Reuters
May-24-19,"Stocks making the biggest moves premarket: Foot Locker, Amazon, HP Inc, Autodesk & more",CNBC
May-24-19,Semtech (SMTC) to Report Q1 Earnings: What's in the Offing?,Zacks
May-24-19,"Dow Jones Futures Rebound After China Trade War Sell-Off; Boeing, Splunk Move",Investor's Business Daily
May-24-19,Edited Transcript of ADSK earnings conference call or presentation 23-May-19 9:00pm GMT,Thomson Reuters StreetEvents
May-24-19,Stocks- U.S. Futures Rally After Trump Tones Down Huawei Rhetoric,Investing.com
May-28-19,"Company News For May 28, 2019",Zacks
May-29-19,Three Eye-Catching Metrics From Autodesk's First Quarter,Motley Fool
May-29-19,Autodesk to Present at Bank of America Merrill Lynch Global Technology Conference,PR Newswire
May-30-19,"How a Bay Area banker, hotelier and former salsa studio owner doubled their salaries",American City Business Journals
Jun-03-19,"Top Stock Reports for Amazon, Procter & Gamble & UnitedHealth",Zacks
Jun-03-19,Edited Transcript of ADSK earnings conference call or presentation 23-May-19 9:00pm GMT,Thomson Reuters StreetEvents
Jun-03-19,New Strong Sell Stocks for June 3rd,Zacks
