date,title,source
Oct-18-18,A Look At The Intrinsic Value Of Yamana Gold Inc (TSE:YRI),Simply Wall St.
Oct-25-18,"Yamana Gold Announces Solid Quarter From Cerro Moro & Overall Portfolio, Increases Guidance for Gold and Copper Production While Lowering Guidance for Operating Costs",GlobeNewswire
Oct-25-18,Yamana Gold Announces the Sale of the Gualcamayo Mine and Grants an Option for the La Pepa Project,GlobeNewswire
Oct-25-18,Yamana Gold Declares Fourth Quarter Dividend,GlobeNewswire
Oct-25-18,Yamana Gold Inc (TSE:YRI): Time For A Financial Health Check,Simply Wall St.
Oct-25-18,Yamana Gold's Q3 Earnings Outlook,Benzinga
