date,title,source
Oct-18-18,BEK Communications Redefines Customer Support for Subscribers with New Insights from Calix Support Cloud,GlobeNewswire
Oct-23-18,"CableSouth Media3 Launches Next-Generation Services for Rural Business Customers, Partnering with Momentum Telecom to Deploy a Future Proof Software Defined Network with Calix AXOS",GlobeNewswire
Oct-29-18,ALLO Communications Looks to Elevate Subscriber Experience with Exclusive Smart Home Solution Powered by Calix,GlobeNewswire
Oct-29-18,"Calix Launches the Ultimate Smart Home System, Enabling Service Providers to Deploy Cutting-Edge Solutions That Their Subscribers Cant Find in Retail Stores",GlobeNewswire
Oct-29-18,Service Providers Can Now Elevate Their Business Models by Seizing Control of the Burgeoning Smart Home and Business Opportunity,GlobeNewswire
Oct-30-18,Verizon and Calix achieved speeds of 8 Gbps using NGPON2 technology,GlobeNewswire
Oct-30-18,"Calix Delivers AXOS Intelligent Access Edge, Enabling Service Providers to Simplify Network Architecture and Operations, Dramatically Reducing Total Cost of Ownership",GlobeNewswire
Oct-31-18,Calix Innovation Awards Recognize Outstanding Achievements from Six Broadband Service Providers,GlobeNewswire
Nov-01-18,Triangle Communications Shines as the Inaugural Winner of the Innovations in Marketing Award at Calix ConneXions 2018,GlobeNewswire
Nov-05-18,Calix Releases Third Quarter 2018 Financial Results,GlobeNewswire
Nov-06-18,Why Calix Inc. Stock Jumped Today,Motley Fool
Nov-06-18,How Much Of Calix Inc (NYSE:CALX) Do Insiders Own?,Simply Wall St.
Nov-06-18,Calix to Participate in Upcoming Investor Conferences,GlobeNewswire
Nov-08-18,"Infosys and GLDS Recognized with Calix Partnership Innovation Awards for Enabling Customers to Deploy Future-Proof Networks, Accelerating Adoption of AXOS Platforms",GlobeNewswire
Nov-13-18,Latest Calix Cloud Release Enables Service Providers to Elevate Revenue and Subscriber Experience with New Insights into Smart Home Device Utilization and Network Capacity,GlobeNewswire
Nov-13-18,"Analysis: Positioning to Benefit within Calix, Majesco, Era Group, Strattec Security, Safety, Income and Growth, and Herbalife LTD  Research Highlights Growth, Revenue, and Consolidated Results",GlobeNewswire
Nov-14-18,Edited Transcript of CALX earnings conference call or presentation 5-Nov-18 10:00pm GMT,Thomson Reuters StreetEvents
Nov-14-18,Melita selects Calix AXOS to Enhance its Fiber Infrastructure and Provide Always-On Network Services to Businesses Customers Across Malta,GlobeNewswire
Nov-15-18,Edited Transcript of CALX earnings conference call or presentation 5-Nov-18 10:00pm GMT,Thomson Reuters StreetEvents
Nov-20-18,Firefly Fiber Broadband Partners with Calix to Leverage End-to-End Solutions that Deliver World Class Broadband and Wi-Fi Services While Preparing for the Future of the Smart Home,GlobeNewswire
Nov-29-18,Dickey Rural Networks Dramatically Simplifies Their Operations and Accelerates Their Path to Gigabit Services by Embracing AXOS,GlobeNewswire
Dec-06-18,Calix Announces New Remote Monitoring Service That Delivers Radical Improvements In Network Operations Efficiency,GlobeNewswire
Dec-13-18,Nex-Tech Embraces Calix Mesh-Enhanced Carrier Class Wi-Fi Solution to Provide an Exceptional and Differentiated Subscriber Experience,GlobeNewswire
Dec-14-18,"Calix, Inc. (NYSE:CALX): Time For A Financial Health Check",Simply Wall St.
Dec-20-18,Edited Transcript of CALX earnings conference call or presentation 5-Nov-18 10:00pm GMT,Thomson Reuters StreetEvents
Dec-20-18,"Calix Adds Connect America Fund Phase II Performance Testing to Smart Home and Business Solution, Enabling Service Providers to Meet Requirements Ahead of FCC Deadline",GlobeNewswire
Jan-09-19,Calix to Post Fourth Quarter 2018 Stockholder Letter with Results on February 5th,GlobeNewswire
Jan-10-19,Range Companies Realize Immediate Reduction of Operating Expenses and Massive Return on Investment from Improving Subscriber Experience through Calix Support Cloud,GlobeNewswire
Jan-17-19,Winnebago Cooperative Telecom Association Selects Calix GigaSpire Powered by EXOS to Elevate Member Experience in the Smart Home with Best Available Wi-Fi,GlobeNewswire
Jan-24-19,"ADTRAN (ADTN) Q4 Loss Wider Than Estimated, Revenues Up Y/Y",Zacks
Jan-29-19,Calix (CALX) Earnings Expected to Grow: Should You Buy?,Zacks
Jan-31-19,Service Providers Can Elevate Revenue and Deliver Exceptional Subscriber Experience with Expanded Portfolio of EXOS-Powered Solutions and Capabilities,GlobeNewswire
Feb-04-19,FTC Jumps on Board with Calix to Enhance Subscriber Experience and Lay Foundation for Smart Home,GlobeNewswire
Feb-04-19,"FTC Dramatically Simplifies Network Operations with AXOS, Cuts OSS/BSS Integration Time from 18 Months to Just 10 Weeks",GlobeNewswire
Feb-05-19,Calix Releases Fourth Quarter 2018 Financial Results,GlobeNewswire
Feb-06-19,Why Calix Stock Was Slammed Wednesday,Motley Fool
Feb-06-19,Edited Transcript of CALX earnings conference call or presentation 5-Feb-19 10:00pm GMT,Thomson Reuters StreetEvents
Feb-06-19,Calix Inc (CALX) Q4 2018 Earnings Conference Call Transcript,Motley Fool
Feb-07-19,Edited Transcript of CALX earnings conference call or presentation 5-Feb-19 10:00pm GMT,Thomson Reuters StreetEvents
Feb-14-19,"Is Calix, Inc.s (NYSE:CALX) CEO Paid At A Competitive Rate?",Simply Wall St.
Feb-14-19,Calix Marketing Cloud Adds Machine Learning Capabilities for Behavioral Analytics-Based Churn Prediction,GlobeNewswire
Feb-19-19,Calix Delivers Speed and Simplicity for Active Ethernet with New AXOS Systems and Services,GlobeNewswire
Feb-22-19,Weak Data Day Puts Winning Streak in Jeopardy,Zacks
Feb-26-19,New Reporting and Analytics Portal for the Calix Remote Monitoring Service Makes it Easier Than Ever to Cut Issue Resolution Times by Up to 50 Percent,GlobeNewswire
Mar-04-19,Zayo Chosen by Fintech Company for Wavelengths Solution,Zacks
Mar-08-19,Bandwidth (BAND) Surges: Stock Moves 10.8% Higher,Zacks
Mar-12-19,BrightRidge Partners With Calix to Electrify Its Utility Business With Fiber Broadband Service,GlobeNewswire
Mar-20-19,SCTelcom Recovers Cloud Investment Just Four Months After Turn Up Thanks to Calix Customer Success Services,GlobeNewswire
Mar-22-19,Grim Outlook for Communication Infrastructure Industry,Zacks
Mar-25-19,Zayo Chosen by Cloud Infrastructure Provider for Connectivity,Zacks
Apr-01-19,"New Research Coverage Highlights International Paper, Square, Sealed Air, Calix, e.l.f. Beauty, and Cytokinetics  Consolidated Revenues, Company Growth, and Expectations for 2019",GlobeNewswire
Apr-02-19,Viasat Unveils Hybrid In-Flight Connectivity Antenna System,Zacks
Apr-02-19,Zayo (ZAYO) Chosen by Infrastructure as a Service Provider,Zacks
Apr-02-19,IdeaTek Partners with Calix to Dramatically Simplify Network Operations and Deliver an Exceptional Subscriber Experience,GlobeNewswire
Apr-09-19,Groundbreaking Smart Home Campaign Sets New Standards for Success and Garners Major Broadband Marketing Award,GlobeNewswire
Apr-10-19,Calix Updates First Quarter 2019 Financial Guidance and Announces Release Date of First Quarter 2019 Stockholder Letter and Results,GlobeNewswire
Apr-11-19,Canadas Tbaytel Outpaces the Competition and Generates New Revenue Streams with Calix Managed Wi-Fi Solution,GlobeNewswire
Apr-17-19,"Cruzio Powers the Tech-Savvy Heart of Santa Cruz County with a Simplified, Future-Proof Network Built on Calix AXOS",GlobeNewswire
Apr-24-19,"Did Calix, Inc. (NYSE:CALX) Insiders Buy Up More Shares?",Simply Wall St.
Apr-24-19,Calix (CALX) May Report Negative Earnings: Know the Trend Ahead of Next Week's Release,Zacks
May-01-19,Calix (CALX) Q1 2019 Earnings Call Transcript,Motley Fool
May-01-19,"Calix (CALX) Reports Q1 Loss, Lags Revenue Estimates",Zacks
May-01-19,Calix: 1Q Earnings Snapshot,Associated Press
May-01-19,Calix Releases First Quarter 2019 Financial Results,GlobeNewswire
