date,title,source
Oct-17-18,JBS Investments II GmbH -- Moody's upgrades JBS S.A. ratings to Ba3 and assigns Ba3 rating to proposed notes; stable outlook,Moody's
Oct-18-18,"Consolidated Research: 2018 Summary Expectations for Barnes & Noble, Boot Barn, Endologix, Pilgrim's Pride, OraSure Technologies, and Genesco  Fundamental Analysis, Key Performance Indications",GlobeNewswire
Oct-24-18,Pilgrim's Pride (PPC) Q3 Earnings Preview: What to Know Ahead of the Release,Zacks
Oct-30-18,Pilgrim's Pride (PPC) Q3 Earnings: High Costs Dim Prospects,Zacks
Oct-31-18,Pilgrim's Pride (PPC) Q3 Earnings and Revenues Lag Estimates,Zacks
Oct-31-18,Pilgrim's Pride: 3Q Earnings Snapshot,Associated Press
Oct-31-18,Pilgrims Pride Announces Initiation of a New $200 Million Share Repurchase Program,GlobeNewswire
Oct-31-18,"Pilgrims Pride Reports Net Sales of $2.70 Billion, Operating Income of $85 Million and GAAP EPS of $0.12 for the Third Quarter of 2018",GlobeNewswire
Nov-01-18,Edited Transcript of PPC earnings conference call or presentation 1-Nov-18 1:00pm GMT,Thomson Reuters StreetEvents
Nov-01-18,What You Must Know About Pilgrims Pride Corporations (NASDAQ:PPC) Financial Strength,Simply Wall St.
Nov-01-18,"Pilgrim's Pride (PPC) Stock Down on Dismal Q3 Earnings, Sales",Zacks
Nov-12-18,Edited Transcript of PPC earnings conference call or presentation 1-Nov-18 1:00pm GMT,Thomson Reuters StreetEvents
Nov-13-18,Edited Transcript of PPC earnings conference call or presentation 1-Nov-18 1:00pm GMT,Thomson Reuters StreetEvents
Nov-13-18,"U.S. pigs out on bacon, ribs as trade wars cut chicken demand",Reuters
Nov-14-18,Edited Transcript of PPC earnings conference call or presentation 1-Nov-18 1:00pm GMT,Thomson Reuters StreetEvents
Nov-28-18,"Consolidated Research: 2018 Summary Expectations for Ocwen Financial, Inovalon, Reading International, Cutera, Sunrun, and Pilgrim's Pride  Fundamental Analysis, Key Performance Indications",GlobeNewswire
Nov-30-18,Pilgrim's Pride (PPC) Up 3.9% Since Last Earnings Report: Can It Continue?,Zacks
Dec-07-18,FinFit Announces Partnership with Pilgrims Pride Corporation,Business Wire
Dec-10-18,Pilgrim's Pride (PPC) Hurt by Volatility in Chicken Market,Zacks
Dec-31-18,"Despite Softer Outlook, Pilgrim's Pride Is Attractively Valued",Morningstar
Jan-08-19,Can Pilgrim's Pride's Growth Strategies Revive the Stock?,Zacks
Jan-08-19,Pilgrims Pride Corporation (NASDAQ:PPC) Delivered A Better ROE Than Its Industry,Simply Wall St.
Jan-09-19,Pilgrims Pride Drops Some Chicken Welfare Claims Amid Scalding Complaint,Bloomberg
Jan-17-19,Restructuring to Drive Kimberly-Clark's (KMB) Q4 Earnings,Zacks
Jan-24-19,"Pilgrims Pride Corporation to Host Year End 2018 Earnings Call on February 14, 2019",GlobeNewswire
Jan-24-19,Hershey (HSY) Q4 Earnings to Gain on Buyouts &amp; Savings Plans,Zacks
Jan-28-19,Sysco (SYY) to Post Q2 Earnings: Can Endeavors Check Costs?,Zacks
Feb-01-19,Kellogg (K) to Post Q4 Earnings: Cost Woes Likely to Linger?,Zacks
Feb-04-19,Is Pilgrims Pride Corporations (NASDAQ:PPC) 13% ROCE Any Good?,Simply Wall St.
Feb-06-19,Earnings Preview: Pilgrim's Pride (PPC) Q4 Earnings Expected to Decline,Zacks
Feb-12-19,Pilgrim's Pride (PPC) Q4 Earnings: Will Chicken Woes Persist?,Zacks
Feb-13-19,Pilgrim's Pride: 4Q Earnings Snapshot,Associated Press
Feb-13-19,"Pilgrims Pride Ends Fiscal Year 2018 with Net Sales of $10.94 Billion, Operating Income of $496 Million and GAAP EPS of $1.00",GlobeNewswire
Feb-14-19,Pilgrims Pride Corp (PPC) Q4 2018 Earnings Conference Call Transcript,Motley Fool
Feb-14-19,"Pilgrim's Pride (PPC) Q4 Earnings Lag, Weak Regions Hurt",Zacks
Feb-22-19,How Many Insiders Sold Pilgrims Pride Corporation (NASDAQ:PPC) Shares?,Simply Wall St.
Mar-01-19,"Pilgrim's Pride Looks Bland on Commodity Chicken, Cost Woes",Zacks
Mar-04-19,"Pilgrim's Pride to Host Annual Meeting of Shareholders on May 1, 2019",GlobeNewswire
Mar-04-19,"Stocks Moving After Hours: Salesforce.com, Google, Arcosa, Floor and Decor",Investing.com
Mar-07-19,Edited Transcript of PPC earnings conference call or presentation 14-Feb-19 2:00pm GMT,Thomson Reuters StreetEvents
Mar-12-19,Fight Over Pilgrims Pride Chicken Claims Expands to Seven States,Bloomberg
Mar-12-19,Should We Worry About Pilgrims Pride Corporations (NASDAQ:PPC) P/E Ratio?,Simply Wall St.
Mar-12-19,Can Campbell's Portfolio-Review Efforts Help Pare Challenges?,Zacks
Mar-15-19,Pilgrim's Pride shareholders can pursue Moy Park deal suit,Associated Press
Mar-15-19,Pilgrim's Pride shareholders can pursue Moy Park deal suit,Associated Press
Mar-15-19,"JBS, Pilgrim's Pride execs face U.S. trial in lawsuit over Moy Park deal",Reuters
Mar-15-19,Pilgrim's Pride (PPC) Up 7.2% Since Last Earnings Report: Can It Continue?,Zacks
Mar-22-19,Jayson Penn to Succeed Bill Lovette as Global CEO of Pilgrims Pride,GlobeNewswire
Mar-25-19,"Report: Exploring Fundamental Drivers Behind ON Semiconductor, Pilgrim's Pride, Merck & Co., Healthcare Services Group, Genomic Health, and Spectrum Pharmaceuticals  New Horizons, Emerging Trends, and Upcoming Developments",GlobeNewswire
Mar-28-19,Here's Why Kraft Heinz Appears Unappetizing Since Q4 Results,Zacks
