date,title,source
Oct-17-18,Adams Natural Resources Fund Reports Nine-Month Results,PR Newswire
Oct-17-18,Adams Diversified Equity Fund Reports Nine-Month Results,PR Newswire
Nov-15-18,Adams Natural Resources Fund Declares Year-End Distribution,PR Newswire
Nov-15-18,Adams Diversified Equity Fund Declares Year-End Distribution; Exceeds Its Annual 6% Minimum Distribution Rate Commitment,PR Newswire
Dec-11-18,"Bank Polska Kasa Opieki S.A. -- Moody's affirms deposits ratings of Bank Polska Kasa Opieki S.A., stable outlook maintained",Moody's
