date,title,source
Oct-18-18,"Investor Expectations to Drive Momentum within Aethlon Medical, Jaguar Animal Health, Advaxis, Forestar Group, Platform Specialty Products, and AVEO Pharmaceuticals  Discovering Underlying Factors of Influence",GlobeNewswire
Oct-24-18,"Jaguar Health, Inc. to Host Investor Meetings at Dawson James Small Cap Growth Conference Tuesday, October 30, 2018 in Jupiter, Florida",ACCESSWIRE
Oct-29-18,The Brilliance Behind a Global Operator of Crypto Exchanges BitMax: Understanding the Trans-Fee Mining Model,ACCESSWIRE
Oct-29-18,"Jaguar Health, Inc. Expects to File Third-Quarter 2018 Financial Results November 14th",ACCESSWIRE
Nov-13-18,"Reminder: Jaguar Health, Inc. Will Release 3Q'18 Financial Results After Market on November 14th",ACCESSWIRE
