date,title,source
Oct-17-18,"Cramer's lightning round: For growth and yield, go with V...",CNBC Videos
Oct-17-18,"Cramer's lightning round: For growth and yield, go with Verizon over Kraft Heinz",CNBC
Oct-17-18,"Matterhorn Merger Sub, LLC -- Moody's places Matterhorn now known as H-Food Holdings (Hearthside) rating on review for downgrade",Moody's
Oct-18-18,Why Warren Buffett and a Wal-Mart Heir Want a Slice of This Brazilian Payments IPO,IPO-Edge.com
Oct-19-18,The 25 Biggest U.S. IPOs of All Time,Kiplinger
Oct-19-18,Beauty Sales Make Procter & Gamble Shine,GuruFocus.com
Oct-19-18,12 Stocks May Plunge as Investors 'Harvest' Tax Losses,Investopedia
Oct-22-18,Today's Research Reports on Trending Tickers: The Kraft Heinz and Campbell Soup,ACCESSWIRE
Oct-23-18,"Morning News Call - India, October 24",Reuters
Oct-24-18,"Morning News Call - India, October 25",Reuters
Oct-24-18,Beware the Roving Bear: Cramer's 'Mad Money' Recap (Wednesday 9/12/18),TheStreet.com
Oct-24-18,Kraft Heinz to sell part of India business for about $630 million,Reuters
Oct-24-18,Kraft Heinz to sell part of India business for about $630 mln,Reuters
Oct-24-18,"Kraft Heinz to Sell Indian Brands Complan, Glucon-D, Nycil and Sampriti to Zydus Wellness Limited",Business Wire
Oct-24-18,Exclusive: Billionaire family behind Tetra Pak revealed as mystery IFF shareholder,Reuters
Oct-25-18,Kraft Heinz (KHC) Q3 Earnings Preview: What's in the Cards?,Zacks
Oct-25-18,Why the Earnings Surprise Streak Could Continue for Kraft (KHC),Zacks
Oct-26-18,"Investor Expectations to Drive Momentum within Adient, BT Group, The Kraft Heinz, Teladoc, Oracle, and Akcea Therapeutics  Discovering Underlying Factors of Influence",GlobeNewswire
Oct-29-18,Will Sprouts Farmers' (SFM) Earnings Continue to Rise in Q3?,Zacks
Oct-29-18,Kraft Heinz (KHC) Q3 Earnings: Weak U.S Segment a Worry,Zacks
Oct-31-18,Jim Cramer's Thoughts on Alibaba and Kraft-Heinz Earnings,TheStreet.com
Oct-31-18,An American Airlines Director Buys Stock Near a Two-Year Low,Barrons.com
Oct-31-18,Should You Buy Kraft Heinz (KHC) Ahead of Earnings?,Zacks
Nov-01-18,The Kraft Heinz Company (KHC) Q3 2018 Earnings Conference Call Transcript,Motley Fool
Nov-01-18,[$$] Kraft Heinzs Profit Suffers as Costs Rise,The Wall Street Journal
Nov-01-18,"Kraft Heinz Earnings miss, Revenue beats In Q3",Investing.com
Nov-01-18,U.S. judge shreds main claim in Parmesan cheese labeling lawsuits,Reuters
Nov-01-18,[$$] Kraft Heinz's Profit Suffers as Costs Rise,The Wall Street Journal
Nov-01-18,"Kraft Heinz earnings disappoint as costs surge, shares slide",Reuters
Nov-01-18,Kraft Heinz Stock Plummets on Q3 Earnings Miss,InvestorPlace
Nov-01-18,Kraft Heinz (KHC) Misses Q3 Earnings Estimates,Zacks
Nov-01-18,"Stocks making the biggest moves after hours: Apple, Starbucks and more",CNBC
Nov-01-18,Kraft Heinz Shares Sink as Higher Costs Weigh Down Results,Bloomberg
Nov-01-18,Kraft Heinz shares slump on weaker-than-expected third-quarter earnings,MarketWatch
Nov-01-18,Kraft: 3Q Earnings Snapshot,Associated Press
Nov-01-18,Kraft Heinz Reports Third Quarter 2018 Results,Business Wire
Nov-01-18,The Kraft Heinz Company Declares Regular Quarterly Dividend of $0.625 Per Share,Business Wire
Nov-01-18,Kraft Heinz stock plunges on earnings miss,CNBC Videos
Nov-01-18,Jim Cramer's Thoughts on Alibaba and Kraft-Heinz Earnings,TheStreet.com
Nov-01-18,Stocks- U.S. Futures Rise as Market Recovery Continues,Investing.com
Nov-01-18,Top 5 Things to Know in The Market on Thursday,Investing.com
Nov-05-18,"Bulls & Bears Of The Week: Amazon, Apple, Ford, GE And More",Benzinga
Nov-05-18,52-Week Company Lows,GuruFocus.com
Nov-05-18,Should You Buy The Kraft Heinz Company (NASDAQ:KHC) For Its Dividend?,Simply Wall St.
Nov-05-18,"Company News For Nov 5, 2018",Zacks
Nov-05-18,Kraft-Heinz shares battered after earnings miss by a wide mark,MarketWatch
Nov-05-18,Edited Transcript of KHC earnings conference call or presentation 1-Nov-18 9:00pm GMT,Thomson Reuters StreetEvents
Nov-06-18,Edited Transcript of KHC earnings conference call or presentation 1-Nov-18 9:00pm GMT,Thomson Reuters StreetEvents
Nov-06-18,[$$] Finding Stocks to Buy in an Era of Rising Prices,The Wall Street Journal
Nov-06-18,"H-Food Holdings, LLC -- Moody's confirms H-Food Holdings (Hearthside) B3 CFR; outlook is stable",Moody's
Nov-06-18,Kraft to sell Canadian natural cheese operations to Parmalat,Reuters
Nov-06-18,Kraft Heinz to sell natural cheese operations in Canada for $1.23 bln,Reuters
Nov-06-18,Kraft Heinz to sell natural cheese operations in Canada for $1.23 bln,Reuters
Nov-06-18,Kraft Heinz Canada Announces Agreement to Sell Its Natural Cheese Business to Parmalat,Business Wire
Nov-06-18,"Amazon, Pandora, PTC Therapeutics, and More: Why These Stocks Are Trending",Insider Monkey
Nov-07-18,Earningspalooza Hits Full Swing,Motley Fool
Nov-07-18,Kraft to sell Canada natural cheese business to Parmalat,Reuters
Nov-08-18,7 Safe Dividend Stocks to Buy Now,InvestorPlace
Nov-09-18,Warren Buffett Takes 11% Stake in Stoneco,GuruFocus.com
Nov-09-18,Kraft Heinz (KHC) Gains As Market Dips: What You Should Know,Zacks
Nov-09-18,Kraft Heinz selling Canadian natural cheese business for $1.23B,American City Business Journals
Nov-09-18,"Campbell's cookie unit Arnott's attracts attention from Kraft Heinz, Mondelez",CNBC
Nov-09-18,3 Dividend Stocks That Pay You More Than Coca-Cola Does,Motley Fool
Nov-12-18,"Kellogg explores sale of cookies, fruit snacks businesses",Reuters
Nov-12-18,"[$$] Prada, Starbucks and Kraft censured over human rights transparency",Financial Times
Nov-13-18,"U.S. pigs out on bacon, ribs as trade wars cut chicken demand",Reuters
Nov-14-18,Kellogg Stock Slides as Outlook Fails to Impress,Barrons.com
Nov-15-18,George Soros' Top 6 Buys in 3rd Quarter,GuruFocus.com
Nov-15-18,JELL-O PLAY Introduces First Slime You Can Eat,Business Wire
Nov-16-18,"Element Capital Managements Returns, AUM, and Holdings",Insider Monkey
