date,title,source
Oct-18-18,"Amira Nature Foods, Ltd (ANFI) Regains Compliance with NYSE Continued Listing Standards",Business Wire
Nov-07-18,Does Amira Nature Foods Ltds (NYSE:ANFI) CEO Pay Reflect Performance?,Simply Wall St.
Dec-17-18,"Amira Nature Foods, Ltd. Receives a Continued Listing Standard Letter from the NYSE",Business Wire
Dec-27-18,"Stocks to Watch Before The Opening Bell on December 27, 2018",ACCESSWIRE
Dec-27-18,Amira Nature Foods Ltd Announces $30 Million Contract with Repeat Customer,Business Wire
Jan-22-19,"Amira Nature Foods Ltd Announces Appointment of Thomas Dennhardt as CEO of Its German Subsidiary, Amira Basmati Rice GmbH",Business Wire
Feb-07-19,"Amira Nature Foods, Ltd Announces 2018 Annual General Meeting",Business Wire
