date,title,source
Nov-14-18,"China Rapid Finance to Announce Third Quarter 2018 Financial Results on November 20, 2018",PR Newswire
Nov-20-18,China Rapid Finance Limited (NYSE:XRF) Is Expected To Breakeven,Simply Wall St.
Dec-10-18,Additional Senior Talent Joins Executive Team at China Rapid Finance,PR Newswire
Dec-18-18,Edited Transcript of XRF.N earnings conference call or presentation 21-Nov-18 1:00am GMT,Thomson Reuters StreetEvents
Jan-08-19,Edited Transcript of XRF.N earnings conference call or presentation 21-Nov-18 1:00am GMT,Thomson Reuters StreetEvents
