date,title,source
Oct-19-18,"Centennial Resource Development, Inc. Announces Third Quarter 2018 Earnings Conference Call",GlobeNewswire
Nov-05-18,Centennial Resource Development Announces Third Quarter 2018 Financial and Operational Results,GlobeNewswire
Nov-30-18,New Strong Sell Stocks for November 30th,Zacks
Dec-03-18,What Makes Centennial Resource (CDEV) a Strong Sell?,Zacks
Dec-17-18,Moving Average Crossover Alert: CENTENNIAL RES,Zacks
Dec-21-18,U.S. shale producers hit the brakes on 2019 spending,Reuters
Dec-21-18,U.S. shale producers hit the brakes on 2019 spending,Reuters
Dec-26-18,Moving Average Crossover Alert: Centennial Resource Development,Zacks
Jan-09-19,What Makes Centennial Resource (CDEV) a Strong Sell?,Zacks
