date,title,source
Oct-17-18,Can Lockheed (LMT) Keep the Earnings Surprise Streak Alive?,Zacks
Oct-17-18,New Lockheed Martin-Built Protected Communications Satellite Confirmed Online in Orbit Following Successful Launch,PR Newswire
Oct-18-18,[$$] U.S.-Saudi Defense Ties on Track to Weather Controversy,The Wall Street Journal
Oct-18-18,Lockheed Martin (LMT) Dips More Than Broader Markets: What You Should Know,Zacks
Oct-18-18,[$$] U.S.-Saudi Defense Ties on Track to Weather Controversy,The Wall Street Journal
Oct-18-18,"Local rocket, spacecraft builders hiring 400+ workers",American City Business Journals
Oct-18-18,"1+1 = $16B: Harris Corp., L3 Technologies merger shakes up defense industry",American City Business Journals
Oct-18-18,Lockheed Martin (LMT) to Report Q3 Earnings: What's in Store?,Zacks
Oct-19-18,Trump to meet defense and aerospace CEOs to talk supply chain: report,MarketWatch
Oct-19-18,"Trump to meet heads of Boeing, Lockheed, Northrop at Arizona air base",Reuters
Oct-19-18,Canada gives Lockheed Martin first chance to bid on warships design,Reuters
Oct-19-18,JP Morgan's Jamie Dimon makes his biggest bet on Silicon Valley with new 'fintech campus',CNBC
Oct-19-18,"NASA aims to land payloads on Moon next year, signaling more local space activity",American City Business Journals
Oct-19-18,Belgium seen picking Lockheed F-35 over Eurofighter,Reuters
Oct-22-18,Here are OBJ's 2018 40 Under 40 honorees  Part 3,American City Business Journals
Oct-22-18,Lockheed Martin's Q3 Earnings Outlook,Benzinga
Oct-22-18,Raytheon to lay off 52 local workers after loss of $3.5B military deal,American City Business Journals
Oct-22-18,"China's Stock Market Rally & Earnings Previews for CAT, MCD, and LMT",Zacks
Oct-22-18,Will Lower 737 Deliveries Mar Boeing's (BA) Q3 Earnings?,Zacks
Oct-22-18,Report: Belgium ready to buy billions worth of F-35s,American City Business Journals
Oct-22-18,Belgium chooses Lockheed's F-35 over Eurofighter: Belga,Reuters
Oct-22-18,Belgium chooses Lockheed's F-35 over Eurofighter -Belga,Reuters
Oct-22-18,US May Exit Weapons Pact With Russia: 2 Defense Stocks to Buy,Zacks
Oct-22-18,"The Zacks Analyst Blog Highlights: Boeing, L3, Leidos and Lockheed",Zacks
Oct-23-18,[$$] Lockheed Martin Eyes Higher Sales,The Wall Street Journal
Oct-23-18,"Lockheed Martin Tops Earnings, Revenue Estimates",TheStreet.com
Oct-23-18,Lockheed Martin Corp (LMT) Q3 2018 Earnings Conference Call Transcript,Motley Fool
Oct-23-18,Fort Worth-made F-35s lift Lockheed Martin earnings,American City Business Journals
Oct-23-18,How Lockheed thinks Saudi turmoil could impact sales,American City Business Journals
Oct-23-18,[$$] Lockheed Martin Eyes Higher Sales,The Wall Street Journal
Oct-23-18,The Tesla Value Case & Why Stocks Are Looking Volatile Again,Zacks
Oct-23-18,"Lockheed Martin profit beats, downplays Saudi exposure",Reuters
Oct-23-18,"Lockheed Martin third-quarter profit beats, helped by F-35, lower tax rate",Reuters
Oct-23-18,"Lockheed Martin 3rd-qtr profit beats, helped by F-35, lower tax rate",Reuters
Oct-23-18,"Lockheed Martin (LMT) Q3 Earnings Beat, '18 EPS View Up",Zacks
Oct-23-18,"Lockheed Martin Earnings, Revenue beat in Q3",Investing.com
Oct-23-18,Stocks - Dow Futures Point to Triple-Digit Drop Amid Global Selloff,Investing.com
Oct-23-18,"Lockheed Martin profit rises 17 percent in third quarter, sees '19 sales up 5-6 percent",Reuters
Oct-23-18,Dont Run Away From This Dip in Lockheed Martin Stock,InvestorPlace
Oct-23-18,Defense Stocks for the New Cold War,TheStreet.com
Oct-23-18,Lockheed Martin (LMT) Tops Q3 Earnings and Revenue Estimates,Zacks
Oct-23-18,"Lockheed Martin beats profit and sales expectations, but shares slip",MarketWatch
Oct-23-18,Lockheed Martin raises 2018 forecast on strong quarterly earnings,CNBC
Oct-23-18,Lockheed: 3Q Earnings Snapshot,Associated Press
Oct-23-18,Lockheed Martin Reports Third Quarter 2018 Results,PR Newswire
Oct-23-18,What the Stock Market Says About the Midterm Elections,Barrons.com
Oct-24-18,Sikorsky Aircraft wins $717 mln U.S. defense contract -Pentagon,Reuters
Oct-24-18,"Exclusive: Trump, industry work behind the scenes to save Saudi arms package",Reuters
Oct-24-18,Boeing Sees $60 Billion 'Opportunity Space' From These Pentagon Deals,Investor's Business Daily
Oct-24-18,Goldman Adds Lockheed Martin to 'Conviction List',Investopedia
Oct-24-18,Edited Transcript of LMT earnings conference call or presentation 23-Oct-18 3:00pm GMT,Thomson Reuters StreetEvents
Oct-24-18,The Street's Reaction To Lockheed Martin's Q3 Earnings,Benzinga
Oct-24-18,"Top Analyst Reports for Procter & Gamble, Philip Morris & Honeywell",Zacks
Oct-24-18,Lockheed Martin sees gain in every sector for Q3; its Orlando units in hiring frenzy,American City Business Journals
Oct-24-18,"Stocks making the biggest move premarket: T, BA, UPS, SIRI, QSR, TXN & more",CNBC
Oct-24-18,Lockheed Martin shares rise after a Goldman upgrade and listing as a top stock,CNBC
Oct-25-18,"More F-35 work headed to Orlando as Lockheed closes $11.5B deal, expects future growth",American City Business Journals
Oct-25-18,"Raytheon Sees Weathering Saudi 'Complexity,' With 2019 Sales About Flat",Investor's Business Daily
Oct-25-18,"Here come the wafers: Local smart sensor maker gets first client, to double staff",American City Business Journals
Oct-25-18,Belgium picks Lockheed's F-35 over Eurofighter on price,Reuters
Oct-25-18,Belgium picks Lockheed's F-35 over Eurofighter on price,Reuters
Oct-25-18,Immersed in inclusion: How these 2 C. Fla. execs ended up in surprising leadership roles,American City Business Journals
Oct-25-18,Belgium picks Lockheed's F-35 over Eurofighter on price,Reuters
Oct-25-18,Belgium picks US F-35As fighter planes to replace aging F16s,Associated Press
Oct-25-18,Factbox: European fighter jet competitions and recent contract wins,Reuters
Oct-25-18,"The Zacks Analyst Blog Highlights: Procter & Gamble, Philip Morris, Honeywell, Lockheed and Illumina",Zacks
Oct-25-18,Turkey says Russian S-400 systems installation to begin Oct. 2019 - Anadolu,Reuters
Oct-25-18,Turkey says Russian S-400 systems installation to begin Oct. 2019 - Hurriyet,Reuters
Oct-26-18,Aerospace and Defense ETFs Dip Despite Strong Q3 Earnings,Zacks
Oct-26-18,The Midterm Elections Wont Save the Stock Market,Barrons.com
Oct-26-18,ULA gets $152.4M military contract to send top secret payload to orbit,American City Business Journals
Oct-26-18,Aegis Combat System Demonstrates Success During At-Sea Test Against Medium Range Ballistic Missile,PR Newswire
Oct-26-18,U.S. successfully tests anti-ballistic missile off coast of Hawaii,Reuters
Oct-26-18,Lockheed's F-35 jet is taking Europe by stealth,Reuters Videos
Oct-26-18,French President Macron regrets Belgium choosing Lockheed jets,Reuters
Oct-29-18,U.S. Army Pilots Fly Autonomous Sikorsky Helicopter in First-of-its-Kind Demonstration,PR Newswire
Oct-29-18,Is Lockheed Martin Corporation (NYSE:LMT) A Smart Choice For Dividend Investors?,Simply Wall St.
Oct-29-18,"Defense Stock Roundup: Q3 Picture Impressive, LMT, BA, UTX, GD Earnings Beat",Zacks
Oct-29-18,"Factors of Influence in 2018, Key Indicators and Opportunity within Monster Beverage, Celanese, Nu Skin Enterprises, AG Mortgage Investment Trust, Lockheed Martin, and The Charles Schwab  New Research Emphasizes Economic Growth",GlobeNewswire
Oct-30-18,Exclusive: Defence firms see only hundreds of new U.S. jobs from Saudi mega deal,Reuters
Oct-30-18,'Catch a Falling Knife' to Buy Defense Stocks,Investopedia
Oct-30-18,Exclusive: Defense firms see only hundreds of new U.S. jobs from Saudi mega deal,Reuters
Oct-30-18,Lockheed Martin Challenges Students to Create the Future of Flight,PR Newswire
Oct-30-18,"The Zacks Analyst Blog Highlights: Lockheed Martin, Boeing, United Technologies, General Dynamics and Northrop Grumman",Zacks
Oct-31-18,Wallace Loh helped change the relationship between UMd. and College Park. There's hope that work will continue after he's gone.,American City Business Journals
Oct-31-18,Network 200: 25 manufacturing and logistics leaders to know in DFW,American City Business Journals
Nov-01-18,What Should We Expect From Lockheed Martin Corporations (NYSE:LMT) Earnings In The Next 12 Months?,Simply Wall St.
Nov-01-18,5 Stocks to Sell In November Amid Elections and Earnings,InvestorPlace
Nov-01-18,"Lockheed's F-35 picks up $11.5B contract, bringing work to Orlando",American City Business Journals
Nov-01-18,Top Ranked Income Stocks to Buy for November 1st,Zacks
Nov-02-18,U.S. approves key step toward German missile defence deal,Reuters
Nov-02-18,"Parsons reorganizes, head of federal business named COO",American City Business Journals
Nov-02-18,"Lockheed, Northrop Grumman, more grab $120M in military work for Orlando",American City Business Journals
Nov-02-18,4 Top Efficient Stocks to Buy in November,Zacks
Nov-02-18,This Oversold Sector is Set for a Huge Rebound,InvestorPlace
Nov-02-18,To the Moon and beyond - Airbus delivers powerhouse for NASA's Orion spacecraft,Reuters
Nov-02-18,To the Moon and beyond: Airbus delivers powerhouse for NASA's Orion spacecraft,Reuters
Nov-02-18,4 Great Defense Stocks to Buy in November,Zacks
Nov-02-18,To the Moon and beyond: Airbus delivers powerhouse for NASA's Orion spacecraft,Reuters
Nov-05-18,Lockheed Martin (LMT) Outpaces Stock Market Gains: What You Should Know,Zacks
Nov-05-18,Key piece of NASAs Orion spacecraft arrives in Florida to prep for moon mission,American City Business Journals
Nov-05-18,Military gets a boost in revised German spending plan,Reuters
Nov-05-18,Sikorsky Wins $717 Million Award to Sustain Super Stallion and Sea Dragon Aircraft for the U.S. Marine Corps and U.S. Navy,PR Newswire
Nov-05-18,These local companies are considered the best for military veterans,American City Business Journals
Nov-05-18,US Defense Stocks Could Rally Into Year End,Investopedia
Nov-05-18,"Zacks.com highlights: Lululemon Athletica, Malibu Boats, MCBC Holdings and Lockheed Martin",Zacks
Nov-05-18,"The Zacks Analyst Blog Highlights: Aerojet Rocketdyne Holdings, Lockheed Martin, Raytheon and Boeing",Zacks
Nov-06-18,Democrats Hold Edge in House Battle: 5 Great Picks,Zacks
Nov-07-18,"Lockheed Martin scores $350M contract for work in Orlando, plus other work order awards",American City Business Journals
Nov-07-18,"Harris Corp. delivers payload for Lockheed Martin-built GPS III satellite, more on the way",American City Business Journals
Nov-07-18,What the midterm results mean for government contractors,American City Business Journals
Nov-07-18,"Health Insurers, Cannabis, Energy Stocks Gain on Election",Bloomberg
Nov-07-18,"For Defense Companies, the Post-Election Funding Outlook Is Still Strong",Barrons.com
Nov-07-18,China unveils stealth combat drone in development,Associated Press
Nov-07-18,China unveils stealth combat drone in development,Associated Press
Nov-08-18,The Next Boom in Defense Stocks,Barrons.com
Nov-08-18,"DFW units of Lockheed Martin, Boeing score big contracts",American City Business Journals
Nov-08-18,Lockheed Martin files permit for 5.52-acre test facility in Orlando,American City Business Journals
Nov-08-18,"The Zacks Analyst Blog Highlights: HCA Healthcare, Molina Healthcare, Johnson & Johnson, Lockheed Martin and Boeing",Zacks
Nov-08-18,Lockheed Martin and Cypress Creek Renewables Receive National Award for Energy Storage Project,PR Newswire
Nov-08-18,Democrats Hold Edge in House Battle: 5 Great Picks (Revised),Zacks
Nov-09-18,"From Lockheed to Rollins: Meet this avid Orlandoan, who's considered a local PR industry expert",American City Business Journals
Nov-09-18,"See which companies in Central Florida are hiring the most $100,000+ jobs",American City Business Journals
Nov-12-18,5 Stocks to Sell After the Midterm Election,InvestorPlace
Nov-12-18,7 Aerospace Stocks to Buy That Were Previously Grounded,InvestorPlace
Nov-12-18,"Lockheed Martin seeks $5.2M funding to expand in Orlando, create 750 high-wage jobs",American City Business Journals
Nov-12-18,Lockheed Martin Honors Three Wounded Veterans through Scholarship Program,PR Newswire
Nov-13-18,County quickly approves $5.2M incentives for Lockheed to create 750 high-wage jobs in Orlando,American City Business Journals
Nov-13-18,"NATO looks to startups, disruptive tech to conquer emerging threats",Reuters
Nov-13-18,AlphaPilot AI Innovation Challenge Flies North to Canada,CNW Group
Nov-13-18,Pentagon expects next big F-35 contract in spring 2019,Reuters
Nov-13-18,An Investor's Guide to Space,Motley Fool
Nov-14-18,"Lockheed Martin awarded $22.7B deal, with most of the work coming to Fort Worth",American City Business Journals
Nov-14-18,[$$] Lockheed Martin Lands $23 Billion Pentagon Contract,The Wall Street Journal
Nov-14-18,Lockheed gets interim payment for first multiyear F-35 contract: Pentagon,Reuters
Nov-14-18,"Lockheed Martin's growth frenzy in Orlando bodes well for local economy, smaller firms",American City Business Journals
Nov-14-18,At least 13 countries are interested in buying Russian missile system despite threat of US sanctions,CNBC
Nov-15-18,Lockheed Martin (LMT) Gains But Lags Market: What You Should Know,Zacks
Nov-15-18,Pentagon report on Turkey's F-35 program delivered to Congress,Reuters
Nov-15-18,"Lockheed Martin, local metalwork firm win a combined $23B in military deals",American City Business Journals
Nov-15-18,"Why Orlando may see more mergers after $33.5B Harris Corp., L3 alliance",American City Business Journals
Nov-15-18,Proposed US Space Force budget could be less than $5 bln - deputy defense sec,Reuters
Nov-15-18,Lockheed Martin Launches $30 Million STEM Scholarship Program,PR Newswire
Nov-15-18,"[$$] Stocks to Watch: Walmart, PG&E, Lockheed Martin, JPMorgan Chase",The Wall Street Journal
Nov-15-18,Lockheed Martin Wins $22.7B Deal for F-35 Aircraft Program,Zacks
Nov-16-18,Defense giant Lockheed Martin building a supersonic plane,CNBC Videos
Nov-16-18,"NASA OSIRIS-REx Flexes its ""Arm"" Before Arriving at Asteroid Bennu",PR Newswire
Nov-16-18,Lockheed Martin starts production of its experimental supersonic plane,CNBC
Nov-19-18,Colfax churns its business with $3.15 billion purchase of medical device maker,Reuters
Nov-19-18,Elon Musk Teases 'Radical Change' To Massive New SpaceX Rocket,Investor's Business Daily
Nov-19-18,"Berlin imposes travel ban, arms freeze over Khashoggi killing",Reuters
Nov-19-18,"Lockheed Martin's anti-ship missile, Southeast Power Systems score $181.4M in local military work",American City Business Journals
Nov-19-18,Russia lures global arms buyers with a missile system that costs much less than US models,CNBC
Nov-19-18,Raytheon (RTN) Wins $34M Navy Deal to Support CEC Program,Zacks
Nov-19-18,Lockheed Martin Lands 255-Jet Fighter Order Worth $22.7 Billion,Motley Fool
Nov-19-18,Lockheed begins production on jet that could reopen door to supersonic passenger travel,American City Business Journals
Nov-19-18,Lockheed Martin Wins $282M Navy Deal to Support MMSC Ships,Zacks
Nov-20-18,Trump stands by Saudi prince despite journalist Khashoggi's murder,Reuters
Nov-20-18,"Falcon Heavy, astronauts, satellites: 2019 is shaping up to be a big year for SpaceX",American City Business Journals
Nov-20-18,"Canadian air force running short of pilots, jets -watchdog",Reuters
Nov-20-18,"Lockheed, Northrop, more net $143.8M worth of missile and aircraft work in Orlando",American City Business Journals
Nov-20-18,How to answer Lockheed Martin CEO Marillyn Hewson's favorite job interview question,CNBC
Nov-20-18,"Boeing (BA) to Supply 40 737 MAX 8 to Jeju Air, Orders Rise",Zacks
Nov-21-18,Lockheed Martin (LMT) Gains But Lags Market: What You Should Know,Zacks
Nov-21-18,"Huntington Ingalls to Gain From New Products, Debt Load High",Zacks
Nov-21-18,"Lockheed Martin Chairman, President and CEO to Speak at Credit Suisse 6th Annual Industrials Conference",PR Newswire
Nov-21-18,Lockheed Martin Wins $42M Deal to Support Aircraft Program,Zacks
Nov-23-18,Boeing (BA) to Supply 12 737 MAX 8 to Caribbean Airlines,Zacks
Nov-23-18,Estimating The Intrinsic Value Of Lockheed Martin Corporation (NYSE:LMT),Simply Wall St.
Nov-26-18,Lockheed Martin and NASA JPL Successfully Land on Mars,PR Newswire
Nov-26-18,"NASA's Mars InSight Lands Successfully, Beams This First Photo",Investor's Business Daily
Nov-26-18,"These local industries most affected by tariffs, say Central Florida economic development execs",American City Business Journals
Nov-26-18,Boeing Wins $14M Air Force Deal for WGS Communication System,Zacks
Nov-26-18,"NASA successfully lands InSight spacecraft on Mars, first mission to the planet's surface in 6 years",CNBC
Nov-26-18,Limits on arms sales to Saudi Arabia would likely have little impact on US defense firms' revenue,CNBC
Nov-26-18,Mars InSight Successfully Lands on Mars,Bloomberg
Nov-26-18,4 Defense Stocks Up More Than 8% on a Year-to-Date Basis,Zacks
Nov-26-18,Lockheed Martin Awarded $108 Million for IRST21 Sensor System,PR Newswire
