date,title,source
Oct-17-18,[$$] Judge Clears Genesis Healthcare to Take Over Preferred Care Facilities,The Wall Street Journal
Oct-17-18,"Report: Developing Opportunities within Genesis Healthcare, Rexnord, Renewable Energy Group, Aurora Cannabis, Nomad Foods, and BRF S.A  Future Expectations, Projections Moving into 2018",GlobeNewswire
Oct-18-18,[$$] Sears Owner Eddie Lampert Is Unrepentant,The Wall Street Journal
Oct-24-18,"Genesis HealthCare Expects to Release Third Quarter 2018 Results on November 7, 2018",GlobeNewswire
Nov-07-18,Genesis Healthcare: 3Q Earnings Snapshot,Associated Press
Nov-07-18,Genesis HealthCare Reports Solid Third Quarter 2018 Results,GlobeNewswire
Nov-07-18,Genesis Healthcare (GEN) May Report Negative Earnings: Know the Trend Ahead of Next Week's Release,Zacks
Jan-07-19,Schuylkill Center Achieves American Nurses Credentialing Center Pathway to Excellence in Long Term Care Designation,GlobeNewswire
Jan-22-19,Nursing Home Industry Should Thrive on Aging Population,Zacks
