date,title,source
Oct-17-18,Advanced Micro Devices (AMD) Q3 Earnings Preview: Here's What to Look Out For,Zacks
Oct-17-18,"3 Big Stock Charts for Wednesday: Pinnacle West Capital, Comerica and Hartford Financial Services",InvestorPlace
Oct-18-18,AMD Seen Facing Huge 20% Stock Swings Amid Earnings,Investopedia
Oct-18-18,Is It Too Early to Get Back Into Nvidia Stock?,InvestorPlace
Oct-18-18,Theres a Huge Flaw in Valuing AMD Stock Like Amazon or Netflix,InvestorPlace
Oct-18-18,"3 Stock Charts for Thursday: Wells Fargo, CSX and Macys",InvestorPlace
Oct-18-18,Love the Players and the Games With This New ETF,Investopedia
Oct-18-18,"Dow Jones Futures: 3 Reasons To Stay In Cash As Bulls, Bears Battle For Stock Market Control",Investor's Business Daily
Oct-19-18,Berkshire Hathaway Stock Looks Cheap by Warren Buffetts Measure,Barrons.com
Oct-19-18,Cramer's game plan: Companies tied to China or the Fed are 'guilty until proven innocent',CNBC
Oct-19-18,"Why Advanced Micro Devices, Inc. Stock Closed 11% Lower on Friday",Motley Fool
Oct-19-18,"AMD's stock tumbles after bearish analyst call, to pace broad sector weakness",MarketWatch
Oct-19-18,AMD's Q3 Earnings to Gain on Portfolio Strength & GPU Demand,Zacks
Oct-22-18,AMD's Q3 Earnings to Benefit from Strong Demand for GPUs,Zacks
Oct-22-18,Should You Buy Intel This Week Into Earnings?,TheStreet.com
Oct-22-18,AMD earnings: Trade wars could harm assault on Intel,MarketWatch
Oct-22-18,Meet What Could Be Advanced Micro Devices' Next Billion-Dollar Business,Motley Fool
Oct-22-18,"Benzinga's Week Ahead: Can Tech Earnings Restore The Rally? Amazon, Google To Report",Benzinga
Oct-22-18,"Stocks lose ground on global growth worries, earnings anxiety",MarketWatch
Oct-22-18,"Intel Is The Semiconductor Sector's Only Candidate For Estimate Raises, Nomura Says In Upgrade",Benzinga
Oct-22-18,"Stocks: Early Gains Fizzle, This FANG Stock Dives On Debt Offering",Investor's Business Daily
Oct-22-18,"[$$] Stocks to Watch: Hasbro, Halliburton, Goldman Sachs, Polaris Industries, and More",The Wall Street Journal
Oct-22-18,"3 Stock Charts for Monday: Netflix, PPL and Nvidia",InvestorPlace
Oct-22-18,Dow Jones Futures Rise After More Leaders Break Support In Stock Market Correction,Investor's Business Daily
Oct-22-18,"Acceleware Ltd. Announces US$2.5 Million Agreement with Advanced Micro Devices, Inc.",CNW Group
Oct-23-18,AMD earnings: Trade wars could harm assault on Intel,MarketWatch
Oct-23-18,AMD Stock Is Up 140% in 2018 and May Not Be Done Yet,Barrons.com
Oct-23-18,AMD and Oracle Collaborate to Provide AMD EPYC Processor-Based Offering in the Cloud,GlobeNewswire
Oct-23-18,Not All Chip ETFs Are Bleeding Assets,Benzinga
Oct-23-18,Advanced Micro Devices Stock Is Finally Ready for a Strong Comeback,InvestorPlace
Oct-23-18,"Semiconductor Stocks' Earnings on Oct 24: MLNX, AMD & XLNX",Zacks
Oct-23-18,Is a Surprise Coming for Advanced Micro Devices (AMD) This Earnings Season?,Zacks
Oct-23-18,Advanced Micro Devices' Correction Isn't Over,TheStreet.com
Oct-23-18,"3 Big Stock Charts for Tuesday: Western Union, Praxair and Activision Blizzard",InvestorPlace
Oct-23-18,Dow Jones Futures Tumble: Why This Stock Market Correction Is More Dangerous Than A Bear Market,Investor's Business Daily
Oct-23-18,"Chip stocks could plunge another 8 percent before hitting bottom, technician warns",CNBC
Oct-24-18,[$$] Advanced Micro Devices Tumbles in After-Hours Trading,The Wall Street Journal
Oct-24-18,[$$] AMD's Gain Before Pain,The Wall Street Journal
Oct-24-18,"AMD Follows TI With Dour Sales Forecast, Adding to Chip Woes",Bloomberg
Oct-24-18,"AMD revenue forecast disappoints as crypto demand subsides, shares plummet",Reuters
Oct-24-18,AMDs stock craters more than 20% after weak graphics sales,MarketWatch
Oct-24-18,"AMD revenue forecast disappoints as crypto demand subsides, shares plummet",Reuters
Oct-24-18,Cramer Remix: One line in AMD's earnings report was enough to hurt the stock,CNBC
Oct-24-18,AMD revenue forecast disappoints as crypto demand wanes,Reuters
Oct-24-18,Here are the biggest Silicon Valley losers in Nasdaq correction,American City Business Journals
Oct-24-18,Advanced Micro Devices (AMD) Matches Q3 Earnings Estimates,Zacks
Oct-24-18,"Stocks making the biggest moves after hours: Tesla, AMD, Ford and more",CNBC
Oct-24-18,Chip stocks suffer their biggest drop in nearly 10 years,CNBC
Oct-24-18,"AMD revenue forecast falls short of estimates, shares sink",Reuters
Oct-24-18,"AMD's Revenue and Forecasts Fall Short, Sending Stock Tumbling",Bloomberg
Oct-24-18,"AMD Stock Falls On Sales Miss, In-Line Earnings For Third Quarter",Investor's Business Daily
Oct-24-18,Top 3 Shareholders of AMD,Investopedia
Oct-24-18,Advanced Micro: 3Q Earnings Snapshot,Associated Press
Oct-24-18,AMD shares crushed as weak graphics sales ding revenue,MarketWatch
Oct-24-18,AMD Reports Third Quarter 2018 Financial Results,GlobeNewswire
Oct-24-18,"AMD sinks on weak Q4 revenue guidance, sees EPS beat",CNBC Videos
Oct-24-18,Chip stocks are getting crushed ahead of AMD earnings  here's what to watch,CNBC
Oct-24-18,Texas Instruments Hits Chips Midday; Disney Slumps,Investing.com
Oct-24-18,US STOCKS-Wall St drops as chipmakers fan corporate growth fears,Reuters
Oct-24-18,US STOCKS-Chipmakers lead Wall St lower as concerns over China impact grow,Reuters
Oct-24-18,AMD Earnings Preview: Expect a Growth Slowdown,Motley Fool
Oct-24-18,KLA-Tencor (KLAC) to Post Q1 Earnings: What's in the Cards?,Zacks
Oct-24-18,"Earnings Aside, AMD Stock Still Has a Ton of Room to Grow",InvestorPlace
Oct-24-18,AMD Stock Looks Good Ahead of Q3 Earnings Report,Zacks
Oct-24-18,Advanced Micro Devices Q3 Earnings Preview,Benzinga
Oct-24-18,AMD earnings: Trade wars could harm assault on Intel,MarketWatch
Oct-24-18,Get Ready for Another AMD vs. Intel Battle,Barrons.com
Oct-24-18,Intel Stock Needs an Earnings Beat (And Chip Stocks Need It Even More),InvestorPlace
Oct-25-18,Jim Cramer: Don't Blame These Companies for the Cataclysmic Selling,TheStreet.com
Oct-25-18,AMD left behind as Wall Street rebounds,American City Business Journals
Oct-25-18,"Why Align Technology, Goldcorp, and Advanced Micro Devices Slumped Today",Motley Fool
Oct-25-18,Dow Closes 400 Points Higher as Wall Street Rebounds on Earnings,TheStreet.com
Oct-25-18,"AMD Was Blinded by Easy Money, and Now Its Paying the Price",Motley Fool
Oct-25-18,"AMD Beats on Q3 Earnings, Shares Down on Weak Q4 Guidance",Zacks
Oct-25-18,Why October Spells Doom for Semis: ETFs in Focus,Zacks
Oct-25-18,Nasdaq Leads Furious Rebound; When To Buy Tesla Stock Again,Investor's Business Daily
Oct-25-18,"AMDs poor outlook, crypto-chip slowdown intensify swoon in semiconductor sector",MarketWatch
Oct-25-18,"INVESTOR ALERT: Ademi & O'Reilly, LLP Investigates Whether Advanced Micro Devices Inc. (AMD) Violated Securities Laws",PR Newswire
Oct-25-18,Edited Transcript of AMD earnings conference call or presentation 24-Oct-18 9:30pm GMT,Thomson Reuters StreetEvents
Oct-25-18,Xilinx stock rallies more than 15% to lead S&P 500 higher,MarketWatch
Oct-25-18,"US STOCKS-Strong results, bargain-hunting help Wall St bounce back from rout",Reuters
Oct-25-18,"Be Careful, Advanced Micro Devices Looks Like a 'Falling Knife'",TheStreet.com
Oct-25-18,Why Shares of AMD Tumbled Today,Motley Fool
Oct-25-18,"Bitcoin, Other Cryptos Pare Back Gains",Investing.com
Oct-25-18,US STOCKS-Microsoft leads Wall St fightback from Wednesday's rout,Reuters
Oct-25-18,AMD concerns arent limited to crypto and graphics pain,MarketWatch
Oct-25-18,eBay (EBAY) Gears Up for Q3 Earnings: What's in the Cards?,Zacks
Oct-25-18,Can Growing Partnerships Drive Baidu's (BIDU) Q3 Earnings?,Zacks
Oct-25-18,A lot just happened in markets over the last 24 hours: Here's what you should know,CNBC
Oct-25-18,"Stocks - Tesla, Twitter Soar in Pre-market; AMD Crashes; Microsoft, Ford Gain",Investing.com
Oct-25-18,Chip Stocks See Worst Day in a Decade: ETFs in Focus,Zacks
Oct-25-18,AMD Chief Lisa Su Says the Trade War Is an Opportunity,Barrons.com
Oct-25-18,US STOCKS-Wall Street rises as technology stocks gain,Reuters
Oct-25-18,AMD Is Getting Battered After a Weak Revenue Forecast. Heres What Wall Street Is Saying,Bloomberg
Oct-25-18,"American Airlines Flies, Twitters Stock Soars as Dow Aims High",Barrons.com
Oct-25-18,US STOCKS-Wall St set to bounce back after tech selloff,Reuters
Oct-25-18,Implied Volatility Surging for Advanced Micro Devices (AMD) Stock Options,Zacks
Oct-25-18,"Stocks making the biggest move premarket: CMCSA, TWTR, BMY, SWK, LUV & more",CNBC
Oct-25-18,US STOCKS-Wall St on course for bounce after tech selloff,Reuters
Oct-25-18,AMDs stock craters more than 20% after weak graphics sales,MarketWatch
Oct-25-18,"AMD Follows TI With Dour Sales Forecast, Adding to Chip Woes",Bloomberg
Oct-25-18,"Tesla, Microsoft, Amazon, Alphabet and AMD - 5 Things You Must Know",TheStreet.com
Oct-25-18,"Market Morning: Carnage Spreads, Real Estate Discourages, Tesla Surprises, Cook Warns",Market Exclusive
Oct-25-18,FAANG Stocks Set to Rebound as AMD Plunges,Investopedia
Oct-26-18,Forget Amazon and Google. Chip Stocks Are the Problem.,Barrons.com
Oct-26-18,Global chip sales rise to new records as demand appears to ease,MarketWatch
Oct-26-18,"AMD, Nvidia, Western Digital Get Smoked",TheStreet.com
Oct-26-18,"5 Top Stock Trades for Monday: Trading Alphabet, Snap Earnings",InvestorPlace
Oct-26-18,This money-flow chart shows that Amazon and Netflix are in dangerous territory,MarketWatch
Oct-26-18,Nvidia Upside Slimmer on AMD Earnings: BofA,Investopedia
Oct-26-18,Intels Blockbuster Results Still Dont Win Over Some Analysts,Barrons.com
Oct-26-18,Stocks Fight To Curb Losses; Is It Time To Sell These 4 Growth Stocks?,Investor's Business Daily
Oct-26-18,AMD Stock Could Bounce Back to $20 Once Tech Markets Stabilize,InvestorPlace
Oct-26-18,Sell-Side Guarded On Intel Despite Beat-And-Raise Quarter: 'Cycle Risk A Deterrent',Benzinga
Oct-26-18,Mediocre Earnings Undercut the Bull Case for Buying AMD Stock,InvestorPlace
Oct-26-18,"Boasting A 32% Return On Equity, Is Advanced Micro Devices Inc (NASDAQ:AMD) A Top Quality Stock?",Simply Wall St.
Oct-26-18,Will E-Commerce Growth Aid Alibaba (BABA) in Q2 Earnings?,Zacks
Oct-26-18,Buying Nvidia Stock Below $200 Is a No-Brainer,InvestorPlace
Oct-26-18,Trading the Earnings Plunge in AMD Stock,InvestorPlace
Oct-26-18,Chip stocks telegraphed this sell-off back in early September and now signal more trouble ahead,CNBC
Oct-26-18,"3 Big Stock Charts for Friday: Intel, Apple and Mondelez International",InvestorPlace
Oct-29-18,Strong Q3 Numbers Affirm the Bull Thesis for Intel Stock,InvestorPlace
Oct-29-18,AMD Traders Bet Stock Will Plunge 53% Off Highs,Investopedia
Oct-29-18,3 Reasons This Is the End of the Micron Stock Growth Cycle,InvestorPlace
Oct-29-18,"AMD Expands 2nd Generation Ryzen Threadripper Desktop Processor Line-up, Powering Ultimate Computing Experiences, Available Today From $649*",GlobeNewswire
Oct-29-18,"The Zacks Analyst Blog Highlights: Advanced Micro Devices, Texas Instruments, Intel, Micron Technology and Broadcom",Zacks
Oct-29-18,This money-flow chart shows that Amazon and Netflix are in dangerous territory,MarketWatch
Oct-29-18,"3 Stock Charts for Monday: Cisco Systems, Fortive and Walgreens Boots Alliance",InvestorPlace
Oct-30-18,AMD's Lisa Su appointed first chairwoman of Global Semiconductor Alliance,MarketWatch
Oct-30-18,Advanced Micro Devices (AMD) Outpaces Stock Market Gains: What You Should Know,Zacks
Oct-30-18,"Intel Roundup: Earnings, Micron & ARM Deals, New Chips, More",Zacks
Oct-30-18,Nvidia Stock Has Some Potential That AMD Just Never Will,InvestorPlace
Oct-30-18,Cowen's Bullish Thesis 'Unchanged' After AMD's Q3 Print,Benzinga
Oct-30-18,AMD Stock Is on Its Way Back to Reasonable Valuation Land,InvestorPlace
Oct-30-18,AMD Radeon Vega Mobile Discrete Graphics Coming to MacBook Pro,GlobeNewswire
Oct-30-18,"Weakness In Nvidia's Gaming Segment Could Be A Passing Phase, JPMorgan Says In Upgrade",Benzinga
Oct-30-18,AMD price target cut to $26 from $33 at Cowen,MarketWatch
Oct-30-18,"Research Report Identifies Cabot Microelectronics, Check Point Software Technologies, Aon plc, Acadia Healthcare, Advanced Micro Devices, and Nevsun Resources with Renewed Outlook  Fundamental Analysis, Calculating Forward Movement",GlobeNewswire
Oct-31-18,How Does Bitcoin Mining Work?,Investopedia
Oct-31-18,The stock market lost nearly $2 trillion in October. Here's what happened,CNBC
Oct-31-18,"After Plummeting, AMD Stock Has Big Upside Potential",InvestorPlace
Oct-31-18,Trade of the Day: AMD Stock Finally Reaches a Better Buy Spot,InvestorPlace
Nov-01-18,Nvidia Helps Lead Semiconductors Higher: Now What?,TheStreet.com
Nov-01-18,AMD and Abiomed Duke It Out for Title of S&P 500's Top Stock,Bloomberg
Nov-01-18,"Advanced Micro Devices, Q3 Earnings, New Products and Guidance",ACCESSWIRE
Nov-05-18,Advanced Micro Devices (AMD) Stock Sinks As Market Gains: What You Should Know,Zacks
Nov-05-18,How Trump could rescue Apples fast-sinking stock,MarketWatch
Nov-05-18,"Bulls & Bears Of The Week: Amazon, Apple, Ford, GE And More",Benzinga
Nov-05-18,Which of These 3 Semiconductor Stocks Leads the Self-Driving Race?,InvestorPlace
Nov-05-18,Why Micron Technology Stock Is Still Worth At Least $60,InvestorPlace
Nov-05-18,"Stay Away from AMD Stock Above $20, but Buy It Below That for Sure",InvestorPlace
Nov-05-18,Apple's MacBook Pro Gets the AMD Vega Treatment,Motley Fool
Nov-06-18,AMD celebrates Election Day with a political rally of its own,MarketWatch
Nov-06-18,AMD stock jumps as Amazon starts using Epyc chips in the cloud,MarketWatch
Nov-06-18,Abiomed Leads This Year's Stock Market Race,GuruFocus.com
Nov-06-18,Why NVIDIA Stock Lost 25% in October,Motley Fool
Nov-06-18,"IMX Dips In October, But Investors Remain Bullish",Benzinga
Nov-06-18,AMD Takes High-Performance Datacenter Computing to the Next Horizon,GlobeNewswire
Nov-06-18,Why Texas Instruments Stock Lost 13.5% in October,Motley Fool
Nov-06-18,AMD Shares Pop as Amazon Becomes Big Customer,TheStreet.com
Nov-06-18,AMD's stock rallies as Amazon's AWS deploys Epyc chips,MarketWatch
Nov-06-18,AMD Climbs After Saying Amazon Will Use Its Cloud Server Chips,Bloomberg
Nov-06-18,"AMD Unveils Worlds First 7nm Datacenter GPUs -- Powering the Next Era of Artificial Intelligence, Cloud Computing and High Performance Computing (HPC)",GlobeNewswire
Nov-06-18,AMD Announces EPYC Processors Now Available on Amazon Web Services,GlobeNewswire
Nov-06-18,How Trump could rescue Apples fast-sinking stock,MarketWatch
Nov-07-18,[$$] AMDs Cloud Payoff Will ComeEventually,The Wall Street Journal
Nov-07-18,"AMD stock keeps rising amid push into Amazon cloud, valuation debate",MarketWatch
Nov-07-18,Cloud plays may be best as 2018 ends: Cramer,CNBC Videos
Nov-07-18,Cloud plays may be 'best tech stocks to own' as 2018 ends...,CNBC Videos
Nov-07-18,Cloud plays may be 'best tech stocks to own' as 2018 ends: Cramer,CNBC
Nov-07-18,Dow Ends Up More Than 500 Points; Stocks Jump in Post-Election Rally,TheStreet.com
Nov-07-18,"Why AMD, Micron, Diplomat Pharmacy, and More Are Trending",Insider Monkey
Nov-07-18,5 Dow Stocks to Sell (And 2 to Buy),Kiplinger
Nov-07-18,[$$] AMD's Cloud Payoff Will Come---Eventually,The Wall Street Journal
Nov-07-18,"Analysts React After AMD Product Launch, See 'Real And Compelling' Market Share Opportunity",Benzinga
Nov-07-18,"AMD Unveils 7nm CPU, GPU At 'Next Horizon' Event",Benzinga
Nov-07-18,"AMD Stock Pops on New 7nm Chips, Amazon Web Services Partnership",InvestorPlace
Nov-07-18,"Democrats Win House, Fed Meets, AMD Partners With Amazon- 5 Things You Must Know",TheStreet.com
Nov-07-18,"3 Big Stock Charts for Wednesday: Walt Disney, Skyworks Solutions and PG&E Corporation",InvestorPlace
Nov-08-18,2nd Generation AMD Ryzen Processors Win Prestigious Industry Awards for Technology Innovation and Consumer Value,GlobeNewswire
Nov-08-18,Why AMD's Stock Rebound Won't Last,Investopedia
Nov-08-18,Morgan Stanley's Bull Case For Nvidia Unchanged By Near-Term Concerns,Benzinga
Nov-08-18,AMD celebrates Election Day with a political rally of its own,MarketWatch
Nov-09-18,"AMD Shows Off &quot;Rome&quot; Data Center CPU, Signs Amazon as Cloud Chip Customer",Motley Fool
Nov-09-18,How Advanced Micro Devices Inc. Stock Fell 41% Last Month,Motley Fool
Nov-09-18,5 Dow Stocks to Sell (And 2 to Buy),Kiplinger
Nov-12-18,This Is What You Should Expect From Nvidia Earnings This Week,InvestorPlace
Nov-12-18,"5 Top Stock Trades for Tuesday: Goldman, Apple, and AMD Fall Hard",InvestorPlace
Nov-12-18,The year's best-performing tech stock  AMD  got crushed,CNBC
Nov-12-18,"AMD Holiday Gift Guide: Just Add Wrapping to AMD Ryzen processors, AMD Radeon graphics cards, and AMD-Powered Systems this Holiday",GlobeNewswire
Nov-12-18,Factors Likely to Influence NVIDIA's (NVDA) Q3 Earnings?,Zacks
Nov-12-18,Advanced Micro Devices Nears Sell Signal After Oversold Bounce,Investopedia
Nov-13-18,Kellogg Joins Campbell In Seeking Sweets Exit; Oil Dips Again -- ICYMI,TheStreet.com
Nov-13-18,Advanced Micro Devices (AMD) Supercomputer to Hit the Market at the Turn of the Year,SmarterAnalyst
Nov-13-18,10 Deeply Discounted Stocks to Buy,Kiplinger
Nov-13-18,3 Overpriced Semiconductor Stocks Due for a Fall,InvestorPlace
Nov-13-18,Time to Buy Nvidia (NVDA) Stock on the Dip Before Q3 Earnings?,Zacks
Nov-13-18,Here's What AMD Might Have in Store for Its Next Threadripper,Motley Fool
Nov-13-18,Advanced Micro Devices Stock Makes a Strong Contrarian Case,InvestorPlace
Nov-13-18,New AMD-Powered Supercomputers Unleash Discovery and Accelerate Innovation,GlobeNewswire
Nov-13-18,High-Performance Computing Center Stuttgart and Hewlett Packard Enterprise Collaborate to Build Worlds Fastest Supercomputer for Industrial Production,GlobeNewswire
Nov-13-18,"3 Big Stock Charts for Tuesday: Apple, Scana and Procter & Gamble",InvestorPlace
Nov-13-18,Can AMD Keep Growing Without Crypto at its Back?,Motley Fool
Nov-13-18,Dow Jones Futures Rebound After Apple-Led Stock Market Sell-Off; What To Do Now,Investor's Business Daily
Nov-13-18,Todays Research Reports on Stocks to Watch: NVIDIA and Advanced Micro Devices,ACCESSWIRE
Nov-14-18,"Gaming, Datacenters, & Other Key Q3 Nvidia (NVDA) Estimates",Zacks
Nov-14-18,10 Deeply Discounted Stocks to Buy,Kiplinger
Nov-14-18,"Nvidia Q3 Earnings Preview: Analysts Forecast Data Center, Gaming, Automotive Performance",Benzinga
Nov-14-18,My 7 Worst Stock Picks of 2018,InvestorPlace
Nov-14-18,3 Beaten-Down Semiconductor Stocks to Buy Before the End of 2018,InvestorPlace
Nov-14-18,"Despite Headwinds, NVDA Stock Looks Compelling Ahead of Earnings",InvestorPlace
Nov-15-18,"AMD stock drops 6% after hours, following Nvidia GPU inventory issues",MarketWatch
Nov-15-18,Why Intel Is Up Just 3% So Far in 2018,Motley Fool
Nov-15-18,[$$] Nvidias Game Isnt Over,The Wall Street Journal
Nov-15-18,[$$] Nvidia's Game Isn't Over,The Wall Street Journal
Nov-15-18,Jim Cramer Correctly Predicted Nvidia's Earnings Miss Back in October,TheStreet.com
Nov-15-18,"NVIDIA Crashes 16% After Q3 Miss, Lowered Guidance",Zacks
Nov-15-18,"Big Box Bonanza: Walmart Beats Most Estimates, But Brexit Could Steal Attention",Benzinga
Nov-15-18,Its Time to Buy NVDA Stock Before and After Earnings,InvestorPlace
Nov-15-18,"New AMD Radeon RX 590 Graphics Cards Deliver Leading-Edge, Smooth HD Gaming Experience for Latest Games",GlobeNewswire
Nov-16-18,Nvidia Hands an $824 Million Windfall to Semiconductor Shorts,Bloomberg
Nov-16-18,Flashback Friday: Nvidia Is the Ultimate Chip and Dip,TheStreet.com
Nov-16-18,"AMD, Micron Shares Follow Nvidia Lower",TheStreet.com
Nov-16-18,"Friday Follies: Brexit, Semiconductor, And Tariffs All Take Center Stage",Benzinga
Nov-16-18,Should You Buy Nvidia Stock During Its Crypto Hangover?,InvestorPlace
Nov-16-18,"Chip stocks set to tumble after Nvidia, AMD and Applied Materials pace losers",MarketWatch
Nov-16-18,Dont Sell Advanced Micro Devices Stock Because of Nvidia,InvestorPlace
Nov-16-18,Nvidia tumbles 19% after missing on revenue and guidance,CNBC
Nov-16-18,"AMD Unveils Radeon RX 590 GPU, Enhances Gaming Experience",Zacks
Nov-16-18,"Dow Jones Futures: Nvidia, Applied Materials Dive On Guidance, Slam Chip Stocks",Investor's Business Daily
Nov-16-18,Top 5 Things to Know in the Market on Friday,Investing.com
Nov-16-18,"3 Big Stock Charts for Friday: Lowes Companies, HP and Conagra Brands",InvestorPlace
Nov-16-18,Today's Research Reports on Trending Tickers: Advanced Micro Devices and NVIDIA,ACCESSWIRE
Nov-19-18,"AMD to Present at 22nd Annual Credit Suisse Technology, Media & Telecom Conference",GlobeNewswire
Nov-19-18,FAANG Stocks Are Getting Knocked Again,Bloomberg
Nov-19-18,Nvidia continues to fall as much as 8 percent after revenue and guidance miss,CNBC
Nov-19-18,"Online.net Deploys AMD EPYC Processors in its Bare-Metal Server Offering, Boosts Performance for its Dedicated Hosting Services",GlobeNewswire
Nov-19-18,Paul Meeks on why he's taking tech-like defense on chip s...,CNBC Videos
Nov-19-18,Todays Research Reports on Stocks to Watch: Micron Technology and Advanced Micro Devices,ACCESSWIRE
Nov-19-18,How the Crypto Collapse is Hurting Nvidia,Investopedia
Nov-19-18,[$$] US markets dragged lower by Apple and chipmakers,Financial Times
Nov-19-18,[$$] Tech leads broad sell-off on Wall Street,Financial Times
Nov-20-18,Advanced Micro Devices (AMD) Gains As Market Dips: What You Should Know,Zacks
Nov-20-18,MarketPulse: Nvidia Rally Shelters Semis From Selloff,Investing.com
Nov-20-18,5 Dow Stocks to Sell (And 2 to Buy),Kiplinger
Nov-20-18,AMD's Breakdown Seen Sparking 16% Stock Decline,Investopedia
Nov-20-18,3 Reasons Why Electronic Arts Stock Cratered So Badly,InvestorPlace
Nov-20-18,5 Semiconductor Stocks Getting Cut Down,InvestorPlace
Nov-20-18,Micron leads chipmaker losses as demand concerns grow,Reuters
Nov-20-18,"3 Big Stock Charts for Tuesday: Micron Technology, PulteGroup and Intuit",InvestorPlace
Nov-20-18,[$$] Markets dragged lower by Apple and chipmakers,Financial Times
Nov-21-18,Can Old-School Chip Stocks Like INTC Be Better Than NVDA Stock?,InvestorPlace
Nov-21-18,Investors Should Buy Nvidia Stock,InvestorPlace
Nov-21-18,Nasdaq turns positive for first time in four trading sess...,CNBC Videos
Nov-21-18,"Unfortunately, There Is Nothing Very Special About Nvidia Stock",InvestorPlace
Nov-21-18,The Resilience of Intel Stock Makes It a Winner,InvestorPlace
Nov-26-18,KeyBanc Sees 'Significant Runway' For AMD In Cloud Data Processors,Benzinga
Nov-26-18,"AMD's Mark Papermaster turned company's failure into success, when it needed it most",American City Business Journals
Nov-26-18,"Zacks Value Trader Highlights: NVIDIA, Lam Research, Micron, Intel, Applied Materials and Applied Micro Devices",Zacks
Nov-26-18,Implied Volatility Surging for Advanced Micro Devices (AMD) Stock Options,Zacks
Nov-27-18,"Tuesday Turnaround: Salesforce, Apple and AMD, Oh My!",TheStreet.com
Nov-27-18,AMD's Correction Puts Shares Back on Track: Chart,TheStreet.com
Nov-28-18,Advanced Micro Devices (AMD) Gains But Lags Market: What You Should Know,Zacks
Nov-28-18,A Company Few Americans Know Is About to Dethrone Intel,Bloomberg
Nov-28-18,Dont Miss This Chance to Buy into the NVDA Stock Weakness,InvestorPlace
Nov-28-18,"AMD, Nvidia stocks rise after Mizuho says GPU prices are rebounding",MarketWatch
Nov-28-18,"3 Big Stock Charts for Wednesday: Delta Air Lines, Amgen and Mondelez International",InvestorPlace
Nov-29-18,[$$] Slumping Semiconductor Stocks Dont Bode Well for Broader Market,The Wall Street Journal
Nov-29-18,[$$] Slumping Semiconductor Stocks Don't Bode Well for Broader Market,The Wall Street Journal
Nov-29-18,"Even If the Economy Doesnt Turn, Square Stock Still Has a Problem",InvestorPlace
Nov-29-18,3 Tech Stocks to Buy as They Fight Tooth and Nail to Stay Afloat,InvestorPlace
Nov-30-18,Flashback Friday: Relighting the Cannabis Craze,TheStreet.com
Nov-30-18,Is AMD Stock a Great Buy Right Now?,TheStreet.com
Dec-03-18,5 Reasons Why AMD Stock Is Way Overpriced Here,TheStreet.com
Dec-03-18,"5 Top Stock Trades for Tuesday: NFLX, AMD, SQ, QQQ",InvestorPlace
Dec-03-18,Why Advanced Micro Devices Stock Just Popped 10%,Motley Fool
Dec-03-18,AMD's stock soars on heavy volume to pace chip sector's gainers,MarketWatch
Dec-03-18,"Everyones Ignoring the Fundamentals on AMD Stock, Which Is a Problem",InvestorPlace
Dec-03-18,Is Advanced Micro Devices Incs (NASDAQ:AMD) CEO Paid At A Competitive Rate?,Simply Wall St.
Dec-04-18,"Intel, Hurt by Delays, Will Lose Market Share to AMD, Says Analyst",Barrons.com
Dec-04-18,AMD Is Still a 'Buy the Dips' Stock Despite Selling: Chart,TheStreet.com
Dec-04-18,Intel stock falls after Northland Capital cuts to underperform,MarketWatch
Dec-04-18,"Tuesdays Vital Data: Intel, Advanced Micro Devices and Cronos Group",InvestorPlace
Dec-04-18,Intel shares fall after downgrade: 'It takes forever to turn the ship',CNBC
Dec-04-18,"3 Big Stock Charts for Tuesday: Morgan Stanley, Ross Stores and Dominion Energy",InvestorPlace
Dec-06-18,Advanced Micro Devices (AMD) Gains As Market Dips: What You Should Know,Zacks
Dec-06-18,Here are the S&P 500s best and worst stock performers of 2018,MarketWatch
Dec-06-18,"Dow, S&P Pare Losses Into Close, Nasdaq Closes in the Green",TheStreet.com
Dec-06-18,Gaming Industry Growth Poses New Opportunities For Tech Stocks,ACCESSWIRE
Dec-06-18,"Thursdays Vital Data: General Motors, JPMorgan Chase and Advanced Micro Devices",InvestorPlace
Dec-07-18,The Future of Virtual Reality Could Be Huge for Nvidia Stock,InvestorPlace
Dec-07-18,Here are the S&P 500s best and worst stock performers of 2018,MarketWatch
