date,title,source
May-01-19,"Stocks making the biggest moves premarket: Boeing, Wynn Resorts, CVS, Apple, Estee Lauder & more",CNBC
May-01-19,"Dow Jones Futures: Apple, AMD Lead 5 Stocks Near Buy Points Moving On Earnings",Investor's Business Daily
May-01-19,AMD stock rallies after hours as earnings top Wall Street estimates,MarketWatch
May-01-19,AMD is sticking with its story amid revenue decline,MarketWatch
May-01-19,"Apple, AMD, Federal Reserve, CVS Health and Qualcomm - 5 Things You Must Know",TheStreet.com
May-01-19,Edited Transcript of AMD earnings conference call or presentation 30-Apr-19 9:30pm GMT,Thomson Reuters StreetEvents
May-01-19,Advanced Micro Devices (AMD) Q1 2019 Earnings Call Transcript,Motley Fool
May-02-19,The stock markets reaction to this one word from the Feds Powell shows investors should be careful,MarketWatch
May-02-19,"5 Top Stock Trades for Friday: AYX, AMD, QCOM, FIT",InvestorPlace
May-02-19,Qualcomm average analyst price target rises 11% even as smartphone slowdown looms,MarketWatch
May-02-19,Edited Transcript of AMD earnings conference call or presentation 30-Apr-19 9:30pm GMT,Thomson Reuters StreetEvents
May-02-19,9 High-Growth Stocks to Buy Now for Monster Returns,InvestorPlace
May-02-19,AMD Stock Is Already Bouncing Back From Its Earnings Selloff,Barrons.com
May-02-19,AMD: The Upside Opportunity Outweighs the Risk,SmarterAnalyst
May-02-19,AMDs Results Confirm AMD Stock Wont Climb Much Above Current Levels,InvestorPlace
May-02-19,"'Great Technology' Is How AMD Differentiates Itself, CEO Tells Cramer",Benzinga
May-02-19,3 Mega-Cap Stocks to Trade After Sour Earnings Reactions,InvestorPlace
May-02-19,Dump these 5 tech stocks in 5 high-profile sectors,MarketWatch
May-02-19,"3 Big Stock Charts for Thursday: Cisco Systems, ConocoPhillips and Brighthouse Financial",InvestorPlace
May-03-19,Cramer's Exec Cut: Top brass explain their positive outlooks for the rest of 2019,CNBC Videos
May-03-19,Cramer's Exec Cut: Top brass explain their positive outlooks for the rest of 2019,CNBC
May-03-19,"Chip companies face worst downturn in a decade, analysis contends",MarketWatch
May-03-19,Heres Why Susquehanna Is Neutral on Advanced Micro Devices (AMD) Stock,SmarterAnalyst
May-03-19,"Monster Job Number: April's 263,000 Gain In Payrolls Comes In Well Above Expectations",Benzinga
May-06-19,AMD Needs a Very Strong Second Half,Motley Fool
May-06-19,How to trade stocks as Trump threatens China with new tariffs,MarketWatch
May-06-19,Technical Bottom? This Chart Paints A More Bullish Picture For AMD,Benzinga
May-06-19,"All 30 SOX components are falling, AMD and Micron stocks were the most active decliners",MarketWatch
May-06-19,"Stocks making the biggest moves midday: Bausch Health, Anadarko Petroleum, Nvidia & more",CNBC
May-06-19,Chart of the Day: China Exposure in Semiconductors Tells the Tale,TheStreet.com
May-06-19,"Nvidia Could Have Rough Quarter as Data Center Weakness Persists, Cowen Says",TheStreet.com
May-06-19,Here are the biggest stock-market losers after Trump threatens more tariffs,MarketWatch
May-06-19,"Apple, Tesla, Intel shares drop following Trumps surprise Chinese tariffs threat",American City Business Journals
May-06-19,"Boeing, Caterpillar, Chipmakers Retreat After Trump Threats To Raise China Tariffs",Benzinga
May-06-19,"Morris Marks Mark Asset Managements Return, AUM, and Holdings (Part II)",Insider Monkey
May-06-19,Trump Trade Tweets Rattle Global Markets,Investopedia
May-06-19,Stocks - U.S. Futures Tumble as Trump Breaks Trade Truce,Investing.com
May-07-19,AMD Wins a Massive Supercomputer Deal,Motley Fool
May-07-19,AMD Is Testing Its 'Buy Zone' This Spring,TheStreet.com
May-07-19,AMD and Cray seek to develop fastest supercomputer in the world,MarketWatch
May-07-19,Here Are the Bull and Bear Cases for AMD Stock Returning to $30,InvestorPlace
May-07-19,How to trade stocks as Trump threatens China with new tariffs,MarketWatch
May-07-19,"3 Big Stock Charts for Tuesday: NRG Energy, Citrix Systems and General Electric",InvestorPlace
May-07-19,"Netflix and Google now pay a typical employee more than $200K per year. Here's how that compares to Facebook, Intel, Twitter and other big Bay Area tech employers.",American City Business Journals
May-07-19,"AMD EPYC CPUs, AMD Radeon Instinct GPUs and ROCm Open Source Software to Power Worlds Fastest Supercomputer at Oak Ridge National Laboratory",GlobeNewswire
May-08-19,"Buy Nvidia (NVDA) Stock Ahead of Q1 Earnings, Despite Semiconductor Industry Concerns?",Zacks
May-08-19,Detailed Look at Q1 Earnings Season,Zacks
May-08-19,U.S. stock market is setting two traps for investors,MarketWatch
May-08-19,AMD to Host Annual Meeting of Stockholders,GlobeNewswire
May-08-19,"Is AMD Stock A Buy Right Now? Here's What Its Earnings, Stock Chart Show",Investor's Business Daily
May-08-19,Can AMD Stocks Good Times Last?,InvestorPlace
May-08-19,3 Reasons the Next-Gen PlayStation Will Supercharge Sony Stock,InvestorPlace
May-08-19,AMD and Cray seek to develop fastest supercomputer in the world,MarketWatch
May-09-19,Analysts Weigh In On Intel Following Guidance Update,Benzinga
May-09-19,3 Semiconductor Stocks to Buy Right Now,Zacks
May-09-19,Why Intel Stock Slumped Today,Motley Fool
May-09-19,Intel Guidance Clips Shares as Chipmaker Faces AMD Challenge in Key Markets,TheStreet.com
May-09-19,"Zacks Earnings Trends Highlights: Apple, Intel, Advanced Micro Devices, Micron and Lam Research",Zacks
May-09-19,Another Big Win for Advanced Micro Devices (AMD) Stock,SmarterAnalyst
May-09-19,BMO Downgrades Intel As Gross Margins Slip,Benzinga
May-09-19,AMD Stock Is A Long-Term Winner Facing Short-Term Uncertainty,InvestorPlace
May-10-19,Micron Stock Is a Canary in a Coal Mine for Chinese Trade,InvestorPlace
May-10-19,Better Buy: Advanced Micro Devices vs. NVIDIA,Motley Fool
May-10-19,"Without Strong Guidance, Nvidia Stock Could Drop Toward $100",InvestorPlace
May-10-19,Could Nvidia Stock Really Reach That $227 Target Price? Absolutely,InvestorPlace
May-13-19,Escalating US-China trade war sends stocks plunging,Associated Press
May-13-19,Top 5 Information Technology Stocks of 2018 by Performance,Investopedia
May-13-19,Here are Mondays worst stock-market performers as U.S.-China trade dispute escalates,MarketWatch
May-13-19,"Apple, other Silicon Valley stocks hammered as U.S.-China trade war escalates",American City Business Journals
May-13-19,Stocks suffer biggest one-day loss since Jan. 3 as U.S.-China tariff fight escalates,MarketWatch
May-13-19,"S&P, Dow suffers worst day since Jan. 3 as China imposes retaliatory tariffs",MarketWatch
May-13-19,Tech stocks fuel broader market rout as chip sector gutted by China trade war fears,MarketWatch
May-13-19,AMD to Livestream Dr. Lisa Su Computex 2019 Keynote,GlobeNewswire
May-13-19,Dow Jones Futures Tumble As China Trade War Pressures Stock Market Rally,Investor's Business Daily
May-14-19,Will Weak Datacenter Market Hit NVIDIA's (NVDA) Q1 Earnings?,Zacks
May-14-19,Here's Why I Think Advanced Micro Devices (NASDAQ:AMD) Might Deserve Your Attention Today,Simply Wall St.
May-14-19,"Tuesdays Vital Data: Alibaba, Apple and Advanced Micro Devices",InvestorPlace
May-14-19,How Does Bitcoin Mining Work?,Investopedia
May-14-19,AMD Next Horizon Gaming Streamed Event from E3 2019 to Showcase Next-Generation Gaming Products and Experiences,GlobeNewswire
May-14-19,When Will Advanced Micro Devices Stock Rise Above $30?,InvestorPlace
May-15-19,What to Expect from Nvidia (NVDA) Q1 Earnings Amid Semiconductor Market Downturn,Zacks
May-15-19,"Chip sales to fall more than 7% in 2019 after three years of growth, IDC predicts",MarketWatch
May-15-19,"Nvidia Q1 Earnings Preview: Data Center, Gaming Inventory In Focus Amid Fundamental Uncertainties",Benzinga
May-15-19,AMD Stock Pops as Intel Suffers From ZombieLoad Vulnerability,InvestorPlace
May-15-19,"How, When and Why to Buy AMD Stock in Todays Market",InvestorPlace
May-15-19,"AMD Is a Supercomputer Maker, But Not a Super Stock",SmarterAnalyst
May-16-19,This chart proves the existence of a Trump put in the stock market,MarketWatch
May-16-19,Can Nvidia Stock Hit $250 Before AMD Hits $40?,InvestorPlace
May-16-19,Nvidia earnings: Data-center weakness continues to create fear,MarketWatch
May-17-19,"Nvidia tells the truth, and tempers a potential rally for chip stocks",MarketWatch
May-17-19,Will Nvidia Stock Rally or Falter After Muted Earnings?,TheStreet.com
May-17-19,"Nvidia Analysts Sold On Long-Term Story, But Cautious On Data Center Weakness, Competition",Benzinga
May-17-19,"After NVDA Stock Earnings, $200 Is Within Reach",InvestorPlace
May-17-19,This chart proves the existence of a Trump put in the stock market,MarketWatch
May-20-19,Intel: Value Opportunity or Value Trap?,Motley Fool
May-20-19,Top 5 Information Technology Stocks of 2018 by Performance,Investopedia
May-20-19,Cramer: Investing in chip suppliers during the trade war is risky,CNBC Videos
May-20-19,Chipmaker stocks plunge on report that companies are dropping business with big customer Huawei,CNBC
May-20-19,Why Nvidia Stock Will Retreat,InvestorPlace
May-20-19,5 Valuation Metrics An Investor Needs To Know,Benzinga
May-21-19,Top 5 S&P 500 Stocks for 2018 by Performance,Investopedia
May-21-19,AMD Seen Facing Huge 20% Stock Swings Amid Earnings,Investopedia
May-21-19,Nvidia's Uncertain Outlook Is Worrying Investors,TheStreet.com
May-21-19,"Huawei will stock up on semiconductors, expert predicts",CNBC Videos
May-22-19,Can AMD Stock Rally to $30 Per Share?,InvestorPlace
May-22-19,"3 Big Stock Charts for Wednesday: Oracle, Lamb Weston Holdings and TJX Companies",InvestorPlace
May-23-19,"Earnings Preview: Veeva (VEEV), Palo Alto Networks (PANW), Workday (WDAY)",Zacks
May-23-19,3 Smart Trades for a Troubled Market,InvestorPlace
May-23-19,"Is AMD Stock A Buy Right Now? Here's What Its Stock Chart, Earnings Show",Investor's Business Daily
May-23-19,Is Nvidia Stock a Good Short-Term Investment?,InvestorPlace
May-23-19,"Chip sector falls below 200-day moving average, led by AMD and Micron stock selloffs",MarketWatch
May-24-19,10 Tech Stocks Walloped by the Huawei Ban,InvestorPlace
May-24-19,"3 Big Stock Charts for Friday: Alaska Air Group, Comcast and Moodys",InvestorPlace
May-28-19,"Despite chip crash, technician says now's the time to buy semis",CNBC Videos
May-28-19,The Dow Dropped Because the Market Decided It Couldnt Ignore Trade Anymore,Barrons.com
May-28-19,AMD stock jumps 10% after detailing new PC push at trade show,MarketWatch
May-28-19,"Advanced Micro faces key resistance that could produce 'spectacular' rally, chart analyst says",CNBC
May-28-19,"Why Advanced Micro Devices, SeaWorld Entertainment, and Beyond Meat Jumped Today",Motley Fool
May-28-19,"AMD Stock Jumps On Introduction Of New Chip Products, Graphics Cards",Investor's Business Daily
May-28-19,US STOCKS-Wall St loses early gains as trade concerns abound,Reuters
May-28-19,"Stock Market Falls In Post-Holiday Trading, But Some Tech Stars Shine",Investor's Business Daily
May-28-19,US STOCKS-Wall St gains fade as U.S.-China trade concerns linger,Reuters
May-28-19,Advanced Micro Devices News: AMD Stock Shoots Higher on Ryzen 3000 Buzz,InvestorPlace
May-28-19,Why Advanced Micro Devices Stock Popped 11.5% Today,Motley Fool
May-28-19,"Stocks making the biggest moves midday: Fiat Chrysler, AMD, Beyond Meat & more",CNBC
May-28-19,Advanced Micro Devices Surges as New Chip Releases Point to Market Share Gains,TheStreet.com
May-28-19,US STOCKS-Wall St propped up by gains in technology shares,Reuters
May-28-19,"Amid Battle, Both Advanced Micro Devices (AMD) and Intel (INTC) Stocks are Buys, Says Analyst",SmarterAnalyst
May-28-19,Rosenblatt: AMD Will Be 'Much Bigger Player In High-End GPU Gaming',Benzinga
May-28-19,How Does Bitcoin Mining Work?,Investopedia
May-28-19,US STOCKS-Tech gains keep Wall Street afloat,Reuters
May-28-19,US STOCKS-Technology shares prop up Wall Street,Reuters
May-28-19,"AMD 'steals the show' with announcement of new PC and gaming chips, says analyst",MarketWatch
May-28-19,AMD Poses Tough Competition With New 3rd-Gen Ryzen Processors,Zacks
May-29-19,3 Reasons to Buy AMD Stock and 3 Reasons to Sell It,InvestorPlace
May-29-19,"Impact of tariffs on semiconductors small, says analyst",CNBC Videos
May-29-19,Semiconductor Pairs Trade: AMD Stock and INTC Stock,InvestorPlace
May-29-19,Intel's (INTC) 10th Gen CPUs Steal the Show at COMPUTEX 2019,Zacks
May-29-19,"Wednesdays Vital Data: Teva Pharmaceuticals, Advanced Micro Devices and General Electric",InvestorPlace
May-29-19,"Company News For May 29, 2019",Zacks
May-29-19,AMD Looks Good: Stock Adds 9.8% in Session,Zacks
May-29-19,"Chip Champ AMD, 5 Rules to Work Around Trying Conditions: Market Recon",TheStreet.com
May-29-19,AMD stock jumps 10% after detailing new PC push at trade show,MarketWatch
May-29-19,"3 Big Stock Charts for Wednesday: Juniper Networks, Eli Lilly and Hormel Foods",InvestorPlace
May-29-19,3 Reasons To Buy The Discount In Nvidia Stock,InvestorPlace
May-29-19,How the Huawei Ban May Backfire on 10 U.S. Stocks,Investopedia
May-30-19,Advanced Micro Devices (AMD) Stock Sinks As Market Gains: What You Should Know,Zacks
May-30-19,What to Expect from Cloudera's Q1 Earnings as CLDR Stock Falls Further,Zacks
May-30-19,FAANG's Out: Investing Gems In Today's Technology Landscape,Benzinga
May-30-19,"AMD Makes Splash at Computex, Rosenblatt Weighs in on the Stock",SmarterAnalyst
May-30-19,Advanced Micro (AMD) Up 4.8% Since Last Earnings Report: Can It Continue?,Zacks
May-30-19,Buy Intel Stock on This Dip Because Its Intel,InvestorPlace
May-30-19,"3 Big Stock Charts for Thursday: General Mills, Iron Mountain and PayPal",InvestorPlace
May-31-19,5 Large-Cap Semiconductor Stocks to Buy Right Now,Zacks
May-31-19,Should Intel Stock Be Bought on Weakness?,InvestorPlace
May-31-19,Nvidia Stock Has More Than Just Short-Term Problems,InvestorPlace
May-31-19,Bitcoin's resurgence could help fuel the next rally in chip stock Advanced Micro,CNBC
Jun-03-19,The 10 Biggest Announcements From Apple WWDC 2019,InvestorPlace
Jun-03-19,Samsung Electronics Partners With AMD On Mobile Graphics Chips,Investor's Business Daily
Jun-03-19,High-Performance AMD Radeon GPUs to Power All-New Mac Pro,GlobeNewswire
Jun-03-19,Advanced Micro Devices Rises on Graphics Deal With Samsung,TheStreet.com
Jun-03-19,AMD Stock Jumps on Samsung Partnership,InvestorPlace
Jun-03-19,Third Times the Charm for AMDs Ryzen Chips,Motley Fool
Jun-03-19,3 Stocks to Buy for a Rebound,InvestorPlace
Jun-03-19,"The Zacks Analyst Blog Highlights: Fujifilm, NXP Semiconductor, Taiwan Semiconductor Manufacturing, XILINX and Advanced Micro Devices",Zacks
Jun-03-19,AMD shares rise on mobile graphics tie-up with Samsung,Reuters
Jun-03-19,"How Many Advanced Micro Devices, Inc. (NASDAQ:AMD) Shares Have Insiders Sold, In The Last Year?",Simply Wall St.
Jun-03-19,AMD Shares Rise After Inking New Strategic Partnership With Samsung,Benzinga
Jun-03-19,Samsung to Use AMD's Graphics Chip Technology in Smartphones,Bloomberg
Jun-03-19,AMD stock gains after announcement of Samsung partnership,MarketWatch
Jun-03-19,"AMD and Samsung Announce Strategic Partnership in Ultra Low Power, High Performance Graphics Technologies",GlobeNewswire
Jun-03-19,Should Investors Buy Nvidia Stock After Its Recent Drop?,InvestorPlace
Jun-03-19,Buy AMD Stock Because Advanced Micro Devices Just Dealt Intel Another Blow,InvestorPlace
Jun-03-19,Does Nvidia Stocks 23% May Tumble Make Shares A June Buy?,InvestorPlace
Jun-04-19,"Apple's WWDC 2019 Was All About Apps, Security",Benzinga
Jun-04-19,AMD stock surges on heavy volume; CFO makes about $3 million on a pre-scheduled stock trade,MarketWatch
Jun-04-19,Anticipation of Something Super at E3 Fails to Halt Nvidia Stock Slump,InvestorPlace
Jun-04-19,AMD Radeon Graphics to Enhance Samsung Smartphone Experience,Zacks
Jun-04-19,Samsung Deal Could Help AMD Stock Past the $34 Per Share Level,InvestorPlace
Jun-05-19,Advanced Micro Devices (AMD) Stock Sinks As Market Gains: What You Should Know,Zacks
Jun-05-19,4 Momentum Stocks To Watch,Benzinga
Jun-05-19,Can Red-Hot AMD Stock Finally Take Out the $30 Level?,InvestorPlace
Jun-05-19,AMD and 3 more momentum stocks to watch,MarketWatch
Jun-05-19,Is Now the Time to Pull the Trigger on Advanced Micro Devices (AMD) Stock? Rosenblatt Says Yes,SmarterAnalyst
Jun-05-19,Advanced Micro Devices Has Reached a Cross Road on the Chart,TheStreet.com
Jun-05-19,Who Will Win the GPU Battle This Year?,Motley Fool
Jun-05-19,"Stock Futures Rebound From Lows, Nasdaq Paces Early Stock Market Rally",Investor's Business Daily
Jun-05-19,"Wednesdays Vital Data: Home Depot, Snap and Advanced Micro Devices",InvestorPlace
Jun-05-19,AMD Radeon GPUs to Boost Apple Mac Pro's Graphics Performance,Zacks
Jun-05-19,"3 Big Stock Charts for Wednesday: eBay, General Mills and Intel",InvestorPlace
Jun-05-19,AMD Stock Looks as If It Finally Is Ready to Cool off a Bit,InvestorPlace
Jun-05-19,"Jim Cramer Shares His Thoughts On AMD, CME Group, Microsoft And More",Benzinga
Jun-06-19,"Why Advanced Micro Devices, Ciena, and Eloxx Pharmaceuticals Jumped Today",Motley Fool
Jun-06-19,IBD Stock Of The Day: AMD Hits Buy Point On Analyst's Cautious Upgrade,Investor's Business Daily
Jun-06-19,AMD stock jumps as Morgan Stanley throws in the towel on obviously wrong bearish call,MarketWatch
Jun-06-19,Even Nvidias Biggest Critics Arent Very Bearish,InvestorPlace
Jun-06-19,Morgan Stanley Says Its Bearish Call on AMD Stock Was Wrong,Barrons.com
Jun-06-19,"Morgan Stanley Upgrades AMD, Says 'Table Is Set Well' For 2020",Benzinga
Jun-06-19,"Futures Rise; Stocks To Watch: AMD, Ciena",Investor's Business Daily
Jun-06-19,Tesla Stock Rises as the Dow Goes for 4 Wins in a Row,Barrons.com
Jun-06-19,AMD stock gains after Morgan Stanley ends bearish call,MarketWatch
Jun-06-19,Intel Stock Gets More Value Oriented by the Day,InvestorPlace
Jun-06-19,Stocks - Wall Street Flat as Trump Hints at More Tariffs After G20,Investing.com
Jun-07-19,1 Big Reason AMD Is a Better Buy Than NVIDIA,Motley Fool
Jun-07-19,Is It Time to Hold Your Horses on AMD Stock?,Zacks
Jun-07-19,"Fridays Vital Data: Snap, Beyond Meat and Advanced Micro Devices",InvestorPlace
Jun-07-19,AMD's rise wins over more of Wall Street,American City Business Journals
Jun-07-19,3 Big Reasons AMD Stock Is Just Starting Its Next Growth Surge,InvestorPlace
Jun-07-19,Nvidia Stock Is Out of Favor on Wall Street  Own It Anyway,InvestorPlace
Jun-07-19,"3 Big Stock Charts for Friday: AT&T, Metlife and KeyCorp",InvestorPlace
Jun-07-19,Dan Nathan Sees Unusual Options Activity In AMD,Benzinga
Jun-07-19,AMD stock jumps as Morgan Stanley throws in the towel on obviously wrong bearish call,MarketWatch
Jun-07-19,Stocks - U.S. Futures Keep Gains on Hopes of Mexico Tariff Delay,Investing.com
Jun-10-19,AMD Reveals Leadership PC Platform for Gamers Worldwide at E3 2019,GlobeNewswire
Jun-10-19,Will AMD Stock Continue to Climb After Reaching New 52-Week High?,Zacks
Jun-10-19,Microsoft (MSFT) at Xbox E3 Briefing: Project Scarlett &amp; More,Zacks
Jun-10-19,Nasdaq Outmatches Dow Jones In Broad Rally; Can These 2 Tech Groups Lead In June?,Investor's Business Daily
Jun-10-19,Breakout Watch: AMD Stock On This Watchlist Before Soaring Higher,Investor's Business Daily
Jun-10-19,Analyst: Inclusion In New Gaming Console A Positive For AMD,Benzinga
Jun-10-19,4 Technology Stocks Blasting Higher,InvestorPlace
Jun-10-19,"AMDs stock powers up toward 13-year high, as Microsofts new Xbox provides a boost",MarketWatch
Jun-10-19,3 Semiconductor Stocks to Buy Right Now,Zacks
Jun-10-19,Nasdaq Today: Broadcom Leads Chip Rally With Earnings Right Around The Corner,Investor's Business Daily
Jun-10-19,Best Growth Stocks To Buy And Research,Investor's Business Daily
Jun-10-19,"Microsoft Unveils Project Scarlett, Its Next-Gen Gaming Console",TheStreet.com
Jun-10-19,Project Scarlett: What We Know About Microsofts New Xbox Console 2020,InvestorPlace
Jun-10-19,"Microsoft, AMD Grab Early Headlines At E3 Video Game Show",Investor's Business Daily
Jun-10-19,Custom AMD Chip Set to Power Next Generation Xbox,TheStreet.com
Jun-10-19,"Stocks Jump: Revolve, Tableau Spike: Dow Jones Industrials Aim For Six",Investor's Business Daily
Jun-10-19,StockBeat - AMD to Power Microsoft's Next-Gen Console; Shares Hit 13-Year High,Investing.com
Jun-10-19,AMD Partners With Microsoft For Project Scarlett,Benzinga
Jun-10-19,Heres What to Look for in Intel Stock over the Next Few Sessions,InvestorPlace
Jun-10-19,The Endless Plunge Plaguing Nvidia Stock Still Isnt Over,InvestorPlace
Jun-10-19,"Dow Jones Futures Rise On Mexico, China Trade News, Big Defense, Tech M&A",Investor's Business Daily
Jun-10-19,AMD Stock Surges on Morgan Stanley Upgrade,InvestorPlace
Jun-10-19,The Bull Run on AMD Stock Is Not Anywhere Near Over,InvestorPlace
Jun-11-19,Money flows in 11 popular tech stocks show that the rally is suspect,MarketWatch
Jun-11-19,Breakout Watch: AMD Stock On This Watchlist Before Soaring Higher,Investor's Business Daily
Jun-11-19,Buy Microsoft (MSFT) Shares at New High as Tech Stocks Soar?,Zacks
Jun-11-19,Analyst: AMD's New Graphics Cards Make 'Meaningful Improvement' But Cost More Than Expected,Benzinga
Jun-11-19,"Is Advanced Micro Devices, Inc. (AMD) A Good Stock To Buy?",Insider Monkey
Jun-11-19,Bullish Semiconductor Options Trades Suggest Trade War Fears Might Be Overblown,Benzinga
Jun-11-19,"Buy AMD Stock For Its New Gaming Chips, Analyst Says",Barrons.com
Jun-11-19,Advanced Micro Devices Shares See Big Demand  Again,Investopedia
Jun-11-19,AMD Ups the Ante in Gaming With New Product Launches at E3,Zacks
Jun-11-19,"Old Mo, Tariffs Weaponry, a Need for Easing and AMD Revives: Market Recon",TheStreet.com
Jun-11-19,"AMDs stock powers up to 13-year high, as Microsofts new Xbox provides a boost",MarketWatch
Jun-11-19,"AMD Stock Is for Real, but Intel Wont Sleep on It Much Longer",InvestorPlace
Jun-11-19,"For Chipmaker Advanced Micro Devices Stock, How High Is Too High?",InvestorPlace
Jun-11-19,"Stocks -  Apple, Broadcom, Barnes & Noble Rise Premarket; Beyond Meat Falls",Investing.com
Jun-11-19,Near-Term Pain Will Shift To Longer-Term Benefits For MU Stock Investors,InvestorPlace
Jun-12-19,Advanced Micro Devices Inc (AMD) President & CEO Lisa T Su Sold $5.5 million of Shares,GuruFocus.com
Jun-12-19,Advanced Micro Devices (AMD) Dips More Than Broader Markets: What You Should Know,Zacks
Jun-12-19,"Nomura: AMD's Upcoming Products Can Drive Revenue Momentum, Operating Leverage",Benzinga
Jun-12-19,What Does Deutsche Bank Think About AMD Stock?,SmarterAnalyst
Jun-12-19,Money flows in 11 popular tech stocks show that the rally is suspect,MarketWatch
Jun-12-19,Xbox Excitement Lifts Microsoft Stock to All-Time High,Investopedia
Jun-12-19,"Buy AMD Stock Because It Will Gain Chip Market Share, Analyst Says",Barrons.com
Jun-12-19,"The Zacks Analyst Blog Highlights: Microsoft, Amazon, Google and AMD",Zacks
Jun-12-19,"Wednesdays Vital Data: Sprint, Advanced Micro Devices and Facebook",InvestorPlace
Jun-12-19,A Return to Innovation Is the Catalyst Intel Stock Needs Right Now,InvestorPlace
Jun-12-19,9 major Bay Area tech employers pay a typical worker more than $200K per year,American City Business Journals
Jun-12-19,7 Stocks to Avoid,Morningstar
Jun-13-19,Dow Jones Futures: Broadcom Warning Is Bad News For Stock Market Rally,Investor's Business Daily
Jun-13-19,Broadcom slaps down hopes for a second-half rebound in chips,MarketWatch
Jun-13-19,Heres How Intel Stock (INTC) Could Rally to $58,InvestorPlace
Jun-13-19,Buy These Stocks Before the June Fed Meeting,Schaeffer's Investment Research
Jun-13-19,Is AMD Stock a Buy with New Product Launches? Morgan Stanley Says Not Yet,SmarterAnalyst
Jun-13-19,AMD Slips as Analyst Warns on Valuation; Backs Nvidia,Investing.com
Jun-13-19,Small-cap stocks are flashing a yellow signal,MarketWatch
Jun-14-19,"AVGO Stock Fell After Broadcom Lowered Guidance, Semiconductor Stocks Follow",Zacks
Jun-14-19,Best ETFs to Invest in 5G Theme,Zacks
Jun-14-19,Do AMD Stock Bears Have a Valid Argument?,InvestorPlace
Jun-14-19,"Stocks Slip On Chips, China Data; Facebook Gets Cryptocurrency Lift",Investor's Business Daily
Jun-14-19,Experience The Exascale Era with AMD at ISC19,GlobeNewswire
Jun-14-19,Broadcom stock plunge triggers broad selloff in chips,MarketWatch
Jun-14-19,Dow Jones Futures: Broadcom Warning Is Bad News For Stock Market Rally,Investor's Business Daily
Jun-14-19,Broadcom slaps down hopes for a second-half rebound in chips,MarketWatch
Jun-17-19,AMD's stock slumps toward longest losing streak in 8 months,MarketWatch
Jun-17-19,Microsoft (MSFT) vs. Google (GOOGL): Who Will Win the Cloud Gaming Battle?,Zacks
Jun-17-19,"Software Stocks Most Overvalued Among Tech Issues, Says Goldman Sachs",Investor's Business Daily
Jun-17-19,3 of the Best Stocks to Buy Now,InvestorPlace
Jun-17-19,"Mondays Vital Data: Disney, Beyond Meat and Advanced Micro Devices",InvestorPlace
Jun-17-19,"Stock Market News For Jun 17, 2019",Zacks
Jun-17-19,Rise Of The 'She-EO?' The 7 Best Women CEOs You Can Invest In,Investor's Business Daily
Jun-17-19,Don't Count Intel Out Just Yet,Morningstar
Jun-17-19,"Next-Gen Xbox Wont Launch Microsoft Stock, But It Doesnt Need To",InvestorPlace
Jun-18-19,Chip Stocks Rally On News Of U.S.-China Trade Summit Next Week,Investor's Business Daily
Jun-18-19,6 Chip Stocks Staring At Big Headwinds in 2019,InvestorPlace
Jun-18-19,AMD Reclaims Buy Point,Investor's Business Daily Video
Jun-18-19,AMD's stock surges toward first gain in 6 days amid broad chip-sector rally,MarketWatch
Jun-18-19,"NVIDIA Ups the Game in Self Driving, Unveils DGX SuperPOD",Zacks
