date,title,source
Dec-07-18,"New Research Coverage Highlights Callaway Golf, Synchrony Financial, Roper Technologies, Ringcentral, Sarepta Therapeutics, and Advanced Micro Devices  Consolidated Revenues, Company Growth, and Expectations for 2018",GlobeNewswire
Dec-10-18,Cramer's lightning round: Cisco is currently the cheapest large-cap tech stock,CNBC
Dec-10-18,Support Will Hold for Micron Stock After Earnings,InvestorPlace
Dec-10-18,2 Important Levels to Watch for Nvidia Stock,InvestorPlace
Dec-10-18,Why Advanced Micro Devices Stock Surged 17% in November,Motley Fool
Dec-10-18,"3 Big Stock Charts for Monday: Intuit, PPL and HollyFrontier",InvestorPlace
Dec-11-18,"Jim Cramer: Don't Buy Tech ETFs, Buy Strong Tech Stocks",TheStreet.com
Dec-11-18,The Two Best-Performing U.S. Stocks Aren't Getting Analyst Love,Bloomberg
Dec-11-18,"Trade Talks, Apple News, & the Outlook for AMD Stock in 2019",Zacks
Dec-11-18,How Much Should You Pay for Advanced Micro Devices Stock?,InvestorPlace
Dec-11-18,AMD stock rises after Cowen names it among best ideas for 2019,MarketWatch
Dec-11-18,"Jim Cramer Weighs In On Cisco, General Electric And More",Benzinga
Dec-12-18,Intel plans 'stacked' circuits in bid to regain its chipmaking lead,Reuters
Dec-12-18,Intel plans 'stacked' circuits in bid to regain its chipmaking lead,Reuters
Dec-12-18,Stocks Open Higher On Trade News; Exxon Fuels Dow Jones' Advance,Investor's Business Daily
Dec-12-18,Intel (INTC) Stock Looks Like a Strong Buy Heading into 2019,Zacks
Dec-12-18,"Do Hedge Funds Love Advanced Micro Devices, Inc. (AMD)?",Insider Monkey
Dec-13-18,Is Activision Blizzard the Best Video Game Stock to Buy?,InvestorPlace
Dec-13-18,Should You Buy Micron (MU) Stock On the Dip Ahead of Earnings?,Zacks
Dec-13-18,AMD Slides After Target Price Is Cut at Baird,TheStreet.com
Dec-13-18,Unleash the Full Power of AMD Radeon GPUs with New AMD Radeon Software Adrenalin 2019 Edition,GlobeNewswire
Dec-13-18,NVIDIA Stock Looks Cheap. It's Probably Not.,Motley Fool
Dec-14-18,Annual Changes to the NASDAQ-100 Index,GlobeNewswire
Dec-14-18,How to Play Techs Top 3 Themes for 2019,Barrons.com
Dec-14-18,Advanced Micro Devices (AMD) Gains As Market Dips: What You Should Know,Zacks
Dec-14-18,AMD Announces Latest Radeon Software Adrenalin 2019 Edition,Zacks
Dec-14-18,"3 Big Stock Charts for Friday: Duke Realty, Mattel and Delta Air Lines",InvestorPlace
Dec-14-18,"Intel Inks New $100M Deal With ESL, Ups the Game in Esports",Zacks
Dec-14-18,Today's Research Reports on Trending Tickers: Advanced Micro Devices and Intel,ACCESSWIRE
Dec-14-18,"Highlighted as Zacks Bull and Bear of the Day Azure Power, Tata Motors, Micron, Nvidia and AMD",Zacks
Dec-18-18,AMD's Uptrend Is Still Alive (for Now),TheStreet.com
Dec-18-18,"Nasdaq 100 Inclusion A 'Small Near-Term Positive' For AMD, RBC Says",Benzinga
Dec-18-18,Activision Stock Looks Poised to Rebound From Plunge,InvestorPlace
Dec-18-18,Is AMD Stock Really a Best Bet for 2019?,InvestorPlace
Dec-18-18,"3 Big Stock Charts for Tuesday: Juniper Networks, Home Depot and Campbell Soup Company",InvestorPlace
Dec-19-18,5 Blue-Chip Stocks That Could Break Their Bull Trend,InvestorPlace
Dec-19-18,Nvidia and AMD Are Two of the Best Buys in the Chip Sector,TheStreet.com
Dec-19-18,"3 Big Stock Charts for Wednesday: Nike, Johnson & Johnson and Facebook",InvestorPlace
Dec-19-18,Why AMD Stock Is Stuck in Neutral for Now,InvestorPlace
Dec-20-18,I'm Looking at Western Digital Short Term,TheStreet.com
Dec-20-18,"Bank Of America Cuts AMD Target By 10%, Still Bullish In The Long Term",Benzinga
Dec-20-18,The Weakness of Micron Stock Has Created a Good Buying Opportunity,InvestorPlace
Dec-20-18,"The AMD Stock Yo-Yo Continues, but New Highs Could Be on the Way",InvestorPlace
Dec-20-18,A Bearish Semiconductor ETF Still Looks Good,ETF Trends
Dec-20-18,Better Buy: NXP Semiconductors vs. NVIDIA,Motley Fool
Dec-20-18,Which Semiconductor Stock Could be the AMD of 2019?,Zacks
Dec-20-18,AMD to Join NASDAQ-100 Index,GlobeNewswire
Dec-21-18,Nvidia's 54 percent plunge this quarter makes it the biggest loser in S&P 500,CNBC
Dec-21-18,4 Reasons Qualcomm's Data Center Business Failed,Motley Fool
Dec-21-18,Advanced Micro Devices Could Drop Another 40%,Investopedia
Dec-21-18,Chip Stocks Looking To Find A Bottom Sometime In Early 2019,Investor's Business Daily
Dec-26-18,Will This Be AMD's Big Break in 2019?,Motley Fool
Dec-26-18,10 Stocks That Won Big In 2018,InvestorPlace
Dec-26-18,"3 Big Stock Charts for Wednesday: Advanced Micro Devices, Morgan Stanley and Amazon",InvestorPlace
Dec-27-18,"5 Must-See Stock Charts for Friday: Nvidia, AMD, VIX, APRN",InvestorPlace
Dec-27-18,"Artificial intelligence will be 50 percent year upside, s...",CNBC Videos
Dec-27-18,"Chip stocks take a slide, here's where it's headed",CNBC Videos
Dec-27-18,Chip Stocks Under Pressure Midday in Overall Selloff,Investing.com
Dec-27-18,How to Ride Market Volatility as S&P 500 Enters Bear Market Territory,InvestorPlace
Dec-27-18,Stocks Drop: FANGs Chip Stocks Tumble; Dow Jones Dives 300-Points,Investor's Business Daily
Dec-27-18,Trump Mulling Order That Bans US Companies From Dealing With Huawei - Report,TheStreet.com
Dec-27-18,"Shun NVIDIA, Opt for These 4 Top-Ranked Semi Stocks in 2019",Zacks
Dec-28-18,Advanced Micro Devices (AMD) Gains As Market Dips: What You Should Know,Zacks
Dec-28-18,There Are Better Chip Names for 2019 Than Intel Stock,InvestorPlace
Dec-28-18,Should You Join Advanced Micro Devices Stock as Part of the NASDAQ-100?,InvestorPlace
Dec-28-18,"[$$] Stocks to Watch: Tesla, IBM, P&G, AMD, Nvidia and Salesforce",The Wall Street Journal
Dec-28-18,Patent Wins Make QCOM Stock a Lot More Interesting,InvestorPlace
Dec-31-18,"CNBC Tech Check Evening Edition: December 31, 2018",CNBC Videos
Dec-31-18,The best and worst stocks of 2018,MarketWatch
Dec-31-18,3 Semiconductor Stocks to Buy Amid a 2019 Chip Glut,InvestorPlace
Dec-31-18,Here are the best and worst performing stocks of this tough and volatile year for the market,CNBC
Dec-31-18,Tech had a rocky 2018. Here's what 2019 might look like.,CNBC Videos
Dec-31-18,The Perfect Spot to Buy AMD Stock,InvestorPlace
Jan-02-19,AMD President and CEO Dr. Lisa Su to Keynote at CES 2019,GlobeNewswire
Jan-02-19,Here's What to Expect from Micron (MU) Stock in 2019,Zacks
Jan-02-19,The best and worst stocks of 2018,MarketWatch
Jan-02-19,Advanced Micro Devices Stock Is In Good Shape for 2019,InvestorPlace
Jan-02-19,Dont Let the Class-Action Suit Dissuade You from Nvidia Stock,InvestorPlace
Jan-02-19,"Apple, Amazon sell-off overdone, research analyst says",CNBC Videos
Jan-02-19,"3 Stock Charts for Wednesday: Dentsply, Procter & Gamble and Valero Energy",InvestorPlace
Jan-03-19,"Why Intel, AMD, and Qorvo Stocks All Sank More Than 5% Today",Motley Fool
Jan-03-19,Apple shares dive; rare revenue warning drags global markets,Reuters
Jan-03-19,Nvidia Stock Is Far Too Cheap to Ignore Now,InvestorPlace
Jan-03-19,"The Zacks Analyst Blog Highlights: Micron, Nvidia, AMD and Intel",Zacks
Jan-03-19,The best and worst stocks of 2018,MarketWatch
Jan-03-19,The 3 Best Stocks in the Nasdaq 100 in 2018,Motley Fool
Jan-03-19,Semiconductor Sales Dip in November: Can Chipmakers Rebound?,Zacks
Jan-03-19,NVIDIA's Biggest Hurdle for 2019,Motley Fool
Jan-04-19,"Shares of Boeing and AMD will rise 50% over the next three years, tech investor predicts",CNBC
Jan-04-19,Amazon has been a market darling for Main and Wall Street...,CNBC Videos
Jan-04-19,Tech's big gadget show edges closer to gender equity,Associated Press
Jan-04-19,"Millennials Load Up on Battered Apple, Facebook, GE",Investopedia
Jan-04-19,How to Trade Intel Stock and Its Potential 33% Upside,TheStreet.com
Jan-04-19,"Intel Makes A Compelling Large-Cap Investment, BofA Says In Upgrade",Benzinga
Jan-04-19,"Stock Market News For Jan 4, 2019",Zacks
Jan-04-19,IoT Stocks to Watch,ACCESSWIRE
Jan-04-19,"Stocks - Wall Street Soars on 'Patient' Powell, Strong Jobs Data",Investing.com
Jan-07-19,Cramer Remix: This chipmaker could have another bad quarterbut it's worth buying now,CNBC
Jan-07-19,Top 5 S&P 500 Stocks for 2018 by Performance,Investopedia
Jan-07-19,Here's What to Expect from Nvidia (NVDA) Stock in 2019,Zacks
Jan-07-19,Why Investors Should Love NVIDIA's Latest Announcement,Motley Fool
Jan-07-19,"Why Advanced Micro Devices, Luxoft Holding, and QEP Resources Jumped Today",Motley Fool
Jan-07-19,Top 5 Information Technology Stocks of 2018 by Performance,Investopedia
Jan-07-19,3 Big Gainers That Easily Could Be the Best Stocks to Buy,InvestorPlace
Jan-07-19,AMD and Nvidia Lead Biggest Two-Day Chip Stock Rally Since 2015,Bloomberg
Jan-07-19,NVIDIA's RTX 2060 Continues Its Price-Boosting Strategy,Motley Fool
Jan-07-19,Here's what a promising startup and 30 Bay Area honorees are showing off at CES this week,American City Business Journals
Jan-07-19,"AMD Stock Is Hanging by a Thread, and Its a Long Way Down",InvestorPlace
Jan-07-19,"[$$] Stocks to Watch: Eli Lilly, PG&E, Dollar Tree, Netflix, AMD",The Wall Street Journal
Jan-07-19,AMD Commences 2019 With Latest Ryzen Processors and GPUs,Zacks
Jan-07-19,China Aims to Curb US Dependency With New Data Center Chip,Zacks
Jan-07-19,Stocks Bouncing Off Their Bottoms,ACCESSWIRE
Jan-07-19,China's Huawei unveils chip for global big data market,Associated Press
Jan-08-19,Advanced Micro Devices (AMD) Gains But Lags Market: What You Should Know,Zacks
Jan-08-19,Goldman Sachs Shares Semiconductor Stock Picks For A Challenging 2019,Benzinga
Jan-08-19,4 Tech Stocks That Are Showing Signs Of Life Right Now,Benzinga
Jan-08-19,AMD Could Break Out From Descending Triangle,Investopedia
Jan-08-19,"Technical View of Markets & Today's Trending Tickers: AMD, NVDA",Zacks
Jan-08-19,Here's What Investors Should Expect from AMD Stock in 2019,Zacks
Jan-08-19,Chip Stocks See Big Two-Day Rally After 2015: ETFs in Focus,Zacks
Jan-08-19,"Editas Medicine, YY, Intel, Advanced Micro Devices and NVIDIA highlighted as Zacks Bull and Bear of the Day",Zacks
Jan-08-19,Top 5 S&P 500 Stocks for 2018 by Performance,Investopedia
Jan-09-19,"AMDs Lisa Su takes center stage at CES, taking aim at Intel and Nvidia",MarketWatch
Jan-09-19,"AMD shows off 7nm next-gen chips at CES, aims at Intel and Nvidia",Reuters
Jan-09-19,AMD President and CEO Dr. Lisa Su Reveals Coming High-Performance Computing Inflection Point in CES 2019 Keynote,GlobeNewswire
Jan-10-19,AMD Lays Out Big Plans for 2019,Motley Fool
Jan-10-19,Nvidia's Huang Dismisses Rival AMD's Latest Graphics Card As 'Underwhelming',Benzinga
Jan-10-19,"AMDs Lisa Su takes center stage at CES, taking aim at Intel and Nvidia",MarketWatch
Jan-10-19,Jon Fortt breaks down trash talk in chip sector at CES,CNBC Videos
Jan-10-19,AMD Boosts Gaming Experience With 7nm Radeon Graphics Card,Zacks
Jan-10-19,Hedge Funds Bet These 12 Stocks Will Plunge Amid Rally,Investopedia
Jan-10-19,NVIDIA Bonds With Mercedes for Next-Gen AI-Run Vehicles,Zacks
Jan-10-19,"Advanced Micro Devices Storms CES With 7nm Chips, Radeon VII",InvestorPlace
Jan-10-19,Tech Stocks Surging,ACCESSWIRE
Jan-10-19,Today's Research Reports on Trending Tickers: Advanced Micro Devices and Micron Technology,ACCESSWIRE
Jan-10-19,Hedge Funds Bet These 12 Stocks Will Plunge Amid Rally,Investopedia
Jan-11-19,Here's When AMD Stock Becomes a Buy,TheStreet.com
Jan-11-19,"Money flows show Netflix, AMD and Amazon shares may rocket on good news",MarketWatch
Jan-11-19,"AMD shows off 7nm next-gen chips at CES, aims at Intel and Nvidia",Reuters
Jan-11-19,ON Semiconductor Stock Has Positive And Negative Attributes,InvestorPlace
Jan-11-19,"Advanced Micro Devices, Inc. (NASDAQ:AMD) Earns A Nice Return On Capital Employed",Simply Wall St.
Jan-11-19,AMD Stock Just Keeps Giving Us More to Look Forward To,InvestorPlace
Jan-14-19,Why NVIDIA Stock Plunged 31% in 2018,Motley Fool
Jan-14-19,Advanced Micro Devices (AMD) Stock Moves -0.2%: What You Should Know,Zacks
Jan-14-19,"Money flows show Netflix, AMD and Amazon shares may rocket on good news",MarketWatch
Jan-14-19,Heading Into Earnings Season with 3 Weeks of Gains,Zacks
Jan-14-19,"Detailed Research: Economic Perspectives on Advanced Micro Devices, Blackbaud, United States Cellular, CalAmp, Visteon, and Zogenix  What Drives Growth in Today's Competitive Landscape",GlobeNewswire
Jan-14-19,Stocks - U.S. Futures Slip after Chinese Exports Shrink,Investing.com
Jan-15-19,Will Intel Be Upgraded to a Buy in 2019?,Zacks
Jan-15-19,Capture the eSports Craze with this ETF,Zacks
Jan-15-19,Descending Triangle Pattern in AMD Stock,Investopedia
Jan-15-19,"CES 2019: What Google, Amazon, &amp; Other Tech Giants Showed Off",Zacks
Jan-15-19,"This is how much Apple pays a typical employee  and how that compares to Google, Facebook, Netflix, Microsoft, Box and more",American City Business Journals
Jan-16-19,Should You Buy Intel (INTC) Stock Ahead of the Chip Giant's Q4 Earnings?,Zacks
Jan-16-19,AMD to Report Fiscal Fourth Quarter and Full Year 2018 Financial Results,GlobeNewswire
Jan-16-19,What To Expect From AMD's Earnings,Investopedia
Jan-17-19,Stocks climb on report US may pare back tariffs on China,Associated Press
Jan-17-19,5 Reasons to Buy AMD Stock,InvestorPlace
Jan-17-19,Taiwan Semiconductor Gives Gloomy Outlook on Smartphone Demand,Barrons.com
Jan-17-19,AMD Selected for 2019 Bloomberg Gender-Equality Index,GlobeNewswire
Jan-18-19,"5 Top Stock Trades for Tuesday: SPY, NFLX, TSLA, AMD, T",InvestorPlace
Jan-18-19,3 Earnings Reports to Watch Next Week,InvestorPlace
Jan-18-19,"3 Big Stock Charts for Friday: General Electric, Nike and Wynn Resorts",InvestorPlace
Jan-22-19,"Intel (INTC) Q4 Earnings Preview: Client Computing, Data Centers, IoT &amp; More",Zacks
Jan-22-19,3 Blue-Chip Stocks That Will Power Through Market Turmoil,InvestorPlace
Jan-22-19,Stocks - Wall Street Weaker on Global Growth Concerns,Investing.com
Jan-23-19,Will Investors Like Intel's Earnings Results?,Motley Fool
Jan-23-19,Will Intel Stock Suffer Like Nvidia on Earnings?,InvestorPlace
Jan-23-19,"Big Chip Earnings Preview: Intel, AMD Set To Report Amid Changing Competitive Landscape, Cycle Risk",Benzinga
Jan-23-19,"Dont Jump on Nvidia Stock Just Yet, It Might Stay Stuck Awhile",InvestorPlace
Jan-23-19,"U.S. has five-year lead on semiconductors, says Breyer Ca...",CNBC Videos
Jan-23-19,Today's Research Reports on Trending Tickers: NVIDIA and Advanced Micro Devices,ACCESSWIRE
Jan-24-19,Top technician says this chip stock is about to break out,CNBC Videos
Jan-24-19,Chip stocks retreat after Intel earnings disappoint,MarketWatch
Jan-24-19,"Intel forecasts first-quarter below estimates, shares fall",Reuters
Jan-24-19,Intel forecasts first-quarter below estimates,Reuters
Jan-24-19,Better Buy: Advanced Micro Devices vs. Cypress Semiconductor,Motley Fool
Jan-24-19,Will GPU Product Introduction Benefit AMD's Q4 Earnings?,Zacks
Jan-25-19,Shutdown News and FOMC Speculation Lift Stocks,Investopedia
Jan-25-19,AMD earnings: Will the crypto hangover lift before new product launches?,MarketWatch
Jan-25-19,4 Reasons Why Intel Stock Should Be Bought on Its Current Weakness,InvestorPlace
Jan-25-19,Why Intel Stock Tumbled Today,Motley Fool
Jan-25-19,What to Expect From AMD's Q4 Earnings,Motley Fool
Jan-25-19,An Early Nvidia (NVDA) Q4 Earnings Preview,Zacks
Jan-25-19,"Susquehanna Downgrades Intel, Questions Management's Guidance",Benzinga
Jan-25-19,"AMD rewards 3 top execs, hires another",MarketWatch
Jan-25-19,"Your first trade for Friday, January 25",CNBC
Jan-25-19,AMD Strengthens Senior Leadership Team,GlobeNewswire
Jan-25-19,AMD at Major Crossroads Ahead of Earnings,Investopedia
Jan-25-19,"Intel stock drops 6% after Needham, Susquehanna downgrades",MarketWatch
Jan-25-19,US STOCKS-Futures higher as upbeat corporate earnings lift sentiment,Reuters
Jan-25-19,"3 Big Stock Charts for Friday: Merck, Broadcom and Advanced Micro Devices",InvestorPlace
Jan-28-19,The Best S&P 500 Stocks of 2018,Investopedia
Jan-28-19,What to Expect from AMD Q4 Earnings After Nvidia Lowered Guidance,Zacks
Jan-28-19,"Caterpillar, Nvidia sound alarm on profit hit from China",Reuters
Jan-28-19,Brace Yourself for AMD's Earnings Report,Motley Fool
Jan-28-19,"Why Vale, Rite Aid, and Advanced Micro Devices Slumped Today",Motley Fool
Jan-28-19,How to Trade AMD Stock After Nvidia's Plunge,TheStreet.com
Jan-28-19,AMD earnings: Odds of persistent crypto hangover just jumped with Nvidias warning,MarketWatch
Jan-28-19,"As Tempting as It Is, AMD Stock Still Comes down to Valuation",InvestorPlace
Jan-28-19,"Why Boeing Is a Strong Buy Stock and News from CAT, NVDA, &amp; VALE",Zacks
Jan-28-19,Is Advanced Micro Devices Stock a Buy Ahead of Earnings?,InvestorPlace
Jan-28-19,Capital Market Laboratories (CMLviz) Interviews Advanced Micro Devices CEO  AMD is no longer the one-hit wonder,GlobeNewswire
Jan-28-19,"Earnings Preview: Apple, AMD, Verizon, Other Giants to Report Crucial Q4",TheStreet.com
Jan-28-19,Nvidias Growth Story Hits a Wall,InvestorPlace
Jan-28-19,"AMD, Micron and Intel shares sink after Nvidia cuts revenue and gross margin guidance",MarketWatch
Jan-28-19,"Semiconductor Stocks' Earnings on Jan 29: AMD, MXIM, IPHI",Zacks
Jan-28-19,AMD Q4 Earnings to Gain from Computing &amp; Graphics Segment,Zacks
Jan-28-19,Today's Research Reports on Trending Tickers: Advanced Micro Devices and Universal Display,ACCESSWIRE
Jan-28-19,"A Big Pension Is Buying Up GE, AMD, and Caterpillar Stock",Barrons.com
Jan-29-19,"Dow Jones Futures: Apple, AMD Lead Big Earnings Movers Late",Investor's Business Daily
Jan-29-19,"[$$] AMD Guides for Slower Growth, But Thats OK for Wall Street",The Wall Street Journal
Jan-29-19,AMD shares jump on record growth in data centre revenue,Reuters
Jan-29-19,AMD shares jump on record growth in data center revenue,Reuters
Jan-29-19,Here's when an earnings miss isn't really a miss: Jim Cramer,CNBC
Jan-29-19,AMDs stock rallies after hours as full-year outlook holds out hope,MarketWatch
Jan-29-19,"[$$] AMD Guides for Slower Growth, but Shares Rise",The Wall Street Journal
Jan-29-19,Advanced Micro Devices (AMD) Misses Q4 Earnings and Revenue Estimates,Zacks
Jan-29-19,"Apple (AAPL) Barely Beats After Warning, Plus AMD &amp; EBAY Report",Zacks
Jan-29-19,AMD shares jump on record growth in data center revenue,Reuters
Jan-29-19,AMD Shares Surge as Chipmaker Gives Rosy 2019 Sales Forecast,Bloomberg
Jan-29-19,Advanced Micro: 4Q Earnings Snapshot,Associated Press
Jan-29-19,AMD Stock Rises Despite Mixed Fourth-Quarter Earnings Report,Investor's Business Daily
Jan-29-19,AMD Shares Pop Despite Missing Revenue Expectations,TheStreet.com
Jan-29-19,"AMD shares rise after hours even as revenue, outlook miss Street view",MarketWatch
Jan-29-19,AMD Reports Fourth Quarter and Annual 2018 Financial Results,GlobeNewswire
Jan-29-19,AMD earnings: Odds of persistent crypto hangover are higher after Nvidias warning,MarketWatch
Jan-29-19,"Apple Today, Powell Tomorrow: Busy Earnings And Fed Week Continues",Benzinga
Jan-29-19,Key Levels to Know for AMD Stock Earnings,InvestorPlace
Jan-29-19,5 ETFs Hit By NVIDIA's Revenue Guidance Cut,Zacks
Jan-29-19,Dow Leads Despite Mixed Earnings Results; Apple Earnings On Deck,Investor's Business Daily
Jan-29-19,"Stock Market News For Jan 29, 2019",Zacks
Jan-29-19,I'm Not Crazy in Love With Advanced Micro Devices Stock,TheStreet.com
Jan-29-19,"Forget INTC &amp; NVDA, Buy These 4 Semiconductor Stocks Instead",Zacks
Jan-29-19,"Sloppy Earnings, China's Economy, AMD Earnings Preview: Market Recon",TheStreet.com
Jan-29-19,Today's Research Reports on Trending Tickers: NVIDIA and Advanced Micro Devices,ACCESSWIRE
Jan-29-19,"Apple, AMD, PG&E, Huawei and the Federal Reserve - 5 Things You Must Know",TheStreet.com
Jan-29-19,NVIDIA (NVDA) Down on Reduction in Revenue Forecast for Q4,Zacks
Jan-29-19,Advanced Micro Devices Q4 Earnings Preview,Benzinga
Jan-29-19,Nvidia Short Sellers Have Earned $1.3B in Profits Since Mid-November,Investopedia
Jan-30-19,When AT&T Stock Becomes a Buy After Earnings Pullback,TheStreet.com
Jan-30-19,AMD Continues Its Turnaround Story Post-Earnings,TheStreet.com
Jan-30-19,"Why Boeing, Advanced Micro Devices, and Cleveland-Cliffs Jumped Today",Motley Fool
Jan-30-19,AMD stock logs best day in nearly three years after predicting sales jump that would make Evel Knievel nervous,MarketWatch
Jan-30-19,"Dow Cracks 25,000 After Fed Holds Rates Steady, Apple and Boeing Surge Higher",TheStreet.com
Jan-30-19,"5 Top Stock Trades for Thursday: AAPL, AMD, BA",InvestorPlace
Jan-30-19,US Stocks Fly Higher on Wednesday,GuruFocus.com
Jan-30-19,Should You Buy Nvidia Stock After Its Recent Drop?,InvestorPlace
Jan-30-19,These 4 Tech Stocks Are Surging With Potential,ACCESSWIRE
Jan-30-19,"After AMD's 15% surge, chip stocks cement their status as the craziest sector right now",CNBC
Jan-30-19,Wall Street finally rewards AMD progress; Shares spike despite mixed financial news,American City Business Journals
Jan-30-19,Analysts Weigh In On AMD Earnings Relief Rally,Benzinga
Jan-30-19,Why Shares of AMD Are Surging Today,Motley Fool
Jan-30-19,"AMD has won Wall Streets trust, and its stock is showing the results",MarketWatch
Jan-30-19,Dow Strong Ahead Of Fed Decision; 2 Dow Stocks Report Strong Earnings,Investor's Business Daily
Jan-30-19,AMD Surges as Wall Street Cheers 2019 Forecast and Execution,Bloomberg
Jan-30-19,AMD Surges After Solid 2019 Sales Guidance Offsets Tepid Q4 Earnings,TheStreet.com
Jan-30-19,"Stocks Surge On Earnings, Dow Jones Stock Eyes Breakout",Investor's Business Daily
Jan-30-19,"AMD Misses on Q4 Earnings &amp; Revenues Estimates, Shares Down",Zacks
Jan-30-19,"Stocks making the biggest moves premarket: Boeing, Apple, Alibaba, Tesla & more",CNBC
Jan-30-19,"Apple Earnings, the Fed, Trade Talks, AMD and eBay - 5 Things You Must Know",TheStreet.com
Jan-30-19,"Dow Jones Futures: Apple, AMD Drive Premarket Rally",Investor's Business Daily
Jan-30-19,"The Zacks Analyst Blog Highlights: Apple, Advanced Micro Devices, Nvidia and eBay",Zacks
Jan-30-19,Advanced Micro Devices (AMD) Q4 2018 Earnings Conference Call Transcript,Motley Fool
Jan-30-19,Edited Transcript of AMD earnings conference call or presentation 29-Jan-19 10:30pm GMT,Thomson Reuters StreetEvents
Jan-31-19,Is It Finally Time to Buy Advanced Micro Devices?,Motley Fool
Jan-31-19,How to Trade Advanced Micro Devices Stock After Stellar Earnings,InvestorPlace
Jan-31-19,3 Stocks to Buy as They Bottom,InvestorPlace
Jan-31-19,Is It Finally Time to Sell Nvidia Stock?,InvestorPlace
Jan-31-19,AMD Could Break Out From Rising Wedge After Q4 Results,Investopedia
Jan-31-19,AMD stock gains after Intel CEO announcement suggests 'an opening for AMD',MarketWatch
Jan-31-19,Rehashed News Is the Only Thing Wrong with Nvidia Stock,InvestorPlace
Jan-31-19,Intel names finance chief Bob Swan permanent CEO,American City Business Journals
Jan-31-19,Implied Volatility Surging for Advanced Micro Devices (AMD) Stock Options,Zacks
Jan-31-19,AMD stock logs best day in nearly three years after predicting sales jump that would make Evel Knievel nervous,MarketWatch
Jan-31-19,"AMD has won Wall Streets trust, and its stock is showing the results",MarketWatch
Jan-31-19,"This stock, up 155% from its low, has more room to run, technician says",CNBC
Jan-31-19,Edited Transcript of AMD earnings conference call or presentation 29-Jan-19 10:30pm GMT,Thomson Reuters StreetEvents
Feb-01-19,The Best Tech Products Will Overcome Volatile Times,Barrons.com
Feb-01-19,Weekend roundup: Facebook comeback of 2019 | Kevin OLeary and your debt | AMDs bright and sunny outlook,MarketWatch
Feb-01-19,Here's Why AMD Can Rally Once Again,Motley Fool
Feb-01-19,"Amazon's (AMZN) Q4 Earnings Beat, Sales View Disappoints",Zacks
Feb-01-19,Intel Stock Awaits Likely Rebound Under Interim-Turned-Permanent CEO Swan,InvestorPlace
Feb-04-19,3 Earnings Gaps Worth Buying,InvestorPlace
Feb-04-19,CNBC crowns 2018 Stock Draft winner,CNBC Videos
Feb-05-19,How AMD's Stock Rose 32% in January,Motley Fool
Feb-05-19,AMD to Present at Goldman Sachs Technology and Internet Conference,GlobeNewswire
Feb-05-19,AMD Declines After Large Shareholder Sells 34.9 Million Shares,TheStreet.com
Feb-05-19,"Bull trend strengthens, S&P 500 approaches 200-day average",MarketWatch
Feb-05-19,Tech and Cannabis Plays to Watch,ACCESSWIRE
Feb-05-19,AMD's stock sinks after large shareholder Mubadala tweets about share sales,MarketWatch
Feb-05-19,Kannalife Spokesman Nick Lowery Wins 2018 CNBC Stock Draft,GlobeNewswire
Feb-05-19,AMD Falls As Major Shareholder Sells,Benzinga
Feb-05-19,Abu Dhabi's Mubadala sells 34.9 million shares in U.S. chipmaker AMD,Reuters
Feb-05-19,[$$] Abu Dhabi sovereign fund cuts stake in US semiconductor group,Financial Times
Feb-05-19,Abu Dhabi's Mubadala sells 34.9 mln shares in U.S. chipmaker AMD,Reuters
Feb-05-19,Abu Dhabi's Mubadala to sell 34.9 million shares in U.S. chipmaker AMD,Reuters
Feb-06-19,"Semi stocks are on fire, but could the hot trade be about to burn out?",CNBC Videos
Feb-06-19,Learning From AMD's Massive Move,Investopedia
Feb-06-19,"3 Big Stock Charts for Wednesday: Intel, Electronic Arts and Conagra Brands",InvestorPlace
Feb-06-19,"New Research: Key Drivers of Growth for Advanced Micro Devices, BGC Partners, Compass Minerals International, Harsco, CVR Energy, and BlackRock  Factors of Influence, Major Initiatives and Sustained Production",GlobeNewswire
Feb-07-19,AMD's Radeon VII Graphics Card Won't Dethrone NVIDIA,Motley Fool
Feb-07-19,3 Leading Stocks to Buy on the Dip,InvestorPlace
Feb-07-19,Bear of the Day: NVIDIA (NVDA),Zacks
Feb-08-19,What to Expect for the Markets Next Week,Investopedia
Feb-08-19,"Advanced Micro Devices Inc (AMD) Files 10-K for the Fiscal Year Ended on December 31, 2018",GuruFocus.com
