date,title,source
Feb-08-19,"Large AMD Stock Sale Warrants Some Consideration, but Its Just Noise",InvestorPlace
Feb-08-19,US STOCKS-Wall Street set to drop at open as trade worries persist,Reuters
Feb-08-19,Chip stocks fall after Goldman and others warn they've gotten ahead of themselves,CNBC
Feb-08-19,"3 Big Stock Charts for Friday: Regions Financial, Fortinet and U.S. Bancorp",InvestorPlace
Feb-08-19,Why AMD Stock Looks Good Up to $25 but Not Beyond,InvestorPlace
Feb-08-19,Heres Why New CEO Bob Swan Is Perfect for Intel Stock,InvestorPlace
Feb-11-19,Weekly CFO Sells Highlight,GuruFocus.com
Feb-11-19,Why Advanced Micro Devices Stock Is Worth Buying Today,InvestorPlace
Feb-12-19,The Best S&P 500 Stocks of 2018,Investopedia
Feb-12-19,"US STOCKS-Wall St set to rise on trade optimism, progress to avert govt shutdown",Reuters
Feb-12-19,"US STOCKS-Futures gain on deal to avert government shutdown, trade hopes",Reuters
Feb-13-19,"Nvidia (NVDA) Q4 Earnings Preview: Gaming, Data Centers &amp; More",Zacks
Feb-13-19,Is NVIDIA a Value Play or a Falling Knife?,Motley Fool
Feb-13-19,Should You Buy AMD Stock in 2019? 6 Factors to Consider,TheStreet.com
Feb-14-19,"Nvidia, AMD Could Benefit From Google's $13 Billion Data Center Investment",TheStreet.com
Feb-14-19,Weekly Options Traders Bet on Semiconductor Sector,Schaeffer's Investment Research
Feb-14-19,Bulls bet on Intel and one more chip stock,CNBC Videos
Feb-14-19,The Main Drivers of Microsoft Stock Are Still Intact,InvestorPlace
Feb-14-19,NVIDIA Reports Today: Here's What You Need to Know,Zacks
Feb-14-19,8 Stocks That Can Lead in a 'Micro-Driven' Market,Investopedia
Feb-15-19,AMD Stock Will Benefit Even More with the Rise of Cloud Computing,InvestorPlace
Feb-15-19,"Nvidia forecasts demand rebound, Wall Street not so sure",Reuters
Feb-15-19,"Nvidia forecasts demand rebound, Wall Street not so sure",Reuters
Feb-15-19,The typical Facebook employee earns double Silicon Valley's median household income. How 50+ big tech employers compare,American City Business Journals
Feb-15-19,Stocks - U.S. Futures Rise as Trade Talks Extended,Investing.com
Feb-19-19,3 Stocks With Breakout Potential,InvestorPlace
Feb-19-19,"Nvidia Stock Soars After Fourth Quarter, So Now What?",InvestorPlace
Feb-20-19,6 Companies With 20% Or More Earnings Growth,Investopedia
Feb-20-19,3 Semiconductor Stocks to Buy Right Now,Zacks
Feb-21-19,9 High-Growth Stocks to Buy Now for Monster Returns,InvestorPlace
Feb-21-19,Heres Why You Should Sell the Rally in AMD Stock,InvestorPlace
Feb-21-19,"The Zacks Analyst Blog Highlights: Nvidia, Advanced Micro, Xilinx, Inphi and Cree",Zacks
Feb-21-19,Heres How AMD Is Turning the Tables on NVIDIA,Motley Fool
Feb-22-19,4 ETFs to Invest in Soaring Semiconductor Stocks,Zacks
Feb-22-19,The 3D XPoint Could Be a True Game Changer for MU Stock,InvestorPlace
Feb-22-19,5 Large-Cap Stocks Prepping for a Rebound,InvestorPlace
Feb-25-19,Chip Stocks' Rally Approaches Record High on Trade Deal Hopes,Bloomberg
Feb-25-19,Advanced Micro Devices Could Rally Further From Here,TheStreet.com
Feb-26-19,Why AMD Could Dent NVIDIAs Graphics Cards Business This Year,Motley Fool
Feb-26-19,"Stock Market News For Feb 26, 2019",Zacks
Feb-26-19,NVIDIA Ups the Ante on Gaming With GeForce GTX 1660 Ti,Zacks
Feb-26-19,"AMD Drives High-Performance Computing for the Embedded Industry with New Customers, Growing Momentum and Broad Ecosystem Support",GlobeNewswire
Feb-27-19,"5 Top Stock Trades for Thursday: BBY, MELI, CPB, AMD",InvestorPlace
Feb-27-19,3 Great Semiconductor Stocks to Buy Now,InvestorPlace
Feb-27-19,Cold War With China Will Hurt U.S. Stocks Long After Trade Deal,Investopedia
Feb-27-19,"AMD at EWC 2019: Edge Computing Alliances, Deal Wins &amp; More",Zacks
Mar-01-19,Bearish Reversal In AMD Stock Gave Early Warning Of Trouble,Investor's Business Daily
Mar-04-19,5 Blue-Chip Stocks Ready to Rise,InvestorPlace
Mar-04-19,The Advanced Micro Devices Share Price Is Up 899% And Shareholders Are Delighted,Simply Wall St.
Mar-05-19,The $200K Club: Broadcom joins these Bay Area tech companies paying a typical employee top dollar,American City Business Journals
Mar-06-19,Jim Cramer: This Is the Selloff a Lot of People Have Been Waiting For,TheStreet.com
Mar-07-19,Buy Micron Heading into Q2 Earnings with MU Stock Up 20% in 2019?,Zacks
Mar-07-19,The promise of a magical rebound for tech comes with little evidence to back it up,MarketWatch
Mar-07-19,"3 Big Stock Charts for Thursday: Omnicell, Advance Auto Parts and LyondellBasell",InvestorPlace
Mar-07-19,No Growth May Plague Intel in 2019,Investopedia
Mar-08-19,Advanced Micro Devices (AMD) Dips More Than Broader Markets: What You Should Know,Zacks
Mar-08-19,"The smart money prefers Alibaba over Amazon, Intel over AMD, and Google over Apple",MarketWatch
Mar-08-19,The promise of a magical rebound for tech comes with little evidence to back it up,MarketWatch
Mar-11-19,AMD's Graphics Market Share Nears Decade Low,Motley Fool
Mar-11-19,"The smart money prefers Alibaba over Amazon, Intel over AMD, and Google over Apple",MarketWatch
Mar-11-19,Buy NVDA Stock With Nvidia Set to Buy Mellanox to Expand Cloud Business?,Zacks
Mar-11-19,Why Advanced Micro Devices Stock Should Be Bought on Weakness,InvestorPlace
Mar-11-19,Why Advanced Micro Devices Stock Is a Solid Buy Today,InvestorPlace
Mar-11-19,2 Stellar Charts To Watch This Week,TheStreet.com
Mar-12-19,NVIDIA Outbids Intel &amp; Xilinx to Acquire Mellanox for $6.9B,Zacks
Mar-12-19,Why 2019 Probably Will Be a Really Tough Year for Nvidia Stock,InvestorPlace
Mar-12-19,"3 Big Stock Charts for Tuesday: NiSource, PulteGroup and Nielsen Holdings",InvestorPlace
Mar-13-19,Five Tech Stocks to Watch this Week,ACCESSWIRE
Mar-13-19,"3 Big Stock Charts for Wednesday: Brown-Forman, Westrock and Fifth Third",InvestorPlace
Mar-14-19,Why Intel Stock Isnt Too Exciting,InvestorPlace
Mar-14-19,5 Interesting AI Investment Opportunities,ACCESSWIRE
Mar-15-19,3 Semiconductor Stocks to Buy Right Now,Zacks
Mar-15-19,"AI Stocks to Watch, Including One Under-The-Radar Gem",ACCESSWIRE
Mar-15-19,ETF Pick of the Month: Watch out for Major Resistance Facing Semiconductors,ETF Database
Mar-15-19,"Stocks - Wall Street Jumps as U.S.-China Trade Talks, Brexit Vote Lifts Sentiment",Investing.com
Mar-18-19,Advanced Micro Devices (AMD) Stock Sinks As Market Gains: What You Should Know,Zacks
Mar-18-19,"Buy 'Cheap' Micron (MU) Stock Before Earnings, Despite Chip Price Worries?",Zacks
Mar-20-19,Winners and Losers From Alphabet's Gaming Effort,TheStreet.com
Mar-20-19,Stocks End Day Mixed After Fed Leaves Interest Rates Unchanged,TheStreet.com
Mar-20-19,AMDs stock moves into risky territory on Google gaming hype,MarketWatch
Mar-20-19,HP Brings New Solutions at HP Reinvent to Boost Business,Zacks
Mar-20-19,"Theres a Lot to Like About AMD Stock, But Dont Buy Into the Google Hype",SmarterAnalyst
Mar-20-19,"NVIDIA Ray-Tracing Technology Rides on Adoption, Shares Rise",Zacks
Mar-20-19,Alphabet's Stadia Video Streaming Is Here but I Have Issues With the Stock,TheStreet.com
Mar-20-19,Synopsys Rides on Solid Product Suite &amp; Wide Customer Base,Zacks
Mar-20-19,Will AMD's Google Stadia Win Pose a Threat to NVIDIA GPU Moat?,Zacks
Mar-20-19,How Google's Stadia Video Game Streamer Will Be 'Highly Disruptive',Benzinga
Mar-20-19,AMD Extends Gains After Google Picks Radeon GPUs for New Stadia Gaming Platform,TheStreet.com
Mar-20-19,Do Options Traders Know Something About Advanced Micro Devices (AMD) Stock We Don't?,Zacks
Mar-20-19,"FedEx, Federal Reserve, Google, AMD, Sage Therapeutics - 5 Things You Must Know",TheStreet.com
Mar-21-19,"AMD CEO Su's pay rose 19% in 2018, two board members not up for re-election",MarketWatch
Mar-21-19,Google's Stadia Makes a Mark: Should Gaming Players Take Note?,Zacks
Mar-21-19,Apple Updates Portfolio Prior to Streaming Service Launch,Zacks
Mar-21-19,Buy Apple (AAPL) Stock Up 22% in 2019 Before Streaming Video Launch?,Zacks
Mar-21-19,Advanced Micro Devices (AMD) Stock Has More Room to Shine,SmarterAnalyst
Mar-22-19,Googles Gaming Platform Is Not a Reason to Buy AMD Stock,InvestorPlace
Mar-22-19,"The Zacks Analyst Blog Highlights: Apple, Intel, Advanced Micro, Lenovo and HP",Zacks
Mar-22-19,"Dow 30 Stock Roundup: AAPL Refreshes Product Lineup, BA Wins $327M Navy Order",Zacks
Mar-22-19,Chipmakers on Fire: 3 Under-the-Radar Stocks to Win,Zacks
Mar-22-19,Dont Trust the Surprise Rally In Advanced Micro Devices Stock,InvestorPlace
Mar-25-19,Advanced Micro Devices (AMD) Dips More Than Broader Markets: What You Should Know,Zacks
Mar-25-19,Micron (MU) Earnings &amp; Revenue Are Expected to Decline Beyond 2019,Zacks
Mar-25-19,10 Stocks That Could Feast or Fall on China Trade,Kiplinger
Mar-26-19,Can Nvidia Stock Trade to $200 and Beyond?,TheStreet.com
Mar-26-19,"NTT DATA Deploys AMD EPYC Processors, Boosts Performance for its Financial Systems",GlobeNewswire
Mar-27-19,Video Gaming Shifts to the Cloud,GuruFocus.com
Mar-27-19,"Boeing, Apple Lead Stock Market As Dow Jones Passes This Key Test",Investor's Business Daily
Mar-27-19,"Micron Stock Is Tanking, but Could Soon Bottom Out",TheStreet.com
Mar-27-19,"Travelers, Apple Lead Dow Jones Today; Advanced Micro Devices Weighs On Nasdaq",Investor's Business Daily
Mar-27-19,Valuation Becomes an Issue for AMD Stock Above $25,InvestorPlace
Mar-27-19,Valuation Still Is a Big Question Mark for AMD Stock,InvestorPlace
Mar-28-19,"3 Big Stock Charts for Thursday: Pfizer, Coty and Pioneer Natural Resources",InvestorPlace
Mar-28-19,Stocks - U.S. Futures Flat as Focus Turns to Trade Talks,Investing.com
Mar-29-19,Why the Second Half Is So Crucial for Nvidia Stock,InvestorPlace
Mar-29-19,"Buy Micron (MU) Stock on Momentum &amp; Analyst Positivity, Despite Headwinds?",Zacks
Apr-01-19,Pay attention to the stock markets golden cross but not for the reason you may read about,MarketWatch
Apr-01-19,"AMD Stock: Next Stop, $30?",SmarterAnalyst
Apr-01-19,"AI, IoT and Other Tech Plays",ACCESSWIRE
Apr-01-19,Assessing The Angles On Chipmaker Advanced Micro Devices Stock,InvestorPlace
Apr-01-19,Stocks - U.S. Futures Jump as China Manufacturing Sector Rebounds,Investing.com
Apr-02-19,Dow Jones Futures: AMD Nears Buy Point; Altaba To Liquidate Alibaba Stake; Tesla Stock Watch,Investor's Business Daily
Apr-02-19,"Charting a bullish second-quarter start, S&P 500 nails major resistance (2,873)",MarketWatch
Apr-02-19,Elon Musks CEO pay-to-worker ratio is the highest ever recorded  how it compares at other tech companies,American City Business Journals
Apr-02-19,Should Intel's (INTC) GPU Ambitions Bother NVIDIA &amp; AMD?,Zacks
Apr-02-19,Pay attention to the stock markets golden cross but not for the reason you may read about,MarketWatch
Apr-02-19,"HOSTKEY Deploys AMD EPYC Processors for Customers Needing Powerful Performance on Virtualized, HPC and Parallel Workloads",GlobeNewswire
Apr-02-19,"3 Big Stock Charts for Tuesday: American Tower, AT&T and Allstate",InvestorPlace
Apr-03-19,Wall of Worry: Cramer's 'Mad Money' Recap (Wednesday 4/3/19),TheStreet.com
Apr-03-19,Jim Cramer: The Best Time of All to Invest,TheStreet.com
Apr-03-19,Citrix Systems Mostly Fits the Profile of a Private Equity Target - Tech Check,TheStreet.com
Apr-03-19,Can AMD Stock Rally 23% to $33?,TheStreet.com
Apr-03-19,GameStop falls while Dave & Buster's and Blue Apron rise,Associated Press
Apr-03-19,"Why Advanced Micro Devices, Acuity Brands, and DMC Global Jumped Today",Motley Fool
Apr-03-19,"Chip Stocks Jump On China Trade Talks, New Buy Ratings For Intel, AMD",Investor's Business Daily
Apr-03-19,Nasdaq Hits 6-Month High Thanks To These Surging Stocks,Investor's Business Daily
Apr-03-19,Stocks End Up on Reports U.S.-China Trade Deal Close to Being Done,TheStreet.com
Apr-03-19,"US STOCKS-U.S. chip stocks surge on trade deal hopes, Wall Street edges up",Reuters
Apr-03-19,Markets Right Now: US indexes hold on to moderate gains,Associated Press
Apr-03-19,"Analysts: Intel's Datacentric Innovation Day Reinforces Performance Leadership, But No Major Surprises",Benzinga
Apr-03-19,The smart money is buying only five of 11 popular tech stocks  and selling one,MarketWatch
Apr-03-19,"Stocks making the biggest moves midday: AMD, GameStop, Signet Jewelers & more",CNBC
Apr-03-19,AMD and Intel Are Better Picks Than Nvidia Right Now: Analyst,TheStreet.com
Apr-03-19,AMD stock surges after Instinet calls it a buy,MarketWatch
Apr-03-19,US STOCKS-Wall Street rises as trade hopes build; chip index hits record,Reuters
Apr-03-19,Advanced Micro Devices Leads Nasdaq Today; Dow Jones Led By Intel,Investor's Business Daily
Apr-03-19,Why AMD Stock Is Soaring Today,Motley Fool
Apr-03-19,AMD Stock Is Soaring After an Analyst Predicted It Could Steal Market Share From Intel and Nvidia,Barrons.com
Apr-03-19,"US stocks move higher in morning trading, led by tech",Associated Press
Apr-03-19,"US stocks move broadly higher in early trading, led by tech",Associated Press
Apr-03-19,"Stocks Open Higher; Chip Stocks Lead, Dow Jones Lags",Investor's Business Daily
Apr-03-19,"AMD, Micron Trade Higher After Report Says TSMC Seeing Smartphone Order Increase",TheStreet.com
Apr-03-19,"Here are the biggest analyst calls of the day: Caterpillar, AMD, Intel, Dunkin' Brands & more",CNBC
Apr-03-19,Dow Jones Futures Rise On China Trade News: AMD Nears Buy; Altaba To Liquidate Alibaba Stake; Tesla In Focus,Investor's Business Daily
Apr-03-19,AMD shares pop after analyst predicts 'rapidly improving profitability' and 20% rally,CNBC
Apr-03-19,"These Factors Make Advanced Micro Devices, Inc. (NASDAQ:AMD) An Interesting Investment",Simply Wall St.
Apr-04-19,This Analyst Loves Advanced Micro Devices (AMD) Stock. Should You?,SmarterAnalyst
Apr-04-19,Advanced Micro Devices Shares Are Alerting Buy Activity,Investopedia
Apr-04-19,A Pair of Semiconductor Stock Buys: AMD and Micron,InvestorPlace
Apr-04-19,The smart money is buying only five of 11 popular tech stocks  and selling one,MarketWatch
Apr-04-19,"Stock Market News For Apr 4, 2019",Zacks
Apr-04-19,Micron Stock Is Heating up for the Long-Term Growth,InvestorPlace
Apr-04-19,"The Zacks Analyst Blog Highlights: Pfizer, Royal Dutch, Celgene, Advanced Micro and Blackstone",Zacks
Apr-04-19,"Thursdays Vital Data: American Airlines, Advanced Micro Devices and Twitter",InvestorPlace
Apr-04-19,Advanced Micro Devices (AMD) Jumps: Stock Rises 8.5%,Zacks
Apr-04-19,"3 Big Stock Charts for Thursday: Citrix Systems, Invesco and HollyFrontier",InvestorPlace
Apr-04-19,Beware Red-Hot AMD Stock as Index Leader Closes In on $30,InvestorPlace
Apr-05-19,These stocks are soaring this week and traders say they've even more room to run,CNBC Videos
Apr-05-19,Intel Declines After Wells Fargo Downgrades Chipmaker,TheStreet.com
Apr-08-19,Advanced Micro Devices (AMD) Stock Sinks As Market Gains: What You Should Know,Zacks
Apr-08-19,All eyes are on company earnings as the stock market has overshot to the upside,MarketWatch
Apr-08-19,How a rally in semiconductor stocks may herald a global growth rebound,MarketWatch
Apr-08-19,Gaming on Snapchat Is Positive for Snap Stock,InvestorPlace
Apr-08-19,These Five Stocks Are Trending,Insider Monkey
Apr-08-19,Why the Rally in AMD Stock Isnt Over Yet,SmarterAnalyst
Apr-08-19,"AMDs Profitability Will Surge Next Year Thanks to Its New Chips, Analyst Says",Barrons.com
Apr-08-19,2nd Gen AMD Ryzen PRO and AMD Athlon PRO Mobile Processors to Power New Premium to Entry Commercial Notebooks,GlobeNewswire
Apr-08-19,Dow Jones Futures: Stock Market On Cusp Of Long Bullish Phase,Investor's Business Daily
Apr-08-19,BUZZ-U.S. stocks weekly: Just shy of highs,Reuters
Apr-08-19,Advanced Micro Devices Enters Overbought Territory: Is A Drop Coming?,Zacks
Apr-09-19,"Dow Jones Futures: This Hot Stock Broke Out Bullishly As Flawed Apple, AMD Falter",Investor's Business Daily
Apr-09-19,All eyes are on company earnings as the stock market has overshot to the upside,MarketWatch
Apr-10-19,Advanced Micro Devices Continues to Surge,GuruFocus.com
Apr-10-19,"Intel CPU shortages helped AMD, hurt PC shipments in first quarter, analyses contend",MarketWatch
Apr-10-19,AMD Climbs on Bullish Cowen Note Praising Competitive Positioning,TheStreet.com
Apr-10-19,Dow Takes a Boeing Hit as Markets Send Mixed Messages,Barrons.com
Apr-10-19,"Stocks making the biggest moves midday: Under Armour, Tesla, Lyft, First Solar & more",CNBC
Apr-10-19,"Wednesdays Vital Data: United States Steel, Disney and Advanced Micro Devices",InvestorPlace
Apr-10-19,"AMD Enhances Ryzen Series Mobile Processors, Boosts Efficiency",Zacks
Apr-10-19,US STOCKS-Futures tick higher as focus turns to central banks,Reuters
Apr-10-19,"Dow Jones Futures: This Hot Stock Broke Out Bullishly As Flawed Apple, AMD Falter",Investor's Business Daily
Apr-10-19,"FireEye joins major Bay Area employers like Facebook, Netflix, Google, Microsoft and Salesforce in paying a typical worker more than $150,000 per year",American City Business Journals
Apr-11-19,3 Semiconductor Stocks to Buy Right Now,Zacks
Apr-11-19,AMD Stock Gets a Price Target Boost Ahead of Earnings,SmarterAnalyst
Apr-11-19,Analysts believe the stock market will set a record soon and these names are going to lead the way,CNBC
Apr-11-19,Advanced Micro Devices Continues to Surge,GuruFocus.com
Apr-11-19,"PC Shipments Soften in Q1: LNVGY, HPQ, DELL &amp; AAPL in View",Zacks
Apr-12-19,Stock market investors are split into bull and bear camps  taking the middle road is the way to go,MarketWatch
Apr-12-19,Better Buy: Advanced Micro Devices vs. Cypress Semiconductor,Motley Fool
Apr-15-19,Advanced Micro Devices (AMD) Dips More Than Broader Markets: What You Should Know,Zacks
Apr-15-19,Billionaire George Soros Bought and Sold These Big Tech Names,Insider Monkey
Apr-15-19,Bernstein analyst on chip rally risks,CNBC Videos
Apr-15-19,Stock market investors are split into bull and bear camps  taking the middle road is the way to go,MarketWatch
Apr-15-19,Ambarella Partners OFilm to Develop Automated Parking System,Zacks
Apr-16-19,Sony's Next PlayStation Will Be Powered by AMD,Motley Fool
Apr-16-19,AMD to Report Fiscal First Quarter 2019 Financial Results,GlobeNewswire
Apr-16-19,Netflix Dominates Stock Market News Ahead Of Quarterly Results,Investor's Business Daily
Apr-16-19,Sony PlayStation 5 Rumors: What Weve Heard ,InvestorPlace
Apr-16-19,Why Amgen Stock Could Break Out to New Highs,InvestorPlace
Apr-16-19,AMD's Latest Ryzen Embedded SoC Witnesses Rapid Adoption,Zacks
Apr-16-19,AMD Climbs Midday on PlayStation 5 Inclusion,Investing.com
Apr-16-19,Why AMD Stock Can Jump Higher on Q1 Earnings,Motley Fool
Apr-16-19,"AMD Expands Embedded Product Family, Adds Design Wins and Customers, with New Ryzen Embedded R1000",GlobeNewswire
Apr-17-19,Dow Jones Futures: Why This Sector Leads The Stock Market Rally Despite Glaring Flaw,Investor's Business Daily
Apr-17-19,Intel Breaks Out to Fresh Highs After Qualcomm Deal,Investopedia
Apr-18-19,5 Semiconductor Stocks to Buy for a Spring Charge,InvestorPlace
Apr-18-19,Dow Jones Futures Signal Stock Market Losses; This Sector Leads Despite Plunging Earnings,Investor's Business Daily
Apr-22-19,Why Overbought Chip Stocks May Be Poised For Steep Declines,Investopedia
Apr-22-19,Advanced Micro Devices (AMD) Stock Is Back in a Big Way,SmarterAnalyst
Apr-22-19,Tech giants made so much money in 2018 that 2019 is bound to look pretty bad,MarketWatch
Apr-22-19,Will New Offerings &amp; Alliances Aid Intel's (INTC) Q1 Earnings?,Zacks
Apr-23-19,Advanced Micro Devices (AMD) Stock Sinks As Market Gains: What You Should Know,Zacks
Apr-23-19,Intel earnings: New CEO is not getting a honeymoon period,MarketWatch
Apr-23-19,It Will Take a Huge Earnings Report to Move Intel Stock Higher,InvestorPlace
Apr-23-19,Analysts Estimate Advanced Micro Devices (AMD) to Report a Decline in Earnings: What to Look Out for,Zacks
Apr-23-19,Should Long-Term Investors Buy into Intels Earnings Results?,InvestorPlace
Apr-24-19,This chart says to stay bullish on the U.S. stock market,MarketWatch
Apr-24-19,Intel earnings: New CEO is not getting a honeymoon period,MarketWatch
Apr-24-19,"Chip stocks set for sixth straight record high on strong earnings, 5G outlook",MarketWatch
Apr-24-19,"Profitability has improved for semiconductors, says expert",CNBC Videos
Apr-24-19,"Its time to buy tech stocks again, and these 17 are your best bet",MarketWatch
Apr-24-19,These stocks are the biggest winners in the market's incredible rebound back to a record,CNBC
Apr-25-19,Intel cuts forecast as China data centre sales remain weak,Reuters
Apr-25-19,NVIDIAs New Budget Graphics Card Misses the Mark,Motley Fool
Apr-25-19,AMD Q1 Earnings to Gain From GPU Product Rollouts &amp; Deal Wins,Zacks
Apr-25-19,Investors Are Betting on a Big Second Half for AMD Stock,InvestorPlace
Apr-25-19,"Ex-NFLer Nick Lowery goes for repeat win in CNBC's Stock Draft after riding Amazon, AMD last year",CNBC
Apr-25-19,"Better Pricing, New Product Release Could Boost Micron Stock",InvestorPlace
Apr-25-19,"Chip stocks are at an all-time high, but Nvidia, Micron and AMD are lagging",CNBC
Apr-26-19,Earnings Game Plan: Cramer's 'Mad Money' Recap (Friday 4/26/19),TheStreet.com
Apr-26-19,"AMD earnings: In a weakening chip sector, AMD brings rare optimism",MarketWatch
Apr-26-19,Cramer's game plan: What to expect in the week of earnings and Friday's jobs report,CNBC
Apr-26-19,Intel Stock Takes Historically Deep Dive After Offering Gloomy Guidance,TheStreet.com
Apr-26-19,Intels stock logs worst day in more than 3 years as data-center weakness debated,MarketWatch
Apr-26-19,Intel Stock Belongs In the Penalty Box  For Now,InvestorPlace
Apr-26-19,Factors Likely to Decide AMD's Fate This Earnings Season,Zacks
Apr-26-19,Intel? Here's How I'd Trade It Now,TheStreet.com
Apr-26-19,"Intel Guidance Disappoints, But Earnings Season Overall Has Surprised To Upside",Benzinga
Apr-26-19,"Calculating The Fair Value Of Advanced Micro Devices, Inc. (NASDAQ:AMD)",Simply Wall St.
Apr-29-19,AMD's Outlook Needs to Be Better Than Its Results,Motley Fool
Apr-29-19,How Does Bitcoin Mining Work?,Investopedia
Apr-29-19,"AMD Stock Is Vulnerable Because the Good News Is Priced In, Analyst Says",Barrons.com
Apr-29-19,Why the Navi Launch Is So Important for Advanced Micro Devices Stock,InvestorPlace
Apr-29-19,"AMD Commemorates 50th Anniversary with Launch of Gold Edition AMD Ryzen Processor and AMD Radeon VII Graphics Card, AMD50 Game Bundle and More",GlobeNewswire
Apr-29-19,"AMD earnings: In a weakening chip sector, AMD brings rare optimism",MarketWatch
Apr-30-19,"Dow Jones Futures: Apple, AMD Lead 5 Stocks Near Buy Points Moving On Earnings",Investor's Business Daily
Apr-30-19,AMD Earnings Saw Decline: Why is the Stock Up?,Zacks
Apr-30-19,AMD stock rallies after hours as earnings top Wall Street estimates,MarketWatch
Apr-30-19,"AMD results beat estimates on data center, server growth; shares climb",Reuters
Apr-30-19,"Apple (AAPL) Beats &amp; Raises; AMD, Mondelez Also Outperform",Zacks
Apr-30-19,"AMD Earnings Beat Views, Sending Chipmaker's Stock Soaring",Investor's Business Daily
Apr-30-19,"AMD Shares Rise After Chipmaker Beats on Earnings, Issues Strong Guidance",TheStreet.com
Apr-30-19,"AMD revenue beats estimates on data center, server growth",Reuters
Apr-30-19,AMD Stock Is Rising On a Slight Earnings Beat,Barrons.com
Apr-30-19,Advanced Micro: 1Q Earnings Snapshot,Associated Press
Apr-30-19,AMD's quarterly revenue beats estimates on data center growth,Reuters
Apr-30-19,AMD Reports First Quarter 2019 Financial Results,GlobeNewswire
Apr-30-19,"AMD Stock Is Vulnerable Because the Good News Is Priced In, Analyst Says",Barrons.com
Apr-30-19,Day Ahead: Top 3 Things to Watch,Investing.com
Apr-30-19,Sell AMD With the Stock Between Key Levels,TheStreet.com
Apr-30-19,Advanced Micro Devices at Crossroads Ahead of Earnings,Investopedia
Apr-30-19,Why Theres Still Some Hope Left for Western Digital Stock,InvestorPlace
Apr-30-19,"You're Entering the ""Show-Me State"" As Chip Firms Get Ready To Report",Benzinga
Apr-30-19,"Google, Apple, AMD, General Electric and General Motors - 5 Things You Must Know",TheStreet.com
May-01-19,What Goes Up: Cramer's 'Mad Money' Recap (Wednesday 5/1/19),TheStreet.com
May-01-19,"AMD CEO: With new products launching, 2019 is a 'growth year'",CNBC Videos
May-01-19,"AMD CEO: With new products launching, 2019 is a 'growth year'",CNBC
May-01-19,Making Sense of Tech Sector Earnings,Zacks
May-01-19,Stocks Close Down as Fed Holds Rates Steady,TheStreet.com
May-01-19,How Are Semiconductor Companies Doing This Quarter?,Zacks
May-01-19,Will AMD Stock Break Out or Break Down on Earnings?,TheStreet.com
May-01-19,AMD optimism reigns despite ho-hum earnings,MarketWatch
May-01-19,"AMD Beats Q1 Profit Forecast, Sees New Chips, Stronger Demand Driving 2019 Sales",TheStreet.com
May-01-19,"Analysts Impressed With AMD's Execution, Pipeline Following Solid Q1 Results",Benzinga
May-01-19,"Stocks making the biggest moves midday: Apple, CVS Health, Clorox & more",CNBC
May-01-19,AMD Stock Management Is Executing Well  Own It,InvestorPlace
May-01-19,"SunPower, 3M, Apple, Mondelez and Advanced Micro as Zacks Bull and Bear of the Day",Zacks
May-01-19,3 Reasons to Buy Nvidia Stock,InvestorPlace
May-01-19,AMD Stock Is Rising After Earnings Because the Dream Is Still Alive,Barrons.com
May-01-19,Stocks Whittle Gains; Apple Backstops Dow Jones Ahead Of Fed,Investor's Business Daily
May-01-19,"Fed Day Underway, But Focus Might Be On Apple As Results Get Positive Read",Benzinga
May-01-19,"Opening Bell, May 1, 2019",CNBC Videos
May-01-19,"Heres how Apple can reach $350 a share, according to this tech investor",MarketWatch
May-01-19,US STOCKS-Wall St set for strong open as investors cheer Apple results,Reuters
