date,title,source
Oct-17-18,LCOR plans more multifamily in Crystal City,American City Business Journals
Oct-19-18,"Report: Developing Opportunities within Spotify Technology SA, Vornado Realty Trust, Merus N.V, Teekay Tankers, PagSeguro Digital, and Liberty Oilfield Services  Future Expectations, Projections Moving into 2018",GlobeNewswire
Oct-22-18,"Arlington approves major changes, additions for Crystal City, including Alamo Drafthouse",American City Business Journals
Oct-23-18,Vornado Realty (VNO) to Post Q3 Earnings: What Lies Ahead?,Zacks
Oct-25-18,Vornado Declares Quarterly $.63 Dividend on Common Shares,GlobeNewswire
Oct-25-18,Vornado Declares Quarterly Dividends On Preferred Shares,GlobeNewswire
Oct-26-18,"REITs to Watch for Q3 Earnings on Oct 29: AVB, ESS & More",Zacks
