date,title,source
Oct-23-18,Waste Management (WM) To Report Q3 Earnings: What's in Store?,Zacks
Oct-24-18,Why Waste Management (WM) Might Surprise This Earnings Season,Zacks
Oct-25-18,"Waste Management (WM) Beats on Q3 Earnings, Raises EPS View",Zacks
Oct-25-18,Waste Management (WM) Q3 Earnings Surpass Estimates,Zacks
Oct-25-18,Waste Management: 3Q Earnings Snapshot,Associated Press
Oct-25-18,Waste Management Announces Third Quarter Earnings,Business Wire
Oct-26-18,Waste Management CEO on earnings and the economy,CNBC Videos
Oct-29-18,Edited Transcript of WM earnings conference call or presentation 25-Oct-18 2:00pm GMT,Thomson Reuters StreetEvents
Oct-29-18,Top 5 ROE Picks as Markets Remain Volatile Despite Solid Q3,Zacks
Nov-01-18,"Report: Developing Opportunities within Waste Management, Cubic, Unum Therapeutics, Highwoods Properties, Trinity Industries, and Cerner  Future Expectations, Projections Moving into 2018",GlobeNewswire
Nov-06-18,"Portfolio 21 Investments Buys Linde PLC, Sells Waste Management Inc, US Bancorp, International ...",GuruFocus.com
Nov-06-18,5 Bullish Stocks For Tuesday's Trading,Benzinga
Nov-08-18,"Waste Management (WM) Solid Waste Business Strong, Debt High",Zacks
Nov-08-18,3 Stocks to Hold for the Next 20 Years,Motley Fool
Nov-12-18,Waste Management Announces Cash Dividend,Business Wire
Nov-12-18,Major Houston public company to relocate downtown HQ to Capitol Tower,American City Business Journals
Nov-13-18,"Here's why Capitol Tower appealed to Waste Management, Bank of America",American City Business Journals
Nov-14-18,An Examination Of Waste Management Inc (NYSE:WM),Simply Wall St.
Nov-16-18,Has Waste Management (WM) Outpaced Other Business Services Stocks This Year?,Zacks
Nov-20-18,"First Data Rides on Acquisitions, Integration Risks Stay",Zacks
Nov-29-18,4 'Tariff-Proof' Stock Picks From A Pro,Benzinga
Nov-29-18,Top 5 ROE Stocks to Buy on Renewed Fed Optimism,Zacks
Nov-30-18,3 Stocks Built to Thrive in a Bear Market,Motley Fool
Nov-30-18,DocuSign (DOCU) Q3 Earnings to See Impacts of SpringCM Buyout,Zacks
Nov-30-18,Will Heavy Investments Dent H&R Block (HRB) in Q2 Earnings?,Zacks
Dec-03-18,Korn/Ferry's (KFY) Earnings to Reflect Tax Benefits in Q2,Zacks
Dec-03-18,Express Shareholders Expressly Exit the Stock,Motley Fool
Dec-04-18,WM or RSG: Which Waste Management Stock Is Better Placed?,Zacks
Dec-04-18,"Goldman Sachs Double Upgrades Waste Management, Says Stock Is 'Least Expensive' Route To Sector Exposure",Benzinga
Dec-04-18,Waste Management Stock Finds a Fan in Goldman Sachs,Barrons.com
Dec-04-18,Waste Management Rises After Goldman Says It Likes Garbage,TheStreet.com
Dec-04-18,Goldman Sachs just got very bullish on garbage because it's afraid the economy is rolling over,CNBC
Dec-04-18,Stocks - U.S. Futures Fall as Trade Truce Doubts Weigh,Investing.com
Dec-06-18,Waste Management- A &quot;Steady Eddie&quot;,MoneyShow
Dec-10-18,"Hedge Funds Are Dumping Waste Management, Inc. (WM)",Insider Monkey
Dec-13-18,Waste Management Announces Plan to Increase the Quarterly Dividend Rate and for the Authorization of up to $1.5 Billion in Share Repurchases,Business Wire
Dec-14-18,1 Rock-Solid Dividend Stock to Buy During the Market Downturn,Motley Fool
Dec-14-18,"Need To Know: Waste Management, Inc. (NYSE:WM) Insiders Have Been Selling Shares",Simply Wall St.
Dec-14-18,Top 5 ROE Stocks to Invest in as Trade Talks Resume,Zacks
Dec-17-18,"The Zacks Analyst Blog Highlights: Progressive, Waste, Celanese, CBRE and General Motors",Zacks
Dec-18-18,"Jim Cramer Advises His Viewers On Apache, Waste Management And More",Benzinga
Dec-19-18,Waste Management Publishes 2018 Sustainability Report,Business Wire
Dec-20-18,3 Stocks to Hold for the Next 20 Years,Motley Fool
Jan-08-19,6 Reasons Why You Should Invest in Waste Management (WM) Now,Zacks
Jan-08-19,Here's Why You Should Retain Gartner Stock in Your Portfolio,Zacks
Jan-09-19,Is Waste Management (WM) Stock Outpacing Its Business Services Peers This Year?,Zacks
Jan-14-19,Waste Management Sets Date for Fourth Quarter and Full-Year Earnings Release Conference Call,Business Wire
Jan-17-19,S&P 500 Is Preparing to Tackle Its Next Major Resistance,TheStreet.com
Jan-22-19,Waste Management Named to Fortune Magazines List of Worlds Most Admired Companies,Business Wire
Jan-24-19,Waste Management Hailed as Climate Change Leader for Third Straight Year,Business Wire
Jan-24-19,The Great Plastic Cleanup  and How to Profit From It,Barrons.com
Jan-25-19,5 High-Performing Stocks,GuruFocus.com
Jan-31-19,"More U.S. companies discussing climate change in wake of hurricanes, wildfires",Reuters
Jan-31-19,How Waste Management leverages Phoenix Open sponsorship into more business opportunities,American City Business Journals
Feb-05-19,"Estimating The Fair Value Of Waste Management, Inc. (NYSE:WM)",Simply Wall St.
Feb-07-19,Broadridge (BR) Misses Earnings and Revenue Estimates in Q2,Zacks
Feb-07-19,"S&amp;P Global (SPGI) Q4 Earnings Beat Estimates, Revenue Miss",Zacks
Feb-07-19,Waste Management (WM) Earnings Expected to Grow: What to Know Ahead of Next Week's Release,Zacks
Feb-07-19,First Data (FDC) Beats Q4 Earnings and Revenue Estimates,Zacks
Feb-08-19,Genpact (G) Surpasses Earnings and Revenue Estimates in Q4,Zacks
Feb-08-19,"Fiserv (FISV) Q4 Earnings In Line, Revenues Beat Estimates",Zacks
Feb-08-19,How technology is changing the waste management industry,CNBC Videos
Feb-08-19,"Republic Services (RSG) Beats on Q4 Earnings, Lags Revenues",Zacks
Feb-12-19,"Omnicom (OMC) Q4 Earnings, Revenues Exceed Estimates",Zacks
Feb-12-19,Waste Management (WM) to Post Q4 Earnings: What's in Store?,Zacks
Feb-13-19,Interpublic (IPG) Tops Q4 Earnings &amp; Revenue Estimates,Zacks
Feb-13-19,Insperity (NSP) Q4 Earnings &amp; Revenues Surpass Estimate,Zacks
Feb-14-19,"Waste Management (WM) Beats Q4 Earnings, Revenue Estimates",Zacks
Feb-14-19,Bill Gates Bought Up More Waste Management Stock,Barrons.com
Feb-14-19,Waste Management (WM) Surpasses Q4 Earnings and Revenue Estimates,Zacks
Feb-14-19,Waste Management: 4Q Earnings Snapshot,Associated Press
Feb-14-19,Waste Management Announces Fourth Quarter and Full-Year 2018 Earnings,Business Wire
Feb-19-19,Waste Management Announces Cash Dividend,Business Wire
Feb-20-19,ICF International (ICFI) to Report Q4 Earnings: What's Up?,Zacks
Feb-25-19,Waste Management (WM) Stock Sinks As Market Gains: What You Should Know,Zacks
Feb-25-19,"Waste Management (WM) Implements Cost Discipline, Debt High",Zacks
Feb-27-19,Waste Management to Host Investor Day in New York City,Business Wire
Feb-27-19,"Analysis: Positioning to Benefit within Kohl's, Regeneron Pharmaceuticals, Moody's, Ashland Global, Waste Management, and Newmark Group  Research Highlights Growth, Revenue, and Consolidated Results",GlobeNewswire
Mar-01-19,"What Do Investors Need To Know About The Future Of Waste Management, Inc.s (NYSE:WM)?",Simply Wall St.
Mar-04-19,3 Dividend Stocks That Should Pay You for the Rest of Your Life,Motley Fool
Mar-05-19,H&amp;R Block (HRB) to Report Q3 Earnings: What's in Store?,Zacks
Mar-06-19,G.researchs 5th Annual Waste & Environmental Services Symposium,Business Wire
Mar-11-19,Petro Waste bought by Houston company,American City Business Journals
Mar-11-19,Tailwater Capital Announces Sale of Petro Waste Environmental To Waste Management Energy Services,PR Newswire
Mar-11-19,Waste Management Energy Services Acquires Petro Waste Environmental from Tailwater Capital to Expand Service to the Oil and Gas Industry,Business Wire
Mar-12-19,Why Petro Waste ex-CEO is bullish on company's future after being sold to Waste Management,American City Business Journals
Mar-12-19,Waste Management's Subsidiary Buys Petro Waste Environmental,Zacks
Mar-13-19,Waste Management (WM) Gains But Lags Market: What You Should Know,Zacks
