date,title,source
Nov-09-18,Study on Molecular Templates PD-L1 ETB with Antigen Seeding Technology Presented at SITC Annual Meeting,GlobeNewswire
Nov-13-18,"Molecular Templates, Inc. Reports Third Quarter 2018 Financial Results and Provides Corporate Update",GlobeNewswire
Nov-26-18,Molecular Templates to Present at the Evercore ISI and BMO Healthcare Conferences,GlobeNewswire
Jan-18-19,"Do Institutions Own Molecular Templates, Inc. (NASDAQ:MTEM) Shares?",Simply Wall St.
Feb-12-19,"New Research Coverage Highlights Overstock, Regeneron Pharmaceuticals, Molecular Templates, The Ensign Group, Limoneira, and Primo Water  Consolidated Revenues, Company Growth, and Expectations for 2019",GlobeNewswire
Feb-19-19,"Molecular Templates Appoints Roger J. Waltzman, M.D., as Chief Medical Officer",GlobeNewswire
Feb-27-19,New Data on Molecular Templates Engineered Toxin Bodies to be Presented at the American Association of Cancer Research (AACR) Annual Meeting 2019,GlobeNewswire
