date,title,source
Nov-09-18,Study on Molecular Templates PD-L1 ETB with Antigen Seeding Technology Presented at SITC Annual Meeting,GlobeNewswire
Nov-13-18,"Molecular Templates, Inc. Reports Third Quarter 2018 Financial Results and Provides Corporate Update",GlobeNewswire
Nov-26-18,Molecular Templates to Present at the Evercore ISI and BMO Healthcare Conferences,GlobeNewswire
Jan-18-19,"Do Institutions Own Molecular Templates, Inc. (NASDAQ:MTEM) Shares?",Simply Wall St.
Feb-12-19,"New Research Coverage Highlights Overstock, Regeneron Pharmaceuticals, Molecular Templates, The Ensign Group, Limoneira, and Primo Water  Consolidated Revenues, Company Growth, and Expectations for 2019",GlobeNewswire
Feb-19-19,"Molecular Templates Appoints Roger J. Waltzman, M.D., as Chief Medical Officer",GlobeNewswire
Feb-27-19,New Data on Molecular Templates Engineered Toxin Bodies to be Presented at the American Association of Cancer Research (AACR) Annual Meeting 2019,GlobeNewswire
Mar-05-19,Molecular Templates to Present a Corporate Overview at the Cowen & Company 39th Annual and the Oppenheimer & Co. 29th Annual Health Care Conferences,GlobeNewswire
Mar-28-19,"Molecular Templates, Inc. Reports Fourth Quarter 2018 Financial Results",GlobeNewswire
Mar-28-19,Molecular Templates Announces Initiation of Phase II Monotherapy Study of MT-3724 in Relapsed/Refractory Diffuse Large B-Cell Lymphoma Patients,GlobeNewswire
Apr-02-19,Molecular Templates Presentations at the American Association of Cancer Research (AACR) Annual Meeting 2019 Highlight Evolution of ETB Platform,GlobeNewswire
Apr-03-19,Small Drugmakers Outperforming the Bigshots: 7 Stocks to Buy,Zacks
Apr-03-19,Will Molecular Templates Continue to Surge Higher?,Zacks
Apr-04-19,"The Zacks Analyst Blog Highlights: Alpine, Actinium, Molecular Templates, Tricida and Otonomy",Zacks
Apr-22-19,"Molecular Templates Announces FDA Acceptance of IND Application for MT-5111, An Engineered Toxin Body Targeting HER2",GlobeNewswire
Apr-25-19,The Judge Group Named a Winner of the Delaware Valley 2019 Top Workplaces Award by Philadelphia Media Network,GlobeNewswire
May-06-19,Will Molecular Templates (MTEM) Report Negative Q1 Earnings? What You Should Know,Zacks
May-13-19,"Molecular Templates, Inc. Reports First Quarter 2019 Financial Results",GlobeNewswire
May-14-19,Molecular Templates to Present at the Oppenheimer New York Oncology Insight Summit and the UBS Global Healthcare Conference,GlobeNewswire
May-29-19,Will Molecular Templates to Surge Higher?,Zacks
