date,title,source
Oct-17-18,IBD 50 Growth Stocks To Watch,Investor's Business Daily
Oct-18-18,Morgan Stanley Downgrades Wingstop For Valuation Reasons,Benzinga
Oct-18-18,"Tech Stocks Sell Off, These 2 Top Stocks Fall On Analyst Actions",Investor's Business Daily
Oct-22-18,Perfectly Cooked: Wedbush Turns Neutral On Wingstop After 40% Stock Run,Benzinga
Oct-22-18,Wingstop (WING) Q3 Earnings Preview: What to Watch Ahead of the Release,Zacks
Oct-22-18,Stocks Turn Red After Early Gains; These 2 Top Stocks Falter,Investor's Business Daily
Oct-23-18,IBD 50 Growth Stocks To Watch,Investor's Business Daily
Oct-24-18,Wingstop's Strong Growth Outlook Doesn't Halt Downgrades,Bloomberg
Oct-25-18,Wingstop Announces Intention to Refinance its Existing Credit Agreement Through a Securitization,GlobeNewswire
Oct-26-18,Joe & the Juice's Private Equity Owners Considering IPO in 2019,Bloomberg
Oct-26-18,What Is Wingstop Incs (NASDAQ:WING) Share Price Doing?,Simply Wall St.
Oct-26-18,"Restaurant Stock Q3 Earnings Due on Oct 29: TXRH, WING & More",Zacks
Oct-29-18,Wingstop Inc (WING) Q3 2018 Earnings Conference Call Transcript,Motley Fool
Oct-29-18,Wingstop: 3Q Earnings Snapshot,Associated Press
Oct-29-18,Wingstop Earnings Fly Past Views; Texas Roadhouse Falls Short,Investor's Business Daily
Oct-29-18,Wingstop Inc. Reports Fiscal Third Quarter 2018 Financial Results,GlobeNewswire
Oct-29-18,Dow Gains 300 Points With This Blue-Chip Stock In Buy Range,Investor's Business Daily
Oct-29-18,Wingstop's Q3 Earnings Outlook,Benzinga
Oct-31-18,Edited Transcript of WING earnings conference call or presentation 29-Oct-18 8:30pm GMT,Thomson Reuters StreetEvents
Oct-31-18,Where Wingstop's CEO sees the company going next,CNBC Videos
Oct-31-18,"Cramer Remix: Facebook's not back yet, but it's on its way",CNBC
Oct-31-18,A quarter of Wingstop's revenue comes from digitalhere's...,CNBC Videos
Oct-31-18,A quarter of Wingstop's revenue comes from digitalhere's where the CEO sees it going next,CNBC
Nov-01-18,Wingstop Could See Its Stock Get Clipped,TheStreet.com
Nov-06-18,Triad shopping center adds more national tenants,American City Business Journals
Nov-12-18,Stock Market Dives; How IBD's Rules Dodged Apple's Pain,Investor's Business Daily
Nov-14-18,"Wingstop to pay second special dividend this year, borrow $320 million",MarketWatch
Nov-14-18,Wingstop Inc. Declares Special Dividend -- $3.05 Per Share and Completes $320 Million Securitized Financing Facility,GlobeNewswire
Nov-23-18,"Detailed Research: Economic Perspectives on Wingstop, Marlin Business Services, Aware, Zynerba Pharmaceuticals, Auris Medical Holding AG, and Gulf Island Fabrication  What Drives Growth in Today's Competitive Landscape",GlobeNewswire
Nov-26-18,Wingstop Begins National Delivery Rollout in Partnership with DoorDash,GlobeNewswire
Nov-26-18,Why Wingstop Incs (NASDAQ:WING) High P/E Ratio Isnt Necessarily A Bad Thing,Simply Wall St.
Nov-27-18,Wingstop (WING) & DoorDash Tie Up for On-Demand Delivery,Zacks
Dec-19-18,Here is What Hedge Funds Think About Wingstop Inc (WING),Insider Monkey
