date,title,source
Oct-23-18,AGS to Report Third Quarter 2018 Results on November 8,PR Newswire
Oct-31-18,"Nantahala Capital Managements Returns, AUM, and Holdings",Insider Monkey
Nov-02-18,Should Allgemeine Gold- und Silberscheideanstalt AG (MUN:AGS) Be Part Of Your Dividend Portfolio?,Simply Wall St.
Nov-08-18,PlayAGS: 3Q Earnings Snapshot,Associated Press
Nov-08-18,AGS Announces Third Quarter 2018 Results,PR Newswire
Nov-09-18,AGS Announces Appointment Of Geoff Freeman To Board Of Directors,PR Newswire
Nov-09-18,Edited Transcript of AGS.N earnings conference call or presentation 8-Nov-18 10:00pm GMT,Thomson Reuters StreetEvents
Nov-16-18,"Market Trends Toward New Normal in PlayAGS, BEST, Inc. Sponsored ADR, Verrica Pharmaceuticals, Telenav, bluebird bio, and CompX International  Emerging Consolidated Expectations, Analyst Ratings",GlobeNewswire
Nov-27-18,Relax Gaming and AGS Announce Significant Partnership,PR Newswire
Dec-13-18,AGS Partners with The Rank Group to Provide Third-Party Game Aggregation Through AGS iGaming Platform,PR Newswire
