date,title,source
Oct-18-18,"Analysis: Positioning to Benefit within Clovis Oncology, Destination Maternity, MSG Networks, Lindblad Expeditions, NetScout, and ANI Pharmaceuticals  Research Highlights Growth, Revenue, and Consolidated Results",GlobeNewswire
Oct-23-18,NETSCOUT Takes Internet Scale Threat Protection to the Edge,Business Wire
Oct-24-18,NETSCOUTs Arbor Cloud Wins Fierce Innovation Award,Business Wire
Oct-24-18,NETSCOUTs Arbor Cloud Expands DDoS Protection Across Asia,Business Wire
Oct-30-18,Frost & Sullivan Awards NETSCOUT for Visionary Innovation,Business Wire
Nov-01-18,Edited Transcript of NTCT earnings conference call or presentation 1-Nov-18 12:30pm GMT,Thomson Reuters StreetEvents
Nov-01-18,Netscout Systems Inc (NTCT) Q2 2019 Earnings Conference Call Transcript,Motley Fool
Nov-01-18,NetScout: Fiscal 2Q Earnings Snapshot,Associated Press
Nov-01-18,NETSCOUT Reports Financial Results for Second Quarter Fiscal Year 2019,Business Wire
