date,title,source
Oct-19-18,KT Corp. Wins Second Smart Meter Project in Uzbekistan,PR Newswire
Oct-31-18,KT Corp. to Open Virtual Reality (VR) Center in Malaysia,PR Newswire
Oct-31-18,KT Corp. to Open Virtual Reality (VR) Center in Malaysia,PR Newswire
Nov-02-18,KT Corporation -- Moody's assigns A3 to KT Corp's proposed JPY bonds,Moody's
Nov-06-18,KT vs. BB: Which Stock Should Value Investors Buy Now?,Zacks
Nov-06-18,KT Corp. Unveils ICT-Assisted 'Intelligent Boracay',PR Newswire
Nov-06-18,KT Corp. Unveils ICT-Assisted 'Intelligent Boracay',PR Newswire
Nov-14-18,KT Chairman Advocates New Technology for Better World,PR Newswire
Nov-16-18,KT Corp. Tests Driverless Bus at Incheon Int'l Airport,PR Newswire
Nov-16-18,KT Corp. Tests Driverless Bus at Incheon Int'l Airport,PR Newswire
Dec-11-18,"Highlighted as Zacks Bull and Bear of the Day Columbia Sportswear, Seagate Technology, Fujifilm, Mosaic Company and KT",Zacks
Dec-12-18,Vodafone Expects Green Signal from EU on Liberty Global Deal,Zacks
Dec-13-18,KT Corp. Launches 5G Service with AI Robot in S. Korea,PR Newswire
Dec-14-18,KT vs. CHL: Which Stock Should Value Investors Buy Now?,Zacks
Dec-21-18,BlackBerry (BB) Q3 Earnings Top Estimates on Lower Expenses,Zacks
Dec-31-18,KT vs. CHL: Which Stock Should Value Investors Buy Now?,Zacks
Jan-31-19,KT Corp. Reveals New 5G Services in South Korea,PR Newswire
Jan-31-19,KT Corp. Reveals New 5G Services in South Korea,PR Newswire
Feb-12-19,Edited Transcript of 030200.KS earnings conference call or presentation 12-Feb-19 6:00am GMT,Thomson Reuters StreetEvents
Feb-15-19,KT vs. CRNT: Which Stock Is the Better Value Option?,Zacks
Feb-20-19,Bet on Emerging Markets With These 6 Great Stocks,Zacks
Feb-21-19,"The Zacks Analyst Blog Highlights: China Southern Airlines, Banco Santander, JinkoSolar, Wipro and KT",Zacks
Feb-28-19,KT Corp. Debuts New 5G Services at MWC 2019,PR Newswire
Mar-08-19,KT and Dal.Komm Showcase AI Robot Cafe 'b;eat2E' at MWC,PR Newswire
Mar-13-19,BlackBerry to Offer Secure Voice Communication to NCI Agency,Zacks
Mar-20-19,Is KT Corp. (KT) Stock Undervalued Right Now?,Zacks
Mar-29-19,BlackBerry (BB) Q4 Earnings Top Estimates on Higher Revenues,Zacks
Apr-03-19,"South Korea rolls out 5G services on phones, in race with U.S. and China",Reuters
Apr-03-19,"South Korea rolls out 5G services on phones, in race with U.S. and China",Reuters
Apr-03-19,"S.Korea rolls out 5G services on phones, in race with U.S. and China",Reuters
Apr-03-19,KT vs. BB: Which Stock Is the Better Value Option?,Zacks
Apr-03-19,"S.Korea first to roll out 5G services, beating U.S. and China",Reuters
