date,title,source
Oct-23-18,"The Zacks Analyst Blog Highlights: National Bank, CBTX, S&T Bancorp, SVB and Orrstown",Zacks
Oct-25-18,"CBTX, Inc. Reports Third Quarter Financial Results",GlobeNewswire
Oct-29-18,CBTX Sees Hammer Chart Pattern: Time to Buy?,Zacks
Nov-08-18,"CommunityBank of Texas, N.A. Announces New Loan and Deposit Production Office in Dallas, Texas",GlobeNewswire
Nov-09-18,"CBTX, Inc. Announces Redemption of Certain of its Trust Preferred Securities",GlobeNewswire
Nov-29-18,Three Understated Metrics For CBTX Inc (NASDAQ:CBTX) You Should Know,Simply Wall St.
Dec-19-18,"CBTX, Inc. Declares Quarterly Dividend",GlobeNewswire
