date,title,source
Oct-22-18,HC2 Holdings Announces Launch of $535 Million Senior Secured Notes Private Offering,GlobeNewswire
Oct-22-18,HC2 to Explore Strategic Alternatives for Global Marine Subsidiary,GlobeNewswire
Oct-22-18,HC2 Portfolio Company MediBeacon Granted Breakthrough Device Status From FDA for Transdermal GFR Measurement System,GlobeNewswire
Oct-22-18,FDA Grants Breakthrough Device Status for MediBeacon's Transdermal GFR Measurement System,PR Newswire
Oct-23-18,"HC2 Holdings, Inc. -- Moody's affirms HC2 Holdings, Inc.'s B3 CFR; assigns Caa1 rating to senior secured notes",Moody's
