date,title,source
Oct-31-18,Restoration Robotics to Participate in Two Upcoming Investor Conferences,GlobeNewswire
Nov-05-18,"Restoration Robotics (HAIR) Reports Q3 Loss, Misses Revenue Estimates",Zacks
Nov-05-18,Restoration Robotics: 3Q Earnings Snapshot,Associated Press
Nov-27-18,"Consolidated Research: 2018 Summary Expectations for Houghton Mifflin Harcourt, Abraxas Petroleum, Restoration Robotics, Cemex S.A.B. de C.V, Kratos Defense & Security Solutions, and Schweitzer-Mauduit International  Fundamental Analysis, Key Performance Indications",GlobeNewswire
Dec-20-18,"Do Insiders Own Shares In Restoration Robotics, Inc. (NASDAQ:HAIR)?",Simply Wall St.
Jan-28-19,Restoration Robotics to Showcase ARTAS iX at IMCAS 2019,GlobeNewswire
Feb-08-19,Restoration Robotics Announces Presentation on ARTAS iX at the South Beach Symposium in Miami,GlobeNewswire
