date,title,source
Oct-25-18,Edited Transcript of EIGI earnings conference call or presentation 25-Oct-18 12:00pm GMT,Thomson Reuters StreetEvents
Oct-25-18,"Endurance International (EIGI) Reports Q3 Loss, Misses Revenue Estimates",Zacks
Oct-25-18,Endurance International: 3Q Earnings Snapshot,Associated Press
Oct-25-18,Endurance International Group Reports 2018 Third Quarter Results,GlobeNewswire
Oct-29-18,Edited Transcript of EIGI earnings conference call or presentation 25-Oct-18 12:00pm GMT,Thomson Reuters StreetEvents
Oct-30-18,Edited Transcript of EIGI earnings conference call or presentation 25-Oct-18 12:00pm GMT,Thomson Reuters StreetEvents
Oct-31-18,Endurance International Group Appoints Manish Dalal As Managing Director Of Asia-Pacific,PR Newswire
Nov-06-18,5 Breakout Stocks Offering Admirable Returns,Zacks
