date,title,source
Oct-30-18,Yield10 Bioscience to Host Webcast of its Third Quarter 2018 Conference Call,GlobeNewswire
Nov-08-18,Yield10 Bioscience Announces Third Quarter 2018 Financial Results,GlobeNewswire
Nov-28-18,What does Yield10 Bioscience Incs (NASDAQ:YTEN) Balance Sheet Tell Us About Its Future?,Simply Wall St.
Dec-13-18,"Yield10 Bioscience Names Sherri M. Brown, Ph.D., Former Monsanto Executive, as Special Commercial and Technical Advisor",GlobeNewswire
Jan-15-19,Yield10 Bioscience Reports Encouraging Results from 2018 Field Tests of C3003 and Announces Advancement of C3003 into Commercial Development for Canola,GlobeNewswire
