date,title,source
Oct-17-18,Accelerate Diagnostics to Review Third Quarter 2018 Results on November 6th,PR Newswire
Oct-30-18,Earnings Preview: Accelerate Diagnostics (AXDX) Q3 Earnings Expected to Decline,Zacks
Nov-06-18,"Accelerate Diagnostics (AXDX) Reports Q3 Loss, Lags Revenue Estimates",Zacks
Nov-06-18,Accelerate Diagnostics: 3Q Earnings Snapshot,Associated Press
Nov-06-18,Accelerate Diagnostics reports Q3 2018 financial results,PR Newswire
Nov-07-18,Edited Transcript of AXDX earnings conference call or presentation 6-Nov-18 9:15pm GMT,Thomson Reuters StreetEvents
Nov-09-18,"Analysis: Positioning to Benefit within CSS Industries, Accelerate Diagnostics, Oasis Petroleum, Model N, Carbonite, and Masonite International  Research Highlights Growth, Revenue, and Consolidated Results",GlobeNewswire
Nov-19-18,Edited Transcript of AXDX earnings conference call or presentation 6-Nov-18 9:15pm GMT,Thomson Reuters StreetEvents
Nov-20-18,Edited Transcript of AXDX earnings conference call or presentation 6-Nov-18 9:15pm GMT,Thomson Reuters StreetEvents
