date,title,source
Oct-17-18,Kinder Morgan Inc (KMI) Q3 2018 Earnings Conference Call Transcript,Motley Fool
Oct-17-18,"Kinder Morgan Earnings inline, Revenue misses In Q3",Investing.com
Oct-17-18,Kinder Morgan (KMI) Tops Q3 Earnings Estimates,Zacks
Oct-17-18,Kinder Morgan Canada's profit surges on TransMountain sale,Reuters
Oct-17-18,Kinder Morgan Canada's profit surges on TransMountain sale,Reuters
Oct-17-18,Kinder Morgan: 3Q Earnings Snapshot,Associated Press
Oct-17-18,Kinder Morgan Declares $0.20 Dividend and Announces Results for Third Quarter of 2018,Business Wire
Oct-17-18,Kinder Morgan Canada Limited Declares Dividend and Announces Results for Third Quarter of 2018,CNW Group
Oct-17-18,Kinder Morgan Inc (NYSE:KMI): Time For A Financial Health Check,Simply Wall St.
Oct-17-18,Kinder Morgan's Q3 Earnings Preview,Benzinga
Oct-18-18,Finding a Cure for Kinder Morgans Frustration,Bloomberg
Oct-18-18,Edited Transcript of KMI earnings conference call or presentation 17-Oct-18 8:30pm GMT,Thomson Reuters StreetEvents
Oct-19-18,Kinder Morgan Inc.s CEO Outlines a 4-Step Plan for a Brighter Tomorrow,Motley Fool
Oct-19-18,"3 Big Stock Charts for Friday: Kinder Morgan, Danaher and Viacom",InvestorPlace
Oct-19-18,Edited Transcript of KMI earnings conference call or presentation 17-Oct-18 8:30pm GMT,Thomson Reuters StreetEvents
Oct-22-18,What the Market Missed in Kinder Morgan Inc.'s Results,Motley Fool
Oct-23-18,"NextEra Energy Earnings, Revenue miss in Q3",Investing.com
Oct-25-18,"American Electric Power Earnings, Revenue beat in Q3",Investing.com
Oct-25-18,Could Enbridge Inc. Be a Millionaire-Maker Stock?,Motley Fool
Oct-26-18,5 Crude Oil Stocks to Buy While Investors Run Scared,InvestorPlace
Oct-26-18,The Case for MLPs and Energy Stocks,Barrons.com
Oct-26-18,"Investor Expectations to Drive Momentum within Paratek Pharmaceuticals, Dell Technologies, Dover, Black Hills, Kinder Morgan, and Novo Nordisk A/S  Discovering Underlying Factors of Influence",GlobeNewswire
Oct-30-18,"Kinder Morgan Issues First, Stand-Alone Environmental, Social and Governance Report",Business Wire
Nov-01-18,Kinder Morgan (KMI) Outpaces Stock Market Gains: What You Should Know,Zacks
Nov-05-18,"3 Big Stock Charts for Monday: Coca-Cola, Kinder Morgan and Adobe",InvestorPlace
Nov-05-18,More Tax Pain for Some Mutual Fund Shareholders in 2018,Morningstar
Nov-06-18,Kinder Morgan says Louisiana natgas pipe in service for LNG terminal,Reuters
Nov-09-18,Kinder Morgan to Participate in Upcoming Investor Meetings at the RBC Capital Markets Midstream Conference and the Bank of America Merrill Lynch Global Energy Conference,CNW Group
Nov-15-18,Kinder Morgan (KMI) Outpaces Stock Market Gains: What You Should Know,Zacks
Nov-15-18,3 Things Brookfield Infrastructure Partners LP Wants You to Know,Motley Fool
Nov-16-18,Why Is Kinder Morgan (KMI) Down 4.3% Since Last Earnings Report?,Zacks
Nov-16-18,Is Kinder Morgan Incs (NYSE:KMI) CEO Paid At A Competitive Rate?,Simply Wall St.
Nov-19-18,NGPL PipeCo. LLC (Old) -- Moody's affirms NGPL's Ba1 ratings; outlook stable,Moody's
Nov-19-18,Kinder Morgan's Gulf LNG Project Clears Environmental Test,Zacks
Nov-21-18,"Ruby Pipeline, LLC -- Moody's reviews Ruby Pipeline's Baa3 ratings for downgrade",Moody's
Nov-27-18,"Get your natural gas in Texas for 25 cents, if you can",Reuters
Nov-27-18,"Get your natural gas in Texas for 25 cents, if you can",Reuters
Nov-28-18,Canada's Alberta to buy rail cars; expects deal within weeks,Reuters
Nov-28-18,Canada's Alberta to buy rail cars; expects deal within weeks,Reuters
Nov-30-18,Kinder Morgan (KMI) Outpaces Stock Market Gains: What You Should Know,Zacks
Nov-30-18,Better Buy: Kinder Morgan vs. ONEOK,Motley Fool
Dec-03-18,Kinder Morgan Canada Limited Announces 2019 Financial Expectations,CNW Group
Dec-03-18,Kinder Morgan Announces 2019 Financial Expectations,Business Wire
Dec-03-18,Cheniere's LNG Plants to Get a Fillip From Increasing Feedgas,Zacks
Dec-04-18,Kinder Morgan Falls After Guidance Update,Benzinga
Dec-04-18,Kinder Morgan Expects to Hit the Gas in 2019,Motley Fool
Dec-04-18,"Stock Market News For Dec 4, 2018",Zacks
Dec-04-18,Kinder Morgan (KMI) Releases Initial Financial Projections,Zacks
