date,title,source
Oct-29-18,"Taro to Announce Second Quarter Results on November 5, 2018",Business Wire
Oct-30-18,Taro Pharmaceutical (TARO) Earnings Expected to Grow: What to Know Ahead of Next Week's Release,Zacks
Nov-05-18,Taro Pharmaceutical (TARO) Q2 Earnings and Revenues Lag Estimates,Zacks
Nov-05-18,Taro: Fiscal 2Q Earnings Snapshot,Associated Press
Nov-05-18,"Taro Provides Results for September 30, 2018",Business Wire
Nov-09-18,Edited Transcript of TARO earnings conference call or presentation 6-Nov-18 1:00pm GMT,Thomson Reuters StreetEvents
