date,title,source
Oct-17-18,Shutterstock Announces Editorial Content on its eCommerce Platform is Now Available for License,PR Newswire
Oct-29-18,Q3 Earnings Preview For Shutterstock,Benzinga
Oct-30-18,"Why Shutterstock, FLIR Systems, and Chesapeake Energy Slumped Today",Motley Fool
Oct-30-18,Edited Transcript of SSTK earnings conference call or presentation 30-Oct-18 12:30pm GMT,Thomson Reuters StreetEvents
Oct-30-18,Shutterstock Inc (SSTK) Q3 2018 Earnings Conference Call Transcript,Motley Fool
Oct-30-18,Cost Controls Pay Off for Shutterstock,Motley Fool
Oct-30-18,Shutterstock (SSTK) Surpasses Q3 Earnings Estimates,Zacks
Oct-30-18,Shutterstock: 3Q Earnings Snapshot,Associated Press
Oct-30-18,Shutterstock Reports Third Quarter 2018 Financial Results,PR Newswire
Nov-08-18,What Kind Of Share Price Volatility Should You Expect For Shutterstock Inc (NYSE:SSTK)?,Simply Wall St.
Nov-15-18,"Shutterstock Launches Workflow Extension for Final Cut Pro X to Enable Seamless Access to Video, Image, and Music Collections",PR Newswire
Nov-26-18,"Shutterstock Announces Exclusive Partnership with Rights Clearance Industry Leader, Greenlight",PR Newswire
Nov-28-18,"Introducing Shutterstock Select, Premium Footage Filmed by Industry Experts",PR Newswire
Nov-29-18,Shutterstock's 2019 Color Trends Identifies Fastest Growing Colors in Popularity Around the World,PR Newswire
Dec-04-18,Why Fundamental Investors Might Love Shutterstock Inc (NYSE:SSTK),Simply Wall St.
Dec-11-18,Cramer's lightning round: You may end up regretting selli...,CNBC Videos
Dec-12-18,"Jim Cramer Advises His Viewers On Electronic Arts, Zillow And More",Benzinga
Jan-02-19,"A Closer Look At Shutterstock, Inc.s (NYSE:SSTK) Impressive ROE",Simply Wall St.
Jan-03-19,Shutterstock's Contributor Site and Mobile Applications now in 21 languages,PR Newswire
Jan-09-19,"It's not Stock, it's Shutterstock; New Ad Campaign Aims to Inspire the World with Stock",PR Newswire
Jan-15-19,Shutterstock's 2019 Creative Trends Report Predicts a Nostalgic Return to Visual Aesthetics of the Past,PR Newswire
Jan-25-19,"What Should You Know About Shutterstock, Inc.s (NYSE:SSTK) Growth?",Simply Wall St.
Jan-25-19,"Shutterstock To Report Fourth Quarter and Full Year 2018 Earnings Results on February 26, 2019",PR Newswire
Feb-19-19,Shutterstock Reimagines Oscar-Nominated Movie Posters in Seventh Annual Oscar Pop! Poster Series,PR Newswire
Feb-26-19,Shutterstock Keeps Making Progress Toward Faster Growth,Motley Fool
Feb-26-19,Shutterstock Reports Fourth Quarter and Full Year 2018 Financial Results,PR Newswire
Feb-27-19,Edited Transcript of SSTK earnings conference call or presentation 26-Feb-19 1:30pm GMT,Thomson Reuters StreetEvents
Feb-28-19,Edited Transcript of SSTK earnings conference call or presentation 26-Feb-19 1:30pm GMT,Thomson Reuters StreetEvents
Mar-01-19,Edited Transcript of SSTK earnings conference call or presentation 26-Feb-19 1:30pm GMT,Thomson Reuters StreetEvents
Mar-04-19,"Report: Exploring Fundamental Drivers Behind Facebook, Kellogg, Omnicom Group, Universal Health Services, Shutterstock, and Antero Midstream Partners LP  New Horizons, Emerging Trends, and Upcoming Developments",GlobeNewswire
Mar-07-19,Why Shutterstock Shares Jumped 16% Last Month,Motley Fool
Mar-07-19,"Dont Buy Shutterstock, Inc. (NYSE:SSTK) Until You Understand Its ROCE",Simply Wall St.
Mar-13-19,Shutterstock Announces Stan Pavlovsky to Join as Co-Chief Operating Officer,PR Newswire
Mar-13-19,Shutterstock Launches In-App Contributor Registration for the Mobile-First Generation,PR Newswire
Mar-26-19,"Shutterstock To Report First Quarter 2019 Earnings Results on April 25, 2019",PR Newswire
Mar-27-19,"Will Shutterstock, Inc.'s (NYSE:SSTK) Earnings Grow In The Years Ahead?",Simply Wall St.
