date,title,source
Oct-17-18,"The Zacks Analyst Blog Highlights: Altria, Coca-Cola, PepsiCo, Constellation and Canopy Growth",Zacks
Oct-18-18,3 Top Tobacco Stocks Still Burning Strong,InvestorPlace
Oct-18-18,Pricing boost helps Philip Morris quarterly results to beat estimates,Reuters
Oct-19-18,What Would Warren Buffett Buy?,GuruFocus.com
Oct-19-18,FDA to consider limiting e-cigarette sales to vape shops to curb youth use,CNBC
Oct-22-18,Will Pricing & Smokeless Unit Aid Altria's (MO) Q3 Earnings?,Zacks
Oct-22-18,Altria earnings: Investors are hoping for news of a move into the cannabis market,MarketWatch
Oct-22-18,Will Altria Make Its Marijuana Move This Week?,Motley Fool
Oct-22-18,Forget Altria: Philip Morris Should Make a Play for Canadas Pot Market,InvestorPlace
Oct-23-18,Altria earnings: Investors are hoping for news of a move into the cannabis market,MarketWatch
Oct-23-18,Philip Morris aims to revive Japan sales with cheaper heat-not-burn tobacco,Reuters
Oct-24-18,Q3 Earnings Preview For Altria Group,Benzinga
Oct-24-18,Altria earnings: Investors are hoping for news of a move into the cannabis market,MarketWatch
Oct-25-18,Altria Group Inc (MO) Q3 2018 Earnings Conference Call Transcript,Motley Fool
Oct-25-18,[$$] Altria Will Pull Its E-Cigarette Pods From the Market,The Wall Street Journal
Oct-25-18,"Altrias move to placate regulators on teen smoking is smart, analyst says",MarketWatch
Oct-25-18,Altria has more to gain than lose in pulling e-cigarette pods and most flavors amid FDA crackdown,CNBC
Oct-25-18,Calculating The Intrinsic Value Of Altria Group Inc (NYSE:MO),Simply Wall St.
Oct-25-18,Altria to Cut E-Gigarette Pods Over Vaping Concerns,TheStreet.com
Oct-25-18,"Altria Earnings, Revenue beat in Q3",Investing.com
Oct-25-18,"Altria (MO) Q3 Earnings Top, Revenues Gain on Strong Pricing",Zacks
Oct-25-18,Altria (MO) Q3 Earnings Top Estimates,Zacks
Oct-25-18,Altria: 3Q Earnings Snapshot,Associated Press
Oct-25-18,[$$] Cigarette Maker Altria Reports Higher Revenues,The Wall Street Journal
Oct-25-18,"Altria earnings and revenue beat expectations, will remove some products from the market",MarketWatch
Oct-25-18,Altria Reports 2018 Third-Quarter and Nine-Months Results; Tightens 2018 Full-Year Earnings Guidance; Announces Actions to Address Underage E-Vapor Use,Business Wire
Oct-26-18,Edited Transcript of MO earnings conference call or presentation 25-Oct-18 1:00pm GMT,Thomson Reuters StreetEvents
Oct-26-18,"Altrias move to placate regulators on teen smoking is smart, analyst says",MarketWatch
Oct-26-18,PRESS DIGEST-New York Times business news - Oct 26,Reuters
Oct-29-18,Altria Leaves Cannabis Investors Hanging,Motley Fool
Oct-29-18,6 Stocks Trading Below Peter Lynch Value,GuruFocus.com
