date,title,source
Oct-24-18,New York Community Bancorp Inc (NYCB) Q3 2018 Earnings Conference Call Transcript,Motley Fool
Oct-24-18,Edited Transcript of NYCB earnings conference call or presentation 24-Oct-18 12:30pm GMT,Thomson Reuters StreetEvents
Oct-24-18,2 Financial Stocks to Watch Now,Motley Fool
Oct-24-18,Does The Data Make New York Community Bancorp Inc (NYSE:NYCB) An Attractive Investment?,Simply Wall St.
Oct-24-18,New York Community Bancorp (NYCB) Q3 Earnings Meet Estimates,Zacks
Oct-24-18,New York Community Bancorp: 3Q Earnings Snapshot,Associated Press
Oct-24-18,"New York Community Bancorp, Inc. Reports Third Quarter 2018 Diluted Earnings Per Common Share of $0.20 as Growth and Expense Reductions Continue",PR Newswire
Oct-24-18,"New York Community Bancorp, Inc. Announces Capital Optimization Plan",PR Newswire
Oct-25-18,New York Community Capital Trust V -- Moody's affirms New York Community's long-term issuer rating at Baa2; changes outlook to negative,Moody's
Oct-25-18,"New York Community Bancorp, Inc. President and Chief Executive Officer Joseph R. Ficalora to Speak at Bank of America Merrill Lynch Investor Conference",PR Newswire
Oct-25-18,"New York Community (NYCB) Q3 Earnings In Line, Stock Down",Zacks
Oct-29-18,Edited Transcript of NYCB earnings conference call or presentation 24-Oct-18 12:30pm GMT,Thomson Reuters StreetEvents
Oct-30-18,Edited Transcript of NYCB earnings conference call or presentation 24-Oct-18 12:30pm GMT,Thomson Reuters StreetEvents
Oct-31-18,New York Community Bancorp Inc (NYSE:NYCB): 4 Days To Buy Before The Ex-Dividend Date,Simply Wall St.
Nov-01-18,Edited Transcript of NYCB earnings conference call or presentation 24-Oct-18 12:30pm GMT,Thomson Reuters StreetEvents
Nov-06-18,"New York Community Bancorp, Inc. Completes $300 Million Offering of Fixed-to-Floating Rate Subordinated Notes",PR Newswire
Nov-09-18,Edited Transcript of NYCB earnings conference call or presentation 24-Oct-18 12:30pm GMT,Thomson Reuters StreetEvents
Nov-27-18,"New York Community Bancorp, Inc. Declares A Quarterly Cash Dividend On Its Preferred Stock",PR Newswire
Dec-27-18,"New York Community Bancorp, Inc. To Report Fourth Quarter 2018 Earnings And Host Conference Call On January 30th",PR Newswire
Jan-04-19,"Does New York Community Bancorp, Inc.s (NYSE:NYCB) P/E Ratio Signal A Buying Opportunity?",Simply Wall St.
Jan-07-19,Is New York Community Bancorp a Buy?,Motley Fool
Jan-17-19,"Loan Growth, Rising Rates to Aid Citizens' (CFG) Q4 Earnings",Zacks
Jan-23-19,New York Community Bancorp (NYCB) Earnings Expected to Grow: What to Know Ahead of Next Week's Release,Zacks
Jan-25-19,"Bank Stock Roundup: Q4 Earnings in Full Swing, SunTrust, Fifth Third Beat Estimates",Zacks
Jan-30-19,New York Community Bancorp (NYCB) Matches Q4 Earnings Estimates,Zacks
Jan-30-19,New York Community Bancorp: 4Q Earnings Snapshot,Associated Press
Jan-30-19,"New York Community Bancorp, Inc. Reports Fourth Quarter And Full Year 2018 Diluted Earnings Per Common Share Of $0.19 And $0.79",PR Newswire
Jan-31-19,Edited Transcript of NYCB earnings conference call or presentation 30-Jan-19 1:30pm GMT,Thomson Reuters StreetEvents
Jan-31-19,"New York Community (NYCB) Q4 Earnings Meet, Stock Up 5.2%",Zacks
Jan-31-19,New York Community Bancorp (NYCB) Q4 2018 Earnings Conference Call Transcript,Motley Fool
Feb-04-19,"What Should Investors Know About New York Community Bancorp, Inc.s (NYSE:NYCB) Long Term Outlook?",Simply Wall St.
Feb-04-19,Goldman to Withhold Top Executives' Pay Until 1MBD Resolves,Zacks
Feb-05-19,"New York Community Bancorp, Inc. (NYCB) Shares March Higher, Can It Continue?",Zacks
Feb-06-19,Goldman Plans to Pull Back Commodities Trading Operations,Zacks
Feb-08-19,Goldman Sachs (GS) Plans to Enter Swiss Mortgage Market,Zacks
Feb-08-19,Fiserv Inc (FISV) Q4 2018 Earnings Conference Call Transcript,Motley Fool
Feb-22-19,"New York Community Bancorp, Inc. Declares A Quarterly Cash Dividend On Its Preferred Stock",PR Newswire
Feb-25-19,"New York Community Bancorp, Inc. Sets Date of 2019 Annual Meeting of Shareholders",PR Newswire
Feb-26-19,"New York Community Bancorp, Inc. President And Chief Executive Officer Joseph R. Ficalora To Speak At Raymond James Investor Conference",PR Newswire
Mar-01-19,"Is New York Community Bancorp, Inc.s (NYSE:NYCB) CEO Pay Fair?",Simply Wall St.
Mar-01-19,"New York Community Bancorp Inc (NYCB) Files 10-K for the Fiscal Year Ended on December 31, 2018",GuruFocus.com
Mar-19-19,"Fidelity's (FIS) Ratings Affirmed by Moody's, Outlook Stable",Zacks
Mar-22-19,NYCB vs. NFBK: Which Stock Is the Better Value Option?,Zacks
Mar-26-19,Did You Manage To Avoid New York Community Bancorps (NYSE:NYCB) 29% Share Price Drop?,Simply Wall St.
Mar-27-19,"New York Community Bancorp, Inc. To Report First Quarter 2019 Earnings And Host Conference Call On April 30th",PR Newswire
Mar-28-19,"New York Community Capital Trust V -- Moody's announces completion of a periodic review of ratings of New York Community Bancorp, Inc.",Moody's
Apr-18-19,"New York Community Bancorp, Inc. (NYSE:NYCB) Insiders Increased Their Holdings",Simply Wall St.
