date,title,source
Oct-23-18,Why Idexx (IDXX) is Poised to Beat Earnings Estimates Again,Zacks
Oct-25-18,Can CAG Growth Steadily Drive IDEXX (IDXX) in Q3 Earnings?,Zacks
Oct-25-18,Idexx Laboratories (IDXX) Q3 Earnings Preview: What's Shaping Up?,Zacks
Nov-01-18,Edited Transcript of IDXX earnings conference call or presentation 1-Nov-18 12:30pm GMT,Thomson Reuters StreetEvents
Nov-01-18,IDEXX Laboratories Inc (IDXX) Q3 2018 Earnings Conference Call Transcript,Motley Fool
Nov-01-18,Idexx: 3Q Earnings Snapshot,Associated Press
Nov-01-18,IDEXX Laboratories Announces Third Quarter Results,PR Newswire
Nov-05-18,Do Institutions Own Shares In IDEXX Laboratories Inc (NASDAQ:IDXX)?,Simply Wall St.
Nov-05-18,IDEXX Lets the 2019 Cat Out of the Bag,Motley Fool
Nov-06-18,Edited Transcript of IDXX earnings conference call or presentation 1-Nov-18 12:30pm GMT,Thomson Reuters StreetEvents
Nov-07-18,Edited Transcript of IDXX earnings conference call or presentation 1-Nov-18 12:30pm GMT,Thomson Reuters StreetEvents
Nov-08-18,Cramer's lightning round: Foot Locker's stock has run too much for my liking,CNBC
Nov-08-18,Edited Transcript of IDXX earnings conference call or presentation 1-Nov-18 12:30pm GMT,Thomson Reuters StreetEvents
Nov-12-18,"Analysis: Positioning to Benefit within IDEXX Laboratories, Editas Medicine, Arconic, Cardtronics, Cloudera, and BMC Stock  Research Highlights Growth, Revenue, and Consolidated Results",GlobeNewswire
Nov-16-18,"IDEXX Clear Leader in Animal Diagnostics, but Market Growth Could Boost Others",GuruFocus.com
Dec-10-18,"Do Hedge Funds Love IDEXX Laboratories, Inc. (IDXX)?",Insider Monkey
Dec-11-18,Royce Funds Commentary: Lauren Romeo on 4 Small-Caps with Quality Fundamentals,GuruFocus.com
Dec-11-18,"Will IDEXX Laboratories, Inc.s (NASDAQ:IDXX) Earnings Grow In The Next 12 Months?",Simply Wall St.
Jan-09-19,IDEXX Laboratories to Release 2018 Fourth Quarter and Full-Year Financial Results,PR Newswire
Jan-11-19,Why Idexx Laboratories Stock Gained 19% in 2018,Motley Fool
