date,title,source
Oct-17-18,"Banks are rallying, is the beaten down sector finally out...",CNBC Videos
Oct-18-18,China's economic growth slows amid trade battle with US,Associated Press
Oct-18-18,Stays in Play? PNC's sale of Fairmont Pittsburgh could mean more business for other local hotels,American City Business Journals
Oct-19-18,China's growth slows as officials try to reassure investors,Associated Press
Oct-19-18,3 mistakes you shouldn't make if you win the $1 billion Mega Millions jackpot,CNBC
Oct-22-18,Regional Bank Corrections Remain After Earnings,Investopedia
Oct-22-18,PNC partners with OnDeck for online small business lending,Reuters
