date,title,source
Nov-06-18,MINDBODY Inc (MB) Q3 2018 Earnings Conference Call Transcript,Motley Fool
Nov-06-18,Mindbody: 3Q Earnings Snapshot,Associated Press
Nov-06-18,MINDBODY Reports Third Quarter 2018 Financial Results,GlobeNewswire
Nov-07-18,MINDBODY Announces Schedule of Upcoming Investor Conferences,GlobeNewswire
Nov-07-18,"Mindbody Continues to Grow Revenue Rapidly, but Stock Plunges 18% on Outlook",Motley Fool
Nov-13-18,Sunil Rajasekar Named Chief Technology Officer of MINDBODY,PR Newswire
Nov-15-18,MINDBODY Named to Deloitte's 2018 Technology Fast 500,PR Newswire
Nov-16-18,Edited Transcript of MB earnings conference call or presentation 6-Nov-18 9:30pm GMT,Thomson Reuters StreetEvents
Nov-19-18,Edited Transcript of MB earnings conference call or presentation 6-Nov-18 9:30pm GMT,Thomson Reuters StreetEvents
Nov-26-18,3 Top Growth Stocks to Buy Right Now,Motley Fool
Nov-27-18,"New Research: Key Drivers of Growth for Martin Midstream Partners, Galectin Therapeutics, Mountain Province Diamonds, MINDBODY, Pareteum, and Pieris Pharmaceuticals  Factors of Influence, Major Initiatives and Sustained Production",GlobeNewswire
Dec-12-18,"Is MINDBODY, Inc.s (NASDAQ:MB) Balance Sheet Strong Enough To Weather A Storm?",Simply Wall St.
Dec-13-18,Edited Transcript of MB earnings conference call or presentation 6-Nov-18 9:30pm GMT,Thomson Reuters StreetEvents
Dec-17-18,Should You Avoid MINDBODY Inc (MB)?,Insider Monkey
Dec-24-18,Software Maker Mindbody Acquired By Private Equity Firm Vista Equity,Investor's Business Daily
Dec-24-18,"Why Mindbody, New Gold, and Acorda Therapeutics Jumped Today",Motley Fool
Dec-24-18,Why Mindbody Is Skyrocketing,Motley Fool
Dec-24-18,Mindbody to Be Bought by Vista Equity Partners in $1.9 Billion Deal,TheStreet.com
Dec-24-18,"MINDBODY (MB) Alert: Johnson Fistel Investigates Proposed Sale of MINDBODY, Inc. to Vista Equity Partners; Are Shareholders Getting a Fair Deal?",PR Newswire
Dec-24-18,[$$] Software Firm Mindbody Going Private in $1.9 Billion Cash Deal,The Wall Street Journal
Dec-24-18,Vista Equity Partners to buy Mindbody in a $1.9 billion deal,Reuters
Dec-24-18,Vista Equity Partners to buy Mindbody in a $1.9 bln deal,Reuters
Dec-24-18,Vista Equity Partners to buy Mindbody in a $1.9 billion deal,Reuters
Dec-24-18,"Mindbody to be acquired by Vista Equity for 68% premium, in a deal valued at $1.9 billion",MarketWatch
Dec-24-18,Vista Equity Partners to buy Mindbody in a $1.9 bln deal,Reuters
Dec-24-18,MINDBODY Enters into Definitive Agreement to be Acquired by Vista Equity Partners for $1.9 Billion,GlobeNewswire
Dec-26-18,Vista Equity Partners to buy Mindbody in a $1.9 billion deal,Reuters
Dec-26-18,"4 Healthcare Stocks Getting A Boost On Wednesday, Dec. 26, 2018",ACCESSWIRE
Dec-26-18,"Company News For Dec 26, 2018",Zacks
Dec-26-18,"WeissLaw LLP Investigates MINDBODY, Inc.",ACCESSWIRE
Dec-31-18,Vista Equity to buy Mindbody for $1.9B as it raises $16B buyout fund,American City Business Journals
Jan-02-19,"Bragar Eagel & Squire, P.C. is Investigating the Board of Directors of MINDBODY, Inc. (MB) on Behalf of Stockholders and Encourages MB Investors to Contact the Firm",GlobeNewswire
Jan-02-19,"MINDBODY, INC. SHAREHOLDER ALERT: Rigrodsky & Long, P.A. Announces Investigation of Buyout",Business Wire
Jan-02-19,"SHAREHOLDER ALERT: Levi & Korsinsky, LLP Notifies Investors of an Investigation Regarding Whether the Sale of MINDBODY, Inc. to Vista Equity Partners is Fair to Shareholders",GlobeNewswire
Jan-03-19,MINDBODY Research Reveals the Strongest Wellness Markets in America,PR Newswire
Jan-07-19,"SHAREHOLDER NOTICE: Brodsky & Smith, LLC Announces an Investigation into the Fairness of the Sale of MINDBODY, Inc. - MB",ACCESSWIRE
Jan-07-19,These Sports Tech Stocks Could Be A Slam Dunk,ACCESSWIRE
Jan-07-19,"INVESTOR ALERT: Levi & Korsinsky, LLP Reminds Investors of an Investigation Regarding Whether the Sale of MINDBODY, Inc. to Vista Equity Partners is Fair to Shareholders",GlobeNewswire
Jan-09-19,"MERGER ALERT  BDMS, LOXO and MB: Levi & Korsinsky, LLP Reminds Investors of Investigations Concerning the Sale of these Companies",GlobeNewswire
Jan-10-19,"SHAREHOLDER ALERT: WeissLaw LLP Investigates MINDBODY, Inc.",PR Newswire
