date,title,source
Oct-23-18,Champions Oncology (CSBR) Gains As Market Dips: What You Should Know,Zacks
Oct-29-18,Has Champions Oncology (CSBR) Outpaced Other Medical Stocks This Year?,Zacks
Nov-05-18,Champions Oncology (CSBR) Outpaces Stock Market Gains: What You Should Know,Zacks
Nov-07-18,Champions Oncology to Participate in the 9th Annual Craig-Hallum Alpha Select Conference,PR Newswire
Nov-15-18,"Analysis: Positioning to Benefit within Red Lion Hotels, P.A.M. Transportation Services, Champions Oncology, Kingstone Companies, Applied DNA Sciences, and Innodata  Research Highlights Growth, Revenue, and Consolidated Results",GlobeNewswire
