date,title,source
Oct-18-18,"TiVo Corporation Announces 2018 Q3 Results and Conference Call Scheduled for November 7, 2018",Business Wire
Oct-25-18,"Report: Exploring Fundamental Drivers Behind Atossa Genetics, Titan International, Olympic Steel, L Brands, Sysco, and TiVo  New Horizons, Emerging Trends, and Upcoming Developments",GlobeNewswire
Oct-31-18,TiVo (TIVO) Earnings Expected to Grow: What to Know Ahead of Next Week's Release,Zacks
Nov-05-18,TiVo Renews Personalized Content Discovery Platform Agreement with Foxtel,Business Wire
Nov-07-18,TiVo (TIVO) Lags Q3 Earnings and Revenue Estimates,Zacks
Nov-07-18,TiVo: 3Q Earnings Snapshot,Associated Press
Nov-07-18,TiVo Corporation Reports Third Quarter Financial Results,Business Wire
Nov-08-18,Why TiVo Corporation Was Slammed Thursday,Motley Fool
Nov-08-18,"TiVo's (TIVO) Reports Wider Loss in Q3, Revenues Decline Y/Y",Zacks
Nov-12-18,Edited Transcript of TIVO earnings conference call or presentation 7-Nov-18 10:00pm GMT,Thomson Reuters StreetEvents
Nov-12-18,TiVo (TIVO) in Focus: Stock Moves 5.6% Higher,Zacks
Nov-13-18,Is There An Opportunity With TiVo Corporations (NASDAQ:TIVO) 27.27% Undervaluation?,Simply Wall St.
Dec-04-18,TiVo Renews Patent License Agreement with Samsung for Smartphones and Tablets,Business Wire
Dec-06-18,TiVo Refreshes License With Samsung to Aid Customer Relations,Zacks
Dec-17-18,Gift Guide: Some tech gadgets that actually fill a real need,Associated Press
Dec-18-18,Hedge Funds Are Buying TiVo Corporation (TIVO),Insider Monkey
Dec-27-18,3 Tech Stocks for Dividend Investors to Buy Now,Zacks
Dec-31-18,"Corsair Capital Managements Returns, AUM and Holdings",Insider Monkey
Dec-31-18,"Highlighted as Zacks Bull and Bear of the Day Big Lots, Insperity, Garmin, Qualcomm and TiVo",Zacks
Jan-04-19,Bull or Bear: Your Investment Strategy for 2019,Zacks
Jan-08-19,Verizon Extends Partnership With TiVo to Deliver Personalized User Experience for 4.6 Million Subscribers,Business Wire
Jan-08-19,TiVo Releases New Churn Analysis From Its Personalized Content Discovery Platform,Business Wire
Jan-09-19,TiVo Renews Multi-year Patent License and Signs Global Metadata Deal with Minerva Networks,Business Wire
Jan-09-19,TiVo Inks Multi-Year Deal With izzi Telecom in Mexico,Business Wire
Jan-09-19,"Detailed Research: Economic Perspectives on TiVo, Harris, J.B. Hunt Transport Services, Align Technology, McDermott International, and Patrick Industries  What Drives Growth in Today's Competitive Landscape",GlobeNewswire
Jan-10-19,TiVo Rides High on Back-to-Back Deals With Minerva and izzi,Zacks
Jan-28-19,TiVo could split its business in two: report,MarketWatch
Feb-05-19,"TiVo Corporation Announces 2018 Q4 and Year-End Results and Conference Call Scheduled for February 26, 2019",Business Wire
Feb-06-19,Why TiVo's Stock Rose 18.3% in January,Motley Fool
Feb-20-19,TiVo (TIVO) to Report Q4 Earnings: What's Up for the Stock?,Zacks
Feb-20-19,TiVo Announces Metadata Deal With Sky Mexico,Business Wire
Feb-21-19,TiVo Signs Video Metadata and IP License Extension with TikiLIVE,Business Wire
