date,title,source
Oct-18-18,"Report: Exploring Fundamental Drivers Behind St. Joe, Emerge Energy Services LP, Resources Connection, FormFactor, Global Brass and Copper, and Otonomy  New Horizons, Emerging Trends, and Upcoming Developments",GlobeNewswire
Oct-29-18,Otonomy to Report Third Quarter 2018 Financial Results and Provide Corporate Update,GlobeNewswire
Oct-30-18,"Otonomy Announces Multiple Presentations at Society for Neuroscience Annual Meeting including OTO-413 Presentation Selected as ""Hot Topic""",GlobeNewswire
Nov-05-18,Otonomy: 3Q Earnings Snapshot,Associated Press
Nov-05-18,Otonomy Reports Third Quarter 2018 Financial Results and Provides Corporate Update,GlobeNewswire
Nov-06-18,"Otonomy Presents Data Highlighting Potential of OTO-413, an Otic Sustained-Exposure Formulation of BDNF, to Treat Hearing Loss",GlobeNewswire
Nov-12-18,"Report: Developing Opportunities within Control4, Nanometrics, Century Casinos, Steven Madden, Otonomy, and C&J Energy Services  Future Expectations, Projections Moving into 2018",GlobeNewswire
