date,title,source
Oct-17-18,Ryder Expands Last-Mile Delivery Network in 11 North American Markets,Business Wire
Oct-18-18,Ryder Receives 2018 Green Fleet Award for Driving New Technologies for Environmental Sustainability,Business Wire
Oct-19-18,Ryder (R) Q3 Earnings Preview: What to Know Ahead of the Release,Zacks
Oct-22-18,Forbes Names Ryder among the Worlds Best Employers for 2018,Business Wire
Oct-22-18,Truck makers rev up for rollout of electric big rigs,Reuters
Oct-22-18,Truck makers rev up for rollout of electric big rigs,Reuters
Oct-24-18,RyderGyde Makes it Easier than Ever to Rent a Commercial Truck,Business Wire
Oct-25-18,"R, GBX Earnings Due on Oct 26: Here are the Key Predictions",Zacks
Oct-26-18,"Ryder System, Inc. (R) Q3 2018 Earnings Conference Call Transcript",Motley Fool
Oct-26-18,Ryder (R) Q3 Earnings and Revenues Beat Estimates,Zacks
Oct-26-18,Ryder: 3Q Earnings Snapshot,Associated Press
Oct-26-18,Should We Be Delighted With Ryder System Incs (NYSE:R) ROE Of 27%?,Simply Wall St.
Oct-26-18,Ryder Reports Third Quarter 2018 Results,Business Wire
Oct-29-18,"Ryder (R) Beats on Q3 Earnings & Revenues, Raises 2018 View",Zacks
Oct-29-18,Edited Transcript of R earnings conference call or presentation 26-Oct-18 3:00pm GMT,Thomson Reuters StreetEvents
Oct-30-18,Edited Transcript of R earnings conference call or presentation 26-Oct-18 3:00pm GMT,Thomson Reuters StreetEvents
