date,title,source
Oct-26-18,AmeriGas Propane Announces Quarterly Distribution,Business Wire
Nov-12-18,AmeriGas Reports Fiscal 2018 Results,Business Wire
Nov-13-18,UGI Corp (UGI) Q4 2018 Earnings Conference Call Transcript,Motley Fool
Nov-19-18,"UGI Utilities, Inc. -- Moody's affirms UGI Utilities at A2, outlook stable",Moody's
Nov-20-18,"AmeriGas Partners LP (APU) Files 10-K for the Fiscal Year Ended on September 30, 2018",GuruFocus.com
Nov-20-18,"AmeriGas Partners, L.P. Announces Filing of its Annual Report on Form 10-K",Business Wire
Nov-26-18,"Research Report Identifies Ebix, Gold Resource, Mastech Digital, AmeriGas Partners, Tactile Systems Technology, and AnaptysBio with Renewed Outlook  Fundamental Analysis, Calculating Forward Movement",GlobeNewswire
Nov-27-18,UGI Announces UGI/AmeriGas Investor Day Webcast,Business Wire
Dec-03-18,Edited Transcript of APU earnings conference call or presentation 13-Nov-18 2:00pm GMT,Thomson Reuters StreetEvents
Dec-03-18,AmeriGas Partners (APU) Looks Good: Stock Adds 6.6% in Session,Zacks
Dec-10-18,Better Buy: Suburban Propane Partners vs. AmeriGas Partners,Motley Fool
Jan-10-19,"AmeriGas Partners, L.P. to Hold 1QFY19 Earnings Conference Call and Webcast on Wednesday, February 6",Business Wire
Jan-17-19,New Strong Sell Stocks for January 17th,Zacks
Jan-18-19,"Analysis: Positioning to Benefit within Amerco, American Financial Group, AmeriGas Partners, Ares Management, LivePerson, and Armada Hoffler Properties  Research Highlights Growth, Revenue, and Consolidated Results",GlobeNewswire
Jan-22-19,"AmeriGas Appoints Ann P. Kelly Chief Financial Officer; UGI Appoints Laurie A. Bergman Vice President, Chief Accounting Officer and Corporate Controller",Business Wire
Jan-29-19,AmeriGas Propane Announces Quarterly Distribution,Business Wire
