date,title,source
Oct-17-18,Spotify takes minor stake in music distributor DistroKid,Reuters
Oct-18-18,Four Reasons Why Snap Stock Will Rally in the Near Future,InvestorPlace
Oct-19-18,Sirius XM Investors Better Thank Amazon,Motley Fool
Oct-23-18,SiriusXM Stock Could Bounce Back After Earnings,InvestorPlace
Oct-23-18,Sirius XM Stock Has a Lot to Prove This Week,Motley Fool
Oct-23-18,"Pandora Presents: Backroads with Jason Aldean, The Most Played Country Artist in Pandora History",Business Wire
Oct-24-18,Sirius XMs Purchase of Pandora Just Got One Step Closer,Barrons.com
Oct-24-18,Is a Record Quarter Enough to Make Sirius XM Stock Hot Again?,Motley Fool
Oct-24-18,Pandora Announces Completion of Go-Shop Process,Business Wire
Oct-25-18,Sirius XM (SIRI) Q3 Earnings and Revenues Top Estimates,Zacks
Oct-25-18,"Pandora Presents Beyond 2018 Concert Featuring Performances by Cardi B, Julia Michaels and DaniLeigh with DJ Big Ben in New York City on November 13th",Business Wire
Oct-25-18,This Failure to Rally Isnt a Great Sign for SIRI Stock,InvestorPlace
Nov-01-18,Spotify faults itself for margin gains; stock hits new lows,Reuters
Nov-01-18,Apple in Talks With iHeartMedia About Tie-Up: Report,Investopedia
Nov-01-18,Music streaming leader Spotify reports modest rise in paid users,Reuters
Nov-01-18,Music streaming leader Spotify posts rise in third-quarter users,Reuters
Nov-02-18,SHAREHOLDER ANNOUNCEMENT: Monteverde & Associates PC Launches An Investigation of the Board of Directors of Pandora Media  P,ACCESSWIRE
Nov-05-18,"Pandora Media (P) Reports Q3 Loss, Tops Revenue Estimates",Zacks
Nov-05-18,Pandora: 3Q Earnings Snapshot,Associated Press
Nov-05-18,Pandora Reports Q3 2018 Financial Results,Business Wire
Nov-06-18,"URGENT: Monteverde & Associates PC Continues Investigation of XOXO, CORI, PLRM, P, EGL, EGN, NXEO, and SIR",ACCESSWIRE
Nov-06-18,"Pandora Delivers Accelerated Growth, and Looks to Its Future With Sirius XM",Motley Fool
Nov-06-18,The Street's Reaction To Pandora's Q3 Earnings,Benzinga
Nov-06-18,"Amazon, Pandora, PTC Therapeutics, and More: Why These Stocks Are Trending",Insider Monkey
Nov-07-18,Today's Research Reports on Trending Tickers: Pandora Media and Sirius XM Holdings,ACCESSWIRE
Nov-08-18,"Moore Kuehn, PLLC Announces an Investigation of Pandora Media, Inc. Acquisition",PR Newswire
Nov-08-18,Pandora Turns up the Volume with New Sound On Brand Narrative,Business Wire
Nov-13-18,"Pandora expands podcast inventory, creates Podcast Genome Project for recommendations",MarketWatch
Nov-13-18,Pandora Launches Podcast Offering Powered by the Podcast Genome Project,Business Wire
Nov-14-18,"SiriusXM CEO: Were in the radio business, not music dist...",CNBC Videos
Nov-15-18,John Paulson's Top 5 Buys of 3rd Quarter,GuruFocus.com
Nov-15-18,Why Pandora Media Is Up 80% Year to Date in 2018,Motley Fool
Nov-15-18,[$$] Resignations rock Theresa Mays government,Financial Times
Nov-19-18,Pandora Presents: El Pulso Featuring Headliner Becky G with Special Performance by Farina,Business Wire
Nov-26-18,4 Headwinds That Will Likely Cause Apple Stock to Drop Further,InvestorPlace
Nov-27-18,Libsyn Selected as a Pandora Podcast Launch Partner,ACCESSWIRE
Nov-27-18,[$$] EU lawyers tell ECJ that Article 50 cannot be unilaterally revoked,Financial Times
Nov-29-18,5 Stocks Under $5 to Buy Before They Soar,InvestorPlace
Nov-29-18,[$$] FirstFT: Todays top stories,Financial Times
Nov-30-18,Apple Music Is Coming To Amazon Echo Smart Speakers,Investor's Business Daily
Nov-30-18,Where Will Sirius XM Holdings Be in 5 Years?,Motley Fool
Nov-30-18,"[$$] Dystopian Dream, Sadlers Wells, London  dance theatre taken to another level",Financial Times
Nov-30-18,[$$] Mastering evolution: the worlds first gene-edited babies,Financial Times
Dec-03-18,Why Sirius XM Could Deliver Improving Returns,GuruFocus.com
Dec-06-18,Hedge Funds Are Crazy About Pandora Media Inc (NYSE:P),Insider Monkey
Dec-06-18,"Monteverde & Associates PC Files Class Action Lawsuit On Behalf Of Shareholders Of Pandora Media, Inc. In The U.S. District Court For The Northern District Of California",PR Newswire
Dec-10-18,"1 Stock That Got Bought Out in 2018, 2 That Did Not",Motley Fool
Dec-13-18,Today's Research Reports on Trending Tickers: Pandora and Tencent,ACCESSWIRE
Dec-17-18,2 Risks That Could Affect the Future Apple App Store Revenue,InvestorPlace
Dec-24-18,SiriusXM Files Definitive Proxy Statement/Prospectus; Pandora Schedules Special Meeting of Stockholders to Vote on Merger,PR Newswire
Dec-24-18,Top film and entertainment stories in Georgia of 2018,American City Business Journals
Dec-26-18,Could Sirius XM Be a Millionaire-Maker Stock?,Motley Fool
Dec-31-18,3 Stocks Under $10 to Buy in 2019,Motley Fool
Jan-02-19,JPMorgan Turns Bullish On Sirius XM As Pandora Deal Nears Completion,Benzinga
Jan-02-19,Sirius XM Radio Stock Upgraded: What You Need to Know,Motley Fool
Jan-02-19,Sirius XM Holdings Is Upgraded at JPMorgan Chase,TheStreet.com
Jan-02-19,"Sirius upgraded on valuation, as J.P. Morgan swings to bullish from bearish",MarketWatch
Jan-07-19,East Bay startup eyes larger HQ as it helps retailers compete against Amazon,American City Business Journals
Jan-08-19,Sirius stock ticks lower following outlook,MarketWatch
Jan-08-19,Better Buy: Sirius XM Holdings vs. Pandora,Motley Fool
Jan-09-19,Sirius XM Is Carving Out a Bottom in January,TheStreet.com
Jan-09-19,Will Sirius XM Move Higher For 11 Years in a Row?,Motley Fool
Jan-10-19,Pandora Blitzes Into 2019 Kicking Off Big Game Weekend in Atlanta,Business Wire
Jan-11-19,"[$$] 5G, Robot Delivery Dogs and a Google Ad Blitz: What CMOs Found at CES",The Wall Street Journal
Jan-14-19,Pandora Celebrates TRAP Karaoke in Los Angeles,Business Wire
Jan-15-19,Pandora Launches Voice Mode in Mobile App,Business Wire
Jan-22-19,5 Stocks Under $5 to Buy Before They Soar,InvestorPlace
Jan-22-19,How to Tap Into Big Gains With a Pairs Play in Spotify Stock and Pandora,InvestorPlace
Jan-24-19,Will Pandora Vote in Favor of the Sirius XM Deal Next Week?,Motley Fool
Jan-29-19,Sirius to clean house at Pandora after buyout closes,MarketWatch
Jan-29-19,Pandora Stockholders Approve Transaction with SiriusXM,Business Wire
Jan-30-19,Sirius XM Radio (SIRI) Q4 2018 Earnings Conference Call Transcript,Motley Fool
Jan-30-19,"Sirius XM Rises After Earnings Meet Estimates, Revenue Beats",TheStreet.com
Jan-30-19,Big Things Are Happening at Sirius XM in 2019,Motley Fool
Jan-30-19,Pandora Says &quot;Yes&quot; -- and Wall Street Goes Wild,Motley Fool
Jan-30-19,Today's Research Reports on Trending Tickers: Sirius XM Holdings and Pandora Media,ACCESSWIRE
Feb-01-19,Sirius XM Holdings Completes Purchase Of Pandora Media,Investor's Business Daily
Feb-01-19,"Sirius XM (SIRI) Q4 Earnings Match Estimates, Revenues Up Y/Y",Zacks
Feb-01-19,Facebook (FB) Soars: Stock Adds 10.8% in Session,Zacks
Feb-01-19,Overcome Market Volatility With These 5 Low-Beta Stocks,Zacks
Feb-04-19,"For Sirius XM, Is There Life After Howard Stern?",Motley Fool
Feb-04-19,Why Apple and Sirius Are Both Even Stronger Than They Look,Motley Fool
Feb-04-19,"Zacks.com featured highlights include: El Pollo Loco, Jabil, Omega, Pandora Media and Talend",Zacks
