date,title,source
Oct-17-18,"Dow Slips for Fifth Day in Seven, Led Lower by IBM, Home Depot",TheStreet.com
Oct-17-18,"Abbott (ABT) Q3 Earnings Top Estimates, Guidance Narrowed",Zacks
Oct-17-18,Abbott Laboratories (ABT) Q3 2018 Earnings Conference Call Transcript,Motley Fool
Oct-17-18,"New Study Shows Abbott's Novel Diagnostic Test has the Potential to Demonstrate Gold Standard Accuracy and Speed, Which Could Help Rule Out Heart Attacks Earlier at the Point of Care",PR Newswire
Oct-17-18,Barclays Takes Action on Health Care Stocks,GuruFocus.com
Oct-17-18,ABT Stock Dips Following Q3 Earnings Results,InvestorPlace
Oct-17-18,"Abbott Labs Earnings, Revenue beat in Q3",Investing.com
Oct-17-18,Earnings & Economic Data Deluge,Zacks
Oct-17-18,"Q3 Earnings Stay (Mostly) Strong, Plus Housing Data",Zacks
Oct-17-18,Stocks- U.S. Futures Fall as Investors Look Ahead to Fed Minutes,Investing.com
Oct-17-18,"Abbott Laboratories Posts Solid Q3 Earnings, Trims Full-Year Forecast",TheStreet.com
Oct-17-18,"Buy MedTech names due to improving fundamentals, Barclays says in sector initiation",CNBC
Oct-17-18,Abbott (ABT) Q3 Earnings Top Estimates,Zacks
Oct-17-18,Abbott: 3Q Earnings Snapshot,Associated Press
Oct-17-18,"[$$] Abbott Laboratories Meets Views, Narrows Outlook",The Wall Street Journal
Oct-17-18,"Abbott drops 2.3% premarket after in-line Q3 profit, narrowed 2018 outlook",MarketWatch
Oct-17-18,Abbott Labs quarterly profit falls 6.6 pct on tax expense,Reuters
Oct-17-18,Abbott Reports Third-Quarter 2018 Results,PR Newswire
Oct-17-18,"Dow set for 100 point-plus decline as volatile trading continues, but Netflix will boost Nasdaq",CNBC
Oct-18-18,Abbott Labs Falls 3%,Investing.com
Oct-18-18,Abbott Labs Declines on 3rd-Quarter Earnings,GuruFocus.com
Oct-18-18,4 MedTech Names to Buy on 'Strong Fundamentals',Investopedia
Oct-19-18,Abbott's HeartMate 3 Heart Pump Now FDA Approved for Advanced Heart Failure Patients Not Eligible for a Heart Transplant,PR Newswire
Oct-23-18,"Stocks to Buy, Stocks to Dump in This Volatile Market",TheStreet.com
Oct-24-18,These 10 companies are helping employees pay off their student loans,CNBC
Oct-25-18,Abbott (ABT) Gains But Lags Market: What You Should Know,Zacks
Oct-25-18,Abbott Introduces the Next Generation of Influenza A & B and Strep A Assays with Fastest-Ever Time to Molecular Results,PR Newswire
Oct-26-18,"Abbott, AbbVie settle TriCor marketing case for $25 mln",Reuters
Oct-26-18,"Abbott, AbbVie settle U.S. case over TriCor marketing for $25 mln",Reuters
Oct-26-18,How Does Abbott Laboratories (NYSE:ABT) Fare As A Dividend Stock?,Simply Wall St.
Oct-26-18,"Consolidated Research: 2018 Summary Expectations for Kulicke and Soffa Industries, QUALCOMM, Net Element, AT&T, Abbott Laboratories, and The Kroger  Fundamental Analysis, Key Performance Indications",GlobeNewswire
Oct-31-18,Abbott (ABT) Outpaces Stock Market Gains: What You Should Know,Zacks
Nov-01-18,[$$] Australia to move child refugees from island camps,Financial Times
Nov-02-18,5 Income Stocks for Massive Payouts and Steady Growth,InvestorPlace
Nov-02-18,Abbott (ABT) Q3 Earnings Top Estimates,Zacks
Nov-07-18,Cramer's advice on investing during Washington gridlock: Buy fast growers,CNBC
Nov-07-18,Drug Stocks Climb as Investors Digest Midterm Election Results,TheStreet.com
Nov-08-18,Abbott (ABT) Gains As Market Dips: What You Should Know,Zacks
Nov-09-18,Yacktman Asset Management Buys 4 Companies in 3rd Quarter,GuruFocus.com
Nov-09-18,FOCUS-U.S. regulators snip red tape for medical devices to curb opioid crisis,Reuters
Nov-09-18,FOCUS-U.S. regulators snip red tape for medical devices to curb opioid crisis,Reuters
Nov-12-18,Chartmaster says amid the market sell-off these are the b...,CNBC Videos
Nov-12-18,Abbott Labs Falls 3%,Investing.com
Nov-12-18,Surmodics' (SRDX) Q4 Earnings and Revenues Beat Estimates,Zacks
Nov-14-18,Abbott (ABT) Stock Moves -0.12%: What You Should Know,Zacks
Nov-14-18,Abbott Recommends Rejection of Below-Market Mini-Tender Offer by Baker Mills LLC,PR Newswire
Nov-15-18,New Approvals Allow Chronic Pain Sufferers to Try Abbott's Non-Opioid Pain Therapy Before Getting Device Implant,PR Newswire
Nov-16-18,"Stanley Druckenmiller Sells Facebook, Buys PayPal in 3rd Quarter",GuruFocus.com
Nov-16-18,Abbott (ABT) Up 3.8% Since Last Earnings Report: Can It Continue?,Zacks
Nov-20-18,We'll have a slowdown of growth and earnings in 2019: Pro,CNBC Videos
Nov-21-18,Abbott (ABT) Stock Sinks As Market Gains: What You Should Know,Zacks
Nov-21-18,IBD 50 Stocks To Watch: Will Top Health Stock Offer New Buy Point?,Investor's Business Daily
Nov-21-18,"At US$72.04, Is Abbott Laboratories (NYSE:ABT) Worth Looking At Closely?",Simply Wall St.
Nov-28-18,Abbott Labs Rises 3%,Investing.com
Nov-30-18,Abbott Laboratories (ABT) Chairman and CEO Miles D White Sold $10.3 million of Shares,GuruFocus.com
Nov-30-18,Abbott (ABT) Outpaces Stock Market Gains: What You Should Know,Zacks
Nov-30-18,"Jim Cramer Shares His Thoughts On DowDuPont, Home Depot And More",Benzinga
Nov-30-18,[$$] Vivian Maier: The secret hoard of a suburban spy,Financial Times
Dec-04-18,Abbott Labs Falls 3%,Investing.com
Dec-06-18,Today's Research Reports on Trending Tickers: Boston Scientific and Abbott Laboratories,ACCESSWIRE
Dec-07-18,Abbott Labs Falls 3%,Investing.com
Dec-10-18,Generic-drug stocks slammed by report of expanded price-fixing probe,MarketWatch
Dec-10-18,Generic drug makers stocks fall sharply after report of expanded price-fixing probe,MarketWatch
