date,title,source
Oct-17-18,Edited Transcript of ADTN earnings conference call or presentation 17-Oct-18 2:30pm GMT,Thomson Reuters StreetEvents
Oct-17-18,Why ADTRAN Shares Plunged Today,Motley Fool
Oct-17-18,Adtran (ADTN) Q3 Earnings Surpass Estimates,Zacks
Oct-17-18,Adtran: 3Q Earnings Snapshot,Associated Press
Oct-18-18,ADTRAN (ADTN) Q3 2018 Earnings Conference Call Transcript,Motley Fool
Oct-23-18,ADTRAN Partners with SCTEISBE Cable-Tec Expo to Explore the Evolution of the Access Network,Business Wire
Oct-23-18,Community Fibre Teams up with ADTRAN to Build 10G Regional Full-Fibre to the Home (FTTH) Network,Business Wire
Oct-23-18,ADTRAN Showcases Successful SEBA Integration with ONF,Business Wire
Oct-30-18,"Detailed Research: Economic Perspectives on Raytheon, Noodles, Monolithic Power, Moody's, ADTRAN, and Aspen Technology  What Drives Growth in Today's Competitive Landscape",GlobeNewswire
Oct-31-18,"ADTRAN, Inc. to Present at the Needham Networking, Communications & Security Conference in New York on November 13, 2018",Business Wire
Nov-01-18,Top Ranked Income Stocks to Buy for November 1st,Zacks
Nov-12-18,ADTRAN Aims to Curb Margin Woes With Solid Product Portfolio,Zacks
Nov-14-18,Is ADTRAN Incs (NASDAQ:ADTN) CEO Overpaid Relative To Its Peers?,Simply Wall St.
Nov-15-18,Why Is Adtran (ADTN) Down 9.2% Since Last Earnings Report?,Zacks
Nov-20-18,ADTRAN Leads 10G PON Worldwide Adoption Wave as Gigabit Societys Rising Tide Lifts Market,Business Wire
Nov-28-18,ADTRAN Advances Gigabit Society with NBN Co in Massive Rollout of Its Cutting-Edge G.fast Fibre-to-the-Curb (FTTC) Technology,Business Wire
Nov-29-18,NBN to Deploy ADTRAN's (ADTN) In-Ground G.fast Technology,Zacks
Dec-06-18,SmartRG snapped up by Alabama networking company,American City Business Journals
Dec-06-18,ADTRANs Gary Bolton Re-Elected to Fiber Broadband Associations Board,Business Wire
Dec-06-18,ADTRAN Acquires SmartRGLeading Provider of Connected Home Software Platforms & Cloud Services,Business Wire
Dec-07-18,"ADTRAN, Inc. to attend the 5th Annual Cowen and Company Networking & Cybersecurity Summit in New York on December 12, 2018",Business Wire
Dec-07-18,"Analysis: Positioning to Benefit within BioMarin Pharmaceutical, Ritchie Bros. Auctioneers, ADTRAN, Aspen Technology, AMC Entertainment, and Halliburton  Research Highlights Growth, Revenue, and Consolidated Results",GlobeNewswire
Dec-13-18,"Telecom Stock Roundup: Qualcomm Wins Patent, Verizon's Oath Write Off & More",Zacks
Dec-18-18,"ADTRAN Introduces New, Affordable CAF II Solutions to Address 30% of Rural America without Broadband",Business Wire
Jan-08-19,Analysts Estimate Adtran (ADTN) to Report a Decline in Earnings: What to Look Out for,Zacks
Jan-09-19,"ADTRAN, Inc. to Release Fourth Quarter Earnings on January 23, 2019",Business Wire
Jan-16-19,Analysts Estimate Adtran (ADTN) to Report a Decline in Earnings: What to Look Out for,Zacks
Jan-23-19,"ADTRAN, Inc. Reports Earnings for the Fourth Quarter 2018 and Declares Quarterly Cash Dividend",Business Wire
Jan-24-19,"ADTRAN (ADTN) Q4 Loss Wider Than Estimated, Revenues Up Y/Y",Zacks
Jan-24-19,"Adtran (ADTN) Reports Q4 Loss, Tops Revenue Estimates",Zacks
Jan-24-19,Adtran: 4Q Earnings Snapshot,Associated Press
Jan-25-19,"Estimating The Intrinsic Value Of ADTRAN, Inc. (NASDAQ:ADTN)",Simply Wall St.
Jan-25-19,ADTRAN (ADTN) Q4 2018 Earnings Conference Call Transcript,Motley Fool
Jan-29-19,Edited Transcript of ADTN earnings conference call or presentation 24-Jan-19 3:30pm GMT,Thomson Reuters StreetEvents
Feb-04-19,ADTRAN Enters Overbought Territory: Is A Drop Coming?,Zacks
Feb-11-19,"ADTRAN, Inc. to attend the Goldman Sachs Technology and Internet Conference in San Francisco on February 13, 2019",Business Wire
Feb-14-19,ADTRAN Unveils New Software-Only Solution to Help CAF Service Providers Comply and Manage Performance Testing,Business Wire
Feb-14-19,Lumos Networks Selects ADTRAN for Innovative 10G FTTP Rollout,Business Wire
Feb-22-19,Adtran (ADTN) Up 7.2% Since Last Earnings Report: Can It Continue?,Zacks
Feb-26-19,ADTRAN Delivers Fixed Wireless Access Solutions to Accelerate 5G Deployments,Business Wire
Feb-27-19,"Detailed Research: Economic Perspectives on AT&T, Nokia, United Parcel Service, Tailored Brands, ADTRAN, and Carpenter Technology  What Drives Growth in Today's Competitive Landscape",GlobeNewswire
Feb-27-19,ADTRAN and IoT.nxt Collaborate to Bring Exciting Internet of Things (IoT) Synergies to Worldwide Enterprise and Carrier Markets,Business Wire
Feb-28-19,"Adtran Inc (ADTN) Files 10-K for the Fiscal Year Ended on December 31, 2018",GuruFocus.com
Mar-06-19,"Is It Time To Consider Buying ADTRAN, Inc. (NASDAQ:ADTN)?",Simply Wall St.
Mar-07-19,ADTRAN and Zzoomm Accelerate 10G FTTH Across the U.K.,Business Wire
Mar-08-19,ADTRAN (ADTN) Chosen by Zzoomm for 10G FTTH Network Buildout,Zacks
Mar-12-19,Former ADTRAN general counsel joins Bradley as partner,American City Business Journals
Mar-14-19,"Telecom Stock Roundup: AT&amp;T Revamps Content Lineup, Motorola Buys Avtec &amp; More",Zacks
Mar-27-19,"ADTRAN, Inc. to Release First Quarter Earnings on April 17, 2019",Business Wire
Apr-05-19,"How Does ADTRAN, Inc. (NASDAQ:ADTN) Affect Your Portfolio Volatility?",Simply Wall St.
Apr-17-19,"ADTRAN, Inc. Reports Earnings for the First Quarter 2019 and Declares Quarterly Cash Dividend",Business Wire
Apr-18-19,ADTRAN INC (ADTN) Q1 2019 Earnings Call Transcript,Motley Fool
Apr-18-19,"ADTRAN (ADTN) Q1 Earnings and Revenues Beat, Increase Y/Y",Zacks
Apr-18-19,Adtran: 1Q Earnings Snapshot,Associated Press
Apr-22-19,Edited Transcript of ADTN earnings conference call or presentation 18-Apr-19 2:30pm GMT,Thomson Reuters StreetEvents
Apr-25-19,"Telecom Stock Roundup: AT&amp;T, Verizon Miss Q1 Revenue Estimates &amp; More",Zacks
Apr-30-19,Surprise Loss Highlights Ongoing Risk to Nokia Stock,InvestorPlace
Apr-30-19,"ADTRAN Shares March Higher, Can It Continue?",Zacks
May-01-19,Moving Average Crossover Alert: ADTRAN,Zacks
May-08-19,"ADTRAN, Inc. to Present at the 47th Annual J.P. Morgan Global Technology, Media and Communications Conference on May 16, 2019",Business Wire
May-09-19,"Hedge Funds Have Never Been More Bullish On ADTRAN, Inc. (ADTN)",Insider Monkey
May-15-19,"ADTRAN, Inc. (NASDAQ:ADTN) Insiders Have Been Selling",Simply Wall St.
May-16-19,"First in North America, ADTRAN SmartOS Platform Leverages Super-Vectoring to Deliver Ultra-Broadband Wi-Fi Services",GlobeNewswire
May-16-19,"First in North America, ADTRAN SmartOS Platform Leverages Super-Vectoring to Deliver Ultra-Broadband Wi-Fi Services",Business Wire
May-17-19,Why Is Adtran (ADTN) Down 1.5% Since Last Earnings Report?,Zacks
May-22-19,All You Need to Know About Adtran (ADTN) Rating Upgrade to Strong Buy,Zacks
May-22-19,ADTRAN Earns Global Recognition for Marketing Excellence,Business Wire
May-22-19,New Strong Buy Stocks for May 22nd,Zacks
May-30-19,Bet on These 4 Top Liquid Stocks for Solid Returns,Zacks
May-31-19,"Zacks.com featured highlights include: ADTRAN, Cardlytics, Molina and Carlisle",Zacks
Jun-04-19,ADTRAN 2nd Generation Gfast Portfolio Recognized for its Excellence in Gigabit Service Delivery Innovation,Business Wire
