date,title,source
Oct-17-18,IBD Stock Of The Day Ross Stores Holds Key Support As Other Leaders Buckle,Investor's Business Daily
Oct-24-18,IBD Stock Of The Day Burlington Stores Powers Toward Buy Point In Market Correction,Investor's Business Daily
Oct-26-18,"Report: Developing Opportunities within Orbotech, Dorchester Minerals, Ross Stores, QIWI, Fibria Celulose S.A, and Atlassian  Future Expectations, Projections Moving into 2018",GlobeNewswire
Oct-29-18,These Factors Make Ross Stores Inc (NASDAQ:ROST) An Interesting Investment,Simply Wall St.
Oct-31-18,3 Retail Stocks Alerting Big Buying,Investopedia
Oct-31-18,8 Quality Stocks To Buy After 'Overdone' October Sell-Off,Investopedia
Nov-05-18,TGT vs. ROST: Which Stock Is the Better Value Option?,Zacks
Nov-06-18,Ross Stores Announces Third Quarter 2018 Earnings Release and Conference Call,GlobeNewswire
Nov-06-18,"Ross Stores (ROST) Hits 52-Week High, Can the Run Continue?",Zacks
Nov-07-18,Know Ross Stores (ROST) Stock Inside Out Before Investment,Zacks
Nov-07-18,Here's Why Ross Stores (ROST) is a Great Momentum Stock to Buy,Zacks
Nov-13-18,Ross Stores (ROST) Earnings Expected to Grow: Should You Buy?,Zacks
Nov-13-18,Can Ross Stores (ROST) Retain Positive Earnings Trend in Q3?,Zacks
Nov-16-18,3 Earnings Reports to Watch Next Week,InvestorPlace
Nov-16-18,Why the Earnings Surprise Streak Could Continue for Ross Stores (ROST),Zacks
Nov-16-18,Does Ross Stores Inc (NASDAQ:ROST) Generate Enough Cash?,Simply Wall St.
Nov-19-18,Ross Stores Announces Quarterly Dividend,Business Wire
Nov-19-18,This is the time of year when everyone gets in the mood f...,CNBC Videos
Nov-19-18,"Final trades: Aptiv, Alphabet, Ross Stores, Abbvie, Acadi...",CNBC Videos
Nov-19-18,Burlington Stores (BURL) Q3 Earnings: Is a Beat in Store?,Zacks
Nov-19-18,"Discount Retailers Kohl's, Ross, TJX Report Earnings",Investopedia
Nov-19-18,Is a Surprise Coming for Ross Stores (ROST) This Earnings Season?,Zacks
Nov-19-18,"Ross Stores Donates $300,000 To The American Red Cross For California Wildfires",PR Newswire
Nov-20-18,"Ross Stores, Inc. (ROST) Q3 2018 Earnings Conference Call Transcript",Motley Fool
Nov-20-18,"Ross Stores Earnings beat, Revenue Inline In Q3",Investing.com
Nov-20-18,"Ross Stores (ROST) Q3 Earnings Beat, Soft Margin Hurts Stock",Zacks
Nov-20-18,TJX Companies (TJX) Raises View on Solid Q3 Earnings & Sales,Zacks
Nov-20-18,TJX and Ross Stores Are Falling Today but Theyre Still Up for 2018,Barrons.com
Nov-20-18,Ross Stores (ROST) Surpasses Q3 Earnings Estimates,Zacks
Nov-20-18,"Target (TGT) Q3 Earnings Miss Estimates, Stock Tumbles",Zacks
Nov-20-18,Shares of Ross Stores down 7.9% in premarket trade after company projects disappointing fourth-quarter same-store sales,MarketWatch
Nov-20-18,Ross Stores: Fiscal 3Q Earnings Snapshot,Associated Press
Nov-20-18,"Ross Stores Reports Third Quarter Earnings, Updates Fourth Quarter Guidance",Business Wire
Nov-20-18,6 Consumer Discretionary Stocks to Buy for Black Friday Week,Zacks
Nov-21-18,"Freight Costs, Higher Wages Likely To Weigh On Ross Stores' Margins",Benzinga
Nov-21-18,Edited Transcript of ROST earnings conference call or presentation 20-Nov-18 5:00pm GMT,Thomson Reuters StreetEvents
Nov-21-18,Is Ross Stores (ROST) Outperforming Other Retail-Wholesale Stocks This Year?,Zacks
Nov-21-18,Buckle (BKE) to Post Q3 Earnings: Factors to Impact Results,Zacks
Nov-21-18,"BJ's Wholesale (BJ) Stock Gains on Q3 Earnings Beat, Ups View",Zacks
Nov-21-18,TJX Outshines Ross Stores During Q3,Motley Fool
Nov-21-18,"The Zacks Analyst Blog Highlights: Macy's, Ross Stores, Ralph Lauren, Under Armour and V.F.",Zacks
Nov-21-18,5 Great Travel & Retail Stocks to Buy for Thanksgiving,Zacks
Nov-23-18,"The Zacks Analyst Blog Highlights: Spirit Airlines, Hertz Global Holdings, Macy's, Target and Ross Stores",Zacks
Nov-23-18,What's Hurting Ross Stores (ROST) Stock Despite a Strong Q3?,Zacks
Nov-26-18,Ross Stock Is Still Worth a Look,InvestorPlace
Nov-27-18,Costco's (COST) Comparable Sales Run Looks Compelling,Zacks
Nov-28-18,Burlington Earnings Growth Crush Estimates; Stock Soars,Investor's Business Daily
Nov-29-18,Burlington Stores Continues Its Stellar Sales and Earnings Growth,Motley Fool
Dec-03-18,"Walmart, Target Benefiting From G-20 Talks, TJX, Ross Not So Much",TheStreet.com
Dec-04-18,Should You Be Pleased About The CEO Pay At Ross Stores Incs (NASDAQ:ROST),Simply Wall St.
Dec-04-18,"3 Big Stock Charts for Tuesday: Morgan Stanley, Ross Stores and Dominion Energy",InvestorPlace
Dec-06-18,Why Ross Stores Stock Lost 12% in November,Motley Fool
Dec-10-18,Costco (COST) Continues With Solid Comparable Sales Momentum,Zacks
Dec-10-18,"Do Hedge Funds Love Ross Stores, Inc. (ROST)?",Insider Monkey
Dec-12-18,Darden's (DRI) Q2 Earnings: Olive Garden Major Growth Driver,Zacks
Dec-13-18,Ross Stores (ROST) Dips More Than Broader Markets: What You Should Know,Zacks
Dec-18-18,Darden Restaurants Lends a Hand to Consumer Stocks Midday,Investing.com
Dec-20-18,Ross Stores (ROST) Down 3.9% Since Last Earnings Report: Can It Rebound?,Zacks
Dec-21-18,"A Look At The Fair Value Of Ross Stores, Inc. (NASDAQ:ROST)",Simply Wall St.
Dec-24-18,The 9 Best Stocks of Americas Last Bear Market,Kiplinger
Dec-31-18,Ross Stores (ROST) Outpaces Stock Market Gains: What You Should Know,Zacks
Dec-31-18,6 Undervalued Stocks Growing Earnings,GuruFocus.com
Jan-02-19,3 Double Top Stocks to Trade in January,Investopedia
Jan-07-19,Ross Stores (ROST) Stock to Remain a Lucrative Pick in 2019,Zacks
Jan-07-19,"Should You Investigate Ross Stores, Inc. (NASDAQ:ROST) At US$85.34?",Simply Wall St.
Jan-08-19,6 Retail Stocks to Consider as Sears Nears Final Demise,GuruFocus.com
Jan-08-19,The 9 Best Stocks of America&rsquo;s Last Bear Market,Kiplinger
Jan-10-19,Do Costco's December Comps Indicate a Solid Run in 2019?,Zacks
Jan-16-19,Retail Slips Midday as Nordstrom Delivers Another Holiday Sales Blow,Investing.com
Jan-17-19,Here's Why Costco Scored Decent Numbers in Holiday Season,Zacks
Jan-22-19,"Ross Stores, Inc. (NASDAQ:ROST): Financial Strength Analysis",Simply Wall St.
Jan-24-19,Retail-Discount Stores Outlook: Consumer Spending Key to Growth,Zacks
Jan-28-19,Target (TGT) Set to Offer Same-Day Delivery Service in Hawaii,Zacks
Jan-28-19,4 Discount Retailers to Steal the Show this Earnings Season,Zacks
Jan-29-19,"The Zacks Analyst Blog Highlights: Ross Stores, Costco, Target and Burlington",Zacks
Jan-30-19,Has Ross Stores (ROST) Outpaced Other Retail-Wholesale Stocks This Year?,Zacks
Feb-04-19,Why Ross Stores (ROST) is Poised to Beat Earnings Estimates Again,Zacks
Feb-06-19,US Retail Sales to Top $3.8 Trillion in 2019: 5 Gainers,Zacks
Feb-07-19,"The Zacks Analyst Blog Highlights: Shoe Carnival, Boot Barn, Ross Stores, RH and DSW",Zacks
Feb-08-19,"What Do Analysts Think About Ross Stores, Inc.s (NASDAQ:ROST) Growth?",Simply Wall St.
Feb-11-19,Costco's January Comps Growth Decelerates: Should You Worry?,Zacks
Feb-12-19,DLTR vs. ROST: Which Stock Should Value Investors Buy Now?,Zacks
Feb-14-19,ETFs &amp; Stocks to Fall for This Valentine's Day,Zacks
Feb-19-19,Ross Stores Announces Fourth Quarter and Fiscal 2018 Earnings Release and Conference Call,GlobeNewswire
Feb-20-19,"Construction underway in expansive Rock Hill industrial park, generating interest from potential tenants",American City Business Journals
Feb-20-19,The &quot;Weak&quot; December Retail Sales Report Is Good News for TJX and Ross Stores,Motley Fool
Feb-25-19,"Detailed Research: Economic Perspectives on Zosano Pharma, Appian, Ross Stores, Alleghany, ZAGG, and Lindsay  What Drives Growth in Today's Competitive Landscape",GlobeNewswire
Feb-26-19,Check Ross Stores' (ROST) Probability to Beat Earnings in Q4,Zacks
Feb-26-19,"Ross Stores, Inc. (NASDAQ:ROST) Insiders Have Been Selling",Simply Wall St.
Mar-04-19,Day Ahead: Top 3 Things to Watch,Investing.com
Mar-04-19,"Ciena Earnings Expected To Double; Several Retail, China Stocks On Tap: Action Plan",Investor's Business Daily
Mar-04-19,Ross Stores Rides the Escalator to New 2019 High,Investopedia
