date,title,source
Oct-23-18,"Lazydays Holdings, Inc. To Acquire Tennessee RV Supercenter",PR Newswire
Oct-25-18,"Lazydays Holdings, Inc. Schedules Third Quarter Financial Results Conference Call for Thursday November 8, 2018 at 10:00 AM ET",PR Newswire
Nov-08-18,"Lazydays Holdings, Inc. Reports Third Quarter 2018 Financial Results",PR Newswire
Nov-30-18,What Kind Of Shareholder Owns Most Lazydays Holdings Inc (NASDAQ:LAZY) Stock?,Simply Wall St.
Dec-07-18,"Lazydays Holdings, Inc. Completes Acquisition of Tennessee RV Supercenter",PR Newswire
Dec-14-18,Lazydays RV Names Jason Rees Knoxville General Manager,PR Newswire
Jan-10-19,Lazydays RV Names Linda Stephens VP of Customer Experience,PR Newswire
