date,title,source
Oct-17-18,"ScanSource to Announce First Quarter Fiscal Year 2019 Results on November 6, 2018",Business Wire
Oct-19-18,Does Market Volatility Impact ScanSource Incs (NASDAQ:SCSC) Share Price?,Simply Wall St.
Nov-06-18,ScanSource (SCSC) Surpasses Q1 Earnings Estimates,Zacks
Nov-06-18,ScanSource: Fiscal 1Q Earnings Snapshot,Associated Press
Nov-06-18,ScanSource Delivers Strong First Quarter Performance,Business Wire
Nov-07-18,Edited Transcript of SCSC earnings conference call or presentation 6-Nov-18 10:00pm GMT,Thomson Reuters StreetEvents
