date,title,source
Oct-23-18,Concord Medical Services Holdings Limited (NYSE:CCM): Time For A Financial Health Check,Simply Wall St.
Dec-07-18,Concord Medical Schedules 2018 Annual Meeting of Shareholders,PR Newswire
Dec-19-18,Concord Medical Announces a Topping Out Ceremony of Guangzhou Concord Cancer Center,PR Newswire
Dec-20-18,Shanghai Concord Medical Cancer Center has completed the First Bill of Medical Insurance Settlement on 2018 December 17th,PR Newswire
Feb-20-19,Shanghai Concord Medical Cancer Center's Basic Medical Services have been Fully Covered by Medical Insurance,PR Newswire
