date,title,source
Oct-22-18,Why Nektar Therapeutics Crashed 17.2% Today,Motley Fool
Oct-22-18,Why Mirati Therapeutics Inc. Is Plunging Today,Motley Fool
Oct-22-18,"Microsoft's typical worker makes $168K a year  how that compares with Facebook, Google, PayPal, Box, Salesforce, Intel and other big Bay Area tech employers",American City Business Journals
Oct-23-18,Todays Research Reports on Stocks to Watch: Tesaro and Nektar Therapeutics,ACCESSWIRE
Oct-24-18,Implied Volatility Surging for Nektar Therapeutics (NKTR) Stock Options,Zacks
Oct-24-18,"New Research Coverage Highlights Nektar Therapeutics, General Mills, Yelp, Zillow Group, Tutor Perini, and Hormel Foods  Consolidated Revenues, Company Growth, and Expectations for 2018",GlobeNewswire
Oct-30-18,EQUITY ALERT: Rosen Law Firm Announces Filing of Securities Class Action Lawsuit Against Nektar Therapeutics  NKTR,Business Wire
Oct-30-18,"Pomerantz Law Firm Announces the Filing of a Class Action against Nektar Therapeutics, Inc. and Certain Officers  NKTR",GlobeNewswire
Oct-30-18,"Nektar to Announce Financial Results for the Third Quarter 2018 on Wednesday, November 7, 2018, After Close of U.S.-Based Financial Markets",PR Newswire
