date,title,source
Oct-17-18,Inseegos Ctrack Selected by Michelin Group Commercial Fleet Leader to Improve Driver Behavior and Safety,Business Wire
Oct-23-18,"Inseego Corp. to Report Third Quarter 2018 Financial Results on November 6, 2018",Business Wire
Oct-25-18,Inseego Opens Cupertino Design Center,Business Wire
Oct-25-18,"Factors of Influence in 2018, Key Indicators and Opportunity within Kelly Services, Inseego, Digital Turbine, SandRidge Energy, Western Asset Mortgage Capital, and Textron  New Research Emphasizes Economic Growth",GlobeNewswire
Oct-30-18,Inseego (INSG) Earnings Expected to Grow: Should You Buy?,Zacks
Oct-30-18,Inseego Delivers Industrys First Gigabit Mobile Hotspot,Business Wire
Nov-01-18,Penny Stocks to Buy Using Technical Analysis for November 2018,Investopedia
Nov-06-18,"Inseego (INSG) Reports Q3 Loss, Tops Revenue Estimates",Zacks
Nov-06-18,Inseego: 3Q Earnings Snapshot,Associated Press
Nov-06-18,Inseego Reports Third Quarter 2018 Financial Results,Business Wire
Dec-04-18,Inseego Achieves Multigigabit Per Second Speed and Millisecond Latency in Live 5G NR Mobile Network Field Trials,Business Wire
Dec-04-18,5G NR: Inseego and Verizon Demonstrate Virtual Reality Telemedicine over 5G at Qualcomm Snapdragon Technology Summit in Maui,Business Wire
Dec-21-18,Could Inseego Corp.s (NASDAQ:INSG) Investor Composition Influence The Stock Price?,Simply Wall St.
