date,title,source
Oct-17-18,"Universal Insurance Holdings, Inc. Announces Third Quarter 2018 Earnings Release and Conference Call Date",PR Newswire
Oct-22-18,"Universal Insurance Holdings, Inc. Announces Expected Financial Impact from Recent Weather Events",PR Newswire
Oct-29-18,Universal Insurance: 3Q Earnings Snapshot,Associated Press
Oct-29-18,"Universal Insurance Holdings, Inc. Reports Third Quarter 2018 Results",PR Newswire
Oct-30-18,Edited Transcript of UVE earnings conference call or presentation 30-Oct-18 1:00pm GMT,Thomson Reuters StreetEvents
Nov-08-18,"Recent Analysis Shows Automatic Data Processing, GTx, Ionis Pharmaceuticals, TriNet Group, Ternium S.A, and UNIVERSAL INSURANCE HOLDINGS INC Market Influences  Renewed Outlook, Key Drivers of Growth",GlobeNewswire
Nov-16-18,"Universal Insurance Holdings, Inc. Declares Cash Dividend of 0.29 Cents per Share",PR Newswire
