date,title,source
Oct-26-18,Brief Commentary On Entravision Communications Corporations (NYSE:EVC) Fundamentals,Simply Wall St.
Oct-29-18,Pulpo Media Appoints Laura Willis to Vice President of Digital Sales,PR Newswire
Oct-29-18,"Entravision Communications Corporation Appoints Mark Garcia to Senior Vice President of Integrated Marketing Solutions in McAllen, TX",PR Newswire
Oct-31-18,Entravision Communications Corporation Schedules Third Quarter 2018 Earnings Release And Teleconference,PR Newswire
Nov-07-18,Entravision Communications: 3Q Earnings Snapshot,Associated Press
Nov-07-18,Entravision Communications Corporation Reports Third Quarter 2018 Results,PR Newswire
Nov-07-18,Mario M. Carrera to Step down as Chief Revenue Officer of Entravision Communications Corporation,PR Newswire
Nov-08-18,Edited Transcript of EVC earnings conference call or presentation 7-Nov-18 10:00pm GMT,Thomson Reuters StreetEvents
Nov-12-18,"Recent Analysis Shows Gray Television, The Michaels Companies, Farmland Partners, Impinj, Entravision Communications, and INTL FCStone Market Influences  Renewed Outlook, Key Drivers of Growth",GlobeNewswire
Nov-16-18,"Entravision Communications Corporation -- Moody's downgrades Entravision's Corporate Family Rating to B2, Outlook Negative",Moody's
Dec-04-18,"Entravision's Oswaldo Diaz to be Recognized by the National Association of Broadcasters of Mexico, A.C. at the 2018 National Voice Awards",PR Newswire
Dec-10-18,Entravision Communications Corporation Wins 60 Emmy Awards Across 7 U.S. Markets,PR Newswire
Dec-11-18,Entravision Communications Corporation's Denver Television and Radio Stations Extend their Market Leadership with Exceptional Ratings Performance in November 2018,PR Newswire
Dec-18-18,Entravision Communications Corporation Announces Partial Debt Repayment,PR Newswire
Dec-18-18,Entravision Communications Corporation Expands Reach of Entravision Solutions Platform,PR Newswire
Dec-19-18,Entravision Communications Corporation Extends Hit Morning Radio Show Alex 'El Genio' Lucas Through 2020,PR Newswire
Dec-25-18,Is Entravision Communications (EVC) Stock Undervalued Right Now?,Zacks
Dec-26-18,These 5 Television Broadcasters Are Attractive Bets in 2019,Zacks
Dec-26-18,Is Entravision Communications Corporation (NYSE:EVC) A Volatile Stock?,Simply Wall St.
Dec-28-18,"Ed Goldman: Reviewing a years worth of people columns, Part 2",American City Business Journals
Jan-09-19,Entravision Communications Corporation Launches New Radio Format in the Albuquerque Market,PR Newswire
