date,title,source
Oct-22-18,NuCana Presents Data from Phase I Study of NUC-3373 at ESMO 2018,GlobeNewswire
Oct-24-18,NuCana Sees Hammer Chart Pattern: Time to Buy?,Zacks
Nov-01-18,NuCana Announces First Patients Enrolled in Phase Ib Study of NUC-3373 in Advanced Colorectal Cancer,GlobeNewswire
Nov-07-18,NuCana to Participate in the Jefferies 2018 London Healthcare Conference,GlobeNewswire
Nov-20-18,NuCana to Participate in the 2018 Evercore ISI HealthCONx Conference,GlobeNewswire
Nov-27-18,NuCana Reports Third Quarter 2018 Financial Results and Provides Business Update,GlobeNewswire
