date,title,source
Oct-17-18,AVX (AVX) Q2 Earnings Preview: What to Know Ahead of the Release,Zacks
Oct-17-18,AVX Releases New Lambda-Bridge Thermal Conductors,GlobeNewswire
Oct-18-18,"AVX to Showcase its Innovative Technology in an Upcoming ""Success Television Production",GlobeNewswire
Oct-18-18,AVX Corporation Declares Dividend,Business Wire
Oct-19-18,Can Automotive Strength & Acquisitions Aid AVX Q2 Earnings?,Zacks
Oct-24-18,AVX (AVX) Surpasses Q2 Earnings Estimates,Zacks
Oct-24-18,AVX: Fiscal 2Q Earnings Snapshot,Associated Press
Oct-24-18,AVX Corporation Announces Preliminary Second Quarter Results,Business Wire
Oct-26-18,"With A 2.9% Return On Equity, Is AVX Corporation (NYSE:AVX) A Quality Stock?",Simply Wall St.
Oct-31-18,"Consolidated Research: 2018 Summary Expectations for EQT GP Holdings, LP, Esterline Technologies, HNI, ONE Gas, AVX, and Chart Industries  Fundamental Analysis, Key Performance Indications",GlobeNewswire
Nov-05-18,5 Best Stocks to Buy Ahead of Midterm Election,Zacks
Nov-06-18,"The Zacks Analyst Blog Highlights: AVX, RH, Herbalife Nutrition, Lumentum Holdings and Methanex",Zacks
Nov-08-18,AVX is Exhibiting at electronica 2018,GlobeNewswire
Nov-09-18,Edited Transcript of AVX earnings conference call or presentation 24-Oct-18 2:00pm GMT,Thomson Reuters StreetEvents
Nov-13-18,Are Investors Undervaluing AVX (AVX) Right Now?,Zacks
Nov-20-18,Losing Appetite for FAANG? 5 Promising Tech Stocks,Zacks
Nov-29-18,Are Investors Undervaluing AVX (AVX) Right Now?,Zacks
