date,title,source
Oct-22-18,One Liberty Properties Acquires Industrial/Office Property,GlobeNewswire
Oct-25-18,"Consolidated Research: 2018 Summary Expectations for Kinsale Capital Group, Blue Bird, Key Energy Services, Enviva Partners, LP, LGI Homes, and One Liberty Properties  Fundamental Analysis, Key Performance Indications",GlobeNewswire
Nov-01-18,One Liberty Properties Acquires Industrial Property,GlobeNewswire
Nov-08-18,One Liberty Properties Reports Third Quarter 2018 Results,GlobeNewswire
Nov-09-18,One Liberty Properties (OLP) Meets Q3 FFO Estimates,Zacks
Nov-09-18,One Liberty Properties: 3Q Earnings Snapshot,Associated Press
Nov-16-18,Should You Worry About One Liberty Properties Incs (NYSE:OLP) CEO Pay Cheque?,Simply Wall St.
Nov-20-18,5 Momentum Picks Screened on Driehaus Strategy,Zacks
Nov-21-18,"Zacks.com highlights: Insperity, One Liberty Properties, Clearway Energy, Northrim BanCorp and United States Cellular",Zacks
Nov-29-18,One Liberty Properties Acquires Industrial Property,GlobeNewswire
Dec-06-18,One Liberty Properties Announces Dividend,GlobeNewswire
Dec-10-18,One Liberty Properties Acquires Industrial Property,GlobeNewswire
Dec-13-18,One Liberty Properties Acquires Industrial Property for $10 Million,GlobeNewswire
Dec-17-18,"Can We See Significant Insider Ownership On The One Liberty Properties, Inc. (NYSE:OLP) Share Register?",Simply Wall St.
Dec-18-18,"Hedge Funds Are Dumping One Liberty Properties, Inc. (OLP)",Insider Monkey
Jan-07-19,5 REITs to Scoop Gains After a Stellar U.S. Jobs Report,Zacks
Jan-31-19,"Did One Liberty Properties, Inc. (NYSE:OLP) Insiders Sell Shares?",Simply Wall St.
Feb-19-19,"Market Trends Toward New Normal in CenturyLink, Textainer Group, BeiGene, Nova Measuring Instruments, One Liberty Properties, and Westwood Holdings Group  Emerging Consolidated Expectations, Analyst Ratings",GlobeNewswire
Mar-11-19,One Liberty Properties Announces Dividend,GlobeNewswire
Mar-18-19,One Liberty Properties: 4Q Earnings Snapshot,Associated Press
Mar-18-19,One Liberty Properties Reports Fourth Quarter and Full Year 2018 Results,GlobeNewswire
Apr-09-19,"Should You Invest In One Liberty Properties, Inc. (NYSE:OLP)?",Simply Wall St.
May-03-19,"Does One Liberty Properties, Inc. (NYSE:OLP) Have A Volatile Share Price?",Simply Wall St.
May-07-19,One Liberty Properties Reports First Quarter 2019 Results,GlobeNewswire
May-08-19,One Liberty Properties: 1Q Earnings Snapshot,Associated Press
