date,title,source
Oct-18-18,Edited Transcript of EWBC earnings conference call or presentation 18-Oct-18 3:30pm GMT,Thomson Reuters StreetEvents
Oct-18-18,East West Bancorp Inc (EWBC) Q3 2018 Earnings Conference Call Transcript,Motley Fool
Oct-18-18,"East West Bancorp, Inc. to Host Earnings Call",ACCESSWIRE
Oct-18-18,East West Bancorp (EWBC) Tops Q3 Earnings Estimates,Zacks
Oct-18-18,East West Bancorp: 3Q Earnings Snapshot,Associated Press
Oct-18-18,"East West Bancorp Reports Net Income for Third Quarter 2018 of $171 Million and Diluted Earnings Per Share of $1.17, Both Up By 29% Year-Over-Year",Business Wire
Oct-19-18,Edited Transcript of EWBC earnings conference call or presentation 18-Oct-18 3:30pm GMT,Thomson Reuters StreetEvents
Oct-19-18,East West Bancorp (EWBC) Stock Down Despite Q3 Earnings Beat,Zacks
Oct-23-18,Is East West Bancorp Inc (NASDAQ:EWBC) Potentially Undervalued?,Simply Wall St.
Oct-26-18,"Only 4 Days Left Before East West Bancorp Inc (NASDAQ:EWBC) Will Be Trading Ex-Dividend,",Simply Wall St.
Nov-07-18,Dallas bankers get in on the U.S. oil field waste water problem,American City Business Journals
Dec-04-18,What Caused Huge Outflows in Regional Bank ETFs in November,Zacks
Dec-11-18,"Is East West Bancorp, Inc. (EWBC) Going to Burn These Hedge Funds?",Insider Monkey
Dec-18-18,Should You Invest in the First Trust NASDAQ ABA Community Bank Index Fund (QABA)?,Zacks
Dec-19-18,East West Bancorp Announces Date for Fourth Quarter and Full Year 2018 Financial Results,Business Wire
Dec-27-18,Will East West Bancorp (EWBC) Beat Estimates Again in Its Next Earnings Report?,Zacks
Jan-09-19,Should You Invest in the First Trust NASDAQ ABA Community Bank Index Fund (QABA)?,Zacks
Jan-17-19,East West Bancorp (EWBC) Earnings Expected to Grow: Should You Buy?,Zacks
Jan-23-19,"Bank Stocks Q4 Earnings Slated on Jan 24: HBAN, SIVB &amp; More",Zacks
Jan-24-19,East West Bancorp Inc (EWBC) Q4 2018 Earnings Conference Call Transcript,Motley Fool
Jan-24-19,East West Bancorp (EWBC) Q4 Earnings and Revenues Surpass Estimates,Zacks
Jan-24-19,East West Bancorp: 4Q Earnings Snapshot,Associated Press
Jan-24-19,"East West Bancorp Reports Record Net Income for Full Year 2018 of $704 Million and Diluted Earnings Per Share of $4.81, Both up by 39% from the Prior Year",Business Wire
Jan-25-19,East West Bancorp (EWBC) Gains on Q4 Earnings &amp; Revenue Beat,Zacks
Jan-25-19,Edited Transcript of EWBC earnings conference call or presentation 24-Jan-19 4:30pm GMT,Thomson Reuters StreetEvents
Jan-29-19,East West Bank Aligns with CITCON to Offer Chinese Mobile Wallet Solutions,PR Newswire
Jan-31-19,Should You Invest in the First Trust NASDAQ ABA Community Bank Index Fund (QABA)?,Zacks
Feb-08-19,"Our Take On East West Bancorp, Inc.s (NASDAQ:EWBC) CEO Salary",Simply Wall St.
Mar-01-19,"East West Bancorp, Inc. (NASDAQ:EWBC): Are Analysts Bullish?",Simply Wall St.
Mar-12-19,Here's Why East West Bancorp (EWBC) Stock is a Solid Bet,Zacks
Mar-19-19,EWBC vs. FRC: Which Stock Should Value Investors Buy Now?,Zacks
Mar-21-19,Top Ranked Value Stocks to Buy for March 21st,Zacks
Mar-22-19,East West Bancorp Announces Date for First Quarter 2019 Financial Results,Business Wire
Mar-27-19,Should You Invest in the First Trust NASDAQ ABA Community Bank Index Fund (QABA)?,Zacks
Mar-28-19,Here's Why You Should Hold East West Bancorp (EWBC) Stock,Zacks
Apr-01-19,PINTEC Empowers East West Bank in its Digital Transformation,Business Wire
Apr-01-19,"Is East West Bancorp, Inc. (NASDAQ:EWBC) Potentially Undervalued?",Simply Wall St.
Apr-11-19,East West Bancorp (EWBC) Reports Next Week: Wall Street Expects Earnings Growth,Zacks
Apr-12-19,"First Republic's (FRC) Q1 Earnings Beat, Revenues Increase",Zacks
Apr-16-19,"Fee Income, Loan Growth to Aid Popular's (BPOP) Q1 Earnings",Zacks
Apr-16-19,CITCON Raises US$5 Million to Power Global Expansion of Mobile Payments,PR Newswire
Apr-18-19,East West Bancorp Inc (EWBC) Q1 2019 Earnings Call Transcript,Motley Fool
Apr-18-19,East West Bancorp (EWBC) Lags Q1 Earnings and Revenue Estimates,Zacks
Apr-18-19,East West Bancorp: 1Q Earnings Snapshot,Associated Press
Apr-18-19,"East West Bancorp Reports Net Income for First Quarter 2019 of $164 Million and Diluted Earnings Per Share of $1.12, Increases Quarterly Dividend by 20%",Business Wire
Apr-22-19,East West Bancorp (EWBC) Stock Down 4.1% on Q1 Earnings Miss,Zacks
Apr-22-19,Edited Transcript of EWBC earnings conference call or presentation 18-Apr-19 3:30pm GMT,Thomson Reuters StreetEvents
May-15-19,PG&E loses another philanthropy executive to banking,American City Business Journals
May-15-19,Does East West Bancorp's (NASDAQ:EWBC) Share Price Gain of 41% Match Its Business Performance?,Simply Wall St.
May-21-19,Higher Costs Hurt East West Bancorp (EWBC): Time to Sell?,Zacks
Jun-10-19,"Heres What Hedge Funds Think About East West Bancorp, Inc. (EWBC)",Insider Monkey
Jun-14-19,"Why Dividend Hunters Love East West Bancorp, Inc. (NASDAQ:EWBC)",Simply Wall St.
Jun-20-19,East West Bancorp Announces Date for Second Quarter 2019 Financial Results,Business Wire
