date,title,source
Oct-23-18,"Market Trends Toward New Normal in Syros Pharmaceuticals, Westlake Chemical Partners LP, SITO Mobile, ShotSpotter, Motorcar Parts of America, and Benefitfocus  Emerging Consolidated Expectations, Analyst Ratings",GlobeNewswire
Oct-25-18,"Syros to Report Third Quarter 2018 Financial Results on Thursday, November 1, 2018",Business Wire
Oct-30-18,Syros to Present Clinical and Preclinical Data on SY-1365 and Earlier-Stage Pipeline at EORTC-NCI-AACR Meeting,Business Wire
Nov-01-18,Edited Transcript of SYRS earnings conference call or presentation 1-Nov-18 11:30am GMT,Thomson Reuters StreetEvents
Nov-01-18,Syros to Present Initial Clinical Data from Combination Cohorts in Its Ongoing Phase 2 Trial of SY-1425 at ASH Annual Meeting,Business Wire
Nov-01-18,Syros Reports Third Quarter 2018 Financial Results and Highlights Key Accomplishments and Upcoming Milestones,Business Wire
Nov-06-18,Edited Transcript of SYRS earnings conference call or presentation 1-Nov-18 11:30am GMT,Thomson Reuters StreetEvents
Nov-07-18,Edited Transcript of SYRS earnings conference call or presentation 1-Nov-18 11:30am GMT,Thomson Reuters StreetEvents
Nov-09-18,Syros Announces Presentation of New Preclinical Data on SY-1365 in Treatment-Resistant HR-Positive Breast Cancer Cell Lines at San Antonio Breast Cancer Symposium,Business Wire
Nov-13-18,Syros Presents New Preclinical Combination Data on SY-1365 and First Preclinical Data from Oral CDK7 Inhibitor Program at EORTC-NCI-AACR Meeting,Business Wire
Nov-15-18,Syros Announces Dose Escalation Data from Phase 1 Trial of SY-1365 Demonstrating Proof-of-Mechanism at Tolerable Doses in Patients with Advanced Solid Tumors,Business Wire
Nov-20-18,Syros to Present at 30th Annual Piper Jaffray Healthcare Conference,Business Wire
Nov-30-18,"Market Trends Toward New Normal in Gartner, CONVERGEONE HLD, Syros Pharmaceuticals, Akers Biosciences, Edge Therapeutics, and Cracker Barrel Old Country Store  Emerging Consolidated Expectations, Analyst Ratings",GlobeNewswire
Dec-07-18,Syros Announces New Preclinical Data on SY-1365 at San Antonio Breast Cancer Symposium,Business Wire
Dec-21-18,Syros Added to NASDAQ Biotechnology Index,Business Wire
