date,title,source
Oct-18-18,"Recent Analysis Shows Lantheus, Editas Medicine, CorMedix, DXP Enterprises, Peabody Energy, and CommScope Holding Market Influences  Renewed Outlook, Key Drivers of Growth",GlobeNewswire
Oct-24-18,"Illinois Tool (ITW) Q3 Earnings Top Estimates, Revenues Miss",Zacks
Oct-29-18,DXP Sets Date for 2018 Third Quarter Results Release and Conference Call,Business Wire
Oct-30-18,"Xylem's (XYL) Q3 Earnings Meet, Revenues Miss Estimates",Zacks
Oct-30-18,A. O. Smith (AOS) Earnings & Revenues Miss Estimates in Q3,Zacks
Nov-05-18,DXP Enterprises Inc (DXPE) Q3 2018 Earnings Conference Call Transcript,Motley Fool
Nov-05-18,DXP Enterprises (DXPE) Tops Q3 Earnings and Revenue Estimates,Zacks
Nov-05-18,DXP Enterprises: 3Q Earnings Snapshot,Associated Press
Nov-05-18,DXP Enterprises Reports Third Quarter 2018 Results,Business Wire
Nov-06-18,Edited Transcript of DXPE earnings conference call or presentation 5-Nov-18 4:00pm GMT,Thomson Reuters StreetEvents
Nov-07-18,Edited Transcript of DXPE earnings conference call or presentation 5-Nov-18 4:00pm GMT,Thomson Reuters StreetEvents
Nov-09-18,"The Zacks Analyst Blog Highlights: DXP Enterprises, Bristol-Myers Squibb, EnPro Industries, Illumina and NetApp",Zacks
Nov-12-18,"Research Report Identifies DXP Enterprises, Diebold Nixdorf, Fitbit, Nevro, Plains All American Pipeline, and Cara Therapeutics with Renewed Outlook  Fundamental Analysis, Calculating Forward Movement",GlobeNewswire
Nov-13-18,Fortune Brands Arm Clinches Partnership Deal With Wolf Home,Zacks
Nov-16-18,Berry Global (BERY) in Focus: Stock Moves 9.6% Higher,Zacks
Nov-19-18,Here's Why You Should Buy Applied Industrial (AIT) Stock Now,Zacks
Nov-19-18,Manufacturing Output Rises for Fifth Straight Month: 5 Picks,Zacks
Nov-20-18,Xylem (XYL) Signs MoU to Improve Water Security in Ethiopia,Zacks
Nov-20-18,Colfax to Enter Medical Solutions Market With DJO Global Deal,Zacks
Nov-20-18,"The Zacks Analyst Blog Highlights: Atkore International Group, EnPro Industries, DXP Enterprises, Harsco and Ennis",Zacks
Nov-20-18,Here's Why You Must Hold on to Berry Global (BERY) Stock Now,Zacks
Nov-23-18,Here's Why It's Worth Investing in DXP Enterprises (DXPE) Now,Zacks
Nov-27-18,Tetra Tech Clinches $100M Architect-Engineer Deal from USACE,Zacks
Nov-27-18,"Actuant Gains From Solid Sales, Rising Cost Remains a Drag",Zacks
Nov-27-18,Graco to Benefit From Sturdy Project Activities & Buyouts,Zacks
Nov-28-18,Is DXP Enterprises Incs (NASDAQ:DXPE) ROE Of 10% Impressive?,Simply Wall St.
Nov-29-18,Kaman (KAMN) Wing Secures Dual Orders for K-MAX Helicopters,Zacks
Nov-30-18,"iRobot Gains From Solid Robotic Sales, Tariff Woes Ail",Zacks
Nov-30-18,RBC Bearings to Divest Avborne Accessory Business to AerSale,Zacks
Dec-03-18,Here's Why You Should Hold on to Illinois Tool Stock Now,Zacks
Dec-03-18,Sealed Air Stock Down 26% This Year: Will It Bounce Back?,Zacks
Dec-03-18,5 Best Stocks to Own This December,Zacks
