date,title,source
Oct-17-18,Accenture Positioned as Leader in Everest Group 2018 Finance and Accounting Digital Augmentation Suite Assessment,Business Wire
Oct-17-18,Efma and Accenture Announce Winners of Distribution & Marketing Innovation Awards 2018,Business Wire
Oct-17-18,"Fintech making inroads, but U.S. bank revenues little changed: report",Reuters
Oct-17-18,"Accenture Acquires TargetST8 Consulting, Enhancing Its Consulting and Advisory Capabilities in Commercial and Corporate Lending",Business Wire
Oct-17-18,"Fintech making inroads, but U.S. bank revenues little changed - report",Reuters
Oct-17-18,"Banks Revenue Growth at Risk Due to Unprecedented Competitive Pressure Resulting from Digital Disruption, Accenture Study Finds",Business Wire
Oct-18-18,"Accenture, Partnership Fund for New York City and Leading Financial Institutions Call for Applicants for New York FinTech Innovation Lab 2019",Business Wire
Oct-18-18,Accenture and ServiceNow Announce Greater Collaboration To Drive Innovation In Europe,Business Wire
Oct-19-18,Accenture Named a Leader In Services For Next-Generation Oracle Applications Report by Independent Research Firm,Business Wire
Oct-22-18,Accenture Enables Interoperability Between Major Blockchain Platforms,Business Wire
Oct-22-18,"New Report from Payments Canada, the Bank of Canada, TMX Group, Accenture and R3 Proves that Distributed Ledger Technology Can Enable Equity Settlement",CNW Group
Oct-22-18,Accenture and Oracle Unveil Integrated Technology and Services Platform for Utilities to Help Clients Enhance Customer Experience,Business Wire
Oct-22-18,Accenture Recognized with 11 Oracle Partner Awards at OpenWorld 2018 for Global Excellence and Performance,Business Wire
Oct-22-18,Accenture Positioned as a Leader in Gartner Magic Quadrants for Data Center Outsourcing & Hybrid Infrastructure Managed Services in North America and Europe,Business Wire
Oct-22-18,Accenture Integrates Oracle with Accenture myConcerto to Orchestrate Enterprise Transformation for Clients Using Advanced Oracle Technologies,Business Wire
Oct-22-18,"Accenture Agrees to Acquire Brazilian Content Marketing Agency, New Content",Business Wire
Oct-22-18,"Market Trends Toward New Normal in CryoPort, The J. M. Smucker, Accenture, Albemarle, The Allstate, and Huami  Emerging Consolidated Expectations, Analyst Ratings",GlobeNewswire
Oct-23-18,"High-Growth Companies Buck Trend of Declining Returns on Innovation, Accenture Report Finds",Business Wire
Oct-23-18,Accenture's The AI Effect Podcast Launches Season 2; Unites Artificial Intelligence Leaders to Discuss Challenges and Benefits of AI Adoption in Canada,CNW Group
Oct-24-18,"Accenture PLC (ACN) Files 10-K for the Fiscal Year Ended on August 31, 2018",GuruFocus.com
Oct-24-18,Accenture acquires DAZ to bolster its Oracle cloud computing services,American City Business Journals
Oct-25-18,Accenture's The AI Effect Podcast Launches Season 2; Unites Artificial Intelligence Leaders to Discuss Challenges and Benefits of AI Adoption in Canada,CNW Group
Oct-25-18,Efma and Accenture Announce Winners of Innovation in Insurance Awards - North America,Business Wire
Oct-25-18,Air Canada Plans To Use Blockchain For Travel Management,Market Exclusive
Oct-25-18,Accenture Survey Identifies Citizens Suggestions for Ways Governments Can Improve Services and Constituents Lives,Business Wire
Oct-29-18,Final Report from the Canada-U.S. Council for Advancement of Women Identifies Clear Opportunity to Accelerate the Advancement of Women by Closing the Gap Between Commitment and Action,CNW Group
Oct-29-18,What Are Analysts Saying About Accenture plcs (NYSE:ACN) Growth?,Simply Wall St.
Oct-29-18,Final Report from the Canada-U.S. Council for Advancement of Women Identifies Clear Opportunity to Accelerate the Advancement of Women by Closing the Gap Between Commitment and Action,Business Wire
Oct-29-18,"Companies Leading in Disability Inclusion Have Outperformed Peers, Accenture Research Finds",Business Wire
Oct-30-18,3 Big Tech Stocks to Short,InvestorPlace
Oct-30-18,"Half of Companies on the Accenture Competitive Agility Index Experienced a Major Drop in Trust, Losing Out on $180B in Potential Revenues",Business Wire
Oct-31-18,Accenture Rises 3%,Investing.com
Oct-31-18,8 Quality Stocks To Buy After 'Overdone' October Sell-Off,Investopedia
Oct-31-18,Blockchain's potential will continue to spur public and private investment,CNBC
Oct-31-18,"Citizen Comfort with AI Growing, Accenture Study Shows",Business Wire
Nov-01-18,Accenture (ACN) Gains But Lags Market: What You Should Know,Zacks
Nov-01-18,Accenture Names Jeffrey Russell President of Accenture in Canada,CNW Group
Nov-02-18,Accenture Interactive to Bolster Creative Capabilities by Acquiring Kolle Rebbe,Business Wire
Nov-05-18,"Accenture Acquires Intrigo Systems, Expands its Capabilities in Digital Supply Chains",Business Wire
Nov-05-18,"Accenture to Open New R&D Lab in Shenzhen, China, with a Focus on Artificial Intelligence, Robotics and Industry X.0",Business Wire
Nov-06-18,Accenture Research Shows CFOs Play a Growing Role in Digital Transformations at Financial Services Companies,Business Wire
Nov-06-18,"Most Electricity Distribution Utilities Are Optimistic and Expect Earnings to Grow Beyond 2025, According to Research from Accenture",Business Wire
Nov-07-18,DowDuPont Plastic Spinoff Vows Growth Despite Pollution Fear,Bloomberg
Nov-07-18,Do Customers Ever Truly Forgive Businesses That Betray Their Trust?,Motley Fool
Nov-07-18,Accenture Forms Strategic Alliance and Invests in Data Analytics Firm Quantexa,Business Wire
Nov-08-18,"ProCredEx Announces Launch of Partner Program with National Government Services, Spectrum Health System, WellCare, Accenture, and The Hardenbergh Group",PR Newswire
Nov-09-18,Accenture Named to 2019 List of Canada's Top Employers for Eighth Consecutive Year,CNW Group
Nov-12-18,Accenture Deploys New Software License Management Application on Digital Assets Distributed Ledger Platform,Business Wire
Nov-12-18,Accenture Interactive Acquires Swedish Customer Relationship Management Firm Kaplan,Business Wire
Nov-13-18,"Accenture Opens Innovation Hub in Seattle, Adding 300 Jobs to Citys Tech Community",Business Wire
Nov-13-18,"Accenture Completes Kaplan Buyout, Boosts Nordics Presence",Zacks
Nov-13-18,Calculating The Intrinsic Value Of Accenture plc (NYSE:ACN),Simply Wall St.
Nov-14-18,"Accenture (ACN) Opens Innovation Hub, Aims to Add 300 Jobs",Zacks
Nov-14-18,Accenture Life Insurance and Annuity Platform Wins Two XCelent Industry Awards,Business Wire
Nov-14-18,Accenture Helps Carlsberg Transition to the Cloud as Part of its Strategy to Accelerate Growth and Improve Margins,Business Wire
Nov-20-18,Mortgage Cadence Enhances Its Enterprise Lending Center Platform with Integration of Additional Capabilities from MGIC,Business Wire
Nov-23-18,Does Accenture plcs (NYSE:ACN) CEO Pay Reflect Performance?,Simply Wall St.
Nov-26-18,Accenture Named a Leader in IDC MarketScape Report on Oracle Worldwide Implementation Services Ecosystem,Business Wire
Nov-26-18,Accenture Expands Platform for Drug Discovery and Innovation with Creation of Life Sciences Partner Ecosystem,Business Wire
Nov-26-18,[$$] Asset managers under fire over costs and profits,Financial Times
Nov-27-18,Accenture Brings Open Partner Ecosystem for Drug Discovery,Zacks
Nov-27-18,Accenture Opens Canada Innovation Hub in Toronto to Help Clients Reimagine Their Businesses for the Digital Economy,CNW Group
Nov-27-18,"AI & Blockchain Accelerating Each Others Growth; Gopher Protocol, Inc. (OTCQB: GOPH), Accenture",GlobeNewswire
Nov-27-18,ETS Selects Accenture for Transformation on the Cloud to Help Drive Innovation,Business Wire
Nov-27-18,Accenture and Amazon Web Services Extend Enterprise Transformation Leadership with Expanded Services and Dedicated Resources Designed to Accelerate Innovation,Business Wire
Nov-28-18,"Accenture Opens Innovation Hub in Canada, 800 Jobs in Focus",Zacks
Nov-28-18,"Most Banks Plan to Offer Open Banking Services to Commercial Customers, with Many Expecting Double-Digit Revenue Growth as a Result, Accenture Research Finds",Business Wire
Nov-29-18,"The Zacks Analyst Blog Highlights: Johnson & Johnson, Thermo Fisher, Goldman Sachs, Oracle and Accenture",Zacks
Nov-30-18,"Russian hackers use Brexit in phishing email, experts warn",Associated Press
Nov-30-18,Accenture Interactive Completes Acquisition of Kolle Rebbe,Business Wire
Nov-30-18,"Analysis: Positioning to Benefit within Dicerna Pharmaceuticals, Sun Life Financial, Autodesk, Eagle Pharmaceuticals, Curis, and Accenture  Research Highlights Growth, Revenue, and Consolidated Results",GlobeNewswire
Dec-03-18,Accenture acquires Houston consulting firm serving energy and airline industry cos.,American City Business Journals
Dec-03-18,"Accenture Acquires Enaxis Consulting, a Provider of Digital Transformation Services to Oil and Gas and Airline Companies",Business Wire
Dec-03-18,III or ACN: Which Is the Better Value Stock Right Now?,Zacks
Dec-03-18,Accenture Names 762 New Managing Directors and Senior Managing Directors,Business Wire
Dec-03-18,"Accenture Completes Kolle Rebbe Buyout, Focuses on Germany",Zacks
Dec-03-18,"Accenture Expands Coding Tutorial to 15 Languages for Hour of Code 2018, Providing More Opportunities for Students Around the World to Learn to Code",Business Wire
Dec-03-18,Efma and Accenture Launch 4th Annual Innovation in Insurance Awards,Business Wire
Dec-04-18,"Accenture Interactive Completes Acquisition of New Content, a Brazilian Marketing Agency",Business Wire
Dec-04-18,"Future Systems: Tomorrows Intelligent Enterprise Will be Built on Interconnected Systems of Technologies, Applications and People, Finds New Accenture Report",Business Wire
Dec-06-18,Accenture Falls 3%,Investing.com
Dec-06-18,This Firm Thrives By Hiring Top Tech Talent In Eastern Europe,Investor's Business Daily
Dec-06-18,"Attention, Corporate America: Consumers Care About Your Values",Barrons.com
Dec-06-18,3 Things Zebra Technologies' CEO Wants You to Know,Motley Fool
Dec-06-18,Mortgage Cadence Enhances Enterprise Lending Center Through Integration with Radian Mortgage Insurance,Business Wire
Dec-06-18,"Most Traditional Energy Retail Utilities Lag Disruptor Brands in Delivering Customer Experience, Accenture Research Finds",Business Wire
Dec-10-18,"Accenture Acquires PrimeQ, Further Strengthening its Digital Transformation Capabilities on Oracle Cloud",Business Wire
Dec-10-18,Should You Buy Accenture Plc (ACN)?,Insider Monkey
Dec-10-18,Why the Earnings Surprise Streak Could Continue for Accenture (ACN),Zacks
Dec-10-18,Here's Why You Should Hold WEX Stock in Your Portfolio Now,Zacks
Dec-10-18,Adobe Systems (ADBE) to Report Q4 Earnings: What's in Store?,Zacks
Dec-11-18,It's getting easier for shoppers to skip the line by buying online and picking up in store,CNBC
Dec-11-18,Will Top-Line Growth Support Ciena's (CIEN) Q4 Earnings?,Zacks
Dec-11-18,Interpublic (IPG) Stock Up 13.6% Year to Date: Here's Why,Zacks
Dec-11-18,"Evolving Attitudes Toward Digital and Brands Will Fuel the Next Creative Revolution, Finds New Report from Accenture Interactive",CNW Group
Dec-11-18,Waste Connections (WCN) Acquires American Disposal Services,Zacks
Dec-12-18,Oracle (ORCL) to Report Q2 Earnings: What's in the Offing?,Zacks
Dec-12-18,[$$] Accenture Interactive to Acquire Ad-Tech Firm Adaptly,The Wall Street Journal
Dec-12-18,Accenture to Acquire Adaptly to Bolster Accenture Interactive Programmatic Services Offering,Business Wire
Dec-12-18,Accenture to Form Strategic Alliance with and Acquire Select Professional Services Assets from Financial Software Firm Zafin,CNW Group
Dec-12-18,Accenture Opens Innovation Hub in Atlantas Technology Square,Business Wire
Dec-12-18,Accenture to Form Strategic Alliance with and Acquire Select Professional Services Assets from Financial Software Firm Zafin,Business Wire
Dec-13-18,Red Hat (RHT) Set to Report Q3 Earnings: What's in Store?,Zacks
Dec-13-18,Accenture (ACN) Earnings Expected to Grow: What to Know Ahead of Next Week's Release,Zacks
Dec-13-18,Accenture (ACN) Boosts Interactive Suite With Adaptly Buyout,Zacks
Dec-13-18,Accenture Opens 11th North America Innovation Hub in Atlanta,Zacks
Dec-13-18,Accenture Named a Leader in Digital Process Automation by Independent Research Firm,Business Wire
Dec-14-18,Accenture Falls 3%,Investing.com
Dec-17-18,Will Revenue Growth Aid Paychex's (PAYX) Earnings in Q2?,Zacks
Dec-17-18,Is a Beat in the Cards for Accenture (ACN) in Q1 Earnings?,Zacks
Dec-17-18,New Report from Accenture Finds Gaps Between Federal Agencies IT Adoption and Mission Objectives,Business Wire
Dec-19-18,III vs. ACN: Which Stock Is the Better Value Option?,Zacks
Dec-20-18,"Cramer feels 'powerless' after Fed hike, tells investors to buy gold",CNBC
Dec-20-18,Accenture to Acquire Knowledgent to Amplify Capabilities that Help Businesses Transform into Data-Powered Intelligent Enterprises,Business Wire
Dec-20-18,"Accenture Stock Falls As Earnings Top Views, Revenue Outlook Light",Investor's Business Daily
Dec-20-18,Accenture plc (ACN) Q1 2019 Earnings Conference Call Transcript,Motley Fool
Dec-20-18,"Accenture revenue forecast falls short, shares slip",Reuters
Dec-20-18,"Accenture revenue forecast falls short, shares slip",Reuters
Dec-20-18,"US STOCKS-Wall St drops as Fed, weak earnings fan growth worries",Reuters
Dec-20-18,Accenture Falls 5%,Investing.com
Dec-20-18,US STOCKS-Weak earnings add to Wall Street's Fed-triggered slide,Reuters
Dec-20-18,Dow Continues Post-Fed Sell-Off; This Blue Chip Stock Has Earnings Due,Investor's Business Daily
Dec-20-18,Accenture Chosen by Bombardier to Help Streamline Procurement Processes and Reduce Costs for Indirect Goods and Services,CNW Group
Dec-20-18,US STOCKS-Futures shed gains to trade lower on Fed disappointment,Reuters
Dec-20-18,"Accenture Earnings, Revenue beat in Q1",Investing.com
Dec-20-18,Accenture (ACN) Surpasses Q1 Earnings and Revenue Estimates,Zacks
Dec-20-18,"Stocks making the biggest moves premarket: WBA, BB, MO, ACN & more",CNBC
Dec-20-18,Accenture: Fiscal 1Q Earnings Snapshot,Associated Press
Dec-20-18,Accenture quarterly revenue rises 7.4 pct,Reuters
Dec-20-18,Accenture Reports Strong First-Quarter Fiscal 2019 Results,Business Wire
Dec-21-18,Four Finalists in US and Canada Selected for Accenture HealthTech Innovation Challenge,Business Wire
Dec-21-18,Accenture (ACN) Signs Agreement for Knowledgent Takeover,Zacks
Dec-21-18,Accenture Recognized as Product and Platform Engineering Leader by Zinnov for Third Consecutive Year,Business Wire
Dec-24-18,"Company News For Dec 24, 2018",Zacks
Dec-24-18,Workiva's Wdesk to Enhance Broadridge's Reporting Methods,Zacks
Dec-24-18,Are Accenture plc (NYSE:ACN) Shareholders Getting A Good Deal?,Simply Wall St.
Dec-26-18,Accenture Plc (ACN) Chairman & CEO Pierre Nanterme Sold $5.1 million of Shares,GuruFocus.com
Dec-26-18,Accenture Rises 3%,Investing.com
Dec-27-18,Accenture Falls 3%,Investing.com
Dec-28-18,"Insiders Roundup: Accenture, Apollo",GuruFocus.com
Dec-28-18,Bi-Partisan Bets on an Infrastructure Plan,MoneyShow
Jan-03-19,Accenture Falls 3%,Investing.com
Jan-04-19,Accenture Rises 3%,Investing.com
Jan-07-19,Will Oracle and Accenture Help Secoo Stay Relevant?,Motley Fool
Jan-08-19,"Molex, Accenture and Amazon Web Services Co-Develop Edge Computing Solution Powering NextGen Autonomous Vehicles",Business Wire
Jan-08-19,Ayasdi Named Accenture HealthTech Innovation Challenge Innovation Champion,Business Wire
Jan-08-19,"Smart Speaker Usage Booming Worldwide, Accenture Study Finds",Business Wire
Jan-09-19,"Accenture to Acquire Orbium, a Business and Technology Consultancy to the Financial Services Industry",Business Wire
Jan-10-19,"Accenture Rides on Buyouts & Cloud, Pricing Pressure Rife",Zacks
Jan-10-19,Accenture Boosts Financial Services With Orbium Buyout,Zacks
Jan-10-19,Accenture Collaborates with KPN to Demonstrate the Value of 5G-Enabled Industrial Applications,Business Wire
Jan-11-19,Accenture and KPN Collaborate on Industrial 5G Applications,Zacks
Jan-11-19,Accenture CEO Pierre Nanterme Steps Down for Health Reasons,TheStreet.com
Jan-11-19,Accenture CEO steps down due to health reasons,Reuters
Jan-11-19,Accenture CEO steps down due to health reasons,Reuters
Jan-11-19,Accenture CEO to step down after 8 years in the role for health reasons,MarketWatch
Jan-11-19,Accenture Chairman & CEO Pierre Nanterme Steps Down for Health Reasons; David Rowland Appointed Interim Chief Executive Officer; Marge Magner Named Non-Executive Chair,Business Wire
Jan-11-19,[$$] Accenture CEO steps down for health reasons,Financial Times
Jan-14-19,Edited Transcript of ACN earnings conference call or presentation 20-Dec-18 1:00pm GMT,Thomson Reuters StreetEvents
Jan-14-19,"Accenture Chairman &amp; CEO Resigns, Company Names Interim CEO",Zacks
Jan-14-19,Accenture Positioned as Leader in Everest Group PEAK Matrix Assessment for Blockchain Services,Business Wire
Jan-15-19,CAQH Develops the First Provider Data Management Solution for Delegated Groups with Support from Accenture,Business Wire
Jan-15-19,Salesforce Updates Commerce Cloud to Uplift Client Experience,Zacks
Jan-16-19,Morgan Stanleys Best Services Idea: Accenture Stock,Barrons.com
Jan-17-19,"Cybercrime Could Cost Companies US$5.2 Trillion Over Next Five Years, According to New Research from Accenture",Business Wire
Jan-22-19,Inside the final quarter of construction at the Warriors' new Chase Center,American City Business Journals
Jan-22-19,Accenture Named a Leader in Everest Group PEAK Matrix Report for IoT Services,Business Wire
Jan-23-19,The next big job negotiation to master: Company use of your personal data,CNBC
Jan-23-19,Accenture Positioned as a Leader and Star Performer in Everest Group Cloud Enablement Services Market Assessment 2019,Business Wire
Jan-24-19,"Traditional Energy Providers Leaving Value on the Table by Not Fully Serving Small and Medium-Sized Businesses, Research from Accenture Shows",Business Wire
Jan-24-19,Accenture Federal Services Wins Contract to Modernize U.S. Air Forces Personnel System,Business Wire
Jan-25-19,"U.S. bank trade group, Accenture and others back fintech startup Finxact",Reuters
Jan-25-19,"U.S. bank trade group, Accenture and others back fintech startup Finxact",Reuters
Jan-28-19,Jax fintech lands $30 million to take disruptor to market,American City Business Journals
Jan-28-19,"Majority of Canadian consumers buying from companies that take a stand on issues they care about and ditching those that don't, Accenture study finds",CNW Group
Jan-29-19,"Accenture to Sell Software That Helped It Cut 40,000 Jobs",Bloomberg
Jan-29-19,"Accenture Launches SynOps, a Human-Machine Operating Engine Designed to Help Enterprises Achieve Sustainable Competitive Advantage",Business Wire
Jan-29-19,Accenture Joins Forces with MIT Professional Education to Reinvent Their Quality Engineering Workforce,Business Wire
Jan-30-19,"Accenture Debuts Platform That Automated 40,000 Roles",Bloomberg
Jan-30-19,Accenture Integrates RGAs Underwriting Rules Engine into the Accenture Life Insurance and Annuity Platform,Business Wire
Jan-31-19,Workday Stock Jumps As Analyst Says Accenture Contract Will Drive Sales,Investor's Business Daily
Jan-31-19,Accenture's former CEO Nanterme dies,Reuters
Jan-31-19,Accenture's former CEO Nanterme dies,Reuters
Jan-31-19,Accenture's former CEO Nanterme dies,Reuters
Jan-31-19,Accenture Announces Passing of Former Chairman and CEO Pierre Nanterme,Business Wire
Jan-31-19,12 Stocks to Ride the Defense Spending Boom,Investopedia
Feb-01-19,12 Stocks to Ride the Defense Spending Boom,Investopedia
Feb-01-19,"[$$] Pierre Nanterme, business executive, 1959-2019",Financial Times
Feb-04-19,New Accenture Microsoft Business Group Will Empower Enterprises to Thrive in the Era of Digital Disruption,Business Wire
Feb-04-19,Could Accenture plcs (NYSE:ACN) Investor Composition Influence The Stock Price?,Simply Wall St.
Feb-04-19,A Texas company is acquiring MicroPact for $185M,American City Business Journals
Feb-05-19,"Most Utilities Executives Agree Risk of Consumers Going Largely Off-Grid Will Increase Significantly in Next Two Years, According to Research from Accenture",Business Wire
Feb-05-19,Accenture to Launch Applied Intelligence Studio in South Africa for Mining,Business Wire
Feb-06-19,Accenture unveils new Salesforce Tower innovation hub,American City Business Journals
Feb-06-19,Accenture Opens Flagship Innovation Hub in San Francisco,Business Wire
Feb-06-19,[$$] Pierre Nanterme Pushed Accenture to Rethink Its Mission in Consulting,The Wall Street Journal
Feb-06-19,Publicis lifts full-year profits despite sluggish sales,Reuters
Feb-06-19,"Accenture to Improve Mining Skills, Focus on South Africa",Zacks
Feb-07-19,Accenture Completes Acquisition of Select Professional Services Workforce from Financial Software Firm Zafin,Business Wire
Feb-07-19,"Emerging Post-Digital World Provides New Opportunities for Businesses to Deliver Personalized Realities and Experiences, According to Accenture Technology Vision 2019",Business Wire
Feb-12-19,"Millennial and Gen Z Consumers Paving the Way for Non-Traditional Care Models, Accenture Study Finds",Business Wire
Feb-13-19,Accenture Names Athina Kanioura as Chief Analytics Officer and Global Lead of Accenture Applied Intelligence,Business Wire
Feb-14-19,Immigration spending pact has more than a border wall,Associated Press
Feb-15-19,Here's what one global tech firm is keeping an eye on in 2019,American City Business Journals
Feb-15-19,Expedia Winning at Mobile in Southeast Asia: New Study,Skift
Feb-15-19,"[$$] Cyber Daily: Carmakers Cope with New Cyber Threats; CISOs Overstressed, Study Says",The Wall Street Journal
Feb-15-19,[$$] Dyson sweeps 100 back office jobs out of the UK,Financial Times
Feb-19-19,"Over Half of Government Workforce Welcome Intelligent Technologies, but want more Technical Support and User Training, According to a Study by Government Business Council and Accenture",Business Wire
Feb-19-19,"Facebook moderators pen internal memo protesting Big Brother surveillance, working conditions",American City Business Journals
Feb-19-19,Need To Know: Accenture plc (NYSE:ACN) Insiders Have Been Selling Shares,Simply Wall St.
Feb-20-19,Accenture Partners with and Invests in Splice Machine to Help Bring Operational Artificial Intelligence to Critical Business Applications,Business Wire
Feb-21-19,The Wendy's Co (WEN) Q4 2018 Earnings Conference Call Transcript,Motley Fool
Feb-21-19,"Detailed Research: Economic Perspectives on The J. M. Smucker, West Pharmaceutical Services, Franklin Electric Co., Accenture, LiveXLive Media, and Otter Tail  What Drives Growth in Today's Competitive Landscape",GlobeNewswire
Feb-21-19,How Cybersecurity Experts are Leading Companies into a New Era of Security,GlobeNewswire
Feb-25-19,Facebook Grappling With Employee Anger Over Moderator Conditions,Bloomberg
Feb-25-19,Accenture Launches Liquid Studio in Argentina to Help Clients Accelerate Digital Transformation,Business Wire
Feb-25-19,"Accenture Collaborates with Mastercard, Amazon Web Services, Everledger, and Mercy Corps to Increase the Sustainability and Fairness of Global Supply Chains",Business Wire
Feb-25-19,"Business and Technology Executives Underestimate the Disruptive Prospects of 5G Technology, Accenture Study Finds",Business Wire
Feb-26-19,Accenture Completes First Cloud-Based Implementation of Its Life Insurance & Annuity Platform,Business Wire
Feb-26-19,Accenture and nCino Expand Alliance Scope to Help Financial Institutions in Asia-Pacific and EMEA Accelerate Their Digital Transformations,Business Wire
Feb-26-19,Accenture Wins GLOMO Award for Virtual Reality Mobile Application,Business Wire
Feb-26-19,Accenture Launches Applied Intelligence Platform to Help Clients Use Artificial Intelligence without Need for Deep Data Science Expertise,Business Wire
Feb-28-19,Houston digital payment co. closes $20M after Accenture investment,American City Business Journals
Feb-28-19,Accenture Forms Alliance with and Invests in P97 Networks Inc.,Business Wire
Feb-28-19,Accenture to add 500 jobs in SA as EDF scores another win,American City Business Journals
Feb-28-19,AI Tech Increasingly Leveraged in the Oil & Gas Industry,GlobeNewswire
Mar-01-19,"Investor Expectations to Drive Momentum within NextEra Energy, Equifax, Accenture, STORE Capital, SMART Global, and Cavco Industries  Discovering Underlying Factors of Influence",GlobeNewswire
Mar-04-19,EU antitrust boss studying car repairs market but no investigation,Reuters
Mar-04-19,"Accenture Acquires UK-Based Innovation Firm ?What If!, Enhancing Ability to Help Clients Reinvent Themselves with Experimentation-Led Approach",Business Wire
Mar-04-19,Accenture Interactive Operations Expands Leadership Team with Addition of Two Seasoned Industry Executives,Business Wire
Mar-05-19,Accenture to Acquire ESP to Help Life Sciences Clients Digitize and Transform Manufacturing Operations,Business Wire
Mar-05-19,Accenture Interactive to Strengthen Creative Capabilities by Acquiring Hjaltelin Stahl,Business Wire
Mar-06-19,EU antitrust boss studying car repairs market but no investigation,Reuters
Mar-06-19,(OFFICIAL)-EU antitrust boss studying car repairs market but no investigation,Reuters
Mar-06-19,Corrected: EU antitrust boss studying car repairs market but no investigation,Reuters
Mar-06-19,Accenture Appoints Piyush Bhatnagar Office Managing Director for Toronto,CNW Group
Mar-06-19,Accenture Announces Acquisition of Life Sciences Company ESP,Zacks
Mar-06-19,"Malware and Malicious Insiders Accounted for One-Third of All Cybercrime Costs Last Year, According to Report from Accenture and Ponemon Institute",Business Wire
