date,title,source
Mar-06-19,"New Research: Key Drivers of Growth for Energy Transfer LP, Domo, Accenture, Chevron, Cincinnati Financial, and Dicerna Pharmaceuticals  Factors of Influence, Major Initiatives and Sustained Production",GlobeNewswire
Mar-06-19,Heres What Accenture plcs (NYSE:ACN) ROCE Can Tell Us,Simply Wall St.
Mar-06-19,Accenture Helps Anheuser-Busch InBev Better Target Promotion Spend in Europe with Implementation of Cloud-Based Accenture Trade Promotion Management Solution,Business Wire
Mar-07-19,"Accenture Security Introduces Identity Management Capability Powered by Artificial Intelligence to Transform the Way User Access Privileges Are Managed, Monitored and Controlled",Business Wire
Mar-07-19,"Accenture Ranked #1 in Microsoft Artificial Intelligence Services, According to HFS Research",Business Wire
Mar-07-19,"Culture of Equality Is Powerful Multiplier of Workplace Innovation, New Accenture Research Finds",Business Wire
