date,title,source
Oct-17-18,ABM to Reduce Energy and Operating Costs of the Schools of Guntersville by More Than $9.3 Million,GlobeNewswire
Oct-23-18,ABM Grows International Business with New Ryanair Contract,GlobeNewswire
Oct-24-18,ABM Names LeighAnne Baker to its Board of Directors,GlobeNewswire
Oct-25-18,Is ABM Industries Incorporateds (NYSE:ABM) ROE Of 5.8% Concerning?,Simply Wall St.
Oct-26-18,ABM Expands Line of Service,GlobeNewswire
Nov-02-18,"Report: Exploring Fundamental Drivers Behind Pfizer, eBay, ABM Industries, Quad Graphics, FireEye, and BJ's Restaurants  New Horizons, Emerging Trends, and Upcoming Developments",GlobeNewswire
Nov-07-18,"Genpact (G) Q3 Earnings Surpass Estimates, Revenues Miss",Zacks
Nov-20-18,"Before Investing In ABM Industries Incorporated (NYSE:ABM), Consider This",Simply Wall St.
Nov-23-18,Here's Why You Should Retain ABM Industries in Your Portfolio,Zacks
Nov-28-18,Atlanta aviation services firm to eliminate 100+ positions at OIA,American City Business Journals
Dec-07-18,ABM Industries to Announce Fourth Quarter and Full Year 2018 Financial Results,GlobeNewswire
Dec-11-18,ABM Industries (ABM) Earnings Expected to Grow: Should You Buy?,Zacks
Dec-17-18,ABM Industries Names New Treasurer,GlobeNewswire
Dec-18-18,ABM Industries (ABM) Q4 Earnings and Revenues Beat Estimates,Zacks
Dec-18-18,ABM Industries: Fiscal 4Q Earnings Snapshot,Associated Press
Dec-18-18,ABM Industries Announces Fourth Quarter and Full Year 2018 Financial Results,GlobeNewswire
Dec-19-18,Should We Worry About ABM Industries Incorporateds (NYSE:ABM) P/E Ratio?,Simply Wall St.
Dec-19-18,ABM Industries Surges After Earnings Beat Forecasts,TheStreet.com
Dec-19-18,Why ABM Industries Stock Popped 17%,Motley Fool
Dec-19-18,ABM Industries (ABM) Beats Q4 Earnings & Revenue Estimates,Zacks
Dec-20-18,ABM CEO: Efficiency is the key to success in current labo...,CNBC Videos
Dec-20-18,Edited Transcript of ABM earnings conference call or presentation 19-Dec-18 1:30pm GMT,Thomson Reuters StreetEvents
Dec-21-18,"ABM Industries Inc (ABM) Files 10-K for the Fiscal Year Ended on October 31, 2018",GuruFocus.com
Dec-24-18,ABMs Dividend Increase Wont Keep it Above $30,InvestorPlace
Dec-28-18,ABM Industries Rides on Strategic Buyouts Amid High Costs,Zacks
Jan-03-19,West Mifflin Area School District Projected to Save $9.9 Million through ABMs Energy Performance Contracting Program,GlobeNewswire
Jan-07-19,Are ABM Industries Incorporateds (NYSE:ABM) Interest Costs Too High?,Simply Wall St.
Jan-10-19,ABM Healthcare Achieves ISSA Cleaning Industry Management Standard and Green Building Certifications with Honors,GlobeNewswire
Jan-15-19,ABM Partners with Georgias 9th Largest School System to Provide Custodial Service,GlobeNewswire
Jan-17-19,ABM Industries (ABM) to Offer Custodial Services to CCSD,Zacks
Jan-17-19,Why Is ABM Industries (ABM) Up 13.6% Since Last Earnings Report?,Zacks
Jan-24-19,Rainbow Municipal Water District to Recoup Estimated $10 Million with ABMs Water Meter Replacement Project,GlobeNewswire
Jan-24-19,ABM Industries Incorporated (NYSE:ABM) Insiders Have Been Selling,Simply Wall St.
Jan-31-19,"ABMs Energy Performance Contracting Program Projected to Save Turner County, Georgia, More Than $7.2 Million",GlobeNewswire
Feb-06-19,City of Virginia Beach Partners with ABM to Support Launch and Maintenance of a Crucial Community Resource,GlobeNewswire
Feb-08-19,"Recent Analysis Shows Amerco, McKesson, Ophthotech, IQVIA, Highwoods Properties, and ABM Industries Market Influences  Renewed Outlook, Key Drivers of Growth",GlobeNewswire
Feb-11-19,Heres why ABM Industries Incorporateds (NYSE:ABM) Returns On Capital Matters So Much,Simply Wall St.
Feb-19-19,ABM Industries Named By Best in Biz Awards,GlobeNewswire
Feb-19-19,5 Stocks in Limelight Due to Recent Broker Rating Upgrades,Zacks
Feb-19-19,"1,121 cabin cleaning, janitorial workers getting laid off at Atlanta airport",American City Business Journals
Feb-20-19,"Zacks.com featured highlights include: Abercrombie, Bloomin', DICK'S, ABM and Avnet",Zacks
Feb-21-19,ABM Industries to Announce First Quarter 2019 Financial Results,GlobeNewswire
Feb-28-19,Edited Transcript of ABM earnings conference call or presentation 19-Dec-18 1:30pm GMT,Thomson Reuters StreetEvents
Mar-01-19,Want To Invest In ABM Industries Incorporated (NYSE:ABM)? Heres How It Performed Lately,Simply Wall St.
Mar-04-19,Edited Transcript of ABM earnings conference call or presentation 19-Dec-18 1:30pm GMT,Thomson Reuters StreetEvents
Mar-06-19,ABM Industries Announces Results for First Quarter Fiscal 2019,GlobeNewswire
Mar-06-19,5 Stocks in Focus Following Broker Rating Upgrades,Zacks
Mar-07-19,ABM Industries (ABM) Q1 2019 Earnings Conference Call Transcript,Motley Fool
Mar-07-19,"Zacks.com featured highlights include: ABM, Atlas Air, Diebold Nixdorf, C&amp;J and Arrow",Zacks
Mar-07-19,"ABM Industries (ABM) Q1 Earnings Beat, Revenues Rise Y/Y",Zacks
Mar-11-19,Edited Transcript of ABM earnings conference call or presentation 7-Mar-19 1:30pm GMT,Thomson Reuters StreetEvents
Mar-13-19,"ABM Rides on Vision 2020 and GCA Buyout, Suffers Debt Woes",Zacks
Mar-19-19,ROL or ABM: Which is a Better Building Maintenance Stock?,Zacks
Mar-19-19,ABM and AEG Renew Partnership at Landmark Southern California Venues,GlobeNewswire
Mar-21-19,El Paso Independent School District Projected to Save $14.8 Million through ABMs Energy Performance Contracting Program,GlobeNewswire
Mar-21-19,ABM Industries Extends Janitorial Services Alliance With AEG,Zacks
Mar-21-19,Edited Transcript of ABM earnings conference call or presentation 7-Mar-19 1:30pm GMT,Thomson Reuters StreetEvents
Mar-28-19,ABM Grows Wisconsin Footprint; Signs Sheboygan Area School District,GlobeNewswire
Apr-05-19,ABM Industries (ABM) Up 9.7% Since Last Earnings Report: Can It Continue?,Zacks
Apr-17-19,ABM Introduces Plane Fueling Services; Now Serving Spirit Airlines at IAH,GlobeNewswire
Apr-26-19,ABM CEO Scott Salmirs Wins Business Achievement Award from Beta Gamma Sigma,GlobeNewswire
Apr-26-19,ABM Industries Incorporated Provides Notice of Data Privacy Incident,GlobeNewswire
Apr-29-19,Emerald Aire Inc. joins ABMs Linc Service franchise network,GlobeNewswire
Apr-30-19,"Heres What Hedge Funds Think About ABM Industries, Inc. (ABM)",Insider Monkey
May-02-19,"ABMs Energy Performance Contracting Program Projected to Save Bryan County, Georgia, More Than $16.4 Million",GlobeNewswire
May-06-19,Calculating The Fair Value Of ABM Industries Incorporated (NYSE:ABM),Simply Wall St.
May-23-19,ABM Industries to Announce Second Quarter 2019 Financial Results,GlobeNewswire
May-29-19,Earnings Preview: ABM Industries (ABM) Q2 Earnings Expected to Decline,Zacks
May-30-19,Here's Why You Should Hold on to ABM Industries (ABM) Stock,Zacks
May-30-19,ABM Industries Incorporated (NYSE:ABM): Time For A Financial Health Check,Simply Wall St.
May-30-19,"ABM Industries to Participate in Bairds 2019 Global Consumer, Technology & Services Conference on June 6th",GlobeNewswire
Jun-03-19,ABM Industries (ABM) to Report Q2 Earnings: What's in Store?,Zacks
