date,title,source
Oct-22-18,Hexcel (HXL) Q3 Earnings Match Estimates,Zacks
Oct-22-18,Hexcel: 3Q Earnings Snapshot,Associated Press
Oct-22-18,Hexcel Declares Quarterly Dividend,GlobeNewswire
Oct-22-18,Hexcel Reports 2018 Third Quarter Results,GlobeNewswire
Oct-22-18,Hexcel Declares Quarterly Dividend,GlobeNewswire
Oct-22-18,Hexcel Reports 2018 Third Quarter Results,GlobeNewswire
Oct-22-18,"This market cycle will end like all other cycles, but we'...",CNBC Videos
Oct-22-18,Does Hexcel Corporations (NYSE:HXL) Past Performance Indicate A Stronger Future?,Simply Wall St.
Oct-23-18,"Hexcel (HXL) Q3 Earnings Match Estimates, Revenues Miss",Zacks
Oct-25-18,CW or HXL: Which Is the Better Value Stock Right Now?,Zacks
Oct-31-18,"Investor Expectations to Drive Momentum within Flex, Shaw Communications, Teck Resources, Dycom Industries, Hexcel, and Campbell Soup  Discovering Underlying Factors of Influence",GlobeNewswire
Nov-01-18,Hexcel to Participate in the Baird Global Industrial Conference,GlobeNewswire
Nov-21-18,Hexcel (HXL) Down 3.8% Since Last Earnings Report: Can It Rebound?,Zacks
Nov-29-18,Why Hexcel Corporations (NYSE:HXL) CEO Pay Matters To You,Simply Wall St.
Nov-30-18,Hexcel to Acquire ARC Technologies,GlobeNewswire
Dec-03-18,"Hexcel Hires Colleen Pritchett as President  Aerospace, Americas",Business Wire
Dec-03-18,Read This Before You Buy Hexcel Corporation (NYSE:HXL) Because Of Its P/E Ratio,Simply Wall St.
Dec-06-18,CW vs. HXL: Which Stock Should Value Investors Buy Now?,Zacks
Dec-12-18,3 Undervalued-Predictable Aerospace Companies to Consider as Trade Talks Materialize,GuruFocus.com
Dec-12-18,Hexcel Corporation (HXL) Hedge Funds Are Snapping Up,Insider Monkey
