date,title,source
Oct-22-18,VCTR or OAK: Which Is the Better Value Stock Right Now?,Zacks
Oct-23-18,"Victory Capital to Announce Third Quarter 2018 Results on November 6, 2018",GlobeNewswire
Nov-05-18,What to Expect From Victory Capital (VCTR) in Q3 Earnings?,Zacks
Nov-06-18,USAA to sell investment arm for $850M,American City Business Journals
Nov-06-18,Victory Capital to Acquire USAA Asset Management Company,GlobeNewswire
Nov-06-18,Victory Capital Announces Acquisition of USAA Asset Management Company and Reports Third Quarter Results,GlobeNewswire
