date,title,source
Oct-22-18,Is Urban Outfitters (URBN) Stock Undervalued Right Now?,Zacks
Oct-23-18,"The Zacks Analyst Blog Highlights: Target, Burlington, Dollar General, Tilly's and Urban Outfitters",Zacks
Oct-24-18,Urban Outfitters (URBN) Gains As Market Dips: What You Should Know,Zacks
Oct-25-18,"Research Report Identifies CSG Systems International, Zumiez, Urban Outfitters, Mirati Therapeutics, Applied Materials, and Xencor with Renewed Outlook  Fundamental Analysis, Calculating Forward Movement",GlobeNewswire
Oct-31-18,Urban Outfitters (URBN) Stock Sinks As Market Gains: What You Should Know,Zacks
