date,title,source
Oct-17-18,"Asian shares climb on strong US corporate earnings, data",Associated Press
Oct-17-18,"UnitedHealth Has Made a Long Rise, but an EKG of the Indicators Gives Us Pause",TheStreet.com
Oct-17-18,Today's Research Reports on Trending Tickers: UnitedHealth and Centene,ACCESSWIRE
Oct-17-18,"Asian shares climb on strong US corporate earnings, data",Associated Press
Oct-18-18,This Market Needs More Fear: Cramer's 'Mad Money' Recap (Thursday 10/18/18),TheStreet.com
Oct-18-18,Can UnitedHealth Group and Johnson & Johnson Continue Their Winning Ways?,Motley Fool
Oct-18-18,Cramer: Use the sell-off to start 'nibbling' at stocks of...,CNBC Videos
Oct-18-18,Use sell-off to 'nibble' at stocks of high-quality compan...,CNBC Videos
Oct-18-18,Cramer: Use the sell-off to start 'nibbling' at stocks of high-quality companies like Citigroup,CNBC
Oct-18-18,Dow stocks Pfizer and UnitedHealth could be safety plays amid market volatility,CNBC
Oct-18-18,"Stock Market News For Oct 18, 2018",Zacks
Oct-18-18,"Dow Jones Futures: 3 Reasons To Stay In Cash As Bulls, Bears Battle For Stock Market Control",Investor's Business Daily
Oct-18-18,Trade of the Day: UnitedHealth Stock Is a Year-End Outperformer,InvestorPlace
Oct-19-18,IBD Stock Of The Day Cigna Nears Buy Point After Fighting Off Merger Doubts,Investor's Business Daily
Oct-19-18,2 Dow Safety Stock for Volatile Market: Portfolio Manager,Investopedia
Oct-19-18,What's Behind UnitedHealth Group's Q3 Earnings Success,Motley Fool
Oct-22-18,UnitedHealth Group (UNH) Dips More Than Broader Markets: What You Should Know,Zacks
Oct-22-18,Markets Right Now: Banks lead US indexes lower; tech gains,Associated Press
Oct-22-18,Markets Right Now: Stocks turn mostly lower at midday,Associated Press
Oct-23-18,The fear gauge and strong earnings tell Jim Cramer this bottom in the stock market may be real,CNBC
Oct-23-18,Quest Diagnostics Inc (DGX) Q3 2018 Earnings Conference Call Transcript,Motley Fool
Oct-23-18,Play UnitedHealth's Q3 Earnings Beat With These 3 Funds,Zacks
Oct-23-18,NASDAQ Rises to Start Busy Week for Tech,Zacks
Oct-23-18,Dow Jones Futures Tumble: Why This Stock Market Correction Is More Dangerous Than A Bear Market,Investor's Business Daily
Oct-24-18,Google's former head of search products has just joined insurer Anthem to run its A.I. group,CNBC
Oct-24-18,UnitedHealth Falls 3%,Investing.com
Oct-24-18,"Stock market volatility is back, and history shows these Dow stocks thrive during turbulent times",CNBC
Oct-24-18,"New Research: Key Drivers of Growth for UnitedHealth Group, The Wendy's Co., Xenia Hotels & Resorts, TopBuild, Coherus BioSciences, and Virtu Financial  Factors of Influence, Major Initiatives and Sustained Production",GlobeNewswire
Oct-24-18,Obamacare Set to Gain From Mid-Term Polls: 4 HMO Picks,Zacks
Oct-25-18,UnitedHealth Rises 3%,Investing.com
Oct-25-18,Is UnitedHealth Group (UNH) Stock Outpacing Its Medical Peers This Year?,Zacks
Oct-25-18,"The Zacks Analyst Blog Highlights: Molina, WellCare, Humana and UnitedHealth",Zacks
Oct-26-18,7 Major Market Indices and How to Trade Them,InvestorPlace
Oct-26-18,The bigger message behind Amgens decision to slash cost of its Repatha cholesterol drug,MarketWatch
Oct-29-18,UnitedHealth Group (UNH) Stock Moves -0.6%: What You Should Know,Zacks
Oct-29-18,"Top Analyst Reports for Johnson & Johnson, UnitedHealth, AT&T & Intel",Zacks
Oct-29-18,The bigger message behind Amgens decision to slash cost of its Repatha cholesterol drug,MarketWatch
Oct-29-18,UnitedHealthcares New My ScriptRewards Enables People to Share Cost Savings on Select Medications,Business Wire
Oct-29-18,Here's Why UnitedHealth Should Have Already Been in My Portfolio,TheStreet.com
Oct-29-18,2 Plays on UnitedHealth Amid the Market Wreckage: Market Recon,TheStreet.com
Oct-30-18,"After short tenure as UnitedHealthcare's chief medical officer, Pronovost takes job at Cleveland health system",American City Business Journals
Oct-30-18,"Aetna (AET) Q3 Earnings Beat Estimates, Membership Increases",Zacks
Oct-30-18,"The Zacks Analyst Blog Highlights: Johnson & Johnson, UnitedHealth, AT&T and Intel",Zacks
