date,title,source
Oct-18-18,7 Tech Stocks to Buy for the Future of HR,InvestorPlace
Oct-22-18,Paycom Jim Thorpe Award Names 2018 Semifinalists,Business Wire
Oct-22-18,"Consolidated Research: 2018 Summary Expectations for Paycom Software, Orchids Paper Products, Gartner, Transdigm Group, Universal Electronics, and Primerica  Fundamental Analysis, Key Performance Indications",GlobeNewswire
Oct-24-18,Paycom (PAYC) to Report Q3 Earnings: What's in the Offing?,Zacks
Oct-29-18,Paycom to Participate in Upcoming Investor Conferences,Business Wire
Oct-30-18,Paycom Software Inc (PAYC) Q3 2018 Earnings Conference Call Transcript,Motley Fool
Oct-30-18,Paycom Software (PAYC) Q3 Earnings Match Estimates,Zacks
Oct-30-18,Paycom stock drops as forecast earnings metric falls short of Street view,MarketWatch
Oct-30-18,Paycom: 3Q Earnings Snapshot,Associated Press
Oct-30-18,"Paycom Software, Inc. Reports Third Quarter 2018 Results",Business Wire
Oct-30-18,"Dow Rallies 200 Points, But These 2 FANG Stocks Stumble",Investor's Business Daily
Oct-31-18,Want To Invest In Paycom Software Inc (NYSE:PAYC)? Heres How It Performed Lately,Simply Wall St.
Oct-31-18,"Paycom (PAYC) Q3 Earnings Match Estimates, Revenues Top",Zacks
Nov-01-18,Paycom Software Targets Larger Customers as Its Sales Growth Accelerates,Motley Fool
Nov-02-18,Is Paycom Software (PAYC) Stock Outpacing Its Computer and Technology Peers This Year?,Zacks
Nov-06-18,Edited Transcript of PAYC earnings conference call or presentation 30-Oct-18 9:00pm GMT,Thomson Reuters StreetEvents
Nov-08-18,Paycom Launches Machine Learning Technology with Employment Predictor,Business Wire
Nov-08-18,Earnings Season Continues -- Here Are 3 Financial-Sector Companies to Watch,Motley Fool
Nov-20-18,Has Paycom Software (PAYC) Outpaced Other Computer and Technology Stocks This Year?,Zacks
Nov-20-18,"Paycom Software, Inc. Announces New Stock Repurchase Plan",Business Wire
Nov-23-18,Is Paycom Software Incs (NYSE:PAYC) High P/E Ratio A Problem For Investors?,Simply Wall St.
Nov-29-18,Paycom (PAYC) Up 3.9% Since Last Earnings Report: Can It Continue?,Zacks
