date,title,source
Oct-17-18,"Investor Expectations to Drive Momentum within Matthews International, AC Immune SA, Entercom Communications, Sunrun, Axcelis Technologies, and Advanced Disposal Services  Discovering Underlying Factors of Influence",GlobeNewswire
Oct-31-18,Advanced Disposal Services (ADSW) Lags Q3 Earnings Estimates,Zacks
Oct-31-18,Advanced Disposal Services: 3Q Earnings Snapshot,Associated Press
Oct-31-18,Advanced Disposal Announces Third Quarter Results,PR Newswire
Oct-31-18,Advanced Disposal Services Inc (NYSE:ADSW) Delivered A Weaker ROE Than Its Industry,Simply Wall St.
Nov-02-18,Edited Transcript of ADSW earnings conference call or presentation 1-Nov-18 2:00pm GMT,Thomson Reuters StreetEvents
Nov-08-18,"Analysis: Positioning to Benefit within American Homes 4 Rent, Royal Gold, MSC Industrial Direct, Keane Group, Advanced Disposal Services, and Pacific Ethanol  Research Highlights Growth, Revenue, and Consolidated Results",GlobeNewswire
Nov-20-18,Advanced Disposal To Attend Credit Suisse Industrials Conference,PR Newswire
Jan-08-19,Advanced Disposal Sets Date For Fourth Quarter 2018 Earnings Call,PR Newswire
Jan-18-19,6 Reasons to Bet on Booz Allen Hamilton (BAH) Stock Now,Zacks
Jan-22-19,RSG or WCN: Which Waste Removal Stock is a Better Buy Now?,Zacks
Feb-07-19,"Market Trends Toward New Normal in lululemon athletica inc, Insmed, Advanced Disposal Services, AGCO, Douglas Dynamics, and Ballard Power  Emerging Consolidated Expectations, Analyst Ratings",GlobeNewswire
Feb-14-19,Advanced Disposal Services (ADSW) Reports Next Week: What to Expect,Zacks
Feb-21-19,Advanced Disposal Services: 4Q Earnings Snapshot,Associated Press
Feb-21-19,Advanced Disposal Announces Fourth Quarter Results,PR Newswire
Feb-22-19,"Advanced Disposal Services South, Inc. (ADSW) Q4 2018 Earnings Conference Call Transcript",Motley Fool
Feb-25-19,Advanced Disposal Announces Q1 Investor Conference Schedule,PR Newswire
Feb-25-19,Edited Transcript of ADSW earnings conference call or presentation 22-Feb-19 3:00pm GMT,Thomson Reuters StreetEvents
Feb-26-19,Clean Harbors (CLH) to Report Q4 Earnings: What's in Store?,Zacks
Feb-26-19,Stericycle (SRCL) to Post Q4 Earnings: What's in the Cards?,Zacks
Feb-27-19,"Have Insiders Been Selling Advanced Disposal Services, Inc. (NYSE:ADSW) Shares?",Simply Wall St.
Feb-27-19,What's Up for Charles River Associates (CRAI) in Q4 Earnings?,Zacks
Feb-27-19,Steelcase's (SCS) Q4 Earnings: How Things Are Shaping Up?,Zacks
Mar-06-19,G.researchs 5th Annual Waste & Environmental Services Symposium,Business Wire
Mar-15-19,Advanced Disposal Sets Date For First Quarter 2019 Earnings Call,PR Newswire
Apr-15-19,"Stocks close slightly lower amid lackluster Goldman, Citi earnings",MarketWatch
Apr-15-19,"Dow Ends Lower, Hurt by Goldman, Boeing; S&P 500 Finishes Little Changed",TheStreet.com
Apr-15-19,Cash to invest? Here are 3 countries you should consider ahead of the U.S.,MarketWatch
Apr-15-19,"Advanced Disposal (ADSW) Merger Investigation: Halper Sadeh LLP Announces Investigation Into Whether the Sale of Advanced Disposal Services, Inc. is Fair to Shareholders  ADSW",GlobeNewswire
Apr-15-19,Stock Market News: Waste Management Goes Shopping; Goldman Sachs Disappoints,Motley Fool
Apr-15-19,"SHAREHOLDER ALERT: Levi & Korsinsky, LLP Notifies Investors of an Investigation Regarding Whether the Sale of Advanced Disposal Services, Inc. to Waste Management, Inc. for $33.15 Per Share is Fair to Shareholders",ACCESSWIRE
Apr-15-19,Waste Management to acquire Florida-based co. in $4.9B deal,American City Business Journals
Apr-15-19,Advanced Disposal Pops Over 21% on Acquisition Announcement,Motley Fool
Apr-15-19,Waste Management to buy Advanced Disposal for about $3 bln,Reuters
Apr-15-19,Waste Management Is Buying Advanced Disposal. Heres What It Means for the Stock.,Barrons.com
Apr-15-19,Waste Management to Buy Advanced Disposal Services in $4.9 Billion Deal,TheStreet.com
Apr-15-19,"Advanced Disposal Services, Inc. (NYSE:ADSW) Might Not Be A Great Investment",Simply Wall St.
Apr-15-19,Waste Management Buys Advanced Disposal For $3B,Benzinga
Apr-15-19,Waste Management pays $3 billion for Advanced Disposal,Associated Press
Apr-15-19,Waste Management hauls in rival Advanced Disposal in $4.9bn deal,Financial Times
Apr-15-19,Waste Management to acquire Advanced Disposal in deal valued at $4.9 billion,MarketWatch
Apr-15-19,Waste Management to buy Advanced Disposal Services in $4.9 bln deal,Reuters
Apr-15-19,Waste Management to Acquire Advanced Disposal for $4.9 Billion Adding Complementary Assets and Customer Base in the Eastern United States,Business Wire
Apr-15-19,Waste Management Reportedly Close to Buying Advanced Disposal Services for $2.9B,TheStreet.com
Apr-16-19,"ADVANCED DISPOSAL INVESTOR ALERT BY THE FORMER ATTORNEY GENERAL OF LOUISIANA: Kahn Swick & Foti, LLC Investigates Adequacy of Price and Process in Proposed Sale of Advanced Disposal Services, Inc. - ADSW",GlobeNewswire
Apr-16-19,"Bragar Eagel & Squire, P.C. is Investigating the Board of Directors of Advanced Disposal Services, Inc. (ADSW) on Behalf of Stockholders and Encourages ADSW Investors to Contact the Firm",GlobeNewswire
Apr-16-19,"Company News For Apr 16, 2019",Zacks
Apr-16-19,"Stock Market News For Apr 16, 2019",Zacks
Apr-16-19,Waste Management Snaps Up Advanced Disposal for $4.9 Billion,Zacks
Apr-23-19,"Lifshitz & Miller LLP Announces Investigation of Advanced Disposal Services, Inc., Boston Scientific Corporation, Cavco Industries, Inc., Evoqua Water Technologies Corp., HomeFed Corporation, KeyW Holding Corporation, Level Brands, Inc., and Nightstar Therapeutics plc.",PR Newswire
Apr-23-19,Earnings Preview: Advanced Disposal Services (ADSW) Q1 Earnings Expected to Decline,Zacks
Apr-24-19,"EFII, SFS, HOFD, and ADSW SHAREHOLDER ALERT: Rigrodsky & Long, P.A. Reminds Investors of Investigations of Buyouts",GlobeNewswire
Apr-24-19,"Solid Earnings Boost S&P, NASDAQ to New Closing Highs",Zacks
Apr-29-19,"ADSW, EFII, BRSS Shareholder Alert: Halper Sadeh LLP Reminds Investors It Is Investigating Whether the Sale of These Companies is Fair to Shareholders  ADSW, EFII, BRSS",GlobeNewswire
Apr-30-19,Advanced Disposal Services: 1Q Earnings Snapshot,Associated Press
Apr-30-19,Advanced Disposal Announces First Quarter Results,PR Newswire
Apr-30-19,"Were Hedge Funds Right About Flocking Into Advanced Disposal Services, Inc. (ADSW) ?",Insider Monkey
Apr-30-19,"MERGER ALERT TIER, ADSW and BRSS: Levi & Korsinsky, LLP Reminds Investors of Investigations Concerning the Sale of these Companies",GlobeNewswire
May-01-19,"KEYW, BRSS, FRSH, and ADSW SHAREHOLDER ALERT: Rigrodsky & Long, P.A. Reminds Investors of Investigations of Buyouts",GlobeNewswire
May-06-19,"MERGER ALERT  ADSW and MSL: Levi & Korsinsky, LLP Reminds Investors of Investigations Concerning the Sale of these Companies",GlobeNewswire
May-07-19,Advanced Disposal Postpones 2019 Annual Meeting of Stockholders,PR Newswire
May-14-19,"ADSW, SFS, MSL Investor Alert: Halper Sadeh LLP Is Investigating Whether the Sale of These Companies Is Fair to Shareholders  ADSW, SFS, MSL",GlobeNewswire
May-15-19,"INVESTOR ALERT: Monteverde & Associates PC Investigates the Acquisition of BRSS, MLNX and ADSW",ACCESSWIRE
May-17-19,SHAREHOLDER ALERT: WeissLaw LLP Investigates Advanced Disposal Services Inc.,PR Newswire
May-17-19,"SHAREHOLDER ALERT: Rigrodsky & Long, P.A. Files Class Action Suit Against Advanced Disposal Services, Inc.",GlobeNewswire
May-17-19,"IMPORTANT INVESTOR ALERT: Halper Sadeh LLP Announces Lawsuits Against WellCare Health Plans, Inc., Global Brass and Copper Holdings, Inc., and Advanced Disposal Services, Inc.; Investors are Encouraged to Contact the Firm  WCG, BRSS, ADSW",GlobeNewswire
May-21-19,"SHAREHOLDER ALERT: Rigrodsky & Long, P.A. Files Class Action Suit Against Advanced Disposal Services, Inc.",ACCESSWIRE
May-21-19,"KEYW, VSM, ADSW Alert: Halper Sadeh LLP Announces Shareholder Class Actions Against The KeyW Holding Corporation, Versum Materials, Inc., and Advanced Disposal Services, Inc.  KEYW, VSM, ADSW",GlobeNewswire
May-23-19,URGENT ALERT: Monteverde & Associates PC Launches Legal Inquiry Regarding the Acquisition,ACCESSWIRE
May-23-19,"Moore Kuehn, PLLC Announces Investigation of Advanced Disposal Services, Inc. (NYSE: ADSW)",PR Newswire
May-23-19,SHAREHOLDER ALERT: Monteverde & Associates PC Is Investigating the Acquisitions,ACCESSWIRE
Jun-03-19,KeyBanc Has 'Greater Confidence' In Waste Management's Leadership Team,Benzinga
Jun-05-19,Fed Sparks Relief Rally of More Than 2%,Zacks
Jun-06-19,"PETX, ADSW, AQ Shareholder Alert: Halper Sadeh LLP Reminds Investors of Class Action Lawsuits Filed Against Aratana Therapeutics, Inc., Advanced Disposal Services, Inc., and Aquantia Corp.  PETX, ADSW, AQ",GlobeNewswire
Jun-06-19,"SHAREHOLDER ALERT: Rigrodsky & Long, P.A. Reminds Investors of ADSW and AQ of Class Action Lawsuits Filed",GlobeNewswire
Jun-06-19,"AQ, ADSW Important Investor Alert: Halper Sadeh LLP Announces Class Actions Against Aquantia Corp. and Advanced Disposal Services, Inc.; Investors Are Encouraged to Contact the Firm  AQ, ADSW",GlobeNewswire
