date,title,source
Jan-07-19,"Mobileye, Ordnance Survey to Gather and Share Map Data to Manage Infrastructure for Smarter Cities, Safer Roads",Business Wire
Jan-07-19,Intel Showcases New Technology for Next Era of Computing at CES 2019,Business Wire
Jan-07-19,Top 5 S&P 500 Stocks for 2018 by Performance,Investopedia
Jan-07-19,zGlue pitches 'chiplets' to make custom chips for startups,Reuters
Jan-07-19,Intel (INTC) Gains But Lags Market: What You Should Know,Zacks
Jan-07-19,zGlue pitches 'chiplets' to make custom chips for startups,Reuters
Jan-07-19,Intel Interim CEO Bob Swan Is Buying Up eBay Stock,Barrons.com
Jan-07-19,Here's what a promising startup and 30 Bay Area honorees are showing off at CES this week,American City Business Journals
Jan-07-19,The 9 Best Dividend Growth Stocks in the Dow Jones,Kiplinger
Jan-07-19,"AMD Stock Is Hanging by a Thread, and Its a Long Way Down",InvestorPlace
Jan-07-19,Should Value Investors Pick Intel Corporation (INTC) Stock?,Zacks
Jan-07-19,"Three options strategies for the week: January 7, 2019",CNBC
Jan-07-19,"QuickLogic Buys SensiML, Gains AI-based SaaS Toolkit Platorm",Zacks
Jan-07-19,AMD Commences 2019 With Latest Ryzen Processors and GPUs,Zacks
Jan-07-19,Qualcomm Braces for Legal Battle with US Antitrust Regulator,Zacks
Jan-07-19,China Aims to Curb US Dependency With New Data Center Chip,Zacks
Jan-07-19,Xilinx Platform to Run AI Driven ZF Automotive Control Unit,Zacks
Jan-07-19,Huawei launches next-generation chipset for servers as it aims to become a top 5 cloud player,CNBC
Jan-08-19,7 5G Stocks to Buy as the Race for Spectrum Tightens,InvestorPlace
Jan-08-19,Using Autonomous Vehicle Technology to Make Roads Safer Today,Business Wire
Jan-08-19,AMD Could Break Out From Descending Triangle,Investopedia
Jan-08-19,NXP teams with French company on self-driving car chips,Reuters
Jan-08-19,Here's What Investors Should Expect from AMD Stock in 2019,Zacks
Jan-08-19,Intel and Warner Bros. Immersive CES Experience Previews Entertainments Future in Autonomous Vehicles,Business Wire
Jan-08-19,Intel's CES event returns to its chip-making roots,American City Business Journals
Jan-08-19,"Intel (INTC) at CES 2019: Xeon CPUs, AI-Chip & Alliances",Zacks
Jan-08-19,"Intel Announces New Chips for PCs, AI and 5G Base Stations at CES",TheStreet.com
Jan-08-19,"Editas Medicine, YY, Intel, Advanced Micro Devices and NVIDIA highlighted as Zacks Bull and Bear of the Day",Zacks
Jan-08-19,Top 5 S&P 500 Stocks for 2018 by Performance,Investopedia
Jan-08-19,IBM Is U.S. Patent Leader for 26th Year Running,Investopedia
Jan-09-19,Buy Microsoft (MSFT) Stock on the Dip Amid Apple (AAPL) Uncertainty?,Zacks
Jan-09-19,Intel: These Guys Are Competing Aggressively,TheStreet.com
Jan-09-19,10 Tech Stocks That Pay You Dividends to Own Them,Kiplinger
Jan-09-19,7 Tech Stocks That Can Lead a Sector Turnaround,InvestorPlace
Jan-09-19,"AMD shows off 7nm next-gen chips at CES, aims at Intel and Nvidia",Reuters
Jan-09-19,"AMD shows off 7nm next-gen chips at CES, aims at Intel and Nvidia",Reuters
Jan-09-19,AMD Unveils New High-End GPU and Details Upcoming CPUs at CES,TheStreet.com
Jan-09-19,Intel Stock Will Benefit  From the Magic of AI,InvestorPlace
Jan-09-19,Intel Looks Set to Raise Its Dividend Later This Month,Motley Fool
Jan-09-19,"Intel, Warner Bros Alliance Ups the Ante in Self Driving Space",Zacks
Jan-09-19,NVIDIA Makes Headway in Automotive Space With Drive AutoPilot,Zacks
Jan-09-19,"General Motors, Exxon Mobil, Advanced Micro Devices, Nvidia and Intel highlighted as Zacks Bull and Bear of the Day",Zacks
Jan-09-19,IBM Is U.S. Patent Leader for 26th Year Running,Investopedia
Jan-09-19,Trade Resolution Would Keep This Correction From Becoming a Crash: Market Recon,TheStreet.com
Jan-09-19,Chip Stocks Higher Midday Despite Lowered Guidance,Investing.com
Jan-09-19,"Intel Stock: New Tech Products, Old Tech Valuation",InvestorPlace
Jan-10-19,Will NVIDIA's New Automotive Platform Widen Its Moat Against Intel?,Motley Fool
Jan-10-19,"Cramer Remix: Retailers are facing a new, harsher reality",CNBC
Jan-10-19,Intel has its biggest addressable market ever: Interim CE...,CNBC Videos
Jan-10-19,"Intel has the biggest addressable market it's ever seen, says company's interim CEO",CNBC
Jan-10-19,Morgan Stanley's Key CES Takeaways For Semi Companies,Benzinga
Jan-10-19,AMD Lays Out Big Plans for 2019,Motley Fool
Jan-10-19,Jon Fortt breaks down trash talk in chip sector at CES,CNBC Videos
Jan-10-19,AMD Boosts Gaming Experience With 7nm Radeon Graphics Card,Zacks
Jan-10-19,Baidu Ups Ante in Self Driving With New Developments at CES,Zacks
Jan-10-19,NVIDIA Bonds With Mercedes for Next-Gen AI-Run Vehicles,Zacks
Jan-10-19,"Advanced Micro Devices Storms CES With 7nm Chips, Radeon VII",InvestorPlace
Jan-10-19,Read This Before You Buy Intel Corporation (NASDAQ:INTC) Because Of Its P/E Ratio,Simply Wall St.
Jan-14-19,3 Stocks to Bet on the Future of Self-Driving Cars,Motley Fool
Jan-14-19,[$$] Autonomous Vehicle Startup Zoox Names Intel Executive Aicha Evans as CEO,The Wall Street Journal
Jan-14-19,"CNBC Tech Check Evening Edition: January 14, 2019",CNBC Videos
Jan-14-19,Intel (INTC) Dips More Than Broader Markets: What You Should Know,Zacks
Jan-14-19,AMD's CTO Talks to TheStreet About Next Gen Chips and Keeping Up With Rivals,TheStreet.com
Jan-14-19,"Despite Legal War, Apple Was Planning on Buying Qualcomm Modems Last Year",Motley Fool
Jan-15-19,Will Intel Raise Its Dividend in 2019?,Motley Fool
Jan-15-19,Micron Confirms It's Buying Out Intel in Flash Memory Joint Venture,TheStreet.com
Jan-15-19,Intel Reportedly Considers Apple's Chip Chief for CEO,Motley Fool
Jan-15-19,Why Qualcomm Shareholders Should Be Furious,Motley Fool
Jan-15-19,Will Intel Be Upgraded to a Buy in 2019?,Zacks
Jan-15-19,Will Intel have a CEO by next week's earnings call?,American City Business Journals
Jan-15-19,Tuesday Apple Rumors: iPhone 11 May Ditch Lightning Port,InvestorPlace
Jan-15-19,8 Corporate Earnings That Are Vulnerable To China's Downturn,Investopedia
Jan-15-19,"CES 2019: What Google, Amazon, &amp; Other Tech Giants Showed Off",Zacks
Jan-15-19,"Apple, Intel Persuade U.S. Patent Office to Enter Qualcomm Fight",Bloomberg
Jan-15-19,Baidu to Help Deliver Groceries Through Apollo Powered Vans,Zacks
Jan-15-19,"Report: Intel narrows its field, wants to name a new CEO by the end of the month",American City Business Journals
Jan-15-19,Western Digital Stock Falls Following Analyst Rating Downgrade,Zacks
Jan-15-19,"Stocks - JPMorgan, Wells Fargo, UnitedHealth, Delta Airlines Fall in Premarket",Investing.com
Jan-16-19,Should You Buy Intel (INTC) Stock Ahead of the Chip Giant's Q4 Earnings?,Zacks
Jan-16-19,How Apple in 2019 Seems a Lot Like Intel in 2012,Motley Fool
Jan-16-19,"Look to Semiconductor ETFs Once U.S., China Reach a Deal",ETF Trends
Jan-16-19,Buy Semiconductors on the Dip? 3 Stocks to Consider Now,Zacks
Jan-16-19,Intel's Next CEO Could Be One of These 5 People,TheStreet.com
Jan-16-19,6 Single-Digit P/E Stocks With Huge Upside,InvestorPlace
Jan-16-19,3 Cheap Stocks to Buy (Before They Skyrocket),InvestorPlace
Jan-16-19,A Big Week Looms for Chip ETFs,ETF Trends
Jan-16-19,The 5 Best Mutual Funds to Invest In the Semiconductor Space,InvestorPlace
Jan-16-19,Micron to Own 100% of IM Flash Post Intel's Share Purchase,Zacks
Jan-16-19,Report: Intel puts Apple hardware executive on its CEO shortlist,American City Business Journals
Jan-16-19,A Big Risk to Intel's Modem Efforts,Motley Fool
Jan-16-19,How to spot stocks that could blow up your portfolio during this earnings season,CNBC
Jan-16-19,8 Corporate Earnings That Are Vulnerable To China's Downturn,Investopedia
Jan-17-19,5 Reasons to Buy AMD Stock,InvestorPlace
Jan-17-19,Intel (INTC) Reports Next Week: Wall Street Expects Earnings Growth,Zacks
Jan-17-19,Apple Stock Needs to Declare Independence From iPhone Dependence,InvestorPlace
Jan-17-19,"US STOCKS-Weak Morgan Stanley results, trade worries to pull Wall St lower at open",Reuters
Jan-17-19,TSMC meets market forecasts with 0.7 percent fourth-quarter net profit rise,Reuters
Jan-18-19,"Cramer's game plan: This week, forecasts are more important than earnings",CNBC
Jan-18-19,Wall Street Week Ahead - U.S. chipmakers may give clues on China hazard,Reuters
Jan-18-19,Investors Who Couldn't Wait to Dump Stocks Now Can't Buy Them Fast Enough,TheStreet.com
Jan-18-19,Key Takeaways from Q4 Earnings Results Thus Far,Zacks
Jan-18-19,"Upcoming Earnings Reports to Watch: IBM, INTC, SBUX",Zacks
Jan-18-19,3 Earnings Reports to Watch Next Week,InvestorPlace
Jan-18-19,[$$] Intel's Tough Act to Follow,The Wall Street Journal
Jan-22-19,What to watch in Intel's Q4 earnings Thursday,American City Business Journals
Jan-22-19,"Intel (INTC) Q4 Earnings Preview: Client Computing, Data Centers, IoT &amp; More",Zacks
Jan-22-19,We See Dead Stocks,GuruFocus.com
Jan-22-19,3 Tech Earnings Reports We're Watching This Week,Zacks
Jan-22-19,"What to Watch as Intel, TI and Other Major Chip Companies Report This Week",TheStreet.com
Jan-22-19,"Intel earnings: A precarious time as CEO choice, data-center competition loom",MarketWatch
Jan-22-19,Semiconductor ETFs Rallying Ahead of Q4 Earnings,Zacks
Jan-22-19,Intel Editorial: Intel Achieves Gender Pay Equity Globally,Business Wire
Jan-22-19,"Five Things for Tuesday, including Wheeler weighs in and Intel's billion-dollar plans for Hillsboro",American City Business Journals
Jan-22-19,"Tuesdays Vital Data: Tesla, Netflix and Intel",InvestorPlace
Jan-22-19,"3 Big Stock Charts for Tuesday: Intel, eBay and Fiserv",InvestorPlace
Jan-22-19,"The Zacks Analyst Blog Highlights: salesforce.com, Amazon.com, Intel, NVIDIA and Microsoft",Zacks
Jan-22-19,"Microsoft, Intel Look to Cloud Sales as Earnings Season Begins",Bloomberg
Jan-22-19,Apple Concedes That Qualcomm Was the Only 4G-Ready Chip Source,Bloomberg
Jan-23-19,Intel Is Doing Something Smart,Motley Fool
Jan-23-19,Intel Reports Earnings on Thursday: 5 Important Things to Watch,TheStreet.com
Jan-23-19,"Intel earnings: A precarious time as CEO choice, data-center competition loom",MarketWatch
Jan-23-19,"TXN vs. INTC Ahead of Earnings and Reports from IBM, UTX, &amp; More",Zacks
Jan-23-19,Will Investors Like Intel's Earnings Results?,Motley Fool
Jan-23-19,Will Intel Stock Suffer Like Nvidia on Earnings?,InvestorPlace
Jan-23-19,"Big Chip Earnings Preview: Intel, AMD Set To Report Amid Changing Competitive Landscape, Cycle Risk",Benzinga
Jan-23-19,Intel Announces New Class of RealSense Stand-Alone Inside-Out Tracking Camera,Business Wire
Jan-23-19,"Five Things for Wednesday, including a huge homeless count and will Intel pick its new CEO by Thursday?",American City Business Journals
Jan-23-19,Qualcomm's stock sinks after short-seller takes aim,MarketWatch
Jan-23-19,Intel's Plan to Defeat Qualcomm in Laptops,Motley Fool
Jan-24-19,Intel Slumps on a Revenue Miss and Light Guidance: 8 Key Takeaways,TheStreet.com
Jan-24-19,"Intels cloud boom is no longer making it rain, and thats a problem",MarketWatch
Jan-24-19,[$$] Intel Projects Slower Revenue Growth This Year,The Wall Street Journal
Jan-24-19,Intel interim CEO convinced a permanent replacement coming 'in the near future',American City Business Journals
Jan-24-19,[$$] Intel: Good Times Never Last,The Wall Street Journal
Jan-24-19,Intel's 2019 Forecasts Signal Slowdown After Data-Center Surge,Bloomberg
Jan-24-19,Weak Intel outlook stokes fears of a chip slowdown,Reuters
Jan-24-19,[$$] Intel Projects Slower Revenue Growth This Year,The Wall Street Journal
Jan-24-19,Weak Intel outlook stokes fears of a chip slowdown,Reuters
Jan-24-19,Stock market faces hurdles after Intel earnings miss sours chip rally,CNBC
Jan-24-19,Intel's Earnings Whiff Breaks Semiconductor Stock Momentum,Bloomberg
Jan-24-19,Weak Intel outlook stokes fears of a chip slowdown,Reuters
Jan-24-19,"CNBC Tech Check Evening Edition: January 24, 2019",CNBC Videos
Jan-24-19,"Intel stock drops after earnings show weak outlook, revenue miss",MarketWatch
Jan-24-19,[$$] Intel: Good Times Never Last,The Wall Street Journal
Jan-24-19,Top technician says this chip stock is about to break out,CNBC Videos
Jan-24-19,"Post-Bell Q4 Highlights: Intel, Starbucks &amp; More",Zacks
Jan-24-19,Intel: 4Q Earnings Snapshot,Associated Press
Jan-24-19,Intel Bursts Semiconductor Sector Optimism as Forecast Falls Flat,TheStreet.com
Jan-24-19,"Stocks making the biggest moves after hours: Intel, Starbucks and more",CNBC
Jan-24-19,"Intel shares fall after revenue miss, lower Q1 guidance",American City Business Journals
Jan-24-19,"Intel Stock Drops On Mixed Fourth-Quarter Results, Disappointing Guide",Investor's Business Daily
Jan-24-19,Intel Stock Plunges Because China and Cloud Growth Are Slowing,Barrons.com
Jan-24-19,How the Market Digests Intel's Results Friday Is Important,TheStreet.com
Jan-24-19,Chip stocks retreat after Intel earnings disappoint,MarketWatch
Jan-24-19,"3 Things to Know at Market Close: Intel, Renewable Energy Stocks, and Disney",TheStreet.com
Jan-24-19,"US STOCKS-Nasdaq boosted by chip rally, Dow, S&P 500 stall",Reuters
Jan-24-19,"Intel Slides on Revenue Miss, Weak Guidance",TheStreet.com
Jan-24-19,"Intel stock drops 7% on revenue miss, outlook",MarketWatch
Jan-24-19,Nasdaq Rallies In Stock Market Today On These Big Earnings Beats,Investor's Business Daily
Jan-24-19,Intel misses on revenue and gives weak guidance  stock falls after hours,CNBC
Jan-24-19,Extreme Call Activity on Intel Before Earnings,Schaeffer's Investment Research
Jan-24-19,Secular Shifts in Tech Underline Long-Term Sights of Semiconductor Stocks,TheStreet.com
Jan-24-19,"US STOCKS-Chipmakers, airlines lift Nasdaq; trade worries stall S&P, Dow",Reuters
Jan-24-19,Better Buy: Advanced Micro Devices vs. Cypress Semiconductor,Motley Fool
Jan-25-19,Edited Transcript of INTC earnings conference call or presentation 24-Jan-19 10:00pm GMT,Thomson Reuters StreetEvents
Jan-25-19,Shutdown News and FOMC Speculation Lift Stocks,Investopedia
Jan-25-19,Intel Analysts Cut Price Targets Following Disappointing Earnings Report,TheStreet.com
Jan-25-19,Intel's Dividend Boost Isn't Enough,Motley Fool
Jan-25-19,"Why Intel, AbbVie, and Vale Slumped Today",Motley Fool
Jan-25-19,"In Case You Missed It: How JNJ, IBM, INTC, SBUX Are Doing",TheStreet.com
Jan-25-19,US STOCKS-Wall St advances on Washington temporary shutdown deal,Reuters
Jan-25-19,"Stock Market Rally Pauses; Intel, Xilinx, Starbucks, Airlines Earnings: Weekly Review",Investor's Business Daily
Jan-25-19,Dow Closes Higher to End Week With Modest Gains,TheStreet.com
Jan-25-19,Dow clinches triple-digit gain on upbeat earnings,MarketWatch
Jan-25-19,US STOCKS-Wall St gains on U.S. government shutdown compromise,Reuters
Jan-25-19,"Apple Fuels Dow Jones Rally; Western Digital, Micron Lead Nasdaq",Investor's Business Daily
Jan-25-19,"US STOCKS-Wall St surges on upbeat earnings, hopes of end to govt. shutdown",Reuters
Jan-25-19,Intel CEO: The government shutdown and US-China trade war curtail consumer and business spending,CNBC
Jan-25-19,"Stocks making moves midday: Airlines, Ford, Western Digital, Vale & more",CNBC
Jan-25-19,Why Intel Stock Tumbled Today,Motley Fool
Jan-25-19,"US STOCKS-Wall St surges on upbeat earnings, hopes of end to govt. shutdown",Reuters
Jan-25-19,"Upcoming Earnings Reports to Watch: CAT, AAPL, FB",Zacks
Jan-25-19,An Early Nvidia (NVDA) Q4 Earnings Preview,Zacks
Jan-25-19,Intel cloud slowdown sending stock toward worst day in six months,MarketWatch
Jan-25-19,"Five Things for Friday, including a new whiskey library owner and Intel's CEO search",American City Business Journals
Jan-25-19,Congressional Activities on Shutdown in Focus,Zacks
Jan-25-19,"Asia, Congress Activity, Put Futures in the Green",Zacks
Jan-25-19,Intel Shares Slump After Giving Lackluster 2019 Forecast,Bloomberg
Jan-25-19,Dow Jumps 200 Points Despite This Chipmaker's Poor Earnings,Investor's Business Daily
Jan-25-19,Intel Stock Is Sliding After the Companys Gloomy Outlook Rattles Wall Street Analysts,Barrons.com
Jan-25-19,US STOCKS-Earnings optimism pushes Wall Street higher,Reuters
Jan-25-19,Will Intel's Weak Guidance Disrupt Semiconductor ETFs' Rally?,Zacks
Jan-25-19,"Intel (INTC) Q4 Earnings Surpass Estimates, Revenues Miss",Zacks
Jan-25-19,Intel Slides After Weak Q1 Profit Guidance Clouds Forecast for Global Chipmakers,TheStreet.com
Jan-25-19,"Stocks Surge As Dow Jones, Nasdaq, S&P 500 Fight To Extend Rally",Investor's Business Daily
Jan-25-19,Intel tanks after revenue miss and weak guidance,CNBC
Jan-25-19,"[$$] Stocks to Watch: Intel, Starbucks, Colgate-Palmolive",The Wall Street Journal
Jan-25-19,US STOCKS-Wall St set to open higher as investors focus on upbeat earnings,Reuters
Jan-25-19,Xilinx (XLNX) Rallies on Impressive Q3 Results &amp; Upbeat View,Zacks
Jan-25-19,"Intel stock drops 6% after Needham, Susquehanna downgrades",MarketWatch
Jan-25-19,Intel Slumps on a Revenue Miss and Light Guidance: 8 Key Takeaways,TheStreet.com
Jan-25-19,"As Intel plunges, here's what every major analyst had to say about its dismal report",CNBC
Jan-25-19,Stock Futures Rise as Earnings News Comes In Better Than Feared,Barrons.com
Jan-25-19,US STOCKS-Futures higher as upbeat corporate earnings lift sentiment,Reuters
Jan-25-19,"Stocks making the biggest moves premarket: Lear, Intel, Colgate & more",CNBC
Jan-25-19,Today's Research Reports on Trending Tickers: Intel and NXP Semiconductors,ACCESSWIRE
Jan-25-19,[$$] Intel revenue warning sends shares sharply lower,Financial Times
Jan-25-19,"The Zacks Analyst Blog Highlights: Intel, Starbucks, Intuitive Surgical and Western Digital",Zacks
Jan-25-19,"Intel, Starbucks, Facebook's Mark Zuckerberg and PG&E - 5 Things You Must Know",TheStreet.com
Jan-25-19,"Semis are up nearly 20 percent off the lows, but there's still room to buy. Here's why",CNBC
Jan-25-19,"Intel stock drops after earnings show weak outlook, revenue miss",MarketWatch
Jan-25-19,"Intels cloud boom is no longer making it rain, and thats a problem",MarketWatch
Jan-25-19,Tech exuberance lifts European shares near 2-month highs,Reuters
Jan-25-19,Stocks - Futures Push Higher After Chipmaker Rally,Investing.com
Jan-25-19,Intel Corp (INTC) Q4 2018 Earnings Conference Call Transcript,Motley Fool
Jan-28-19,"[$$] Nvidia Lowers Guidance on Weakness in Gaming, Datacenter Businesses",The Wall Street Journal
Jan-28-19,The Best S&P 500 Stocks of 2018,Investopedia
Jan-28-19,The Irony of Intel's Multibillion-Dollar Acquisitions,Motley Fool
Jan-28-19,Intel to invest $11 billion on new Israeli chip plant - Israel finance minister,Reuters
Jan-28-19,Intel to invest $11 bln on new Israeli chip plant - Israel FinMin,Reuters
Jan-28-19,Entegris Inc. -- Moody's affirms Entegris's Ba1 CFR and other ratings on merger with Versum; outlook stable,Moody's
Jan-28-19,Intel (INTC) Stock Moves -0.7%: What You Should Know,Zacks
Jan-28-19,What to Expect from AMD Q4 Earnings After Nvidia Lowered Guidance,Zacks
Jan-28-19,Why Microsoft Stock Requires Extreme Caution Ahead of Earnings,InvestorPlace
Jan-28-19,"[$$] Nvidia Lowers Guidance on Weakness in China, Cloud Computing",The Wall Street Journal
Jan-28-19,7 Chinese Stocks to Buy Now,InvestorPlace
Jan-28-19,NVIDIA Stock Crushed as Gaming and Datacenter Businesses Fall Short,Motley Fool
Jan-28-19,"As Tempting as It Is, AMD Stock Still Comes down to Valuation",InvestorPlace
Jan-28-19,"Why Boeing Is a Strong Buy Stock and News from CAT, NVDA, &amp; VALE",Zacks
Jan-28-19,Is Advanced Micro Devices Stock a Buy Ahead of Earnings?,InvestorPlace
Jan-28-19,"Long-Term Investors, Ignore the Noise in Nvidia Stock",InvestorPlace
Jan-28-19,5 Dow Jones Stocks Under Pressure,InvestorPlace
Jan-28-19,Nvidias Growth Story Hits a Wall,InvestorPlace
Jan-28-19,The Chip Canary in Big Techs Coal Mine,Bloomberg
Jan-28-19,Dissecting Nvidia's Sales Warning: Tech Check Blog,TheStreet.com
Jan-28-19,Chipmaker Xilinx's 5G orders kick off race to cash in on new networks,Reuters
Jan-28-19,Dissecting Nvidia's Sales Warning: Tech Check Blog,TheStreet.com
Jan-28-19,NVIDIA Retests Lows After Lowering Guidance,Investopedia
Jan-28-19,These 5 Companies Have Hiked Their Dividends,Barrons.com
Jan-28-19,Intel Felt Some Chinese Pain in the Fourth Quarter,Motley Fool
Jan-28-19,"Company News for Jan 28, 2019",Zacks
Jan-28-19,"Intel Stock Isnt a Buy Today, But Traders Should Watch It Closely",InvestorPlace
Jan-28-19,"AMD, Micron and Intel shares sink after Nvidia cuts revenue and gross margin guidance",MarketWatch
Jan-28-19,"Semiconductor Stocks' Earnings on Jan 29: AMD, MXIM, IPHI",Zacks
Jan-28-19,AMD Q4 Earnings to Gain from Computing &amp; Graphics Segment,Zacks
Jan-28-19,Why Xilinx Is Seeing Strong Growth When Many Chip Peers Aren't Growing at All,TheStreet.com
Jan-28-19,Chipmaker Xilinx's 5G orders kick off race to cash in on new networks,Reuters
Jan-28-19,"Intel stock drops after earnings show weak outlook, revenue miss",MarketWatch
Jan-29-19,AMD shares jump on record growth in data center revenue,Reuters
Jan-29-19,AMD shares jump on record growth in data centre revenue,Reuters
Jan-29-19,AMD Shares Surge as Chipmaker Gives Rosy 2019 Sales Forecast,Bloomberg
Jan-29-19,AMD Stock Surges on Solid Full-Year Sales Guidance,Barrons.com
Jan-29-19,Dont Be So Quick to Catch the Nvidia Stock Falling Knife,InvestorPlace
Jan-29-19,"Jerome Dodson Sells eBay, Intel",GuruFocus.com
Jan-29-19,"Top Analyst Reports for JPMorgan, Intel & Comcast",Zacks
Jan-29-19,Intel prepping 'business plan' for Israel investment,Associated Press
Jan-29-19,5 ETFs Hit By NVIDIA's Revenue Guidance Cut,Zacks
Jan-29-19,QCOMs Future Will Not Be Revealed With Tomorrows Earnings,InvestorPlace
Jan-29-19,Intel commits another $11B to Israel expansion plans,American City Business Journals
Jan-29-19,"Forget INTC &amp; NVDA, Buy These 4 Semiconductor Stocks Instead",Zacks
Jan-29-19,NVIDIA (NVDA) Down on Reduction in Revenue Forecast for Q4,Zacks
Jan-29-19,[$$] Big Tech's Capital Bills Aren't Always Telling,The Wall Street Journal
Jan-29-19,Nvidia Short Sellers Have Earned $1.3B in Profits Since Mid-November,Investopedia
Jan-29-19,"Micron Stock Is Perfect For Patient, Buy and Wait Investors",InvestorPlace
Jan-29-19,Intel to get $1 billion state grant for $11 billion Israel chip plant expansion,Reuters
Jan-29-19,Intel to get state grant of around $1 billion for Israel expansion - finance minister,Reuters
Jan-29-19,Intel to invest $11 billion on new Israeli chip plant: Israel finance minister,Reuters
Jan-29-19,Intel to get state grant of around $1 billion for Israel expansion: finance minister,Reuters
Jan-29-19,Intel to get state grant of around $1 bln for Israel expansion -finmin,Reuters
Jan-29-19,"Stocks - Pfizer, Verizon, PG&E Slump in Premarket, Harley Davidson Tumbles",Investing.com
Jan-29-19,Intel to invest $11 billion on new Israeli chip plant - Israel Finance Minister,Reuters
Jan-30-19,Near-Term Calls Hot During Intel M&A Buzz,Schaeffer's Investment Research
Jan-30-19,"Intel-backed Israeli startup raises $30M, opens U.S. HQ in San Jose",American City Business Journals
Jan-30-19,Breaking Down Apple's (AAPL) Dismal Q1 iPhone &amp; Greater China Revenues,Zacks
Jan-30-19,"After AMD's 15% surge, chip stocks cement their status as the craziest sector right now",CNBC
Jan-30-19,"As AMD Stock Soars, CEO Says Its Superior Chips Will Win in 2019",Barrons.com
Jan-30-19,5 Machine-Learning Stocks to Buy for a Smarter Portfolio,InvestorPlace
Jan-30-19,Intel has reportedly bid as much as $6B for Israeli chipmaker Mellanox,American City Business Journals
Jan-30-19,AMD Surges as Wall Street Cheers 2019 Forecast and Execution,Bloomberg
Jan-30-19,Mellanox Soars as Intel Reportedly Places Buyout Bid of Nearly $6 Billion,TheStreet.com
Jan-30-19,Microsoft a Must Buy Ahead of Q2 Earnings,Zacks
Jan-30-19,"AMD Misses on Q4 Earnings &amp; Revenues Estimates, Shares Down",Zacks
Jan-30-19,Seagate (STX) to Report Q2 Earnings: Disappointment in Store?,Zacks
Jan-30-19,US STOCKS-Futures rise on Apple relief,Reuters
Jan-30-19,"The Zacks Analyst Blog Highlights: JPMorgan, Intel, Comcast, Kinder Morgan and Discover Financial",Zacks
Jan-30-19,"Israel, Intel agree to reciprocal spending deal: ministry",Reuters
Jan-30-19,[$$] Microsoft's Expanding Cloud Is Likely to Limit Growth,The Wall Street Journal
Jan-30-19,"Israel, Intel agree to reciprocal spending deal: ministry",Reuters
Jan-30-19,"Stocks - Apple, AMD, Boeing Surge in Premarket, AT&T, Amgen Drop",Investing.com
Jan-30-19,Intel offered up to $6 billion for Israel's Mellanox - reports,Reuters
Jan-31-19,[$$] Intels CEO Search Ends Where It Began: With the CFO,The Wall Street Journal
Jan-31-19,[$$] Intel's New CEO Advances From CFO Spot a Second Time,The Wall Street Journal
Jan-31-19,Is It Finally Time to Buy Advanced Micro Devices?,Motley Fool
Jan-31-19,[$$] Intel Splits the Difference With New CEO,The Wall Street Journal
Jan-31-19,Tesla Keeps Struggling to Make Good on its Ambitious Targets: Tech Check Blog,TheStreet.com
Jan-31-19,"With Intel CEO choice, the bean counters are in charge of Silicon Valleys most storied tech company",MarketWatch
Jan-31-19,Here's Why Microsoft (MSFT) Stock Looks Strong After Q2 Earnings,Zacks
Jan-31-19,Intel stock slips as board says What about Bob? at end of lengthy CEO search,MarketWatch
Jan-31-19,"3 Things at Market Close: Intel, Facebook and China",TheStreet.com
Jan-31-19,US STOCKS-S&P 500's best month since 2015 ends on a high note,Reuters
Jan-31-19,Intel Names Interim CEO As Permanent Chief After Seven-Month Search,Investor's Business Daily
Jan-31-19,"US STOCKS-Wall St ascends, S&P 500 heads for best month since 2015",Reuters
Jan-31-19,"In new CEO Swan, Intel picks finance acumen over technical",American City Business Journals
