date,title,source
Jan-31-19,Intel's New CEO Promises to Be 'Bold and Fearless' in Meeting Challenges,TheStreet.com
Jan-31-19,[$$] Intel's CEO Search Ends Where It Began: With the CFO,The Wall Street Journal
Jan-31-19,"US STOCKS-S&P, Nasdaq extend rally after Facebook earnings, trade talks eyed",Reuters
Jan-31-19,"Intel makes interim CEO Swan permanent, bucking history of insiders",Reuters
Jan-31-19,Newly-minted Intel CEO Bob Swan clarifies reason he took position,CNBC Videos
Jan-31-19,[$$] Intel Splits the Difference With New CEO,The Wall Street Journal
Jan-31-19,"US STOCKS-S&P, Nasdaq boosted by Facebook results; eyes on trade talks",Reuters
Jan-31-19,"Intel makes interim CEO Swan permanent, bucking history of insiders",Reuters
Jan-31-19,Intel Slumps as Wall Street Scrutinizes New CEO Swan's Pedigree,Bloomberg
Jan-31-19,The Top 4 Intel Shareholders (INTC),Investopedia
Jan-31-19,Intel Names Swan CEO as Chipmaker Faces Challenging Market,Bloomberg
Jan-31-19,Robert Swan moves from interim to permanent CEO at Intel,Associated Press
Jan-31-19,"US STOCKS-S&P, Nasdaq boosted by Facebook results; eyes on trade talks",Reuters
Jan-31-19,"After a seven-month search, Intel names a new CEO",American City Business Journals
Jan-31-19,Intel Finds Its New CEO Close to Home,Barrons.com
Jan-31-19,AMD stock gains after Intel CEO announcement suggests 'an opening for AMD',MarketWatch
Jan-31-19,"Intel names Bob Swan permanent CEO, shares drop",American City Business Journals
Jan-31-19,"Forget Intel, NVIDIA Is a Better Growth Stock.",Motley Fool
Jan-31-19,Intel's New CEO Is ... Current Interim CEO Robert Swan,TheStreet.com
Jan-31-19,Intel makes interim CEO Swan permanent,Reuters
Jan-31-19,Intel Names Swan CEO After Ex-Chief Krzanich Ousted Last Year,Bloomberg
Jan-31-19,Intel stock falls after company names interim chief Bob Swan the new CEO,MarketWatch
Jan-31-19,Intel stock sinks after the chipmaker names Robert Swan as permanent CEO,CNBC
Jan-31-19,Intel Names Robert Swan CEO,Business Wire
Jan-31-19,Can You Earn Money in Stocks?,Investopedia
Feb-01-19,The Best Tech Products Will Overcome Volatile Times,Barrons.com
Feb-01-19,"Semiconductor Earnings Scorecard: INTC, TXN, XLNX, LRCX, ASML",Zacks
Feb-01-19,CORRECTING and REPLACING Media Alert: Intel Architects the Data-Centric 5G Future at Mobile World Congress 2019,Business Wire
Feb-01-19,AI is here to stay. These women want to make sure Intel does it right.,American City Business Journals
Feb-01-19,"With Intel CEO choice, the bean counters are in charge of Silicon Valleys most storied tech company",MarketWatch
Feb-01-19,Intel Rises 3%,Investing.com
Feb-01-19,Intel Stock Awaits Likely Rebound Under Interim-Turned-Permanent CEO Swan,InvestorPlace
Feb-01-19,PRESS DIGEST-New York Times business news - Feb 1,Reuters
Feb-01-19,[$$] Shares in besieged GE rally after a quarter with no surprise,Financial Times
Feb-04-19,"As Nasdaq exits correction, is it off to the races for tech?",CNBC Videos
Feb-04-19,Edited Transcript of INTC earnings conference call or presentation 24-Jan-19 10:00pm GMT,Thomson Reuters StreetEvents
Feb-04-19,Intel leads $30 million round in Chicago startup Catalytic,American City Business Journals
Feb-04-19,Dont Count On Xilinx Stocks Hot Streak to Last,InvestorPlace
Feb-04-19,Intel Capital Fuels Cloud Innovation with a Combined $30 Million Investment in Three Startups,Business Wire
Feb-04-19,"Palo Alto Networks may buy McAfee, Intel vets Cupertino startup",American City Business Journals
Feb-04-19,Be Careful with the Post-Earnings Rally in WDC Stock,InvestorPlace
Feb-04-19,"The Zacks Analyst Blog Highlights: Intel, Texas Instruments, Xilinx, Lam Research and ASML",Zacks
Feb-04-19,"Michigan Bought Intel and IBM Stock, and Sold Apple",Barrons.com
Feb-05-19,Better Buy: Intel vs. Xilinx,Motley Fool
Feb-05-19,Boeing (BA) Stock Looks Like a Strong Buy at Supersonic Highs,Zacks
Feb-05-19,"He may not be a techie, but Intel workers think Bob Swan is the right CEO for right now",American City Business Journals
Feb-05-19,Intel outlines expansion plans with Hillsboro neighbors,American City Business Journals
Feb-05-19,"Final trades: chips, big tech, & retail",CNBC Videos
Feb-05-19,"At Tesla and Intel, 2 Unsettling Stories From the C-Suite",Motley Fool
Feb-05-19,Reports of Facebook's Decline Have Been Greatly Exaggerated,Motley Fool
Feb-05-19,Silicon Valley's 20 highest-paid CEOs may surprise you,American City Business Journals
Feb-06-19,Here are the 5 biggest beneficiaries of the 5G rollout: Jim Cramer,CNBC Videos
Feb-06-19,Here are the 5 biggest beneficiaries of the 5G rollout: Jim Cramer,CNBC
Feb-06-19,3 Reasons Traders Will Want to Watch Semiconductors,Investopedia
Feb-06-19,"3 Big Stock Charts for Wednesday: Intel, Electronic Arts and Conagra Brands",InvestorPlace
Feb-06-19,Bear of the Day: Apple (AAPL),Zacks
Feb-07-19,"If you own Apple, Amazon, Facebook or AMD, look out below",MarketWatch
Feb-07-19,"Intel expansion may result in nearly 1,750 new jobs in Hillsboro",American City Business Journals
Feb-07-19,"Cramer Talks Telecom Stocks: What To Buy Ahead Of 5G, China Trade Deal",Benzinga
Feb-07-19,Thursday Apple Rumors: Apple Working on Its Own Modems,InvestorPlace
Feb-07-19,End of an Era: Big Tech Stocks Move from Growth to Value,Zacks
Feb-07-19,Dont Rush to Buy Micron Stock,InvestorPlace
Feb-07-19,Apple restructures in-house modem group in its race to 5G,American City Business Journals
Feb-07-19,Can Semiconductor Industry Sustain Momentum in 2019?,Zacks
Feb-07-19,Bear of the Day: NVIDIA (NVDA),Zacks
Feb-07-19,Soccer: New TV technology to take fans 'inside the game',Reuters
Feb-07-19,"Arsenal FC, Liverpool FC and Manchester City Bring Immersive Experiences to Fans with Intel True View",Business Wire
Feb-08-19,"Overwatch League inks Coca-Cola, Toyota, T-Mobile as sponsors",American City Business Journals
Feb-08-19,"Zacks Value Trader Highlights: IBM, Microsoft, Intel, Cisco and Apple",Zacks
Feb-08-19,"Why a Big Investment Manager Bought Up Microsoft, IBM, and Nvidia Stock",Barrons.com
Feb-08-19,Why AMD Stock Looks Good Up to $25 but Not Beyond,InvestorPlace
Feb-08-19,Heres Why New CEO Bob Swan Is Perfect for Intel Stock,InvestorPlace
Feb-08-19,The safest ways to use free public Wi-Fi from a Dayton expert,American City Business Journals
Feb-08-19,Stocks - Wall Street Slumps on Trade Worries,Investing.com
Feb-11-19,Trump Signs Order Prioritizing Artificial Intelligence Research,Bloomberg
Feb-11-19,6 Cheap Stocks With Low Price-Earnings Ratios,GuruFocus.com
Feb-11-19,3 Cheap Stocks to Buy (Before They Skyrocket),InvestorPlace
Feb-11-19,Intels global creative chief is out after in-house ad agency model fails,American City Business Journals
Feb-11-19,IBM Inks $2 Billion Deal to Develop AI Hardware Center in NY,Zacks
Feb-11-19,Honeywells Pension Bought Up GE Stock and Doubled Down on Netflix,Barrons.com
Feb-11-19,Google extends chip-making efforts to design hub Bengaluru,Reuters
Feb-12-19,Aquantia Corp. (AQ) Q4 2018 Earnings Conference Call Transcript,Motley Fool
Feb-12-19,5 Self-Driving Car Stocks to Buy,InvestorPlace
Feb-12-19,Honeywells Pension Bought Up GE Stock and Doubled Down on Netflix,Barrons.com
Feb-12-19,The Best S&P 500 Stocks of 2018,Investopedia
Feb-12-19,Ericsson-Intel Partner to Develop Advanced Platform for CSPs,Zacks
Feb-13-19,"Nvidia (NVDA) Q4 Earnings Preview: Gaming, Data Centers &amp; More",Zacks
Feb-13-19,Should You Buy AMD Stock in 2019? 6 Factors to Consider,TheStreet.com
Feb-13-19,Has Intel Corporation (NASDAQ:INTC) Got Enough Cash?,Simply Wall St.
Feb-13-19,Intel Names Robert Swan CEO,ETF Trends
Feb-13-19,The C-suite hiring puzzle: How companies like Intel are shifting strategies,American City Business Journals
Feb-13-19,"MarketPulse: Lattice Semiconductor Surges on Earnings, Lifting Chip Stocks",Investing.com
Feb-14-19,"Overwatch League kicks off season with new teams, broadcast partners",American City Business Journals
Feb-14-19,Bulls bet on Intel and one more chip stock,CNBC Videos
Feb-14-19,The Main Drivers of Microsoft Stock Are Still Intact,InvestorPlace
Feb-14-19,3 Software Stocks to Buy for Big Changes And High Growth,InvestorPlace
Feb-14-19,Walmart startup partners with DreamWorks for 'How to Train Your Dragon' virtual reality experience,MarketWatch
Feb-14-19,Apple to ship iPhones with only Qualcomm chips to German stores,Reuters
Feb-14-19,"Apple resumes sale of iPhones in Germany, with Qualcomm chip",Associated Press
Feb-14-19,Tech Giants Are Increasingly Designing Their Own Custom Chips - How to Play It,TheStreet.com
Feb-14-19,U.S.-China Trade Deal Could Pump Up These Stocks,Zacks
Feb-14-19,"3 Big Stock Charts for Thursday: Conagra Brands, Intel and Franklin Resources",InvestorPlace
Feb-14-19,Sierra Wireless (SWIR) Q4 2018 Earnings Conference Call Transcript,Motley Fool
Feb-14-19,Apple to ship iPhones with only Qualcomm chips to German stores,Reuters
Feb-14-19,Apple to ship iPhones with only Qualcomm chips to German stores,Reuters
Feb-14-19,Apple to ship iPhones with only Qualcomm chips to German stores,Reuters
Feb-15-19,AMD Stock Will Benefit Even More with the Rise of Cloud Computing,InvestorPlace
Feb-15-19,"Fridays Vital Data: Bristol-Myers Squibb, Intel and Activision Blizzard",InvestorPlace
Feb-15-19,"iRobot, Grubhub, Broadcom, Intel and Marvell highlighted as Zacks Bull and Bear of the Day",Zacks
Feb-19-19,Qualcomm urges U.S. regulators to reverse course and ban some iPhones,Reuters
Feb-19-19,Qualcomm urges U.S. regulators to reverse course and ban some iPhones,Reuters
Feb-19-19,"Apple Roundup: China, Services, App Store, Pullstring &amp; More",Zacks
Feb-19-19,"Charting a primary trend shift: S&P 500, Nasdaq reclaim 200-day average",MarketWatch
Feb-19-19,3 Stocks With Breakout Potential,InvestorPlace
Feb-19-19,Cupertino 'surround' video startup backed by Intel acquired for $125M,American City Business Journals
Feb-19-19,"Nvidia Stock Soars After Fourth Quarter, So Now What?",InvestorPlace
Feb-20-19,7 Healthy Dividend Stocks to Buy for Extra Stability,InvestorPlace
Feb-20-19,"AI Chip Market Will Soar to $34 Billion in Five Years, Says Analyst",Barrons.com
Feb-20-19,"The Zacks Analyst Blog Highlights: Apple, Alphabet, Amazon, Intel and Qualcomm",Zacks
Feb-20-19,Qualcomm urges U.S. regulators to reverse course and ban some iPhones,Reuters
Feb-20-19,Nio Stock Logic Plays On China Car Buying Instead of Unaffordable Apartments,InvestorPlace
Feb-21-19,The Real Story Behind Facebook's AI Chip Push,Motley Fool
Feb-21-19,Heres Why You Should Sell the Rally in AMD Stock,InvestorPlace
Feb-21-19,Trump urges U.S. telecommunications companies to step up 5G systems,Reuters
Feb-21-19,Trump urges U.S. telecommunications companies to step up 5G systems,Reuters
Feb-21-19,Autonomous Driving Set to Rev Up: 4 Stocks to Gain,Zacks
Feb-21-19,This Stock Could Become the Next NVIDIA,Motley Fool
Feb-21-19,7 Executives Who Climbed The Corporate Ladder,Benzinga
Feb-21-19,Stocks - Wall Street Falls After Weak U.S. Economic Data,Investing.com
Feb-22-19,Intel: 5G Chips Won't Show Up in Smartphones Until 2020,TheStreet.com
Feb-22-19,Traders discuss whether investors should pick up Intel after its upgrade by Morgan Stanley,CNBC Videos
Feb-22-19,"Intel Upgraded, Broadcom Downgraded As Analysts Rethink Chip Stocks",Investor's Business Daily
Feb-22-19,4 ETFs to Invest in Soaring Semiconductor Stocks,Zacks
Feb-22-19,Intel says its 5G modem chips will not appear in phones until 2020,Reuters
Feb-22-19,5 Dow Jones Stocks That Will Lead the Market Higher,InvestorPlace
Feb-22-19,Intel says its 5G modem chips will not appear in phones until 2020,Reuters
Feb-22-19,Intel Stock Gets Upgraded Because Its Too Cheap,Barrons.com
Feb-22-19,Intel says its modem chips will not appear in phones until 2020,Reuters
Feb-22-19,Friday Apple Rumors: Apple Closing Stores to Combat Patent Trolls,InvestorPlace
Feb-22-19,"Stocks making the biggest moves midday: Kraft Heinz, Wayfair, Stamps.com & more",CNBC
Feb-22-19,The 3D XPoint Could Be a True Game Changer for MU Stock,InvestorPlace
Feb-22-19,US STOCKS-Tech stocks lift Wall Street amid trade hopes,Reuters
Feb-22-19,Morgan Stanley is bullish on Intel for the first time in 7 years,MarketWatch
Feb-22-19,Stocks - Dow Rallies as Trump Talks up Prospects of Trade Deal,Investing.com
Feb-22-19,"Morgan Stanley Turns Bullish On Intel, Cites CEO Changeover",Benzinga
Feb-22-19,Intel Shares Jump on Morgan Stanley Upgrade,TheStreet.com
Feb-22-19,HP (HPQ) to Post Q1 Earnings: What's in Store for the Stock?,Zacks
Feb-22-19,Dow Jones Gains 100 Points As These 2 Top Stocks Soar On Earnings,Investor's Business Daily
Feb-22-19,Intel Thinks Apple Will Move to ARM-Based Macs in 2020,InvestorPlace
Feb-22-19,"Stocks, Oil Prices Jump On Trade Talks; Intel Upgraded",Investor's Business Daily
Feb-22-19,US STOCKS-Wall St set to bounce on signs of trade progress,Reuters
Feb-22-19,"The Zacks Analyst Blog Highlights: General Motors, Alphabet, Intel and BlackBerry",Zacks
Feb-22-19,Intel shares jump after Morgan Stanley upgrades the stock and predicts a big rally,CNBC
Feb-22-19,US STOCKS-Futures bounce on signs of progress in trade talks,Reuters
Feb-22-19,"Stocks - Wall Street Rises Ahead of Trump, China Vice Premier Trade Meeting",Investing.com
Feb-22-19,Stocks - U.S. Futures Higher as Trump Prepares to Meet Top China Trade Rep,Investing.com
Feb-25-19,"Qualcomm, Sprint and Others Tee Up Their 5G Plans",TheStreet.com
Feb-25-19,Monday Apple Rumors: AAPL May Not Have a 5G iPhone Until 2020,InvestorPlace
Feb-25-19,"Intel CEO Bob Swan talks trade, economy and more",CNBC Videos
Feb-25-19,2 Pros Debate: Is Intel A Compelling Buy Or Value Trap?,Benzinga
Feb-25-19,Intel and Apple Among Stocks Set to Gain on Improving U.S.-China Relations,TheStreet.com
Feb-25-19,"Late to 5G, Intel instead talks up its infrastructure partners",American City Business Journals
Feb-25-19,Heres how Silicon Valleys largest tech employers did under Trumps stricter H-1B process,American City Business Journals
Feb-25-19,"[$$] Stocks to Watch: GE, Facebook, Twitter, and Intuit",The Wall Street Journal
Feb-25-19,Nutanix (NTNX) to Report Q2 Earnings: What's in the Cards?,Zacks
Feb-25-19,"Intel shares are ripping, and one trader says its heading back toward highs",CNBC
Feb-25-19,"Chipmaker Intel has ripped higher, and one trader says it's heading back to record levels",CNBC
Feb-25-19,Intel aims to push beyond phones with 5G infrastructure deals,Reuters
Feb-25-19,Intel aims to push beyond phones with 5G infrastructure deals,Reuters
Feb-25-19,MWC 2019: Intel Showcases New Products and Partnerships Accelerating the 5G Revolution,Business Wire
Feb-25-19,Intel Announces Next-Generation Acceleration Card to Deliver 5G,Business Wire
Feb-26-19,Intel receives $500 million bond approval for Chandler campus,American City Business Journals
Feb-26-19,"Intel (INTC) Stock Has Gotten off to a Good Start in 2019, But This Analyst Is Still Unconvinced",SmarterAnalyst
Feb-26-19,"Intel CEOs Visionary Strategy Can Drive the Stock Higher, Analyst Says",Barrons.com
Feb-26-19,Intel target hiked at Deutsche Bank,MarketWatch
Feb-26-19,Intel at MWC 2019: 5G &amp; Edge Computing Remain Focal Points,Zacks
Feb-26-19,Is the Future Foldable Smartphones? Where Does That Leave Apple?,InvestorPlace
Feb-26-19,"Stock Market News For Feb 26, 2019",Zacks
Feb-26-19,NVIDIA Ups the Ante on Gaming With GeForce GTX 1660 Ti,Zacks
Feb-27-19,Cold War With China Will Hurt U.S. Stocks Long After Trade Deal,Investopedia
Feb-27-19,RSA 2019: Intel and Partner Ecosystem Offer New Silicon-Enabled Security Solutions,Business Wire
Feb-27-19,"AMD at EWC 2019: Edge Computing Alliances, Deal Wins &amp; More",Zacks
Feb-28-19,Intel (INTC) Ups the Ante in Hardware Security With SGX Card,Zacks
Feb-28-19,New Intel CEO Says Paranoia (and 5G) Will Pay Off for the Chip Giant,TheStreet.com
Feb-28-19,How Will Partnership With VMware Affect Microsoft Stock?,InvestorPlace
Feb-28-19,"HP (HPQ) Q1 Earnings Meet Mark, Revenues Miss, Shares Fall",Zacks
Feb-28-19,Intel Drives Development of Quantum Cryoprober with Bluefors and Afore to Accelerate Quantum Computing,Business Wire
Feb-28-19,"Recent Analysis Shows Intel, Gilead Sciences, Amdocs, Ascendis Pharma A/S, Hill-Rom, and Ingevity Market Influences  Renewed Outlook, Key Drivers of Growth",GlobeNewswire
Feb-28-19,How to Profit Off a U.S.-China Stock Rebound,Investopedia
Mar-01-19,Intel and 2 Other Stock Picks From a Tech Analyst,Barrons.com
Mar-01-19,Outsourcers file more than 40 lawsuits challenging Trump-era H-1B visa restrictions,American City Business Journals
Mar-04-19,DEQ names 20 companies for Cleaner Air Oregon review,American City Business Journals
Mar-04-19,"Top Research Reports for Intel, AbbVie & United Technologies",Zacks
Mar-04-19,Jury selection begins in Qualcomms patent case against Apple,American City Business Journals
Mar-04-19,IBM Attains Highest Quantum Volume Milestone: Key Takeaways,Zacks
Mar-04-19,Will Intel Corporations (NASDAQ:INTC) Earnings Grow In The Years Ahead?,Simply Wall St.
Mar-04-19,Qualcomm launches patent challenge to Apple ahead of antitrust case,Reuters
Mar-04-19,Qualcomm launches patent challenge to Apple ahead of antitrust case,Reuters
Mar-05-19,"Tuesday Apple Rumors: 5G Supplier, Foldable Phones, Futuristic Car",InvestorPlace
Mar-05-19,Rajaratnam's $92.8 million SEC civil fine is upheld,Reuters
Mar-05-19,"The Zacks Analyst Blog Highlights: Intel, AbbVie, United Technologies, Simon Property and FirstEnergy",Zacks
Mar-05-19,Mellanox Adapters Selected by JD Cloud to Boost Efficiency,Zacks
Mar-05-19,Stocks - Wall Street Slips as China Growth Forecast Disappoints,Investing.com
Mar-06-19,How to play Apple and two other tech names on progress in US-China trade talks,CNBC
Mar-06-19,Why Intel Stock Rose 12% in February,Motley Fool
Mar-06-19,Jim Cramer: This Is the Selloff a Lot of People Have Been Waiting For,TheStreet.com
Mar-06-19,"Stocks - Wall Street Mixed After ADP Data, Lack of Trade Deal News",Investing.com
Mar-07-19,"How Lattice Semiconductor survived a scuttled $1.3B deal, a powerful activist investor and big changes at the top",American City Business Journals
Mar-07-19,Galaxy S10 Estimates Raised; Suppliers Still Look Cheap - Tech Check,TheStreet.com
Mar-07-19,Buy Micron Heading into Q2 Earnings with MU Stock Up 20% in 2019?,Zacks
Mar-07-19,These 7 tech companies are todays 5G winners,MarketWatch
Mar-07-19,Chip Stock Reversal Could Signal Long-Term Top,Investopedia
Mar-07-19,No Growth May Plague Intel in 2019,Investopedia
Mar-08-19,Intel Is Finally Getting New Blood and Thats Good News for Investors,Barrons.com
Mar-08-19,Intel (INTC) Dips More Than Broader Markets: What You Should Know,Zacks
Mar-08-19,"The smart money prefers Alibaba over Amazon, Intel over AMD, and Google over Apple",MarketWatch
Mar-08-19,"Meet the woman who won over Google, Apple and Intel to get more girls into tech",CNBC
Mar-11-19,Nvidias Mellanox Buy Begs the Questions: Whos Next?,Barrons.com
Mar-11-19,"The smart money prefers Alibaba over Amazon, Intel over AMD, and Google over Apple",MarketWatch
Mar-11-19,Nvidia Outbids Intel To Buy Mellanox For $6.9 Billion In Cash,Investor's Business Daily
Mar-11-19,"5 Top Stock Trades for Tuesday: Apple, Nvidia, Boeing",InvestorPlace
Mar-11-19,Nvidia outbids Intel to buy Israel's Mellanox in data centre push,Reuters
Mar-11-19,Buy NVDA Stock With Nvidia Set to Buy Mellanox to Expand Cloud Business?,Zacks
Mar-11-19,Why Advanced Micro Devices Stock Should Be Bought on Weakness,InvestorPlace
Mar-11-19,Former Intel Capital VC explains why he joined a 'micro-fund' and what it's investing in,American City Business Journals
Mar-11-19,Nvidia outbids Intel for Mellanox,Reuters Videos
Mar-11-19,Should You Buy Nvidia Stock for Its Mellanox Deal?,InvestorPlace
Mar-11-19,Nvidia Is Buying Mellanox. Heres What It Means for Semiconductors.,Barrons.com
Mar-11-19,NVIDIA Sparks Rumors to Beat Rivals in Mellanox Buyout Race,Zacks
Mar-11-19,"Outbidding Intel, Nvidia scoops up Mellanox in $6.9B cash deal",American City Business Journals
Mar-11-19,$143 Billion Is Watching the Nvidia-Mellanox Deal,Bloomberg
Mar-11-19,Dow Jones Futures Fall As Boeing Dives In Key Week For Stock Market Rally,Investor's Business Daily
Mar-11-19,Crypto Inches Down; Invesco Launches Blockchain ETF,Investing.com
Mar-12-19,Better Buy: Seagate Technology vs. Intel,Motley Fool
Mar-12-19,[$$] Intel Keeps Its Powder Dry,The Wall Street Journal
Mar-12-19,Semi stock come back? 6 trades,CNBC Videos
Mar-12-19,Top technician says this is the key level to watch in the semis,CNBC Videos
Mar-12-19,"Nvidia's Purchase Of Mellanox Seen As Defensive Move, But Wall Street Approves",Investor's Business Daily
Mar-12-19,NVIDIA Outbids Intel &amp; Xilinx to Acquire Mellanox for $6.9B,Zacks
Mar-12-19,"Chips are on a tear, and one Dow stock could be on its way back to recent highs",CNBC
Mar-12-19,Legal Noise Wont Stop Qualcomm Stock,InvestorPlace
Mar-12-19,Nvidia Acquires Mellanox: What Does the Deal Mean for Intel Stock?,InvestorPlace
Mar-12-19,Bet on NVIDIA's Largest-Ever Deal With These ETFs,Zacks
Mar-12-19,Why 2019 Probably Will Be a Really Tough Year for Nvidia Stock,InvestorPlace
Mar-12-19,Why Nvidia really needed to win over Mellanox,American City Business Journals
Mar-12-19,Nvidias Mellanox Buy Begs the Question: Whos Next?,Barrons.com
Mar-12-19,"Nvidia Addresses Needs for AI, Robotics Revolution With Mellanox Deal",TheStreet.com
Mar-12-19,[$$] Intel Keeps Its Powder Dry,The Wall Street Journal
Mar-12-19,Is Micron Stock Poised To Make New Lows On Changes To DRAM Chip Outlook?,InvestorPlace
Mar-12-19,Why an Apple and AMD Veteran Decamped for Intel,Barrons.com
Mar-12-19,Stocks - U.S. Futures Turn Lower After Brexit Blow; More Boeings Grounded,Investing.com
Mar-13-19,"Dow Jones Futures: S&P 500, Nasdaq Hit 2019 Rally Highs; Intel, Arista Break Out",Investor's Business Daily
Mar-13-19,7 Dividend Stocks With Big Yields,InvestorPlace
Mar-13-19,5 Large-Cap Stocks Pushing Higher,InvestorPlace
Mar-13-19,Intel Is a Bargain for Risk-Averse Investors,TheStreet.com
Mar-13-19,Mellanox Ups Ante in Storage Virtualization With NVMe SNAP,Zacks
Mar-13-19,Intel Tells TheStreet How It's Going After Nvidia in the A.I. Chip Market,TheStreet.com
Mar-13-19,Dongles and Dollars Keep Square on the Move,MoneyShow
Mar-13-19,Bet Your Chips on Intel,MoneyShow
Mar-14-19,Intel (INTC) Dips More Than Broader Markets: What You Should Know,Zacks
Mar-14-19,Intel analyst lays out the bear case for the chipmaker,American City Business Journals
Mar-14-19,Why Intel Stock Isnt Too Exciting,InvestorPlace
Mar-14-19,Intel Declares Quarterly Cash Dividend,Business Wire
Mar-14-19,"Dow Jones Futures: Two Big Earnings Movers After Intel, Arista Networks Break Out",Investor's Business Daily
Mar-15-19,Market Rally Hits 2019 High On Apple; Boeing 737 Max Grounded; Tesla Model Y Unveiled: Weekly Review,Investor's Business Daily
Mar-15-19,"Intel, Microsoft Lead Dow Jones; Broadcom, Ulta Beauty Soar On Earnings",Investor's Business Daily
Mar-15-19,15 New Products Apple Might Release in 2019,Kiplinger
Mar-15-19,Stocks - Dow Snaps Losing Streak as China Touts Progress on Trade,Investing.com
Mar-15-19,Micron (MU) Q2 Earnings: What's in the Cards for the Stock?,Zacks
Mar-15-19,7 Best Quantum Computing Stocks Trading Today,InvestorPlace
Mar-15-19,ETF Pick of the Month: Watch out for Major Resistance Facing Semiconductors,ETF Database
Mar-18-19,Huawei leads Asian domination of U.N. patent applications in 2018,Reuters
Mar-18-19,The most powerful supercomputer in the world is coming to Chicago area,American City Business Journals
Mar-18-19,"Buy 'Cheap' Micron (MU) Stock Before Earnings, Despite Chip Price Worries?",Zacks
Mar-18-19,"Project Aurora: U.S. government, Intel aim for nation's fastest computer",Reuters
Mar-18-19,5 Chip Stocks on the Rise,InvestorPlace
Mar-18-19,U.S. Department of Energy and Intel to Deliver First Exascale Supercomputer,Business Wire
Mar-18-19,AI and IoT a Match Made in Heaven,ACCESSWIRE
Mar-18-19,Why Breakouts From These Hot Chip Stocks Bode Well For Market Rally,Investor's Business Daily
Mar-18-19,Stocks - U.S. Futures Mixed as Trade Summit Reportedly Postponed to June,Investing.com
Mar-19-19,AMD Tests Highs After Intel Issues and Gaming Comments,Investopedia
Mar-19-19,"NVIDIA Ups the Game in AI, Tesla T4 GPU Gains AWS Adoption",Zacks
Mar-19-19,"Nvidia Stock Is a Keeper, Its Just Not a Buy Right Now",InvestorPlace
Mar-19-19,Micron Stock Will Likely See Little Change After Wednesdays Earnings Report,InvestorPlace
Mar-19-19,Exclusive: Israel's chip sales to China jump as Intel expands,Reuters
Mar-19-19,Exclusive: Israel's chip sales to China jump as Intel expands,Reuters
Mar-20-19,Intel (INTC) Dips More Than Broader Markets: What You Should Know,Zacks
Mar-20-19,Winners and Losers From Alphabet's Gaming Effort,TheStreet.com
Mar-20-19,7 5G Stocks to Buy as the Race for Spectrum Tightens,InvestorPlace
Mar-20-19,Will Semiconductor ETFs' Best Start to a Year Last Long?,Zacks
Mar-20-19,HP Brings New Solutions at HP Reinvent to Boost Business,Zacks
Mar-20-19,"AMDs and Googles Relationship Is Just Getting Started, Analyst Predicts",Barrons.com
Mar-20-19,3 Chip Stocks to Buy for the Next 3 Years,InvestorPlace
Mar-21-19,Apple Updates Portfolio Prior to Streaming Service Launch,Zacks
Mar-21-19,Micron's Latest Earnings Signal the Worst Could Soon Be Over for Chipmakers,TheStreet.com
Mar-21-19,Buy Apple (AAPL) Stock Up 22% in 2019 Before Streaming Video Launch?,Zacks
Mar-21-19,Qualcomm Offers AI-Enabled Chips for Smarter Audio Apps,Zacks
Mar-21-19,"Micron (MU) Q2 Earnings Miss Estimates, Q3 View Disappoints",Zacks
Mar-22-19,The Biggest Threats Facing Tech Stocks Now,Investopedia
