date,title,source
Oct-17-18,Intel Just Teamed Up With One of Its Biggest Rivals,Motley Fool
Oct-17-18,Stocks Slip as Fed Stays the Course,Investopedia
Oct-17-18,Intel restructures manufacturing organization,American City Business Journals
Oct-17-18,Semiconductor Bear Market Could Trap Complacent Shareholders,Investopedia
Oct-17-18,Things Are Finally Looking Up for Chipmakers,Bloomberg
Oct-18-18,Micron to buy Intel's stake in joint venture IM Flash Technologies,Reuters
Oct-18-18,Micron to buy Intel's stake in joint venture IM Flash Technologies,Reuters
Oct-18-18,Micron to buy out Intel's share in flash memory joint venture for $1.5 billion,MarketWatch
Oct-18-18,Will Apple Really Switch Macs Off Intel Chips in 2020?,InvestorPlace
Oct-18-18,15 Cheap Stocks With Low Risk Profiles,InvestorPlace
Oct-18-18,Is It Too Early to Get Back Into Nvidia Stock?,InvestorPlace
Oct-18-18,Theres a Huge Flaw in Valuing AMD Stock Like Amazon or Netflix,InvestorPlace
Oct-19-18,Micron's Plans to Buy Out Intel's JV Stake Strengthen its Data Center Hand,TheStreet.com
Oct-19-18,"Why Advanced Micro Devices, Inc. Stock Closed 11% Lower on Friday",Motley Fool
Oct-19-18,Why Intel Could Leave AMD in the Dust,Barrons.com
Oct-19-18,Analysts: Micron's Buyout of Joint Flash Venture With Intel A Long-Term Positive,Benzinga
Oct-19-18,3 Software Stocks to Buy for Big Changes and High Growth,InvestorPlace
Oct-19-18,3 Earnings Reports to Watch Next Week,InvestorPlace
Oct-19-18,Micron Buying Out Intel's Stake in Flash Memory Joint Venture for $1.5 Billion,TheStreet.com
Oct-19-18,Western Digital Looks to Flash for the Future,Morningstar
Oct-19-18,Why Is Micron Bullish on 3D XPoint Technology?,Investopedia
Oct-22-18,Intel Rises 3%,Investing.com
Oct-22-18,Why Cisco is adding perks like fertility services to its employee benefits package,American City Business Journals
Oct-22-18,Should You Buy Intel This Week Into Earnings?,TheStreet.com
Oct-22-18,"Buy Intel, Only Chip Stock that Will Lift Estimates: Nomura",Investopedia
Oct-22-18,Meet What Could Be Advanced Micro Devices' Next Billion-Dollar Business,Motley Fool
Oct-22-18,Intel earnings: What the chip maker can say to turn assuage doubts,MarketWatch
Oct-22-18,Intel Denies Report About New Manufacturing Setback as AMD Preps Next-Gen Chips,TheStreet.com
Oct-22-18,Stocks - Wall Street Falls After Disappointing Earnings Results,Investing.com
Oct-22-18,Intel (INTC) to Report Q3 Earnings: Is a Beat in Store?,Zacks
Oct-22-18,Two tech stocks to buy and one to avoid heading into busiest week of earnings,CNBC
Oct-22-18,"Intel Is The Semiconductor Sector's Only Candidate For Estimate Raises, Nomura Says In Upgrade",Benzinga
Oct-22-18,Why You Should Buy Beaten-Down Chip ETFs Ahead of Q3 Earnings,Zacks
Oct-22-18,"Why Intel Stock Is Now a Buy, According to Nomura Instinet",Barrons.com
Oct-22-18,Intel's stock gains after Instinet says 'buy' ahead of results,MarketWatch
Oct-22-18,Stocks - U.S. Futures Rise Ahead of Earnings,Investing.com
Oct-22-18,Intel Jumps Higher After Nomura Upgrade Ahead of Q3 Earnings Thursday,TheStreet.com
Oct-22-18,Intel shares gain after Nomura upgrade,CNBC
Oct-22-18,"Stocks making the biggest move premarket: KMB, HAL, HAS, PII, INTC & more",CNBC
Oct-23-18,Apple Might Ditch Intel in the Macs in 2020,Motley Fool
Oct-23-18,AMD Stock Is Up 140% in 2018 and May Not Be Done Yet,Barrons.com
Oct-23-18,Latest Intel Study Finds People Expect Self-Driving Cars to Be Common in 50 Years,Business Wire
Oct-23-18,"Banks vs. Big Tech: 4 to Buy, 4 to Sell",InvestorPlace
Oct-23-18,One of the inventors of Apple's fingerprint sensor is now making tech easier for seniors,CNBC
Oct-23-18,Three S&P 500 stocks (and two Dow names) could be a buy heading into earnings,CNBC
Oct-23-18,"Intel's (INTC) Q3 Earnings: CCG, DCG & NSG in Spotlight",Zacks
Oct-23-18,Advanced Micro Devices Stock Is Finally Ready for a Strong Comeback,InvestorPlace
Oct-23-18,Intel Looks Vulnerable to Further Losses,TheStreet.com
Oct-23-18,Zappos wants the hard of hearing to listen to music. Here's how they can do it.,CNBC
Oct-23-18,"Chip stocks could plunge another 8 percent before hitting bottom, technician warns",CNBC
Oct-23-18,Intel Denies Report That 10nm Is Canceled,Motley Fool
Oct-24-18,"AMD Follows TI With Dour Sales Forecast, Adding to Chip Woes",Bloomberg
Oct-24-18,"Stocks - Dow Down 600 Points, Turns Negative for the Year as Earnings Disappoint",Investing.com
Oct-24-18,Highflying Chip Stock AMD Plunges on Weak Guidance,Barrons.com
Oct-24-18,Intel Falls 3%,Investing.com
Oct-24-18,Here are the biggest Silicon Valley losers in Nasdaq correction,American City Business Journals
Oct-24-18,"AMD's Revenue and Forecasts Fall Short, Sending Stock Tumbling",Bloomberg
Oct-24-18,Big questions hang over Intel's upcoming earnings report,American City Business Journals
Oct-24-18,How Stephen Hawking helped Intel build better accessibility technology,American City Business Journals
Oct-24-18,"5 Top Stock Charts for Thursday: Ford, AMD Earnings on Deck",InvestorPlace
Oct-24-18,Buy Nvidia Stock While Everyone Else Panic Sells,InvestorPlace
Oct-24-18,Wednesday Apple Rumors: Apple Registers New Macs in Eurasia,InvestorPlace
Oct-24-18,Why Intel Wants Investors to Focus On This Metric,Motley Fool
Oct-24-18,Investors Flee Semiconductor ETF SMH,ETF Trends
Oct-24-18,Two 'siren' Dow stocks could hold the key to where the market heads next,CNBC
Oct-24-18,What You Need to Know About Intel's Internet of Things Business,Motley Fool
Oct-24-18,"Stocks - U.S. Futures Slump Ahead of Earnings, Data",Investing.com
Oct-24-18,"Your first trade for Wednesday, October 24",CNBC
Oct-24-18,Why Earnings Season Could Be Great for Intel (INTC),Zacks
Oct-24-18,Micron Is Buying Intel's Share of IM Flash Technologies,Motley Fool
Oct-24-18,AMD Stock Looks Good Ahead of Q3 Earnings Report,Zacks
Oct-24-18,Get Ready for Another AMD vs. Intel Battle,Barrons.com
Oct-24-18,Intel Stock Needs an Earnings Beat (And Chip Stocks Need It Even More),InvestorPlace
Oct-24-18,Mobileye Opens Up Driverless Tech as Tie-Up With Intel Deepens,Bloomberg
Oct-25-18,Intel's Still Dancing as the Chip Party Dies,Bloomberg
Oct-25-18,Intel avoids chip swoon  for now,MarketWatch
Oct-25-18,"Intel bucks chip industry woes; powered by PCs, iPhones",Reuters
Oct-25-18,Day Ahead: Top 3 Things to Watch,Investing.com
Oct-25-18,"Intel Tops Earnings Estimates, Lifts Guidance; Shares Climb",Investing.com
Oct-25-18,Intel Gives Bullish Outlook on Surprising Jump in PC Demand,Bloomberg
Oct-25-18,Stocks - Dow Returns to Positive for the Year After 400-Point Rally,Investing.com
Oct-25-18,"Intel bucks chip industry woes; powered by PCs, iPhones",Reuters
Oct-25-18,"Intel stock gains evaporate following updates on next-gen chip, margins",MarketWatch
Oct-25-18,[$$] Intel Raises Forecast Amid Robust Chip Sales,The Wall Street Journal
Oct-25-18,"New Batch of Q3 Earnings: AMZN, GOOGL, INTC & More",Zacks
Oct-25-18,"Intel bucks chip industry woes, powered by PCs",Reuters
Oct-25-18,Intel (INTC) Q3 Earnings and Revenues Beat Estimates,Zacks
Oct-25-18,"Stocks making the biggest moves after hours: Amazon, Alphabet, Snap, Intel and more",CNBC
Oct-25-18,"Data center, PC demand drives Intel profit beat",Reuters
Oct-25-18,Intel Is Up After Topping Expectations and Raising Guidance,TheStreet.com
Oct-25-18,Intel: 3Q Earnings Snapshot,Associated Press
Oct-25-18,"Intel's stock rallies more than 5% as earnings, outlook top Wall Street targets",MarketWatch
Oct-25-18,Intel Stock Jumps On Better-Than-Expected Third-Quarter Earnings,Investor's Business Daily
Oct-25-18,The Top 4 Intel Shareholders (INTC),Investopedia
Oct-25-18,Intel soars on big earnings beat,CNBC
Oct-25-18,"Dow Soars 470 Points As Apple, Microsoft Lead Stock Market Rally",Investor's Business Daily
Oct-25-18,How Did Intel Get Its Name? Hint: Two Words Blend to Create It,TheStreet.com
Oct-25-18,Intel earnings: What the chip maker can say to assuage doubts,MarketWatch
Oct-25-18,Intel Rises 3%,Investing.com
Oct-25-18,These Two Chip Stocks Buck Market Downtrend As AMD Plummets,Investor's Business Daily
Oct-25-18,Analysts break down the semiconductor sector,CNBC Videos
Oct-25-18,AMD Chief Lisa Su Says the Trade War Is an Opportunity,Barrons.com
Oct-25-18,Stocks - U.S. Futures Rally Ahead of Earnings,Investing.com
Oct-25-18,"Nasdaq Leads Stocks Higher As Tesla, Xilinx Pace Early Gains",Investor's Business Daily
Oct-25-18,"Tech stocks bounce back on the heels of strong Twitter, Microsoft and Tesla earnings",CNBC
Oct-25-18,AMD Is Getting Battered After a Weak Revenue Forecast. Heres What Wall Street Is Saying,Bloomberg
Oct-25-18,Top 5 Things to Know in The Market on Thursday,Investing.com
Oct-25-18,[$$] FirstFT: Todays top stories,Financial Times
Oct-25-18,"AMD Follows TI With Dour Sales Forecast, Adding to Chip Woes",Bloomberg
Oct-25-18,Saving This Market May Come Down to These 4 Things: Taking Stock,Bloomberg
Oct-25-18,Highflying AMD Stock Plunged on Weak Guidance,Barrons.com
Oct-25-18,"China says ""hard to understand"" U.S. skipping import fair",Reuters
Oct-25-18,[$$] Intel Looks to Calm Concerns on Chip Supplies,The Wall Street Journal
Oct-25-18,Microsoft Spending Heralds New Era of Capex Kings,Bloomberg
Oct-26-18,AMD and Intel's Earnings Might Provide a Hard Lesson or Two for Investors,TheStreet.com
Oct-26-18,Forget Amazon and Google. Chip Stocks Are the Problem.,Barrons.com
Oct-26-18,"Top VC deals: Amazon backs Tado, Bessemer closes its 10th fund at $1.85 billion",CNBC
Oct-29-18,"To Intel, 27% women in the workforce mean it has reached full representation",MarketWatch
Oct-29-18,[$$] Intel Hits an Internal Goal for Workforce Diversity,The Wall Street Journal
Oct-29-18,"Intel says more women, blacks in workforce after diversity push",Reuters
Oct-29-18,"Intel says more women, blacks in workforce after diversity push",Reuters
Oct-29-18,Intel (INTC) Stock Moves -0.63%: What You Should Know,Zacks
Oct-29-18,"Intel's Mobileye, Volkswagen plan Israel's first autonomous ride-hailing service",Reuters
Oct-29-18,Monday Madness: It's All About Cannabis and Chip Stocks,TheStreet.com
Oct-29-18,"[$$] VW, Intel's Mobileye To Create JV in Israel",The Wall Street Journal
Oct-29-18,"Volkswagen, Mobileye and Champion Motors to Invest in Israel and Deploy First Autonomous EV Ride-Hailing Service",Business Wire
Oct-29-18,"Top Analyst Reports for Johnson & Johnson, UnitedHealth, AT&T & Intel",Zacks
Oct-29-18,"Stocks - Wall Street Rises After Inflation Data, IBM Acquisition",Investing.com
Oct-29-18,Strong Q3 Numbers Affirm the Bull Thesis for Intel Stock,InvestorPlace
Oct-29-18,AMD and Intel's Earnings Provide a Key Lesson for Tech Investors,TheStreet.com
Oct-29-18,"Company News For Oct 29, 2018",Zacks
Oct-29-18,INTC or TXN: Which Is the Better Value Stock Right Now?,Zacks
Oct-29-18,[$$] Intel Hits a Novel Diversity Target It Calls 'Full Representation',The Wall Street Journal
Oct-29-18,Should Value Investors Buy Intel (INTC) Stock?,Zacks
Oct-29-18,Intel says it's reached diversity goal two years early,American City Business Journals
Oct-29-18,"Intel Achieves Goal of Full US Workforce Representation, Notes Its Just the Beginning",Business Wire
Oct-29-18,"The Zacks Analyst Blog Highlights: Advanced Micro Devices, Texas Instruments, Intel, Micron Technology and Broadcom",Zacks
Oct-29-18,This money-flow chart shows that Amazon and Netflix are in dangerous territory,MarketWatch
Oct-29-18,"After Blowout Earnings, I'm Expecting Intel's Dividend to Surge",Motley Fool
Oct-30-18,"Stocks - S&P, Dow Jump as Semis Rebound",Investing.com
Oct-30-18,Microsoft Picks Xilinx for Over Half of Azure Servers,Bloomberg
Oct-30-18,Micron CEO on how the company plans to stay ahead of the semiconductor slump,American City Business Journals
Oct-30-18,"Intel Roundup: Earnings, Micron & ARM Deals, New Chips, More",Zacks
Oct-30-18,"Stock Market Today: Dow Jumps 432 Points As Intel, Boeing Stocks Rally",Investor's Business Daily
Oct-31-18,"Intel, Purina have pulled political contributions to Rep. Steve King",MarketWatch
Oct-31-18,3 Blue Chip Tech Stocks to Buy Now,Zacks
Oct-31-18,GOP fund won't help Rep. Steve King in Iowa race due to his support for white supremacists,CNBC
Oct-31-18,Should You Buy Intel Stock in November?,InvestorPlace
Oct-31-18,Professional investors are snapping up Facebook and avoiding Amazon,MarketWatch
Oct-31-18,Intel's Breakout Seen Boosting Stock 9%,Investopedia
Oct-31-18,Will Apples New MacBook Air Be A Giant Flop?,InvestorPlace
Oct-31-18,The Top 4 eBay Shareholders (EBAY),Investopedia
Oct-31-18,"Recent Analysis Shows AK Steel Holding, New Gold, Freeport-McMoRan, Sirius XM, Intel, and SPS Commerce Market Influences  Renewed Outlook, Key Drivers of Growth",GlobeNewswire
Oct-31-18,"One Big Investor Is Buying Up Apple, Boeing, Verizon, and Intel Stock",Barrons.com
Nov-01-18,"Apple Silence on iPhone Unit Sales Sparks Concern, Shows Future",Bloomberg
Nov-01-18,"How, by leaving Intel, Renee James is following in its footsteps",American City Business Journals
Nov-01-18,Intel Rises 3%,Investing.com
Nov-01-18,"Nike, Intel among 56 companies standing up for transgender rights",American City Business Journals
Nov-01-18,"Intel, Purina have pulled political contributions to Rep. Steve King",MarketWatch
Nov-01-18,"This Day In Market History: Microsoft, Intel Become First Nasdaq Stocks To Join The Dow",Benzinga
Nov-01-18,Professional investors are snapping up Facebook and avoiding Amazon,MarketWatch
Nov-01-18,"Driverless Cars Hit the Road for Testing, Stocks in Focus",Zacks
Nov-01-18,"Thursdays Vital Data: Coca-Cola, Twitter and Intel",InvestorPlace
Nov-01-18,Inside Intel's Big Sacrifice,Motley Fool
Nov-01-18,A Key Detail of Apple's 2019 iPhones May Have Just Been Confirmed,Motley Fool
Nov-01-18,"Decker's Outdoor, Thor Industries, Sony, Intel and PayPal Holdings highlighted as Zacks Bull and Bear of the Day",Zacks
Nov-01-18,"4 Days Left Until Intel Corporation (NASDAQ:INTC) Trades Ex-Dividend,",Simply Wall St.
Nov-05-18,Intel (INTC) Outpaces Stock Market Gains: What You Should Know,Zacks
Nov-05-18,Intel Promises to Invest More in Its Future,Motley Fool
Nov-05-18,How Trump could rescue Apples fast-sinking stock,MarketWatch
Nov-05-18,"Dow, S&P 500 Rally In Stock Market Today, But Why Did Apple Drop?",Investor's Business Daily
Nov-05-18,Which of These 3 Semiconductor Stocks Leads the Self-Driving Race?,InvestorPlace
Nov-05-18,NXP Semiconductors Stock Is Back on Track After Qualcomms Bid Fell Through,InvestorPlace
Nov-05-18,Why Micron Technology Stock Is Still Worth At Least $60,InvestorPlace
Nov-05-18,10 Tech Stocks That Pay You Dividends to Own Them,Kiplinger
Nov-05-18,"Stay Away from AMD Stock Above $20, but Buy It Below That for Sure",InvestorPlace
Nov-05-18,Will Top-Line Woes Impact QUALCOMM's (QCOM) Q4 Earnings?,Zacks
Nov-05-18,"The Zacks Analyst Blog Highlights: Intel, Exxon Mobil, Johnson & Johnson, JPMorgan and Microsoft",Zacks
Nov-06-18,Intel-drafted U.S. data privacy bill would protect firms from fines,Reuters
Nov-06-18,AMD celebrates Election Day with a political rally of its own,MarketWatch
Nov-06-18,[$$] Judge Rules Against Qualcomm in Antitrust Lawsuit,The Wall Street Journal
Nov-06-18,AMD Unveils How It Plans to Battle Intel and Nvidia in the Data Center,TheStreet.com
Nov-06-18,AMD Stock Is Soaring on a Deal with Amazon Web Services,Barrons.com
Nov-06-18,U.S. court rules Qualcomm must licence technology to rivals,Reuters
Nov-06-18,5 Top Stock Trades for Wednesday: AMDs Teaming Up With Amazon?,InvestorPlace
Nov-06-18,7 Dividend Stocks To Consider for Growth,InvestorPlace
Nov-06-18,Abiomed Leads This Year's Stock Market Race,GuruFocus.com
Nov-06-18,Why Texas Instruments Stock Lost 13.5% in October,Motley Fool
Nov-06-18,AMD Climbs After Saying Amazon Will Use Its Cloud Server Chips,Bloomberg
Nov-06-18,AMD shares rise after chipmaker announces new business from Amazon's cloud unit,CNBC
Nov-06-18,3 Large-Cap Self-Driving Car Stocks to Ride the Driverless Craze,InvestorPlace
Nov-06-18,The Cost of Catching AMD Will Take a Toll on INTC Stock,InvestorPlace
Nov-06-18,Is Qualcomm Stock Ready for a Comeback?,InvestorPlace
Nov-06-18,Report: Intel Will Supply 5G Modems to Apple in 2020,Motley Fool
Nov-06-18,"You should be worried about tech stocks, and heres why",MarketWatch
Nov-06-18,How Trump could rescue Apples fast-sinking stock,MarketWatch
Nov-06-18,"Hasbro, PriceSmart, Hess, Molina Health and Tetra Tech highlighted as Zacks Bull and Bear of the Day",Zacks
Nov-06-18,5 Relative Price Strength Stocks to Maximize Your Returns,Zacks
Nov-07-18,[$$] Former Intel CEO Krzanich to Lead CDK Global,The Wall Street Journal
Nov-07-18,[$$] AMDs Cloud Payoff Will ComeEventually,The Wall Street Journal
Nov-07-18,"Cramer Remix: With Jeff Sessions out, this stock could thrive",CNBC
Nov-07-18,Intel Announces New Data Center Chips,Motley Fool
Nov-08-18,"Stocks - S&P Ends in the Red on Plunge in Energy, Rate Hike Fears",Investing.com
Nov-08-18,Scenes from the 2018 Makers and Manufacturing awards (photos),American City Business Journals
Nov-08-18,"As Apple Weighs on Qualcomm's Earnings, 5G Can't Take Off Soon Enough",TheStreet.com
Nov-08-18,50-years of Intel CEOs (infographic),American City Business Journals
Nov-08-18,Qualcomm Slumps After Apple Move to New iPhone Chips Trims Revenue Guidance,TheStreet.com
Nov-08-18,Stocks - Wall Street Mixed as All Eyes Turn to Fed,Investing.com
Nov-08-18,Report: San Jose chip giant Xilinx in active talks over $5B takeover of Sunnyvale company,American City Business Journals
Nov-08-18,Intel Drafts Model Legislation to Spur Data Privacy Discussion,Business Wire
Nov-08-18,"You should be worried about tech stocks, and heres why",MarketWatch
Nov-08-18,AMD celebrates Election Day with a political rally of its own,MarketWatch
Nov-09-18,2019 Is Shaping Up to Be the Year of the Self-Driving Car Service,Motley Fool
Nov-09-18,How Advanced Micro Devices Inc. Stock Fell 41% Last Month,Motley Fool
Nov-09-18,Tech Stocks Could Really Use 5G Right About Now,Barrons.com
Nov-09-18,Friday Apple Rumors: i7 MacBook Air May Have Been in the Works,InvestorPlace
Nov-09-18,"Continued, Reliable Improvements Make Microsoft Stock a Smart Choice",InvestorPlace
Nov-09-18,Top VC deals: Ford buys a scooter start-up; Microsoft's venture arm backs an emergency response firm,CNBC
Nov-09-18,5 Dow Stocks to Sell (And 2 to Buy),Kiplinger
Nov-09-18,"Despite Lacking a Permanent CEO, Intel Stock Could Be a Good Bet",InvestorPlace
Nov-09-18,Intel's philanthropy head is the company's philanthropic 'connector',American City Business Journals
Nov-09-18,"3 Big Stock Charts for Friday: Intel, Marathon Oil and Juniper Networks",InvestorPlace
Nov-09-18,"You should be worried about tech stocks, and heres why",MarketWatch
Nov-09-18,Apples Snub Could Mean Qualcomm Stock Is a Bargain,Barrons.com
Nov-12-18,Intel Falls 3%,Investing.com
Nov-12-18,Buy Semiconductors on the Dip? 3 Stocks to Consider Now,Zacks
Nov-12-18,Intel and Rolls-Royce Team Up for Autonomous Shipping,Motley Fool
Nov-12-18,Longtime Intel Capital VC tells why she now runs a major utility's $250M fund,American City Business Journals
Nov-12-18,Monday Apple Rumors: AAPL Addressing iPhone X Display Issues,InvestorPlace
Nov-12-18,10 Tech Stocks That Pay You Dividends to Own Them,Kiplinger
Nov-12-18,Intel Accelerates Timing for Intel XMM 8160 5G Multimode Modem to Support Broad Global 5G Rollouts,Business Wire
Nov-12-18,5 Top Stocks With Upgraded Broker Ratings Worth Investing In,Zacks
Nov-13-18,Intel (INTC) Gains As Market Dips: What You Should Know,Zacks
Nov-13-18,"Oil Bulls Trampled, Stocks Wobble; This Chip Stock Strengthens Its Chart",Investor's Business Daily
Nov-13-18,3 Overpriced Semiconductor Stocks Due for a Fall,InvestorPlace
Nov-13-18,Stocks Today: Nvidia Leads Technology Rally; Caterpillar Boosts Dow,Investor's Business Daily
Nov-13-18,"Nvidia, Xilinx Stocks Upgraded To Buy On Artificial Intelligence",Investor's Business Daily
Nov-13-18,Intel Rises 3%,Investing.com
Nov-13-18,Should You Buy Qualcomm for Its 4% Dividend Yield?,Motley Fool
Nov-13-18,Advanced Micro Devices Stock Makes a Strong Contrarian Case,InvestorPlace
Nov-13-18,EBay is the latest tech giant to end forced arbitration of sexual harassment at work,American City Business Journals
Nov-13-18,Blue Chips Wrapping Up a Solid Q3: 4 Top Picks,Zacks
Nov-13-18,Stock Market Volatility Lingers in November: 5 Low-Beta Picks,Zacks
Nov-13-18,Intel Pulls In XMM 8160 5G Modem,Motley Fool
Nov-14-18,Why Apple Didn't Upgrade the iMac Last Month?,Motley Fool
Nov-14-18,4 Stocks Billionaire Ray Dalio Bought in Q3 (and 1 He Dumped),Insider Monkey
Nov-14-18,3 Beaten-Down Semiconductor Stocks to Buy Before the End of 2018,InvestorPlace
Nov-14-18,"Intel Debuts Faster, Smarter Device for AI, Computer Vision",TheStreet.com
Nov-14-18,Abellio London Achieves Significant Reductions in Collisions and Injuries through Mobileye Safety Trial,Business Wire
Nov-14-18,San Jose to draft privacy policies for smart city expansion,American City Business Journals
Nov-14-18,"Stocks - U.S. Futures Flat to Lower, Inflation Data in Focus",Investing.com
Nov-14-18,"The Zacks Analyst Blog Highlights: Microsoft, Berkshire Hathaway, Intel and Boeing",Zacks
Nov-14-18,Intel Unveils the Intel Neural Compute Stick 2 at Intel AI Devcon Beijing for Building Smarter AI Edge Devices,Business Wire
Nov-15-18,Qualcomm's Chances of Winning Back the iPhone Don't Look Good,Motley Fool
Nov-15-18,Why Intel Is Up Just 3% So Far in 2018,Motley Fool
Nov-15-18,Intel Boosts Stock Buyback by $15 Billion,TheStreet.com
Nov-15-18,Intel adds $15 billion to its buyback program,Reuters
Nov-15-18,Intel board OKs $15 billion share buyback,MarketWatch
Nov-15-18,Intel adds $15 billion to its buyback program,Reuters
Nov-15-18,Intel Announces $15 Billion Increase to Stock Repurchase Authorization,Business Wire
Nov-15-18,Ex-Bosch engineers aim to strengthen self-driving car software,Reuters
Nov-15-18,3 Chip Suppliers Inside the Apple iPhone XR Teardown,Motley Fool
Nov-15-18,"Q3 13F Roundup: How Buffett, Einhorn, Ackman And Others Adjusted Their Portfolio",Benzinga
Nov-15-18,Solving the Mystery of Apple's Missing Core i7 MacBook Air,Motley Fool
Nov-15-18,INTC or NVDA: Which Is the Better Value Stock Right Now?,Zacks
Nov-15-18,3 Positives for Intel's Business in 2019,Motley Fool
Nov-15-18,Apple Recruiting Chip Engineers to Work in Qualcomms Backyard,Bloomberg
Nov-16-18,[$$] Why PCs Still Compute,The Wall Street Journal
Nov-16-18,Here's How Intel Will Profit From 5G,Motley Fool
Nov-16-18,"How to Play Semiconductors Amid Nvidia's Crash, Cycle Pressure",TheStreet.com
Nov-16-18,"Bridgewater Associates Returns, AUM, and Holdings",Insider Monkey
Nov-16-18,7 Tech Stocks to Buy That Can Lead a Sector Turnaround,InvestorPlace
Nov-16-18,"Chip stocks set to tumble after Nvidia, AMD and Applied Materials pace losers",MarketWatch
Nov-16-18,"[$$] Stocks to Watch: Viacom, PG&E, Nvidia, Nordstrom",The Wall Street Journal
Nov-16-18,Intel's Multibillion-Dollar Question,Motley Fool
Nov-16-18,"Black Friday bargain stocks: Consider Ford, Intel and three others",MarketWatch
Nov-19-18,Intel (INTC) Dips More Than Broader Markets: What You Should Know,Zacks
Nov-19-18,MKM Says Intel Offers 'Defensive Value',Benzinga
Nov-19-18,"Microsoft to Buy XOXCO, Expand Conversational AI Portfolio",Zacks
Nov-19-18,Has Intel (INTC) Outpaced Other Computer and Technology Stocks This Year?,Zacks
Nov-19-18,Oversold Chip Stocks Could Squeeze Complacent Sellers,Investopedia
Nov-19-18,Xilinx Scales New 52-Week High: What's Driving the Stock?,Zacks
Nov-19-18,Q3 Earnings of S&P 500 Companies Cross 7-Year Peak: 5 Picks,Zacks
Nov-20-18,Why Intel's Data Center Growth Is Set to Slow,Motley Fool
Nov-20-18,What Intel's Internet of Things Chief Wants You to Know About His Business,Motley Fool
Nov-20-18,MarketPulse: Nvidia Rally Shelters Semis From Selloff,Investing.com
Nov-20-18,The worst is not behind semis: Pro,CNBC Videos
Nov-20-18,10 Beaten Tech Stocks to Consider,InvestorPlace
Nov-20-18,Why Intel's Gaming Business Won't Suffer Like NVIDIA's,Motley Fool
Nov-20-18,5 Dow Stocks to Sell (And 2 to Buy),Kiplinger
Nov-20-18,Keysight's (KEYS) Solutions to Aid Telcos with 5G Deployment,Zacks
Nov-20-18,"Intuit (INTU) Q1 Earnings and Revenues Top Estimates, Up Y/Y",Zacks
Nov-20-18,Losing Appetite for FAANG? 5 Promising Tech Stocks,Zacks
Nov-20-18,Do Directors Own Intel Corporation (NASDAQ:INTC) Shares?,Simply Wall St.
Nov-20-18,3 Reasons NVIDIA Should Raise Its Dividend,Motley Fool
Nov-20-18,CACI's Winning Streak Continues With $413 Million Contract,Zacks
Nov-20-18,Sabre Undertakes Efforts to Boost Presence in Airlines Space,Zacks
Nov-21-18,The Semiconductors After the Sell Off: Are they Value Stocks or Traps?,Zacks
Nov-21-18,Can Old-School Chip Stocks Like INTC Be Better Than NVDA Stock?,InvestorPlace
Nov-21-18,Investors Should Buy Nvidia Stock,InvestorPlace
Nov-21-18,The Market Is Right About Qualcomm Stock,InvestorPlace
Nov-21-18,"Unfortunately, There Is Nothing Very Special About Nvidia Stock",InvestorPlace
Nov-21-18,The Resilience of Intel Stock Makes It a Winner,InvestorPlace
Nov-21-18,"Sell Micron because of continued deterioration in pricing, analyst says in downgrade",CNBC
Nov-21-18,"Avoid NVIDIA, Add These 4 Top-Ranked Semi Stocks to Portfolio",Zacks
Nov-21-18,Earnings Estimates Moving Higher for Intel (INTC): Time to Buy?,Zacks
Nov-21-18,Xilinx's Zynq MPSoC Platform Secures Exida Certification,Zacks
Nov-23-18,"Mercury's EW Efforts Continue, Wins Another Follow-On Order",Zacks
Nov-23-18,Apple May Offer Discounts to Carriers for iPhone XR in Japan,Zacks
Nov-26-18,Amazon Stock Jumps With Kickoff Of Giant Web Services Conference,Investor's Business Daily
