date,title,source
Nov-26-18,IBD Stock Of The Day: This Contract Manufacturer's Relative Strength Shines,Investor's Business Daily
Nov-26-18,KeyBanc Sees 'Significant Runway' For AMD In Cloud Data Processors,Benzinga
Nov-26-18,"Zacks Value Trader Highlights: NVIDIA, Lam Research, Micron, Intel, Applied Materials and Applied Micro Devices",Zacks
Nov-27-18,Intel's Interim CEO Dives Deep Into the Chip Shortage Situation,Motley Fool
Nov-27-18,Intel (INTC) Outpaces Stock Market Gains: What You Should Know,Zacks
Nov-27-18,Amazon's New Server Processor Is Just One of Several Threats Intel Is Facing,TheStreet.com
Nov-27-18,Holiday Gift Guide 2018: The Best Tablets and E-readers,InvestorPlace
Nov-27-18,Ex-Intel researchers unveil 'a unicorn in the making',American City Business Journals
Nov-27-18,What Makes NVIDIA (NVDA) a Strong Sell?,Zacks
Nov-27-18,Intel (INTC) Looks Promising on Upbeat Q3: Should You Buy?,Zacks
Nov-27-18,Apple Drops as Trump Threatens More Tariff on China Imports,Zacks
Nov-27-18,Amazon's cloud unit launches Arm-based server chips,CNBC
Nov-28-18,Qualcomm sets up $100 mln fund to invest in AI startups,Reuters
Nov-28-18,"Amazon launches machine learning chip, taking on Nvidia, Intel",Reuters
Nov-28-18,"Amazon launches machine learning chip, taking on Nvidia, Intel",Reuters
Nov-28-18,"Amazon launches machine learning chip, taking on Nvidia, Intel",Reuters
Nov-28-18,4 Tech Stocks That Have Weathered the Market Selloff,InvestorPlace
Nov-28-18,A Company Few Americans Know Is About to Dethrone Intel,Bloomberg
Nov-28-18,Apple Stock Wont Make You Much Money over the Next Few Years,InvestorPlace
Nov-28-18,"Qorvo, Zomedica Tie-Up to Enhance Vet Health with BAW Sensors",Zacks
Nov-29-18,Rumor Has It That Intel Is Planning a 10-Core Gaming Chip,Motley Fool
Nov-29-18,NVIDIA Upgrades Its Dividend and Buyback,Motley Fool
Nov-29-18,These 2 Apple Suppliers Have Something in Common,Motley Fool
Nov-29-18,Microsoft (MSFT) Secures Contract Worth $480M From U.S. Army,Zacks
Nov-29-18,"Stocks - U.S. Futures Pull Back with G20, Fed Minutes Ahead",Investing.com
Nov-29-18,"Intel, Dillard's and Boeing highlighted as Zacks Bull and Bear of the Day",Zacks
Nov-30-18,Intel Rises 3%,Investing.com
Nov-30-18,The Gaga Effect: Intel pulls back on splashy consumer marketing strategy,American City Business Journals
Nov-30-18,5 Must-See Stock Trades for Monday,InvestorPlace
Nov-30-18,8 Stocks to Buy for 2019 (and 5 to Sell),Kiplinger
Nov-30-18,10 Value Stocks to Buy for December,InvestorPlace
Nov-30-18,Palo Alto (PANW) Q1 Earnings and Revenues Surpass Estimates,Zacks
Nov-30-18,Intel Speeds Up the Launch of 5G,Motley Fool
Nov-30-18,"HP (HPQ) Q4 Earnings Match Estimates, Revenues Top, Up Y/Y",Zacks
Nov-30-18,[$$] 7 Companies That Do Everything Well,The Wall Street Journal
Nov-30-18,Splunk (SPLK) Q3 Earnings and Revenues Surpass Estimates,Zacks
Nov-30-18,"SINA Q3 Earnings Surpass Estimates, Revenues Increase Y/Y",Zacks
Dec-03-18,"Salt River Project, tech giant partner on 100-megawatt solar project",American City Business Journals
Dec-03-18,Intel (INTC) Outpaces Stock Market Gains: What You Should Know,Zacks
Dec-03-18,5 Reasons Why AMD Stock Is Way Overpriced Here,TheStreet.com
Dec-03-18,"Intel Corp (INTC) Interim CEO  Robert Holmes Swan Bought $247,151 of Shares",GuruFocus.com
Dec-03-18,Cisco commits $1.5 billion to digital workforce training worldwide,American City Business Journals
Dec-03-18,Oil Groups Lead Stock Market Up; Will These 3 Large Cap Stocks Beat Apple In December?,Investor's Business Daily
Dec-03-18,AMD's stock soars on heavy volume to pace chip sector's gainers,MarketWatch
Dec-03-18,"Intel Editorial: Intel Doubles Commitment, Sets Goal to Spend $200 Million with Women-Owned Businesses Globally",Business Wire
Dec-03-18,"Everyones Ignoring the Fundamentals on AMD Stock, Which Is a Problem",InvestorPlace
Dec-03-18,INTC or TXN: Which Is the Better Value Stock Right Now?,Zacks
Dec-03-18,5 Solid Dividend Growth Stocks for Your Portfolio,Zacks
Dec-03-18,"6 Stocks to Gain as Trump, Xi Hammer Out Trade Truce",Zacks
Dec-03-18,Here's Why Intel's Planning This Strange Lineup of Chips,Motley Fool
Dec-03-18,"3 Big Stock Charts for Monday: Intel, HP and Prologis",InvestorPlace
Dec-04-18,This Might Be the Real Reason Apple's Not Launching a 5G iPhone Until 2020,Motley Fool
Dec-04-18,"Why Intel, Barnes & Noble Education, and Veeva Systems Slumped Today",Motley Fool
Dec-04-18,Corporate tax breaks cost U.S. schools billions of lost revenue -report,Reuters
Dec-04-18,Apple's Reported 5G iPhone Plans Fit With Its Traditional Hardware Philosophy,TheStreet.com
Dec-04-18,4 Self-Driving Car Stocks Paving the Way for Profits,InvestorPlace
Dec-04-18,Intel Falls 3%,Investing.com
Dec-04-18,Market bears resurface: S&P 500 nails major resistance amid flattening yield curve,MarketWatch
Dec-04-18,"Intel, Hurt by Delays, Will Lose Market Share to AMD, Says Analyst",Barrons.com
Dec-04-18,Intel Gets Trampled After Former Bull Turns on Company,TheStreet.com
Dec-04-18,Intel stock falls after Northland Capital cuts to underperform,MarketWatch
Dec-04-18,"Stock Market's Losses Deepen, But Volume Falls",Investor's Business Daily
Dec-04-18,How Does Nasdaq Make Money?,Investopedia
Dec-04-18,3D Systems Rides on Figure 4 Platform's Positive Feedback,Zacks
Dec-04-18,"Broadcom, HCL Sign Preferred Services Deal Post CA Buyout",Zacks
Dec-04-18,"Zacks.com featured highlights include: Intel, Thermo Fisher, Marcus, Anthem and ArcBest",Zacks
Dec-04-18,Another ex-Intel worker-founded startup lands millions from well-known investors,American City Business Journals
Dec-04-18,Intel shares fall after downgrade: 'It takes forever to turn the ship',CNBC
Dec-04-18,"The Zacks Analyst Blog Highlights: Intel, Diodes, Methanex, Harsco and Cleveland-Cliffs",Zacks
Dec-06-18,Huawei arrest creates concerns in Silicon Valley as well as abroad,MarketWatch
Dec-06-18,"Huawei arrest just made companies like Apple less valuable, Jim Cramer says",CNBC
Dec-06-18,"Huawei arrest made companies, including Apple, less valua...",CNBC Videos
Dec-06-18,3 Key Quotes from Intel's Chief Engineering Officer,Motley Fool
Dec-06-18,How Did Intel Get Its Name? Hint: Two Words Blend to Create It,TheStreet.com
Dec-06-18,Canada PM says government played no role in Huawei executive's arrest,Reuters
Dec-06-18,"Taking aim at Intel, Qualcomm launches chip for business PCs",Reuters
Dec-06-18,Canada PM says government played no role in Huawei executive's arrest,Reuters
Dec-06-18,"Taking aim at Intel, Qualcomm launches chip for business PCs",Reuters
Dec-06-18,"Top Huawei executive arrested on U.S. request, clouding China trade truce",Reuters
Dec-06-18,Winning the Mobile 5G Race Is Just the Ticket for Qualcomm Stock,InvestorPlace
Dec-06-18,TiVo Refreshes License With Samsung to Aid Customer Relations,Zacks
Dec-06-18,Global Semiconductor Sales Rise in October: 4 Stocks to Buy,Zacks
Dec-06-18,Mellanox Adapters Accelerate Alibaba's Network Applications,Zacks
Dec-06-18,"Top Huawei executive arrested on U.S. request, clouding China trade truce",Reuters
Dec-06-18,Intel Stock Is a Lot More Promising Than You Think,InvestorPlace
Dec-06-18,Intels Interim CEO Swan Is the Only Insider Buying Stock Since 2010,Barrons.com
Dec-06-18,"Huawei founder's daughter arrested on U.S. request, puts trade war truce in doubt",Reuters
Dec-07-18,Qualcomm's Latest Notebook Chip Could Be a Sign of Things to Come from Apple,TheStreet.com
Dec-07-18,All 30 Dow industrials stocks and the 20 Dow transport stocks are falling,MarketWatch
Dec-07-18,The 5 Things I Look For In A Potential Trade,Benzinga
Dec-07-18,5 5G Stocks That Should Connect With Growth in 2019,InvestorPlace
Dec-07-18,Qualcomm Takes Aim at Intel With 7nm Snapdragon 8cx,InvestorPlace
Dec-07-18,Netflix and Palo Alto Networks Offer Growth at a Discount,Barrons.com
Dec-07-18,"Analysis: Positioning to Benefit within Snap, Kansas City Southern, Intel, Methanex, Retail Opportunity Investments, and Acadia Healthcare  Research Highlights Growth, Revenue, and Consolidated Results",GlobeNewswire
Dec-07-18,Is Intel Corporation (INTC) A Good Stock To Buy?,Insider Monkey
Dec-07-18,[$$] Japan eyes ban on government use of Huawei and ZTE equipment,Financial Times
Dec-10-18,"Intel Corp (INTC) Interim CEO  Robert Holmes Swan Bought $245,993 of Shares",GuruFocus.com
Dec-10-18,Intel's Gaming Chip Shortage Seems to Be Easing,Motley Fool
Dec-10-18,"Stocks - Dow Tumbles Again Amid Bank, Energy Selloff",Investing.com
Dec-10-18,"US STOCKS-Dow, S&P dogged by growth worries; techs help Nasdaq bounce",Reuters
Dec-10-18,Why Should You Hold Hewlett Packard Stock in Your Portfolio?,Zacks
Dec-10-18,Ultimate Software Ups Ante in HCM With Slack App for UltiPro,Zacks
Dec-11-18,Intel (INTC) Gains As Market Dips: What You Should Know,Zacks
Dec-11-18,Aspen Technology's Mtell to Aid SCG Boost Asset Utilization,Zacks
Dec-11-18,Cisco Is in Talks to Buy Optical Chip Maker Luxtera,Bloomberg
Dec-11-18,"Trade Talks, Apple News, & the Outlook for AMD Stock in 2019",Zacks
Dec-11-18,Where McDonald's reigns as most popular brand in 50 states,American City Business Journals
Dec-11-18,Media Alert: Intel to Showcase Technology Innovation for the Next Era of Computing at CES 2019,Business Wire
Dec-11-18,3 Chip Stocks to Buy for the Next 3 Years,InvestorPlace
Dec-11-18,How Much Should You Pay for Advanced Micro Devices Stock?,InvestorPlace
Dec-11-18,Dow Trims Advance As This Top Stock Battles To Regain Buy Point,Investor's Business Daily
Dec-11-18,"AMD Stock Is a Best Idea for 2019, Says Analyst",Barrons.com
Dec-11-18,Tyler's Buyout Binge is Consistent With SceneDoc Purchase,Zacks
Dec-11-18,AMD stock rises after Cowen names it among best ideas for 2019,MarketWatch
Dec-11-18,"Stocks making the biggest moves premarket: DSW, F, GM, CVS, PFE & more",CNBC
Dec-12-18,Intel's Latest Announcements Are a Good Reminder of its Competitive Strengths,TheStreet.com
Dec-12-18,"Qualcomm Seeks iPhone Import Ban, Stepping Up Patent Fight",Bloomberg
Dec-12-18,Cisco Systems (CSCO) Likely to Buy Luxtera: Good Move?,Zacks
Dec-12-18,Intel unveils how it wants to get its mojo back,American City Business Journals
Dec-12-18,How Will Intel Stock Be Impacted by Amazons Homegrown Chips?,InvestorPlace
Dec-12-18,Intel plans 'stacked' circuits in bid to regain its chipmaking lead,Reuters
Dec-12-18,Intel plans 'stacked' circuits in bid to regain its chipmaking lead,Reuters
Dec-12-18,Intel plans 'stacked' circuits in bid to regain its chipmaking lead,Reuters
Dec-12-18,New Intel Architectures and Technologies Target Expanded Market Opportunities,Business Wire
Dec-12-18,NVIDIA (NVDA) Shares Slip as SoftBank Aims to Sell Stake,Zacks
Dec-12-18,Intel (INTC) Stock Looks Like a Strong Buy Heading into 2019,Zacks
Dec-13-18,Evidence of Apple switch ruled inadmissible in Qualcomm antitrust case,Reuters
Dec-13-18,Evidence of Apple switch ruled inadmissible in Qualcomm antitrust case,Reuters
Dec-13-18,5 Tech Stocks That Braved Nasdaq's Loss of 2018 Gains,Zacks
Dec-13-18,"ESL, Intel extend esports partnership for 3 more years",American City Business Journals
Dec-13-18,"Micron Stock Is a Long-Term Buy, Even Ahead of Earnings",InvestorPlace
Dec-13-18,Apple Could Be Planning to Cut Out Another iPhone Supplier,Motley Fool
Dec-13-18,Avnet (AVT) Eyes IoT Expansion With Acquisition of Softweb,Zacks
Dec-13-18,Intel Editorial: Study Considers Applying Emerging Technology to Solve Environmental Challenges,Business Wire
Dec-13-18,Amazon Could Dent Intels Near-Monopoly on Data Center Chips,Motley Fool
Dec-13-18,"Apple Plans to Design Its Own iPhone Modem, Ditching QCOM and INTC",InvestorPlace
Dec-13-18,What Will You Miss Out On by Overlooking Mellanox Stock?,Zacks
Dec-13-18,5 Dow Stocks Stand Tall Despite Index's Loss of 2018 Gains,Zacks
Dec-13-18,Intel's Latest Announcements Are a Good Reminder of Its Competitive Strengths,TheStreet.com
Dec-13-18,"Intel and ESL sign 3-year, $100 million deal, adding heft to booming esports market",CNBC
Dec-13-18,6 Stocks to Gain From a US-China Trade Deal,Zacks
Dec-13-18,A bullish chart pattern could be flashing a buy sign for tech stocks,CNBC
Dec-13-18,"Intel's new chip architecture, Apple's subscription news service may arrive in the Spring",CNET
Dec-14-18,How to Play Techs Top 3 Themes for 2019,Barrons.com
Dec-14-18,"Intel, TPG in early talks to sell McAfee to Thoma Bravo: source",Reuters
Dec-14-18,Will Low DRAM and NAND Pricing Hamper Micron's Q1 Earnings?,Zacks
Dec-14-18,Intel and TPG Reportedly in Talks to Sell McAfee,TheStreet.com
Dec-14-18,"Intel, TPG in talks to sell McAfee to Thoma Bravo for over $4.2 billion - CNBC",Reuters
Dec-14-18,CNBC'S ALEX SHERMAN: INTEL AND TPG IN TALKS TO SELL MCAFEE TO THOMA BRAVO FOR SIGNIFICANTLY MORE THAN $4.2 BILLION,CNBC
Dec-14-18,Intel and TPG in talks to sell McAfee to Thoma Bravo for well more than $4.2 billion,CNBC
Dec-14-18,AMD Announces Latest Radeon Software Adrenalin 2019 Edition,Zacks
Dec-14-18,"Intel Interim Chief Bob Swan Talks China, CEO Search, and Cultural Shift",Barrons.com
Dec-14-18,Keysight's (KEYS) Solutions to Aid OPPO 5G Phones Production,Zacks
Dec-14-18,"Intel Inks New $100M Deal With ESL, Ups the Game in Esports",Zacks
Dec-14-18,Today's Research Reports on Trending Tickers: Advanced Micro Devices and Intel,ACCESSWIRE
Dec-14-18,"The Zacks Analyst Blog Highlights: Intel, Diodes, Schnitzer Steel, Harsco, Encore Wire and Celanese",Zacks
Dec-17-18,Intel (INTC) Stock Moves -1.63%: What You Should Know,Zacks
Dec-17-18,Buy Semiconductors on the Dip? 3 Stocks to Consider Now,Zacks
Dec-17-18,"Intel expanding fabs in Oregon, Ireland, Israel",American City Business Journals
Dec-17-18,Buy Intel Stock for Its Potentially Huge Upside In eSports,InvestorPlace
Dec-17-18,Intel to Reportedly Offload McAfee Business: Key Takeaways,Zacks
Dec-17-18,Symantec or McAfee? Analyst weighs Thoma Bravo's M&A possibilities,American City Business Journals
Dec-17-18,Intuit Overhauls QuickBooks ProAdvisor Program to Aid Growth,Zacks
Dec-17-18,5 Excellent Dividend Growth Stocks to Buy Now,Zacks
Dec-17-18,"Gophers Avant! AI Answers User Questions About Stock Market, Bitcoin, Cannabis, Apples Siri and More",GlobeNewswire
Dec-18-18,MobileIron Cloud to Aid Montagu Evans to Safeguard Phone Data,Zacks
Dec-18-18,Intel Announces Chip Manufacturing Expansion,Motley Fool
Dec-18-18,Stock Market Today Volatile Ahead Of Fed; What's Ahead For Apple?,Investor's Business Daily
Dec-18-18,"Cisco To Acquire Luxtera, Rival Of Intel In Silicon Photonics",Investor's Business Daily
Dec-18-18,Margin Expansion Is the Key to Unlocking the Value of Amazon Stock,InvestorPlace
Dec-18-18,IBM Analytics to Facilitate Catalina's Digital Overhaul,Zacks
Dec-18-18,S&P 500 Q3 2018 Buybacks Surpass $200 Billion Mark for the First Time Ever,PR Newswire
Dec-18-18,Huge Geodesic Dome is Worlds Largest 360-Degree Movie Set,Business Wire
Dec-18-18,"Veeva, Party City, Mellanox, Cree and Intel highlighted as Zacks Bull and Bear of the Day",Zacks
Dec-18-18,"Zacks.com featured highlights include: Intel, Marcus, BG Staffing, Progressive and Anthem",Zacks
Dec-18-18,Synopsys Refurbishes RSoft Photonic Component Design Suite,Zacks
Dec-18-18,Cisco to pay $660M to buy optical chip company Luxtera,American City Business Journals
Dec-18-18,Arm Holdings unveils chip aimed at self-driving car sensors,Reuters
Dec-19-18,Powell party pooper: Here are the worst-performing stocks after the Fed wrecks the market,MarketWatch
Dec-19-18,Intel Falls 3%,Investing.com
Dec-19-18,Cisco to Gain Integrated Optics Technology With Luxtera Buyout,Zacks
Dec-19-18,INTC or NVDA: Which Is the Better Value Stock Right Now?,Zacks
Dec-19-18,"Micron (MU) Q1 Earnings Top Estimates, Revenues Disappoint",Zacks
Dec-19-18,Why AMD Stock Is Stuck in Neutral for Now,InvestorPlace
Dec-19-18,Exclusive: McAfee aims to be first major cybersecurity company to achieve gender pay parity,American City Business Journals
Dec-20-18,"Walgreen's, Tesla, Symantec Nudge Nasdaq Into Bear Territory",Investing.com
Dec-20-18,Apple to pull some iPhones in Germany as Qualcomm extends global wins,Reuters
Dec-20-18,The Weakness of Micron Stock Has Created a Good Buying Opportunity,InvestorPlace
Dec-20-18,7 Stocks to Buy and Hold Through Any Market Selloff,InvestorPlace
Dec-20-18,A Bearish Semiconductor ETF Still Looks Good,ETF Trends
Dec-20-18,What You Need to Know About Intel's Dividend,Motley Fool
Dec-20-18,Intel Connected Logistics Platform Helps Prevent Package Loss or Damage in Transit,Business Wire
Dec-20-18,Which Semiconductor Stock Could be the AMD of 2019?,Zacks
Dec-20-18,Keysight & Qualcomm's New Milestone to Propel 5G Deployment,Zacks
Dec-20-18,Apple will stop selling some iPhone models in its stores in Germany following ruling in patent case,CNBC
Dec-20-18,Powell party pooper: Here are the worst-performing stocks after the Fed wrecks the market,MarketWatch
Dec-20-18,Intel Wants to Give You Virtual Courtside Seats,Barrons.com
Dec-21-18,"Intel CFO and interim CEO Bob Swan on Leadership, Competi...",CNBC Videos
Dec-21-18,4 Reasons Qualcomm's Data Center Business Failed,Motley Fool
Dec-21-18,Why Investors Should Cheer Intel's Graphics Ambitions,Motley Fool
Dec-21-18,Why Intel's Share Price Has Held Up -- and Has Room to Rise in 2019,TheStreet.com
Dec-21-18,"Who Joins Salesforce, Adobe, Alphabet On List Of Fastest-Growing Large-Cap Stocks?",Investor's Business Daily
Dec-21-18,"Market Rallies After Fed's Williams, Then Turns Lower; This Dow Jones Stock Surges",Investor's Business Daily
Dec-21-18,Broadcom's SAN Management Platforms to Simplify IT Operations,Zacks
Dec-21-18,Qualcomm Wins German Court Verdict for Apple's iPhone Ban,Zacks
Dec-21-18,"Dow Jones Futures: After Bear Market Day, Bulls Try To Take Back The Night",Investor's Business Daily
Dec-24-18,Program to help Intel Corp. veterans deal with PTSD spreads to other employees,American City Business Journals
Dec-24-18,Will Ambarella's Latest Deal Widen Its Moat Against Intel?,Motley Fool
Dec-24-18,3 Driverless Car Stocks to Watch in January,Motley Fool
Dec-24-18,"Stock Indexes Suffer More Pain, Head Toward 4th Loss In Row",Investor's Business Daily
Dec-24-18,"Micron Stock Dips to a New 52-Week Low, Shares Decline 3%",Zacks
Dec-24-18,Intel's New IoT Platform to Aid Companies Trim Freight Loss,Zacks
Dec-24-18,3 Things You Shouldn't Miss from Micron's Last Earnings Call,Motley Fool
Dec-24-18,Better Buy: Seagate Technology vs. Intel Corporation,Motley Fool
Dec-24-18,Closing the Books on Techs Deceptively Good Year,Bloomberg
Dec-24-18,Does The Data Make Intel Corporation (NASDAQ:INTC) An Attractive Investment?,Simply Wall St.
Dec-25-18,Dow Jones Futures Volatile: Dow Jones On Verge Of Bear Market,Investor's Business Daily
Dec-25-18,Intel to get 700 million shekel grant for Israel expansion,Reuters
Dec-25-18,Intel to get 700 mln shekel grant for Israel expansion,Reuters
Dec-26-18,Intel Rises 3%,Investing.com
Dec-26-18,5G Will Soon End the Winter of Discontent for Qualcomm Stock,InvestorPlace
Dec-26-18,This Intel Product Stood Out in 2018,Motley Fool
Dec-26-18,Will This Be AMD's Big Break in 2019?,Motley Fool
Dec-26-18,10 Stocks That Won Big In 2018,InvestorPlace
Dec-26-18,"2018 in review: Portland's most-read tech, startup stories",American City Business Journals
Dec-26-18,20 Realistic Tech Predictions for 2019 -- Part Two,TheStreet.com
Dec-26-18,"Stocks making the biggest moves premarket: INTC, WMT, TGT, M, MAR, EXPE & more",CNBC
Dec-26-18,Intel (INTC) to Expand Production Operations in Israel,Zacks
Dec-26-18,Dow Jones Futures: Dow On Verge Of Bear Market,Investor's Business Daily
Dec-26-18,Stocks - Wall Street Sees Some Green in Early Trading,Investing.com
Dec-26-18,"Stocks - Amazon, Target, Walmart, Intel, Jd.Com Rise in Premarket",Investing.com
Dec-27-18,Intel (INTC) Gains But Lags Market: What You Should Know,Zacks
Dec-27-18,Year in Review: Top local tech stories of 2018,American City Business Journals
Dec-27-18,Intel Falls 3%,Investing.com
Dec-27-18,Chip Stocks Under Pressure Midday in Overall Selloff,Investing.com
Dec-27-18,Qualcomm Gets Trial in FTC Case That Threatens Its Smartphone Dominance,Bloomberg
Dec-27-18,Here's Why Holding Xilinx Can Give Solid Returns in 2019,Zacks
Dec-27-18,Reasons Why You Should Get Rid of Seagate (STX) Stock Now,Zacks
Dec-27-18,"Company News For Dec 27, 2018",Zacks
Dec-27-18,Trump Mulling Order That Bans US Companies From Dealing With Huawei - Report,TheStreet.com
Dec-27-18,Why Waymo And Autonomous Vehicle Rivals May Take Slower Road To Riches,Investor's Business Daily
Dec-28-18,Stocks - Wall Street Ends Wild Week With a Whimper,Investing.com
Dec-28-18,Nasdaq Scores 4% Weekly Gain As Stock Market Snaps Losing Streak,Investor's Business Daily
Dec-28-18,"Market hasn't hit bottom but investors can start to 'nibble' on stocks, says Bespoke's Paul Hickey",CNBC
Dec-28-18,There Are Better Chip Names for 2019 Than Intel Stock,InvestorPlace
Dec-28-18,Tech stock picks from two investing experts,CNBC Videos
Dec-28-18,Bespoke Investment Group co-founder shares his stock pick...,CNBC Videos
Dec-28-18,Traders debate the Salesforce hype,CNBC Videos
Dec-28-18,20 Realistic Tech Predictions for 2019 -- Part Two,TheStreet.com
Dec-28-18,"Fridays Vital Data: Coca-Cola, Intel and Ford",InvestorPlace
Dec-28-18,Patent Wins Make QCOM Stock a Lot More Interesting,InvestorPlace
Dec-28-18,Intel Stock Got Hammered This Year. Is It Finally Cheap Enough?,Barrons.com
Dec-31-18,3 Semiconductor Stocks to Buy Amid a 2019 Chip Glut,InvestorPlace
Dec-31-18,Year in review: 5 technology and startup stories that defined 2018,American City Business Journals
Dec-31-18,Intel Stock Could Hit New Highs in 2019,Investopedia
Dec-31-18,QuickLogic Raises Credit Facility to Enhance QuickAI Platform,Zacks
Dec-31-18,The Perfect Spot to Buy AMD Stock,InvestorPlace
Jan-02-19,Here's What to Expect from Micron (MU) Stock in 2019,Zacks
Jan-02-19,Microsoft (MSFT) Debuts Surface Go in India via Flipkart,Zacks
Jan-02-19,Advanced Micro Devices Stock Is In Good Shape for 2019,InvestorPlace
Jan-02-19,Dont Let the Class-Action Suit Dissuade You from Nvidia Stock,InvestorPlace
Jan-02-19,Legal battle unfolds over 3 million cockroaches,American City Business Journals
Jan-02-19,Stocks Dive As China Tariffs Bite; Dow Jones Drops 350 Points,Investor's Business Daily
Jan-02-19,What we're watching in 2019: Intel's CEO search lends intrigue,American City Business Journals
Jan-02-19,All 30 Dow stocks fall in premarket,MarketWatch
Jan-02-19,Dow Jones Futures Signal Sell-Off To Open 2019 Stock Market; Trump Says 'Let's Make A Deal',Investor's Business Daily
Jan-03-19,"Why Intel, AMD, and Qorvo Stocks All Sank More Than 5% Today",Motley Fool
Jan-03-19,Apple shares dive; rare revenue warning drags global markets,Reuters
Jan-03-19,"Apple, Delta, Intel and 3M sink while Celgene soars",Associated Press
Jan-03-19,Qualcomm Adds to Apple's Anguish on Thursday,TheStreet.com
Jan-03-19,Apple shares slide after iPhone maker issues rare revenue warning,Reuters
Jan-03-19,Dow Tumbles More Than 550 Points; Apple Sells Off On Slashed Estimates,Investor's Business Daily
Jan-03-19,"The Zacks Analyst Blog Highlights: Micron, Nvidia, AMD and Intel",Zacks
Jan-03-19,"The Zacks Analyst Blog Highlights: Facebook, Wells Fargo, AT&T, Intel and Glaxo",Zacks
Jan-03-19,Intel Falls 3%,Investing.com
Jan-03-19,Stocks - U.S. Futures Slump After Apple Cuts Forecast,Investing.com
Jan-04-19,Why Intel Stock Popped 6% Today,Motley Fool
Jan-04-19,"Shares of Boeing and AMD will rise 50% over the next three years, tech investor predicts",CNBC
Jan-04-19,Value Screeners Identify Good Opportunities for 2019,GuruFocus.com
Jan-04-19,The biggest stock-market winners and losers on the best day for jobs news in 10 months,MarketWatch
Jan-04-19,A Silver Lining for This Apple Supplier After iPhone Shortfall,Motley Fool
Jan-04-19,Qualcomm's FTC Trial Could Be Significant for Its Lucrative Patent Business,TheStreet.com
Jan-04-19,"Annual Tech Show To Tout 5G Wireless, 8K TV  And Smart Everything",Investor's Business Daily
Jan-04-19,"Bulls Stun The Bears, As Stock Indexes Sprint Ahead",Investor's Business Daily
Jan-04-19,Buy Netflix (NFLX) Stock After Goldman Positivity & New CFO Hire?,Zacks
Jan-04-19,Intel Tops Dow Gainers After BAML 'Buy' Upgrade on Higher Margin Business Focus,TheStreet.com
Jan-04-19,How to Trade Intel Stock and Its Potential 33% Upside,TheStreet.com
Jan-04-19,The 9 Best Dividend Growth Stocks in the Dow Jones,Kiplinger
Jan-04-19,Traders debate BoA's buy rating on Intel,CNBC Videos
Jan-04-19,"Intel Makes A Compelling Large-Cap Investment, BofA Says In Upgrade",Benzinga
Jan-04-19,Stock Market Surges On Jobs Report; FANG Stock To Retake Key Level,Investor's Business Daily
Jan-04-19,Intel Stock Is Soaring on an Analyst Upgrade,Barrons.com
Jan-04-19,"Stocks Surge On China, Jobs Data And A Dow Stock Upgrade",Investor's Business Daily
Jan-04-19,Better Buy: Cisco vs. Intel,Motley Fool
Jan-04-19,Bank of America upgrades Intel: It can ride out a chip slowdown and its shares are cheap,CNBC
Jan-04-19,"Stocks making the biggest moves premarket: LUV, TSLA, NFLX, INTC & more",CNBC
Jan-04-19,Intel Rises 3%,Investing.com
Jan-04-19,"Stock futures point to rebound after strong jobs report, tech stock gains",CNBC
Jan-04-19,"Stocks - Tesla, Intel Gain in Premarket; GameStop, Flex Pharma Soar",Investing.com
Jan-04-19,Stocks - U.S. Futures Rally on Trade Talk Hope,Investing.com
Jan-07-19,Intel working with Facebook on AI chip coming later this year,Reuters
Jan-07-19,Intel developing 3D Athlete Tracking for Tokyo 2020 Olympics,CNET
Jan-07-19,Intel working with Facebook on AI chip coming later this year,Reuters
Jan-07-19,Intel announces new chips at CES,MarketWatch
