date,title,source
Oct-17-18,"5 Great Stocks You've Never Heard Of: 1 Year Later, Should You Be Glad We Told You About Them?",Motley Fool
Oct-19-18,"NuVasive's stock tumble on CEO departure presents buying opportunity, analyst says",MarketWatch
Oct-19-18,"NuVasive CEO Lucier to step down, names Chris Barry as successor",MarketWatch
Oct-19-18,NuVasive Names J. Christopher Barry To Succeed Gregory T. Lucier As Chief Executive Officer; Lucier To Remain Chairman Of The Board,PR Newswire
Oct-29-18,"1 Extraordinary Investor, Plus a 5-Stock Sampler Annual Check-In",Motley Fool
Oct-30-18,NuVasive Inc (NUVA) Q3 2018 Earnings Conference Call Transcript,Motley Fool
Oct-30-18,NuVasive (NUVA) Q3 Earnings Miss Estimates,Zacks
Oct-30-18,NuVasive: 3Q Earnings Snapshot,Associated Press
Oct-30-18,NuVasive Reports Third Quarter 2018 Financial Results,PR Newswire
Oct-31-18,"Why NuVasive, Inc. Stock Is Sinking Today",Motley Fool
Oct-31-18,"NuVasive (NUVA) Q3 Earnings Lag Estimates, Revenues Top Mark",Zacks
Oct-31-18,NuVasive Makes a Big Bet for 2019,Motley Fool
Oct-31-18,Edited Transcript of NUVA earnings conference call or presentation 30-Oct-18 8:30pm GMT,Thomson Reuters StreetEvents
Nov-06-18,Edited Transcript of NUVA earnings conference call or presentation 30-Oct-18 8:30pm GMT,Thomson Reuters StreetEvents
Nov-15-18,NuVasive Porous PEEK Implant OK'd for Use in XLIF Procedure,Zacks
Nov-19-18,NuVasive To Participate In The 30th Annual Piper Jaffray Healthcare Conference,PR Newswire
Nov-29-18,NuVasive (NUVA) Up 11% Since Last Earnings Report: Can It Continue?,Zacks
Dec-04-18,Edited Transcript of NUVA earnings conference call or presentation 30-Oct-18 8:30pm GMT,Thomson Reuters StreetEvents
Dec-10-18,NuVasive Grows Cervical Spinal Interbody Portfolio With PEEK Corpectomy Implant,PR Newswire
Dec-11-18,"Is There Now An Opportunity In NuVasive, Inc. (NASDAQ:NUVA)?",Simply Wall St.
Dec-11-18,"New Research Coverage Highlights Facebook, Korn/Ferry International, NuVasive, Sonic Automotive, B Communications, and Marin Software  Consolidated Revenues, Company Growth, and Expectations for 2018",GlobeNewswire
Dec-12-18,NuVasive's Monolith Corpectomy System Ok'd for Expanded Use,Zacks
Dec-14-18,"NuVasive, Inc. (NUVA): Are Hedge Funds Right About This Stock?",Insider Monkey
Dec-27-18,NuVasive To Participate In 37th Annual J.P. Morgan Healthcare Conference,PR Newswire
Jan-03-19,Solid Global Business Aids NuVasive Amid Pricing Pressure,Zacks
Jan-03-19,NuVasive CEO J. Christopher Barry Announces New Organizational Structure And Leadership Team,PR Newswire
Jan-07-19,"Stocks making the biggest moves after hours: Union Pacific, Lennar and more",CNBC
Jan-07-19,NuVasive Announces Preliminary Unaudited Fourth Quarter And Full Year 2018 Revenue Results,PR Newswire
Jan-10-19,"Did NuVasive, Inc. (NASDAQ:NUVA) Insiders Buy Up More Shares?",Simply Wall St.
Jan-11-19,"Tamarack Capital Managements Return, AUM, and Holdings",Insider Monkey
Jan-29-19,NuVasive Announces Conference Call And Webcast Of Fourth Quarter And Full Year 2018 Results,PR Newswire
Feb-08-19,Smith & Nephew in talks to buy NuVasive for over $3 billion - FT,Reuters
Feb-08-19,Smith & Nephew in talks to buy NuVasive for over $3 bln - FT,Reuters
Feb-08-19,Smith & Nephew in talks to buy NuVasive for over $3 billion - Financial Times,Reuters
Feb-08-19,Smith & Nephew in talks to buy NuVasive for over $3 bln - FT,Reuters
Feb-08-19,Smith & Nephew in talks to buy NuVasive for over $3 bln - FT,Reuters
Feb-08-19,[$$] Smith & Nephew in talks to buy NuVasive for over $3bn,Financial Times
Feb-11-19,"Why NuVasive, Avis Budget Group, and Insperity Jumped Today",Motley Fool
Feb-11-19,NuVasive Stock Surges on Report of Smith & Nephew Interest,TheStreet.com
Feb-11-19,Medical Stock Pops On Potential $3 Billion Smith & Nephew Takeover,Investor's Business Daily
Feb-11-19,"Heres why NuVasive, Inc.s (NASDAQ:NUVA) Returns On Capital Matters So Much",Simply Wall St.
Feb-11-19,NuVasive Stock Shoots Higher on Takeover Talk,InvestorPlace
Feb-11-19,Here's Why NuVasive Stock Is Soaring Today,Motley Fool
Feb-11-19,Smith & Nephew Drops on Report of Deal Talks With NuVasive,Bloomberg
Feb-11-19,Alphatec Announces Stay of Court Proceedings in NuVasive Patent Lawsuit,GlobeNewswire
Feb-11-19,"Trade Talks, Shutdown, NuVasive, Activision, Amazon - 5 Things You Must Know",TheStreet.com
Feb-12-19,"Jefferies Downgrades NuVasive, Says M&A Unlikely To Materialize",Benzinga
Feb-12-19,[$$] Morgan Stanley tests M&A waters with millennial millionaires play,Financial Times
Feb-13-19,NuVasive (NUVA) Earnings Expected to Grow: Should You Buy?,Zacks
Feb-13-19,"New Research: Key Drivers of Growth for Plains Group Holdings, Cooper Tire & Rubber, NuVasive, Envestnet, Pacific Ethanol, and Mistras Group  Factors of Influence, Major Initiatives and Sustained Production",GlobeNewswire
Feb-19-19,"NuVasive's Proprietary Magnetic Implant System To Be Used In First-Of-Its-Kind, All-Internal Bone Transport System",PR Newswire
Feb-20-19,NuVasive Overcomes Industry Headwinds to Finish 2018 Strong,Motley Fool
Feb-20-19,NuVasive (NUVA) Q4 Earnings and Revenues Top Estimates,Zacks
Feb-20-19,NuVasive: 4Q Earnings Snapshot,Associated Press
Feb-20-19,NuVasive Reports Fourth Quarter And Full Year 2018 Financial Results,PR Newswire
Feb-20-19,"NuVasive, Inc. to Host Earnings Call",ACCESSWIRE
Feb-21-19,NuVasive To Present At 8th Annual Leerink Partners Global Healthcare Conference,PR Newswire
Feb-21-19,NuVasive (NUVA) Q4 2018 Earnings Conference Call Transcript,Motley Fool
Feb-21-19,Edited Transcript of NUVA earnings conference call or presentation 20-Feb-19 9:30pm GMT,Thomson Reuters StreetEvents
Feb-22-19,Edited Transcript of NUVA earnings conference call or presentation 20-Feb-19 9:30pm GMT,Thomson Reuters StreetEvents
Feb-22-19,"NuVasive (NUVA) Q4 Earnings Beat Estimates, Margins Fall",Zacks
Feb-25-19,Edited Transcript of NUVA earnings conference call or presentation 20-Feb-19 9:30pm GMT,Thomson Reuters StreetEvents
Mar-05-19,NuVasive To Participate In Cowen And Company 39th Annual Health Care Conference,PR Newswire
Mar-06-19,NuVasive To Feature Lateral Single-Position Surgery And Surgical Intelligence At Spine Summit 2019,PR Newswire
Mar-06-19,Why NuVasive Stock Rose 18% in February,Motley Fool
Mar-06-19,"Research Report Identifies E*TRADE Financial, Kennedy-Wilson, Alteryx, PTC Therapeutics, Ocean Power Technologies, and NuVasive with Renewed Outlook  Fundamental Analysis, Calculating Forward Movement",GlobeNewswire
Mar-12-19,Options Bears Jump on Battered NuVasive Stock,Schaeffer's Investment Research
Mar-22-19,NuVasive (NUVA) Down 1% Since Last Earnings Report: Can It Rebound?,Zacks
Apr-02-19,NuVasive (NUVA) Completes First COHERE XLIF Case in U.S.,Zacks
Apr-11-19,Nuvasive Advances Lateral Single-Position Surgery With Introduction Of X360 System At AANS 2019,PR Newswire
Apr-15-19,NuVasive Announces Conference Call And Webcast Of First Quarter 2019 Results,PR Newswire
Apr-24-19,NuVasive (NUVA) Reports Next Week: Wall Street Expects Earnings Growth,Zacks
Apr-29-19,"Is NuVasive, Inc. (NUVA) A Good Stock To Buy?",Insider Monkey
May-01-19,NuVasive Straightens Up to Start 2019,Motley Fool
May-01-19,NuVasive (NUVA) Q1 Earnings and Revenues Top Estimates,Zacks
May-01-19,NuVasive: 1Q Earnings Snapshot,Associated Press
May-01-19,NuVasive Announces First Quarter 2019 Financial Results,PR Newswire
May-01-19,A Preview Of NuVasive's Q1 Earnings,Benzinga
May-02-19,Edited Transcript of NUVA earnings conference call or presentation 1-May-19 8:30pm GMT,Thomson Reuters StreetEvents
May-02-19,"NuVasive (NUVA) Q1 Earnings Top Estimates, Margins Strong",Zacks
May-02-19,NuVasive Inc (NUVA) Q1 2019 Earnings Call Transcript,Motley Fool
May-06-19,NuVasive To Present At The Bank of America Merrill Lynch Healthcare Conference 2019,PR Newswire
May-06-19,"How NuVasive, Inc. (NASDAQ:NUVA) Can Impact Your Portfolio Volatility",Simply Wall St.
May-06-19,Edited Transcript of NUVA earnings conference call or presentation 1-May-19 8:30pm GMT,Thomson Reuters StreetEvents
