date,title,source
Oct-22-18,Potlatch (PCH) Q3 Earnings Preview: What to Know Ahead of the Release,Zacks
Oct-26-18,Does PotlatchDeltic Corporations (NASDAQ:PCH) CEO Pay Compare Well With Peers?,Simply Wall St.
Oct-29-18,Edited Transcript of PCH earnings conference call or presentation 29-Oct-18 3:00pm GMT,Thomson Reuters StreetEvents
Oct-29-18,Potlatch Corp (Holding Co) (PCH) Q3 2018 Earnings Conference Call Transcript,Motley Fool
Oct-29-18,Potlatch (PCH) Misses Q3 Earnings and Revenue Estimates,Zacks
Oct-29-18,Potlatch: 3Q Earnings Snapshot,Associated Press
Oct-29-18,PotlatchDeltic Corporation Reports Third Quarter 2018 Results,GlobeNewswire
Oct-30-18,Edited Transcript of PCH earnings conference call or presentation 29-Oct-18 3:00pm GMT,Thomson Reuters StreetEvents
Nov-01-18,Edited Transcript of PCH earnings conference call or presentation 29-Oct-18 3:00pm GMT,Thomson Reuters StreetEvents
Nov-13-18,PotlatchDeltic Announces Preliminary Results of Special Dividend Shareholder Election,GlobeNewswire
Nov-14-18,PotlatchDeltic Announces Estimated Number of Shares for Stock Portion of the Special Dividend,GlobeNewswire
Nov-15-18,PotlatchDeltic Announces Payment of Special Dividend,GlobeNewswire
Nov-21-18,Is Now An Opportune Moment To Examine PotlatchDeltic Corporation (NASDAQ:PCH)?,Simply Wall St.
Dec-07-18,UPDATE - PotlatchDeltic Board Declares Quarterly Distribution of 40 Cents Per Share on Increased Share Count,GlobeNewswire
Dec-07-18,PotlatchDeltic Board Declares Quarterly Distribution of 40 Cents Per Share on Increased Share Count,GlobeNewswire
Dec-14-18,How To Look At PotlatchDeltic Corporation (NASDAQ:PCH),Simply Wall St.
Dec-21-18,PotlatchDeltic Announces Agreement to Sell El Dorado MDF,GlobeNewswire
Dec-24-18,PotlatchDeltic (PCH) to Divest MDF Business for $92 Million,Zacks
Jan-08-19,"PotlatchDeltic Scheduled to Release Fourth Quarter 2018 Earnings on February 4, 2019",Business Wire
Jan-10-19,PotlatchDeltic Announces Tax Treatment for 2018 Dividend Distributions,Business Wire
Jan-11-19,Need To Know: PotlatchDeltic Corporation (NASDAQ:PCH) Insiders Have Been Selling Shares,Simply Wall St.
Jan-28-19,Analysts Estimate Potlatch (PCH) to Report a Decline in Earnings: What to Look Out for,Zacks
Feb-04-19,Potlatch (PCH) Beats Q4 Earnings Estimates,Zacks
Feb-04-19,Potlatch: 4Q Earnings Snapshot,Associated Press
Feb-04-19,PotlatchDeltic Corporation Reports Fourth Quarter and Full Year 2018 Results,Business Wire
Feb-05-19,Potlatch Corp (Holding Co) (PCH) Q4 2018 Earnings Conference Call Transcript,Motley Fool
Feb-06-19,"Boasting A 9.3% Return On Equity, Is PotlatchDeltic Corporation (NASDAQ:PCH) A Top Quality Stock?",Simply Wall St.
Feb-07-19,Edited Transcript of PCH earnings conference call or presentation 5-Feb-19 5:00pm GMT,Thomson Reuters StreetEvents
Feb-08-19,New Strong Sell Stocks for February 8th,Zacks
Feb-13-19,"Roseburg and PotlatchDeltic Complete Purchase and Sale of MDF Plant in El Dorado, Ark.",Business Wire
Feb-15-19,PotlatchDeltic Board Declares Distribution on Common Stock,Business Wire
Feb-20-19,PotlatchDeltic Executives to Present at the Raymond James & Associates 40th Annual Institutional Investors Conference in Orlando,Business Wire
Feb-22-19,Mason Hawkins' Southeastern Buys 5 Stocks in 4th Quarter,GuruFocus.com
Feb-27-19,"PotlatchDeltic Corp (PCH) Files 10-K for the Fiscal Year Ended on December 31, 2018",GuruFocus.com
Mar-12-19,Are PotlatchDeltic Corporation (NASDAQ:PCH) Shareholders Getting A Good Deal?,Simply Wall St.
Mar-21-19,"PotlatchDeltic Names Anna Torma Vice President, Public Affairs",Business Wire
Mar-22-19,Edited Transcript of PCH earnings conference call or presentation 5-Feb-19 5:00pm GMT,Thomson Reuters StreetEvents
Apr-08-19,"CORRECTING and REPLACING PotlatchDeltic Scheduled to Release First Quarter 2019 Earnings on April 29, 2019",Business Wire
Apr-10-19,Does The Data Make PotlatchDeltic Corporation (NASDAQ:PCH) An Attractive Investment?,Simply Wall St.
Apr-15-19,United Rentals (URI) to Report Q1 Earnings: What's in Store?,Zacks
Apr-16-19,Will Lower Sales and Margins Impact NVR in Q1 Earnings?,Zacks
Apr-17-19,Volatility Woes Dampen Wood Industry's Near-Term Prospects,Zacks
Apr-18-19,Top Ranked Income Stocks to Buy for April 18th,Zacks
Apr-18-19,Will Lower Deliveries Impact PulteGroup's (PHM) Q1 Earnings?,Zacks
Apr-22-19,"The Zacks Analyst Blog Highlights: Buckle, Macquarie Infrastructure, Las Vegas Sands and PotlatchDeltic",Zacks
Apr-22-19,Will Margin Woes Impact D.R. Horton's (DHI) Q2 Earnings?,Zacks
Apr-23-19,Can Juniper (JNPR) Keep Earnings Beat Streak Alive in Q1?,Zacks
Apr-23-19,Sony (SNE) to Report Q4 Earnings: What's in the Offing?,Zacks
Apr-23-19,Masco (MAS) to Report Q1 Earnings: What's in the Cards?,Zacks
Apr-24-19,What Awaits SBA Communications (SBAC) This Earnings Season?,Zacks
Apr-25-19,Masco's (MAS) Shares Decline as Q1 Earnings Miss Estimates,Zacks
Apr-25-19,"Universal Forest Products' (UFPI) Q1 Earnings Beat, Up Y/Y",Zacks
Apr-26-19,"Weyerhaeuser's (WY) Q1 Earnings In Line, Sales Lag, Down Y/Y",Zacks
Apr-29-19,Is PotlatchDeltic Corporation (PCH) A Good Stock To Buy?,Insider Monkey
Apr-29-19,Potlatch: 1Q Earnings Snapshot,Associated Press
Apr-29-19,PotlatchDeltic Corporation Reports First Quarter 2019 Results,Business Wire
Apr-30-19,PotlatchDeltic Corp (PCH) Q1 2019 Earnings Call Transcript,Motley Fool
Apr-30-19,Will Top-Line Growth Drive Arista's (ANET) Q1 Earnings?,Zacks
Apr-30-19,Will Higher Revenues Boost Motorola's (MSI) Q1 Earnings?,Zacks
May-02-19,Edited Transcript of PCH earnings conference call or presentation 30-Apr-19 4:00pm GMT,Thomson Reuters StreetEvents
May-03-19,Investors Who Bought PotlatchDeltic (NASDAQ:PCH) Shares A Year Ago Are Now Down 19%,Simply Wall St.
May-08-19,PotlatchDeltic Executives to Present at REITWeek Conference in New York,Business Wire
May-09-19,PotlatchDeltic Board Declares Distribution on Common Stock,Business Wire
May-20-19,PotlatchDeltic Announces Changes to Idaho Recreation Permits,Business Wire
