date,title,source
Oct-17-18,Vodafone UK's One Net cloud-based service experiencing technical issues,Reuters
Oct-22-18,[$$] EU Launches Probe Into Vodafone-Liberty Global Deal,The Wall Street Journal
Oct-22-18,Telefonica Deutschland calls for regulators to block Vodafone-Liberty deal,Reuters
Oct-26-18,Ex-UBS Compliance Officer Used Burner Phone for Takeover Talk,Bloomberg
Oct-29-18,"A UBS Compliance Officer, a Mayfair Club and a Secret Deal",Bloomberg
Oct-31-18,Play Communications S.A. -- Moody's: EMEA telecoms sector outlook stable into 2019 but increasingly fragile as revenues slow,Moody's
Nov-07-18,German broadband group urges EU to block Vodafone-Liberty deal,Reuters
Nov-07-18,eircom Holdings (Ireland) Limited -- Moody's: Europe's telcos to avoid major investment increase in 5G over the next five years; a credit neutral,Moody's
