date,title,source
Oct-17-18,Nordson Corporation Acquires Clada Medical Devices to Expand Balloon Catheter Engineering Capabilities,Business Wire
Oct-18-18,New Sustainable Fluid Packaging Technology from Nordson EFD Nominated for Product of the Year,Business Wire
Oct-23-18,New Nordson EFD Fluid Dispensing Video Gallery is Now Live,Business Wire
Oct-23-18,"Research Report Identifies Nordson, Willis Towers Watson Public, Bio-Rad Laboratories, Insperity, SAP SE, and Wesco Aircraft with Renewed Outlook  Fundamental Analysis, Calculating Forward Movement",GlobeNewswire
Oct-25-18,Nordson Corporation to Present at Bairds 2018 Global Industrial Conference,Business Wire
Oct-30-18,Nordson EFD Introduces Dial-A-Dose and Posi-Dose Animal Health Dosing Syringes,Business Wire
Nov-08-18,Nordson Corporation Receives Outstanding Philanthropic Business Award,Business Wire
Nov-20-18,Nordson Corporation Announces Earnings Release and Webcast for Fourth Quarter and Fiscal Year 2018,Business Wire
Nov-30-18,"Report: Exploring Fundamental Drivers Behind Tesla, Nordson, Paycom Software, PDL BioPharma, Corcept Therapeutics, and Willis Towers Watson Public  New Horizons, Emerging Trends, and Upcoming Developments",GlobeNewswire
Dec-11-18,Nordson Corporation Declares First Quarter Dividend for Fiscal Year 2019,Business Wire
Dec-12-18,"Nordson Caps a Solid Year, Predicts Accelerated Organic Growth in Fiscal 2019",Motley Fool
Dec-12-18,Nordson (NDSN) Lags Q4 Earnings Estimates,Zacks
Dec-12-18,Nordson: Fiscal 4Q Earnings Snapshot,Associated Press
Dec-12-18,Nordson Corporation Reports Fiscal Year 2018 Fourth Quarter and Record Full Year Results,Business Wire
Dec-13-18,Nordson Corporation (NDSN) Q4 2018 Earnings Conference Call Transcript,Motley Fool
Dec-13-18,Edited Transcript of NDSN earnings conference call or presentation 13-Dec-18 1:30pm GMT,Thomson Reuters StreetEvents
Dec-13-18,Is Nordson Corporations (NASDAQ:NDSN) 26% Better Than Average?,Simply Wall St.
Dec-13-18,"Nordson (NDSN) Q4 Earnings Lag Estimates, Organic View Solid",Zacks
Dec-14-18,Wells Fargo On Nordson: Margin Targets Not Reflective Of Cyclical Upside,Benzinga
Dec-14-18,Nordson (NDSN) in Focus: Stock Moves 6.3% Higher,Zacks
Dec-26-18,Edited Transcript of NDSN earnings conference call or presentation 13-Dec-18 1:30pm GMT,Thomson Reuters StreetEvents
Dec-27-18,Here's Why Investors Should Avoid Nordson (NDSN) Stock Now,Zacks
Jan-03-19,New Better Dispensing Videos from Nordson EFD Explain How Pistons Improve Process Control,Business Wire
Jan-10-19,Edited Transcript of NDSN earnings conference call or presentation 13-Dec-18 1:30pm GMT,Thomson Reuters StreetEvents
Jan-11-19,Nordson (NDSN) Up 4.5% Since Last Earnings Report: Can It Continue?,Zacks
Jan-18-19,Nordson Corporation (NASDAQ:NDSN) Investors Are Paying Above The Intrinsic Value,Simply Wall St.
Jan-24-19,Nordson Corporation and Nordson Corporation Foundation Mark $100 Million Milestone in Cumulative Giving in Fiscal Year 2018,Business Wire
Jan-25-19,CFX or NDSN: Which Is the Better Value Stock Right Now?,Zacks
Jan-28-19,Xylem (XYL) to Report Q4 Earnings: What's in the Offing?,Zacks
Jan-29-19,What's in the Cards for Parker-Hannifin (PH) in Q2 Earnings?,Zacks
Jan-29-19,General Electric (GE) to Post Q4 Earnings: What's in Store?,Zacks
Jan-30-19,What's in the Cards for Roper (ROP) This Earnings Season?,Zacks
Jan-30-19,Illinois Tool (ITW) to Report Q4 Earnings: What to Expect?,Zacks
Jan-31-19,Nordson Corporation Announces Earnings Release and Webcast for First Quarter Fiscal Year 2019,Business Wire
Feb-05-19,"Investor Expectations to Drive Momentum within Continental Resources, Protagonist Therapeutics, Mobile Mini, J & J Snack Foods, Griffon, and Nordson  Discovering Underlying Factors of Influence",GlobeNewswire
Feb-07-19,Nordson Industrial Coating Systems Launches New Complete Dispensing Product Line for Automotive Customers,Business Wire
Feb-12-19,Nordson Corporation Declares Second Quarter Dividend for Fiscal Year 2019,Business Wire
Feb-12-19,Nordson ASYMTEK Wins Its 15th Service Excellence Award,Business Wire
Feb-15-19,GEAGY or NDSN: Which Is the Better Value Stock Right Now?,Zacks
Feb-19-19,Nordson Corporation (NASDAQ:NDSN): How Much Money Comes Back To Investors?,Simply Wall St.
Feb-20-19,Nordson (NDSN) Lags Q1 Earnings and Revenue Estimates,Zacks
Feb-20-19,Nordson: Fiscal 1Q Earnings Snapshot,Associated Press
Feb-20-19,Nordson Corporation Reports Fiscal Year 2019 First Quarter Results,Business Wire
Feb-21-19,Nordson Slumps on Soft Organic Sales,Motley Fool
Feb-21-19,Edited Transcript of NDSN earnings conference call or presentation 21-Feb-19 1:30pm GMT,Thomson Reuters StreetEvents
Feb-21-19,"Nordson (NDSN) Q1 Earnings Lag Estimates, Down on Weak Sales",Zacks
