date,title,source
Oct-17-18,"Report: Developing Opportunities within Genesis Healthcare, Rexnord, Renewable Energy Group, Aurora Cannabis, Nomad Foods, and BRF S.A  Future Expectations, Projections Moving into 2018",GlobeNewswire
Oct-29-18,Billionaire Noam Gottesman Sued Over Manhattan Property Deal,Bloomberg
Nov-08-18,Nomad Foods (NOMD) Surpasses Q3 Earnings and Revenue Estimates,Zacks
Nov-08-18,Nomad Foods: 3Q Earnings Snapshot,Associated Press
Nov-08-18,Nomad Foods Reports Third Quarter 2018 Financial Results,Business Wire
Nov-12-18,Nomad Foods Limited (NYSE:NOMD): Cash Is King,Simply Wall St.
Dec-12-18,Edited Transcript of NOMD earnings conference call or presentation 8-Nov-18 1:30pm GMT,Thomson Reuters StreetEvents
Dec-19-18,"At US$17.02, Is Nomad Foods Limited (NYSE:NOMD) Worth Looking At Closely?",Simply Wall St.
Jan-22-19,Archer Daniels Rides on Solid Cost Saving &amp; Readiness Efforts,Zacks
Jan-23-19,Dean Foods Slumps 56% in a Year: What Makes it Unappetizing?,Zacks
Jan-24-19,Does Nomad Foods Limited (NYSE:NOMD) Have A Good P/E Ratio?,Simply Wall St.
Jan-25-19,"Instead of Conagra (CAG), Go for These 3 Sizzling Food Stocks",Zacks
Jan-25-19,Soft Representatives Growth Hurts Avon: Is There a Way Out?,Zacks
Jan-25-19,4 Reasons Why Lamb Weston is Set to Maintain Its Robust Trend,Zacks
Jan-25-19,Factors to Watch Ahead of Blue Apron's (APRN) Q4 Earnings,Zacks
Jan-29-19,Church &amp; Dwight's (CHD) International Unit to Aid Q4 Earnings,Zacks
Jan-30-19,Will High Costs Hinder Flowers Foods' (FLO) Q4 Earnings?,Zacks
Jan-30-19,"Sysco Inks Deal to Acquire Waugh Foods, Expands Portfolio",Zacks
Jan-30-19,NOMD vs. POST: Which Stock Should Value Investors Buy Now?,Zacks
Jan-30-19,"Factors of Influence in 2019, Key Indicators and Opportunity within Leidos, Nomad Foods, Huron Consulting Group, Casella Waste, The Medicines, and Aurinia Pharmaceuticals  New Research Emphasizes Economic Growth",GlobeNewswire
Jan-31-19,"Hershey (HSY) Q4 Earnings &amp; Sales Miss Estimates, Improve Y/Y",Zacks
Jan-31-19,"Mondelez (MDLZ) Q4 Earnings In Line, Revenues Top Estimates",Zacks
Feb-04-19,"Sysco (SYY) Q2 Earnings Surpass Estimates, Revenues Miss",Zacks
Feb-04-19,Archer Daniels' Neovia Buyout to Bolster Nutrition Portfolio,Zacks
Feb-05-19,Will Freight &amp; Tariff Woes Mar Tyson Foods (TSN) Q1 Earnings?,Zacks
Feb-05-19,Archer Daniels (ADM) Q4 Earnings and Revenues Miss Estimates,Zacks
Feb-05-19,"Estee Lauder (EL) Ups View on Robust Q2 Earnings, Stock Gains",Zacks
Feb-05-19,Will Hain Celestial (HAIN) Earnings Continue to Fall in Q2?,Zacks
Feb-06-19,Will Supply Chain Hurdles Show on Coty's (COTY) Q2 Earnings?,Zacks
Feb-06-19,"Nomad Foods to Report Fourth Quarter and Full Year 2018 Results on Thursday, February 28, 2019",Business Wire
Feb-07-19,"Philip Morris (PM) Beats on Q4 Earnings, Revenues Down Y/Y",Zacks
Feb-07-19,"Tyson Foods (TSN) Q1 Earnings Beat Estimates, Sales Miss",Zacks
Feb-07-19,"Kellogg (K) Q4 Earnings Decline Year Over Year, Sales Rise",Zacks
Feb-07-19,"Flowers Foods (FLO) Q4 Earnings Beat Estimates, Sales Up Y/Y",Zacks
Feb-08-19,"Coty (COTY) Q2 Earnings Beat Estimates, Revenues Down Y/Y",Zacks
Feb-08-19,"Hain Celestial's (HAIN) Q2 Earnings Decline Y/Y, View Slashed",Zacks
Feb-11-19,Will Currency be a Drag on Nu Skin's (NUS) Q4 Earnings?,Zacks
Feb-12-19,Strong Segments to Fuel Service Corporation (SCI) Q4 Earnings,Zacks
Feb-12-19,Pilgrim's Pride (PPC) Q4 Earnings: Will Chicken Woes Persist?,Zacks
Feb-13-19,Smucker Unveils Plans for Investment in Sherbrooke Facility,Zacks
Feb-13-19,Hormel Foods (HRL) Q1 Earnings: Will Tariff Woes Persist?,Zacks
Feb-14-19,"Pilgrim's Pride (PPC) Q4 Earnings Lag, Weak Regions Hurt",Zacks
Feb-14-19,Will Higher Revenues Drive Sprouts Farmers' (SFM) Q4 Earnings?,Zacks
Feb-15-19,"TreeHouse Foods (THS) Beats Q4 Earnings, Lags Sales Estimates",Zacks
Feb-15-19,"Newell (NWL) Q4 Earnings Beat, Stock Down on Soft 2019 View",Zacks
Feb-15-19,NOMD or POST: Which Is the Better Value Stock Right Now?,Zacks
Feb-19-19,"Service Corporation (SCI) Q4 Earnings Miss Estimates, Up Y/Y",Zacks
Feb-20-19,"Ocean Beauty Named U.S. Distributor for Findus, Europe's Popular High Quality Frozen Food Brand",PR Newswire
Feb-20-19,P&amp;G's Tide Cleaners to Offer Hassle-Free Laundry Solutions,Zacks
Feb-21-19,"Hormel Foods (HRL) Beats on Earnings in Q1, Sales Up Y/Y",Zacks
Feb-21-19,Nomad Foods (NOMD) Reports Next Week: Wall Street Expects Earnings Growth,Zacks
Feb-21-19,Boston Beer's (SAM) Earnings &amp; Revenues Top Estimates in Q4,Zacks
Feb-22-19,"Sprouts Farmers (SFM) Q4 Earnings Beat, Soft View Hurts Stock",Zacks
Feb-22-19,Kraft Heinz (KHC) Crashes on Q4 Earnings Miss &amp; Weak Guidance,Zacks
Feb-25-19,Why Were Not Keen On Nomad Foods Limiteds (NYSE:NOMD) 6.6% Return On Capital,Simply Wall St.
Feb-25-19,Estee Lauder Hits 52-Week High: What's Behind the Rally?,Zacks
Feb-26-19,Smucker (SJM) Stock Gains 7% on Q3 Earnings &amp; Sales Beat,Zacks
Feb-27-19,"Campbell Soup (CPB) Q2 Earnings Beat Estimates, Sales Up Y/Y",Zacks
Feb-27-19,Sanderson Farms (SAFM) Down as Q1 Earnings &amp; Sales Fall Y/Y,Zacks
Feb-27-19,"B&amp;G Foods (BGS) Q4 Earnings &amp; Sales Lag Estimates, Stock Down",Zacks
Feb-28-19,Nomad Foods CEO: Why frozen fish is a 'great category' for our business,CNBC Videos
Feb-28-19,"Dean Foods (DF) Q4 Loss Wider Than Expected, Sales Down Y/Y",Zacks
Feb-28-19,Monster Beverage (MNST) Stock Up on Q4 Earnings &amp; Sales Beat,Zacks
Feb-28-19,Acquisitions boost Nomad Foods quarterly sales,Reuters
Feb-28-19,Nomad Foods quarterly sales beat estimates,Reuters
Feb-28-19,Nomad Foods Reports Fourth Quarter and Full Year 2018 Financial Results,Business Wire
Mar-01-19,Nomad Foods Could Roam to Higher Ground,TheStreet.com
Mar-01-19,Nomad Foods to Present at the UBS Global Consumer and Retail Conference,Business Wire
Mar-04-19,"Archer Daniels Acquires FCC, Boosts Citrus Flavors Portfolio",Zacks
Mar-04-19,"Kimberly-Clark to Invest in Oklahoma Mill, Boost Brands",Zacks
Mar-04-19,"Hormel Foods Boasts Strong Brands, High Tariffs a Worry",Zacks
Mar-05-19,Edited Transcript of NOMD earnings conference call or presentation 28-Feb-19 1:30pm GMT,Thomson Reuters StreetEvents
Mar-18-19,Nomad Foods Announces Public Offering of Ordinary Shares,Business Wire
Mar-21-19,Nomad Foods Announces Full Exercise of Underwriters Option to Purchase Additional Shares,Business Wire
Mar-22-19,Nomad Foods Announces Closing of Public Offering of Ordinary Shares,Business Wire
Mar-22-19,Nomad Foods Expands its Plant Protein Offerings with the Launch of Birds Eye Green Cuisine in the United Kingdom,Business Wire
Mar-28-19,"Consolidated Research: 2019 Summary Expectations for Penn National Gaming, Nomad Foods, Americold Realty Trust, Cboe Global Markets, Eagle Pharmaceuticals, and National Commerce  Fundamental Analysis, Key Performance Indications",GlobeNewswire
Apr-08-19,Nomad Foods Limited (NYSE:NOMD): Immense Growth Potential?,Simply Wall St.
Apr-18-19,"Nomad Foods to Report First Quarter 2019 Results on Thursday, May 9, 2019",Business Wire
Apr-23-19,Is Nomad Foods Limited (NYSE:NOMD) A Financially Sound Company?,Simply Wall St.
Apr-26-19,Did Hedge Funds Drop The Ball On Nomad Foods Limited (NOMD) ?,Insider Monkey
May-02-19,Earnings Preview: Nomad Foods (NOMD) Q1 Earnings Expected to Decline,Zacks
May-08-19,Nomad Foods Appoints Stuart MacFarlane to its Board of Directors,Business Wire
May-09-19,Nomad Foods (NOMD) Tops Q1 Earnings and Revenue Estimates,Zacks
May-09-19,Nomad Foods: 1Q Earnings Snapshot,Associated Press
May-09-19,Nomad Foods Reports First Quarter 2019 Financial Results,Business Wire
May-10-19,Is Nomad Foods's (NYSE:NOMD) 145% Share Price Increase Well Justified?,Simply Wall St.
May-15-19,Edited Transcript of NOMD earnings conference call or presentation 9-May-19 12:30pm GMT,Thomson Reuters StreetEvents
May-21-19,Nomad Foods Limited (NOMD) Q1 2019 Earnings Call Transcript,Motley Fool
