date,title,source
Oct-19-18,Can These Factors Give You An Edge In Popular Inc (NASDAQ:BPOP)?,Simply Wall St.
Oct-24-18,Edited Transcript of BPOP earnings conference call or presentation 24-Oct-18 3:00pm GMT,Thomson Reuters StreetEvents
Oct-24-18,Popular (BPOP) Q3 Earnings and Revenues Beat Estimates,Zacks
Oct-24-18,Popular: 3Q Earnings Snapshot,Associated Press
Oct-24-18,"Popular, Inc. Announces Third Quarter 2018 Financial Results",Business Wire
Oct-25-18,Edited Transcript of BPOP earnings conference call or presentation 24-Oct-18 3:00pm GMT,Thomson Reuters StreetEvents
Oct-29-18,Edited Transcript of BPOP earnings conference call or presentation 24-Oct-18 3:00pm GMT,Thomson Reuters StreetEvents
Oct-29-18,[$$] UK to study possible ban on sale of cryptocurrency derivatives,Financial Times
Oct-30-18,Edited Transcript of BPOP earnings conference call or presentation 24-Oct-18 3:00pm GMT,Thomson Reuters StreetEvents
Nov-05-18,Itau Unibanco (ITUB) Receives Approval for 50% Stock Split,Zacks
Nov-05-18,"Popular, Inc. Declares Dividends on Preferred Stock, Announces Distribution on Trust Preferred Securities",Business Wire
Nov-08-18,4 Reasons to Add Popular (BPOP) Stock to Your Portfolio Now,Zacks
Nov-09-18,Popular Celebrates 125 Years of Music in Puerto Rico,Business Wire
Nov-09-18,[$$] Why do we keep revisiting pops classics?,Financial Times
Nov-14-18,"Popular, Inc. Declares a Cash Dividend of $0.25 Per Common Share",Business Wire
Nov-19-18,"Popular (BPOP) Hits 52-Week High, Can the Run Continue?",Zacks
Nov-20-18,Popular Appoints Investor Relations Officer,Business Wire
Nov-20-18,Is Popular (BPOP) a Great Value Stock Right Now?,Zacks
Nov-26-18,5 Bargain Stocks Boasting Amazingly Low EV/EBITDA Ratios,Zacks
Nov-27-18,"Zacks.com featured highlights include: EnPro, Domtar, Unum, Popular and Wintrust",Zacks
Nov-27-18,National Commerce (NCOM) Surges: Stock Moves 5.2% Higher,Zacks
Nov-28-18,5 High-Flying Stocks Near 52-Week High That Can Scale Higher,Zacks
Nov-29-18,"Regions Financial on Track to Save Costs, Legal Woes Linger",Zacks
Nov-29-18,"Zacks.com highlights: United States Cellular, Mosaic, Moog, Xilinx and Popular",Zacks
Dec-04-18,"Popular, Inc. Declares Dividends on Preferred Stock, Announces Distribution on Trust Preferred Securities",Business Wire
Dec-06-18,Financial Times The Banker Magazine Recognizes Banco Popular De Puerto Rico as a Leading Bank of the Year Americas for the Fifth Consecutive Year,Business Wire
