date,title,source
Oct-18-18,Busy as a Jollibee - Asia's fast-food giant expands abroad,Reuters
Oct-22-18,Taco Bell testing Toasted Cheddar Chalupa and other menu items,MarketWatch
Oct-22-18,This is how McDonalds stacks up against two dozen restaurant chains,MarketWatch
Oct-23-18,Can Dominos Pizza Climb Higher After Rallying 40% This Year?,Motley Fool
Oct-23-18,This is how McDonalds stacks up against two dozen restaurant chains,MarketWatch
Oct-24-18,The Potential Chipotle Stock Rebound Is All About Brian Niccol,InvestorPlace
Oct-25-18,Can This Eatery's Earnings Get Food-Safety Incident Out Of Its System?,Investor's Business Daily
Oct-29-18,Here's what analysts expect from Yum's Q3 report,American City Business Journals
Oct-29-18,Yum Brands exec adds public affairs role,American City Business Journals
Oct-30-18,Yum China Rises After Surprise Quarterly Gain in Sales at KFC,Bloomberg
Oct-30-18,Want a piece of Colonel Sanders memorabilia? Here's your chance,American City Business Journals
Oct-30-18,Pizza Hut Teams Up With Toyota To Unveil Pizza-Making Pickup Truck At SEMA 2018,PR Newswire
Oct-30-18,Can Yum! Brands Be Your Shelter From the Storm?,InvestorPlace
Oct-30-18,YUM! Brands (YUM) Q3 Earnings to Gain From Refranchising,Zacks
Oct-31-18,"Why Yum! Brands, Inc. Stock Popped Today",Motley Fool
Oct-31-18,Wall Street ends last day of haunted October in the black,Reuters
Oct-31-18,Yum Brands Pizza Hut is losing out on one key demographic,MarketWatch
Oct-31-18,Edited Transcript of YUM earnings conference call or presentation 31-Oct-18 12:15pm GMT,Thomson Reuters StreetEvents
Oct-31-18,Yum Brands CEO: Foundation in place for Pizza Hut turnaround,American City Business Journals
Oct-31-18,Yum Brands Inc (YUM) Q3 2018 Earnings Conference Call Transcript,Motley Fool
Oct-31-18,"Taco Bell, KFC power Yum Brands quarterly results",Reuters
Oct-31-18,"Taco Bell, KFC power Yum Brands quarterly results",Reuters
Oct-31-18,"Taco Bell, KFC power Yum Brands quarterly results",Reuters
Oct-31-18,"Yum Brands shares jump as $1 nacho fries, pickle fried chicken draw more diners to Taco Bell and KFC",CNBC
Oct-31-18,"Strength at Taco Bell, KFC helps Yum top 3Q forecasts",Associated Press
Oct-31-18,"Yum! Brands (YUM) Q3 Earnings Top Estimates, Sales Disappoint",Zacks
Oct-31-18,"Yum! Brands Earnings, Revenue beat in Q3",Investing.com
Oct-31-18,Yum Brands CEO on earnings,CNBC Videos
Oct-31-18,"Despite Its High P/E Ratio, Is YUM! Brands Inc (NYSE:YUM) Still Undervalued?",Simply Wall St.
Oct-31-18,Yum Brands shares rise after earnings and sales beat,MarketWatch
Oct-31-18,"Stocks making the biggest move premarket: GM, ANTM, CLX, EL & more",CNBC
Oct-31-18,Yum! Brands Reports Third-Quarter GAAP Operating Profit Decline of (14)%; Delivers Third-Quarter Core Operating Profit Growth of 2%; System Sales Growth of 5%,Business Wire
Oct-31-18,Pizza Hut and Toyota team up to make a pizza-baking truck,American City Business Journals
Nov-01-18,Analyst: Here's why Pizza Hut 'plays third fiddle' to competitors,American City Business Journals
Nov-01-18,Edited Transcript of YUM earnings conference call or presentation 31-Oct-18 12:15pm GMT,Thomson Reuters StreetEvents
Nov-01-18,Its Hard to Go Wrong With McDonalds Stock,InvestorPlace
Nov-01-18,YUM! Brands Announces Intention to Refinance Certain Notes Issued Pursuant to its Existing Securitization Financing Facility,Business Wire
Nov-01-18,Yum Brands Pizza Hut is losing out on one key demographic,MarketWatch
