date,title,source
Oct-19-18,Exclusive: Global investor KKR to buy Oakland landmark for $255 million,American City Business Journals
Oct-19-18,"Stock Indexes Battle At 200-Day Lines, Try To Hold Off Bears",Investor's Business Daily
Oct-19-18,Why Clorox (CLX) Could Beat Earnings Estimates Again,Zacks
Oct-19-18,"Burts Bees Sensitive Skin Regimen Helps Support Skin Barrier Function, Promotes Visibly Healthy-looking Skin in Atopic Dermatitis/Eczema and Rosacea",Business Wire
Oct-26-18,3 Consumer Goods Stocks Bucking the Bears,Investopedia
Oct-29-18,Clorox Professional Products Company Debuts New Brand: CloroxPro,PR Newswire
Oct-30-18,"CLX, EL Q1 Earnings on Oct 31: Here are the Key Predictions",Zacks
Oct-30-18,Can Clorox (CLX) Retain its Earnings Beat Streak in Q1?,Zacks
Oct-31-18,[$$] That Big Mac and Coke Now Comes With a Side Order of Inflation,The Wall Street Journal
Oct-31-18,"Cramer Remix: Facebook's not back yet, but it's on its way",CNBC
Oct-31-18,Clorox CEO addresses 'temporary' issues in earnings with ...,CNBC Videos
Oct-31-18,Clorox Co (CLX) Q1 2019 Earnings Conference Call Transcript,Motley Fool
Oct-31-18,[$$] That Big Mac and Coke Now Comes With a Side Order of Inflation,The Wall Street Journal
Oct-31-18,Kellogg and Clorox Are More Evidence Safe Stocks Arent Safe Anymore,Barrons.com
Oct-31-18,Does The Data Make The Clorox Company (NYSE:CLX) An Attractive Investment?,Simply Wall St.
Oct-31-18,Clorox (CLX) Earnings and Sales Surpass Estimates in Q1,Zacks
Oct-31-18,"Stocks making the biggest move premarket: GM, ANTM, CLX, EL & more",CNBC
Oct-31-18,Clorox (CLX) Q1 Earnings and Revenues Surpass Estimates,Zacks
Oct-31-18,"[$$] Clorox latest to cut guidance as strong dollar, cost increases bite",Financial Times
Oct-31-18,"Clorox's stock set to fall after earnings beat, but guidance cut",MarketWatch
Oct-31-18,Clorox: Fiscal 1Q Earnings Snapshot,Associated Press
Oct-31-18,"Clorox Reports Q1 Fiscal Year 2019 Results, Updates FY19 Outlook",PR Newswire
Nov-01-18,Edited Transcript of CLX earnings conference call or presentation 31-Oct-18 5:30pm GMT,Thomson Reuters StreetEvents
Nov-01-18,"Clorox Could Correct Slightly in the Short-Run, Long-Term Still Promising",TheStreet.com
Nov-01-18,Clorox Announces Nov. 6 Webcast of Presentation at AllianceBernstein Conference,PR Newswire
Nov-05-18,"Research Report Identifies Alexandria Real Estate Equities, Select Medical, The Clorox, BlackRock, Hi-Crush Partners LP, and Oceaneering International with Renewed Outlook  Fundamental Analysis, Calculating Forward Movement",GlobeNewswire
Nov-06-18,Jim Cramer: Common Sense Is in Short Supply Right Now,TheStreet.com
Nov-09-18,Edited Transcript of CLX earnings conference call or presentation 31-Oct-18 5:30pm GMT,Thomson Reuters StreetEvents
Nov-26-18,Clorox (CLX) Gains 35% in 6 Months: Will the Rally Continue?,Zacks
Nov-28-18,MS Global Franchise Fund's Top 5 Buys in 3rd Quarter,GuruFocus.com
Nov-28-18,Clorox Shares Are Looking Still Brighter for the Months Ahead,TheStreet.com
