date,title,source
Oct-17-18,Varonis Talks Data Security and Exhibits at NetApp Insight 2018,GlobeNewswire
Oct-18-18,Palo Alto Networks Stock Upgraded: What You Need to Know,Motley Fool
Oct-22-18,Varonis Systems (VRNS) Q3 Earnings Preview: How Are Events Shaping Up?,Zacks
Oct-29-18,Varonis: 3Q Earnings Snapshot,Associated Press
Oct-29-18,Varonis Announces Third Quarter 2018 Financial Results,GlobeNewswire
Oct-30-18,Edited Transcript of VRNS earnings conference call or presentation 29-Oct-18 9:00pm GMT,Thomson Reuters StreetEvents
Oct-30-18,Varonis Systems Inc (VRNS) Q3 2018 Earnings Conference Call Transcript,Motley Fool
Oct-31-18,Edited Transcript of VRNS earnings conference call or presentation 29-Oct-18 9:00pm GMT,Thomson Reuters StreetEvents
Oct-31-18,Varonis Sees a North American Recovery,Motley Fool
