date,title,source
Oct-25-18,Should You Buy Chemed (CHE) Ahead of Earnings?,Zacks
Oct-29-18,Chemed (CHE) Beats Q3 Earnings and Revenue Estimates,Zacks
Oct-29-18,Chemed: 3Q Earnings Snapshot,Associated Press
Oct-29-18,Chemed Reports Third-Quarter 2018 Results - Earnings Guidance Increased,Business Wire
Oct-29-18,Should You Be Tempted To Sell Chemed Corporation (NYSE:CHE) Because Of Its P/E Ratio?,Simply Wall St.
Oct-30-18,"Chemed (CHE) Beats on Q3 Earnings, Raises 2018 Guidance",Zacks
Oct-30-18,Chemed stock skyrockets on earnings report,American City Business Journals
Oct-30-18,How Should Investors Feel About Chemed Corporations (NYSE:CHE) CEO Pay?,Simply Wall St.
Oct-31-18,Edited Transcript of CHE earnings conference call or presentation 30-Oct-18 2:00pm GMT,Thomson Reuters StreetEvents
Nov-01-18,Edited Transcript of CHE earnings conference call or presentation 30-Oct-18 2:00pm GMT,Thomson Reuters StreetEvents
Nov-02-18,Chemed Corporation Declares Quarterly Dividend of 30 Cents,Business Wire
Nov-02-18,"New Research Coverage Highlights Chemed, Systemax, Curtiss-Wright, Agree Realty, Standard Motor Products, and NutriSystem  Consolidated Revenues, Company Growth, and Expectations for 2018",GlobeNewswire
Nov-05-18,"Mario Gabelli Trims Keurig Dr Pepper, Chemed Positions",GuruFocus.com
Nov-07-18,Chemed Corporation to Present at the 2018 Credit Suisse Healthcare Conference,Business Wire
Nov-07-18,Diane Psaras Joins VITAS as Chief Human Resources Officer,GlobeNewswire
Nov-12-18,"VITAS Healthcare Boosts Heart Care and Education in Lake and Sumter Counties with $50,000 Donation",GlobeNewswire
Nov-28-18,Why Is Chemed (CHE) Down 2.4% Since Last Earnings Report?,Zacks
Nov-29-18,"VITAS Healthcare Supports Hospice Care for Homeless With $25,000 Gift to Joshuas House",GlobeNewswire
Nov-30-18,"HCA (HCA) Hits 52-Week High, Can the Run Continue?",Zacks
Dec-03-18,EHC vs. CHE: Which Stock Is the Better Value Option?,Zacks
Dec-06-18,Here's Why You Should Invest in Chemed (CHE) Stock Right Now,Zacks
Dec-12-18,Hedge Funds Are Betting On Chemed Corporation (CHE),Insider Monkey
Dec-19-18,EHC vs. CHE: Which Stock Is the Better Value Option?,Zacks
Jan-16-19,VITAS Healthcare Celebrates 40th Anniversary with MDC Freedom Tower Illumination,GlobeNewswire
Jan-25-19,How Many Insiders Sold Chemed Corporation (NYSE:CHE) Shares?,Simply Wall St.
Jan-25-19,"Chemed To Report Fourth-Quarter 2018 Earnings February 20, Related Conference Call To Be Held On February 21",Business Wire
Feb-06-19,VITAS HEALTHCARE CELEBRATES GRAND OPENING OF HOSPICE INPATIENT CENTER AT ROCKLEDGE,GlobeNewswire
Feb-07-19,VITAS HEALTHCARE CELEBRATES GRAND OPENING OF INPATIENT HOSPICE UNIT AT METHODIST DALLAS MEDICAL CENTER,GlobeNewswire
Feb-07-19,VITAS HEALTHCARE LAUNCHES VALENTINE HELPLINE FOR CALIFORNIANS GRIEVING THIS VALENTINES DAY,GlobeNewswire
Feb-11-19,"Factors of Influence in 2019, Key Indicators and Opportunity within Noble Energy, Chemed, Wesco Aircraft, Asbury Automotive Group, CIRCOR International, and Minerals Technologies  New Research Emphasizes Economic Growth",GlobeNewswire
Feb-13-19,Chemed (CHE) Earnings Expected to Grow: Should You Buy?,Zacks
Feb-20-19,Chemed: 4Q Earnings Snapshot,Associated Press
Feb-20-19,Chemed Reports Fourth-Quarter 2018 Results,Business Wire
Feb-20-19,Is Chemed Corporations (NYSE:CHE) Liquidity Good Enough?,Simply Wall St.
Feb-21-19,Chemed Corp (CHE) Q4 2018 Earnings Conference Call Transcript,Motley Fool
Feb-22-19,Edited Transcript of CHE earnings conference call or presentation 21-Feb-19 3:00pm GMT,Thomson Reuters StreetEvents
Feb-22-19,Chemed Corporation Declares Quarterly Dividend of 30 Cents,Business Wire
Feb-25-19,Chemed Corporations Board of Directors Authorizes an Additional $150 Million for Stock Repurchase,Business Wire
Feb-25-19,"Chemed (CHE) Q4 Earnings Beat Estimates, Gross Margin Falls",Zacks
Feb-27-19,Chemed Gains Ground on Solid VITAS &amp; Roto-Rooter Businesses,Zacks
Feb-28-19,5 VITAS Healthcare Physicians Earn Fellow Status from the American Academy of Hospice and Palliative Medicine,GlobeNewswire
Feb-28-19,VITAS Healthcare Introduces New Regional Medical Directors,GlobeNewswire
Feb-28-19,Here's Why You Should Invest in Chemed (CHE) Stock Right Now,Zacks
Mar-04-19,"Factors of Influence in 2019, Key Indicators and Opportunity within Edison International, Host Hotels & Resorts, Mondelez International, CACI International, MGM Growth Properties, and Chemed  New Research Emphasizes Economic Growth",GlobeNewswire
Mar-11-19,5 Stocks in Focus on New Analysts Coverage,Zacks
Mar-12-19,Chemed Corporation to Present at the Oppenheimer 29th Annual Healthcare Conference,Business Wire
Mar-12-19,"Zacks.com featured expert Kevin Matras highlights: Balchem, Methode Electronics, Chemed, Ubiquiti Networks and HEXO",Zacks
Mar-15-19,When Should You Buy Chemed Corporation (NYSE:CHE)?,Simply Wall St.
Mar-15-19,Chemed (CHE) Upgraded to Strong Buy: What Does It Mean for the Stock?,Zacks
Mar-22-19,Why Is Chemed (CHE) Up 2.7% Since Last Earnings Report?,Zacks
Mar-28-19,These 5 Stocks Make Great Buys on New Analyst Coverage,Zacks
Mar-29-19,"Zacks.com featured expert Kevin Matras highlights: Methode Electronics, Walker &amp; Dunlop, Marker Therapeutics, Chemed and Olympic Steel",Zacks
Apr-05-19,"Chemed To Report First-Quarter 2019 Earnings April 29, Related Conference Call To Be Held On April 30",Business Wire
Apr-08-19,Does Chemed Corporation's (NYSE:CHE) CEO Salary Compare Well With Others?,Simply Wall St.
