date,title,source
Oct-18-18,G.research 42nd Annual Automotive Aftermarket Symposium,Business Wire
Oct-23-18,"Market Trends Toward New Normal in Syros Pharmaceuticals, Westlake Chemical Partners LP, SITO Mobile, ShotSpotter, Motorcar Parts of America, and Benefitfocus  Emerging Consolidated Expectations, Analyst Ratings",GlobeNewswire
Oct-23-18,Motorcar Parts of America to Launch Additional Braking-Related Products at Upcoming Trade Show,GlobeNewswire
Oct-24-18,Motorcar Parts of America to Present at Gabelli & Companys 42nd Annual Automotive Aftermarket Symposium,GlobeNewswire
Nov-06-18,Motorcar Parts of America to Report Fiscal 2019 Second Quarter Results; Host Conference Call,GlobeNewswire
Nov-09-18,Motorcar Parts of America to Delay Filing of Fiscal Second Quarter 10-Q,GlobeNewswire
Nov-12-18,"Motorcar Parts of America still reviewing accounting policies, delaying Q2 regulatory filing",MarketWatch
Nov-12-18,Motorcar Parts of America Provides Clarification of the Delay in Filing its Fiscal Second Quarter 10-Q,GlobeNewswire
Nov-20-18,Motorcar Parts of America Receives Notice From NASDAQ Due to Delayed Filing of Form 10-Q,GlobeNewswire
Dec-07-18,Glancy Prongay & Murray LLP Announces Investigation on Behalf of Motorcar Parts of America Inc. Investors,Business Wire
Dec-07-18,INVESTOR ALERT: Law Offices of Howard G. Smith Announces Investigation on Behalf of Motorcar Parts of America Inc. Investors (MPAA),Business Wire
Dec-10-18,INVESTOR ALERT: Kirby McInerney LLP Announces an Investigation of Shareholder Claims Against Motorcar Parts of America Inc.,Business Wire
Dec-10-18,Glancy Prongay & Murray LLP Announces Investigation on Behalf of Motorcar Parts of America Inc. Investors,Business Wire
Dec-10-18,INVESTOR ALERT: Law Offices of Howard G. Smith Announces Investigation on Behalf of Motorcar Parts of America Inc. Investors (MPAA),Business Wire
Dec-12-18,"Bragar Eagel & Squire, P.C. is Investigating Motorcar Parts of America, Inc. (MPAA) on Behalf of Stockholders and Encourages MPAA Investors to Contact the Firm",GlobeNewswire
Dec-19-18,Is Motorcar Parts of America (MPAA) a Suitable Value Pick?,Zacks
