date,title,source
Oct-18-18,G.research 42nd Annual Automotive Aftermarket Symposium,Business Wire
Oct-23-18,"Market Trends Toward New Normal in Syros Pharmaceuticals, Westlake Chemical Partners LP, SITO Mobile, ShotSpotter, Motorcar Parts of America, and Benefitfocus  Emerging Consolidated Expectations, Analyst Ratings",GlobeNewswire
Oct-23-18,Motorcar Parts of America to Launch Additional Braking-Related Products at Upcoming Trade Show,GlobeNewswire
Oct-24-18,Motorcar Parts of America to Present at Gabelli & Companys 42nd Annual Automotive Aftermarket Symposium,GlobeNewswire
Nov-06-18,Motorcar Parts of America to Report Fiscal 2019 Second Quarter Results; Host Conference Call,GlobeNewswire
Nov-09-18,Motorcar Parts of America to Delay Filing of Fiscal Second Quarter 10-Q,GlobeNewswire
Nov-12-18,"Motorcar Parts of America still reviewing accounting policies, delaying Q2 regulatory filing",MarketWatch
Nov-12-18,Motorcar Parts of America Provides Clarification of the Delay in Filing its Fiscal Second Quarter 10-Q,GlobeNewswire
Nov-20-18,Motorcar Parts of America Receives Notice From NASDAQ Due to Delayed Filing of Form 10-Q,GlobeNewswire
Dec-07-18,Glancy Prongay & Murray LLP Announces Investigation on Behalf of Motorcar Parts of America Inc. Investors,Business Wire
Dec-07-18,INVESTOR ALERT: Law Offices of Howard G. Smith Announces Investigation on Behalf of Motorcar Parts of America Inc. Investors (MPAA),Business Wire
Dec-10-18,INVESTOR ALERT: Kirby McInerney LLP Announces an Investigation of Shareholder Claims Against Motorcar Parts of America Inc.,Business Wire
Dec-10-18,Glancy Prongay & Murray LLP Announces Investigation on Behalf of Motorcar Parts of America Inc. Investors,Business Wire
Dec-10-18,INVESTOR ALERT: Law Offices of Howard G. Smith Announces Investigation on Behalf of Motorcar Parts of America Inc. Investors (MPAA),Business Wire
Dec-12-18,"Bragar Eagel & Squire, P.C. is Investigating Motorcar Parts of America, Inc. (MPAA) on Behalf of Stockholders and Encourages MPAA Investors to Contact the Firm",GlobeNewswire
Dec-19-18,Is Motorcar Parts of America (MPAA) a Suitable Value Pick?,Zacks
Dec-27-18,"SHAREHOLDER ALERT: Levi & Korsinsky, LLP Notifies Investors of an Investigation Involving Possible Securities Fraud Violations by Certain Officers and Directors of Motorcar Parts of America, Inc.",GlobeNewswire
Dec-31-18,"INVESTIGATION ALERT: The Schall Law Firm Announces it is Investigating Claims Against Motorcar Parts of America, Inc. and Encourages Investors with Losses in Excess of $100,000 to Contact the Firm",Business Wire
Dec-31-18,"EQUITY ALERT: Rosen Law Firm Announces Investigation of Securities Claims Against Motorcar Parts of America, Inc.  MPAA",Business Wire
Jan-02-19,"Bragar Eagel & Squire, P.C. Reminds Investors that it is Investigating Motorcar Parts of America, Inc. (MPAA) on Behalf of Stockholders and Encourages MPAA Investors to Contact the Firm",GlobeNewswire
Jan-02-19,"INVESTIGATION ALERT REMINDER: The Schall Law Firm Announces it is Investigating Claims Against Motorcar Parts of America, Inc. and Encourages Investors with Losses in Excess of $100,000 to Contact the Firm",Business Wire
Jan-02-19,"SHAREHOLDER ALERT: Bronstein, Gewirtz & Grossman, LLC Announces Investigation of Motorcar Parts of America, Inc. (MPAA)",GlobeNewswire
Jan-02-19,Motorcar Parts of America Expands Position Within Electric Vehicle Testing Market With Acquisition of E&M Power,GlobeNewswire
Jan-04-19,INVESTOR ALERT: Kirby McInerney LLP Continues Investigation of Shareholder Claims against Motorcar Parts of America Inc.,Business Wire
Jan-04-19,"ONGOING INVESTIGATION ALERT: The Schall Law Firm Announces it is Investigating Claims Against Motorcar Parts of America, Inc. and Encourages Investors with Losses in Excess of $100,000 to Contact the Firm",GlobeNewswire
Jan-08-19,Motorcar Parts of America Inc (MPAA) Q2 2019 Earnings Conference Call Transcript,Motley Fool
Jan-08-19,"Top Gainers: Union Pacific, Motorcar Parts, Nektar Rally Into Close",Investing.com
Jan-08-19,Motorcar Parts: Fiscal 2Q Earnings Snapshot,Associated Press
Jan-08-19,Motorcar Parts of America Reports Fiscal 2019 Second Quarter Results,GlobeNewswire
Jan-09-19,Edited Transcript of MPAA earnings conference call or presentation 8-Jan-19 6:00pm GMT,Thomson Reuters StreetEvents
Jan-10-19,INVESTOR ALERT: Law Offices of Howard G. Smith Announces Investigation on Behalf of Motorcar Parts of America Inc. Investors (MPAA),GlobeNewswire
Jan-11-19,"ONGOING INVESTIGATION NOTICE: The Schall Law Firm Announces it is Investigating Claims Against Motorcar Parts of America, Inc. and Encourages Investors with Losses in Excess of $100,000 to Contact the Firm",GlobeNewswire
Jan-15-19,Glancy Prongay & Murray LLP Announces Investigation on Behalf of Motorcar Parts of America Inc. Investors,GlobeNewswire
Jan-17-19,"Bragar Eagel & Squire, P.C. Reminds Investors that it is Investigating Motorcar Parts of America, Inc. (MPAA) on Behalf of Stockholders and Encourages MPAA Investors to Contact the Firm",GlobeNewswire
Jan-17-19,New Strong Sell Stocks for January 17th,Zacks
Jan-23-19,"Heres why Motorcar Parts of America, Inc.s (NASDAQ:MPAA) Returns On Capital Matters So Much",Simply Wall St.
Jan-31-19,Motorcar Parts of America Expands Sales Team,GlobeNewswire
Feb-05-19,Motorcar Parts of America to Report Fiscal 2019 Third Quarter Results; Host Conference Call,GlobeNewswire
Feb-11-19,Motorcar Parts of America Inc (MPAA) Q3 2019 Earnings Conference Call Transcript,Motley Fool
Feb-11-19,Glancy Prongay & Murray LLP Announces Investigation on Behalf of Motorcar Parts of America Inc. Investors,GlobeNewswire
Feb-11-19,"Motorcar Parts of America, Inc. to Host Earnings Call",ACCESSWIRE
Feb-11-19,Motorcar Parts: Fiscal 3Q Earnings Snapshot,Associated Press
Feb-14-19,"Consolidated Research: 2019 Summary Expectations for Varonis, Dolby Laboratories, Alder BioPharmaceuticals, Retail Properties of America, Cerus, and Motorcar Parts of America  Fundamental Analysis, Key Performance Indications",GlobeNewswire
Feb-20-19,"Lifshitz & Miller LLP Announces Investigation of Amdocs Limited, The Container Store Group, McCormick & Company, Motorcar Parts of America, Inc., SITO Mobile, Ltd., TrueCar, Inc., United Microelectronics Corp., and Uxin Limited",PR Newswire
Feb-25-19,Glancy Prongay & Murray LLP Announces Investigation on Behalf of Motorcar Parts of America Inc. Investors,GlobeNewswire
Feb-25-19,Edited Transcript of MPAA earnings conference call or presentation 11-Feb-19 6:00pm GMT,Thomson Reuters StreetEvents
Feb-25-19,Motorcar Parts of America Director Steps Down Due to New Position,GlobeNewswire
Feb-26-19,Edited Transcript of MPAA earnings conference call or presentation 11-Feb-19 6:00pm GMT,Thomson Reuters StreetEvents
Mar-14-19,Motorcar Parts Of America To Present At 31st Annual Roth Conference,GlobeNewswire
Mar-20-19,"INVESTIGATION ALERT: The Schall Law Firm Announces it is Investigating Claims Against Motorcar Parts of America, Inc. and Encourages Investors with Losses in Excess of $100,000 to Contact the Firm",GlobeNewswire
Apr-22-19,SHAREHOLDER ALERT: Pomerantz Law Firm Investigates Claims On Behalf of Investors of Motorcar Parts of America Inc. - MPAA,PR Newswire
Apr-23-19,"Bronstein, Gewirtz & Grossman, LLC Announces Investigation of Motorcar Parts of America Inc. (MPAA)",GlobeNewswire
Apr-23-19,"Bronstein, Gewirtz & Grossman, LLC Announces Investigation of Motorcar Parts of America Inc. (MPAA)",ACCESSWIRE
Apr-24-19,"Bragar Eagel & Squire, P.C. Reminds Investors that it is Investigating Motorcar Parts of America, Inc. (MPAA) on Behalf of Stockholders and Encourages MPAA Investors to Contact the Firm",GlobeNewswire
May-13-19,Motorcar Parts of America to Present at B. Riley FBR Institutional Investor Conference,GlobeNewswire
