date,title,source
Jan-11-19,BAMLL Commercial Mortgage Securities Trust 2013-WBRK -- Moody's affirms five CMBS classes of BAMLL 2013-WBRK,Moody's
Jan-11-19,"Macys has only itself to blame for lackluster holiday performance, analyst says",MarketWatch
Jan-11-19,"Stock Market Rally Runs Into Resistance; Boeing, GM, Macy's, American Airlines: Weekly Review",Investor's Business Daily
Jan-11-19,Novice Trade: Nordstrom,TheStreet.com
Jan-11-19,Buy the Big Dip Below $30 in Macys Stock,InvestorPlace
Jan-11-19,Macy's holiday sales news prompted largest-ever selloff,American City Business Journals
Jan-11-19,Macy's Sluggish Sales Hurt Big Malls but Provide Trading Opportunities,TheStreet.com
Jan-11-19,"Macy's has tough holiday season, drags on other retailers",CNBC Videos
Jan-11-19,"Netflix, Ruku, & Chipotle In Spotlight After Wall Street's Green Week",Zacks
Jan-11-19,Macy's will be the winner from the Sears liquidation that will come inevitably: Retail analyst,Fox Business Videos
Jan-11-19,Macy's Falls for a Second Day Following Batch of Price Target Reductions,TheStreet.com
Jan-11-19,"Cramer: Macy's In Retail's 'Ugly' Category, Sears 'Horrifying'",Benzinga
Jan-11-19,Department Stores Under Pressure After Macy's Warning,Investopedia
Jan-11-19,"Company News For Jan 11, 2019",Zacks
Jan-11-19,"Fridays Vital Data: Bed Bath & Beyond, Macys and Netflix",InvestorPlace
Jan-11-19,"Macy's just had its worst day ever, but there are still bargain buys in the retail space",CNBC
Jan-11-19,"Kohl's Raises View Despite Unimpressive Comps, Stock Down 5%",Zacks
Jan-11-19,"Macy's (M) Disappoints With Holiday Numbers, So Do JCP & KSS",Zacks
Jan-11-19,Target Posts Solid Holiday Numbers Unlike Few Other Retailers,Zacks
Jan-11-19,These Are the 2019 Holiday Season's Retail Winners and Losers,Motley Fool
Jan-11-19,Is Macy's Spooking You? 3 Retail ETFs & Stocks for 2019,Zacks
Jan-11-19,Urban Outfitters Falls After Posting In-Line Holiday Sales,TheStreet.com
Jan-11-19,[$$] Macys profit warning raises concerns over US retailers,Financial Times
Jan-11-19,"Retailer stocks take a broad beating, led by Macys record plunge",MarketWatch
Jan-11-19,Today's Research Reports on Trending Tickers: Macy's and Kohl's Corporation,ACCESSWIRE
Jan-11-19,Macy's reports weak holiday sales,Fox Business Videos
Jan-14-19,Lululemon (LULU) Stock Looks Like a Buy &amp; It Just Raised Its Q4 Guidance,Zacks
Jan-14-19,Kroger Stock Could Be So Much More,InvestorPlace
Jan-14-19,Yellen says economic uncertainty has prompted some retailers to put plans on hold,CNBC
Jan-14-19,Stein Mart Joins List of Retailers Posting Soft Holiday Sales,Zacks
Jan-14-19,Lululemon shares climb 3% after raising fourth-quarter outlook,CNBC
Jan-15-19,Cramer Remix: Don't take your cue on all of retail from M...,CNBC Videos
Jan-15-19,Jim Cramer: Let's Break Down What Is Really Happening in Retail,TheStreet.com
Jan-15-19,Cramer Remix: Don't take your cue on all of retail from Macy's,CNBC
Jan-15-19,Nordstrom says sales at some stores 'below expectations' this holiday season,CNBC
Jan-15-19,"Comp Experts: CEO Pay Ratio Triggered Fresh Investor Questions, Possible Legislation",CorpGov.com
Jan-15-19,Macy's (M) Stock Sinks As Market Gains: What You Should Know,Zacks
Jan-15-19,#AskHalftime on a Dow component & retail,CNBC Videos
Jan-15-19,Macys Stock Is Stuck Between Brick-and-Mortar and Cyberspace,InvestorPlace
Jan-15-19,Macy's CEO: Customers have put us on notice,CNBC Videos
Jan-15-19,"Tuesdays Vital Data: Macys, Citigroup and Bank of America",InvestorPlace
Jan-15-19,"The Zacks Analyst Blog Highlights: Lululemon, Macy???s, Kohl???s, Nike and Adidas",Zacks
Jan-15-19,Can These 3 Hated Department Store Stocks Recover?,Motley Fool
Jan-15-19,7 Key Names to Watch This Earnings Season,TheStreet.com
Jan-15-19,"The State of Retail: Or, Why Bed Bath & Beyond Is Still a Bad Bet",Motley Fool
Jan-16-19,"Lululemon, Macy's, Meet, Ribbon and AudioEye highlighted as Zacks Bull and Bear of the Day",Zacks
Jan-16-19,Women at Macys Lead The Way,Business Wire
Jan-16-19,COMM 2012-LC4 Mortgage Trust -- Moody's affirms five classes and downgrades four classes of COMM 2012-LC4,Moody's
Jan-16-19,"Nordstrom downgraded at Goldman Sachs as full-price same-store sales decelerate, shares tumble 8%",MarketWatch
Jan-16-19,"Holiday online sales up between 16 -19%, in-store sales m...",CNBC Videos
Jan-16-19,Bear of the Day: Macy's (M),Zacks
Jan-17-19,Consumer giants spurn risks to chase online subscribers,Reuters
Jan-17-19,Consumer giants spurn risks to chase online subscribers,Reuters
Jan-17-19,Risk-Reward With Macy's,GuruFocus.com
Jan-17-19,3 Retail Stocks to Buy As They Rise From the Ashes,InvestorPlace
Jan-17-19,Doom and gloom: Department stores' disappointing holiday sales results spell trouble for 2019,CNBC
Jan-17-19,Gymboree begins winding down operations after 2nd bankruptcy,Associated Press
Jan-17-19,Trending: Investors Turn to Dividend Aristocrats Amid Market Volatility,ETF Database
Jan-18-19,"The S&P 500 is out of correction, but a number of stocks ...",CNBC Videos
Jan-18-19,Consumer giants spurn risks to chase online subscribers,Reuters
Jan-18-19,Consumer giants spurn risks to chase online subscribers,Reuters
Jan-22-19,3 Top Dividend Stocks to Buy in January,Motley Fool
Jan-22-19,New Strong Sell Stocks for January 22nd,Zacks
Jan-22-19,1 Underrated Stock to Buy in January,Motley Fool
Jan-22-19,"Report: Developing Opportunities within Macy's, Leggett & Platt, Tyler Technologies, BioScrip, DXC Technology, and STERIS plc  Future Expectations, Projections Moving into 2019",GlobeNewswire
Jan-23-19,Morgan Stanley Bank of America Merrill Lynch Trust 2016-C28 -- Moody's affirms ten classes of MSBAM 2016-C28,Moody's
Jan-24-19,Macy's (M) Stock Sinks As Market Gains: What You Should Know,Zacks
Jan-24-19,Can J.C. Penney Steer Clear of the Iceberg?,GuruFocus.com
Jan-24-19,"Deal or no deal, Sears' challenges will boost Macy's, J.C. Penney and Dillard's business",CNBC
Jan-24-19,"Walmart and Macy's are diverging, and the gap could get even worse",CNBC
Jan-25-19,How the Macy's Credit Card Works: Benefits and Rewards (M),Investopedia
Jan-28-19,Morgan Stanley Capital I Trust 2016-PSQ -- Moody's affirms four CMBS classes of MSCI 2016-PSQ,Moody's
Jan-28-19,Is Macy's Getting Ready to Cash In on Its Manhattan Flagship?,Motley Fool
Jan-29-19,Macys Celebrates Lunar New Year 2019,Business Wire
Jan-29-19,"Why You Should Care About Macys, Inc.s (NYSE:M) Low Return On Capital",Simply Wall St.
Jan-30-19,Macy's (M) Flat As Market Gains: What You Should Know,Zacks
Jan-30-19,Report: Macy's could be ready to cash in on NY flagship,American City Business Journals
Jan-30-19,Macys Celebrates Lasting Legacies During Black History Month 2019,Business Wire
Jan-30-19,Target Stock Doesnt Look Cheap Enough,InvestorPlace
Jan-31-19,Iconic Macy's building sold to Silicon Valley developer for $250 million,American City Business Journals
Jan-31-19,4 Cincinnati firms among best at working with women-owned businesses,American City Business Journals
Jan-31-19,A Reduced Payout Could Be Coming for These High-Yield Dividend Stocks,Motley Fool
Feb-01-19,Report: Target's app charges higher prices to customers near a store,American City Business Journals
Feb-06-19,All the biggest Union Square retail sales that led to Macy's latest $250M deal,American City Business Journals
Feb-08-19,Nordstrom Overcomes Department Store Woes,Morningstar
Feb-11-19,"Kroger, Bloomingdales, other retailers prevail in racketeering lawsuit",American City Business Journals
Feb-11-19,Why Macy's Stock Lost 12% in January,Motley Fool
Feb-11-19,7 High-Yield Dividend Plays to Consider,TheStreet.com
Feb-11-19,Stanford Shopping Center wants to tear down a Macy's store to make room for luxury retailers,American City Business Journals
Feb-11-19,Global Stocks Trade Cautiously Higher as US-China Trade Talks Resume in Beijing,TheStreet.com
Feb-12-19,"Macy's is down double digits this year, but here's why the magic may be coming back to the stock",CNBC Videos
Feb-12-19,Macys Names Patti Ongman Chief Merchandising Officer,Business Wire
Feb-12-19,Atlanta-based jewelry wholesaler partners with Macy's,American City Business Journals
Feb-12-19,ZENZII and Macy's Announce Partnership,PR Newswire
Feb-12-19,"Exclusive: Walmart, Google-backed Deliv end online grocery partnership",Reuters
Feb-12-19,"Exclusive: Walmart, Google-backed Deliv end online grocery partnership",Reuters
Feb-13-19,Macy's (M) Outpaces Stock Market Gains: What You Should Know,Zacks
Feb-13-19,Macy's names C-suite executive in charge of merchandising,American City Business Journals
Feb-14-19,"It's Time to Buy Into the Retail Comeback, Cramer Says",TheStreet.com
Feb-14-19,"Beaten-down Macy's needs to drop another 20 percent before it's a buy, trader says",CNBC
Feb-14-19,3 Retail REITs That Are Still in Big Trouble,InvestorPlace
Feb-14-19,8 Stocks That Can Lead in a 'Micro-Driven' Market,Investopedia
Feb-19-19,How the Macy's Credit Card Works: Benefits and Rewards (M),Investopedia
Feb-19-19,"Who Has Been Buying Macys, Inc. (NYSE:M) Shares?",Simply Wall St.
Feb-19-19,Factors Likely to Decide Macy's (M) Fate in Q4 Earnings,Zacks
Feb-20-19,Citigroup Commercial Mortgage Trust 2016-P6 -- Moody's affirms ten classes of CGCMT 2016-P6,Moody's
Feb-20-19,"Casey's, Polaris, Telenav, Applied Materials, Macy's, Zumiez and Abercrombie &amp; Fitch highlighted as Zacks Bull and Bear of the Day",Zacks
Feb-21-19,Here's What to Expect from Macy's (M) Q4 Earnings as Stock Tumbles,Zacks
Feb-21-19,Buy Home Depot (HD) Stock Before Q4 Earnings Tuesday?,Zacks
Feb-21-19,"Expect Macy's, Nordstrom Volatility Around Quarterly Prints",Benzinga
Feb-22-19,Macy's (M) Stock Sinks As Market Gains: What You Should Know,Zacks
Feb-22-19,3 Dividend Stocks That Are Actually Worth Owning,InvestorPlace
Feb-22-19,"Macys, Inc. Board Declares Quarterly Dividend",Business Wire
Feb-22-19,"CVS Stock Is Undervalued, but the Amazon Risk Looms Large",InvestorPlace
Feb-22-19,Here's what investors should know ahead of retail earnings week,CNBC Videos
Feb-25-19,COMM 2014-CCRE14 Mortgage Trust -- Moody's affirms nine and downgrades three classes of COMM 2014-CCRE14,Moody's
Feb-25-19,Macy's Reports With Stock 'Too Cheap to Ignore',Investopedia
Feb-25-19,Macy's Expected to Earn $2.53 a Share,TheStreet.com
Feb-25-19,Why Retail Stocks Are The New Big Short,Investopedia
Feb-25-19,Macy's Q4 Earnings Preview,Benzinga
Feb-25-19,52-Week Company Lows,GuruFocus.com
Feb-25-19,"Macy's, Nordstrom, Shake Shack, Potbelly and Red Robin Gourmet are part of Zacks Earnings Preview",Zacks
Feb-25-19,Dell returns to the earnings calendar as retailers holiday returns keep flowing,MarketWatch
Feb-26-19,[$$] Macy's to Trim Management Ranks,The Wall Street Journal
Feb-26-19,Macys sales hurt by fire and promotional event fumble,MarketWatch
Feb-26-19,Dillard's Stock Soars 23% on Solid Earnings,Motley Fool
Feb-26-19,"Dow Ends Slightly Lower on Weak Housing, Declines in Home Depot and Caterpillar",TheStreet.com
Feb-26-19,Macy's Earnings Beat But Comps Miss As Restructuring Sees $100 Million In Savings,Investor's Business Daily
Feb-26-19,Macy's announces multiyear restructuring plan,Associated Press
Feb-26-19,Macy's Inc (M) Q4 2018 Earnings Conference Call Transcript,Motley Fool
Feb-26-19,"Macy's main hurdle continues to be sales, says JP Morgan retail analyst",CNBC Videos
Feb-26-19,"Macys Stock Is Up, but Investors Need More Than One Good Quarter",Barrons.com
Feb-26-19,"Macy's new restructuring to cut 100 senior jobs, save $100 million annually",Reuters
Feb-26-19,Macy's will cut 100 senior jobs in restructuring to save $100 mln annually,Reuters
Feb-26-19,Macy's said these are the five areas where it plans to invest in 2019,CNBC
Feb-26-19,"Why Macy's Is Still a B Student, Says Jim Cramer",TheStreet.com
Feb-26-19,"Jim Cramer: Home Depot, Macy's, Elon Musk, Indra Nooyi and Nikki Haley",TheStreet.com
Feb-26-19,"Jim Cramer's Thoughts on Home Depot, Macy's, Tesla, Indra Nooyi and Nikki Haley",TheStreet.com
Feb-26-19,"&quot;New&quot; Housing Data, Macy's &amp; Home Depot Report Q4 Earnings",Zacks
Feb-26-19,[$$] Macy's: Plan on More Disappointment,The Wall Street Journal
Feb-26-19,"Macy's (M) Q4 Earnings Beat, Strategic Initiatives on Track",Zacks
Feb-26-19,Mixed Housing Data for December,Zacks
Feb-26-19,Macy's Needs to Embrace a Bigger Idea Than Cost Cuts,Bloomberg
Feb-26-19,"&quot;New&quot; Housing Data, Macy's &amp; Home Depot Report Q4 Earnings",Zacks
Feb-26-19,"Dillard's shares soar 21% after earnings beat, but analysts are cautious about promotions",MarketWatch
Feb-26-19,"Macy's Beats Q4 Earnings, Unveils $100 Million Restructuring Plan",TheStreet.com
Feb-26-19,Macy's Disappointing Earnings Beat,TheStreet.com
Feb-26-19,"Macy's reports EPS, revenue Q4 beat despite December slowdown",CNBC Videos
Feb-26-19,Are Options Traders Betting on a Big Move in Macy's (M) Stock?,Zacks
Feb-26-19,Macy's announces 100 executive layoffs as it beats earnings estimates,American City Business Journals
Feb-26-19,Macy's shares rise after earnings and sales beat expectations,MarketWatch
Feb-26-19,"Macy's earnings top estimates, to cut 100 jobs in restructuring; shares rise",CNBC
Feb-26-19,"Macys, Inc. Reports Fourth Quarter and Fiscal Year 2018 Earnings and Provides 2019 Guidance",Business Wire
Feb-27-19,Retail is racking up big gains this week and these names in the space are headed even higher,CNBC Videos
Feb-27-19,Edited Transcript of M earnings conference call or presentation 26-Feb-19 2:30pm GMT,Thomson Reuters StreetEvents
Feb-27-19,"Macy's Earnings Don't Encourage Morgan Stanley, Shares Pressured in 2019? ICYMI",TheStreet.com
Feb-27-19,Macys sales hurt by fire and promotional event fumble,MarketWatch
Feb-27-19,Takeaways From This Week's Surprising Retail Earnings,Benzinga
Feb-27-19,"Even After Earnings Beat, Analysts Aren't Buying Macy's",Benzinga
Feb-27-19,"Top Research Reports for NextEra Energy, Walgreens Boots & Southern Company",Zacks
Feb-27-19,"Wednesdays Vital Data: Macys, Home Depot and Bank of America",InvestorPlace
Feb-27-19,It Worked at Target. Maybe It'll Work at Macy's.,Bloomberg
Feb-27-19,Should Investors Like the Earnings Report and Guidance From Macy's?,Motley Fool
