date,title,source
Oct-17-18,These 3 Retailers Will Benefit From the Death of Sears,Motley Fool
Oct-17-18,UBS Commercial Mortgage Trust 2017-C4 -- Moody's affirms seven classes of UBSCM 2017-C4,Moody's
Oct-17-18,Macy's partners with Ohio company to roll out VR to more locations,American City Business Journals
Oct-17-18,Macy's Could Benefit From Rising Interest Rates,Motley Fool
Oct-18-18,15 Cheap Stocks With Low Risk Profiles,InvestorPlace
Oct-18-18,Macy's Stock Seen Dropping 13% As Earnings Plunge,Investopedia
Oct-18-18,"3 Stock Charts for Thursday: Wells Fargo, CSX and Macys",InvestorPlace
Oct-18-18,5 Retail Stocks Seen Winning From a Sears Bankruptcy,Investopedia
Oct-19-18,Wells Fargo Commercial Mortgage Trust 2016-C36 -- Moody's affirms seven classes of WFCM 2016-C36,Moody's
Oct-19-18,Ulta Beauty: The Brick-And-Mortar Shop With Amazon-Proof Chops,Investor's Business Daily
Oct-22-18,Find the Ultimate Gift for Everyone on Your List at Macys This Holiday Season,Business Wire
Oct-23-18,Macys Launches Sixth Annual The Big Give Back: Buy a Coat and Well Donate One,Business Wire
Oct-24-18,Macy's (M) Stock Moves -1.01%: What You Should Know,Zacks
Oct-25-18,Will Sears Holdings Survive 2018?,Motley Fool
Oct-25-18,Macy's investing $200 million in 50 stores  including a local one,American City Business Journals
Oct-25-18,Macy's adds to C-suite,American City Business Journals
Oct-26-18,5 Stocks to Buy at the Bottom,InvestorPlace
Oct-26-18,"Macys, Inc. Board Declares Quarterly Dividend",Business Wire
Oct-29-18,Bloomingdale's getting serious about natural cosmetics,American City Business Journals
Oct-29-18,Why Macy's Inc. Stock Popped Today,Motley Fool
Oct-29-18,"Retailers offer vacation raffles, kayaks, even 'glamour' bundles to attract holiday help",CNBC
Oct-29-18,"7 things to know and the best place to open a restaurant? Sorry, it's not Orlando",American City Business Journals
Oct-30-18,"Your first trade for Tuesday, Oct 30",CNBC
Oct-30-18,Today's Research Reports on Trending Tickers: Macy's and Dillard's,ACCESSWIRE
Oct-31-18,"Macys, Inc. To Report Third Quarter Results On November 14",Business Wire
Nov-01-18,Macy's (M) Outpaces Stock Market Gains: What You Should Know,Zacks
Nov-01-18,"Target plans to open its doors at 5 pm on Thanksgiving, one hour earlier than last year",CNBC
Nov-02-18,4 retail lessons from an upgraded Macy's store in Roseville,American City Business Journals
Nov-02-18,Wells Fargo Commercial Mortgage Trust 2015-P2 -- Moody's affirms eight classes of WFCM 2015-P2,Moody's
Nov-02-18,"Malls, markets, marine services: OBJ introduces the 2018 Readers' Choice Awards winners in Shopping",American City Business Journals
Nov-02-18,"Plush bathrobes, mattresses, toys and scooters on order for Black Friday",CNBC
Nov-05-18,"The fight for seasonal workers is on, as Amazon, Target compete in tightest labor market in decades",CNBC
Nov-05-18,Explore Whats New at Macys This Holiday Season,Business Wire
Nov-05-18,Macys Black Friday and Cyber Week Wonder Deals,Business Wire
Nov-06-18,10 Best Value Stocks to Buy Now,Kiplinger
Nov-06-18,"Facebook ventures into pop-up stores, featuring 'most-loved brands' like Bespoke Post, Love Your Melon",American City Business Journals
Nov-07-18,Will Macy's and Kohl's Be Done Paying Down Debt Soon?,Motley Fool
Nov-07-18,Earnings Preview: Macy's (M) Q3 Earnings Expected to Decline,Zacks
Nov-08-18,No. 1 ranked retail analyst on holiday shopping,CNBC Videos
Nov-08-18,KSS Stock is a Standout in the Soaring Retail Sector,InvestorPlace
Nov-09-18,Your Game Plan: Cramer's 'Mad Money' Recap (Friday 11/9/18),TheStreet.com
Nov-09-18,GS Mortgage Securities Trust 2014-GC26 -- Moody's affirms 12 classes of GSMS 2014-GC26,Moody's
Nov-09-18,Cramer's game plan: Let the market fret over oil and get ready to buy high-quality stocks,CNBC
Nov-09-18,Buy Macy's (M) Stock Ahead of Q3 & $1 Trillion Holiday Shopping Season?,Zacks
Nov-09-18,Macy's (M) Stock Moves -0.05%: What You Should Know,Zacks
Nov-09-18,Morgan Stanley Capital I Trust 2016-UBS12 -- Moody's affirms seven classes of MSC 2016-UBS12,Moody's
Nov-09-18,Macy's unveils renovated Kenwood store: PHOTOS,American City Business Journals
Nov-09-18,WFRBS Commercial Mortgage Trust 2012-C10 -- Moody's affirms ten and downgrades two classes of WFRBS 2012-C10,Moody's
Nov-09-18,Brookstone is coming back to America's malls,American City Business Journals
Nov-12-18,[$$] Macy's Radical Plan to Save Itself: Shrink,The Wall Street Journal
Nov-12-18,The market plunges: 3 trades,CNBC Videos
Nov-12-18,Can Macy's Regain Investors' Favor With Q3 Earnings?,Motley Fool
Nov-12-18,Macy's new holiday TV spot falls short of tearjerker status,American City Business Journals
Nov-12-18,CNBC's Cramer 'gun shy' ahead of Macy's earnings,American City Business Journals
Nov-12-18,10 Best Value Stocks to Buy Now,Kiplinger
Nov-12-18,Why the Earnings Surprise Streak Could Continue for Macy's (M),Zacks
Nov-12-18,Macy's (M) Q3 Earnings: Omnichannel Efforts to Play Key Role,Zacks
Nov-12-18,3 Things to Know as Oil Tries to Break a 10-Day Slide,Barrons.com
Nov-12-18,"Macy's, Nordstrom, Wal-Mart and Amazon are part of Zacks Earnings Preview",Zacks
Nov-12-18,"The Zacks Analyst Blog Highlights: Macy's, Amazon, J. C. Penney and Nordstrom",Zacks
Nov-13-18,Day Ahead: Top 3 Things to Watch,Investing.com
Nov-13-18,Ray Dalio's Top 5 Buys in 3rd Quarter,GuruFocus.com
Nov-13-18,Shopping for History: A Macy's Timeline,TheStreet.com
Nov-13-18,Here's What to Look for When Macy's Reports Earnings on Wednesday,TheStreet.com
Nov-13-18,How to Play Macy's Stock Into Earnings,TheStreet.com
Nov-13-18,Macy's Reports Below Its 'Reversion to the Mean',Investopedia
Nov-13-18,Is a Surprise Coming for Macy's (M) This Earnings Season?,Zacks
Nov-13-18,Macy's is testing smaller stores to save money,CNBC
Nov-13-18,This Strong U.S. Dollar Is Deadly: Market Recon,TheStreet.com
Nov-14-18,"[$$] Macy's Reports Strong Sales Growth, Raises Guidance",The Wall Street Journal
Nov-14-18,Macy's Fails to Sway Skeptical Investors,GuruFocus.com
Nov-14-18,Macy's Shares Plummet on Wednesday Despite Strong Earnings Report,TheStreet.com
Nov-14-18,Ignore Macy's 7% Decline Today as It Rides Strong Q3 Momentum into Holiday Season,Motley Fool
Nov-14-18,Retail Is Ready to Take Off This Holiday Shopping Season,TheStreet.com
Nov-14-18,What Happened in the Stock Market Today,Motley Fool
Nov-14-18,Stock Market Closes Lower After Wild Session As Indexes Remain Below This Key Level,Investor's Business Daily
Nov-14-18,"Dow Drops Triple Digits for Fourth Day, Led By Apple, Travelers, Banks",TheStreet.com
Nov-14-18,"Macy's Earnings Crush Views, Holiday Guidance Raised, But Stock Dives",Investor's Business Daily
Nov-14-18,Macys Stock Is Sliding in Spite of Strong Earnings and Guidance,Barrons.com
Nov-14-18,Shrinking Stores Are Shrinking Shares of Macy's on Wednesday,TheStreet.com
Nov-14-18,MarketPulse: Retailers Under Pressure as Traders Check Out of Macy's,Investing.com
Nov-14-18,E-Commerce Could Elevate Macy's Stock Out of Its Post-Earnings Doldrums,TheStreet.com
Nov-14-18,Macy's Reports Another Strong Quarter -- But the Stock Sinks Again,Motley Fool
Nov-14-18,Macys CEO says stores are important to the business even if theyre going to shrink,MarketWatch
Nov-14-18,Lack of Love for Macy's Doesn't Add Up,TheStreet.com
Nov-14-18,"As Macy's shrinks its stores, CEO Jeff Gennette says this is what he will do with the extra space",CNBC
Nov-14-18,"3 Reasons to Like Tesla Stock & Earnings News from Macy's, Canada Goose",Zacks
Nov-14-18,Macy's Picked a Bad Time to Announce Earnings,TheStreet.com
Nov-14-18,Don't Sweat Macy's Post-Earnings Stock Slide,TheStreet.com
Nov-14-18,Macy's Inc (M) Q3 2018 Earnings Conference Call Transcript,Motley Fool
Nov-14-18,Macy's expanding Growth50 upgrades to more stores next year,American City Business Journals
Nov-14-18,Macy's charges into the holiday shopping season like a boss,Associated Press
Nov-14-18,[$$] Investors Shrink From a Shrinking Macy's,The Wall Street Journal
Nov-14-18,Macy's raises profit forecast before key holiday season,Reuters
Nov-14-18,"Macy's Smashes Q3 Earnings Forecast, Boosts 2018 Outlook Ahead of Black Friday",TheStreet.com
Nov-14-18,Ahead of Black Friday,Zacks
Nov-14-18,"CPI In-Line at 0.3%, Plus Macy???s & Canada Goose Beat",Zacks
Nov-14-18,"Macy's (M) Beats on Q3 Earnings & Sales, Updates Outlook",Zacks
Nov-14-18,Macy's Stock Is Volatile Despite Positive Earnings,TheStreet.com
Nov-14-18,Macy's raises annual forecast before holiday season,Reuters
Nov-14-18,Macy's Investors Should Hold the Applause,Bloomberg
Nov-14-18,Macy's (M) Surpasses Q3 Earnings and Revenue Estimates,Zacks
Nov-14-18,Is Macy's (M) a Great Value Stock Right Now?,Zacks
Nov-14-18,Shopping for History: A Macy's Timeline,TheStreet.com
Nov-14-18,My Gut Says the Risk in Macy's Is to the Downside,TheStreet.com
Nov-14-18,"Macy's beats Wall Street estimates, increases sales",American City Business Journals
Nov-14-18,Macy's reports earnings that beat expectations,MarketWatch
Nov-14-18,"Stocks making the biggest move premarket: TLRY, AAPL, SNAP, K & more",CNBC
Nov-14-18,"Cisco, Macy's, Boeing, Tilray and Snap - 5 Things You Must Know",TheStreet.com
Nov-14-18,Macy's raises FY revenue and earnings guidance,CNBC Videos
Nov-14-18,"See how Macys, Kroger rank among major retailers in use of toxic chemicals",American City Business Journals
Nov-14-18,"Macys, Inc. Reports Third Quarter 2018 Earnings",Business Wire
Nov-14-18,Macy's earnings beat estimates as retailer raises forecast with hopes for strong holiday,CNBC
Nov-15-18,"Retail rally is rolling over, are these names on sale ahe...",CNBC Videos
Nov-15-18,J.C. Penney Isn't a Stock for Smart Investors,TheStreet.com
Nov-15-18,What to Expect From Victoria's Secret Parent L Brands (LB) Q3 Earnings,Zacks
Nov-15-18,"Macy's Receives Mixed Analyst Reaction After Q3 Earnings Beat, Sales Miss",Benzinga
Nov-15-18,Macys CEO says stores are important to the business even if theyre going to shrink,MarketWatch
Nov-15-18,Todays Research Reports on Stocks to Watch: Canada Goose and Macy's,ACCESSWIRE
Nov-16-18,Buy Lowe's (LOW) Stock Before Q3 Earnings After HD's Strong Quarter?,Zacks
Nov-16-18,Edited Transcript of M earnings conference call or presentation 14-Nov-18 2:30pm GMT,Thomson Reuters StreetEvents
Nov-16-18,"MarketPulse: Retailers Up for Sale as Nordstrom, Williams-Sonoma Plunge",Investing.com
Nov-16-18,"Brick-and-mortar important to Macy's, though it may shrink",American City Business Journals
Nov-16-18,Macys Thanksgiving Parade Lineup 2018: Who Will Peform This Year?,InvestorPlace
Nov-16-18,Is Macys an Undervalued Dividend Stock?,Motley Fool
Nov-16-18,"Nordstrom Tumbles After Credit Card Charge, Q3 Same-Stores Sales Miss",TheStreet.com
Nov-16-18,"Williams-Sonoma (WSM) Q3 Earnings Top, Comps Soft, Stock Down",Zacks
Nov-19-18,Wells Fargo Commercial Mortgage Trust 2017-C41 -- Moody's affirms seven classes of WFCM 2017-C41,Moody's
Nov-19-18,The Best Sports Retail Stocks to Buy Amid the Holiday Shopping Season,Zacks
Nov-19-18,Top and Flop ETFs of Last Week,Zacks
Nov-19-18,"Nordstrom, Wal-Mart, Macy's, Target and Amazon are part of Zacks Earnings Preview",Zacks
Nov-19-18,Q3 Earnings of S&P 500 Companies Cross 7-Year Peak: 5 Picks,Zacks
Nov-19-18,"Relax, Retailers Are Fine Heading Into the Holidays",Bloomberg
Nov-20-18,Why Holiday Sales Won't Boost Macy's Stock,Investopedia
Nov-20-18,These charts show which stores depend the most on holiday sales,CNBC
Nov-20-18,Is Macy's (M) Outperforming Other Retail-Wholesale Stocks This Year?,Zacks
Nov-20-18,6 Consumer Discretionary Stocks to Buy for Black Friday Week,Zacks
Nov-21-18,Investors Will Be Closely Watching Black Friday Retail Sales,GuruFocus.com
Nov-21-18,These retailers will attract the most shoppers during the holidays,American City Business Journals
Nov-21-18,Bloomingdale's taps new leader for flagship Chicago outpost,American City Business Journals
Nov-21-18,Want the best Black Friday deals? Head to a department store,CNBC
Nov-21-18,4 Retail Stocks to Buy This Thanksgiving Weekend,Zacks
Nov-21-18,"Today's Bell Ringer, November 21, 2018",CNBC Videos
Nov-21-18,Looking for Value? Why It Might Be Time to Try Macy's (M),Zacks
Nov-21-18,"The Zacks Analyst Blog Highlights: Macy's, Ross Stores, Ralph Lauren, Under Armour and V.F.",Zacks
Nov-21-18,5 Great Travel & Retail Stocks to Buy for Thanksgiving,Zacks
Nov-21-18,A Complete History of Black Friday,Zacks
Nov-23-18,"Upcoming Tech Earnings to Watch: Salesforce, VMware & HP",Zacks
Nov-23-18,"Deals lure U.S. Black Friday shoppers, biggest sales gains online",Reuters
Nov-23-18,3 Top Retail Stocks to Buy Right Now,Motley Fool
Nov-23-18,J Crew website experiences glitches on Black Friday,CNBC
Nov-23-18,Welcome To Black Friday: A Day For Retailers,Zacks
Nov-23-18,"Black Friday, Red Pre-Market",Zacks
Nov-23-18,Macy's CEO says the department store is 'prepared and ready' for more tariffs,CNBC
Nov-23-18,How Black Friday Became America's Biggest Shopping Holiday of the Year,Zacks
Nov-23-18,Watch CNBC's full interview with Macy's CEO Jeff Gennette,CNBC Videos
Nov-23-18,Macy's CEO: Brick-and-mortar business strengthening,CNBC Videos
Nov-23-18,"The Zacks Analyst Blog Highlights: Spirit Airlines, Hertz Global Holdings, Macy's, Target and Ross Stores",Zacks
Nov-23-18,5 Stocks That Make Great Buys This Black Friday,Zacks
Nov-26-18,"Cramer flags 'bargain' retail stocks: Macy's, Kohl's, Target, Amazon",CNBC
Nov-26-18,Cyber Monday on track for U.S. online shopping record,Reuters
Nov-27-18,"Cyber Monday sales break a record, with $7.9 billion spent online, Adobe Analytics says",CNBC
Nov-27-18,"The Zacks Analyst Blog Highlights: Macy???s, Amazon, eBay, Walmart and Adobe",Zacks
Nov-27-18,Can Traditional Retailers Battle Online Competition? 5 Picks,Zacks
Nov-28-18,"Macys, Inc. Announces Debt Tender Offer",Business Wire
Nov-28-18,"The Zacks Analyst Blog Highlights: Macy's, Boot Barn Holdings, Shoe Carnival, Conn's and Dollar General",Zacks
Nov-28-18,Today's Research Reports on Trending Tickers: Kohl's and Macy's,ACCESSWIRE
Nov-29-18,Macy's Sponsored a Great Parade but It Hasn't Helped the Share Price,TheStreet.com
Nov-29-18,Buy Discount Retail Stocks After Dollar Tree's (DLTR) Strong Q3 Earnings?,Zacks
Nov-29-18,"Macy's is hiring 80,000 workers this holiday seasonhere's how to land a job there",CNBC
Nov-29-18,Macy's to buy back debt,American City Business Journals
Nov-30-18,CSAIL 2016-C7 Commercial Mortgage Trust -- Moody's affirms eight classes of CSAIL 2016-C7,Moody's
Nov-30-18,Lululemon (LULU) Stock Looks Like a Buy Ahead of Q3 Earnings,Zacks
Nov-30-18,Weak Black Friday Trends Affirm That JCP Stock Is a Sell,InvestorPlace
Nov-30-18,Are Investors Undervaluing Macy's (M) Right Now?,Zacks
Nov-30-18,"Kirkland's (KIRK) Q3 Loss Lower Than Expected, Stock Up 34%",Zacks
Dec-03-18,Macy's (M) Gains But Lags Market: What You Should Know,Zacks
Dec-03-18,Should You Buy Kroger (KR) Stock Before Q3 Earnings?,Zacks
Dec-03-18,Wells Fargo Commercial Mortgage Trust 2017-C42 -- Moody's affirms nine classes of WFCM 2017-C42,Moody's
Dec-03-18,Macy's Is Shrinking Its Debt Once Again,Motley Fool
Dec-04-18,"Kirkland's Up 20% in 3 Months, Online Strength Counters Odds",Zacks
Dec-04-18,Here's What to Expect from Ulta Beauty's (ULTA) Q3 Earnings,Zacks
Dec-04-18,TJX Companies Up 29% YTD: Can Solid Comps Sustain Momentum?,Zacks
Dec-06-18,"Recent Analysis Shows Athenex, National CineMedia, Macy's, Manulife Financial, CBS, and Strategic Education Market Influences  Renewed Outlook, Key Drivers of Growth",GlobeNewswire
Dec-06-18,"After a Rough 2018, Will J.C. Penney Follow the Path of Sears or Macy's?",Motley Fool
Dec-06-18,Macy's could have been the site for filming 'Elf' if it wasn't for this one request,American City Business Journals
Dec-07-18,Here's What to Expect from Stitch Fix (SFIX) Earnings,Zacks
Dec-10-18,Grab Macys Inc (NYSE:M) Today With A Solid 4.8% Dividend Yield,Simply Wall St.
Dec-10-18,30 Christmas Gift Ideas for Anyone in 2018,TheStreet.com
Dec-10-18,"Without Toys R Us, one iconic, international toy chain could soon make its mark in the US",CNBC
Dec-10-18,"PriceSmart's (PSMT) November Comps Down, Dismal Run Continues",Zacks
Dec-11-18,Macy's (M) Dips More Than Broader Markets: What You Should Know,Zacks
Dec-11-18,Find the Perfect Last-Minute Gift at Macys,Business Wire
Dec-12-18,"Macys, Inc. Announces Pricing of Debt Tender Offer",Business Wire
Dec-12-18,"For retailers, the smartphone is future of store experience",Associated Press
Dec-12-18,"Macys, Inc. Announces Early Results and Upsizing Of Debt Tender Offer",Business Wire
Dec-13-18,Rising Interest Rates Complicate the Corporate Borrowing Spree,Barrons.com
Dec-13-18,Buy Amazon (AMZN) Stock on the Dip Heading into 2019?,Zacks
Dec-13-18,Why Big Lots (BIG) Could Be Positioned for a Slump,Zacks
Dec-13-18,Macy's Accelerates Its Debt Reduction Plan,Motley Fool
Dec-14-18,Dow drops almost 500: 3 buys,CNBC Videos
Dec-14-18,"3 Stocks That Might Seem Like Great Holiday Buys, but Aren't",Motley Fool
Dec-14-18,Morgan Stanley Bank of America Merrill Lynch Trust 2016-C32 -- Moody's affirms seven classes of MSBAM 2016-C32,Moody's
Dec-14-18,Macy's (M) Down 4.6% Since Last Earnings Report: Can It Rebound?,Zacks
Dec-14-18,"L Brands to Sell La Sanza Operations, Inks Deal with Regent",Zacks
Dec-17-18,3 Top Dividend Stocks With Yields Over 4%,Motley Fool
Dec-17-18,Developer proposes converting part of CambridgeSide mall to office space,American City Business Journals
Dec-17-18,Here's Why J. C. Penney is Down More Than 50% in 6 Months,Zacks
Dec-17-18,Rising Interest Rates Complicate the Corporate Borrowing Spree,Barrons.com
Dec-17-18,"Macy's (M) Up More Than 20% YTD, Stock Well Poised for 2019",Zacks
Dec-17-18,Is Macy's (M) Stock Outpacing Its Retail-Wholesale Peers This Year?,Zacks
Dec-17-18,Is Macy's (M) Stock Undervalued Right Now?,Zacks
Dec-19-18,5 Top Notch Retail Stocks Poised to Beat the Market in 2019,Zacks
Dec-19-18,Are Options Traders Betting on a Big Move in Macy's (M) Stock?,Zacks
Dec-19-18,Today's Research Reports on Trending Tickers: The Kroger and Macy's,ACCESSWIRE
Dec-20-18,Ollie's Bargain (OLLI) Set to Replicate Decent Show in 2019,Zacks
Dec-20-18,Macy's Finally Has a Real Growth Strategy,Motley Fool
Dec-20-18,Trump tariff war with China sends U.S. retailers on buying binge,Reuters
Dec-20-18,Trump tariff war with China sends U.S. retailers on buying binge,Reuters
Dec-21-18,There's never been this kind of surge in last-minute shoppers picking up online orders,CNBC
Dec-21-18,5 S&P 500 Stocks Stand Tall Despite Index's Loss of 2018 Gains,Zacks
Dec-21-18,"Expect a strong close for retail season, industry veteran...",CNBC Videos
Dec-24-18,Macy's (M) Stock Moves -0.18%: What You Should Know,Zacks
Dec-24-18,Retail stocks inch up in the final shopping day before Christmas,MarketWatch
Dec-26-18,"Why Amazon.com, Macy's, and Kohl's All Popped 5% or Better on Wednesday",Motley Fool
Dec-26-18,The department store genre is dead: Retail expert,CNBC Videos
Dec-26-18,"Expect strong retail season through end of 2018, sector a...",CNBC Videos
Dec-27-18,Where to Find Stocks on Sale,Zacks
Dec-27-18,These Cincinnati stocks benefited most from markets massive rally,American City Business Journals
Dec-28-18,The Top Retail Industry Headlines of 2018,Zacks
Dec-28-18,"2019 retail preview: The face of retail is changing rapidly, with pace of innovation  and destruction  likely to increase",American City Business Journals
Dec-28-18,"Zacks Value Trader Highlights: Citigroup, Huntsman, Macy???s, MetLife and Apple",Zacks
Jan-03-19,Is Macy's (M) Outperforming Other Retail-Wholesale Stocks This Year?,Zacks
Jan-03-19,Are Investors Undervaluing Macy's (M) Right Now?,Zacks
Jan-04-19,Macy's (M) Stock Sinks As Market Gains: What You Should Know,Zacks
Jan-07-19,Dillard's shares jump 6% after J.P. Morgan upgrade on 'upscale' shift,MarketWatch
Jan-07-19,Macy's and Kohl's Could Report Stellar Holiday Sales This Week,Motley Fool
Jan-07-19,Now thats how you break up a Macys. Heres whats in store for the Tysons Galleria space.,American City Business Journals
Jan-08-19,Nordstrom Stock Jumps on Morgan Stanley Upgrade,TheStreet.com
Jan-08-19,7 Retail Stocks to Buy for Winning the Online Battle,InvestorPlace
Jan-08-19,Will Kirkland's Continue Gaining From Sales-Driving Efforts?,Zacks
Jan-09-19,Check out the high-end tenants in talks for Tysons Galleria Macys,American City Business Journals
Jan-09-19,Best Buy Stock Is a Strong Trade Ahead of Earnings,InvestorPlace
Jan-09-19,"J.C. Penney Holiday Comps Fall, Store Closures in the Cards",Zacks
Jan-09-19,Herbalife Unveils Preliminary Volume Points Data & CEO Exit,Zacks
Jan-09-19,"Investors Are Undervaluing Macys, Inc. (NYSE:M) By 38.29%",Simply Wall St.
Jan-09-19,Top Ranked Income Stocks to Buy for January 9th,Zacks
Jan-10-19,[$$] Strong Economy Cant Save Macys From Retail Shifts,The Wall Street Journal
Jan-10-19,Jim Cramer: Here's What's Really Going on With Retail,TheStreet.com
Jan-10-19,"Macy's cuts profit, sales forecast after weak holiday season",Reuters
Jan-10-19,"Cramer Remix: Retailers are facing a new, harsher reality",CNBC
Jan-10-19,Good sign stocks rallying on days they should drop: Crame...,CNBC Videos
Jan-10-19,Business Highlights,Associated Press
Jan-10-19,Macy's just ignited major sell-off in the retail space an...,CNBC Videos
Jan-10-19,What Happened in the Stock Market Today,Motley Fool
Jan-10-19,"Department stores are 'fighting for their lives,' says ex-Target exec Gerald Storch",CNBC
Jan-10-19,Macy's and Kohl's slump while Bed Bath & Beyond jumps,Associated Press
Jan-10-19,3 Things to Know at the Market Close: The Retail Rundown and More,TheStreet.com
Jan-10-19,"Stocks Today Reverse Bullishly, But These Factors Show A Moderating Trend",Investor's Business Daily
Jan-10-19,Jim Cramer: Are We in a Rolling Bull Market Now?,TheStreet.com
Jan-10-19,"US STOCKS-Wall St shrugs off Macy's, rallies for fifth session",Reuters
Jan-10-19,"This Retail Giant Has Worst-Ever Stock Loss On Weak Holidays, Outlook",Investor's Business Daily
Jan-10-19,"Retailer stocks take a broad beating, led by Macys record plunge",MarketWatch
Jan-10-19,Markets Right Now: Stocks post their 5th gain in a row,Associated Press
Jan-10-19,"Macys has only itself to blame for lackluster holiday performance, analyst says",MarketWatch
Jan-10-19,Dow Ends in the Green After Falling Triple Digits in Earlier Trading,TheStreet.com
Jan-10-19,"Stock market marks 5th straight gain, Dow, S&P 500 exit correction",MarketWatch
Jan-10-19,"Dow Jones, Nasdaq Erase Early Losses; 4 Clues Hint At Apple Stock Bottoming",Investor's Business Daily
Jan-10-19,US STOCKS-Wall St seesaws higher after comments by Fed's Powell,Reuters
Jan-10-19,"Department stores fight for life in Amazon era, says form...",CNBC Videos
Jan-10-19,Why Retail Stocks Sold Off Today,Motley Fool
Jan-10-19,Drilling Down Into Macy's Results,TheStreet.com
Jan-10-19,"Macy's is one of the strongest companies out there, says ...",CNBC Videos
Jan-10-19,"Ford Cuts Jobs, Macy's & Kohl's Disappoint: What You Should Know",Zacks
Jan-10-19,From Macy's to Kohl's to L Brands: Retailers Get Hammered,TheStreet.com
Jan-10-19,Macy's shares tank on weak holiday salesHere's what thre...,CNBC Videos
Jan-10-19,Macy's Gets Crushed After Lowering Fiscal-Year Guidance,TheStreet.com
Jan-10-19,Few Places to Hide in Retail Today,TheStreet.com
Jan-10-19,Buy Target (TGT) Stock After Strong Holiday Sales Despite Macy's Sell-off?,Zacks
Jan-10-19,The Bodies Are Strewn Across the Retail Space,TheStreet.com
Jan-10-19,"Macy's cuts profit, sales forecast after weak holiday season",Reuters
Jan-10-19,Macy's shares plunge on poor holiday sales; 8 stores to close,American City Business Journals
Jan-10-19,The Latest: Analyst says colliding events hit Macy's,Associated Press
Jan-10-19,"US STOCKS-Wall St flat after four-day surge as retailers, trade talks disappoint",Reuters
Jan-10-19,[$$] Strong Economy Can't Save Retailers From Holiday Blues,The Wall Street Journal
Jan-10-19,Macy's downgraded by Bank of America after holiday sales miss,CNBC
Jan-10-19,Retail Is Getting Clobbered but There Are Some Opportunities Here,TheStreet.com
Jan-10-19,"Market is overreacting to Macy's sales, says former Walma...",CNBC Videos
Jan-10-19,Retail shares slide as otherwise strong consumer spending didn't boost holiday sales enough,CNBC
Jan-10-19,Macy's shares plunge as weak holiday sales prompt forecast cut,Reuters
Jan-10-19,Earnings Estimates for Q4 2018 Move Downward,Zacks
Jan-10-19,"US STOCKS-Wall St drops after four-day rally as retailers, trade talks disappoint",Reuters
Jan-10-19,Hedge Funds Bet These 12 Stocks Will Plunge Amid Rally,Investopedia
Jan-10-19,Macy's Tumbles Most in a Decade After Cutting Profit Forecast,Bloomberg
Jan-10-19,Markets Right Now: Retailers lead early slump on Wall Street,Associated Press
Jan-10-19,"Amazon wrecked the retail margins for all companies, Cram...",CNBC Videos
Jan-10-19,"PriceSmart (PSMT) Q1 Earnings Beat, December Comps Robust",Zacks
Jan-10-19,Macy's shares fall after company lowers guidance,CNBC Videos
Jan-10-19,Macy's stock plunges after profit and sales outlook slashed,MarketWatch
Jan-10-19,"Stocks making the biggest moves premarket: LB, BA, TGT, KSS & more",CNBC
Jan-10-19,"U.K. favorite M&S disappoints, faced with same pressures as U.S. retailers",MarketWatch
Jan-10-19,"Macys, Inc. Announces November/December 2018 Sales Results",Business Wire
Jan-10-19,J.C. Penney Plans More Store Closures as Sales Keep Falling,Motley Fool
Jan-10-19,Hedge Funds Bet These 12 Stocks Will Plunge Amid Rally,Investopedia
