date,title,source
Oct-17-18,Brink's (BCO) Q3 Earnings Preview: Here's What to Look Out For,Zacks
Oct-24-18,The Brink's Co (BCO) Q3 2018 Earnings Conference Call Transcript,Motley Fool
Oct-24-18,"[$$] Brink's Profit Shrinks, Cuts Earnings Forecast",The Wall Street Journal
Oct-24-18,Brink's (BCO) Beats Q3 Earnings and Revenue Estimates,Zacks
Oct-24-18,Brink's: 3Q Earnings Snapshot,Associated Press
Oct-24-18,Brink's Reports Improved Third-Quarter Results,GlobeNewswire
Oct-24-18,An Intrinsic Calculation For The Brinks Company (NYSE:BCO) Shows Its 32.2% Undervalued,Simply Wall St.
