date,title,source
Nov-07-18,Otelco Reports Third Quarter 2018 Operational and Financial Results,GlobeNewswire
Nov-16-18,Edited Transcript of OTEL earnings conference call or presentation 8-Nov-18 4:30pm GMT,Thomson Reuters StreetEvents
Nov-19-18,"New Research Coverage Highlights Famous Dave's of America, Great Elm Capital Group, Otelco, Simulations Plus, SilverSun Technologies, Inc., and ENGlobal  Consolidated Revenues, Company Growth, and Expectations for 2018",GlobeNewswire
Dec-12-18,Is Otelco Inc. (NASDAQ:OTEL) Overpaying Its CEO?,Simply Wall St.
Jan-17-19,A Close Look At Otelco Inc.s (NASDAQ:OTEL) 18% ROCE,Simply Wall St.
Jan-31-19,Otelco Announces Release Date for Fourth Quarter and 2018 Results and Provides Operational Update,GlobeNewswire
Mar-04-19,Otelco Reports Fourth Quarter and 2018 Operational and Financial Results,GlobeNewswire
