date,title,source
Oct-25-18,Great Western Bancorp (GWB) Misses Q4 Earnings and Revenue Estimates,Zacks
Oct-25-18,Great Western Bancorp: Fiscal 4Q Earnings Snapshot,Associated Press
Oct-25-18,Read This Before You Buy Great Western Bancorp Inc (NYSE:GWB) Because Of Its P/E Ratio,Simply Wall St.
Oct-25-18,"Great Western Bancorp, Inc. Announces Fiscal Year 2018 Fourth Quarter Financial Results; Strong Net Income Growth and Tangible Book Value Per Share1 in Fiscal Year 2018",Business Wire
Oct-25-18,"Great Western Bancorp, Inc. Declares Quarterly Cash Dividend",Business Wire
Oct-26-18,Edited Transcript of GWB earnings conference call or presentation 25-Oct-18 12:30pm GMT,Thomson Reuters StreetEvents
Oct-31-18,Construction begins on downtown Chandler mixed-use development,American City Business Journals
Oct-31-18,Great Western Bancorp (GWB): Moving Average Crossover Alert,Zacks
Nov-05-18,Edited Transcript of GWB earnings conference call or presentation 25-Oct-18 12:30pm GMT,Thomson Reuters StreetEvents
Nov-29-18,Why Great Western Bancorp Incs (NYSE:GWB) Risk Control Makes It Attractive,Simply Wall St.
Dec-25-18,"Is Great Western Bancorp, Inc.s (NYSE:GWB) CEO Pay Fair?",Simply Wall St.
Jan-10-19,"Great Western Bancorp, Inc. Announces First Quarter Fiscal 2019 Earnings and Conference Call Date",Business Wire
Jan-17-19,Great Western Bancorp (GWB) Reports Next Week: Wall Street Expects Earnings Growth,Zacks
Jan-24-19,Great Western Bancorp Inc (GWB) Q1 2019 Earnings Conference Call Transcript,Motley Fool
Jan-24-19,Great Western Bancorp (GWB) Q1 Earnings Beat Estimates,Zacks
Jan-24-19,Great Western Bancorp: Fiscal 1Q Earnings Snapshot,Associated Press
Jan-24-19,"Great Western Bancorp, Inc. Declares Quarterly Cash Dividend",Business Wire
Jan-24-19,"Great Western Bancorp, Inc. Announces Fiscal Year 2019 First Quarter Financial Results",Business Wire
Jan-28-19,Edited Transcript of GWB earnings conference call or presentation 24-Jan-19 1:30pm GMT,Thomson Reuters StreetEvents
Feb-04-19,Edited Transcript of GWB earnings conference call or presentation 24-Jan-19 1:30pm GMT,Thomson Reuters StreetEvents
Feb-26-19,"Should You Be Concerned About Great Western Bancorp, Inc.s (NYSE:GWB) Liquidity?",Simply Wall St.
Mar-22-19,Top Ranked Income Stocks to Buy for March 22nd,Zacks
Mar-26-19,Wall Street Fettered by Three Concerns: 5 High-Yielding Picks,Zacks
Mar-26-19,Is Great Western Bancorp (GWB) a Great Value Stock Right Now?,Zacks
Apr-02-19,"How Does Investing In Great Western Bancorp, Inc. (NYSE:GWB) Impact The Volatility Of Your Portfolio?",Simply Wall St.
Apr-04-19,GWB or WAFD: Which Is the Better Value Stock Right Now?,Zacks
Apr-11-19,"Great Western Bancorp, Inc. Announces Second Quarter Fiscal 2019 Earnings and Conference Call Date",Business Wire
