date,title,source
Oct-17-18,Today's Research Reports on Trending Tickers: BioMarin Pharmaceutical and Tesaro,ACCESSWIRE
Oct-18-18,"TESARO to Announce Third-Quarter 2018 Financial Results on November 1, 2018",GlobeNewswire
Oct-18-18,Tesaro Bulls Double Their Money,TheStreet.com
Oct-22-18,"Why Tesaro, Inc. Is Tanking Today",Motley Fool
Oct-22-18,3 Biotech Stocks Poised to Rise by 15% or More,Investopedia
Oct-23-18,Todays Research Reports on Stocks to Watch: Tesaro and Nektar Therapeutics,ACCESSWIRE
