date,title,source
Oct-17-18,aTyr Pharma Presents at American Society of Human Genetics 2018 Meeting,GlobeNewswire
Nov-08-18,"aTyr Pharma to Host Conference Call and Webcast of Third Quarter 2018 Financial Results on November 13, 2018",GlobeNewswire
Nov-13-18,Atyr Pharma: 3Q Earnings Snapshot,Associated Press
Nov-13-18,aTyr Pharma Announces Third Quarter 2018 Operating Results and Provides Corporate Update,GlobeNewswire
Nov-21-18,"Market Trends Toward New Normal in Wilhelmina International, Eyenovia, aTyr Pharma, Avinger, Viacom, and Axsome Therapeutics  Emerging Consolidated Expectations, Analyst Ratings",GlobeNewswire
Nov-28-18,aTyr Pharma to Present at the BMO 2018 Prescriptions for Success Healthcare Conference,GlobeNewswire
Nov-28-18,5 Top-Ranked Rising P/E Stocks to Lure Investors,Zacks
Nov-29-18,"Zacks.com highlights: Asbury Automotive, OncoGenex Pharmaceuticals, aTyr Pharma, Avinger and Sunesis Pharmaceuticals",Zacks
