date,title,source
Oct-18-18,"Trupanion, Inc. Announces Third Quarter 2018 Earnings Release and Conference Call",GlobeNewswire
Oct-22-18,Trupanion Stock Rebounds After It Rebuts Critics,Barrons.com
Oct-22-18,"Consolidated Research: 2018 Summary Expectations for Gol Linhas Aereas Inteligentes S.A, Trupanion, Ecopetrol S.A, Tejon Ranch, Cosan, and Thomson Reuters  Fundamental Analysis, Key Performance Indications",GlobeNewswire
Oct-31-18,[$$] High-Flying Pet Insurer Faces New Risk,The Wall Street Journal
Oct-31-18,[$$] High-Flying Pet Insurer Faces New Risk,The Wall Street Journal
Oct-31-18,Trupanion Ends Rewards Program Probed by Regulator,Barrons.com
Nov-01-18,Trupanion Issues Statement Regarding Conclusion of Points Program,GlobeNewswire
Nov-07-18,Trupanion Announces Upcoming Investor Conference Participation,GlobeNewswire
Nov-08-18,Trupanion (TRUP) Tops Q3 Earnings and Revenue Estimates,Zacks
Nov-08-18,Trupanion: 3Q Earnings Snapshot,Associated Press
Nov-08-18,Trupanion Reports Third Quarter 2018 Results,GlobeNewswire
