date,title,source
Oct-18-18,FICO Survey Finds Indian Firms Are Overly Confident About Their Cybersecurity,PR Newswire
Oct-22-18,Business Highlights,Associated Press
Oct-22-18,FICO to test new type of credit score,Associated Press
Oct-22-18,Should You Think About Buying Fair Isaac Corporation (NYSE:FICO) Now?,Simply Wall St.
Oct-22-18,Credit Scores Are Changing With UltraFICO: Cash Is Now Part of the Equation,TheStreet.com
Oct-22-18,FICO Named a Leader in Digital Decisioning Platforms by Independent Research Firm,PR Newswire
Oct-22-18,"Experian, FICO and Finicity Launch New UltraFICO Credit Score",PR Newswire
Oct-22-18,Your FICO credit score could go up under a new system reportedly set for unveiling next year,CNBC
Oct-23-18,This Week's Bank Earnings: What Investors Need to Know,Motley Fool
Oct-23-18,FICO Decision Management Platform Streaming is Now in the Oracle Cloud,PR Newswire
Oct-23-18,"Report: Exploring Fundamental Drivers Behind Helen of Troy, BioPharmX, Fair Isaac, Frontier Communications, ICU Medical, and Darling Ingredients  New Horizons, Emerging Trends, and Upcoming Developments",GlobeNewswire
Oct-24-18,A New FICO Scoring Model Is Coming. Is It a Good Idea?,Motley Fool
