date,title,source
Oct-25-18,"Switch's Guidance 'Achievable,' Wells Fargo Says In Upgrade Ahead Of Q3 Print",Benzinga
Oct-25-18,NTDTY or SWCH: Which Is the Better Value Stock Right Now?,Zacks
Oct-25-18,"Report: Exploring Fundamental Drivers Behind The ExOne, Switch, Monotype Imaging, Celsion, TrueCar, and Sandstorm Gold  New Horizons, Emerging Trends, and Upcoming Developments",GlobeNewswire
Nov-06-18,Analysts Estimate Switch (SWCH) to Report a Decline in Earnings: What to Look Out for,Zacks
Nov-12-18,Business Services Stocks' Earnings on Nov 13: SWCH and GDS,Zacks
Nov-13-18,Switch (SWCH) Reports Break-Even Earnings for Q3,Zacks
Nov-13-18,Switch: 3Q Earnings Snapshot,Associated Press
Nov-13-18,Switch Announces Third Quarter 2018 Financial Results,PR Newswire
Nov-14-18,2 Stocks Move Wednesday,GuruFocus.com
Nov-14-18,Analysts Hold The Line On Switch After Q3 Earnings Miss,Benzinga
Nov-14-18,Why Switch Shares Plunged Today,Motley Fool
Nov-14-18,Switch Shares Plunge Following Sharp Earnings Drop,TheStreet.com
Nov-14-18,Edited Transcript of SWCH.N earnings conference call or presentation 13-Nov-18 10:00pm GMT,Thomson Reuters StreetEvents
Nov-15-18,Why Switch Stock Bounced Back Today,Motley Fool
Dec-12-18,What Falling Estimates & Price Mean for Switch (SWCH),Zacks
Dec-14-18,Edited Transcript of SWCH.N earnings conference call or presentation 13-Nov-18 10:00pm GMT,Thomson Reuters StreetEvents
