date,title,source
Oct-19-18,Western Digital Looks to Flash for the Future,Morningstar
Oct-25-18,"Be Slow to Dump Any Stock Now With a High Dividend Yield, Solid Track Record",TheStreet.com
Oct-26-18,Is Seagate Technology plc (NASDAQ:STX) Potentially Underrated?,Simply Wall St.
Oct-26-18,Seagate (STX) Q1 Earnings Preview: What's Shaping Up?,Zacks
Oct-26-18,"Report: Developing Opportunities within Assured Guaranty, Potbelly, Enanta Pharmaceuticals, Seagate Technology, Ctrip.com International, and CyberArk Software  Future Expectations, Projections Moving into 2018",GlobeNewswire
Oct-26-18,Today's Research Reports on Trending Tickers: Western Digital and Seagate Technology,ACCESSWIRE
Oct-29-18,3 Big Yields That Got Bigger Last Week,Motley Fool
Oct-30-18,Factors Setting the Tone for Seagate (STX) in Q1 Earnings,Zacks
Oct-31-18,"Jim Cramer Shares His Thoughts On Boyd Gaming, Square And More",Benzinga
Nov-05-18,Seagate (STX) Earnings and Revenues Beat Estimates in Q1,Zacks
Nov-06-18,Edited Transcript of STX earnings conference call or presentation 2-Nov-18 1:00pm GMT,Thomson Reuters StreetEvents
Nov-08-18,Seagate and IBM Work Together to Help Reduce Global Hard Drive Counterfeiting with Blockchain Technology,Business Wire
Nov-12-18,This Is What You Should Expect From Nvidia Earnings This Week,InvestorPlace
Nov-12-18,Edited Transcript of STX earnings conference call or presentation 2-Nov-18 1:00pm GMT,Thomson Reuters StreetEvents
Nov-12-18,How Seagate Technology PLC Shares Fell 17% Last Month,Motley Fool
