date,title,source
Oct-19-18,"Detailed Research: Economic Perspectives on Anthem, Rockwell Automation, Kaiser Aluminum, LyondellBasell Industries N.V, SK Telecom Co., and ANSYS  What Drives Growth in Today's Competitive Landscape",GlobeNewswire
Oct-23-18,5 Undervalued Companies Growing Earnings,GuruFocus.com
Oct-23-18,SK Hynix Inc. -- Moody's upgrades SK Hynix's rating to Baa2; outlook stable,Moody's
Oct-30-18,Edited Transcript of 017670.KS earnings conference call or presentation 30-Oct-18 6:00am GMT,Thomson Reuters StreetEvents
Dec-13-18,SK Telecom Partners with MobiledgeX to Enable the Next Generation of Connected Devices and Mobile Application Experiences,GlobeNewswire
Jan-07-19,SK Telecom and Sinclair Broadcast Group Sign Joint Venture Agreement,PR Newswire
Jan-08-19,SK Telecom and Sinclair Broadcast Group Sign Joint Venture Agreement,PR Newswire
Jan-09-19,"SK Telecom, Harman and Sinclair Broadcast Group Sign MOU",PR Newswire
Jan-31-19,Edited Transcript of 017670.KS earnings conference call or presentation 31-Jan-19 7:00am GMT,Thomson Reuters StreetEvents
Feb-01-19,Edited Transcript of 017670.KS earnings conference call or presentation 31-Jan-19 7:00am GMT,Thomson Reuters StreetEvents
Feb-15-19,"Factors of Influence in 2019, Key Indicators and Opportunity within CVS Health, Solaris Oilfield Infrastructure, SK Telecom Co., Energizer, Emergent Biosolutions, and Quad Graphics  New Research Emphasizes Economic Growth",GlobeNewswire
Feb-15-19,SK E&S Co. Ltd. -- Moody's revises outlook on SK E&S' Baa2 rating to negative,Moody's
Feb-20-19,MobiledgeX and SK Telecom to Demonstrate the Next Generation of Connected Devices and Edge-Enabled Application Experiences at MWC,GlobeNewswire
Feb-25-19,3 Stocks With Superior Earnings Yields,GuruFocus.com
Feb-26-19,SK Telecom and Comcast Spectacor Forge Strategic Partnership for Cooperation in Esports Business,PR Newswire
Feb-26-19,SK Telecom Wins Global Mobile Awards 2019,PR Newswire
Feb-26-19,SK Telecom and Comcast Spectacor Forge Strategic Partnership for Cooperation in Esports Business,PR Newswire
Feb-26-19,SK Telecom Wins Global Mobile Awards 2019,PR Newswire
Feb-27-19,Risk-Reward With SK Telecom,GuruFocus.com
Mar-01-19,Sinclair Broadcast (SBGI) Beats on Q4 Earnings &amp; Revenues,Zacks
Apr-03-19,"South Korea rolls out 5G services on phones, in race with U.S. and China",Reuters
Apr-03-19,"South Korea first to roll out 5G services, beating U.S. and China",Reuters
Apr-03-19,"South Korea first to roll out 5G services, beating U.S. and China",Reuters
Apr-03-19,"S.Korea first to roll out 5G services, beating U.S. and China",Reuters
Apr-04-19,South Korea Is Getting a Head Start in 5G as U.S. and China Spar Over Huawei,Bloomberg
Apr-05-19,"South Korean, U.S. telcos roll out 5G services early as race heats up",Reuters
Apr-08-19,"5G: Where It's Available, Who's First, What's Next",Benzinga
Apr-10-19,"SK Telecom Co., Ltd. -- Moody's announces completion of a periodic review of ratings of SK Telecom Co., Ltd.",Moody's
Apr-17-19,Fast but patchy: trying South Koreas new 5G service,Financial Times
Apr-29-19,SK Telecom Co. Ltd. Files its Annual Report on Form 20-F,PR Newswire
Apr-29-19,South Korea's SK Telecom to develop a 5G-based map for self-driving cars,CNBC
