date,title,source
Oct-18-18,"Home Depot vs. Lowes: Both Stocks Are Slumping, So Which One Should You Buy?",GoBankingRates
Oct-18-18,The housing markets slowdown is going to kill the home renovation boom too,MarketWatch
Oct-18-18,Todays Research Reports on Stocks to Watch: The Home Depot and Lowe's Companies,ACCESSWIRE
Oct-18-18,"Asia shares sag after retreat on Wall St, weaker Japan data",Associated Press
Oct-19-18,"It was a wild week on Wall Street, here are the moves the...",CNBC Videos
Oct-19-18,"Home Depot vs. Lowes: Both Stocks Are Slumping, So Which One Should You Buy?",GoBankingRates
Oct-19-18,The housing markets slowdown is going to kill the home renovation boom too,MarketWatch
Oct-19-18,"Home Depot Customers Bought Before the Storms, Investors Might Want to Sell",TheStreet.com
Oct-19-18,Home Depot adding hundreds of high-paying jobs in Cobb County,American City Business Journals
Oct-22-18,Fed Chair Powell 'like a racehorse with blinkers on',CNBC Videos
Oct-22-18,Cramer: Fed Chair Powell is 'like a racehorse with blinke...,CNBC Videos
Oct-22-18,Home Depot (HD) Dips More Than Broader Markets: What You Should Know,Zacks
Oct-23-18,CarMax Wants to Sell You Your Next Car Entirely Online,Motley Fool
Oct-23-18,Caterpillar Drops Amid Market Uncertainty on Industrials,TheStreet.com
Oct-23-18,"Report: Exploring Fundamental Drivers Behind The Home Depot, uniQure N.V, Catalent, Apple, BioTime, and PDL BioPharma  New Horizons, Emerging Trends, and Upcoming Developments",GlobeNewswire
Oct-24-18,"Final Trades: HD, MA & more",CNBC Videos
Oct-24-18,"This is a solid consumer spending environment, says Oppen...",CNBC Videos
Oct-25-18,Will Sears Holdings Survive 2018?,Motley Fool
Oct-25-18,"Moody's turns ""positive"" as retailers reap rewards from strong U.S. economy",Reuters
Oct-25-18,3 Bounce-Back Stocks to Sell Into the False Rally,InvestorPlace
Oct-25-18,STANLEY Announces Exclusive Partnership with The Home Depot,PR Newswire
Oct-26-18,[$$] Are Companies Price Increases Painting Them Into a Corner?,The Wall Street Journal
Oct-26-18,Regency Centers Corp (REG) Q3 2018 Earnings Conference Call Transcript,Motley Fool
Oct-26-18,Looking for bright spots on a dark market day,CNBC Videos
Oct-26-18,Home Depot Falls 3%,Investing.com
Oct-26-18,[$$] Are Price Increases Painting Companies Into a Corner?,The Wall Street Journal
Oct-26-18,CBJ Morning Buzz: Sears bankruptcy a windfall for Lowe's?; NoDa artery reopens after years of construction,American City Business Journals
Oct-26-18,Real Estate Notebook: Honeywell expands; WeWork to Interlock,American City Business Journals
Oct-29-18,Home Depot (HD) Gains As Market Dips: What You Should Know,Zacks
Oct-29-18,The housing markets slowdown is going to kill the home renovation boom too,MarketWatch
Oct-29-18,Todays Research Reports on Stocks to Watch: Home Depot and Lowes,ACCESSWIRE
Oct-30-18,Philanthropic karma: Bernie Marcus tours future hospital site 24 hours after 'life-saving surgery' he helped bring to Atlanta,American City Business Journals
Oct-30-18,Masco Corp (MAS) Q3 2018 Earnings Conference Call Transcript,Motley Fool
Oct-30-18,The Home Depot to Host Third Quarter 2018 Earnings Conference Call on November 13,PR Newswire
Oct-31-18,The housing markets slowdown is going to kill the home renovation boom too,MarketWatch
Oct-31-18,10 Cant-Miss Dividend Growth Stocks to Buy,InvestorPlace
Oct-31-18,American Airlines names new senior vice president,American City Business Journals
Oct-31-18,3 Top Retail Stocks to Buy Right Now,Motley Fool
Nov-01-18,"Tom Lee: Bull Market is 'Middled Aged,' May Last to 2038",Investopedia
Nov-01-18,New to Stocks? Buy What You Know,Zacks
Nov-02-18,Why would the Fed want to cool the economy at this point: Bernie Marcus,Fox Business Videos
Nov-02-18,"Zacks Value Investor Highlights: Home Depot, Lululemon, Amazon, Tripadvisor and Domino's",Zacks
Nov-05-18,Why Lowe's Stock Lost 17% in October,Motley Fool
Nov-05-18,A Foolish Take: The Biggest Losers in the Dow's October Swoon,Motley Fool
Nov-05-18,Lowes Stock Is Rising on News the Company Is Closing Struggling Stores,Barrons.com
Nov-05-18,This map shows where Lowe's is closing stores,CNBC
Nov-05-18,Will Lowes' Turnaround Pick Up Steam?,Investopedia
Nov-05-18,[$$] Lowe's to Close Nearly 50 Stores,The Wall Street Journal
Nov-05-18,Hedge Funds Are Piling Into This Stock,Insider Monkey
Nov-05-18,Exclusive: Restoration Hardware goes beyond furniture with new food and wine offerings in Yountville,American City Business Journals
Nov-05-18,"Lowe's to close 51 stores, including 20 in the U.S.",MarketWatch
Nov-06-18,Why Home Depot Stock Lost 15% in October,Motley Fool
Nov-06-18,Is Home Depot (HD) Poised to Beat Earnings Estimates in Q3?,Zacks
Nov-06-18,Home Depot (HD) Reports Next Week: Wall Street Expects Earnings Growth,Zacks
Nov-06-18,Home Depot co-founder on rising number of 401(K) millionaires,Fox Business Videos
Nov-07-18,Home Depot Rises 3%,Investing.com
Nov-07-18,Home Depot and Lowes Look Ready to Get Back on Track,Barrons.com
Nov-07-18,The End of an Era for SeaWorld,Motley Fool
Nov-08-18,Home Depot (HD) Gains As Market Dips: What You Should Know,Zacks
Nov-08-18,Should You Buy Home Depot (HD) Stock Before Q3 Earnings?,Zacks
Nov-08-18,"Lowe's, RH downgraded on concerns about slowing housing market",MarketWatch
Nov-08-18,Home Depot Earnings: What to Watch,Motley Fool
Nov-09-18,Your Game Plan: Cramer's 'Mad Money' Recap (Friday 11/9/18),TheStreet.com
Nov-09-18,"The Home Depot, Inc. (HD): Hedge Funds Appear Confident in the Housing Market",Insider Monkey
Nov-09-18,Cramer's game plan: Let the market fret over oil and get ready to buy high-quality stocks,CNBC
Nov-09-18,Home Depot Black Friday Ad 2018: 10 Top Deals,InvestorPlace
Nov-09-18,"ANGI HomeServices, National Oilwell Varco, Home Depot, Macy's and Lowe's highlighted as Zacks Bull and Bear of the Day",Zacks
Nov-12-18,"They Were Fired, Then a Billionaire Investor Helped Them Build Home Depot",TheStreet.com
Nov-12-18,Here's What to Expect from Home Depot's (HD) Q3 Earnings,Zacks
Nov-12-18,Day Ahead: Top 3 Things to Watch,Investing.com
Nov-12-18,Home Depot Falls 3%,Investing.com
Nov-12-18,"5 Top Stock Trades for Tuesday: Goldman, Apple, and AMD Fall Hard",InvestorPlace
Nov-12-18,Home Depot Black Friday Hours 2018  Closed on Thanksgiving Day,InvestorPlace
Nov-12-18,Report: Public opinion in Equifax is nearly back to normal,American City Business Journals
Nov-12-18,Chart of the Day: Home Depot and Lowe's Go Head to Head in Home Improvement,TheStreet.com
Nov-12-18,Q3 Earnings Preview For Home Depot,Benzinga
Nov-12-18,Disabled Iraq veteran and his family surprised with adapted smart home,ABC News Videos
Nov-12-18,Why Home Depot and Retailers Are Betting on a Strong Holiday Shopping Season,TheStreet.com
Nov-12-18,I See Upside Catalysts for Home Depot Stock,TheStreet.com
Nov-12-18,Load Up on Home Depot Stock Ahead of Earnings?,InvestorPlace
Nov-12-18,It Doesn't Look Like Home Depot's Struggles Are Over,TheStreet.com
Nov-12-18,Upcoming Earnings: Home Depot Takes The Stage As Housing Data Looks Mixed,Benzinga
Nov-12-18,Home Depot Seems to Be Trading More In Line With the Struggling Housing Market,TheStreet.com
Nov-12-18,"AAP, HD Earnings on Nov 13: Here are the Key Predictions",Zacks
Nov-12-18,Housing Market Weakness Causes Concern for Home Depot,TheStreet.com
Nov-12-18,Home Depot Reports in Correction Territory,Investopedia
Nov-12-18,"Home Depot Sell Signals Abound, So Don't Pull In Ahead of Earnings",TheStreet.com
Nov-12-18,Top 5 Things to Know in The Market on Monday,Investing.com
Nov-13-18,Chart master Larry Williams' top trades for end of year,CNBC Videos
Nov-13-18,Cramer shares 'chart master' Larry Williams' top trades f...,CNBC Videos
Nov-13-18,Cramer shares 'chart master' Larry Williams' top trades for the end of the year,CNBC
Nov-13-18,[$$] Home Depot Ratchets Up Fiscal-Year Guidance,The Wall Street Journal
Nov-13-18,"S&P, Dow lose ground as crude plunge punishes energy stocks",Reuters
Nov-13-18,"US STOCKS-S&P, Dow lose ground as crude plunge punishes energy stocks",Reuters
Nov-13-18,What Happened in the Stock Market Today,Motley Fool
Nov-13-18,Buy Home Depot (HD) Stock After Strong Q3 Earnings Results?,Zacks
Nov-13-18,"Dow Ends Lower, Nasdaq Finishes Flat in Seesaw Trading",TheStreet.com
Nov-13-18,"Home Depot Earnings Easily Beat, But Dow Jones Stock Closes Lower",Investor's Business Daily
Nov-13-18,Wall Street gives up early gains as energy weighs on stocks,Reuters
Nov-13-18,"Oil Bulls Trampled, Stocks Wobble; This Chip Stock Strengthens Its Chart",Investor's Business Daily
Nov-13-18,Home Depot signals U.S. housing demand slowing,Reuters
Nov-13-18,US STOCKS-Wall Street gives up early gains as energy weighs on stocks,Reuters
Nov-13-18,"The Home Depot, Inc. (HD) Q3 2018 Earnings Conference Call Transcript",Motley Fool
Nov-13-18,"Cannabis Stocks Reporting Earnings & News from HD, AAPL, TSN",Zacks
Nov-13-18,[$$] Housing Won't Hammer Home Depot,The Wall Street Journal
Nov-13-18,Nasdaq Stages Modest Comeback After a Brutal Monday,Barrons.com
Nov-13-18,Home Depot Stock Is Falling Despite Strong Earnings and Outlook,Barrons.com
Nov-13-18,Wall Street Trades Higher Tuesday,GuruFocus.com
Nov-13-18,Home Depot's Outlook Keeps Inching Higher,Motley Fool
Nov-13-18,Cramer: Wall Street is 'absurd' for punishing Home Depot for good earnings,CNBC
Nov-13-18,"Home Depot Tops Q3 Earnings Estimate on Solid US Comps, Boosts Full-Year Outlook",TheStreet.com
Nov-13-18,Earnings Data Deluge,Zacks
Nov-13-18,Dow tumbles 160 points in early Tuesday trade as rebound attempt sputters,MarketWatch
Nov-13-18,"Indexes Try to Claw Back from Bloody Monday; Plus HD, TSN & More",Zacks
Nov-13-18,"Stock Market News For Nov 13, 2018",Zacks
Nov-13-18,No Housing Alarm Bells (Yet) for Home Depot,Bloomberg
Nov-13-18,"Walmart, Home Depot adopt health insurer tactic in drug copay battle",Reuters
Nov-13-18,"Home Depot (HD) Gains on Q3 Earnings Beat, Raises FY18 View",Zacks
Nov-13-18,"General Electric Gains, Nvidia Jumps, Best Buy Slumps",Barrons.com
Nov-13-18,"Home Depot could have a second U-turn today, says Budd Bu...",CNBC Videos
Nov-13-18,"Stocks - U.S. Futures Point to Rebound on Earnings, Easing Trade Concerns",Investing.com
Nov-13-18,"Homeowners are spending, Home Depot is winning",Associated Press
Nov-13-18,Home Depot Shares Higher on Earnings Beat,Investing.com
Nov-13-18,"Stocks making the biggest move premarket: AMZN, AAPL, HD, K & more",CNBC
Nov-13-18,US STOCKS-Futures point to rebound after technology-led selloff,Reuters
Nov-13-18,Home Depot (HD) Q3 Earnings and Revenues Top Estimates,Zacks
Nov-13-18,"Walmart, Home Depot adopt health insurer tactic in drug copay battle",Reuters
Nov-13-18,Home Depot 3Q earnings top estimates,Fox Business Videos
Nov-13-18,Does The Home Depot Incs (NYSE:HD) CEO Pay Reflect Performance?,Simply Wall St.
Nov-13-18,Two Dow stocks to buy now,CNBC Videos
Nov-13-18,"Home Depot shares jump 2.6% in premarket trade after earnings, bettter-than-expected guidance",MarketWatch
Nov-13-18,"They Were Fired, Then a Billionaire Investor Helped Them Build Home Depot",TheStreet.com
Nov-13-18,The Home Depot Announces Third Quarter Results; Updates Fiscal Year 2018 Guidance,PR Newswire
Nov-13-18,"Housing, Holidays and Heated Competition: A Home Depot Earnings Primer",TheStreet.com
Nov-13-18,"Home Depot shares up jump on earnings beat, raised sales outlook",CNBC
Nov-13-18,"Dow set to rebound nearly 150 points, boosted by blowout Home Depot earnings",CNBC
Nov-14-18,Jim Cramer: Why the Bear Market Appellation Is Worthless and Gets Us Nowhere,TheStreet.com
Nov-14-18,Jim Cramer: Don't Underestimate the China Tariff Risk,TheStreet.com
Nov-14-18,Cramer's 3 cardinal rules for investing during a bear market,CNBC
Nov-14-18,Sears customers could soon be taking their business to Home Depot,MarketWatch
Nov-14-18,Resideo Still Looks Like a Smart Smart-Home Play,Barrons.com
Nov-14-18,Don't Sweat Macy's Post-Earnings Stock Slide,TheStreet.com
Nov-14-18,[$$] Sears Customers Could Soon Be Taking Their Business to Home Depot,The Wall Street Journal
Nov-14-18,The Street Reacts To Home Depot's Q3 Beat,Benzinga
Nov-14-18,Don't Be Afraid of Home Depot,Motley Fool
Nov-14-18,Hold Onto Walmart Stock Despite Its Stretched Valuation,InvestorPlace
Nov-14-18,"Best Black Friday Deals 2018: Walmart, Target and More",TheStreet.com
Nov-14-18,"3 Stock Charts for Wednesday: Home Depot, PPL and HollyFrontier",InvestorPlace
Nov-14-18,Oil struggles after plunge | A draft Brexit 'deal' | Snap subpoenaed,CNBC
Nov-14-18,Todays Research Reports on Stocks to Watch: Home Depot and Halliburton,ACCESSWIRE
