date,title,source
Oct-17-18,"Report: Exploring Fundamental Drivers Behind Inovalon, Evolent Health, Limoneira, Overstock, Hologic, and Reading International  New Horizons, Emerging Trends, and Upcoming Developments",GlobeNewswire
Oct-19-18,Overstock.com Appoints Three New Executive Officers,GlobeNewswire
Oct-22-18,"Overstock.com Blockchain Subsidiary, Medici Ventures, Purchases Equity in Crypto Social Network, Minds",GlobeNewswire
Oct-23-18,Overstock.com Announces Upcoming Investor Event,GlobeNewswire
Oct-25-18,The Weakness of Overstock Stock Could Be a Buying Opportunity,InvestorPlace
Oct-29-18,7 Bitcoin Stocks That You Wont Lose Your Shirt Over,InvestorPlace
Nov-01-18,"Medici Land Governance, an Overstock Subsidiary, Signs MOU With Government of Rwanda to Implement Paperless Blockchain Land Governance and Property Rights Management",GlobeNewswire
Nov-06-18,"Overstock.com Scheduled to Release Q3 2018 Financial Results on November 8, 2018",GlobeNewswire
Nov-06-18,Todays Research Reports on Stocks to Watch: Overstock.com and The Childrens Place,ACCESSWIRE
Nov-07-18,Earnings Preview: Overstock.com (OSTK) Q3 Earnings Expected to Decline,Zacks
Nov-08-18,"Overstock.com (OSTK) Reports Q3 Loss, Lags Revenue Estimates",Zacks
Nov-08-18,Overstock: 3Q Earnings Snapshot,Associated Press
Nov-08-18,Overstock.com Reports Q3 2018 Results,GlobeNewswire
Nov-08-18,Bitsy.com to Open to Public Beta,GlobeNewswire
