date,title,source
Oct-17-18,Google Turns EU Regulatory Violations Into Fees,Bloomberg
Oct-17-18,Search engine Baidu becomes first China firm to join U.S. AI ethics group,Reuters
Oct-17-18,Search engine Baidu becomes first China firm to join U.S. AI ethics group,Reuters
Oct-17-18,PRESS DIGEST -Wall Street Journal - Oct 17,Reuters
Oct-17-18,"Cramer says shares of Alphabet and Amazon, his largest tr...",CNBC Videos
Oct-17-18,"SHAREHOLDER ALERT: Pomerantz Law Firm Reminds Shareholders with Losses on their Investment in Alphabet, Inc. of Class Action Lawsuit and Upcoming Deadline - GOOG",ACCESSWIRE
Oct-17-18,"Cramer: Alphabet and Amazon, my largest trust holding, can still be bought after Netflix beat",CNBC
Oct-17-18,Google refusing contracts wont hurt US Defense Department: T.J. Rodgers,Fox Business Videos
Oct-17-18,Jeff Bezos has been quiet on the disappearance of Washington Post journalist Jamal Khashoggi,CNBC
Oct-17-18,Alphabet stock initiated at Wedbush with outperform rating,MarketWatch
Oct-17-18,S&P 500 Today Drops After Fed Comments Rattle Stock Market,Investor's Business Daily
Oct-17-18,Netflixs Blowout Report Is a Great Thing for FANG Stocks,InvestorPlace
Oct-17-18,Great Quarter Pushes Netflix Stock Back to Fair Value,InvestorPlace
Oct-17-18,"The Klein Law Firm Reminds Investors of Class Actions on Behalf of Shareholders of PZZA, TGTX, MGTI, CHGG and GOOG",GlobeNewswire
Oct-17-18,"Sen. Cardin on Khashoggi, Google in China, Midterms",Bloomberg
Oct-17-18,Are Consumers Worried Enough to Buy a Personal Computer Server?,Bloomberg
Oct-17-18,10 Companies Distancing Themselves From Saudi Arabia,Benzinga
Oct-17-18,Co-living startup seeks to build nearly 800 units in downtown San Jose amid Google campus plans,American City Business Journals
Oct-18-18,Ex-Googler's Anti-Conservative Bias Case Headed to Arbitration,Bloomberg
Oct-18-18,Amazon will subpoena Google and Cisco to unmask malvertising scammers,American City Business Journals
Oct-18-18,Alphabet A Falls 3%,Investing.com
Oct-18-18,"INVESTOR ACTION NOTICE: The Schall Law Firm Announces it is Investigating Claims Against Alphabet Inc. and Encourages Investors with Losses in Excess of $100,000 to Contact the Firm",ACCESSWIRE
Oct-18-18,Dissecting Google Parent Alphabet (GOOGL) Ahead of Q3 Earnings,Zacks
Oct-18-18,Going Long? This Analyst Likes Amazon and Facebook More Than Google.,Barrons.com
Oct-18-18,Why Google Stock Looks Attractive,InvestorPlace
Oct-18-18,Google Maps will now navigate to your favorite electric car charging station,Quartz
Oct-18-18,Google Just Exposed Its Achilles Heel to Microsoft in Europe,Motley Fool
Oct-18-18,Wedbush's 7 Reasons To Like Alphabet,Benzinga
Oct-18-18,This Quarters Earnings Could Be a Huge Deal for Microsoft Stock,InvestorPlace
Oct-18-18,"CLASS ACTION UPDATE for TGTX, MGTI, SFIX and GOOG: Levi & Korsinsky, LLP Reminds Investors of Class Actions on Behalf of Shareholders",GlobeNewswire
Oct-18-18,"As Pentagon Cloud Computing Bid Deadline Nears, Google Drops Out, IBM Protests",Benzinga
Oct-18-18,The 'Fab 5' Stocks  And Why They're So Important To The Rally,Benzinga
Oct-18-18,"The Zacks Analyst Blog Highlights: Google, Facebook, Amazon and Netflix",Zacks
Oct-18-18,Is Apple Getting Ahead of Others in Maintaining Data Privacy?,Zacks
Oct-18-18,Google parent Alphabet's stock gains after Webush starts coverage with bullish rating,MarketWatch
Oct-18-18,"Beaten-up tech stocks to feel more pain, investor Paul Meeks predicts",CNBC
Oct-18-18,"Amazon Tops in Product Search, but Can It Keep Growing?",Motley Fool
Oct-18-18,'Enough excuses!' France's Le Maire grows impatient over GAFA tax,Reuters
Oct-18-18,'Enough excuses!' France's Le Maire grows impatient over GAFA tax,Reuters
Oct-18-18,Google to charge smartphone makers for Google Play in Europe,Reuters
Oct-18-18,China's JD Will Launch Flagship U.S. Store on Google This Year,Bloomberg
Oct-18-18,"France's OVH to triple spending to take on Google, Amazon in cloud computing",Reuters
Oct-18-18,Google My Business Insights adds branded search reporting,Search Engine Land
Oct-18-18,Why You Should Ditch Googles Favorite Data Collection Tools,Bloomberg
Oct-19-18,"ALPHABET SHAREHOLDER ALERT BY FORMER LOUISIANA ATTORNEY GENERAL: Kahn Swick & Foti, LLC Reminds Investors with Losses in Excess of $100,000 of Lead Plaintiff Deadline in Class Action Lawsuits Against Alphabet Inc. - GOOG, GOOGL",PR Newswire
Oct-19-18,[$$] Why Big Tech Keeps Trying Its Hand at Hardware,The Wall Street Journal
Oct-19-18,Google to charge Android partners up to $40 per device for apps: source,Reuters
Oct-19-18,Facebook Hires Ex-Deputy Premier Clegg to Lead Lobbying Push,Bloomberg
Oct-19-18,Google to charge Android partners up to $40 per device for apps - source,Reuters
