date,title,source
Oct-18-18,Will Fee Income Growth Aid Citizens (CFG) in Q3 Earnings?,Zacks
Oct-19-18,Edited Transcript of CFG earnings conference call or presentation 19-Oct-18 1:00pm GMT,Thomson Reuters StreetEvents
Oct-19-18,Citizens Financial Group CEO: Higher interest rates are a...,CNBC Videos
Oct-19-18,"Citizens Financial Group, Inc. (CFG) Q3 2018 Earnings Conference Call Transcript",Motley Fool
Oct-19-18,The 25 Biggest U.S. IPOs of All Time,Kiplinger
Oct-19-18,"Citizens Financial's (CFG) Q3 Earnings Beat, Expenses Rise",Zacks
Oct-19-18,Citizens Financial Group (CFG) Tops Q3 Earnings Estimates,Zacks
Oct-19-18,Citizens Financial Group: 3Q Earnings Snapshot,Associated Press
Oct-19-18,"Citizens Financial Group, Inc. Reports Third Quarter Net Income of $443 Million with Diluted EPS of $0.91 up 34% Year over Year; Underlying Net Income of $450 million and EPS of $0.93, up 37% Year over Year*",Business Wire
Oct-22-18,Citizens Financial Group Announces Pricing of $300 Million Preferred Stock Offering,Business Wire
Oct-22-18,"Citizens Bank Stock Gets Two Upgrades, but Still Doesnt Rally",Barrons.com
Oct-22-18,Citizens Bank CEO says investing in technology is one of its biggest challenges for the next year,American City Business Journals
Oct-23-18,Edited Transcript of CFG earnings conference call or presentation 19-Oct-18 1:00pm GMT,Thomson Reuters StreetEvents
Oct-23-18,"Sallie Mae (SLM) Q3 Earnings Match Estimates, Expenses Rise",Zacks
Oct-29-18,Should You Worry About Citizens Financial Group Incs (NYSE:CFG) CEO Salary Level?,Simply Wall St.
Oct-29-18,"Bank Notes: Citizens touts fintech partnerships, in-house tech development",American City Business Journals
Oct-30-18,Regional Banks Loan Portfolios Can Only Get Worse,Barrons.com
Oct-31-18,Federal Reserve unveils proposal to ease regulations for larger banks,Reuters
Oct-31-18,U.S. Federal Reserve unveils proposal to ease regulations for larger banks,Reuters
Oct-31-18,Regional Banks Loan Portfolios Can Only Get Worse,Barrons.com
Nov-01-18,"Fed proposes going easier on some large banks, including Citizens",American City Business Journals
Nov-02-18,Citizens Financial Group to Present at the BancAnalysts Association of Boston Conference,Business Wire
Nov-02-18,Citizens Bank and Military Warriors Support Foundation Present Home to Purple Heart Recipient,Business Wire
Nov-05-18,Citizens Financial to acquire wealth management firm,American City Business Journals
Nov-05-18,"Citizens Financial Group, Inc. to Expand Wealth Management Business with the Acquisition of Clarfeld Financial Advisors, LLC",Business Wire
Nov-06-18,Bank Snags Top Barrons Advisor Firm,Barrons.com
Nov-06-18,This Finance Stock is a Favorite Among Top Hedge Funds,Insider Monkey
Nov-06-18,Citizens Financial (CFG) to Buy Clarfeld Financial Advisors,Zacks
Nov-07-18,Dallas bankers get in on the U.S. oil field waste water problem,American City Business Journals
Nov-07-18,"Huge bank plans to cut 55 jobs, close Greater Cincinnati facility",American City Business Journals
Nov-08-18,76% Of Consumers Are More Likely to Make a Purchase If a Simple and Seamless Payment Plan is Offered,Business Wire
Nov-09-18,4 Bank Stocks at Risk of Big Sell-Offs,Investopedia
Nov-12-18,Citizens Financial Services (CZFS) Beats Q3 Earnings Estimates,Zacks
Nov-12-18,"Bank Notes: Wells Fargo shuffles C-suite, uncovers more mortgage issues",American City Business Journals
Nov-14-18,Citizens Bank Teams with LISC Across Workforce Development Initiatives,Business Wire
Nov-19-18,4 Low P/CF Stocks to Add Maximum Value to Your Investment,Zacks
Nov-20-18,Citizens Financial Group to Present at the Goldman Sachs Financial Services Conference,Business Wire
Nov-20-18,"New Citizens Bank Survey Finds Two-Thirds of U.S. Companies May Be Overexposed to Risks Posed by Interest Rate, Foreign Exchange Volatility",Business Wire
Nov-20-18,"Zacks.com highlights: ArcBest, Citizens Financial Group, General Motors and Gulfport Energy",Zacks
Nov-27-18,Why Citizens Financial is Worth Adding to Your Portfolio,Zacks
Nov-28-18,Is Citizens Financial Group Inc (NYSE:CFG) An Attractive Dividend Stock?,Simply Wall St.
Dec-03-18,Michael Ruttledge Joining Citizens Financial Group as Chief Information Officer,Business Wire
Dec-03-18,Pick These 4 Low P/CF Stocks to Add Value to Your Investment,Zacks
Dec-04-18,Citizens Bank closes branch in Comcast Center,American City Business Journals
Dec-04-18,"Zacks.com featured highlights include: ArcBest, Citizens Financial, General Motors and Gulfport Energy",Zacks
Dec-06-18,"The Zacks Analyst Blog Highlights: Bank of America, Citigroup, Regional Financial, Capital One and Citizens Financial",Zacks
Dec-07-18,"Citizens Financial Group, Inc. Declares Dividends on Preferred Stock",Business Wire
Dec-10-18,CFG vs. FFIC: Which Stock Should Value Investors Buy Now?,Zacks
Dec-12-18,Filling the Gap: Pittsburgh companies share their workforce strategies,American City Business Journals
Dec-14-18,Continue to see reasonably good loan demand: Citizens Financial CEO,Fox Business Videos
Dec-14-18,3 Battered Finance Stocks Set to Rebound in 2019,Zacks
Dec-17-18,"The Zacks Analyst Blog Highlights: Essent Group, Citizens Financial and Federated Investors",Zacks
Dec-18-18,Create a Standout Portfolio With These 4 Low P/CF Stocks,Zacks
Dec-19-18,Citizens Financial Group Announces Prime Rate Change,Business Wire
Dec-19-18,"Zacks.com featured highlights include: Daqo, ArcBest, Citizens Financial and General Motors",Zacks
Dec-19-18,"Citizens Financial Group, Inc. Appoints Edward J. Kelly III to Board of Directors; Art Ryan to Retire from Board in April 2019",Business Wire
Dec-20-18,Citizens Financial Group Announces Fourth Quarter and Full Year 2018 Earnings Conference Call Details,Business Wire
Dec-21-18,4 High Earnings Yield Stocks to Strengthen Your Portfolio,Zacks
Dec-21-18,"Citizens Bank reshaping branch network with relocations, rehabs",American City Business Journals
Dec-24-18,Why Citizens Financial Group (CFG) is Poised to Beat Earnings Estimates Again,Zacks
Dec-24-18,"Zacks.com featured highlights include: Citizens Financial, Nexeo, Domtar and KBR",Zacks
Jan-02-19,Citizens Bank parent company completes acquisition of wealth management firm,American City Business Journals
Jan-02-19,"Citizens Financial Group, Inc. Completes Previously Announced Acquisition of Clarfeld Financial Advisors, LLC",Business Wire
Jan-03-19,Citizens Financial Closes Clarfeld Financial Advisors Buyout,Zacks
Jan-08-19,"Citizens Financial Group to Announce First Quarter Results on April 18, 2019",Business Wire
Jan-09-19,Here are the local banks with the most consumer complaints,American City Business Journals
Jan-09-19,"Citizens Bank sees more consumer complaints than most, study finds",American City Business Journals
Jan-11-19,Citizens Financial Group (CFG) Earnings Expected to Grow: What to Know Ahead of Next Week's Release,Zacks
Jan-17-19,"Boston Fed adds banking, real estate execs to board",American City Business Journals
Jan-17-19,Here Are 6 Regional Banks That Pay Big Dividend Yields,Barrons.com
Jan-17-19,"Loan Growth, Rising Rates to Aid Citizens' (CFG) Q4 Earnings",Zacks
Jan-18-19,Citizens Financial Group Inc (CFG) Q4 2018 Earnings Conference Call Transcript,Motley Fool
Jan-18-19,"Citizens Financial's (CFG) Q4 Earnings Beat, Expenses Rise",Zacks
Jan-18-19,Citizens Financial (CFG) Tops Q4 Earnings on High Revenues,Zacks
Jan-18-19,Citizens Financial Group (CFG) Q4 Earnings Surpass Estimates,Zacks
Jan-18-19,Citizens Financial Group: 4Q Earnings Snapshot,Associated Press
Jan-18-19,"Citizens Financial Group, Inc. Reports Fourth Quarter Net Income of $465 Million and Diluted EPS of $0.96",Business Wire
Jan-22-19,Citizens Financial Group Announces Pricing of $300 Million Preferred Stock Depositary Shares Offering,Business Wire
Jan-22-19,Fifth Third's (FITB) Q4 Earnings Beat on Higher Revenues,Zacks
Jan-22-19,Goldman Says Bank Shares Likely to Keep Rallying as Loans Grow,Bloomberg
Jan-24-19,"Huntington (HBAN) Q4 Earnings Lag Estimates, Expenses Rise",Zacks
Jan-24-19,CFG vs. FFIC: Which Stock Should Value Investors Buy Now?,Zacks
Jan-25-19,Citizens Financial Services: 4Q Earnings Snapshot,Associated Press
Jan-25-19,President of one of Pittsburgh's biggest banks to retire,American City Business Journals
Jan-25-19,SVB Financial (SIVB) Q4 Earnings &amp; Revenues Beat Estimates,Zacks
Jan-25-19,East West Bancorp (EWBC) Gains on Q4 Earnings &amp; Revenue Beat,Zacks
Jan-29-19,"TCF Financial (TCF) Up 5.3% on Q4 Earnings Beat, Merger Deal",Zacks
Jan-29-19,"Bank of Hawaii (BOH) Q4 Earnings Miss Estimates, Revenues Up",Zacks
Jan-29-19,"M&A still going strong as middle market execs still sold on selling, Citizens survey says",American City Business Journals
Jan-29-19,2019 M&A Outlook: Its Still a Sellers Market  For Now,Business Wire
Jan-30-19,Here's why Citizens needs a Pittsburgh market president  especially now,American City Business Journals
Jan-30-19,"UMB Financial (UMBF) Q4 Earnings Disappoint, Provisions Up",Zacks
Jan-31-19,"BOK Financial (BOKF) Q4 Earnings Lag Estimates, Expenses Up",Zacks
Jan-31-19,Top Ranked Momentum Stocks to Buy for January 31st,Zacks
Feb-01-19,Citizens Financial Group to Participate at the Credit Suisse 20th Annual Financial Services Forum,Business Wire
Feb-05-19,Add These 5 Low P/CF Stocks for Optimum Portfolio Returns,Zacks
Feb-05-19,Citizens Bank keeps working on new business in Buffalo,American City Business Journals
Feb-07-19,6 Low Price-to-Book Value Stocks to Buy in February,Zacks
Feb-11-19,"Citizens Financial Group Announces Pricing of $1.5 Billion of Citizens Bank, N.A. Senior Notes",Business Wire
Feb-11-19,Citizens Financial Group Announces a Change In Time of its Participation at the Credit Suisse 20th Annual Financial Services Forum,Business Wire
Feb-11-19,"Should You Think About Buying Citizens Financial Group, Inc. (NYSE:CFG) Now?",Simply Wall St.
Feb-11-19,Edited Transcript of CFG earnings conference call or presentation 18-Jan-19 2:00pm GMT,Thomson Reuters StreetEvents
Feb-12-19,CFG or FFIC: Which Is the Better Value Stock Right Now?,Zacks
Feb-14-19,Citizens Financial Group Appoints John F. Woods Vice Chairman,Business Wire
Feb-14-19,Chase breaks into Boston with a $600 offer for new customers,American City Business Journals
Feb-19-19,Citizens Financial Group makes Atlanta firm its fourth acquisition since IPO,American City Business Journals
Feb-19-19,Citizens Financial Group Further Expands M&A Advisory Team with Bowstring Advisors Acquisition,Business Wire
Feb-19-19,This analyst suggests a merger partner for M&T Bank,American City Business Journals
Feb-20-19,"Citizens (CFG) to Buy Bowstring Assets, Boost M&amp;A Advisory",Zacks
Feb-20-19,Most Americans With Student Loan Debt Regret It,Motley Fool
Feb-21-19,"Citizens Financial Group Inc (CFGpD.PFD) Files 10-K for the Fiscal Year Ended on December 31, 2018",GuruFocus.com
Feb-22-19,"Citizens Financial Group, Inc. Declares Dividends on Preferred Stock",Business Wire
Feb-22-19,Citizens Financial Group to Participate at the 2019 RBC Capital Markets Financial Institutions Conference,Business Wire
Mar-01-19,"Do You Like Citizens Financial Group, Inc. (NYSE:CFG) At This P/E Ratio?",Simply Wall St.
Mar-01-19,Citizens Financial Group Completes Previously Announced Acquisition of Bowstring Advisors,Business Wire
Mar-04-19,Citizens Financial (CFG) Closes Bowstring Advisors Buyout,Zacks
Mar-20-19,CFG vs. FFIC: Which Stock Is the Better Value Option?,Zacks
Mar-20-19,Are Investors Undervaluing Citizens Financial Group (CFG) Right Now?,Zacks
Mar-20-19,"Wells Fargo (WFC) Settles Schilling Fraud Case, To Pay $800K",Zacks
Mar-21-19,"Strong Interest in HELOCs Highlights Homeowner Optimism in Economy and Housing Market, According to Citizens Bank Survey",Business Wire
Mar-22-19,Here's Why IBERIABANK (IBKC) Stock is a Good Pick Right Now,Zacks
Mar-25-19,"Bank Stocks Slide on Inverted Yield Curve, Economic Slowdown",Zacks
Mar-26-19,Here's why one of Pittsburgh's biggest banks expects to name a new local president,American City Business Journals
Mar-26-19,"The Zacks Analyst Blog Highlights: Bank of America, Citigroup, Wells Fargo, Regional Financial and Citizens Financial",Zacks
Mar-27-19,5 Reasons to Add E*TRADE (ETFC) Stock to Your Portfolio Now,Zacks
Apr-03-19,More Than a Third of Teens Dont Believe They Will Be Financially Independent from Parents by Age 30,Business Wire
Apr-08-19,"Risk Factors To Consider Before Investing In Citizens Financial Group, Inc. (NYSE:CFG)",Simply Wall St.
Apr-08-19,Why the Earnings Surprise Streak Could Continue for Citizens Financial Group (CFG),Zacks
Apr-09-19,Citizens Bank Announces More Than $1.5 Million in Financial Literacy Charitable Contributions to Non-Profits In Nine States,Business Wire
Apr-10-19,One-third of teens say they could be financially dependent on their parents at age 30,American City Business Journals
Apr-11-19,Citizens Financial Group (CFG) Earnings Expected to Grow: Should You Buy?,Zacks
Apr-12-19,12 Bank Stocks That Wall Street Loves the Most,Kiplinger
Apr-12-19,Meet Citizens Bank's new Pittsburgh president,American City Business Journals
Apr-16-19,Loan &amp; Fee Income Growth to Aid Citizens' (CFG) Q1 Earnings,Zacks
Apr-18-19,Citizens Financial Group Inc (CFG) Q1 2019 Earnings Call Transcript,Motley Fool
Apr-18-19,"Citizen Financial's (CFG) Q1 Earnings Top, Expenses Flare Up",Zacks
Apr-18-19,Citizens Financial Group (CFG) Surpasses Q1 Earnings and Revenue Estimates,Zacks
Apr-18-19,Citizens Financial Group: 1Q Earnings Snapshot,Associated Press
Apr-18-19,"Citizens Financial Group, Inc. Reports First Quarter Net Income of $439 million and EPS of $0.92",Business Wire
Apr-22-19,Citizens CEO: Fintech partnerships will keep bank competitive,American City Business Journals
Apr-22-19,East West Bancorp (EWBC) Stock Down 4.1% on Q1 Earnings Miss,Zacks
Apr-22-19,"People's United (PBCT) Q1 Earnings In Line, Revenues Up",Zacks
Apr-22-19,Edited Transcript of CFG earnings conference call or presentation 18-Apr-19 1:00pm GMT,Thomson Reuters StreetEvents
Apr-23-19,Bank of Hawaii (BOH) Q1 Earnings Beat on Higher Revenues,Zacks
Apr-23-19,"Northern Trust (NTRS) Q1 Earnings Beat Estimates, Costs Up",Zacks
Apr-23-19,"Fifth Third (FITB) Q1 Earnings Top Estimates, Costs Flare Up",Zacks
Apr-23-19,"TCF Financial (TCF) Q1 Earnings Top Estimates, Stock Down 3.4%",Zacks
Apr-24-19,Heres how Citizens Bank is changing to serve bigger clients,American City Business Journals
Apr-24-19,Synovus (SNV) Stock Up 3.6% on Q1 Earnings &amp; Revenue Beat,Zacks
Apr-25-19,CVB Financial Corp (CVBF) Q1 2019 Earnings Call Transcript,Motley Fool
Apr-25-19,"BOK Financial (BOKF) Q1 Earnings Beat Estimates, Expenses Up",Zacks
Apr-26-19,Cullen/Frost (CFR) Down Despite Solid Q1 Earnings &amp; Revenues,Zacks
Apr-29-19,LendingTree (TREE) Stock Up 5.7% Despite Q1 Earnings Miss,Zacks
Apr-29-19,Teens don't believe they'll be financially independent from parents by 30: Survey,CNBC
Apr-30-19,New York Community Bancorp (NYCB) Q1 Earnings as Expected,Zacks
May-01-19,Citizens Financial Services: 1Q Earnings Snapshot,Associated Press
May-03-19,Meet the woman leading Chase's branch expansion in Pittsburgh,American City Business Journals
May-03-19,"3 Big Stock Charts for Friday: Citizens Financial, Gap and News Corp",InvestorPlace
May-06-19,Citizens Financial Group to Present at the Barclays Americas Select Franchise Conference,Business Wire
May-06-19,BofA ranks last in New England in customer survey,American City Business Journals
May-13-19,3 High-Earnings Yield Stocks,GuruFocus.com
May-15-19,"Citizens Financial Group, Inc. Declares Dividends on Preferred Stock",Business Wire
May-16-19,Did You Miss Citizens Financial Group's (NYSE:CFG) 49% Share Price Gain?,Simply Wall St.
May-17-19,Citizens Financial Group to Present at the Deutsche Bank Global Financial Services Conference,Business Wire
May-21-19,Citizens Financial Group to Present at the Morgan Stanley Financials Conference,Business Wire
May-21-19,Citizens Financial Group to Participate in the Bernstein 35th Annual Strategic Decisions Conference 2019,Business Wire
May-23-19,Citizens Commercial Banking: Businesses Nearly Unanimous That Shift to Real-Time Payments Will Transform Commerce,Business Wire
May-28-19,"Instant transactions are taking over, business owners say in Citizens survey",American City Business Journals
May-28-19,Peoples United eyes more supermarket branches after merger,American City Business Journals
Jun-07-19,"Citizens Financial Group to Announce Second Quarter Results on July 19, 2019",Business Wire
Jun-11-19,Heres What Hedge Funds Think About Citizens Financial Group Inc (CFG),Insider Monkey
Jun-12-19,Citizens Bank Digitally Transforms End-to-End Mortgage Customer Experience,Business Wire
Jun-13-19,Those Who Purchased CreativeForge Games (WSE:CFG) Shares A Year Ago Have A 60% Loss To Show For It,Simply Wall St.
