date,title,source
Oct-26-18,"Market Trends Toward New Normal in Ascendis Pharma A/S, Diodes, Laureate Education, Randgold Resources, Fastenal, and LTC Properties  Emerging Consolidated Expectations, Analyst Ratings",GlobeNewswire
Nov-01-18,Diodes (DIOD) to Report Q3 Earnings: What's in the Offing?,Zacks
Nov-06-18,Diodes (DIOD) Q3 Earnings Beat Estimates,Zacks
Nov-06-18,Diodes: 3Q Earnings Snapshot,Associated Press
Nov-06-18,Diodes Incorporated Reports Record Third Quarter 2018 Financial Results,Business Wire
Nov-07-18,Edited Transcript of DIOD earnings conference call or presentation 6-Nov-18 10:00pm GMT,Thomson Reuters StreetEvents
Nov-08-18,Edited Transcript of DIOD earnings conference call or presentation 6-Nov-18 10:00pm GMT,Thomson Reuters StreetEvents
