date,title,source
Oct-17-18,"Investor Expectations to Drive Momentum within Matthews International, AC Immune SA, Entercom Communications, Sunrun, Axcelis Technologies, and Advanced Disposal Services  Discovering Underlying Factors of Influence",GlobeNewswire
Oct-25-18,Axcelis Technologies (ACLS) Q3 Earnings Preview: What to Look Out For,Zacks
Nov-01-18,Axcelis Technologies Inc (ACLS) Q3 2018 Earnings Conference Call Transcript,Motley Fool
Nov-01-18,Axcelis Technologies (ACLS) Surpasses Q3 Earnings Estimates,Zacks
Nov-01-18,Axcelis: 3Q Earnings Snapshot,Associated Press
Nov-01-18,Axcelis Announces Financial Results For Third Quarter 2018,PR Newswire
Nov-06-18,New Strong Sell Stocks for November 6th,Zacks
Nov-07-18,Edited Transcript of ACLS earnings conference call or presentation 1-Nov-18 9:00pm GMT,Thomson Reuters StreetEvents
Nov-08-18,Edited Transcript of ACLS earnings conference call or presentation 1-Nov-18 9:00pm GMT,Thomson Reuters StreetEvents
Nov-08-18,"New Research Coverage Highlights John B. Sanfilippo & Son, Axcelis Technologies, Cogent Communications, Star Bulk Carriers, Agios Pharmaceuticals, and MDC Partners  Consolidated Revenues, Company Growth, and Expectations for 2018",GlobeNewswire
Nov-16-18,Axcelis to Participate in the Benchmark Discovery Conference,PR Newswire
Nov-26-18,Do Institutions Own Axcelis Technologies Inc (NASDAQ:ACLS) Shares?,Simply Wall St.
Nov-28-18,Axcelis Secures Ion Implant Tool Orders In Japan And Announces Participation In SEMICON Japan 2018 With Partner SCREEN Semiconductor Solutions,PR Newswire
Nov-28-18,Axcelis Announces Participation In Seventh Annual NYC Investor Summit 2018,PR Newswire
Dec-17-18,"Is Axcelis Technologies, Inc. (NASDAQ:ACLS) A Financially Sound Company?",Simply Wall St.
Jan-03-19,Axcelis Announces Participation In 21st Annual Needham Growth Conference,PR Newswire
Jan-08-19,"Did Axcelis Technologies, Inc. (NASDAQ:ACLS) Insiders Sell Shares?",Simply Wall St.
Jan-14-19,Axcelis Announces $35 Million Share Repurchase Program,PR Newswire
Jan-15-19,Axcelis Announces Timing and Availability of Fourth Quarter 2018 Results and Conference Call,PR Newswire
Jan-17-19,"Market Trends Toward New Normal in Altria Group, Anthem, SemGroup, Axcelis Technologies, M.D.C., and Hologic  Emerging Consolidated Expectations, Analyst Ratings",GlobeNewswire
Jan-24-19,UPDATE: Axcelis Announces Timing And Availability Of Fourth Quarter And Full Year 2018 Results And Conference Call,PR Newswire
Jan-28-19,"Are Axcelis Technologies, Inc.s (NASDAQ:ACLS) Returns Worth Your While?",Simply Wall St.
Jan-30-19,Earnings Preview: Axcelis Technologies (ACLS) Q4 Earnings Expected to Decline,Zacks
Feb-06-19,Axcelis Technologies (ACLS) Beats Q4 Earnings and Revenue Estimates,Zacks
Feb-06-19,Axcelis: 4Q Earnings Snapshot,Associated Press
Feb-06-19,Axcelis Announces Financial Results for Fourth Quarter and Full Year 2018,PR Newswire
Feb-07-19,Edited Transcript of ACLS earnings conference call or presentation 7-Feb-19 1:30pm GMT,Thomson Reuters StreetEvents
Feb-07-19,Top 4 Small-Cap Stocks for 2018,Investopedia
Feb-08-19,Edited Transcript of ACLS earnings conference call or presentation 7-Feb-19 1:30pm GMT,Thomson Reuters StreetEvents
Feb-08-19,Axcelis Technologies (ACLS) Q4 2018 Earnings Conference Call Transcript,Motley Fool
Feb-11-19,Edited Transcript of ACLS earnings conference call or presentation 7-Feb-19 1:30pm GMT,Thomson Reuters StreetEvents
Feb-20-19,"Should You Be Pleased About The CEO Pay At Axcelis Technologies, Inc.s (NASDAQ:ACLS)",Simply Wall St.
Feb-27-19,Axcelis To Participate In The Susquehanna Financial Group Eighth Annual Technology Conference,PR Newswire
Feb-28-19,The Top 5 New Buys of Chuck Royce's Firm,GuruFocus.com
Mar-11-19,"Axcelis Technologies Inc (ACLS) Files 10-K for the Fiscal Year Ended on December 31, 2018",GuruFocus.com
Mar-14-19,"Is Axcelis Technologies, Inc. (NASDAQ:ACLS) A Volatile Stock?",Simply Wall St.
Apr-23-19,Axcelis Announces Timing And Availability Of First Quarter 2019 Results And Conference Call,PR Newswire
Apr-24-19,Did Business Growth Power Axcelis Technologies's (NASDAQ:ACLS) Share Price Gain of 195%?,Simply Wall St.
Apr-24-19,Earnings Preview: Axcelis Technologies (ACLS) Q1 Earnings Expected to Decline,Zacks
Apr-30-19,Earnings Preview: Axcelis Technologies (ACLS) Q1 Earnings Expected to Decline,Zacks
May-07-19,Axcelis: 1Q Earnings Snapshot,Associated Press
May-07-19,Axcelis Announces Financial Results For First Quarter 2019,PR Newswire
May-08-19,Axcelis Technologies Inc (ACLS) Q1 2019 Earnings Call Transcript,Motley Fool
May-09-19,Heres What Hedge Funds Think About Axcelis Technologies Inc (ACLS),Insider Monkey
May-09-19,Axcelis Announces Participation in Upcoming Investor Conferences,PR Newswire
May-13-19,"Do You Like Axcelis Technologies, Inc. (NASDAQ:ACLS) At This P/E Ratio?",Simply Wall St.
May-28-19,Axcelis Announces Participation In Upcoming Investor Conferences,PR Newswire
Jun-04-19,Edited Transcript of ACLS earnings conference call or presentation 8-May-19 12:30pm GMT,Thomson Reuters StreetEvents
Jun-06-19,"Should You Be Concerned About Axcelis Technologies, Inc.'s (NASDAQ:ACLS) ROE?",Simply Wall St.
