date,title,source
Nov-05-18,Is Hooker Furniture Corporations (NASDAQ:HOFT) 13% Better Than Average?,Simply Wall St.
Nov-15-18,Hooker Furniture to Host Third Quarter Earnings Call December 6,GlobeNewswire
Dec-03-18,What Did Hooker Furniture Corporations (NASDAQ:HOFT) CEO Take Home Last Year?,Simply Wall St.
Dec-06-18,Hooker Furniture Corporation (HOFT) Q3 2019 Earnings Conference Call Transcript,Motley Fool
Dec-06-18,Hooker Furniture: Fiscal 3Q Earnings Snapshot,Associated Press
Dec-06-18,"Hooker Furniture Quarterly Sales, Income Gains Led by Hooker Branded Segment",GlobeNewswire
