date,title,source
Oct-17-18,IBD 50 Growth Stocks To Watch,Investor's Business Daily
Oct-22-18,Tractor Supplys 2018 Paper Clover Raises Nearly $2 Million for 4-H Youth Nationwide,GlobeNewswire
Oct-22-18,These 5 Top Stocks With Solid Sales Growth Are Holding Up In Market Correction,Investor's Business Daily
Oct-23-18,Agree Realty Corp (ADC) Q3 2018 Earnings Conference Call Transcript,Motley Fool
Oct-23-18,Will Tractor Supply's (TSCO) Growth Plans Drive Q3 Earnings?,Zacks
Oct-24-18,Tractor Supply's Q3 Earnings Outlook,Benzinga
Oct-25-18,Tractor Supply Co (TSCO) Q3 2018 Earnings Conference Call Transcript,Motley Fool
Oct-25-18,Edited Transcript of TSCO earnings conference call or presentation 25-Oct-18 2:00pm GMT,Thomson Reuters StreetEvents
Oct-25-18,"IBD 50 Stocks To Watch: Tractor Supply Jumps On Earnings, Triggers These 2 Bullish Signals",Investor's Business Daily
Oct-25-18,Things Keep Looking Up for Tractor Supply,Motley Fool
Oct-25-18,"Tractor Supply (TSCO) Q3 Earnings and Sales Beat, View Up",Zacks
Oct-25-18,Tractor Supply (TSCO) Beats Q3 Earnings and Revenue Estimates,Zacks
Oct-25-18,Tractor Supply: 3Q Earnings Snapshot,Associated Press
Oct-25-18,Tractor Supply Company Reports Third Quarter 2018 Financial Results,GlobeNewswire
Oct-26-18,Edited Transcript of TSCO earnings conference call or presentation 25-Oct-18 2:00pm GMT,Thomson Reuters StreetEvents
Oct-26-18,Stocks Fight To Curb Losses; Is It Time To Sell These 4 Growth Stocks?,Investor's Business Daily
Oct-26-18,Correction Deepens As Stocks Crumble On Amazon's Revenue Miss,Investor's Business Daily
Oct-29-18,KAR or TSCO: Which Is the Better Value Stock Right Now?,Zacks
Oct-30-18,Dow Jones Leads Fragile Rebound; Will This Sector Head A Recovery?,Investor's Business Daily
Oct-30-18,5 Companies Hit 52-Week Highs,GuruFocus.com
Nov-01-18,Tractor Supply Company Announces Veterans Day Discount for Active and Former Military Members,GlobeNewswire
Nov-01-18,"Zacks Market Edge Highlights: Burlington Stores, Mellanox, Tractor Supply, Stitch Fix and JD.com",Zacks
Nov-01-18,"Factors of Influence in 2018, Key Indicators and Opportunity within BP p.l.c, Nokia, Xcel Energy, Employers, Utah Medical Products, and Tractor Supply  New Research Emphasizes Economic Growth",GlobeNewswire
