date,title,source
Oct-18-18,YY or YELP: Which Is the Better Value Stock Right Now?,Zacks
Oct-18-18,Today's Research Reports on Trending Tickers: YY Inc. and Momo,ACCESSWIRE
Oct-19-18,"YY Stock Has Become a Bargain, But Dont But It Yet!",InvestorPlace
Oct-22-18,"Report: Developing Opportunities within YY, Ingredion, Standex International, Graham, Cooper-Standard, and Titan Machinery  Future Expectations, Projections Moving into 2018",GlobeNewswire
Oct-23-18,Today's Research Reports on Trending Tickers: YY and 58.com,ACCESSWIRE
Oct-30-18,Is YY (YY) a Great Value Stock Right Now?,Zacks
Oct-30-18,"YY to Announce Third Quarter 2018 Financial Results on November 12, 2018",GlobeNewswire
Nov-05-18,YY or YELP: Which Is the Better Value Stock Right Now?,Zacks
Nov-07-18,Will Solid Live Streaming Revenues Boost YY's Q3 Earnings?,Zacks
Nov-07-18,"YY Inc. to Hold 2018 Annual General Meeting on November 30, 2018",GlobeNewswire
Nov-12-18,YY: 3Q Earnings Snapshot,Associated Press
Nov-12-18,YY Reports Third Quarter 2018 Unaudited Financial Results,GlobeNewswire
Nov-12-18,A Preview Of YY Inc.'s Q3 Earnings,Benzinga
Nov-13-18,How Much Of YY Inc (NASDAQ:YY) Do Insiders Own?,Simply Wall St.
Nov-13-18,Implied Volatility Surging for YY Stock Options,Zacks
Nov-13-18,Today's Research Reports on Trending Tickers: Yelp and YY,ACCESSWIRE
Nov-13-18,Edited Transcript of YY earnings conference call or presentation 13-Nov-18 2:00am GMT,Thomson Reuters StreetEvents
Nov-14-18,"Why YY, Inc. Stock Popped Today",Motley Fool
Nov-14-18,"YY Q3 Earnings and Revenues Beat Estimates, Increase Y/Y",Zacks
Nov-15-18,Todays Research Reports on Stocks to Watch: YY Inc. and NIO Inc.,ACCESSWIRE
Nov-15-18,Edited Transcript of YY earnings conference call or presentation 13-Nov-18 2:00am GMT,Thomson Reuters StreetEvents
Nov-16-18,YY (YY) Stock Sinks As Market Gains: What You Should Know,Zacks
Nov-26-18,Today's Research Reports on Trending Tickers: Baidu and YY,ACCESSWIRE
Nov-29-18,"What Is Resistance In Stocks? This Chinese Leader Overcame It, Broke Out",Investor's Business Daily
Dec-12-18,Hedge Funds Are Crazy About YY Inc (YY),Insider Monkey
Dec-18-18,How Do Analysts See YY Inc. (NASDAQ:YY) Performing In The Year Ahead?,Simply Wall St.
Dec-18-18,New Strong Sell Stocks for December 18th,Zacks
Jan-08-19,"Editas Medicine, YY, Intel, Advanced Micro Devices and NVIDIA highlighted as Zacks Bull and Bear of the Day",Zacks
Jan-08-19,Bear of the Day: YY Inc. (YY),Zacks
Jan-10-19,How Many Insiders Sold YY Inc. (NASDAQ:YY) Shares?,Simply Wall St.
Jan-11-19,Why YY Inc. Stock Fell 12.1% in December,Motley Fool
Jan-17-19,Today's Research Reports on Trending Tickers: Weibo and YY,ACCESSWIRE
Jan-22-19,Cramer: Charts reveal buying opportunities in some high-q...,CNBC Videos
Jan-22-19,Buying opportunities in high-quality Chinese stocks: Cram...,CNBC Videos
Jan-22-19,Love Stocks? Secrets of the Zacks Rank Revealed,Zacks
Jan-23-19,"Zacks Market Edge Highlights: Bank of America, JP Morgan, YY, Alibaba and Las Vegas Sands",Zacks
Jan-25-19,Video Will Determine the Fate of Meet Group Stock in 2019,InvestorPlace
