date,title,source
Oct-19-18,CNX Resources Sees Hammer Chart Pattern: Time to Buy?,Zacks
Oct-23-18,"The Zacks Analyst Blog Highlights: CNX, First Bancorp, Arch Coal and Callaway Golf",Zacks
Oct-26-18,CNX Resources (CNX) Stock Moves -1.53%: What You Should Know,Zacks
Oct-29-18,Are Investors Undervaluing CNX Resources (CNX) Right Now?,Zacks
Oct-30-18,"CNX Resources (CNX) Q3 Revenues Beat, Earnings Miss",Zacks
Oct-30-18,CNX Reports Third Quarter Results and Provides Updated Guidance,PR Newswire
Nov-14-18,"CNX Resources Corporation -- Moody's revises CNX's outlook to positive, keeps CNXM's rating outlook stable",Moody's
Dec-07-18,Do Hedge Funds Love CNX Resources Corporation (CNX)?,Insider Monkey
Jan-07-19,Crude Oil Prices Likely to Remain Stable in 2019: 5 Top Picks,Zacks
Jan-08-19,Is CNX Resources (CNX) a Great Value Stock Right Now?,Zacks
Jan-08-19,CNX Resources Corporation and CNX Midstream Partners LP Announce Fourth Quarter 2018 Earnings Release and Conference Call Schedule,PR Newswire
