date,title,source
Oct-22-18,SHAREHOLDER ALERT: Monteverde & Associates PC Announces An Investigation Of JetPay Corporation - JTPY,PR Newswire
Oct-22-18,[$$] NCR Agrees to Buy JetPay for $184 Million,The Wall Street Journal
Oct-22-18,"JETPAY CORPORATION SHAREHOLDER ALERT: Rigrodsky & Long, P.A. Announces Investigation of Buyout",Business Wire
Oct-22-18,"SHAREHOLDER ALERT: Levi & Korsinsky, LLP Notifies Investors of an Investigation Regarding Whether the Sale of JetPay Corporation to NCR Corporation for $5.05 Per Share is Fair to Shareholders",GlobeNewswire
Oct-22-18,"NCR Steps Into Payments, Announces Definitive Agreement to Acquire JetPay",Business Wire
Oct-23-18,"MERGER ALERT  PRSS and JTPY: Levi & Korsinsky, LLP Reminds Investors of Investigations Concerning the Sale of these Companies",GlobeNewswire
Oct-23-18,Todays Research Reports on Stocks to Watch: Hasbro and JetPay,ACCESSWIRE
Oct-26-18,WeissLaw LLP Investigates JetPay Corporation Acquisition,ACCESSWIRE
Oct-30-18,NCR Corp (NCR) Q3 2018 Earnings Conference Call Transcript,Motley Fool
