date,title,source
Oct-23-18,Townsquare Announces Conference Call To Discuss Third Quarter 2018 Results; To Attend Upcoming Investor Conferences,PR Newswire
Oct-24-18,What Percentage Of Townsquare Media Inc (NYSE:TSQ) Shares Do Insiders Own?,Simply Wall St.
Nov-06-18,Edited Transcript of TSQ earnings conference call or presentation 6-Nov-18 1:00pm GMT,Thomson Reuters StreetEvents
Nov-06-18,Townsquare Media (TSQ) Tops Q3 Earnings and Revenue Estimates,Zacks
Nov-06-18,Townsquare: 3Q Earnings Snapshot,Associated Press
Nov-06-18,Townsquare Reports Third Quarter 2018 Results,PR Newswire
Nov-09-18,Edited Transcript of TSQ earnings conference call or presentation 6-Nov-18 1:00pm GMT,Thomson Reuters StreetEvents
Nov-14-18,"Investor Expectations to Drive Momentum within Townsquare Media, Koss, ESSA Pharma, MVC Capital, Valeritas, and Sonic Foundry  Discovering Underlying Factors of Influence",GlobeNewswire
