date,title,source
Oct-23-18,Cyclacel Pharmaceuticals to Present at the Dawson James Small Cap Growth Conference,GlobeNewswire
Oct-25-18,"Report: Exploring Fundamental Drivers Behind Invitae, Aerie Pharmaceuticals, Gevo, Global Medical REIT, Cyclacel Pharmaceuticals, and Toll Brothers  New Horizons, Emerging Trends, and Upcoming Developments",GlobeNewswire
Nov-06-18,Cyclacel Pharmaceuticals to Release Third Quarter 2018 Financial Results,GlobeNewswire
Nov-12-18,Cyclacel Pharmaceuticals Reports Third Quarter 2018 Financial Results,GlobeNewswire
Nov-13-18,"The Daily Biotech Pulse: Viking's Fatty Liver And Cholesterol Drug, Cyclacel Loss Narrows, Eton's Debut",Benzinga
Nov-13-18,Edited Transcript of CYCC earnings conference call or presentation 12-Nov-18 9:30pm GMT,Thomson Reuters StreetEvents
Dec-04-18,"Consolidated Research: 2018 Summary Expectations for Xencor, Cyclacel Pharmaceuticals, Amicus Therapeutics, Take-Two Interactive Software, CSG Systems International, and Vonage  Fundamental Analysis, Key Performance Indications",GlobeNewswire
Dec-13-18,Edited Transcript of CYCC earnings conference call or presentation 12-Nov-18 9:30pm GMT,Thomson Reuters StreetEvents
