date,title,source
Oct-17-18,Scientific Warmth Ratings Guide Families on Outerwear Choices,PR Newswire
Oct-18-18,Lands' End stays focused on own retail stores,American City Business Journals
Oct-18-18,"Delta uniforms recognized for design, despite some employee complaints",American City Business Journals
Oct-22-18,American Airlines flight attendants take challenge: Describe employer in three words,American City Business Journals
Oct-22-18,Lands' End Celebrates 25 Years Of Making Memories And Merriment With Its Beloved Needlepoint Christmas Stockings,PR Newswire
Oct-25-18,"Lands' End Makes It an Easier and Merrier 2018 Holiday Season Filled with Great Gifts, Traditions and Warmth",PR Newswire
Oct-29-18,Lands' End Opens Second Store in New Jersey Just in Time for the Holidays,PR Newswire
Nov-06-18,"Recent Analysis Shows Gladstone Commercial, Lands' End, Echo Global Logistics, Magellan Midstream Partners, Suncor Energy, and Canadian Natural Resources Market Influences  Renewed Outlook, Key Drivers of Growth",GlobeNewswire
Nov-09-18,Lands' End And The Weather Channel Celebrate Year One Of Partnership,PR Newswire
Nov-12-18,Cyber Monday Arrives Two Weeks Early at Lands' End,PR Newswire
Nov-12-18,Is There Life After Death for Sears Stock?,InvestorPlace
Nov-13-18,American Airlines employees start Lands' End uniform field test,American City Business Journals
Nov-15-18,Delta Air Lines reveals what happened to all those retired uniforms,American City Business Journals
Nov-20-18,Lands' End's Women's Faux Fur Hooded Down Winter Long Coat Selected As One Of This Year's Oprah's Favorite Things,PR Newswire
Nov-21-18,Lands' End Announces Third Quarter Fiscal 2018 Earnings Conference Call,GlobeNewswire
Nov-23-18,Lands' End Puts the Twelve Most Instagrammable Holiday Gifts into Focus,PR Newswire
Dec-03-18,Lands' End changes earnings reporting date to Thursday,MarketWatch
Dec-03-18,Lands' End Announces Date Change for Its Third Quarter Fiscal 2018 Earnings Conference Call,GlobeNewswire
Dec-06-18,Lands End (LE) Q3 2018 Earnings Conference Call Transcript,Motley Fool
Dec-06-18,Edited Transcript of LE earnings conference call or presentation 6-Dec-18 1:30pm GMT,Thomson Reuters StreetEvents
Dec-06-18,"Lands' End sees 'viable, profitable' model as it announces Q3 earnings",American City Business Journals
Dec-06-18,Lands' End: Fiscal 3Q Earnings Snapshot,Associated Press
Dec-06-18,"Lands' End profit and revenue rise, as same-store sales jump nearly 12%",MarketWatch
Dec-06-18,Lands' End Announces Third Quarter Fiscal 2018 Results,GlobeNewswire
Dec-07-18,Edited Transcript of LE earnings conference call or presentation 6-Dec-18 1:30pm GMT,Thomson Reuters StreetEvents
Dec-10-18,"Lands' End Ranks First In Newsweek's List Of America's Best Customer Service For Online Retailers, Clothing",PR Newswire
Dec-11-18,"Lands' End, Inc. -- Moody's Affirms Lands' End's CFR at B3; outlook revised to stable from negative",Moody's
Dec-11-18,Edited Transcript of LE earnings conference call or presentation 6-Dec-18 1:30pm GMT,Thomson Reuters StreetEvents
Dec-11-18,Lands' End Shares Favorite Holiday Gifts On Amazon,PR Newswire
Dec-14-18,"Lands' End Inc (LE) CEO and President Jerome Griffith Bought $145,800 of Shares",GuruFocus.com
Dec-20-18,"Hedge Funds Are Dumping Lands End, Inc. (LE)",Insider Monkey
Dec-20-18,Rumors fly when American Airlines executive gets promotion,American City Business Journals
Jan-03-19,Lands' End Announces Participation in the 21st Annual ICR Conference,GlobeNewswire
Jan-10-19,Lands' End Names Chieh Tsai Chief Product Officer,PR Newswire
Jan-18-19,"Why You Should Care About Lands End, Inc.s (NASDAQ:LE) Low Return On Capital",Simply Wall St.
Jan-30-19,American Airlines fast-track uniform project hits some speed bumps,American City Business Journals
Feb-06-19,4 New CEOs to Watch in 2019,Investopedia
Feb-13-19,"Analysis: Positioning to Benefit within Apache, A. O. Smith, Diamondback Energy, Maiden, Lands' End, and Otonomy  Research Highlights Growth, Revenue, and Consolidated Results",GlobeNewswire
Mar-04-19,"Is It Too Late To Consider Buying Lands End, Inc. (NASDAQ:LE)?",Simply Wall St.
Mar-07-19,Lands' End Announces Fourth Quarter and Fiscal 2018 Earnings Conference Call,GlobeNewswire
Mar-21-19,Edited Transcript of LE earnings conference call or presentation 21-Mar-19 12:30pm GMT,Thomson Reuters StreetEvents
Mar-21-19,Lands' End Keeps Nudging Profitability Higher,Motley Fool
Mar-21-19,"Why Guess?, Canadian Solar, and Lands' End Slumped Today",Motley Fool
Mar-21-19,"Lands End sees potential in digital investments, growing Amazon presence",American City Business Journals
Mar-21-19,Lands' End Inc (LE) Q4 2018 Earnings Conference Call Transcript,Motley Fool
Mar-21-19,Lands' End Fiscal Fourth-Quarter Profit Beats Estimates,TheStreet.com
Mar-21-19,Lands End reports quarterly growth in same-store sales,American City Business Journals
Mar-21-19,Lands' End: Fiscal 4Q Earnings Snapshot,Associated Press
Mar-21-19,Lands' End Announces Fourth Quarter and Fiscal 2018 Results,GlobeNewswire
Mar-22-19,Edited Transcript of LE earnings conference call or presentation 21-Mar-19 12:30pm GMT,Thomson Reuters StreetEvents
Mar-26-19,Lands' End Opens Store in Pittsburgh,PR Newswire
Mar-26-19,Edited Transcript of LE earnings conference call or presentation 21-Mar-19 12:30pm GMT,Thomson Reuters StreetEvents
Mar-27-19,"How Financially Strong Is Lands' End, Inc. (NASDAQ:LE)?",Simply Wall St.
Apr-09-19,Selling with the enemy: Why rival retailers embrace Amazon.com,Reuters
Apr-09-19,Selling with the enemy: Why rival retailers embrace Amazon.com,Reuters
Apr-09-19,Selling with the enemy - Why rival retailers embrace Amazon.com,Reuters
Apr-24-19,Lawsuit calls 2014 spinoff of Lands' End from Sears 'fraudulent',American City Business Journals
Apr-30-19,Lands' End Announces Partial Debt Prepayment,GlobeNewswire
May-03-19,"Should You Take Comfort From Insider Transactions At Lands' End, Inc. (NASDAQ:LE)?",Simply Wall St.
May-07-19,American Airlines beginning a new field test of Lands' End uniforms,American City Business Journals
May-07-19,Lands End Showcases Inclusive Swimsuit Offerings for Summer 2019,GlobeNewswire
May-09-19,"Heres What Hedge Funds Think About Lands End, Inc. (LE)",Insider Monkey
May-15-19,AutoNation's stock set to rally after Eddie Lampert discloses increased equity stake,MarketWatch
May-15-19,Lands' End Announces Third Annual National Swimsuit Day on May 21,PR Newswire
May-20-19,More American Airlines flight attendants complain of health issues over uniforms,American City Business Journals
May-21-19,Lands' End Announces 50% Off All Swimwear in Honor of National Swimsuit Day,PR Newswire
May-21-19,Lands' End Announces First Quarter Fiscal 2019 Earnings Conference Call,GlobeNewswire
May-29-19,Lawsuit accuses Lands' End of 'negligence' in Delta Air Lines uniforms,American City Business Journals
Jun-03-19,Q1 Earnings Outlook For Lands' End,Benzinga
Jun-03-19,"Based On Its ROE, Is Lands' End, Inc. (NASDAQ:LE) A High Quality Stock?",Simply Wall St.
Jun-04-19,Edited Transcript of LE earnings conference call or presentation 4-Jun-19 12:30pm GMT,Thomson Reuters StreetEvents
Jun-04-19,Lands' End Inc (LE) Q1 2019 Earnings Call Transcript,Motley Fool
Jun-04-19,Lands' End Lands Narrower-Than-Expected Quarterly Loss,TheStreet.com
Jun-04-19,Lands' End: Fiscal 1Q Earnings Snapshot,Associated Press
Jun-04-19,Lands' End Announces First Quarter Fiscal 2019 Results,GlobeNewswire
Jun-04-19,"Lands' End, Inc. to Host Earnings Call",ACCESSWIRE
