date,title,source
Oct-17-18,Could Enbridge Inc. Be a Millionaire-Maker Stock?,Motley Fool
Oct-19-18,Enbridge says Canada natgas pipe to restart in mid-November,Reuters
Oct-19-18,Oil Boom Drives North Dakota Production to Record Levels,Zacks
Oct-22-18,Enbridge seeks to put more of Ohio-Michigan NEXUS natgas pipe in service,Reuters
Oct-24-18,Enbridge seeks to put more of Ohio TEAL natgas pipe into service,Reuters
Oct-25-18,Is a Beat in Store for Baker Hughes (BHGE) in Q3 Earnings?,Zacks
Oct-25-18,Could Enbridge Inc. Be a Millionaire-Maker Stock?,Motley Fool
Oct-26-18,Westcoast Energy Declares Dividends,CNW Group
Oct-26-18,U.S. OKs wider startup of Enbridge Ohio-Michigan NEXUS natgas pipe,Reuters
Oct-26-18,Enterprise Products (EPD) Q3 Earnings: Can it Beat Estimates?,Zacks
Oct-26-18,Phillips 66 (PSX) Beats Q3 Earnings & Revenue Estimates,Zacks
Oct-26-18,"Recent Analysis Shows Enbridge, Gerdau S.A., Infosys, Regal Beloit, Cheetah Mobile, and EnLink Midstream Partners, LP Market Influences  Renewed Outlook, Key Drivers of Growth",GlobeNewswire
Oct-29-18,"Output, Price Gain to Aid Eclipse Resources (ECR) Q3 Earnings",Zacks
Oct-30-18,Robust Near-Term Outlook for Oil and Gas Pipeline Industry,Zacks
Oct-30-18,Apache (APA) Q3 Earnings: Permian Production Growth to Aid,Zacks
Oct-30-18,Hess (HES) to Report Q3 Earnings: Is a Beat in the Cards?,Zacks
Oct-30-18,"BP Beats Q3 Earnings Estimates, Projects $3B Oil Spill Cost",Zacks
Oct-30-18,Is a Beat in Store for Enbridge (ENB) This Earnings Season?,Zacks
Oct-31-18,"Transocean (RIG) Q3 Earnings and Revenues Beat, Shares Up",Zacks
Oct-31-18,RPC (RES) Earnings and Revenues Fall Shy of Estimates in Q3,Zacks
Oct-31-18,Hess (HES) Surpasses Earnings and Revenue Estimates in Q3,Zacks
Oct-31-18,ENB or WMB: Which Is the Better Value Stock Right Now?,Zacks
Nov-01-18,Is a Beat in the Cards for Evergy (EVRG) in Q3 Earnings?,Zacks
Nov-01-18,Enbridge Provides Notice of Series N Preferred Shares Conversion Right and Announces Reset Dividend Rates,CNW Group
Nov-01-18,Williams (WMB) Q3 Earnings and Sales Beat on Transco Project,Zacks
Nov-01-18,Why Enbridge (ENB) Might Surprise This Earnings Season,Zacks
Nov-01-18,"Ensco (ESV) Q3 Loss Narrower Than Expected, Revenues Beat",Zacks
Nov-01-18,"Dril-Quip (DRQ) Q3 Loss Narrower Than Expected, Revenues Beat",Zacks
Nov-01-18,Newfield (NFX) Beats Q3 Earnings & Revenue Estimates,Zacks
Nov-02-18,Spectra Energy Partners LP (SEP) Q3 2018 Earnings Conference Call Transcript,Motley Fool
Nov-02-18,"ExxonMobil (XOM) Q3 Earnings Surpass Estimates, Improve Y/Y",Zacks
Nov-02-18,Whiting (WLL) Q3 Earnings Beat on Crude Rally and Low Costs,Zacks
Nov-02-18,Pioneer Natural (PXD) to Post Q3 Earnings: What's in Store?,Zacks
Nov-02-18,Enbridge: 3Q Earnings Snapshot,Associated Press
Nov-02-18,Enbridge Inc. Reports Strong Third Quarter 2018 Results and Significant Progress on Strategic Priorities,CNW Group
Nov-02-18,Enbridge Suspends Dividend Reinvestment and Share Purchase Plan,CNW Group
Nov-05-18,Enbridge's Asset Sales Put It Ahead of Schedule,Motley Fool
Nov-05-18,"Enbridge (ENB) Earnings Meet Estimates in Q3, Increase Y/Y",Zacks
Nov-06-18,U.S. says Enbridge can start more of Ohio-Michigan Nexus natgas pipeline,Reuters
Nov-06-18,Spectra Energy Partners Hits a Few Snags in Its Last Quarterly Report,Motley Fool
Nov-06-18,"McDermott's (MDR) Q3 Earnings and Revenues Miss, View Cut",Zacks
Nov-08-18,Enbridge Inc. and Enbridge Income Fund Holdings Inc. Complete Plan of Arrangement,CNW Group
Nov-09-18,Enbridge Income Fund -- Moody's affirms Enbridge and Enbridge Income Fund at Baa3; outlooks changed to positive,Moody's
Nov-14-18,Enbridge Inc. and Enbridge Income Fund Announce Proposal to Exchange Enbridge Income Fund Medium Term Notes for Newly-Issued Enbridge Inc. Medium Term Notes,PR Newswire
Nov-15-18,Enbridge (ENB) Gains But Lags Market: What You Should Know,Zacks
Nov-15-18,3 Things Brookfield Infrastructure Partners LP Wants You to Know,Motley Fool
Nov-16-18,Enbridge Announces Conversion Results for Series N Preferred Shares,CNW Group
Nov-19-18,DCP Midstream Operating LP -- Moody's changes DCP Midstream's rating outlook to positive,Moody's
Nov-21-18,Enbridge (ENB) Outpaces Stock Market Gains: What You Should Know,Zacks
Nov-21-18,Enbridge Counters Claim Air Barrels Sent Through Pipeline,Bloomberg
Nov-26-18,Shale Boom Raises Specter of New Glut: Gulf Coast Oil Terminals,Bloomberg
Nov-27-18,Dominion Energy (D) to Acquire Dominion Energy Midstream,Zacks
Nov-27-18,Enbridge (ENB) to Power Nyhamna Plant Post Talks With Norway,Zacks
Nov-28-18,Will Oil Plunge Disrupt North Dakota's Production Juggernaut?,Zacks
Nov-30-18,Enbridge (ENB) Stock Sinks As Market Gains: What You Should Know,Zacks
Dec-04-18,Enbridge to host Annual Investor Conference on December 11,CNW Group
Dec-04-18,Enbridge Announces Sale of Enbridge Gas New Brunswick Business,CNW Group
Dec-06-18,"Spectra Energy Partners, LP Unitholder Consent Solicitation Period to Expire on December 12, 2018",PR Newswire
Dec-06-18,"Market Trends Toward New Normal in Perrigo Company plc, Sina, Gerdau S.A, Sinclair Broadcast Group, Invesco, and Enbridge  Emerging Consolidated Expectations, Analyst Ratings",GlobeNewswire
Dec-07-18,Enbridge (ENB) Stock Moves -1.21%: What You Should Know,Zacks
Dec-07-18,Enbridge Inc. and Enbridge Income Fund Announce Fund Noteholder Approval to Exchange Certain Enbridge Income Fund Medium Term Notes for Newly-Issued Enbridge Inc. Medium Term Notes,CNW Group
Dec-11-18,Enbridge Gives Investors a 10% Raise for 2019 (and There's Plenty More Coming Down the Pipeline),Motley Fool
Dec-11-18,Enbridge Energy Limited Partnership -- Moody's places Enbridge's and EEP's Baa3 ratings on review for upgrade,Moody's
Dec-11-18,Enbridge says working on easing pipeline capacity shortages,Reuters
Dec-11-18,Enbridge says working on easing pipeline capacity shortages,Reuters
Dec-11-18,Enbridge Inc. Announces 10 Percent Quarterly Dividend Increase for 2019,CNW Group
Dec-11-18,Enbridge Completes 2018 Strategic and Financial Outlook; Reaffirms 10% Annual Growth Guidance Through 2020 and Announces 10% Dividend Increase for 2019,CNW Group
Dec-12-18,"Natural Resource Sells Assets for $205M, To Lower Debts",Zacks
Dec-12-18,"Enbridge (ENB) Raises 2019 Dividend, Maintains DCF Guidance",Zacks
Dec-13-18,Michigan governor reaches final deal on Great Lakes pipeline,Associated Press
Dec-13-18,Enbridge (ENB) Gains As Market Dips: What You Should Know,Zacks
Dec-13-18,Is Production Cut in Alberta Too Good for its Own Good?,Zacks
Dec-14-18,Retain These Canadian Energy Stocks for Long-Term Gains,Zacks
Dec-14-18,"Enbridge Hikes Dividend, Remains Deeply Undervalued",Morningstar
Dec-17-18,"Enbridge Energy Partners, L.P. and Enbridge Energy Management, L.L.C. Announce Approval of Proposed Mergers with Enbridge Inc.",PR Newswire
Dec-17-18,"Enbridge Inc. and Spectra Energy Partners, LP Complete Merger",PR Newswire
Dec-17-18,"The Zacks Analyst Blog Highlights: Enbridge, TransCanada, Suncor, Imperial and Cenovus",Zacks
Dec-19-18,The Latest: Michigan panel OKs Great Lakes pipeline tunnel,Associated Press
Dec-19-18,Enbridge Needs to Prove Itself on the Charts With Some Strength,TheStreet.com
Dec-19-18,New Michigan panel to consider Great Lakes pipeline tunnel,Associated Press
Dec-20-18,"Enbridge Inc. Completes Mergers with Enbridge Energy Partners, L.P. and Enbridge Energy Management, L.L.C.",CNW Group
Dec-21-18,Enbridge Inc. and Enbridge Income Fund Announce Completion of the Exchange of Certain Enbridge Income Fund Medium Term Notes for Newly-Issued Enbridge Inc. Medium Term Notes,PR Newswire
Dec-21-18,Seaway Begins Open Season,Business Wire
Dec-26-18,Enterprise Products Starts Open Season for Seaway Expansion,Zacks
Dec-28-18,"Oil Plunge, Winter Threaten North Dakota's Record Production",Zacks
Dec-31-18,Equinor Concludes Sale of Stake in King Lear & Tommeliten,Zacks
Jan-02-19,3 Dividend Aristocrats to Buy and Hold Forever,Motley Fool
Jan-08-19,"Enbridge Inc. Announces that Enbridge Energy Partners, L.P. and Spectra Energy Partners, LP Have Launched Consent Solicitations with Respect to Certain of their Outstanding Notes",PR Newswire
Jan-09-19,Enbridge (ENB) Outpaces Stock Market Gains: What You Should Know,Zacks
Jan-14-19,Why Enbridge Tumbled 20% in 2018,Motley Fool
Jan-16-19,Enbridge (ENB) Flat As Market Gains: What You Should Know,Zacks
Jan-22-19,Enbridge Inc. to Hold Webcast to Discuss 2018 Fourth Quarter and Full-Year Results on February 15,CNW Group
Jan-22-19,"Enbridge Inc. Announces Successful Completion of Enbridge Energy Partners, L.P. and Spectra Energy Partners, LP Consent Solicitations and Implementation of Guarantees",PR Newswire
Jan-22-19,"Enbridge Inc. Announces Successful Completion of Enbridge Energy Partners, L.P. and Spectra Energy Partners, LP Consent Solicitations and Implementation of Guarantees",CNW Group
Jan-23-19,Kinder Morgan Is Teaming Up to Capture a Slice of this Rapidly Expanding Market,Motley Fool
Jan-23-19,"Enbridge TETCO Ohio pipe blast cuts U.S. Marcellus, Utica natgas output",Reuters
Jan-24-19,Enbridge (ENB) Stock Sinks As Market Gains: What You Should Know,Zacks
Jan-24-19,"North Dakota Oil Production Falls, Growth Likely to Moderate",Zacks
Jan-24-19,U.S. natgas pipeline flows reversed after Enbridge TETCO Ohio pipe blast,Reuters
Jan-25-19,Express Pipeline Limited Partnership -- Moody's upgrades Enbridge and two subsidiaries and assigns a positive outlook,Moody's
Jan-25-19,Enbridge expects to restore part of damaged Ohio TETCO pipe next week,Reuters
Jan-28-19,Enbridge restores some natgas flows on damaged TETCO pipe in Ohio,Reuters
Jan-28-19,Texas Eastern Transmission L.P. -- Moody's upgrades Enbridge and two subsidiaries and assigns a positive outlook,Moody's
Jan-29-19,Pape's Picks- 4 Ideas for the Year Ahead,MoneyShow
Jan-30-19,Enbridge Provides Notice of Series P Preferred Shares Conversion Right and Announces Reset Dividend Rates,PR Newswire
Jan-30-19,Enbridge Provides Notice of Series 7 Preferred Shares Conversion Right and Announces Reset Dividend Rates,PR Newswire
Jan-30-19,Enbridge (ENB) Gains But Lags Market: What You Should Know,Zacks
Jan-31-19,Texas COLT Submits Application with MARAD for Deepwater Port Project,PR Newswire
Feb-05-19,Enbridge (ENB) Outpaces Stock Market Gains: What You Should Know,Zacks
Feb-05-19,Why Enbridge Stock Soared Nearly 18% in January,Motley Fool
Feb-05-19,"Top Research Reports for Pepsico, Walt Disney & Sanofi",Zacks
Feb-06-19,Brookfield Infrastructure Partners Restarts Its Growth Engine in Q4,Motley Fool
Feb-07-19,Two Key Pipeline Shutdowns Cause Canadian Oil Price to Slip,Bloomberg
Feb-08-19,TransCanada says Keystone likely source of Missouri oil leak,Associated Press
Feb-11-19,Enbridge (ENB) Outpaces Stock Market Gains: What You Should Know,Zacks
Feb-11-19,"Pipelines, Politics and Profits",MoneyShow
Feb-12-19,Westcoast Energy Declares Dividends,CNW Group
Feb-12-19,Key Factors to Know Ahead of Enbridge's (ENB) Q4 Earnings,Zacks
Feb-14-19,McDermott Plunges 26.7% on Cameron LNG Project Cost Surge,Zacks
Feb-15-19,Enbridge Inc (ENB) Q4 2018 Earnings Conference Call Transcript,Motley Fool
Feb-15-19,Enbridge 'not surprised' by Minnesota governor's pipeline appeal -CEO,Reuters
Feb-15-19,Oceaneering's (OII) Q4 Earnings &amp; Revenues Surpass Estimates,Zacks
Feb-15-19,"Enbridge (ENB) Beats on Q4 Earnings, Revenues Decline Y/Y",Zacks
Feb-15-19,Enbridge: 4Q Earnings Snapshot,Associated Press
Feb-15-19,Top 4 Oil and Gas Penny Stocks for 2019,Investopedia
Feb-15-19,Enbridge Files 2018 Year End Disclosure Documents,CNW Group
Feb-15-19,Enbridge Appoints New Directors to its Board,PR Newswire
Feb-15-19,Enbridge Appoints New Directors to its Board,CNW Group
Feb-15-19,Enbridge Inc. Reports Strong Fourth Quarter and Full Year 2018 Results,PR Newswire
Feb-19-19,"Westcoast Energy Announces Redemption of Cumulative Redeemable First Preferred Shares, Series 7, and Series 8",CNW Group
Feb-19-19,"Top Research Reports for United Parcel Service, Morgan Stanley & CME Group",Zacks
Feb-20-19,"TransCanada (TRP) Q4 Earnings Beat, Revenues &amp; DCF Jump Y/Y",Zacks
Feb-20-19,"The Zacks Analyst Blog Highlights: United Parcel, Morgan Stanley, CME, Williams and Enbridge",Zacks
Feb-20-19,Diamondback (FANG) Q4 Earnings Miss as Crude Prices Fall,Zacks
Feb-21-19,"SM Energy's (SM) Q4 Loss Wider Than Expected, Sales Beat",Zacks
Feb-22-19,The Oil Price Rally Shows No Sign Of Stopping,Oilprice.com
Feb-22-19,"Cabot (COG) Q4 Earnings Miss, Cash Flow &amp; Reserves Jump",Zacks
Feb-22-19,"QEP Resources' (QEP) Q4 Earnings and Sales Miss, Down Y/Y",Zacks
Feb-22-19,Delek (DK) Q4 Earnings Beat on Favorable Midland Differential,Zacks
Feb-25-19,"New Research Coverage Highlights Enbridge, Petroleo Brasileiro S.A.- Petrobras, Cadence Design, Yirendai, Arbor Realty Trust, and W.P. Carey  Consolidated Revenues, Company Growth, and Expectations for 2019",GlobeNewswire
Feb-26-19,"Matador, Five Point New JV to Boost Permian Midstream Assets",Zacks
Feb-26-19,"Southeast Supply Header, LLC -- Moody's affirms Southeast Supply Header's Baa2 rating; changes outlook to negative",Moody's
Feb-27-19,"Callon Petroleum's (CPE) Q4 Earnings &amp; Sales Miss, Up Y/Y",Zacks
Feb-27-19,"McDermott's (MDR) Q4 Earnings, Revenues Lag Estimates",Zacks
Feb-27-19,3 Stocks Anyone Can Understand,Motley Fool
Feb-28-19,"Encana (ECA) Beats on Q4 Earnings &amp; Sales, Hikes Dividend",Zacks
Feb-28-19,"Rowan Companies (RDC) Q4 Loss Wider Than Expected, Sales Top",Zacks
Feb-28-19,"Oasis Petroleum (OAS) Slips to Loss in Q4, Production Jumps",Zacks
Feb-28-19,Apache (APA) Q4 Earnings Top on Permian Production Strength,Zacks
Feb-28-19,"BP Brings Angelin Online, to Deliver 2 More Upstream Projects",Zacks
Mar-01-19,"Petrobras (PBR) Q4 Earnings Jump on Oil Surge, Output Falls",Zacks
Mar-01-19,Whiting (WLL) Posts Q4 Loss on Weak Oil Price Realizations,Zacks
Mar-04-19,"Why Hawaiian Holdings, Okta, and Enbridge Slumped Today",Motley Fool
Mar-04-19,Midwest Connector Capital Company LLC -- Moody's assigns Baa2 rating to Midwest Connector Capital Company,Moody's
Mar-04-19,"Ensco (ESV) Q4 Loss Wider than Expected, Revenues Fall Y/Y",Zacks
Mar-04-19,Enbridge Pipeline Delay Punishes Oil-Sands Producers Shares,Bloomberg
Mar-04-19,Canada Oil Industry Takes Fresh Hit With Key Pipeline Delay,Bloomberg
Mar-04-19,CNX Resources (CNX) Prices Senior Notes to Refinance Debts,Zacks
Mar-04-19,ExxonMobil to Build a New Polypropylene Plant in Baton Rouge,Zacks
Mar-04-19,TransCanada's (TRP) Mountaineer Xpress Project Comes Online,Zacks
Mar-05-19,Cimarex's Resolute Energy Acquisition to Add to March Output,Zacks
Mar-05-19,Top Ranked Income Stocks to Buy for March 5th,Zacks
