date,title,source
Oct-18-18,Pzena (PZN) Q3 Earnings and Revenues Top Estimates,Zacks
Oct-18-18,Pzena: 3Q Earnings Snapshot,Associated Press
Oct-18-18,"Pzena Investment Management, Inc. Reports Results for the Third Quarter of 2018",GlobeNewswire
Oct-19-18,Edited Transcript of PZN earnings conference call or presentation 19-Oct-18 2:00pm GMT,Thomson Reuters StreetEvents
Oct-19-18,Pzena Investment (PZN) Q3 2018 Earnings Conference Call Transcript,Motley Fool
Oct-22-18,Edited Transcript of PZN earnings conference call or presentation 19-Oct-18 2:00pm GMT,Thomson Reuters StreetEvents
Oct-29-18,"Consolidated Research: 2018 Summary Expectations for Insys Therapeutics, Achaogen, Astec Industries, Central European Media Enterprises, Pzena Investment Management, and Clementia Pharmaceuticals  Fundamental Analysis, Key Performance Indications",GlobeNewswire
Nov-07-18,"Pzena Investment Management, Inc. Announces October 31, 2018 Assets Under Management",GlobeNewswire
Nov-07-18,"BlackRock (BLK) Acquisitions Aid Revenues, Expenses Increase",Zacks
Nov-16-18,Pzena Investment Management's Top 4 Position Boosts in 3rd Quarter,GuruFocus.com
Dec-07-18,"Pzena Investment Management, Inc. Announces November 30, 2018 Assets Under Management",GlobeNewswire
Dec-18-18,Richard Pzena Whittles Down Stake in Office Supplies Distributor Essendant,GuruFocus.com
Jan-07-19,"Pzena Investment Management, Inc. Announces December 31, 2018 Assets Under Management",GlobeNewswire
Jan-23-19,"Pzena Investment Management, Inc. Announces Fourth-Quarter and Full-Year 2018 Earnings Conference Call",GlobeNewswire
Jan-25-19,Moving Average Crossover Alert: Pzena Investment Management,Zacks
Feb-05-19,Pzena: 4Q Earnings Snapshot,Associated Press
Feb-05-19,"Pzena Investment Management, Inc. Reports Results for the Fourth Quarter and Full Year of 2018",GlobeNewswire
Feb-05-19,"Pzena Investment Management, Inc. Announces January 31, 2019 Assets Under Management",GlobeNewswire
