date,title,source
Oct-23-18,"Royal Bank of Canada to redeem Non-Cumulative First Preferred Shares Series AD, Non-Cumulative Floating Rate First Preferred Shares Series AK and Non-Cumulative 5-Year Rate Reset First Preferred Shares Series AJ & AL",CNW Group
Oct-24-18,RBC Royal Bank increases prime rate,CNW Group
Oct-24-18,[$$] Eurozone economic confidence hurt by global trade war,Financial Times
Oct-24-18,[$$] Why challenger banks Metro and TSB struggle to make a difference,Financial Times
Oct-25-18,Royal Bank of Canada announces increase to NVCC Preferred Share issue,CNW Group
Oct-25-18,Royal Bank of Canada announces NVCC preferred share issue,CNW Group
Oct-25-18,[$$] Chinas currency nears key level in late-day drop,Financial Times
Oct-25-18,[$$] BT cuts off investors calling for shake-up,Financial Times
Oct-26-18,[$$] Chinas renminbi falls to lowest against US dollar in decade,Financial Times
Oct-29-18,"Texas Municipal Gas Acquisition & Supply Corporation II, Gas Supply Revenue Bonds, Series 2007A, Series 2007B, and Series 2012C -- Moody's Upgrades to A2 from A3 Long-Term Ratings of Four Gas Prepayment Bonds Supported by JPMorgan Chase & Co.",Moody's
Oct-30-18,"Lakeshore Trust Canadian ABCP Program -- Moody's Canadian ABCP activity ended October 26, 2018",Moody's
Oct-30-18,[$$] US dollar hits highest level in 10 weeks with yen under pressure,Financial Times
Nov-01-18,RBC to announce fourth quarter and fiscal 2018 results,CNW Group
Nov-02-18,Royal Bank of Canada Announces Closing of $350 Million NVCC Preferred Share Offering,CNW Group
Nov-06-18,"RBC Global Asset Management Inc. announces October sales results for RBC Funds, PH&N Funds and BlueBay Funds",CNW Group
Nov-06-18,Canadian pension returns post slight gain in Q3 2018: RBC Investor & Treasury Services,CNW Group
Nov-06-18,[$$] Direct Line posts fall in premium income in challenging market,Financial Times
Nov-07-18,Big investors sue 16 banks in U.S. over currency market rigging,Reuters
Nov-07-18,"Thunder Bay Funding LLC -- Moody's ABCP activity ending November 2, 2018",Moody's
Nov-08-18,RBC Wealth Management partners with 'The Wealthy Barber' David Chilton,CNW Group
Nov-08-18,RBC Global Asset Management Inc. recognized in multiple categories at Lipper Canada Fund Awards,CNW Group
Nov-09-18,RBC honoured with four wealth management awards at industry galas,CNW Group
Nov-09-18,[$$] SSE and Npower lambasted for merger shambles,Financial Times
Nov-12-18,[$$] MoD contractor Babcock finds defence is not best form of attack,Financial Times
Nov-14-18,"Tender Option Bond Trust (RBC Liquidity), Puttable Floating Rate Receipts, Series 2018-XM0707 -- Moody's assigns A1/VMIG 1 to Puttable Floating Rate Receipts, Series 2018-XM0707",Moody's
Nov-14-18,RBC Global Asset Management Inc. lowers administration fees for RBC Emerging Markets Bond Fund,CNW Group
Nov-14-18,Many Canadians are more prepared for a stormy day than a financial emergency: RBC poll,CNW Group
Nov-15-18,RBC Global Asset Management Inc. announces RBC ETF cash distributions for November 2018,CNW Group
Nov-15-18,[$$] Federal Reserve to review how it conducts monetary policy in 2019,Financial Times
Nov-15-18,Moving Average Crossover Alert: Royal Bank of Canada (RY),Zacks
Nov-16-18,[$$] CVC Capital to Take Minority Stake in German Services Firm,The Wall Street Journal
Nov-16-18,RBC Global Asset Management Inc. announces final valuation of RBC Target 2018 Corporate Bond Index ETF,CNW Group
Nov-16-18,[$$] Pound pauses in Asia after Brexit drop,Financial Times
Nov-21-18,Royal Bank (RY) Earnings Expected to Grow: What to Know Ahead of Next Week's Release,Zacks
Nov-21-18,[$$] Kingfisher to exit smaller markets as French woe deepens,Financial Times
Nov-23-18,RBC leaders and Board member recognized at Canada's Most Powerful Women: Top 100 Awards,CNW Group
Nov-27-18,"[$$] Stocks to watch: Thomas Cook, Osram, NMC, Woodford, Hikma",Financial Times
Nov-28-18,Royal Bank of Canada (RY) Q4 2018 Earnings Conference Call Transcript,Motley Fool
Nov-28-18,"[$$] Royal Bank of Canada Earnings Jump on Higher Rates, Fees",The Wall Street Journal
Nov-28-18,Royal Bank of Canada eyes further margin gains in 2019,Reuters
Nov-28-18,Royal Bank of Canada eyes further margin gains in 2019,Reuters
Nov-28-18,"CANADA STOCKS-TSX up on strong earnings of Royal Bank, consumer staples",Reuters
Nov-28-18,RBCs Rising Margins Push Canadian Banking Profit to Record,Bloomberg
Nov-28-18,Royal Bank (RY) Tops Q4 Earnings Estimates,Zacks
Nov-28-18,Royal Bank of Canada quarterly earnings beat market forecasts,Reuters
Nov-28-18,Thomas A. Renyi retires from Royal Bank of Canada's Board of Directors,CNW Group
Nov-28-18,Royal Bank of Canada declares dividends,CNW Group
Nov-28-18,Royal Bank of Canada Reports Fourth Quarter and 2018 Results,CNW Group
Nov-28-18,[$$] Wall St debates two words in Powell speech: just below,Financial Times
Nov-29-18,PRESS DIGEST - Canada - Nov 29,Reuters
Nov-29-18,RBC takes robo-advisor service national - making it easy for Canadians to access investment advice online,CNW Group
Nov-30-18,"Salt Verde Financial Corporation, AZ -- Moody's places Baa1 of Salt Verde Financial Corporation, AZ Senior Gas Revenue Bonds, Series 2007 under review for upgrade.",Moody's
Nov-30-18,"[$$] Week ahead: US jobs, Powell testimony, Opec",Financial Times
Dec-03-18,"Salt Verde Financial Corporation, AZ, Senior Gas Revenue Bonds, Series 2007 & Subordinate Gas Revenue Bonds, Series 2007, $1, -- Moody's downgrades to Ba3 Salt Verde Financial Corporation, AZ Subordinate Gas Revenue Bonds, Series 2007.",Moody's
Dec-03-18,[$$] Commodities and miners rally amid optimism following Xi-Trump truce,Financial Times
Dec-03-18,[$$] Is the global economy late cycle?,Financial Times
Dec-04-18,"[$$] Toniic, partner of GIIN, wants to bring impact investing to Chinas wealthy",Financial Times
Dec-04-18,"Salt Verde Financial Corporation, AZ -- Moody's downgrades to Ba3 Salt Verde Financial Corporation, AZ Subordinate Gas Revenue Bonds, Series 2007.",Moody's
Dec-04-18,[$$] Opec: why Trump has Saudi Arabia over a barrel,Financial Times
Dec-06-18,RBC Wealth Management - U.S. launches Client Risk Prevention Division to detect and curb fraud and financial exploitation targeting vulnerable and aging clients,PR Newswire
Dec-06-18,"RBC Global Asset Management Inc. announces November sales results for RBC Funds, PH&N Funds and BlueBay Funds",CNW Group
Dec-06-18,"Salt Verde Financial Corporation, AZ -- Moody's downgrades to Ba3 Salt Verde Financial Corporation, AZ Subordinate Gas Revenue Bonds, Series 2007.",Moody's
Dec-07-18,"Honolulu (City & County of) HI -- Moody's affirms P-1 of Honolulu, HI GO Commercial Paper Notes Issue A",Moody's
Dec-10-18,"Main Street Natural Gas, Inc., Gas Project Revenue Bonds, Series 2006 B, $536.865MM -- Moody's places A3 rating of six gas prepayment bonds under review for upgrade.",Moody's
Dec-10-18,RBC Global Asset Management Strengthens US Responsible Investing Team,PR Newswire
Dec-11-18,Public Authority for Colorado Energy -- Moody's places A3 rating of six gas prepayment bonds under review for upgrade.,Moody's
Dec-12-18,"Main Street Natural Gas, Inc., Gas Supply Revenue, Series 2018F, $700MM -- Moody's assigns A3 to Main Street Natural Gas, Inc. Gas Supply Revenue Bonds Series 2018F",Moody's
Dec-12-18,Alberta to face uphill battle; B.C economy to thrive in 2019: RBC Economics,CNW Group
Dec-12-18,RBC's Croft:  What does an OPEC cut really look like?,CNBC Videos
Dec-13-18,"California Statewide Communities Dev. Auth. -- Moody's Affirms Aa2/ VMIG 1 of California Statewide Communities Development Authority, Gas Supply Rev. Bonds, Series 2010A & 2010B",Moody's
Dec-13-18,"Main Street Natural Gas, Inc. -- Moody's assigns A3 to Main Street Natural Gas, Inc. Gas Supply Revenue Bonds Series 2018F",Moody's
Dec-17-18,"Lakeshore Trust Canadian ABCP Program -- Moody's Canadian ABCP activity ended December 14, 2018",Moody's
Dec-18-18,BMA vs. RY: Which Stock Should Value Investors Buy Now?,Zacks
Dec-20-18,RBC Global Asset Management Inc. announces RBC ETF cash distributions for December 2018,CNW Group
Dec-21-18,"Plaza Trust -- Moody's Canadian ABCP activity for week ended December 21, 2018",Moody's
Dec-21-18,Little relief in sight for Canadian housing affordability in 2019: RBC Economics,CNW Group
Dec-27-18,RBCs McGregor Eyes More Private-Equity Dealings to Gain Edge,Bloomberg
Dec-31-18,/C O R R E C T I O N from Source -- RBC Global Asset Management/,CNW Group
Jan-02-19,"Versailles Commercial Paper -- Moody's ABCP activity ending December 28, 2018",Moody's
