date,title,source
Oct-29-18,Why the Earnings Surprise Streak Could Continue for Viav Solutions (VIAV),Zacks
Oct-31-18,Wall Street Outperforms Global Markets in 2018: 5 Top Picks,Zacks
Oct-31-18,"VIAVI Unveils Industry's First 3GPP-Compliant 5G Core Emulator, Accelerating Network Development to Speed 5G Deployments",PR Newswire
Nov-01-18,Viav Solutions (VIAV) Surpasses Q1 Earnings Estimates,Zacks
Nov-01-18,Viav Solutions: Fiscal 1Q Earnings Snapshot,Associated Press
Nov-01-18,VIAVI Announces First Quarter Fiscal 2019 Results,PR Newswire
Nov-01-18,Wall Street Mayhem to Persist in November: 5 Defensive Picks,Zacks
Nov-14-18,VIAVI Introduces the First True 5G Base Station Analyzer for Large-Scale Deployments,PR Newswire
Nov-20-18,Altice Launches Altice One OS 2.0 to Boost User Experience,Zacks
Nov-21-18,"Detailed Research: Economic Perspectives on OpGen, Viavi Solutions, Domo, LM Funding America, Orion Energy, and Rimini Street  What Drives Growth in Today's Competitive Landscape",GlobeNewswire
Dec-03-18,ARRIS International Displays Bright Prospects Amid Risks,Zacks
Jan-07-19,VIAVI To Participate At J.P. Morgan's Tech Forum Investor Conference,PR Newswire
Jan-11-19,VIAVI Announces Date for Fiscal Second Quarter 2019 Financial Results,PR Newswire
Jan-23-19,Rakuten Selects VIAVI To Validate World's First End-to-End Cloud-Native Mobile Network,PR Newswire
Jan-29-19,Viav Solutions (VIAV) Earnings Expected to Grow: What to Know Ahead of Next Week's Release,Zacks
Jan-29-19,VIAVI Reinvents Performance Management and Network Security with Enriched Data Flow Records,PR Newswire
Feb-04-19,VIAVI Showcases Advanced Optical Filters for Sensing Systems at Photonics West 2019,PR Newswire
Feb-05-19,Viavi Solutions Inc (VIAV) Q2 2019 Earnings Conference Call Transcript,Motley Fool
Feb-05-19,Viav Solutions (VIAV) Beats Q2 Earnings and Revenue Estimates,Zacks
Feb-05-19,Viav Solutions: Fiscal 2Q Earnings Snapshot,Associated Press
Feb-05-19,VIAVI Announces Second Quarter Fiscal 2019 Results,PR Newswire
Feb-05-19,Viavi Solutions Inc. to Host Earnings Call,ACCESSWIRE
Feb-06-19,Edited Transcript of VIAV earnings conference call or presentation 5-Feb-19 9:30pm GMT,Thomson Reuters StreetEvents
Feb-06-19,What You Must Know About Viavi Solutions Inc.s (NASDAQ:VIAV) Financial Strength,Simply Wall St.
Feb-08-19,"Detailed Research: Economic Perspectives on Hess, Vi, Marsh & McLennan Companies, Kratos Defense & Security Solutions, Knoll, and Viavi Solutions  What Drives Growth in Today's Competitive Landscape",GlobeNewswire
Feb-12-19,"VIAVI Equips Mobily with Location Intelligence, Boosting Network Capacity, Operational Efficiency and Profitability",PR Newswire
Feb-14-19,VIAVI Solutions Recognized as a Leader in Gartner Magic Quadrant for Network Performance Monitoring and Diagnostics for Sixth Consecutive Year,PR Newswire
Feb-20-19,"VIAVI to Showcase 5G Network Validation, Verification and Visibility Solutions at Mobile World Congress 2019",PR Newswire
Feb-27-19,"VIAVI Unveils New Testing Solutions for Network Equipment Manufacturers and Labs, Paving the Way to Next-Generation Networks up to 800G",PR Newswire
Mar-04-19,VIAVI to Showcase the Industry's Most Comprehensive Portfolio of Test and Measurement Solutions at OFC 2019,PR Newswire
