date,title,source
Oct-17-18,Las Vegas Sands to Announce Third Quarter 2018 Financial Results,PR Newswire
Oct-19-18,"Gambling Stocks Arent So Lucky, According to Goldman Sachs",Barrons.com
Oct-19-18,Why Caesars Stock Is Worth the Gamble,InvestorPlace
Oct-22-18,Las Vegas Sands (LVS) Q3 Earnings to Gain From Strong Margins,Zacks
Oct-24-18,Las Vegas Sands: 3Q Earnings Snapshot,Associated Press
Oct-24-18,Las Vegas Sands (LVS) Lags Q3 Earnings and Revenue Estimates,Zacks
Oct-24-18,Las Vegas Sands Misses As U.S. Casinos Weaken; Dividend Hiked,Investor's Business Daily
Oct-24-18,Las Vegas Sands Reports Third Quarter 2018 Results,PR Newswire
Oct-24-18,Las Vegas Sands earnings miss expectations,CNBC Videos
Oct-24-18,Las Vegas Sands Q3 Earnings Preview,Benzinga
Oct-24-18,Is Las Vegas Sands Corp (NYSE:LVS) A Financially Sound Company?,Simply Wall St.
