date,title,source
Oct-25-18,Why TAL Education Group Stock Jumped Today,Motley Fool
Oct-25-18,TAL Education: Fiscal 2Q Earnings Snapshot,Associated Press
Oct-25-18,"TAL Education Group Announces Unaudited Financial Results for the Second Fiscal Quarter Ended August 31, 2018, and Adoption of up to US$100 Million Share Repurchase Program",PR Newswire
Oct-29-18,TAL Education (TAL) Looks Good: Stock Adds 7.4% in Session,Zacks
Oct-31-18,"Detailed Research: Economic Perspectives on Allegion, Ryder System, TAL Education Group, The Hartford Financial Services Group, Franklin Resources, and EQT  What Drives Growth in Today's Competitive Landscape",GlobeNewswire
Nov-07-18,Why TAL Education Group Gained 13% in October,Motley Fool
Nov-12-18,Tiger Global Throws Support Behind Struggling Chinese Stocks,Insider Monkey
Dec-06-18,Should We Worry About TAL Education Groups (NYSE:TAL) P/E Ratio?,Simply Wall St.
Dec-12-18,"Here is What Hedge Funds Think About TAL Education Group, Inc. (TAL)",Insider Monkey
Dec-28-18,"TAL Education Group to Announce Third Quarter of Fiscal Year 2019 Financial Results on January 24, 2019",PR Newswire
Jan-11-19,This Fund Will Help You Ride Out a Global Recession,Barrons.com
Jan-15-19,A Holistic Look At TAL Education Group (NYSE:TAL),Simply Wall St.
Jan-22-19,5 Amazing Earnings Charts,Zacks
Jan-23-19,Q3 Earnings Outlook For TAL Education,Benzinga
Jan-24-19,"Earnings Reports: American Airlines, Southwest, Union Pacific, Norfolk Southern",Investor's Business Daily
Jan-24-19,TAL Education: Fiscal 3Q Earnings Snapshot,Associated Press
Jan-24-19,"TAL Education Group Announces Unaudited Financial Results for the Third Fiscal Quarter Ended November 30, 2018",PR Newswire
Jan-28-19,How a Buffett-Inspired Fund Aims to Navigate a Global Bear Market,Investopedia
Jan-29-19,Is TAL Education (TAL) a Solid Growth Stock? 3 Reasons to Think &quot; Yes &quot;,Zacks
Feb-06-19,7 of the Best Emerging Markets Stocks to Buy,InvestorPlace
Feb-07-19,TAL Education Group Acquires Ready4,PR Newswire
Feb-11-19,Is TAL Education Group (TAL) Stock Outpacing Its Consumer Discretionary Peers This Year?,Zacks
Feb-12-19,Top Ranked Momentum Stocks to Buy for February 12th,Zacks
Feb-14-19,Here is Why Growth Investors Should Buy TAL Education (TAL) Now,Zacks
Feb-26-19,Will TAL Education Group Continue to Surge Higher?,Zacks
Mar-08-19,Top Ranked Momentum Stocks to Buy for March 8th,Zacks
Mar-11-19,Satellites and shoe-leather - How investors get beyond China's dubious data,Reuters
Mar-12-19,Satellites and shoe-leather - How investors get beyond China's dubious data,Reuters
Mar-15-19,TAL Education Group (TAL) Q3 2019 Earnings Conference Call Transcript,Motley Fool
Mar-28-19,"TAL Education Group to Announce Fourth Quarter and Fiscal Year 2019 Financial Results on April 25, 2019",PR Newswire
Mar-29-19,IBD Stock Of The Day Surges Past Buy Point Amid Trump Trade War Optimism,Investor's Business Daily
Apr-15-19,TAL Showcases Smart Education Solutions at Education Exhibition during China-CEEC '16+1' Business Forum,PR Newswire
Apr-15-19,TAL Joins Hands with UNESCO to Promote Educational Development,PR Newswire
Apr-18-19,China's TAL Stock Flashes Buy Before Earnings,Schaeffer's Investment Research
Apr-23-19,"New Oriental Education Earnings In Line, But Revenue Guidance Weak",Investor's Business Daily
Apr-25-19,TAL Education Beats But Guides Low After New Oriental Education Meets,Investor's Business Daily
Apr-25-19,TAL Education: Fiscal 4Q Earnings Snapshot,Associated Press
Apr-25-19,TAL Education Group Announces Unaudited Financial Results for the Fourth Fiscal Quarter and the Fiscal Year 2019,PR Newswire
Apr-26-19,TAL Education Group (TAL) Q4 2019 Earnings Call Transcript,Motley Fool
