date,title,source
Oct-17-18,NeuroMetrix Reports Q3 2018 Financial Results,GlobeNewswire
Oct-18-18,Better Buy: GlaxoSmithKline plc vs. Eli Lilly,Motley Fool
Oct-22-18,Apple named best private sector employer in the UK,CNBC
Oct-22-18,Merck (MRK) to Report Q3 Earnings: What's in the Cards?,Zacks
Oct-22-18,Today's Research Reports on Trending Tickers: Immunomedics and GlaxoSmithKline,ACCESSWIRE
Oct-23-18,"Leaning on tech expertise, Peninsula gene-editing company raises $110 million, targets lower-priced drugs",American City Business Journals
Oct-25-18,3 Beaten-Down Biotech Stocks: Can They Bounce Back?,Motley Fool
Oct-26-18,What's in the Cards for Glaxo (GSK) This Earnings Season?,Zacks
Oct-30-18,Long-lasting HIV injection is a step closer after second GSK study,Reuters
Oct-31-18,GlaxoSmithKline plc (GSK) Q3 Earnings Conference Call Transcript,Motley Fool
Oct-31-18,Mylan (MYL) Q3 Earnings: Is a Disappointment in the Cards?,Zacks
Oct-31-18,Glaxo: 3Q Earnings Snapshot,Associated Press
Oct-31-18,"GSK feels shingles vaccine boost, but shares slip on drugs mix",Reuters
Oct-31-18,[$$] Glaxo's Shingles Vaccine Gave Earnings a Shot in the Arm,The Wall Street Journal
Oct-31-18,"Shingles vaccine helps GSK beat earnings forecasts, raise guidance",Reuters
Oct-31-18,"Shingles vaccine helps GSK beat earnings forecasts, raise guidance",Reuters
Oct-31-18,"Glaxo (GSK) Beats Earnings Estimates in Q3, Revenue In-line",Zacks
Oct-31-18,[$$] GSKs shingles vaccine helps it shrug off Advair fears,Financial Times
Oct-31-18,"[$$] GlaxoSmithKline 3Q Profit Rose, Raises Guidance",The Wall Street Journal
Nov-01-18,Edited Transcript of GSK.L earnings conference call or presentation 31-Oct-18 2:30pm GMT,Thomson Reuters StreetEvents
Nov-01-18,"Glaxo (GSK) Beats on Q3 Earnings & Sales, Raises '18 View",Zacks
Nov-01-18,"Big pharma leases almost 500,000 square feet for new research center",American City Business Journals
Nov-02-18,"Pharma Stock Roundup: PFE, AGN Q3 Earnings, LLY, NVS Collaboration Deals in Focus",Zacks
Nov-05-18,IBD 50 Growth Stocks To Watch,Investor's Business Daily
Nov-06-18,Edited Transcript of GSK.L earnings conference call or presentation 31-Oct-18 2:30pm GMT,Thomson Reuters StreetEvents
Nov-06-18,"Report: Developing Opportunities within Avon Products, Sanofi, Arch Coal, GlaxoSmithKline plc, Chimera Investment, and PTC  Future Expectations, Projections Moving into 2018",GlobeNewswire
Nov-06-18,Today's Research Reports on Trending Tickers: GlaxoSmithKline and Eli Lilly and Company,ACCESSWIRE
Nov-07-18,Edited Transcript of GSK.L earnings conference call or presentation 31-Oct-18 2:30pm GMT,Thomson Reuters StreetEvents
Nov-08-18,"Theravance (TBPH) Beats on Q3 Earnings, Inks Deal for Vibativ",Zacks
Nov-09-18,Once-daily Trelegy Ellipta gains expanded COPD indication in Europe,Business Wire
