date,title,source
Jan-22-19,"Cloud, services fuel IBM's profit beat, robust outlook; shares jump",Reuters
Jan-22-19,What to Expect from Alibaba (BABA) Earnings Amid Chinese Economic Slowdown,Zacks
Jan-22-19,"IBM Gains as Quarterly Earnings, 2019 Outlook Beat Estimates",Bloomberg
Jan-22-19,[$$] IBM Beats Earnings Expectations Although Its Revenue Again Declines,The Wall Street Journal
Jan-22-19,IBM exec on Red Hat deal: Reaction 'overwhelmingly positive',American City Business Journals
Jan-22-19,IBM Rises on Otherwise Down Day for Stocks,GuruFocus.com
Jan-22-19,Why IBM Shares Are on the Rise After Earnings Report,Bloomberg
Jan-22-19,"IBM Stock Soars on Better-Than-Expected Earnings, Forecast",Barrons.com
Jan-22-19,"Intel (INTC) Q4 Earnings Preview: Client Computing, Data Centers, IoT &amp; More",Zacks
Jan-22-19,IBM Shares Jump After Beating Earnings and Guidance Expectations,TheStreet.com
Jan-22-19,"IBM Earnings Report Beats On Top, Bottom Line; Shares Surge",Investor's Business Daily
Jan-22-19,"Cloud, services fuel IBM's profit beat, robust outlook; shares jump",Reuters
Jan-22-19,"Stocks making the biggest moves after hours: IBM, Capital One and more",CNBC
Jan-22-19,"IBM stock rallies after earnings, annual outlook top Wall Street view",MarketWatch
Jan-22-19,IBM: 4Q Earnings Snapshot,Associated Press
Jan-22-19,"IBM beats earnings, sets higher than expected 2019 guidan...",CNBC Videos
Jan-22-19,"IBM revenue beats estimates on strength in cloud, services businesses",Reuters
Jan-22-19,"IBM stock rallies 5% on earnings beat, outlook",MarketWatch
Jan-22-19,IBM Reports 2018 Fourth-Quarter and Full-Year Results,Business Wire
Jan-22-19,"In Case You Missed it: Stocks Face Headwinds Times 10, IBM Earnings",TheStreet.com
Jan-22-19,3 Tech Earnings Reports We're Watching This Week,Zacks
Jan-22-19,IBM set to report earnings after the bell,CNBC
Jan-22-19,IBM jumps nearly 5% after earnings beat,CNBC
Jan-22-19,IBM CEO Rometty: This is what could topple the whole digital economy,CNBC
Jan-22-19,"China's Weak Economic Data and News from EBay, IBM, Halliburton, &amp; More",Zacks
Jan-22-19,IBM earnings: Emerging tech expected to account for half of sales as revenue declines,MarketWatch
Jan-22-19,"To Sell Europe on Cyber Security, IBM Turns to Big Rig Operations Center",Bloomberg
Jan-22-19,BNP Paribas Signs an Agreement with IBM Services to further deploy its Cloud Strategy,PR Newswire
Jan-22-19,IBM's stock falls ahead of earnings report that has usually led to losses,MarketWatch
Jan-22-19,IBM Earnings Preview: Closing Out a Rough 2018,Motley Fool
Jan-22-19,"Dow components head in opposite directions after earnings, one more is on the way",MarketWatch
Jan-22-19,Should You Buy IBM ETFs Ahead of Q4 Results?,Zacks
Jan-22-19,IBM Stocks Red Hat Era Begins With Its Q4 Report,InvestorPlace
Jan-22-19,IBM Earnings Unlikely to End 9-Year Downtrend,Investopedia
Jan-22-19,IBM: Look to Invest Now While It's Undervalued,TheStreet.com
Jan-22-19,IBM CEO: Over-regulation could put the digital economy at...,CNBC Videos
Jan-22-19,Phunware Selected for Inaugural IBM Blockchain Accelerator program,GlobeNewswire
Jan-22-19,"IBM, Johnson & Johnson, Starbucks, Global Growth Worries- 5 Things You Must Know",TheStreet.com
Jan-22-19,"The Zacks Analyst Blog Highlights: Bank of America, Merck, Netflix, IBM and The Bank of New York Mellon",Zacks
Jan-22-19,Stocks - Global Growth Worries Send U.S. Futures Lower,Investing.com
Jan-22-19,Top 5 Things to Know in The Market on Tuesday,Investing.com
Jan-23-19,Jim Cramer: These Giant Hedge Funds Are Financial Hooligans,TheStreet.com
Jan-23-19,Edited Transcript of IBM earnings conference call or presentation 22-Jan-19 10:00pm GMT,Thomson Reuters StreetEvents
Jan-23-19,IBM's Earnings: What You Need to Know,Motley Fool
Jan-23-19,IBM Stock Jumps After 'Cleanest Quarter in Years',TheStreet.com
Jan-23-19,Is Netflix telling the real market story?,CNBC Videos
Jan-23-19,What Happened in the Stock Market Today,Motley Fool
Jan-23-19,"3 Things to Know at Market Close: 2019 IPO's, IBM Earnings, and Oil",TheStreet.com
Jan-23-19,US stocks waver as signs of future profit growth wobble,Associated Press
Jan-23-19,Capital One and Abbott fall while IBM and Comcast jump,Associated Press
Jan-23-19,How to Trade IBM Following Better-Than-Expected Earnings,TheStreet.com
Jan-23-19,"US STOCKS-Wall St edges higher as upbeat earnings dampened by trade, shutdown woes",Reuters
Jan-23-19,Dow Today Rallies 170 Points On Huge Moves By These 3 Stocks,Investor's Business Daily
Jan-23-19,"In Case You Missed It: Qualcomm's Legal Issues Explained, IBM Is Surging",TheStreet.com
Jan-23-19,Markets Right Now: US stock indexes end with meager gains,Associated Press
Jan-23-19,Markets Right Now: US stock indexes end with meager gains,Associated Press
Jan-23-19,"Dow Rises as Wall Street Weighs Strong Earnings, Global Growth Concerns",TheStreet.com
Jan-23-19,IBM Stock Jumps As Fourth-Quarter Earnings Present Upside Surprise,Investor's Business Daily
Jan-23-19,"IBM, P&G and United Technologies are all saying something very important about the stock market",CNBC
Jan-23-19,Dow Outperforms Nasdaq; Will These 5 Top Stocks Outpace Apple In 2019?,Investor's Business Daily
Jan-23-19,IBM is having its best day in a decade,CNBC Videos
Jan-23-19,"US STOCKS-Wall St mixed as shutdown, trade tensions dampen upbeat earnings",Reuters
Jan-23-19,IBM: Why I'm Starting to Believe in Big Blue's Turnaround Story,TheStreet.com
Jan-23-19,"TXN vs. INTC Ahead of Earnings and Reports from IBM, UTX, &amp; More",Zacks
Jan-23-19,"Blockchain, Cloud are Keys to IBM Cashing in on Consumer Trends",TheStreet.com
Jan-23-19,US STOCKS-Wall St hit again by growth worries; blue-chip earnings prop up Dow,Reuters
Jan-23-19,Dow's gain bucks negative broad-market breadth data,MarketWatch
Jan-23-19,Why IBM's Stock Jumped as Much as 10% Higher Today,Motley Fool
Jan-23-19,"Jim Cramer Weighs in on IBM Earnings, Tesla Downgrade and Trade Talks",TheStreet.com
Jan-23-19,Chart of the Day: IBM's Spending Habits Could Set a Ceiling on Growth,TheStreet.com
Jan-23-19,"Stocks making the biggest moves midday: United Technologies, Tesla, IBM & more",CNBC
Jan-23-19,Dow Jones Gives Back Gains After Negative Reversal Shakes Stocks,Investor's Business Daily
Jan-23-19,"US STOCKS-S&P, Nasdaq dip as healthcare, financials weigh; IBM keeps Dow higher",Reuters
Jan-23-19,[$$] IBM: Some Blue Sky for Big Blue,The Wall Street Journal
Jan-23-19,IBM Services Signs a USD$260M Agreement with Bank of the Philippine Islands to Support the Bank's Digital Transformation,PR Newswire
Jan-23-19,Jim Cramer Reacts to IBM Earnings,TheStreet.com
Jan-23-19,US STOCKS-Wall Street bounces back on strong corporate earnings,Reuters
Jan-23-19,ETFs to Buy on IBM's Annual Revenue Growth Story,Zacks
Jan-23-19,IBM Gains Most in a Decade After Surprisingly Positive Results,Bloomberg
Jan-23-19,"IBM's Top-and-Bottom-Line Beat Surprised Analysts, the Charts Say It Is a Buy",TheStreet.com
Jan-23-19,IBM Soars as Morgan Stanley Hails Cleanest Quarter in Years,Bloomberg
Jan-23-19,"Jim Cramer on Tesla, IBM and China",TheStreet.com
Jan-23-19,"IBM Stock Soars as Clean, Cloud-Heavy Forecast Fuels Comeback",TheStreet.com
Jan-23-19,US STOCKS SNAPSHOT-Strong earnings boost Dow at the open,Reuters
Jan-23-19,IBM Stock Is Soaring on Better-Than-Expected Earnings,Barrons.com
Jan-23-19,I Will Not Be Chasing IBM Stock Wednesday,TheStreet.com
Jan-23-19,IBM Gains After Beating Estimates: 6 Key Takeaways,TheStreet.com
Jan-23-19,Wall Street set to open higher on strong earnings from Dow members,Reuters
Jan-23-19,US STOCKS-Wall St set to open higher on strong earnings from Dow members,Reuters
Jan-23-19,"[$$] Stocks to Watch: IBM, P&G, Synchrony",The Wall Street Journal
Jan-23-19,"Comcast Gains, TD Ameritrade Rises, and 3 More Wednesday Morning Movers",Barrons.com
Jan-23-19,"IBM stock rallies after earnings, annual outlook top Wall Street view",MarketWatch
Jan-23-19,"The Morning Download: IBM Earnings Reflect Rising Demand for AI, Cloud",The Wall Street Journal
Jan-23-19,IBM's stock surges into bull-market territory ahead of the open,MarketWatch
Jan-23-19,"IBM, P&G, United Technologies Earnings Lift Dow Above a Sea of Troubles",Barrons.com
Jan-23-19,"IBM Q4 Earnings Surpass Estimates, Revenues Decline Y/Y",Zacks
Jan-23-19,Behind the Computer: A Look at the History of IBM,TheStreet.com
Jan-23-19,"IBM Jumps After Q4 Earnings, Cloud-Focused Outlook Following $34B Red Hat Deal",TheStreet.com
Jan-23-19,US STOCKS-Futures rise on strong earnings reports from Dow members,Reuters
Jan-23-19,Dow's 3 earnings reporters adding 100 points to Dow's price,MarketWatch
Jan-23-19,"Stocks making the biggest moves premarket: Comcast, Walmart, IBM & more",CNBC
Jan-23-19,An IBM Play and 2 Catalysts To Watch in Wednesday's Trading: Market Recon,TheStreet.com
Jan-23-19,"IBM, Procter & Gamble, Ford, Comcast and Mariano Rivera - 5 Things You Must Know",TheStreet.com
Jan-23-19,"Stocks - U.S. Futures Point to Rebound, Dow Earnings Boost Sentiment",Investing.com
Jan-23-19,IBM (IBM) Q4 2018 Earnings Conference Call Transcript,Motley Fool
Jan-24-19,Here's Why Microsoft (MSFT) Stock Looks like a Buy Ahead of Earnings,Zacks
Jan-24-19,"Top Analyst Reports for Caterpillar, Microsoft & General Dynamics",Zacks
Jan-24-19,"Aetna, other health insurers team up with IBM on blockchain project",Reuters
Jan-24-19,"Aetna, other health insurers team up with IBM on blockchain project",Reuters
Jan-24-19,"Aetna, Anthem, Health Care Service Corporation, PNC Bank and IBM announce collaboration to establish blockchain-based ecosystem for the healthcare industry",PR Newswire
Jan-24-19,What's in the Offing for ServiceNow (NOW) in Q4 Earnings?,Zacks
Jan-24-19,"Zacks Investment Ideas feature highlights: International Business Machines, Procter and Gamble, Ford, Intel and Abbvie",Zacks
Jan-24-19,"Stock Market News for Jan 24, 2019",Zacks
Jan-24-19,Stocks open mixed as strong earnings struggle to counter growth concerns,MarketWatch
Jan-24-19,IBM Looks Good: Stock Adds 8.5% in Session,Zacks
Jan-24-19,Discussing the Era of 'New Collar&quot; Workers With IBM CEO Ginni Rometty,WSJ
Jan-24-19,IBM CEO Ginni Rometty on the Three Mistakes Companies Make With AI,WSJ
Jan-24-19,IBM CEO Ginni Rometty: AI Will Impact All Jobs,WSJ
Jan-24-19,IBM CEO: There needs to be precision regulation,Fox Business Videos
Jan-24-19,IBM CEO: We are the cloud for business,Fox Business Videos
Jan-24-19,IBM CEO on companies dealing with uncertainty by balancing productivity versus innovation,Fox Business Videos
Jan-24-19,International Business Machines Finally Has A Strategy That Can Drive IBM Stock,InvestorPlace
Jan-25-19,"In Case You Missed It: How JNJ, IBM, INTC, SBUX Are Doing",TheStreet.com
Jan-25-19,Researchers say Amazon face-detection technology shows bias,Associated Press
Jan-25-19,Analyst on IBM's Red Hat buy: 'They had to do something',American City Business Journals
Jan-25-19,"Upcoming Earnings Reports to Watch: CAT, AAPL, FB",Zacks
Jan-25-19,"IBM, Comcast, and eBay's Quandary",Motley Fool
Jan-25-19,Wall Street Sees Heaps of Earnings Reports as Shutdown Rages,Zacks
Jan-25-19,"Dow 30 Stock Roundup: UTX, TRV, PG, JNJ Earnings Impress, IBM Revenues Decline Y/Y",Zacks
Jan-25-19,"The Zacks Analyst Blog Highlights: Caterpillar, Microsoft, General Dynamics, IBM and Deere",Zacks
Jan-28-19,IBM (IBM) Gains As Market Dips: What You Should Know,Zacks
Jan-28-19,IBM Bets the Farm on the Cloud,GuruFocus.com
Jan-28-19,"SolarWinds Holdings, Inc. -- Moody's changes SolarWinds' outlook to positive, affirms B2 CFR and assigns SGL-1",Moody's
Jan-28-19,IBM launches blockchain health initiative with RTP campus support,American City Business Journals
Jan-28-19,Swedroe: Do Surprises Really Move Markets?,ETF.com
Jan-28-19,Is the Stock Market Too Upbeat About IBM Now?,Motley Fool
Jan-28-19,IBM: How To Play It Post Earnings Rally,TheStreet.com
Jan-28-19,"[$$] Stocks to Watch: eBay, Arconic, McCormick, IBM",The Wall Street Journal
Jan-29-19,Douglas Development makes a bargain buy in Fairfax County,American City Business Journals
Jan-29-19,IBM hopes 1 million faces will help fight bias in facial recognition,CNBC
Jan-29-19,IBM Board Approves Regular Quarterly Cash Dividend,Business Wire
Jan-30-19,3 Top Value Stocks to Buy Right Now,Motley Fool
Jan-30-19,"Toronto Transit Commission works with IBM and SAP to digitize payroll, finance and HR",CNW Group
Jan-31-19,3 Dividend Growth ETFs &amp; Stocks to Counter Looming Volatility,Zacks
Jan-31-19,7 Blue-Chip Stocks That Could Lead the Market Higher,InvestorPlace
Jan-31-19,Majesco (MJCO) Q3 2019 Earnings Conference Call Transcript,Motley Fool
Feb-01-19,Wisdomtree Investments Inc (WETF) Q4 2018 Earnings Conference Call Transcript,Motley Fool
Feb-01-19,Amazon Q4 Earnings Breakdown: Should Investors Worry About Slowing Growth?,Zacks
Feb-01-19,5 Top Stocks to Own This February,Zacks
Feb-01-19,5 Top Stocks to Buy in February,Motley Fool
Feb-04-19,Edited Transcript of IBM earnings conference call or presentation 22-Jan-19 10:00pm GMT,Thomson Reuters StreetEvents
Feb-04-19,McCormick partners with IBM on AI to come up with new flavors,American City Business Journals
Feb-04-19,Now A.I. might decide how your food tastes,CNBC
Feb-04-19,Why International Business Machines Corporation (NYSE:IBM) Is A Dividend Rockstar,Simply Wall St.
Feb-04-19,"Michigan Bought Intel and IBM Stock, and Sold Apple",Barrons.com
Feb-04-19,McCormick & Company and IBM Announce Collaboration Pioneering the Use of Artificial Intelligence in Flavor and Food Product Development,PR Newswire
Feb-05-19,How IBM Shares Gained 18.3% in January,Motley Fool
Feb-05-19,Jim Cramer: Running a Growth Business in This Market Is a High-Wire Act,TheStreet.com
Feb-05-19,Jim Cramer on Why Google Just Can't Make Analysts Happy,TheStreet.com
Feb-05-19,"With Fading Headwinds and Cloud Growth, Microsoft Stock Looks Solid",InvestorPlace
Feb-05-19,Should Invesco Defensive Equity ETF (DEF) Be on Your Investing Radar?,Zacks
Feb-05-19,IBM charts a new path to fill 151K data scientist jobs,American City Business Journals
Feb-05-19,Corporate Profits' New Enemy Is the 'Dollar Vortex',Investopedia
Feb-06-19,"IBM Poised to Grind Higher, New Risk Level Suggested",TheStreet.com
Feb-06-19,IBM develops new technology to help prevent power outages,Reuters
Feb-06-19,IBM develops new technology to help prevent power outages,Reuters
Feb-06-19,Apple Stock vs. Microsoft Stock: Investors Are Asking the Wrong Question,InvestorPlace
Feb-06-19,IBM to Help Utilities Cut Tree Trimming Budgets and Reduce Outages,PR Newswire
Feb-06-19,Smart Energy Water and IBM Sign Multi-Year Agreement to Speed Innovation on the Cloud,PR Newswire
Feb-06-19,China hacked Norway's Visma to steal client secrets -investigators,Reuters
Feb-07-19,Governor Cuomo Announces IBM Investment To Create Artificial Intelligence Hardware Center At SUNY Poly Albany Campus,PR Newswire
Feb-07-19,End of an Era: Big Tech Stocks Move from Growth to Value,Zacks
Feb-07-19,IBM: $2B expansion in NY to focus on artificial intelligence,Associated Press
Feb-08-19,"Zacks Value Trader Highlights: IBM, Microsoft, Intel, Cisco and Apple",Zacks
Feb-08-19,State of California Tackles Drought with IoT & Blockchain,PR Newswire
Feb-08-19,"Why a Big Investment Manager Bought Up Microsoft, IBM, and Nvidia Stock",Barrons.com
Feb-08-19,Buying the Dow Stocks With the Highest Dividends Is a Winning Strategy,Barrons.com
Feb-11-19,Trump calls for investment in artificial intelligence,Associated Press
Feb-11-19,Trump calls for investment in artificial intelligence,Associated Press
Feb-11-19,"IBM Chairman, President And CEO Ginni Rometty To Keynote IBM Think 2019",PR Newswire
Feb-11-19,10 Stocks That Every 20-Year-Old Should Buy,InvestorPlace
Feb-11-19,IBM debating robot challenges a human,Fox Business Videos
Feb-11-19,California to Use Blockchain to Manage Groundwater Usage,Market Exclusive
Feb-11-19,IBM Inks $2 Billion Deal to Develop AI Hardware Center in NY,Zacks
Feb-11-19,These 7 Iconic U.S. Companies Are Making a Comeback. Call Them the Dinos of the Dow.,Barrons.com
Feb-11-19,Dow Underdogs for 2019,MoneyShow
Feb-12-19,IBM Announces Additional $25 Million Investment to Put Technology to Work Saving Lives,PR Newswire
Feb-12-19,Hear IBM Debater argue with a human -- and lose,CNET
Feb-13-19,Market May Avoid Another Shutdown After All,Investopedia
Feb-13-19,Google Boosts Presence in Applicant Tracking Space with Hire,Zacks
Feb-13-19,IBM Watson Health Invests in Research Collaborations with Leading Medical Centers to Advance the Application of AI to Health,PR Newswire
Feb-13-19,IBM Watson Health and the Broad Institute Launch Initiative to Help Clinicians Predict the Risk of Cardiovascular Disease with Genomics and AI,PR Newswire
Feb-13-19,"Cigna and Sentara Healthcare Expand Blockchain-Based Ecosystem for Healthcare Industry - Along with Aetna, Anthem, Health Care Service Corporation, PNC Bank and IBM",PR Newswire
Feb-13-19,Apple and IBM CEOs join Trump's advisory board to make sure AI doesn't kill jobs,CNBC
Feb-13-19,IBM Watson Assistant Continues to Drive Global Business Transformation,PR Newswire
Feb-13-19,IBM strikes $700M deal with Santander to accelerate transformation,PR Newswire
Feb-13-19,IBM Helps Organizations Monitor Their Workers' Safety with Watson IoT,PR Newswire
Feb-13-19,Harley-Davidson to Redefine Riding with IBM Cloud,PR Newswire
Feb-13-19,"Apple, Walmart, IBM CEOs join White House advisory panel",Reuters
Feb-13-19,Can Google and IBM Catch Up in the Cloud?,InvestorPlace
Feb-13-19,"The Morning Download: Google Cloud Boosting Sales Efforts to Catch Amazon, Microsoft",The Wall Street Journal
Feb-13-19,Silicon Valley Is Using Trade Secrets to Hide Its Race Problem,Bloomberg
Feb-13-19,Hyundai Card  Commercial Tap IBM To Accelerate Digital Transformation,PR Newswire
Feb-14-19,Warren Buffett Doubles Down on Big Banks as Berkshire Trims Apple Stake,Bloomberg
Feb-14-19,VMware Announces Partnerships with Healthcare Organizations,Zacks
Feb-15-19,$2 billion IBM investment will create 316 jobs in Albany,American City Business Journals
Feb-15-19,Analysts Applaud IBM's Move To Make Watson Available Cross-Cloud,Benzinga
Feb-15-19,3 Top Artificial Intelligence Stocks to Watch in February,Motley Fool
Feb-19-19,How to Replicate Hedge Fund Strategies with ETFs,Zacks
Feb-19-19,John Paulson's Top 5 Buys in 4th Quarter,GuruFocus.com
Feb-19-19,Calculating The Fair Value Of International Business Machines Corporation (NYSE:IBM),Simply Wall St.
Feb-19-19,Nasdaq Exits Bear Market: 5 Top-Ranked Winners,Zacks
Feb-20-19,IBM (IBM) Stock Sinks As Market Gains: What You Should Know,Zacks
Feb-20-19,Gen Z workers target high-paying tech jobs,American City Business Journals
Feb-20-19,"The Evolution of the Smartphone, From IBM's Simon to Samsung's Galaxy Fold",TheStreet.com
Feb-20-19,"IBM Is on a Spectacular Streak, Will It Come to a Bad End?",Motley Fool
Feb-20-19,COFCO International selects IBM Services for global digital transformation,PR Newswire
Feb-21-19,IBM to join Aggie Square at new project headquarters,American City Business Journals
Feb-21-19,Quantum Computing Companies Aim To Go Where No Computer Has Gone Before,Investor's Business Daily
Feb-21-19,3 Cloud Stocks to Buy Right Now,Zacks
Feb-21-19,2 Top Tech Dividend Stocks to Buy Right Now,Motley Fool
Feb-21-19,IBM will get up to $300 million from state toward its $2 billion SUNY Poly AI project,American City Business Journals
Feb-21-19,IBM invaded San Francisco to prove it is still a tech innovator,MarketWatch
Feb-21-19,IBM (IBM) Up 3.9% Since Last Earnings Report: Can It Continue?,Zacks
Feb-21-19,"The Evolution of the Smartphone, From IBM's Simon to Samsung's Galaxy Fold",TheStreet.com
Feb-21-19,"Investor Expectations to Drive Momentum within International Business Machines, Trex, ForeScout Technologies, Red Hat, Amedisys, and Atrion  Discovering Underlying Factors of Influence",GlobeNewswire
Feb-21-19,Should Franklin LibertyQ U.S. Equity ETF (FLQL) Be on Your Investing Radar?,Zacks
Feb-22-19,IBM's Cheap Valuation Is a Great Buying Opportunity,TheStreet.com
Feb-22-19,"Exxon, Microsoft strike cloud computing agreement for U.S. shale",Reuters
Feb-22-19,"Boeing, Goldman and three other Dow stocks are soaring. Here's how to play them",CNBC
Feb-22-19,Quantum Computing Companies Aim To Go Where No Computer Has Gone Before,Investor's Business Daily
Feb-22-19,Warren Buffett Owes Investors More Than a Memo This Year,Bloomberg
Feb-25-19,[$$] Mercedes Enlists Quantum Computing to Build a Better Electric Vehicle Battery,The Wall Street Journal
Feb-25-19,Buy Amazon (AMZN) Stock Down 20% From Highs?,Zacks
Feb-25-19,Volkswagen Teams Up With IBM's AI for App to Navigate Cities,Bloomberg
Feb-25-19,"Energy, commodity space opportunity for patient investor: Portfolio manager",CNBC Videos
Feb-25-19,5 Hot Stocks in Dow ETF That Led the Market Higher,Zacks
Feb-25-19,"Should You Buy Alibaba Stock? 3 Pros, 3 Cons",InvestorPlace
Feb-25-19,"Warren Buffett Likes JPMorgan, Blasts Bitcoin, and Isnt Buying Apple",Barrons.com
Feb-25-19,"Buffett Drew Lessons From IBM as He Entered, Then Exited, Oracle",Bloomberg
Feb-25-19,"Warren Buffett: Oracle Is 'Great Company,' Not Sure I Understand Cloud Business",TheStreet.com
Feb-25-19,Factors Setting the Tone for VMware's (VMW) Q4 Earnings,Zacks
Feb-26-19,Perficient Inc (PRFT) Q4 2018 Earnings Conference Call Transcript,Motley Fool
Feb-26-19,IBM Job Applicants Outraged Over Racially Insensitive Labels,Bloomberg
Feb-26-19,"Top Stock Reports for IBM, Duke Energy & General Dynamics",Zacks
Feb-26-19,IBM Elects Michelle J. Howard to Its Board of Directors,Business Wire
Feb-26-19,IBM just appointed the first African-American woman to command a US Navy ship to its board,CNBC
Feb-26-19,Warren Buffett Joins the Crowd Struggling to Understand Oracle,Bloomberg
Feb-26-19,Why Warren Buffett fled Oracle stock: I dont think I understand where the cloud is going,American City Business Journals
Feb-26-19,Blockchains Biggest Opportunities Arent in Bitcoin,Barrons.com
Feb-26-19,salesforce (CRM) Q4 Earnings: Can it Sustain its Earnings Streak?,Zacks
Feb-26-19,How Safe Is IBM's Dividend?,Motley Fool
Feb-26-19,IBM X-Force Report: Ransomware Doesn't Pay in 2018 as Cybercriminals Turn to Cryptojacking for Profit,PR Newswire
Feb-26-19,IBM Named One of the 2019 World's Most Ethical Companies,PR Newswire
Feb-26-19,SEAT & IBM Revolutionize Urban Mobility with AI,PR Newswire
Feb-27-19,Will Amazon Kill MongoDB Stock?,InvestorPlace
Feb-27-19,"The Zacks Analyst Blog Highlights: IBM, Duke Energy, General Dynamics, Hewlett Packard and Rockwell Automation",Zacks
Feb-28-19,Benchmark Electronics names new CEO,American City Business Journals
Feb-28-19,IBM exec says we need to get the world ready for quantum computing,Mashable Videos
Feb-28-19,"Women are crowding into board rooms, but the likes of Ginni Rometty and Safra Catz are few and far between",American City Business Journals
Feb-28-19,Why Amazon Stock Should Rebound Soon,InvestorPlace
Feb-28-19,IBM Brings AI and Advanced Analytics to the Industrial World,PR Newswire
Feb-28-19,Intel (INTC) Ups the Ante in Hardware Security With SGX Card,Zacks
Feb-28-19,Cyber criminals shifting from ransomware to crypto mining,Fox Business Videos
Mar-01-19,KenSci: Using Artificial Intelligence and Machine Learning to Save Lives,Zacks Small Cap Research
Mar-01-19,"Detailed Research: Economic Perspectives on Xilinx, Activision Blizzard, International Business Machines, Digital Realty Trust, Six Flags Entertainment Corporation New, and INTL FCStone  What Drives Growth in Today's Competitive Landscape",GlobeNewswire
Mar-04-19,Boeing's Big Gains Make Dow Vulnerable,Investing.com
Mar-04-19,IBM Attains Highest Quantum Volume Milestone: Key Takeaways,Zacks
Mar-04-19,IBM Watson Health Announces 100 Top Hospitals,PR Newswire
Mar-04-19,Buy VMware (VMW) With or Without Dell,InvestorPlace
Mar-04-19,"IBM Achieves Highest Quantum Volume to Date, Establishes Roadmap for Reaching Quantum Advantage",PR Newswire
Mar-05-19,Alphabet Ups the Ante in Cybersecurity Space with Backstory,Zacks
Mar-05-19,IBM unveils new hacker-led blockchain initiative,American City Business Journals
Mar-05-19,"As the Competition Heats Up, Tableau Stock Is a Little Pricey",InvestorPlace
Mar-05-19,CyberArk Boosts Enterprise Security Presence With New Product,Zacks
Mar-05-19,IBM X-Force Red Launches New Service for Blockchain Security Testing,PR Newswire
Mar-06-19,"Undercover Down Under - Miners study gum leaves, groundwater for new finds",Reuters
Mar-06-19,Volatility 101: Should International Business Machines Shares Have Dropped 26%?,Simply Wall St.
Mar-07-19,"Server Market Data Release for Q4, Dell &amp; HPE Lead the Way",Zacks
Mar-07-19,DES: The story of the Data Encryption Standard,Coin Rivet
Mar-07-19,IBM Study Reveals Advancing Women is Still Not a Priority for 79 percent of Global Organizations,PR Newswire
Mar-08-19,"79 percent of global companies say they haven't prioritized achieving gender equality, new IBM research finds",CNBC
Mar-08-19,IBM Stock Could Offer Profitable Short Sales,Investopedia
Mar-11-19,IBM (IBM) Outpaces Stock Market Gains: What You Should Know,Zacks
Mar-11-19,SAP Cloud Platform Blockchain Service Selected By Bumble Bee,Zacks
Mar-12-19,IBM criticised for collecting social media photos for facial recognition research,The Telegraph
Mar-12-19,Should You Buy Microsoft Stock in March?,InvestorPlace
Mar-12-19,"Cisco Has the Fundamentals, but Shares Are Looking Frothy",Investing.com
Mar-12-19,[$$] Cyber Daily: Unpatched Holes Pile Up; U.S. Warns Germany to Avoid Huawei in 5G,The Wall Street Journal
