date,title,source
Oct-17-18,"Paul Allen's passions: Rock n' roll, sports and philanthropy",Associated Press
Oct-17-18,IBMs Cognitive Solutions Sales Slumped. What Happened?,Motley Fool
Oct-17-18,"Fighting Currency Headwinds, IBM Corp. Isn't Giving Up on Its Full-Year Goals",Motley Fool
Oct-17-18,IBM Shares Fall Hard a Day After Disappointing Earnings,TheStreet.com
Oct-17-18,Edited Transcript of IBM earnings conference call or presentation 16-Oct-18 9:00pm GMT,Thomson Reuters StreetEvents
Oct-17-18,[$$] IBM Shares Slide After Revenue Drop Renews Concerns,The Wall Street Journal
Oct-17-18,Jim Cramer: The Bulls Won the Night on Tuesday,TheStreet.com
Oct-17-18,IBMs stock falls to close at early 2016 levels as investors impatient with turnaround,MarketWatch
Oct-17-18,Dow Drops 91 Pointsand We Can Blame IBM,Barrons.com
Oct-17-18,What Happened in the Stock Market Today,Motley Fool
Oct-17-18,Stocks Slip as Fed Stays the Course,Investopedia
Oct-17-18,IBM Stock Takes a Dive as Revenue Falls Short,Barrons.com
Oct-17-18,Wall St. falls as investors eye a united hawkish Fed,Reuters
Oct-17-18,"PulteGroup, IBM and Fiat Chrysler fall while Netflix climbs",Associated Press
Oct-17-18,"Dow Slips for Fifth Day in Seven, Led Lower by IBM, Home Depot",TheStreet.com
Oct-17-18,Jim Cramer Dives Into Cannabis and IBM Earnings,TheStreet.com
Oct-17-18,"Notable Stocks Moving After Earnings: NFLX, IBM, USB & More",Zacks
Oct-17-18,IBM Results Fail to Impress,Morningstar
Oct-17-18,"Bezos: If big tech turns its back on the Pentagon, 'this country is going to be in trouble'",American City Business Journals
Oct-17-18,IBM's Stock Looks Like a Value Trap Unless Revenue Growth Improves,TheStreet.com
Oct-17-18,[$$] IBM Shares Slide as Revenue Drop Renews Concerns,The Wall Street Journal
Oct-17-18,IBM Earnings: More Good Than Bad,Motley Fool
Oct-17-18,IBM VP of Threat Intelligence on The Steps to Take After a Cyber Attack,TheStreet.com
Oct-17-18,Why IBM Stock Tumbled Today,Motley Fool
Oct-17-18,Stock Market News Daily Roundup October 17,Market Exclusive
Oct-17-18,"IBM Beats on Q2 Earnings, Stock Down on Top-Line Decline",Zacks
Oct-17-18,"IBM's stock heads for worst day in 6 months, lowest price since early 2016",MarketWatch
Oct-17-18,IBM's Chart Looks Busted Following Earnings,TheStreet.com
Oct-17-18,IBM: Has Big Blue Become Big Red?,TheStreet.com
Oct-17-18,The Top 5 IBM Shareholders,Investopedia
Oct-17-18,IBM to Hold Cybersecurity Training in New Mobile Command Center on National Mall,PR Newswire
Oct-17-18,"Stocks are sinking early on, giving back some of a big gain",Associated Press
Oct-17-18,IBM Falls Most in Four Years After Quarterly Earnings Disappoint,Bloomberg
Oct-17-18,US STOCKS-Wall St slips as IBM disappoints; Fed minutes awaited,Reuters
Oct-17-18,"Dow falls to session lows as Home Depot Inc., IBM stocks deliver 110-point headwind",MarketWatch
Oct-17-18,IBM Is Feeling Blue Over Its Stock Price,TheStreet.com
Oct-17-18,Is student loan assistance the next 401k?,American City Business Journals
Oct-17-18,IBM's stock is exacting a roughly 70-point toll on the Dow Jones Industrial Average,MarketWatch
Oct-17-18,IBM slides at the open after revenue miss,CNBC
Oct-17-18,IBM Slides After Q3 Revenue Miss as Turnaround Stalls,TheStreet.com
Oct-17-18,"[$$] Stocks to Watch: Netflix, IBM, United Continental, Facebook, Tesla",The Wall Street Journal
Oct-17-18,"IBM CFO: Deals, divestments part of 'critical strategy' for Big Blue",American City Business Journals
Oct-17-18,"Stocks making the biggest move premarket: NFLX, IBM, CSX, UAL, TEVA & more",CNBC
Oct-17-18,"Netflix, IBM, Legal Pot in Canada, Mega Millions - 5 Things You Must Know",TheStreet.com
Oct-17-18,IBM's stock drop would shave nearly 50 points off the Dow's price,MarketWatch
Oct-17-18,The Morning Download: IBM CEO Says AI for Business Raises Unique Challenges,The Wall Street Journal
Oct-17-18,"IBM is shrinking again, and so is its stock price",MarketWatch
Oct-17-18,IBM will not see strong growth for another 4 to 5 quarter...,CNBC Videos
Oct-17-18,"Paul Allen's passions: Rock n' roll, sports and philanthropy",Associated Press
Oct-18-18,IBM's cybersecurity tractor-trailer rolled up to the National Mall. Hackers should take note.,American City Business Journals
Oct-18-18,IBM Snags $240 Million AI Deal,Motley Fool
Oct-18-18,"Stocks Dive, Dow Loses 300 Points As Apple, Caterpillar Weigh",Investor's Business Daily
Oct-18-18,Data project aims to stop human trafficking before it occurs - organisers,Reuters
Oct-18-18,52-Week Company Lows,GuruFocus.com
Oct-18-18,"As Pentagon Cloud Computing Bid Deadline Nears, Google Drops Out, IBM Protests",Benzinga
Oct-18-18,Is It Time to Give Up on International Business Machines (IBM)?,Motley Fool
Oct-18-18,BRIEF-IBM Services Signs $240 Mln Agreement With Lenovo,Reuters
Oct-18-18,"Danaher Earnings, Revenue beat in Q3",Investing.com
Oct-18-18,IBM Services Signs $240M Agreement with Lenovo to Help Drive the Future of its Call Centers with Artificial Intelligence,PR Newswire
Oct-18-18,"IBM, Stop the Traffik, Western Union, Barclays, Lloyd's Banking Group, Liberty Global, Europol and University College London Unveil International Data Hub to Combat Human Trafficking",PR Newswire
Oct-18-18,Todays Research Reports on Stocks to Watch: IBM and Apple,ACCESSWIRE
Oct-18-18,Lufthansa and IBM Collaborate for AI-Powered Ad Campaign,PR Newswire
Oct-18-18,IBMs stock falls to close at early 2016 levels as investors impatient with turnaround,MarketWatch
Oct-18-18,Jim Cramer Dives Into Cannabis and IBM Earnings,TheStreet.com
Oct-19-18,IBM's cybersecurity semi is rolling into Austin,American City Business Journals
Oct-19-18,"It was a wild week on Wall Street, here are the moves the...",CNBC Videos
Oct-19-18,Can the new 'blockchain music festival' in Berkeley lure concertgoers with cryptocurrency?,American City Business Journals
Oct-19-18,IBM Results Leave Investors Feeling Blue,Motley Fool
Oct-19-18,IBM Watson head to leave role: report,MarketWatch
Oct-19-18,Nothing Short of a Top-Down Shakeup Can Save IBM Stock,InvestorPlace
Oct-19-18,Why IBMs Brief Growth Streak Just Stalled,Motley Fool
Oct-19-18,"Netflix Keeps Surging, IBM Stops Surging",Motley Fool
Oct-19-18,London gold association plans to approve blockchain trackers,Reuters
Oct-22-18,Shares of downtrodden IBM 'ready to roar higher': Charts,CNBC Videos
Oct-22-18,Cramer's charts suggest shares of the downtrodden IBM are...,CNBC Videos
Oct-22-18,Cramer Remix: VF Corp is poised for a breakout once it ditches denim,CNBC
Oct-22-18,Cramer's charts suggest shares of the downtrodden IBM are 'ready to roar higher',CNBC
Oct-22-18,IBM (IBM) Gains As Market Dips: What You Should Know,Zacks
Oct-22-18,3 Dividend Stocks to Fund Your Retirement Nest Egg,Motley Fool
Oct-22-18,"Market Trends Toward New Normal in DryShips, Royal Caribbean Cruises, The Walt Disney, Geopark, International Business Machines, and Humana  Emerging Consolidated Expectations, Analyst Ratings",GlobeNewswire
Oct-23-18,Sifting through the earnings wreckage,CNBC Videos
Oct-23-18,President Bill Clinton Joins Call for Code as Finalists Revealed Ahead of Global Prize Celebration,PR Newswire
Oct-23-18,5 Deeply Discounted Value Stocks That Haven't Been This Cheap in at Least a Decade,Motley Fool
Oct-24-18,IBM Falls 3%,Investing.com
Oct-24-18,Bausch + Lomb To Launch First-In-Class Surgical Support Applications For Stellaris Elite Vision Enhancement System On IBM Cloud,PR Newswire
Oct-24-18,Travelport and IBM working to disrupt travel industry with new innovations,PR Newswire
Oct-25-18,Whirlpool Corporation Teams with IBM Services to Manage Global Operations on the Cloud,PR Newswire
Oct-25-18,"Kyocera Taps IBM Services for a Flexible, Cost Effective Cloud Environment",PR Newswire
Oct-25-18,Western Europe's November temperatures will be below normal-The Weather Company,Reuters
