date,title,source
Nov-12-18,Weekly CEO Buys Highlight,GuruFocus.com
Nov-12-18,"Inside IBM's Zurich lab, where scientists are creating technology that could break the bank",The Telegraph
Nov-13-18,IBM (IBM) Stock Moves -0.04%: What You Should Know,Zacks
Nov-13-18,EBay is the latest tech giant to end forced arbitration of sexual harassment at work,American City Business Journals
Nov-13-18,Here's How M&As Are Giving Cloud Services a Boost,Zacks
Nov-13-18,"IBM CEO Ginni Rometty hopes &quot;new collar&quot; skills will bridge digital, AI divide",CBS News Videos
Nov-13-18,Could Red Hat deal be a 'distraction' for IBM? Unisys CEO hopes so,American City Business Journals
Nov-13-18,[$$] Correction: P-Tech high school,Financial Times
Nov-14-18,Fairfax's Prem Watsa Goes 2 for 2 in 3rd Quarter,GuruFocus.com
Nov-14-18,A JEDI contract protest has been emphatically denied,American City Business Journals
Nov-14-18,7 Highest-Yielding Dow Dividend Stocks,Kiplinger
Nov-14-18,GAO denies Oracle's protest over Pentagon $10 billion cloud contract,MarketWatch
Nov-14-18,Amazon's 2nd GovCloud Region to Boost Government Clientele,Zacks
Nov-14-18,[$$] Shipping groups plot a course for digital collaboration,Financial Times
Nov-14-18,Leading European Companies Select IBM Blockchain to Drive Innovation,PR Newswire
Nov-15-18,HP Enterprise chief tech officer on Houston's talent: 'I would stack it up against any city in the world',American City Business Journals
Nov-15-18,IBM (IBM) Down 10.3% Since Last Earnings Report: Can It Rebound?,Zacks
Nov-15-18,"Thursdays Vital Data: Apple, IBM and Canopy Growth Corp",InvestorPlace
Nov-15-18,Oracle dealt major setback in legal challenge to $10B Pentagon contract,American City Business Journals
Nov-16-18,3 Top Artificial Intelligence Stocks to Watch in November,Motley Fool
Nov-16-18,IBM Introduces New Services to Automate Cloud Migration,PR Newswire
Nov-16-18,IBM Expands Its Partnership with ServiceNow to Serve Multicloud Enterprises,PR Newswire
Nov-16-18,"Black Friday bargain stocks: Consider Ford, Intel and three others",MarketWatch
Nov-19-18,IBM (IBM) Stock Moves -1.04%: What You Should Know,Zacks
Nov-19-18,3 Top Blockchain Stocks to Watch in November,Motley Fool
Nov-20-18,Taiwan Semiconductor Manufacturing Company Looks Set to Win IBM Chip Orders,Motley Fool
Nov-20-18,MarketPulse: Nvidia Rally Shelters Semis From Selloff,Investing.com
Nov-20-18,"After a Disastrous Run, IBM Stock Is Too Cheap to Ignore",InvestorPlace
Nov-20-18,[$$] Nielsen Holdings Names IBM's David Kenny as CEO,The Wall Street Journal
Nov-20-18,Bitcoin News Crypto Currency Daily Roundup November 20,Market Exclusive
Nov-20-18,"Nielsen names IBM's David Kenny new CEO, effective Dec. 3",MarketWatch
Nov-21-18,"Wednesdays Vital Data: Apple, Applied Materials and IBM",InvestorPlace
Nov-21-18,"MEDIA ALERT: IBM Holiday Retail Forecast - U.S. Retail Industry Sees Nearly 5% Growth in 2018, Strong Holiday Shopping Season Predicted",PR Newswire
Nov-23-18,"Bitcoin review: IBM joins Columbia University, crypto prices tumble",American City Business Journals
Nov-26-18,VMware (VMW) to Report Q3 Earnings: What's in the Cards?,Zacks
Nov-26-18,[$$] IBM CEO Criticizes Big Internet Platforms for Mishandling Customers' Data,The Wall Street Journal
Nov-26-18,"IBM, Goldcorp seek gold with Watson-based mining product",American City Business Journals
Nov-26-18,IBM CEO Ginni Rometty calls for regulation of consumer-facing tech companies,CNBC
Nov-26-18,IBM CEO Ginni Rometty calls consumer tech companies 'irresponsible',CNBC
Nov-26-18,IBM CEO Joins Apple in Blasting Data Use by Silicon Valley Firms,Bloomberg
Nov-26-18,52-Week Company Lows,GuruFocus.com
Nov-26-18,Goldcorp and IBM Develop New AI Technology Solution to Improve Predictability for Gold Mineralization,CNW Group
Nov-27-18,Amazon Cyber Monday Sales Highlight its Expanding Advertising Business,Zacks
Nov-27-18,IBM CEO joins calls for regulating consumer tech companies,Fox Business Videos
Nov-27-18,"Amid $34B IBM buyout, Red Hat makes its own acquisition",American City Business Journals
Nov-27-18,The Cloud Tailwinds for Alibaba Stock Shouldnt Be Forgotten,InvestorPlace
Nov-27-18,IBM's Rometty calls for transparency regulation,CNBC Videos
Nov-27-18,IBM CEO Joins Apple in Blasting Data Use by Silicon Valley,Bloomberg
Nov-28-18,5 Deep-Value Stocks to Invest In,InvestorPlace
Nov-28-18,"Salesforce (CRM) Beats on Q3 Earnings, Raises FY19 View",Zacks
Nov-28-18,IBM Talent Business Uses AI To Rethink The Modern Workforce,PR Newswire
Nov-28-18,"IBM, MIT helping companies adapt to AI",Fox Business Videos
Nov-28-18,"Amazon's ARM Adoption Lends Competitive Edge Over GOOGL, MSFT",Zacks
Nov-28-18,The Red Hat Acquisition Could Do Wonders for IBM Stock,InvestorPlace
Nov-28-18,"Microsoft set to become most valuable company again after 16-year hiatus, but don't count Apple out",CNBC
Nov-28-18,IBM QRadar Advisor with Watson Expands Knowledge of Cybercriminal Techniques,PR Newswire
Nov-29-18,IBM (IBM) Dips More Than Broader Markets: What You Should Know,Zacks
Nov-30-18,Investment Loss Dings VMware's Bottom Line,Motley Fool
Nov-30-18,Better Long-Term Buy: Amazon (AMZN) vs. Microsoft (MSFT) Stock,Zacks
Nov-30-18,Thinking of protesting a government contract? You may want to pursue this argument.,American City Business Journals
Nov-30-18,Heres the Simple Reason Why I Think IBM Stock Is Dead Money,InvestorPlace
Nov-30-18,The New Amazon Blockchain Products Could Be Huge for AMZN,InvestorPlace
Nov-30-18,"VMware (VMW) Tops Earnings Estimates in Q3, Raises FY19 View",Zacks
Nov-30-18,"Report: Developing Opportunities within Gol Linhas Aereas Inteligentes S.A., Duluth, International Business Machines, Lam Research, Red Hat, and Weatherford International  Future Expectations, Projections Moving into 2018",GlobeNewswire
Dec-03-18,GS Mortgage Securities Trust 2016-GS4 -- Moody's affirms seven classes of GSMS 2016-GS4,Moody's
Dec-03-18,Better Buy: IBM vs. Coca-Cola,Motley Fool
Dec-04-18,"Berkshire Hathaway Has Given Up on IBM, but Recent Acquisition May Resuscitate Big Blue",GuruFocus.com
Dec-04-18,IBM Falls 3%,Investing.com
Dec-04-18,Tech company looking to hire more than 50 at Plano hub next year,American City Business Journals
Dec-04-18,"Blockchain companies go silent when their tech promises fall short, research group finds",MarketWatch
Dec-04-18,Thought Machine Names IBM Services as Global Implementation Partner,PR Newswire
Dec-04-18,[$$] Big Tech's Deal Risk Isn't Over,The Wall Street Journal
Dec-06-18,IBM to sell some of its software products to HCL for $1.8 billion,Reuters
Dec-06-18,White House huddles with tech execs on future of jobs,Reuters
Dec-06-18,HCL Technologies to Acquire Select IBM Software Products for $1.8B,PR Newswire
Dec-06-18,IBM to sell some of its software products to HCL for $1.8 billion,Reuters
Dec-06-18,IBM to sell some of its software products to HCL for $1.8 billion,Reuters
Dec-06-18,IBM to sell some of its software products to HCL for $1.8 bln,Reuters
Dec-06-18,HCL Technologies to Acquire Select IBM Software Products for $1.8B,PR Newswire
Dec-06-18,IBM (IBM) Gains As Market Dips: What You Should Know,Zacks
Dec-06-18,Data privacy needs to be harmonized globally after GDPR b...,CNBC Videos
Dec-06-18,Tech execs at White House field ideas for US dominance,Associated Press
Dec-06-18,The Latest: Trump greets tech execs at White House,Associated Press
Dec-06-18,Here's What to Expect from Oracle's (ORCL) Earnings,Zacks
Dec-06-18,[$$] What Exactly Is Artificial Intelligence?,The Wall Street Journal
Dec-06-18,White House to huddle with tech execs on future of jobs,Reuters
Dec-06-18,3 Things Zebra Technologies' CEO Wants You to Know,Motley Fool
Dec-06-18,This Quiet Corner of the Bond Market Is Getting Riskier,Barrons.com
Dec-07-18,IBM Raises Cash Ahead of Megadeal,Motley Fool
Dec-07-18,GSA appoints director of Technology Transformation Services,American City Business Journals
Dec-07-18,IBM Falls 3%,Investing.com
Dec-07-18,IBM selling Indian tech company $1.8 billion in software products,American City Business Journals
Dec-07-18,IBM Sells Software Portfolio to India's HCL Technologies,TheStreet.com
Dec-07-18,HCL Drops Most in Seven Weeks on $1.8 Billion IBM-Asset Buy,Bloomberg
Dec-07-18,"In biggest Indian IT deal, HCL Tech to buy $1.8 billion of IBM software",Reuters
Dec-10-18,Theres a new legal twist in the JEDI procurement,American City Business Journals
Dec-11-18,"MERGER ALERT  RHT, PVAC and ATHN: Levi & Korsinsky, LLP Reminds Investors of Investigations Concerning the Sale of these Companies",GlobeNewswire
Dec-11-18,Here's Why Microsoft (MSFT) Stock Looks Like a Buy Right Now,Zacks
Dec-11-18,IBM Elects Martha E. Pollack to Its Board of Directors,Business Wire
Dec-11-18,IBM exec: Why buying Red Hat is better than partnership,American City Business Journals
Dec-12-18,Dell Gains Approval to Repurchase VMware (VMW) Tracking Stock,Zacks
Dec-12-18,IBM (IBM) Gains But Lags Market: What You Should Know,Zacks
Dec-12-18,"Server Market Data for Q3 Out, Dell Holds Top Spot Per IDC",Zacks
Dec-12-18,"IBM Study: Blockchain Brings Trust to How Companies, Consumers and Cars Connect",PR Newswire
Dec-13-18,Cramer's lightning round: I see Walmart's stock going higher,CNBC
Dec-13-18,Buy Amazon (AMZN) Stock on the Dip Heading into 2019?,Zacks
Dec-13-18,The DOD is defending its JEDI procurement  and AWS has joined that defense,American City Business Journals
Dec-13-18,Oracle files suit over $10B winner-takes-all Pentagon cloud contract Amazon is favored to land,American City Business Journals
Dec-13-18,Red Hat (RHT) Set to Report Q3 Earnings: What's in Store?,Zacks
Dec-13-18,Red Hat proxy shows 'opportunity' for upset bids in IBM deal,American City Business Journals
Dec-13-18,"Warren Buffett, IBM and Other Hedge Funds",GuruFocus.com
Dec-13-18,IBM Delivers 100+ SAP S/4HANA Enterprise Transformations,PR Newswire
Dec-14-18,This Plunge in Adobe Stock Is Your Buying Opportunity,InvestorPlace
Dec-17-18,IBM Falls 3%,Investing.com
Dec-17-18,Heres an evergreen strategy to make money in a volatile stock market,MarketWatch
Dec-17-18,Why Red Hats Q3 Earnings Report Should Be Good,InvestorPlace
Dec-17-18,3 Big Trends to Play in 2019,InvestorPlace
Dec-17-18,IBM Watson Marketing Releases 2019 Marketing Trends Report Focused on Emerging Trends Redefining the Profession in the Shift to AI,PR Newswire
Dec-17-18,"Gophers Avant! AI Answers User Questions About Stock Market, Bitcoin, Cannabis, Apples Siri and More",GlobeNewswire
Dec-17-18,Catalina Taps IBM Analytics to Aid in Digital Transformation,PR Newswire
Dec-18-18,IBM (IBM) Outpaces Stock Market Gains: What You Should Know,Zacks
Dec-18-18,Shareholder files suit over IBM-Red Hat deal,American City Business Journals
Dec-18-18,Red Hat's 3rd-Quarter Results: What You Need to Know,GuruFocus.com
Dec-18-18,IBM Analytics to Facilitate Catalina's Digital Overhaul,Zacks
Dec-18-18,Rapid-Fire Pitch: eShipGlobal,Benzinga
Dec-18-18,2 Analysts React To Red Hat's Q3 Earnings Print,Benzinga
Dec-18-18,"Red Hat (RHT) Q3 Earnings Beat Estimates, Revenues Up Y/Y",Zacks
Dec-18-18,Is IBM (IBM) a Great Value Stock Right Now?,Zacks
Dec-18-18,Heres an evergreen strategy to make money in a volatile stock market,MarketWatch
Dec-19-18,H-1B Visa to Green Card Backlog: Why Tech Companies Demand Change,Investopedia
Dec-19-18,Stock News: Techs Fade After Fed Statement; Facebook Slammed Again,Investor's Business Daily
Dec-19-18,Artificial intelligence is making it easier to describe smells,Quartz
Dec-20-18,[$$] U.S. Charges China Intelligence Officers Over Hacking Companies and Agencies,The Wall Street Journal
Dec-20-18,"U.S., allies slam China for economic espionage, spies indicted",Reuters
Dec-21-18,How IBM's new fingernail sensor can improve your health,Fox Business Videos
Dec-21-18,"IBM Services to Help Corinthians, One of Brazil's Largest Soccer Clubs, to Personalize Fan Experience Journey with Artificial Intelligence",PR Newswire
Dec-21-18,Stocks - Wall Street Cautiously Higher on Witching Day Amid Shutdown War of Words,Investing.com
Dec-21-18,"Stocks - Nike, Cintas Soar in Premarket; CarMax, CalAmp Sink; Goldman Falls",Investing.com
Dec-21-18,Is 2019 Going to End the Bad Spell for IBM?,Zacks
Dec-21-18,Here are stock losers to buy today  because others are selling them for tax purposes,MarketWatch
Dec-21-18,IBM Taps Samsung for Chip Manufacturing,Motley Fool
Dec-21-18,"Amid $34B IBM deal, Red Hat goes to court to squash infringement allegations",American City Business Journals
Dec-21-18,"Stocks making the biggest moves premarket: KMX, NKE, HPE, IBM, CPB & more",CNBC
Dec-21-18,ETF Scorecard: Annual Review of Major Indexes,ETF Database
Dec-21-18,"China denies ""slanderous"" economic espionage charges from U.S., allies",Reuters
Dec-21-18,How IBM is using A.I. for marketing,CNBC
Dec-24-18,IBM Falls 3%,Investing.com
Dec-24-18,IBMs Debt and Deal Make the Stock a Big Loser Again,Barrons.com
Dec-24-18,The most important tech stories of 2018  in tweets,CNBC
Dec-26-18,IBM Rises 3%,Investing.com
Dec-26-18,Here Are The 5 Best Dividend Stocks On The Dow Jones Average By Yield,Investor's Business Daily
Dec-26-18,Amazon Posts Record-Breaking Holiday Sales: Time to Buy AMZN Stock?,Zacks
Dec-26-18,Five Year-End Bargains,MoneyShow
Dec-27-18,"[$$] Former AmEx Boss Chenault Leaving IBM, P&G Boards",The Wall Street Journal
Dec-27-18,Stocks - Market Stages a Serious Late-Day Rally to Close Higher,Investing.com
Dec-27-18,"After-hours buzz: Aphria, IBM and P&G",CNBC
Dec-27-18,"Former AmEx Chief Ken Chenault Leaves Director Posts at P&G, IBM",Bloomberg
Dec-27-18,These Are The 5 Worst Dow Jones Stocks Of 2018 As Index Eyes Yearly Dip,Investor's Business Daily
Dec-27-18,GuruFocus Interviews of 2018,GuruFocus.com
Dec-27-18,How the Express Scripts merger stacks up against the top M&A deals of the year,American City Business Journals
Dec-27-18,"On SMEs, Globalization, and the Role of Blockchain-Powered Supply Chain Management",Benzinga
Dec-27-18,IBM's Focus on Digital Overhaul of Sports Holds Promise,Zacks
Dec-28-18,IBM (IBM) Dips More Than Broader Markets: What You Should Know,Zacks
Dec-28-18,GuruFocus Interviews of 2018,GuruFocus.com
Dec-28-18,IBM: Why I Would Be Barking Mad to Invest in This Dow 'Dog',TheStreet.com
Dec-28-18,"[$$] Stocks to Watch: Tesla, IBM, P&G, AMD, Nvidia and Salesforce",The Wall Street Journal
Dec-28-18,Fund Rebalancing Will Drive These Markets: Market Recon,TheStreet.com
Dec-28-18,Ken Chenault to step down from P&G and IBM boards,CNBC Videos
Dec-31-18,These Are The 5 Worst Dow Jones Stocks Of 2018 As Index Eyes Yearly Dip,Investor's Business Daily
Dec-31-18,"Dow Jones Leads Gains, But Confident Volume Is Missing",Investor's Business Daily
Dec-31-18,Behind the Computer: A Look at the History of IBM,TheStreet.com
Dec-31-18,Buy IBM Stock as It Begins 2019 as the Cheapest Dow Component,TheStreet.com
Dec-31-18,5 Dogs of the Dow Stocks for 2019,Zacks
Dec-31-18,IBM Stock: One of the Most Attractive Yields in Tech,InvestorPlace
Jan-02-19,How this SaaS company struck gold on its third business plan after two failures,American City Business Journals
Jan-02-19,The 3 Worst Stocks in the Dow Jones in 2018,Motley Fool
Jan-02-19,"[$$] CIOs Prioritize Intersection of AI, Business Process",The Wall Street Journal
Jan-02-19,Stay with IBM? What's up with Blackstone? That and more i...,CNBC Videos
Jan-02-19,"The Zacks Analyst Blog Highlights: IBM, ExxonMobil, Verizon, Chevron and Coca-Cola",Zacks
Jan-02-19,Top Picks 2019- International Business Machines IBM,MoneyShow
Jan-02-19,AI is increasing understanding of customers at IBM,CNBC Videos
Jan-02-19,Sponsorship and TV lies at the heart of marketing efforts...,CNBC Videos
Jan-03-19,"Jim Cramer: 7 Winning Stocks in Q4, and Where They Stand for 2019",TheStreet.com
Jan-03-19,IBM (IBM) Stock Moves -1.98%: What You Should Know,Zacks
Jan-03-19,"Cloudera completes Hortonworks deal, but investors aren't convinced",American City Business Journals
Jan-03-19,Computer Integrated Systems Outlook: Growth Remains Steady,Zacks
Jan-03-19,Apple plunge deepens Warren Buffett's book value woes,Reuters
Jan-03-19,"New Prediction Feature for Hypoglycemia Now Available in Sugar.IQ(TM) Personal Diabetes Assistant App, Developed by Medtronic and IBM Watson Health",GlobeNewswire
Jan-04-19,The Latest: Weather Channel app denies data wrongdoing,Associated Press
Jan-04-19,Why a Data Privacy Lawsuit May Have Implications for Investors,Barrons.com
Jan-04-19,Los Angeles Sues IBM Over its Weather App,Meredith Videos
Jan-04-19,Coppell company to buy IBM mortgage servicing platform,American City Business Journals
Jan-04-19,IBM Rises 3%,Investing.com
Jan-04-19,"IBM CEO Ginni Rometty Delivers Opening Keynote at CES 2019 on What's Next in Artificial Intelligence, Blockchain and Quantum Computing",PR Newswire
Jan-07-19,"The JEDI war: Amazon, Oracle and IBM battle in mysterious world of military contracts",MarketWatch
Jan-07-19,8 Stocks To Outperform In An Uncertain Market,Investopedia
Jan-07-19,Morgan Stanley set to make millions upon closing of IBM-Red Hat deal,American City Business Journals
Jan-07-19,"Buy Amazon (AMZN) Stock On Rising Profits, Before 2019 Comeback?",Zacks
Jan-07-19,Goldman Sachs sees these high-quality stocks as the market leaders in 2019,CNBC
Jan-07-19,Artificial Intelligence Is About to Make a Splash at CES 2019,Barrons.com
Jan-08-19,"Big Tech to Consumers: You Can Trust Us, Really",Barrons.com
Jan-08-19,"""Deep Data"" To Become The Greatest Natural Resource, Tech Execs Say",Benzinga
Jan-08-19,"IBM continues its big bet on data with new weather, health-tech applications",MarketWatch
Jan-08-19,IBM Unveils Groundbreaking Quantum Computing System,Meredith Videos
Jan-08-19,"Quantum computing priority is materials, chemicals: IBM C...",CNBC Videos
Jan-08-19,"IBM Managers Discussed Ways to Thin Older Ranks, Documents Say",Bloomberg
Jan-08-19,"People want innovation and productivity at same time, say...",CNBC Videos
Jan-08-19,"U.S. initiative warns firms of hacking by China, other countries",Reuters
Jan-08-19,"U.S. initiative warns firms of hacking by China, other countries",Reuters
Jan-08-19,Jeremy Siegel: Stock Characteristics That Offer an Advantage,GuruFocus.com
Jan-08-19,"The JEDI war: Amazon, Oracle and IBM battle in mysterious world of military contracts",MarketWatch
Jan-08-19,CES responds to backlash with four women keynote speakers,American City Business Journals
Jan-08-19,Dogs of the Dow Win in 2018: Will ETFs See Success in 2019?,Zacks
Jan-08-19,The simple 'Dogs of the Dow' strategy topped the market for a fourth straight year,CNBC
Jan-08-19,IBM unveils world's first commercial quantum computer,The Telegraph
Jan-08-19,IBM Is U.S. Patent Leader for 26th Year Running,Investopedia
Jan-08-19,IBM Signs $540M services agreement with Nordic's Nordea Bank,PR Newswire
Jan-08-19,[$$] IBM unveils first standalone quantum computer,Financial Times
Jan-08-19,IBM's Innovations at CES 2019 Showcase What's Next in Technology Transforming the World,PR Newswire
Jan-08-19,New IBM Weather System to Provide Vastly Improved Forecasting Around the World,PR Newswire
Jan-08-19,IBM Unveils World's First Integrated Quantum Computing System for Commercial Use,PR Newswire
Jan-08-19,"IBM Earns Record 9,100 Patents in 2018, Tops U.S. Patent List",PR Newswire
Jan-08-19,ExxonMobil and World's Leading Research Labs Collaborate with IBM to Accelerate Joint Research in Quantum Computing,PR Newswire
Jan-08-19,China Increases U.S. Patent Holdings While IBM Keeps Top Spot,Bloomberg
Jan-09-19,Buy Microsoft (MSFT) Stock on the Dip Amid Apple (AAPL) Uncertainty?,Zacks
Jan-09-19,IBM (IBM) Outpaces Stock Market Gains: What You Should Know,Zacks
Jan-09-19,5 High-Yield Dividend Stocks to Watch,Motley Fool
Jan-09-19,IBM Hits the Ground Running in 2019,Motley Fool
Jan-09-19,Stocks & ETFs to Pick From Goldman Sachs' Favored List in 2019,Zacks
Jan-09-19,Value Added: 7 Top Stocks for 2019,Kiplinger
Jan-09-19,Jon Fortt breaks down first day interviews from CES 2019,CNBC Videos
Jan-09-19,[$$] IBM CEO Ginni Rometty's Algorithm for Working with AI,The Wall Street Journal
Jan-09-19,IBM Ups Game in AI & Blockchain Technology in CES 2019,Zacks
Jan-09-19,IBM Is U.S. Patent Leader for 26th Year Running,Investopedia
Jan-10-19,Why IBM Stock Fell 26% in 2018,Motley Fool
Jan-10-19,Here's Why Amazon (AMZN) Stock Looks Like A Strong Buy Right Now,Zacks
Jan-10-19,L.A. Joins the Growing Battle Over Location Data,City Lab NonHosted
Jan-10-19,Earnings Preview: IBM (IBM) Q4 Earnings Expected to Decline,Zacks
Jan-10-19,"Amazon Launches Document Database Service, Expands Portfolio",Zacks
Jan-10-19,Are Options Traders Betting on a Big Move in IBM Stock?,Zacks
Jan-10-19,Warren Buffett's Loss on Apple Isn't as Big as You Think,Motley Fool
Jan-11-19,IBM cuts 310 jobs in Durham after sale,American City Business Journals
Jan-11-19,Oracle Commerce Cloud Solution Adopted by Things Remembered,Zacks
Jan-11-19,AMD Stock Just Keeps Giving Us More to Look Forward To,InvestorPlace
Jan-14-19,"IBM, T-Systems to jointly offer mainframe services",Reuters
Jan-14-19,"IBM, T-Systems to jointly offer mainframe services",Reuters
Jan-14-19,IBM forecasts a federal market for weather model that uses smartphone data,American City Business Journals
Jan-14-19,Why Red Hat's Stock Rose 46.2% in 2018,Motley Fool
Jan-14-19,"Records show both IBM, NC had big expectations for shuttering RTP unit",American City Business Journals
Jan-14-19,A Look at Dow ETF Ahead of Q4 Earnings,Zacks
Jan-14-19,IBM to Reportedly Buy T-Systems' Mainframe Business Unit,Zacks
Jan-15-19,Cramer Remix: Don't take your cue on all of retail from Macy's,CNBC
Jan-15-19,IBM (IBM) Outpaces Stock Market Gains: What You Should Know,Zacks
Jan-15-19,Will Intel Be Upgraded to a Buy in 2019?,Zacks
Jan-15-19,IBM MaaS360 with Watson Among First-Ever Android Enterprise Recommended EMM Solutions,PR Newswire
Jan-15-19,Analysts Estimate IBM (IBM) to Report a Decline in Earnings: What to Look Out for,Zacks
Jan-15-19,IBM target cut at Instinet but stock remains firm's 'preferred defensive play',MarketWatch
Jan-15-19,IBM Showcases New AI Innovations at NRF 2019 to Help Retail Industry Accelerate Customer Experience,PR Newswire
Jan-15-19,Whats New for Artificial Intelligence in 2019?,GlobeNewswire
Jan-15-19,Former IBM Security execs launch new cloud data startup,American City Business Journals
Jan-16-19,[$$] WeWorks CEO Makes Millions as Landlord to WeWork,The Wall Street Journal
Jan-16-19,IBM Brings Blockchain Technology to Cobalt Mining,Motley Fool
Jan-16-19,99% of Red Hat shareholders: We want blue  Big Blue,American City Business Journals
Jan-16-19,Big Blue Looks Stronger in the Weeks Ahead - Go Long Here and on Strength,TheStreet.com
Jan-16-19,Ford and IBM use blockchain to combat child labour in Congo,The Independent
Jan-16-19,IBM Services Strikes Agreement with Juniper Networks to Speed its Journey to the Cloud,PR Newswire
Jan-16-19,An Analyst Called IBM Stock a Defensive Play. Hardly.,Barrons.com
Jan-16-19,7 Reasons Why Buffetts Bet on Apple Stock Is a Good One,InvestorPlace
Jan-16-19,"WeWork CEO owns some buildings WeWork leases, causing conflict of interest concerns",American City Business Journals
Jan-16-19,IBM Began 2019 as the Cheapest Dow Stock,Investopedia
Jan-16-19,Snap Stock: Why Would Its CFO Resign So Abruptly?,InvestorPlace
Jan-16-19,"Market Morning: Brexit Burn, New Anti-Cannabis AG, Cobalt On Blockchain, Microsoft on Healthcare",Market Exclusive
Jan-16-19,Ford and IBM among quartet in Congo cobalt blockchain project,Reuters
Jan-16-19,Ford and IBM among quartet in Congo cobalt blockchain project,Reuters
Jan-16-19,"Ford Motor Company, Huayou Cobalt, IBM, LG Chem and RCS Global Launch Blockchain Pilot to Address Concerns in Strategic Mineral Supply Chains",PR Newswire
Jan-17-19,IBM earnings: Emerging tech expected to account for half of sales as revenue declines,MarketWatch
Jan-17-19,"IBM to Run Vodafone's Cloud Business, Offer Solutions to Its European Customers",TheStreet.com
Jan-17-19,IBM Signs Two Big Cloud Deals,Motley Fool
Jan-17-19,"Amazon (AMZN) Q4 Earnings Preview: Revenue, AWS, Advertising &amp; Prime",Zacks
Jan-17-19,"In 5G play, Vodafone and IBM link up cloud systems for business",Reuters
Jan-17-19,IBM and Vodafone launch new European venture in bid to catch China and US in race to 5G,CNBC
Jan-17-19,"In 5G play, Vodafone and IBM link up cloud systems for business",Reuters
Jan-17-19,IBM Services to support digital transformation of Meiji Yasuda Life,PR Newswire
Jan-17-19,IBM & Vodafone Business Join Forces to Drive Innovation in Rapidly Changing World,PR Newswire
Jan-17-19,IBM to Aid Juniper to Enhance IT and Cloud Infrastructure,Zacks
Jan-17-19,Will Product Rollouts &amp; Deal Wins Aid IBM's Q4 Earnings?,Zacks
Jan-18-19,New Rules for This Market: Cramer's 'Mad Money' Recap (Friday 1/18/19),TheStreet.com
Jan-18-19,Key Takeaways from Q4 Earnings Results Thus Far,Zacks
Jan-18-19,What To Expect When IBM Reports Fourth-Quarter Earnings,Investor's Business Daily
Jan-18-19,The Dogs of the Dow 2019: 10 Dividend Stocks to Watch,Kiplinger
Jan-18-19,Analyst Casts Doubt on IBMs Hopes for Growth,Barrons.com
Jan-18-19,"Upcoming Earnings Reports to Watch: IBM, INTC, SBUX",Zacks
Jan-18-19,"[$$] Vodafone Enters Cloud Agreement With IBM, Keeping 5G in Mind",The Wall Street Journal
Jan-18-19,IBM earnings: Emerging tech expected to account for half of sales as revenue declines,MarketWatch
Jan-18-19,"IBM Inks Deal with Vodafone, Expands Cloud Presence in Europe",Zacks
Jan-22-19,IBM Gains After Beating Estimates: 6 Key Takeaways,TheStreet.com
Jan-22-19,[$$] IBM Beats Earnings Expectations Although Its Revenue Again Declines,The Wall Street Journal
