date,title,source
Oct-17-18,"Paul Allen's passions: Rock n' roll, sports and philanthropy",Associated Press
Oct-17-18,IBMs Cognitive Solutions Sales Slumped. What Happened?,Motley Fool
Oct-17-18,"Fighting Currency Headwinds, IBM Corp. Isn't Giving Up on Its Full-Year Goals",Motley Fool
Oct-17-18,IBM Shares Fall Hard a Day After Disappointing Earnings,TheStreet.com
Oct-17-18,Edited Transcript of IBM earnings conference call or presentation 16-Oct-18 9:00pm GMT,Thomson Reuters StreetEvents
Oct-17-18,[$$] IBM Shares Slide After Revenue Drop Renews Concerns,The Wall Street Journal
Oct-17-18,Jim Cramer: The Bulls Won the Night on Tuesday,TheStreet.com
Oct-17-18,IBMs stock falls to close at early 2016 levels as investors impatient with turnaround,MarketWatch
Oct-17-18,Dow Drops 91 Pointsand We Can Blame IBM,Barrons.com
Oct-17-18,What Happened in the Stock Market Today,Motley Fool
Oct-17-18,Stocks Slip as Fed Stays the Course,Investopedia
Oct-17-18,IBM Stock Takes a Dive as Revenue Falls Short,Barrons.com
Oct-17-18,Wall St. falls as investors eye a united hawkish Fed,Reuters
Oct-17-18,"PulteGroup, IBM and Fiat Chrysler fall while Netflix climbs",Associated Press
Oct-17-18,"Dow Slips for Fifth Day in Seven, Led Lower by IBM, Home Depot",TheStreet.com
Oct-17-18,Jim Cramer Dives Into Cannabis and IBM Earnings,TheStreet.com
Oct-17-18,"Notable Stocks Moving After Earnings: NFLX, IBM, USB & More",Zacks
Oct-17-18,IBM Results Fail to Impress,Morningstar
Oct-17-18,"Bezos: If big tech turns its back on the Pentagon, 'this country is going to be in trouble'",American City Business Journals
Oct-17-18,IBM's Stock Looks Like a Value Trap Unless Revenue Growth Improves,TheStreet.com
Oct-17-18,[$$] IBM Shares Slide as Revenue Drop Renews Concerns,The Wall Street Journal
Oct-17-18,IBM Earnings: More Good Than Bad,Motley Fool
Oct-17-18,IBM VP of Threat Intelligence on The Steps to Take After a Cyber Attack,TheStreet.com
Oct-17-18,Why IBM Stock Tumbled Today,Motley Fool
Oct-17-18,Stock Market News Daily Roundup October 17,Market Exclusive
Oct-17-18,"IBM Beats on Q2 Earnings, Stock Down on Top-Line Decline",Zacks
Oct-17-18,"IBM's stock heads for worst day in 6 months, lowest price since early 2016",MarketWatch
Oct-17-18,IBM's Chart Looks Busted Following Earnings,TheStreet.com
Oct-17-18,IBM: Has Big Blue Become Big Red?,TheStreet.com
Oct-17-18,The Top 5 IBM Shareholders,Investopedia
Oct-17-18,IBM to Hold Cybersecurity Training in New Mobile Command Center on National Mall,PR Newswire
Oct-17-18,"Stocks are sinking early on, giving back some of a big gain",Associated Press
Oct-17-18,IBM Falls Most in Four Years After Quarterly Earnings Disappoint,Bloomberg
Oct-17-18,US STOCKS-Wall St slips as IBM disappoints; Fed minutes awaited,Reuters
Oct-17-18,"Dow falls to session lows as Home Depot Inc., IBM stocks deliver 110-point headwind",MarketWatch
Oct-17-18,IBM Is Feeling Blue Over Its Stock Price,TheStreet.com
Oct-17-18,Is student loan assistance the next 401k?,American City Business Journals
Oct-17-18,IBM's stock is exacting a roughly 70-point toll on the Dow Jones Industrial Average,MarketWatch
Oct-17-18,IBM slides at the open after revenue miss,CNBC
Oct-17-18,IBM Slides After Q3 Revenue Miss as Turnaround Stalls,TheStreet.com
Oct-17-18,"[$$] Stocks to Watch: Netflix, IBM, United Continental, Facebook, Tesla",The Wall Street Journal
Oct-17-18,"IBM CFO: Deals, divestments part of 'critical strategy' for Big Blue",American City Business Journals
Oct-17-18,"Stocks making the biggest move premarket: NFLX, IBM, CSX, UAL, TEVA & more",CNBC
Oct-17-18,"Netflix, IBM, Legal Pot in Canada, Mega Millions - 5 Things You Must Know",TheStreet.com
Oct-17-18,IBM's stock drop would shave nearly 50 points off the Dow's price,MarketWatch
Oct-17-18,The Morning Download: IBM CEO Says AI for Business Raises Unique Challenges,The Wall Street Journal
Oct-17-18,"IBM is shrinking again, and so is its stock price",MarketWatch
Oct-17-18,IBM will not see strong growth for another 4 to 5 quarter...,CNBC Videos
Oct-17-18,"Paul Allen's passions: Rock n' roll, sports and philanthropy",Associated Press
Oct-18-18,IBM's cybersecurity tractor-trailer rolled up to the National Mall. Hackers should take note.,American City Business Journals
Oct-18-18,IBM Snags $240 Million AI Deal,Motley Fool
Oct-18-18,"Stocks Dive, Dow Loses 300 Points As Apple, Caterpillar Weigh",Investor's Business Daily
Oct-18-18,Data project aims to stop human trafficking before it occurs - organisers,Reuters
Oct-18-18,52-Week Company Lows,GuruFocus.com
Oct-18-18,"As Pentagon Cloud Computing Bid Deadline Nears, Google Drops Out, IBM Protests",Benzinga
Oct-18-18,Is It Time to Give Up on International Business Machines (IBM)?,Motley Fool
Oct-18-18,BRIEF-IBM Services Signs $240 Mln Agreement With Lenovo,Reuters
Oct-18-18,"Danaher Earnings, Revenue beat in Q3",Investing.com
Oct-18-18,IBM Services Signs $240M Agreement with Lenovo to Help Drive the Future of its Call Centers with Artificial Intelligence,PR Newswire
Oct-18-18,"IBM, Stop the Traffik, Western Union, Barclays, Lloyd's Banking Group, Liberty Global, Europol and University College London Unveil International Data Hub to Combat Human Trafficking",PR Newswire
Oct-18-18,Todays Research Reports on Stocks to Watch: IBM and Apple,ACCESSWIRE
Oct-18-18,Lufthansa and IBM Collaborate for AI-Powered Ad Campaign,PR Newswire
Oct-18-18,IBMs stock falls to close at early 2016 levels as investors impatient with turnaround,MarketWatch
Oct-18-18,Jim Cramer Dives Into Cannabis and IBM Earnings,TheStreet.com
Oct-19-18,IBM's cybersecurity semi is rolling into Austin,American City Business Journals
Oct-19-18,"It was a wild week on Wall Street, here are the moves the...",CNBC Videos
Oct-19-18,Can the new 'blockchain music festival' in Berkeley lure concertgoers with cryptocurrency?,American City Business Journals
Oct-19-18,IBM Results Leave Investors Feeling Blue,Motley Fool
Oct-19-18,IBM Watson head to leave role: report,MarketWatch
Oct-19-18,Nothing Short of a Top-Down Shakeup Can Save IBM Stock,InvestorPlace
Oct-19-18,Why IBMs Brief Growth Streak Just Stalled,Motley Fool
Oct-19-18,"Netflix Keeps Surging, IBM Stops Surging",Motley Fool
Oct-19-18,London gold association plans to approve blockchain trackers,Reuters
Oct-22-18,Shares of downtrodden IBM 'ready to roar higher': Charts,CNBC Videos
Oct-22-18,Cramer's charts suggest shares of the downtrodden IBM are...,CNBC Videos
Oct-22-18,Cramer Remix: VF Corp is poised for a breakout once it ditches denim,CNBC
Oct-22-18,Cramer's charts suggest shares of the downtrodden IBM are 'ready to roar higher',CNBC
Oct-22-18,IBM (IBM) Gains As Market Dips: What You Should Know,Zacks
Oct-22-18,3 Dividend Stocks to Fund Your Retirement Nest Egg,Motley Fool
Oct-22-18,"Market Trends Toward New Normal in DryShips, Royal Caribbean Cruises, The Walt Disney, Geopark, International Business Machines, and Humana  Emerging Consolidated Expectations, Analyst Ratings",GlobeNewswire
Oct-23-18,Sifting through the earnings wreckage,CNBC Videos
Oct-23-18,President Bill Clinton Joins Call for Code as Finalists Revealed Ahead of Global Prize Celebration,PR Newswire
Oct-23-18,5 Deeply Discounted Value Stocks That Haven't Been This Cheap in at Least a Decade,Motley Fool
Oct-24-18,IBM Falls 3%,Investing.com
Oct-24-18,Bausch + Lomb To Launch First-In-Class Surgical Support Applications For Stellaris Elite Vision Enhancement System On IBM Cloud,PR Newswire
Oct-24-18,Travelport and IBM working to disrupt travel industry with new innovations,PR Newswire
Oct-25-18,Whirlpool Corporation Teams with IBM Services to Manage Global Operations on the Cloud,PR Newswire
Oct-25-18,"Kyocera Taps IBM Services for a Flexible, Cost Effective Cloud Environment",PR Newswire
Oct-25-18,Western Europe's November temperatures will be below normal-The Weather Company,Reuters
Oct-26-18,Jack Ma says he 'hated' Bill Gates. Here's why and what changed his mind,CNBC
Oct-29-18,Sell or Hold Tight?: Cramer's 'Mad Money' Recap (Monday 10/29/18),TheStreet.com
Oct-29-18,[$$] IBMs Rometty Bets Her Legacy on Red Hat Deal,The Wall Street Journal
Oct-29-18,[$$] IBM Thinks Really Different with Red Hat,The Wall Street Journal
Oct-29-18,"Red Hat gave Google and other buyers a chance to bid before IBM's $34 billion offer, sources say",CNBC
Oct-29-18,IBM's Tip of the Hat,TheStreet.com
Oct-29-18,Microsoft vs. IBM: Can a $34B Acquisition Help IBM Return to Glory?,GoBankingRates
Oct-29-18,"Red Hat deal will grow cash flow, gross margins in first ...",CNBC Videos
Oct-29-18,Cramer Remix: This market is telling you its next victim,CNBC
Oct-29-18,[$$] IBM's Rometty Bets Her Legacy on Red Hat Deal,The Wall Street Journal
Oct-29-18,IBM CEO: Red Hat deal is a 'game-changer' that will grow ...,CNBC Videos
Oct-29-18,IBM CEO: Red Hat deal is a 'game-changer' that will grow cash flow and gross margins in first year,CNBC
Oct-29-18,Chart of the Day: IBM Stock Closes at Two-Year Low After Red Hat Deal,TheStreet.com
Oct-29-18,Here's how Red Hat can help IBM in the cloud and beyond,CNBC
Oct-29-18,Litecoin vs. Bitcoin: What's the Difference in 2018?,TheStreet.com
Oct-29-18,[$$] IBM's $33 Billion Red Hat Deal Part of Revival Plan,The Wall Street Journal
Oct-29-18,Business Highlights,Associated Press
Oct-29-18,Stocks tumble again on report US plans more tariffs,Associated Press
Oct-29-18,IBM Trying to Steer Clear of Bond Market's Triple-B Bogeyman,Bloomberg
Oct-29-18,IBM Pursues Amazon Into Cloud With $33 Billion Red Hat Deal,Bloomberg
Oct-29-18,IBM-Red Hat Deal Leaves Steep Premium as Merger Funds Stay Away,Bloomberg
Oct-29-18,"IBM's Red Hat acquisition is a 'desperate deal,' says analyst",CNBC
Oct-29-18,What Happened in the Stock Market Today,Motley Fool
Oct-29-18,Dow Falls 245 Points Because the Midterm Elections Arent Here Yet,Barrons.com
Oct-29-18,"IBMs record offer for Red Hat leaves analysts doubtful, but still speculating on bidding war",MarketWatch
Oct-29-18,"Bragar Eagel & Squire, P.C. is Investigating the Board of Directors of Red Hat, Inc. (RHT) on Behalf of Stockholders and Encourages RHT Investors to Contact the Firm",GlobeNewswire
Oct-29-18,Stocks tumble again on report US plans more tariffs,Associated Press
Oct-29-18,IBM Is Paying a Rich Price to Acquire Red Hat,Barrons.com
Oct-29-18,IBM Acquires Redhat: Now What?,GuruFocus.com
Oct-29-18,IBM's $34B Red Hat deal is risky bid to boost cloud business,Associated Press
Oct-29-18,"Markets Right Now: Stocks sink again, extending dismal month",Associated Press
Oct-29-18,"Dow, Nasdaq End Sharply Lower as Fears of Slowing Growth Weigh on Investors",TheStreet.com
Oct-29-18,IBM Credit LLC -- Moody's places IBM Credit senior unsecured and long term issuer ratings under review for downgrade,Moody's
Oct-29-18,Stocks finish lower as Dow sheds more than 200 points,MarketWatch
Oct-29-18,Software Stocks Waver Following IBM's Acquisition of Red Hat,TheStreet.com
Oct-29-18,IBM's $34-Billion Deal for Red Hat Is a Calculated Swing for the Fences,TheStreet.com
Oct-29-18,IBM Picks Up Much-Needed Developer Talent in $34 Billion Red Hat Deal,TheStreet.com
Oct-29-18,"Amazon shares are cratering  down 8% today, down 25% in the past three weeks",CNBC
Oct-29-18,"Red Hat jumps, IBM shares dip on cloud mega-merger",Reuters
Oct-29-18,The Triangle reacts to IBM's $34 billion buyout of Red Hat (Slideshow),American City Business Journals
Oct-29-18,Here are the six things that could ignite a rally in the stock market,MarketWatch
Oct-29-18,"In IBM's $34B Red Hat deal, Boston tech sector sees validation",American City Business Journals
Oct-29-18,T. Rowe Price funds stand to make millions off $34B IBM-Red Hat deal,American City Business Journals
Oct-29-18,Execs: Red Hat wants to remain 'Switzerland' when IBM deal closes,American City Business Journals
Oct-29-18,"After IBM-Red Hat, cloud companies such as Workday, Okta, MongoDB could be next, analysts say",CNBC
Oct-29-18,"US STOCKS-S&P 500 rebounds, helped by financials; Nasdaq in check",Reuters
Oct-29-18,"Stocks Attempt Rally, IBM Buys Red Hat, & Q3 Earnings Season Stays Hot",Zacks
Oct-29-18,IBM Puts on a Red Hat,GuruFocus.com
Oct-29-18,Shareholder (IBM) Alert: Johnson Fistel is Investigating International Business Machines Corporation for Potential Breaches of Fiduciary Duty by Its Board of Directors,PR Newswire
Oct-29-18,"The top tech acquisitions of all time, charted",Quartz
Oct-29-18,IBMs Debt Load Will Get Bigger After Red Hat,Barrons.com
Oct-29-18,Why Red Hat Inc. Stock Jumped 50% This Morning,Motley Fool
Oct-29-18,Dows Rally Loses Steam as Tech Stocks Fizzle,Barrons.com
Oct-29-18,Who's Next?: Acquisition Rumors Abound After IBM's $34 Billion Red Hat Splash,TheStreet.com
Oct-29-18,"IBM's $34 billion bid for Red Hat could be 'game changing,' Wall Street predicts",CNBC
Oct-29-18,IBM's $33 Billion Red Hat Deal Leaves Street Weighing Who's Next,Bloomberg
Oct-29-18,IBM Slides to 2-Year Low After $34 Billion Red Hat Deal; Moody's Warns on Rating,TheStreet.com
Oct-29-18,[$$] IBM Thinks Really Different with Red Hat,The Wall Street Journal
Oct-29-18,IBM Falls 5%,Investing.com
Oct-29-18,Software stocks jump as analysts bet surge of cloud M&A could follow IBM/Red Hat,MarketWatch
Oct-29-18,These 6 Software Stocks Could Be Takeover Targets After Red Hat Deal,Barrons.com
Oct-29-18,"Editor's Notebook: The $34 billion gamble on one person, one culture",American City Business Journals
Oct-29-18,Markets Right Now: US stocks surge following gains in Europe,Associated Press
Oct-29-18,US STOCKS-Wall St claws back as financials lead,Reuters
Oct-29-18,IBM to Enhance Hybrid Cloud Platform With $34B Red Hat Buy,Zacks
Oct-29-18,Beyond Red Hat  here are other cloud companies that could be takeover targets,MarketWatch
Oct-29-18,"Stocks - RedHat Soars in Pre-market, IBM Falls, Tesla, Ford Jump",Investing.com
Oct-29-18,"SHAREHOLDER ALERT: Levi & Korsinsky, LLP Notifies Investors of an Investigation Regarding Whether the Sale of Red Hat, Inc. to IBM for $190 Per Share is Fair to Shareholders",GlobeNewswire
Oct-29-18,Personal Income And Spending Brought Modestly Positive Numbers,Zacks
Oct-29-18,Boeing's stock a rare Dow decliner after Lion Air 737 MAX accident,MarketWatch
Oct-29-18,"US STOCKS-Wall St rebounds with help from auto, tech stocks",Reuters
Oct-29-18,"Dow races up 330 points and retakes 25,000, as the stock market extends Monday gains",MarketWatch
Oct-29-18,"Red Hat jumps, IBM shares dip on cloud mega-merger",Reuters
Oct-29-18,US stock indexes jump following big gains in Europe,Associated Press
Oct-29-18,Top 3 Mutual Fund Holders of IBM,Investopedia
Oct-29-18,"Stocks - U.S. Futures Higher Ahead of Earnings, Data",Investing.com
Oct-29-18,Dow climbs 250 points at the open as Wall Street shrugs of political instability to rebound; IBM to buy Red Hat,MarketWatch
Oct-29-18,Can Mergers Boost Tech Amid Trade War Woes?,Zacks
Oct-29-18,"IBM Not Shy About Approaching Redhat, October Stock Bounce: Trading Keys Today",TheStreet.com
Oct-29-18,US STOCKS-Wall St set to rebound after steep sell-off,Reuters
Oct-29-18,Here's How Big Blue's Charts Shape Up on Cusp of Red Hat Deal,TheStreet.com
Oct-29-18,S&P cuts IBM rating one notch on announced Red Hat acquisition,Reuters
Oct-29-18,Here's who benefits the most from IBM's $34B buy of Red Hat,American City Business Journals
Oct-29-18,Top 5 Things to Know in The Market on Monday,Investing.com
Oct-29-18,[$$] FirstFT: Todays top stories,Financial Times
Oct-29-18,The Morning Download: IBM-Red Hat Deal Bets Server Farm on Hybrid Cloud,The Wall Street Journal
Oct-29-18,"IBM Pays Up for Red Hat, Rally to End October?: Keys to Your Trading Day",TheStreet.com
Oct-29-18,IBM's Pricey Red Hat Deal Helps Put Pep in Market's Step,TheStreet.com
Oct-29-18,"Red Hat Takes Off, IBM Slips as Stocks Bounce Higher",Barrons.com
Oct-29-18,IBM's Red Hat Deal Increases Chase for Amazon's Cloud Crown,TheStreet.com
Oct-29-18,"US Stocks Set for Solid Rebound but Political Risks, Earnings Questions Linger",TheStreet.com
Oct-29-18,"Stocks making the biggest move premarket: IBM, RHT, HSBC, BLMN, FDC & more",CNBC
Oct-29-18,"Hortonworks, Nutanix among software stocks rising after IBM announces of Red Hat deal",MarketWatch
Oct-29-18,2 Plays on UnitedHealth Amid the Market Wreckage: Market Recon,TheStreet.com
Oct-29-18,US STOCKS-Futures slightly higher ahead of inflation data,Reuters
Oct-29-18,"IBM, Red Hat, Elon Musk, Walmart, Boston Red Sox - 5 Things You Must Know",TheStreet.com
Oct-29-18,"I'm not concerned about tariffs right now, says IBM CEO R...",CNBC Videos
Oct-29-18,This is best way for open source and our company to achie...,CNBC Videos
Oct-29-18,IBM Scoops Up Red Hat for $190 Per Share,Motley Fool
Oct-29-18,International Business Machines Corporation -- Moody's places IBM senior unsecured rating under review for downgrade,Moody's
Oct-29-18,"$33 billion IBM-Red Hat deal is 'a very fair price,' says...",CNBC Videos
Oct-30-18,[$$] Linux Cements Move to Business Mainstay From Maverick With IBM Deal,The Wall Street Journal
Oct-30-18,Jim Cramer: We Are Seeing the Power of Negative Thinking,TheStreet.com
Oct-30-18,IBM Falls 3%,Investing.com
Oct-30-18,"Stock Market Today: Dow Jumps 432 Points As Intel, Boeing Stocks Rally",Investor's Business Daily
Oct-30-18,Red Hat Stock Points to Wall Streets Worries Over the IBM Deal,Barrons.com
Oct-30-18,Why IBMs $34 Billion Acquisition of This Company Will Change How You Use Computers,GoBankingRates
Oct-30-18,The IBM and Red Hat deal: How stock sales cost an investor $1 billion,American City Business Journals
Oct-30-18,Can IBM Accept That Open Source Won the War?,InvestorPlace
Oct-30-18,Bulls Hoping IBM Buyback Opens the Spigot on Corporate Demand,Bloomberg
Oct-30-18,"IBM Adds $4 Billion to Share Buyback Plan, Confirms Dividend After Red Hat Deal",TheStreet.com
Oct-30-18,IBM's Red Hat Acquisition & The Future of Cloud Computing,Zacks
Oct-30-18,IBM to Buy Back Up to $4 Billion of Its Own Shares,Bloomberg
Oct-30-18,IBM announces $4 billion stock buyback program,CNBC Videos
Oct-30-18,4 ETFs to Tap IBM-Red Hat Potential Growth Deal,Zacks
Oct-30-18,IBM Board Approves Quarterly Cash Dividend; Authorizes $4 Billion for Stock Repurchase,Business Wire
Oct-30-18,"Tuesdays Vital Data: First Data Corp, Ford and IBM",InvestorPlace
Oct-30-18,Filings reveal what happens if IBM's Red Hat deal fails,American City Business Journals
Oct-30-18,"The Zacks Analyst Blog Highlights: International Business Machines, Red Hat, Amazon and Microsoft",Zacks
Oct-30-18,Does IBM's Big Red Hat Buy Put Its Dividend at Risk?,Motley Fool
Oct-30-18,[$$] IBM's Red Hat Deal Shows Linux's Rise to Business Mainstay,The Wall Street Journal
Oct-30-18,Todays Research Reports on Stocks to Watch: IBM and Red Hat,ACCESSWIRE
Oct-30-18,"Self Evolving Gophers (OTCQB: GOPH) AVANT! Takes on IBM Watson; Key Players in the Evolution Race of AI in the US and Globally; Intel, Qualcomm, Baidu, Alibaba",GlobeNewswire
Oct-30-18,IBM's Rometty Stakes Legacy on Risky $33 Billion Red Hat Deal,Bloomberg
Oct-30-18,The 5 Biggest Tech Deals of All Time,Investopedia
Oct-30-18,"IG Group names ex-Citi, IBM exec as CEO",Reuters
Oct-30-18,A look at the Dubai blockchain platform,CNBC Videos
Oct-30-18,Smart Dubai and IBM to Offer the First Government-Endorsed Blockchain Platform in the Middle East,PR Newswire
Oct-30-18,Asian markets rise as weaker yuan eases fear of more tariffs,Associated Press
Oct-30-18,IBMs Call for Code Prize Goes to a Team With Clusterducks,Wired
Oct-30-18,Winning Developer Solutions Announced in Inaugural Call for Code Global Challenge to Mitigate Effects of Natural Disasters,PR Newswire
Oct-31-18,IBM (IBM) Stock Sinks As Market Gains: What You Should Know,Zacks
Oct-31-18,'Time will tell' what IBM's Red Hat acquisition could mean for Colorado,American City Business Journals
Oct-31-18,'Time will tell' what IBM's Red Hat acquisition could mean for Colorado,American City Business Journals
Oct-31-18,Investors Didnt Want the Latest Investment-Grade Bonds,Barrons.com
Oct-31-18,Is IBM Really Resetting the Cloud Landscape With Its Red Hat Acquisition?,Motley Fool
Oct-31-18,IBM's RTP-based cloud leader talks Red Hat opportunity,American City Business Journals
Oct-31-18,IBM Stock Investors Dont Yet Get It  Red Hat Is a Game-Changer,InvestorPlace
Oct-31-18,These 3 Leading Tech Companies Just Took the Conversation in New Directions,Motley Fool
Oct-31-18,Blockchain's potential will continue to spur public and private investment,CNBC
Oct-31-18,[$$] Tech takes its hat off to open source,Financial Times
Oct-31-18,How Does IBM's Red Hat Acquisition Impact its 5% Dividend Yield?,Motley Fool
Oct-31-18,IBM and Berkshire Hathaway Highlight the Risk of Counting on Stock Buybacks,Barrons.com
Nov-01-18,"Bottom fishers, these stocks are within 5% of their 52-week lows",MarketWatch
Nov-01-18,IBM is paying $34 billion for a company that was founded by an unemployed guy working in a closet,CNBC
Nov-01-18,Buy the Wayfair dip? Can IBM recover? The answer to those...,CNBC Videos
Nov-01-18,"MERGER ALERT  RHT and PVAC: Levi & Korsinsky, LLP Reminds Investors of Investigations Concerning the Sale of these Companies",GlobeNewswire
Nov-01-18,"In a big year for open source, investors anoint HashiCorp as the next start-up to watch",CNBC
Nov-01-18,How Much Did International Business Machines Corporations (NYSE:IBM) CEO Pocket Last Year?,Simply Wall St.
Nov-01-18,Editor's Notebook: Raleigh on the losing side of IBM-Red Hat monster deal,American City Business Journals
Nov-01-18,CAIXA Commits to IBM Z Following Unprecedented Growth,PR Newswire
Nov-01-18,Ex-Microsoft boss Steve Ballmer's reaction on hearing of IBM's $34B plan to buy Red Hat: 'Whoa',American City Business Journals
Nov-01-18,CAIXA Commits to IBM Z Following Unprecedented Growth,PR Newswire
Nov-02-18,Marathon Petroleum Looks Like a Long-Run Winner,Barrons.com
Nov-02-18,"With Red Hat, IBM Makes a Big Cloud Promise. The Reality Is Far More Hazy.",Barrons.com
Nov-02-18,Red Hat CEO: 'There are no planned layoffs' with $34B IBM buyout,American City Business Journals
Nov-02-18,IBM Insiders Bought Stock Near a 9-Year Low,Barrons.com
Nov-02-18,3 Blue-Chip Stocks to Buy for Future Growth,InvestorPlace
Nov-02-18,"Will Apple Stall Market Rebound? & News from IBM, FB, SBUX",Zacks
Nov-02-18,"Dow 30 Stock Roundup: Apple, Coca-Cola, DowDuPont Earnings Impress",Zacks
Nov-02-18,Cover Story: How Red is Turning Blue: The effects of $34B IBM-Red Hat marriage,American City Business Journals
Nov-02-18,[$$] IBMs ultimate insider makes an uncharacteristic gamble,Financial Times
Nov-05-18,Insider Confidence: Cramer's 'Mad Money' Recap (Monday 11/5/18),TheStreet.com
Nov-05-18,Jim Cramer: Keep an Eye on the Insiders Who Are Buying,TheStreet.com
Nov-05-18,Cramer: Pay attention to recent insider buying at GE and IBM,CNBC
Nov-05-18,"RED HAT INVESTOR ALERT BY THE FORMER ATTORNEY GENERAL OF LOUISIANA: Kahn Swick & Foti, LLC Investigates Adequacy of Price and Process in Proposed Sale of Red Hat, Inc. - RHT",PR Newswire
Nov-05-18,"Apple Covering Up Hardware Numbers, and for Good Reason",Zacks
Nov-05-18,IBM CEO Rometty Buys Almost $3 Million in Company Stock,TheStreet.com
Nov-05-18,"Dow, S&P 500 Rally In Stock Market Today, But Why Did Apple Drop?",Investor's Business Daily
Nov-06-18,IBM Rises 3%,Investing.com
Nov-06-18,Cramer: IBM CEO Rometty Signaled 'Real Commitment' To Stock,Benzinga
Nov-06-18,Todays Research Reports on Stocks to Watch: IBM and Netflix,ACCESSWIRE
Nov-06-18,Insider Confidence: Cramer's 'Mad Money' Recap (Monday 11/5/18),TheStreet.com
Nov-06-18,IBM and VMware Advance Partnership to Accelerate Enterprise Hybrid Cloud Adoption and Digital Transformation,GlobeNewswire
Nov-07-18,Podcast: The IBM Hype Machine,Barrons.com
Nov-07-18,"Armstrong Shaw Associates Inc Buys Dell-VMWare Tracking Stock, Sells International Business ...",GuruFocus.com
Nov-07-18,"The World's Top 10 Tech Companies (AAPL, GOOGL)",Investopedia
Nov-07-18,IBM Traders See Stock Rising 10% Despite Weak Outlook,Investopedia
Nov-07-18,Why International Business Machines Corporation Stock Tumbled 24% Last Month,Motley Fool
Nov-07-18,"Stock Market News For Nov 7, 2018",Zacks
Nov-07-18,"Wednesdays Vital Data: General Motors, IBM and Wells Fargo",InvestorPlace
Nov-07-18,European Startups Select IBM Cloud to Drive Innovation,PR Newswire
Nov-07-18,What Kind Of Shareholder Owns Most International Business Machines Corporation (NYSE:IBM) Stock?,Simply Wall St.
Nov-08-18,Why Red Hat Inc. Shares Jumped 26% Higher Last Month,Motley Fool
Nov-08-18,"With Red Hat, IBM Makes a Big Cloud Promise. The Reality Is Far More Hazy.",Barrons.com
Nov-08-18,"This is what A.I. looks like, according to A.I.",CNBC
Nov-08-18,"Ancestry Adopts IBM Cloud, Advanced Analytics to Discover Business Insights",PR Newswire
Nov-08-18,"Triangle has 2 top-50 cardiovascular hospitals, IBM's Watson says",American City Business Journals
Nov-08-18,Seagate and IBM Work Together to Help Reduce Global Hard Drive Counterfeiting with Blockchain Technology,Business Wire
Nov-09-18,General Electric Takes Another Dive; IBM's Golden Goose Explained -- ICYMI,TheStreet.com
Nov-09-18,Does the Red Hat Deal Make IBM Stock Worth Buying?,InvestorPlace
Nov-09-18,"Continued, Reliable Improvements Make Microsoft Stock a Smart Choice",InvestorPlace
Nov-09-18,Why you should let your stock winners run and dump your losers ASAP,MarketWatch
Nov-12-18,Cisco Stock Is Ready to Prove That Its Comeback Is Real,InvestorPlace
Nov-12-18,Why SAP Stock Is Getting Hammered After Its Qualtrics Acquisition,InvestorPlace
Nov-12-18,7 Multi-Billion-Dollar Software Deals This Year,Investopedia
Nov-12-18,Bitcoin Inches Up; CFTC Fines Trader $1 Million for Crypto Fraud,Investing.com
