date,title,source
Mar-12-19,UK Startup Karantis360 Taps IBM Cloud for AI-Powered Assisted Living Solution,PR Newswire
Mar-13-19,Buy Amazon (AMZN) Stock on Earnings Growth &amp; E-commerce Dominance?,Zacks
Mar-13-19,How IBM is changing the face of blockchain,Coin Rivet
Mar-13-19,"IBM's top North Carolina exec talks 'Think Desk,' expansion and Red Hat",American City Business Journals
Mar-13-19,"If you invested $1,000 in IBM 10 years ago, here's how much you'd have now",CNBC
Mar-13-19,Facial recognition systems trained on millions of photos of people without their consent,The Independent
Mar-14-19,Jim Cramer: Underestimate Michael Dell At Your Peril,TheStreet.com
Mar-14-19,"French National Council of Clerks of Commercial Courts announce the deployment of a blockchain network developed by IBM, to streamline the management of commercial and corporate registry",PR Newswire
Mar-14-19,Hot Growth Ahead for LPSN Stock in 2019,InvestorPlace
Mar-14-19,The Timely Ten- Blue Chip Buys with Value and Yield,MoneyShow
Mar-14-19,"MongoDB, Inc. (MDB) Q4 2018 Earnings Conference Call Transcript",Motley Fool
Mar-15-19,Microsoft Is an Outstanding 'Boring' Investment,TheStreet.com
Mar-15-19,IBM Has Significant Problems,GuruFocus.com
Mar-15-19,"Hurd says Congress, local governments need to incentivize 5G",American City Business Journals
Mar-15-19,7 Best Quantum Computing Stocks Trading Today,InvestorPlace
Mar-15-19,Is International Business Machines (IBM) a Buy?,Motley Fool
Mar-15-19,Can You Trust in IBMs Nearly 5% Dividend?,InvestorPlace
Mar-18-19,IBM (IBM) Outpaces Stock Market Gains: What You Should Know,Zacks
Mar-18-19,Accenture Acquires Storm Digital to Boost Dutch Presence,Zacks
Mar-18-19,Competitive Debaters Have a Problem: They Can't Stop Arguing,The Wall Street Journal
Mar-18-19,IBM's The Weather Company Releases Spring Forecast for the United States,PR Newswire
Mar-18-19,"IBM Blockchain World Wire, a New Global Payment Network, to Support Payments and Foreign Exchange in More Than 50 Countries",PR Newswire
Mar-18-19,IBM Blockchain Network to Aid NCC Simplify Registry Dealings,Zacks
Mar-19-19,3 Cloud Stocks to Buy Right Now,Zacks
Mar-19-19,A Low-Risk Way to Bet on Fintech and Blockchain,Motley Fool
Mar-19-19,"The Bigger College Scandal Isnt About Admission Bribes, but Graduation Rates",Barrons.com
Mar-20-19,Crypto Initiative Could End IBM's Long-Term Downtrend,Investopedia
Mar-21-19,RemoteMyApp adopts IBM Cloud to scale multi-platform gaming service,PR Newswire
Mar-21-19,RemoteMyApp adopts IBM Cloud to scale multi-platform gaming service,PR Newswire
Mar-21-19,Health Quest Sets out to Boost Participation in Clinical Trials with IBM Watson,PR Newswire
Mar-21-19,Discussing IBM's foray into blockchain-based payment syst...,CNBC Videos
Mar-22-19,Red Hat (RHT) Gears Up for Q4 Earnings: What's in the Cards?,Zacks
Mar-22-19,Three stocks to hedge against an economic slowdown,CNBC
Mar-25-19,"Red Hat, IBM Rise in After-Hours Trading",Investing.com
Mar-25-19,Buy IBM for Price Gains and Dividend,TheStreet.com
Mar-25-19,IBM Cloud to Aid RemoteMyApp Enhance Vortex Gaming Service,Zacks
Mar-25-19,S&P 500 Q4 2018 Buybacks Set 4th Consecutive Quarterly Record at $223 Billion; 2018 Sets Record $806 Billion,PR Newswire
Mar-25-19,[$$] Banks use AI to catch rogue traders before the act,Financial Times
Mar-26-19,Key Takeaways From Red Hat's 4th-Quarter Results,GuruFocus.com
Mar-26-19,Red Hat Reports Double-Digit Growth Ahead of IBM Deal,Motley Fool
Mar-26-19,"Durham data firm hiring for its new HQ, CEO says",American City Business Journals
Mar-26-19,State has not yet signed contract with IBM for partnership at SUNY Poly,American City Business Journals
Mar-27-19,Learning From Warren Buffett's Mistakes,GuruFocus.com
Mar-27-19,IBM (IBM) Dips More Than Broader Markets: What You Should Know,Zacks
Mar-27-19,Former Colorado IBM employees sue tech giant for violating federal age-discrimination laws,American City Business Journals
Mar-27-19,Warren Buffett Sold Oracle Stock  Should You?,InvestorPlace
Mar-27-19,XRP/USD Stages A Recovery As XRP Futures Go Live On Huobi Exchange,Benzinga
Mar-27-19,3 Reasons to Buy Microsoft Stock on Any Weakness,InvestorPlace
Mar-27-19,Democratizing Blockchain Beyond Bitcoin: Tech Giants to Gain,Zacks
Mar-27-19,"Adobe, Microsoft Combine to Take On salesforce's CRM Dominance",Zacks
Mar-28-19,Top Dow Stocks Of 2019: Where Does Apple Rank?,Investor's Business Daily
Mar-28-19,Perspectives From McCormick's Management,Motley Fool
Mar-28-19,Amazon Aids Redshift's Performance With Concurrency Scaling,Zacks
Mar-28-19,Why Broadcom Is a Better Bet Than IBM,Motley Fool
Mar-29-19,These Are The 5 Top Dow Stocks Of 2019,Investor's Business Daily
Mar-29-19,"Stock Market News: IBM, Cisco Top First-Quarter Dow Winners",Motley Fool
Mar-29-19,"21Vianet Group, Inc. -- Moody's assigns first-time B1 CFR to 21Vianet; outlook stable",Moody's
Apr-01-19,"Top Analyst Reports for Chevron, IBM & Medtronic",Zacks
Apr-01-19,Why IBM Stock Could Keep Soaring,Motley Fool
Apr-01-19,Wall Street Embraces Weather Risk in New Era of Storms,Bloomberg
Apr-01-19,Sandvik and IBM Usher in the Fourth Industrial Revolution to the Mining Industry with IBM Watson,PR Newswire
Apr-02-19,IBM CEO Ginni Rometty: AI will change 100 percent of jobs over the next decade,CNBC
Apr-02-19,How IBM World Wire could disrupt global payments,Coin Rivet
Apr-02-19,IBM Watson &amp; Sandvik Driven OptiMine Analytics Gains Adoption,Zacks
Apr-02-19,Elon Musks CEO pay-to-worker ratio is the highest ever recorded  how it compares at other tech companies,American City Business Journals
Apr-02-19,"The Zacks Analyst Blog Highlights: Chevron, IBM, Medtronic, lululemon and Carnival",Zacks
Apr-03-19,3 Tech Stocks That Will Raise Their Dividends in 2019,Motley Fool
Apr-03-19,AI experts take on Amazon after researchers findings of racial bias in facial recognition,MarketWatch
Apr-03-19,Face recognition researcher fights Amazon over biased AI,Associated Press
Apr-03-19,IBM's Ginni Rometty: AI will change 100 percent of jobs,CNBC Videos
Apr-03-19,IBM artificial intelligence can predict with 95% accuracy which workers are about to quit their jobs,CNBC
Apr-03-19,Livingston Announces Collaboration with TradeLens for Blockchain Pilot,CNW Group
Apr-03-19,"21Vianet Group, Inc. -- Moody's assigns first-time B1 CFR to 21Vianet; outlook stable",Moody's
Apr-04-19,IBM (IBM) Stock Sinks As Market Gains: What You Should Know,Zacks
Apr-04-19,"Dynatrace Intermediate, LLC -- Moody's announces completion of a periodic review of ratings of Dynatrace Intermediate, LLC",Moody's
Apr-04-19,Amazon (AMZN) Stock Looks Like a Buy Heading into Q1 2019 Earnings,Zacks
Apr-04-19,Livingston Joins TradeLens Blockchain Shipping Platform,Benzinga
Apr-05-19,Will International Business Machines Corporation's (NYSE:IBM) Earnings Grow In The Year Ahead?,Simply Wall St.
Apr-08-19,"AI must be accountable, EU says as it sets ethical guidelines",Reuters
Apr-09-19,"Microsoft (MSFT) Q3 2019 Earnings Preview: Cloud, Gaming, Office &amp; More",Zacks
Apr-09-19,"In public Google Cloud debut, Kurian shows off hybrid-cloud product that interacts with rivals",MarketWatch
Apr-09-19,Heres Where You Buy 3M Stock for Capital Gains,InvestorPlace
Apr-09-19,Earnings Preview: IBM (IBM) Q1 Earnings Expected to Decline,Zacks
Apr-09-19,SAP HANA's New Capabilities Ups Ante in Database Management,Zacks
Apr-09-19,Google shifts cloud computing strategy,Financial Times
Apr-10-19,IBM (IBM) Outpaces Stock Market Gains: What You Should Know,Zacks
Apr-10-19,Amazon-Microsoft Face-Off Set for Pentagon's $10 Billion Cloud,Bloomberg
Apr-10-19,8 in 10 tech companies offer this fix to reduce gender bias at work,CNBC
Apr-11-19,Stocks close mostly lower as earnings season set to kick off,MarketWatch
Apr-11-19,A Look At The Dow And FANG Stocks In 2019,Benzinga
Apr-11-19,IBM's Food Trust Blockchain Adds Another Grocery Chain,Motley Fool
Apr-11-19,Blue Chips Erase Gains But 3 Stocks Show Strength; This Sector Shows Leadership,Investor's Business Daily
Apr-11-19,IBMs Big-Ticket Purchase Gets a Vote of Confidence From Wall Street,Barrons.com
Apr-11-19,Albertsons Companies Partners With IBM Food Trust Network To Use Blockchain For Food Supply Chain Traceability,Benzinga
Apr-11-19,What's in Store for Dow ETF in Q1 Earnings?,Zacks
Apr-11-19,"Google Ups Ante Against AMZN, MSFT &amp; IBM in Open-Source Game",Zacks
Apr-11-19,"Oracle eliminated from $10B Pentagon cloud contract as Amazon, Microsoft advance",American City Business Journals
Apr-11-19,Albertsons Companies to Join Blockchain-based IBM Food Trust Network to Pilot Increased Transparency for Romaine Lettuce,PR Newswire
Apr-11-19,Unibright.io CTO Stefan Schmidt on the future of cryptocurrency and blockchain,Coin Rivet
Apr-11-19,Masters 2019: How IBM's AI tech tracks golf shots,Fox Business Videos
Apr-11-19,It's now an Amazon-Microsoft showdown for the Pentagon's massive JEDI contract,American City Business Journals
Apr-11-19,IBM stock gains after Credit Suisse initiates with bullish rating,MarketWatch
Apr-11-19,"Here are the biggest analyst calls of the day: Apple, Chipotle, IBM, Xerox, U.S. Steel & more",CNBC
Apr-11-19,"Cisco, Apple and IBM are leading the Dow this year, but only two look good, according to two experts",CNBC
Apr-11-19,"Senator David Perdue Buys FedEx and Alphabet Stock, Sells IBM and First Data",Barrons.com
Apr-11-19,IBM Study: More Than Half of Organizations with Cybersecurity Incident Response Plans Fail to Test Them,PR Newswire
Apr-11-19,"Stocks - Bed, Bath & Beyond Tumbles in Premarket, Tesla Sinks, Amazon Treads Water",Investing.com
Apr-12-19,Earnings Optimism Following Bank Results,Zacks
Apr-12-19,3 Earnings Reports to Watch Next Week,InvestorPlace
Apr-12-19,4 Stocks to Gain Traction From Cloud Computing Revolution,Zacks
Apr-12-19,"Microsoft &amp; Amazon Stay in JEDI Race, IBM &amp; ORCL Shunned",Zacks
Apr-12-19,What Does the Future Hold for Artificial Intelligence?,Motley Fool
Apr-12-19,Factors Expected to Influence IBM This Earnings Season,Zacks
Apr-12-19,Latest Stellar price and analysis (XLM to USD),Coin Rivet
Apr-15-19,IBM Expected to Earn $2.22 Per Share,TheStreet.com
Apr-15-19,IBM earnings: Short-term revenue pain needs to translate into services growth,MarketWatch
Apr-15-19,IBM First-Quarter Earnings Report Will Put Focus On Cloud Transition,Investor's Business Daily
Apr-15-19,"Final Trades: Fortinet, Shake Shack, IBM & BlackRock",CNBC Videos
Apr-15-19,Day Ahead: Top 3 Things to Watch,Investing.com
Apr-15-19,"As IBM Faces Falling Revenue, Red Hat Deal May Change Narrative",Bloomberg
Apr-15-19,IBM Buyers in Control Ahead of Earnings,Investopedia
Apr-15-19,"IBM Stock Could Rally After Earnings, but Dont Buy It, Analyst Says",Barrons.com
Apr-15-19,Should You Avoid IBM ETFs Ahead of Q1 Earnings?,Zacks
Apr-15-19,"Top Stock Reports for JPMorgan, Visa & Chevron",Zacks
Apr-15-19,IBM Stock Wont Rise as Fast as Investors Expect,InvestorPlace
Apr-15-19,"Earnings Parade Rolls Along As Citigroup, Goldman Sachs Report And SPX Now Tops 2900",Benzinga
Apr-15-19,Factors Expected to Influence IBM This Earnings Season (Revised),Zacks
Apr-15-19,What to Expect When IBM Reports Earnings,Motley Fool
Apr-15-19,IBM's Blockchain Service Adopted by Albertsons Companies,Zacks
Apr-15-19,IBM Reports Earnings Tomorrow. Heres What to Expect.,Barrons.com
Apr-16-19,"IBM revenue takes a slide, and the stock is doing the same",MarketWatch
Apr-16-19,"IBM quarterly revenue, full-year forecast disappoints",Reuters
Apr-16-19,"Corrected: IBM quarterly revenue, full-year forecast disappoints",Reuters
Apr-16-19,"Dow Jones Futures: Netflix, Sprint Headline Key Movers On News",Investor's Business Daily
Apr-16-19,IBM Stock Is Dropping After the Company Missed Revenue Forecasts,Barrons.com
Apr-16-19,IBM CFO: Red Hat deal is on track to close,American City Business Journals
Apr-16-19,The Key Takeaways From IBM's First-Quarter Earnings,Bloomberg
Apr-16-19,"Netflix (NFLX) Beats but Guides Weak; IBM Mixed; United, CSX Top",Zacks
Apr-16-19,"IBM quarterly revenue, full-year forecast disappoints",Reuters
Apr-16-19,IBM (IBM) Q1 Earnings Top Estimates,Zacks
Apr-16-19,"Stocks making the biggest moves after hours: Netflix, IBM, Qualcomm and more",CNBC
Apr-16-19,"IBM quarterly revenue misses estimates on weak cloud, services demand",Reuters
Apr-16-19,"IBM faces many secular headwinds, says analyst",CNBC Videos
Apr-16-19,IBM First-Quarter Earnings Beat On Bottom Line; Revenue Falls Short,Investor's Business Daily
Apr-16-19,US STOCKS-Wall St edges higher on generally positive earnings,Reuters
Apr-16-19,Sprint stock falls 10% on report T-Mobile merger is unlikely to be approved as currently structured,CNBC
Apr-16-19,"IBM Shares Fall on Weak Revenue, Mixed Guidance",TheStreet.com
Apr-16-19,"IBM First-Quarter Earnings Beat On Bottom Line, Fall Short On Revenue",Investor's Business Daily
Apr-16-19,IBM: 1Q Earnings Snapshot,Associated Press
Apr-16-19,IBM Reports 2019 First-Quarter Results,Business Wire
Apr-16-19,Why Apple May Have Decided to Settle With Qualcomm Now -- Tech Check,TheStreet.com
Apr-16-19,IBM stock slips after revenue shortfall,CNBC
Apr-16-19,"A 26-year-old trend line suggests IBM still has more upside from here, technician says",CNBC
Apr-16-19,Q1 Earnings To Watch For,Zacks
Apr-16-19,"Q1 Earnings Spigot Opens: JNJ, BAC, UNH &amp; More",Zacks
Apr-16-19,"DXC Boosts Asia Security Business, Opens Operations Center",Zacks
Apr-16-19,IBM earnings: Short-term revenue pain needs to translate into services growth,MarketWatch
Apr-16-19,Netflix is already over Apple and Disney as it prepares to launch this quarters earnings,MarketWatch
Apr-16-19,9 Stocks That Every 20-Year-Old Should Buy,InvestorPlace
Apr-16-19,Can IBM Accelerate Its Dividend Growth Rate?,Motley Fool
Apr-16-19,FirstFT: Todays top stories,Financial Times
Apr-16-19,"Netflix, Bank of America, IBM, Hulu and Notre Dame - 5 Things You Must Know",TheStreet.com
Apr-16-19,IBM Reports Earnings Today. Heres What to Expect.,Barrons.com
Apr-17-19,Edited Transcript of IBM earnings conference call or presentation 16-Apr-19 9:00pm GMT,Thomson Reuters StreetEvents
Apr-17-19,"Wall Street slips, weighed down by healthcare plunge",Reuters
Apr-17-19,IBM's Mainframe Sales Crashed. Thats Normal.,Motley Fool
Apr-17-19,PepsiCo and Intel rise while IBM and T-Mobile slip,Associated Press
Apr-17-19,Stocks Drop on Health-Care Rout; Crude Oil Slumps: Markets Wrap,Bloomberg
Apr-17-19,Novice Trade: IBM,TheStreet.com
Apr-17-19,"Pinterest's IPO, IBM melts down & Godiva's chocolate cafes, all in today's Rapid Fire",CNBC Videos
Apr-17-19,"Stocks making the biggest moves midday: Qualcomm, Morgan Stanley, CSX & more",CNBC
Apr-17-19,IBM's Top-Line Performance Continues to Raise Red Flags -- Tech Check,TheStreet.com
Apr-17-19,"IBM revenue takes a slide, and the stock is doing the same",MarketWatch
Apr-17-19,Blame IBM and United Health for the Dows 46 Point Drop,Barrons.com
Apr-17-19,IBM's Global Supply Chain Transformation Wins 2019 NextGen Supply Chain Leadership Award for Blockchain and IoT,PR Newswire
Apr-17-19,IBM Stock Is Dropping Because the Company Missed Revenue Forecasts,Barrons.com
Apr-17-19,"Netflix Stock Is Up, IBM Is Down, and 3 Other Wednesday Movers",Barrons.com
Apr-17-19,"US STOCKS-Wall St set for higher open on encouraging China data, earnings",Reuters
Apr-17-19,"IBM beats earnings expectations, misses on revenue",CNBC Videos
Apr-17-19,"IBM Earnings: Sales Down, Margins Up",Motley Fool
Apr-17-19,"Stocks making the biggest moves premarket: Netflix, IBM, PepsiCo, Morgan Stanley, Boeing & more",CNBC
Apr-17-19,Dow Jones Futures Signal Stock Market Gains: 9 Key Stocks Moving On News,Investor's Business Daily
Apr-17-19,Dow Futures Gain 30 Points as Earnings Remain Good Enough to Lift the Market,Barrons.com
Apr-17-19,"U.S. stock-market euphoria may be nearing a dangerous level, says RBC strategist",MarketWatch
Apr-17-19,Stocks hold ground as investors measure earnings and China data,Financial Times
Apr-17-19,Singapore Exports Slump on Worst Electronics Drop Since 2013,Bloomberg
Apr-18-19,IBM Served Up Some Surprises in Q1,Motley Fool
Apr-18-19,"7 Tech Stocks With Too Much Risk, Not Enough Upside",InvestorPlace
Apr-18-19,Boursorama renews its agreement with IBM to accelerate its hybrid cloud strategy,PR Newswire
Apr-18-19,"Company News For Apr 18, 2019",Zacks
Apr-18-19,Boursorama renews its agreement with IBM to accelerate its hybrid cloud strategy,PR Newswire
Apr-18-19,Japan's Fukui Bank Moves to IBM Cloud to Transform the Way it Does Business,PR Newswire
Apr-18-19,"State board approves $425 million toward IBM, Applied Materials projects at SUNY Poly",American City Business Journals
Apr-18-19,Podcast: Qualcomm Jumps 12% Jump After its Fight With Apple Ends,Barrons.com
Apr-18-19,"U.S.-China Tensions May Linger After Trade War, Singapore Says",Bloomberg
Apr-22-19,Earnings Beats Dont Help a Stock as Much as They Used To,Barrons.com
Apr-22-19,Volume Is a Key Indicator for Stocks: Here's How to Use It,TheStreet.com
Apr-22-19,"Top Stock Reports for IBM, Honeywell & American Express",Zacks
Apr-22-19,Investors Are Raising the Bar for Companies Earnings Reports,Barrons.com
Apr-22-19,Microsoft Ups the Ante in IoT With Express Logic Acquisition,Zacks
Apr-22-19,IBM Watson Health Names Nation's Top Health Systems,PR Newswire
Apr-22-19,Is International Business Machines Corporation's (NYSE:IBM) CEO Pay Fair?,Simply Wall St.
Apr-23-19,Mozambique Faces Another Powerful Cyclone One Month After Idai,Bloomberg
Apr-23-19,Why Groupon Stock Cant Quite Deliver,InvestorPlace
Apr-23-19,IBM Stock Keeps Moving Sideways With No End in Sight,InvestorPlace
Apr-23-19,"The Zacks Analyst Blog Highlights: IBM, Honeywell, American Express, CSX, Progressive",Zacks
Apr-24-19,Here's What to Expect from Amazon's (AMZN) Q1 2019 Earnings Results,Zacks
Apr-24-19,3 Cloud Stocks to Buy Right Now,Zacks
Apr-24-19,"Focus on the Movie, Not the Snapshot",GuruFocus.com
Apr-24-19,"IBM to Develop an AI-Powered IoT Solution to Help Clients Manage and Monitor Aging Bridges, Tunnels, Highways and Railways",PR Newswire
Apr-25-19,"Adesto, IBM and NXP Demonstrate Robust End-to-End Security for Industrial IoT",GlobeNewswire
Apr-25-19,IBM Services Signs Agreement with Lenovo Data Center Group to Increase Customer Care with Cognitive and Blockchain Solutions,PR Newswire
Apr-25-19,Leading universities partner with IBM to accelerate joint research and drive educational opportunities in quantum computing,PR Newswire
Apr-25-19,Chinas unchecked expansion of data-powered AI raises civic concerns,Financial Times
Apr-25-19,Regions Bank Taps IBM's AI to Power Next Generation Customer Service,PR Newswire
Apr-26-19,Buy Amazon (AMZN) Stock After Q1 Earnings on 1-Day Shipping Push?,Zacks
Apr-26-19,Amazon Posts Another Huge Beat: Cloud Computing Driving Growth,Zacks
Apr-26-19,IBM: Don't Give Up on the Stock,TheStreet.com
Apr-26-19,"Yara, IBM to offer digital services to farmers",Reuters
Apr-26-19,Yara and IBM join forces to transform the future of farming,GlobeNewswire
Apr-29-19,9 High-Yield Dividend Stocks That Deserve Your Attention,Kiplinger
Apr-29-19,"The Zacks Analyst Blog Highlights: Amazon, Microsoft, IBM, Facebook and Microsoft",Zacks
Apr-29-19,IBM study: 77% of firms don't have cyber resiliency plans,CNBC Videos
Apr-30-19,Older Tech Giants Score Wins With Trump Ties,Bloomberg
Apr-30-19,Samsung and IBM going all-in to Ethereum and Stellar?,Coin Rivet
Apr-30-19,IBM Raises Quarterly Cash Dividend by 5 Cents to $1.62,TheStreet.com
Apr-30-19,"IBM boosts dividend by 3.2%, remains the 2nd-highest yielding Dow component",MarketWatch
Apr-30-19,IBM Board Approves Increase in Quarterly Cash Dividend for the 24th Consecutive Year,Business Wire
May-01-19,Software Alliance looks to plug security holes in development,American City Business Journals
May-01-19,IBM Nudges Its Dividend Higher,Motley Fool
May-01-19,Two Technology-Stock Icons Just Raised Their Dividends,Barrons.com
May-01-19,"IBM, Thomson Reuters Introduce Powerful New AI and Data Combination to Simplify How Financial Institutions Tackle Regulatory Compliance Challenges",PR Newswire
May-02-19,8 High-Yield Dividend Stocks That Deserve Your Attention,Kiplinger
May-03-19,Lowest Unemployment Rate in 50 Years: What To Buy,Zacks
May-03-19,"Vodafone Idea and IBM in Five Year, Multi-Million-Dollar Engagement to Advance the Future of Telco with Hybrid Cloud, and AI",PR Newswire
May-03-19,"Earnings Season Brings Dividend Increases. Think PepsiCo, Apple, and IBM.",Barrons.com
May-06-19,Edited Transcript of IBM earnings conference call or presentation 16-Apr-19 9:00pm GMT,Thomson Reuters StreetEvents
May-06-19,Experts: IBM's $34 billion buy of Red Hat not quite a done deal,American City Business Journals
May-06-19,Why Apple Stock Could Drop Below $100 by the End of 2019,InvestorPlace
May-06-19,Here are the biggest stock-market losers after Trump threatens more tariffs,MarketWatch
May-07-19,San Mateo 'Splunk killer' scores second big funding in 8 months,American City Business Journals
May-07-19,AMD and Cray seek to develop fastest supercomputer in the world,MarketWatch
May-07-19,Microsoft Enters Blockchain Race With an Edge  And A Big Player Partner,InvestorPlace
May-08-19,IBM Sells $20 Billion of Bonds as Market Defies Trade Drag,Bloomberg
May-08-19,IBM Gets a Tepid Reception for Its $20 Billion Bond Sale,Barrons.com
May-08-19,Buy Alibaba (BABA) Stock Ahead of Earnings Amid Trade War Worries?,Zacks
May-08-19,IBM seeks funding for Red Hat acquisition,Financial Times
May-09-19,"Apple Roundup: SAP Deal, Spotify Challenge, 5G, Market Share",Zacks
May-09-19,"IBM Could Struggle in the Cloud, Analyst Says  and Watch Out for Activist Investors",Barrons.com
May-09-19,CyberArk (CYBR) to Report Q1 Earnings: What's in Store?,Zacks
May-10-19,IBM's Stephen Rogers Addresses BiTA On Transport's Adoption Of Blockchain,Benzinga
May-10-19,Why Income Investors Should Have International Business Machines Corporation (NYSE:IBM) In Their Portfolio,Simply Wall St.
May-13-19,"Public safety, civil rights groups battle over face ID tech",Associated Press
May-13-19,"Sirius Computer Solutions, Inc. (New) -- Moody's assigns B2 CFR to Sirius Computer Solutions (New) on buyout; outlook is stable",Moody's
May-13-19,3 Cloud Stocks to Buy Right Now,Zacks
May-13-19,Sustainable Shrimp Partnership Joins IBM Food Trust To Provide Visibility To Shrimp Farming Through Blockchain,Benzinga
May-13-19,"EquBot Taps AI To Perform The Work Of 3,000 Research Analysts",Investor's Business Daily
May-14-19,IBM Releases AI-Powered Anomaly Detection Capabilities to Mitigate Supply Chain Disruptions,PR Newswire
May-14-19,European Companies Turn to IBM AI and Hybrid Cloud to Help Drive the Next Chapter of Digital Transformation in the Automotive Industry,PR Newswire
May-15-19,Bet on Big Blue? Are Emerging Markets heading higher? The traders answer viewer questions,CNBC Videos
May-15-19,Cramerica Calls in About IBM: The Charts Look Bullish,TheStreet.com
May-15-19,"IBM Cloud, Watson &amp; AI Services Adoption Grows in Europe",Zacks
May-15-19,DataStax revamps leadership as it prepares for $1B-plus IPO,American City Business Journals
May-15-19,Oracle claims Amazon offered jobs to Pentagon officials working on the $10B JEDI contract,American City Business Journals
May-15-19,Wait Out the Storm in Nvidia Stock,InvestorPlace
May-15-19,"IBM Expands ""New Collar"" Programs into France",PR Newswire
May-15-19,Polish Agricultural Social Insurance Fund Adopts IBM Cloud to Advance Farming Safety,PR Newswire
May-15-19,IBM Showcases Work with European Companies Using Hybrid Cloud and AI Solutions to Transform Industries,PR Newswire
May-15-19,IBM and ERGO Aktiv are helping people after stroke,PR Newswire
May-15-19,Endesa taps IBM Watson and IBM Cloud to deliver superior Customer Service through its AI Contact Center,PR Newswire
May-15-19,Confindustria adopts IBM Cloud to drive digital transformation,PR Newswire
May-16-19,H-1B Visa to Green Card Backlog: Why Tech Companies Demand Change,Investopedia
May-16-19,IBM to Strengthen Foothold in France With New Collar Program,Zacks
May-16-19,Why Is IBM (IBM) Down 3.4% Since Last Earnings Report?,Zacks
May-16-19,Re-imagining the Cloud Will Be the Secret Sauce for IBM Stock,InvestorPlace
May-16-19,"Every job will change because of technology, IBM CEO says",CNBC Videos
May-16-19,"Opening up 'digital trade' between US and China just as important as solving tariffs, IBM CEO says",CNBC
May-17-19,Hewlett Packard's Possible Cray Buyout to Boost HPC Footing,Zacks
May-17-19,Computer Integrated Systems Industry Prospects Not Bright,Zacks
May-17-19,"Dow 30 Stock Roundup: Walmart, Cisco Earnings Impress",Zacks
May-17-19,HP Enterprise Climbs Midday After $1.3B Cray Deal,Investing.com
May-17-19,H-1B Visa to Green Card Backlog: Why Tech Companies Demand Change,Investopedia
May-20-19,"Top Analyst Reports for Johnson & Johnson, Apple & Goldman Sachs",Zacks
May-20-19,3 Stocks to Sell for Big Profits,InvestorPlace
May-20-19,Women CEOs make more than men  but there's a catch,American City Business Journals
May-21-19,Buy Hewlett Packard Enterprise (HPE) Stock Before Q2 2019 Earnings?,Zacks
May-21-19,EU regulators to decide on IBM's $34 billion Red Hat bid by June 27,Reuters
May-21-19,Altcoins under the radar: Stellar and NEO,Coin Rivet
May-21-19,"The Zacks Analyst Blog Highlights: Johnson &amp; Johnson, Apple, Goldman Sachs, IBM and Netflix",Zacks
May-21-19,IBM Security: Cybersecurity Threats Growing In Travel and Transportation Industries,PR Newswire
May-22-19,IBM Weather Signals Uses AI to Enable Predictive Weather-based Business Forecasting,PR Newswire
