date,title,source
Oct-22-18,"Gaia Sets Third Quarter 2018 Conference Call for Monday, November 5, 2018, at 4:30 p.m. ET",GlobeNewswire
Nov-05-18,"Gaiam (GAIA) Reports Q3 Loss, Tops Revenue Estimates",Zacks
Nov-05-18,Gaiam: 3Q Earnings Snapshot,Associated Press
Nov-05-18,Gaia Reports Third Quarter 2018 Results,GlobeNewswire
Nov-09-18,Edited Transcript of GAIA earnings conference call or presentation 5-Nov-18 9:30pm GMT,Thomson Reuters StreetEvents
Nov-13-18,"Factors of Influence in 2018, Key Indicators and Opportunity within Brookfield Renewable Partners, Libbey, Safe Bulkers, Intermolecular, Gaia, and United-Guardian  New Research Emphasizes Economic Growth",GlobeNewswire
