date,title,source
Oct-29-18,Bsquare Corporation Schedules Third Quarter 2018 Earnings Conference Call,PR Newswire
Nov-06-18,Bsquare Appoints Davin Cushman to Board of Directors,PR Newswire
Nov-12-18,Bsquare: 3Q Earnings Snapshot,Associated Press
Nov-12-18,Bsquare Reports Third Quarter 2018 Financial Results,PR Newswire
Nov-13-18,Edited Transcript of BSQR earnings conference call or presentation 12-Nov-18 10:00pm GMT,Thomson Reuters StreetEvents
Nov-23-18,Should You Be Concerned About BSQUARE Corporations (NASDAQ:BSQR) Historical Volatility?,Simply Wall St.
Nov-23-18,"Report: Exploring Fundamental Drivers Behind Harvard Bioscience, TTM Technologies, BSQUARE, United Therapeutics, KCAP Financial, and Gladstone Capital  New Horizons, Emerging Trends, and Upcoming Developments",GlobeNewswire
Dec-03-18,Edited Transcript of BSQR earnings conference call or presentation 13-Aug-18 9:00pm GMT,Thomson Reuters StreetEvents
Jan-15-19,Bsquare and Amazon Web Services Collaborate to Accelerate Internet of Things Adoption,PR Newswire
Feb-11-19,Bsquare Corporation Schedules Fourth Quarter And Full Year 2018 Earnings Conference Call,PR Newswire
Feb-20-19,Bsquare Appoints Ralph Derrickson as President and Chief Executive Officer,PR Newswire
Feb-25-19,Bsquare Reports Fourth Quarter and Full Year 2018 Results,PR Newswire
Feb-26-19,Edited Transcript of BSQR earnings conference call or presentation 25-Feb-19 10:00pm GMT,Thomson Reuters StreetEvents
Feb-27-19,Edited Transcript of BSQR earnings conference call or presentation 25-Feb-19 10:00pm GMT,Thomson Reuters StreetEvents
Mar-01-19,Bsquare Enters into Global Partner Agreement with Microsoft,PR Newswire
Apr-29-19,Bsquare Corporation Schedules First Quarter 2019 Earnings Conference Call,PR Newswire
May-13-19,Bsquare: 1Q Earnings Snapshot,Associated Press
May-13-19,Bsquare Reports First Quarter 2019 Financial Results,PR Newswire
May-13-19,BSQUARE Corp. to Host Earnings Call,ACCESSWIRE
