date,title,source
Oct-29-18,Biotech RXi sues former top scientist for alleged trade secrets theft,American City Business Journals
Nov-07-18,RXi Pharmaceuticals to Present New Data Demonstrating the Ability of sd-rxRNA to Enhance NK Cell Activity for Adoptive Cell Transfer at SITC 2018,PR Newswire
Nov-14-18,4 Healthcare Stocks To Watch On Wednesday,ACCESSWIRE
Nov-14-18,RXi Pharmaceuticals Reports Third Quarter 2018 Financial Results and Recent Corporate Highlights,PR Newswire
Nov-15-18,Edited Transcript of RXII earnings conference call or presentation 14-Nov-18 9:30pm GMT,Thomson Reuters StreetEvents
