date,title,source
Oct-17-18,ServiceNow Invests for Growth in Japan,Business Wire
Oct-18-18,Accenture and ServiceNow Announce Greater Collaboration To Drive Innovation In Europe,Business Wire
Oct-19-18,ServiceNow (NOW) to Report Q3 Earnings: Is a Beat in Store?,Zacks
Oct-22-18,Nasdaq Up; Will These 3 Sectors Lead A Market Turnaround?,Investor's Business Daily
Oct-22-18,Nasdaq Leads Mixed Session As China Names Rise; AMD Rallies Ahead Of Earnings,Investor's Business Daily
Oct-23-18,Device42 Launches Integration with ServiceNow,PR Newswire
Oct-23-18,Why Earnings Season Could Be Great for ServiceNow (NOW),Zacks
Oct-24-18,ServiceNow (NOW) Beats Q3 Earnings and Revenue Estimates,Zacks
Oct-24-18,ServiceNow: 3Q Earnings Snapshot,Associated Press
Oct-24-18,"ServiceNow Stock Slips As Earnings Beat, Billings Outlook Light",Investor's Business Daily
Oct-24-18,ServiceNow Reports Strong Third Quarter 2018 Financial Results,Business Wire
Oct-25-18,ServiceNow's (NOW) Q3 Earnings & Revenues Beat Estimates,Zacks
Oct-25-18,ServiceNow CEO on earnings and cloud business,CNBC Videos
Oct-25-18,Edited Transcript of NOW earnings conference call or presentation 24-Oct-18 9:00pm GMT,Thomson Reuters StreetEvents
Oct-26-18,Edited Transcript of NOW earnings conference call or presentation 24-Oct-18 9:00pm GMT,Thomson Reuters StreetEvents
Oct-29-18,ServiceNow (NOW) Dips More Than Broader Markets: What You Should Know,Zacks
Oct-29-18,IBM's $33 Billion Red Hat Deal Leaves Street Weighing Who's Next,Bloomberg
Oct-30-18,Analysts think these Bay Area deals could follow Red Hat's $34 billion sale to IBM,American City Business Journals
Oct-30-18,Heres What Hedge Funds Pitched at Sohn San Francisco,Bloomberg
Oct-31-18,"Top Research Reports for Comcast, ConocoPhillips & Delta Air Lines",Zacks
Nov-01-18,"The Zacks Analyst Blog Highlights: Comcast, ConocoPhillips, Delta Air Lines, ServiceNow and Zimmer Biomet",Zacks
Nov-05-18,Forget the FANGs  Buy These 5 Tech Stocks Instead,InvestorPlace
Nov-05-18,"David Carlson Buys 3, Sells 2 in 3rd Quarter",GuruFocus.com
Nov-06-18,"New Research: Key Drivers of Growth for The Carlyle Group, Gaming and Leisure Properties, FTI Consulting, Lear, HMS, and ServiceNow  Factors of Influence, Major Initiatives and Sustained Production",GlobeNewswire
Nov-08-18,ServiceNows Chief Financial Officer to Present at Three Upcoming Investor Conferences,Business Wire
Nov-09-18,Who Joins Square On This List Of Today's Fastest-Growing Companies?,Investor's Business Daily
Nov-12-18,SAP to buy customer sentiment tracker Qualtrics for $8 bln,Reuters
Nov-16-18,"Stanley Druckenmiller Sells Facebook, Buys PayPal in 3rd Quarter",GuruFocus.com
Nov-16-18,IBM Expands Its Partnership with ServiceNow to Serve Multicloud Enterprises,PR Newswire
Nov-19-18,"Who Joins Canada Goose, Square On This List Of Today's Fastest-Growing Companies?",Investor's Business Daily
Nov-20-18,10 Beaten Tech Stocks to Consider,InvestorPlace
Nov-21-18,DVMT vs. NOW: Which Stock Is the Better Value Option?,Zacks
Nov-28-18,"Salesforce Bullish Outlook Lifts Adobe, ServiceNow, Workday Stocks",Investor's Business Daily
Dec-03-18,"Who Joins Canada Goose, Abiomed On This List Of Today's Fastest-Growing Companies?",Investor's Business Daily
Dec-06-18,IBD Stock Of The Day: ServiceNow Finds Support Amid Tech Sell-Off,Investor's Business Daily
Dec-06-18,Nasdaq Rises Off Low As This Sector Strengthens; Apple Plunge Offers This Silver Lining,Investor's Business Daily
Dec-06-18,Is ServiceNow Inc (NYSE:NOW) A Good Stock To Buy?,Insider Monkey
Dec-06-18,"Psst, Boss, Heres What Your Employees Want Most This Holiday  Meaningful Work",Business Wire
Dec-07-18,Edited Transcript of NOW earnings conference call or presentation 24-Oct-18 9:00pm GMT,Thomson Reuters StreetEvents
Dec-10-18,"IBD Stock Of The Day: This Software Maker Does Battle With Microsoft, ServiceNow",Investor's Business Daily
Dec-11-18,"Dow Jones Futures Jump, Tesla Set To Reclaim Buy Zone On China Trade Hopes",Investor's Business Daily
Dec-14-18,"ServiceNow, Palo Alto Networks Make This List Of Today's Fastest-Growing Companies",Investor's Business Daily
Dec-17-18,Q4 Earnings Preview: Atlassian Joins 13 Stocks Expecting 50% To 233% Growth,Investor's Business Daily
Dec-20-18,Software Stocks To Buy And Watch: SaaS Firms Thrive Amid Shift To Cloud,Investor's Business Daily
Dec-20-18,3 Stocks Billionaire Dan Loeb Bought in Q3 (and 2 He Dumped),Insider Monkey
Dec-21-18,Software Stocks To Buy And Watch: SaaS Firms Thrive Amid Shift To Cloud,Investor's Business Daily
Dec-27-18,Dow Jones Futures: Another Bullish Stock Market Close; Here's What To Do Now,Investor's Business Daily
Dec-27-18,Stock Market Rallies Again In Wild Session; Is This The New Normal?,Investor's Business Daily
Dec-28-18,These 5 Tech Companies Strut Rising Relative Strength Amid Bear Market,Investor's Business Daily
Dec-28-18,"Abiomed, ServiceNow, Workday Make This List Of Today's Fastest-Growing Companies",Investor's Business Daily
Dec-28-18,Dow Jones Futures Signal Stock Market Rally To Roll On: What You Need To Do Now,Investor's Business Daily
Dec-31-18,"Dow Jones Leads Gains, But Confident Volume Is Missing",Investor's Business Daily
Dec-31-18,Q4 Earnings Preview: Berkshire Among 14 Stocks Expecting 52% To 187% Growth,Investor's Business Daily
Jan-02-19,"Stocks Sell Off But Try To Recover; Apple, Netflix, Tesla Under Fire",Investor's Business Daily
Jan-02-19,ServiceNow to Announce Fourth Quarter and Fiscal Year 2018 Financial Results on January 30,Business Wire
Jan-04-19,Dow Jones Rips More Than 700 Points Higher; These Stocks May Beat Apple In 2019,Investor's Business Daily
Jan-04-19,"Stock Market News: Nasdaq Soars On Jobs Data, Powell Comments",Investor's Business Daily
Jan-09-19,ASGN vs. NOW: Which Stock Should Value Investors Buy Now?,Zacks
Jan-09-19,"3 Big Stock Charts for Wednesday: Anthem, ServiceNow and Hewlett Packard Enterprise",InvestorPlace
Jan-10-19,IBD 50 Stocks To Watch: 3 Metrics That Explain ServiceNow's Success,Investor's Business Daily
Jan-11-19,10 A-Rated Stocks the Smart Money Is Piling Into,InvestorPlace
Jan-14-19,IBD Stock Of The Day: Workday Boasts Corporate Strength Amid Government Shutdown,Investor's Business Daily
Jan-16-19,IBD Stock Of The Day: This Software Company Is Among Today's Top Picks,Investor's Business Daily
Jan-17-19,"Q4 Earnings: ServiceNow, Splunk Among 25 Stocks Expecting 50%-2,300% Growth",Investor's Business Daily
Jan-17-19,ServiceNow CEO John Donahoe Wants Clients to Embrace Digital Transformation,Barrons.com
Jan-22-19,"Fastest-Growing Companies: Netfflix, Workday Among Names With 51% To 922% EPS Growth",Investor's Business Daily
Jan-23-19,ServiceNow (NOW) Reports Next Week: Wall Street Expects Earnings Growth,Zacks
Jan-24-19,What's in the Offing for ServiceNow (NOW) in Q4 Earnings?,Zacks
Jan-25-19,ASGN vs. NOW: Which Stock Is the Better Value Option?,Zacks
Jan-28-19,State of Utah Projected to Save Millions of Dollars with Forescouts Integrated ServiceNow Solution,GlobeNewswire
Jan-30-19,ServiceNow Working On Forming Base,Investor's Business Daily Video
Jan-30-19,ServiceNow (NOW) Q4 Earnings Surpass Estimates,Zacks
Jan-30-19,ServiceNow: 4Q Earnings Snapshot,Associated Press
Jan-30-19,ServiceNow stock rallies on earnings beat,MarketWatch
Jan-30-19,ServiceNow Reports Record Fourth Quarter and Fiscal Year 2018 Financial Results,Business Wire
