date,title,source
Oct-17-18,ServiceNow Invests for Growth in Japan,Business Wire
Oct-18-18,Accenture and ServiceNow Announce Greater Collaboration To Drive Innovation In Europe,Business Wire
Oct-19-18,ServiceNow (NOW) to Report Q3 Earnings: Is a Beat in Store?,Zacks
Oct-22-18,Nasdaq Up; Will These 3 Sectors Lead A Market Turnaround?,Investor's Business Daily
Oct-22-18,Nasdaq Leads Mixed Session As China Names Rise; AMD Rallies Ahead Of Earnings,Investor's Business Daily
Oct-23-18,Device42 Launches Integration with ServiceNow,PR Newswire
Oct-23-18,Why Earnings Season Could Be Great for ServiceNow (NOW),Zacks
