date,title,source
Oct-17-18,What Should Investors Know About Ubiquiti Networks Incs (NASDAQ:UBNT) Future?,Simply Wall St.
Oct-18-18,3 Unknown but Amazing Dividend Stocks,Motley Fool
Oct-31-18,Why Ubiquiti (UBNT) is Poised to Beat Earnings Estimates Again,Zacks
Nov-01-18,Ubiquiti Networks (UBNT) Earnings Expected to Grow: What to Know Ahead of Next Week's Release,Zacks
Nov-05-18,"Ubiquiti Networks to Report First Quarter Fiscal 2019 Earnings Results on November 9, 2018",Business Wire
Nov-08-18,Why Earnings Season Could Be Great for Ubiquiti Networks (UBNT),Zacks
Nov-08-18,"The Zacks Analyst Blog Highlights: LM Ericsson, Nokia, Comtech Telecommunications, Juniper Networks and Ubiquiti Networks",Zacks
Nov-09-18,Ubiquiti Networks Makes It 3 Straight,Motley Fool
Nov-09-18,Why Ubiquiti Networks Inc. Stock Soared Today,Motley Fool
Nov-09-18,Stock Market News: Nasdaq Walloped As Netflix Dives 5%; Disney Leads Dow,Investor's Business Daily
Nov-09-18,"Stock Market Sharply Lower, But These 2 Top Stocks Break Out",Investor's Business Daily
Nov-09-18,Ubiquiti Networks (UBNT) Q1 Earnings and Revenues Surpass Estimates,Zacks
Nov-09-18,Ubiquiti: Fiscal 1Q Earnings Snapshot,Associated Press
Nov-09-18,Ubiquiti Networks Reports First Quarter Fiscal 2019 Financial Results,Business Wire
Nov-12-18,Ubiquiti (UBNT) Q1 Earnings Beat Estimates on Revenue Growth,Zacks
Nov-12-18,Today's Research Reports on Trending Tickers: Finisar and Ubiquiti Networks,ACCESSWIRE
Nov-14-18,"Stocks Today: Apple, Netflix, Nvidia Lead Nasdaq 100 Lower",Investor's Business Daily
Nov-15-18,"Recent Analysis Shows Aquantia, Ubiquiti Networks, Reliv' International, Permian Basin Royalty Trust, Patriot Transportation Holding, and Navidea Biopharmaceuticals Market Influences  Renewed Outlook, Key Drivers of Growth",GlobeNewswire
Nov-16-18,Top Stocks: IBD Screens Uncover Emerging Leaders Before Big Moves,Investor's Business Daily
Nov-19-18,Stock Market News: Tesla Breakout Fades As FAANG Stocks Slammed Again,Investor's Business Daily
Nov-20-18,Motorola (MSI) Selects Aviat as Wireless Backhaul Provider,Zacks
Nov-21-18,Stocks Today: Autodesk Soars On Earnings; Microsoft Leads Dow Jones,Investor's Business Daily
Nov-21-18,Ubiquiti Introduces Gaming-Optimized AmpliFi HD,ACCESSWIRE
Nov-21-18,"Bilibili's (BILI) Q3 Loss Narrows, Revenues Increase Y/Y",Zacks
Nov-21-18,Here's Why Investors Should Bet on Twitter (TWTR) Right Now,Zacks
Nov-23-18,Strong Demand for Wireless Infrastructure Makers: 5 Top Picks,Zacks
Nov-27-18,Harris (HRS) Ships Largest Mirror for Ground-Based Telescope,Zacks
Nov-27-18,Nokia and StarHub Complete 5G New Radio Trial in Singapore,Zacks
Nov-27-18,Juniper Rides on Solid Demand Trends & Portfolio Strength,Zacks
Nov-28-18,Ericsson's Mobility Report Shows 5G as the Next Big Thing,Zacks
Nov-28-18,Nokia Partners With Smart to Facilitate Disaster Response,Zacks
Dec-03-18,Strong Week Saves November,Zacks
Dec-03-18,Zayo (ZAYO) to Augment Long Haul Fiber in UK to Meet Demands,Zacks
Dec-04-18,"Viasat Rolls Out Urban Wi-Fi Service, Announces Partnership",Zacks
Dec-04-18,"Finisar's (FNSR) Q2 Earnings Beat, Revenues Decline Y/Y",Zacks
Dec-06-18,Why Ubiquiti Networks Stock Popped 17.1% in November,Motley Fool
Dec-06-18,Strong Demand for Wireless Equipment Makers: 5 Top Picks,Zacks
Dec-10-18,Ericsson Gets Multi-Year Deal From TIGO to Boost Network,Zacks
Dec-11-18,IBD Stock Of The Day: Ubiquiti Networks Shows Strength In Tough Market,Investor's Business Daily
Dec-11-18,"InterDigital Issues Q4 Revenue Guidance, Announces Dividend",Zacks
Dec-11-18,Nokia Deploys Liquid-Cooled Base Station to Reduce Emission,Zacks
Dec-11-18,Is Ubiquiti Networks (UBNT) Outperforming Other Computer and Technology Stocks This Year?,Zacks
Dec-12-18,Viasat Announces Master Agent Deal With Sandler Partners,Zacks
Dec-13-18,"Ciena (CIEN) Q4 Earnings Beat Estimates, Revenues Rise Y/Y",Zacks
Dec-13-18,Micron (MU) Q1 Earnings: Will the Stock Disappoint This Time?,Zacks
Dec-14-18,Ciena Hits 52-Week High: What's Driving the Outperformance?,Zacks
Dec-18-18,5 Telecom Stocks with Promise to Continue Bull Run in 2019,Zacks
Dec-19-18,Do Hedge Funds Love Ubiquiti Networks Inc (UBNT)?,Insider Monkey
Dec-20-18,Viasat (VSAT) Upgrades its KG-142 Network Encryptor Device,Zacks
Dec-20-18,Fed Lowers GDP Estimates for 2018 & 2019: 5 Defensive Picks,Zacks
Dec-26-18,Will Juniper be Able to Sustain Momentum Amid Headwinds?,Zacks
Dec-27-18,Here's Why Investing in Motorola Solutions (MSI) Makes Sense,Zacks
Dec-28-18,Is Ubiquiti Networks (UBNT) Outperforming Other Computer and Technology Stocks This Year?,Zacks
Jan-08-19,"Motorola Buys VaaS, Boosts Command Center Software Portfolio",Zacks
Jan-09-19,Qualcomm-Green Hills Software Collaborate on Auto Solutions,Zacks
Jan-09-19,Market's Newfound Optimism Brings Another 1% Gain,Zacks
Jan-09-19,Ubiquiti Networks Sees Hammer Chart Pattern: Time to Buy?,Zacks
Jan-10-19,Akre Focus Fund Commentary: 4th Quarter 2018,GuruFocus.com
Jan-11-19,"Glancy Prongay & Murray LLP Announces Investigation On Behalf Of Ubiquiti Networks, Inc. Investors (UBNT)",GlobeNewswire
Jan-11-19,Ubiquiti Networks (UBNT) Dips More Than Broader Markets: What You Should Know,Zacks
Jan-11-19,Ericsson to Reshape Digital Services Strategy to Stem Losses,Zacks
Jan-11-19,"Ubiquiti Networks, United Natural Foods, Ford Motor, Genuine Parts and Fiat Chrysler Automobiles highlighted as Zacks Bull and Bear of the Day",Zacks
Jan-14-19,How Much Does Stock Investing Really Cost You?,Zacks
Jan-15-19,Harris Secures $75 Million Order from U.S. Marine Corps,Zacks
Jan-18-19,Ubiquiti Networks (UBNT) Gains But Lags Market: What You Should Know,Zacks
Jan-23-19,Ciena (CIEN) Touches 52-Week High: Will the Rally Continue?,Zacks
Jan-23-19,Is Ubiquiti Networks (UBNT) Stock Outpacing Its Computer and Technology Peers This Year?,Zacks
Jan-24-19,Ubiquiti Networks (UBNT) Outpaces Stock Market Gains: What You Should Know,Zacks
Jan-25-19,"Ericsson (ERIC) Q4 Earnings Miss Estimates, Revenues Improve",Zacks
Jan-30-19,Ubiquiti Networks (UBNT) Outpaces Stock Market Gains: What You Should Know,Zacks
Jan-31-19,"Why You Should Like Ubiquiti Networks, Inc.s (NASDAQ:UBNT) ROCE",Simply Wall St.
Feb-07-19,IBD 50 Stocks To Watch: Is Ubiquiti Headed For A Breakout?,Investor's Business Daily
Feb-07-19,Ubiquiti Networks (UBNT) Earnings Expected to Grow: What to Know Ahead of Next Week's Release,Zacks
Feb-08-19,Ubiquiti Networks Soars On Earnings,Investor's Business Daily Video
Feb-08-19,"Stocks Erase Most Losses, End Mainly Higher As Leading Stocks Outperform",Investor's Business Daily
Feb-08-19,Ubiquiti Earnings Beat Boosts Shares For Network Gear Maker,Investor's Business Daily
Feb-08-19,Why Ubiquiti Networks Stock Soared Today,Motley Fool
Feb-08-19,Ubiquiti Networks Delivers an Impressive Holiday Quarter,Motley Fool
Feb-08-19,"Stock Market Pares Losses, Nasdaq Leads As Growth Stocks Break Out",Investor's Business Daily
Feb-08-19,Ubiquiti Earnings Beat Boosts Shares For Network Gear Maker,Investor's Business Daily
Feb-08-19,Ubiquiti Networks stock heads for best day since 2013 after big earnings beat,MarketWatch
Feb-08-19,Stock Market Falls For Third Day; Two Top Growth Stocks Break Out,Investor's Business Daily
Feb-08-19,Ubiquiti Networks (UBNT) Q2 Earnings and Revenues Beat Estimates,Zacks
Feb-08-19,"Stocks, Dow Jones Index Dive As China Tariffs Deadline Approaches",Investor's Business Daily
Feb-08-19,Zayo Group (ZAYO) Misses Q2 Earnings &amp; Revenue Estimates,Zacks
Feb-08-19,Motorola (MSI) Q4 Earnings Beat Estimates on Record Revenues,Zacks
Feb-08-19,Ubiquiti: Fiscal 2Q Earnings Snapshot,Associated Press
Feb-08-19,Ubiquiti Networks Reports Second Quarter Fiscal 2019 Financial Results,Business Wire
Feb-08-19,The safest ways to use free public Wi-Fi from a Dayton expert,American City Business Journals
Feb-11-19,Ubiquiti Networks Soars On Earnings,Investor's Business Daily Video
Feb-11-19,Ubiquiti (UBNT) Q2 Earnings Beat on Healthy Revenue Growth,Zacks
Feb-13-19,Good Feelings for Good Dealings,Zacks
Feb-14-19,"Telecom Stock Roundup: Motorola, Ubiquiti Trump Earnings Estimates &amp; More",Zacks
Feb-14-19,Ubiquiti Networks Surges After Reporting Q2 Results. Time to Buy?,Motley Fool
Feb-15-19,"The Zacks Analyst Blog Highlights: Motorola Solutions, Ubiquiti Networks, Nokia, Zayo and NETGEAR",Zacks
Feb-19-19,Could Amazon's Latest Acquisition Hurt Ubiquiti Networks?,Motley Fool
Feb-22-19,5 Stocks to Buy as New Analysts Initiate Coverage,Zacks
Feb-25-19,"Zacks.com featured expert Kevin Matras highlights: Shenandoah Telecommunications, Honda Motor, PolarityTE, Ubiquiti Networks and Titan Machinery",Zacks
Mar-04-19,S&P Reclaims 2800; NASDAQs Streak Hits 10 Weeks,Zacks
Mar-08-19,Stock Chart Reading: What Is Overhead Supply And Why You've Been Part Of It,Investor's Business Daily
Mar-08-19,Why Ubiquiti Networks Stock Popped 33.4% in February,Motley Fool
Mar-11-19,5 Stocks in Focus on New Analysts Coverage,Zacks
Mar-12-19,Imagine Holding Ubiquiti Networks (NASDAQ:UBNT) Shares While The Price Zoomed 357% Higher,Simply Wall St.
Mar-12-19,"Zacks.com featured expert Kevin Matras highlights: Balchem, Methode Electronics, Chemed, Ubiquiti Networks and HEXO",Zacks
Mar-15-19,"Robbins Arroyo LLP: Ubiquiti Networks, Inc. (UBNT) Misled Shareholders According to Complaint",Business Wire
Mar-19-19,Motorola Introduces MOTOTRBO Nitro for Commercial Operations,Zacks
Mar-19-19,Ericsson Collaborates With TDC to Support Digital Denmark,Zacks
Mar-19-19,Has Ubiquiti Networks (UBNT) Outpaced Other Computer and Technology Stocks This Year?,Zacks
Mar-22-19,Invest Carefully Despite a Dovish Fed: 5 Safe Picks,Zacks
Mar-26-19,Nokia Partners A1 to Build 5G Mobile Networks in Austria,Zacks
Mar-27-19,Fight the Recession Scare With These 5 Top Tech Picks,Zacks
Mar-28-19,Juniper Networking Solutions to Boost LINE's Services Growth,Zacks
Apr-01-19,Ericsson and Batelco to Introduce 5G Services in Bahrain,Zacks
Apr-02-19,Viasat Unveils Hybrid In-Flight Connectivity Antenna System,Zacks
Apr-02-19,Zayo (ZAYO) Chosen by Infrastructure as a Service Provider,Zacks
Apr-02-19,Buy These 3 Wireless Equipment Stocks That Beat the S&amp;P in Q1,Zacks
Apr-04-19,Has Ubiquiti Networks (UBNT) Outpaced Other Computer and Technology Stocks This Year?,Zacks
Apr-05-19,CenturyLink's New Mesh Delivery Platform to Manage Traffic,Zacks
Apr-05-19,Ubiquiti Networks (UBNT) Outpaces Stock Market Gains: What You Should Know,Zacks
Apr-05-19,Indexes Within Striking Distance of Record High: 5 Top Picks,Zacks
Apr-09-19,Harris Augments US Air Force's Electronic Warfare Systems,Zacks
Apr-10-19,Global Economic Growth Concerns Resurface: 5 Safe Picks,Zacks
Apr-11-19,Ubiquiti Networks (UBNT) Stock Moves 0.66%: What You Should Know,Zacks
Apr-11-19,"The Zacks Analyst Blog Highlights: MGP Ingredients, Medifast, Ubiquiti Networks, Yield10 Bioscience and Otter Tail",Zacks
Apr-23-19,"Should You Be Worried About Insider Transactions At Ubiquiti Networks, Inc. (NASDAQ:UBNT)?",Simply Wall St.
Apr-25-19,Ubiquiti Networks (UBNT) Dips More Than Broader Markets: What You Should Know,Zacks
May-01-19,Ubiquiti Networks (UBNT) Stock Moves -0.42%: What You Should Know,Zacks
May-02-19,Ubiquiti Networks (UBNT) Earnings Expected to Grow: What to Know Ahead of Q3 Release,Zacks
May-10-19,Ubiquiti Networks Slips After a Perfectly Good Quarter,Motley Fool
May-10-19,Ubiquiti Earnings Mixed; Stock Falls Amid China Trade War,Investor's Business Daily
May-10-19,Why Ubiquiti Networks Stock Dropped Today,Motley Fool
May-10-19,Ubiquiti Networks (UBNT) Tops Q3 Earnings and Revenue Estimates,Zacks
May-10-19,Ubiquiti: Fiscal 3Q Earnings Snapshot,Associated Press
May-10-19,Ubiquiti Networks Reports Third Quarter Fiscal 2019 Financial Results,Business Wire
May-13-19,"Ubiquiti (UBNT) Tops Q3 Earnings &amp; Revenue Estimates, Up Y/Y",Zacks
May-16-19,"Telecom Stock Roundup: Ubiquiti, CommScope Trump Earnings Estimates &amp; More",Zacks
May-16-19,"Ubiquiti Networks, Inc. (NASDAQ:UBNT): What Does The Future Look Like?",Simply Wall St.
May-17-19,Ubiquiti Falls 25% on Tariff News and a Slow Quarter. Is It a Buy?,Motley Fool
May-21-19,Is Ubiquiti Networks (UBNT) Outperforming Other Computer and Technology Stocks This Year?,Zacks
May-22-19,Viasat Secures Contract from General Services Administration,Zacks
May-23-19,CenturyLink Expands E-Services Portfolio for Global Markets,Zacks
May-24-19,"Viasat (VSAT) Q4 Earnings &amp; Revenues Top Estimates, Up Y/Y",Zacks
May-28-19,Is Ubiquiti (UBNT) a Solid Growth Stock? 3 Reasons to Think &quot; Yes &quot;,Zacks
May-28-19,"CenturyLink Purchases Property in Miami, Expands Footprint",Zacks
May-29-19,Nokia to Support SoftBank in Commercial 5G Network Launch,Zacks
May-30-19,AT&amp;T Invests in Networks Across Wisconsin to Expand Reach,Zacks
May-31-19,Nokia Deepfield Analytics to Boost Telefonica Spain's Network,Zacks
