date,title,source
Oct-24-18,"New Research Coverage Highlights Vmware, Kala Pharmaceuticals, El Pollo Loco, Integer, AAC, and Vectren  Consolidated Revenues, Company Growth, and Expectations for 2018",GlobeNewswire
Oct-30-18,This is Why Vectren (VVC) is a Great Dividend Stock,Zacks
Nov-01-18,Vectren Increases Dividend 6.7 Percent; Marks 59th Consecutive Year of Dividend Increases,GlobeNewswire
Nov-05-18,Vectren: 3Q Earnings Snapshot,Associated Press
Nov-06-18,Vectren Corp (VVC) Q3 2018 Earnings Conference Call Transcript,Motley Fool
Nov-08-18,Centerpoint Energy Inc (CNP) Q3 2018 Earnings Conference Call Transcript,Motley Fool
Nov-09-18,Edited Transcript of VVC earnings conference call or presentation 6-Nov-18 7:00pm GMT,Thomson Reuters StreetEvents
Nov-12-18,Edited Transcript of VVC earnings conference call or presentation 6-Nov-18 7:00pm GMT,Thomson Reuters StreetEvents
