date,title,source
Oct-22-18,"REITs to Watch for Q3 Earnings on Oct 23: EQR, LPT, BXMT & PSB",Zacks
Oct-23-18,Blackstone Mortgage Trust (BXMT) Q3 Earnings and Revenues Beat Estimates,Zacks
Oct-23-18,Blackstone Mortgage: 3Q Earnings Snapshot,Associated Press
Oct-23-18,Blackstone Mortgage Trust Reports Third Quarter 2018 Results,PR Newswire
Oct-29-18,Edited Transcript of BXMT earnings conference call or presentation 24-Oct-18 2:00pm GMT,Thomson Reuters StreetEvents
Nov-14-18,Here's Why Blackstone Mortgage Trust (BXMT) is a Great Momentum Stock to Buy,Zacks
Nov-29-18,Will Blackstone Mortgage Trust Incs (NYSE:BXMT) Earnings Grow Over The Next Year?,Simply Wall St.
