date,title,source
Oct-17-18,3 Inflation-Proof Stocks to Buy as Interest Rates Rise,InvestorPlace
Oct-17-18,Chubb Appoints Judy Gonsalves Division President of Chubb Bermuda,PR Newswire
Oct-23-18,Chubb (CB) Beats Q3 Earnings and Revenue Estimates,Zacks
Oct-23-18,Chubb: 3Q Earnings Snapshot,Associated Press
Oct-23-18,"Chubb Reports Third Quarter Net Income Per Share and Core Operating Income Per Share of $2.64 and $2.41, Respectively, Including Catastrophe Losses of $0.80 Per Share; P&C Combined Ratio of 90.9%, or 84.8% Excluding Catastrophes",PR Newswire
Oct-23-18,Is Chubb Limiteds (NYSE:CB) ROE Of 7.5% Impressive?,Simply Wall St.
Oct-23-18,Q3 Earnings Preview For Chubb,Benzinga
Oct-25-18,Edited Transcript of CB earnings conference call or presentation 24-Oct-18 12:30pm GMT,Thomson Reuters StreetEvents
Oct-26-18,Edited Transcript of CB earnings conference call or presentation 24-Oct-18 12:30pm GMT,Thomson Reuters StreetEvents
