date,title,source
Oct-22-18,"James River Announces Appointment of President, Specialty Admitted Insurance Segment",GlobeNewswire
Oct-29-18,"Detailed Research: Economic Perspectives on National CineMedia, James River Group, Carpenter Technology, CarMax, Ritchie Bros. Auctioneers, and Quest Diagnostics  What Drives Growth in Today's Competitive Landscape",GlobeNewswire
Oct-31-18,James River Group (JRVR) Earnings Expected to Grow: Should You Buy?,Zacks
Nov-05-18,Can James River Group (JRVR) Keep the Earnings Surprise Streak Alive?,Zacks
Nov-06-18,James River Announces Christopher L. Harris and Sundar Srinivasan Appointed to its Board of Directors,GlobeNewswire
Nov-07-18,James River Group: 3Q Earnings Snapshot,Associated Press
Nov-07-18,James River Announces Third Quarter 2018 Results,GlobeNewswire
Nov-07-18,How Does James River Group Holdings Ltd (NASDAQ:JRVR) Fare As A Dividend Stock?,Simply Wall St.
Nov-08-18,Edited Transcript of JRVR earnings conference call or presentation 8-Nov-18 1:00pm GMT,Thomson Reuters StreetEvents
Nov-08-18,James River Group Holdings Ltd (JRVR) Q3 2018 Earnings Conference Call Transcript,Motley Fool
Nov-09-18,Edited Transcript of JRVR earnings conference call or presentation 8-Nov-18 1:00pm GMT,Thomson Reuters StreetEvents
Nov-12-18,Edited Transcript of JRVR earnings conference call or presentation 8-Nov-18 1:00pm GMT,Thomson Reuters StreetEvents
Nov-26-18,"AIG Stock Down More Than 25% This Year, Will it Bounce Back?",Zacks
Nov-27-18,James River Will Pay Quarterly Dividend,GlobeNewswire
Dec-26-18,Is AIG Doomed to Have a Terrible 2019 Too?,Zacks
Jan-09-19,"James River (NASDAQ: ""JRVR"") Announces Dates for Its 2018 Fourth Quarter Earnings Release and Conference Call",GlobeNewswire
Jan-29-19,"Have Insiders Been Selling James River Group Holdings, Ltd. (NASDAQ:JRVR) Shares?",Simply Wall St.
