date,title,source
Oct-17-18,Today's Logistics Report: Shipping Consolidation Losses; Rising Labor Costs; CSX Precision Profits,The Wall Street Journal
Oct-17-18,3 Charts That Suggest Transportation Stocks Are Heading Lower,Investopedia
Oct-17-18,WERN vs. JBHT: Which Stock Is the Better Value Option?,Zacks
Oct-18-18,"J.B. Hunt Transport Services, Inc. Announces Payment of Dividend",Business Wire
Oct-23-18,"J.B. Hunt Transport Services, Inc. to Participate in the Baird 2018 Global Industrials and the Stephens Fall Investment Conferences",Business Wire
Oct-23-18,"Research Report Identifies Cohu, Maxwell Technologies, J.B. Hunt Transport Services, Sprague Resources LP, Fortuna Silver Mines, and International Seaways with Renewed Outlook  Fundamental Analysis, Calculating Forward Movement",GlobeNewswire
Oct-25-18,Trucking Companies Boost Prices Amid Capacity Squeeze,The Wall Street Journal
