date,title,source
Oct-17-18,Total Canadian Consumer Debt Climbs to $1.864 Trillion,GlobeNewswire
Oct-18-18,Equifax Announces Earnings Release Date and Conference Call for Third Quarter 2018 Results,PR Newswire
Oct-19-18,Equifax Sees Rate Hikes Pushing Canadian Delinquencies Higher,Bloomberg
Oct-22-18,What's in the Cards for Equifax (EFX) This Earnings Season?,Zacks
Oct-24-18,Equifax (EFX) Misses Q3 Earnings and Revenue Estimates,Zacks
Oct-24-18,Equifax shares slump on disappointing third-quarter earnings,MarketWatch
Oct-24-18,Equifax: 3Q Earnings Snapshot,Associated Press
Oct-24-18,Equifax releases third quarter 2018 results,PR Newswire
Oct-24-18,Equifax Q3 Earnings Preview,Benzinga
Oct-25-18,Here's Why Equifax Stock Is Plunging Today,Motley Fool
Oct-25-18,"Equifax (EFX) Q3 Earnings & Revenues Lag Estimates, Stock Down",Zacks
Oct-26-18,"At US$98.31, Is It Time To Put Equifax Inc (NYSE:EFX) On Your Watch List?",Simply Wall St.
Oct-29-18,Edited Transcript of EFX earnings conference call or presentation 25-Oct-18 12:30pm GMT,Thomson Reuters StreetEvents
Oct-29-18,Equifax introduces new Peak Attributes featuring alternative data and machine learning technology,PR Newswire
Oct-29-18,Equifax Names Byron McDuffee Automotive General Manager,PR Newswire
Oct-30-18,"Investor Expectations to Drive Momentum within Kraton, Boyd Gaming, PayPal, The Sherwin-Williams, Barnes Group, and Equifax  Discovering Underlying Factors of Influence",GlobeNewswire
Nov-02-18,"Equifax Deepens Commitment to Consumer Identity Protection, Joins Cause to Evolve Verification Beyond Social Security Numbers",PR Newswire
Nov-07-18,Millennials Optimistic about their Financial Future,GlobeNewswire
Nov-08-18,Enerflex Reports Record Bookings and Backlog and Increases the Quarterly Dividend,GlobeNewswire
Nov-08-18,[$$] Data brokers and credit scorers accused of GDPR breaches,Financial Times
Nov-09-18,Equifax Board of Directors Declares Quarterly Dividend,PR Newswire
Nov-12-18,Why Equifax Inc. Stock Fell 22.3% in October,Motley Fool
Nov-12-18,Report: Public opinion in Equifax is nearly back to normal,American City Business Journals
Nov-16-18,"Only 4 Days Left Before Equifax Inc (NYSE:EFX) Will Be Trading Ex-Dividend,",Simply Wall St.
Nov-16-18,Moving Average Crossover Alert: Equifax (EFX),Zacks
Nov-27-18,"Making the Grade in Financial Literacy, Canadians still have a lot to Learn",GlobeNewswire
Nov-28-18,Equifax to Meet With Investors in Toronto and Dallas,PR Newswire
Nov-28-18,Equifax Solution Helps Mortgage Lenders Find and Nurture Prospective Buyers in Tightening Market,PR Newswire
Nov-30-18,Marriotts Data Breach Hits the Stock  and as Many as Half a Billion Consumers,Barrons.com
Dec-03-18,Equifax Joins Global Effort to Advance & Strengthen Cybersecurity,PR Newswire
Dec-04-18,Equifax-Centre for Cybersecurity Tie Up to Fix Cyber Attacks,Zacks
Dec-06-18,"Equifax to Meet With Investors in San Francisco, Chicago and Minneapolis",PR Newswire
Dec-07-18,"Consolidated Research: 2018 Summary Expectations for Equifax, Celanese, McKesson, ManpowerGroup, NewMarket, and Phillips 66  Fundamental Analysis, Key Performance Indications",GlobeNewswire
Dec-10-18,Nearly 90 Percent of IT Pros See Gap Between Customer Experience and Digital Security,PR Newswire
Dec-10-18,Equifax Inc. (EFX): Hedge Fund Sentiment Unchanged,Insider Monkey
Dec-11-18,A person dressed up like the Monopoly man is sat behind Google's CEO as he testified in Congress,CNBC
Dec-11-18,The Equifax breach affecting nearly half of Americans was entirely preventable,Quartz
Dec-13-18,Valeyo and Equifax deliver an industry first by integrating automated income verification into the lending process,CNW Group
Dec-17-18,Equifax Introduces Soft Credit Inquiry Checks for Tenant Screening,PR Newswire
Dec-18-18,Equifax (EFX) Canada Takes Over Property Knowledge Firm JLR,Zacks
Dec-18-18,Experian Finance plc -- Moody's affirms Experian's Baa1 long-term ratings and P-2 short-term ratings; outlook stable,Moody's
Dec-18-18,4 Simple Steps to Help Protect Against Identity Theft,Kiplinger
Dec-18-18,[$$] Your Cellphone Bill Could Soon Help Build Credit,The Wall Street Journal
Dec-20-18,Unit of Equifaxs auditor EY certified the information security that was later breached,MarketWatch
Dec-26-18,How to Dispute Something on Your Equifax Credit Report,Motley Fool
Jan-02-19,WSJ: New House leadership will take aim at Equifax,American City Business Journals
Jan-02-19,Why Should You Hold Equifax (EFX) Stock in Your Portfolio?,Zacks
Jan-10-19,The 25 Best S&amp;P 500 Stocks of the Past 50 Years,Kiplinger
Jan-11-19,What Impacts Your Credit Score the Most,Zacks
Jan-16-19,Waters says shell investigate Mick Mulvaneys actions at CFPB,MarketWatch
Jan-17-19,[$$] New on Parents' To-Do List: Checking Kids' Credit History,The Wall Street Journal
Jan-17-19,Equifax delivers on data for customers in 2018,PR Newswire
Jan-22-19,"Millennial Money: This winter, your credit should freeze too",Associated Press
Jan-23-19,"The Work Number, from Equifax, on display at AFSA and NADA 2019",PR Newswire
Jan-24-19,Equifax and Jabian Consulting listen to what auto dealers and lenders want for a successful customer journey,PR Newswire
Jan-25-19,Dealers gain efficiency: Equifax helps fuel DealerPolicy's solution that enables car buying for the digital age,PR Newswire
Jan-29-19,The Unfinished Business of the Equifax Hack,Bloomberg
Jan-30-19,Equifax Outlook: Trends to Watch in Data-driven Marketing,PR Newswire
Jan-30-19,[$$] Consumer borrowing rises at slowest rate since 2014,Financial Times
Jan-31-19,"""For Love or Money"": Equifax commissioned study finds that neither is a key factor in determining customers' loyalty to their banks",PR Newswire
Feb-01-19,"Enerflex to Announce Fourth Quarter and Year End 2018 Results on February 21, 2019",GlobeNewswire
Feb-04-19,Equifax picks Global Payments president as new exec,American City Business Journals
Feb-04-19,Equifax to provide free credit report service to consumers impacted by partial government shutdown,PR Newswire
Feb-04-19,Equifax announces senior leadership changes,PR Newswire
Feb-05-19,[$$] Cyber Daily: Can You Explain Why It Took So Long to Reveal That Security Problem?,The Wall Street Journal
Feb-11-19,Robert Olstein's Top 5 Buys in 4th Quarter,GuruFocus.com
Feb-11-19,"Elizabeth Warren schedules campaign stop, marking metro Atlanta's first 2020 presidential pitch",American City Business Journals
Feb-12-19,Tom Gayner Picks Up 4 Stocks in the 4th Quarter,GuruFocus.com
Feb-12-19,The 25 Best S&amp;P 500 Stocks of the Past 50 Years,Kiplinger
Feb-13-19,Yelp jumps after posting earnings and increasing share buyback by $250 million,CNBC
Feb-13-19,"The great Equifax mystery: 17 months later, the stolen data has never been found, and experts are starting to suspect a spy scheme",CNBC
Feb-15-19,[$$] How to improve your credit score,Financial Times
Feb-19-19,15 Cybersecurity Stocks to Watch as the Industry Heats Up,InvestorPlace
Feb-19-19,Equifax announces earnings release date and conference call for fourth quarter 2018 results,PR Newswire
Feb-20-19,Equifax: 4Q Earnings Snapshot,Associated Press
Feb-20-19,Equifax disappoints with earnings and forecast as it spends on tech and security,MarketWatch
Feb-20-19,Equifax Board of Directors declares quarterly dividend,PR Newswire
Feb-20-19,Equifax releases fourth quarter 2018 results,PR Newswire
Feb-20-19,Equifax Q4 Earnings Preview,Benzinga
Feb-21-19,Equifax Inc (EFX) Q4 2018 Earnings Conference Call Transcript,Motley Fool
Feb-21-19,Equifax (EFX) Down on Bearish View Despite Q4 Earnings Beat,Zacks
Feb-21-19,Is Equifax Inc.s (NYSE:EFX) High P/E Ratio A Problem For Investors?,Simply Wall St.
Feb-21-19,Equifax Inc. to Host Earnings Call,ACCESSWIRE
Feb-22-19,Understanding GAAP vs. Non-GAAP,Investopedia
Feb-22-19,Equifax adds L Brands data scientist to its reshaped board of directors,American City Business Journals
Feb-22-19,Equifax says U.S. regulators seek damages related to 2017 breach,Reuters
Feb-22-19,Equifax says US regulators seek damages related to 2017 breach,Reuters
Feb-22-19,"[$$] Equifax Expects U.S., Canada Regulatory Action Over 2017 Breach",The Wall Street Journal
Feb-22-19,Equifax names Heather H. Wilson as new independent director,PR Newswire
Feb-22-19,"3 Big Stock Charts for Friday: Equifax, Mattel and Kimberly Clark",InvestorPlace
Feb-26-19,Congresswoman asks Equifax CEO for his personal data as she hammers companys legal moves,MarketWatch
Feb-26-19,[$$] Credit-Reporting Companies Told Their System Is 'Broken',The Wall Street Journal
Feb-26-19,Credit reporting agencies face pressure from skeptical U.S. Congress,Reuters
Feb-26-19,Credit reporting agencies face pressure from skeptical U.S. Congress,Reuters
Feb-26-19,Equifax Faces Fresh D.C. Fury With Democrats in Control of House,Bloomberg
Feb-26-19,[$$] Cyber Daily: Government Clearance for CISOs; Equifax Expects More Legal Fallout,The Wall Street Journal
Feb-26-19,Edited Transcript of EFX earnings conference call or presentation 21-Feb-19 1:30pm GMT,Thomson Reuters StreetEvents
Feb-27-19,Democrats and Republicans in Congress agree: The system that determines credit scores is 'broken',CNBC
Feb-27-19,Equifax CEO: Identity has been stolen 3 times in last 10 years,American City Business Journals
Feb-27-19,"Stock Market News: Buffett Makes a Sale, Equifax Takes Heat on the Hill",Motley Fool
Feb-27-19,9 Best Dividend Stocks to Buy for Every Investor,InvestorPlace
Feb-27-19,Credit reporting agencies face pressure from skeptical U.S. Congress,Reuters
Feb-27-19,Credit reporting agencies face pressure from skeptical U.S. Congress,Reuters
Feb-28-19,"Equifax to meet with investors in Chicago, Boston and New York",PR Newswire
Mar-01-19,"Investor Expectations to Drive Momentum within NextEra Energy, Equifax, Accenture, STORE Capital, SMART Global, and Cavco Industries  Discovering Underlying Factors of Influence",GlobeNewswire
Mar-04-19,Marriott CEO to testify before U.S. Senate panel on data breach,Reuters
Mar-04-19,Understanding GAAP vs. Non-GAAP,Investopedia
Mar-05-19,Fico vs. Experian vs. Equifax: What's the Difference?,Investopedia
Mar-05-19,Canadian consumer delinquencies starting to rise,GlobeNewswire
Mar-06-19,Fico vs. Experian vs. Equifax: What's the Difference?,Investopedia
Mar-07-19,Former Equifax executive pleads guilty to insider trading,Associated Press
Mar-07-19,Former Equifax executive pleads guilty to insider trading,Associated Press
Mar-07-19,Rep. Will Hurd on Marriott-Equifax and the border emergency,CNBC Videos
Mar-07-19,Equifax CEO testifies company took security seriously before its massive breach in response to scathing Senate report,CNBC
Mar-07-19,Senators will grill Equifax and Marriott executives about two of the biggest data breaches in history,CNBC
Mar-08-19,"Equifax to meet with investors in Los Angeles, San Francisco and Portland",PR Newswire
Mar-08-19,[$$] Cyber Daily: Fixing Bias Among Cyber Professionals; Equifax and Marriott CEOs Testify; Sonic Sued,The Wall Street Journal
Mar-11-19,[$$] Cyber Daily: Information Security Chiefs Gain Stature; Citrix Attacked; U.K. Girds for Election Interference,The Wall Street Journal
Mar-13-19,What Are the Three Credit Bureaus and Why Do They Matter?,TheStreet.com
Mar-13-19,Are Insiders Buying Equifax Inc. (NYSE:EFX) Stock?,Simply Wall St.
Mar-13-19,Equifax Canada finds Canadians taking fewer steps to protect personal information,GlobeNewswire
Mar-18-19,Equifax and Gwynn Group team up to deliver comprehensive collections management solution,PR Newswire
Mar-21-19,Successful innovation in AI drives customer success for Equifax,PR Newswire
Mar-22-19,Why Is Equifax (EFX) Up 4.1% Since Last Earnings Report?,Zacks
Mar-27-19,Banks Want More Consumer Data. Equifax and FICO Are Here to Help.,Barrons.com
Mar-27-19,Equifax joins the WiCyS mission of advancing women in cyber security,PR Newswire
Mar-27-19,Equifax and FICO introduce strategic partnership to deliver the Data Decisions Cloud,PR Newswire
Mar-28-19,Equifax (EFX) and FICO Team Up for Data Decisions Cloud,Zacks
Mar-28-19,Equifax and Wolters Kluwer Team up to Offer End-to-End CECL Solution,Business Wire
Mar-29-19,Equifax Stock Investors Are Still Paying For 2017 Data Breach,InvestorPlace
Apr-02-19,Equifax Inc. (NYSE:EFX) Has A ROE Of 9.7%,Simply Wall St.
Apr-03-19,Cramer: Warren is going about executive liability bill the wrong way,CNBC Videos
Apr-04-19,Heres What Hedge Funds Think About Equifax Inc. (EFX),Insider Monkey
Apr-08-19,Equifax Insight Score for Personal Loans empowers FinTech lenders to approve a full spectrum of consumer loans,PR Newswire
Apr-09-19,Canadian regulator says Equifax fell short of privacy compliance,Reuters
Apr-09-19,Canadian regulator says Equifax fell short of privacy compliance,Reuters
Apr-09-19,Equifax and Credit Bureau Connection team up to provide soft credit inquiry checks to auto dealers and lenders,PR Newswire
Apr-10-19,9 Best Dividend Stocks to Buy for Every Investor,InvestorPlace
Apr-10-19,Equifax announces new chief human resources officer,PR Newswire
Apr-15-19,"MOVES-Stone Harbor, Equifax, State Street",Reuters
Apr-15-19,"MOVES-Equifax ropes in Tony Banks as vice president of UK, Ireland operations",Reuters
Apr-16-19,Leading CMOs gain $4 for every dollar invested in marketing measurement,PR Newswire
Apr-18-19,Understanding GAAP vs. Non-GAAP,Investopedia
Apr-18-19,Equifax among top 50 in 'FinTech Leaders 2019' ecosystem rankings,PR Newswire
Apr-22-19,Equifax names Graphic Packaging executive as new CHRO,American City Business Journals
Apr-23-19,Equifax announces conference call for first quarter 2019 results,PR Newswire
Apr-23-19,"TransUnion Earnings Top, Guidance Mixed",Investor's Business Daily
Apr-24-19,Equifax Buys PayNet To Create 'Premier Set Of Data' In Private Credit Space,Benzinga
Apr-24-19,Equifax acquires PayNet to help expand access to capital for small and mid-sized businesses,PR Newswire
Apr-29-19,Consumer Loans Industry Outlook: Near-Term Prospects Bright,Zacks
Apr-30-19,"Bernice King, Chick-fil-A exec among 84 in 2020 Leadership Atlanta class (Slideshow)",American City Business Journals
Apr-30-19,Equifax survey reveals saving is a challenge for most consumers,PR Newswire
May-02-19,Analysts Estimate Equifax (EFX) to Report a Decline in Earnings: What to Look Out for,Zacks
May-02-19,"S&amp;P Global (SPGI) Q1 Earnings In Line, Revenue Lag Estimates",Zacks
May-02-19,"Aptiv (APTV) Beats on Q1 Earnings &amp; Revenues, Cuts '19 View",Zacks
May-02-19,Navigant (NCI) Surpasses Q1 Earnings and Revenue Estimates,Zacks
May-03-19,"FTI Consulting (FCN) Tops Q1 Earnings, Revenues Estimates",Zacks
May-03-19,"Stericycle (SRCL) Posts Disappointing Q1 Earnings, Stock Down",Zacks
May-03-19,Fang Holdings (SFUN) Q4 Earnings &amp; Revenues Decline Y/Y,Zacks
May-06-19,"Clean Harbors (CLH) Beats on Q1 Earnings, Misses Revenues",Zacks
May-06-19,"Avis Budget (CAR) Q1 Earnings Top Estimates, Revenues Miss",Zacks
May-06-19,"First Data (FDC) Q1 Earnings Match Estimates, Revenues Beat",Zacks
May-07-19,"Broadridge (BR) Tops Earnings Estimates in Q3, Lags Revenues",Zacks
May-07-19,Gartner (IT) Surpasses Q1 Earnings and Revenue Estimates,Zacks
May-07-19,ICF International (ICFI) Beats on Q1 Earnings and Revenues,Zacks
May-08-19,Equifax Expected to Earn $1.20 a Share,TheStreet.com
May-08-19,"WEX Beats on Q1 Earnings and Revenues, Raises 2019 View",Zacks
May-08-19,Equifax (EFX) to Report Q1 Earnings: What's in the Cards?,Zacks
May-08-19,Equifax Inc. (NYSE:EFX): Will The Growth Last?,Simply Wall St.
May-08-19,"FLEETCOR (FLT) Q1 Earnings &amp; Revenues Beat, 2019 View Up",Zacks
May-09-19,Equifax Q1 Earnings Preview,Benzinga
May-10-19,Diversity Champion Award: Coca-Cola's Monica Howard Douglas learned about justice at an early age,American City Business Journals
May-10-19,Equifax Inc (EFX) Q1 2019 Earnings Call Transcript,Motley Fool
May-10-19,"Equifax's (EFX) Q1 Earnings Beat Estimates, Revenues Lag",Zacks
May-10-19,Equifax (EFX) Surpasses Q1 Earnings Estimates,Zacks
May-10-19,"Stocks making the biggest moves premarket: Uber, Marriott, Viacom, Equifax, Zillow & more",CNBC
May-10-19,Equifax: 1Q Earnings Snapshot,Associated Press
May-10-19,Equifax Releases First Quarter Results,PR Newswire
May-10-19,"Equifax, Inc. to Host Earnings Call",ACCESSWIRE
May-13-19,"Company News For May 13, 2019",Zacks
May-15-19,Edited Transcript of EFX earnings conference call or presentation 10-May-19 12:30pm GMT,Thomson Reuters StreetEvents
May-17-19,"Equifax Inc. -- Moody's affirms Equifax sr uns at Baa1, revises outlook to negative from stable",Moody's
May-17-19,3 Reasons Not To Chase The Parabolic Okta Stock Price  For Now,InvestorPlace
May-20-19,Equifax to meet with investors in New York and Boston,PR Newswire
May-22-19,Equifax just became the first company to have its outlook downgraded for a cyber attack,CNBC
May-22-19,Cybersecurity Stocks: Why the Market is Virtually Guaranteed to Soar,InvestorPlace
May-22-19,Equifax Introduces Instant Client Insights Solution For Social Services,PR Newswire
May-22-19,"Equifax Inc. -- Moody's affirms Equifax sr uns at Baa1, revises outlook to negative from stable",Moody's
May-24-19,Equifax joins Canadian banks in using the SecureKey blockchain system,Coin Rivet
May-28-19,9 Best Dividend Stocks to Buy for Every Investor,InvestorPlace
May-30-19,Equifax to present at conferences in New York and Chicago,PR Newswire
May-30-19,10-acre Atlanta estate with six-bedroom home nabs highest sale price so far this year,American City Business Journals
Jun-05-19,"Former CNN reporter, Coca-Cola exec picked to lead Equifax global communications strategy",American City Business Journals
Jun-05-19,"10 years post the Great Recession, Equifax suggests communication providers review alternative data for emerging qualified customers",PR Newswire
Jun-06-19,Mayor Bottoms adds Equifax crisis management analyst to City executive team,American City Business Journals
