date,title,source
Oct-29-18,Kornit Digital Announces Date for Third Quarter 2018 Earnings Results,GlobeNewswire
Nov-05-18,Kornit Digital (KRNT) Earnings Expected to Grow: Should You Buy?,Zacks
Nov-12-18,Kornit Digital (KRNT) Q3 2018 Earnings Conference Call Transcript,Motley Fool
Nov-12-18,Kornit Digital (KRNT) Beats Q3 Earnings and Revenue Estimates,Zacks
Nov-12-18,Kornit Digital Reports 2018 Third Quarter Results,GlobeNewswire
Nov-14-18,IBD Stock Of The Day: Kornit Digital Breaks Out On Earnings,Investor's Business Daily
Nov-19-18,Edited Transcript of KRNT earnings conference call or presentation 12-Nov-18 10:00pm GMT,Thomson Reuters StreetEvents
Dec-03-18,Kornit Announces Launch of Secondary Public Offering of Ordinary Shares,GlobeNewswire
Dec-03-18,Edited Transcript of KRNT earnings conference call or presentation 12-Nov-18 10:00pm GMT,Thomson Reuters StreetEvents
Dec-04-18,Why Kornit Digital Stock Is Sinking Today,Motley Fool
Dec-04-18,Kornit Announces Pricing of Secondary Public Offering of Ordinary Shares,GlobeNewswire
Dec-13-18,Kornit Digital North America Moves Closer to Its Customers,GlobeNewswire
Dec-20-18,Kornit Digital to Present at Upcoming Investor Conferences,GlobeNewswire
Jan-14-19,"Kornit Digital launches the Atlas, the super-industrial, next-generation direct-to-garment printing platform",GlobeNewswire
Jan-14-19,Kornit Digital Wins Silver in Hong Kong Digital Printing Award 2018,PR Newswire
Jan-15-19,"Kornit Digital launches the Atlas, the super-industrial, next-generation direct-to-garment printing platform",PR Newswire
Jan-30-19,Kornit Digital Announces Date for Fourth Quarter and Full Year 2018 Earnings Results,GlobeNewswire
Feb-05-19,Kornit Digital (KRNT) Reports Next Week: Wall Street Expects Earnings Growth,Zacks
Feb-06-19,These 2 stocks youve never heard of are better ways to profit from Amazons growth,MarketWatch
Feb-07-19,Kornit Digital Completes Acquisition of Assets from Hirsch Solutions Inc.,GlobeNewswire
Feb-07-19,These 2 stocks youve never heard of are better ways to profit from Amazons growth,MarketWatch
Feb-11-19,Kornit Digital Expands Partnership with Delta Apparel,GlobeNewswire
Feb-12-19,Kornit Digital: 4Q Earnings Snapshot,Associated Press
Feb-12-19,Kornit Digital (KRNT) Lags Q4 Earnings and Revenue Estimates,Zacks
Feb-12-19,"Kornit Digital Misses Fourth-Quarter Sales, Earnings Targets",Investor's Business Daily
Feb-12-19,Kornit Digital Reports 2018 Fourth Quarter and Full Year Results,GlobeNewswire
Feb-12-19,Kornit Digital Ltd. to Host Earnings Call,ACCESSWIRE
Feb-22-19,Kornit Digital appoints Andy Yarrow as President of Asia Pacific,PR Newswire
Feb-26-19,Is Now An Opportune Moment To Examine Kornit Digital Ltd. (NASDAQ:KRNT)?,Simply Wall St.
Mar-05-19,"Analysis: Positioning to Benefit within IHS Markit, PRA Group, Acacia Communications, Vanda Pharmaceuticals, Gran Tierra Energy, and Kornit Digital  Research Highlights Growth, Revenue, and Consolidated Results",GlobeNewswire
Mar-25-19,Near-Term Outlook for Commercial Printing Industry Lackluster,Zacks
Mar-28-19,"Kornit Digital Files Annual Report on Form 20-F for the Year Ended December 31, 2018",GlobeNewswire
Apr-01-19,Industry Veteran Stephen Nigro joins the Kornit Digital Team,GlobeNewswire
Apr-02-19,Kornit Stock Jumps As Digital Textile Printer Hires HP Veteran,Investor's Business Daily
Apr-02-19,Kornit Digital Ltd. (NASDAQ:KRNT) Might Not Be A Great Investment,Simply Wall St.
Apr-02-19,Kornit Digital Reinvents Industrial Polyester Printing with Breakthrough Innovation and Technology,GlobeNewswire
Apr-03-19,Kornit Digital (KRNT) Surges: Stock Moves 5.5% Higher,Zacks
Apr-04-19,Textile Printer Maker Kornit Hits Record High On Price-Target Hike,Investor's Business Daily
Apr-17-19,"Kornit Digital Unveils the Kornit Presto System, a Breakthrough Single-Step Industrial Solution for Digital Direct-to-Fabric Printing",GlobeNewswire
Apr-29-19,Kornit Digital Announces Date for First Quarter 2019 Earnings Results,GlobeNewswire
