date,title,source
Nov-01-18,"Pareteum to support launch of Kyiv, Ukraine's first US-based Smart City Accelerator in Silicon Valley on Nov. 15 with iPass",GlobeNewswire
Nov-06-18,"iPass Receives Nasdaq Listing Determination; Eligible to Trade Over-the-Counter November 7, 2018",GlobeNewswire
Nov-12-18,Pareteum Enters into Denitive Agreement to Acquire iPass,PR Newswire
Nov-13-18,Why Pareteum Corp. Stock Plunged Today,Motley Fool
Nov-13-18,"Bragar Eagel & Squire, P.C. is Investigating the Board of Directors of iPass Inc. (IPAS) on Behalf of Stockholders and Encourages IPAS Investors to Contact the Firm",GlobeNewswire
Nov-13-18,"IPASS INC SHAREHOLDER ALERT: Rigrodsky & Long, P.A. Announces Investigation of Merger",Business Wire
Nov-13-18,"SHAREHOLDER ALERT: Levi & Korsinsky, LLP Notifies Investors of an Investigation Regarding Whether the Sale of iPass Inc. to Pareteum Corporation is Fair to Shareholders",GlobeNewswire
Nov-21-18,"iPass Shares to Resume Trading on The Nasdaq Stock Market on November 23, 2018",GlobeNewswire
Nov-26-18,iPass and Deutsche Telekom Strengthen Their Partnership,GlobeNewswire
Dec-06-18,"Bragar Eagel & Squire, P.C. Reminds Investors that it is Investigating the Boards of Directors of ARRIS, Athenahealth, and iPass on Behalf of Stockholders and Encourages Investors to Contact the Firm",GlobeNewswire
Dec-07-18,"READ NOW: Monteverde & Associates PC Is Investigating The Tender Offer Of iPass, Inc. Set To Expire On January 3, 2019 - IPAS",ACCESSWIRE
Dec-31-18,Penny Stocks to Buy Using Technical Analysis for January 2019,Investopedia
