date,title,source
Oct-17-18,Proteostasis Therapeutics Announces Positive Preliminary Results from Proprietary Doublet in Cystic Fibrosis Patients,PR Newswire
Oct-18-18,PTI Stock News: Why Is Proteostasis Therapeutics Stock Skyrocketing Today,InvestorPlace
Oct-18-18,Proteostasis Therapeutics Shares Surge On Positive Preliminary Cystic Fibrosis Trial Results,Benzinga
Oct-18-18,Proteostasis Therapeutics' rockets to 4-fold gain on massive volume after positive trial results,MarketWatch
Oct-18-18,"The Daily Biotech Pulse: Novartis Buys Endocyte, Proteostasis Positive Cystic Fibrosis Trial, 2 IPOs",Benzinga
Oct-19-18,Why Proteostasis Therapeutics Tumbled 23.2% on Friday,Motley Fool
Oct-19-18,Is Proteostasis Therapeutics Inc (NASDAQ:PTI) Worth US$10.35 Based On Intrinsic Value?,Simply Wall St.
Oct-19-18,Todays Research Reports on Stocks to Watch: Proteostasis Therapeutics and Endocyte,ACCESSWIRE
Oct-22-18,Proteostasis Therapeutics Announces Proposed Public Offering of Common Stock,PR Newswire
Oct-23-18,Proteostasis Therapeutics Prices Public Offering of Common Stock,PR Newswire
Oct-23-18,"The Daily Biotech Pulse: Regulus Soars On Positive Pre-Clinical Data, Biogen Earnings, Proteostasis And Eiger to Offer Shares",Benzinga
